
    -----------------------------------------------------------------------
          Psi4: An Open-Source Ab Initio Electronic Structure Package
                               Psi4 1.9.1 release

                         Git: Rev {} zzzzzzz 


    D. G. A. Smith, L. A. Burns, A. C. Simmonett, R. M. Parrish,
    M. C. Schieber, R. Galvelis, P. Kraus, H. Kruse, R. Di Remigio,
    A. Alenaizan, A. M. James, S. Lehtola, J. P. Misiewicz, M. Scheurer,
    R. A. Shaw, J. B. Schriber, Y. Xie, Z. L. Glick, D. A. Sirianni,
    J. S. O'Brien, J. M. Waldrop, A. Kumar, E. G. Hohenstein,
    B. P. Pritchard, B. R. Brooks, H. F. Schaefer III, A. Yu. Sokolov,
    K. Patkowski, A. E. DePrince III, U. Bozkaya, R. A. King,
    F. A. Evangelista, J. M. Turney, T. D. Crawford, C. D. Sherrill,
    J. Chem. Phys. 152(18) 184108 (2020). https://doi.org/10.1063/5.0006002

                            Additional Code Authors
    E. T. Seidl, C. L. Janssen, E. F. Valeev, M. L. Leininger,
    J. F. Gonthier, R. M. Richard, H. R. McAlexander, M. Saitow, X. Wang,
    P. Verma, M. H. Lechner, A. Jiang, S. Behnle, A. G. Heide,
    M. F. Herbst, and D. L. Poole

             Previous Authors, Complete List of Code Contributors,
                       and Citations for Specific Modules
    https://github.com/psi4/psi4/blob/master/codemeta.json
    https://github.com/psi4/psi4/graphs/contributors
    http://psicode.org/psi4manual/master/introduction.html#citing-psifour

    -----------------------------------------------------------------------


    Psi4 started on: Thursday, 17 July 2025 12:28PM

    Process ID: 73760
    Host:       Joses-MacBook-Pro-2.local
    PSIDATADIR: /Users/joseantoniorodriguesromero/anaconda3/share/psi4
    Memory:     500.0 MiB
    Threads:    1
    
  ==> Input File <==

--------------------------------------------------------------------------
molecule { 
1 2
He   0.00000        0.60000        0.00000
O   0.00000       -0.60000        0.00000
}

set { 
basis              cc-pvdz
reference          uks
maxiter            500
geom_maxiter       500
DAMPING_PERCENTAGE 1
guess              SAP
}

optimize('b3lyp')
--------------------------------------------------------------------------

Scratch directory: /tmp/
gradient() will perform analytic gradient computation.
   => Libint2 <=

    Primary   basis highest AM E, G, H:  6, 6, 3
    Auxiliary basis highest AM E, G, H:  7, 7, 4
    Onebody   basis highest AM E, G, H:  -, -, -
    Solid Harmonics ordering:            Gaussian

*** tstart() called on Joses-MacBook-Pro-2.local
*** at Thu Jul 17 12:28:50 2025

   => Loading Basis Set <=

    Name: CC-PVDZ
    Role: ORBITAL
    Keyword: BASIS
    atoms 1 entry HE         line    32 file /Users/joseantoniorodriguesromero/anaconda3/share/psi4/basis/cc-pvdz.gbs 
    atoms 2 entry O          line   198 file /Users/joseantoniorodriguesromero/anaconda3/share/psi4/basis/cc-pvdz.gbs 


         ---------------------------------------------------------
                                   SCF
               by Justin Turney, Rob Parrish, Andy Simmonett
                          and Daniel G. A. Smith
                              UKS Reference
                        1 Threads,    500 MiB Core
         ---------------------------------------------------------

  ==> Geometry <==

    Molecular point group: c2v
    Full point group: C_inf_v

    Geometry (in Angstrom), charge = 1, multiplicity = 2:

       Center              X                  Y                   Z               Mass       
    ------------   -----------------  -----------------  -----------------  -----------------
         HE           0.000000000000     0.000000000000     0.959813996152     4.002603254130
         O            0.000000000000     0.000000000000    -0.240186003848    15.994914619570

  Running in c2v symmetry.

  Rotational constants: A = ************  B =      3.65667  C =      3.65667 [cm^-1]
  Rotational constants: A = ************  B = 109624.17312  C = 109624.17312 [MHz]
  Nuclear repulsion =    7.055696142266668

  Charge       = 1
  Multiplicity = 2
  Electrons    = 9
  Nalpha       = 5
  Nbeta        = 4

  ==> Algorithm <==

  SCF Algorithm Type is DF.
  DIIS enabled.
  MOM disabled.
  Fractional occupation disabled.
  Guess Type is SAP.
  Energy threshold   = 1.00e-08
  Density threshold  = 1.00e-08
  Integral threshold = 1.00e-12

  ==> Primary Basis <==

  Basis Set: CC-PVDZ
    Blend: CC-PVDZ
    Number of shells: 9
    Number of basis functions: 19
    Number of Cartesian functions: 20
    Spherical Harmonics?: true
    Max angular momentum: 2

  ==> DFT Potential <==

   => LibXC <=

    Version 6.2.2
    S. Lehtola, C. Steigemann, M. J.T. Oliveira, and M. A.L. Marques.,  SoftwareX 7, 1–5 (2018) (10.1016/j.softx.2017.11.002)

   => Composite Functional: B3LYP <= 

    B3LYP Hyb-GGA Exchange-Correlation Functional

    P. J. Stephens, F. J. Devlin, C. F. Chabalowski, and M. J. Frisch.,  J. Phys. Chem. 98, 11623 (1994) (10.1021/j100096a001)

    Deriv               =              1
    GGA                 =           TRUE
    Meta                =          FALSE

    Exchange Hybrid     =           TRUE
    MP2 Hybrid          =          FALSE

   => Exchange Functionals <=

    0.0800   Slater exchange
    0.7200         Becke 88

   => Exact (HF) Exchange <=

    0.2000               HF 

   => Correlation Functionals <=

    0.1900   Vosko, Wilk & Nusair (VWN5_RPA)
    0.8100   Lee, Yang & Parr

   => LibXC Density Thresholds  <==

    XC_HYB_GGA_XC_B3LYP:  1.00E-15 

   => Molecular Quadrature <=

    Radial Scheme          =       TREUTLER
    Pruning Scheme         =           NONE
    Nuclear Scheme         =       TREUTLER

    Blocking Scheme        =         OCTREE
    BS radius alpha        =              1
    Pruning alpha          =              1
    Radial Points          =             75
    Spherical Points       =            302
    Total Points           =          42796
    Total Blocks           =            369
    Max Points             =            256
    Max Functions          =             19
    Weights Tolerance      =       1.00E-15

   => Loading Basis Set <=

    Name: (CC-PVDZ AUX)
    Role: JKFIT
    Keyword: DF_BASIS_SCF
    atoms 1 entry HE         line    34 file /Users/joseantoniorodriguesromero/anaconda3/share/psi4/basis/def2-universal-jkfit.gbs 
    atoms 2 entry O          line   221 file /Users/joseantoniorodriguesromero/anaconda3/share/psi4/basis/cc-pvdz-jkfit.gbs 

  ==> Integral Setup <==

  DFHelper Memory: AOs need 0.000 GiB; user supplied 0.343 GiB. 
  Using in-core AOs.

  ==> MemDFJK: Density-Fitted J/K Matrices <==

    J tasked:                   Yes
    K tasked:                   Yes
    wK tasked:                   No
    OpenMP threads:               1
    Memory [MiB]:               350
    Algorithm:                 Core
    Schwarz Cutoff:           1E-12
    Mask sparsity (%):       0.0000
    Fitting Condition:        1E-10

   => Auxiliary Basis Set <=

  Basis Set: (CC-PVDZ AUX)
    Blend: CC-PVDZ-JKFIT + DEF2-UNIVERSAL-JKFIT
    Number of shells: 33
    Number of basis functions: 93
    Number of Cartesian functions: 106
    Spherical Harmonics?: true
    Max angular momentum: 3

  Cached 100.0% of DFT collocation blocks in 0.024 [GiB].

  Minimum eigenvalue in the overlap matrix is 8.7581458565E-02.
  Reciprocal condition number of the overlap matrix is 3.4898297788E-02.
    Using symmetric orthogonalization.

  ==> Pre-Iterations <==

  SCF Guess: Superposition of Atomic Potentials (doi:10.1021/acs.jctc.8b01089).

  ==> SAP guess <==

   => Molecular Quadrature <=

    Radial Scheme          =       TREUTLER
    Pruning Scheme         =           NONE
    Nuclear Scheme         =       TREUTLER

    Blocking Scheme        =         OCTREE
    BS radius alpha        =              1
    Pruning alpha          =              1
    Radial Points          =             75
    Spherical Points       =            302
    Total Points           =          42796
    Total Blocks           =            369
    Max Points             =            256
    Max Functions          =             19
    Weights Tolerance      =       1.00E-15

   -------------------------------------------------------
    Irrep   Nso     Nmo     Nalpha   Nbeta   Ndocc  Nsocc
   -------------------------------------------------------
     A1        10      10       3       3       3       0
     A2         1       1       0       0       0       0
     B1         4       4       1       1       1       0
     B2         4       4       1       0       0       1
   -------------------------------------------------------
    Total      19      19       5       4       4       1
   -------------------------------------------------------

  ==> Iterations <==

                           Total Energy        Delta E     RMS |[F,P]|

   @DF-UKS iter   1:   -77.34862851553106   -7.73486e+01   2.38780e-02 DIIS/ADIIS
   @DF-UKS iter   2:   -77.37795269182223   -2.93242e-02   7.65228e-03 DIIS/ADIIS/DAMP=1%
   @DF-UKS iter   3:   -77.38291400443956   -4.96131e-03   1.36699e-03 DIIS/ADIIS/DAMP=1%
   @DF-UKS iter   4:   -77.38089361849450    2.02039e-03   6.07650e-04 DIIS/ADIIS/DAMP=1%
   @DF-UKS iter   5:   -77.38141640030611   -5.22782e-04   1.87853e-04 DIIS/ADIIS/DAMP=1%
   @DF-UKS iter   6:   -77.38128521978868    1.31181e-04   3.37401e-05 DIIS/DAMP=1%
   @DF-UKS iter   7:   -77.38130416017447   -1.89404e-05   7.81471e-06 DIIS/DAMP=1%
   @DF-UKS iter   8:   -77.38130146594429    2.69423e-06   2.01076e-06 DIIS/DAMP=1%
   @DF-UKS iter   9:   -77.38130204958469   -5.83640e-07   3.76386e-07 DIIS/DAMP=1%
   @DF-UKS iter  10:   -77.38130192771455    1.21870e-07   2.74979e-08 DIIS/DAMP=1%
   @DF-UKS iter  11:   -77.38130195598023   -2.82657e-08   1.47765e-09 DIIS/DAMP=1%
   @DF-UKS iter  12:   -77.38130195527489    7.05342e-10   9.87561e-11 DIIS/DAMP=1%
  Energy and wave function converged.


  ==> Post-Iterations <==

   Electrons on quadrature grid:
      Nalpha   =    5.0000001702 ; deviation = 1.702e-07
      Nbeta    =    4.0000001751 ; deviation = 1.751e-07
      Ntotal   =    9.0000003453 ; deviation = 3.453e-07 

   @Spin Contamination Metric:   1.777595989E-03
   @S^2 Expected:                7.500000000E-01
   @S^2 Observed:                7.517775960E-01
   @S   Expected:                5.000000000E-01
   @S   Observed:                5.000000000E-01

    Orbital Energies [Eh]
    ---------------------

    Alpha Occupied:                                                       

       1A1   -19.868479     2A1    -1.588438     3A1    -1.212038  
       1B2    -0.951325     1B1    -0.867739  

    Alpha Virtual:                                                        

       4A1    -0.656351     2B2     0.378174     2B1     0.423521  
       5A1     0.478197     6A1     0.647186     7A1     0.795117  
       3B2     1.480531     3B1     1.501324     8A1     1.606611  
       1A2     2.000138     9A1     2.002341     4B2     2.191983  
       4B1     2.237745    10A1     3.140242  

    Beta Occupied:                                                        

       1A1   -19.840078     2A1    -1.530608     3A1    -1.181241  
       1B1    -0.838830  

    Beta Virtual:                                                         

       1B2    -0.672161     4A1    -0.626590     2B1     0.437073  
       2B2     0.469936     5A1     0.494202     6A1     0.647192  
       7A1     0.832349     3B1     1.502327     3B2     1.507079  
       8A1     1.627837     1A2     2.082918     9A1     2.094936  
       4B1     2.247436     4B2     2.263480    10A1     3.161394  

    Final Occupation by Irrep:
             A1    A2    B1    B2 
    DOCC [     3,    0,    1,    0 ]
    SOCC [     0,    0,    0,    1 ]
    NA   [     3,    0,    1,    1 ]
    NB   [     3,    0,    1,    0 ]

  @DF-UKS Final Energy:   -77.38130195527489

   => Energetics <=

    Nuclear Repulsion Energy =              7.0556961422666680
    One-Electron Energy =                -115.6985492141702139
    Two-Electron Energy =                  38.6176659933007045
    DFT Exchange-Correlation Energy =      -7.3561148766720468
    Empirical Dispersion Energy =           0.0000000000000000
    VV10 Nonlocal Energy =                  0.0000000000000000
    Total Energy =                        -77.3813019552748926

  UHF NO Occupations:
  HONO-2 :    2 A1 1.9997154
  HONO-1 :    3 A1 1.9994581
  HONO-0 :    1 B2 1.0000000
  LUNO+0 :    4 A1 0.0005419
  LUNO+1 :    5 A1 0.0002846
  LUNO+2 :    2 B1 0.0000624
  LUNO+3 :    6 A1 0.0000000


Computation Completed


Properties will be evaluated at   0.000000,   0.000000,   0.000000 [a0]

Properties computed using the SCF density matrix


 Multipole Moments:

 ------------------------------------------------------------------------------------
     Multipole            Electronic (a.u.)      Nuclear  (a.u.)        Total (a.u.)
 ------------------------------------------------------------------------------------

 L = 1.  Multiply by 2.5417464519 to convert [e a0] to [Debye]
 Dipole X            :          0.0000000            0.0000000            0.0000000
 Dipole Y            :          0.0000000            0.0000000            0.0000000
 Dipole Z            :          0.5044268           -0.0035150            0.5009118
 Magnitude           :                                                    0.5009118

 ------------------------------------------------------------------------------------

*** tstop() called on Joses-MacBook-Pro-2.local at Thu Jul 17 12:28:50 2025
Module time:
	user time   =       1.17 seconds =       0.02 minutes
	system time =       2.45 seconds =       0.04 minutes
	total time  =          0 seconds =       0.00 minutes
Total time:
	user time   =       1.17 seconds =       0.02 minutes
	system time =       2.45 seconds =       0.04 minutes
	total time  =          0 seconds =       0.00 minutes

*** tstart() called on Joses-MacBook-Pro-2.local
*** at Thu Jul 17 12:28:50 2025


         ------------------------------------------------------------
                                   SCF GRAD                          
                          Rob Parrish, Justin Turney,                
                       Andy Simmonett, and Alex Sokolov              
         ------------------------------------------------------------

  ==> Geometry <==

    Molecular point group: c2v
    Full point group: C_inf_v

    Geometry (in Angstrom), charge = 1, multiplicity = 2:

       Center              X                  Y                   Z               Mass       
    ------------   -----------------  -----------------  -----------------  -----------------
         HE           0.000000000000     0.000000000000     0.959813996152     4.002603254130
         O            0.000000000000     0.000000000000    -0.240186003848    15.994914619570

  Nuclear repulsion =    7.055696142266668

  ==> Basis Set <==

  Basis Set: CC-PVDZ
    Blend: CC-PVDZ
    Number of shells: 9
    Number of basis functions: 19
    Number of Cartesian functions: 20
    Spherical Harmonics?: true
    Max angular momentum: 2

  ==> DFJKGrad: Density-Fitted SCF Gradients <==

    Gradient:                    1
    J tasked:                  Yes
    K tasked:                  Yes
    wK tasked:                  No
    OpenMP threads:              1
    Integrals threads:           1
    Memory [MiB]:              375
    Schwarz Cutoff:          1E-12
    Fitting Condition:       1E-10

   => Auxiliary Basis Set <=

  Basis Set: (CC-PVDZ AUX)
    Blend: CC-PVDZ-JKFIT + DEF2-UNIVERSAL-JKFIT
    Number of shells: 33
    Number of basis functions: 93
    Number of Cartesian functions: 106
    Spherical Harmonics?: true
    Max angular momentum: 3

  ==> DFT Potential <==

   => LibXC <=

    Version 6.2.2
    S. Lehtola, C. Steigemann, M. J.T. Oliveira, and M. A.L. Marques.,  SoftwareX 7, 1–5 (2018) (10.1016/j.softx.2017.11.002)

   => Composite Functional: B3LYP <= 

    B3LYP Hyb-GGA Exchange-Correlation Functional

    P. J. Stephens, F. J. Devlin, C. F. Chabalowski, and M. J. Frisch.,  J. Phys. Chem. 98, 11623 (1994) (10.1021/j100096a001)

    Deriv               =              1
    GGA                 =           TRUE
    Meta                =          FALSE

    Exchange Hybrid     =           TRUE
    MP2 Hybrid          =          FALSE

   => Exchange Functionals <=

    0.0800   Slater exchange
    0.7200         Becke 88

   => Exact (HF) Exchange <=

    0.2000               HF 

   => Correlation Functionals <=

    0.1900   Vosko, Wilk & Nusair (VWN5_RPA)
    0.8100   Lee, Yang & Parr

   => LibXC Density Thresholds  <==

    XC_HYB_GGA_XC_B3LYP:  1.00E-15 

   => Molecular Quadrature <=

    Radial Scheme          =       TREUTLER
    Pruning Scheme         =           NONE
    Nuclear Scheme         =       TREUTLER

    Blocking Scheme        =         OCTREE
    BS radius alpha        =              1
    Pruning alpha          =              1
    Radial Points          =             75
    Spherical Points       =            302
    Total Points           =          42796
    Total Blocks           =            369
    Max Points             =            256
    Max Functions          =             19
    Weights Tolerance      =       1.00E-15


  -Total Gradient:
     Atom            X                  Y                   Z
    ------   -----------------  -----------------  -----------------
       1        0.000000000000    -0.000000000000    -0.004903672933
       2        0.000000000000     0.000000000000     0.004902775559


*** tstop() called on Joses-MacBook-Pro-2.local at Thu Jul 17 12:28:50 2025
Module time:
	user time   =       0.25 seconds =       0.00 minutes
	system time =       0.86 seconds =       0.01 minutes
	total time  =          0 seconds =       0.00 minutes
Total time:
	user time   =       1.42 seconds =       0.02 minutes
	system time =       3.31 seconds =       0.06 minutes
	total time  =          0 seconds =       0.00 minutes

    			-----------------------------------------

    			 OPTKING 3.0: for geometry optimizations 

    			     By R.A. King, Bethel University     

    			        with contributions from          

    			    A.V. Copan, J. Cayton, A. Heide      

    			-----------------------------------------

    
	                            ===> Fragment 1 <== 

	 Z (Atomic Numbers)          Masses                          Geom                  
	       2.000000             4.002603          0.00000000  0.00000000  1.81378558   
	       8.000000            15.994915          0.00000000  0.00000000 -0.45388577   

	 - Coordinate -           - BOHR/RAD -       - ANG/DEG -
	 R(1,2)           =         2.267671           1.200000


	        --- Internal Coordinate Step in ANG or DEG, aJ/ANG or AJ/DEG ---
	-------------------------------------------------------------------------------
	           Coordinate      Previous         Force          Change          New 
	           ----------      --------        ------          ------        ------
	               R(1,2)       1.20000        0.04040        0.01052       1.21052
	-------------------------------------------------------------------------------

	                                 ==> Convergence Check <==                                  
    
	Measures of convergence in internal coordinates in au.
    
	Criteria marked as inactive (o), active & met (*), and active & unmet ( ).

	----------------------------------------------------------------------------------------------
	   Step    Total Energy     Delta E     Max Force     RMS Force      Max Disp      RMS Disp   
	----------------------------------------------------------------------------------------------
	  Convergence Criteria     1.00e-06 *    3.00e-04 *             o    1.20e-03 *             o
	----------------------------------------------------------------------------------------------
	     1     -77.38130196   -7.74e+01      4.90e-03      4.90e-03 o    1.99e-02      1.99e-02 o  ~
	----------------------------------------------------------------------------------------------

Next Geometry in Ang 
	Fragment 1 (Ang)

	   He   0.0000000000   0.0000000000   0.9650716900
	    O   0.0000000000   0.0000000000  -0.2454436977


    Structure for next step:
    Molecular point group: c2v
    Full point group: C_inf_v

    Geometry (in Angstrom), charge = 1, multiplicity = 2:

    HE           0.000000000000     0.000000000000     0.968224676341
    O            0.000000000000     0.000000000000    -0.242290711293


Scratch directory: /tmp/
gradient() will perform analytic gradient computation.
   => Libint2 <=

    Primary   basis highest AM E, G, H:  6, 6, 3
    Auxiliary basis highest AM E, G, H:  7, 7, 4
    Onebody   basis highest AM E, G, H:  -, -, -
    Solid Harmonics ordering:            Gaussian

*** tstart() called on Joses-MacBook-Pro-2.local
*** at Thu Jul 17 12:28:51 2025

   => Loading Basis Set <=

    Name: CC-PVDZ
    Role: ORBITAL
    Keyword: BASIS
    atoms 1 entry HE         line    32 file /Users/joseantoniorodriguesromero/anaconda3/share/psi4/basis/cc-pvdz.gbs 
    atoms 2 entry O          line   198 file /Users/joseantoniorodriguesromero/anaconda3/share/psi4/basis/cc-pvdz.gbs 


         ---------------------------------------------------------
                                   SCF
               by Justin Turney, Rob Parrish, Andy Simmonett
                          and Daniel G. A. Smith
                              UKS Reference
                        1 Threads,    500 MiB Core
         ---------------------------------------------------------

  ==> Geometry <==

    Molecular point group: c2v
    Full point group: C_inf_v

    Geometry (in Angstrom), charge = 1, multiplicity = 2:

       Center              X                  Y                   Z               Mass       
    ------------   -----------------  -----------------  -----------------  -----------------
         HE           0.000000000000     0.000000000000     0.968224676341     4.002603254130
         O            0.000000000000     0.000000000000    -0.242290711293    15.994914619570

  Running in c2v symmetry.

  Rotational constants: A = ************  B =      3.59342  C =      3.59342 [cm^-1]
  Rotational constants: A = ************  B = 107727.89997  C = 107727.89997 [MHz]
  Nuclear repulsion =    6.994405405507260

  Charge       = 1
  Multiplicity = 2
  Electrons    = 9
  Nalpha       = 5
  Nbeta        = 4

  ==> Algorithm <==

  SCF Algorithm Type is DF.
  DIIS enabled.
  MOM disabled.
  Fractional occupation disabled.
  Guess Type is READ.
  Energy threshold   = 1.00e-08
  Density threshold  = 1.00e-08
  Integral threshold = 1.00e-12

  ==> Primary Basis <==

  Basis Set: CC-PVDZ
    Blend: CC-PVDZ
    Number of shells: 9
    Number of basis functions: 19
    Number of Cartesian functions: 20
    Spherical Harmonics?: true
    Max angular momentum: 2

  ==> DFT Potential <==

   => LibXC <=

    Version 6.2.2
    S. Lehtola, C. Steigemann, M. J.T. Oliveira, and M. A.L. Marques.,  SoftwareX 7, 1–5 (2018) (10.1016/j.softx.2017.11.002)

   => Composite Functional: B3LYP <= 

    B3LYP Hyb-GGA Exchange-Correlation Functional

    P. J. Stephens, F. J. Devlin, C. F. Chabalowski, and M. J. Frisch.,  J. Phys. Chem. 98, 11623 (1994) (10.1021/j100096a001)

    Deriv               =              1
    GGA                 =           TRUE
    Meta                =          FALSE

    Exchange Hybrid     =           TRUE
    MP2 Hybrid          =          FALSE

   => Exchange Functionals <=

    0.0800   Slater exchange
    0.7200         Becke 88

   => Exact (HF) Exchange <=

    0.2000               HF 

   => Correlation Functionals <=

    0.1900   Vosko, Wilk & Nusair (VWN5_RPA)
    0.8100   Lee, Yang & Parr

   => LibXC Density Thresholds  <==

    XC_HYB_GGA_XC_B3LYP:  1.00E-15 

   => Molecular Quadrature <=

    Radial Scheme          =       TREUTLER
    Pruning Scheme         =           NONE
    Nuclear Scheme         =       TREUTLER

    Blocking Scheme        =         OCTREE
    BS radius alpha        =              1
    Pruning alpha          =              1
    Radial Points          =             75
    Spherical Points       =            302
    Total Points           =          42805
    Total Blocks           =            372
    Max Points             =            256
    Max Functions          =             19
    Weights Tolerance      =       1.00E-15

   => Loading Basis Set <=

    Name: (CC-PVDZ AUX)
    Role: JKFIT
    Keyword: DF_BASIS_SCF
    atoms 1 entry HE         line    34 file /Users/joseantoniorodriguesromero/anaconda3/share/psi4/basis/def2-universal-jkfit.gbs 
    atoms 2 entry O          line   221 file /Users/joseantoniorodriguesromero/anaconda3/share/psi4/basis/cc-pvdz-jkfit.gbs 

   => Loading Basis Set <=

    Name: CC-PVDZ
    Role: ORBITAL
    Keyword: BASIS
    atoms 1 entry HE         line    32 file /Users/joseantoniorodriguesromero/anaconda3/share/psi4/basis/cc-pvdz.gbs 
    atoms 2 entry O          line   198 file /Users/joseantoniorodriguesromero/anaconda3/share/psi4/basis/cc-pvdz.gbs 

  Reading orbitals from file /tmp/doublet_HeO.default.73760.180.npy, no projection.

  ==> Integral Setup <==

  DFHelper Memory: AOs need 0.000 GiB; user supplied 0.343 GiB. 
  Using in-core AOs.

  ==> MemDFJK: Density-Fitted J/K Matrices <==

    J tasked:                   Yes
    K tasked:                   Yes
    wK tasked:                   No
    OpenMP threads:               1
    Memory [MiB]:               350
    Algorithm:                 Core
    Schwarz Cutoff:           1E-12
    Mask sparsity (%):       0.0000
    Fitting Condition:        1E-10

   => Auxiliary Basis Set <=

  Basis Set: (CC-PVDZ AUX)
    Blend: CC-PVDZ-JKFIT + DEF2-UNIVERSAL-JKFIT
    Number of shells: 33
    Number of basis functions: 93
    Number of Cartesian functions: 106
    Spherical Harmonics?: true
    Max angular momentum: 3

  Cached 100.0% of DFT collocation blocks in 0.024 [GiB].

  Minimum eigenvalue in the overlap matrix is 8.9303477425E-02.
  Reciprocal condition number of the overlap matrix is 3.5759305278E-02.
    Using symmetric orthogonalization.

  ==> Pre-Iterations <==

  SCF Guess: Orbitals guess was supplied from a previous computation.

   -------------------------------------------------------
    Irrep   Nso     Nmo     Nalpha   Nbeta   Ndocc  Nsocc
   -------------------------------------------------------
     A1        10      10       3       3       3       0
     A2         1       1       0       0       0       0
     B1         4       4       1       1       1       0
     B2         4       4       1       0       0       1
   -------------------------------------------------------
    Total      19      19       5       4       4       1
   -------------------------------------------------------

  ==> Iterations <==

                           Total Energy        Delta E     RMS |[F,P]|

   @DF-UKS iter   0:   -77.37592365166749   -7.73759e+01   1.38256e-03 
   @DF-UKS iter   1:   -77.38133584390236   -5.41219e-03   7.13772e-04 DIIS/ADIIS
   @DF-UKS iter   2:   -77.38132874043765    7.10346e-06   7.82165e-04 DIIS/ADIIS/DAMP=1%
   @DF-UKS iter   3:   -77.38148803511808   -1.59295e-04   4.49285e-05 DIIS/DAMP=1%
   @DF-UKS iter   4:   -77.38136046555667    1.27570e-04   3.51213e-06 DIIS/DAMP=1%
   @DF-UKS iter   5:   -77.38136959524455   -9.12969e-06   1.31647e-06 DIIS/DAMP=1%
   @DF-UKS iter   6:   -77.38136898004777    6.15197e-07   3.12867e-07 DIIS/DAMP=1%
   @DF-UKS iter   7:   -77.38136914427568   -1.64228e-07   6.85247e-08 DIIS/DAMP=1%
   @DF-UKS iter   8:   -77.38136913406109    1.02146e-08   1.14882e-08 DIIS/DAMP=1%
   @DF-UKS iter   9:   -77.38136911787066    1.61904e-08   1.80479e-09 DIIS/DAMP=1%
   @DF-UKS iter  10:   -77.38136911989312   -2.02246e-09   2.70030e-10 DIIS/DAMP=1%
  Energy and wave function converged.


  ==> Post-Iterations <==

   Electrons on quadrature grid:
      Nalpha   =    5.0000001722 ; deviation = 1.722e-07
      Nbeta    =    4.0000001779 ; deviation = 1.779e-07
      Ntotal   =    9.0000003501 ; deviation = 3.501e-07 

   @Spin Contamination Metric:   1.802325839E-03
   @S^2 Expected:                7.500000000E-01
   @S^2 Observed:                7.518023258E-01
   @S   Expected:                5.000000000E-01
   @S   Observed:                5.000000000E-01

    Orbital Energies [Eh]
    ---------------------

    Alpha Occupied:                                                       

       1A1   -19.870083     2A1    -1.583417     3A1    -1.210839  
       1B2    -0.951741     1B1    -0.868084  

    Alpha Virtual:                                                        

       4A1    -0.661233     2B2     0.378010     2B1     0.423329  
       5A1     0.478258     6A1     0.653988     7A1     0.793132  
       3B2     1.489333     3B1     1.509861     8A1     1.595187  
       1A2     1.999757     9A1     2.001907     4B2     2.181717  
       4B1     2.227582    10A1     3.124924  

    Beta Occupied:                                                        

       1A1   -19.841653     2A1    -1.524515     3A1    -1.181248  
       1B1    -0.839156  

    Beta Virtual:                                                         

       1B2    -0.672366     4A1    -0.631368     2B1     0.436868  
       2B2     0.469713     5A1     0.494441     6A1     0.653849  
       7A1     0.830289     3B1     1.510775     3B2     1.515468  
       8A1     1.616298     1A2     2.082555     9A1     2.094580  
       4B1     2.237324     4B2     2.253566    10A1     3.146095  

    Final Occupation by Irrep:
             A1    A2    B1    B2 
    DOCC [     3,    0,    1,    0 ]
    SOCC [     0,    0,    0,    1 ]
    NA   [     3,    0,    1,    1 ]
    NB   [     3,    0,    1,    0 ]

  @DF-UKS Final Energy:   -77.38136911989312

   => Energetics <=

    Nuclear Repulsion Energy =              6.9944054055072602
    One-Electron Energy =                -115.5854320683910430
    Two-Electron Energy =                  38.5637312080364438
    DFT Exchange-Correlation Energy =      -7.3540736650457861
    Empirical Dispersion Energy =           0.0000000000000000
    VV10 Nonlocal Energy =                  0.0000000000000000
    Total Energy =                        -77.3813691198931224

  UHF NO Occupations:
  HONO-2 :    2 A1 1.9997000
  HONO-1 :    3 A1 1.9994611
  HONO-0 :    1 B2 1.0000000
  LUNO+0 :    4 A1 0.0005389
  LUNO+1 :    5 A1 0.0003000
  LUNO+2 :    2 B1 0.0000624
  LUNO+3 :    6 A1 0.0000000


Computation Completed


Properties will be evaluated at   0.000000,   0.000000,   0.000000 [a0]

Properties computed using the SCF density matrix


 Multipole Moments:

 ------------------------------------------------------------------------------------
     Multipole            Electronic (a.u.)      Nuclear  (a.u.)        Total (a.u.)
 ------------------------------------------------------------------------------------

 L = 1.  Multiply by 2.5417464519 to convert [e a0] to [Debye]
 Dipole X            :          0.0000000            0.0000000            0.0000000
 Dipole Y            :          0.0000000            0.0000000            0.0000000
 Dipole Z            :          0.4923362           -0.0035458            0.4887905
 Magnitude           :                                                    0.4887905

 ------------------------------------------------------------------------------------

*** tstop() called on Joses-MacBook-Pro-2.local at Thu Jul 17 12:28:51 2025
Module time:
	user time   =       0.90 seconds =       0.02 minutes
	system time =       3.16 seconds =       0.05 minutes
	total time  =          0 seconds =       0.00 minutes
Total time:
	user time   =       2.36 seconds =       0.04 minutes
	system time =       6.68 seconds =       0.11 minutes
	total time  =          1 seconds =       0.02 minutes

*** tstart() called on Joses-MacBook-Pro-2.local
*** at Thu Jul 17 12:28:51 2025


         ------------------------------------------------------------
                                   SCF GRAD                          
                          Rob Parrish, Justin Turney,                
                       Andy Simmonett, and Alex Sokolov              
         ------------------------------------------------------------

  ==> Geometry <==

    Molecular point group: c2v
    Full point group: C_inf_v

    Geometry (in Angstrom), charge = 1, multiplicity = 2:

       Center              X                  Y                   Z               Mass       
    ------------   -----------------  -----------------  -----------------  -----------------
         HE           0.000000000000     0.000000000000     0.968224676341     4.002603254130
         O            0.000000000000     0.000000000000    -0.242290711293    15.994914619570

  Nuclear repulsion =    6.994405405507260

  ==> Basis Set <==

  Basis Set: CC-PVDZ
    Blend: CC-PVDZ
    Number of shells: 9
    Number of basis functions: 19
    Number of Cartesian functions: 20
    Spherical Harmonics?: true
    Max angular momentum: 2

  ==> DFJKGrad: Density-Fitted SCF Gradients <==

    Gradient:                    1
    J tasked:                  Yes
    K tasked:                  Yes
    wK tasked:                  No
    OpenMP threads:              1
    Integrals threads:           1
    Memory [MiB]:              375
    Schwarz Cutoff:          1E-12
    Fitting Condition:       1E-10

   => Auxiliary Basis Set <=

  Basis Set: (CC-PVDZ AUX)
    Blend: CC-PVDZ-JKFIT + DEF2-UNIVERSAL-JKFIT
    Number of shells: 33
    Number of basis functions: 93
    Number of Cartesian functions: 106
    Spherical Harmonics?: true
    Max angular momentum: 3

  ==> DFT Potential <==

   => LibXC <=

    Version 6.2.2
    S. Lehtola, C. Steigemann, M. J.T. Oliveira, and M. A.L. Marques.,  SoftwareX 7, 1–5 (2018) (10.1016/j.softx.2017.11.002)

   => Composite Functional: B3LYP <= 

    B3LYP Hyb-GGA Exchange-Correlation Functional

    P. J. Stephens, F. J. Devlin, C. F. Chabalowski, and M. J. Frisch.,  J. Phys. Chem. 98, 11623 (1994) (10.1021/j100096a001)

    Deriv               =              1
    GGA                 =           TRUE
    Meta                =          FALSE

    Exchange Hybrid     =           TRUE
    MP2 Hybrid          =          FALSE

   => Exchange Functionals <=

    0.0800   Slater exchange
    0.7200         Becke 88

   => Exact (HF) Exchange <=

    0.2000               HF 

   => Correlation Functionals <=

    0.1900   Vosko, Wilk & Nusair (VWN5_RPA)
    0.8100   Lee, Yang & Parr

   => LibXC Density Thresholds  <==

    XC_HYB_GGA_XC_B3LYP:  1.00E-15 

   => Molecular Quadrature <=

    Radial Scheme          =       TREUTLER
    Pruning Scheme         =           NONE
    Nuclear Scheme         =       TREUTLER

    Blocking Scheme        =         OCTREE
    BS radius alpha        =              1
    Pruning alpha          =              1
    Radial Points          =             75
    Spherical Points       =            302
    Total Points           =          42805
    Total Blocks           =            372
    Max Points             =            256
    Max Functions          =             19
    Weights Tolerance      =       1.00E-15


  -Total Gradient:
     Atom            X                  Y                   Z
    ------   -----------------  -----------------  -----------------
       1        0.000000000000    -0.000000000000    -0.001892053969
       2        0.000000000000     0.000000000000     0.001891039718


*** tstop() called on Joses-MacBook-Pro-2.local at Thu Jul 17 12:28:51 2025
Module time:
	user time   =       0.19 seconds =       0.00 minutes
	system time =       0.90 seconds =       0.02 minutes
	total time  =          0 seconds =       0.00 minutes
Total time:
	user time   =       2.56 seconds =       0.04 minutes
	system time =       7.58 seconds =       0.13 minutes
	total time  =          1 seconds =       0.02 minutes

    			-----------------------------------------

    			 OPTKING 3.0: for geometry optimizations 

    			     By R.A. King, Bethel University     

    			        with contributions from          

    			    A.V. Copan, J. Cayton, A. Heide      

    			-----------------------------------------

    
	                            ===> Fragment 1 <== 

	 Z (Atomic Numbers)          Masses                          Geom                  
	       2.000000             4.002603          0.00000000  0.00000000  1.82967947   
	       8.000000            15.994915          0.00000000  0.00000000 -0.45786309   

	 - Coordinate -           - BOHR/RAD -       - ANG/DEG -
	 R(1,2)           =         2.287543           1.210515


	        --- Internal Coordinate Step in ANG or DEG, aJ/ANG or AJ/DEG ---
	-------------------------------------------------------------------------------
	           Coordinate      Previous         Force          Change          New 
	           ----------      --------        ------          ------        ------
	               R(1,2)       1.21052        0.01558        0.00660       1.21712
	-------------------------------------------------------------------------------

	                                 ==> Convergence Check <==                                  
    
	Measures of convergence in internal coordinates in au.
    
	Criteria marked as inactive (o), active & met (*), and active & unmet ( ).

	----------------------------------------------------------------------------------------------
	   Step    Total Energy     Delta E     Max Force     RMS Force      Max Disp      RMS Disp   
	----------------------------------------------------------------------------------------------
	  Convergence Criteria     1.00e-06 *    3.00e-04 *             o    1.20e-03 *             o
	----------------------------------------------------------------------------------------------
	     2     -77.38136912   -6.72e-05      1.89e-03      1.89e-03 o    1.25e-02      1.25e-02 o  ~
	----------------------------------------------------------------------------------------------

Next Geometry in Ang 
	Fragment 1 (Ang)

	   He   0.0000000000   0.0000000000   0.9715263665
	    O   0.0000000000   0.0000000000  -0.2455924014


    Structure for next step:
    Molecular point group: c2v
    Full point group: C_inf_v

    Geometry (in Angstrom), charge = 1, multiplicity = 2:

    HE           0.000000000000     0.000000000000     0.973506356992
    O            0.000000000000     0.000000000000    -0.243612410888


Scratch directory: /tmp/
gradient() will perform analytic gradient computation.
   => Libint2 <=

    Primary   basis highest AM E, G, H:  6, 6, 3
    Auxiliary basis highest AM E, G, H:  7, 7, 4
    Onebody   basis highest AM E, G, H:  -, -, -
    Solid Harmonics ordering:            Gaussian

*** tstart() called on Joses-MacBook-Pro-2.local
*** at Thu Jul 17 12:28:51 2025

   => Loading Basis Set <=

    Name: CC-PVDZ
    Role: ORBITAL
    Keyword: BASIS
    atoms 1 entry HE         line    32 file /Users/joseantoniorodriguesromero/anaconda3/share/psi4/basis/cc-pvdz.gbs 
    atoms 2 entry O          line   198 file /Users/joseantoniorodriguesromero/anaconda3/share/psi4/basis/cc-pvdz.gbs 


         ---------------------------------------------------------
                                   SCF
               by Justin Turney, Rob Parrish, Andy Simmonett
                          and Daniel G. A. Smith
                              UKS Reference
                        1 Threads,    500 MiB Core
         ---------------------------------------------------------

  ==> Geometry <==

    Molecular point group: c2v
    Full point group: C_inf_v

    Geometry (in Angstrom), charge = 1, multiplicity = 2:

       Center              X                  Y                   Z               Mass       
    ------------   -----------------  -----------------  -----------------  -----------------
         HE           0.000000000000     0.000000000000     0.973506356992     4.002603254130
         O            0.000000000000     0.000000000000    -0.243612410888    15.994914619570

  Running in c2v symmetry.

  Rotational constants: A = ************  B =      3.55453  C =      3.55453 [cm^-1]
  Rotational constants: A = ************  B = 106562.13280  C = 106562.13280 [MHz]
  Nuclear repulsion =    6.956457820026587

  Charge       = 1
  Multiplicity = 2
  Electrons    = 9
  Nalpha       = 5
  Nbeta        = 4

  ==> Algorithm <==

  SCF Algorithm Type is DF.
  DIIS enabled.
  MOM disabled.
  Fractional occupation disabled.
  Guess Type is READ.
  Energy threshold   = 1.00e-08
  Density threshold  = 1.00e-08
  Integral threshold = 1.00e-12

  ==> Primary Basis <==

  Basis Set: CC-PVDZ
    Blend: CC-PVDZ
    Number of shells: 9
    Number of basis functions: 19
    Number of Cartesian functions: 20
    Spherical Harmonics?: true
    Max angular momentum: 2

  ==> DFT Potential <==

   => LibXC <=

    Version 6.2.2
    S. Lehtola, C. Steigemann, M. J.T. Oliveira, and M. A.L. Marques.,  SoftwareX 7, 1–5 (2018) (10.1016/j.softx.2017.11.002)

   => Composite Functional: B3LYP <= 

    B3LYP Hyb-GGA Exchange-Correlation Functional

    P. J. Stephens, F. J. Devlin, C. F. Chabalowski, and M. J. Frisch.,  J. Phys. Chem. 98, 11623 (1994) (10.1021/j100096a001)

    Deriv               =              1
    GGA                 =           TRUE
    Meta                =          FALSE

    Exchange Hybrid     =           TRUE
    MP2 Hybrid          =          FALSE

   => Exchange Functionals <=

    0.0800   Slater exchange
    0.7200         Becke 88

   => Exact (HF) Exchange <=

    0.2000               HF 

   => Correlation Functionals <=

    0.1900   Vosko, Wilk & Nusair (VWN5_RPA)
    0.8100   Lee, Yang & Parr

   => LibXC Density Thresholds  <==

    XC_HYB_GGA_XC_B3LYP:  1.00E-15 

   => Molecular Quadrature <=

    Radial Scheme          =       TREUTLER
    Pruning Scheme         =           NONE
    Nuclear Scheme         =       TREUTLER

    Blocking Scheme        =         OCTREE
    BS radius alpha        =              1
    Pruning alpha          =              1
    Radial Points          =             75
    Spherical Points       =            302
    Total Points           =          42805
    Total Blocks           =            371
    Max Points             =            256
    Max Functions          =             19
    Weights Tolerance      =       1.00E-15

   => Loading Basis Set <=

    Name: (CC-PVDZ AUX)
    Role: JKFIT
    Keyword: DF_BASIS_SCF
    atoms 1 entry HE         line    34 file /Users/joseantoniorodriguesromero/anaconda3/share/psi4/basis/def2-universal-jkfit.gbs 
    atoms 2 entry O          line   221 file /Users/joseantoniorodriguesromero/anaconda3/share/psi4/basis/cc-pvdz-jkfit.gbs 

   => Loading Basis Set <=

    Name: CC-PVDZ
    Role: ORBITAL
    Keyword: BASIS
    atoms 1 entry HE         line    32 file /Users/joseantoniorodriguesromero/anaconda3/share/psi4/basis/cc-pvdz.gbs 
    atoms 2 entry O          line   198 file /Users/joseantoniorodriguesromero/anaconda3/share/psi4/basis/cc-pvdz.gbs 

  Reading orbitals from file /tmp/doublet_HeO.default.73760.180.npy, no projection.

  ==> Integral Setup <==

  DFHelper Memory: AOs need 0.000 GiB; user supplied 0.343 GiB. 
  Using in-core AOs.

  ==> MemDFJK: Density-Fitted J/K Matrices <==

    J tasked:                   Yes
    K tasked:                   Yes
    wK tasked:                   No
    OpenMP threads:               1
    Memory [MiB]:               350
    Algorithm:                 Core
    Schwarz Cutoff:           1E-12
    Mask sparsity (%):       0.0000
    Fitting Condition:        1E-10

   => Auxiliary Basis Set <=

  Basis Set: (CC-PVDZ AUX)
    Blend: CC-PVDZ-JKFIT + DEF2-UNIVERSAL-JKFIT
    Number of shells: 33
    Number of basis functions: 93
    Number of Cartesian functions: 106
    Spherical Harmonics?: true
    Max angular momentum: 3

  Cached 100.0% of DFT collocation blocks in 0.024 [GiB].

  Minimum eigenvalue in the overlap matrix is 9.0386122327E-02.
  Reciprocal condition number of the overlap matrix is 3.6304387491E-02.
    Using symmetric orthogonalization.

  ==> Pre-Iterations <==

  SCF Guess: Orbitals guess was supplied from a previous computation.

   -------------------------------------------------------
    Irrep   Nso     Nmo     Nalpha   Nbeta   Ndocc  Nsocc
   -------------------------------------------------------
     A1        10      10       3       3       3       0
     A2         1       1       0       0       0       0
     B1         4       4       1       1       1       0
     B2         4       4       1       0       0       1
   -------------------------------------------------------
    Total      19      19       5       4       4       1
   -------------------------------------------------------

  ==> Iterations <==

                           Total Energy        Delta E     RMS |[F,P]|

   @DF-UKS iter   0:   -77.37802999942978   -7.73780e+01   8.51017e-04 
   @DF-UKS iter   1:   -77.38136864901308   -3.33865e-03   4.41675e-04 DIIS/ADIIS
   @DF-UKS iter   2:   -77.38136581555038    2.83346e-06   4.85656e-04 DIIS/ADIIS/DAMP=1%
   @DF-UKS iter   3:   -77.38145542662630   -8.96111e-05   2.74008e-05 DIIS/DAMP=1%
   @DF-UKS iter   4:   -77.38137619091667    7.92357e-05   2.20908e-06 DIIS/DAMP=1%
   @DF-UKS iter   5:   -77.38138174909582   -5.55818e-06   8.26777e-07 DIIS/DAMP=1%
   @DF-UKS iter   6:   -77.38138136451258    3.84583e-07   1.95359e-07 DIIS/DAMP=1%
   @DF-UKS iter   7:   -77.38138146040365   -9.58911e-08   4.52486e-08 DIIS/DAMP=1%
   @DF-UKS iter   8:   -77.38138145799891    2.40473e-09   6.86357e-09 DIIS/DAMP=1%
  Energy and wave function converged.


  ==> Post-Iterations <==

   Electrons on quadrature grid:
      Nalpha   =    5.0000001724 ; deviation = 1.724e-07
      Nbeta    =    4.0000001787 ; deviation = 1.787e-07
      Ntotal   =    9.0000003510 ; deviation = 3.510e-07 

   @Spin Contamination Metric:   1.818662047E-03
   @S^2 Expected:                7.500000000E-01
   @S^2 Observed:                7.518186620E-01
   @S   Expected:                5.000000000E-01
   @S   Observed:                5.000000000E-01

    Orbital Energies [Eh]
    ---------------------

    Alpha Occupied:                                                       

       1A1   -19.871087     2A1    -1.580405     3A1    -1.210010  
       1B2    -0.952013     1B1    -0.868313  

    Alpha Virtual:                                                        

       4A1    -0.664228     2B2     0.377910     2B1     0.423212  
       5A1     0.478303     6A1     0.658178     7A1     0.791852  
       3B2     1.494856     3B1     1.515217     8A1     1.588455  
       1A2     1.999509     9A1     2.001630     4B2     2.175381  
       4B1     2.221316    10A1     3.115081  

    Beta Occupied:                                                        

       1A1   -19.842639     2A1    -1.520823     3A1    -1.181183  
       1B1    -0.839372  

    Beta Virtual:                                                         

       1B2    -0.672506     4A1    -0.634295     2B1     0.436743  
       2B2     0.469576     5A1     0.494595     6A1     0.657958  
       7A1     0.828950     3B1     1.516073     3B2     1.520728  
       8A1     1.609503     1A2     2.082319     9A1     2.094348  
       4B1     2.231091     4B2     2.247459    10A1     3.136260  

    Final Occupation by Irrep:
             A1    A2    B1    B2 
    DOCC [     3,    0,    1,    0 ]
    SOCC [     0,    0,    0,    1 ]
    NA   [     3,    0,    1,    1 ]
    NB   [     3,    0,    1,    0 ]

  @DF-UKS Final Energy:   -77.38138145799891

   => Energetics <=

    Nuclear Repulsion Energy =              6.9564578200265874
    One-Electron Energy =                -115.5152412643157334
    Two-Electron Energy =                  38.5302266845820824
    DFT Exchange-Correlation Energy =      -7.3528246982918501
    Empirical Dispersion Energy =           0.0000000000000000
    VV10 Nonlocal Energy =                  0.0000000000000000
    Total Energy =                        -77.3813814579989270

  UHF NO Occupations:
  HONO-2 :    2 A1 1.9996901
  HONO-1 :    3 A1 1.9994627
  HONO-0 :    1 B2 1.0000000
  LUNO+0 :    4 A1 0.0005373
  LUNO+1 :    5 A1 0.0003099
  LUNO+2 :    2 B1 0.0000623
  LUNO+3 :    6 A1 0.0000000


Computation Completed


Properties will be evaluated at   0.000000,   0.000000,   0.000000 [a0]

Properties computed using the SCF density matrix


 Multipole Moments:

 ------------------------------------------------------------------------------------
     Multipole            Electronic (a.u.)      Nuclear  (a.u.)        Total (a.u.)
 ------------------------------------------------------------------------------------

 L = 1.  Multiply by 2.5417464519 to convert [e a0] to [Debye]
 Dipole X            :          0.0000000            0.0000000            0.0000000
 Dipole Y            :          0.0000000            0.0000000            0.0000000
 Dipole Z            :          0.4847744           -0.0035651            0.4812093
 Magnitude           :                                                    0.4812093

 ------------------------------------------------------------------------------------

*** tstop() called on Joses-MacBook-Pro-2.local at Thu Jul 17 12:28:52 2025
Module time:
	user time   =       0.80 seconds =       0.01 minutes
	system time =       3.13 seconds =       0.05 minutes
	total time  =          1 seconds =       0.02 minutes
Total time:
	user time   =       3.40 seconds =       0.06 minutes
	system time =      10.98 seconds =       0.18 minutes
	total time  =          2 seconds =       0.03 minutes

*** tstart() called on Joses-MacBook-Pro-2.local
*** at Thu Jul 17 12:28:52 2025


         ------------------------------------------------------------
                                   SCF GRAD                          
                          Rob Parrish, Justin Turney,                
                       Andy Simmonett, and Alex Sokolov              
         ------------------------------------------------------------

  ==> Geometry <==

    Molecular point group: c2v
    Full point group: C_inf_v

    Geometry (in Angstrom), charge = 1, multiplicity = 2:

       Center              X                  Y                   Z               Mass       
    ------------   -----------------  -----------------  -----------------  -----------------
         HE           0.000000000000     0.000000000000     0.973506356992     4.002603254130
         O            0.000000000000     0.000000000000    -0.243612410888    15.994914619570

  Nuclear repulsion =    6.956457820026587

  ==> Basis Set <==

  Basis Set: CC-PVDZ
    Blend: CC-PVDZ
    Number of shells: 9
    Number of basis functions: 19
    Number of Cartesian functions: 20
    Spherical Harmonics?: true
    Max angular momentum: 2

  ==> DFJKGrad: Density-Fitted SCF Gradients <==

    Gradient:                    1
    J tasked:                  Yes
    K tasked:                  Yes
    wK tasked:                  No
    OpenMP threads:              1
    Integrals threads:           1
    Memory [MiB]:              375
    Schwarz Cutoff:          1E-12
    Fitting Condition:       1E-10

   => Auxiliary Basis Set <=

  Basis Set: (CC-PVDZ AUX)
    Blend: CC-PVDZ-JKFIT + DEF2-UNIVERSAL-JKFIT
    Number of shells: 33
    Number of basis functions: 93
    Number of Cartesian functions: 106
    Spherical Harmonics?: true
    Max angular momentum: 3

  ==> DFT Potential <==

   => LibXC <=

    Version 6.2.2
    S. Lehtola, C. Steigemann, M. J.T. Oliveira, and M. A.L. Marques.,  SoftwareX 7, 1–5 (2018) (10.1016/j.softx.2017.11.002)

   => Composite Functional: B3LYP <= 

    B3LYP Hyb-GGA Exchange-Correlation Functional

    P. J. Stephens, F. J. Devlin, C. F. Chabalowski, and M. J. Frisch.,  J. Phys. Chem. 98, 11623 (1994) (10.1021/j100096a001)

    Deriv               =              1
    GGA                 =           TRUE
    Meta                =          FALSE

    Exchange Hybrid     =           TRUE
    MP2 Hybrid          =          FALSE

   => Exchange Functionals <=

    0.0800   Slater exchange
    0.7200         Becke 88

   => Exact (HF) Exchange <=

    0.2000               HF 

   => Correlation Functionals <=

    0.1900   Vosko, Wilk & Nusair (VWN5_RPA)
    0.8100   Lee, Yang & Parr

   => LibXC Density Thresholds  <==

    XC_HYB_GGA_XC_B3LYP:  1.00E-15 

   => Molecular Quadrature <=

    Radial Scheme          =       TREUTLER
    Pruning Scheme         =           NONE
    Nuclear Scheme         =       TREUTLER

    Blocking Scheme        =         OCTREE
    BS radius alpha        =              1
    Pruning alpha          =              1
    Radial Points          =             75
    Spherical Points       =            302
    Total Points           =          42805
    Total Blocks           =            371
    Max Points             =            256
    Max Functions          =             19
    Weights Tolerance      =       1.00E-15


  -Total Gradient:
     Atom            X                  Y                   Z
    ------   -----------------  -----------------  -----------------
       1        0.000000000000    -0.000000000000    -0.000099300342
       2       -0.000000000000    -0.000000000000     0.000098227824


*** tstop() called on Joses-MacBook-Pro-2.local at Thu Jul 17 12:28:52 2025
Module time:
	user time   =       0.32 seconds =       0.01 minutes
	system time =       0.76 seconds =       0.01 minutes
	total time  =          0 seconds =       0.00 minutes
Total time:
	user time   =       3.73 seconds =       0.06 minutes
	system time =      11.74 seconds =       0.20 minutes
	total time  =          2 seconds =       0.03 minutes

    			-----------------------------------------

    			 OPTKING 3.0: for geometry optimizations 

    			     By R.A. King, Bethel University     

    			        with contributions from          

    			    A.V. Copan, J. Cayton, A. Heide      

    			-----------------------------------------

    
	                            ===> Fragment 1 <== 

	 Z (Atomic Numbers)          Masses                          Geom                  
	       2.000000             4.002603          0.00000000  0.00000000  1.83966040   
	       8.000000            15.994915          0.00000000  0.00000000 -0.46036074   

	 - Coordinate -           - BOHR/RAD -       - ANG/DEG -
	 R(1,2)           =         2.300021           1.217119


	        --- Internal Coordinate Step in ANG or DEG, aJ/ANG or AJ/DEG ---
	-------------------------------------------------------------------------------
	           Coordinate      Previous         Force          Change          New 
	           ----------      --------        ------          ------        ------
	               R(1,2)       1.21712        0.00081        0.00035       1.21747
	-------------------------------------------------------------------------------

	                                 ==> Convergence Check <==                                  
    
	Measures of convergence in internal coordinates in au.
    
	Criteria marked as inactive (o), active & met (*), and active & unmet ( ).

	----------------------------------------------------------------------------------------------
	   Step    Total Energy     Delta E     Max Force     RMS Force      Max Disp      RMS Disp   
	----------------------------------------------------------------------------------------------
	  Convergence Criteria     1.00e-06 *    3.00e-04 *             o    1.20e-03 *             o
	----------------------------------------------------------------------------------------------
	     3     -77.38138146   -1.23e-05      9.88e-05 *    9.88e-05 o    6.65e-04 *    6.65e-04 o  ~
	----------------------------------------------------------------------------------------------

Next Geometry in Ang 
	Fragment 1 (Ang)

	   He   0.0000000000   0.0000000000   0.9736823100
	    O   0.0000000000   0.0000000000  -0.2437883639


    Final optimized geometry and variables:
    Molecular point group: c2v
    Full point group: C_inf_v

    Geometry (in Angstrom), charge = 1, multiplicity = 2:

    HE           0.000000000000     0.000000000000     0.973506356992
    O            0.000000000000     0.000000000000    -0.243612410888


    Psi4 stopped on: Thursday, 17 July 2025 12:28PM
    Psi4 wall time for execution: 0:00:02.45

*** Psi4 exiting successfully. Buy a developer a beer!
