
    -----------------------------------------------------------------------
          Psi4: An Open-Source Ab Initio Electronic Structure Package
                               Psi4 1.9.1 release

                         Git: Rev {} zzzzzzz 


    D. G. A. Smith, L. A. Burns, A. C. Simmonett, R. M. Parrish,
    M. C. Schieber, R. Galvelis, P. Kraus, H. Kruse, R. Di Remigio,
    A. Alenaizan, A. M. James, S. Lehtola, J. P. Misiewicz, M. Scheurer,
    R. A. Shaw, J. B. Schriber, Y. Xie, Z. L. Glick, D. A. Sirianni,
    J. S. O'Brien, J. M. Waldrop, A. Kumar, E. G. Hohenstein,
    B. P. Pritchard, B. R. Brooks, H. F. Schaefer III, A. Yu. Sokolov,
    K. Patkowski, A. E. DePrince III, U. Bozkaya, R. A. King,
    F. A. Evangelista, J. M. Turney, T. D. Crawford, C. D. Sherrill,
    J. Chem. Phys. 152(18) 184108 (2020). https://doi.org/10.1063/5.0006002

                            Additional Code Authors
    E. T. Seidl, C. L. Janssen, E. F. Valeev, M. L. Leininger,
    J. F. Gonthier, R. M. Richard, H. R. McAlexander, M. Saitow, X. Wang,
    P. Verma, M. H. Lechner, A. Jiang, S. Behnle, A. G. Heide,
    M. F. Herbst, and D. L. Poole

             Previous Authors, Complete List of Code Contributors,
                       and Citations for Specific Modules
    https://github.com/psi4/psi4/blob/master/codemeta.json
    https://github.com/psi4/psi4/graphs/contributors
    http://psicode.org/psi4manual/master/introduction.html#citing-psifour

    -----------------------------------------------------------------------


    Psi4 started on: Thursday, 17 July 2025 01:31PM

    Process ID: 74227
    Host:       Joses-MacBook-Pro-2.local
    PSIDATADIR: /Users/joseantoniorodriguesromero/anaconda3/share/psi4
    Memory:     500.0 MiB
    Threads:    1
    
  ==> Input File <==

--------------------------------------------------------------------------
molecule { 
1 2
B   0.00000        0.60000        0.00000
F   0.00000       -0.60000        0.00000
}

set { 
basis              cc-pvdz
reference          uks
maxiter            500
geom_maxiter       500
DAMPING_PERCENTAGE 1
guess              SAP
}

optimize('b3lyp')
--------------------------------------------------------------------------

Scratch directory: /tmp/
gradient() will perform analytic gradient computation.
   => Libint2 <=

    Primary   basis highest AM E, G, H:  6, 6, 3
    Auxiliary basis highest AM E, G, H:  7, 7, 4
    Onebody   basis highest AM E, G, H:  -, -, -
    Solid Harmonics ordering:            Gaussian

*** tstart() called on Joses-MacBook-Pro-2.local
*** at Thu Jul 17 13:31:10 2025

   => Loading Basis Set <=

    Name: CC-PVDZ
    Role: ORBITAL
    Keyword: BASIS
    atoms 1 entry B          line   108 file /Users/joseantoniorodriguesromero/anaconda3/share/psi4/basis/cc-pvdz.gbs 
    atoms 2 entry F          line   228 file /Users/joseantoniorodriguesromero/anaconda3/share/psi4/basis/cc-pvdz.gbs 


         ---------------------------------------------------------
                                   SCF
               by Justin Turney, Rob Parrish, Andy Simmonett
                          and Daniel G. A. Smith
                              UKS Reference
                        1 Threads,    500 MiB Core
         ---------------------------------------------------------

  ==> Geometry <==

    Molecular point group: c2v
    Full point group: C_inf_v

    Geometry (in Angstrom), charge = 1, multiplicity = 2:

       Center              X                  Y                   Z               Mass       
    ------------   -----------------  -----------------  -----------------  -----------------
         B            0.000000000000     0.000000000000     0.759740910507    11.009305360000
         F            0.000000000000     0.000000000000    -0.440259089493    18.998403162730

  Running in c2v symmetry.

  Rotational constants: A = ************  B =      1.67954  C =      1.67954 [cm^-1]
  Rotational constants: A = ************  B =  50351.28084  C =  50351.28084 [MHz]
  Nuclear repulsion =   19.844145400125004

  Charge       = 1
  Multiplicity = 2
  Electrons    = 13
  Nalpha       = 7
  Nbeta        = 6

  ==> Algorithm <==

  SCF Algorithm Type is DF.
  DIIS enabled.
  MOM disabled.
  Fractional occupation disabled.
  Guess Type is SAP.
  Energy threshold   = 1.00e-08
  Density threshold  = 1.00e-08
  Integral threshold = 1.00e-12

  ==> Primary Basis <==

  Basis Set: CC-PVDZ
    Blend: CC-PVDZ
    Number of shells: 12
    Number of basis functions: 28
    Number of Cartesian functions: 30
    Spherical Harmonics?: true
    Max angular momentum: 2

  ==> DFT Potential <==

   => LibXC <=

    Version 6.2.2
    S. Lehtola, C. Steigemann, M. J.T. Oliveira, and M. A.L. Marques.,  SoftwareX 7, 1–5 (2018) (10.1016/j.softx.2017.11.002)

   => Composite Functional: B3LYP <= 

    B3LYP Hyb-GGA Exchange-Correlation Functional

    P. J. Stephens, F. J. Devlin, C. F. Chabalowski, and M. J. Frisch.,  J. Phys. Chem. 98, 11623 (1994) (10.1021/j100096a001)

    Deriv               =              1
    GGA                 =           TRUE
    Meta                =          FALSE

    Exchange Hybrid     =           TRUE
    MP2 Hybrid          =          FALSE

   => Exchange Functionals <=

    0.0800   Slater exchange
    0.7200         Becke 88

   => Exact (HF) Exchange <=

    0.2000               HF 

   => Correlation Functionals <=

    0.1900   Vosko, Wilk & Nusair (VWN5_RPA)
    0.8100   Lee, Yang & Parr

   => LibXC Density Thresholds  <==

    XC_HYB_GGA_XC_B3LYP:  1.00E-15 

   => Molecular Quadrature <=

    Radial Scheme          =       TREUTLER
    Pruning Scheme         =           NONE
    Nuclear Scheme         =       TREUTLER

    Blocking Scheme        =         OCTREE
    BS radius alpha        =              1
    Pruning alpha          =              1
    Radial Points          =             75
    Spherical Points       =            302
    Total Points           =          43513
    Total Blocks           =            394
    Max Points             =            256
    Max Functions          =             28
    Weights Tolerance      =       1.00E-15

   => Loading Basis Set <=

    Name: (CC-PVDZ AUX)
    Role: JKFIT
    Keyword: DF_BASIS_SCF
    atoms 1 entry B          line    71 file /Users/joseantoniorodriguesromero/anaconda3/share/psi4/basis/cc-pvdz-jkfit.gbs 
    atoms 2 entry F          line   271 file /Users/joseantoniorodriguesromero/anaconda3/share/psi4/basis/cc-pvdz-jkfit.gbs 

  ==> Integral Setup <==

  DFHelper Memory: AOs need 0.001 GiB; user supplied 0.332 GiB. 
  Using in-core AOs.

  ==> MemDFJK: Density-Fitted J/K Matrices <==

    J tasked:                   Yes
    K tasked:                   Yes
    wK tasked:                   No
    OpenMP threads:               1
    Memory [MiB]:               339
    Algorithm:                 Core
    Schwarz Cutoff:           1E-12
    Mask sparsity (%):       0.0000
    Fitting Condition:        1E-10

   => Auxiliary Basis Set <=

  Basis Set: (CC-PVDZ AUX)
    Blend: CC-PVDZ-JKFIT
    Number of shells: 48
    Number of basis functions: 140
    Number of Cartesian functions: 162
    Spherical Harmonics?: true
    Max angular momentum: 3

  Cached 100.0% of DFT collocation blocks in 0.034 [GiB].

  Minimum eigenvalue in the overlap matrix is 3.0008824607E-02.
  Reciprocal condition number of the overlap matrix is 1.0252816104E-02.
    Using symmetric orthogonalization.

  ==> Pre-Iterations <==

  SCF Guess: Superposition of Atomic Potentials (doi:10.1021/acs.jctc.8b01089).

  ==> SAP guess <==

   => Molecular Quadrature <=

    Radial Scheme          =       TREUTLER
    Pruning Scheme         =           NONE
    Nuclear Scheme         =       TREUTLER

    Blocking Scheme        =         OCTREE
    BS radius alpha        =              1
    Pruning alpha          =              1
    Radial Points          =             75
    Spherical Points       =            302
    Total Points           =          43513
    Total Blocks           =            394
    Max Points             =            256
    Max Functions          =             28
    Weights Tolerance      =       1.00E-15

   -------------------------------------------------------
    Irrep   Nso     Nmo     Nalpha   Nbeta   Ndocc  Nsocc
   -------------------------------------------------------
     A1        14      14       5       4       4       1
     A2         2       2       0       0       0       0
     B1         6       6       1       1       1       0
     B2         6       6       1       1       1       0
   -------------------------------------------------------
    Total      28      28       7       6       6       1
   -------------------------------------------------------

  ==> Iterations <==

                           Total Energy        Delta E     RMS |[F,P]|

   @DF-UKS iter   1:  -124.18970967328201   -1.24190e+02   2.57035e-02 DIIS/ADIIS
   @DF-UKS iter   2:  -124.00165770577631    1.88052e-01   5.34038e-02 DIIS/ADIIS/DAMP=1%
   @DF-UKS iter   3:  -124.23911493030303   -2.37457e-01   4.75490e-03 DIIS/ADIIS/DAMP=1%
   @DF-UKS iter   4:  -124.25827744813044   -1.91625e-02   5.04928e-04 DIIS/ADIIS/DAMP=1%
   @DF-UKS iter   5:  -124.26006142140201   -1.78397e-03   4.48639e-05 DIIS/DAMP=1%
   @DF-UKS iter   6:  -124.26016269114763   -1.01270e-04   1.08522e-05 DIIS/DAMP=1%
   @DF-UKS iter   7:  -124.26017702900043   -1.43379e-05   1.72619e-06 DIIS/DAMP=1%
   @DF-UKS iter   8:  -124.26017244392587    4.58507e-06   3.13869e-07 DIIS/DAMP=1%
   @DF-UKS iter   9:  -124.26017305239262   -6.08467e-07   3.35355e-08 DIIS/DAMP=1%
   @DF-UKS iter  10:  -124.26017294262395    1.09769e-07   9.10375e-09 DIIS/DAMP=1%
   @DF-UKS iter  11:  -124.26017294408229   -1.45833e-09   1.18099e-09 DIIS/DAMP=1%
  Energy and wave function converged.


  ==> Post-Iterations <==

   Electrons on quadrature grid:
      Nalpha   =    6.9999998975 ; deviation = -1.025e-07
      Nbeta    =    5.9999999011 ; deviation = -9.895e-08
      Ntotal   =   12.9999997986 ; deviation = -2.014e-07 

   @Spin Contamination Metric:   2.336053875E-03
   @S^2 Expected:                7.500000000E-01
   @S^2 Observed:                7.523360539E-01
   @S   Expected:                5.000000000E-01
   @S   Observed:                5.000000000E-01

    Orbital Energies [Eh]
    ---------------------

    Alpha Occupied:                                                       

       1A1   -25.142496     2A1    -7.328949     3A1    -1.671008  
       4A1    -0.965499     1B2    -0.875740     1B1    -0.875740  
       5A1    -0.710034  

    Alpha Virtual:                                                        

       2B2    -0.393708     2B1    -0.393708     6A1    -0.153957  
       3B2    -0.008527     3B1    -0.008527     7A1     0.020386  
       8A1     0.184081     9A1     0.328612     1A2     0.328612  
       4B2     0.460845     4B1     0.460845    10A1     0.646919  
       5B1     0.912028     5B2     0.912028    11A1     1.063172  
      12A1     1.773682     2A2     3.154241    13A1     3.154243  
       6B2     3.352133     6B1     3.352133    14A1     3.787891  

    Beta Occupied:                                                        

       1A1   -25.142355     2A1    -7.309647     3A1    -1.669248  
       4A1    -0.959806     1B2    -0.875694     1B1    -0.875694  

    Beta Virtual:                                                         

       5A1    -0.511655     2B2    -0.342509     2B1    -0.342509  
       6A1    -0.131311     3B2     0.005163     3B1     0.005163  
       7A1     0.078526     8A1     0.224478     1A2     0.366911  
       9A1     0.366912     4B2     0.520594     4B1     0.520594  
      10A1     0.668053     5B1     0.914804     5B2     0.914804  
      11A1     1.089139    12A1     1.775651     2A2     3.151372  
      13A1     3.151373     6B1     3.355780     6B2     3.355780  
      14A1     3.792324  

    Final Occupation by Irrep:
             A1    A2    B1    B2 
    DOCC [     4,    0,    1,    1 ]
    SOCC [     1,    0,    0,    0 ]
    NA   [     5,    0,    1,    1 ]
    NB   [     4,    0,    1,    1 ]

  @DF-UKS Final Energy:  -124.26017294408229

   => Energetics <=

    Nuclear Repulsion Energy =             19.8441454001250044
    One-Electron Energy =                -205.5822476511349350
    Two-Electron Energy =                  72.9236664892489443
    DFT Exchange-Correlation Energy =     -11.4457371823212934
    Empirical Dispersion Energy =           0.0000000000000000
    VV10 Nonlocal Energy =                  0.0000000000000000
    Total Energy =                       -124.2601729440822851

  UHF NO Occupations:
  HONO-2 :    1 B2 1.9994222
  HONO-1 :    1 B1 1.9994222
  HONO-0 :    5 A1 1.0000000
  LUNO+0 :    2 B2 0.0005778
  LUNO+1 :    2 B1 0.0005778
  LUNO+2 :    6 A1 0.0000112
  LUNO+3 :    7 A1 0.0000015


Computation Completed


Properties will be evaluated at   0.000000,   0.000000,   0.000000 [a0]

Properties computed using the SCF density matrix


 Multipole Moments:

 ------------------------------------------------------------------------------------
     Multipole            Electronic (a.u.)      Nuclear  (a.u.)        Total (a.u.)
 ------------------------------------------------------------------------------------

 L = 1.  Multiply by 2.5417464519 to convert [e a0] to [Debye]
 Dipole X            :          0.0000000            0.0000000            0.0000000
 Dipole Y            :          0.0000000            0.0000000            0.0000000
 Dipole Z            :          1.5991036           -0.3092107            1.2898929
 Magnitude           :                                                    1.2898929

 ------------------------------------------------------------------------------------

*** tstop() called on Joses-MacBook-Pro-2.local at Thu Jul 17 13:31:11 2025
Module time:
	user time   =       2.88 seconds =       0.05 minutes
	system time =       4.97 seconds =       0.08 minutes
	total time  =          1 seconds =       0.02 minutes
Total time:
	user time   =       2.88 seconds =       0.05 minutes
	system time =       4.97 seconds =       0.08 minutes
	total time  =          1 seconds =       0.02 minutes

*** tstart() called on Joses-MacBook-Pro-2.local
*** at Thu Jul 17 13:31:11 2025


         ------------------------------------------------------------
                                   SCF GRAD                          
                          Rob Parrish, Justin Turney,                
                       Andy Simmonett, and Alex Sokolov              
         ------------------------------------------------------------

  ==> Geometry <==

    Molecular point group: c2v
    Full point group: C_inf_v

    Geometry (in Angstrom), charge = 1, multiplicity = 2:

       Center              X                  Y                   Z               Mass       
    ------------   -----------------  -----------------  -----------------  -----------------
         B            0.000000000000     0.000000000000     0.759740910507    11.009305360000
         F            0.000000000000     0.000000000000    -0.440259089493    18.998403162730

  Nuclear repulsion =   19.844145400125004

  ==> Basis Set <==

  Basis Set: CC-PVDZ
    Blend: CC-PVDZ
    Number of shells: 12
    Number of basis functions: 28
    Number of Cartesian functions: 30
    Spherical Harmonics?: true
    Max angular momentum: 2

  ==> DFJKGrad: Density-Fitted SCF Gradients <==

    Gradient:                    1
    J tasked:                  Yes
    K tasked:                  Yes
    wK tasked:                  No
    OpenMP threads:              1
    Integrals threads:           1
    Memory [MiB]:              375
    Schwarz Cutoff:          1E-12
    Fitting Condition:       1E-10

   => Auxiliary Basis Set <=

  Basis Set: (CC-PVDZ AUX)
    Blend: CC-PVDZ-JKFIT
    Number of shells: 48
    Number of basis functions: 140
    Number of Cartesian functions: 162
    Spherical Harmonics?: true
    Max angular momentum: 3

  ==> DFT Potential <==

   => LibXC <=

    Version 6.2.2
    S. Lehtola, C. Steigemann, M. J.T. Oliveira, and M. A.L. Marques.,  SoftwareX 7, 1–5 (2018) (10.1016/j.softx.2017.11.002)

   => Composite Functional: B3LYP <= 

    B3LYP Hyb-GGA Exchange-Correlation Functional

    P. J. Stephens, F. J. Devlin, C. F. Chabalowski, and M. J. Frisch.,  J. Phys. Chem. 98, 11623 (1994) (10.1021/j100096a001)

    Deriv               =              1
    GGA                 =           TRUE
    Meta                =          FALSE

    Exchange Hybrid     =           TRUE
    MP2 Hybrid          =          FALSE

   => Exchange Functionals <=

    0.0800   Slater exchange
    0.7200         Becke 88

   => Exact (HF) Exchange <=

    0.2000               HF 

   => Correlation Functionals <=

    0.1900   Vosko, Wilk & Nusair (VWN5_RPA)
    0.8100   Lee, Yang & Parr

   => LibXC Density Thresholds  <==

    XC_HYB_GGA_XC_B3LYP:  1.00E-15 

   => Molecular Quadrature <=

    Radial Scheme          =       TREUTLER
    Pruning Scheme         =           NONE
    Nuclear Scheme         =       TREUTLER

    Blocking Scheme        =         OCTREE
    BS radius alpha        =              1
    Pruning alpha          =              1
    Radial Points          =             75
    Spherical Points       =            302
    Total Points           =          43513
    Total Blocks           =            394
    Max Points             =            256
    Max Functions          =             28
    Weights Tolerance      =       1.00E-15


  -Total Gradient:
     Atom            X                  Y                   Z
    ------   -----------------  -----------------  -----------------
       1        0.000000000000    -0.000000000000    -0.042035538836
       2       -0.000000000000     0.000000000000     0.042057583621


*** tstop() called on Joses-MacBook-Pro-2.local at Thu Jul 17 13:31:11 2025
Module time:
	user time   =       0.63 seconds =       0.01 minutes
	system time =       1.02 seconds =       0.02 minutes
	total time  =          0 seconds =       0.00 minutes
Total time:
	user time   =       3.52 seconds =       0.06 minutes
	system time =       5.99 seconds =       0.10 minutes
	total time  =          1 seconds =       0.02 minutes

    			-----------------------------------------

    			 OPTKING 3.0: for geometry optimizations 

    			     By R.A. King, Bethel University     

    			        with contributions from          

    			    A.V. Copan, J. Cayton, A. Heide      

    			-----------------------------------------

    
	                            ===> Fragment 1 <== 

	 Z (Atomic Numbers)          Masses                          Geom                  
	       5.000000            11.009305          0.00000000  0.00000000  1.43570225   
	       9.000000            18.998403          0.00000000  0.00000000 -0.83196910   

	 - Coordinate -           - BOHR/RAD -       - ANG/DEG -
	 R(1,2)           =         2.267671           1.200000


	        --- Internal Coordinate Step in ANG or DEG, aJ/ANG or AJ/DEG ---
	-------------------------------------------------------------------------------
	           Coordinate      Previous         Force          Change          New 
	           ----------      --------        ------          ------        ------
	               R(1,2)       1.20000        0.34641        0.02119       1.22119
	-------------------------------------------------------------------------------

	                                 ==> Convergence Check <==                                  
    
	Measures of convergence in internal coordinates in au.
    
	Criteria marked as inactive (o), active & met (*), and active & unmet ( ).

	----------------------------------------------------------------------------------------------
	   Step    Total Energy     Delta E     Max Force     RMS Force      Max Disp      RMS Disp   
	----------------------------------------------------------------------------------------------
	  Convergence Criteria     1.00e-06 *    3.00e-04 *             o    1.20e-03 *             o
	----------------------------------------------------------------------------------------------
	     1    -124.26017294   -1.24e+02      4.20e-02      4.20e-02 o    4.00e-02      4.00e-02 o  ~
	----------------------------------------------------------------------------------------------

Next Geometry in Ang 
	Fragment 1 (Ang)

	    B   0.0000000000   0.0000000000   0.7703370501
	    F   0.0000000000   0.0000000000  -0.4508552291


    Structure for next step:
    Molecular point group: c2v
    Full point group: C_inf_v

    Geometry (in Angstrom), charge = 1, multiplicity = 2:

    B            0.000000000000     0.000000000000     0.773158111740
    F            0.000000000000     0.000000000000    -0.448034167440


Scratch directory: /tmp/
gradient() will perform analytic gradient computation.
   => Libint2 <=

    Primary   basis highest AM E, G, H:  6, 6, 3
    Auxiliary basis highest AM E, G, H:  7, 7, 4
    Onebody   basis highest AM E, G, H:  -, -, -
    Solid Harmonics ordering:            Gaussian

*** tstart() called on Joses-MacBook-Pro-2.local
*** at Thu Jul 17 13:31:11 2025

   => Loading Basis Set <=

    Name: CC-PVDZ
    Role: ORBITAL
    Keyword: BASIS
    atoms 1 entry B          line   108 file /Users/joseantoniorodriguesromero/anaconda3/share/psi4/basis/cc-pvdz.gbs 
    atoms 2 entry F          line   228 file /Users/joseantoniorodriguesromero/anaconda3/share/psi4/basis/cc-pvdz.gbs 


         ---------------------------------------------------------
                                   SCF
               by Justin Turney, Rob Parrish, Andy Simmonett
                          and Daniel G. A. Smith
                              UKS Reference
                        1 Threads,    500 MiB Core
         ---------------------------------------------------------

  ==> Geometry <==

    Molecular point group: c2v
    Full point group: C_inf_v

    Geometry (in Angstrom), charge = 1, multiplicity = 2:

       Center              X                  Y                   Z               Mass       
    ------------   -----------------  -----------------  -----------------  -----------------
         B            0.000000000000     0.000000000000     0.773158111740    11.009305360000
         F            0.000000000000     0.000000000000    -0.448034167440    18.998403162730

  Running in c2v symmetry.

  Rotational constants: A = ************  B =      1.62175  C =      1.62175 [cm^-1]
  Rotational constants: A = ************  B =  48618.87608  C =  48618.87608 [MHz]
  Nuclear repulsion =   19.499774839816862

  Charge       = 1
  Multiplicity = 2
  Electrons    = 13
  Nalpha       = 7
  Nbeta        = 6

  ==> Algorithm <==

  SCF Algorithm Type is DF.
  DIIS enabled.
  MOM disabled.
  Fractional occupation disabled.
  Guess Type is READ.
  Energy threshold   = 1.00e-08
  Density threshold  = 1.00e-08
  Integral threshold = 1.00e-12

  ==> Primary Basis <==

  Basis Set: CC-PVDZ
    Blend: CC-PVDZ
    Number of shells: 12
    Number of basis functions: 28
    Number of Cartesian functions: 30
    Spherical Harmonics?: true
    Max angular momentum: 2

  ==> DFT Potential <==

   => LibXC <=

    Version 6.2.2
    S. Lehtola, C. Steigemann, M. J.T. Oliveira, and M. A.L. Marques.,  SoftwareX 7, 1–5 (2018) (10.1016/j.softx.2017.11.002)

   => Composite Functional: B3LYP <= 

    B3LYP Hyb-GGA Exchange-Correlation Functional

    P. J. Stephens, F. J. Devlin, C. F. Chabalowski, and M. J. Frisch.,  J. Phys. Chem. 98, 11623 (1994) (10.1021/j100096a001)

    Deriv               =              1
    GGA                 =           TRUE
    Meta                =          FALSE

    Exchange Hybrid     =           TRUE
    MP2 Hybrid          =          FALSE

   => Exchange Functionals <=

    0.0800   Slater exchange
    0.7200         Becke 88

   => Exact (HF) Exchange <=

    0.2000               HF 

   => Correlation Functionals <=

    0.1900   Vosko, Wilk & Nusair (VWN5_RPA)
    0.8100   Lee, Yang & Parr

   => LibXC Density Thresholds  <==

    XC_HYB_GGA_XC_B3LYP:  1.00E-15 

   => Molecular Quadrature <=

    Radial Scheme          =       TREUTLER
    Pruning Scheme         =           NONE
    Nuclear Scheme         =       TREUTLER

    Blocking Scheme        =         OCTREE
    BS radius alpha        =              1
    Pruning alpha          =              1
    Radial Points          =             75
    Spherical Points       =            302
    Total Points           =          43517
    Total Blocks           =            389
    Max Points             =            256
    Max Functions          =             28
    Weights Tolerance      =       1.00E-15

   => Loading Basis Set <=

    Name: (CC-PVDZ AUX)
    Role: JKFIT
    Keyword: DF_BASIS_SCF
    atoms 1 entry B          line    71 file /Users/joseantoniorodriguesromero/anaconda3/share/psi4/basis/cc-pvdz-jkfit.gbs 
    atoms 2 entry F          line   271 file /Users/joseantoniorodriguesromero/anaconda3/share/psi4/basis/cc-pvdz-jkfit.gbs 

   => Loading Basis Set <=

    Name: CC-PVDZ
    Role: ORBITAL
    Keyword: BASIS
    atoms 1 entry B          line   108 file /Users/joseantoniorodriguesromero/anaconda3/share/psi4/basis/cc-pvdz.gbs 
    atoms 2 entry F          line   228 file /Users/joseantoniorodriguesromero/anaconda3/share/psi4/basis/cc-pvdz.gbs 

  Reading orbitals from file /tmp/doublet_BF.default.74227.180.npy, no projection.

  ==> Integral Setup <==

  DFHelper Memory: AOs need 0.001 GiB; user supplied 0.332 GiB. 
  Using in-core AOs.

  ==> MemDFJK: Density-Fitted J/K Matrices <==

    J tasked:                   Yes
    K tasked:                   Yes
    wK tasked:                   No
    OpenMP threads:               1
    Memory [MiB]:               339
    Algorithm:                 Core
    Schwarz Cutoff:           1E-12
    Mask sparsity (%):       0.0000
    Fitting Condition:        1E-10

   => Auxiliary Basis Set <=

  Basis Set: (CC-PVDZ AUX)
    Blend: CC-PVDZ-JKFIT
    Number of shells: 48
    Number of basis functions: 140
    Number of Cartesian functions: 162
    Spherical Harmonics?: true
    Max angular momentum: 3

  Cached 100.0% of DFT collocation blocks in 0.034 [GiB].

  Minimum eigenvalue in the overlap matrix is 3.1875934349E-02.
  Reciprocal condition number of the overlap matrix is 1.0933174100E-02.
    Using symmetric orthogonalization.

  ==> Pre-Iterations <==

  SCF Guess: Orbitals guess was supplied from a previous computation.

   -------------------------------------------------------
    Irrep   Nso     Nmo     Nalpha   Nbeta   Ndocc  Nsocc
   -------------------------------------------------------
     A1        14      14       5       4       4       1
     A2         2       2       0       0       0       0
     B1         6       6       1       1       1       0
     B2         6       6       1       1       1       0
   -------------------------------------------------------
    Total      28      28       7       6       6       1
   -------------------------------------------------------

  ==> Iterations <==

                           Total Energy        Delta E     RMS |[F,P]|

   @DF-UKS iter   0:  -124.23696658971501   -1.24237e+02   4.46980e-03 
   @DF-UKS iter   1:  -124.26110339033633   -2.41368e-02   1.05642e-03 DIIS/ADIIS
   @DF-UKS iter   2:  -124.26086898876963    2.34402e-04   1.96719e-03 DIIS/ADIIS/DAMP=1%
   @DF-UKS iter   3:  -124.26047221793955    3.96771e-04   5.77850e-05 DIIS/DAMP=1%
   @DF-UKS iter   4:  -124.26121321923549   -7.41001e-04   2.75132e-05 DIIS/DAMP=1%
   @DF-UKS iter   5:  -124.26120296798219    1.02513e-05   2.28226e-06 DIIS/DAMP=1%
   @DF-UKS iter   6:  -124.26121347297386   -1.05050e-05   4.95363e-07 DIIS/DAMP=1%
   @DF-UKS iter   7:  -124.26121328751597    1.85458e-07   9.07626e-08 DIIS/DAMP=1%
   @DF-UKS iter   8:  -124.26121310422963    1.83286e-07   7.30397e-09 DIIS/DAMP=1%
   @DF-UKS iter   9:  -124.26121312359274   -1.93631e-08   1.66500e-09 DIIS/DAMP=1%
   @DF-UKS iter  10:  -124.26121312529301   -1.70027e-09   3.88832e-11 DIIS/DAMP=1%
  Energy and wave function converged.


  ==> Post-Iterations <==

   Electrons on quadrature grid:
      Nalpha   =    7.0000001175 ; deviation = 1.175e-07
      Nbeta    =    6.0000001333 ; deviation = 1.333e-07
      Ntotal   =   13.0000002508 ; deviation = 2.508e-07 

   @Spin Contamination Metric:   2.391848195E-03
   @S^2 Expected:                7.500000000E-01
   @S^2 Observed:                7.523918482E-01
   @S   Expected:                5.000000000E-01
   @S   Observed:                5.000000000E-01

    Orbital Energies [Eh]
    ---------------------

    Alpha Occupied:                                                       

       1A1   -25.138785     2A1    -7.333203     3A1    -1.659567  
       4A1    -0.959473     1B1    -0.866959     1B2    -0.866959  
       5A1    -0.711731  

    Alpha Virtual:                                                        

       2B1    -0.398693     2B2    -0.398693     6A1    -0.157945  
       3B1    -0.008455     3B2    -0.008455     7A1     0.019163  
       8A1     0.170318     9A1     0.328876     1A2     0.328876  
       4B1     0.453147     4B2     0.453147    10A1     0.627173  
       5B1     0.916152     5B2     0.916152    11A1     1.054245  
      12A1     1.777307    13A1     3.158758     2A2     3.158759  
       6B2     3.347520     6B1     3.347520    14A1     3.757275  

    Beta Occupied:                                                        

       1A1   -25.138542     2A1    -7.313945     3A1    -1.657649  
       4A1    -0.953022     1B1    -0.866984     1B2    -0.866984  

    Beta Virtual:                                                         

       5A1    -0.513909     2B1    -0.347474     2B2    -0.347474  
       6A1    -0.134069     3B1     0.004987     3B2     0.004987  
       7A1     0.077612     8A1     0.206684     1A2     0.367207  
       9A1     0.367207     4B2     0.512226     4B1     0.512226  
      10A1     0.651216     5B1     0.919073     5B2     0.919073  
      11A1     1.079424    12A1     1.779347    13A1     3.155893  
       2A2     3.155894     6B2     3.351334     6B1     3.351334  
      14A1     3.761730  

    Final Occupation by Irrep:
             A1    A2    B1    B2 
    DOCC [     4,    0,    1,    1 ]
    SOCC [     1,    0,    0,    0 ]
    NA   [     5,    0,    1,    1 ]
    NB   [     4,    0,    1,    1 ]

  @DF-UKS Final Energy:  -124.26121312529301

   => Energetics <=

    Nuclear Repulsion Energy =             19.4997748398168618
    One-Electron Energy =                -204.9713836703914751
    Two-Electron Energy =                  72.6449351812300819
    DFT Exchange-Correlation Energy =     -11.4345394759484815
    Empirical Dispersion Energy =           0.0000000000000000
    VV10 Nonlocal Energy =                  0.0000000000000000
    Total Energy =                       -124.2612131252930112

  UHF NO Occupations:
  HONO-2 :    1 B1 1.9994102
  HONO-1 :    1 B2 1.9994102
  HONO-0 :    5 A1 1.0000000
  LUNO+0 :    2 B2 0.0005898
  LUNO+1 :    2 B1 0.0005898
  LUNO+2 :    6 A1 0.0000152
  LUNO+3 :    7 A1 0.0000015


Computation Completed


Properties will be evaluated at   0.000000,   0.000000,   0.000000 [a0]

Properties computed using the SCF density matrix


 Multipole Moments:

 ------------------------------------------------------------------------------------
     Multipole            Electronic (a.u.)      Nuclear  (a.u.)        Total (a.u.)
 ------------------------------------------------------------------------------------

 L = 1.  Multiply by 2.5417464519 to convert [e a0] to [Debye]
 Dipole X            :          0.0000000            0.0000000            0.0000000
 Dipole Y            :          0.0000000            0.0000000            0.0000000
 Dipole Z            :          1.6491844           -0.3146714            1.3345129
 Magnitude           :                                                    1.3345129

 ------------------------------------------------------------------------------------

*** tstop() called on Joses-MacBook-Pro-2.local at Thu Jul 17 13:31:12 2025
Module time:
	user time   =       3.29 seconds =       0.05 minutes
	system time =       3.47 seconds =       0.06 minutes
	total time  =          1 seconds =       0.02 minutes
Total time:
	user time   =       6.87 seconds =       0.11 minutes
	system time =       9.81 seconds =       0.16 minutes
	total time  =          2 seconds =       0.03 minutes

*** tstart() called on Joses-MacBook-Pro-2.local
*** at Thu Jul 17 13:31:12 2025


         ------------------------------------------------------------
                                   SCF GRAD                          
                          Rob Parrish, Justin Turney,                
                       Andy Simmonett, and Alex Sokolov              
         ------------------------------------------------------------

  ==> Geometry <==

    Molecular point group: c2v
    Full point group: C_inf_v

    Geometry (in Angstrom), charge = 1, multiplicity = 2:

       Center              X                  Y                   Z               Mass       
    ------------   -----------------  -----------------  -----------------  -----------------
         B            0.000000000000     0.000000000000     0.773158111740    11.009305360000
         F            0.000000000000     0.000000000000    -0.448034167440    18.998403162730

  Nuclear repulsion =   19.499774839816862

  ==> Basis Set <==

  Basis Set: CC-PVDZ
    Blend: CC-PVDZ
    Number of shells: 12
    Number of basis functions: 28
    Number of Cartesian functions: 30
    Spherical Harmonics?: true
    Max angular momentum: 2

  ==> DFJKGrad: Density-Fitted SCF Gradients <==

    Gradient:                    1
    J tasked:                  Yes
    K tasked:                  Yes
    wK tasked:                  No
    OpenMP threads:              1
    Integrals threads:           1
    Memory [MiB]:              375
    Schwarz Cutoff:          1E-12
    Fitting Condition:       1E-10

   => Auxiliary Basis Set <=

  Basis Set: (CC-PVDZ AUX)
    Blend: CC-PVDZ-JKFIT
    Number of shells: 48
    Number of basis functions: 140
    Number of Cartesian functions: 162
    Spherical Harmonics?: true
    Max angular momentum: 3

  ==> DFT Potential <==

   => LibXC <=

    Version 6.2.2
    S. Lehtola, C. Steigemann, M. J.T. Oliveira, and M. A.L. Marques.,  SoftwareX 7, 1–5 (2018) (10.1016/j.softx.2017.11.002)

   => Composite Functional: B3LYP <= 

    B3LYP Hyb-GGA Exchange-Correlation Functional

    P. J. Stephens, F. J. Devlin, C. F. Chabalowski, and M. J. Frisch.,  J. Phys. Chem. 98, 11623 (1994) (10.1021/j100096a001)

    Deriv               =              1
    GGA                 =           TRUE
    Meta                =          FALSE

    Exchange Hybrid     =           TRUE
    MP2 Hybrid          =          FALSE

   => Exchange Functionals <=

    0.0800   Slater exchange
    0.7200         Becke 88

   => Exact (HF) Exchange <=

    0.2000               HF 

   => Correlation Functionals <=

    0.1900   Vosko, Wilk & Nusair (VWN5_RPA)
    0.8100   Lee, Yang & Parr

   => LibXC Density Thresholds  <==

    XC_HYB_GGA_XC_B3LYP:  1.00E-15 

   => Molecular Quadrature <=

    Radial Scheme          =       TREUTLER
    Pruning Scheme         =           NONE
    Nuclear Scheme         =       TREUTLER

    Blocking Scheme        =         OCTREE
    BS radius alpha        =              1
    Pruning alpha          =              1
    Radial Points          =             75
    Spherical Points       =            302
    Total Points           =          43517
    Total Blocks           =            389
    Max Points             =            256
    Max Functions          =             28
    Weights Tolerance      =       1.00E-15


  -Total Gradient:
     Atom            X                  Y                   Z
    ------   -----------------  -----------------  -----------------
       1       -0.000000000000    -0.000000000000    -0.010617560139
       2        0.000000000000    -0.000000000000     0.010642582814


*** tstop() called on Joses-MacBook-Pro-2.local at Thu Jul 17 13:31:12 2025
Module time:
	user time   =       0.70 seconds =       0.01 minutes
	system time =       1.65 seconds =       0.03 minutes
	total time  =          0 seconds =       0.00 minutes
Total time:
	user time   =       7.57 seconds =       0.13 minutes
	system time =      11.46 seconds =       0.19 minutes
	total time  =          2 seconds =       0.03 minutes

    			-----------------------------------------

    			 OPTKING 3.0: for geometry optimizations 

    			     By R.A. King, Bethel University     

    			        with contributions from          

    			    A.V. Copan, J. Cayton, A. Heide      

    			-----------------------------------------

    
	                            ===> Fragment 1 <== 

	 Z (Atomic Numbers)          Masses                          Geom                  
	       5.000000            11.009305          0.00000000  0.00000000  1.46105708   
	       9.000000            18.998403          0.00000000  0.00000000 -0.84666187   

	 - Coordinate -           - BOHR/RAD -       - ANG/DEG -
	 R(1,2)           =         2.307719           1.221192


	        --- Internal Coordinate Step in ANG or DEG, aJ/ANG or AJ/DEG ---
	-------------------------------------------------------------------------------
	           Coordinate      Previous         Force          Change          New 
	           ----------      --------        ------          ------        ------
	               R(1,2)       1.22119        0.08758        0.00717       1.22836
	-------------------------------------------------------------------------------

	                                 ==> Convergence Check <==                                  
    
	Measures of convergence in internal coordinates in au.
    
	Criteria marked as inactive (o), active & met (*), and active & unmet ( ).

	----------------------------------------------------------------------------------------------
	   Step    Total Energy     Delta E     Max Force     RMS Force      Max Disp      RMS Disp   
	----------------------------------------------------------------------------------------------
	  Convergence Criteria     1.00e-06 *    3.00e-04 *             o    1.20e-03 *             o
	----------------------------------------------------------------------------------------------
	     2    -124.26121313   -1.04e-03      1.06e-02      1.06e-02 o    1.35e-02      1.35e-02 o  ~
	----------------------------------------------------------------------------------------------

Next Geometry in Ang 
	Fragment 1 (Ang)

	    B   0.0000000000   0.0000000000   0.7767427594
	    F   0.0000000000   0.0000000000  -0.4516188151


    Structure for next step:
    Molecular point group: c2v
    Full point group: C_inf_v

    Geometry (in Angstrom), charge = 1, multiplicity = 2:

    B            0.000000000000     0.000000000000     0.777697117546
    F            0.000000000000     0.000000000000    -0.450664456972


Scratch directory: /tmp/
gradient() will perform analytic gradient computation.
   => Libint2 <=

    Primary   basis highest AM E, G, H:  6, 6, 3
    Auxiliary basis highest AM E, G, H:  7, 7, 4
    Onebody   basis highest AM E, G, H:  -, -, -
    Solid Harmonics ordering:            Gaussian

*** tstart() called on Joses-MacBook-Pro-2.local
*** at Thu Jul 17 13:31:12 2025

   => Loading Basis Set <=

    Name: CC-PVDZ
    Role: ORBITAL
    Keyword: BASIS
    atoms 1 entry B          line   108 file /Users/joseantoniorodriguesromero/anaconda3/share/psi4/basis/cc-pvdz.gbs 
    atoms 2 entry F          line   228 file /Users/joseantoniorodriguesromero/anaconda3/share/psi4/basis/cc-pvdz.gbs 


         ---------------------------------------------------------
                                   SCF
               by Justin Turney, Rob Parrish, Andy Simmonett
                          and Daniel G. A. Smith
                              UKS Reference
                        1 Threads,    500 MiB Core
         ---------------------------------------------------------

  ==> Geometry <==

    Molecular point group: c2v
    Full point group: C_inf_v

    Geometry (in Angstrom), charge = 1, multiplicity = 2:

       Center              X                  Y                   Z               Mass       
    ------------   -----------------  -----------------  -----------------  -----------------
         B            0.000000000000     0.000000000000     0.777697117546    11.009305360000
         F            0.000000000000     0.000000000000    -0.450664456972    18.998403162730

  Running in c2v symmetry.

  Rotational constants: A = ************  B =      1.60288  C =      1.60288 [cm^-1]
  Rotational constants: A = ************  B =  48053.00704  C =  48053.00704 [MHz]
  Nuclear repulsion =   19.385964991210738

  Charge       = 1
  Multiplicity = 2
  Electrons    = 13
  Nalpha       = 7
  Nbeta        = 6

  ==> Algorithm <==

  SCF Algorithm Type is DF.
  DIIS enabled.
  MOM disabled.
  Fractional occupation disabled.
  Guess Type is READ.
  Energy threshold   = 1.00e-08
  Density threshold  = 1.00e-08
  Integral threshold = 1.00e-12

  ==> Primary Basis <==

  Basis Set: CC-PVDZ
    Blend: CC-PVDZ
    Number of shells: 12
    Number of basis functions: 28
    Number of Cartesian functions: 30
    Spherical Harmonics?: true
    Max angular momentum: 2

  ==> DFT Potential <==

   => LibXC <=

    Version 6.2.2
    S. Lehtola, C. Steigemann, M. J.T. Oliveira, and M. A.L. Marques.,  SoftwareX 7, 1–5 (2018) (10.1016/j.softx.2017.11.002)

   => Composite Functional: B3LYP <= 

    B3LYP Hyb-GGA Exchange-Correlation Functional

    P. J. Stephens, F. J. Devlin, C. F. Chabalowski, and M. J. Frisch.,  J. Phys. Chem. 98, 11623 (1994) (10.1021/j100096a001)

    Deriv               =              1
    GGA                 =           TRUE
    Meta                =          FALSE

    Exchange Hybrid     =           TRUE
    MP2 Hybrid          =          FALSE

   => Exchange Functionals <=

    0.0800   Slater exchange
    0.7200         Becke 88

   => Exact (HF) Exchange <=

    0.2000               HF 

   => Correlation Functionals <=

    0.1900   Vosko, Wilk & Nusair (VWN5_RPA)
    0.8100   Lee, Yang & Parr

   => LibXC Density Thresholds  <==

    XC_HYB_GGA_XC_B3LYP:  1.00E-15 

   => Molecular Quadrature <=

    Radial Scheme          =       TREUTLER
    Pruning Scheme         =           NONE
    Nuclear Scheme         =       TREUTLER

    Blocking Scheme        =         OCTREE
    BS radius alpha        =              1
    Pruning alpha          =              1
    Radial Points          =             75
    Spherical Points       =            302
    Total Points           =          43517
    Total Blocks           =            390
    Max Points             =            256
    Max Functions          =             28
    Weights Tolerance      =       1.00E-15

   => Loading Basis Set <=

    Name: (CC-PVDZ AUX)
    Role: JKFIT
    Keyword: DF_BASIS_SCF
    atoms 1 entry B          line    71 file /Users/joseantoniorodriguesromero/anaconda3/share/psi4/basis/cc-pvdz-jkfit.gbs 
    atoms 2 entry F          line   271 file /Users/joseantoniorodriguesromero/anaconda3/share/psi4/basis/cc-pvdz-jkfit.gbs 

   => Loading Basis Set <=

    Name: CC-PVDZ
    Role: ORBITAL
    Keyword: BASIS
    atoms 1 entry B          line   108 file /Users/joseantoniorodriguesromero/anaconda3/share/psi4/basis/cc-pvdz.gbs 
    atoms 2 entry F          line   228 file /Users/joseantoniorodriguesromero/anaconda3/share/psi4/basis/cc-pvdz.gbs 

  Reading orbitals from file /tmp/doublet_BF.default.74227.180.npy, no projection.

  ==> Integral Setup <==

  DFHelper Memory: AOs need 0.001 GiB; user supplied 0.332 GiB. 
  Using in-core AOs.

  ==> MemDFJK: Density-Fitted J/K Matrices <==

    J tasked:                   Yes
    K tasked:                   Yes
    wK tasked:                   No
    OpenMP threads:               1
    Memory [MiB]:               339
    Algorithm:                 Core
    Schwarz Cutoff:           1E-12
    Mask sparsity (%):       0.0000
    Fitting Condition:        1E-10

   => Auxiliary Basis Set <=

  Basis Set: (CC-PVDZ AUX)
    Blend: CC-PVDZ-JKFIT
    Number of shells: 48
    Number of basis functions: 140
    Number of Cartesian functions: 162
    Spherical Harmonics?: true
    Max angular momentum: 3

  Cached 100.0% of DFT collocation blocks in 0.034 [GiB].

  Minimum eigenvalue in the overlap matrix is 3.2512876678E-02.
  Reciprocal condition number of the overlap matrix is 1.1166666337E-02.
    Using symmetric orthogonalization.

  ==> Pre-Iterations <==

  SCF Guess: Orbitals guess was supplied from a previous computation.

   -------------------------------------------------------
    Irrep   Nso     Nmo     Nalpha   Nbeta   Ndocc  Nsocc
   -------------------------------------------------------
     A1        14      14       5       4       4       1
     A2         2       2       0       0       0       0
     B1         6       6       1       1       1       0
     B2         6       6       1       1       1       0
   -------------------------------------------------------
    Total      28      28       7       6       6       1
   -------------------------------------------------------

  ==> Iterations <==

                           Total Energy        Delta E     RMS |[F,P]|

   @DF-UKS iter   0:  -124.25309795494728   -1.24253e+02   1.46455e-03 
   @DF-UKS iter   1:  -124.26127816406304   -8.18021e-03   3.60224e-04 DIIS/ADIIS
   @DF-UKS iter   2:  -124.26125077135188    2.73927e-05   6.71314e-04 DIIS/ADIIS/DAMP=1%
   @DF-UKS iter   3:  -124.26103928649690    2.11485e-04   2.03664e-05 DIIS/DAMP=1%
   @DF-UKS iter   4:  -124.26128967815468   -2.50392e-04   9.53239e-06 DIIS/DAMP=1%
   @DF-UKS iter   5:  -124.26128739002432    2.28813e-06   7.99673e-07 DIIS/DAMP=1%
   @DF-UKS iter   6:  -124.26129104560104   -3.65558e-06   1.75328e-07 DIIS/DAMP=1%
   @DF-UKS iter   7:  -124.26129098040811    6.51929e-08   3.09175e-08 DIIS/DAMP=1%
   @DF-UKS iter   8:  -124.26129091905487    6.13532e-08   2.86045e-09 DIIS/DAMP=1%
   @DF-UKS iter   9:  -124.26129092433597   -5.28109e-09   6.56405e-10 DIIS/DAMP=1%
  Energy and wave function converged.


  ==> Post-Iterations <==

   Electrons on quadrature grid:
      Nalpha   =    7.0000001884 ; deviation = 1.884e-07
      Nbeta    =    6.0000002084 ; deviation = 2.084e-07
      Ntotal   =   13.0000003969 ; deviation = 3.969e-07 

   @Spin Contamination Metric:   2.410893929E-03
   @S^2 Expected:                7.500000000E-01
   @S^2 Observed:                7.524108939E-01
   @S   Expected:                5.000000000E-01
   @S   Observed:                5.000000000E-01

    Orbital Energies [Eh]
    ---------------------

    Alpha Occupied:                                                       

       1A1   -25.137524     2A1    -7.334634     3A1    -1.655755  
       4A1    -0.957444     1B2    -0.864042     1B1    -0.864042  
       5A1    -0.712297  

    Alpha Virtual:                                                        

       2B1    -0.400333     2B2    -0.400333     6A1    -0.159402  
       3B2    -0.008431     3B1    -0.008431     7A1     0.018734  
       8A1     0.165679     9A1     0.328954     1A2     0.328954  
       4B2     0.450596     4B1     0.450596    10A1     0.621039  
       5B2     0.917506     5B1     0.917506    11A1     1.051560  
      12A1     1.778551    13A1     3.160298     2A2     3.160300  
       6B2     3.345998     6B1     3.345998    14A1     3.747075  

    Beta Occupied:                                                        

       1A1   -25.137244     2A1    -7.315390     3A1    -1.653778  
       4A1    -0.950723     1B2    -0.864087     1B1    -0.864087  

    Beta Virtual:                                                         

       5A1    -0.514682     2B1    -0.349110     2B2    -0.349110  
       6A1    -0.135089     3B2     0.004932     3B1     0.004932  
       7A1     0.077278     8A1     0.200690     1A2     0.367294  
       9A1     0.367294     4B2     0.509451     4B1     0.509451  
      10A1     0.646064     5B2     0.920476     5B1     0.920476  
      11A1     1.076490    12A1     1.780624    13A1     3.157436  
       2A2     3.157439     6B2     3.349876     6B1     3.349876  
      14A1     3.751554  

    Final Occupation by Irrep:
             A1    A2    B1    B2 
    DOCC [     4,    0,    1,    1 ]
    SOCC [     1,    0,    0,    0 ]
    NA   [     5,    0,    1,    1 ]
    NB   [     4,    0,    1,    1 ]

  @DF-UKS Final Energy:  -124.26129092433597

   => Energetics <=

    Nuclear Repulsion Energy =             19.3859649912107379
    One-Electron Energy =                -204.7691813457724379
    Two-Electron Energy =                  72.5528112273166670
    DFT Exchange-Correlation Energy =     -11.4308857970909177
    Empirical Dispersion Energy =           0.0000000000000000
    VV10 Nonlocal Energy =                  0.0000000000000000
    Total Energy =                       -124.2612909243359667

  UHF NO Occupations:
  HONO-2 :    1 B1 1.9994063
  HONO-1 :    1 B2 1.9994063
  HONO-0 :    5 A1 1.0000000
  LUNO+0 :    2 B1 0.0005937
  LUNO+1 :    2 B2 0.0005937
  LUNO+2 :    6 A1 0.0000168
  LUNO+3 :    7 A1 0.0000015


Computation Completed


Properties will be evaluated at   0.000000,   0.000000,   0.000000 [a0]

Properties computed using the SCF density matrix


 Multipole Moments:

 ------------------------------------------------------------------------------------
     Multipole            Electronic (a.u.)      Nuclear  (a.u.)        Total (a.u.)
 ------------------------------------------------------------------------------------

 L = 1.  Multiply by 2.5417464519 to convert [e a0] to [Debye]
 Dipole X            :          0.0000000            0.0000000            0.0000000
 Dipole Y            :          0.0000000            0.0000000            0.0000000
 Dipole Z            :          1.6661188           -0.3165188            1.3496000
 Magnitude           :                                                    1.3496000

 ------------------------------------------------------------------------------------

*** tstop() called on Joses-MacBook-Pro-2.local at Thu Jul 17 13:31:13 2025
Module time:
	user time   =       2.39 seconds =       0.04 minutes
	system time =       3.73 seconds =       0.06 minutes
	total time  =          1 seconds =       0.02 minutes
Total time:
	user time   =      10.00 seconds =       0.17 minutes
	system time =      15.40 seconds =       0.26 minutes
	total time  =          3 seconds =       0.05 minutes

*** tstart() called on Joses-MacBook-Pro-2.local
*** at Thu Jul 17 13:31:13 2025


         ------------------------------------------------------------
                                   SCF GRAD                          
                          Rob Parrish, Justin Turney,                
                       Andy Simmonett, and Alex Sokolov              
         ------------------------------------------------------------

  ==> Geometry <==

    Molecular point group: c2v
    Full point group: C_inf_v

    Geometry (in Angstrom), charge = 1, multiplicity = 2:

       Center              X                  Y                   Z               Mass       
    ------------   -----------------  -----------------  -----------------  -----------------
         B            0.000000000000     0.000000000000     0.777697117546    11.009305360000
         F            0.000000000000     0.000000000000    -0.450664456972    18.998403162730

  Nuclear repulsion =   19.385964991210738

  ==> Basis Set <==

  Basis Set: CC-PVDZ
    Blend: CC-PVDZ
    Number of shells: 12
    Number of basis functions: 28
    Number of Cartesian functions: 30
    Spherical Harmonics?: true
    Max angular momentum: 2

  ==> DFJKGrad: Density-Fitted SCF Gradients <==

    Gradient:                    1
    J tasked:                  Yes
    K tasked:                  Yes
    wK tasked:                  No
    OpenMP threads:              1
    Integrals threads:           1
    Memory [MiB]:              375
    Schwarz Cutoff:          1E-12
    Fitting Condition:       1E-10

   => Auxiliary Basis Set <=

  Basis Set: (CC-PVDZ AUX)
    Blend: CC-PVDZ-JKFIT
    Number of shells: 48
    Number of basis functions: 140
    Number of Cartesian functions: 162
    Spherical Harmonics?: true
    Max angular momentum: 3

  ==> DFT Potential <==

   => LibXC <=

    Version 6.2.2
    S. Lehtola, C. Steigemann, M. J.T. Oliveira, and M. A.L. Marques.,  SoftwareX 7, 1–5 (2018) (10.1016/j.softx.2017.11.002)

   => Composite Functional: B3LYP <= 

    B3LYP Hyb-GGA Exchange-Correlation Functional

    P. J. Stephens, F. J. Devlin, C. F. Chabalowski, and M. J. Frisch.,  J. Phys. Chem. 98, 11623 (1994) (10.1021/j100096a001)

    Deriv               =              1
    GGA                 =           TRUE
    Meta                =          FALSE

    Exchange Hybrid     =           TRUE
    MP2 Hybrid          =          FALSE

   => Exchange Functionals <=

    0.0800   Slater exchange
    0.7200         Becke 88

   => Exact (HF) Exchange <=

    0.2000               HF 

   => Correlation Functionals <=

    0.1900   Vosko, Wilk & Nusair (VWN5_RPA)
    0.8100   Lee, Yang & Parr

   => LibXC Density Thresholds  <==

    XC_HYB_GGA_XC_B3LYP:  1.00E-15 

   => Molecular Quadrature <=

    Radial Scheme          =       TREUTLER
    Pruning Scheme         =           NONE
    Nuclear Scheme         =       TREUTLER

    Blocking Scheme        =         OCTREE
    BS radius alpha        =              1
    Pruning alpha          =              1
    Radial Points          =             75
    Spherical Points       =            302
    Total Points           =          43517
    Total Blocks           =            390
    Max Points             =            256
    Max Functions          =             28
    Weights Tolerance      =       1.00E-15


  -Total Gradient:
     Atom            X                  Y                   Z
    ------   -----------------  -----------------  -----------------
       1        0.000000000000    -0.000000000000    -0.000936190637
       2        0.000000000000     0.000000000000     0.000964212677


*** tstop() called on Joses-MacBook-Pro-2.local at Thu Jul 17 13:31:13 2025
Module time:
	user time   =       0.37 seconds =       0.01 minutes
	system time =       1.23 seconds =       0.02 minutes
	total time  =          0 seconds =       0.00 minutes
Total time:
	user time   =      10.37 seconds =       0.17 minutes
	system time =      16.63 seconds =       0.28 minutes
	total time  =          3 seconds =       0.05 minutes

    			-----------------------------------------

    			 OPTKING 3.0: for geometry optimizations 

    			     By R.A. King, Bethel University     

    			        with contributions from          

    			    A.V. Copan, J. Cayton, A. Heide      

    			-----------------------------------------

    
	                            ===> Fragment 1 <== 

	 Z (Atomic Numbers)          Masses                          Geom                  
	       5.000000            11.009305          0.00000000  0.00000000  1.46963456   
	       9.000000            18.998403          0.00000000  0.00000000 -0.85163240   

	 - Coordinate -           - BOHR/RAD -       - ANG/DEG -
	 R(1,2)           =         2.321267           1.228362


	        --- Internal Coordinate Step in ANG or DEG, aJ/ANG or AJ/DEG ---
	-------------------------------------------------------------------------------
	           Coordinate      Previous         Force          Change          New 
	           ----------      --------        ------          ------        ------
	               R(1,2)       1.22836        0.00783        0.00066       1.22902
	-------------------------------------------------------------------------------

	                                 ==> Convergence Check <==                                  
    
	Measures of convergence in internal coordinates in au.
    
	Criteria marked as inactive (o), active & met (*), and active & unmet ( ).

	----------------------------------------------------------------------------------------------
	   Step    Total Energy     Delta E     Max Force     RMS Force      Max Disp      RMS Disp   
	----------------------------------------------------------------------------------------------
	  Convergence Criteria     1.00e-06 *    3.00e-04 *             o    1.20e-03 *             o
	----------------------------------------------------------------------------------------------
	     3    -124.26129092   -7.78e-05      9.50e-04      9.50e-04 o    1.24e-03      1.24e-03 o  ~
	----------------------------------------------------------------------------------------------

Next Geometry in Ang 
	Fragment 1 (Ang)

	    B   0.0000000000   0.0000000000   0.7780249954
	    F   0.0000000000   0.0000000000  -0.4509923348


    Structure for next step:
    Molecular point group: c2v
    Full point group: C_inf_v

    Geometry (in Angstrom), charge = 1, multiplicity = 2:

    B            0.000000000000     0.000000000000     0.778112287933
    F            0.000000000000     0.000000000000    -0.450905042326


Scratch directory: /tmp/
gradient() will perform analytic gradient computation.
   => Libint2 <=

    Primary   basis highest AM E, G, H:  6, 6, 3
    Auxiliary basis highest AM E, G, H:  7, 7, 4
    Onebody   basis highest AM E, G, H:  -, -, -
    Solid Harmonics ordering:            Gaussian

*** tstart() called on Joses-MacBook-Pro-2.local
*** at Thu Jul 17 13:31:13 2025

   => Loading Basis Set <=

    Name: CC-PVDZ
    Role: ORBITAL
    Keyword: BASIS
    atoms 1 entry B          line   108 file /Users/joseantoniorodriguesromero/anaconda3/share/psi4/basis/cc-pvdz.gbs 
    atoms 2 entry F          line   228 file /Users/joseantoniorodriguesromero/anaconda3/share/psi4/basis/cc-pvdz.gbs 


         ---------------------------------------------------------
                                   SCF
               by Justin Turney, Rob Parrish, Andy Simmonett
                          and Daniel G. A. Smith
                              UKS Reference
                        1 Threads,    500 MiB Core
         ---------------------------------------------------------

  ==> Geometry <==

    Molecular point group: c2v
    Full point group: C_inf_v

    Geometry (in Angstrom), charge = 1, multiplicity = 2:

       Center              X                  Y                   Z               Mass       
    ------------   -----------------  -----------------  -----------------  -----------------
         B            0.000000000000     0.000000000000     0.778112287933    11.009305360000
         F            0.000000000000     0.000000000000    -0.450905042326    18.998403162730

  Running in c2v symmetry.

  Rotational constants: A = ************  B =      1.60117  C =      1.60117 [cm^-1]
  Rotational constants: A = ************  B =  48001.74229  C =  48001.74229 [MHz]
  Nuclear repulsion =   19.375621395946091

  Charge       = 1
  Multiplicity = 2
  Electrons    = 13
  Nalpha       = 7
  Nbeta        = 6

  ==> Algorithm <==

  SCF Algorithm Type is DF.
  DIIS enabled.
  MOM disabled.
  Fractional occupation disabled.
  Guess Type is READ.
  Energy threshold   = 1.00e-08
  Density threshold  = 1.00e-08
  Integral threshold = 1.00e-12

  ==> Primary Basis <==

  Basis Set: CC-PVDZ
    Blend: CC-PVDZ
    Number of shells: 12
    Number of basis functions: 28
    Number of Cartesian functions: 30
    Spherical Harmonics?: true
    Max angular momentum: 2

  ==> DFT Potential <==

   => LibXC <=

    Version 6.2.2
    S. Lehtola, C. Steigemann, M. J.T. Oliveira, and M. A.L. Marques.,  SoftwareX 7, 1–5 (2018) (10.1016/j.softx.2017.11.002)

   => Composite Functional: B3LYP <= 

    B3LYP Hyb-GGA Exchange-Correlation Functional

    P. J. Stephens, F. J. Devlin, C. F. Chabalowski, and M. J. Frisch.,  J. Phys. Chem. 98, 11623 (1994) (10.1021/j100096a001)

    Deriv               =              1
    GGA                 =           TRUE
    Meta                =          FALSE

    Exchange Hybrid     =           TRUE
    MP2 Hybrid          =          FALSE

   => Exchange Functionals <=

    0.0800   Slater exchange
    0.7200         Becke 88

   => Exact (HF) Exchange <=

    0.2000               HF 

   => Correlation Functionals <=

    0.1900   Vosko, Wilk & Nusair (VWN5_RPA)
    0.8100   Lee, Yang & Parr

   => LibXC Density Thresholds  <==

    XC_HYB_GGA_XC_B3LYP:  1.00E-15 

   => Molecular Quadrature <=

    Radial Scheme          =       TREUTLER
    Pruning Scheme         =           NONE
    Nuclear Scheme         =       TREUTLER

    Blocking Scheme        =         OCTREE
    BS radius alpha        =              1
    Pruning alpha          =              1
    Radial Points          =             75
    Spherical Points       =            302
    Total Points           =          43517
    Total Blocks           =            392
    Max Points             =            256
    Max Functions          =             28
    Weights Tolerance      =       1.00E-15

   => Loading Basis Set <=

    Name: (CC-PVDZ AUX)
    Role: JKFIT
    Keyword: DF_BASIS_SCF
    atoms 1 entry B          line    71 file /Users/joseantoniorodriguesromero/anaconda3/share/psi4/basis/cc-pvdz-jkfit.gbs 
    atoms 2 entry F          line   271 file /Users/joseantoniorodriguesromero/anaconda3/share/psi4/basis/cc-pvdz-jkfit.gbs 

   => Loading Basis Set <=

    Name: CC-PVDZ
    Role: ORBITAL
    Keyword: BASIS
    atoms 1 entry B          line   108 file /Users/joseantoniorodriguesromero/anaconda3/share/psi4/basis/cc-pvdz.gbs 
    atoms 2 entry F          line   228 file /Users/joseantoniorodriguesromero/anaconda3/share/psi4/basis/cc-pvdz.gbs 

  Reading orbitals from file /tmp/doublet_BF.default.74227.180.npy, no projection.

  ==> Integral Setup <==

  DFHelper Memory: AOs need 0.001 GiB; user supplied 0.332 GiB. 
  Using in-core AOs.

  ==> MemDFJK: Density-Fitted J/K Matrices <==

    J tasked:                   Yes
    K tasked:                   Yes
    wK tasked:                   No
    OpenMP threads:               1
    Memory [MiB]:               339
    Algorithm:                 Core
    Schwarz Cutoff:           1E-12
    Mask sparsity (%):       0.0000
    Fitting Condition:        1E-10

   => Auxiliary Basis Set <=

  Basis Set: (CC-PVDZ AUX)
    Blend: CC-PVDZ-JKFIT
    Number of shells: 48
    Number of basis functions: 140
    Number of Cartesian functions: 162
    Spherical Harmonics?: true
    Max angular momentum: 3

  Cached 100.0% of DFT collocation blocks in 0.034 [GiB].

  Minimum eigenvalue in the overlap matrix is 3.2571249214E-02.
  Reciprocal condition number of the overlap matrix is 1.1188101164E-02.
    Using symmetric orthogonalization.

  ==> Pre-Iterations <==

  SCF Guess: Orbitals guess was supplied from a previous computation.

   -------------------------------------------------------
    Irrep   Nso     Nmo     Nalpha   Nbeta   Ndocc  Nsocc
   -------------------------------------------------------
     A1        14      14       5       4       4       1
     A2         2       2       0       0       0       0
     B1         6       6       1       1       1       0
     B2         6       6       1       1       1       0
   -------------------------------------------------------
    Total      28      28       7       6       6       1
   -------------------------------------------------------

  ==> Iterations <==

                           Total Energy        Delta E     RMS |[F,P]|

   @DF-UKS iter   0:  -124.26054280019838   -1.24261e+02   1.32693e-04 
   @DF-UKS iter   1:  -124.26129144848878   -7.48648e-04   3.28972e-05 DIIS
   @DF-UKS iter   2:  -124.26129122142028    2.27068e-07   6.11785e-05 DIIS/DAMP=1%
   @DF-UKS iter   3:  -124.26126868955652    2.25319e-05   1.90002e-06 DIIS/DAMP=1%
   @DF-UKS iter   4:  -124.26129138510132   -2.26955e-05   8.72781e-07 DIIS/DAMP=1%
   @DF-UKS iter   5:  -124.26129123130252    1.53799e-07   7.28403e-08 DIIS/DAMP=1%
   @DF-UKS iter   6:  -124.26129156555238   -3.34250e-07   1.61833e-08 DIIS/DAMP=1%
   @DF-UKS iter   7:  -124.26129155993654    5.61585e-09   2.79223e-09 DIIS/DAMP=1%
  Energy and wave function converged.


  ==> Post-Iterations <==

   Electrons on quadrature grid:
      Nalpha   =    7.0000001950 ; deviation = 1.950e-07
      Nbeta    =    6.0000002154 ; deviation = 2.154e-07
      Ntotal   =   13.0000004105 ; deviation = 4.105e-07 

   @Spin Contamination Metric:   2.412641353E-03
   @S^2 Expected:                7.500000000E-01
   @S^2 Observed:                7.524126414E-01
   @S   Expected:                5.000000000E-01
   @S   Observed:                5.000000000E-01

    Orbital Energies [Eh]
    ---------------------

    Alpha Occupied:                                                       

       1A1   -25.137409     2A1    -7.334764     3A1    -1.655407  
       4A1    -0.957259     1B1    -0.863777     1B2    -0.863777  
       5A1    -0.712349  

    Alpha Virtual:                                                        

       2B1    -0.400482     2B2    -0.400482     6A1    -0.159539  
       3B1    -0.008428     3B2    -0.008428     7A1     0.018694  
       8A1     0.165256     9A1     0.328961     1A2     0.328961  
       4B1     0.450364     4B2     0.450364    10A1     0.620491  
       5B2     0.917629     5B1     0.917629    11A1     1.051322  
      12A1     1.778665    13A1     3.160439     2A2     3.160441  
       6B1     3.345860     6B2     3.345860    14A1     3.746146  

    Beta Occupied:                                                        

       1A1   -25.137125     2A1    -7.315522     3A1    -1.653425  
       4A1    -0.950512     1B1    -0.863824     1B2    -0.863824  

    Beta Virtual:                                                         

       5A1    -0.514753     2B1    -0.349259     2B2    -0.349259  
       6A1    -0.135184     3B1     0.004927     3B2     0.004927  
       7A1     0.077247     8A1     0.200143     1A2     0.367302  
       9A1     0.367302     4B1     0.509199     4B2     0.509199  
      10A1     0.645605     5B2     0.920604     5B1     0.920604  
      11A1     1.076230    12A1     1.780741    13A1     3.157578  
       2A2     3.157580     6B1     3.349744     6B2     3.349744  
      14A1     3.750629  

    Final Occupation by Irrep:
             A1    A2    B1    B2 
    DOCC [     4,    0,    1,    1 ]
    SOCC [     1,    0,    0,    0 ]
    NA   [     5,    0,    1,    1 ]
    NB   [     4,    0,    1,    1 ]

  @DF-UKS Final Energy:  -124.26129155993654

   => Energetics <=

    Nuclear Repulsion Energy =             19.3756213959460908
    One-Electron Energy =                -204.7507963755028300
    Two-Electron Energy =                  72.5444383118616969
    DFT Exchange-Correlation Energy =     -11.4305548922415046
    Empirical Dispersion Energy =           0.0000000000000000
    VV10 Nonlocal Energy =                  0.0000000000000000
    Total Energy =                       -124.2612915599365380

  UHF NO Occupations:
  HONO-2 :    1 B1 1.9994059
  HONO-1 :    1 B2 1.9994059
  HONO-0 :    5 A1 1.0000000
  LUNO+0 :    2 B2 0.0005941
  LUNO+1 :    2 B1 0.0005941
  LUNO+2 :    6 A1 0.0000169
  LUNO+3 :    7 A1 0.0000015


Computation Completed


Properties will be evaluated at   0.000000,   0.000000,   0.000000 [a0]

Properties computed using the SCF density matrix


 Multipole Moments:

 ------------------------------------------------------------------------------------
     Multipole            Electronic (a.u.)      Nuclear  (a.u.)        Total (a.u.)
 ------------------------------------------------------------------------------------

 L = 1.  Multiply by 2.5417464519 to convert [e a0] to [Debye]
 Dipole X            :          0.0000000            0.0000000            0.0000000
 Dipole Y            :          0.0000000            0.0000000            0.0000000
 Dipole Z            :          1.6676674           -0.3166878            1.3509796
 Magnitude           :                                                    1.3509796

 ------------------------------------------------------------------------------------

*** tstop() called on Joses-MacBook-Pro-2.local at Thu Jul 17 13:31:13 2025
Module time:
	user time   =       1.80 seconds =       0.03 minutes
	system time =       3.39 seconds =       0.06 minutes
	total time  =          0 seconds =       0.00 minutes
Total time:
	user time   =      12.21 seconds =       0.20 minutes
	system time =      20.23 seconds =       0.34 minutes
	total time  =          3 seconds =       0.05 minutes

*** tstart() called on Joses-MacBook-Pro-2.local
*** at Thu Jul 17 13:31:13 2025


         ------------------------------------------------------------
                                   SCF GRAD                          
                          Rob Parrish, Justin Turney,                
                       Andy Simmonett, and Alex Sokolov              
         ------------------------------------------------------------

  ==> Geometry <==

    Molecular point group: c2v
    Full point group: C_inf_v

    Geometry (in Angstrom), charge = 1, multiplicity = 2:

       Center              X                  Y                   Z               Mass       
    ------------   -----------------  -----------------  -----------------  -----------------
         B            0.000000000000     0.000000000000     0.778112287933    11.009305360000
         F            0.000000000000     0.000000000000    -0.450905042326    18.998403162730

  Nuclear repulsion =   19.375621395946091

  ==> Basis Set <==

  Basis Set: CC-PVDZ
    Blend: CC-PVDZ
    Number of shells: 12
    Number of basis functions: 28
    Number of Cartesian functions: 30
    Spherical Harmonics?: true
    Max angular momentum: 2

  ==> DFJKGrad: Density-Fitted SCF Gradients <==

    Gradient:                    1
    J tasked:                  Yes
    K tasked:                  Yes
    wK tasked:                  No
    OpenMP threads:              1
    Integrals threads:           1
    Memory [MiB]:              375
    Schwarz Cutoff:          1E-12
    Fitting Condition:       1E-10

   => Auxiliary Basis Set <=

  Basis Set: (CC-PVDZ AUX)
    Blend: CC-PVDZ-JKFIT
    Number of shells: 48
    Number of basis functions: 140
    Number of Cartesian functions: 162
    Spherical Harmonics?: true
    Max angular momentum: 3

  ==> DFT Potential <==

   => LibXC <=

    Version 6.2.2
    S. Lehtola, C. Steigemann, M. J.T. Oliveira, and M. A.L. Marques.,  SoftwareX 7, 1–5 (2018) (10.1016/j.softx.2017.11.002)

   => Composite Functional: B3LYP <= 

    B3LYP Hyb-GGA Exchange-Correlation Functional

    P. J. Stephens, F. J. Devlin, C. F. Chabalowski, and M. J. Frisch.,  J. Phys. Chem. 98, 11623 (1994) (10.1021/j100096a001)

    Deriv               =              1
    GGA                 =           TRUE
    Meta                =          FALSE

    Exchange Hybrid     =           TRUE
    MP2 Hybrid          =          FALSE

   => Exchange Functionals <=

    0.0800   Slater exchange
    0.7200         Becke 88

   => Exact (HF) Exchange <=

    0.2000               HF 

   => Correlation Functionals <=

    0.1900   Vosko, Wilk & Nusair (VWN5_RPA)
    0.8100   Lee, Yang & Parr

   => LibXC Density Thresholds  <==

    XC_HYB_GGA_XC_B3LYP:  1.00E-15 

   => Molecular Quadrature <=

    Radial Scheme          =       TREUTLER
    Pruning Scheme         =           NONE
    Nuclear Scheme         =       TREUTLER

    Blocking Scheme        =         OCTREE
    BS radius alpha        =              1
    Pruning alpha          =              1
    Radial Points          =             75
    Spherical Points       =            302
    Total Points           =          43517
    Total Blocks           =            392
    Max Points             =            256
    Max Functions          =             28
    Weights Tolerance      =       1.00E-15


  -Total Gradient:
     Atom            X                  Y                   Z
    ------   -----------------  -----------------  -----------------
       1        0.000000000000     0.000000000000    -0.000073220261
       2        0.000000000000     0.000000000000     0.000101514495


*** tstop() called on Joses-MacBook-Pro-2.local at Thu Jul 17 13:31:13 2025
Module time:
	user time   =       0.32 seconds =       0.01 minutes
	system time =       1.31 seconds =       0.02 minutes
	total time  =          0 seconds =       0.00 minutes
Total time:
	user time   =      12.55 seconds =       0.21 minutes
	system time =      21.54 seconds =       0.36 minutes
	total time  =          3 seconds =       0.05 minutes

    			-----------------------------------------

    			 OPTKING 3.0: for geometry optimizations 

    			     By R.A. King, Bethel University     

    			        with contributions from          

    			    A.V. Copan, J. Cayton, A. Heide      

    			-----------------------------------------

    
	                            ===> Fragment 1 <== 

	 Z (Atomic Numbers)          Masses                          Geom                  
	       5.000000            11.009305          0.00000000  0.00000000  1.47041912   
	       9.000000            18.998403          0.00000000  0.00000000 -0.85208704   

	 - Coordinate -           - BOHR/RAD -       - ANG/DEG -
	 R(1,2)           =         2.322506           1.229017


	        --- Internal Coordinate Step in ANG or DEG, aJ/ANG or AJ/DEG ---
	-------------------------------------------------------------------------------
	           Coordinate      Previous         Force          Change          New 
	           ----------      --------        ------          ------        ------
	               R(1,2)       1.22902        0.00072        0.00006       1.22908
	-------------------------------------------------------------------------------

	                                 ==> Convergence Check <==                                  
    
	Measures of convergence in internal coordinates in au.
    
	Criteria marked as inactive (o), active & met (*), and active & unmet ( ).

	----------------------------------------------------------------------------------------------
	   Step    Total Energy     Delta E     Max Force     RMS Force      Max Disp      RMS Disp   
	----------------------------------------------------------------------------------------------
	  Convergence Criteria     1.00e-06 *    3.00e-04 *             o    1.20e-03 *             o
	----------------------------------------------------------------------------------------------
	     4    -124.26129156   -6.36e-07 *    8.74e-05 *    8.74e-05 o    1.14e-04 *    1.14e-04 o  ~
	----------------------------------------------------------------------------------------------

Next Geometry in Ang 
	Fragment 1 (Ang)

	    B   0.0000000000   0.0000000000   0.7781424979
	    F   0.0000000000   0.0000000000  -0.4509352522


    Final optimized geometry and variables:
    Molecular point group: c2v
    Full point group: C_inf_v

    Geometry (in Angstrom), charge = 1, multiplicity = 2:

    B            0.000000000000     0.000000000000     0.778112287933
    F            0.000000000000     0.000000000000    -0.450905042326


    Psi4 stopped on: Thursday, 17 July 2025 01:31PM
    Psi4 wall time for execution: 0:00:03.87

*** Psi4 exiting successfully. Buy a developer a beer!
