
    -----------------------------------------------------------------------
          Psi4: An Open-Source Ab Initio Electronic Structure Package
                               Psi4 1.9.1 release

                         Git: Rev {} zzzzzzz 


    D. G. A. Smith, L. A. Burns, A. C. Simmonett, R. M. Parrish,
    M. C. Schieber, R. Galvelis, P. Kraus, H. Kruse, R. Di Remigio,
    A. Alenaizan, A. M. James, S. Lehtola, J. P. Misiewicz, M. Scheurer,
    R. A. Shaw, J. B. Schriber, Y. Xie, Z. L. Glick, D. A. Sirianni,
    J. S. O'Brien, J. M. Waldrop, A. Kumar, E. G. Hohenstein,
    B. P. Pritchard, B. R. Brooks, H. F. Schaefer III, A. Yu. Sokolov,
    K. Patkowski, A. E. DePrince III, U. Bozkaya, R. A. King,
    F. A. Evangelista, J. M. Turney, T. D. Crawford, C. D. Sherrill,
    J. Chem. Phys. 152(18) 184108 (2020). https://doi.org/10.1063/5.0006002

                            Additional Code Authors
    E. T. Seidl, C. L. Janssen, E. F. Valeev, M. L. Leininger,
    J. F. Gonthier, R. M. Richard, H. R. McAlexander, M. Saitow, X. Wang,
    P. Verma, M. H. Lechner, A. Jiang, S. Behnle, A. G. Heide,
    M. F. Herbst, and D. L. Poole

             Previous Authors, Complete List of Code Contributors,
                       and Citations for Specific Modules
    https://github.com/psi4/psi4/blob/master/codemeta.json
    https://github.com/psi4/psi4/graphs/contributors
    http://psicode.org/psi4manual/master/introduction.html#citing-psifour

    -----------------------------------------------------------------------


    Psi4 started on: Thursday, 17 July 2025 01:51PM

    Process ID: 74456
    Host:       Joses-MacBook-Pro-2.local
    PSIDATADIR: /Users/joseantoniorodriguesromero/anaconda3/share/psi4
    Memory:     500.0 MiB
    Threads:    1
    
  ==> Input File <==

--------------------------------------------------------------------------
molecule { 
1 2
N   0.00000        0.60000        0.00000
F   0.00000       -0.60000        0.00000
}

set { 
basis              cc-pvdz
reference          uks
maxiter            500
geom_maxiter       500
DAMPING_PERCENTAGE 1
guess              SAP
}

optimize('b3lyp')
--------------------------------------------------------------------------

Scratch directory: /tmp/
gradient() will perform analytic gradient computation.
   => Libint2 <=

    Primary   basis highest AM E, G, H:  6, 6, 3
    Auxiliary basis highest AM E, G, H:  7, 7, 4
    Onebody   basis highest AM E, G, H:  -, -, -
    Solid Harmonics ordering:            Gaussian

*** tstart() called on Joses-MacBook-Pro-2.local
*** at Thu Jul 17 13:51:41 2025

   => Loading Basis Set <=

    Name: CC-PVDZ
    Role: ORBITAL
    Keyword: BASIS
    atoms 1 entry N          line   168 file /Users/joseantoniorodriguesromero/anaconda3/share/psi4/basis/cc-pvdz.gbs 
    atoms 2 entry F          line   228 file /Users/joseantoniorodriguesromero/anaconda3/share/psi4/basis/cc-pvdz.gbs 


         ---------------------------------------------------------
                                   SCF
               by Justin Turney, Rob Parrish, Andy Simmonett
                          and Daniel G. A. Smith
                              UKS Reference
                        1 Threads,    500 MiB Core
         ---------------------------------------------------------

  ==> Geometry <==

    Molecular point group: c2v
    Full point group: C_inf_v

    Geometry (in Angstrom), charge = 1, multiplicity = 2:

       Center              X                  Y                   Z               Mass       
    ------------   -----------------  -----------------  -----------------  -----------------
         N            0.000000000000     0.000000000000     0.690820101167    14.003074004430
         F            0.000000000000     0.000000000000    -0.509179898833    18.998403162730

  Running in c2v symmetry.

  Rotational constants: A = ************  B =      1.45220  C =      1.45220 [cm^-1]
  Rotational constants: A = ************  B =  43535.90766  C =  43535.90766 [MHz]
  Nuclear repulsion =   27.781803560175003

  Charge       = 1
  Multiplicity = 2
  Electrons    = 15
  Nalpha       = 8
  Nbeta        = 7

  ==> Algorithm <==

  SCF Algorithm Type is DF.
  DIIS enabled.
  MOM disabled.
  Fractional occupation disabled.
  Guess Type is SAP.
  Energy threshold   = 1.00e-08
  Density threshold  = 1.00e-08
  Integral threshold = 1.00e-12

  ==> Primary Basis <==

  Basis Set: CC-PVDZ
    Blend: CC-PVDZ
    Number of shells: 12
    Number of basis functions: 28
    Number of Cartesian functions: 30
    Spherical Harmonics?: true
    Max angular momentum: 2

  ==> DFT Potential <==

   => LibXC <=

    Version 6.2.2
    S. Lehtola, C. Steigemann, M. J.T. Oliveira, and M. A.L. Marques.,  SoftwareX 7, 1–5 (2018) (10.1016/j.softx.2017.11.002)

   => Composite Functional: B3LYP <= 

    B3LYP Hyb-GGA Exchange-Correlation Functional

    P. J. Stephens, F. J. Devlin, C. F. Chabalowski, and M. J. Frisch.,  J. Phys. Chem. 98, 11623 (1994) (10.1021/j100096a001)

    Deriv               =              1
    GGA                 =           TRUE
    Meta                =          FALSE

    Exchange Hybrid     =           TRUE
    MP2 Hybrid          =          FALSE

   => Exchange Functionals <=

    0.0800   Slater exchange
    0.7200         Becke 88

   => Exact (HF) Exchange <=

    0.2000               HF 

   => Correlation Functionals <=

    0.1900   Vosko, Wilk & Nusair (VWN5_RPA)
    0.8100   Lee, Yang & Parr

   => LibXC Density Thresholds  <==

    XC_HYB_GGA_XC_B3LYP:  1.00E-15 

   => Molecular Quadrature <=

    Radial Scheme          =       TREUTLER
    Pruning Scheme         =           NONE
    Nuclear Scheme         =       TREUTLER

    Blocking Scheme        =         OCTREE
    BS radius alpha        =              1
    Pruning alpha          =              1
    Radial Points          =             75
    Spherical Points       =            302
    Total Points           =          42508
    Total Blocks           =            375
    Max Points             =            256
    Max Functions          =             28
    Weights Tolerance      =       1.00E-15

   => Loading Basis Set <=

    Name: (CC-PVDZ AUX)
    Role: JKFIT
    Keyword: DF_BASIS_SCF
    atoms 1 entry N          line   171 file /Users/joseantoniorodriguesromero/anaconda3/share/psi4/basis/cc-pvdz-jkfit.gbs 
    atoms 2 entry F          line   271 file /Users/joseantoniorodriguesromero/anaconda3/share/psi4/basis/cc-pvdz-jkfit.gbs 

  ==> Integral Setup <==

  DFHelper Memory: AOs need 0.001 GiB; user supplied 0.332 GiB. 
  Using in-core AOs.

  ==> MemDFJK: Density-Fitted J/K Matrices <==

    J tasked:                   Yes
    K tasked:                   Yes
    wK tasked:                   No
    OpenMP threads:               1
    Memory [MiB]:               340
    Algorithm:                 Core
    Schwarz Cutoff:           1E-12
    Mask sparsity (%):       0.0000
    Fitting Condition:        1E-10

   => Auxiliary Basis Set <=

  Basis Set: (CC-PVDZ AUX)
    Blend: CC-PVDZ-JKFIT
    Number of shells: 48
    Number of basis functions: 140
    Number of Cartesian functions: 162
    Spherical Harmonics?: true
    Max angular momentum: 3

  Cached 100.0% of DFT collocation blocks in 0.034 [GiB].

  Minimum eigenvalue in the overlap matrix is 2.8155524161E-02.
  Reciprocal condition number of the overlap matrix is 9.9008142976E-03.
    Using symmetric orthogonalization.

  ==> Pre-Iterations <==

  SCF Guess: Superposition of Atomic Potentials (doi:10.1021/acs.jctc.8b01089).

  ==> SAP guess <==

   => Molecular Quadrature <=

    Radial Scheme          =       TREUTLER
    Pruning Scheme         =           NONE
    Nuclear Scheme         =       TREUTLER

    Blocking Scheme        =         OCTREE
    BS radius alpha        =              1
    Pruning alpha          =              1
    Radial Points          =             75
    Spherical Points       =            302
    Total Points           =          42508
    Total Blocks           =            375
    Max Points             =            256
    Max Functions          =             28
    Weights Tolerance      =       1.00E-15

   -------------------------------------------------------
    Irrep   Nso     Nmo     Nalpha   Nbeta   Ndocc  Nsocc
   -------------------------------------------------------
     A1        14      14       5       5       5       0
     A2         2       2       0       0       0       0
     B1         6       6       1       1       1       0
     B2         6       6       2       1       1       1
   -------------------------------------------------------
    Total      28      28       8       7       7       1
   -------------------------------------------------------

  ==> Iterations <==

                           Total Energy        Delta E     RMS |[F,P]|

   @DF-UKS iter   1:  -153.98371329454218   -1.53984e+02   1.17054e-02 DIIS/ADIIS
   @DF-UKS iter   2:  -153.98632976447990   -2.61647e-03   9.43502e-03 DIIS/ADIIS/DAMP=1%
   @DF-UKS iter   3:  -153.98368145281273    2.64831e-03   9.56969e-03 DIIS/ADIIS/DAMP=1%
   @DF-UKS iter   4:  -153.99764195468140   -1.39605e-02   4.34986e-04 DIIS/ADIIS/DAMP=1%
   @DF-UKS iter   5:  -153.99534331196924    2.29864e-03   1.32582e-04 DIIS/ADIIS/DAMP=1%
   @DF-UKS iter   6:  -153.99551430282332   -1.70991e-04   6.50005e-05 DIIS/DAMP=1%
   @DF-UKS iter   7:  -153.99547349793082    4.08049e-05   2.04442e-05 DIIS/DAMP=1%
   @DF-UKS iter   8:  -153.99547742956992   -3.93164e-06   4.38851e-06 DIIS/DAMP=1%
   @DF-UKS iter   9:  -153.99547686093337    5.68637e-07   8.56681e-07 DIIS/DAMP=1%
   @DF-UKS iter  10:  -153.99547787397560   -1.01304e-06   8.03784e-08 DIIS/DAMP=1%
   @DF-UKS iter  11:  -153.99547764183200    2.32144e-07   1.65199e-08 DIIS/DAMP=1%
   @DF-UKS iter  12:  -153.99547765104612   -9.21412e-09   2.18248e-09 DIIS/DAMP=1%
  Energy and wave function converged.


  ==> Post-Iterations <==

   Electrons on quadrature grid:
      Nalpha   =    7.9999997360 ; deviation = -2.640e-07
      Nbeta    =    6.9999997615 ; deviation = -2.385e-07
      Ntotal   =   14.9999994975 ; deviation = -5.025e-07 

   @Spin Contamination Metric:   3.265258453E-03
   @S^2 Expected:                7.500000000E-01
   @S^2 Observed:                7.532652585E-01
   @S   Expected:                5.000000000E-01
   @S   Observed:                5.000000000E-01

    Orbital Energies [Eh]
    ---------------------

    Alpha Occupied:                                                       

       1A1   -25.304210     2A1   -15.014781     3A1    -1.864854  
       4A1    -1.247778     1B2    -1.033288     1B1    -1.008750  
       5A1    -0.964804     2B2    -0.734326  

    Alpha Virtual:                                                        

       2B1    -0.605062     6A1    -0.230536     7A1     0.242688  
       3B2     0.273317     3B1     0.291576     8A1     0.398815  
       9A1     0.711791     4B2     0.738815     4B1     0.742183  
       1A2     1.211598    10A1     1.217623     5B2     1.282013  
       5B1     1.286020    11A1     1.704881    12A1     1.899819  
       2A2     3.019845    13A1     3.020457     6B1     3.361140  
       6B2     3.363218    14A1     3.775620  

    Beta Occupied:                                                        

       1A1   -25.298273     2A1   -14.993128     3A1    -1.848307  
       4A1    -1.211599     1B1    -1.003698     1B2    -0.974227  
       5A1    -0.930768  

    Beta Virtual:                                                         

       2B1    -0.581665     2B2    -0.525964     6A1    -0.206547  
       7A1     0.253066     3B1     0.303992     3B2     0.339246  
       8A1     0.424095     9A1     0.716187     4B1     0.742971  
       4B2     0.761099    10A1     1.280600     1A2     1.281151  
       5B1     1.293706     5B2     1.333196    11A1     1.712809  
      12A1     1.924792    13A1     3.036003     2A2     3.036057  
       6B1     3.362416     6B2     3.387362    14A1     3.785547  

    Final Occupation by Irrep:
             A1    A2    B1    B2 
    DOCC [     5,    0,    1,    1 ]
    SOCC [     0,    0,    0,    1 ]
    NA   [     5,    0,    1,    2 ]
    NB   [     5,    0,    1,    1 ]

  @DF-UKS Final Energy:  -153.99547765104612

   => Energetics <=

    Nuclear Repulsion Energy =             27.7818035601750033
    One-Electron Energy =                -260.3658307338850477
    Two-Electron Energy =                  92.1691259284499296
    DFT Exchange-Correlation Energy =     -13.5805764057859921
    Empirical Dispersion Energy =           0.0000000000000000
    VV10 Nonlocal Energy =                  0.0000000000000000
    Total Energy =                       -153.9954776510461159

  UHF NO Occupations:
  HONO-2 :    1 B1 1.9994669
  HONO-1 :    5 A1 1.9992856
  HONO-0 :    2 B2 1.0000000
  LUNO+0 :    6 A1 0.0007144
  LUNO+1 :    2 B1 0.0005331
  LUNO+2 :    3 B2 0.0003355
  LUNO+3 :    7 A1 0.0000397


Computation Completed


Properties will be evaluated at   0.000000,   0.000000,   0.000000 [a0]

Properties computed using the SCF density matrix


 Multipole Moments:

 ------------------------------------------------------------------------------------
     Multipole            Electronic (a.u.)      Nuclear  (a.u.)        Total (a.u.)
 ------------------------------------------------------------------------------------

 L = 1.  Multiply by 2.5417464519 to convert [e a0] to [Debye]
 Dipole X            :          0.0000000            0.0000000            0.0000000
 Dipole Y            :          0.0000000            0.0000000            0.0000000
 Dipole Z            :         -0.0897825            0.4783305            0.3885480
 Magnitude           :                                                    0.3885480

 ------------------------------------------------------------------------------------

*** tstop() called on Joses-MacBook-Pro-2.local at Thu Jul 17 13:51:42 2025
Module time:
	user time   =       3.27 seconds =       0.05 minutes
	system time =       5.32 seconds =       0.09 minutes
	total time  =          1 seconds =       0.02 minutes
Total time:
	user time   =       3.27 seconds =       0.05 minutes
	system time =       5.32 seconds =       0.09 minutes
	total time  =          1 seconds =       0.02 minutes

*** tstart() called on Joses-MacBook-Pro-2.local
*** at Thu Jul 17 13:51:42 2025


         ------------------------------------------------------------
                                   SCF GRAD                          
                          Rob Parrish, Justin Turney,                
                       Andy Simmonett, and Alex Sokolov              
         ------------------------------------------------------------

  ==> Geometry <==

    Molecular point group: c2v
    Full point group: C_inf_v

    Geometry (in Angstrom), charge = 1, multiplicity = 2:

       Center              X                  Y                   Z               Mass       
    ------------   -----------------  -----------------  -----------------  -----------------
         N            0.000000000000     0.000000000000     0.690820101167    14.003074004430
         F            0.000000000000     0.000000000000    -0.509179898833    18.998403162730

  Nuclear repulsion =   27.781803560175003

  ==> Basis Set <==

  Basis Set: CC-PVDZ
    Blend: CC-PVDZ
    Number of shells: 12
    Number of basis functions: 28
    Number of Cartesian functions: 30
    Spherical Harmonics?: true
    Max angular momentum: 2

  ==> DFJKGrad: Density-Fitted SCF Gradients <==

    Gradient:                    1
    J tasked:                  Yes
    K tasked:                  Yes
    wK tasked:                  No
    OpenMP threads:              1
    Integrals threads:           1
    Memory [MiB]:              375
    Schwarz Cutoff:          1E-12
    Fitting Condition:       1E-10

   => Auxiliary Basis Set <=

  Basis Set: (CC-PVDZ AUX)
    Blend: CC-PVDZ-JKFIT
    Number of shells: 48
    Number of basis functions: 140
    Number of Cartesian functions: 162
    Spherical Harmonics?: true
    Max angular momentum: 3

  ==> DFT Potential <==

   => LibXC <=

    Version 6.2.2
    S. Lehtola, C. Steigemann, M. J.T. Oliveira, and M. A.L. Marques.,  SoftwareX 7, 1–5 (2018) (10.1016/j.softx.2017.11.002)

   => Composite Functional: B3LYP <= 

    B3LYP Hyb-GGA Exchange-Correlation Functional

    P. J. Stephens, F. J. Devlin, C. F. Chabalowski, and M. J. Frisch.,  J. Phys. Chem. 98, 11623 (1994) (10.1021/j100096a001)

    Deriv               =              1
    GGA                 =           TRUE
    Meta                =          FALSE

    Exchange Hybrid     =           TRUE
    MP2 Hybrid          =          FALSE

   => Exchange Functionals <=

    0.0800   Slater exchange
    0.7200         Becke 88

   => Exact (HF) Exchange <=

    0.2000               HF 

   => Correlation Functionals <=

    0.1900   Vosko, Wilk & Nusair (VWN5_RPA)
    0.8100   Lee, Yang & Parr

   => LibXC Density Thresholds  <==

    XC_HYB_GGA_XC_B3LYP:  1.00E-15 

   => Molecular Quadrature <=

    Radial Scheme          =       TREUTLER
    Pruning Scheme         =           NONE
    Nuclear Scheme         =       TREUTLER

    Blocking Scheme        =         OCTREE
    BS radius alpha        =              1
    Pruning alpha          =              1
    Radial Points          =             75
    Spherical Points       =            302
    Total Points           =          42508
    Total Blocks           =            375
    Max Points             =            256
    Max Functions          =             28
    Weights Tolerance      =       1.00E-15


  -Total Gradient:
     Atom            X                  Y                   Z
    ------   -----------------  -----------------  -----------------
       1       -0.000000000000     0.000000000000     0.018954112218
       2       -0.000000000000     0.000000000000    -0.018945122775


*** tstop() called on Joses-MacBook-Pro-2.local at Thu Jul 17 13:51:42 2025
Module time:
	user time   =       0.63 seconds =       0.01 minutes
	system time =       0.91 seconds =       0.02 minutes
	total time  =          0 seconds =       0.00 minutes
Total time:
	user time   =       3.91 seconds =       0.07 minutes
	system time =       6.23 seconds =       0.10 minutes
	total time  =          1 seconds =       0.02 minutes

    			-----------------------------------------

    			 OPTKING 3.0: for geometry optimizations 

    			     By R.A. King, Bethel University     

    			        with contributions from          

    			    A.V. Copan, J. Cayton, A. Heide      

    			-----------------------------------------

    
	                            ===> Fragment 1 <== 

	 Z (Atomic Numbers)          Masses                          Geom                  
	       7.000000            14.003074          0.00000000  0.00000000  1.30546079   
	       9.000000            18.998403          0.00000000  0.00000000 -0.96221056   

	 - Coordinate -           - BOHR/RAD -       - ANG/DEG -
	 R(1,2)           =         2.267671           1.200000


	        --- Internal Coordinate Step in ANG or DEG, aJ/ANG or AJ/DEG ---
	-------------------------------------------------------------------------------
	           Coordinate      Previous         Force          Change          New 
	           ----------      --------        ------          ------        ------
	               R(1,2)       1.20000       -0.15612       -0.00956       1.19044
	-------------------------------------------------------------------------------

	                                 ==> Convergence Check <==                                  
    
	Measures of convergence in internal coordinates in au.
    
	Criteria marked as inactive (o), active & met (*), and active & unmet ( ).

	----------------------------------------------------------------------------------------------
	   Step    Total Energy     Delta E     Max Force     RMS Force      Max Disp      RMS Disp   
	----------------------------------------------------------------------------------------------
	  Convergence Criteria     1.00e-06 *    3.00e-04 *             o    1.20e-03 *             o
	----------------------------------------------------------------------------------------------
	     1    -153.99547765   -1.54e+02      1.89e-02      1.89e-02 o    1.81e-02      1.81e-02 o  ~
	----------------------------------------------------------------------------------------------

Next Geometry in Ang 
	Fragment 1 (Ang)

	    N   0.0000000000   0.0000000000   0.6860385054
	    F   0.0000000000   0.0000000000  -0.5043983030


    Structure for next step:
    Molecular point group: c2v
    Full point group: C_inf_v

    Geometry (in Angstrom), charge = 1, multiplicity = 2:

    N            0.000000000000     0.000000000000     0.685314730339
    F            0.000000000000     0.000000000000    -0.505122078054


Scratch directory: /tmp/
gradient() will perform analytic gradient computation.
   => Libint2 <=

    Primary   basis highest AM E, G, H:  6, 6, 3
    Auxiliary basis highest AM E, G, H:  7, 7, 4
    Onebody   basis highest AM E, G, H:  -, -, -
    Solid Harmonics ordering:            Gaussian

*** tstart() called on Joses-MacBook-Pro-2.local
*** at Thu Jul 17 13:51:42 2025

   => Loading Basis Set <=

    Name: CC-PVDZ
    Role: ORBITAL
    Keyword: BASIS
    atoms 1 entry N          line   168 file /Users/joseantoniorodriguesromero/anaconda3/share/psi4/basis/cc-pvdz.gbs 
    atoms 2 entry F          line   228 file /Users/joseantoniorodriguesromero/anaconda3/share/psi4/basis/cc-pvdz.gbs 


         ---------------------------------------------------------
                                   SCF
               by Justin Turney, Rob Parrish, Andy Simmonett
                          and Daniel G. A. Smith
                              UKS Reference
                        1 Threads,    500 MiB Core
         ---------------------------------------------------------

  ==> Geometry <==

    Molecular point group: c2v
    Full point group: C_inf_v

    Geometry (in Angstrom), charge = 1, multiplicity = 2:

       Center              X                  Y                   Z               Mass       
    ------------   -----------------  -----------------  -----------------  -----------------
         N            0.000000000000     0.000000000000     0.685314730339    14.003074004430
         F            0.000000000000     0.000000000000    -0.505122078054    18.998403162730

  Running in c2v symmetry.

  Rotational constants: A = ************  B =      1.47563  C =      1.47563 [cm^-1]
  Rotational constants: A = ************  B =  44238.19532  C =  44238.19532 [MHz]
  Nuclear repulsion =   28.004984420163698

  Charge       = 1
  Multiplicity = 2
  Electrons    = 15
  Nalpha       = 8
  Nbeta        = 7

  ==> Algorithm <==

  SCF Algorithm Type is DF.
  DIIS enabled.
  MOM disabled.
  Fractional occupation disabled.
  Guess Type is READ.
  Energy threshold   = 1.00e-08
  Density threshold  = 1.00e-08
  Integral threshold = 1.00e-12

  ==> Primary Basis <==

  Basis Set: CC-PVDZ
    Blend: CC-PVDZ
    Number of shells: 12
    Number of basis functions: 28
    Number of Cartesian functions: 30
    Spherical Harmonics?: true
    Max angular momentum: 2

  ==> DFT Potential <==

   => LibXC <=

    Version 6.2.2
    S. Lehtola, C. Steigemann, M. J.T. Oliveira, and M. A.L. Marques.,  SoftwareX 7, 1–5 (2018) (10.1016/j.softx.2017.11.002)

   => Composite Functional: B3LYP <= 

    B3LYP Hyb-GGA Exchange-Correlation Functional

    P. J. Stephens, F. J. Devlin, C. F. Chabalowski, and M. J. Frisch.,  J. Phys. Chem. 98, 11623 (1994) (10.1021/j100096a001)

    Deriv               =              1
    GGA                 =           TRUE
    Meta                =          FALSE

    Exchange Hybrid     =           TRUE
    MP2 Hybrid          =          FALSE

   => Exchange Functionals <=

    0.0800   Slater exchange
    0.7200         Becke 88

   => Exact (HF) Exchange <=

    0.2000               HF 

   => Correlation Functionals <=

    0.1900   Vosko, Wilk & Nusair (VWN5_RPA)
    0.8100   Lee, Yang & Parr

   => LibXC Density Thresholds  <==

    XC_HYB_GGA_XC_B3LYP:  1.00E-15 

   => Molecular Quadrature <=

    Radial Scheme          =       TREUTLER
    Pruning Scheme         =           NONE
    Nuclear Scheme         =       TREUTLER

    Blocking Scheme        =         OCTREE
    BS radius alpha        =              1
    Pruning alpha          =              1
    Radial Points          =             75
    Spherical Points       =            302
    Total Points           =          42500
    Total Blocks           =            376
    Max Points             =            253
    Max Functions          =             28
    Weights Tolerance      =       1.00E-15

   => Loading Basis Set <=

    Name: (CC-PVDZ AUX)
    Role: JKFIT
    Keyword: DF_BASIS_SCF
    atoms 1 entry N          line   171 file /Users/joseantoniorodriguesromero/anaconda3/share/psi4/basis/cc-pvdz-jkfit.gbs 
    atoms 2 entry F          line   271 file /Users/joseantoniorodriguesromero/anaconda3/share/psi4/basis/cc-pvdz-jkfit.gbs 

   => Loading Basis Set <=

    Name: CC-PVDZ
    Role: ORBITAL
    Keyword: BASIS
    atoms 1 entry N          line   168 file /Users/joseantoniorodriguesromero/anaconda3/share/psi4/basis/cc-pvdz.gbs 
    atoms 2 entry F          line   228 file /Users/joseantoniorodriguesromero/anaconda3/share/psi4/basis/cc-pvdz.gbs 

  Reading orbitals from file /tmp/doublet_NF.default.74456.180.npy, no projection.

  ==> Integral Setup <==

  DFHelper Memory: AOs need 0.001 GiB; user supplied 0.332 GiB. 
  Using in-core AOs.

  ==> MemDFJK: Density-Fitted J/K Matrices <==

    J tasked:                   Yes
    K tasked:                   Yes
    wK tasked:                   No
    OpenMP threads:               1
    Memory [MiB]:               340
    Algorithm:                 Core
    Schwarz Cutoff:           1E-12
    Mask sparsity (%):       0.0000
    Fitting Condition:        1E-10

   => Auxiliary Basis Set <=

  Basis Set: (CC-PVDZ AUX)
    Blend: CC-PVDZ-JKFIT
    Number of shells: 48
    Number of basis functions: 140
    Number of Cartesian functions: 162
    Spherical Harmonics?: true
    Max angular momentum: 3

  Cached 100.0% of DFT collocation blocks in 0.034 [GiB].

  Minimum eigenvalue in the overlap matrix is 2.7665794002E-02.
  Reciprocal condition number of the overlap matrix is 9.6968949973E-03.
    Using symmetric orthogonalization.

  ==> Pre-Iterations <==

  SCF Guess: Orbitals guess was supplied from a previous computation.

   -------------------------------------------------------
    Irrep   Nso     Nmo     Nalpha   Nbeta   Ndocc  Nsocc
   -------------------------------------------------------
     A1        14      14       5       5       5       0
     A2         2       2       0       0       0       0
     B1         6       6       1       1       1       0
     B2         6       6       2       1       1       1
   -------------------------------------------------------
    Total      28      28       8       7       7       1
   -------------------------------------------------------

  ==> Iterations <==

                           Total Energy        Delta E     RMS |[F,P]|

   @DF-UKS iter   0:  -154.01175477309533   -1.54012e+02   2.17566e-03 
   @DF-UKS iter   1:  -153.99559770924455    1.61571e-02   1.04805e-03 DIIS/ADIIS
   @DF-UKS iter   2:  -153.99515428786682    4.43421e-04   2.45439e-03 DIIS/ADIIS/DAMP=1%
   @DF-UKS iter   3:  -153.99627478059398   -1.12049e-03   1.24479e-04 DIIS/ADIIS/DAMP=1%
   @DF-UKS iter   4:  -153.99570678709509    5.67993e-04   2.78757e-05 DIIS/DAMP=1%
   @DF-UKS iter   5:  -153.99570437152835    2.41557e-06   3.29134e-06 DIIS/DAMP=1%
   @DF-UKS iter   6:  -153.99570320879315    1.16274e-06   1.83424e-06 DIIS/DAMP=1%
   @DF-UKS iter   7:  -153.99570127441490    1.93438e-06   2.69929e-07 DIIS/DAMP=1%
   @DF-UKS iter   8:  -153.99570177487192   -5.00457e-07   8.53184e-08 DIIS/DAMP=1%
   @DF-UKS iter   9:  -153.99570175871736    1.61546e-08   7.27550e-09 DIIS/DAMP=1%
   @DF-UKS iter  10:  -153.99570174158694    1.71304e-08   1.09428e-09 DIIS/DAMP=1%
   @DF-UKS iter  11:  -153.99570174219437   -6.07429e-10   1.45144e-10 DIIS/DAMP=1%
  Energy and wave function converged.


  ==> Post-Iterations <==

   Electrons on quadrature grid:
      Nalpha   =    7.9999997059 ; deviation = -2.941e-07
      Nbeta    =    6.9999997400 ; deviation = -2.600e-07
      Ntotal   =   14.9999994460 ; deviation = -5.540e-07 

   @Spin Contamination Metric:   3.162977654E-03
   @S^2 Expected:                7.500000000E-01
   @S^2 Observed:                7.531629777E-01
   @S   Expected:                5.000000000E-01
   @S   Observed:                5.000000000E-01

    Orbital Energies [Eh]
    ---------------------

    Alpha Occupied:                                                       

       1A1   -25.307077     2A1   -15.012780     3A1    -1.873800  
       4A1    -1.248519     1B2    -1.038535     1B1    -1.014142  
       5A1    -0.965069     2B2    -0.731583  

    Alpha Virtual:                                                        

       2B1    -0.602259     6A1    -0.218633     7A1     0.242888  
       3B2     0.273201     3B1     0.291374     8A1     0.399185  
       9A1     0.706956     4B2     0.738519     4B1     0.741878  
       1A2     1.211120    10A1     1.217125     5B2     1.283404  
       5B1     1.287304    11A1     1.712016    12A1     1.909767  
       2A2     3.017373    13A1     3.017995     6B1     3.371217  
       6B2     3.373283    14A1     3.784532  

    Beta Occupied:                                                        

       1A1   -25.300992     2A1   -14.991193     3A1    -1.857059  
       4A1    -1.213075     1B1    -1.008846     1B2    -0.979117  
       5A1    -0.930441  

    Beta Virtual:                                                         

       2B1    -0.579007     2B2    -0.523431     6A1    -0.194790  
       7A1     0.253549     3B1     0.303686     3B2     0.338873  
       8A1     0.424320     9A1     0.711449     4B1     0.742789  
       4B2     0.760931    10A1     1.279770     1A2     1.280287  
       5B1     1.294868     5B2     1.334415    11A1     1.719529  
      12A1     1.935119    13A1     3.033931     2A2     3.033983  
       6B1     3.372686     6B2     3.397873    14A1     3.794684  

    Final Occupation by Irrep:
             A1    A2    B1    B2 
    DOCC [     5,    0,    1,    1 ]
    SOCC [     0,    0,    0,    1 ]
    NA   [     5,    0,    1,    2 ]
    NB   [     5,    0,    1,    1 ]

  @DF-UKS Final Energy:  -153.99570174219437

   => Energetics <=

    Nuclear Repulsion Energy =             28.0049844201636979
    One-Electron Energy =                -260.7692283101204112
    Two-Electron Energy =                  92.3550830167197319
    DFT Exchange-Correlation Energy =     -13.5865408689573925
    Empirical Dispersion Energy =           0.0000000000000000
    VV10 Nonlocal Energy =                  0.0000000000000000
    Total Energy =                       -153.9957017421943704

  UHF NO Occupations:
  HONO-2 :    1 B1 1.9995103
  HONO-1 :    5 A1 1.9992919
  HONO-0 :    2 B2 1.0000000
  LUNO+0 :    6 A1 0.0007081
  LUNO+1 :    2 B1 0.0004897
  LUNO+2 :    3 B2 0.0003361
  LUNO+3 :    7 A1 0.0000376


Computation Completed


Properties will be evaluated at   0.000000,   0.000000,   0.000000 [a0]

Properties computed using the SCF density matrix


 Multipole Moments:

 ------------------------------------------------------------------------------------
     Multipole            Electronic (a.u.)      Nuclear  (a.u.)        Total (a.u.)
 ------------------------------------------------------------------------------------

 L = 1.  Multiply by 2.5417464519 to convert [e a0] to [Debye]
 Dipole X            :          0.0000000            0.0000000            0.0000000
 Dipole Y            :          0.0000000            0.0000000            0.0000000
 Dipole Z            :         -0.1055500            0.4745186            0.3689686
 Magnitude           :                                                    0.3689686

 ------------------------------------------------------------------------------------

*** tstop() called on Joses-MacBook-Pro-2.local at Thu Jul 17 13:51:43 2025
Module time:
	user time   =       2.69 seconds =       0.04 minutes
	system time =       6.34 seconds =       0.11 minutes
	total time  =          1 seconds =       0.02 minutes
Total time:
	user time   =       6.65 seconds =       0.11 minutes
	system time =      12.85 seconds =       0.21 minutes
	total time  =          2 seconds =       0.03 minutes

*** tstart() called on Joses-MacBook-Pro-2.local
*** at Thu Jul 17 13:51:43 2025


         ------------------------------------------------------------
                                   SCF GRAD                          
                          Rob Parrish, Justin Turney,                
                       Andy Simmonett, and Alex Sokolov              
         ------------------------------------------------------------

  ==> Geometry <==

    Molecular point group: c2v
    Full point group: C_inf_v

    Geometry (in Angstrom), charge = 1, multiplicity = 2:

       Center              X                  Y                   Z               Mass       
    ------------   -----------------  -----------------  -----------------  -----------------
         N            0.000000000000     0.000000000000     0.685314730339    14.003074004430
         F            0.000000000000     0.000000000000    -0.505122078054    18.998403162730

  Nuclear repulsion =   28.004984420163698

  ==> Basis Set <==

  Basis Set: CC-PVDZ
    Blend: CC-PVDZ
    Number of shells: 12
    Number of basis functions: 28
    Number of Cartesian functions: 30
    Spherical Harmonics?: true
    Max angular momentum: 2

  ==> DFJKGrad: Density-Fitted SCF Gradients <==

    Gradient:                    1
    J tasked:                  Yes
    K tasked:                  Yes
    wK tasked:                  No
    OpenMP threads:              1
    Integrals threads:           1
    Memory [MiB]:              375
    Schwarz Cutoff:          1E-12
    Fitting Condition:       1E-10

   => Auxiliary Basis Set <=

  Basis Set: (CC-PVDZ AUX)
    Blend: CC-PVDZ-JKFIT
    Number of shells: 48
    Number of basis functions: 140
    Number of Cartesian functions: 162
    Spherical Harmonics?: true
    Max angular momentum: 3

  ==> DFT Potential <==

   => LibXC <=

    Version 6.2.2
    S. Lehtola, C. Steigemann, M. J.T. Oliveira, and M. A.L. Marques.,  SoftwareX 7, 1–5 (2018) (10.1016/j.softx.2017.11.002)

   => Composite Functional: B3LYP <= 

    B3LYP Hyb-GGA Exchange-Correlation Functional

    P. J. Stephens, F. J. Devlin, C. F. Chabalowski, and M. J. Frisch.,  J. Phys. Chem. 98, 11623 (1994) (10.1021/j100096a001)

    Deriv               =              1
    GGA                 =           TRUE
    Meta                =          FALSE

    Exchange Hybrid     =           TRUE
    MP2 Hybrid          =          FALSE

   => Exchange Functionals <=

    0.0800   Slater exchange
    0.7200         Becke 88

   => Exact (HF) Exchange <=

    0.2000               HF 

   => Correlation Functionals <=

    0.1900   Vosko, Wilk & Nusair (VWN5_RPA)
    0.8100   Lee, Yang & Parr

   => LibXC Density Thresholds  <==

    XC_HYB_GGA_XC_B3LYP:  1.00E-15 

   => Molecular Quadrature <=

    Radial Scheme          =       TREUTLER
    Pruning Scheme         =           NONE
    Nuclear Scheme         =       TREUTLER

    Blocking Scheme        =         OCTREE
    BS radius alpha        =              1
    Pruning alpha          =              1
    Radial Points          =             75
    Spherical Points       =            302
    Total Points           =          42500
    Total Blocks           =            376
    Max Points             =            253
    Max Functions          =             28
    Weights Tolerance      =       1.00E-15


  -Total Gradient:
     Atom            X                  Y                   Z
    ------   -----------------  -----------------  -----------------
       1        0.000000000000     0.000000000000     0.005685644608
       2       -0.000000000000     0.000000000000    -0.005677515555


*** tstop() called on Joses-MacBook-Pro-2.local at Thu Jul 17 13:51:43 2025
Module time:
	user time   =       0.52 seconds =       0.01 minutes
	system time =       1.23 seconds =       0.02 minutes
	total time  =          0 seconds =       0.00 minutes
Total time:
	user time   =       7.18 seconds =       0.12 minutes
	system time =      14.09 seconds =       0.23 minutes
	total time  =          2 seconds =       0.03 minutes

    			-----------------------------------------

    			 OPTKING 3.0: for geometry optimizations 

    			     By R.A. King, Bethel University     

    			        with contributions from          

    			    A.V. Copan, J. Cayton, A. Heide      

    			-----------------------------------------

    
	                            ===> Fragment 1 <== 

	 Z (Atomic Numbers)          Masses                          Geom                  
	       7.000000            14.003074          0.00000000  0.00000000  1.29505715   
	       9.000000            18.998403          0.00000000  0.00000000 -0.95454239   

	 - Coordinate -           - BOHR/RAD -       - ANG/DEG -
	 R(1,2)           =         2.249600           1.190437


	        --- Internal Coordinate Step in ANG or DEG, aJ/ANG or AJ/DEG ---
	-------------------------------------------------------------------------------
	           Coordinate      Previous         Force          Change          New 
	           ----------      --------        ------          ------        ------
	               R(1,2)       1.19044       -0.04681       -0.00409       1.18634
	-------------------------------------------------------------------------------

	                                 ==> Convergence Check <==                                  
    
	Measures of convergence in internal coordinates in au.
    
	Criteria marked as inactive (o), active & met (*), and active & unmet ( ).

	----------------------------------------------------------------------------------------------
	   Step    Total Energy     Delta E     Max Force     RMS Force      Max Disp      RMS Disp   
	----------------------------------------------------------------------------------------------
	  Convergence Criteria     1.00e-06 *    3.00e-04 *             o    1.20e-03 *             o
	----------------------------------------------------------------------------------------------
	     2    -153.99570174   -2.24e-04      5.68e-03      5.68e-03 o    7.74e-03      7.74e-03 o  ~
	----------------------------------------------------------------------------------------------

Next Geometry in Ang 
	Fragment 1 (Ang)

	    N   0.0000000000   0.0000000000   0.6832672992
	    F   0.0000000000   0.0000000000  -0.5030746469


    Structure for next step:
    Molecular point group: c2v
    Full point group: C_inf_v

    Geometry (in Angstrom), charge = 1, multiplicity = 2:

    N            0.000000000000     0.000000000000     0.682957386046
    F            0.000000000000     0.000000000000    -0.503384560100


Scratch directory: /tmp/
gradient() will perform analytic gradient computation.
   => Libint2 <=

    Primary   basis highest AM E, G, H:  6, 6, 3
    Auxiliary basis highest AM E, G, H:  7, 7, 4
    Onebody   basis highest AM E, G, H:  -, -, -
    Solid Harmonics ordering:            Gaussian

*** tstart() called on Joses-MacBook-Pro-2.local
*** at Thu Jul 17 13:51:43 2025

   => Loading Basis Set <=

    Name: CC-PVDZ
    Role: ORBITAL
    Keyword: BASIS
    atoms 1 entry N          line   168 file /Users/joseantoniorodriguesromero/anaconda3/share/psi4/basis/cc-pvdz.gbs 
    atoms 2 entry F          line   228 file /Users/joseantoniorodriguesromero/anaconda3/share/psi4/basis/cc-pvdz.gbs 


         ---------------------------------------------------------
                                   SCF
               by Justin Turney, Rob Parrish, Andy Simmonett
                          and Daniel G. A. Smith
                              UKS Reference
                        1 Threads,    500 MiB Core
         ---------------------------------------------------------

  ==> Geometry <==

    Molecular point group: c2v
    Full point group: C_inf_v

    Geometry (in Angstrom), charge = 1, multiplicity = 2:

       Center              X                  Y                   Z               Mass       
    ------------   -----------------  -----------------  -----------------  -----------------
         N            0.000000000000     0.000000000000     0.682957386046    14.003074004430
         F            0.000000000000     0.000000000000    -0.503384560100    18.998403162730

  Running in c2v symmetry.

  Rotational constants: A = ************  B =      1.48583  C =      1.48583 [cm^-1]
  Rotational constants: A = ************  B =  44544.11377  C =  44544.11377 [MHz]
  Nuclear repulsion =   28.101648416367944

  Charge       = 1
  Multiplicity = 2
  Electrons    = 15
  Nalpha       = 8
  Nbeta        = 7

  ==> Algorithm <==

  SCF Algorithm Type is DF.
  DIIS enabled.
  MOM disabled.
  Fractional occupation disabled.
  Guess Type is READ.
  Energy threshold   = 1.00e-08
  Density threshold  = 1.00e-08
  Integral threshold = 1.00e-12

  ==> Primary Basis <==

  Basis Set: CC-PVDZ
    Blend: CC-PVDZ
    Number of shells: 12
    Number of basis functions: 28
    Number of Cartesian functions: 30
    Spherical Harmonics?: true
    Max angular momentum: 2

  ==> DFT Potential <==

   => LibXC <=

    Version 6.2.2
    S. Lehtola, C. Steigemann, M. J.T. Oliveira, and M. A.L. Marques.,  SoftwareX 7, 1–5 (2018) (10.1016/j.softx.2017.11.002)

   => Composite Functional: B3LYP <= 

    B3LYP Hyb-GGA Exchange-Correlation Functional

    P. J. Stephens, F. J. Devlin, C. F. Chabalowski, and M. J. Frisch.,  J. Phys. Chem. 98, 11623 (1994) (10.1021/j100096a001)

    Deriv               =              1
    GGA                 =           TRUE
    Meta                =          FALSE

    Exchange Hybrid     =           TRUE
    MP2 Hybrid          =          FALSE

   => Exchange Functionals <=

    0.0800   Slater exchange
    0.7200         Becke 88

   => Exact (HF) Exchange <=

    0.2000               HF 

   => Correlation Functionals <=

    0.1900   Vosko, Wilk & Nusair (VWN5_RPA)
    0.8100   Lee, Yang & Parr

   => LibXC Density Thresholds  <==

    XC_HYB_GGA_XC_B3LYP:  1.00E-15 

   => Molecular Quadrature <=

    Radial Scheme          =       TREUTLER
    Pruning Scheme         =           NONE
    Nuclear Scheme         =       TREUTLER

    Blocking Scheme        =         OCTREE
    BS radius alpha        =              1
    Pruning alpha          =              1
    Radial Points          =             75
    Spherical Points       =            302
    Total Points           =          42500
    Total Blocks           =            376
    Max Points             =            252
    Max Functions          =             28
    Weights Tolerance      =       1.00E-15

   => Loading Basis Set <=

    Name: (CC-PVDZ AUX)
    Role: JKFIT
    Keyword: DF_BASIS_SCF
    atoms 1 entry N          line   171 file /Users/joseantoniorodriguesromero/anaconda3/share/psi4/basis/cc-pvdz-jkfit.gbs 
    atoms 2 entry F          line   271 file /Users/joseantoniorodriguesromero/anaconda3/share/psi4/basis/cc-pvdz-jkfit.gbs 

   => Loading Basis Set <=

    Name: CC-PVDZ
    Role: ORBITAL
    Keyword: BASIS
    atoms 1 entry N          line   168 file /Users/joseantoniorodriguesromero/anaconda3/share/psi4/basis/cc-pvdz.gbs 
    atoms 2 entry F          line   228 file /Users/joseantoniorodriguesromero/anaconda3/share/psi4/basis/cc-pvdz.gbs 

  Reading orbitals from file /tmp/doublet_NF.default.74456.180.npy, no projection.

  ==> Integral Setup <==

  DFHelper Memory: AOs need 0.001 GiB; user supplied 0.332 GiB. 
  Using in-core AOs.

  ==> MemDFJK: Density-Fitted J/K Matrices <==

    J tasked:                   Yes
    K tasked:                   Yes
    wK tasked:                   No
    OpenMP threads:               1
    Memory [MiB]:               340
    Algorithm:                 Core
    Schwarz Cutoff:           1E-12
    Mask sparsity (%):       0.0000
    Fitting Condition:        1E-10

   => Auxiliary Basis Set <=

  Basis Set: (CC-PVDZ AUX)
    Blend: CC-PVDZ-JKFIT
    Number of shells: 48
    Number of basis functions: 140
    Number of Cartesian functions: 162
    Spherical Harmonics?: true
    Max angular momentum: 3

  Cached 100.0% of DFT collocation blocks in 0.034 [GiB].

  Minimum eigenvalue in the overlap matrix is 2.7460089378E-02.
  Reciprocal condition number of the overlap matrix is 9.6114335474E-03.
    Using symmetric orthogonalization.

  ==> Pre-Iterations <==

  SCF Guess: Orbitals guess was supplied from a previous computation.

   -------------------------------------------------------
    Irrep   Nso     Nmo     Nalpha   Nbeta   Ndocc  Nsocc
   -------------------------------------------------------
     A1        14      14       5       5       5       0
     A2         2       2       0       0       0       0
     B1         6       6       1       1       1       0
     B2         6       6       2       1       1       1
   -------------------------------------------------------
    Total      28      28       8       7       7       1
   -------------------------------------------------------

  ==> Iterations <==

                           Total Energy        Delta E     RMS |[F,P]|

   @DF-UKS iter   0:  -154.00270371629384   -1.54003e+02   9.46553e-04 
   @DF-UKS iter   1:  -153.99570333680498    7.00038e-03   4.52546e-04 DIIS/ADIIS
   @DF-UKS iter   2:  -153.99562128992102    8.20469e-05   1.05803e-03 DIIS/ADIIS/DAMP=1%
   @DF-UKS iter   3:  -153.99596708167667   -3.45792e-04   4.75833e-05 DIIS/DAMP=1%
   @DF-UKS iter   4:  -153.99572745597433    2.39626e-04   1.21600e-05 DIIS/DAMP=1%
   @DF-UKS iter   5:  -153.99572387109797    3.58488e-06   1.46086e-06 DIIS/DAMP=1%
   @DF-UKS iter   6:  -153.99572335542317    5.15675e-07   8.09000e-07 DIIS/DAMP=1%
   @DF-UKS iter   7:  -153.99572248941431    8.66009e-07   1.15963e-07 DIIS/DAMP=1%
   @DF-UKS iter   8:  -153.99572271054831   -2.21134e-07   3.88664e-08 DIIS/DAMP=1%
   @DF-UKS iter   9:  -153.99572270474451    5.80380e-09   3.59261e-09 DIIS/DAMP=1%
  Energy and wave function converged.


  ==> Post-Iterations <==

   Electrons on quadrature grid:
      Nalpha   =    7.9999996974 ; deviation = -3.026e-07
      Nbeta    =    6.9999997349 ; deviation = -2.651e-07
      Ntotal   =   14.9999994323 ; deviation = -5.677e-07 

   @Spin Contamination Metric:   3.121529213E-03
   @S^2 Expected:                7.500000000E-01
   @S^2 Observed:                7.531215292E-01
   @S   Expected:                5.000000000E-01
   @S   Observed:                5.000000000E-01

    Orbital Energies [Eh]
    ---------------------

    Alpha Occupied:                                                       

       1A1   -25.308309     2A1   -15.011915     3A1    -1.877675  
       4A1    -1.248860     1B2    -1.040807     1B1    -1.016476  
       5A1    -0.965158     2B2    -0.730384  

    Alpha Virtual:                                                        

       2B1    -0.601037     6A1    -0.213493     7A1     0.243082  
       3B2     0.273139     3B1     0.291274     8A1     0.399353  
       9A1     0.704886     4B2     0.738381     4B1     0.741736  
       1A2     1.210903    10A1     1.216898     5B2     1.284068  
       5B1     1.287923    11A1     1.714823    12A1     1.914293  
       2A2     3.016332    13A1     3.016958     6B1     3.375600  
       6B2     3.377660    14A1     3.788491  

    Beta Occupied:                                                        

       1A1   -25.302161     2A1   -14.990356     3A1    -1.860855  
       4A1    -1.213724     1B1    -1.011078     1B2    -0.981238  
       5A1    -0.930279  

    Beta Virtual:                                                         

       2B1    -0.577845     2B2    -0.522323     6A1    -0.189724  
       7A1     0.253876     3B1     0.303542     3B2     0.338699  
       8A1     0.424429     9A1     0.709420     4B1     0.742698  
       4B2     0.760848    10A1     1.279401     1A2     1.279903  
       5B1     1.295437     5B2     1.335009    11A1     1.722189  
      12A1     1.939777    13A1     3.033060     2A2     3.033111  
       6B1     3.377150     6B2     3.402440    14A1     3.798739  

    Final Occupation by Irrep:
             A1    A2    B1    B2 
    DOCC [     5,    0,    1,    1 ]
    SOCC [     0,    0,    0,    1 ]
    NA   [     5,    0,    1,    2 ]
    NB   [     5,    0,    1,    1 ]

  @DF-UKS Final Energy:  -153.99572270474451

   => Energetics <=

    Nuclear Repulsion Energy =             28.1016484163679436
    One-Electron Energy =                -260.9438122304514991
    Two-Electron Energy =                  92.4355845967237713
    DFT Exchange-Correlation Energy =     -13.5891434873847192
    Empirical Dispersion Energy =           0.0000000000000000
    VV10 Nonlocal Energy =                  0.0000000000000000
    Total Energy =                       -153.9957227047445087

  UHF NO Occupations:
  HONO-2 :    1 B1 1.9995277
  HONO-1 :    5 A1 1.9992947
  HONO-0 :    2 B2 1.0000000
  LUNO+0 :    6 A1 0.0007053
  LUNO+1 :    2 B1 0.0004723
  LUNO+2 :    3 B2 0.0003364
  LUNO+3 :    7 A1 0.0000367


Computation Completed


Properties will be evaluated at   0.000000,   0.000000,   0.000000 [a0]

Properties computed using the SCF density matrix


 Multipole Moments:

 ------------------------------------------------------------------------------------
     Multipole            Electronic (a.u.)      Nuclear  (a.u.)        Total (a.u.)
 ------------------------------------------------------------------------------------

 L = 1.  Multiply by 2.5417464519 to convert [e a0] to [Debye]
 Dipole X            :          0.0000000            0.0000000            0.0000000
 Dipole Y            :          0.0000000            0.0000000            0.0000000
 Dipole Z            :         -0.1123231            0.4728863            0.3605632
 Magnitude           :                                                    0.3605632

 ------------------------------------------------------------------------------------

*** tstop() called on Joses-MacBook-Pro-2.local at Thu Jul 17 13:51:44 2025
Module time:
	user time   =       2.05 seconds =       0.03 minutes
	system time =       5.32 seconds =       0.09 minutes
	total time  =          1 seconds =       0.02 minutes
Total time:
	user time   =       9.37 seconds =       0.16 minutes
	system time =      19.67 seconds =       0.33 minutes
	total time  =          3 seconds =       0.05 minutes

*** tstart() called on Joses-MacBook-Pro-2.local
*** at Thu Jul 17 13:51:44 2025


         ------------------------------------------------------------
                                   SCF GRAD                          
                          Rob Parrish, Justin Turney,                
                       Andy Simmonett, and Alex Sokolov              
         ------------------------------------------------------------

  ==> Geometry <==

    Molecular point group: c2v
    Full point group: C_inf_v

    Geometry (in Angstrom), charge = 1, multiplicity = 2:

       Center              X                  Y                   Z               Mass       
    ------------   -----------------  -----------------  -----------------  -----------------
         N            0.000000000000     0.000000000000     0.682957386046    14.003074004430
         F            0.000000000000     0.000000000000    -0.503384560100    18.998403162730

  Nuclear repulsion =   28.101648416367944

  ==> Basis Set <==

  Basis Set: CC-PVDZ
    Blend: CC-PVDZ
    Number of shells: 12
    Number of basis functions: 28
    Number of Cartesian functions: 30
    Spherical Harmonics?: true
    Max angular momentum: 2

  ==> DFJKGrad: Density-Fitted SCF Gradients <==

    Gradient:                    1
    J tasked:                  Yes
    K tasked:                  Yes
    wK tasked:                  No
    OpenMP threads:              1
    Integrals threads:           1
    Memory [MiB]:              375
    Schwarz Cutoff:          1E-12
    Fitting Condition:       1E-10

   => Auxiliary Basis Set <=

  Basis Set: (CC-PVDZ AUX)
    Blend: CC-PVDZ-JKFIT
    Number of shells: 48
    Number of basis functions: 140
    Number of Cartesian functions: 162
    Spherical Harmonics?: true
    Max angular momentum: 3

  ==> DFT Potential <==

   => LibXC <=

    Version 6.2.2
    S. Lehtola, C. Steigemann, M. J.T. Oliveira, and M. A.L. Marques.,  SoftwareX 7, 1–5 (2018) (10.1016/j.softx.2017.11.002)

   => Composite Functional: B3LYP <= 

    B3LYP Hyb-GGA Exchange-Correlation Functional

    P. J. Stephens, F. J. Devlin, C. F. Chabalowski, and M. J. Frisch.,  J. Phys. Chem. 98, 11623 (1994) (10.1021/j100096a001)

    Deriv               =              1
    GGA                 =           TRUE
    Meta                =          FALSE

    Exchange Hybrid     =           TRUE
    MP2 Hybrid          =          FALSE

   => Exchange Functionals <=

    0.0800   Slater exchange
    0.7200         Becke 88

   => Exact (HF) Exchange <=

    0.2000               HF 

   => Correlation Functionals <=

    0.1900   Vosko, Wilk & Nusair (VWN5_RPA)
    0.8100   Lee, Yang & Parr

   => LibXC Density Thresholds  <==

    XC_HYB_GGA_XC_B3LYP:  1.00E-15 

   => Molecular Quadrature <=

    Radial Scheme          =       TREUTLER
    Pruning Scheme         =           NONE
    Nuclear Scheme         =       TREUTLER

    Blocking Scheme        =         OCTREE
    BS radius alpha        =              1
    Pruning alpha          =              1
    Radial Points          =             75
    Spherical Points       =            302
    Total Points           =          42500
    Total Blocks           =            376
    Max Points             =            252
    Max Functions          =             28
    Weights Tolerance      =       1.00E-15


  -Total Gradient:
     Atom            X                  Y                   Z
    ------   -----------------  -----------------  -----------------
       1        0.000000000000     0.000000000000    -0.000301305219
       2        0.000000000000     0.000000000000     0.000308928088


*** tstop() called on Joses-MacBook-Pro-2.local at Thu Jul 17 13:51:44 2025
Module time:
	user time   =       0.50 seconds =       0.01 minutes
	system time =       1.36 seconds =       0.02 minutes
	total time  =          0 seconds =       0.00 minutes
Total time:
	user time   =       9.87 seconds =       0.16 minutes
	system time =      21.04 seconds =       0.35 minutes
	total time  =          3 seconds =       0.05 minutes

    			-----------------------------------------

    			 OPTKING 3.0: for geometry optimizations 

    			     By R.A. King, Bethel University     

    			        with contributions from          

    			    A.V. Copan, J. Cayton, A. Heide      

    			-----------------------------------------

    
	                            ===> Fragment 1 <== 

	 Z (Atomic Numbers)          Masses                          Geom                  
	       7.000000            14.003074          0.00000000  0.00000000  1.29060241   
	       9.000000            18.998403          0.00000000  0.00000000 -0.95125895   

	 - Coordinate -           - BOHR/RAD -       - ANG/DEG -
	 R(1,2)           =         2.241861           1.186342


	        --- Internal Coordinate Step in ANG or DEG, aJ/ANG or AJ/DEG ---
	-------------------------------------------------------------------------------
	           Coordinate      Previous         Force          Change          New 
	           ----------      --------        ------          ------        ------
	               R(1,2)       1.18634        0.00251        0.00022       1.18656
	-------------------------------------------------------------------------------

	                                 ==> Convergence Check <==                                  
    
	Measures of convergence in internal coordinates in au.
    
	Criteria marked as inactive (o), active & met (*), and active & unmet ( ).

	----------------------------------------------------------------------------------------------
	   Step    Total Energy     Delta E     Max Force     RMS Force      Max Disp      RMS Disp   
	----------------------------------------------------------------------------------------------
	  Convergence Criteria     1.00e-06 *    3.00e-04 *             o    1.20e-03 *             o
	----------------------------------------------------------------------------------------------
	     3    -153.99572270   -2.10e-05      3.05e-04      3.05e-04 o    4.09e-04 *    4.09e-04 o  ~
	----------------------------------------------------------------------------------------------

Next Geometry in Ang 
	Fragment 1 (Ang)

	    N   0.0000000000   0.0000000000   0.6830656010
	    F   0.0000000000   0.0000000000  -0.5034927750


    Structure for next step:
    Molecular point group: c2v
    Full point group: C_inf_v

    Geometry (in Angstrom), charge = 1, multiplicity = 2:

    N            0.000000000000     0.000000000000     0.683081981115
    F            0.000000000000     0.000000000000    -0.503476394869


Scratch directory: /tmp/
gradient() will perform analytic gradient computation.
   => Libint2 <=

    Primary   basis highest AM E, G, H:  6, 6, 3
    Auxiliary basis highest AM E, G, H:  7, 7, 4
    Onebody   basis highest AM E, G, H:  -, -, -
    Solid Harmonics ordering:            Gaussian

*** tstart() called on Joses-MacBook-Pro-2.local
*** at Thu Jul 17 13:51:44 2025

   => Loading Basis Set <=

    Name: CC-PVDZ
    Role: ORBITAL
    Keyword: BASIS
    atoms 1 entry N          line   168 file /Users/joseantoniorodriguesromero/anaconda3/share/psi4/basis/cc-pvdz.gbs 
    atoms 2 entry F          line   228 file /Users/joseantoniorodriguesromero/anaconda3/share/psi4/basis/cc-pvdz.gbs 


         ---------------------------------------------------------
                                   SCF
               by Justin Turney, Rob Parrish, Andy Simmonett
                          and Daniel G. A. Smith
                              UKS Reference
                        1 Threads,    500 MiB Core
         ---------------------------------------------------------

  ==> Geometry <==

    Molecular point group: c2v
    Full point group: C_inf_v

    Geometry (in Angstrom), charge = 1, multiplicity = 2:

       Center              X                  Y                   Z               Mass       
    ------------   -----------------  -----------------  -----------------  -----------------
         N            0.000000000000     0.000000000000     0.683081981115    14.003074004430
         F            0.000000000000     0.000000000000    -0.503476394869    18.998403162730

  Running in c2v symmetry.

  Rotational constants: A = ************  B =      1.48529  C =      1.48529 [cm^-1]
  Rotational constants: A = ************  B =  44527.86544  C =  44527.86544 [MHz]
  Nuclear repulsion =   28.096522638045602

  Charge       = 1
  Multiplicity = 2
  Electrons    = 15
  Nalpha       = 8
  Nbeta        = 7

  ==> Algorithm <==

  SCF Algorithm Type is DF.
  DIIS enabled.
  MOM disabled.
  Fractional occupation disabled.
  Guess Type is READ.
  Energy threshold   = 1.00e-08
  Density threshold  = 1.00e-08
  Integral threshold = 1.00e-12

  ==> Primary Basis <==

  Basis Set: CC-PVDZ
    Blend: CC-PVDZ
    Number of shells: 12
    Number of basis functions: 28
    Number of Cartesian functions: 30
    Spherical Harmonics?: true
    Max angular momentum: 2

  ==> DFT Potential <==

   => LibXC <=

    Version 6.2.2
    S. Lehtola, C. Steigemann, M. J.T. Oliveira, and M. A.L. Marques.,  SoftwareX 7, 1–5 (2018) (10.1016/j.softx.2017.11.002)

   => Composite Functional: B3LYP <= 

    B3LYP Hyb-GGA Exchange-Correlation Functional

    P. J. Stephens, F. J. Devlin, C. F. Chabalowski, and M. J. Frisch.,  J. Phys. Chem. 98, 11623 (1994) (10.1021/j100096a001)

    Deriv               =              1
    GGA                 =           TRUE
    Meta                =          FALSE

    Exchange Hybrid     =           TRUE
    MP2 Hybrid          =          FALSE

   => Exchange Functionals <=

    0.0800   Slater exchange
    0.7200         Becke 88

   => Exact (HF) Exchange <=

    0.2000               HF 

   => Correlation Functionals <=

    0.1900   Vosko, Wilk & Nusair (VWN5_RPA)
    0.8100   Lee, Yang & Parr

   => LibXC Density Thresholds  <==

    XC_HYB_GGA_XC_B3LYP:  1.00E-15 

   => Molecular Quadrature <=

    Radial Scheme          =       TREUTLER
    Pruning Scheme         =           NONE
    Nuclear Scheme         =       TREUTLER

    Blocking Scheme        =         OCTREE
    BS radius alpha        =              1
    Pruning alpha          =              1
    Radial Points          =             75
    Spherical Points       =            302
    Total Points           =          42500
    Total Blocks           =            376
    Max Points             =            252
    Max Functions          =             28
    Weights Tolerance      =       1.00E-15

   => Loading Basis Set <=

    Name: (CC-PVDZ AUX)
    Role: JKFIT
    Keyword: DF_BASIS_SCF
    atoms 1 entry N          line   171 file /Users/joseantoniorodriguesromero/anaconda3/share/psi4/basis/cc-pvdz-jkfit.gbs 
    atoms 2 entry F          line   271 file /Users/joseantoniorodriguesromero/anaconda3/share/psi4/basis/cc-pvdz-jkfit.gbs 

   => Loading Basis Set <=

    Name: CC-PVDZ
    Role: ORBITAL
    Keyword: BASIS
    atoms 1 entry N          line   168 file /Users/joseantoniorodriguesromero/anaconda3/share/psi4/basis/cc-pvdz.gbs 
    atoms 2 entry F          line   228 file /Users/joseantoniorodriguesromero/anaconda3/share/psi4/basis/cc-pvdz.gbs 

  Reading orbitals from file /tmp/doublet_NF.default.74456.180.npy, no projection.

  ==> Integral Setup <==

  DFHelper Memory: AOs need 0.001 GiB; user supplied 0.332 GiB. 
  Using in-core AOs.

  ==> MemDFJK: Density-Fitted J/K Matrices <==

    J tasked:                   Yes
    K tasked:                   Yes
    wK tasked:                   No
    OpenMP threads:               1
    Memory [MiB]:               340
    Algorithm:                 Core
    Schwarz Cutoff:           1E-12
    Mask sparsity (%):       0.0000
    Fitting Condition:        1E-10

   => Auxiliary Basis Set <=

  Basis Set: (CC-PVDZ AUX)
    Blend: CC-PVDZ-JKFIT
    Number of shells: 48
    Number of basis functions: 140
    Number of Cartesian functions: 162
    Spherical Harmonics?: true
    Max angular momentum: 3

  Cached 100.0% of DFT collocation blocks in 0.034 [GiB].

  Minimum eigenvalue in the overlap matrix is 2.7470902590E-02.
  Reciprocal condition number of the overlap matrix is 9.6159231077E-03.
    Using symmetric orthogonalization.

  ==> Pre-Iterations <==

  SCF Guess: Orbitals guess was supplied from a previous computation.

   -------------------------------------------------------
    Irrep   Nso     Nmo     Nalpha   Nbeta   Ndocc  Nsocc
   -------------------------------------------------------
     A1        14      14       5       5       5       0
     A2         2       2       0       0       0       0
     B1         6       6       1       1       1       0
     B2         6       6       2       1       1       1
   -------------------------------------------------------
    Total      28      28       8       7       7       1
   -------------------------------------------------------

  ==> Iterations <==

                           Total Energy        Delta E     RMS |[F,P]|

   @DF-UKS iter   0:  -153.99535218644283   -1.53995e+02   5.02091e-05 
   @DF-UKS iter   1:  -153.99572269969380   -3.70513e-04   2.40323e-05 DIIS
   @DF-UKS iter   2:  -153.99572246553464    2.34159e-07   5.64811e-05 DIIS/DAMP=1%
   @DF-UKS iter   3:  -153.99570979781970    1.26677e-05   2.36970e-06 DIIS/DAMP=1%
   @DF-UKS iter   4:  -153.99572240775905   -1.26099e-05   6.50395e-07 DIIS/DAMP=1%
   @DF-UKS iter   5:  -153.99572269030350   -2.82544e-07   7.95817e-08 DIIS/DAMP=1%
   @DF-UKS iter   6:  -153.99572271827276   -2.79693e-08   4.44078e-08 DIIS/DAMP=1%
   @DF-UKS iter   7:  -153.99572276576478   -4.74920e-08   6.45008e-09 DIIS/DAMP=1%
   @DF-UKS iter   8:  -153.99572275352503    1.22398e-08   2.15977e-09 DIIS/DAMP=1%
   @DF-UKS iter   9:  -153.99572275385992   -3.34893e-10   2.16930e-10 DIIS/DAMP=1%
  Energy and wave function converged.


  ==> Post-Iterations <==

   Electrons on quadrature grid:
      Nalpha   =    7.9999996978 ; deviation = -3.022e-07
      Nbeta    =    6.9999997351 ; deviation = -2.649e-07
      Ntotal   =   14.9999994329 ; deviation = -5.671e-07 

   @Spin Contamination Metric:   3.123686163E-03
   @S^2 Expected:                7.500000000E-01
   @S^2 Observed:                7.531236862E-01
   @S   Expected:                5.000000000E-01
   @S   Observed:                5.000000000E-01

    Orbital Energies [Eh]
    ---------------------

    Alpha Occupied:                                                       

       1A1   -25.308244     2A1   -15.011960     3A1    -1.877470  
       4A1    -1.248842     1B2    -1.040686     1B1    -1.016352  
       5A1    -0.965154     2B2    -0.730447  

    Alpha Virtual:                                                        

       2B1    -0.601102     6A1    -0.213766     7A1     0.243070  
       3B2     0.273142     3B1     0.291279     8A1     0.399344  
       9A1     0.704995     4B2     0.738388     4B1     0.741744  
       1A2     1.210914    10A1     1.216910     5B2     1.284032  
       5B1     1.287890    11A1     1.714679    12A1     1.914050  
       2A2     3.016386    13A1     3.017013     6B1     3.375367  
       6B2     3.377428    14A1     3.788280  

    Beta Occupied:                                                        

       1A1   -25.302099     2A1   -14.990400     3A1    -1.860654  
       4A1    -1.213690     1B1    -1.010959     1B2    -0.981125  
       5A1    -0.930288  

    Beta Virtual:                                                         

       2B1    -0.577907     2B2    -0.522382     6A1    -0.189992  
       7A1     0.253857     3B1     0.303549     3B2     0.338709  
       8A1     0.424423     9A1     0.709527     4B1     0.742703  
       4B2     0.760852    10A1     1.279421     1A2     1.279924  
       5B1     1.295406     5B2     1.334977    11A1     1.722051  
      12A1     1.939527    13A1     3.033106     2A2     3.033157  
       6B1     3.376913     6B2     3.402198    14A1     3.798523  

    Final Occupation by Irrep:
             A1    A2    B1    B2 
    DOCC [     5,    0,    1,    1 ]
    SOCC [     0,    0,    0,    1 ]
    NA   [     5,    0,    1,    2 ]
    NB   [     5,    0,    1,    1 ]

  @DF-UKS Final Energy:  -153.99572275385992

   => Energetics <=

    Nuclear Repulsion Energy =             28.0965226380456023
    One-Electron Energy =                -260.9345567822795147
    Two-Electron Energy =                  92.4313165897735161
    DFT Exchange-Correlation Energy =     -13.5890051993995122
    Empirical Dispersion Energy =           0.0000000000000000
    VV10 Nonlocal Energy =                  0.0000000000000000
    Total Energy =                       -153.9957227538598943

  UHF NO Occupations:
  HONO-2 :    1 B1 1.9995268
  HONO-1 :    5 A1 1.9992945
  HONO-0 :    2 B2 1.0000000
  LUNO+0 :    6 A1 0.0007055
  LUNO+1 :    2 B1 0.0004732
  LUNO+2 :    3 B2 0.0003364
  LUNO+3 :    7 A1 0.0000368


Computation Completed


Properties will be evaluated at   0.000000,   0.000000,   0.000000 [a0]

Properties computed using the SCF density matrix


 Multipole Moments:

 ------------------------------------------------------------------------------------
     Multipole            Electronic (a.u.)      Nuclear  (a.u.)        Total (a.u.)
 ------------------------------------------------------------------------------------

 L = 1.  Multiply by 2.5417464519 to convert [e a0] to [Debye]
 Dipole X            :          0.0000000            0.0000000            0.0000000
 Dipole Y            :          0.0000000            0.0000000            0.0000000
 Dipole Z            :         -0.1119648            0.4729726            0.3610078
 Magnitude           :                                                    0.3610078

 ------------------------------------------------------------------------------------

*** tstop() called on Joses-MacBook-Pro-2.local at Thu Jul 17 13:51:45 2025
Module time:
	user time   =       2.03 seconds =       0.03 minutes
	system time =       5.29 seconds =       0.09 minutes
	total time  =          1 seconds =       0.02 minutes
Total time:
	user time   =      11.98 seconds =       0.20 minutes
	system time =      26.59 seconds =       0.44 minutes
	total time  =          4 seconds =       0.07 minutes

*** tstart() called on Joses-MacBook-Pro-2.local
*** at Thu Jul 17 13:51:45 2025


         ------------------------------------------------------------
                                   SCF GRAD                          
                          Rob Parrish, Justin Turney,                
                       Andy Simmonett, and Alex Sokolov              
         ------------------------------------------------------------

  ==> Geometry <==

    Molecular point group: c2v
    Full point group: C_inf_v

    Geometry (in Angstrom), charge = 1, multiplicity = 2:

       Center              X                  Y                   Z               Mass       
    ------------   -----------------  -----------------  -----------------  -----------------
         N            0.000000000000     0.000000000000     0.683081981115    14.003074004430
         F            0.000000000000     0.000000000000    -0.503476394869    18.998403162730

  Nuclear repulsion =   28.096522638045602

  ==> Basis Set <==

  Basis Set: CC-PVDZ
    Blend: CC-PVDZ
    Number of shells: 12
    Number of basis functions: 28
    Number of Cartesian functions: 30
    Spherical Harmonics?: true
    Max angular momentum: 2

  ==> DFJKGrad: Density-Fitted SCF Gradients <==

    Gradient:                    1
    J tasked:                  Yes
    K tasked:                  Yes
    wK tasked:                  No
    OpenMP threads:              1
    Integrals threads:           1
    Memory [MiB]:              375
    Schwarz Cutoff:          1E-12
    Fitting Condition:       1E-10

   => Auxiliary Basis Set <=

  Basis Set: (CC-PVDZ AUX)
    Blend: CC-PVDZ-JKFIT
    Number of shells: 48
    Number of basis functions: 140
    Number of Cartesian functions: 162
    Spherical Harmonics?: true
    Max angular momentum: 3

  ==> DFT Potential <==

   => LibXC <=

    Version 6.2.2
    S. Lehtola, C. Steigemann, M. J.T. Oliveira, and M. A.L. Marques.,  SoftwareX 7, 1–5 (2018) (10.1016/j.softx.2017.11.002)

   => Composite Functional: B3LYP <= 

    B3LYP Hyb-GGA Exchange-Correlation Functional

    P. J. Stephens, F. J. Devlin, C. F. Chabalowski, and M. J. Frisch.,  J. Phys. Chem. 98, 11623 (1994) (10.1021/j100096a001)

    Deriv               =              1
    GGA                 =           TRUE
    Meta                =          FALSE

    Exchange Hybrid     =           TRUE
    MP2 Hybrid          =          FALSE

   => Exchange Functionals <=

    0.0800   Slater exchange
    0.7200         Becke 88

   => Exact (HF) Exchange <=

    0.2000               HF 

   => Correlation Functionals <=

    0.1900   Vosko, Wilk & Nusair (VWN5_RPA)
    0.8100   Lee, Yang & Parr

   => LibXC Density Thresholds  <==

    XC_HYB_GGA_XC_B3LYP:  1.00E-15 

   => Molecular Quadrature <=

    Radial Scheme          =       TREUTLER
    Pruning Scheme         =           NONE
    Nuclear Scheme         =       TREUTLER

    Blocking Scheme        =         OCTREE
    BS radius alpha        =              1
    Pruning alpha          =              1
    Radial Points          =             75
    Spherical Points       =            302
    Total Points           =          42500
    Total Blocks           =            376
    Max Points             =            252
    Max Functions          =             28
    Weights Tolerance      =       1.00E-15


  -Total Gradient:
     Atom            X                  Y                   Z
    ------   -----------------  -----------------  -----------------
       1        0.000000000000     0.000000000000     0.000019851626
       2        0.000000000000     0.000000000000    -0.000012200915


*** tstop() called on Joses-MacBook-Pro-2.local at Thu Jul 17 13:51:45 2025
Module time:
	user time   =       0.53 seconds =       0.01 minutes
	system time =       1.42 seconds =       0.02 minutes
	total time  =          0 seconds =       0.00 minutes
Total time:
	user time   =      12.51 seconds =       0.21 minutes
	system time =      28.03 seconds =       0.47 minutes
	total time  =          4 seconds =       0.07 minutes

    			-----------------------------------------

    			 OPTKING 3.0: for geometry optimizations 

    			     By R.A. King, Bethel University     

    			        with contributions from          

    			    A.V. Copan, J. Cayton, A. Heide      

    			-----------------------------------------

    
	                            ===> Fragment 1 <== 

	 Z (Atomic Numbers)          Masses                          Geom                  
	       7.000000            14.003074          0.00000000  0.00000000  1.29083787   
	       9.000000            18.998403          0.00000000  0.00000000 -0.95143250   

	 - Coordinate -           - BOHR/RAD -       - ANG/DEG -
	 R(1,2)           =         2.242270           1.186558


	        --- Internal Coordinate Step in ANG or DEG, aJ/ANG or AJ/DEG ---
	-------------------------------------------------------------------------------
	           Coordinate      Previous         Force          Change          New 
	           ----------      --------        ------          ------        ------
	               R(1,2)       1.18656       -0.00013       -0.00001       1.18655
	-------------------------------------------------------------------------------

	                                 ==> Convergence Check <==                                  
    
	Measures of convergence in internal coordinates in au.
    
	Criteria marked as inactive (o), active & met (*), and active & unmet ( ).

	----------------------------------------------------------------------------------------------
	   Step    Total Energy     Delta E     Max Force     RMS Force      Max Disp      RMS Disp   
	----------------------------------------------------------------------------------------------
	  Convergence Criteria     1.00e-06 *    3.00e-04 *             o    1.20e-03 *             o
	----------------------------------------------------------------------------------------------
	     4    -153.99572275   -4.91e-08 *    1.60e-05 *    1.60e-05 o    2.15e-05 *    2.15e-05 o  ~
	----------------------------------------------------------------------------------------------

Next Geometry in Ang 
	Fragment 1 (Ang)

	    N   0.0000000000   0.0000000000   0.6830762923
	    F   0.0000000000   0.0000000000  -0.5034707061


    Final optimized geometry and variables:
    Molecular point group: c2v
    Full point group: C_inf_v

    Geometry (in Angstrom), charge = 1, multiplicity = 2:

    N            0.000000000000     0.000000000000     0.683081981115
    F            0.000000000000     0.000000000000    -0.503476394869


    Psi4 stopped on: Thursday, 17 July 2025 01:51PM
    Psi4 wall time for execution: 0:00:04.99

*** Psi4 exiting successfully. Buy a developer a beer!
