
    -----------------------------------------------------------------------
          Psi4: An Open-Source Ab Initio Electronic Structure Package
                               Psi4 1.9.1 release

                         Git: Rev {} zzzzzzz 


    D. G. A. Smith, L. A. Burns, A. C. Simmonett, R. M. Parrish,
    M. C. Schieber, R. Galvelis, P. Kraus, H. Kruse, R. Di Remigio,
    A. Alenaizan, A. M. James, S. Lehtola, J. P. Misiewicz, M. Scheurer,
    R. A. Shaw, J. B. Schriber, Y. Xie, Z. L. Glick, D. A. Sirianni,
    J. S. O'Brien, J. M. Waldrop, A. Kumar, E. G. Hohenstein,
    B. P. Pritchard, B. R. Brooks, H. F. Schaefer III, A. Yu. Sokolov,
    K. Patkowski, A. E. DePrince III, U. Bozkaya, R. A. King,
    F. A. Evangelista, J. M. Turney, T. D. Crawford, C. D. Sherrill,
    J. Chem. Phys. 152(18) 184108 (2020). https://doi.org/10.1063/5.0006002

                            Additional Code Authors
    E. T. Seidl, C. L. Janssen, E. F. Valeev, M. L. Leininger,
    J. F. Gonthier, R. M. Richard, H. R. McAlexander, M. Saitow, X. Wang,
    P. Verma, M. H. Lechner, A. Jiang, S. Behnle, A. G. Heide,
    M. F. Herbst, and D. L. Poole

             Previous Authors, Complete List of Code Contributors,
                       and Citations for Specific Modules
    https://github.com/psi4/psi4/blob/master/codemeta.json
    https://github.com/psi4/psi4/graphs/contributors
    http://psicode.org/psi4manual/master/introduction.html#citing-psifour

    -----------------------------------------------------------------------


    Psi4 started on: Thursday, 17 July 2025 12:26PM

    Process ID: 73750
    Host:       Joses-MacBook-Pro-2.local
    PSIDATADIR: /Users/joseantoniorodriguesromero/anaconda3/share/psi4
    Memory:     500.0 MiB
    Threads:    1
    
  ==> Input File <==

--------------------------------------------------------------------------
molecule { 
1 4
He   0.00000        0.60000        0.00000
C   0.00000       -0.60000        0.00000
}

set { 
basis              cc-pvdz
reference          uks
maxiter            500
geom_maxiter       500
DAMPING_PERCENTAGE 1
guess              SAP
}

optimize('b3lyp')
--------------------------------------------------------------------------

Scratch directory: /tmp/
gradient() will perform analytic gradient computation.
   => Libint2 <=

    Primary   basis highest AM E, G, H:  6, 6, 3
    Auxiliary basis highest AM E, G, H:  7, 7, 4
    Onebody   basis highest AM E, G, H:  -, -, -
    Solid Harmonics ordering:            Gaussian

*** tstart() called on Joses-MacBook-Pro-2.local
*** at Thu Jul 17 12:26:51 2025

   => Loading Basis Set <=

    Name: CC-PVDZ
    Role: ORBITAL
    Keyword: BASIS
    atoms 1 entry HE         line    32 file /Users/joseantoniorodriguesromero/anaconda3/share/psi4/basis/cc-pvdz.gbs 
    atoms 2 entry C          line   138 file /Users/joseantoniorodriguesromero/anaconda3/share/psi4/basis/cc-pvdz.gbs 


         ---------------------------------------------------------
                                   SCF
               by Justin Turney, Rob Parrish, Andy Simmonett
                          and Daniel G. A. Smith
                              UKS Reference
                        1 Threads,    500 MiB Core
         ---------------------------------------------------------

  ==> Geometry <==

    Molecular point group: c2v
    Full point group: C_inf_v

    Geometry (in Angstrom), charge = 1, multiplicity = 4:

       Center              X                  Y                   Z               Mass       
    ------------   -----------------  -----------------  -----------------  -----------------
         HE           0.000000000000     0.000000000000     0.899853590776     4.002603254130
         C            0.000000000000     0.000000000000    -0.300146409224    12.000000000000

  Running in c2v symmetry.

  Rotational constants: A = ************  B =      3.90033  C =      3.90033 [cm^-1]
  Rotational constants: A = ************  B = 116928.81682  C = 116928.81682 [MHz]
  Nuclear repulsion =    5.291772106700001

  Charge       = 1
  Multiplicity = 4
  Electrons    = 7
  Nalpha       = 5
  Nbeta        = 2

  ==> Algorithm <==

  SCF Algorithm Type is DF.
  DIIS enabled.
  MOM disabled.
  Fractional occupation disabled.
  Guess Type is SAP.
  Energy threshold   = 1.00e-08
  Density threshold  = 1.00e-08
  Integral threshold = 1.00e-12

  ==> Primary Basis <==

  Basis Set: CC-PVDZ
    Blend: CC-PVDZ
    Number of shells: 9
    Number of basis functions: 19
    Number of Cartesian functions: 20
    Spherical Harmonics?: true
    Max angular momentum: 2

  ==> DFT Potential <==

   => LibXC <=

    Version 6.2.2
    S. Lehtola, C. Steigemann, M. J.T. Oliveira, and M. A.L. Marques.,  SoftwareX 7, 1–5 (2018) (10.1016/j.softx.2017.11.002)

   => Composite Functional: B3LYP <= 

    B3LYP Hyb-GGA Exchange-Correlation Functional

    P. J. Stephens, F. J. Devlin, C. F. Chabalowski, and M. J. Frisch.,  J. Phys. Chem. 98, 11623 (1994) (10.1021/j100096a001)

    Deriv               =              1
    GGA                 =           TRUE
    Meta                =          FALSE

    Exchange Hybrid     =           TRUE
    MP2 Hybrid          =          FALSE

   => Exchange Functionals <=

    0.0800   Slater exchange
    0.7200         Becke 88

   => Exact (HF) Exchange <=

    0.2000               HF 

   => Correlation Functionals <=

    0.1900   Vosko, Wilk & Nusair (VWN5_RPA)
    0.8100   Lee, Yang & Parr

   => LibXC Density Thresholds  <==

    XC_HYB_GGA_XC_B3LYP:  1.00E-15 

   => Molecular Quadrature <=

    Radial Scheme          =       TREUTLER
    Pruning Scheme         =           NONE
    Nuclear Scheme         =       TREUTLER

    Blocking Scheme        =         OCTREE
    BS radius alpha        =              1
    Pruning alpha          =              1
    Radial Points          =             75
    Spherical Points       =            302
    Total Points           =          43489
    Total Blocks           =            384
    Max Points             =            256
    Max Functions          =             19
    Weights Tolerance      =       1.00E-15

   => Loading Basis Set <=

    Name: (CC-PVDZ AUX)
    Role: JKFIT
    Keyword: DF_BASIS_SCF
    atoms 1 entry HE         line    34 file /Users/joseantoniorodriguesromero/anaconda3/share/psi4/basis/def2-universal-jkfit.gbs 
    atoms 2 entry C          line   121 file /Users/joseantoniorodriguesromero/anaconda3/share/psi4/basis/cc-pvdz-jkfit.gbs 

  ==> Integral Setup <==

  DFHelper Memory: AOs need 0.000 GiB; user supplied 0.342 GiB. 
  Using in-core AOs.

  ==> MemDFJK: Density-Fitted J/K Matrices <==

    J tasked:                   Yes
    K tasked:                   Yes
    wK tasked:                   No
    OpenMP threads:               1
    Memory [MiB]:               350
    Algorithm:                 Core
    Schwarz Cutoff:           1E-12
    Mask sparsity (%):       0.0000
    Fitting Condition:        1E-10

   => Auxiliary Basis Set <=

  Basis Set: (CC-PVDZ AUX)
    Blend: CC-PVDZ-JKFIT + DEF2-UNIVERSAL-JKFIT
    Number of shells: 33
    Number of basis functions: 93
    Number of Cartesian functions: 106
    Spherical Harmonics?: true
    Max angular momentum: 3

  Cached 100.0% of DFT collocation blocks in 0.024 [GiB].

  Minimum eigenvalue in the overlap matrix is 6.2022641856E-02.
  Reciprocal condition number of the overlap matrix is 2.2514953967E-02.
    Using symmetric orthogonalization.

  ==> Pre-Iterations <==

  SCF Guess: Superposition of Atomic Potentials (doi:10.1021/acs.jctc.8b01089).

  ==> SAP guess <==

   => Molecular Quadrature <=

    Radial Scheme          =       TREUTLER
    Pruning Scheme         =           NONE
    Nuclear Scheme         =       TREUTLER

    Blocking Scheme        =         OCTREE
    BS radius alpha        =              1
    Pruning alpha          =              1
    Radial Points          =             75
    Spherical Points       =            302
    Total Points           =          43489
    Total Blocks           =            384
    Max Points             =            256
    Max Functions          =             19
    Weights Tolerance      =       1.00E-15

   -------------------------------------------------------
    Irrep   Nso     Nmo     Nalpha   Nbeta   Ndocc  Nsocc
   -------------------------------------------------------
     A1        10      10       3       2       2       1
     A2         1       1       0       0       0       0
     B1         4       4       1       0       0       1
     B2         4       4       1       0       0       1
   -------------------------------------------------------
    Total      19      19       5       2       2       3
   -------------------------------------------------------

  ==> Iterations <==

                           Total Energy        Delta E     RMS |[F,P]|

   @DF-UKS iter   1:   -40.15435204694192   -4.01544e+01   2.05856e-02 DIIS/ADIIS
   @DF-UKS iter   2:   -40.19271606809143   -3.83640e-02   4.69764e-03 DIIS/ADIIS/DAMP=1%
   @DF-UKS iter   3:   -40.19418519398411   -1.46913e-03   6.82077e-04 DIIS/ADIIS/DAMP=1%
   @DF-UKS iter   4:   -40.19403571177526    1.49482e-04   2.93641e-04 DIIS/ADIIS/DAMP=1%
   @DF-UKS iter   5:   -40.19396518059898    7.05312e-05   5.61837e-05 DIIS/DAMP=1%
   @DF-UKS iter   6:   -40.19399884238891   -3.36618e-05   1.12573e-05 DIIS/DAMP=1%
   @DF-UKS iter   7:   -40.19399189582498    6.94656e-06   4.07674e-07 DIIS/DAMP=1%
   @DF-UKS iter   8:   -40.19399308023306   -1.18441e-06   6.80551e-08 DIIS/DAMP=1%
   @DF-UKS iter   9:   -40.19399307161640    8.61666e-09   3.01231e-09 DIIS/DAMP=1%
  Energy and wave function converged.


  ==> Post-Iterations <==

   Electrons on quadrature grid:
      Nalpha   =    5.0000002408 ; deviation = 2.408e-07
      Nbeta    =    2.0000002115 ; deviation = 2.115e-07
      Ntotal   =    7.0000004523 ; deviation = 4.523e-07 

   @Spin Contamination Metric:   6.287326905E-04
   @S^2 Expected:                3.750000000E+00
   @S^2 Observed:                3.750628733E+00
   @S   Expected:                1.500000000E+00
   @S   Observed:                1.500000000E+00

    Orbital Energies [Eh]
    ---------------------

    Alpha Occupied:                                                       

       1A1   -10.789538     2A1    -1.370296     3A1    -0.928906  
       1B1    -0.694040     1B2    -0.694040  

    Alpha Virtual:                                                        

       4A1    -0.402156     5A1     0.096267     2B2     0.102962  
       2B1     0.102962     6A1     0.196434     3B1     0.621175  
       3B2     0.621175     7A1     0.699102     1A2     0.699102  
       8A1     0.770413     9A1     1.087321     4B1     1.908018  
       4B2     1.908018    10A1     2.568812  

    Beta Occupied:                                                        

       1A1   -10.728872     2A1    -1.325614  

    Beta Virtual:                                                         

       3A1    -0.622793     1B1    -0.404536     1B2    -0.404536  
       4A1    -0.293112     5A1     0.125109     2B2     0.207445  
       2B1     0.207445     6A1     0.300302     3B1     0.748502  
       3B2     0.748502     7A1     0.810908     8A1     0.890045  
       1A2     0.890045     9A1     1.185446     4B1     1.945520  
       4B2     1.945520    10A1     2.606015  

    Final Occupation by Irrep:
             A1    A2    B1    B2 
    DOCC [     2,    0,    0,    0 ]
    SOCC [     1,    0,    1,    1 ]
    NA   [     3,    0,    1,    1 ]
    NB   [     2,    0,    0,    0 ]

  @DF-UKS Final Energy:   -40.19399307161640

   => Energetics <=

    Nuclear Repulsion Energy =              5.2917721067000008
    One-Electron Energy =                 -60.9185869076904112
    Two-Electron Energy =                  20.3189173229746984
    DFT Exchange-Correlation Energy =      -4.8860955936006887
    Empirical Dispersion Energy =           0.0000000000000000
    VV10 Nonlocal Energy =                  0.0000000000000000
    Total Energy =                        -40.1939930716163971

  UHF NO Occupations:
  HONO-2 :    1 B1 1.0000000
  HONO-1 :    1 B2 1.0000000
  HONO-0 :    3 A1 1.0000000
  LUNO+0 :    4 A1 0.0003140
  LUNO+1 :    5 A1 0.0000005
  LUNO+2 :    6 A1 0.0000000
  LUNO+3 :    2 B1 0.0000000


Computation Completed


Properties will be evaluated at   0.000000,   0.000000,   0.000000 [a0]

Properties computed using the SCF density matrix


 Multipole Moments:

 ------------------------------------------------------------------------------------
     Multipole            Electronic (a.u.)      Nuclear  (a.u.)        Total (a.u.)
 ------------------------------------------------------------------------------------

 L = 1.  Multiply by 2.5417464519 to convert [e a0] to [Debye]
 Dipole X            :          0.0000000            0.0000000            0.0000000
 Dipole Y            :          0.0000000            0.0000000            0.0000000
 Dipole Z            :          0.2478609           -0.0022134            0.2456475
 Magnitude           :                                                    0.2456475

 ------------------------------------------------------------------------------------

*** tstop() called on Joses-MacBook-Pro-2.local at Thu Jul 17 12:26:52 2025
Module time:
	user time   =       1.04 seconds =       0.02 minutes
	system time =       2.39 seconds =       0.04 minutes
	total time  =          1 seconds =       0.02 minutes
Total time:
	user time   =       1.04 seconds =       0.02 minutes
	system time =       2.39 seconds =       0.04 minutes
	total time  =          1 seconds =       0.02 minutes

*** tstart() called on Joses-MacBook-Pro-2.local
*** at Thu Jul 17 12:26:52 2025


         ------------------------------------------------------------
                                   SCF GRAD                          
                          Rob Parrish, Justin Turney,                
                       Andy Simmonett, and Alex Sokolov              
         ------------------------------------------------------------

  ==> Geometry <==

    Molecular point group: c2v
    Full point group: C_inf_v

    Geometry (in Angstrom), charge = 1, multiplicity = 4:

       Center              X                  Y                   Z               Mass       
    ------------   -----------------  -----------------  -----------------  -----------------
         HE           0.000000000000     0.000000000000     0.899853590776     4.002603254130
         C            0.000000000000     0.000000000000    -0.300146409224    12.000000000000

  Nuclear repulsion =    5.291772106700001

  ==> Basis Set <==

  Basis Set: CC-PVDZ
    Blend: CC-PVDZ
    Number of shells: 9
    Number of basis functions: 19
    Number of Cartesian functions: 20
    Spherical Harmonics?: true
    Max angular momentum: 2

  ==> DFJKGrad: Density-Fitted SCF Gradients <==

    Gradient:                    1
    J tasked:                  Yes
    K tasked:                  Yes
    wK tasked:                  No
    OpenMP threads:              1
    Integrals threads:           1
    Memory [MiB]:              375
    Schwarz Cutoff:          1E-12
    Fitting Condition:       1E-10

   => Auxiliary Basis Set <=

  Basis Set: (CC-PVDZ AUX)
    Blend: CC-PVDZ-JKFIT + DEF2-UNIVERSAL-JKFIT
    Number of shells: 33
    Number of basis functions: 93
    Number of Cartesian functions: 106
    Spherical Harmonics?: true
    Max angular momentum: 3

  ==> DFT Potential <==

   => LibXC <=

    Version 6.2.2
    S. Lehtola, C. Steigemann, M. J.T. Oliveira, and M. A.L. Marques.,  SoftwareX 7, 1–5 (2018) (10.1016/j.softx.2017.11.002)

   => Composite Functional: B3LYP <= 

    B3LYP Hyb-GGA Exchange-Correlation Functional

    P. J. Stephens, F. J. Devlin, C. F. Chabalowski, and M. J. Frisch.,  J. Phys. Chem. 98, 11623 (1994) (10.1021/j100096a001)

    Deriv               =              1
    GGA                 =           TRUE
    Meta                =          FALSE

    Exchange Hybrid     =           TRUE
    MP2 Hybrid          =          FALSE

   => Exchange Functionals <=

    0.0800   Slater exchange
    0.7200         Becke 88

   => Exact (HF) Exchange <=

    0.2000               HF 

   => Correlation Functionals <=

    0.1900   Vosko, Wilk & Nusair (VWN5_RPA)
    0.8100   Lee, Yang & Parr

   => LibXC Density Thresholds  <==

    XC_HYB_GGA_XC_B3LYP:  1.00E-15 

   => Molecular Quadrature <=

    Radial Scheme          =       TREUTLER
    Pruning Scheme         =           NONE
    Nuclear Scheme         =       TREUTLER

    Blocking Scheme        =         OCTREE
    BS radius alpha        =              1
    Pruning alpha          =              1
    Radial Points          =             75
    Spherical Points       =            302
    Total Points           =          43489
    Total Blocks           =            384
    Max Points             =            256
    Max Functions          =             19
    Weights Tolerance      =       1.00E-15


  -Total Gradient:
     Atom            X                  Y                   Z
    ------   -----------------  -----------------  -----------------
       1        0.000000000000    -0.000000000000     0.003799090668
       2        0.000000000000     0.000000000000    -0.003801051492


*** tstop() called on Joses-MacBook-Pro-2.local at Thu Jul 17 12:26:52 2025
Module time:
	user time   =       0.34 seconds =       0.01 minutes
	system time =       0.74 seconds =       0.01 minutes
	total time  =          0 seconds =       0.00 minutes
Total time:
	user time   =       1.38 seconds =       0.02 minutes
	system time =       3.13 seconds =       0.05 minutes
	total time  =          1 seconds =       0.02 minutes

    			-----------------------------------------

    			 OPTKING 3.0: for geometry optimizations 

    			     By R.A. King, Bethel University     

    			        with contributions from          

    			    A.V. Copan, J. Cayton, A. Heide      

    			-----------------------------------------

    
	                            ===> Fragment 1 <== 

	 Z (Atomic Numbers)          Masses                          Geom                  
	       2.000000             4.002603          0.00000000  0.00000000  1.70047684   
	       6.000000            12.000000          0.00000000  0.00000000 -0.56719451   

	 - Coordinate -           - BOHR/RAD -       - ANG/DEG -
	 R(1,2)           =         2.267671           1.200000


	        --- Internal Coordinate Step in ANG or DEG, aJ/ANG or AJ/DEG ---
	-------------------------------------------------------------------------------
	           Coordinate      Previous         Force          Change          New 
	           ----------      --------        ------          ------        ------
	               R(1,2)       1.20000       -0.03131       -0.00815       1.19185
	-------------------------------------------------------------------------------

	                                 ==> Convergence Check <==                                  
    
	Measures of convergence in internal coordinates in au.
    
	Criteria marked as inactive (o), active & met (*), and active & unmet ( ).

	----------------------------------------------------------------------------------------------
	   Step    Total Energy     Delta E     Max Force     RMS Force      Max Disp      RMS Disp   
	----------------------------------------------------------------------------------------------
	  Convergence Criteria     1.00e-06 *    3.00e-04 *             o    1.20e-03 *             o
	----------------------------------------------------------------------------------------------
	     1     -40.19399307   -4.02e+01      3.80e-03      3.80e-03 o    1.54e-02      1.54e-02 o  ~
	----------------------------------------------------------------------------------------------

Next Geometry in Ang 
	Fragment 1 (Ang)

	   He   0.0000000000   0.0000000000   0.8957781581
	    C   0.0000000000   0.0000000000  -0.2960709765


    Structure for next step:
    Molecular point group: c2v
    Full point group: C_inf_v

    Geometry (in Angstrom), charge = 1, multiplicity = 4:

    HE           0.000000000000     0.000000000000     0.893741436155
    C            0.000000000000     0.000000000000    -0.298107698392


Scratch directory: /tmp/
gradient() will perform analytic gradient computation.
   => Libint2 <=

    Primary   basis highest AM E, G, H:  6, 6, 3
    Auxiliary basis highest AM E, G, H:  7, 7, 4
    Onebody   basis highest AM E, G, H:  -, -, -
    Solid Harmonics ordering:            Gaussian

*** tstart() called on Joses-MacBook-Pro-2.local
*** at Thu Jul 17 12:26:52 2025

   => Loading Basis Set <=

    Name: CC-PVDZ
    Role: ORBITAL
    Keyword: BASIS
    atoms 1 entry HE         line    32 file /Users/joseantoniorodriguesromero/anaconda3/share/psi4/basis/cc-pvdz.gbs 
    atoms 2 entry C          line   138 file /Users/joseantoniorodriguesromero/anaconda3/share/psi4/basis/cc-pvdz.gbs 


         ---------------------------------------------------------
                                   SCF
               by Justin Turney, Rob Parrish, Andy Simmonett
                          and Daniel G. A. Smith
                              UKS Reference
                        1 Threads,    500 MiB Core
         ---------------------------------------------------------

  ==> Geometry <==

    Molecular point group: c2v
    Full point group: C_inf_v

    Geometry (in Angstrom), charge = 1, multiplicity = 4:

       Center              X                  Y                   Z               Mass       
    ------------   -----------------  -----------------  -----------------  -----------------
         HE           0.000000000000     0.000000000000     0.893741436155     4.002603254130
         C            0.000000000000     0.000000000000    -0.298107698392    12.000000000000

  Running in c2v symmetry.

  Rotational constants: A = ************  B =      3.95386  C =      3.95386 [cm^-1]
  Rotational constants: A = ************  B = 118533.60047  C = 118533.60047 [MHz]
  Nuclear repulsion =    5.327961689086577

  Charge       = 1
  Multiplicity = 4
  Electrons    = 7
  Nalpha       = 5
  Nbeta        = 2

  ==> Algorithm <==

  SCF Algorithm Type is DF.
  DIIS enabled.
  MOM disabled.
  Fractional occupation disabled.
  Guess Type is READ.
  Energy threshold   = 1.00e-08
  Density threshold  = 1.00e-08
  Integral threshold = 1.00e-12

  ==> Primary Basis <==

  Basis Set: CC-PVDZ
    Blend: CC-PVDZ
    Number of shells: 9
    Number of basis functions: 19
    Number of Cartesian functions: 20
    Spherical Harmonics?: true
    Max angular momentum: 2

  ==> DFT Potential <==

   => LibXC <=

    Version 6.2.2
    S. Lehtola, C. Steigemann, M. J.T. Oliveira, and M. A.L. Marques.,  SoftwareX 7, 1–5 (2018) (10.1016/j.softx.2017.11.002)

   => Composite Functional: B3LYP <= 

    B3LYP Hyb-GGA Exchange-Correlation Functional

    P. J. Stephens, F. J. Devlin, C. F. Chabalowski, and M. J. Frisch.,  J. Phys. Chem. 98, 11623 (1994) (10.1021/j100096a001)

    Deriv               =              1
    GGA                 =           TRUE
    Meta                =          FALSE

    Exchange Hybrid     =           TRUE
    MP2 Hybrid          =          FALSE

   => Exchange Functionals <=

    0.0800   Slater exchange
    0.7200         Becke 88

   => Exact (HF) Exchange <=

    0.2000               HF 

   => Correlation Functionals <=

    0.1900   Vosko, Wilk & Nusair (VWN5_RPA)
    0.8100   Lee, Yang & Parr

   => LibXC Density Thresholds  <==

    XC_HYB_GGA_XC_B3LYP:  1.00E-15 

   => Molecular Quadrature <=

    Radial Scheme          =       TREUTLER
    Pruning Scheme         =           NONE
    Nuclear Scheme         =       TREUTLER

    Blocking Scheme        =         OCTREE
    BS radius alpha        =              1
    Pruning alpha          =              1
    Radial Points          =             75
    Spherical Points       =            302
    Total Points           =          43488
    Total Blocks           =            384
    Max Points             =            256
    Max Functions          =             19
    Weights Tolerance      =       1.00E-15

   => Loading Basis Set <=

    Name: (CC-PVDZ AUX)
    Role: JKFIT
    Keyword: DF_BASIS_SCF
    atoms 1 entry HE         line    34 file /Users/joseantoniorodriguesromero/anaconda3/share/psi4/basis/def2-universal-jkfit.gbs 
    atoms 2 entry C          line   121 file /Users/joseantoniorodriguesromero/anaconda3/share/psi4/basis/cc-pvdz-jkfit.gbs 

   => Loading Basis Set <=

    Name: CC-PVDZ
    Role: ORBITAL
    Keyword: BASIS
    atoms 1 entry HE         line    32 file /Users/joseantoniorodriguesromero/anaconda3/share/psi4/basis/cc-pvdz.gbs 
    atoms 2 entry C          line   138 file /Users/joseantoniorodriguesromero/anaconda3/share/psi4/basis/cc-pvdz.gbs 

  Reading orbitals from file /tmp/quartet_HeC.default.73750.180.npy, no projection.

  ==> Integral Setup <==

  DFHelper Memory: AOs need 0.000 GiB; user supplied 0.342 GiB. 
  Using in-core AOs.

  ==> MemDFJK: Density-Fitted J/K Matrices <==

    J tasked:                   Yes
    K tasked:                   Yes
    wK tasked:                   No
    OpenMP threads:               1
    Memory [MiB]:               350
    Algorithm:                 Core
    Schwarz Cutoff:           1E-12
    Mask sparsity (%):       0.0000
    Fitting Condition:        1E-10

   => Auxiliary Basis Set <=

  Basis Set: (CC-PVDZ AUX)
    Blend: CC-PVDZ-JKFIT + DEF2-UNIVERSAL-JKFIT
    Number of shells: 33
    Number of basis functions: 93
    Number of Cartesian functions: 106
    Spherical Harmonics?: true
    Max angular momentum: 3

  Cached 100.0% of DFT collocation blocks in 0.024 [GiB].

  Minimum eigenvalue in the overlap matrix is 6.1130254840E-02.
  Reciprocal condition number of the overlap matrix is 2.2127390786E-02.
    Using symmetric orthogonalization.

  ==> Pre-Iterations <==

  SCF Guess: Orbitals guess was supplied from a previous computation.

   -------------------------------------------------------
    Irrep   Nso     Nmo     Nalpha   Nbeta   Ndocc  Nsocc
   -------------------------------------------------------
     A1        10      10       3       2       2       1
     A2         1       1       0       0       0       0
     B1         4       4       1       0       0       1
     B2         4       4       1       0       0       1
   -------------------------------------------------------
    Total      19      19       5       2       2       3
   -------------------------------------------------------

  ==> Iterations <==

                           Total Energy        Delta E     RMS |[F,P]|

   @DF-UKS iter   0:   -40.20014763288020   -4.02001e+01   9.03817e-04 
   @DF-UKS iter   1:   -40.19402727751192    6.12036e-03   2.65837e-04 DIIS/ADIIS
   @DF-UKS iter   2:   -40.19403125352505   -3.97601e-06   1.29677e-04 DIIS/ADIIS/DAMP=1%
   @DF-UKS iter   3:   -40.19402503703309    6.21649e-06   8.16141e-06 DIIS/DAMP=1%
   @DF-UKS iter   4:   -40.19403385952515   -8.82249e-06   1.24739e-06 DIIS/DAMP=1%
   @DF-UKS iter   5:   -40.19403239161411    1.46791e-06   2.50462e-07 DIIS/DAMP=1%
   @DF-UKS iter   6:   -40.19403251210864   -1.20495e-07   2.97644e-08 DIIS/DAMP=1%
   @DF-UKS iter   7:   -40.19403249768782    1.44208e-08   3.63619e-09 DIIS/DAMP=1%
   @DF-UKS iter   8:   -40.19403250113431   -3.44649e-09   2.26316e-10 DIIS/DAMP=1%
  Energy and wave function converged.


  ==> Post-Iterations <==

   Electrons on quadrature grid:
      Nalpha   =    5.0000002370 ; deviation = 2.370e-07
      Nbeta    =    2.0000002077 ; deviation = 2.077e-07
      Ntotal   =    7.0000004448 ; deviation = 4.448e-07 

   @Spin Contamination Metric:   6.316146490E-04
   @S^2 Expected:                3.750000000E+00
   @S^2 Observed:                3.750631615E+00
   @S   Expected:                1.500000000E+00
   @S   Observed:                1.500000000E+00

    Orbital Energies [Eh]
    ---------------------

    Alpha Occupied:                                                       

       1A1   -10.788760     2A1    -1.376030     3A1    -0.927625  
       1B2    -0.694066     1B1    -0.694066  

    Alpha Virtual:                                                        

       4A1    -0.397779     5A1     0.093721     2B1     0.103067  
       2B2     0.103067     6A1     0.196046     3B1     0.619896  
       3B2     0.619896     7A1     0.699086     1A2     0.699086  
       8A1     0.769813     9A1     1.095228     4B1     1.912023  
       4B2     1.912023    10A1     2.577564  

    Beta Occupied:                                                        

       1A1   -10.728152     2A1    -1.331449  

    Beta Virtual:                                                         

       3A1    -0.621024     1B1    -0.404899     1B2    -0.404899  
       4A1    -0.288959     5A1     0.122176     2B1     0.207565  
       2B2     0.207565     6A1     0.300378     3B2     0.747165  
       3B1     0.747165     7A1     0.810467     8A1     0.889789  
       1A2     0.889789     9A1     1.193743     4B1     1.949960  
       4B2     1.949960    10A1     2.614726  

    Final Occupation by Irrep:
             A1    A2    B1    B2 
    DOCC [     2,    0,    0,    0 ]
    SOCC [     1,    0,    1,    1 ]
    NA   [     3,    0,    1,    1 ]
    NB   [     2,    0,    0,    0 ]

  @DF-UKS Final Energy:   -40.19403250113431

   => Energetics <=

    Nuclear Repulsion Energy =              5.3279616890865773
    One-Electron Energy =                 -60.9813470441669381
    Two-Electron Energy =                  20.3467757927167305
    DFT Exchange-Correlation Energy =      -4.8874229387706842
    Empirical Dispersion Energy =           0.0000000000000000
    VV10 Nonlocal Energy =                  0.0000000000000000
    Total Energy =                        -40.1940325011343162

  UHF NO Occupations:
  HONO-2 :    1 B2 1.0000000
  HONO-1 :    1 B1 1.0000000
  HONO-0 :    3 A1 1.0000000
  LUNO+0 :    4 A1 0.0003154
  LUNO+1 :    5 A1 0.0000005
  LUNO+2 :    6 A1 0.0000000
  LUNO+3 :    7 A1 0.0000000


Computation Completed


Properties will be evaluated at   0.000000,   0.000000,   0.000000 [a0]

Properties computed using the SCF density matrix


 Multipole Moments:

 ------------------------------------------------------------------------------------
     Multipole            Electronic (a.u.)      Nuclear  (a.u.)        Total (a.u.)
 ------------------------------------------------------------------------------------

 L = 1.  Multiply by 2.5417464519 to convert [e a0] to [Debye]
 Dipole X            :          0.0000000            0.0000000            0.0000000
 Dipole Y            :          0.0000000            0.0000000            0.0000000
 Dipole Z            :          0.2568564           -0.0021984            0.2546581
 Magnitude           :                                                    0.2546581

 ------------------------------------------------------------------------------------

*** tstop() called on Joses-MacBook-Pro-2.local at Thu Jul 17 12:26:52 2025
Module time:
	user time   =       0.79 seconds =       0.01 minutes
	system time =       3.24 seconds =       0.05 minutes
	total time  =          0 seconds =       0.00 minutes
Total time:
	user time   =       2.20 seconds =       0.04 minutes
	system time =       6.57 seconds =       0.11 minutes
	total time  =          1 seconds =       0.02 minutes

*** tstart() called on Joses-MacBook-Pro-2.local
*** at Thu Jul 17 12:26:52 2025


         ------------------------------------------------------------
                                   SCF GRAD                          
                          Rob Parrish, Justin Turney,                
                       Andy Simmonett, and Alex Sokolov              
         ------------------------------------------------------------

  ==> Geometry <==

    Molecular point group: c2v
    Full point group: C_inf_v

    Geometry (in Angstrom), charge = 1, multiplicity = 4:

       Center              X                  Y                   Z               Mass       
    ------------   -----------------  -----------------  -----------------  -----------------
         HE           0.000000000000     0.000000000000     0.893741436155     4.002603254130
         C            0.000000000000     0.000000000000    -0.298107698392    12.000000000000

  Nuclear repulsion =    5.327961689086577

  ==> Basis Set <==

  Basis Set: CC-PVDZ
    Blend: CC-PVDZ
    Number of shells: 9
    Number of basis functions: 19
    Number of Cartesian functions: 20
    Spherical Harmonics?: true
    Max angular momentum: 2

  ==> DFJKGrad: Density-Fitted SCF Gradients <==

    Gradient:                    1
    J tasked:                  Yes
    K tasked:                  Yes
    wK tasked:                  No
    OpenMP threads:              1
    Integrals threads:           1
    Memory [MiB]:              375
    Schwarz Cutoff:          1E-12
    Fitting Condition:       1E-10

   => Auxiliary Basis Set <=

  Basis Set: (CC-PVDZ AUX)
    Blend: CC-PVDZ-JKFIT + DEF2-UNIVERSAL-JKFIT
    Number of shells: 33
    Number of basis functions: 93
    Number of Cartesian functions: 106
    Spherical Harmonics?: true
    Max angular momentum: 3

  ==> DFT Potential <==

   => LibXC <=

    Version 6.2.2
    S. Lehtola, C. Steigemann, M. J.T. Oliveira, and M. A.L. Marques.,  SoftwareX 7, 1–5 (2018) (10.1016/j.softx.2017.11.002)

   => Composite Functional: B3LYP <= 

    B3LYP Hyb-GGA Exchange-Correlation Functional

    P. J. Stephens, F. J. Devlin, C. F. Chabalowski, and M. J. Frisch.,  J. Phys. Chem. 98, 11623 (1994) (10.1021/j100096a001)

    Deriv               =              1
    GGA                 =           TRUE
    Meta                =          FALSE

    Exchange Hybrid     =           TRUE
    MP2 Hybrid          =          FALSE

   => Exchange Functionals <=

    0.0800   Slater exchange
    0.7200         Becke 88

   => Exact (HF) Exchange <=

    0.2000               HF 

   => Correlation Functionals <=

    0.1900   Vosko, Wilk & Nusair (VWN5_RPA)
    0.8100   Lee, Yang & Parr

   => LibXC Density Thresholds  <==

    XC_HYB_GGA_XC_B3LYP:  1.00E-15 

   => Molecular Quadrature <=

    Radial Scheme          =       TREUTLER
    Pruning Scheme         =           NONE
    Nuclear Scheme         =       TREUTLER

    Blocking Scheme        =         OCTREE
    BS radius alpha        =              1
    Pruning alpha          =              1
    Radial Points          =             75
    Spherical Points       =            302
    Total Points           =          43488
    Total Blocks           =            384
    Max Points             =            256
    Max Functions          =             19
    Weights Tolerance      =       1.00E-15


  -Total Gradient:
     Atom            X                  Y                   Z
    ------   -----------------  -----------------  -----------------
       1        0.000000000000    -0.000000000000     0.001287972224
       2        0.000000000000     0.000000000000    -0.001289868439


*** tstop() called on Joses-MacBook-Pro-2.local at Thu Jul 17 12:26:53 2025
Module time:
	user time   =       0.31 seconds =       0.01 minutes
	system time =       0.83 seconds =       0.01 minutes
	total time  =          1 seconds =       0.02 minutes
Total time:
	user time   =       2.51 seconds =       0.04 minutes
	system time =       7.40 seconds =       0.12 minutes
	total time  =          2 seconds =       0.03 minutes

    			-----------------------------------------

    			 OPTKING 3.0: for geometry optimizations 

    			     By R.A. King, Bethel University     

    			        with contributions from          

    			    A.V. Copan, J. Cayton, A. Heide      

    			-----------------------------------------

    
	                            ===> Fragment 1 <== 

	 Z (Atomic Numbers)          Masses                          Geom                  
	       2.000000             4.002603          0.00000000  0.00000000  1.68892654   
	       6.000000            12.000000          0.00000000  0.00000000 -0.56334191   

	 - Coordinate -           - BOHR/RAD -       - ANG/DEG -
	 R(1,2)           =         2.252268           1.191849


	        --- Internal Coordinate Step in ANG or DEG, aJ/ANG or AJ/DEG ---
	-------------------------------------------------------------------------------
	           Coordinate      Previous         Force          Change          New 
	           ----------      --------        ------          ------        ------
	               R(1,2)       1.19185       -0.01062       -0.00418       1.18767
	-------------------------------------------------------------------------------

	                                 ==> Convergence Check <==                                  
    
	Measures of convergence in internal coordinates in au.
    
	Criteria marked as inactive (o), active & met (*), and active & unmet ( ).

	----------------------------------------------------------------------------------------------
	   Step    Total Energy     Delta E     Max Force     RMS Force      Max Disp      RMS Disp   
	----------------------------------------------------------------------------------------------
	  Convergence Criteria     1.00e-06 *    3.00e-04 *             o    1.20e-03 *             o
	----------------------------------------------------------------------------------------------
	     2     -40.19403250   -3.94e-05      1.29e-03      1.29e-03 o    7.91e-03      7.91e-03 o  ~
	----------------------------------------------------------------------------------------------

Next Geometry in Ang 
	Fragment 1 (Ang)

	   He   0.0000000000   0.0000000000   0.8916497338
	    C   0.0000000000   0.0000000000  -0.2960159961


    Structure for next step:
    Molecular point group: c2v
    Full point group: C_inf_v

    Geometry (in Angstrom), charge = 1, multiplicity = 4:

    HE           0.000000000000     0.000000000000     0.890604393104
    C            0.000000000000     0.000000000000    -0.297061336832


Scratch directory: /tmp/
gradient() will perform analytic gradient computation.
   => Libint2 <=

    Primary   basis highest AM E, G, H:  6, 6, 3
    Auxiliary basis highest AM E, G, H:  7, 7, 4
    Onebody   basis highest AM E, G, H:  -, -, -
    Solid Harmonics ordering:            Gaussian

*** tstart() called on Joses-MacBook-Pro-2.local
*** at Thu Jul 17 12:26:53 2025

   => Loading Basis Set <=

    Name: CC-PVDZ
    Role: ORBITAL
    Keyword: BASIS
    atoms 1 entry HE         line    32 file /Users/joseantoniorodriguesromero/anaconda3/share/psi4/basis/cc-pvdz.gbs 
    atoms 2 entry C          line   138 file /Users/joseantoniorodriguesromero/anaconda3/share/psi4/basis/cc-pvdz.gbs 


         ---------------------------------------------------------
                                   SCF
               by Justin Turney, Rob Parrish, Andy Simmonett
                          and Daniel G. A. Smith
                              UKS Reference
                        1 Threads,    500 MiB Core
         ---------------------------------------------------------

  ==> Geometry <==

    Molecular point group: c2v
    Full point group: C_inf_v

    Geometry (in Angstrom), charge = 1, multiplicity = 4:

       Center              X                  Y                   Z               Mass       
    ------------   -----------------  -----------------  -----------------  -----------------
         HE           0.000000000000     0.000000000000     0.890604393104     4.002603254130
         C            0.000000000000     0.000000000000    -0.297061336832    12.000000000000

  Running in c2v symmetry.

  Rotational constants: A = ************  B =      3.98176  C =      3.98176 [cm^-1]
  Rotational constants: A = ************  B = 119370.11082  C = 119370.11082 [MHz]
  Nuclear repulsion =    5.346728770548477

  Charge       = 1
  Multiplicity = 4
  Electrons    = 7
  Nalpha       = 5
  Nbeta        = 2

  ==> Algorithm <==

  SCF Algorithm Type is DF.
  DIIS enabled.
  MOM disabled.
  Fractional occupation disabled.
  Guess Type is READ.
  Energy threshold   = 1.00e-08
  Density threshold  = 1.00e-08
  Integral threshold = 1.00e-12

  ==> Primary Basis <==

  Basis Set: CC-PVDZ
    Blend: CC-PVDZ
    Number of shells: 9
    Number of basis functions: 19
    Number of Cartesian functions: 20
    Spherical Harmonics?: true
    Max angular momentum: 2

  ==> DFT Potential <==

   => LibXC <=

    Version 6.2.2
    S. Lehtola, C. Steigemann, M. J.T. Oliveira, and M. A.L. Marques.,  SoftwareX 7, 1–5 (2018) (10.1016/j.softx.2017.11.002)

   => Composite Functional: B3LYP <= 

    B3LYP Hyb-GGA Exchange-Correlation Functional

    P. J. Stephens, F. J. Devlin, C. F. Chabalowski, and M. J. Frisch.,  J. Phys. Chem. 98, 11623 (1994) (10.1021/j100096a001)

    Deriv               =              1
    GGA                 =           TRUE
    Meta                =          FALSE

    Exchange Hybrid     =           TRUE
    MP2 Hybrid          =          FALSE

   => Exchange Functionals <=

    0.0800   Slater exchange
    0.7200         Becke 88

   => Exact (HF) Exchange <=

    0.2000               HF 

   => Correlation Functionals <=

    0.1900   Vosko, Wilk & Nusair (VWN5_RPA)
    0.8100   Lee, Yang & Parr

   => LibXC Density Thresholds  <==

    XC_HYB_GGA_XC_B3LYP:  1.00E-15 

   => Molecular Quadrature <=

    Radial Scheme          =       TREUTLER
    Pruning Scheme         =           NONE
    Nuclear Scheme         =       TREUTLER

    Blocking Scheme        =         OCTREE
    BS radius alpha        =              1
    Pruning alpha          =              1
    Radial Points          =             75
    Spherical Points       =            302
    Total Points           =          43484
    Total Blocks           =            384
    Max Points             =            256
    Max Functions          =             19
    Weights Tolerance      =       1.00E-15

   => Loading Basis Set <=

    Name: (CC-PVDZ AUX)
    Role: JKFIT
    Keyword: DF_BASIS_SCF
    atoms 1 entry HE         line    34 file /Users/joseantoniorodriguesromero/anaconda3/share/psi4/basis/def2-universal-jkfit.gbs 
    atoms 2 entry C          line   121 file /Users/joseantoniorodriguesromero/anaconda3/share/psi4/basis/cc-pvdz-jkfit.gbs 

   => Loading Basis Set <=

    Name: CC-PVDZ
    Role: ORBITAL
    Keyword: BASIS
    atoms 1 entry HE         line    32 file /Users/joseantoniorodriguesromero/anaconda3/share/psi4/basis/cc-pvdz.gbs 
    atoms 2 entry C          line   138 file /Users/joseantoniorodriguesromero/anaconda3/share/psi4/basis/cc-pvdz.gbs 

  Reading orbitals from file /tmp/quartet_HeC.default.73750.180.npy, no projection.

  ==> Integral Setup <==

  DFHelper Memory: AOs need 0.000 GiB; user supplied 0.342 GiB. 
  Using in-core AOs.

  ==> MemDFJK: Density-Fitted J/K Matrices <==

    J tasked:                   Yes
    K tasked:                   Yes
    wK tasked:                   No
    OpenMP threads:               1
    Memory [MiB]:               350
    Algorithm:                 Core
    Schwarz Cutoff:           1E-12
    Mask sparsity (%):       0.0000
    Fitting Condition:        1E-10

   => Auxiliary Basis Set <=

  Basis Set: (CC-PVDZ AUX)
    Blend: CC-PVDZ-JKFIT + DEF2-UNIVERSAL-JKFIT
    Number of shells: 33
    Number of basis functions: 93
    Number of Cartesian functions: 106
    Spherical Harmonics?: true
    Max angular momentum: 3

  Cached 100.0% of DFT collocation blocks in 0.024 [GiB].

  Minimum eigenvalue in the overlap matrix is 6.0674354328E-02.
  Reciprocal condition number of the overlap matrix is 2.1930196391E-02.
    Using symmetric orthogonalization.

  ==> Pre-Iterations <==

  SCF Guess: Orbitals guess was supplied from a previous computation.

   -------------------------------------------------------
    Irrep   Nso     Nmo     Nalpha   Nbeta   Ndocc  Nsocc
   -------------------------------------------------------
     A1        10      10       3       2       2       1
     A2         1       1       0       0       0       0
     B1         4       4       1       0       0       1
     B2         4       4       1       0       0       1
   -------------------------------------------------------
    Total      19      19       5       2       2       3
   -------------------------------------------------------

  ==> Iterations <==

                           Total Energy        Delta E     RMS |[F,P]|

   @DF-UKS iter   0:   -40.19721637748656   -4.01972e+01   4.69458e-04 
   @DF-UKS iter   1:   -40.19403597819328    3.18040e-03   1.37389e-04 DIIS/ADIIS
   @DF-UKS iter   2:   -40.19403703985782   -1.06166e-06   6.67584e-05 DIIS/DAMP=1%
   @DF-UKS iter   3:   -40.19403353399734    3.50586e-06   4.23754e-06 DIIS/DAMP=1%
   @DF-UKS iter   4:   -40.19403807458897   -4.54059e-06   6.50206e-07 DIIS/DAMP=1%
   @DF-UKS iter   5:   -40.19403731283128    7.61758e-07   1.30732e-07 DIIS/DAMP=1%
   @DF-UKS iter   6:   -40.19403737535448   -6.25232e-08   1.52650e-08 DIIS/DAMP=1%
   @DF-UKS iter   7:   -40.19403736783536    7.51911e-09   1.84783e-09 DIIS/DAMP=1%
  Energy and wave function converged.


  ==> Post-Iterations <==

   Electrons on quadrature grid:
      Nalpha   =    5.0000002344 ; deviation = 2.344e-07
      Nbeta    =    2.0000002052 ; deviation = 2.052e-07
      Ntotal   =    7.0000004396 ; deviation = 4.396e-07 

   @Spin Contamination Metric:   6.331702264E-04
   @S^2 Expected:                3.750000000E+00
   @S^2 Observed:                3.750633170E+00
   @S   Expected:                1.500000000E+00
   @S   Observed:                1.500000000E+00

    Orbital Energies [Eh]
    ---------------------

    Alpha Occupied:                                                       

       1A1   -10.788362     2A1    -1.378996     3A1    -0.926967  
       1B1    -0.694085     1B2    -0.694085  

    Alpha Virtual:                                                        

       4A1    -0.395493     5A1     0.092389     2B2     0.103119  
       2B1     0.103119     6A1     0.195858     3B1     0.619242  
       3B2     0.619242     7A1     0.699074     1A2     0.699074  
       8A1     0.769519     9A1     1.099317     4B2     1.914120  
       4B1     1.914120    10A1     2.582169  

    Beta Occupied:                                                        

       1A1   -10.727784     2A1    -1.334466  

    Beta Virtual:                                                         

       3A1    -0.620113     1B1    -0.405091     1B2    -0.405091  
       4A1    -0.286790     5A1     0.120656     2B1     0.207624  
       2B2     0.207624     6A1     0.300425     3B1     0.746488  
       3B2     0.746488     7A1     0.810264     8A1     0.889654  
       1A2     0.889654     9A1     1.198021     4B2     1.952279  
       4B1     1.952279    10A1     2.619311  

    Final Occupation by Irrep:
             A1    A2    B1    B2 
    DOCC [     2,    0,    0,    0 ]
    SOCC [     1,    0,    1,    1 ]
    NA   [     3,    0,    1,    1 ]
    NB   [     2,    0,    0,    0 ]

  @DF-UKS Final Energy:   -40.19403736783536

   => Energetics <=

    Nuclear Repulsion Energy =              5.3467287705484772
    One-Electron Energy =                 -61.0138441210979607
    Two-Electron Energy =                  20.3611976177539056
    DFT Exchange-Correlation Energy =      -4.8881196350397893
    Empirical Dispersion Energy =           0.0000000000000000
    VV10 Nonlocal Energy =                  0.0000000000000000
    Total Energy =                        -40.1940373678353637

  UHF NO Occupations:
  HONO-2 :    1 B2 1.0000000
  HONO-1 :    1 B1 1.0000000
  HONO-0 :    3 A1 1.0000000
  LUNO+0 :    4 A1 0.0003162
  LUNO+1 :    5 A1 0.0000005
  LUNO+2 :    6 A1 0.0000000
  LUNO+3 :    2 B1 0.0000000


Computation Completed


Properties will be evaluated at   0.000000,   0.000000,   0.000000 [a0]

Properties computed using the SCF density matrix


 Multipole Moments:

 ------------------------------------------------------------------------------------
     Multipole            Electronic (a.u.)      Nuclear  (a.u.)        Total (a.u.)
 ------------------------------------------------------------------------------------

 L = 1.  Multiply by 2.5417464519 to convert [e a0] to [Debye]
 Dipole X            :          0.0000000            0.0000000            0.0000000
 Dipole Y            :          0.0000000            0.0000000            0.0000000
 Dipole Z            :          0.2614471           -0.0021906            0.2592564
 Magnitude           :                                                    0.2592564

 ------------------------------------------------------------------------------------

*** tstop() called on Joses-MacBook-Pro-2.local at Thu Jul 17 12:26:53 2025
Module time:
	user time   =       0.97 seconds =       0.02 minutes
	system time =       2.82 seconds =       0.05 minutes
	total time  =          0 seconds =       0.00 minutes
Total time:
	user time   =       3.51 seconds =       0.06 minutes
	system time =      10.43 seconds =       0.17 minutes
	total time  =          2 seconds =       0.03 minutes

*** tstart() called on Joses-MacBook-Pro-2.local
*** at Thu Jul 17 12:26:53 2025


         ------------------------------------------------------------
                                   SCF GRAD                          
                          Rob Parrish, Justin Turney,                
                       Andy Simmonett, and Alex Sokolov              
         ------------------------------------------------------------

  ==> Geometry <==

    Molecular point group: c2v
    Full point group: C_inf_v

    Geometry (in Angstrom), charge = 1, multiplicity = 4:

       Center              X                  Y                   Z               Mass       
    ------------   -----------------  -----------------  -----------------  -----------------
         HE           0.000000000000     0.000000000000     0.890604393104     4.002603254130
         C            0.000000000000     0.000000000000    -0.297061336832    12.000000000000

  Nuclear repulsion =    5.346728770548477

  ==> Basis Set <==

  Basis Set: CC-PVDZ
    Blend: CC-PVDZ
    Number of shells: 9
    Number of basis functions: 19
    Number of Cartesian functions: 20
    Spherical Harmonics?: true
    Max angular momentum: 2

  ==> DFJKGrad: Density-Fitted SCF Gradients <==

    Gradient:                    1
    J tasked:                  Yes
    K tasked:                  Yes
    wK tasked:                  No
    OpenMP threads:              1
    Integrals threads:           1
    Memory [MiB]:              375
    Schwarz Cutoff:          1E-12
    Fitting Condition:       1E-10

   => Auxiliary Basis Set <=

  Basis Set: (CC-PVDZ AUX)
    Blend: CC-PVDZ-JKFIT + DEF2-UNIVERSAL-JKFIT
    Number of shells: 33
    Number of basis functions: 93
    Number of Cartesian functions: 106
    Spherical Harmonics?: true
    Max angular momentum: 3

  ==> DFT Potential <==

   => LibXC <=

    Version 6.2.2
    S. Lehtola, C. Steigemann, M. J.T. Oliveira, and M. A.L. Marques.,  SoftwareX 7, 1–5 (2018) (10.1016/j.softx.2017.11.002)

   => Composite Functional: B3LYP <= 

    B3LYP Hyb-GGA Exchange-Correlation Functional

    P. J. Stephens, F. J. Devlin, C. F. Chabalowski, and M. J. Frisch.,  J. Phys. Chem. 98, 11623 (1994) (10.1021/j100096a001)

    Deriv               =              1
    GGA                 =           TRUE
    Meta                =          FALSE

    Exchange Hybrid     =           TRUE
    MP2 Hybrid          =          FALSE

   => Exchange Functionals <=

    0.0800   Slater exchange
    0.7200         Becke 88

   => Exact (HF) Exchange <=

    0.2000               HF 

   => Correlation Functionals <=

    0.1900   Vosko, Wilk & Nusair (VWN5_RPA)
    0.8100   Lee, Yang & Parr

   => LibXC Density Thresholds  <==

    XC_HYB_GGA_XC_B3LYP:  1.00E-15 

   => Molecular Quadrature <=

    Radial Scheme          =       TREUTLER
    Pruning Scheme         =           NONE
    Nuclear Scheme         =       TREUTLER

    Blocking Scheme        =         OCTREE
    BS radius alpha        =              1
    Pruning alpha          =              1
    Radial Points          =             75
    Spherical Points       =            302
    Total Points           =          43484
    Total Blocks           =            384
    Max Points             =            256
    Max Functions          =             19
    Weights Tolerance      =       1.00E-15


  -Total Gradient:
     Atom            X                  Y                   Z
    ------   -----------------  -----------------  -----------------
       1       -0.000000000000     0.000000000000    -0.000067864757
       2        0.000000000000    -0.000000000000     0.000065990349


*** tstop() called on Joses-MacBook-Pro-2.local at Thu Jul 17 12:26:53 2025
Module time:
	user time   =       0.41 seconds =       0.01 minutes
	system time =       0.66 seconds =       0.01 minutes
	total time  =          0 seconds =       0.00 minutes
Total time:
	user time   =       3.92 seconds =       0.07 minutes
	system time =      11.09 seconds =       0.18 minutes
	total time  =          2 seconds =       0.03 minutes

    			-----------------------------------------

    			 OPTKING 3.0: for geometry optimizations 

    			     By R.A. King, Bethel University     

    			        with contributions from          

    			    A.V. Copan, J. Cayton, A. Heide      

    			-----------------------------------------

    
	                            ===> Fragment 1 <== 

	 Z (Atomic Numbers)          Masses                          Geom                  
	       2.000000             4.002603          0.00000000  0.00000000  1.68299839   
	       6.000000            12.000000          0.00000000  0.00000000 -0.56136457   

	 - Coordinate -           - BOHR/RAD -       - ANG/DEG -
	 R(1,2)           =         2.244363           1.187666


	        --- Internal Coordinate Step in ANG or DEG, aJ/ANG or AJ/DEG ---
	-------------------------------------------------------------------------------
	           Coordinate      Previous         Force          Change          New 
	           ----------      --------        ------          ------        ------
	               R(1,2)       1.18767        0.00055        0.00021       1.18788
	-------------------------------------------------------------------------------

	                                 ==> Convergence Check <==                                  
    
	Measures of convergence in internal coordinates in au.
    
	Criteria marked as inactive (o), active & met (*), and active & unmet ( ).

	----------------------------------------------------------------------------------------------
	   Step    Total Energy     Delta E     Max Force     RMS Force      Max Disp      RMS Disp   
	----------------------------------------------------------------------------------------------
	  Convergence Criteria     1.00e-06 *    3.00e-04 *             o    1.20e-03 *             o
	----------------------------------------------------------------------------------------------
	     3     -40.19403737   -4.87e-06      6.69e-05 *    6.69e-05 o    4.03e-04 *    4.03e-04 o  ~
	----------------------------------------------------------------------------------------------

Next Geometry in Ang 
	Fragment 1 (Ang)

	   He   0.0000000000   0.0000000000   0.8907111299
	    C   0.0000000000   0.0000000000  -0.2971680737


    Final optimized geometry and variables:
    Molecular point group: c2v
    Full point group: C_inf_v

    Geometry (in Angstrom), charge = 1, multiplicity = 4:

    HE           0.000000000000     0.000000000000     0.890604393104
    C            0.000000000000     0.000000000000    -0.297061336832


    Psi4 stopped on: Thursday, 17 July 2025 12:26PM
    Psi4 wall time for execution: 0:00:02.32

*** Psi4 exiting successfully. Buy a developer a beer!
