
    -----------------------------------------------------------------------
          Psi4: An Open-Source Ab Initio Electronic Structure Package
                               Psi4 1.9.1 release

                         Git: Rev {} zzzzzzz 


    D. G. A. Smith, L. A. Burns, A. C. Simmonett, R. M. Parrish,
    M. C. Schieber, R. Galvelis, P. Kraus, H. Kruse, R. Di Remigio,
    A. Alenaizan, A. M. James, S. Lehtola, J. P. Misiewicz, M. Scheurer,
    R. A. Shaw, J. B. Schriber, Y. Xie, Z. L. Glick, D. A. Sirianni,
    J. S. O'Brien, J. M. Waldrop, A. Kumar, E. G. Hohenstein,
    B. P. Pritchard, B. R. Brooks, H. F. Schaefer III, A. Yu. Sokolov,
    K. Patkowski, A. E. DePrince III, U. Bozkaya, R. A. King,
    F. A. Evangelista, J. M. Turney, T. D. Crawford, C. D. Sherrill,
    J. Chem. Phys. 152(18) 184108 (2020). https://doi.org/10.1063/5.0006002

                            Additional Code Authors
    E. T. Seidl, C. L. Janssen, E. F. Valeev, M. L. Leininger,
    J. F. Gonthier, R. M. Richard, H. R. McAlexander, M. Saitow, X. Wang,
    P. Verma, M. H. Lechner, A. Jiang, S. Behnle, A. G. Heide,
    M. F. Herbst, and D. L. Poole

             Previous Authors, Complete List of Code Contributors,
                       and Citations for Specific Modules
    https://github.com/psi4/psi4/blob/master/codemeta.json
    https://github.com/psi4/psi4/graphs/contributors
    http://psicode.org/psi4manual/master/introduction.html#citing-psifour

    -----------------------------------------------------------------------


    Psi4 started on: Thursday, 17 July 2025 12:29PM

    Process ID: 73769
    Host:       Joses-MacBook-Pro-2.local
    PSIDATADIR: /Users/joseantoniorodriguesromero/anaconda3/share/psi4
    Memory:     500.0 MiB
    Threads:    1
    
  ==> Input File <==

--------------------------------------------------------------------------
molecule { 
1 4
He   0.00000        0.60000        0.00000
Ne   0.00000       -0.60000        0.00000
}

set { 
basis              cc-pvdz
reference          uks
maxiter            500
geom_maxiter       500
DAMPING_PERCENTAGE 1
guess              SAP
}

optimize('b3lyp')
--------------------------------------------------------------------------

Scratch directory: /tmp/
gradient() will perform analytic gradient computation.
   => Libint2 <=

    Primary   basis highest AM E, G, H:  6, 6, 3
    Auxiliary basis highest AM E, G, H:  7, 7, 4
    Onebody   basis highest AM E, G, H:  -, -, -
    Solid Harmonics ordering:            Gaussian

*** tstart() called on Joses-MacBook-Pro-2.local
*** at Thu Jul 17 12:29:30 2025

   => Loading Basis Set <=

    Name: CC-PVDZ
    Role: ORBITAL
    Keyword: BASIS
    atoms 1 entry HE         line    32 file /Users/joseantoniorodriguesromero/anaconda3/share/psi4/basis/cc-pvdz.gbs 
    atoms 2 entry NE         line   258 file /Users/joseantoniorodriguesromero/anaconda3/share/psi4/basis/cc-pvdz.gbs 


         ---------------------------------------------------------
                                   SCF
               by Justin Turney, Rob Parrish, Andy Simmonett
                          and Daniel G. A. Smith
                              UKS Reference
                        1 Threads,    500 MiB Core
         ---------------------------------------------------------

  ==> Geometry <==

    Molecular point group: c2v
    Full point group: C_inf_v

    Geometry (in Angstrom), charge = 1, multiplicity = 4:

       Center              X                  Y                   Z               Mass       
    ------------   -----------------  -----------------  -----------------  -----------------
         HE           0.000000000000     0.000000000000     0.999828497127     4.002603254130
         NE           0.000000000000     0.000000000000    -0.200171502873    19.992440176200

  Running in c2v symmetry.

  Rotational constants: A = ************  B =      3.51032  C =      3.51032 [cm^-1]
  Rotational constants: A = ************  B = 105236.86411  C = 105236.86411 [MHz]
  Nuclear repulsion =    8.819620177833334

  Charge       = 1
  Multiplicity = 4
  Electrons    = 11
  Nalpha       = 7
  Nbeta        = 4

  ==> Algorithm <==

  SCF Algorithm Type is DF.
  DIIS enabled.
  MOM disabled.
  Fractional occupation disabled.
  Guess Type is SAP.
  Energy threshold   = 1.00e-08
  Density threshold  = 1.00e-08
  Integral threshold = 1.00e-12

  ==> Primary Basis <==

  Basis Set: CC-PVDZ
    Blend: CC-PVDZ
    Number of shells: 9
    Number of basis functions: 19
    Number of Cartesian functions: 20
    Spherical Harmonics?: true
    Max angular momentum: 2

  ==> DFT Potential <==

   => LibXC <=

    Version 6.2.2
    S. Lehtola, C. Steigemann, M. J.T. Oliveira, and M. A.L. Marques.,  SoftwareX 7, 1–5 (2018) (10.1016/j.softx.2017.11.002)

   => Composite Functional: B3LYP <= 

    B3LYP Hyb-GGA Exchange-Correlation Functional

    P. J. Stephens, F. J. Devlin, C. F. Chabalowski, and M. J. Frisch.,  J. Phys. Chem. 98, 11623 (1994) (10.1021/j100096a001)

    Deriv               =              1
    GGA                 =           TRUE
    Meta                =          FALSE

    Exchange Hybrid     =           TRUE
    MP2 Hybrid          =          FALSE

   => Exchange Functionals <=

    0.0800   Slater exchange
    0.7200         Becke 88

   => Exact (HF) Exchange <=

    0.2000               HF 

   => Correlation Functionals <=

    0.1900   Vosko, Wilk & Nusair (VWN5_RPA)
    0.8100   Lee, Yang & Parr

   => LibXC Density Thresholds  <==

    XC_HYB_GGA_XC_B3LYP:  1.00E-15 

   => Molecular Quadrature <=

    Radial Scheme          =       TREUTLER
    Pruning Scheme         =           NONE
    Nuclear Scheme         =       TREUTLER

    Blocking Scheme        =         OCTREE
    BS radius alpha        =              1
    Pruning alpha          =              1
    Radial Points          =             75
    Spherical Points       =            302
    Total Points           =          43310
    Total Blocks           =            378
    Max Points             =            256
    Max Functions          =             19
    Weights Tolerance      =       1.00E-15

   => Loading Basis Set <=

    Name: (CC-PVDZ AUX)
    Role: JKFIT
    Keyword: DF_BASIS_SCF
    atoms 1 entry HE         line    34 file /Users/joseantoniorodriguesromero/anaconda3/share/psi4/basis/def2-universal-jkfit.gbs 
    atoms 2 entry NE         line   321 file /Users/joseantoniorodriguesromero/anaconda3/share/psi4/basis/cc-pvdz-jkfit.gbs 

  ==> Integral Setup <==

  DFHelper Memory: AOs need 0.000 GiB; user supplied 0.343 GiB. 
  Using in-core AOs.

  ==> MemDFJK: Density-Fitted J/K Matrices <==

    J tasked:                   Yes
    K tasked:                   Yes
    wK tasked:                   No
    OpenMP threads:               1
    Memory [MiB]:               351
    Algorithm:                 Core
    Schwarz Cutoff:           1E-12
    Mask sparsity (%):       0.0000
    Fitting Condition:        1E-10

   => Auxiliary Basis Set <=

  Basis Set: (CC-PVDZ AUX)
    Blend: CC-PVDZ-JKFIT + DEF2-UNIVERSAL-JKFIT
    Number of shells: 33
    Number of basis functions: 93
    Number of Cartesian functions: 106
    Spherical Harmonics?: true
    Max angular momentum: 3

  Cached 100.0% of DFT collocation blocks in 0.023 [GiB].

  Minimum eigenvalue in the overlap matrix is 1.1974283509E-01.
  Reciprocal condition number of the overlap matrix is 5.2118283457E-02.
    Using symmetric orthogonalization.

  ==> Pre-Iterations <==

  SCF Guess: Superposition of Atomic Potentials (doi:10.1021/acs.jctc.8b01089).

  ==> SAP guess <==

   => Molecular Quadrature <=

    Radial Scheme          =       TREUTLER
    Pruning Scheme         =           NONE
    Nuclear Scheme         =       TREUTLER

    Blocking Scheme        =         OCTREE
    BS radius alpha        =              1
    Pruning alpha          =              1
    Radial Points          =             75
    Spherical Points       =            302
    Total Points           =          43310
    Total Blocks           =            378
    Max Points             =            256
    Max Functions          =             19
    Weights Tolerance      =       1.00E-15

   -------------------------------------------------------
    Irrep   Nso     Nmo     Nalpha   Nbeta   Ndocc  Nsocc
   -------------------------------------------------------
     A1        10      10       5       3       3       2
     A2         1       1       0       0       0       0
     B1         4       4       1       1       1       0
     B2         4       4       1       0       0       1
   -------------------------------------------------------
    Total      19      19       7       4       4       3
   -------------------------------------------------------

  ==> Iterations <==

                           Total Energy        Delta E     RMS |[F,P]|

    Occupation by irrep:
             A1    A2    B1    B2 
    DOCC [     3,    0,    1,    0 ]
    SOCC [     1,    0,    0,    2 ]
    NA   [     4,    0,    1,    2 ]
    NB   [     3,    0,    1,    0 ]

   @DF-UKS iter   1:  -129.04267094548055   -1.29043e+02   9.11531e-02 DIIS/ADIIS
    Occupation by irrep:
             A1    A2    B1    B2 
    DOCC [     3,    0,    1,    0 ]
    SOCC [     2,    0,    0,    1 ]
    NA   [     5,    0,    1,    1 ]
    NB   [     3,    0,    1,    0 ]

   @DF-UKS iter   2:  -128.87962511597942    1.63046e-01   9.35767e-02 DIIS/ADIIS/DAMP=1%
   @DF-UKS iter   3:  -129.47309250886087   -5.93467e-01   5.69151e-03 DIIS/ADIIS/DAMP=1%
   @DF-UKS iter   4:  -129.44779786663020    2.52946e-02   3.10916e-03 DIIS/ADIIS/DAMP=1%
   @DF-UKS iter   5:  -129.45022619535834   -2.42833e-03   5.60307e-04 DIIS/ADIIS/DAMP=1%
   @DF-UKS iter   6:  -129.44959741305709    6.28782e-04   1.25037e-04 DIIS/ADIIS/DAMP=1%
   @DF-UKS iter   7:  -129.44959976990432   -2.35685e-06   5.16892e-05 DIIS/DAMP=1%
   @DF-UKS iter   8:  -129.44960229277939   -2.52288e-06   6.76688e-06 DIIS/DAMP=1%
   @DF-UKS iter   9:  -129.44961107939810   -8.78662e-06   1.55676e-07 DIIS/DAMP=1%
   @DF-UKS iter  10:  -129.44961291088353   -1.83149e-06   1.45135e-08 DIIS/DAMP=1%
   @DF-UKS iter  11:  -129.44961290344233    7.44120e-09   1.93812e-09 DIIS/DAMP=1%
  Energy and wave function converged.


  ==> Post-Iterations <==

   Electrons on quadrature grid:
      Nalpha   =    7.0000003809 ; deviation = 3.809e-07
      Nbeta    =    4.0000000624 ; deviation = 6.235e-08
      Ntotal   =   11.0000004432 ; deviation = 4.432e-07 

   @Spin Contamination Metric:   1.799866054E-03
   @S^2 Expected:                3.750000000E+00
   @S^2 Observed:                3.751799866E+00
   @S   Expected:                1.500000000E+00
   @S   Observed:                1.500000000E+00

    Orbital Energies [Eh]
    ---------------------

    Alpha Occupied:                                                       

       1A1   -31.959172     2A1    -2.344004     3A1    -1.522745  
       1B2    -1.492149     1B1    -1.381245     4A1    -1.156965  
       5A1     0.437844  

    Alpha Virtual:                                                        

       2B2     0.603946     2B1     0.659455     6A1     0.820604  
       7A1     1.154950     3B2     1.669550     3B1     1.675999  
       8A1     2.129926     9A1     3.807194     1A2     3.809754  
       4B2     3.817153     4B1     3.899698    10A1     4.325243  

    Beta Occupied:                                                        

       1A1   -31.905134     2A1    -2.210780     3A1    -1.378785  
       1B1    -1.330206  

    Beta Virtual:                                                         

       1B2    -1.115636     4A1    -0.755541     2B1     0.688862  
       2B2     0.723677     5A1     0.737317     6A1     0.958002  
       7A1     1.248831     3B2     1.819933     3B1     1.821737  
       8A1     2.246163     1A2     3.930377     4B1     3.941613  
       9A1     3.945143     4B2     3.956015    10A1     4.420092  

    Final Occupation by Irrep:
             A1    A2    B1    B2 
    DOCC [     3,    0,    1,    0 ]
    SOCC [     2,    0,    0,    1 ]
    NA   [     5,    0,    1,    1 ]
    NB   [     3,    0,    1,    0 ]

  @DF-UKS Final Energy:  -129.44961290344233

   => Energetics <=

    Nuclear Repulsion Energy =              8.8196201778333343
    One-Electron Energy =                -192.7152411523479145
    Two-Electron Energy =                  65.0152543786058885
    DFT Exchange-Correlation Energy =     -10.5692463075336569
    Empirical Dispersion Energy =           0.0000000000000000
    VV10 Nonlocal Energy =                  0.0000000000000000
    Total Energy =                       -129.4496129034423291

  UHF NO Occupations:
  HONO-2 :    4 A1 1.0000000
  HONO-1 :    5 A1 1.0000000
  HONO-0 :    1 B2 1.0000000
  LUNO+0 :    6 A1 0.0005679
  LUNO+1 :    7 A1 0.0002577
  LUNO+2 :    2 B1 0.0000745
  LUNO+3 :    8 A1 0.0000000


Computation Completed


Properties will be evaluated at   0.000000,   0.000000,   0.000000 [a0]

Properties computed using the SCF density matrix


 Multipole Moments:

 ------------------------------------------------------------------------------------
     Multipole            Electronic (a.u.)      Nuclear  (a.u.)        Total (a.u.)
 ------------------------------------------------------------------------------------

 L = 1.  Multiply by 2.5417464519 to convert [e a0] to [Debye]
 Dipole X            :          0.0000000            0.0000000            0.0000000
 Dipole Y            :          0.0000000            0.0000000            0.0000000
 Dipole Z            :         -0.6749997           -0.0038891           -0.6788889
 Magnitude           :                                                    0.6788889

 ------------------------------------------------------------------------------------

*** tstop() called on Joses-MacBook-Pro-2.local at Thu Jul 17 12:29:31 2025
Module time:
	user time   =       1.17 seconds =       0.02 minutes
	system time =       2.42 seconds =       0.04 minutes
	total time  =          1 seconds =       0.02 minutes
Total time:
	user time   =       1.17 seconds =       0.02 minutes
	system time =       2.42 seconds =       0.04 minutes
	total time  =          1 seconds =       0.02 minutes

*** tstart() called on Joses-MacBook-Pro-2.local
*** at Thu Jul 17 12:29:31 2025


         ------------------------------------------------------------
                                   SCF GRAD                          
                          Rob Parrish, Justin Turney,                
                       Andy Simmonett, and Alex Sokolov              
         ------------------------------------------------------------

  ==> Geometry <==

    Molecular point group: c2v
    Full point group: C_inf_v

    Geometry (in Angstrom), charge = 1, multiplicity = 4:

       Center              X                  Y                   Z               Mass       
    ------------   -----------------  -----------------  -----------------  -----------------
         HE           0.000000000000     0.000000000000     0.999828497127     4.002603254130
         NE           0.000000000000     0.000000000000    -0.200171502873    19.992440176200

  Nuclear repulsion =    8.819620177833334

  ==> Basis Set <==

  Basis Set: CC-PVDZ
    Blend: CC-PVDZ
    Number of shells: 9
    Number of basis functions: 19
    Number of Cartesian functions: 20
    Spherical Harmonics?: true
    Max angular momentum: 2

  ==> DFJKGrad: Density-Fitted SCF Gradients <==

    Gradient:                    1
    J tasked:                  Yes
    K tasked:                  Yes
    wK tasked:                  No
    OpenMP threads:              1
    Integrals threads:           1
    Memory [MiB]:              375
    Schwarz Cutoff:          1E-12
    Fitting Condition:       1E-10

   => Auxiliary Basis Set <=

  Basis Set: (CC-PVDZ AUX)
    Blend: CC-PVDZ-JKFIT + DEF2-UNIVERSAL-JKFIT
    Number of shells: 33
    Number of basis functions: 93
    Number of Cartesian functions: 106
    Spherical Harmonics?: true
    Max angular momentum: 3

  ==> DFT Potential <==

   => LibXC <=

    Version 6.2.2
    S. Lehtola, C. Steigemann, M. J.T. Oliveira, and M. A.L. Marques.,  SoftwareX 7, 1–5 (2018) (10.1016/j.softx.2017.11.002)

   => Composite Functional: B3LYP <= 

    B3LYP Hyb-GGA Exchange-Correlation Functional

    P. J. Stephens, F. J. Devlin, C. F. Chabalowski, and M. J. Frisch.,  J. Phys. Chem. 98, 11623 (1994) (10.1021/j100096a001)

    Deriv               =              1
    GGA                 =           TRUE
    Meta                =          FALSE

    Exchange Hybrid     =           TRUE
    MP2 Hybrid          =          FALSE

   => Exchange Functionals <=

    0.0800   Slater exchange
    0.7200         Becke 88

   => Exact (HF) Exchange <=

    0.2000               HF 

   => Correlation Functionals <=

    0.1900   Vosko, Wilk & Nusair (VWN5_RPA)
    0.8100   Lee, Yang & Parr

   => LibXC Density Thresholds  <==

    XC_HYB_GGA_XC_B3LYP:  1.00E-15 

   => Molecular Quadrature <=

    Radial Scheme          =       TREUTLER
    Pruning Scheme         =           NONE
    Nuclear Scheme         =       TREUTLER

    Blocking Scheme        =         OCTREE
    BS radius alpha        =              1
    Pruning alpha          =              1
    Radial Points          =             75
    Spherical Points       =            302
    Total Points           =          43310
    Total Blocks           =            378
    Max Points             =            256
    Max Functions          =             19
    Weights Tolerance      =       1.00E-15


  -Total Gradient:
     Atom            X                  Y                   Z
    ------   -----------------  -----------------  -----------------
       1        0.000000000000     0.000000000000    -0.008722060629
       2        0.000000000000    -0.000000000000     0.008728848689


*** tstop() called on Joses-MacBook-Pro-2.local at Thu Jul 17 12:29:31 2025
Module time:
	user time   =       0.21 seconds =       0.00 minutes
	system time =       0.82 seconds =       0.01 minutes
	total time  =          0 seconds =       0.00 minutes
Total time:
	user time   =       1.39 seconds =       0.02 minutes
	system time =       3.24 seconds =       0.05 minutes
	total time  =          1 seconds =       0.02 minutes

    			-----------------------------------------

    			 OPTKING 3.0: for geometry optimizations 

    			     By R.A. King, Bethel University     

    			        with contributions from          

    			    A.V. Copan, J. Cayton, A. Heide      

    			-----------------------------------------

    
	                            ===> Fragment 1 <== 

	 Z (Atomic Numbers)          Masses                          Geom                  
	       2.000000             4.002603          0.00000000  0.00000000  1.88940203   
	      10.000000            19.992440          0.00000000  0.00000000 -0.37826932   

	 - Coordinate -           - BOHR/RAD -       - ANG/DEG -
	 R(1,2)           =         2.267671           1.200000


	        --- Internal Coordinate Step in ANG or DEG, aJ/ANG or AJ/DEG ---
	-------------------------------------------------------------------------------
	           Coordinate      Previous         Force          Change          New 
	           ----------      --------        ------          ------        ------
	               R(1,2)       1.20000        0.07189        0.01870       1.21870
	-------------------------------------------------------------------------------

	                                 ==> Convergence Check <==                                  
    
	Measures of convergence in internal coordinates in au.
    
	Criteria marked as inactive (o), active & met (*), and active & unmet ( ).

	----------------------------------------------------------------------------------------------
	   Step    Total Energy     Delta E     Max Force     RMS Force      Max Disp      RMS Disp   
	----------------------------------------------------------------------------------------------
	  Convergence Criteria     1.00e-06 *    3.00e-04 *             o    1.20e-03 *             o
	----------------------------------------------------------------------------------------------
	     1    -129.44961290   -1.29e+02      8.73e-03      8.73e-03 o    3.53e-02      3.53e-02 o  ~
	----------------------------------------------------------------------------------------------

Next Geometry in Ang 
	Fragment 1 (Ang)

	   He   0.0000000000   0.0000000000   1.0091767544
	   Ne   0.0000000000   0.0000000000  -0.2095197601


    Structure for next step:
    Molecular point group: c2v
    Full point group: C_inf_v

    Geometry (in Angstrom), charge = 1, multiplicity = 4:

    HE           0.000000000000     0.000000000000     1.015406253765
    NE           0.000000000000     0.000000000000    -0.203290260707


Scratch directory: /tmp/
gradient() will perform analytic gradient computation.
   => Libint2 <=

    Primary   basis highest AM E, G, H:  6, 6, 3
    Auxiliary basis highest AM E, G, H:  7, 7, 4
    Onebody   basis highest AM E, G, H:  -, -, -
    Solid Harmonics ordering:            Gaussian

*** tstart() called on Joses-MacBook-Pro-2.local
*** at Thu Jul 17 12:29:31 2025

   => Loading Basis Set <=

    Name: CC-PVDZ
    Role: ORBITAL
    Keyword: BASIS
    atoms 1 entry HE         line    32 file /Users/joseantoniorodriguesromero/anaconda3/share/psi4/basis/cc-pvdz.gbs 
    atoms 2 entry NE         line   258 file /Users/joseantoniorodriguesromero/anaconda3/share/psi4/basis/cc-pvdz.gbs 


         ---------------------------------------------------------
                                   SCF
               by Justin Turney, Rob Parrish, Andy Simmonett
                          and Daniel G. A. Smith
                              UKS Reference
                        1 Threads,    500 MiB Core
         ---------------------------------------------------------

  ==> Geometry <==

    Molecular point group: c2v
    Full point group: C_inf_v

    Geometry (in Angstrom), charge = 1, multiplicity = 4:

       Center              X                  Y                   Z               Mass       
    ------------   -----------------  -----------------  -----------------  -----------------
         HE           0.000000000000     0.000000000000     1.015406253765     4.002603254130
         NE           0.000000000000     0.000000000000    -0.203290260707    19.992440176200

  Running in c2v symmetry.

  Rotational constants: A = ************  B =      3.40344  C =      3.40344 [cm^-1]
  Rotational constants: A = ************  B = 102032.67021  C = 102032.67021 [MHz]
  Nuclear repulsion =    8.684314829594921

  Charge       = 1
  Multiplicity = 4
  Electrons    = 11
  Nalpha       = 7
  Nbeta        = 4

  ==> Algorithm <==

  SCF Algorithm Type is DF.
  DIIS enabled.
  MOM disabled.
  Fractional occupation disabled.
  Guess Type is READ.
  Energy threshold   = 1.00e-08
  Density threshold  = 1.00e-08
  Integral threshold = 1.00e-12

  ==> Primary Basis <==

  Basis Set: CC-PVDZ
    Blend: CC-PVDZ
    Number of shells: 9
    Number of basis functions: 19
    Number of Cartesian functions: 20
    Spherical Harmonics?: true
    Max angular momentum: 2

  ==> DFT Potential <==

   => LibXC <=

    Version 6.2.2
    S. Lehtola, C. Steigemann, M. J.T. Oliveira, and M. A.L. Marques.,  SoftwareX 7, 1–5 (2018) (10.1016/j.softx.2017.11.002)

   => Composite Functional: B3LYP <= 

    B3LYP Hyb-GGA Exchange-Correlation Functional

    P. J. Stephens, F. J. Devlin, C. F. Chabalowski, and M. J. Frisch.,  J. Phys. Chem. 98, 11623 (1994) (10.1021/j100096a001)

    Deriv               =              1
    GGA                 =           TRUE
    Meta                =          FALSE

    Exchange Hybrid     =           TRUE
    MP2 Hybrid          =          FALSE

   => Exchange Functionals <=

    0.0800   Slater exchange
    0.7200         Becke 88

   => Exact (HF) Exchange <=

    0.2000               HF 

   => Correlation Functionals <=

    0.1900   Vosko, Wilk & Nusair (VWN5_RPA)
    0.8100   Lee, Yang & Parr

   => LibXC Density Thresholds  <==

    XC_HYB_GGA_XC_B3LYP:  1.00E-15 

   => Molecular Quadrature <=

    Radial Scheme          =       TREUTLER
    Pruning Scheme         =           NONE
    Nuclear Scheme         =       TREUTLER

    Blocking Scheme        =         OCTREE
    BS radius alpha        =              1
    Pruning alpha          =              1
    Radial Points          =             75
    Spherical Points       =            302
    Total Points           =          43314
    Total Blocks           =            379
    Max Points             =            256
    Max Functions          =             19
    Weights Tolerance      =       1.00E-15

   => Loading Basis Set <=

    Name: (CC-PVDZ AUX)
    Role: JKFIT
    Keyword: DF_BASIS_SCF
    atoms 1 entry HE         line    34 file /Users/joseantoniorodriguesromero/anaconda3/share/psi4/basis/def2-universal-jkfit.gbs 
    atoms 2 entry NE         line   321 file /Users/joseantoniorodriguesromero/anaconda3/share/psi4/basis/cc-pvdz-jkfit.gbs 

   => Loading Basis Set <=

    Name: CC-PVDZ
    Role: ORBITAL
    Keyword: BASIS
    atoms 1 entry HE         line    32 file /Users/joseantoniorodriguesromero/anaconda3/share/psi4/basis/cc-pvdz.gbs 
    atoms 2 entry NE         line   258 file /Users/joseantoniorodriguesromero/anaconda3/share/psi4/basis/cc-pvdz.gbs 

  Reading orbitals from file /tmp/quartet_HeNe.default.73769.180.npy, no projection.

  ==> Integral Setup <==

  DFHelper Memory: AOs need 0.000 GiB; user supplied 0.343 GiB. 
  Using in-core AOs.

  ==> MemDFJK: Density-Fitted J/K Matrices <==

    J tasked:                   Yes
    K tasked:                   Yes
    wK tasked:                   No
    OpenMP threads:               1
    Memory [MiB]:               351
    Algorithm:                 Core
    Schwarz Cutoff:           1E-12
    Mask sparsity (%):       0.0000
    Fitting Condition:        1E-10

   => Auxiliary Basis Set <=

  Basis Set: (CC-PVDZ AUX)
    Blend: CC-PVDZ-JKFIT + DEF2-UNIVERSAL-JKFIT
    Number of shells: 33
    Number of basis functions: 93
    Number of Cartesian functions: 106
    Spherical Harmonics?: true
    Max angular momentum: 3

  Cached 100.0% of DFT collocation blocks in 0.023 [GiB].

  Minimum eigenvalue in the overlap matrix is 1.2309836061E-01.
  Reciprocal condition number of the overlap matrix is 5.4097923318E-02.
    Using symmetric orthogonalization.

  ==> Pre-Iterations <==

  SCF Guess: Orbitals guess was supplied from a previous computation.

   -------------------------------------------------------
    Irrep   Nso     Nmo     Nalpha   Nbeta   Ndocc  Nsocc
   -------------------------------------------------------
     A1        10      10       5       3       3       2
     A2         1       1       0       0       0       0
     B1         4       4       1       1       1       0
     B2         4       4       1       0       0       1
   -------------------------------------------------------
    Total      19      19       7       4       4       3
   -------------------------------------------------------

  ==> Iterations <==

                           Total Energy        Delta E     RMS |[F,P]|

   @DF-UKS iter   0:  -129.44673297005903   -1.29447e+02   6.14845e-03 
   @DF-UKS iter   1:  -129.44974811676457   -3.01515e-03   2.64172e-04 DIIS/ADIIS
   @DF-UKS iter   2:  -129.44975860536968   -1.04886e-05   1.02836e-04 DIIS/ADIIS/DAMP=1%
   @DF-UKS iter   3:  -129.44971695926500    4.16461e-05   8.84614e-05 DIIS/DAMP=1%
   @DF-UKS iter   4:  -129.44977977270113   -6.28134e-05   7.71523e-06 DIIS/DAMP=1%
   @DF-UKS iter   5:  -129.44976118678088    1.85859e-05   1.18358e-06 DIIS/DAMP=1%
   @DF-UKS iter   6:  -129.44976024270238    9.44078e-07   1.49256e-07 DIIS/DAMP=1%
   @DF-UKS iter   7:  -129.44976025719063   -1.44883e-08   1.06345e-08 DIIS/DAMP=1%
   @DF-UKS iter   8:  -129.44976025642427    7.66363e-10   1.12789e-09 DIIS/DAMP=1%
  Energy and wave function converged.


  ==> Post-Iterations <==

   Electrons on quadrature grid:
      Nalpha   =    7.0000004493 ; deviation = 4.493e-07
      Nbeta    =    4.0000000984 ; deviation = 9.844e-08
      Ntotal   =   11.0000005477 ; deviation = 5.477e-07 

   @Spin Contamination Metric:   1.740361714E-03
   @S^2 Expected:                3.750000000E+00
   @S^2 Observed:                3.751740362E+00
   @S   Expected:                1.500000000E+00
   @S   Observed:                1.500000000E+00

    Orbital Energies [Eh]
    ---------------------

    Alpha Occupied:                                                       

       1A1   -31.954565     2A1    -2.337437     3A1    -1.512068  
       1B2    -1.487429     1B1    -1.376552     4A1    -1.163325  
       5A1     0.445725  

    Alpha Virtual:                                                        

       2B2     0.607628     2B1     0.663224     6A1     0.819711  
       7A1     1.140894     3B2     1.671862     3B1     1.677936  
       8A1     2.139720     9A1     3.811353     1A2     3.814329  
       4B2     3.818066     4B1     3.900714    10A1     4.286754  

    Beta Occupied:                                                        

       1A1   -31.901279     2A1    -2.205641     3A1    -1.371015  
       1B1    -1.326095  

    Beta Virtual:                                                         

       1B2    -1.111656     4A1    -0.758519     2B1     0.692208  
       2B2     0.727080     5A1     0.747045     6A1     0.958409  
       7A1     1.234737     3B2     1.824521     3B1     1.826268  
       8A1     2.257225     1A2     3.934642     4B1     3.941220  
       9A1     3.949317     4B2     3.955501    10A1     4.379181  

    Final Occupation by Irrep:
             A1    A2    B1    B2 
    DOCC [     3,    0,    1,    0 ]
    SOCC [     2,    0,    0,    1 ]
    NA   [     5,    0,    1,    1 ]
    NB   [     3,    0,    1,    0 ]

  @DF-UKS Final Energy:  -129.44976025642427

   => Energetics <=

    Nuclear Repulsion Energy =              8.6843148295949213
    One-Electron Energy =                -192.4990706171474812
    Two-Electron Energy =                  64.9334074742191376
    DFT Exchange-Correlation Energy =     -10.5684119430908350
    Empirical Dispersion Energy =           0.0000000000000000
    VV10 Nonlocal Energy =                  0.0000000000000000
    Total Energy =                       -129.4497602564242698

  UHF NO Occupations:
  HONO-2 :    4 A1 1.0000000
  HONO-1 :    1 B2 1.0000000
  HONO-0 :    5 A1 1.0000000
  LUNO+0 :    6 A1 0.0005412
  LUNO+1 :    7 A1 0.0002563
  LUNO+2 :    2 B1 0.0000728
  LUNO+3 :    8 A1 0.0000000


Computation Completed


Properties will be evaluated at   0.000000,   0.000000,   0.000000 [a0]

Properties computed using the SCF density matrix


 Multipole Moments:

 ------------------------------------------------------------------------------------
     Multipole            Electronic (a.u.)      Nuclear  (a.u.)        Total (a.u.)
 ------------------------------------------------------------------------------------

 L = 1.  Multiply by 2.5417464519 to convert [e a0] to [Debye]
 Dipole X            :          0.0000000            0.0000000            0.0000000
 Dipole Y            :          0.0000000            0.0000000            0.0000000
 Dipole Z            :         -0.6669796           -0.0039497           -0.6709294
 Magnitude           :                                                    0.6709294

 ------------------------------------------------------------------------------------

*** tstop() called on Joses-MacBook-Pro-2.local at Thu Jul 17 12:29:31 2025
Module time:
	user time   =       0.81 seconds =       0.01 minutes
	system time =       3.27 seconds =       0.05 minutes
	total time  =          0 seconds =       0.00 minutes
Total time:
	user time   =       2.24 seconds =       0.04 minutes
	system time =       6.77 seconds =       0.11 minutes
	total time  =          1 seconds =       0.02 minutes

*** tstart() called on Joses-MacBook-Pro-2.local
*** at Thu Jul 17 12:29:31 2025


         ------------------------------------------------------------
                                   SCF GRAD                          
                          Rob Parrish, Justin Turney,                
                       Andy Simmonett, and Alex Sokolov              
         ------------------------------------------------------------

  ==> Geometry <==

    Molecular point group: c2v
    Full point group: C_inf_v

    Geometry (in Angstrom), charge = 1, multiplicity = 4:

       Center              X                  Y                   Z               Mass       
    ------------   -----------------  -----------------  -----------------  -----------------
         HE           0.000000000000     0.000000000000     1.015406253765     4.002603254130
         NE           0.000000000000     0.000000000000    -0.203290260707    19.992440176200

  Nuclear repulsion =    8.684314829594921

  ==> Basis Set <==

  Basis Set: CC-PVDZ
    Blend: CC-PVDZ
    Number of shells: 9
    Number of basis functions: 19
    Number of Cartesian functions: 20
    Spherical Harmonics?: true
    Max angular momentum: 2

  ==> DFJKGrad: Density-Fitted SCF Gradients <==

    Gradient:                    1
    J tasked:                  Yes
    K tasked:                  Yes
    wK tasked:                  No
    OpenMP threads:              1
    Integrals threads:           1
    Memory [MiB]:              375
    Schwarz Cutoff:          1E-12
    Fitting Condition:       1E-10

   => Auxiliary Basis Set <=

  Basis Set: (CC-PVDZ AUX)
    Blend: CC-PVDZ-JKFIT + DEF2-UNIVERSAL-JKFIT
    Number of shells: 33
    Number of basis functions: 93
    Number of Cartesian functions: 106
    Spherical Harmonics?: true
    Max angular momentum: 3

  ==> DFT Potential <==

   => LibXC <=

    Version 6.2.2
    S. Lehtola, C. Steigemann, M. J.T. Oliveira, and M. A.L. Marques.,  SoftwareX 7, 1–5 (2018) (10.1016/j.softx.2017.11.002)

   => Composite Functional: B3LYP <= 

    B3LYP Hyb-GGA Exchange-Correlation Functional

    P. J. Stephens, F. J. Devlin, C. F. Chabalowski, and M. J. Frisch.,  J. Phys. Chem. 98, 11623 (1994) (10.1021/j100096a001)

    Deriv               =              1
    GGA                 =           TRUE
    Meta                =          FALSE

    Exchange Hybrid     =           TRUE
    MP2 Hybrid          =          FALSE

   => Exchange Functionals <=

    0.0800   Slater exchange
    0.7200         Becke 88

   => Exact (HF) Exchange <=

    0.2000               HF 

   => Correlation Functionals <=

    0.1900   Vosko, Wilk & Nusair (VWN5_RPA)
    0.8100   Lee, Yang & Parr

   => LibXC Density Thresholds  <==

    XC_HYB_GGA_XC_B3LYP:  1.00E-15 

   => Molecular Quadrature <=

    Radial Scheme          =       TREUTLER
    Pruning Scheme         =           NONE
    Nuclear Scheme         =       TREUTLER

    Blocking Scheme        =         OCTREE
    BS radius alpha        =              1
    Pruning alpha          =              1
    Radial Points          =             75
    Spherical Points       =            302
    Total Points           =          43314
    Total Blocks           =            379
    Max Points             =            256
    Max Functions          =             19
    Weights Tolerance      =       1.00E-15


  -Total Gradient:
     Atom            X                  Y                   Z
    ------   -----------------  -----------------  -----------------
       1        0.000000000000     0.000000000000    -0.000060832985
       2        0.000000000000    -0.000000000000     0.000067974451


*** tstop() called on Joses-MacBook-Pro-2.local at Thu Jul 17 12:29:31 2025
Module time:
	user time   =       0.33 seconds =       0.01 minutes
	system time =       0.72 seconds =       0.01 minutes
	total time  =          0 seconds =       0.00 minutes
Total time:
	user time   =       2.57 seconds =       0.04 minutes
	system time =       7.49 seconds =       0.12 minutes
	total time  =          1 seconds =       0.02 minutes

    			-----------------------------------------

    			 OPTKING 3.0: for geometry optimizations 

    			     By R.A. King, Bethel University     

    			        with contributions from          

    			    A.V. Copan, J. Cayton, A. Heide      

    			-----------------------------------------

    
	                            ===> Fragment 1 <== 

	 Z (Atomic Numbers)          Masses                          Geom                  
	       2.000000             4.002603          0.00000000  0.00000000  1.91883973   
	      10.000000            19.992440          0.00000000  0.00000000 -0.38416292   

	 - Coordinate -           - BOHR/RAD -       - ANG/DEG -
	 R(1,2)           =         2.303003           1.218697


	        --- Internal Coordinate Step in ANG or DEG, aJ/ANG or AJ/DEG ---
	-------------------------------------------------------------------------------
	           Coordinate      Previous         Force          Change          New 
	           ----------      --------        ------          ------        ------
	               R(1,2)       1.21870        0.00053        0.00014       1.21884
	-------------------------------------------------------------------------------

	                                 ==> Convergence Check <==                                  
    
	Measures of convergence in internal coordinates in au.
    
	Criteria marked as inactive (o), active & met (*), and active & unmet ( ).

	----------------------------------------------------------------------------------------------
	   Step    Total Energy     Delta E     Max Force     RMS Force      Max Disp      RMS Disp   
	----------------------------------------------------------------------------------------------
	  Convergence Criteria     1.00e-06 *    3.00e-04 *             o    1.20e-03 *             o
	----------------------------------------------------------------------------------------------
	     2    -129.44976026   -1.47e-04      6.44e-05 *    6.44e-05 o    2.63e-04 *    2.63e-04 o  ~
	----------------------------------------------------------------------------------------------

Next Geometry in Ang 
	Fragment 1 (Ang)

	   He   0.0000000000   0.0000000000   1.0154757676
	   Ne   0.0000000000   0.0000000000  -0.2033597745


    Final optimized geometry and variables:
    Molecular point group: c2v
    Full point group: C_inf_v

    Geometry (in Angstrom), charge = 1, multiplicity = 4:

    HE           0.000000000000     0.000000000000     1.015406253765
    NE           0.000000000000     0.000000000000    -0.203290260707


    Psi4 stopped on: Thursday, 17 July 2025 12:29PM
    Psi4 wall time for execution: 0:00:01.82

*** Psi4 exiting successfully. Buy a developer a beer!
