
    -----------------------------------------------------------------------
          Psi4: An Open-Source Ab Initio Electronic Structure Package
                               Psi4 1.9.1 release

                         Git: Rev {} zzzzzzz 


    D. G. A. Smith, L. A. Burns, A. C. Simmonett, R. M. Parrish,
    M. C. Schieber, R. Galvelis, P. Kraus, H. Kruse, R. Di Remigio,
    A. Alenaizan, A. M. James, S. Lehtola, J. P. Misiewicz, M. Scheurer,
    R. A. Shaw, J. B. Schriber, Y. Xie, Z. L. Glick, D. A. Sirianni,
    J. S. O'Brien, J. M. Waldrop, A. Kumar, E. G. Hohenstein,
    B. P. Pritchard, B. R. Brooks, H. F. Schaefer III, A. Yu. Sokolov,
    K. Patkowski, A. E. DePrince III, U. Bozkaya, R. A. King,
    F. A. Evangelista, J. M. Turney, T. D. Crawford, C. D. Sherrill,
    J. Chem. Phys. 152(18) 184108 (2020). https://doi.org/10.1063/5.0006002

                            Additional Code Authors
    E. T. Seidl, C. L. Janssen, E. F. Valeev, M. L. Leininger,
    J. F. Gonthier, R. M. Richard, H. R. McAlexander, M. Saitow, X. Wang,
    P. Verma, M. H. Lechner, A. Jiang, S. Behnle, A. G. Heide,
    M. F. Herbst, and D. L. Poole

             Previous Authors, Complete List of Code Contributors,
                       and Citations for Specific Modules
    https://github.com/psi4/psi4/blob/master/codemeta.json
    https://github.com/psi4/psi4/graphs/contributors
    http://psicode.org/psi4manual/master/introduction.html#citing-psifour

    -----------------------------------------------------------------------


    Psi4 started on: Thursday, 17 July 2025 12:20PM

    Process ID: 73680
    Host:       Joses-MacBook-Pro-2.local
    PSIDATADIR: /Users/joseantoniorodriguesromero/anaconda3/share/psi4
    Memory:     500.0 MiB
    Threads:    1
    
  ==> Input File <==

--------------------------------------------------------------------------
molecule { 
1 6
H   0.00000        0.60000        0.00000
F   0.00000       -0.60000        0.00000
}

set { 
basis              cc-pvdz
reference          uks
maxiter            500
geom_maxiter       500
DAMPING_PERCENTAGE 1
guess              SAP
}

optimize('b3lyp')
--------------------------------------------------------------------------

Scratch directory: /tmp/
gradient() will perform analytic gradient computation.
   => Libint2 <=

    Primary   basis highest AM E, G, H:  6, 6, 3
    Auxiliary basis highest AM E, G, H:  7, 7, 4
    Onebody   basis highest AM E, G, H:  -, -, -
    Solid Harmonics ordering:            Gaussian

*** tstart() called on Joses-MacBook-Pro-2.local
*** at Thu Jul 17 12:20:38 2025

   => Loading Basis Set <=

    Name: CC-PVDZ
    Role: ORBITAL
    Keyword: BASIS
    atoms 1 entry H          line    22 file /Users/joseantoniorodriguesromero/anaconda3/share/psi4/basis/cc-pvdz.gbs 
    atoms 2 entry F          line   228 file /Users/joseantoniorodriguesromero/anaconda3/share/psi4/basis/cc-pvdz.gbs 


         ---------------------------------------------------------
                                   SCF
               by Justin Turney, Rob Parrish, Andy Simmonett
                          and Daniel G. A. Smith
                              UKS Reference
                        1 Threads,    500 MiB Core
         ---------------------------------------------------------

  ==> Geometry <==

    Molecular point group: c2v
    Full point group: C_inf_v

    Geometry (in Angstrom), charge = 1, multiplicity = 6:

       Center              X                  Y                   Z               Mass       
    ------------   -----------------  -----------------  -----------------  -----------------
         H            0.000000000000     0.000000000000     1.139549322996     1.007825032230
         F            0.000000000000     0.000000000000    -0.060450677004    18.998403162730

  Running in c2v symmetry.

  Rotational constants: A = ************  B =     12.23199  C =     12.23199 [cm^-1]
  Rotational constants: A = ************  B = 366705.72038  C = 366705.72038 [MHz]
  Nuclear repulsion =    3.968829080025001

  Charge       = 1
  Multiplicity = 6
  Electrons    = 9
  Nalpha       = 7
  Nbeta        = 2

  ==> Algorithm <==

  SCF Algorithm Type is DF.
  DIIS enabled.
  MOM disabled.
  Fractional occupation disabled.
  Guess Type is SAP.
  Energy threshold   = 1.00e-08
  Density threshold  = 1.00e-08
  Integral threshold = 1.00e-12

  ==> Primary Basis <==

  Basis Set: CC-PVDZ
    Blend: CC-PVDZ
    Number of shells: 9
    Number of basis functions: 19
    Number of Cartesian functions: 20
    Spherical Harmonics?: true
    Max angular momentum: 2

  ==> DFT Potential <==

   => LibXC <=

    Version 6.2.2
    S. Lehtola, C. Steigemann, M. J.T. Oliveira, and M. A.L. Marques.,  SoftwareX 7, 1–5 (2018) (10.1016/j.softx.2017.11.002)

   => Composite Functional: B3LYP <= 

    B3LYP Hyb-GGA Exchange-Correlation Functional

    P. J. Stephens, F. J. Devlin, C. F. Chabalowski, and M. J. Frisch.,  J. Phys. Chem. 98, 11623 (1994) (10.1021/j100096a001)

    Deriv               =              1
    GGA                 =           TRUE
    Meta                =          FALSE

    Exchange Hybrid     =           TRUE
    MP2 Hybrid          =          FALSE

   => Exchange Functionals <=

    0.0800   Slater exchange
    0.7200         Becke 88

   => Exact (HF) Exchange <=

    0.2000               HF 

   => Correlation Functionals <=

    0.1900   Vosko, Wilk & Nusair (VWN5_RPA)
    0.8100   Lee, Yang & Parr

   => LibXC Density Thresholds  <==

    XC_HYB_GGA_XC_B3LYP:  1.00E-15 

   => Molecular Quadrature <=

    Radial Scheme          =       TREUTLER
    Pruning Scheme         =           NONE
    Nuclear Scheme         =       TREUTLER

    Blocking Scheme        =         OCTREE
    BS radius alpha        =              1
    Pruning alpha          =              1
    Radial Points          =             75
    Spherical Points       =            302
    Total Points           =          44389
    Total Blocks           =            394
    Max Points             =            251
    Max Functions          =             19
    Weights Tolerance      =       1.00E-15

   => Loading Basis Set <=

    Name: (CC-PVDZ AUX)
    Role: JKFIT
    Keyword: DF_BASIS_SCF
    atoms 1 entry H          line    51 file /Users/joseantoniorodriguesromero/anaconda3/share/psi4/basis/cc-pvdz-jkfit.gbs 
    atoms 2 entry F          line   271 file /Users/joseantoniorodriguesromero/anaconda3/share/psi4/basis/cc-pvdz-jkfit.gbs 

  ==> Integral Setup <==

  DFHelper Memory: AOs need 0.000 GiB; user supplied 0.342 GiB. 
  Using in-core AOs.

  ==> MemDFJK: Density-Fitted J/K Matrices <==

    J tasked:                   Yes
    K tasked:                   Yes
    wK tasked:                   No
    OpenMP threads:               1
    Memory [MiB]:               350
    Algorithm:                 Core
    Schwarz Cutoff:           1E-12
    Mask sparsity (%):       0.0000
    Fitting Condition:        1E-10

   => Auxiliary Basis Set <=

  Basis Set: (CC-PVDZ AUX)
    Blend: CC-PVDZ-JKFIT
    Number of shells: 33
    Number of basis functions: 93
    Number of Cartesian functions: 106
    Spherical Harmonics?: true
    Max angular momentum: 3

  Cached 100.0% of DFT collocation blocks in 0.024 [GiB].

  Minimum eigenvalue in the overlap matrix is 9.0421244030E-02.
  Reciprocal condition number of the overlap matrix is 3.4800470596E-02.
    Using symmetric orthogonalization.

  ==> Pre-Iterations <==

  SCF Guess: Superposition of Atomic Potentials (doi:10.1021/acs.jctc.8b01089).

  ==> SAP guess <==

   => Molecular Quadrature <=

    Radial Scheme          =       TREUTLER
    Pruning Scheme         =           NONE
    Nuclear Scheme         =       TREUTLER

    Blocking Scheme        =         OCTREE
    BS radius alpha        =              1
    Pruning alpha          =              1
    Radial Points          =             75
    Spherical Points       =            302
    Total Points           =          44389
    Total Blocks           =            394
    Max Points             =            251
    Max Functions          =             19
    Weights Tolerance      =       1.00E-15

   -------------------------------------------------------
    Irrep   Nso     Nmo     Nalpha   Nbeta   Ndocc  Nsocc
   -------------------------------------------------------
     A1        10      10       5       2       2       3
     A2         1       1       0       0       0       0
     B1         4       4       1       0       0       1
     B2         4       4       1       0       0       1
   -------------------------------------------------------
    Total      19      19       7       2       2       5
   -------------------------------------------------------

  ==> Iterations <==

                           Total Energy        Delta E     RMS |[F,P]|

   @DF-UKS iter   1:   -97.88578613298030   -9.78858e+01   8.44844e-02 ADIIS/DIIS
   @DF-UKS iter   2:   -98.14409678396237   -2.58311e-01   3.58967e-02 ADIIS/DIIS/DAMP=1%
   @DF-UKS iter   3:   -98.23425746684376   -9.01607e-02   1.00000e-02 ADIIS/DIIS/DAMP=1%
   @DF-UKS iter   4:   -98.22979729968272    4.46017e-03   1.01298e-03 ADIIS/DIIS/DAMP=1%
   @DF-UKS iter   5:   -98.23110756943821   -1.31027e-03   2.01773e-04 ADIIS/DIIS/DAMP=1%
   @DF-UKS iter   6:   -98.23115773168463   -5.01622e-05   4.42738e-05 DIIS/DAMP=1%
   @DF-UKS iter   7:   -98.23116745000988   -9.71833e-06   1.54876e-06 DIIS/DAMP=1%
   @DF-UKS iter   8:   -98.23116575994797    1.69006e-06   1.84479e-07 DIIS/DAMP=1%
   @DF-UKS iter   9:   -98.23116567022304    8.97249e-08   3.82852e-09 DIIS/DAMP=1%
   @DF-UKS iter  10:   -98.23116565918131    1.10417e-08   1.16597e-09 DIIS/DAMP=1%
   @DF-UKS iter  11:   -98.23116565873610    4.45212e-10   9.96568e-11 DIIS/DAMP=1%
  Energy and wave function converged.


  ==> Post-Iterations <==

   Electrons on quadrature grid:
      Nalpha   =    6.9999998434 ; deviation = -1.566e-07
      Nbeta    =    1.9999999875 ; deviation = -1.255e-08
      Ntotal   =    8.9999998308 ; deviation = -1.692e-07 

   @Spin Contamination Metric:   1.372049251E-03
   @S^2 Expected:                8.750000000E+00
   @S^2 Observed:                8.751372049E+00
   @S   Expected:                2.500000000E+00
   @S   Observed:                2.500000000E+00

    Orbital Energies [Eh]
    ---------------------

    Alpha Occupied:                                                       

       1A1   -26.169803     2A1    -2.388714     3A1    -1.675826  
       1B2    -1.650462     1B1    -1.650462     4A1    -0.575325  
       5A1    -0.027620  

    Alpha Virtual:                                                        

       2B1     0.223071     2B2     0.223071     6A1     0.312430  
       7A1     0.819507     3B2     0.905845     3B1     0.905845  
       8A1     1.259865     1A2     2.345009     9A1     2.345009  
       4B2     2.457735     4B1     2.457735    10A1     3.090110  

    Beta Occupied:                                                        

       1A1   -26.050465     2A1    -2.075550  

    Beta Virtual:                                                         

       3A1    -1.235074     1B2    -1.223799     1B1    -1.223799  
       4A1    -0.273208     5A1     0.255262     2B1     0.341780  
       2B2     0.341780     6A1     0.474355     7A1     0.969632  
       3B2     1.076392     3B1     1.076392     8A1     1.433819  
       1A2     2.577310     9A1     2.577312     4B2     2.688789  
       4B1     2.688789    10A1     3.326783  

    Final Occupation by Irrep:
             A1    A2    B1    B2 
    DOCC [     2,    0,    0,    0 ]
    SOCC [     3,    0,    1,    1 ]
    NA   [     5,    0,    1,    1 ]
    NB   [     2,    0,    0,    0 ]

  @DF-UKS Final Energy:   -98.23116565873610

   => Energetics <=

    Nuclear Repulsion Energy =              3.9688290800250008
    One-Electron Energy =                -136.2909340154882614
    Two-Electron Energy =                  42.2391722513106913
    DFT Exchange-Correlation Energy =      -8.1482329745835287
    Empirical Dispersion Energy =           0.0000000000000000
    VV10 Nonlocal Energy =                  0.0000000000000000
    Total Energy =                        -98.2311656587361028

  UHF NO Occupations:
  HONO-2 :    5 A1 1.0000000
  HONO-1 :    1 B2 1.0000000
  HONO-0 :    1 B1 1.0000000
  LUNO+0 :    6 A1 0.0006863
  LUNO+1 :    7 A1 0.0000000
  LUNO+2 :    8 A1 0.0000000
  LUNO+3 :    2 B1 0.0000000


Computation Completed


Properties will be evaluated at   0.000000,   0.000000,   0.000000 [a0]

Properties computed using the SCF density matrix


 Multipole Moments:

 ------------------------------------------------------------------------------------
     Multipole            Electronic (a.u.)      Nuclear  (a.u.)        Total (a.u.)
 ------------------------------------------------------------------------------------

 L = 1.  Multiply by 2.5417464519 to convert [e a0] to [Debye]
 Dipole X            :          0.0000000            0.0000000            0.0000000
 Dipole Y            :          0.0000000            0.0000000            0.0000000
 Dipole Z            :         -3.2990215            1.1253191           -2.1737024
 Magnitude           :                                                    2.1737024

 ------------------------------------------------------------------------------------

*** tstop() called on Joses-MacBook-Pro-2.local at Thu Jul 17 12:20:39 2025
Module time:
	user time   =       1.11 seconds =       0.02 minutes
	system time =       2.45 seconds =       0.04 minutes
	total time  =          1 seconds =       0.02 minutes
Total time:
	user time   =       1.11 seconds =       0.02 minutes
	system time =       2.45 seconds =       0.04 minutes
	total time  =          1 seconds =       0.02 minutes

*** tstart() called on Joses-MacBook-Pro-2.local
*** at Thu Jul 17 12:20:39 2025


         ------------------------------------------------------------
                                   SCF GRAD                          
                          Rob Parrish, Justin Turney,                
                       Andy Simmonett, and Alex Sokolov              
         ------------------------------------------------------------

  ==> Geometry <==

    Molecular point group: c2v
    Full point group: C_inf_v

    Geometry (in Angstrom), charge = 1, multiplicity = 6:

       Center              X                  Y                   Z               Mass       
    ------------   -----------------  -----------------  -----------------  -----------------
         H            0.000000000000     0.000000000000     1.139549322996     1.007825032230
         F            0.000000000000     0.000000000000    -0.060450677004    18.998403162730

  Nuclear repulsion =    3.968829080025001

  ==> Basis Set <==

  Basis Set: CC-PVDZ
    Blend: CC-PVDZ
    Number of shells: 9
    Number of basis functions: 19
    Number of Cartesian functions: 20
    Spherical Harmonics?: true
    Max angular momentum: 2

  ==> DFJKGrad: Density-Fitted SCF Gradients <==

    Gradient:                    1
    J tasked:                  Yes
    K tasked:                  Yes
    wK tasked:                  No
    OpenMP threads:              1
    Integrals threads:           1
    Memory [MiB]:              375
    Schwarz Cutoff:          1E-12
    Fitting Condition:       1E-10

   => Auxiliary Basis Set <=

  Basis Set: (CC-PVDZ AUX)
    Blend: CC-PVDZ-JKFIT
    Number of shells: 33
    Number of basis functions: 93
    Number of Cartesian functions: 106
    Spherical Harmonics?: true
    Max angular momentum: 3

  ==> DFT Potential <==

   => LibXC <=

    Version 6.2.2
    S. Lehtola, C. Steigemann, M. J.T. Oliveira, and M. A.L. Marques.,  SoftwareX 7, 1–5 (2018) (10.1016/j.softx.2017.11.002)

   => Composite Functional: B3LYP <= 

    B3LYP Hyb-GGA Exchange-Correlation Functional

    P. J. Stephens, F. J. Devlin, C. F. Chabalowski, and M. J. Frisch.,  J. Phys. Chem. 98, 11623 (1994) (10.1021/j100096a001)

    Deriv               =              1
    GGA                 =           TRUE
    Meta                =          FALSE

    Exchange Hybrid     =           TRUE
    MP2 Hybrid          =          FALSE

   => Exchange Functionals <=

    0.0800   Slater exchange
    0.7200         Becke 88

   => Exact (HF) Exchange <=

    0.2000               HF 

   => Correlation Functionals <=

    0.1900   Vosko, Wilk & Nusair (VWN5_RPA)
    0.8100   Lee, Yang & Parr

   => LibXC Density Thresholds  <==

    XC_HYB_GGA_XC_B3LYP:  1.00E-15 

   => Molecular Quadrature <=

    Radial Scheme          =       TREUTLER
    Pruning Scheme         =           NONE
    Nuclear Scheme         =       TREUTLER

    Blocking Scheme        =         OCTREE
    BS radius alpha        =              1
    Pruning alpha          =              1
    Radial Points          =             75
    Spherical Points       =            302
    Total Points           =          44389
    Total Blocks           =            394
    Max Points             =            251
    Max Functions          =             19
    Weights Tolerance      =       1.00E-15


  -Total Gradient:
     Atom            X                  Y                   Z
    ------   -----------------  -----------------  -----------------
       1        0.000000000000     0.000000000000    -0.226728417166
       2        0.000000000000    -0.000000000000     0.226729567642


*** tstop() called on Joses-MacBook-Pro-2.local at Thu Jul 17 12:20:39 2025
Module time:
	user time   =       0.24 seconds =       0.00 minutes
	system time =       0.82 seconds =       0.01 minutes
	total time  =          0 seconds =       0.00 minutes
Total time:
	user time   =       1.35 seconds =       0.02 minutes
	system time =       3.27 seconds =       0.05 minutes
	total time  =          1 seconds =       0.02 minutes

    			-----------------------------------------

    			 OPTKING 3.0: for geometry optimizations 

    			     By R.A. King, Bethel University     

    			        with contributions from          

    			    A.V. Copan, J. Cayton, A. Heide      

    			-----------------------------------------

    
	                            ===> Fragment 1 <== 

	 Z (Atomic Numbers)          Masses                          Geom                  
	       1.000000             1.007825          0.00000000  0.00000000  2.15343613   
	       9.000000            18.998403          0.00000000  0.00000000 -0.11423522   

	 - Coordinate -           - BOHR/RAD -       - ANG/DEG -
	 R(1,2)           =         2.267671           1.200000


	        --- Internal Coordinate Step in ANG or DEG, aJ/ANG or AJ/DEG ---
	-------------------------------------------------------------------------------
	           Coordinate      Previous         Force          Change          New 
	           ----------      --------        ------          ------        ------
	               R(1,2)       1.20000        1.86796        0.26459       1.46459
	-------------------------------------------------------------------------------

	                                 ==> Convergence Check <==                                  
    
	Measures of convergence in internal coordinates in au.
    
	Criteria marked as inactive (o), active & met (*), and active & unmet ( ).

	----------------------------------------------------------------------------------------------
	   Step    Total Energy     Delta E     Max Force     RMS Force      Max Disp      RMS Disp   
	----------------------------------------------------------------------------------------------
	  Convergence Criteria     1.00e-06 *    3.00e-04 *             o    1.20e-03 *             o
	----------------------------------------------------------------------------------------------
	     1     -98.23116566   -9.82e+01      2.27e-01      2.27e-01 o    5.00e-01      5.00e-01 o  ~
	----------------------------------------------------------------------------------------------

Next Geometry in Ang 
	Fragment 1 (Ang)

	    H   0.0000000000   0.0000000000   1.2718448773
	    F   0.0000000000   0.0000000000  -0.1927462313


    Structure for next step:
    Molecular point group: c2v
    Full point group: C_inf_v

    Geometry (in Angstrom), charge = 1, multiplicity = 6:

    H            0.000000000000     0.000000000000     1.390811505202
    F            0.000000000000     0.000000000000    -0.073779603372


Scratch directory: /tmp/
gradient() will perform analytic gradient computation.
   => Libint2 <=

    Primary   basis highest AM E, G, H:  6, 6, 3
    Auxiliary basis highest AM E, G, H:  7, 7, 4
    Onebody   basis highest AM E, G, H:  -, -, -
    Solid Harmonics ordering:            Gaussian

*** tstart() called on Joses-MacBook-Pro-2.local
*** at Thu Jul 17 12:20:39 2025

   => Loading Basis Set <=

    Name: CC-PVDZ
    Role: ORBITAL
    Keyword: BASIS
    atoms 1 entry H          line    22 file /Users/joseantoniorodriguesromero/anaconda3/share/psi4/basis/cc-pvdz.gbs 
    atoms 2 entry F          line   228 file /Users/joseantoniorodriguesromero/anaconda3/share/psi4/basis/cc-pvdz.gbs 


         ---------------------------------------------------------
                                   SCF
               by Justin Turney, Rob Parrish, Andy Simmonett
                          and Daniel G. A. Smith
                              UKS Reference
                        1 Threads,    500 MiB Core
         ---------------------------------------------------------

  ==> Geometry <==

    Molecular point group: c2v
    Full point group: C_inf_v

    Geometry (in Angstrom), charge = 1, multiplicity = 6:

       Center              X                  Y                   Z               Mass       
    ------------   -----------------  -----------------  -----------------  -----------------
         H            0.000000000000     0.000000000000     1.390811505202     1.007825032230
         F            0.000000000000     0.000000000000    -0.073779603372    18.998403162730

  Running in c2v symmetry.

  Rotational constants: A = ************  B =      8.21158  C =      8.21158 [cm^-1]
  Rotational constants: A = ************  B = 246176.95207  C = 246176.95207 [MHz]
  Nuclear repulsion =    3.251825624331454

  Charge       = 1
  Multiplicity = 6
  Electrons    = 9
  Nalpha       = 7
  Nbeta        = 2

  ==> Algorithm <==

  SCF Algorithm Type is DF.
  DIIS enabled.
  MOM disabled.
  Fractional occupation disabled.
  Guess Type is READ.
  Energy threshold   = 1.00e-08
  Density threshold  = 1.00e-08
  Integral threshold = 1.00e-12

  ==> Primary Basis <==

  Basis Set: CC-PVDZ
    Blend: CC-PVDZ
    Number of shells: 9
    Number of basis functions: 19
    Number of Cartesian functions: 20
    Spherical Harmonics?: true
    Max angular momentum: 2

  ==> DFT Potential <==

   => LibXC <=

    Version 6.2.2
    S. Lehtola, C. Steigemann, M. J.T. Oliveira, and M. A.L. Marques.,  SoftwareX 7, 1–5 (2018) (10.1016/j.softx.2017.11.002)

   => Composite Functional: B3LYP <= 

    B3LYP Hyb-GGA Exchange-Correlation Functional

    P. J. Stephens, F. J. Devlin, C. F. Chabalowski, and M. J. Frisch.,  J. Phys. Chem. 98, 11623 (1994) (10.1021/j100096a001)

    Deriv               =              1
    GGA                 =           TRUE
    Meta                =          FALSE

    Exchange Hybrid     =           TRUE
    MP2 Hybrid          =          FALSE

   => Exchange Functionals <=

    0.0800   Slater exchange
    0.7200         Becke 88

   => Exact (HF) Exchange <=

    0.2000               HF 

   => Correlation Functionals <=

    0.1900   Vosko, Wilk & Nusair (VWN5_RPA)
    0.8100   Lee, Yang & Parr

   => LibXC Density Thresholds  <==

    XC_HYB_GGA_XC_B3LYP:  1.00E-15 

   => Molecular Quadrature <=

    Radial Scheme          =       TREUTLER
    Pruning Scheme         =           NONE
    Nuclear Scheme         =       TREUTLER

    Blocking Scheme        =         OCTREE
    BS radius alpha        =              1
    Pruning alpha          =              1
    Radial Points          =             75
    Spherical Points       =            302
    Total Points           =          44411
    Total Blocks           =            394
    Max Points             =            256
    Max Functions          =             19
    Weights Tolerance      =       1.00E-15

   => Loading Basis Set <=

    Name: (CC-PVDZ AUX)
    Role: JKFIT
    Keyword: DF_BASIS_SCF
    atoms 1 entry H          line    51 file /Users/joseantoniorodriguesromero/anaconda3/share/psi4/basis/cc-pvdz-jkfit.gbs 
    atoms 2 entry F          line   271 file /Users/joseantoniorodriguesromero/anaconda3/share/psi4/basis/cc-pvdz-jkfit.gbs 

   => Loading Basis Set <=

    Name: CC-PVDZ
    Role: ORBITAL
    Keyword: BASIS
    atoms 1 entry H          line    22 file /Users/joseantoniorodriguesromero/anaconda3/share/psi4/basis/cc-pvdz.gbs 
    atoms 2 entry F          line   228 file /Users/joseantoniorodriguesromero/anaconda3/share/psi4/basis/cc-pvdz.gbs 

  Reading orbitals from file /tmp/sextet_HF.default.73680.180.npy, no projection.

  ==> Integral Setup <==

  DFHelper Memory: AOs need 0.000 GiB; user supplied 0.342 GiB. 
  Using in-core AOs.

  ==> MemDFJK: Density-Fitted J/K Matrices <==

    J tasked:                   Yes
    K tasked:                   Yes
    wK tasked:                   No
    OpenMP threads:               1
    Memory [MiB]:               350
    Algorithm:                 Core
    Schwarz Cutoff:           1E-12
    Mask sparsity (%):       0.0000
    Fitting Condition:        1E-10

   => Auxiliary Basis Set <=

  Basis Set: (CC-PVDZ AUX)
    Blend: CC-PVDZ-JKFIT
    Number of shells: 33
    Number of basis functions: 93
    Number of Cartesian functions: 106
    Spherical Harmonics?: true
    Max angular momentum: 3

  Cached 100.0% of DFT collocation blocks in 0.024 [GiB].

  Minimum eigenvalue in the overlap matrix is 1.2903939173E-01.
  Reciprocal condition number of the overlap matrix is 5.5272484602E-02.
    Using symmetric orthogonalization.

  ==> Pre-Iterations <==

  SCF Guess: Orbitals guess was supplied from a previous computation.

   -------------------------------------------------------
    Irrep   Nso     Nmo     Nalpha   Nbeta   Ndocc  Nsocc
   -------------------------------------------------------
     A1        10      10       5       2       2       3
     A2         1       1       0       0       0       0
     B1         4       4       1       0       0       1
     B2         4       4       1       0       0       1
   -------------------------------------------------------
    Total      19      19       7       2       2       5
   -------------------------------------------------------

  ==> Iterations <==

                           Total Energy        Delta E     RMS |[F,P]|

   @DF-UKS iter   0:   -98.37239338473175   -9.83724e+01   4.79529e-02 
   @DF-UKS iter   1:   -98.28191383816944    9.04795e-02   3.04178e-03 ADIIS/DIIS
   @DF-UKS iter   2:   -98.28235534835112   -4.41510e-04   1.20829e-03 ADIIS/DIIS/DAMP=1%
   @DF-UKS iter   3:   -98.28242292265773   -6.75743e-05   8.64223e-05 DIIS/DAMP=1%
   @DF-UKS iter   4:   -98.28243795172249   -1.50291e-05   3.75565e-05 DIIS/DAMP=1%
   @DF-UKS iter   5:   -98.28240808449740    2.98672e-05   1.75392e-06 DIIS/DAMP=1%
   @DF-UKS iter   6:   -98.28241496410735   -6.87961e-06   3.28041e-07 DIIS/DAMP=1%
   @DF-UKS iter   7:   -98.28241457356583    3.90542e-07   8.40430e-08 DIIS/DAMP=1%
   @DF-UKS iter   8:   -98.28241463315307   -5.95872e-08   5.97749e-09 DIIS/DAMP=1%
   @DF-UKS iter   9:   -98.28241462099653    1.21565e-08   2.49102e-10 DIIS/DAMP=1%
   @DF-UKS iter  10:   -98.28241462193495   -9.38414e-10   4.13602e-11 DIIS/DAMP=1%
  Energy and wave function converged.


  ==> Post-Iterations <==

   Electrons on quadrature grid:
      Nalpha   =    7.0000004686 ; deviation = 4.686e-07
      Nbeta    =    1.9999999908 ; deviation = -9.164e-09
      Ntotal   =    9.0000004594 ; deviation = 4.594e-07 

   @Spin Contamination Metric:   1.433203335E-03
   @S^2 Expected:                8.750000000E+00
   @S^2 Observed:                8.751433203E+00
   @S   Expected:                2.500000000E+00
   @S   Observed:                2.500000000E+00

    Orbital Energies [Eh]
    ---------------------

    Alpha Occupied:                                                       

       1A1   -26.174834     2A1    -2.381776     3A1    -1.655899  
       1B2    -1.649334     1B1    -1.649334     4A1    -0.563761  
       5A1     0.038452  

    Alpha Virtual:                                                        

       2B1     0.227470     2B2     0.227470     6A1     0.340272  
       7A1     0.630651     3B2     0.996992     3B1     0.996992  
       8A1     1.327354     9A1     2.345939     1A2     2.345940  
       4B1     2.374250     4B2     2.374250    10A1     2.678781  

    Beta Occupied:                                                        

       1A1   -26.056732     2A1    -2.070420  

    Beta Virtual:                                                         

       1B1    -1.223430     1B2    -1.223430     3A1    -1.218607  
       4A1    -0.263672     5A1     0.310673     2B1     0.342184  
       2B2     0.342184     6A1     0.533822     7A1     0.785721  
       3B1     1.184489     3B2     1.184489     8A1     1.493480  
       9A1     2.577306     1A2     2.577311     4B2     2.605729  
       4B1     2.605729    10A1     2.910225  

    Final Occupation by Irrep:
             A1    A2    B1    B2 
    DOCC [     2,    0,    0,    0 ]
    SOCC [     3,    0,    1,    1 ]
    NA   [     5,    0,    1,    1 ]
    NB   [     2,    0,    0,    0 ]

  @DF-UKS Final Energy:   -98.28241462193495

   => Energetics <=

    Nuclear Repulsion Energy =              3.2518256243314543
    One-Electron Energy =                -135.0806608497014452
    Two-Electron Energy =                  41.6639138679257783
    DFT Exchange-Correlation Energy =      -8.1174932644907258
    Empirical Dispersion Energy =           0.0000000000000000
    VV10 Nonlocal Energy =                  0.0000000000000000
    Total Energy =                        -98.2824146219349473

  UHF NO Occupations:
  HONO-2 :    4 A1 1.0000000
  HONO-1 :    1 B1 1.0000000
  HONO-0 :    5 A1 1.0000000
  LUNO+0 :    6 A1 0.0007168
  LUNO+1 :    7 A1 0.0000000
  LUNO+2 :    2 B1 0.0000000
  LUNO+3 :    2 B2 0.0000000


Computation Completed


Properties will be evaluated at   0.000000,   0.000000,   0.000000 [a0]

Properties computed using the SCF density matrix


 Multipole Moments:

 ------------------------------------------------------------------------------------
     Multipole            Electronic (a.u.)      Nuclear  (a.u.)        Total (a.u.)
 ------------------------------------------------------------------------------------

 L = 1.  Multiply by 2.5417464519 to convert [e a0] to [Debye]
 Dipole X            :          0.0000000            0.0000000            0.0000000
 Dipole Y            :          0.0000000            0.0000000            0.0000000
 Dipole Z            :         -3.7515469            1.3734436           -2.3781033
 Magnitude           :                                                    2.3781033

 ------------------------------------------------------------------------------------

*** tstop() called on Joses-MacBook-Pro-2.local at Thu Jul 17 12:20:39 2025
Module time:
	user time   =       0.97 seconds =       0.02 minutes
	system time =       3.18 seconds =       0.05 minutes
	total time  =          0 seconds =       0.00 minutes
Total time:
	user time   =       2.36 seconds =       0.04 minutes
	system time =       6.68 seconds =       0.11 minutes
	total time  =          1 seconds =       0.02 minutes

*** tstart() called on Joses-MacBook-Pro-2.local
*** at Thu Jul 17 12:20:39 2025


         ------------------------------------------------------------
                                   SCF GRAD                          
                          Rob Parrish, Justin Turney,                
                       Andy Simmonett, and Alex Sokolov              
         ------------------------------------------------------------

  ==> Geometry <==

    Molecular point group: c2v
    Full point group: C_inf_v

    Geometry (in Angstrom), charge = 1, multiplicity = 6:

       Center              X                  Y                   Z               Mass       
    ------------   -----------------  -----------------  -----------------  -----------------
         H            0.000000000000     0.000000000000     1.390811505202     1.007825032230
         F            0.000000000000     0.000000000000    -0.073779603372    18.998403162730

  Nuclear repulsion =    3.251825624331454

  ==> Basis Set <==

  Basis Set: CC-PVDZ
    Blend: CC-PVDZ
    Number of shells: 9
    Number of basis functions: 19
    Number of Cartesian functions: 20
    Spherical Harmonics?: true
    Max angular momentum: 2

  ==> DFJKGrad: Density-Fitted SCF Gradients <==

    Gradient:                    1
    J tasked:                  Yes
    K tasked:                  Yes
    wK tasked:                  No
    OpenMP threads:              1
    Integrals threads:           1
    Memory [MiB]:              375
    Schwarz Cutoff:          1E-12
    Fitting Condition:       1E-10

   => Auxiliary Basis Set <=

  Basis Set: (CC-PVDZ AUX)
    Blend: CC-PVDZ-JKFIT
    Number of shells: 33
    Number of basis functions: 93
    Number of Cartesian functions: 106
    Spherical Harmonics?: true
    Max angular momentum: 3

  ==> DFT Potential <==

   => LibXC <=

    Version 6.2.2
    S. Lehtola, C. Steigemann, M. J.T. Oliveira, and M. A.L. Marques.,  SoftwareX 7, 1–5 (2018) (10.1016/j.softx.2017.11.002)

   => Composite Functional: B3LYP <= 

    B3LYP Hyb-GGA Exchange-Correlation Functional

    P. J. Stephens, F. J. Devlin, C. F. Chabalowski, and M. J. Frisch.,  J. Phys. Chem. 98, 11623 (1994) (10.1021/j100096a001)

    Deriv               =              1
    GGA                 =           TRUE
    Meta                =          FALSE

    Exchange Hybrid     =           TRUE
    MP2 Hybrid          =          FALSE

   => Exchange Functionals <=

    0.0800   Slater exchange
    0.7200         Becke 88

   => Exact (HF) Exchange <=

    0.2000               HF 

   => Correlation Functionals <=

    0.1900   Vosko, Wilk & Nusair (VWN5_RPA)
    0.8100   Lee, Yang & Parr

   => LibXC Density Thresholds  <==

    XC_HYB_GGA_XC_B3LYP:  1.00E-15 

   => Molecular Quadrature <=

    Radial Scheme          =       TREUTLER
    Pruning Scheme         =           NONE
    Nuclear Scheme         =       TREUTLER

    Blocking Scheme        =         OCTREE
    BS radius alpha        =              1
    Pruning alpha          =              1
    Radial Points          =             75
    Spherical Points       =            302
    Total Points           =          44411
    Total Blocks           =            394
    Max Points             =            256
    Max Functions          =             19
    Weights Tolerance      =       1.00E-15


  -Total Gradient:
     Atom            X                  Y                   Z
    ------   -----------------  -----------------  -----------------
       1        0.000000000000     0.000000000000    -0.008885846891
       2       -0.000000000000     0.000000000000     0.008888329784


*** tstop() called on Joses-MacBook-Pro-2.local at Thu Jul 17 12:20:40 2025
Module time:
	user time   =       0.30 seconds =       0.00 minutes
	system time =       0.72 seconds =       0.01 minutes
	total time  =          1 seconds =       0.02 minutes
Total time:
	user time   =       2.66 seconds =       0.04 minutes
	system time =       7.40 seconds =       0.12 minutes
	total time  =          2 seconds =       0.03 minutes

    			-----------------------------------------

    			 OPTKING 3.0: for geometry optimizations 

    			     By R.A. King, Bethel University     

    			        with contributions from          

    			    A.V. Copan, J. Cayton, A. Heide      

    			-----------------------------------------

    
	                            ===> Fragment 1 <== 

	 Z (Atomic Numbers)          Masses                          Geom                  
	       1.000000             1.007825          0.00000000  0.00000000  2.62825284   
	       9.000000            18.998403          0.00000000  0.00000000 -0.13942324   

	 - Coordinate -           - BOHR/RAD -       - ANG/DEG -
	 R(1,2)           =         2.767676           1.464591


	        --- Internal Coordinate Step in ANG or DEG, aJ/ANG or AJ/DEG ---
	-------------------------------------------------------------------------------
	           Coordinate      Previous         Force          Change          New 
	           ----------      --------        ------          ------        ------
	               R(1,2)       1.46459        0.07322        0.01079       1.47538
	-------------------------------------------------------------------------------

	                                 ==> Convergence Check <==                                  
    
	Measures of convergence in internal coordinates in au.
    
	Criteria marked as inactive (o), active & met (*), and active & unmet ( ).

	----------------------------------------------------------------------------------------------
	   Step    Total Energy     Delta E     Max Force     RMS Force      Max Disp      RMS Disp   
	----------------------------------------------------------------------------------------------
	  Convergence Criteria     1.00e-06 *    3.00e-04 *             o    1.20e-03 *             o
	----------------------------------------------------------------------------------------------
	     2     -98.28241462   -5.12e-02      8.89e-03      8.89e-03 o    2.04e-02      2.04e-02 o  ~
	----------------------------------------------------------------------------------------------

Next Geometry in Ang 
	Fragment 1 (Ang)

	    H   0.0000000000   0.0000000000   1.3962063969
	    F   0.0000000000   0.0000000000  -0.0791744951


    Structure for next step:
    Molecular point group: c2v
    Full point group: C_inf_v

    Geometry (in Angstrom), charge = 1, multiplicity = 6:

    H            0.000000000000     0.000000000000     1.401057747186
    F            0.000000000000     0.000000000000    -0.074323144799


Scratch directory: /tmp/
gradient() will perform analytic gradient computation.
   => Libint2 <=

    Primary   basis highest AM E, G, H:  6, 6, 3
    Auxiliary basis highest AM E, G, H:  7, 7, 4
    Onebody   basis highest AM E, G, H:  -, -, -
    Solid Harmonics ordering:            Gaussian

*** tstart() called on Joses-MacBook-Pro-2.local
*** at Thu Jul 17 12:20:40 2025

   => Loading Basis Set <=

    Name: CC-PVDZ
    Role: ORBITAL
    Keyword: BASIS
    atoms 1 entry H          line    22 file /Users/joseantoniorodriguesromero/anaconda3/share/psi4/basis/cc-pvdz.gbs 
    atoms 2 entry F          line   228 file /Users/joseantoniorodriguesromero/anaconda3/share/psi4/basis/cc-pvdz.gbs 


         ---------------------------------------------------------
                                   SCF
               by Justin Turney, Rob Parrish, Andy Simmonett
                          and Daniel G. A. Smith
                              UKS Reference
                        1 Threads,    500 MiB Core
         ---------------------------------------------------------

  ==> Geometry <==

    Molecular point group: c2v
    Full point group: C_inf_v

    Geometry (in Angstrom), charge = 1, multiplicity = 6:

       Center              X                  Y                   Z               Mass       
    ------------   -----------------  -----------------  -----------------  -----------------
         H            0.000000000000     0.000000000000     1.401057747186     1.007825032230
         F            0.000000000000     0.000000000000    -0.074323144799    18.998403162730

  Running in c2v symmetry.

  Rotational constants: A = ************  B =      8.09191  C =      8.09191 [cm^-1]
  Rotational constants: A = ************  B = 242589.42652  C = 242589.42652 [MHz]
  Nuclear repulsion =    3.228044311746297

  Charge       = 1
  Multiplicity = 6
  Electrons    = 9
  Nalpha       = 7
  Nbeta        = 2

  ==> Algorithm <==

  SCF Algorithm Type is DF.
  DIIS enabled.
  MOM disabled.
  Fractional occupation disabled.
  Guess Type is READ.
  Energy threshold   = 1.00e-08
  Density threshold  = 1.00e-08
  Integral threshold = 1.00e-12

  ==> Primary Basis <==

  Basis Set: CC-PVDZ
    Blend: CC-PVDZ
    Number of shells: 9
    Number of basis functions: 19
    Number of Cartesian functions: 20
    Spherical Harmonics?: true
    Max angular momentum: 2

  ==> DFT Potential <==

   => LibXC <=

    Version 6.2.2
    S. Lehtola, C. Steigemann, M. J.T. Oliveira, and M. A.L. Marques.,  SoftwareX 7, 1–5 (2018) (10.1016/j.softx.2017.11.002)

   => Composite Functional: B3LYP <= 

    B3LYP Hyb-GGA Exchange-Correlation Functional

    P. J. Stephens, F. J. Devlin, C. F. Chabalowski, and M. J. Frisch.,  J. Phys. Chem. 98, 11623 (1994) (10.1021/j100096a001)

    Deriv               =              1
    GGA                 =           TRUE
    Meta                =          FALSE

    Exchange Hybrid     =           TRUE
    MP2 Hybrid          =          FALSE

   => Exchange Functionals <=

    0.0800   Slater exchange
    0.7200         Becke 88

   => Exact (HF) Exchange <=

    0.2000               HF 

   => Correlation Functionals <=

    0.1900   Vosko, Wilk & Nusair (VWN5_RPA)
    0.8100   Lee, Yang & Parr

   => LibXC Density Thresholds  <==

    XC_HYB_GGA_XC_B3LYP:  1.00E-15 

   => Molecular Quadrature <=

    Radial Scheme          =       TREUTLER
    Pruning Scheme         =           NONE
    Nuclear Scheme         =       TREUTLER

    Blocking Scheme        =         OCTREE
    BS radius alpha        =              1
    Pruning alpha          =              1
    Radial Points          =             75
    Spherical Points       =            302
    Total Points           =          44411
    Total Blocks           =            393
    Max Points             =            254
    Max Functions          =             19
    Weights Tolerance      =       1.00E-15

   => Loading Basis Set <=

    Name: (CC-PVDZ AUX)
    Role: JKFIT
    Keyword: DF_BASIS_SCF
    atoms 1 entry H          line    51 file /Users/joseantoniorodriguesromero/anaconda3/share/psi4/basis/cc-pvdz-jkfit.gbs 
    atoms 2 entry F          line   271 file /Users/joseantoniorodriguesromero/anaconda3/share/psi4/basis/cc-pvdz-jkfit.gbs 

   => Loading Basis Set <=

    Name: CC-PVDZ
    Role: ORBITAL
    Keyword: BASIS
    atoms 1 entry H          line    22 file /Users/joseantoniorodriguesromero/anaconda3/share/psi4/basis/cc-pvdz.gbs 
    atoms 2 entry F          line   228 file /Users/joseantoniorodriguesromero/anaconda3/share/psi4/basis/cc-pvdz.gbs 

  Reading orbitals from file /tmp/sextet_HF.default.73680.180.npy, no projection.

  ==> Integral Setup <==

  DFHelper Memory: AOs need 0.000 GiB; user supplied 0.342 GiB. 
  Using in-core AOs.

  ==> MemDFJK: Density-Fitted J/K Matrices <==

    J tasked:                   Yes
    K tasked:                   Yes
    wK tasked:                   No
    OpenMP threads:               1
    Memory [MiB]:               350
    Algorithm:                 Core
    Schwarz Cutoff:           1E-12
    Mask sparsity (%):       0.0000
    Fitting Condition:        1E-10

   => Auxiliary Basis Set <=

  Basis Set: (CC-PVDZ AUX)
    Blend: CC-PVDZ-JKFIT
    Number of shells: 33
    Number of basis functions: 93
    Number of Cartesian functions: 106
    Spherical Harmonics?: true
    Max angular momentum: 3

  Cached 100.0% of DFT collocation blocks in 0.024 [GiB].

  Minimum eigenvalue in the overlap matrix is 1.3039567874E-01.
  Reciprocal condition number of the overlap matrix is 5.6093324104E-02.
    Using symmetric orthogonalization.

  ==> Pre-Iterations <==

  SCF Guess: Orbitals guess was supplied from a previous computation.

   -------------------------------------------------------
    Irrep   Nso     Nmo     Nalpha   Nbeta   Ndocc  Nsocc
   -------------------------------------------------------
     A1        10      10       5       2       2       3
     A2         1       1       0       0       0       0
     B1         4       4       1       0       0       1
     B2         4       4       1       0       0       1
   -------------------------------------------------------
    Total      19      19       7       2       2       5
   -------------------------------------------------------

  ==> Iterations <==

                           Total Energy        Delta E     RMS |[F,P]|

   @DF-UKS iter   0:   -98.28372608445375   -9.82837e+01   1.43953e-03 
   @DF-UKS iter   1:   -98.28253915832121    1.18693e-03   5.39478e-05 DIIS
   @DF-UKS iter   2:   -98.28253932373178   -1.65411e-07   2.01335e-05 DIIS/DAMP=1%
   @DF-UKS iter   3:   -98.28253930811988    1.56119e-08   2.04524e-06 DIIS/DAMP=1%
   @DF-UKS iter   4:   -98.28253976379125   -4.55671e-07   1.04829e-06 DIIS/DAMP=1%
   @DF-UKS iter   5:   -98.28253915189867    6.11893e-07   1.79873e-07 DIIS/DAMP=1%
   @DF-UKS iter   6:   -98.28253934244816   -1.90549e-07   1.25853e-08 DIIS/DAMP=1%
   @DF-UKS iter   7:   -98.28253933951709    2.93107e-09   1.12714e-09 DIIS/DAMP=1%
  Energy and wave function converged.


  ==> Post-Iterations <==

   Electrons on quadrature grid:
      Nalpha   =    7.0000004699 ; deviation = 4.699e-07
      Nbeta    =    1.9999999918 ; deviation = -8.224e-09
      Ntotal   =    9.0000004617 ; deviation = 4.617e-07 

   @Spin Contamination Metric:   1.434702350E-03
   @S^2 Expected:                8.750000000E+00
   @S^2 Observed:                8.751434702E+00
   @S   Expected:                2.500000000E+00
   @S   Observed:                2.500000000E+00

    Orbital Energies [Eh]
    ---------------------

    Alpha Occupied:                                                       

       1A1   -26.174965     2A1    -2.381687     3A1    -1.655516  
       1B1    -1.649363     1B2    -1.649363     4A1    -0.562564  
       5A1     0.041298  

    Alpha Virtual:                                                        

       2B2     0.227703     2B1     0.227703     6A1     0.340474  
       7A1     0.624547     3B1     0.999822     3B2     0.999822  
       8A1     1.330591     9A1     2.345900     1A2     2.345902  
       4B2     2.372653     4B1     2.372653    10A1     2.664366  

    Beta Occupied:                                                        

       1A1   -26.056883     2A1    -2.070359  

    Beta Virtual:                                                         

       1B1    -1.223463     1B2    -1.223463     3A1    -1.218289  
       4A1    -0.262853     5A1     0.313190     2B2     0.342312  
       2B1     0.342312     6A1     0.535597     7A1     0.779236  
       3B2     1.187913     3B1     1.187913     8A1     1.496914  
       9A1     2.577248     1A2     2.577253     4B2     2.604148  
       4B1     2.604148    10A1     2.895754  

    Final Occupation by Irrep:
             A1    A2    B1    B2 
    DOCC [     2,    0,    0,    0 ]
    SOCC [     3,    0,    1,    1 ]
    NA   [     5,    0,    1,    1 ]
    NB   [     2,    0,    0,    0 ]

  @DF-UKS Final Energy:   -98.28253933951709

   => Energetics <=

    Nuclear Repulsion Energy =              3.2280443117462974
    One-Electron Energy =                -135.0381663930013474
    Two-Electron Energy =                  41.6441962507687364
    DFT Exchange-Correlation Energy =      -8.1166135090307492
    Empirical Dispersion Energy =           0.0000000000000000
    VV10 Nonlocal Energy =                  0.0000000000000000
    Total Energy =                        -98.2825393395170579

  UHF NO Occupations:
  HONO-2 :    3 A1 1.0000000
  HONO-1 :    4 A1 1.0000000
  HONO-0 :    5 A1 1.0000000
  LUNO+0 :    6 A1 0.0007176
  LUNO+1 :    7 A1 0.0000000
  LUNO+2 :    8 A1 0.0000000
  LUNO+3 :    2 B2 0.0000000


Computation Completed


Properties will be evaluated at   0.000000,   0.000000,   0.000000 [a0]

Properties computed using the SCF density matrix


 Multipole Moments:

 ------------------------------------------------------------------------------------
     Multipole            Electronic (a.u.)      Nuclear  (a.u.)        Total (a.u.)
 ------------------------------------------------------------------------------------

 L = 1.  Multiply by 2.5417464519 to convert [e a0] to [Debye]
 Dipole X            :          0.0000000            0.0000000            0.0000000
 Dipole Y            :          0.0000000            0.0000000            0.0000000
 Dipole Z            :         -3.7686324            1.3835619           -2.3850704
 Magnitude           :                                                    2.3850704

 ------------------------------------------------------------------------------------

*** tstop() called on Joses-MacBook-Pro-2.local at Thu Jul 17 12:20:40 2025
Module time:
	user time   =       0.79 seconds =       0.01 minutes
	system time =       2.98 seconds =       0.05 minutes
	total time  =          0 seconds =       0.00 minutes
Total time:
	user time   =       3.49 seconds =       0.06 minutes
	system time =      10.59 seconds =       0.18 minutes
	total time  =          2 seconds =       0.03 minutes

*** tstart() called on Joses-MacBook-Pro-2.local
*** at Thu Jul 17 12:20:40 2025


         ------------------------------------------------------------
                                   SCF GRAD                          
                          Rob Parrish, Justin Turney,                
                       Andy Simmonett, and Alex Sokolov              
         ------------------------------------------------------------

  ==> Geometry <==

    Molecular point group: c2v
    Full point group: C_inf_v

    Geometry (in Angstrom), charge = 1, multiplicity = 6:

       Center              X                  Y                   Z               Mass       
    ------------   -----------------  -----------------  -----------------  -----------------
         H            0.000000000000     0.000000000000     1.401057747186     1.007825032230
         F            0.000000000000     0.000000000000    -0.074323144799    18.998403162730

  Nuclear repulsion =    3.228044311746297

  ==> Basis Set <==

  Basis Set: CC-PVDZ
    Blend: CC-PVDZ
    Number of shells: 9
    Number of basis functions: 19
    Number of Cartesian functions: 20
    Spherical Harmonics?: true
    Max angular momentum: 2

  ==> DFJKGrad: Density-Fitted SCF Gradients <==

    Gradient:                    1
    J tasked:                  Yes
    K tasked:                  Yes
    wK tasked:                  No
    OpenMP threads:              1
    Integrals threads:           1
    Memory [MiB]:              375
    Schwarz Cutoff:          1E-12
    Fitting Condition:       1E-10

   => Auxiliary Basis Set <=

  Basis Set: (CC-PVDZ AUX)
    Blend: CC-PVDZ-JKFIT
    Number of shells: 33
    Number of basis functions: 93
    Number of Cartesian functions: 106
    Spherical Harmonics?: true
    Max angular momentum: 3

  ==> DFT Potential <==

   => LibXC <=

    Version 6.2.2
    S. Lehtola, C. Steigemann, M. J.T. Oliveira, and M. A.L. Marques.,  SoftwareX 7, 1–5 (2018) (10.1016/j.softx.2017.11.002)

   => Composite Functional: B3LYP <= 

    B3LYP Hyb-GGA Exchange-Correlation Functional

    P. J. Stephens, F. J. Devlin, C. F. Chabalowski, and M. J. Frisch.,  J. Phys. Chem. 98, 11623 (1994) (10.1021/j100096a001)

    Deriv               =              1
    GGA                 =           TRUE
    Meta                =          FALSE

    Exchange Hybrid     =           TRUE
    MP2 Hybrid          =          FALSE

   => Exchange Functionals <=

    0.0800   Slater exchange
    0.7200         Becke 88

   => Exact (HF) Exchange <=

    0.2000               HF 

   => Correlation Functionals <=

    0.1900   Vosko, Wilk & Nusair (VWN5_RPA)
    0.8100   Lee, Yang & Parr

   => LibXC Density Thresholds  <==

    XC_HYB_GGA_XC_B3LYP:  1.00E-15 

   => Molecular Quadrature <=

    Radial Scheme          =       TREUTLER
    Pruning Scheme         =           NONE
    Nuclear Scheme         =       TREUTLER

    Blocking Scheme        =         OCTREE
    BS radius alpha        =              1
    Pruning alpha          =              1
    Radial Points          =             75
    Spherical Points       =            302
    Total Points           =          44411
    Total Blocks           =            393
    Max Points             =            254
    Max Functions          =             19
    Weights Tolerance      =       1.00E-15


  -Total Gradient:
     Atom            X                  Y                   Z
    ------   -----------------  -----------------  -----------------
       1       -0.000000000000     0.000000000000    -0.003380493822
       2        0.000000000000     0.000000000000     0.003382678848


*** tstop() called on Joses-MacBook-Pro-2.local at Thu Jul 17 12:20:40 2025
Module time:
	user time   =       0.34 seconds =       0.01 minutes
	system time =       0.83 seconds =       0.01 minutes
	total time  =          0 seconds =       0.00 minutes
Total time:
	user time   =       3.83 seconds =       0.06 minutes
	system time =      11.42 seconds =       0.19 minutes
	total time  =          2 seconds =       0.03 minutes

    			-----------------------------------------

    			 OPTKING 3.0: for geometry optimizations 

    			     By R.A. King, Bethel University     

    			        with contributions from          

    			    A.V. Copan, J. Cayton, A. Heide      

    			-----------------------------------------

    
	                            ===> Fragment 1 <== 

	 Z (Atomic Numbers)          Masses                          Geom                  
	       1.000000             1.007825          0.00000000  0.00000000  2.64761543   
	       9.000000            18.998403          0.00000000  0.00000000 -0.14045039   

	 - Coordinate -           - BOHR/RAD -       - ANG/DEG -
	 R(1,2)           =         2.788066           1.475381


	        --- Internal Coordinate Step in ANG or DEG, aJ/ANG or AJ/DEG ---
	-------------------------------------------------------------------------------
	           Coordinate      Previous         Force          Change          New 
	           ----------      --------        ------          ------        ------
	               R(1,2)       1.47538        0.02786        0.00663       1.48201
	-------------------------------------------------------------------------------

	                                 ==> Convergence Check <==                                  
    
	Measures of convergence in internal coordinates in au.
    
	Criteria marked as inactive (o), active & met (*), and active & unmet ( ).

	----------------------------------------------------------------------------------------------
	   Step    Total Energy     Delta E     Max Force     RMS Force      Max Disp      RMS Disp   
	----------------------------------------------------------------------------------------------
	  Convergence Criteria     1.00e-06 *    3.00e-04 *             o    1.20e-03 *             o
	----------------------------------------------------------------------------------------------
	     3     -98.28253934   -1.25e-04      3.38e-03      3.38e-03 o    1.25e-02      1.25e-02 o  ~
	----------------------------------------------------------------------------------------------

Next Geometry in Ang 
	Fragment 1 (Ang)

	    H   0.0000000000   0.0000000000   1.4043708750
	    F   0.0000000000   0.0000000000  -0.0776362726


    Structure for next step:
    Molecular point group: c2v
    Full point group: C_inf_v

    Geometry (in Angstrom), charge = 1, multiplicity = 6:

    H            0.000000000000     0.000000000000     1.407350201373
    F            0.000000000000     0.000000000000    -0.074656946161


Scratch directory: /tmp/
gradient() will perform analytic gradient computation.
   => Libint2 <=

    Primary   basis highest AM E, G, H:  6, 6, 3
    Auxiliary basis highest AM E, G, H:  7, 7, 4
    Onebody   basis highest AM E, G, H:  -, -, -
    Solid Harmonics ordering:            Gaussian

*** tstart() called on Joses-MacBook-Pro-2.local
*** at Thu Jul 17 12:20:40 2025

   => Loading Basis Set <=

    Name: CC-PVDZ
    Role: ORBITAL
    Keyword: BASIS
    atoms 1 entry H          line    22 file /Users/joseantoniorodriguesromero/anaconda3/share/psi4/basis/cc-pvdz.gbs 
    atoms 2 entry F          line   228 file /Users/joseantoniorodriguesromero/anaconda3/share/psi4/basis/cc-pvdz.gbs 


         ---------------------------------------------------------
                                   SCF
               by Justin Turney, Rob Parrish, Andy Simmonett
                          and Daniel G. A. Smith
                              UKS Reference
                        1 Threads,    500 MiB Core
         ---------------------------------------------------------

  ==> Geometry <==

    Molecular point group: c2v
    Full point group: C_inf_v

    Geometry (in Angstrom), charge = 1, multiplicity = 6:

       Center              X                  Y                   Z               Mass       
    ------------   -----------------  -----------------  -----------------  -----------------
         H            0.000000000000     0.000000000000     1.407350201373     1.007825032230
         F            0.000000000000     0.000000000000    -0.074656946161    18.998403162730

  Running in c2v symmetry.

  Rotational constants: A = ************  B =      8.01971  C =      8.01971 [cm^-1]
  Rotational constants: A = ************  B = 240424.97549  C = 240424.97549 [MHz]
  Nuclear repulsion =    3.213611286527963

  Charge       = 1
  Multiplicity = 6
  Electrons    = 9
  Nalpha       = 7
  Nbeta        = 2

  ==> Algorithm <==

  SCF Algorithm Type is DF.
  DIIS enabled.
  MOM disabled.
  Fractional occupation disabled.
  Guess Type is READ.
  Energy threshold   = 1.00e-08
  Density threshold  = 1.00e-08
  Integral threshold = 1.00e-12

  ==> Primary Basis <==

  Basis Set: CC-PVDZ
    Blend: CC-PVDZ
    Number of shells: 9
    Number of basis functions: 19
    Number of Cartesian functions: 20
    Spherical Harmonics?: true
    Max angular momentum: 2

  ==> DFT Potential <==

   => LibXC <=

    Version 6.2.2
    S. Lehtola, C. Steigemann, M. J.T. Oliveira, and M. A.L. Marques.,  SoftwareX 7, 1–5 (2018) (10.1016/j.softx.2017.11.002)

   => Composite Functional: B3LYP <= 

    B3LYP Hyb-GGA Exchange-Correlation Functional

    P. J. Stephens, F. J. Devlin, C. F. Chabalowski, and M. J. Frisch.,  J. Phys. Chem. 98, 11623 (1994) (10.1021/j100096a001)

    Deriv               =              1
    GGA                 =           TRUE
    Meta                =          FALSE

    Exchange Hybrid     =           TRUE
    MP2 Hybrid          =          FALSE

   => Exchange Functionals <=

    0.0800   Slater exchange
    0.7200         Becke 88

   => Exact (HF) Exchange <=

    0.2000               HF 

   => Correlation Functionals <=

    0.1900   Vosko, Wilk & Nusair (VWN5_RPA)
    0.8100   Lee, Yang & Parr

   => LibXC Density Thresholds  <==

    XC_HYB_GGA_XC_B3LYP:  1.00E-15 

   => Molecular Quadrature <=

    Radial Scheme          =       TREUTLER
    Pruning Scheme         =           NONE
    Nuclear Scheme         =       TREUTLER

    Blocking Scheme        =         OCTREE
    BS radius alpha        =              1
    Pruning alpha          =              1
    Radial Points          =             75
    Spherical Points       =            302
    Total Points           =          44411
    Total Blocks           =            393
    Max Points             =            256
    Max Functions          =             19
    Weights Tolerance      =       1.00E-15

   => Loading Basis Set <=

    Name: (CC-PVDZ AUX)
    Role: JKFIT
    Keyword: DF_BASIS_SCF
    atoms 1 entry H          line    51 file /Users/joseantoniorodriguesromero/anaconda3/share/psi4/basis/cc-pvdz-jkfit.gbs 
    atoms 2 entry F          line   271 file /Users/joseantoniorodriguesromero/anaconda3/share/psi4/basis/cc-pvdz-jkfit.gbs 

   => Loading Basis Set <=

    Name: CC-PVDZ
    Role: ORBITAL
    Keyword: BASIS
    atoms 1 entry H          line    22 file /Users/joseantoniorodriguesromero/anaconda3/share/psi4/basis/cc-pvdz.gbs 
    atoms 2 entry F          line   228 file /Users/joseantoniorodriguesromero/anaconda3/share/psi4/basis/cc-pvdz.gbs 

  Reading orbitals from file /tmp/sextet_HF.default.73680.180.npy, no projection.

  ==> Integral Setup <==

  DFHelper Memory: AOs need 0.000 GiB; user supplied 0.342 GiB. 
  Using in-core AOs.

  ==> MemDFJK: Density-Fitted J/K Matrices <==

    J tasked:                   Yes
    K tasked:                   Yes
    wK tasked:                   No
    OpenMP threads:               1
    Memory [MiB]:               350
    Algorithm:                 Core
    Schwarz Cutoff:           1E-12
    Mask sparsity (%):       0.0000
    Fitting Condition:        1E-10

   => Auxiliary Basis Set <=

  Basis Set: (CC-PVDZ AUX)
    Blend: CC-PVDZ-JKFIT
    Number of shells: 33
    Number of basis functions: 93
    Number of Cartesian functions: 106
    Spherical Harmonics?: true
    Max angular momentum: 3

  Cached 100.0% of DFT collocation blocks in 0.024 [GiB].

  Minimum eigenvalue in the overlap matrix is 1.3121710420E-01.
  Reciprocal condition number of the overlap matrix is 5.6594937980E-02.
    Using symmetric orthogonalization.

  ==> Pre-Iterations <==

  SCF Guess: Orbitals guess was supplied from a previous computation.

   -------------------------------------------------------
    Irrep   Nso     Nmo     Nalpha   Nbeta   Ndocc  Nsocc
   -------------------------------------------------------
     A1        10      10       5       2       2       3
     A2         1       1       0       0       0       0
     B1         4       4       1       0       0       1
     B2         4       4       1       0       0       1
   -------------------------------------------------------
    Total      19      19       7       2       2       5
   -------------------------------------------------------

  ==> Iterations <==

                           Total Energy        Delta E     RMS |[F,P]|

   @DF-UKS iter   0:   -98.28326192395284   -9.82833e+01   8.74776e-04 
   @DF-UKS iter   1:   -98.28256097065153    7.00953e-04   3.20135e-05 DIIS
   @DF-UKS iter   2:   -98.28256102991109   -5.92596e-08   1.19826e-05 DIIS/DAMP=1%
   @DF-UKS iter   3:   -98.28256095060971    7.93014e-08   1.27220e-06 DIIS/DAMP=1%
   @DF-UKS iter   4:   -98.28256129762823   -3.47019e-07   6.49311e-07 DIIS/DAMP=1%
   @DF-UKS iter   5:   -98.28256091807147    3.79557e-07   1.14564e-07 DIIS/DAMP=1%
   @DF-UKS iter   6:   -98.28256103743273   -1.19361e-07   7.78966e-09 DIIS/DAMP=1%
   @DF-UKS iter   7:   -98.28256103552464    1.90809e-09   7.26943e-10 DIIS/DAMP=1%
  Energy and wave function converged.


  ==> Post-Iterations <==

   Electrons on quadrature grid:
      Nalpha   =    7.0000004677 ; deviation = 4.677e-07
      Nbeta    =    1.9999999921 ; deviation = -7.852e-09
      Ntotal   =    9.0000004599 ; deviation = 4.599e-07 

   @Spin Contamination Metric:   1.435585172E-03
   @S^2 Expected:                8.750000000E+00
   @S^2 Observed:                8.751435585E+00
   @S   Expected:                2.500000000E+00
   @S   Observed:                2.500000000E+00

    Orbital Energies [Eh]
    ---------------------

    Alpha Occupied:                                                       

       1A1   -26.175040     2A1    -2.381636     3A1    -1.655291  
       1B1    -1.649382     1B2    -1.649382     4A1    -0.561812  
       5A1     0.043048  

    Alpha Virtual:                                                        

       2B1     0.227846     2B2     0.227846     6A1     0.340543  
       7A1     0.620906     3B2     1.001529     3B1     1.001529  
       8A1     1.332509     9A1     2.345876     1A2     2.345878  
       4B2     2.371722     4B1     2.371722    10A1     2.655672  

    Beta Occupied:                                                        

       1A1   -26.056970     2A1    -2.070323  

    Beta Virtual:                                                         

       1B1    -1.223483     1B2    -1.223483     3A1    -1.218102  
       4A1    -0.262339     5A1     0.314753     2B1     0.342394  
       2B2     0.342394     6A1     0.536650     7A1     0.775322  
       3B2     1.189967     3B1     1.189967     8A1     1.498924  
       9A1     2.577212     1A2     2.577218     4B2     2.603227  
       4B1     2.603227    10A1     2.887021  

    Final Occupation by Irrep:
             A1    A2    B1    B2 
    DOCC [     2,    0,    0,    0 ]
    SOCC [     3,    0,    1,    1 ]
    NA   [     5,    0,    1,    1 ]
    NB   [     2,    0,    0,    0 ]

  @DF-UKS Final Energy:   -98.28256103552464

   => Energetics <=

    Nuclear Repulsion Energy =              3.2136112865279634
    One-Electron Energy =                -135.0123063012011073
    Two-Electron Energy =                  41.6322210836846054
    DFT Exchange-Correlation Energy =      -8.1160871045360885
    Empirical Dispersion Energy =           0.0000000000000000
    VV10 Nonlocal Energy =                  0.0000000000000000
    Total Energy =                        -98.2825610355246226

  UHF NO Occupations:
  HONO-2 :    1 B2 1.0000000
  HONO-1 :    4 A1 1.0000000
  HONO-0 :    5 A1 1.0000000
  LUNO+0 :    6 A1 0.0007180
  LUNO+1 :    7 A1 0.0000000
  LUNO+2 :    2 B2 0.0000000
  LUNO+3 :    2 B1 0.0000000


Computation Completed


Properties will be evaluated at   0.000000,   0.000000,   0.000000 [a0]

Properties computed using the SCF density matrix


 Multipole Moments:

 ------------------------------------------------------------------------------------
     Multipole            Electronic (a.u.)      Nuclear  (a.u.)        Total (a.u.)
 ------------------------------------------------------------------------------------

 L = 1.  Multiply by 2.5417464519 to convert [e a0] to [Debye]
 Dipole X            :          0.0000000            0.0000000            0.0000000
 Dipole Y            :          0.0000000            0.0000000            0.0000000
 Dipole Z            :         -3.7790676            1.3897758           -2.3892918
 Magnitude           :                                                    2.3892918

 ------------------------------------------------------------------------------------

*** tstop() called on Joses-MacBook-Pro-2.local at Thu Jul 17 12:20:40 2025
Module time:
	user time   =       0.73 seconds =       0.01 minutes
	system time =       2.97 seconds =       0.05 minutes
	total time  =          0 seconds =       0.00 minutes
Total time:
	user time   =       4.60 seconds =       0.08 minutes
	system time =      14.61 seconds =       0.24 minutes
	total time  =          2 seconds =       0.03 minutes

*** tstart() called on Joses-MacBook-Pro-2.local
*** at Thu Jul 17 12:20:40 2025


         ------------------------------------------------------------
                                   SCF GRAD                          
                          Rob Parrish, Justin Turney,                
                       Andy Simmonett, and Alex Sokolov              
         ------------------------------------------------------------

  ==> Geometry <==

    Molecular point group: c2v
    Full point group: C_inf_v

    Geometry (in Angstrom), charge = 1, multiplicity = 6:

       Center              X                  Y                   Z               Mass       
    ------------   -----------------  -----------------  -----------------  -----------------
         H            0.000000000000     0.000000000000     1.407350201373     1.007825032230
         F            0.000000000000     0.000000000000    -0.074656946161    18.998403162730

  Nuclear repulsion =    3.213611286527963

  ==> Basis Set <==

  Basis Set: CC-PVDZ
    Blend: CC-PVDZ
    Number of shells: 9
    Number of basis functions: 19
    Number of Cartesian functions: 20
    Spherical Harmonics?: true
    Max angular momentum: 2

  ==> DFJKGrad: Density-Fitted SCF Gradients <==

    Gradient:                    1
    J tasked:                  Yes
    K tasked:                  Yes
    wK tasked:                  No
    OpenMP threads:              1
    Integrals threads:           1
    Memory [MiB]:              375
    Schwarz Cutoff:          1E-12
    Fitting Condition:       1E-10

   => Auxiliary Basis Set <=

  Basis Set: (CC-PVDZ AUX)
    Blend: CC-PVDZ-JKFIT
    Number of shells: 33
    Number of basis functions: 93
    Number of Cartesian functions: 106
    Spherical Harmonics?: true
    Max angular momentum: 3

  ==> DFT Potential <==

   => LibXC <=

    Version 6.2.2
    S. Lehtola, C. Steigemann, M. J.T. Oliveira, and M. A.L. Marques.,  SoftwareX 7, 1–5 (2018) (10.1016/j.softx.2017.11.002)

   => Composite Functional: B3LYP <= 

    B3LYP Hyb-GGA Exchange-Correlation Functional

    P. J. Stephens, F. J. Devlin, C. F. Chabalowski, and M. J. Frisch.,  J. Phys. Chem. 98, 11623 (1994) (10.1021/j100096a001)

    Deriv               =              1
    GGA                 =           TRUE
    Meta                =          FALSE

    Exchange Hybrid     =           TRUE
    MP2 Hybrid          =          FALSE

   => Exchange Functionals <=

    0.0800   Slater exchange
    0.7200         Becke 88

   => Exact (HF) Exchange <=

    0.2000               HF 

   => Correlation Functionals <=

    0.1900   Vosko, Wilk & Nusair (VWN5_RPA)
    0.8100   Lee, Yang & Parr

   => LibXC Density Thresholds  <==

    XC_HYB_GGA_XC_B3LYP:  1.00E-15 

   => Molecular Quadrature <=

    Radial Scheme          =       TREUTLER
    Pruning Scheme         =           NONE
    Nuclear Scheme         =       TREUTLER

    Blocking Scheme        =         OCTREE
    BS radius alpha        =              1
    Pruning alpha          =              1
    Radial Points          =             75
    Spherical Points       =            302
    Total Points           =          44411
    Total Blocks           =            393
    Max Points             =            256
    Max Functions          =             19
    Weights Tolerance      =       1.00E-15


  -Total Gradient:
     Atom            X                  Y                   Z
    ------   -----------------  -----------------  -----------------
       1        0.000000000000    -0.000000000000    -0.000097063879
       2        0.000000000000    -0.000000000000     0.000099138251


*** tstop() called on Joses-MacBook-Pro-2.local at Thu Jul 17 12:20:41 2025
Module time:
	user time   =       0.23 seconds =       0.00 minutes
	system time =       0.82 seconds =       0.01 minutes
	total time  =          1 seconds =       0.02 minutes
Total time:
	user time   =       4.83 seconds =       0.08 minutes
	system time =      15.43 seconds =       0.26 minutes
	total time  =          3 seconds =       0.05 minutes

    			-----------------------------------------

    			 OPTKING 3.0: for geometry optimizations 

    			     By R.A. King, Bethel University     

    			        with contributions from          

    			    A.V. Copan, J. Cayton, A. Heide      

    			-----------------------------------------

    
	                            ===> Fragment 1 <== 

	 Z (Atomic Numbers)          Masses                          Geom                  
	       1.000000             1.007825          0.00000000  0.00000000  2.65950644   
	       9.000000            18.998403          0.00000000  0.00000000 -0.14108118   

	 - Coordinate -           - BOHR/RAD -       - ANG/DEG -
	 R(1,2)           =         2.800588           1.482007


	        --- Internal Coordinate Step in ANG or DEG, aJ/ANG or AJ/DEG ---
	-------------------------------------------------------------------------------
	           Coordinate      Previous         Force          Change          New 
	           ----------      --------        ------          ------        ------
	               R(1,2)       1.48201        0.00081        0.00019       1.48220
	-------------------------------------------------------------------------------

	                                 ==> Convergence Check <==                                  
    
	Measures of convergence in internal coordinates in au.
    
	Criteria marked as inactive (o), active & met (*), and active & unmet ( ).

	----------------------------------------------------------------------------------------------
	   Step    Total Energy     Delta E     Max Force     RMS Force      Max Disp      RMS Disp   
	----------------------------------------------------------------------------------------------
	  Convergence Criteria     1.00e-06 *    3.00e-04 *             o    1.20e-03 *             o
	----------------------------------------------------------------------------------------------
	     4     -98.28256104   -2.17e-05      9.81e-05 *    9.81e-05 o    3.67e-04 *    3.67e-04 o  ~
	----------------------------------------------------------------------------------------------

Next Geometry in Ang 
	Fragment 1 (Ang)

	    H   0.0000000000   0.0000000000   1.4074473987
	    F   0.0000000000   0.0000000000  -0.0747541435


    Final optimized geometry and variables:
    Molecular point group: c2v
    Full point group: C_inf_v

    Geometry (in Angstrom), charge = 1, multiplicity = 6:

    H            0.000000000000     0.000000000000     1.407350201373
    F            0.000000000000     0.000000000000    -0.074656946161


    Psi4 stopped on: Thursday, 17 July 2025 12:20PM
    Psi4 wall time for execution: 0:00:02.92

*** Psi4 exiting successfully. Buy a developer a beer!
