
    -----------------------------------------------------------------------
          Psi4: An Open-Source Ab Initio Electronic Structure Package
                               Psi4 1.9.1 release

                         Git: Rev {} zzzzzzz 


    D. G. A. Smith, L. A. Burns, A. C. Simmonett, R. M. Parrish,
    M. C. Schieber, R. Galvelis, P. Kraus, H. Kruse, R. Di Remigio,
    A. Alenaizan, A. M. James, S. Lehtola, J. P. Misiewicz, M. Scheurer,
    R. A. Shaw, J. B. Schriber, Y. Xie, Z. L. Glick, D. A. Sirianni,
    J. S. O'Brien, J. M. Waldrop, A. Kumar, E. G. Hohenstein,
    B. P. Pritchard, B. R. Brooks, H. F. Schaefer III, A. Yu. Sokolov,
    K. Patkowski, A. E. DePrince III, U. Bozkaya, R. A. King,
    F. A. Evangelista, J. M. Turney, T. D. Crawford, C. D. Sherrill,
    J. Chem. Phys. 152(18) 184108 (2020). https://doi.org/10.1063/5.0006002

                            Additional Code Authors
    E. T. Seidl, C. L. Janssen, E. F. Valeev, M. L. Leininger,
    J. F. Gonthier, R. M. Richard, H. R. McAlexander, M. Saitow, X. Wang,
    P. Verma, M. H. Lechner, A. Jiang, S. Behnle, A. G. Heide,
    M. F. Herbst, and D. L. Poole

             Previous Authors, Complete List of Code Contributors,
                       and Citations for Specific Modules
    https://github.com/psi4/psi4/blob/master/codemeta.json
    https://github.com/psi4/psi4/graphs/contributors
    http://psicode.org/psi4manual/master/introduction.html#citing-psifour

    -----------------------------------------------------------------------


    Psi4 started on: Thursday, 17 July 2025 12:29PM

    Process ID: 73770
    Host:       Joses-MacBook-Pro-2.local
    PSIDATADIR: /Users/joseantoniorodriguesromero/anaconda3/share/psi4
    Memory:     500.0 MiB
    Threads:    1
    
  ==> Input File <==

--------------------------------------------------------------------------
molecule { 
1 6
He   0.00000        0.60000        0.00000
Ne   0.00000       -0.60000        0.00000
}

set { 
basis              cc-pvdz
reference          uks
maxiter            500
geom_maxiter       500
DAMPING_PERCENTAGE 1
guess              SAP
}

optimize('b3lyp')
--------------------------------------------------------------------------

Scratch directory: /tmp/
gradient() will perform analytic gradient computation.
   => Libint2 <=

    Primary   basis highest AM E, G, H:  6, 6, 3
    Auxiliary basis highest AM E, G, H:  7, 7, 4
    Onebody   basis highest AM E, G, H:  -, -, -
    Solid Harmonics ordering:            Gaussian

*** tstart() called on Joses-MacBook-Pro-2.local
*** at Thu Jul 17 12:29:33 2025

   => Loading Basis Set <=

    Name: CC-PVDZ
    Role: ORBITAL
    Keyword: BASIS
    atoms 1 entry HE         line    32 file /Users/joseantoniorodriguesromero/anaconda3/share/psi4/basis/cc-pvdz.gbs 
    atoms 2 entry NE         line   258 file /Users/joseantoniorodriguesromero/anaconda3/share/psi4/basis/cc-pvdz.gbs 


         ---------------------------------------------------------
                                   SCF
               by Justin Turney, Rob Parrish, Andy Simmonett
                          and Daniel G. A. Smith
                              UKS Reference
                        1 Threads,    500 MiB Core
         ---------------------------------------------------------

  ==> Geometry <==

    Molecular point group: c2v
    Full point group: C_inf_v

    Geometry (in Angstrom), charge = 1, multiplicity = 6:

       Center              X                  Y                   Z               Mass       
    ------------   -----------------  -----------------  -----------------  -----------------
         HE           0.000000000000     0.000000000000     0.999828497127     4.002603254130
         NE           0.000000000000     0.000000000000    -0.200171502873    19.992440176200

  Running in c2v symmetry.

  Rotational constants: A = ************  B =      3.51032  C =      3.51032 [cm^-1]
  Rotational constants: A = ************  B = 105236.86411  C = 105236.86411 [MHz]
  Nuclear repulsion =    8.819620177833334

  Charge       = 1
  Multiplicity = 6
  Electrons    = 11
  Nalpha       = 8
  Nbeta        = 3

  ==> Algorithm <==

  SCF Algorithm Type is DF.
  DIIS enabled.
  MOM disabled.
  Fractional occupation disabled.
  Guess Type is SAP.
  Energy threshold   = 1.00e-08
  Density threshold  = 1.00e-08
  Integral threshold = 1.00e-12

  ==> Primary Basis <==

  Basis Set: CC-PVDZ
    Blend: CC-PVDZ
    Number of shells: 9
    Number of basis functions: 19
    Number of Cartesian functions: 20
    Spherical Harmonics?: true
    Max angular momentum: 2

  ==> DFT Potential <==

   => LibXC <=

    Version 6.2.2
    S. Lehtola, C. Steigemann, M. J.T. Oliveira, and M. A.L. Marques.,  SoftwareX 7, 1–5 (2018) (10.1016/j.softx.2017.11.002)

   => Composite Functional: B3LYP <= 

    B3LYP Hyb-GGA Exchange-Correlation Functional

    P. J. Stephens, F. J. Devlin, C. F. Chabalowski, and M. J. Frisch.,  J. Phys. Chem. 98, 11623 (1994) (10.1021/j100096a001)

    Deriv               =              1
    GGA                 =           TRUE
    Meta                =          FALSE

    Exchange Hybrid     =           TRUE
    MP2 Hybrid          =          FALSE

   => Exchange Functionals <=

    0.0800   Slater exchange
    0.7200         Becke 88

   => Exact (HF) Exchange <=

    0.2000               HF 

   => Correlation Functionals <=

    0.1900   Vosko, Wilk & Nusair (VWN5_RPA)
    0.8100   Lee, Yang & Parr

   => LibXC Density Thresholds  <==

    XC_HYB_GGA_XC_B3LYP:  1.00E-15 

   => Molecular Quadrature <=

    Radial Scheme          =       TREUTLER
    Pruning Scheme         =           NONE
    Nuclear Scheme         =       TREUTLER

    Blocking Scheme        =         OCTREE
    BS radius alpha        =              1
    Pruning alpha          =              1
    Radial Points          =             75
    Spherical Points       =            302
    Total Points           =          43310
    Total Blocks           =            378
    Max Points             =            256
    Max Functions          =             19
    Weights Tolerance      =       1.00E-15

   => Loading Basis Set <=

    Name: (CC-PVDZ AUX)
    Role: JKFIT
    Keyword: DF_BASIS_SCF
    atoms 1 entry HE         line    34 file /Users/joseantoniorodriguesromero/anaconda3/share/psi4/basis/def2-universal-jkfit.gbs 
    atoms 2 entry NE         line   321 file /Users/joseantoniorodriguesromero/anaconda3/share/psi4/basis/cc-pvdz-jkfit.gbs 

  ==> Integral Setup <==

  DFHelper Memory: AOs need 0.000 GiB; user supplied 0.343 GiB. 
  Using in-core AOs.

  ==> MemDFJK: Density-Fitted J/K Matrices <==

    J tasked:                   Yes
    K tasked:                   Yes
    wK tasked:                   No
    OpenMP threads:               1
    Memory [MiB]:               351
    Algorithm:                 Core
    Schwarz Cutoff:           1E-12
    Mask sparsity (%):       0.0000
    Fitting Condition:        1E-10

   => Auxiliary Basis Set <=

  Basis Set: (CC-PVDZ AUX)
    Blend: CC-PVDZ-JKFIT + DEF2-UNIVERSAL-JKFIT
    Number of shells: 33
    Number of basis functions: 93
    Number of Cartesian functions: 106
    Spherical Harmonics?: true
    Max angular momentum: 3

  Cached 100.0% of DFT collocation blocks in 0.023 [GiB].

  Minimum eigenvalue in the overlap matrix is 1.1974283509E-01.
  Reciprocal condition number of the overlap matrix is 5.2118283457E-02.
    Using symmetric orthogonalization.

  ==> Pre-Iterations <==

  SCF Guess: Superposition of Atomic Potentials (doi:10.1021/acs.jctc.8b01089).

  ==> SAP guess <==

   => Molecular Quadrature <=

    Radial Scheme          =       TREUTLER
    Pruning Scheme         =           NONE
    Nuclear Scheme         =       TREUTLER

    Blocking Scheme        =         OCTREE
    BS radius alpha        =              1
    Pruning alpha          =              1
    Radial Points          =             75
    Spherical Points       =            302
    Total Points           =          43310
    Total Blocks           =            378
    Max Points             =            256
    Max Functions          =             19
    Weights Tolerance      =       1.00E-15

   -------------------------------------------------------
    Irrep   Nso     Nmo     Nalpha   Nbeta   Ndocc  Nsocc
   -------------------------------------------------------
     A1        10      10       5       3       3       2
     A2         1       1       0       0       0       0
     B1         4       4       2       0       0       2
     B2         4       4       1       0       0       1
   -------------------------------------------------------
    Total      19      19       8       3       3       5
   -------------------------------------------------------

  ==> Iterations <==

                           Total Energy        Delta E     RMS |[F,P]|

    Occupation by irrep:
             A1    A2    B1    B2 
    DOCC [     3,    0,    0,    0 ]
    SOCC [     1,    0,    2,    2 ]
    NA   [     4,    0,    2,    2 ]
    NB   [     3,    0,    0,    0 ]

   @DF-UKS iter   1:  -127.12828945562816   -1.27128e+02   9.81227e-02 DIIS/ADIIS
    Occupation by irrep:
             A1    A2    B1    B2 
    DOCC [     3,    0,    0,    0 ]
    SOCC [     2,    0,    2,    1 ]
    NA   [     5,    0,    2,    1 ]
    NB   [     3,    0,    0,    0 ]

   @DF-UKS iter   2:  -127.31205361315995   -1.83764e-01   7.19855e-02 DIIS/ADIIS/DAMP=1%
   @DF-UKS iter   3:  -127.67546639810745   -3.63413e-01   1.72816e-02 DIIS/ADIIS/DAMP=1%
   @DF-UKS iter   4:  -127.66902374432273    6.44265e-03   3.91849e-03 DIIS/ADIIS/DAMP=1%
   @DF-UKS iter   5:  -127.67590613409192   -6.88239e-03   6.55334e-04 DIIS/ADIIS/DAMP=1%
   @DF-UKS iter   6:  -127.67517296957256    7.33165e-04   1.74011e-04 DIIS/ADIIS/DAMP=1%
   @DF-UKS iter   7:  -127.67517101283315    1.95674e-06   6.20942e-05 DIIS/DAMP=1%
   @DF-UKS iter   8:  -127.67516280137242    8.21146e-06   6.31102e-06 DIIS/DAMP=1%
   @DF-UKS iter   9:  -127.67517150147148   -8.70010e-06   2.27516e-07 DIIS/DAMP=1%
   @DF-UKS iter  10:  -127.67517288042771   -1.37896e-06   2.33504e-08 DIIS/DAMP=1%
   @DF-UKS iter  11:  -127.67517294845946   -6.80318e-08   7.14254e-10 DIIS/DAMP=1%
   @DF-UKS iter  12:  -127.67517294472887    3.73059e-09   2.29413e-10 DIIS/DAMP=1%
  Energy and wave function converged.


  ==> Post-Iterations <==

   Electrons on quadrature grid:
      Nalpha   =    8.0000006068 ; deviation = 6.068e-07
      Nbeta    =    2.9999999544 ; deviation = -4.556e-08
      Ntotal   =   11.0000005613 ; deviation = 5.613e-07 

   @Spin Contamination Metric:   2.270374045E-03
   @S^2 Expected:                8.750000000E+00
   @S^2 Observed:                8.752270374E+00
   @S   Expected:                2.500000000E+00
   @S   Observed:                2.500000000E+00

    Orbital Energies [Eh]
    ---------------------

    Alpha Occupied:                                                       

       1A1   -32.207222     2A1    -2.563279     1B1    -1.692936  
       1B2    -1.686508     3A1    -1.675986     4A1    -1.262227  
       2B1     0.371253     5A1     0.394264  

    Alpha Virtual:                                                        

       2B2     0.496437     6A1     0.714219     7A1     1.007982  
       3B1     1.603449     3B2     1.611263     8A1     2.034540  
       1A2     3.580090     9A1     3.580721     4B2     3.650872  
       4B1     3.675538    10A1     4.149596  

    Beta Occupied:                                                        

       1A1   -32.085278     2A1    -2.301505     3A1    -1.508088  

    Beta Virtual:                                                         

       1B2    -1.243817     1B1    -1.191738     4A1    -0.814408  
       2B2     0.648520     5A1     0.690109     2B1     0.700112  
       6A1     0.905714     7A1     1.182786     3B2     1.772999  
       3B1     1.785316     8A1     2.183177     4B2     3.803558  
       4B1     3.837616     9A1     3.846235     1A2     3.846352  
      10A1     4.307268  

    Final Occupation by Irrep:
             A1    A2    B1    B2 
    DOCC [     3,    0,    0,    0 ]
    SOCC [     2,    0,    2,    1 ]
    NA   [     5,    0,    2,    1 ]
    NB   [     3,    0,    0,    0 ]

  @DF-UKS Final Energy:  -127.67517294472887

   => Energetics <=

    Nuclear Repulsion Energy =              8.8196201778333343
    One-Electron Energy =                -189.2548670332425331
    Two-Electron Energy =                  63.2479075428885267
    DFT Exchange-Correlation Energy =     -10.4878336322082095
    Empirical Dispersion Energy =           0.0000000000000000
    VV10 Nonlocal Energy =                  0.0000000000000000
    Total Energy =                       -127.6751729447288710

  UHF NO Occupations:
  HONO-2 :    5 A1 1.0000000
  HONO-1 :    2 B1 1.0000000
  HONO-0 :    1 B2 1.0000000
  LUNO+0 :    6 A1 0.0006438
  LUNO+1 :    7 A1 0.0004916
  LUNO+2 :    8 A1 0.0000001
  LUNO+3 :    9 A1 0.0000000


Computation Completed


Properties will be evaluated at   0.000000,   0.000000,   0.000000 [a0]

Properties computed using the SCF density matrix


 Multipole Moments:

 ------------------------------------------------------------------------------------
     Multipole            Electronic (a.u.)      Nuclear  (a.u.)        Total (a.u.)
 ------------------------------------------------------------------------------------

 L = 1.  Multiply by 2.5417464519 to convert [e a0] to [Debye]
 Dipole X            :          0.0000000            0.0000000            0.0000000
 Dipole Y            :          0.0000000            0.0000000            0.0000000
 Dipole Z            :         -0.4622496           -0.0038891           -0.4661387
 Magnitude           :                                                    0.4661387

 ------------------------------------------------------------------------------------

*** tstop() called on Joses-MacBook-Pro-2.local at Thu Jul 17 12:29:33 2025
Module time:
	user time   =       3.43 seconds =       0.06 minutes
	system time =       3.09 seconds =       0.05 minutes
	total time  =          0 seconds =       0.00 minutes
Total time:
	user time   =       3.43 seconds =       0.06 minutes
	system time =       3.09 seconds =       0.05 minutes
	total time  =          0 seconds =       0.00 minutes

*** tstart() called on Joses-MacBook-Pro-2.local
*** at Thu Jul 17 12:29:33 2025


         ------------------------------------------------------------
                                   SCF GRAD                          
                          Rob Parrish, Justin Turney,                
                       Andy Simmonett, and Alex Sokolov              
         ------------------------------------------------------------

  ==> Geometry <==

    Molecular point group: c2v
    Full point group: C_inf_v

    Geometry (in Angstrom), charge = 1, multiplicity = 6:

       Center              X                  Y                   Z               Mass       
    ------------   -----------------  -----------------  -----------------  -----------------
         HE           0.000000000000     0.000000000000     0.999828497127     4.002603254130
         NE           0.000000000000     0.000000000000    -0.200171502873    19.992440176200

  Nuclear repulsion =    8.819620177833334

  ==> Basis Set <==

  Basis Set: CC-PVDZ
    Blend: CC-PVDZ
    Number of shells: 9
    Number of basis functions: 19
    Number of Cartesian functions: 20
    Spherical Harmonics?: true
    Max angular momentum: 2

  ==> DFJKGrad: Density-Fitted SCF Gradients <==

    Gradient:                    1
    J tasked:                  Yes
    K tasked:                  Yes
    wK tasked:                  No
    OpenMP threads:              1
    Integrals threads:           1
    Memory [MiB]:              375
    Schwarz Cutoff:          1E-12
    Fitting Condition:       1E-10

   => Auxiliary Basis Set <=

  Basis Set: (CC-PVDZ AUX)
    Blend: CC-PVDZ-JKFIT + DEF2-UNIVERSAL-JKFIT
    Number of shells: 33
    Number of basis functions: 93
    Number of Cartesian functions: 106
    Spherical Harmonics?: true
    Max angular momentum: 3

  ==> DFT Potential <==

   => LibXC <=

    Version 6.2.2
    S. Lehtola, C. Steigemann, M. J.T. Oliveira, and M. A.L. Marques.,  SoftwareX 7, 1–5 (2018) (10.1016/j.softx.2017.11.002)

   => Composite Functional: B3LYP <= 

    B3LYP Hyb-GGA Exchange-Correlation Functional

    P. J. Stephens, F. J. Devlin, C. F. Chabalowski, and M. J. Frisch.,  J. Phys. Chem. 98, 11623 (1994) (10.1021/j100096a001)

    Deriv               =              1
    GGA                 =           TRUE
    Meta                =          FALSE

    Exchange Hybrid     =           TRUE
    MP2 Hybrid          =          FALSE

   => Exchange Functionals <=

    0.0800   Slater exchange
    0.7200         Becke 88

   => Exact (HF) Exchange <=

    0.2000               HF 

   => Correlation Functionals <=

    0.1900   Vosko, Wilk & Nusair (VWN5_RPA)
    0.8100   Lee, Yang & Parr

   => LibXC Density Thresholds  <==

    XC_HYB_GGA_XC_B3LYP:  1.00E-15 

   => Molecular Quadrature <=

    Radial Scheme          =       TREUTLER
    Pruning Scheme         =           NONE
    Nuclear Scheme         =       TREUTLER

    Blocking Scheme        =         OCTREE
    BS radius alpha        =              1
    Pruning alpha          =              1
    Radial Points          =             75
    Spherical Points       =            302
    Total Points           =          43310
    Total Blocks           =            378
    Max Points             =            256
    Max Functions          =             19
    Weights Tolerance      =       1.00E-15


  -Total Gradient:
     Atom            X                  Y                   Z
    ------   -----------------  -----------------  -----------------
       1        0.000000000000     0.000000000000    -0.025057333257
       2        0.000000000000     0.000000000000     0.025063702537


*** tstop() called on Joses-MacBook-Pro-2.local at Thu Jul 17 12:29:33 2025
Module time:
	user time   =       0.23 seconds =       0.00 minutes
	system time =       0.94 seconds =       0.02 minutes
	total time  =          0 seconds =       0.00 minutes
Total time:
	user time   =       3.67 seconds =       0.06 minutes
	system time =       4.04 seconds =       0.07 minutes
	total time  =          0 seconds =       0.00 minutes

    			-----------------------------------------

    			 OPTKING 3.0: for geometry optimizations 

    			     By R.A. King, Bethel University     

    			        with contributions from          

    			    A.V. Copan, J. Cayton, A. Heide      

    			-----------------------------------------

    
	                            ===> Fragment 1 <== 

	 Z (Atomic Numbers)          Masses                          Geom                  
	       2.000000             4.002603          0.00000000  0.00000000  1.88940203   
	      10.000000            19.992440          0.00000000  0.00000000 -0.37826932   

	 - Coordinate -           - BOHR/RAD -       - ANG/DEG -
	 R(1,2)           =         2.267671           1.200000


	        --- Internal Coordinate Step in ANG or DEG, aJ/ANG or AJ/DEG ---
	-------------------------------------------------------------------------------
	           Coordinate      Previous         Force          Change          New 
	           ----------      --------        ------          ------        ------
	               R(1,2)       1.20000        0.20647        0.05322       1.25322
	-------------------------------------------------------------------------------

	                                 ==> Convergence Check <==                                  
    
	Measures of convergence in internal coordinates in au.
    
	Criteria marked as inactive (o), active & met (*), and active & unmet ( ).

	----------------------------------------------------------------------------------------------
	   Step    Total Energy     Delta E     Max Force     RMS Force      Max Disp      RMS Disp   
	----------------------------------------------------------------------------------------------
	  Convergence Criteria     1.00e-06 *    3.00e-04 *             o    1.20e-03 *             o
	----------------------------------------------------------------------------------------------
	     1    -127.67517294   -1.28e+02      2.51e-02      2.51e-02 o    1.01e-01      1.01e-01 o  ~
	----------------------------------------------------------------------------------------------

Next Geometry in Ang 
	Fragment 1 (Ang)

	   He   0.0000000000   0.0000000000   1.0264394072
	   Ne   0.0000000000   0.0000000000  -0.2267824129


    Structure for next step:
    Molecular point group: c2v
    Full point group: C_inf_v

    Geometry (in Angstrom), charge = 1, multiplicity = 6:

    HE           0.000000000000     0.000000000000     1.044172407421
    NE           0.000000000000     0.000000000000    -0.209049412627


Scratch directory: /tmp/
gradient() will perform analytic gradient computation.
   => Libint2 <=

    Primary   basis highest AM E, G, H:  6, 6, 3
    Auxiliary basis highest AM E, G, H:  7, 7, 4
    Onebody   basis highest AM E, G, H:  -, -, -
    Solid Harmonics ordering:            Gaussian

*** tstart() called on Joses-MacBook-Pro-2.local
*** at Thu Jul 17 12:29:33 2025

   => Loading Basis Set <=

    Name: CC-PVDZ
    Role: ORBITAL
    Keyword: BASIS
    atoms 1 entry HE         line    32 file /Users/joseantoniorodriguesromero/anaconda3/share/psi4/basis/cc-pvdz.gbs 
    atoms 2 entry NE         line   258 file /Users/joseantoniorodriguesromero/anaconda3/share/psi4/basis/cc-pvdz.gbs 


         ---------------------------------------------------------
                                   SCF
               by Justin Turney, Rob Parrish, Andy Simmonett
                          and Daniel G. A. Smith
                              UKS Reference
                        1 Threads,    500 MiB Core
         ---------------------------------------------------------

  ==> Geometry <==

    Molecular point group: c2v
    Full point group: C_inf_v

    Geometry (in Angstrom), charge = 1, multiplicity = 6:

       Center              X                  Y                   Z               Mass       
    ------------   -----------------  -----------------  -----------------  -----------------
         HE           0.000000000000     0.000000000000     1.044172407421     4.002603254130
         NE           0.000000000000     0.000000000000    -0.209049412627    19.992440176200

  Running in c2v symmetry.

  Rotational constants: A = ************  B =      3.21850  C =      3.21850 [cm^-1]
  Rotational constants: A = ************  B =  96488.26444  C =  96488.26444 [MHz]
  Nuclear repulsion =    8.445068577715819

  Charge       = 1
  Multiplicity = 6
  Electrons    = 11
  Nalpha       = 8
  Nbeta        = 3

  ==> Algorithm <==

  SCF Algorithm Type is DF.
  DIIS enabled.
  MOM disabled.
  Fractional occupation disabled.
  Guess Type is READ.
  Energy threshold   = 1.00e-08
  Density threshold  = 1.00e-08
  Integral threshold = 1.00e-12

  ==> Primary Basis <==

  Basis Set: CC-PVDZ
    Blend: CC-PVDZ
    Number of shells: 9
    Number of basis functions: 19
    Number of Cartesian functions: 20
    Spherical Harmonics?: true
    Max angular momentum: 2

  ==> DFT Potential <==

   => LibXC <=

    Version 6.2.2
    S. Lehtola, C. Steigemann, M. J.T. Oliveira, and M. A.L. Marques.,  SoftwareX 7, 1–5 (2018) (10.1016/j.softx.2017.11.002)

   => Composite Functional: B3LYP <= 

    B3LYP Hyb-GGA Exchange-Correlation Functional

    P. J. Stephens, F. J. Devlin, C. F. Chabalowski, and M. J. Frisch.,  J. Phys. Chem. 98, 11623 (1994) (10.1021/j100096a001)

    Deriv               =              1
    GGA                 =           TRUE
    Meta                =          FALSE

    Exchange Hybrid     =           TRUE
    MP2 Hybrid          =          FALSE

   => Exchange Functionals <=

    0.0800   Slater exchange
    0.7200         Becke 88

   => Exact (HF) Exchange <=

    0.2000               HF 

   => Correlation Functionals <=

    0.1900   Vosko, Wilk & Nusair (VWN5_RPA)
    0.8100   Lee, Yang & Parr

   => LibXC Density Thresholds  <==

    XC_HYB_GGA_XC_B3LYP:  1.00E-15 

   => Molecular Quadrature <=

    Radial Scheme          =       TREUTLER
    Pruning Scheme         =           NONE
    Nuclear Scheme         =       TREUTLER

    Blocking Scheme        =         OCTREE
    BS radius alpha        =              1
    Pruning alpha          =              1
    Radial Points          =             75
    Spherical Points       =            302
    Total Points           =          43323
    Total Blocks           =            378
    Max Points             =            256
    Max Functions          =             19
    Weights Tolerance      =       1.00E-15

   => Loading Basis Set <=

    Name: (CC-PVDZ AUX)
    Role: JKFIT
    Keyword: DF_BASIS_SCF
    atoms 1 entry HE         line    34 file /Users/joseantoniorodriguesromero/anaconda3/share/psi4/basis/def2-universal-jkfit.gbs 
    atoms 2 entry NE         line   321 file /Users/joseantoniorodriguesromero/anaconda3/share/psi4/basis/cc-pvdz-jkfit.gbs 

   => Loading Basis Set <=

    Name: CC-PVDZ
    Role: ORBITAL
    Keyword: BASIS
    atoms 1 entry HE         line    32 file /Users/joseantoniorodriguesromero/anaconda3/share/psi4/basis/cc-pvdz.gbs 
    atoms 2 entry NE         line   258 file /Users/joseantoniorodriguesromero/anaconda3/share/psi4/basis/cc-pvdz.gbs 

  Reading orbitals from file /tmp/sextet_HeNe.default.73770.180.npy, no projection.

  ==> Integral Setup <==

  DFHelper Memory: AOs need 0.000 GiB; user supplied 0.343 GiB. 
  Using in-core AOs.

  ==> MemDFJK: Density-Fitted J/K Matrices <==

    J tasked:                   Yes
    K tasked:                   Yes
    wK tasked:                   No
    OpenMP threads:               1
    Memory [MiB]:               351
    Algorithm:                 Core
    Schwarz Cutoff:           1E-12
    Mask sparsity (%):       0.0000
    Fitting Condition:        1E-10

   => Auxiliary Basis Set <=

  Basis Set: (CC-PVDZ AUX)
    Blend: CC-PVDZ-JKFIT + DEF2-UNIVERSAL-JKFIT
    Number of shells: 33
    Number of basis functions: 93
    Number of Cartesian functions: 106
    Spherical Harmonics?: true
    Max angular momentum: 3

  Cached 100.0% of DFT collocation blocks in 0.023 [GiB].

  Minimum eigenvalue in the overlap matrix is 1.2918095032E-01.
  Reciprocal condition number of the overlap matrix is 5.7780055770E-02.
    Using symmetric orthogonalization.

  ==> Pre-Iterations <==

  SCF Guess: Orbitals guess was supplied from a previous computation.

   -------------------------------------------------------
    Irrep   Nso     Nmo     Nalpha   Nbeta   Ndocc  Nsocc
   -------------------------------------------------------
     A1        10      10       5       3       3       2
     A2         1       1       0       0       0       0
     B1         4       4       2       0       0       2
     B2         4       4       1       0       0       1
   -------------------------------------------------------
    Total      19      19       8       3       3       5
   -------------------------------------------------------

  ==> Iterations <==

                           Total Energy        Delta E     RMS |[F,P]|

   @DF-UKS iter   0:  -127.67325504777953   -1.27673e+02   1.72233e-02 
   @DF-UKS iter   1:  -127.67607637129001   -2.82132e-03   7.42722e-04 DIIS/ADIIS
   @DF-UKS iter   2:  -127.67617844547495   -1.02074e-04   4.58820e-04 DIIS/ADIIS/DAMP=1%
   @DF-UKS iter   3:  -127.67607113587381    1.07310e-04   1.68709e-04 DIIS/ADIIS/DAMP=1%
   @DF-UKS iter   4:  -127.67622909324758   -1.57957e-04   1.57017e-05 DIIS/DAMP=1%
   @DF-UKS iter   5:  -127.67620151348011    2.75798e-05   2.92052e-06 DIIS/DAMP=1%
   @DF-UKS iter   6:  -127.67620016329400    1.35019e-06   2.61773e-07 DIIS/DAMP=1%
   @DF-UKS iter   7:  -127.67620025887382   -9.55798e-08   1.64635e-08 DIIS/DAMP=1%
   @DF-UKS iter   8:  -127.67620027677241   -1.78986e-08   2.00612e-09 DIIS/DAMP=1%
   @DF-UKS iter   9:  -127.67620027705117   -2.78760e-10   1.49189e-10 DIIS/DAMP=1%
  Energy and wave function converged.


  ==> Post-Iterations <==

   Electrons on quadrature grid:
      Nalpha   =    8.0000008303 ; deviation = 8.303e-07
      Nbeta    =    2.9999999579 ; deviation = -4.214e-08
      Ntotal   =   11.0000007882 ; deviation = 7.882e-07 

   @Spin Contamination Metric:   2.126053329E-03
   @S^2 Expected:                8.750000000E+00
   @S^2 Observed:                8.752126053E+00
   @S   Expected:                2.500000000E+00
   @S   Observed:                2.500000000E+00

    Orbital Energies [Eh]
    ---------------------

    Alpha Occupied:                                                       

       1A1   -32.193127     2A1    -2.545357     1B1    -1.679265  
       1B2    -1.672789     3A1    -1.645589     4A1    -1.273904  
       2B1     0.381766     5A1     0.418119  

    Alpha Virtual:                                                        

       2B2     0.507111     6A1     0.706966     7A1     0.976484  
       3B1     1.613735     3B2     1.620592     8A1     2.064134  
       1A2     3.593332     9A1     3.593870     4B2     3.654491  
       4B1     3.679321    10A1     4.042145  

    Beta Occupied:                                                        

       1A1   -32.073081     2A1    -2.286572     3A1    -1.488200  

    Beta Virtual:                                                         

       1B2    -1.231913     1B1    -1.179629     4A1    -0.814480  
       2B2     0.658876     2B1     0.710709     5A1     0.715615  
       6A1     0.904594     7A1     1.152804     3B2     1.789398  
       3B1     1.800477     8A1     2.217717     4B2     3.803676  
       4B1     3.837967     9A1     3.858406     1A2     3.858826  
      10A1     4.194703  

    Final Occupation by Irrep:
             A1    A2    B1    B2 
    DOCC [     3,    0,    0,    0 ]
    SOCC [     2,    0,    2,    1 ]
    NA   [     5,    0,    2,    1 ]
    NB   [     3,    0,    0,    0 ]

  @DF-UKS Final Energy:  -127.67620027705117

   => Energetics <=

    Nuclear Repulsion Energy =              8.4450685777158192
    One-Electron Energy =                -188.6672225297593855
    Two-Electron Energy =                  63.0330505807763615
    DFT Exchange-Correlation Energy =     -10.4870969057839751
    Empirical Dispersion Energy =           0.0000000000000000
    VV10 Nonlocal Energy =                  0.0000000000000000
    Total Energy =                       -127.6762002770511657

  UHF NO Occupations:
  HONO-2 :    5 A1 1.0000000
  HONO-1 :    2 B1 1.0000000
  HONO-0 :    1 B2 1.0000000
  LUNO+0 :    6 A1 0.0005897
  LUNO+1 :    7 A1 0.0004735
  LUNO+2 :    8 A1 0.0000001
  LUNO+3 :    3 B1 0.0000000


Computation Completed


Properties will be evaluated at   0.000000,   0.000000,   0.000000 [a0]

Properties computed using the SCF density matrix


 Multipole Moments:

 ------------------------------------------------------------------------------------
     Multipole            Electronic (a.u.)      Nuclear  (a.u.)        Total (a.u.)
 ------------------------------------------------------------------------------------

 L = 1.  Multiply by 2.5417464519 to convert [e a0] to [Debye]
 Dipole X            :          0.0000000            0.0000000            0.0000000
 Dipole Y            :          0.0000000            0.0000000            0.0000000
 Dipole Z            :         -0.4419502           -0.0040616           -0.4460118
 Magnitude           :                                                    0.4460118

 ------------------------------------------------------------------------------------

*** tstop() called on Joses-MacBook-Pro-2.local at Thu Jul 17 12:29:34 2025
Module time:
	user time   =       1.95 seconds =       0.03 minutes
	system time =       3.14 seconds =       0.05 minutes
	total time  =          1 seconds =       0.02 minutes
Total time:
	user time   =       5.65 seconds =       0.09 minutes
	system time =       7.39 seconds =       0.12 minutes
	total time  =          1 seconds =       0.02 minutes

*** tstart() called on Joses-MacBook-Pro-2.local
*** at Thu Jul 17 12:29:34 2025


         ------------------------------------------------------------
                                   SCF GRAD                          
                          Rob Parrish, Justin Turney,                
                       Andy Simmonett, and Alex Sokolov              
         ------------------------------------------------------------

  ==> Geometry <==

    Molecular point group: c2v
    Full point group: C_inf_v

    Geometry (in Angstrom), charge = 1, multiplicity = 6:

       Center              X                  Y                   Z               Mass       
    ------------   -----------------  -----------------  -----------------  -----------------
         HE           0.000000000000     0.000000000000     1.044172407421     4.002603254130
         NE           0.000000000000     0.000000000000    -0.209049412627    19.992440176200

  Nuclear repulsion =    8.445068577715819

  ==> Basis Set <==

  Basis Set: CC-PVDZ
    Blend: CC-PVDZ
    Number of shells: 9
    Number of basis functions: 19
    Number of Cartesian functions: 20
    Spherical Harmonics?: true
    Max angular momentum: 2

  ==> DFJKGrad: Density-Fitted SCF Gradients <==

    Gradient:                    1
    J tasked:                  Yes
    K tasked:                  Yes
    wK tasked:                  No
    OpenMP threads:              1
    Integrals threads:           1
    Memory [MiB]:              375
    Schwarz Cutoff:          1E-12
    Fitting Condition:       1E-10

   => Auxiliary Basis Set <=

  Basis Set: (CC-PVDZ AUX)
    Blend: CC-PVDZ-JKFIT + DEF2-UNIVERSAL-JKFIT
    Number of shells: 33
    Number of basis functions: 93
    Number of Cartesian functions: 106
    Spherical Harmonics?: true
    Max angular momentum: 3

  ==> DFT Potential <==

   => LibXC <=

    Version 6.2.2
    S. Lehtola, C. Steigemann, M. J.T. Oliveira, and M. A.L. Marques.,  SoftwareX 7, 1–5 (2018) (10.1016/j.softx.2017.11.002)

   => Composite Functional: B3LYP <= 

    B3LYP Hyb-GGA Exchange-Correlation Functional

    P. J. Stephens, F. J. Devlin, C. F. Chabalowski, and M. J. Frisch.,  J. Phys. Chem. 98, 11623 (1994) (10.1021/j100096a001)

    Deriv               =              1
    GGA                 =           TRUE
    Meta                =          FALSE

    Exchange Hybrid     =           TRUE
    MP2 Hybrid          =          FALSE

   => Exchange Functionals <=

    0.0800   Slater exchange
    0.7200         Becke 88

   => Exact (HF) Exchange <=

    0.2000               HF 

   => Correlation Functionals <=

    0.1900   Vosko, Wilk & Nusair (VWN5_RPA)
    0.8100   Lee, Yang & Parr

   => LibXC Density Thresholds  <==

    XC_HYB_GGA_XC_B3LYP:  1.00E-15 

   => Molecular Quadrature <=

    Radial Scheme          =       TREUTLER
    Pruning Scheme         =           NONE
    Nuclear Scheme         =       TREUTLER

    Blocking Scheme        =         OCTREE
    BS radius alpha        =              1
    Pruning alpha          =              1
    Radial Points          =             75
    Spherical Points       =            302
    Total Points           =          43323
    Total Blocks           =            378
    Max Points             =            256
    Max Functions          =             19
    Weights Tolerance      =       1.00E-15


  -Total Gradient:
     Atom            X                  Y                   Z
    ------   -----------------  -----------------  -----------------
       1        0.000000000000     0.000000000000     0.000598318668
       2        0.000000000000     0.000000000000    -0.000591943243


*** tstop() called on Joses-MacBook-Pro-2.local at Thu Jul 17 12:29:34 2025
Module time:
	user time   =       0.33 seconds =       0.01 minutes
	system time =       0.75 seconds =       0.01 minutes
	total time  =          0 seconds =       0.00 minutes
Total time:
	user time   =       5.98 seconds =       0.10 minutes
	system time =       8.14 seconds =       0.14 minutes
	total time  =          1 seconds =       0.02 minutes

    			-----------------------------------------

    			 OPTKING 3.0: for geometry optimizations 

    			     By R.A. King, Bethel University     

    			        with contributions from          

    			    A.V. Copan, J. Cayton, A. Heide      

    			-----------------------------------------

    
	                            ===> Fragment 1 <== 

	 Z (Atomic Numbers)          Masses                          Geom                  
	       2.000000             4.002603          0.00000000  0.00000000  1.97319988   
	      10.000000            19.992440          0.00000000  0.00000000 -0.39504614   

	 - Coordinate -           - BOHR/RAD -       - ANG/DEG -
	 R(1,2)           =         2.368246           1.253222


	        --- Internal Coordinate Step in ANG or DEG, aJ/ANG or AJ/DEG ---
	-------------------------------------------------------------------------------
	           Coordinate      Previous         Force          Change          New 
	           ----------      --------        ------          ------        ------
	               R(1,2)       1.25322       -0.00490       -0.00123       1.25199
	-------------------------------------------------------------------------------

	                                 ==> Convergence Check <==                                  
    
	Measures of convergence in internal coordinates in au.
    
	Criteria marked as inactive (o), active & met (*), and active & unmet ( ).

	----------------------------------------------------------------------------------------------
	   Step    Total Energy     Delta E     Max Force     RMS Force      Max Disp      RMS Disp   
	----------------------------------------------------------------------------------------------
	  Convergence Criteria     1.00e-06 *    3.00e-04 *             o    1.20e-03 *             o
	----------------------------------------------------------------------------------------------
	     2    -127.67620028   -1.03e-03      5.95e-04      5.95e-04 o    2.33e-03      2.33e-03 o  ~
	----------------------------------------------------------------------------------------------

Next Geometry in Ang 
	Fragment 1 (Ang)

	   He   0.0000000000   0.0000000000   1.0435551207
	   Ne   0.0000000000   0.0000000000  -0.2084321260


    Structure for next step:
    Molecular point group: c2v
    Full point group: C_inf_v

    Geometry (in Angstrom), charge = 1, multiplicity = 6:

    HE           0.000000000000     0.000000000000     1.043143772745
    NE           0.000000000000     0.000000000000    -0.208843473959


Scratch directory: /tmp/
gradient() will perform analytic gradient computation.
   => Libint2 <=

    Primary   basis highest AM E, G, H:  6, 6, 3
    Auxiliary basis highest AM E, G, H:  7, 7, 4
    Onebody   basis highest AM E, G, H:  -, -, -
    Solid Harmonics ordering:            Gaussian

*** tstart() called on Joses-MacBook-Pro-2.local
*** at Thu Jul 17 12:29:34 2025

   => Loading Basis Set <=

    Name: CC-PVDZ
    Role: ORBITAL
    Keyword: BASIS
    atoms 1 entry HE         line    32 file /Users/joseantoniorodriguesromero/anaconda3/share/psi4/basis/cc-pvdz.gbs 
    atoms 2 entry NE         line   258 file /Users/joseantoniorodriguesromero/anaconda3/share/psi4/basis/cc-pvdz.gbs 


         ---------------------------------------------------------
                                   SCF
               by Justin Turney, Rob Parrish, Andy Simmonett
                          and Daniel G. A. Smith
                              UKS Reference
                        1 Threads,    500 MiB Core
         ---------------------------------------------------------

  ==> Geometry <==

    Molecular point group: c2v
    Full point group: C_inf_v

    Geometry (in Angstrom), charge = 1, multiplicity = 6:

       Center              X                  Y                   Z               Mass       
    ------------   -----------------  -----------------  -----------------  -----------------
         HE           0.000000000000     0.000000000000     1.043143772745     4.002603254130
         NE           0.000000000000     0.000000000000    -0.208843473959    19.992440176200

  Running in c2v symmetry.

  Rotational constants: A = ************  B =      3.22485  C =      3.22485 [cm^-1]
  Rotational constants: A = ************  B =  96678.65068  C =  96678.65068 [MHz]
  Nuclear repulsion =    8.453396183758862

  Charge       = 1
  Multiplicity = 6
  Electrons    = 11
  Nalpha       = 8
  Nbeta        = 3

  ==> Algorithm <==

  SCF Algorithm Type is DF.
  DIIS enabled.
  MOM disabled.
  Fractional occupation disabled.
  Guess Type is READ.
  Energy threshold   = 1.00e-08
  Density threshold  = 1.00e-08
  Integral threshold = 1.00e-12

  ==> Primary Basis <==

  Basis Set: CC-PVDZ
    Blend: CC-PVDZ
    Number of shells: 9
    Number of basis functions: 19
    Number of Cartesian functions: 20
    Spherical Harmonics?: true
    Max angular momentum: 2

  ==> DFT Potential <==

   => LibXC <=

    Version 6.2.2
    S. Lehtola, C. Steigemann, M. J.T. Oliveira, and M. A.L. Marques.,  SoftwareX 7, 1–5 (2018) (10.1016/j.softx.2017.11.002)

   => Composite Functional: B3LYP <= 

    B3LYP Hyb-GGA Exchange-Correlation Functional

    P. J. Stephens, F. J. Devlin, C. F. Chabalowski, and M. J. Frisch.,  J. Phys. Chem. 98, 11623 (1994) (10.1021/j100096a001)

    Deriv               =              1
    GGA                 =           TRUE
    Meta                =          FALSE

    Exchange Hybrid     =           TRUE
    MP2 Hybrid          =          FALSE

   => Exchange Functionals <=

    0.0800   Slater exchange
    0.7200         Becke 88

   => Exact (HF) Exchange <=

    0.2000               HF 

   => Correlation Functionals <=

    0.1900   Vosko, Wilk & Nusair (VWN5_RPA)
    0.8100   Lee, Yang & Parr

   => LibXC Density Thresholds  <==

    XC_HYB_GGA_XC_B3LYP:  1.00E-15 

   => Molecular Quadrature <=

    Radial Scheme          =       TREUTLER
    Pruning Scheme         =           NONE
    Nuclear Scheme         =       TREUTLER

    Blocking Scheme        =         OCTREE
    BS radius alpha        =              1
    Pruning alpha          =              1
    Radial Points          =             75
    Spherical Points       =            302
    Total Points           =          43323
    Total Blocks           =            378
    Max Points             =            256
    Max Functions          =             19
    Weights Tolerance      =       1.00E-15

   => Loading Basis Set <=

    Name: (CC-PVDZ AUX)
    Role: JKFIT
    Keyword: DF_BASIS_SCF
    atoms 1 entry HE         line    34 file /Users/joseantoniorodriguesromero/anaconda3/share/psi4/basis/def2-universal-jkfit.gbs 
    atoms 2 entry NE         line   321 file /Users/joseantoniorodriguesromero/anaconda3/share/psi4/basis/cc-pvdz-jkfit.gbs 

   => Loading Basis Set <=

    Name: CC-PVDZ
    Role: ORBITAL
    Keyword: BASIS
    atoms 1 entry HE         line    32 file /Users/joseantoniorodriguesromero/anaconda3/share/psi4/basis/cc-pvdz.gbs 
    atoms 2 entry NE         line   258 file /Users/joseantoniorodriguesromero/anaconda3/share/psi4/basis/cc-pvdz.gbs 

  Reading orbitals from file /tmp/sextet_HeNe.default.73770.180.npy, no projection.

  ==> Integral Setup <==

  DFHelper Memory: AOs need 0.000 GiB; user supplied 0.343 GiB. 
  Using in-core AOs.

  ==> MemDFJK: Density-Fitted J/K Matrices <==

    J tasked:                   Yes
    K tasked:                   Yes
    wK tasked:                   No
    OpenMP threads:               1
    Memory [MiB]:               351
    Algorithm:                 Core
    Schwarz Cutoff:           1E-12
    Mask sparsity (%):       0.0000
    Fitting Condition:        1E-10

   => Auxiliary Basis Set <=

  Basis Set: (CC-PVDZ AUX)
    Blend: CC-PVDZ-JKFIT + DEF2-UNIVERSAL-JKFIT
    Number of shells: 33
    Number of basis functions: 93
    Number of Cartesian functions: 106
    Spherical Harmonics?: true
    Max angular momentum: 3

  Cached 100.0% of DFT collocation blocks in 0.023 [GiB].

  Minimum eigenvalue in the overlap matrix is 1.2896653179E-01.
  Reciprocal condition number of the overlap matrix is 5.7648092491E-02.
    Using symmetric orthogonalization.

  ==> Pre-Iterations <==

  SCF Guess: Orbitals guess was supplied from a previous computation.

   -------------------------------------------------------
    Irrep   Nso     Nmo     Nalpha   Nbeta   Ndocc  Nsocc
   -------------------------------------------------------
     A1        10      10       5       3       3       2
     A2         1       1       0       0       0       0
     B1         4       4       2       0       0       2
     B2         4       4       1       0       0       1
   -------------------------------------------------------
    Total      19      19       8       3       3       5
   -------------------------------------------------------

  ==> Iterations <==

                           Total Energy        Delta E     RMS |[F,P]|

   @DF-UKS iter   0:  -127.67630827016008   -1.27676e+02   3.73840e-04 
   @DF-UKS iter   1:  -127.67620122272675    1.07047e-04   1.71341e-05 DIIS
   @DF-UKS iter   2:  -127.67620128435149   -6.16247e-08   7.70826e-06 DIIS/DAMP=1%
   @DF-UKS iter   3:  -127.67620364603198   -2.36168e-06   4.71829e-06 DIIS/DAMP=1%
   @DF-UKS iter   4:  -127.67620022980046    3.41623e-06   2.82358e-07 DIIS/DAMP=1%
   @DF-UKS iter   5:  -127.67620127943091   -1.04963e-06   3.87024e-08 DIIS/DAMP=1%
   @DF-UKS iter   6:  -127.67620129500051   -1.55696e-08   7.12943e-09 DIIS/DAMP=1%
   @DF-UKS iter   7:  -127.67620129335315    1.64736e-09   7.94344e-10 DIIS/DAMP=1%
  Energy and wave function converged.


  ==> Post-Iterations <==

   Electrons on quadrature grid:
      Nalpha   =    8.0000008277 ; deviation = 8.277e-07
      Nbeta    =    2.9999999578 ; deviation = -4.220e-08
      Ntotal   =   11.0000007855 ; deviation = 7.855e-07 

   @Spin Contamination Metric:   2.129988298E-03
   @S^2 Expected:                8.750000000E+00
   @S^2 Observed:                8.752129988E+00
   @S   Expected:                2.500000000E+00
   @S   Observed:                2.500000000E+00

    Orbital Energies [Eh]
    ---------------------

    Alpha Occupied:                                                       

       1A1   -32.193429     2A1    -2.545745     1B1    -1.679564  
       1B2    -1.673088     3A1    -1.646265     4A1    -1.273711  
       2B1     0.381527     5A1     0.417578  

    Alpha Virtual:                                                        

       2B2     0.506868     6A1     0.707244     7A1     0.977033  
       3B1     1.613487     3B2     1.620368     8A1     2.063480  
       1A2     3.593040     9A1     3.593581     4B2     3.654370  
       4B1     3.679197    10A1     4.044448  

    Beta Occupied:                                                        

       1A1   -32.073339     2A1    -2.286893     3A1    -1.488617  

    Beta Virtual:                                                         

       1B2    -1.232174     1B1    -1.179895     4A1    -0.814582  
       2B2     0.658638     2B1     0.710464     5A1     0.715071  
       6A1     0.904703     7A1     1.153296     3B2     1.789007  
       3B1     1.800114     8A1     2.216942     4B2     3.803634  
       4B1     3.837920     9A1     3.858139     1A2     3.858551  
      10A1     4.197128  

    Final Occupation by Irrep:
             A1    A2    B1    B2 
    DOCC [     3,    0,    0,    0 ]
    SOCC [     2,    0,    2,    1 ]
    NA   [     5,    0,    2,    1 ]
    NB   [     3,    0,    0,    0 ]

  @DF-UKS Final Energy:  -127.67620129335315

   => Energetics <=

    Nuclear Repulsion Energy =              8.4533961837588620
    One-Electron Energy =                -188.6803666659199052
    Two-Electron Energy =                  63.0378380453419780
    DFT Exchange-Correlation Energy =     -10.4870688565340657
    Empirical Dispersion Energy =           0.0000000000000000
    VV10 Nonlocal Energy =                  0.0000000000000000
    Total Energy =                       -127.6762012933531452

  UHF NO Occupations:
  HONO-2 :    2 B1 1.0000000
  HONO-1 :    5 A1 1.0000000
  HONO-0 :    1 B2 1.0000000
  LUNO+0 :    6 A1 0.0005910
  LUNO+1 :    7 A1 0.0004742
  LUNO+2 :    8 A1 0.0000001
  LUNO+3 :    9 A1 0.0000000


Computation Completed


Properties will be evaluated at   0.000000,   0.000000,   0.000000 [a0]

Properties computed using the SCF density matrix


 Multipole Moments:

 ------------------------------------------------------------------------------------
     Multipole            Electronic (a.u.)      Nuclear  (a.u.)        Total (a.u.)
 ------------------------------------------------------------------------------------

 L = 1.  Multiply by 2.5417464519 to convert [e a0] to [Debye]
 Dipole X            :          0.0000000            0.0000000            0.0000000
 Dipole Y            :          0.0000000            0.0000000            0.0000000
 Dipole Z            :         -0.4422267           -0.0040576           -0.4462843
 Magnitude           :                                                    0.4462843

 ------------------------------------------------------------------------------------

*** tstop() called on Joses-MacBook-Pro-2.local at Thu Jul 17 12:29:34 2025
Module time:
	user time   =       1.92 seconds =       0.03 minutes
	system time =       2.40 seconds =       0.04 minutes
	total time  =          0 seconds =       0.00 minutes
Total time:
	user time   =       7.93 seconds =       0.13 minutes
	system time =      10.74 seconds =       0.18 minutes
	total time  =          1 seconds =       0.02 minutes

*** tstart() called on Joses-MacBook-Pro-2.local
*** at Thu Jul 17 12:29:34 2025


         ------------------------------------------------------------
                                   SCF GRAD                          
                          Rob Parrish, Justin Turney,                
                       Andy Simmonett, and Alex Sokolov              
         ------------------------------------------------------------

  ==> Geometry <==

    Molecular point group: c2v
    Full point group: C_inf_v

    Geometry (in Angstrom), charge = 1, multiplicity = 6:

       Center              X                  Y                   Z               Mass       
    ------------   -----------------  -----------------  -----------------  -----------------
         HE           0.000000000000     0.000000000000     1.043143772745     4.002603254130
         NE           0.000000000000     0.000000000000    -0.208843473959    19.992440176200

  Nuclear repulsion =    8.453396183758862

  ==> Basis Set <==

  Basis Set: CC-PVDZ
    Blend: CC-PVDZ
    Number of shells: 9
    Number of basis functions: 19
    Number of Cartesian functions: 20
    Spherical Harmonics?: true
    Max angular momentum: 2

  ==> DFJKGrad: Density-Fitted SCF Gradients <==

    Gradient:                    1
    J tasked:                  Yes
    K tasked:                  Yes
    wK tasked:                  No
    OpenMP threads:              1
    Integrals threads:           1
    Memory [MiB]:              375
    Schwarz Cutoff:          1E-12
    Fitting Condition:       1E-10

   => Auxiliary Basis Set <=

  Basis Set: (CC-PVDZ AUX)
    Blend: CC-PVDZ-JKFIT + DEF2-UNIVERSAL-JKFIT
    Number of shells: 33
    Number of basis functions: 93
    Number of Cartesian functions: 106
    Spherical Harmonics?: true
    Max angular momentum: 3

  ==> DFT Potential <==

   => LibXC <=

    Version 6.2.2
    S. Lehtola, C. Steigemann, M. J.T. Oliveira, and M. A.L. Marques.,  SoftwareX 7, 1–5 (2018) (10.1016/j.softx.2017.11.002)

   => Composite Functional: B3LYP <= 

    B3LYP Hyb-GGA Exchange-Correlation Functional

    P. J. Stephens, F. J. Devlin, C. F. Chabalowski, and M. J. Frisch.,  J. Phys. Chem. 98, 11623 (1994) (10.1021/j100096a001)

    Deriv               =              1
    GGA                 =           TRUE
    Meta                =          FALSE

    Exchange Hybrid     =           TRUE
    MP2 Hybrid          =          FALSE

   => Exchange Functionals <=

    0.0800   Slater exchange
    0.7200         Becke 88

   => Exact (HF) Exchange <=

    0.2000               HF 

   => Correlation Functionals <=

    0.1900   Vosko, Wilk & Nusair (VWN5_RPA)
    0.8100   Lee, Yang & Parr

   => LibXC Density Thresholds  <==

    XC_HYB_GGA_XC_B3LYP:  1.00E-15 

   => Molecular Quadrature <=

    Radial Scheme          =       TREUTLER
    Pruning Scheme         =           NONE
    Nuclear Scheme         =       TREUTLER

    Blocking Scheme        =         OCTREE
    BS radius alpha        =              1
    Pruning alpha          =              1
    Radial Points          =             75
    Spherical Points       =            302
    Total Points           =          43323
    Total Blocks           =            378
    Max Points             =            256
    Max Functions          =             19
    Weights Tolerance      =       1.00E-15


  -Total Gradient:
     Atom            X                  Y                   Z
    ------   -----------------  -----------------  -----------------
       1        0.000000000000     0.000000000000     0.000283173436
       2       -0.000000000000     0.000000000000    -0.000276647089


*** tstop() called on Joses-MacBook-Pro-2.local at Thu Jul 17 12:29:35 2025
Module time:
	user time   =       0.30 seconds =       0.00 minutes
	system time =       1.03 seconds =       0.02 minutes
	total time  =          1 seconds =       0.02 minutes
Total time:
	user time   =       8.24 seconds =       0.14 minutes
	system time =      11.77 seconds =       0.20 minutes
	total time  =          2 seconds =       0.03 minutes

    			-----------------------------------------

    			 OPTKING 3.0: for geometry optimizations 

    			     By R.A. King, Bethel University     

    			        with contributions from          

    			    A.V. Copan, J. Cayton, A. Heide      

    			-----------------------------------------

    
	                            ===> Fragment 1 <== 

	 Z (Atomic Numbers)          Masses                          Geom                  
	       2.000000             4.002603          0.00000000  0.00000000  1.97125604   
	      10.000000            19.992440          0.00000000  0.00000000 -0.39465697   

	 - Coordinate -           - BOHR/RAD -       - ANG/DEG -
	 R(1,2)           =         2.365913           1.251987


	        --- Internal Coordinate Step in ANG or DEG, aJ/ANG or AJ/DEG ---
	-------------------------------------------------------------------------------
	           Coordinate      Previous         Force          Change          New 
	           ----------      --------        ------          ------        ------
	               R(1,2)       1.25199       -0.00231       -0.00057       1.25141
	-------------------------------------------------------------------------------

	                                 ==> Convergence Check <==                                  
    
	Measures of convergence in internal coordinates in au.
    
	Criteria marked as inactive (o), active & met (*), and active & unmet ( ).

	----------------------------------------------------------------------------------------------
	   Step    Total Energy     Delta E     Max Force     RMS Force      Max Disp      RMS Disp   
	----------------------------------------------------------------------------------------------
	  Convergence Criteria     1.00e-06 *    3.00e-04 *             o    1.20e-03 *             o
	----------------------------------------------------------------------------------------------
	     3    -127.67620129   -1.02e-06      2.80e-04 *    2.80e-04 o    1.09e-03 *    1.09e-03 o  ~
	----------------------------------------------------------------------------------------------

Next Geometry in Ang 
	Fragment 1 (Ang)

	   He   0.0000000000   0.0000000000   1.0428566476
	   Ne   0.0000000000   0.0000000000  -0.2085563488


    Final optimized geometry and variables:
    Molecular point group: c2v
    Full point group: C_inf_v

    Geometry (in Angstrom), charge = 1, multiplicity = 6:

    HE           0.000000000000     0.000000000000     1.043143772745
    NE           0.000000000000     0.000000000000    -0.208843473959


    Psi4 stopped on: Thursday, 17 July 2025 12:29PM
    Psi4 wall time for execution: 0:00:02.58

*** Psi4 exiting successfully. Buy a developer a beer!
