
    -----------------------------------------------------------------------
          Psi4: An Open-Source Ab Initio Electronic Structure Package
                               Psi4 1.9.1 release

                         Git: Rev {} zzzzzzz 


    D. G. A. Smith, L. A. Burns, A. C. Simmonett, R. M. Parrish,
    M. C. Schieber, R. Galvelis, P. Kraus, H. Kruse, R. Di Remigio,
    A. Alenaizan, A. M. James, S. Lehtola, J. P. Misiewicz, M. Scheurer,
    R. A. Shaw, J. B. Schriber, Y. Xie, Z. L. Glick, D. A. Sirianni,
    J. S. O'Brien, J. M. Waldrop, A. Kumar, E. G. Hohenstein,
    B. P. Pritchard, B. R. Brooks, H. F. Schaefer III, A. Yu. Sokolov,
    K. Patkowski, A. E. DePrince III, U. Bozkaya, R. A. King,
    F. A. Evangelista, J. M. Turney, T. D. Crawford, C. D. Sherrill,
    J. Chem. Phys. 152(18) 184108 (2020). https://doi.org/10.1063/5.0006002

                            Additional Code Authors
    E. T. Seidl, C. L. Janssen, E. F. Valeev, M. L. Leininger,
    J. F. Gonthier, R. M. Richard, H. R. McAlexander, M. Saitow, X. Wang,
    P. Verma, M. H. Lechner, A. Jiang, S. Behnle, A. G. Heide,
    M. F. Herbst, and D. L. Poole

             Previous Authors, Complete List of Code Contributors,
                       and Citations for Specific Modules
    https://github.com/psi4/psi4/blob/master/codemeta.json
    https://github.com/psi4/psi4/graphs/contributors
    http://psicode.org/psi4manual/master/introduction.html#citing-psifour

    -----------------------------------------------------------------------


    Psi4 started on: Thursday, 17 July 2025 01:40PM

    Process ID: 74320
    Host:       Joses-MacBook-Pro-2.local
    PSIDATADIR: /Users/joseantoniorodriguesromero/anaconda3/share/psi4
    Memory:     500.0 MiB
    Threads:    1
    
  ==> Input File <==

--------------------------------------------------------------------------
molecule { 
1 1
C   0.00000        0.60000        0.00000
N   0.00000       -0.60000        0.00000
}

set { 
basis              cc-pvdz
reference          uks
maxiter            500
geom_maxiter       500
DAMPING_PERCENTAGE 1
guess              SAP
}

optimize('b3lyp')
--------------------------------------------------------------------------

Scratch directory: /tmp/
gradient() will perform analytic gradient computation.
   => Libint2 <=

    Primary   basis highest AM E, G, H:  6, 6, 3
    Auxiliary basis highest AM E, G, H:  7, 7, 4
    Onebody   basis highest AM E, G, H:  -, -, -
    Solid Harmonics ordering:            Gaussian

*** tstart() called on Joses-MacBook-Pro-2.local
*** at Thu Jul 17 13:40:41 2025

   => Loading Basis Set <=

    Name: CC-PVDZ
    Role: ORBITAL
    Keyword: BASIS
    atoms 1 entry C          line   138 file /Users/joseantoniorodriguesromero/anaconda3/share/psi4/basis/cc-pvdz.gbs 
    atoms 2 entry N          line   168 file /Users/joseantoniorodriguesromero/anaconda3/share/psi4/basis/cc-pvdz.gbs 


         ---------------------------------------------------------
                                   SCF
               by Justin Turney, Rob Parrish, Andy Simmonett
                          and Daniel G. A. Smith
                              UKS Reference
                        1 Threads,    500 MiB Core
         ---------------------------------------------------------

  ==> Geometry <==

    Molecular point group: c2v
    Full point group: C_inf_v

    Geometry (in Angstrom), charge = 1, multiplicity = 1:

       Center              X                  Y                   Z               Mass       
    ------------   -----------------  -----------------  -----------------  -----------------
         C            0.000000000000     0.000000000000     0.646219320164    12.000000000000
         N            0.000000000000     0.000000000000    -0.553780679836    14.003074004430

  Running in c2v symmetry.

  Rotational constants: A = ************  B =      1.81157  C =      1.81157 [cm^-1]
  Rotational constants: A = ************  B =  54309.37053  C =  54309.37053 [MHz]
  Nuclear repulsion =   18.521202373450002

  Charge       = 1
  Multiplicity = 1
  Electrons    = 12
  Nalpha       = 6
  Nbeta        = 6

  ==> Algorithm <==

  SCF Algorithm Type is DF.
  DIIS enabled.
  MOM disabled.
  Fractional occupation disabled.
  Guess Type is SAP.
  Energy threshold   = 1.00e-08
  Density threshold  = 1.00e-08
  Integral threshold = 1.00e-12

  ==> Primary Basis <==

  Basis Set: CC-PVDZ
    Blend: CC-PVDZ
    Number of shells: 12
    Number of basis functions: 28
    Number of Cartesian functions: 30
    Spherical Harmonics?: true
    Max angular momentum: 2

  ==> DFT Potential <==

   => LibXC <=

    Version 6.2.2
    S. Lehtola, C. Steigemann, M. J.T. Oliveira, and M. A.L. Marques.,  SoftwareX 7, 1–5 (2018) (10.1016/j.softx.2017.11.002)

   => Composite Functional: B3LYP <= 

    B3LYP Hyb-GGA Exchange-Correlation Functional

    P. J. Stephens, F. J. Devlin, C. F. Chabalowski, and M. J. Frisch.,  J. Phys. Chem. 98, 11623 (1994) (10.1021/j100096a001)

    Deriv               =              1
    GGA                 =           TRUE
    Meta                =          FALSE

    Exchange Hybrid     =           TRUE
    MP2 Hybrid          =          FALSE

   => Exchange Functionals <=

    0.0800   Slater exchange
    0.7200         Becke 88

   => Exact (HF) Exchange <=

    0.2000               HF 

   => Correlation Functionals <=

    0.1900   Vosko, Wilk & Nusair (VWN5_RPA)
    0.8100   Lee, Yang & Parr

   => LibXC Density Thresholds  <==

    XC_HYB_GGA_XC_B3LYP:  1.00E-15 

   => Molecular Quadrature <=

    Radial Scheme          =       TREUTLER
    Pruning Scheme         =           NONE
    Nuclear Scheme         =       TREUTLER

    Blocking Scheme        =         OCTREE
    BS radius alpha        =              1
    Pruning alpha          =              1
    Radial Points          =             75
    Spherical Points       =            302
    Total Points           =          42672
    Total Blocks           =            384
    Max Points             =            256
    Max Functions          =             28
    Weights Tolerance      =       1.00E-15

   => Loading Basis Set <=

    Name: (CC-PVDZ AUX)
    Role: JKFIT
    Keyword: DF_BASIS_SCF
    atoms 1 entry C          line   121 file /Users/joseantoniorodriguesromero/anaconda3/share/psi4/basis/cc-pvdz-jkfit.gbs 
    atoms 2 entry N          line   171 file /Users/joseantoniorodriguesromero/anaconda3/share/psi4/basis/cc-pvdz-jkfit.gbs 

  ==> Integral Setup <==

  DFHelper Memory: AOs need 0.001 GiB; user supplied 0.332 GiB. 
  Using in-core AOs.

  ==> MemDFJK: Density-Fitted J/K Matrices <==

    J tasked:                   Yes
    K tasked:                   Yes
    wK tasked:                   No
    OpenMP threads:               1
    Memory [MiB]:               339
    Algorithm:                 Core
    Schwarz Cutoff:           1E-12
    Mask sparsity (%):       0.0000
    Fitting Condition:        1E-10

   => Auxiliary Basis Set <=

  Basis Set: (CC-PVDZ AUX)
    Blend: CC-PVDZ-JKFIT
    Number of shells: 48
    Number of basis functions: 140
    Number of Cartesian functions: 162
    Spherical Harmonics?: true
    Max angular momentum: 3

  Cached 100.0% of DFT collocation blocks in 0.034 [GiB].

  Minimum eigenvalue in the overlap matrix is 1.1329986613E-02.
  Reciprocal condition number of the overlap matrix is 3.6584227228E-03.
    Using symmetric orthogonalization.

  ==> Pre-Iterations <==

  SCF Guess: Superposition of Atomic Potentials (doi:10.1021/acs.jctc.8b01089).

  ==> SAP guess <==

   => Molecular Quadrature <=

    Radial Scheme          =       TREUTLER
    Pruning Scheme         =           NONE
    Nuclear Scheme         =       TREUTLER

    Blocking Scheme        =         OCTREE
    BS radius alpha        =              1
    Pruning alpha          =              1
    Radial Points          =             75
    Spherical Points       =            302
    Total Points           =          42672
    Total Blocks           =            384
    Max Points             =            256
    Max Functions          =             28
    Weights Tolerance      =       1.00E-15

   -------------------------------------------------------
    Irrep   Nso     Nmo     Nalpha   Nbeta   Ndocc  Nsocc
   -------------------------------------------------------
     A1        14      14       4       4       4       0
     A2         2       2       0       0       0       0
     B1         6       6       1       1       1       0
     B2         6       6       1       1       1       0
   -------------------------------------------------------
    Total      28      28       6       6       6       0
   -------------------------------------------------------

  ==> Iterations <==

                           Total Energy        Delta E     RMS |[F,P]|

   @DF-UKS iter   1:   -91.80280121835099   -9.18028e+01   4.89294e-02 DIIS/ADIIS
   @DF-UKS iter   2:   -88.37452010142040    3.42828e+00   1.39289e-01 ADIIS/DAMP=1%
   @DF-UKS iter   3:   -91.56754595420530   -3.19303e+00   6.67755e-02 DIIS/ADIIS/DAMP=1%
   @DF-UKS iter   4:   -92.15217814692463   -5.84632e-01   4.43514e-03 DIIS/ADIIS/DAMP=1%
   @DF-UKS iter   5:   -92.15671987269187   -4.54173e-03   8.17679e-03 DIIS/ADIIS/DAMP=1%
   @DF-UKS iter   6:   -92.16502620949305   -8.30634e-03   8.10184e-04 DIIS/ADIIS/DAMP=1%
   @DF-UKS iter   7:   -92.16564467031478   -6.18461e-04   2.77419e-04 DIIS/ADIIS/DAMP=1%
   @DF-UKS iter   8:   -92.16565966802803   -1.49977e-05   3.84314e-05 DIIS/DAMP=1%
   @DF-UKS iter   9:   -92.16571298558961   -5.33176e-05   1.83768e-05 DIIS/DAMP=1%
   @DF-UKS iter  10:   -92.16570266751894    1.03181e-05   1.65918e-07 DIIS/DAMP=1%
   @DF-UKS iter  11:   -92.16570513896103   -2.47144e-06   1.18821e-07 DIIS/DAMP=1%
   @DF-UKS iter  12:   -92.16570516573066   -2.67696e-08   6.08607e-09 DIIS/DAMP=1%
   @DF-UKS iter  13:   -92.16570518181217   -1.60815e-08   8.05590e-10 DIIS/DAMP=1%
   @DF-UKS iter  14:   -92.16570518102053    7.91644e-10   6.56899e-12 DIIS/DAMP=1%
  Energy and wave function converged.


  ==> Post-Iterations <==

   Electrons on quadrature grid:
      Nalpha   =    5.9999999250 ; deviation = -7.498e-08
      Nbeta    =    5.9999999250 ; deviation = -7.498e-08
      Ntotal   =   11.9999998500 ; deviation = -1.500e-07 

   @Spin Contamination Metric:   6.217248938E-15
   @S^2 Expected:                0.000000000E+00
   @S^2 Observed:                6.217248938E-15
   @S   Expected:                0.000000000E+00
   @S   Observed:                0.000000000E+00

    Orbital Energies [Eh]
    ---------------------

    Alpha Occupied:                                                       

       1A1   -14.864515     2A1   -10.789371     3A1    -1.347998  
       4A1    -0.863957     1B1    -0.769049     1B2    -0.769049  

    Alpha Virtual:                                                        

       5A1    -0.693984     2B1    -0.395988     2B2    -0.395988  
       6A1    -0.038106     3B1     0.130603     3B2     0.130603  
       7A1     0.178559     8A1     0.288300     9A1     0.354065  
       4B2     0.431560     4B1     0.431560     1A2     0.716165  
      10A1     0.716165     5B2     0.832250     5B1     0.832250  
      11A1     0.975974    12A1     1.449413     2A2     1.449413  
      13A1     1.488973     6B2     1.919922     6B1     1.919922  
      14A1     2.274580  

    Beta Occupied:                                                        

       1A1   -14.864515     2A1   -10.789371     3A1    -1.347998  
       4A1    -0.863957     1B1    -0.769049     1B2    -0.769049  

    Beta Virtual:                                                         

       5A1    -0.693984     2B1    -0.395988     2B2    -0.395988  
       6A1    -0.038106     3B1     0.130603     3B2     0.130603  
       7A1     0.178559     8A1     0.288300     9A1     0.354065  
       4B2     0.431560     4B1     0.431560     1A2     0.716165  
      10A1     0.716165     5B2     0.832250     5B1     0.832250  
      11A1     0.975974    12A1     1.449413     2A2     1.449413  
      13A1     1.488973     6B2     1.919922     6B1     1.919922  
      14A1     2.274580  

    Final Occupation by Irrep:
             A1    A2    B1    B2 
    DOCC [     4,    0,    1,    1 ]
    SOCC [     0,    0,    0,    0 ]
    NA   [     4,    0,    1,    1 ]
    NB   [     4,    0,    1,    1 ]

  @DF-UKS Final Energy:   -92.16570518102053

   => Energetics <=

    Nuclear Repulsion Energy =             18.5212023734500022
    One-Electron Energy =                -155.7425071314135039
    Two-Electron Energy =                  54.5238340627711153
    DFT Exchange-Correlation Energy =      -9.4682344858281340
    Empirical Dispersion Energy =           0.0000000000000000
    VV10 Nonlocal Energy =                  0.0000000000000000
    Total Energy =                        -92.1657051810205274

  UHF NO Occupations:
  HONO-2 :    2 A1 2.0000000
  HONO-1 :    3 A1 2.0000000
  HONO-0 :    4 A1 2.0000000
  LUNO+0 :    5 A1 0.0000000
  LUNO+1 :    6 A1 0.0000000
  LUNO+2 :    2 B2 0.0000000
  LUNO+3 :    7 A1 0.0000000


Computation Completed


Properties will be evaluated at   0.000000,   0.000000,   0.000000 [a0]

Properties computed using the SCF density matrix


 Multipole Moments:

 ------------------------------------------------------------------------------------
     Multipole            Electronic (a.u.)      Nuclear  (a.u.)        Total (a.u.)
 ------------------------------------------------------------------------------------

 L = 1.  Multiply by 2.5417464519 to convert [e a0] to [Debye]
 Dipole X            :          0.0000000            0.0000000            0.0000000
 Dipole Y            :          0.0000000            0.0000000            0.0000000
 Dipole Z            :          0.7762732            0.0016085            0.7778817
 Magnitude           :                                                    0.7778817

 ------------------------------------------------------------------------------------

*** tstop() called on Joses-MacBook-Pro-2.local at Thu Jul 17 13:40:42 2025
Module time:
	user time   =       5.30 seconds =       0.09 minutes
	system time =       4.23 seconds =       0.07 minutes
	total time  =          1 seconds =       0.02 minutes
Total time:
	user time   =       5.30 seconds =       0.09 minutes
	system time =       4.23 seconds =       0.07 minutes
	total time  =          1 seconds =       0.02 minutes

*** tstart() called on Joses-MacBook-Pro-2.local
*** at Thu Jul 17 13:40:42 2025


         ------------------------------------------------------------
                                   SCF GRAD                          
                          Rob Parrish, Justin Turney,                
                       Andy Simmonett, and Alex Sokolov              
         ------------------------------------------------------------

  ==> Geometry <==

    Molecular point group: c2v
    Full point group: C_inf_v

    Geometry (in Angstrom), charge = 1, multiplicity = 1:

       Center              X                  Y                   Z               Mass       
    ------------   -----------------  -----------------  -----------------  -----------------
         C            0.000000000000     0.000000000000     0.646219320164    12.000000000000
         N            0.000000000000     0.000000000000    -0.553780679836    14.003074004430

  Nuclear repulsion =   18.521202373450002

  ==> Basis Set <==

  Basis Set: CC-PVDZ
    Blend: CC-PVDZ
    Number of shells: 12
    Number of basis functions: 28
    Number of Cartesian functions: 30
    Spherical Harmonics?: true
    Max angular momentum: 2

  ==> DFJKGrad: Density-Fitted SCF Gradients <==

    Gradient:                    1
    J tasked:                  Yes
    K tasked:                  Yes
    wK tasked:                  No
    OpenMP threads:              1
    Integrals threads:           1
    Memory [MiB]:              375
    Schwarz Cutoff:          1E-12
    Fitting Condition:       1E-10

   => Auxiliary Basis Set <=

  Basis Set: (CC-PVDZ AUX)
    Blend: CC-PVDZ-JKFIT
    Number of shells: 48
    Number of basis functions: 140
    Number of Cartesian functions: 162
    Spherical Harmonics?: true
    Max angular momentum: 3

  ==> DFT Potential <==

   => LibXC <=

    Version 6.2.2
    S. Lehtola, C. Steigemann, M. J.T. Oliveira, and M. A.L. Marques.,  SoftwareX 7, 1–5 (2018) (10.1016/j.softx.2017.11.002)

   => Composite Functional: B3LYP <= 

    B3LYP Hyb-GGA Exchange-Correlation Functional

    P. J. Stephens, F. J. Devlin, C. F. Chabalowski, and M. J. Frisch.,  J. Phys. Chem. 98, 11623 (1994) (10.1021/j100096a001)

    Deriv               =              1
    GGA                 =           TRUE
    Meta                =          FALSE

    Exchange Hybrid     =           TRUE
    MP2 Hybrid          =          FALSE

   => Exchange Functionals <=

    0.0800   Slater exchange
    0.7200         Becke 88

   => Exact (HF) Exchange <=

    0.2000               HF 

   => Correlation Functionals <=

    0.1900   Vosko, Wilk & Nusair (VWN5_RPA)
    0.8100   Lee, Yang & Parr

   => LibXC Density Thresholds  <==

    XC_HYB_GGA_XC_B3LYP:  1.00E-15 

   => Molecular Quadrature <=

    Radial Scheme          =       TREUTLER
    Pruning Scheme         =           NONE
    Nuclear Scheme         =       TREUTLER

    Blocking Scheme        =         OCTREE
    BS radius alpha        =              1
    Pruning alpha          =              1
    Radial Points          =             75
    Spherical Points       =            302
    Total Points           =          42672
    Total Blocks           =            384
    Max Points             =            256
    Max Functions          =             28
    Weights Tolerance      =       1.00E-15


  -Total Gradient:
     Atom            X                  Y                   Z
    ------   -----------------  -----------------  -----------------
       1       -0.000000000000     0.000000000000     0.029690080875
       2        0.000000000000     0.000000000000    -0.029687292358


*** tstop() called on Joses-MacBook-Pro-2.local at Thu Jul 17 13:40:43 2025
Module time:
	user time   =       0.58 seconds =       0.01 minutes
	system time =       1.29 seconds =       0.02 minutes
	total time  =          1 seconds =       0.02 minutes
Total time:
	user time   =       5.88 seconds =       0.10 minutes
	system time =       5.52 seconds =       0.09 minutes
	total time  =          2 seconds =       0.03 minutes

    			-----------------------------------------

    			 OPTKING 3.0: for geometry optimizations 

    			     By R.A. King, Bethel University     

    			        with contributions from          

    			    A.V. Copan, J. Cayton, A. Heide      

    			-----------------------------------------

    
	                            ===> Fragment 1 <== 

	 Z (Atomic Numbers)          Masses                          Geom                  
	       6.000000            12.000000          0.00000000  0.00000000  1.22117753   
	       7.000000            14.003074          0.00000000  0.00000000 -1.04649382   

	 - Coordinate -           - BOHR/RAD -       - ANG/DEG -
	 R(1,2)           =         2.267671           1.200000


	        --- Internal Coordinate Step in ANG or DEG, aJ/ANG or AJ/DEG ---
	-------------------------------------------------------------------------------
	           Coordinate      Previous         Force          Change          New 
	           ----------      --------        ------          ------        ------
	               R(1,2)       1.20000       -0.24460       -0.01498       1.18502
	-------------------------------------------------------------------------------

	                                 ==> Convergence Check <==                                  
    
	Measures of convergence in internal coordinates in au.
    
	Criteria marked as inactive (o), active & met (*), and active & unmet ( ).

	----------------------------------------------------------------------------------------------
	   Step    Total Energy     Delta E     Max Force     RMS Force      Max Disp      RMS Disp   
	----------------------------------------------------------------------------------------------
	  Convergence Criteria     1.00e-06 *    3.00e-04 *             o    1.20e-03 *             o
	----------------------------------------------------------------------------------------------
	     1     -92.16570518   -9.22e+01      2.97e-02      2.97e-02 o    2.83e-02      2.83e-02 o  ~
	----------------------------------------------------------------------------------------------

Next Geometry in Ang 
	Fragment 1 (Ang)

	    C   0.0000000000   0.0000000000   0.6387314674
	    N   0.0000000000   0.0000000000  -0.5462928270


    Structure for next step:
    Molecular point group: c2v
    Full point group: C_inf_v

    Geometry (in Angstrom), charge = 1, multiplicity = 1:

    C            0.000000000000     0.000000000000     0.638154661597
    N            0.000000000000     0.000000000000    -0.546869632821


Scratch directory: /tmp/
gradient() will perform analytic gradient computation.
   => Libint2 <=

    Primary   basis highest AM E, G, H:  6, 6, 3
    Auxiliary basis highest AM E, G, H:  7, 7, 4
    Onebody   basis highest AM E, G, H:  -, -, -
    Solid Harmonics ordering:            Gaussian

*** tstart() called on Joses-MacBook-Pro-2.local
*** at Thu Jul 17 13:40:43 2025

   => Loading Basis Set <=

    Name: CC-PVDZ
    Role: ORBITAL
    Keyword: BASIS
    atoms 1 entry C          line   138 file /Users/joseantoniorodriguesromero/anaconda3/share/psi4/basis/cc-pvdz.gbs 
    atoms 2 entry N          line   168 file /Users/joseantoniorodriguesromero/anaconda3/share/psi4/basis/cc-pvdz.gbs 


         ---------------------------------------------------------
                                   SCF
               by Justin Turney, Rob Parrish, Andy Simmonett
                          and Daniel G. A. Smith
                              UKS Reference
                        1 Threads,    500 MiB Core
         ---------------------------------------------------------

  ==> Geometry <==

    Molecular point group: c2v
    Full point group: C_inf_v

    Geometry (in Angstrom), charge = 1, multiplicity = 1:

       Center              X                  Y                   Z               Mass       
    ------------   -----------------  -----------------  -----------------  -----------------
         C            0.000000000000     0.000000000000     0.638154661597    12.000000000000
         N            0.000000000000     0.000000000000    -0.546869632821    14.003074004430

  Running in c2v symmetry.

  Rotational constants: A = ************  B =      1.85764  C =      1.85764 [cm^-1]
  Rotational constants: A = ************  B =  55690.70981  C =  55690.70981 [MHz]
  Nuclear repulsion =   18.755263459863837

  Charge       = 1
  Multiplicity = 1
  Electrons    = 12
  Nalpha       = 6
  Nbeta        = 6

  ==> Algorithm <==

  SCF Algorithm Type is DF.
  DIIS enabled.
  MOM disabled.
  Fractional occupation disabled.
  Guess Type is READ.
  Energy threshold   = 1.00e-08
  Density threshold  = 1.00e-08
  Integral threshold = 1.00e-12

  ==> Primary Basis <==

  Basis Set: CC-PVDZ
    Blend: CC-PVDZ
    Number of shells: 12
    Number of basis functions: 28
    Number of Cartesian functions: 30
    Spherical Harmonics?: true
    Max angular momentum: 2

  ==> DFT Potential <==

   => LibXC <=

    Version 6.2.2
    S. Lehtola, C. Steigemann, M. J.T. Oliveira, and M. A.L. Marques.,  SoftwareX 7, 1–5 (2018) (10.1016/j.softx.2017.11.002)

   => Composite Functional: B3LYP <= 

    B3LYP Hyb-GGA Exchange-Correlation Functional

    P. J. Stephens, F. J. Devlin, C. F. Chabalowski, and M. J. Frisch.,  J. Phys. Chem. 98, 11623 (1994) (10.1021/j100096a001)

    Deriv               =              1
    GGA                 =           TRUE
    Meta                =          FALSE

    Exchange Hybrid     =           TRUE
    MP2 Hybrid          =          FALSE

   => Exchange Functionals <=

    0.0800   Slater exchange
    0.7200         Becke 88

   => Exact (HF) Exchange <=

    0.2000               HF 

   => Correlation Functionals <=

    0.1900   Vosko, Wilk & Nusair (VWN5_RPA)
    0.8100   Lee, Yang & Parr

   => LibXC Density Thresholds  <==

    XC_HYB_GGA_XC_B3LYP:  1.00E-15 

   => Molecular Quadrature <=

    Radial Scheme          =       TREUTLER
    Pruning Scheme         =           NONE
    Nuclear Scheme         =       TREUTLER

    Blocking Scheme        =         OCTREE
    BS radius alpha        =              1
    Pruning alpha          =              1
    Radial Points          =             75
    Spherical Points       =            302
    Total Points           =          42672
    Total Blocks           =            386
    Max Points             =            256
    Max Functions          =             28
    Weights Tolerance      =       1.00E-15

   => Loading Basis Set <=

    Name: (CC-PVDZ AUX)
    Role: JKFIT
    Keyword: DF_BASIS_SCF
    atoms 1 entry C          line   121 file /Users/joseantoniorodriguesromero/anaconda3/share/psi4/basis/cc-pvdz-jkfit.gbs 
    atoms 2 entry N          line   171 file /Users/joseantoniorodriguesromero/anaconda3/share/psi4/basis/cc-pvdz-jkfit.gbs 

   => Loading Basis Set <=

    Name: CC-PVDZ
    Role: ORBITAL
    Keyword: BASIS
    atoms 1 entry C          line   138 file /Users/joseantoniorodriguesromero/anaconda3/share/psi4/basis/cc-pvdz.gbs 
    atoms 2 entry N          line   168 file /Users/joseantoniorodriguesromero/anaconda3/share/psi4/basis/cc-pvdz.gbs 

  Reading orbitals from file /tmp/singlet_CN.default.74320.180.npy, no projection.

  ==> Integral Setup <==

  DFHelper Memory: AOs need 0.001 GiB; user supplied 0.332 GiB. 
  Using in-core AOs.

  ==> MemDFJK: Density-Fitted J/K Matrices <==

    J tasked:                   Yes
    K tasked:                   Yes
    wK tasked:                   No
    OpenMP threads:               1
    Memory [MiB]:               339
    Algorithm:                 Core
    Schwarz Cutoff:           1E-12
    Mask sparsity (%):       0.0000
    Fitting Condition:        1E-10

   => Auxiliary Basis Set <=

  Basis Set: (CC-PVDZ AUX)
    Blend: CC-PVDZ-JKFIT
    Number of shells: 48
    Number of basis functions: 140
    Number of Cartesian functions: 162
    Spherical Harmonics?: true
    Max angular momentum: 3

  Cached 100.0% of DFT collocation blocks in 0.034 [GiB].

  Minimum eigenvalue in the overlap matrix is 1.1006644306E-02.
  Reciprocal condition number of the overlap matrix is 3.5440735889E-03.
    Using symmetric orthogonalization.

  ==> Pre-Iterations <==

  SCF Guess: Orbitals guess was supplied from a previous computation.

   -------------------------------------------------------
    Irrep   Nso     Nmo     Nalpha   Nbeta   Ndocc  Nsocc
   -------------------------------------------------------
     A1        14      14       4       4       4       0
     A2         2       2       0       0       0       0
     B1         6       6       1       1       1       0
     B2         6       6       1       1       1       0
   -------------------------------------------------------
    Total      28      28       6       6       6       0
   -------------------------------------------------------

  ==> Iterations <==

                           Total Energy        Delta E     RMS |[F,P]|

   @DF-UKS iter   0:   -92.19429535368683   -9.21943e+01   2.81820e-03 
   @DF-UKS iter   1:   -92.16609224466899    2.82031e-02   6.62199e-04 DIIS/ADIIS
   @DF-UKS iter   2:   -92.16550559626347    5.86648e-04   2.33480e-03 DIIS/ADIIS/DAMP=1%
   @DF-UKS iter   3:   -92.16650578856429   -1.00019e-03   7.71880e-04 DIIS/ADIIS/DAMP=1%
   @DF-UKS iter   4:   -92.16613774552916    3.68043e-04   3.34281e-05 DIIS/DAMP=1%
   @DF-UKS iter   5:   -92.16616224727272   -2.45017e-05   1.51041e-05 DIIS/DAMP=1%
   @DF-UKS iter   6:   -92.16615342792493    8.81935e-06   9.29201e-07 DIIS/DAMP=1%
   @DF-UKS iter   7:   -92.16615533192466   -1.90400e-06   4.03558e-07 DIIS/DAMP=1%
   @DF-UKS iter   8:   -92.16615527304364    5.88810e-08   4.95731e-08 DIIS/DAMP=1%
   @DF-UKS iter   9:   -92.16615525125228    2.17914e-08   5.77201e-09 DIIS/DAMP=1%
   @DF-UKS iter  10:   -92.16615524761859    3.63369e-09   4.47299e-10 DIIS/DAMP=1%
  Energy and wave function converged.


  ==> Post-Iterations <==

   Electrons on quadrature grid:
      Nalpha   =    5.9999999160 ; deviation = -8.404e-08
      Nbeta    =    5.9999999160 ; deviation = -8.404e-08
      Ntotal   =   11.9999998319 ; deviation = -1.681e-07 

   @Spin Contamination Metric:   2.575717417E-14
   @S^2 Expected:                0.000000000E+00
   @S^2 Observed:                2.575717417E-14
   @S   Expected:                0.000000000E+00
   @S   Observed:                0.000000000E+00

    Orbital Energies [Eh]
    ---------------------

    Alpha Occupied:                                                       

       1A1   -14.862163     2A1   -10.787012     3A1    -1.354701  
       4A1    -0.861602     1B1    -0.773129     1B2    -0.773129  

    Alpha Virtual:                                                        

       5A1    -0.694691     2B2    -0.390603     2B1    -0.390603  
       6A1    -0.035972     3B1     0.129211     3B2     0.129211  
       7A1     0.178634     8A1     0.301675     9A1     0.358788  
       4B2     0.432254     4B1     0.432254     1A2     0.714314  
      10A1     0.714314     5B2     0.840971     5B1     0.840971  
      11A1     0.979310    12A1     1.454022     2A2     1.454022  
      13A1     1.512046     6B2     1.932365     6B1     1.932365  
      14A1     2.295552  

    Beta Occupied:                                                        

       1A1   -14.862163     2A1   -10.787012     3A1    -1.354701  
       4A1    -0.861602     1B1    -0.773129     1B2    -0.773129  

    Beta Virtual:                                                         

       5A1    -0.694691     2B2    -0.390603     2B1    -0.390603  
       6A1    -0.035972     3B1     0.129211     3B2     0.129211  
       7A1     0.178634     8A1     0.301675     9A1     0.358788  
       4B2     0.432254     4B1     0.432254     1A2     0.714314  
      10A1     0.714314     5B1     0.840971     5B2     0.840971  
      11A1     0.979310    12A1     1.454022     2A2     1.454022  
      13A1     1.512046     6B2     1.932365     6B1     1.932365  
      14A1     2.295552  

    Final Occupation by Irrep:
             A1    A2    B1    B2 
    DOCC [     4,    0,    1,    1 ]
    SOCC [     0,    0,    0,    0 ]
    NA   [     4,    0,    1,    1 ]
    NB   [     4,    0,    1,    1 ]

  @DF-UKS Final Energy:   -92.16615524761859

   => Energetics <=

    Nuclear Repulsion Energy =             18.7552634598638370
    One-Electron Energy =                -156.1881051355298382
    Two-Electron Energy =                  54.7463920587798540
    DFT Exchange-Correlation Energy =      -9.4797056307324592
    Empirical Dispersion Energy =           0.0000000000000000
    VV10 Nonlocal Energy =                  0.0000000000000000
    Total Energy =                        -92.1661552476185904

  UHF NO Occupations:
  HONO-2 :    2 A1 2.0000000
  HONO-1 :    3 A1 2.0000000
  HONO-0 :    4 A1 2.0000000
  LUNO+0 :    5 A1 0.0000000
  LUNO+1 :    6 A1 0.0000000
  LUNO+2 :    7 A1 0.0000000
  LUNO+3 :    2 B2 0.0000000


Computation Completed


Properties will be evaluated at   0.000000,   0.000000,   0.000000 [a0]

Properties computed using the SCF density matrix


 Multipole Moments:

 ------------------------------------------------------------------------------------
     Multipole            Electronic (a.u.)      Nuclear  (a.u.)        Total (a.u.)
 ------------------------------------------------------------------------------------

 L = 1.  Multiply by 2.5417464519 to convert [e a0] to [Debye]
 Dipole X            :          0.0000000            0.0000000            0.0000000
 Dipole Y            :          0.0000000            0.0000000            0.0000000
 Dipole Z            :          0.7782002            0.0015884            0.7797886
 Magnitude           :                                                    0.7797886

 ------------------------------------------------------------------------------------

*** tstop() called on Joses-MacBook-Pro-2.local at Thu Jul 17 13:40:43 2025
Module time:
	user time   =       3.05 seconds =       0.05 minutes
	system time =       3.81 seconds =       0.06 minutes
	total time  =          0 seconds =       0.00 minutes
Total time:
	user time   =       8.97 seconds =       0.15 minutes
	system time =       9.57 seconds =       0.16 minutes
	total time  =          2 seconds =       0.03 minutes

*** tstart() called on Joses-MacBook-Pro-2.local
*** at Thu Jul 17 13:40:43 2025


         ------------------------------------------------------------
                                   SCF GRAD                          
                          Rob Parrish, Justin Turney,                
                       Andy Simmonett, and Alex Sokolov              
         ------------------------------------------------------------

  ==> Geometry <==

    Molecular point group: c2v
    Full point group: C_inf_v

    Geometry (in Angstrom), charge = 1, multiplicity = 1:

       Center              X                  Y                   Z               Mass       
    ------------   -----------------  -----------------  -----------------  -----------------
         C            0.000000000000     0.000000000000     0.638154661597    12.000000000000
         N            0.000000000000     0.000000000000    -0.546869632821    14.003074004430

  Nuclear repulsion =   18.755263459863837

  ==> Basis Set <==

  Basis Set: CC-PVDZ
    Blend: CC-PVDZ
    Number of shells: 12
    Number of basis functions: 28
    Number of Cartesian functions: 30
    Spherical Harmonics?: true
    Max angular momentum: 2

  ==> DFJKGrad: Density-Fitted SCF Gradients <==

    Gradient:                    1
    J tasked:                  Yes
    K tasked:                  Yes
    wK tasked:                  No
    OpenMP threads:              1
    Integrals threads:           1
    Memory [MiB]:              375
    Schwarz Cutoff:          1E-12
    Fitting Condition:       1E-10

   => Auxiliary Basis Set <=

  Basis Set: (CC-PVDZ AUX)
    Blend: CC-PVDZ-JKFIT
    Number of shells: 48
    Number of basis functions: 140
    Number of Cartesian functions: 162
    Spherical Harmonics?: true
    Max angular momentum: 3

  ==> DFT Potential <==

   => LibXC <=

    Version 6.2.2
    S. Lehtola, C. Steigemann, M. J.T. Oliveira, and M. A.L. Marques.,  SoftwareX 7, 1–5 (2018) (10.1016/j.softx.2017.11.002)

   => Composite Functional: B3LYP <= 

    B3LYP Hyb-GGA Exchange-Correlation Functional

    P. J. Stephens, F. J. Devlin, C. F. Chabalowski, and M. J. Frisch.,  J. Phys. Chem. 98, 11623 (1994) (10.1021/j100096a001)

    Deriv               =              1
    GGA                 =           TRUE
    Meta                =          FALSE

    Exchange Hybrid     =           TRUE
    MP2 Hybrid          =          FALSE

   => Exchange Functionals <=

    0.0800   Slater exchange
    0.7200         Becke 88

   => Exact (HF) Exchange <=

    0.2000               HF 

   => Correlation Functionals <=

    0.1900   Vosko, Wilk & Nusair (VWN5_RPA)
    0.8100   Lee, Yang & Parr

   => LibXC Density Thresholds  <==

    XC_HYB_GGA_XC_B3LYP:  1.00E-15 

   => Molecular Quadrature <=

    Radial Scheme          =       TREUTLER
    Pruning Scheme         =           NONE
    Nuclear Scheme         =       TREUTLER

    Blocking Scheme        =         OCTREE
    BS radius alpha        =              1
    Pruning alpha          =              1
    Radial Points          =             75
    Spherical Points       =            302
    Total Points           =          42672
    Total Blocks           =            386
    Max Points             =            256
    Max Functions          =             28
    Weights Tolerance      =       1.00E-15


  -Total Gradient:
     Atom            X                  Y                   Z
    ------   -----------------  -----------------  -----------------
       1       -0.000000000000     0.000000000000     0.001608619500
       2        0.000000000000     0.000000000000    -0.001605143635


*** tstop() called on Joses-MacBook-Pro-2.local at Thu Jul 17 13:40:43 2025
Module time:
	user time   =       0.51 seconds =       0.01 minutes
	system time =       0.94 seconds =       0.02 minutes
	total time  =          0 seconds =       0.00 minutes
Total time:
	user time   =       9.50 seconds =       0.16 minutes
	system time =      10.51 seconds =       0.18 minutes
	total time  =          2 seconds =       0.03 minutes

    			-----------------------------------------

    			 OPTKING 3.0: for geometry optimizations 

    			     By R.A. King, Bethel University     

    			        with contributions from          

    			    A.V. Copan, J. Cayton, A. Heide      

    			-----------------------------------------

    
	                            ===> Fragment 1 <== 

	 Z (Atomic Numbers)          Masses                          Geom                  
	       6.000000            12.000000          0.00000000  0.00000000  1.20593754   
	       7.000000            14.003074          0.00000000  0.00000000 -1.03343383   

	 - Coordinate -           - BOHR/RAD -       - ANG/DEG -
	 R(1,2)           =         2.239371           1.185024


	        --- Internal Coordinate Step in ANG or DEG, aJ/ANG or AJ/DEG ---
	-------------------------------------------------------------------------------
	           Coordinate      Previous         Force          Change          New 
	           ----------      --------        ------          ------        ------
	               R(1,2)       1.18502       -0.01324       -0.00086       1.18417
	-------------------------------------------------------------------------------

	                                 ==> Convergence Check <==                                  
    
	Measures of convergence in internal coordinates in au.
    
	Criteria marked as inactive (o), active & met (*), and active & unmet ( ).

	----------------------------------------------------------------------------------------------
	   Step    Total Energy     Delta E     Max Force     RMS Force      Max Disp      RMS Disp   
	----------------------------------------------------------------------------------------------
	  Convergence Criteria     1.00e-06 *    3.00e-04 *             o    1.20e-03 *             o
	----------------------------------------------------------------------------------------------
	     2     -92.16615525   -4.50e-04      1.61e-03      1.61e-03 o    1.62e-03      1.62e-03 o  ~
	----------------------------------------------------------------------------------------------

Next Geometry in Ang 
	Fragment 1 (Ang)

	    C   0.0000000000   0.0000000000   0.6377261969
	    N   0.0000000000   0.0000000000  -0.5464411682


    Structure for next step:
    Molecular point group: c2v
    Full point group: C_inf_v

    Geometry (in Angstrom), charge = 1, multiplicity = 1:

    C            0.000000000000     0.000000000000     0.637693191361
    N            0.000000000000     0.000000000000    -0.546474173735


Scratch directory: /tmp/
gradient() will perform analytic gradient computation.
   => Libint2 <=

    Primary   basis highest AM E, G, H:  6, 6, 3
    Auxiliary basis highest AM E, G, H:  7, 7, 4
    Onebody   basis highest AM E, G, H:  -, -, -
    Solid Harmonics ordering:            Gaussian

*** tstart() called on Joses-MacBook-Pro-2.local
*** at Thu Jul 17 13:40:43 2025

   => Loading Basis Set <=

    Name: CC-PVDZ
    Role: ORBITAL
    Keyword: BASIS
    atoms 1 entry C          line   138 file /Users/joseantoniorodriguesromero/anaconda3/share/psi4/basis/cc-pvdz.gbs 
    atoms 2 entry N          line   168 file /Users/joseantoniorodriguesromero/anaconda3/share/psi4/basis/cc-pvdz.gbs 


         ---------------------------------------------------------
                                   SCF
               by Justin Turney, Rob Parrish, Andy Simmonett
                          and Daniel G. A. Smith
                              UKS Reference
                        1 Threads,    500 MiB Core
         ---------------------------------------------------------

  ==> Geometry <==

    Molecular point group: c2v
    Full point group: C_inf_v

    Geometry (in Angstrom), charge = 1, multiplicity = 1:

       Center              X                  Y                   Z               Mass       
    ------------   -----------------  -----------------  -----------------  -----------------
         C            0.000000000000     0.000000000000     0.637693191361    12.000000000000
         N            0.000000000000     0.000000000000    -0.546474173735    14.003074004430

  Running in c2v symmetry.

  Rotational constants: A = ************  B =      1.86033  C =      1.86033 [cm^-1]
  Rotational constants: A = ************  B =  55771.34076  C =  55771.34076 [MHz]
  Nuclear repulsion =   18.768835810924813

  Charge       = 1
  Multiplicity = 1
  Electrons    = 12
  Nalpha       = 6
  Nbeta        = 6

  ==> Algorithm <==

  SCF Algorithm Type is DF.
  DIIS enabled.
  MOM disabled.
  Fractional occupation disabled.
  Guess Type is READ.
  Energy threshold   = 1.00e-08
  Density threshold  = 1.00e-08
  Integral threshold = 1.00e-12

  ==> Primary Basis <==

  Basis Set: CC-PVDZ
    Blend: CC-PVDZ
    Number of shells: 12
    Number of basis functions: 28
    Number of Cartesian functions: 30
    Spherical Harmonics?: true
    Max angular momentum: 2

  ==> DFT Potential <==

   => LibXC <=

    Version 6.2.2
    S. Lehtola, C. Steigemann, M. J.T. Oliveira, and M. A.L. Marques.,  SoftwareX 7, 1–5 (2018) (10.1016/j.softx.2017.11.002)

   => Composite Functional: B3LYP <= 

    B3LYP Hyb-GGA Exchange-Correlation Functional

    P. J. Stephens, F. J. Devlin, C. F. Chabalowski, and M. J. Frisch.,  J. Phys. Chem. 98, 11623 (1994) (10.1021/j100096a001)

    Deriv               =              1
    GGA                 =           TRUE
    Meta                =          FALSE

    Exchange Hybrid     =           TRUE
    MP2 Hybrid          =          FALSE

   => Exchange Functionals <=

    0.0800   Slater exchange
    0.7200         Becke 88

   => Exact (HF) Exchange <=

    0.2000               HF 

   => Correlation Functionals <=

    0.1900   Vosko, Wilk & Nusair (VWN5_RPA)
    0.8100   Lee, Yang & Parr

   => LibXC Density Thresholds  <==

    XC_HYB_GGA_XC_B3LYP:  1.00E-15 

   => Molecular Quadrature <=

    Radial Scheme          =       TREUTLER
    Pruning Scheme         =           NONE
    Nuclear Scheme         =       TREUTLER

    Blocking Scheme        =         OCTREE
    BS radius alpha        =              1
    Pruning alpha          =              1
    Radial Points          =             75
    Spherical Points       =            302
    Total Points           =          42672
    Total Blocks           =            386
    Max Points             =            256
    Max Functions          =             28
    Weights Tolerance      =       1.00E-15

   => Loading Basis Set <=

    Name: (CC-PVDZ AUX)
    Role: JKFIT
    Keyword: DF_BASIS_SCF
    atoms 1 entry C          line   121 file /Users/joseantoniorodriguesromero/anaconda3/share/psi4/basis/cc-pvdz-jkfit.gbs 
    atoms 2 entry N          line   171 file /Users/joseantoniorodriguesromero/anaconda3/share/psi4/basis/cc-pvdz-jkfit.gbs 

   => Loading Basis Set <=

    Name: CC-PVDZ
    Role: ORBITAL
    Keyword: BASIS
    atoms 1 entry C          line   138 file /Users/joseantoniorodriguesromero/anaconda3/share/psi4/basis/cc-pvdz.gbs 
    atoms 2 entry N          line   168 file /Users/joseantoniorodriguesromero/anaconda3/share/psi4/basis/cc-pvdz.gbs 

  Reading orbitals from file /tmp/singlet_CN.default.74320.180.npy, no projection.

  ==> Integral Setup <==

  DFHelper Memory: AOs need 0.001 GiB; user supplied 0.332 GiB. 
  Using in-core AOs.

  ==> MemDFJK: Density-Fitted J/K Matrices <==

    J tasked:                   Yes
    K tasked:                   Yes
    wK tasked:                   No
    OpenMP threads:               1
    Memory [MiB]:               339
    Algorithm:                 Core
    Schwarz Cutoff:           1E-12
    Mask sparsity (%):       0.0000
    Fitting Condition:        1E-10

   => Auxiliary Basis Set <=

  Basis Set: (CC-PVDZ AUX)
    Blend: CC-PVDZ-JKFIT
    Number of shells: 48
    Number of basis functions: 140
    Number of Cartesian functions: 162
    Spherical Harmonics?: true
    Max angular momentum: 3

  Cached 100.0% of DFT collocation blocks in 0.034 [GiB].

  Minimum eigenvalue in the overlap matrix is 1.0988414443E-02.
  Reciprocal condition number of the overlap matrix is 3.5376447273E-03.
    Using symmetric orthogonalization.

  ==> Pre-Iterations <==

  SCF Guess: Orbitals guess was supplied from a previous computation.

   -------------------------------------------------------
    Irrep   Nso     Nmo     Nalpha   Nbeta   Ndocc  Nsocc
   -------------------------------------------------------
     A1        14      14       4       4       4       0
     A2         2       2       0       0       0       0
     B1         6       6       1       1       1       0
     B2         6       6       1       1       1       0
   -------------------------------------------------------
    Total      28      28       6       6       6       0
   -------------------------------------------------------

  ==> Iterations <==

                           Total Energy        Delta E     RMS |[F,P]|

   @DF-UKS iter   0:   -92.16777536167690   -9.21678e+01   1.63871e-04 
   @DF-UKS iter   1:   -92.16615627391903    1.61909e-03   3.81516e-05 DIIS
   @DF-UKS iter   2:   -92.16615426447591    2.00944e-06   1.36464e-04 DIIS/ADIIS/DAMP=1%
   @DF-UKS iter   3:   -92.16617996028279   -2.56958e-05   3.77439e-05 DIIS/DAMP=1%
   @DF-UKS iter   4:   -92.16615631811455    2.36422e-05   2.86189e-06 DIIS/DAMP=1%
   @DF-UKS iter   5:   -92.16615700082818   -6.82714e-07   7.61468e-07 DIIS/DAMP=1%
   @DF-UKS iter   6:   -92.16615638963553    6.11193e-07   6.80640e-08 DIIS/DAMP=1%
   @DF-UKS iter   7:   -92.16615649047424   -1.00839e-07   2.00334e-08 DIIS/DAMP=1%
   @DF-UKS iter   8:   -92.16615648367890    6.79533e-09   2.85497e-09 DIIS/DAMP=1%
  Energy and wave function converged.


  ==> Post-Iterations <==

   Electrons on quadrature grid:
      Nalpha   =    5.9999999153 ; deviation = -8.467e-08
      Nbeta    =    5.9999999153 ; deviation = -8.467e-08
      Ntotal   =   11.9999998307 ; deviation = -1.693e-07 

   @Spin Contamination Metric:  -1.421085472E-14
   @S^2 Expected:                0.000000000E+00
   @S^2 Observed:               -1.421085472E-14
   @S   Expected:                0.000000000E+00
   @S   Observed:                0.000000000E+00

    Orbital Energies [Eh]
    ---------------------

    Alpha Occupied:                                                       

       1A1   -14.862025     2A1   -10.786875     3A1    -1.355086  
       4A1    -0.861466     1B1    -0.773366     1B2    -0.773366  

    Alpha Virtual:                                                        

       5A1    -0.694731     2B1    -0.390290     2B2    -0.390290  
       6A1    -0.035862     3B1     0.129130     3B2     0.129130  
       7A1     0.178626     8A1     0.302376     9A1     0.359165  
       4B2     0.432294     4B1     0.432294     1A2     0.714208  
      10A1     0.714208     5B1     0.841481     5B2     0.841481  
      11A1     0.979498    12A1     1.454292     2A2     1.454292  
      13A1     1.513407     6B1     1.933080     6B2     1.933080  
      14A1     2.296772  

    Beta Occupied:                                                        

       1A1   -14.862025     2A1   -10.786875     3A1    -1.355086  
       4A1    -0.861466     1B1    -0.773366     1B2    -0.773366  

    Beta Virtual:                                                         

       5A1    -0.694731     2B1    -0.390290     2B2    -0.390290  
       6A1    -0.035862     3B1     0.129130     3B2     0.129130  
       7A1     0.178626     8A1     0.302376     9A1     0.359165  
       4B2     0.432294     4B1     0.432294     1A2     0.714208  
      10A1     0.714208     5B1     0.841481     5B2     0.841481  
      11A1     0.979498    12A1     1.454292     2A2     1.454292  
      13A1     1.513407     6B1     1.933080     6B2     1.933080  
      14A1     2.296772  

    Final Occupation by Irrep:
             A1    A2    B1    B2 
    DOCC [     4,    0,    1,    1 ]
    SOCC [     0,    0,    0,    0 ]
    NA   [     4,    0,    1,    1 ]
    NB   [     4,    0,    1,    1 ]

  @DF-UKS Final Energy:   -92.16615648367890

   => Energetics <=

    Nuclear Repulsion Energy =             18.7688358109248128
    One-Electron Energy =                -156.2138970860873428
    Two-Electron Energy =                  54.7592802662524321
    DFT Exchange-Correlation Energy =      -9.4803754747688149
    Empirical Dispersion Energy =           0.0000000000000000
    VV10 Nonlocal Energy =                  0.0000000000000000
    Total Energy =                        -92.1661564836789040

  UHF NO Occupations:
  HONO-2 :    1 B2 2.0000000
  HONO-1 :    1 B1 2.0000000
  HONO-0 :    4 A1 2.0000000
  LUNO+0 :    5 A1 0.0000000
  LUNO+1 :    2 B2 0.0000000
  LUNO+2 :    6 A1 0.0000000
  LUNO+3 :    7 A1 0.0000000


Computation Completed


Properties will be evaluated at   0.000000,   0.000000,   0.000000 [a0]

Properties computed using the SCF density matrix


 Multipole Moments:

 ------------------------------------------------------------------------------------
     Multipole            Electronic (a.u.)      Nuclear  (a.u.)        Total (a.u.)
 ------------------------------------------------------------------------------------

 L = 1.  Multiply by 2.5417464519 to convert [e a0] to [Debye]
 Dipole X            :          0.0000000            0.0000000            0.0000000
 Dipole Y            :          0.0000000            0.0000000            0.0000000
 Dipole Z            :          0.7783111            0.0015872            0.7798983
 Magnitude           :                                                    0.7798983

 ------------------------------------------------------------------------------------

*** tstop() called on Joses-MacBook-Pro-2.local at Thu Jul 17 13:40:44 2025
Module time:
	user time   =       2.62 seconds =       0.04 minutes
	system time =       3.02 seconds =       0.05 minutes
	total time  =          1 seconds =       0.02 minutes
Total time:
	user time   =      12.16 seconds =       0.20 minutes
	system time =      13.75 seconds =       0.23 minutes
	total time  =          3 seconds =       0.05 minutes

*** tstart() called on Joses-MacBook-Pro-2.local
*** at Thu Jul 17 13:40:44 2025


         ------------------------------------------------------------
                                   SCF GRAD                          
                          Rob Parrish, Justin Turney,                
                       Andy Simmonett, and Alex Sokolov              
         ------------------------------------------------------------

  ==> Geometry <==

    Molecular point group: c2v
    Full point group: C_inf_v

    Geometry (in Angstrom), charge = 1, multiplicity = 1:

       Center              X                  Y                   Z               Mass       
    ------------   -----------------  -----------------  -----------------  -----------------
         C            0.000000000000     0.000000000000     0.637693191361    12.000000000000
         N            0.000000000000     0.000000000000    -0.546474173735    14.003074004430

  Nuclear repulsion =   18.768835810924813

  ==> Basis Set <==

  Basis Set: CC-PVDZ
    Blend: CC-PVDZ
    Number of shells: 12
    Number of basis functions: 28
    Number of Cartesian functions: 30
    Spherical Harmonics?: true
    Max angular momentum: 2

  ==> DFJKGrad: Density-Fitted SCF Gradients <==

    Gradient:                    1
    J tasked:                  Yes
    K tasked:                  Yes
    wK tasked:                  No
    OpenMP threads:              1
    Integrals threads:           1
    Memory [MiB]:              375
    Schwarz Cutoff:          1E-12
    Fitting Condition:       1E-10

   => Auxiliary Basis Set <=

  Basis Set: (CC-PVDZ AUX)
    Blend: CC-PVDZ-JKFIT
    Number of shells: 48
    Number of basis functions: 140
    Number of Cartesian functions: 162
    Spherical Harmonics?: true
    Max angular momentum: 3

  ==> DFT Potential <==

   => LibXC <=

    Version 6.2.2
    S. Lehtola, C. Steigemann, M. J.T. Oliveira, and M. A.L. Marques.,  SoftwareX 7, 1–5 (2018) (10.1016/j.softx.2017.11.002)

   => Composite Functional: B3LYP <= 

    B3LYP Hyb-GGA Exchange-Correlation Functional

    P. J. Stephens, F. J. Devlin, C. F. Chabalowski, and M. J. Frisch.,  J. Phys. Chem. 98, 11623 (1994) (10.1021/j100096a001)

    Deriv               =              1
    GGA                 =           TRUE
    Meta                =          FALSE

    Exchange Hybrid     =           TRUE
    MP2 Hybrid          =          FALSE

   => Exchange Functionals <=

    0.0800   Slater exchange
    0.7200         Becke 88

   => Exact (HF) Exchange <=

    0.2000               HF 

   => Correlation Functionals <=

    0.1900   Vosko, Wilk & Nusair (VWN5_RPA)
    0.8100   Lee, Yang & Parr

   => LibXC Density Thresholds  <==

    XC_HYB_GGA_XC_B3LYP:  1.00E-15 

   => Molecular Quadrature <=

    Radial Scheme          =       TREUTLER
    Pruning Scheme         =           NONE
    Nuclear Scheme         =       TREUTLER

    Blocking Scheme        =         OCTREE
    BS radius alpha        =              1
    Pruning alpha          =              1
    Radial Points          =             75
    Spherical Points       =            302
    Total Points           =          42672
    Total Blocks           =            386
    Max Points             =            256
    Max Functions          =             28
    Weights Tolerance      =       1.00E-15


  -Total Gradient:
     Atom            X                  Y                   Z
    ------   -----------------  -----------------  -----------------
       1        0.000000000000     0.000000000000    -0.000090458216
       2        0.000000000000    -0.000000000000     0.000093961685


*** tstop() called on Joses-MacBook-Pro-2.local at Thu Jul 17 13:40:44 2025
Module time:
	user time   =       0.47 seconds =       0.01 minutes
	system time =       1.38 seconds =       0.02 minutes
	total time  =          0 seconds =       0.00 minutes
Total time:
	user time   =      12.63 seconds =       0.21 minutes
	system time =      15.13 seconds =       0.25 minutes
	total time  =          3 seconds =       0.05 minutes

    			-----------------------------------------

    			 OPTKING 3.0: for geometry optimizations 

    			     By R.A. King, Bethel University     

    			        with contributions from          

    			    A.V. Copan, J. Cayton, A. Heide      

    			-----------------------------------------

    
	                            ===> Fragment 1 <== 

	 Z (Atomic Numbers)          Masses                          Geom                  
	       6.000000            12.000000          0.00000000  0.00000000  1.20506548   
	       7.000000            14.003074          0.00000000  0.00000000 -1.03268652   

	 - Coordinate -           - BOHR/RAD -       - ANG/DEG -
	 R(1,2)           =         2.237752           1.184167


	        --- Internal Coordinate Step in ANG or DEG, aJ/ANG or AJ/DEG ---
	-------------------------------------------------------------------------------
	           Coordinate      Previous         Force          Change          New 
	           ----------      --------        ------          ------        ------
	               R(1,2)       1.18417        0.00076        0.00005       1.18422
	-------------------------------------------------------------------------------

	                                 ==> Convergence Check <==                                  
    
	Measures of convergence in internal coordinates in au.
    
	Criteria marked as inactive (o), active & met (*), and active & unmet ( ).

	----------------------------------------------------------------------------------------------
	   Step    Total Energy     Delta E     Max Force     RMS Force      Max Disp      RMS Disp   
	----------------------------------------------------------------------------------------------
	  Convergence Criteria     1.00e-06 *    3.00e-04 *             o    1.20e-03 *             o
	----------------------------------------------------------------------------------------------
	     3     -92.16615648   -1.24e-06      9.22e-05 *    9.22e-05 o    9.26e-05 *    9.26e-05 o  ~
	----------------------------------------------------------------------------------------------

Next Geometry in Ang 
	Fragment 1 (Ang)

	    C   0.0000000000   0.0000000000   0.6377177025
	    N   0.0000000000   0.0000000000  -0.5464986849


    Final optimized geometry and variables:
    Molecular point group: c2v
    Full point group: C_inf_v

    Geometry (in Angstrom), charge = 1, multiplicity = 1:

    C            0.000000000000     0.000000000000     0.637693191361
    N            0.000000000000     0.000000000000    -0.546474173735


    Psi4 stopped on: Thursday, 17 July 2025 01:40PM
    Psi4 wall time for execution: 0:00:03.30

*** Psi4 exiting successfully. Buy a developer a beer!
