
    -----------------------------------------------------------------------
          Psi4: An Open-Source Ab Initio Electronic Structure Package
                               Psi4 1.9.1 release

                         Git: Rev {} zzzzzzz 


    D. G. A. Smith, L. A. Burns, A. C. Simmonett, R. M. Parrish,
    M. C. Schieber, R. Galvelis, P. Kraus, H. Kruse, R. Di Remigio,
    A. Alenaizan, A. M. James, S. Lehtola, J. P. Misiewicz, M. Scheurer,
    R. A. Shaw, J. B. Schriber, Y. Xie, Z. L. Glick, D. A. Sirianni,
    J. S. O'Brien, J. M. Waldrop, A. Kumar, E. G. Hohenstein,
    B. P. Pritchard, B. R. Brooks, H. F. Schaefer III, A. Yu. Sokolov,
    K. Patkowski, A. E. DePrince III, U. Bozkaya, R. A. King,
    F. A. Evangelista, J. M. Turney, T. D. Crawford, C. D. Sherrill,
    J. Chem. Phys. 152(18) 184108 (2020). https://doi.org/10.1063/5.0006002

                            Additional Code Authors
    E. T. Seidl, C. L. Janssen, E. F. Valeev, M. L. Leininger,
    J. F. Gonthier, R. M. Richard, H. R. McAlexander, M. Saitow, X. Wang,
    P. Verma, M. H. Lechner, A. Jiang, S. Behnle, A. G. Heide,
    M. F. Herbst, and D. L. Poole

             Previous Authors, Complete List of Code Contributors,
                       and Citations for Specific Modules
    https://github.com/psi4/psi4/blob/master/codemeta.json
    https://github.com/psi4/psi4/graphs/contributors
    http://psicode.org/psi4manual/master/introduction.html#citing-psifour

    -----------------------------------------------------------------------


    Psi4 started on: Thursday, 17 July 2025 01:30PM

    Process ID: 74220
    Host:       Joses-MacBook-Pro-2.local
    PSIDATADIR: /Users/joseantoniorodriguesromero/anaconda3/share/psi4
    Memory:     500.0 MiB
    Threads:    1
    
  ==> Input File <==

--------------------------------------------------------------------------
molecule { 
1 1
B   0.00000        0.60000        0.00000
O   0.00000       -0.60000        0.00000
}

set { 
basis              cc-pvdz
reference          uks
maxiter            500
geom_maxiter       500
DAMPING_PERCENTAGE 1
guess              SAP
}

optimize('b3lyp')
--------------------------------------------------------------------------

Scratch directory: /tmp/
gradient() will perform analytic gradient computation.
   => Libint2 <=

    Primary   basis highest AM E, G, H:  6, 6, 3
    Auxiliary basis highest AM E, G, H:  7, 7, 4
    Onebody   basis highest AM E, G, H:  -, -, -
    Solid Harmonics ordering:            Gaussian

*** tstart() called on Joses-MacBook-Pro-2.local
*** at Thu Jul 17 13:30:49 2025

   => Loading Basis Set <=

    Name: CC-PVDZ
    Role: ORBITAL
    Keyword: BASIS
    atoms 1 entry B          line   108 file /Users/joseantoniorodriguesromero/anaconda3/share/psi4/basis/cc-pvdz.gbs 
    atoms 2 entry O          line   198 file /Users/joseantoniorodriguesromero/anaconda3/share/psi4/basis/cc-pvdz.gbs 


         ---------------------------------------------------------
                                   SCF
               by Justin Turney, Rob Parrish, Andy Simmonett
                          and Daniel G. A. Smith
                              UKS Reference
                        1 Threads,    500 MiB Core
         ---------------------------------------------------------

  ==> Geometry <==

    Molecular point group: c2v
    Full point group: C_inf_v

    Geometry (in Angstrom), charge = 1, multiplicity = 1:

       Center              X                  Y                   Z               Mass       
    ------------   -----------------  -----------------  -----------------  -----------------
         B            0.000000000000     0.000000000000     0.710774003397    11.009305360000
         O            0.000000000000     0.000000000000    -0.489225996603    15.994914619570

  Running in c2v symmetry.

  Rotational constants: A = ************  B =      1.79525  C =      1.79525 [cm^-1]
  Rotational constants: A = ************  B =  53820.10002  C =  53820.10002 [MHz]
  Nuclear repulsion =   17.639240355666669

  Charge       = 1
  Multiplicity = 1
  Electrons    = 12
  Nalpha       = 6
  Nbeta        = 6

  ==> Algorithm <==

  SCF Algorithm Type is DF.
  DIIS enabled.
  MOM disabled.
  Fractional occupation disabled.
  Guess Type is SAP.
  Energy threshold   = 1.00e-08
  Density threshold  = 1.00e-08
  Integral threshold = 1.00e-12

  ==> Primary Basis <==

  Basis Set: CC-PVDZ
    Blend: CC-PVDZ
    Number of shells: 12
    Number of basis functions: 28
    Number of Cartesian functions: 30
    Spherical Harmonics?: true
    Max angular momentum: 2

  ==> DFT Potential <==

   => LibXC <=

    Version 6.2.2
    S. Lehtola, C. Steigemann, M. J.T. Oliveira, and M. A.L. Marques.,  SoftwareX 7, 1–5 (2018) (10.1016/j.softx.2017.11.002)

   => Composite Functional: B3LYP <= 

    B3LYP Hyb-GGA Exchange-Correlation Functional

    P. J. Stephens, F. J. Devlin, C. F. Chabalowski, and M. J. Frisch.,  J. Phys. Chem. 98, 11623 (1994) (10.1021/j100096a001)

    Deriv               =              1
    GGA                 =           TRUE
    Meta                =          FALSE

    Exchange Hybrid     =           TRUE
    MP2 Hybrid          =          FALSE

   => Exchange Functionals <=

    0.0800   Slater exchange
    0.7200         Becke 88

   => Exact (HF) Exchange <=

    0.2000               HF 

   => Correlation Functionals <=

    0.1900   Vosko, Wilk & Nusair (VWN5_RPA)
    0.8100   Lee, Yang & Parr

   => LibXC Density Thresholds  <==

    XC_HYB_GGA_XC_B3LYP:  1.00E-15 

   => Molecular Quadrature <=

    Radial Scheme          =       TREUTLER
    Pruning Scheme         =           NONE
    Nuclear Scheme         =       TREUTLER

    Blocking Scheme        =         OCTREE
    BS radius alpha        =              1
    Pruning alpha          =              1
    Radial Points          =             75
    Spherical Points       =            302
    Total Points           =          43261
    Total Blocks           =            392
    Max Points             =            256
    Max Functions          =             28
    Weights Tolerance      =       1.00E-15

   => Loading Basis Set <=

    Name: (CC-PVDZ AUX)
    Role: JKFIT
    Keyword: DF_BASIS_SCF
    atoms 1 entry B          line    71 file /Users/joseantoniorodriguesromero/anaconda3/share/psi4/basis/cc-pvdz-jkfit.gbs 
    atoms 2 entry O          line   221 file /Users/joseantoniorodriguesromero/anaconda3/share/psi4/basis/cc-pvdz-jkfit.gbs 

  ==> Integral Setup <==

  DFHelper Memory: AOs need 0.001 GiB; user supplied 0.332 GiB. 
  Using in-core AOs.

  ==> MemDFJK: Density-Fitted J/K Matrices <==

    J tasked:                   Yes
    K tasked:                   Yes
    wK tasked:                   No
    OpenMP threads:               1
    Memory [MiB]:               339
    Algorithm:                 Core
    Schwarz Cutoff:           1E-12
    Mask sparsity (%):       0.0000
    Fitting Condition:        1E-10

   => Auxiliary Basis Set <=

  Basis Set: (CC-PVDZ AUX)
    Blend: CC-PVDZ-JKFIT
    Number of shells: 48
    Number of basis functions: 140
    Number of Cartesian functions: 162
    Spherical Harmonics?: true
    Max angular momentum: 3

  Cached 100.0% of DFT collocation blocks in 0.034 [GiB].

  Minimum eigenvalue in the overlap matrix is 2.6021757573E-02.
  Reciprocal condition number of the overlap matrix is 8.6042066289E-03.
    Using symmetric orthogonalization.

  ==> Pre-Iterations <==

  SCF Guess: Superposition of Atomic Potentials (doi:10.1021/acs.jctc.8b01089).

  ==> SAP guess <==

   => Molecular Quadrature <=

    Radial Scheme          =       TREUTLER
    Pruning Scheme         =           NONE
    Nuclear Scheme         =       TREUTLER

    Blocking Scheme        =         OCTREE
    BS radius alpha        =              1
    Pruning alpha          =              1
    Radial Points          =             75
    Spherical Points       =            302
    Total Points           =          43261
    Total Blocks           =            392
    Max Points             =            256
    Max Functions          =             28
    Weights Tolerance      =       1.00E-15

   -------------------------------------------------------
    Irrep   Nso     Nmo     Nalpha   Nbeta   Ndocc  Nsocc
   -------------------------------------------------------
     A1        14      14       4       4       4       0
     A2         2       2       0       0       0       0
     B1         6       6       1       1       1       0
     B2         6       6       1       1       1       0
   -------------------------------------------------------
    Total      28      28       6       6       6       0
   -------------------------------------------------------

  ==> Iterations <==

                           Total Energy        Delta E     RMS |[F,P]|

   @DF-UKS iter   1:   -99.20437083131651   -9.92044e+01   5.21287e-02 DIIS/ADIIS
   @DF-UKS iter   2:   -93.97326730460638    5.23110e+00   1.66491e-01 ADIIS/DAMP=1%
   @DF-UKS iter   3:   -98.85207513031483   -4.87881e+00   7.60511e-02 DIIS/ADIIS/DAMP=1%
   @DF-UKS iter   4:   -99.51797050280933   -6.65895e-01   5.64700e-03 DIIS/ADIIS/DAMP=1%
   @DF-UKS iter   5:   -99.54596146206462   -2.79910e-02   3.62720e-03 DIIS/ADIIS/DAMP=1%
   @DF-UKS iter   6:   -99.54757785820878   -1.61640e-03   4.48713e-04 DIIS/ADIIS/DAMP=1%
   @DF-UKS iter   7:   -99.54838720123608   -8.09343e-04   1.27270e-04 DIIS/ADIIS/DAMP=1%
   @DF-UKS iter   8:   -99.54847896789774   -9.17667e-05   7.30567e-06 DIIS/DAMP=1%
   @DF-UKS iter   9:   -99.54852975798970   -5.07901e-05   1.89223e-06 DIIS/DAMP=1%
   @DF-UKS iter  10:   -99.54852596003404    3.79796e-06   1.72182e-07 DIIS/DAMP=1%
   @DF-UKS iter  11:   -99.54852673669150   -7.76657e-07   5.85688e-08 DIIS/DAMP=1%
   @DF-UKS iter  12:   -99.54852664081636    9.58751e-08   5.81247e-10 DIIS/DAMP=1%
   @DF-UKS iter  13:   -99.54852666039106   -1.95747e-08   4.96375e-10 DIIS/DAMP=1%
   @DF-UKS iter  14:   -99.54852666012424    2.66823e-10   7.19696e-11 DIIS/DAMP=1%
  Energy and wave function converged.


  ==> Post-Iterations <==

   Electrons on quadrature grid:
      Nalpha   =    6.0000000834 ; deviation = 8.336e-08
      Nbeta    =    6.0000000834 ; deviation = 8.336e-08
      Ntotal   =   12.0000001667 ; deviation = 1.667e-07 

   @Spin Contamination Metric:  -8.881784197E-16
   @S^2 Expected:                0.000000000E+00
   @S^2 Observed:               -8.881784197E-16
   @S   Expected:                0.000000000E+00
   @S   Observed:                0.000000000E+00

    Orbital Energies [Eh]
    ---------------------

    Alpha Occupied:                                                       

       1A1   -19.546058     2A1    -7.327714     3A1    -1.368519  
       4A1    -0.786981     1B2    -0.724073     1B1    -0.724073  

    Alpha Virtual:                                                        

       5A1    -0.607116     2B2    -0.342193     2B1    -0.342193  
       6A1    -0.109759     3B1    -0.008837     3B2    -0.008837  
       7A1     0.008079     8A1     0.248431     9A1     0.341521  
       1A2     0.341521     4B2     0.509967     4B1     0.509967  
      10A1     0.575538     5B1     0.707586     5B2     0.707586  
      11A1     1.060471    12A1     1.372059     2A2     2.285586  
      13A1     2.285588     6B1     2.575383     6B2     2.575383  
      14A1     3.024444  

    Beta Occupied:                                                        

       1A1   -19.546058     2A1    -7.327714     3A1    -1.368519  
       4A1    -0.786981     1B2    -0.724073     1B1    -0.724073  

    Beta Virtual:                                                         

       5A1    -0.607116     2B2    -0.342193     2B1    -0.342193  
       6A1    -0.109759     3B1    -0.008837     3B2    -0.008837  
       7A1     0.008079     8A1     0.248431     9A1     0.341521  
       1A2     0.341521     4B2     0.509967     4B1     0.509967  
      10A1     0.575538     5B1     0.707586     5B2     0.707586  
      11A1     1.060471    12A1     1.372059     2A2     2.285586  
      13A1     2.285588     6B1     2.575383     6B2     2.575383  
      14A1     3.024444  

    Final Occupation by Irrep:
             A1    A2    B1    B2 
    DOCC [     4,    0,    1,    1 ]
    SOCC [     0,    0,    0,    0 ]
    NA   [     4,    0,    1,    1 ]
    NB   [     4,    0,    1,    1 ]

  @DF-UKS Final Energy:   -99.54852666012424

   => Energetics <=

    Nuclear Repulsion Energy =             17.6392403556666686
    One-Electron Energy =                -166.3022244307537107
    Two-Electron Energy =                  59.0053524713529427
    DFT Exchange-Correlation Energy =      -9.8908950563901161
    Empirical Dispersion Energy =           0.0000000000000000
    VV10 Nonlocal Energy =                  0.0000000000000000
    Total Energy =                        -99.5485266601242245

  UHF NO Occupations:
  HONO-2 :    1 B2 2.0000000
  HONO-1 :    3 A1 2.0000000
  HONO-0 :    4 A1 2.0000000
  LUNO+0 :    5 A1 0.0000000
  LUNO+1 :    6 A1 0.0000000
  LUNO+2 :    7 A1 0.0000000
  LUNO+3 :    8 A1 0.0000000


Computation Completed


Properties will be evaluated at   0.000000,   0.000000,   0.000000 [a0]

Properties computed using the SCF density matrix


 Multipole Moments:

 ------------------------------------------------------------------------------------
     Multipole            Electronic (a.u.)      Nuclear  (a.u.)        Total (a.u.)
 ------------------------------------------------------------------------------------

 L = 1.  Multiply by 2.5417464519 to convert [e a0] to [Debye]
 Dipole X            :          0.0000000            0.0000000            0.0000000
 Dipole Y            :          0.0000000            0.0000000            0.0000000
 Dipole Z            :          2.9143597           -0.6801842            2.2341756
 Magnitude           :                                                    2.2341756

 ------------------------------------------------------------------------------------

*** tstop() called on Joses-MacBook-Pro-2.local at Thu Jul 17 13:30:50 2025
Module time:
	user time   =       3.87 seconds =       0.06 minutes
	system time =       5.82 seconds =       0.10 minutes
	total time  =          1 seconds =       0.02 minutes
Total time:
	user time   =       3.87 seconds =       0.06 minutes
	system time =       5.82 seconds =       0.10 minutes
	total time  =          1 seconds =       0.02 minutes

*** tstart() called on Joses-MacBook-Pro-2.local
*** at Thu Jul 17 13:30:50 2025


         ------------------------------------------------------------
                                   SCF GRAD                          
                          Rob Parrish, Justin Turney,                
                       Andy Simmonett, and Alex Sokolov              
         ------------------------------------------------------------

  ==> Geometry <==

    Molecular point group: c2v
    Full point group: C_inf_v

    Geometry (in Angstrom), charge = 1, multiplicity = 1:

       Center              X                  Y                   Z               Mass       
    ------------   -----------------  -----------------  -----------------  -----------------
         B            0.000000000000     0.000000000000     0.710774003397    11.009305360000
         O            0.000000000000     0.000000000000    -0.489225996603    15.994914619570

  Nuclear repulsion =   17.639240355666669

  ==> Basis Set <==

  Basis Set: CC-PVDZ
    Blend: CC-PVDZ
    Number of shells: 12
    Number of basis functions: 28
    Number of Cartesian functions: 30
    Spherical Harmonics?: true
    Max angular momentum: 2

  ==> DFJKGrad: Density-Fitted SCF Gradients <==

    Gradient:                    1
    J tasked:                  Yes
    K tasked:                  Yes
    wK tasked:                  No
    OpenMP threads:              1
    Integrals threads:           1
    Memory [MiB]:              375
    Schwarz Cutoff:          1E-12
    Fitting Condition:       1E-10

   => Auxiliary Basis Set <=

  Basis Set: (CC-PVDZ AUX)
    Blend: CC-PVDZ-JKFIT
    Number of shells: 48
    Number of basis functions: 140
    Number of Cartesian functions: 162
    Spherical Harmonics?: true
    Max angular momentum: 3

  ==> DFT Potential <==

   => LibXC <=

    Version 6.2.2
    S. Lehtola, C. Steigemann, M. J.T. Oliveira, and M. A.L. Marques.,  SoftwareX 7, 1–5 (2018) (10.1016/j.softx.2017.11.002)

   => Composite Functional: B3LYP <= 

    B3LYP Hyb-GGA Exchange-Correlation Functional

    P. J. Stephens, F. J. Devlin, C. F. Chabalowski, and M. J. Frisch.,  J. Phys. Chem. 98, 11623 (1994) (10.1021/j100096a001)

    Deriv               =              1
    GGA                 =           TRUE
    Meta                =          FALSE

    Exchange Hybrid     =           TRUE
    MP2 Hybrid          =          FALSE

   => Exchange Functionals <=

    0.0800   Slater exchange
    0.7200         Becke 88

   => Exact (HF) Exchange <=

    0.2000               HF 

   => Correlation Functionals <=

    0.1900   Vosko, Wilk & Nusair (VWN5_RPA)
    0.8100   Lee, Yang & Parr

   => LibXC Density Thresholds  <==

    XC_HYB_GGA_XC_B3LYP:  1.00E-15 

   => Molecular Quadrature <=

    Radial Scheme          =       TREUTLER
    Pruning Scheme         =           NONE
    Nuclear Scheme         =       TREUTLER

    Blocking Scheme        =         OCTREE
    BS radius alpha        =              1
    Pruning alpha          =              1
    Radial Points          =             75
    Spherical Points       =            302
    Total Points           =          43261
    Total Blocks           =            392
    Max Points             =            256
    Max Functions          =             28
    Weights Tolerance      =       1.00E-15


  -Total Gradient:
     Atom            X                  Y                   Z
    ------   -----------------  -----------------  -----------------
       1        0.000000000000    -0.000000000000     0.005118113960
       2        0.000000000000    -0.000000000000    -0.005103761962


*** tstop() called on Joses-MacBook-Pro-2.local at Thu Jul 17 13:30:50 2025
Module time:
	user time   =       0.62 seconds =       0.01 minutes
	system time =       1.33 seconds =       0.02 minutes
	total time  =          0 seconds =       0.00 minutes
Total time:
	user time   =       4.49 seconds =       0.07 minutes
	system time =       7.15 seconds =       0.12 minutes
	total time  =          1 seconds =       0.02 minutes

    			-----------------------------------------

    			 OPTKING 3.0: for geometry optimizations 

    			     By R.A. King, Bethel University     

    			        with contributions from          

    			    A.V. Copan, J. Cayton, A. Heide      

    			-----------------------------------------

    
	                            ===> Fragment 1 <== 

	 Z (Atomic Numbers)          Masses                          Geom                  
	       5.000000            11.009305          0.00000000  0.00000000  1.34316820   
	       8.000000            15.994915          0.00000000  0.00000000 -0.92450315   

	 - Coordinate -           - BOHR/RAD -       - ANG/DEG -
	 R(1,2)           =         2.267671           1.200000


	        --- Internal Coordinate Step in ANG or DEG, aJ/ANG or AJ/DEG ---
	-------------------------------------------------------------------------------
	           Coordinate      Previous         Force          Change          New 
	           ----------      --------        ------          ------        ------
	               R(1,2)       1.20000       -0.04211       -0.00258       1.19742
	-------------------------------------------------------------------------------

	                                 ==> Convergence Check <==                                  
    
	Measures of convergence in internal coordinates in au.
    
	Criteria marked as inactive (o), active & met (*), and active & unmet ( ).

	----------------------------------------------------------------------------------------------
	   Step    Total Energy     Delta E     Max Force     RMS Force      Max Disp      RMS Disp   
	----------------------------------------------------------------------------------------------
	  Convergence Criteria     1.00e-06 *    3.00e-04 *             o    1.20e-03 *             o
	----------------------------------------------------------------------------------------------
	     1     -99.54852666   -9.95e+01      5.11e-03      5.11e-03 o    4.88e-03      4.88e-03 o  ~
	----------------------------------------------------------------------------------------------

Next Geometry in Ang 
	Fragment 1 (Ang)

	    B   0.0000000000   0.0000000000   0.7094839593
	    O   0.0000000000   0.0000000000  -0.4879359525


    Structure for next step:
    Molecular point group: c2v
    Full point group: C_inf_v

    Geometry (in Angstrom), charge = 1, multiplicity = 1:

    B            0.000000000000     0.000000000000     0.709245787042
    O            0.000000000000     0.000000000000    -0.488174124749


Scratch directory: /tmp/
gradient() will perform analytic gradient computation.
   => Libint2 <=

    Primary   basis highest AM E, G, H:  6, 6, 3
    Auxiliary basis highest AM E, G, H:  7, 7, 4
    Onebody   basis highest AM E, G, H:  -, -, -
    Solid Harmonics ordering:            Gaussian

*** tstart() called on Joses-MacBook-Pro-2.local
*** at Thu Jul 17 13:30:50 2025

   => Loading Basis Set <=

    Name: CC-PVDZ
    Role: ORBITAL
    Keyword: BASIS
    atoms 1 entry B          line   108 file /Users/joseantoniorodriguesromero/anaconda3/share/psi4/basis/cc-pvdz.gbs 
    atoms 2 entry O          line   198 file /Users/joseantoniorodriguesromero/anaconda3/share/psi4/basis/cc-pvdz.gbs 


         ---------------------------------------------------------
                                   SCF
               by Justin Turney, Rob Parrish, Andy Simmonett
                          and Daniel G. A. Smith
                              UKS Reference
                        1 Threads,    500 MiB Core
         ---------------------------------------------------------

  ==> Geometry <==

    Molecular point group: c2v
    Full point group: C_inf_v

    Geometry (in Angstrom), charge = 1, multiplicity = 1:

       Center              X                  Y                   Z               Mass       
    ------------   -----------------  -----------------  -----------------  -----------------
         B            0.000000000000     0.000000000000     0.709245787042    11.009305360000
         O            0.000000000000     0.000000000000    -0.488174124749    15.994914619570

  Running in c2v symmetry.

  Rotational constants: A = ************  B =      1.80299  C =      1.80299 [cm^-1]
  Rotational constants: A = ************  B =  54052.28291  C =  54052.28291 [MHz]
  Nuclear repulsion =   17.677247737713760

  Charge       = 1
  Multiplicity = 1
  Electrons    = 12
  Nalpha       = 6
  Nbeta        = 6

  ==> Algorithm <==

  SCF Algorithm Type is DF.
  DIIS enabled.
  MOM disabled.
  Fractional occupation disabled.
  Guess Type is READ.
  Energy threshold   = 1.00e-08
  Density threshold  = 1.00e-08
  Integral threshold = 1.00e-12

  ==> Primary Basis <==

  Basis Set: CC-PVDZ
    Blend: CC-PVDZ
    Number of shells: 12
    Number of basis functions: 28
    Number of Cartesian functions: 30
    Spherical Harmonics?: true
    Max angular momentum: 2

  ==> DFT Potential <==

   => LibXC <=

    Version 6.2.2
    S. Lehtola, C. Steigemann, M. J.T. Oliveira, and M. A.L. Marques.,  SoftwareX 7, 1–5 (2018) (10.1016/j.softx.2017.11.002)

   => Composite Functional: B3LYP <= 

    B3LYP Hyb-GGA Exchange-Correlation Functional

    P. J. Stephens, F. J. Devlin, C. F. Chabalowski, and M. J. Frisch.,  J. Phys. Chem. 98, 11623 (1994) (10.1021/j100096a001)

    Deriv               =              1
    GGA                 =           TRUE
    Meta                =          FALSE

    Exchange Hybrid     =           TRUE
    MP2 Hybrid          =          FALSE

   => Exchange Functionals <=

    0.0800   Slater exchange
    0.7200         Becke 88

   => Exact (HF) Exchange <=

    0.2000               HF 

   => Correlation Functionals <=

    0.1900   Vosko, Wilk & Nusair (VWN5_RPA)
    0.8100   Lee, Yang & Parr

   => LibXC Density Thresholds  <==

    XC_HYB_GGA_XC_B3LYP:  1.00E-15 

   => Molecular Quadrature <=

    Radial Scheme          =       TREUTLER
    Pruning Scheme         =           NONE
    Nuclear Scheme         =       TREUTLER

    Blocking Scheme        =         OCTREE
    BS radius alpha        =              1
    Pruning alpha          =              1
    Radial Points          =             75
    Spherical Points       =            302
    Total Points           =          43257
    Total Blocks           =            392
    Max Points             =            256
    Max Functions          =             28
    Weights Tolerance      =       1.00E-15

   => Loading Basis Set <=

    Name: (CC-PVDZ AUX)
    Role: JKFIT
    Keyword: DF_BASIS_SCF
    atoms 1 entry B          line    71 file /Users/joseantoniorodriguesromero/anaconda3/share/psi4/basis/cc-pvdz-jkfit.gbs 
    atoms 2 entry O          line   221 file /Users/joseantoniorodriguesromero/anaconda3/share/psi4/basis/cc-pvdz-jkfit.gbs 

   => Loading Basis Set <=

    Name: CC-PVDZ
    Role: ORBITAL
    Keyword: BASIS
    atoms 1 entry B          line   108 file /Users/joseantoniorodriguesromero/anaconda3/share/psi4/basis/cc-pvdz.gbs 
    atoms 2 entry O          line   198 file /Users/joseantoniorodriguesromero/anaconda3/share/psi4/basis/cc-pvdz.gbs 

  Reading orbitals from file /tmp/singlet_BO.default.74220.180.npy, no projection.

  ==> Integral Setup <==

  DFHelper Memory: AOs need 0.001 GiB; user supplied 0.332 GiB. 
  Using in-core AOs.

  ==> MemDFJK: Density-Fitted J/K Matrices <==

    J tasked:                   Yes
    K tasked:                   Yes
    wK tasked:                   No
    OpenMP threads:               1
    Memory [MiB]:               339
    Algorithm:                 Core
    Schwarz Cutoff:           1E-12
    Mask sparsity (%):       0.0000
    Fitting Condition:        1E-10

   => Auxiliary Basis Set <=

  Basis Set: (CC-PVDZ AUX)
    Blend: CC-PVDZ-JKFIT
    Number of shells: 48
    Number of basis functions: 140
    Number of Cartesian functions: 162
    Spherical Harmonics?: true
    Max angular momentum: 3

  Cached 100.0% of DFT collocation blocks in 0.034 [GiB].

  Minimum eigenvalue in the overlap matrix is 2.5870125900E-02.
  Reciprocal condition number of the overlap matrix is 8.5506348146E-03.
    Using symmetric orthogonalization.

  ==> Pre-Iterations <==

  SCF Guess: Orbitals guess was supplied from a previous computation.

   -------------------------------------------------------
    Irrep   Nso     Nmo     Nalpha   Nbeta   Ndocc  Nsocc
   -------------------------------------------------------
     A1        14      14       4       4       4       0
     A2         2       2       0       0       0       0
     B1         6       6       1       1       1       0
     B2         6       6       1       1       1       0
   -------------------------------------------------------
    Total      28      28       6       6       6       0
   -------------------------------------------------------

  ==> Iterations <==

                           Total Energy        Delta E     RMS |[F,P]|

   @DF-UKS iter   0:   -99.55233095339774   -9.95523e+01   5.25205e-04 
   @DF-UKS iter   1:   -99.54853851412827    3.79244e-03   1.39886e-04 DIIS/ADIIS
   @DF-UKS iter   2:   -99.54851615017465    2.23640e-05   4.72851e-04 DIIS/ADIIS/DAMP=1%
   @DF-UKS iter   3:   -99.54870656813191   -1.90418e-04   1.54446e-05 DIIS/DAMP=1%
   @DF-UKS iter   4:   -99.54854192538097    1.64643e-04   1.23762e-05 DIIS/DAMP=1%
   @DF-UKS iter   5:   -99.54854573857614   -3.81320e-06   1.76325e-06 DIIS/DAMP=1%
   @DF-UKS iter   6:   -99.54854045376419    5.28481e-06   1.14528e-07 DIIS/DAMP=1%
   @DF-UKS iter   7:   -99.54854108269127   -6.28927e-07   3.99654e-09 DIIS/DAMP=1%
   @DF-UKS iter   8:   -99.54854106168773    2.10035e-08   2.58789e-10 DIIS/DAMP=1%
   @DF-UKS iter   9:   -99.54854106158508    1.02645e-10   1.80818e-10 DIIS/DAMP=1%
  Energy and wave function converged.


  ==> Post-Iterations <==

   Electrons on quadrature grid:
      Nalpha   =    6.0000000857 ; deviation = 8.574e-08
      Nbeta    =    6.0000000857 ; deviation = 8.574e-08
      Ntotal   =   12.0000001715 ; deviation = 1.715e-07 

   @Spin Contamination Metric:  -1.776356839E-15
   @S^2 Expected:                0.000000000E+00
   @S^2 Observed:               -1.776356839E-15
   @S   Expected:                0.000000000E+00
   @S   Observed:                0.000000000E+00

    Orbital Energies [Eh]
    ---------------------

    Alpha Occupied:                                                       

       1A1   -19.545648     2A1    -7.327185     3A1    -1.369313  
       4A1    -0.786865     1B1    -0.724655     1B2    -0.724655  

    Alpha Virtual:                                                        

       5A1    -0.607047     2B1    -0.341393     2B2    -0.341393  
       6A1    -0.109442     3B2    -0.008823     3B1    -0.008823  
       7A1     0.008123     8A1     0.250037     9A1     0.341478  
       1A2     0.341478     4B1     0.511045     4B2     0.511045  
      10A1     0.577297     5B1     0.707453     5B2     0.707453  
      11A1     1.063695    12A1     1.372512     2A2     2.285889  
      13A1     2.285891     6B1     2.576996     6B2     2.576996  
      14A1     3.027547  

    Beta Occupied:                                                        

       1A1   -19.545648     2A1    -7.327185     3A1    -1.369313  
       4A1    -0.786865     1B1    -0.724655     1B2    -0.724655  

    Beta Virtual:                                                         

       5A1    -0.607047     2B1    -0.341393     2B2    -0.341393  
       6A1    -0.109442     3B2    -0.008823     3B1    -0.008823  
       7A1     0.008123     8A1     0.250037     9A1     0.341478  
       1A2     0.341478     4B1     0.511045     4B2     0.511045  
      10A1     0.577297     5B1     0.707453     5B2     0.707453  
      11A1     1.063695    12A1     1.372512     2A2     2.285889  
      13A1     2.285891     6B1     2.576996     6B2     2.576996  
      14A1     3.027547  

    Final Occupation by Irrep:
             A1    A2    B1    B2 
    DOCC [     4,    0,    1,    1 ]
    SOCC [     0,    0,    0,    0 ]
    NA   [     4,    0,    1,    1 ]
    NB   [     4,    0,    1,    1 ]

  @DF-UKS Final Energy:   -99.54854106158508

   => Energetics <=

    Nuclear Repulsion Energy =             17.6772477377137598
    One-Electron Energy =                -166.3751415974483905
    Two-Electron Energy =                  59.0421759345730592
    DFT Exchange-Correlation Energy =      -9.8928231364235124
    Empirical Dispersion Energy =           0.0000000000000000
    VV10 Nonlocal Energy =                  0.0000000000000000
    Total Energy =                        -99.5485410615850697

  UHF NO Occupations:
  HONO-2 :    2 A1 2.0000000
  HONO-1 :    3 A1 2.0000000
  HONO-0 :    4 A1 2.0000000
  LUNO+0 :    5 A1 0.0000000
  LUNO+1 :    6 A1 0.0000000
  LUNO+2 :    2 B2 0.0000000
  LUNO+3 :    2 B1 0.0000000


Computation Completed


Properties will be evaluated at   0.000000,   0.000000,   0.000000 [a0]

Properties computed using the SCF density matrix


 Multipole Moments:

 ------------------------------------------------------------------------------------
     Multipole            Electronic (a.u.)      Nuclear  (a.u.)        Total (a.u.)
 ------------------------------------------------------------------------------------

 L = 1.  Multiply by 2.5417464519 to convert [e a0] to [Debye]
 Dipole X            :          0.0000000            0.0000000            0.0000000
 Dipole Y            :          0.0000000            0.0000000            0.0000000
 Dipole Z            :          2.9120190           -0.6787217            2.2332973
 Magnitude           :                                                    2.2332973

 ------------------------------------------------------------------------------------

*** tstop() called on Joses-MacBook-Pro-2.local at Thu Jul 17 13:30:51 2025
Module time:
	user time   =       2.34 seconds =       0.04 minutes
	system time =       3.86 seconds =       0.06 minutes
	total time  =          1 seconds =       0.02 minutes
Total time:
	user time   =       6.86 seconds =       0.11 minutes
	system time =      11.22 seconds =       0.19 minutes
	total time  =          2 seconds =       0.03 minutes

*** tstart() called on Joses-MacBook-Pro-2.local
*** at Thu Jul 17 13:30:51 2025


         ------------------------------------------------------------
                                   SCF GRAD                          
                          Rob Parrish, Justin Turney,                
                       Andy Simmonett, and Alex Sokolov              
         ------------------------------------------------------------

  ==> Geometry <==

    Molecular point group: c2v
    Full point group: C_inf_v

    Geometry (in Angstrom), charge = 1, multiplicity = 1:

       Center              X                  Y                   Z               Mass       
    ------------   -----------------  -----------------  -----------------  -----------------
         B            0.000000000000     0.000000000000     0.709245787042    11.009305360000
         O            0.000000000000     0.000000000000    -0.488174124749    15.994914619570

  Nuclear repulsion =   17.677247737713760

  ==> Basis Set <==

  Basis Set: CC-PVDZ
    Blend: CC-PVDZ
    Number of shells: 12
    Number of basis functions: 28
    Number of Cartesian functions: 30
    Spherical Harmonics?: true
    Max angular momentum: 2

  ==> DFJKGrad: Density-Fitted SCF Gradients <==

    Gradient:                    1
    J tasked:                  Yes
    K tasked:                  Yes
    wK tasked:                  No
    OpenMP threads:              1
    Integrals threads:           1
    Memory [MiB]:              375
    Schwarz Cutoff:          1E-12
    Fitting Condition:       1E-10

   => Auxiliary Basis Set <=

  Basis Set: (CC-PVDZ AUX)
    Blend: CC-PVDZ-JKFIT
    Number of shells: 48
    Number of basis functions: 140
    Number of Cartesian functions: 162
    Spherical Harmonics?: true
    Max angular momentum: 3

  ==> DFT Potential <==

   => LibXC <=

    Version 6.2.2
    S. Lehtola, C. Steigemann, M. J.T. Oliveira, and M. A.L. Marques.,  SoftwareX 7, 1–5 (2018) (10.1016/j.softx.2017.11.002)

   => Composite Functional: B3LYP <= 

    B3LYP Hyb-GGA Exchange-Correlation Functional

    P. J. Stephens, F. J. Devlin, C. F. Chabalowski, and M. J. Frisch.,  J. Phys. Chem. 98, 11623 (1994) (10.1021/j100096a001)

    Deriv               =              1
    GGA                 =           TRUE
    Meta                =          FALSE

    Exchange Hybrid     =           TRUE
    MP2 Hybrid          =          FALSE

   => Exchange Functionals <=

    0.0800   Slater exchange
    0.7200         Becke 88

   => Exact (HF) Exchange <=

    0.2000               HF 

   => Correlation Functionals <=

    0.1900   Vosko, Wilk & Nusair (VWN5_RPA)
    0.8100   Lee, Yang & Parr

   => LibXC Density Thresholds  <==

    XC_HYB_GGA_XC_B3LYP:  1.00E-15 

   => Molecular Quadrature <=

    Radial Scheme          =       TREUTLER
    Pruning Scheme         =           NONE
    Nuclear Scheme         =       TREUTLER

    Blocking Scheme        =         OCTREE
    BS radius alpha        =              1
    Pruning alpha          =              1
    Radial Points          =             75
    Spherical Points       =            302
    Total Points           =          43257
    Total Blocks           =            392
    Max Points             =            256
    Max Functions          =             28
    Weights Tolerance      =       1.00E-15


  -Total Gradient:
     Atom            X                  Y                   Z
    ------   -----------------  -----------------  -----------------
       1        0.000000000000     0.000000000000     0.000782969029
       2        0.000000000000    -0.000000000000    -0.000768469414


*** tstop() called on Joses-MacBook-Pro-2.local at Thu Jul 17 13:30:51 2025
Module time:
	user time   =       0.37 seconds =       0.01 minutes
	system time =       1.59 seconds =       0.03 minutes
	total time  =          0 seconds =       0.00 minutes
Total time:
	user time   =       7.23 seconds =       0.12 minutes
	system time =      12.81 seconds =       0.21 minutes
	total time  =          2 seconds =       0.03 minutes

    			-----------------------------------------

    			 OPTKING 3.0: for geometry optimizations 

    			     By R.A. King, Bethel University     

    			        with contributions from          

    			    A.V. Copan, J. Cayton, A. Heide      

    			-----------------------------------------

    
	                            ===> Fragment 1 <== 

	 Z (Atomic Numbers)          Masses                          Geom                  
	       5.000000            11.009305          0.00000000  0.00000000  1.34028029   
	       8.000000            15.994915          0.00000000  0.00000000 -0.92251540   

	 - Coordinate -           - BOHR/RAD -       - ANG/DEG -
	 R(1,2)           =         2.262796           1.197420


	        --- Internal Coordinate Step in ANG or DEG, aJ/ANG or AJ/DEG ---
	-------------------------------------------------------------------------------
	           Coordinate      Previous         Force          Change          New 
	           ----------      --------        ------          ------        ------
	               R(1,2)       1.19742       -0.00639       -0.00046       1.19696
	-------------------------------------------------------------------------------

	                                 ==> Convergence Check <==                                  
    
	Measures of convergence in internal coordinates in au.
    
	Criteria marked as inactive (o), active & met (*), and active & unmet ( ).

	----------------------------------------------------------------------------------------------
	   Step    Total Energy     Delta E     Max Force     RMS Force      Max Disp      RMS Disp   
	----------------------------------------------------------------------------------------------
	  Convergence Criteria     1.00e-06 *    3.00e-04 *             o    1.20e-03 *             o
	----------------------------------------------------------------------------------------------
	     2     -99.54854106   -1.44e-05      7.76e-04      7.76e-04 o    8.72e-04 *    8.72e-04 o  ~
	----------------------------------------------------------------------------------------------

Next Geometry in Ang 
	Fragment 1 (Ang)

	    B   0.0000000000   0.0000000000   0.7090149541
	    O   0.0000000000   0.0000000000  -0.4879432918


    Structure for next step:
    Molecular point group: c2v
    Full point group: C_inf_v

    Geometry (in Angstrom), charge = 1, multiplicity = 1:

    B            0.000000000000     0.000000000000     0.708972336965
    O            0.000000000000     0.000000000000    -0.487985908964


Scratch directory: /tmp/
gradient() will perform analytic gradient computation.
   => Libint2 <=

    Primary   basis highest AM E, G, H:  6, 6, 3
    Auxiliary basis highest AM E, G, H:  7, 7, 4
    Onebody   basis highest AM E, G, H:  -, -, -
    Solid Harmonics ordering:            Gaussian

*** tstart() called on Joses-MacBook-Pro-2.local
*** at Thu Jul 17 13:30:51 2025

   => Loading Basis Set <=

    Name: CC-PVDZ
    Role: ORBITAL
    Keyword: BASIS
    atoms 1 entry B          line   108 file /Users/joseantoniorodriguesromero/anaconda3/share/psi4/basis/cc-pvdz.gbs 
    atoms 2 entry O          line   198 file /Users/joseantoniorodriguesromero/anaconda3/share/psi4/basis/cc-pvdz.gbs 


         ---------------------------------------------------------
                                   SCF
               by Justin Turney, Rob Parrish, Andy Simmonett
                          and Daniel G. A. Smith
                              UKS Reference
                        1 Threads,    500 MiB Core
         ---------------------------------------------------------

  ==> Geometry <==

    Molecular point group: c2v
    Full point group: C_inf_v

    Geometry (in Angstrom), charge = 1, multiplicity = 1:

       Center              X                  Y                   Z               Mass       
    ------------   -----------------  -----------------  -----------------  -----------------
         B            0.000000000000     0.000000000000     0.708972336965    11.009305360000
         O            0.000000000000     0.000000000000    -0.487985908964    15.994914619570

  Running in c2v symmetry.

  Rotational constants: A = ************  B =      1.80438  C =      1.80438 [cm^-1]
  Rotational constants: A = ************  B =  54093.98679  C =  54093.98679 [MHz]
  Nuclear repulsion =   17.684065838372714

  Charge       = 1
  Multiplicity = 1
  Electrons    = 12
  Nalpha       = 6
  Nbeta        = 6

  ==> Algorithm <==

  SCF Algorithm Type is DF.
  DIIS enabled.
  MOM disabled.
  Fractional occupation disabled.
  Guess Type is READ.
  Energy threshold   = 1.00e-08
  Density threshold  = 1.00e-08
  Integral threshold = 1.00e-12

  ==> Primary Basis <==

  Basis Set: CC-PVDZ
    Blend: CC-PVDZ
    Number of shells: 12
    Number of basis functions: 28
    Number of Cartesian functions: 30
    Spherical Harmonics?: true
    Max angular momentum: 2

  ==> DFT Potential <==

   => LibXC <=

    Version 6.2.2
    S. Lehtola, C. Steigemann, M. J.T. Oliveira, and M. A.L. Marques.,  SoftwareX 7, 1–5 (2018) (10.1016/j.softx.2017.11.002)

   => Composite Functional: B3LYP <= 

    B3LYP Hyb-GGA Exchange-Correlation Functional

    P. J. Stephens, F. J. Devlin, C. F. Chabalowski, and M. J. Frisch.,  J. Phys. Chem. 98, 11623 (1994) (10.1021/j100096a001)

    Deriv               =              1
    GGA                 =           TRUE
    Meta                =          FALSE

    Exchange Hybrid     =           TRUE
    MP2 Hybrid          =          FALSE

   => Exchange Functionals <=

    0.0800   Slater exchange
    0.7200         Becke 88

   => Exact (HF) Exchange <=

    0.2000               HF 

   => Correlation Functionals <=

    0.1900   Vosko, Wilk & Nusair (VWN5_RPA)
    0.8100   Lee, Yang & Parr

   => LibXC Density Thresholds  <==

    XC_HYB_GGA_XC_B3LYP:  1.00E-15 

   => Molecular Quadrature <=

    Radial Scheme          =       TREUTLER
    Pruning Scheme         =           NONE
    Nuclear Scheme         =       TREUTLER

    Blocking Scheme        =         OCTREE
    BS radius alpha        =              1
    Pruning alpha          =              1
    Radial Points          =             75
    Spherical Points       =            302
    Total Points           =          43257
    Total Blocks           =            392
    Max Points             =            256
    Max Functions          =             28
    Weights Tolerance      =       1.00E-15

   => Loading Basis Set <=

    Name: (CC-PVDZ AUX)
    Role: JKFIT
    Keyword: DF_BASIS_SCF
    atoms 1 entry B          line    71 file /Users/joseantoniorodriguesromero/anaconda3/share/psi4/basis/cc-pvdz-jkfit.gbs 
    atoms 2 entry O          line   221 file /Users/joseantoniorodriguesromero/anaconda3/share/psi4/basis/cc-pvdz-jkfit.gbs 

   => Loading Basis Set <=

    Name: CC-PVDZ
    Role: ORBITAL
    Keyword: BASIS
    atoms 1 entry B          line   108 file /Users/joseantoniorodriguesromero/anaconda3/share/psi4/basis/cc-pvdz.gbs 
    atoms 2 entry O          line   198 file /Users/joseantoniorodriguesromero/anaconda3/share/psi4/basis/cc-pvdz.gbs 

  Reading orbitals from file /tmp/singlet_BO.default.74220.180.npy, no projection.

  ==> Integral Setup <==

  DFHelper Memory: AOs need 0.001 GiB; user supplied 0.332 GiB. 
  Using in-core AOs.

  ==> MemDFJK: Density-Fitted J/K Matrices <==

    J tasked:                   Yes
    K tasked:                   Yes
    wK tasked:                   No
    OpenMP threads:               1
    Memory [MiB]:               339
    Algorithm:                 Core
    Schwarz Cutoff:           1E-12
    Mask sparsity (%):       0.0000
    Fitting Condition:        1E-10

   => Auxiliary Basis Set <=

  Basis Set: (CC-PVDZ AUX)
    Blend: CC-PVDZ-JKFIT
    Number of shells: 48
    Number of basis functions: 140
    Number of Cartesian functions: 162
    Spherical Harmonics?: true
    Max angular momentum: 3

  Cached 100.0% of DFT collocation blocks in 0.034 [GiB].

  Minimum eigenvalue in the overlap matrix is 2.5842986232E-02.
  Reciprocal condition number of the overlap matrix is 8.5410525783E-03.
    Using symmetric orthogonalization.

  ==> Pre-Iterations <==

  SCF Guess: Orbitals guess was supplied from a previous computation.

   -------------------------------------------------------
    Irrep   Nso     Nmo     Nalpha   Nbeta   Ndocc  Nsocc
   -------------------------------------------------------
     A1        14      14       4       4       4       0
     A2         2       2       0       0       0       0
     B1         6       6       1       1       1       0
     B2         6       6       1       1       1       0
   -------------------------------------------------------
    Total      28      28       6       6       6       0
   -------------------------------------------------------

  ==> Iterations <==

                           Total Energy        Delta E     RMS |[F,P]|

   @DF-UKS iter   0:   -99.54921965139039   -9.95492e+01   9.42898e-05 
   @DF-UKS iter   1:   -99.54854131893886    6.78332e-04   2.49951e-05 DIIS
   @DF-UKS iter   2:   -99.54854060240672    7.16532e-07   8.46336e-05 DIIS/DAMP=1%
   @DF-UKS iter   3:   -99.54857089277078   -3.02904e-05   2.86022e-06 DIIS/DAMP=1%
   @DF-UKS iter   4:   -99.54854169536915    2.91974e-05   2.21684e-06 DIIS/DAMP=1%
   @DF-UKS iter   5:   -99.54854223882531   -5.43456e-07   3.14424e-07 DIIS/DAMP=1%
   @DF-UKS iter   6:   -99.54854129170732    9.47118e-07   2.10555e-08 DIIS/DAMP=1%
   @DF-UKS iter   7:   -99.54854140430062   -1.12593e-07   6.82370e-10 DIIS/DAMP=1%
   @DF-UKS iter   8:   -99.54854140035441    3.94621e-09   4.52160e-11 DIIS/DAMP=1%
  Energy and wave function converged.


  ==> Post-Iterations <==

   Electrons on quadrature grid:
      Nalpha   =    6.0000000861 ; deviation = 8.613e-08
      Nbeta    =    6.0000000861 ; deviation = 8.613e-08
      Ntotal   =   12.0000001723 ; deviation = 1.723e-07 

   @Spin Contamination Metric:  -5.329070518E-15
   @S^2 Expected:                0.000000000E+00
   @S^2 Observed:               -5.329070518E-15
   @S   Expected:                0.000000000E+00
   @S   Observed:                0.000000000E+00

    Orbital Energies [Eh]
    ---------------------

    Alpha Occupied:                                                       

       1A1   -19.545574     2A1    -7.327090     3A1    -1.369456  
       4A1    -0.786844     1B1    -0.724759     1B2    -0.724759  

    Alpha Virtual:                                                        

       5A1    -0.607034     2B2    -0.341249     2B1    -0.341249  
       6A1    -0.109385     3B2    -0.008820     3B1    -0.008820  
       7A1     0.008130     8A1     0.250323     9A1     0.341470  
       1A2     0.341470     4B2     0.511239     4B1     0.511239  
      10A1     0.577613     5B2     0.707430     5B1     0.707430  
      11A1     1.064277    12A1     1.372595     2A2     2.285944  
      13A1     2.285946     6B1     2.577285     6B2     2.577285  
      14A1     3.028102  

    Beta Occupied:                                                        

       1A1   -19.545574     2A1    -7.327090     3A1    -1.369456  
       4A1    -0.786844     1B1    -0.724759     1B2    -0.724759  

    Beta Virtual:                                                         

       5A1    -0.607034     2B2    -0.341249     2B1    -0.341249  
       6A1    -0.109385     3B2    -0.008820     3B1    -0.008820  
       7A1     0.008130     8A1     0.250323     9A1     0.341470  
       1A2     0.341470     4B2     0.511239     4B1     0.511239  
      10A1     0.577613     5B2     0.707430     5B1     0.707430  
      11A1     1.064277    12A1     1.372595     2A2     2.285944  
      13A1     2.285946     6B1     2.577285     6B2     2.577285  
      14A1     3.028102  

    Final Occupation by Irrep:
             A1    A2    B1    B2 
    DOCC [     4,    0,    1,    1 ]
    SOCC [     0,    0,    0,    0 ]
    NA   [     4,    0,    1,    1 ]
    NB   [     4,    0,    1,    1 ]

  @DF-UKS Final Energy:   -99.54854140035441

   => Energetics <=

    Nuclear Repulsion Energy =             17.6840658383727138
    One-Electron Energy =                -166.3882180237867203
    Two-Electron Energy =                  59.0487801409581152
    DFT Exchange-Correlation Energy =      -9.8931693558985021
    Empirical Dispersion Energy =           0.0000000000000000
    VV10 Nonlocal Energy =                  0.0000000000000000
    Total Energy =                        -99.5485414003544093

  UHF NO Occupations:
  HONO-2 :    3 A1 2.0000000
  HONO-1 :    1 B1 2.0000000
  HONO-0 :    4 A1 2.0000000
  LUNO+0 :    5 A1 0.0000000
  LUNO+1 :    2 B1 0.0000000
  LUNO+2 :    6 A1 0.0000000
  LUNO+3 :    7 A1 0.0000000


Computation Completed


Properties will be evaluated at   0.000000,   0.000000,   0.000000 [a0]

Properties computed using the SCF density matrix


 Multipole Moments:

 ------------------------------------------------------------------------------------
     Multipole            Electronic (a.u.)      Nuclear  (a.u.)        Total (a.u.)
 ------------------------------------------------------------------------------------

 L = 1.  Multiply by 2.5417464519 to convert [e a0] to [Debye]
 Dipole X            :          0.0000000            0.0000000            0.0000000
 Dipole Y            :          0.0000000            0.0000000            0.0000000
 Dipole Z            :          2.9115992           -0.6784600            2.2331392
 Magnitude           :                                                    2.2331392

 ------------------------------------------------------------------------------------

*** tstop() called on Joses-MacBook-Pro-2.local at Thu Jul 17 13:30:52 2025
Module time:
	user time   =       2.70 seconds =       0.05 minutes
	system time =       2.89 seconds =       0.05 minutes
	total time  =          1 seconds =       0.02 minutes
Total time:
	user time   =       9.97 seconds =       0.17 minutes
	system time =      15.92 seconds =       0.27 minutes
	total time  =          3 seconds =       0.05 minutes

*** tstart() called on Joses-MacBook-Pro-2.local
*** at Thu Jul 17 13:30:52 2025


         ------------------------------------------------------------
                                   SCF GRAD                          
                          Rob Parrish, Justin Turney,                
                       Andy Simmonett, and Alex Sokolov              
         ------------------------------------------------------------

  ==> Geometry <==

    Molecular point group: c2v
    Full point group: C_inf_v

    Geometry (in Angstrom), charge = 1, multiplicity = 1:

       Center              X                  Y                   Z               Mass       
    ------------   -----------------  -----------------  -----------------  -----------------
         B            0.000000000000     0.000000000000     0.708972336965    11.009305360000
         O            0.000000000000     0.000000000000    -0.487985908964    15.994914619570

  Nuclear repulsion =   17.684065838372714

  ==> Basis Set <==

  Basis Set: CC-PVDZ
    Blend: CC-PVDZ
    Number of shells: 12
    Number of basis functions: 28
    Number of Cartesian functions: 30
    Spherical Harmonics?: true
    Max angular momentum: 2

  ==> DFJKGrad: Density-Fitted SCF Gradients <==

    Gradient:                    1
    J tasked:                  Yes
    K tasked:                  Yes
    wK tasked:                  No
    OpenMP threads:              1
    Integrals threads:           1
    Memory [MiB]:              375
    Schwarz Cutoff:          1E-12
    Fitting Condition:       1E-10

   => Auxiliary Basis Set <=

  Basis Set: (CC-PVDZ AUX)
    Blend: CC-PVDZ-JKFIT
    Number of shells: 48
    Number of basis functions: 140
    Number of Cartesian functions: 162
    Spherical Harmonics?: true
    Max angular momentum: 3

  ==> DFT Potential <==

   => LibXC <=

    Version 6.2.2
    S. Lehtola, C. Steigemann, M. J.T. Oliveira, and M. A.L. Marques.,  SoftwareX 7, 1–5 (2018) (10.1016/j.softx.2017.11.002)

   => Composite Functional: B3LYP <= 

    B3LYP Hyb-GGA Exchange-Correlation Functional

    P. J. Stephens, F. J. Devlin, C. F. Chabalowski, and M. J. Frisch.,  J. Phys. Chem. 98, 11623 (1994) (10.1021/j100096a001)

    Deriv               =              1
    GGA                 =           TRUE
    Meta                =          FALSE

    Exchange Hybrid     =           TRUE
    MP2 Hybrid          =          FALSE

   => Exchange Functionals <=

    0.0800   Slater exchange
    0.7200         Becke 88

   => Exact (HF) Exchange <=

    0.2000               HF 

   => Correlation Functionals <=

    0.1900   Vosko, Wilk & Nusair (VWN5_RPA)
    0.8100   Lee, Yang & Parr

   => LibXC Density Thresholds  <==

    XC_HYB_GGA_XC_B3LYP:  1.00E-15 

   => Molecular Quadrature <=

    Radial Scheme          =       TREUTLER
    Pruning Scheme         =           NONE
    Nuclear Scheme         =       TREUTLER

    Blocking Scheme        =         OCTREE
    BS radius alpha        =              1
    Pruning alpha          =              1
    Radial Points          =             75
    Spherical Points       =            302
    Total Points           =          43257
    Total Blocks           =            392
    Max Points             =            256
    Max Functions          =             28
    Weights Tolerance      =       1.00E-15


  -Total Gradient:
     Atom            X                  Y                   Z
    ------   -----------------  -----------------  -----------------
       1        0.000000000000    -0.000000000000    -0.000000790006
       2        0.000000000000    -0.000000000000     0.000015317623


*** tstop() called on Joses-MacBook-Pro-2.local at Thu Jul 17 13:30:52 2025
Module time:
	user time   =       0.50 seconds =       0.01 minutes
	system time =       1.06 seconds =       0.02 minutes
	total time  =          0 seconds =       0.00 minutes
Total time:
	user time   =      10.47 seconds =       0.17 minutes
	system time =      16.99 seconds =       0.28 minutes
	total time  =          3 seconds =       0.05 minutes

    			-----------------------------------------

    			 OPTKING 3.0: for geometry optimizations 

    			     By R.A. King, Bethel University     

    			        with contributions from          

    			    A.V. Copan, J. Cayton, A. Heide      

    			-----------------------------------------

    
	                            ===> Fragment 1 <== 

	 Z (Atomic Numbers)          Masses                          Geom                  
	       5.000000            11.009305          0.00000000  0.00000000  1.33976355   
	       8.000000            15.994915          0.00000000  0.00000000 -0.92215972   

	 - Coordinate -           - BOHR/RAD -       - ANG/DEG -
	 R(1,2)           =         2.261923           1.196958


	        --- Internal Coordinate Step in ANG or DEG, aJ/ANG or AJ/DEG ---
	-------------------------------------------------------------------------------
	           Coordinate      Previous         Force          Change          New 
	           ----------      --------        ------          ------        ------
	               R(1,2)       1.19696        0.00007        0.00000       1.19696
	-------------------------------------------------------------------------------

	                                 ==> Convergence Check <==                                  
    
	Measures of convergence in internal coordinates in au.
    
	Criteria marked as inactive (o), active & met (*), and active & unmet ( ).

	----------------------------------------------------------------------------------------------
	   Step    Total Energy     Delta E     Max Force     RMS Force      Max Disp      RMS Disp   
	----------------------------------------------------------------------------------------------
	  Convergence Criteria     1.00e-06 *    3.00e-04 *             o    1.20e-03 *             o
	----------------------------------------------------------------------------------------------
	     3     -99.54854140   -3.39e-07 *    8.05e-06 *    8.05e-06 o    9.04e-06 *    9.04e-06 o  ~
	----------------------------------------------------------------------------------------------

Next Geometry in Ang 
	Fragment 1 (Ang)

	    B   0.0000000000   0.0000000000   0.7089747298
	    O   0.0000000000   0.0000000000  -0.4879883018


    Final optimized geometry and variables:
    Molecular point group: c2v
    Full point group: C_inf_v

    Geometry (in Angstrom), charge = 1, multiplicity = 1:

    B            0.000000000000     0.000000000000     0.708972336965
    O            0.000000000000     0.000000000000    -0.487985908964


    Psi4 stopped on: Thursday, 17 July 2025 01:30PM
    Psi4 wall time for execution: 0:00:03.24

*** Psi4 exiting successfully. Buy a developer a beer!
