
    -----------------------------------------------------------------------
          Psi4: An Open-Source Ab Initio Electronic Structure Package
                               Psi4 1.9.1 release

                         Git: Rev {} zzzzzzz 


    D. G. A. Smith, L. A. Burns, A. C. Simmonett, R. M. Parrish,
    M. C. Schieber, R. Galvelis, P. Kraus, H. Kruse, R. Di Remigio,
    A. Alenaizan, A. M. James, S. Lehtola, J. P. Misiewicz, M. Scheurer,
    R. A. Shaw, J. B. Schriber, Y. Xie, Z. L. Glick, D. A. Sirianni,
    J. S. O'Brien, J. M. Waldrop, A. Kumar, E. G. Hohenstein,
    B. P. Pritchard, B. R. Brooks, H. F. Schaefer III, A. Yu. Sokolov,
    K. Patkowski, A. E. DePrince III, U. Bozkaya, R. A. King,
    F. A. Evangelista, J. M. Turney, T. D. Crawford, C. D. Sherrill,
    J. Chem. Phys. 152(18) 184108 (2020). https://doi.org/10.1063/5.0006002

                            Additional Code Authors
    E. T. Seidl, C. L. Janssen, E. F. Valeev, M. L. Leininger,
    J. F. Gonthier, R. M. Richard, H. R. McAlexander, M. Saitow, X. Wang,
    P. Verma, M. H. Lechner, A. Jiang, S. Behnle, A. G. Heide,
    M. F. Herbst, and D. L. Poole

             Previous Authors, Complete List of Code Contributors,
                       and Citations for Specific Modules
    https://github.com/psi4/psi4/blob/master/codemeta.json
    https://github.com/psi4/psi4/graphs/contributors
    http://psicode.org/psi4manual/master/introduction.html#citing-psifour

    -----------------------------------------------------------------------


    Psi4 started on: Thursday, 17 July 2025 02:01PM

    Process ID: 74537
    Host:       Joses-MacBook-Pro-2.local
    PSIDATADIR: /Users/joseantoniorodriguesromero/anaconda3/share/psi4
    Memory:     500.0 MiB
    Threads:    1
    
  ==> Input File <==

--------------------------------------------------------------------------
molecule { 
1 1
O   0.00000        0.60000        0.00000
F   0.00000       -0.60000        0.00000
}

set { 
basis              cc-pvdz
reference          uks
maxiter            500
geom_maxiter       500
DAMPING_PERCENTAGE 1
guess              SAP
}

optimize('b3lyp')
--------------------------------------------------------------------------

Scratch directory: /tmp/
gradient() will perform analytic gradient computation.
   => Libint2 <=

    Primary   basis highest AM E, G, H:  6, 6, 3
    Auxiliary basis highest AM E, G, H:  7, 7, 4
    Onebody   basis highest AM E, G, H:  -, -, -
    Solid Harmonics ordering:            Gaussian

*** tstart() called on Joses-MacBook-Pro-2.local
*** at Thu Jul 17 14:01:13 2025

   => Loading Basis Set <=

    Name: CC-PVDZ
    Role: ORBITAL
    Keyword: BASIS
    atoms 1 entry O          line   198 file /Users/joseantoniorodriguesromero/anaconda3/share/psi4/basis/cc-pvdz.gbs 
    atoms 2 entry F          line   228 file /Users/joseantoniorodriguesromero/anaconda3/share/psi4/basis/cc-pvdz.gbs 


         ---------------------------------------------------------
                                   SCF
               by Justin Turney, Rob Parrish, Andy Simmonett
                          and Daniel G. A. Smith
                              UKS Reference
                        1 Threads,    500 MiB Core
         ---------------------------------------------------------

  ==> Geometry <==

    Molecular point group: c2v
    Full point group: C_inf_v

    Geometry (in Angstrom), charge = 1, multiplicity = 1:

       Center              X                  Y                   Z               Mass       
    ------------   -----------------  -----------------  -----------------  -----------------
         O            0.000000000000     0.000000000000     0.651498207089    15.994914619570
         F            0.000000000000     0.000000000000    -0.548501792911    18.998403162730

  Running in c2v symmetry.

  Rotational constants: A = ************  B =      1.34809  C =      1.34809 [cm^-1]
  Rotational constants: A = ************  B =  40414.83427  C =  40414.83427 [MHz]
  Nuclear repulsion =   31.750632640200006

  Charge       = 1
  Multiplicity = 1
  Electrons    = 16
  Nalpha       = 8
  Nbeta        = 8

  ==> Algorithm <==

  SCF Algorithm Type is DF.
  DIIS enabled.
  MOM disabled.
  Fractional occupation disabled.
  Guess Type is SAP.
  Energy threshold   = 1.00e-08
  Density threshold  = 1.00e-08
  Integral threshold = 1.00e-12

  ==> Primary Basis <==

  Basis Set: CC-PVDZ
    Blend: CC-PVDZ
    Number of shells: 12
    Number of basis functions: 28
    Number of Cartesian functions: 30
    Spherical Harmonics?: true
    Max angular momentum: 2

  ==> DFT Potential <==

   => LibXC <=

    Version 6.2.2
    S. Lehtola, C. Steigemann, M. J.T. Oliveira, and M. A.L. Marques.,  SoftwareX 7, 1–5 (2018) (10.1016/j.softx.2017.11.002)

   => Composite Functional: B3LYP <= 

    B3LYP Hyb-GGA Exchange-Correlation Functional

    P. J. Stephens, F. J. Devlin, C. F. Chabalowski, and M. J. Frisch.,  J. Phys. Chem. 98, 11623 (1994) (10.1021/j100096a001)

    Deriv               =              1
    GGA                 =           TRUE
    Meta                =          FALSE

    Exchange Hybrid     =           TRUE
    MP2 Hybrid          =          FALSE

   => Exchange Functionals <=

    0.0800   Slater exchange
    0.7200         Becke 88

   => Exact (HF) Exchange <=

    0.2000               HF 

   => Correlation Functionals <=

    0.1900   Vosko, Wilk & Nusair (VWN5_RPA)
    0.8100   Lee, Yang & Parr

   => LibXC Density Thresholds  <==

    XC_HYB_GGA_XC_B3LYP:  1.00E-15 

   => Molecular Quadrature <=

    Radial Scheme          =       TREUTLER
    Pruning Scheme         =           NONE
    Nuclear Scheme         =       TREUTLER

    Blocking Scheme        =         OCTREE
    BS radius alpha        =              1
    Pruning alpha          =              1
    Radial Points          =             75
    Spherical Points       =            302
    Total Points           =          42011
    Total Blocks           =            368
    Max Points             =            253
    Max Functions          =             28
    Weights Tolerance      =       1.00E-15

   => Loading Basis Set <=

    Name: (CC-PVDZ AUX)
    Role: JKFIT
    Keyword: DF_BASIS_SCF
    atoms 1 entry O          line   221 file /Users/joseantoniorodriguesromero/anaconda3/share/psi4/basis/cc-pvdz-jkfit.gbs 
    atoms 2 entry F          line   271 file /Users/joseantoniorodriguesromero/anaconda3/share/psi4/basis/cc-pvdz-jkfit.gbs 

  ==> Integral Setup <==

  DFHelper Memory: AOs need 0.001 GiB; user supplied 0.333 GiB. 
  Using in-core AOs.

  ==> MemDFJK: Density-Fitted J/K Matrices <==

    J tasked:                   Yes
    K tasked:                   Yes
    wK tasked:                   No
    OpenMP threads:               1
    Memory [MiB]:               340
    Algorithm:                 Core
    Schwarz Cutoff:           1E-12
    Mask sparsity (%):       0.0000
    Fitting Condition:        1E-10

   => Auxiliary Basis Set <=

  Basis Set: (CC-PVDZ AUX)
    Blend: CC-PVDZ-JKFIT
    Number of shells: 48
    Number of basis functions: 140
    Number of Cartesian functions: 162
    Spherical Harmonics?: true
    Max angular momentum: 3

  Cached 100.0% of DFT collocation blocks in 0.034 [GiB].

  Minimum eigenvalue in the overlap matrix is 2.7627076544E-02.
  Reciprocal condition number of the overlap matrix is 1.0031729215E-02.
    Using symmetric orthogonalization.

  ==> Pre-Iterations <==

  SCF Guess: Superposition of Atomic Potentials (doi:10.1021/acs.jctc.8b01089).

  ==> SAP guess <==

   => Molecular Quadrature <=

    Radial Scheme          =       TREUTLER
    Pruning Scheme         =           NONE
    Nuclear Scheme         =       TREUTLER

    Blocking Scheme        =         OCTREE
    BS radius alpha        =              1
    Pruning alpha          =              1
    Radial Points          =             75
    Spherical Points       =            302
    Total Points           =          42011
    Total Blocks           =            368
    Max Points             =            253
    Max Functions          =             28
    Weights Tolerance      =       1.00E-15

   -------------------------------------------------------
    Irrep   Nso     Nmo     Nalpha   Nbeta   Ndocc  Nsocc
   -------------------------------------------------------
     A1        14      14       5       5       5       0
     A2         2       2       0       0       0       0
     B1         6       6       1       1       1       0
     B2         6       6       2       2       2       0
   -------------------------------------------------------
    Total      28      28       8       8       8       0
   -------------------------------------------------------

  ==> Iterations <==

                           Total Energy        Delta E     RMS |[F,P]|

   @DF-UKS iter   1:  -174.32799573969842   -1.74328e+02   1.23129e-02 DIIS/ADIIS
   @DF-UKS iter   2:  -174.33247403215526   -4.47829e-03   7.54238e-03 DIIS/ADIIS/DAMP=1%
   @DF-UKS iter   3:  -174.33260509967110   -1.31068e-04   9.62771e-03 DIIS/ADIIS/DAMP=1%
   @DF-UKS iter   4:  -174.33600240068216   -3.39730e-03   1.29015e-03 DIIS/ADIIS/DAMP=1%
   @DF-UKS iter   5:  -174.33689797940818   -8.95579e-04   1.27330e-04 DIIS/ADIIS/DAMP=1%
   @DF-UKS iter   6:  -174.33715541136328   -2.57432e-04   1.05310e-05 DIIS/DAMP=1%
   @DF-UKS iter   7:  -174.33712892840438    2.64830e-05   2.67393e-06 DIIS/DAMP=1%
   @DF-UKS iter   8:  -174.33713164549673   -2.71709e-06   2.31874e-07 DIIS/DAMP=1%
   @DF-UKS iter   9:  -174.33713132101212    3.24485e-07   1.37352e-08 DIIS/DAMP=1%
   @DF-UKS iter  10:  -174.33713129142882    2.95833e-08   1.04636e-09 DIIS/DAMP=1%
   @DF-UKS iter  11:  -174.33713129178798   -3.59165e-10   5.97144e-11 DIIS/DAMP=1%
  Energy and wave function converged.


  ==> Post-Iterations <==

   Electrons on quadrature grid:
      Nalpha   =    7.9999998123 ; deviation = -1.877e-07
      Nbeta    =    7.9999998123 ; deviation = -1.877e-07
      Ntotal   =   15.9999996246 ; deviation = -3.754e-07 

   @Spin Contamination Metric:  -3.552713679E-15
   @S^2 Expected:                0.000000000E+00
   @S^2 Observed:               -3.552713679E-15
   @S   Expected:                0.000000000E+00
   @S   Observed:                0.000000000E+00

    Orbital Energies [Eh]
    ---------------------

    Alpha Occupied:                                                       

       1A1   -25.348079     2A1   -19.846259     3A1    -1.929107  
       4A1    -1.386077     5A1    -1.061963     1B1    -1.049401  
       1B2    -1.044016     2B2    -0.775945  

    Alpha Virtual:                                                        

       2B1    -0.697781     6A1    -0.343399     7A1     0.412125  
       3B1     0.442154     3B2     0.459469     8A1     0.686014  
       4B1     0.721126     4B2     0.735212     9A1     0.740285  
      10A1     1.617124     5B1     1.855257     5B2     1.892797  
       1A2     1.998820    11A1     2.003838    12A1     2.409576  
       2A2     2.995356    13A1     2.996394     6B1     3.365566  
       6B2     3.395814    14A1     4.013235  

    Beta Occupied:                                                        

       1A1   -25.348079     2A1   -19.846259     3A1    -1.929107  
       4A1    -1.386077     5A1    -1.061963     1B1    -1.049401  
       1B2    -1.044016     2B2    -0.775945  

    Beta Virtual:                                                         

       2B1    -0.697781     6A1    -0.343399     7A1     0.412125  
       3B1     0.442154     3B2     0.459469     8A1     0.686014  
       4B1     0.721126     4B2     0.735212     9A1     0.740285  
      10A1     1.617124     5B1     1.855257     5B2     1.892797  
       1A2     1.998820    11A1     2.003838    12A1     2.409576  
       2A2     2.995356    13A1     2.996394     6B1     3.365566  
       6B2     3.395814    14A1     4.013235  

    Final Occupation by Irrep:
             A1    A2    B1    B2 
    DOCC [     5,    0,    1,    2 ]
    SOCC [     0,    0,    0,    0 ]
    NA   [     5,    0,    1,    2 ]
    NB   [     5,    0,    1,    2 ]

  @DF-UKS Final Energy:  -174.33713129178798

   => Energetics <=

    Nuclear Repulsion Energy =             31.7506326402000063
    One-Electron Energy =                -296.5838392802763792
    Two-Electron Energy =                 105.4120425081184180
    DFT Exchange-Correlation Energy =     -14.9159671598300481
    Empirical Dispersion Energy =           0.0000000000000000
    VV10 Nonlocal Energy =                  0.0000000000000000
    Total Energy =                       -174.3371312917879834

  UHF NO Occupations:
  HONO-2 :    2 B2 2.0000000
  HONO-1 :    1 B1 2.0000000
  HONO-0 :    5 A1 2.0000000
  LUNO+0 :    6 A1 0.0000000
  LUNO+1 :    3 B2 0.0000000
  LUNO+2 :    7 A1 0.0000000
  LUNO+3 :    4 B2 0.0000000


Computation Completed


Properties will be evaluated at   0.000000,   0.000000,   0.000000 [a0]

Properties computed using the SCF density matrix


 Multipole Moments:

 ------------------------------------------------------------------------------------
     Multipole            Electronic (a.u.)      Nuclear  (a.u.)        Total (a.u.)
 ------------------------------------------------------------------------------------

 L = 1.  Multiply by 2.5417464519 to convert [e a0] to [Debye]
 Dipole X            :          0.0000000            0.0000000            0.0000000
 Dipole Y            :          0.0000000            0.0000000            0.0000000
 Dipole Z            :         -0.3411109            0.5205619            0.1794511
 Magnitude           :                                                    0.1794511

 ------------------------------------------------------------------------------------

*** tstop() called on Joses-MacBook-Pro-2.local at Thu Jul 17 14:01:14 2025
Module time:
	user time   =       2.45 seconds =       0.04 minutes
	system time =       6.64 seconds =       0.11 minutes
	total time  =          1 seconds =       0.02 minutes
Total time:
	user time   =       2.45 seconds =       0.04 minutes
	system time =       6.64 seconds =       0.11 minutes
	total time  =          1 seconds =       0.02 minutes

*** tstart() called on Joses-MacBook-Pro-2.local
*** at Thu Jul 17 14:01:14 2025


         ------------------------------------------------------------
                                   SCF GRAD                          
                          Rob Parrish, Justin Turney,                
                       Andy Simmonett, and Alex Sokolov              
         ------------------------------------------------------------

  ==> Geometry <==

    Molecular point group: c2v
    Full point group: C_inf_v

    Geometry (in Angstrom), charge = 1, multiplicity = 1:

       Center              X                  Y                   Z               Mass       
    ------------   -----------------  -----------------  -----------------  -----------------
         O            0.000000000000     0.000000000000     0.651498207089    15.994914619570
         F            0.000000000000     0.000000000000    -0.548501792911    18.998403162730

  Nuclear repulsion =   31.750632640200006

  ==> Basis Set <==

  Basis Set: CC-PVDZ
    Blend: CC-PVDZ
    Number of shells: 12
    Number of basis functions: 28
    Number of Cartesian functions: 30
    Spherical Harmonics?: true
    Max angular momentum: 2

  ==> DFJKGrad: Density-Fitted SCF Gradients <==

    Gradient:                    1
    J tasked:                  Yes
    K tasked:                  Yes
    wK tasked:                  No
    OpenMP threads:              1
    Integrals threads:           1
    Memory [MiB]:              375
    Schwarz Cutoff:          1E-12
    Fitting Condition:       1E-10

   => Auxiliary Basis Set <=

  Basis Set: (CC-PVDZ AUX)
    Blend: CC-PVDZ-JKFIT
    Number of shells: 48
    Number of basis functions: 140
    Number of Cartesian functions: 162
    Spherical Harmonics?: true
    Max angular momentum: 3

  ==> DFT Potential <==

   => LibXC <=

    Version 6.2.2
    S. Lehtola, C. Steigemann, M. J.T. Oliveira, and M. A.L. Marques.,  SoftwareX 7, 1–5 (2018) (10.1016/j.softx.2017.11.002)

   => Composite Functional: B3LYP <= 

    B3LYP Hyb-GGA Exchange-Correlation Functional

    P. J. Stephens, F. J. Devlin, C. F. Chabalowski, and M. J. Frisch.,  J. Phys. Chem. 98, 11623 (1994) (10.1021/j100096a001)

    Deriv               =              1
    GGA                 =           TRUE
    Meta                =          FALSE

    Exchange Hybrid     =           TRUE
    MP2 Hybrid          =          FALSE

   => Exchange Functionals <=

    0.0800   Slater exchange
    0.7200         Becke 88

   => Exact (HF) Exchange <=

    0.2000               HF 

   => Correlation Functionals <=

    0.1900   Vosko, Wilk & Nusair (VWN5_RPA)
    0.8100   Lee, Yang & Parr

   => LibXC Density Thresholds  <==

    XC_HYB_GGA_XC_B3LYP:  1.00E-15 

   => Molecular Quadrature <=

    Radial Scheme          =       TREUTLER
    Pruning Scheme         =           NONE
    Nuclear Scheme         =       TREUTLER

    Blocking Scheme        =         OCTREE
    BS radius alpha        =              1
    Pruning alpha          =              1
    Radial Points          =             75
    Spherical Points       =            302
    Total Points           =          42011
    Total Blocks           =            368
    Max Points             =            253
    Max Functions          =             28
    Weights Tolerance      =       1.00E-15


  -Total Gradient:
     Atom            X                  Y                   Z
    ------   -----------------  -----------------  -----------------
       1       -0.000000000000     0.000000000000    -0.035892708818
       2       -0.000000000000     0.000000000000     0.035897908316


*** tstop() called on Joses-MacBook-Pro-2.local at Thu Jul 17 14:01:15 2025
Module time:
	user time   =       0.68 seconds =       0.01 minutes
	system time =       1.16 seconds =       0.02 minutes
	total time  =          1 seconds =       0.02 minutes
Total time:
	user time   =       3.13 seconds =       0.05 minutes
	system time =       7.81 seconds =       0.13 minutes
	total time  =          2 seconds =       0.03 minutes

    			-----------------------------------------

    			 OPTKING 3.0: for geometry optimizations 

    			     By R.A. King, Bethel University     

    			        with contributions from          

    			    A.V. Copan, J. Cayton, A. Heide      

    			-----------------------------------------

    
	                            ===> Fragment 1 <== 

	 Z (Atomic Numbers)          Masses                          Geom                  
	       8.000000            15.994915          0.00000000  0.00000000  1.23115318   
	       9.000000            18.998403          0.00000000  0.00000000 -1.03651817   

	 - Coordinate -           - BOHR/RAD -       - ANG/DEG -
	 R(1,2)           =         2.267671           1.200000


	        --- Internal Coordinate Step in ANG or DEG, aJ/ANG or AJ/DEG ---
	-------------------------------------------------------------------------------
	           Coordinate      Previous         Force          Change          New 
	           ----------      --------        ------          ------        ------
	               R(1,2)       1.20000        0.29573        0.01810       1.21810
	-------------------------------------------------------------------------------

	                                 ==> Convergence Check <==                                  
    
	Measures of convergence in internal coordinates in au.
    
	Criteria marked as inactive (o), active & met (*), and active & unmet ( ).

	----------------------------------------------------------------------------------------------
	   Step    Total Energy     Delta E     Max Force     RMS Force      Max Disp      RMS Disp   
	----------------------------------------------------------------------------------------------
	  Convergence Criteria     1.00e-06 *    3.00e-04 *             o    1.20e-03 *             o
	----------------------------------------------------------------------------------------------
	     1    -174.33713129   -1.74e+02      3.59e-02      3.59e-02 o    3.42e-02      3.42e-02 o  ~
	----------------------------------------------------------------------------------------------

Next Geometry in Ang 
	Fragment 1 (Ang)

	    O   0.0000000000   0.0000000000   0.6605481031
	    F   0.0000000000   0.0000000000  -0.5575516889


    Structure for next step:
    Molecular point group: c2v
    Full point group: C_inf_v

    Geometry (in Angstrom), charge = 1, multiplicity = 1:

    O            0.000000000000     0.000000000000     0.661324858828
    F            0.000000000000     0.000000000000    -0.556774933248


Scratch directory: /tmp/
gradient() will perform analytic gradient computation.
   => Libint2 <=

    Primary   basis highest AM E, G, H:  6, 6, 3
    Auxiliary basis highest AM E, G, H:  7, 7, 4
    Onebody   basis highest AM E, G, H:  -, -, -
    Solid Harmonics ordering:            Gaussian

*** tstart() called on Joses-MacBook-Pro-2.local
*** at Thu Jul 17 14:01:15 2025

   => Loading Basis Set <=

    Name: CC-PVDZ
    Role: ORBITAL
    Keyword: BASIS
    atoms 1 entry O          line   198 file /Users/joseantoniorodriguesromero/anaconda3/share/psi4/basis/cc-pvdz.gbs 
    atoms 2 entry F          line   228 file /Users/joseantoniorodriguesromero/anaconda3/share/psi4/basis/cc-pvdz.gbs 


         ---------------------------------------------------------
                                   SCF
               by Justin Turney, Rob Parrish, Andy Simmonett
                          and Daniel G. A. Smith
                              UKS Reference
                        1 Threads,    500 MiB Core
         ---------------------------------------------------------

  ==> Geometry <==

    Molecular point group: c2v
    Full point group: C_inf_v

    Geometry (in Angstrom), charge = 1, multiplicity = 1:

       Center              X                  Y                   Z               Mass       
    ------------   -----------------  -----------------  -----------------  -----------------
         O            0.000000000000     0.000000000000     0.661324858828    15.994914619570
         F            0.000000000000     0.000000000000    -0.556774933248    18.998403162730

  Running in c2v symmetry.

  Rotational constants: A = ************  B =      1.30833  C =      1.30833 [cm^-1]
  Rotational constants: A = ************  B =  39222.70632  C =  39222.70632 [MHz]
  Nuclear repulsion =   31.278848757775812

  Charge       = 1
  Multiplicity = 1
  Electrons    = 16
  Nalpha       = 8
  Nbeta        = 8

  ==> Algorithm <==

  SCF Algorithm Type is DF.
  DIIS enabled.
  MOM disabled.
  Fractional occupation disabled.
  Guess Type is READ.
  Energy threshold   = 1.00e-08
  Density threshold  = 1.00e-08
  Integral threshold = 1.00e-12

  ==> Primary Basis <==

  Basis Set: CC-PVDZ
    Blend: CC-PVDZ
    Number of shells: 12
    Number of basis functions: 28
    Number of Cartesian functions: 30
    Spherical Harmonics?: true
    Max angular momentum: 2

  ==> DFT Potential <==

   => LibXC <=

    Version 6.2.2
    S. Lehtola, C. Steigemann, M. J.T. Oliveira, and M. A.L. Marques.,  SoftwareX 7, 1–5 (2018) (10.1016/j.softx.2017.11.002)

   => Composite Functional: B3LYP <= 

    B3LYP Hyb-GGA Exchange-Correlation Functional

    P. J. Stephens, F. J. Devlin, C. F. Chabalowski, and M. J. Frisch.,  J. Phys. Chem. 98, 11623 (1994) (10.1021/j100096a001)

    Deriv               =              1
    GGA                 =           TRUE
    Meta                =          FALSE

    Exchange Hybrid     =           TRUE
    MP2 Hybrid          =          FALSE

   => Exchange Functionals <=

    0.0800   Slater exchange
    0.7200         Becke 88

   => Exact (HF) Exchange <=

    0.2000               HF 

   => Correlation Functionals <=

    0.1900   Vosko, Wilk & Nusair (VWN5_RPA)
    0.8100   Lee, Yang & Parr

   => LibXC Density Thresholds  <==

    XC_HYB_GGA_XC_B3LYP:  1.00E-15 

   => Molecular Quadrature <=

    Radial Scheme          =       TREUTLER
    Pruning Scheme         =           NONE
    Nuclear Scheme         =       TREUTLER

    Blocking Scheme        =         OCTREE
    BS radius alpha        =              1
    Pruning alpha          =              1
    Radial Points          =             75
    Spherical Points       =            302
    Total Points           =          42012
    Total Blocks           =            367
    Max Points             =            252
    Max Functions          =             28
    Weights Tolerance      =       1.00E-15

   => Loading Basis Set <=

    Name: (CC-PVDZ AUX)
    Role: JKFIT
    Keyword: DF_BASIS_SCF
    atoms 1 entry O          line   221 file /Users/joseantoniorodriguesromero/anaconda3/share/psi4/basis/cc-pvdz-jkfit.gbs 
    atoms 2 entry F          line   271 file /Users/joseantoniorodriguesromero/anaconda3/share/psi4/basis/cc-pvdz-jkfit.gbs 

   => Loading Basis Set <=

    Name: CC-PVDZ
    Role: ORBITAL
    Keyword: BASIS
    atoms 1 entry O          line   198 file /Users/joseantoniorodriguesromero/anaconda3/share/psi4/basis/cc-pvdz.gbs 
    atoms 2 entry F          line   228 file /Users/joseantoniorodriguesromero/anaconda3/share/psi4/basis/cc-pvdz.gbs 

  Reading orbitals from file /tmp/singlet_OF.default.74537.180.npy, no projection.

  ==> Integral Setup <==

  DFHelper Memory: AOs need 0.001 GiB; user supplied 0.333 GiB. 
  Using in-core AOs.

  ==> MemDFJK: Density-Fitted J/K Matrices <==

    J tasked:                   Yes
    K tasked:                   Yes
    wK tasked:                   No
    OpenMP threads:               1
    Memory [MiB]:               340
    Algorithm:                 Core
    Schwarz Cutoff:           1E-12
    Mask sparsity (%):       0.0000
    Fitting Condition:        1E-10

   => Auxiliary Basis Set <=

  Basis Set: (CC-PVDZ AUX)
    Blend: CC-PVDZ-JKFIT
    Number of shells: 48
    Number of basis functions: 140
    Number of Cartesian functions: 162
    Spherical Harmonics?: true
    Max angular momentum: 3

  Cached 100.0% of DFT collocation blocks in 0.034 [GiB].

  Minimum eigenvalue in the overlap matrix is 2.9115324148E-02.
  Reciprocal condition number of the overlap matrix is 1.0647846613E-02.
    Using symmetric orthogonalization.

  ==> Pre-Iterations <==

  SCF Guess: Orbitals guess was supplied from a previous computation.

   -------------------------------------------------------
    Irrep   Nso     Nmo     Nalpha   Nbeta   Ndocc  Nsocc
   -------------------------------------------------------
     A1        14      14       5       5       5       0
     A2         2       2       0       0       0       0
     B1         6       6       1       1       1       0
     B2         6       6       2       2       2       0
   -------------------------------------------------------
    Total      28      28       8       8       8       0
   -------------------------------------------------------

  ==> Iterations <==

                           Total Energy        Delta E     RMS |[F,P]|

   @DF-UKS iter   0:  -174.31506049551319   -1.74315e+02   3.85014e-03 
   @DF-UKS iter   1:  -174.33772229448158   -2.26618e-02   1.46848e-03 DIIS/ADIIS
   @DF-UKS iter   2:  -174.33637678727155    1.34551e-03   4.12314e-03 DIIS/ADIIS/DAMP=1%
   @DF-UKS iter   3:  -174.33735560053228   -9.78813e-04   4.76632e-04 DIIS/ADIIS/DAMP=1%
   @DF-UKS iter   4:  -174.33792217371504   -5.66573e-04   3.54190e-05 DIIS/DAMP=1%
   @DF-UKS iter   5:  -174.33792382095911   -1.64724e-06   6.77414e-06 DIIS/DAMP=1%
   @DF-UKS iter   6:  -174.33791625666481    7.56429e-06   1.22278e-06 DIIS/DAMP=1%
   @DF-UKS iter   7:  -174.33791816266211   -1.90600e-06   3.56002e-08 DIIS/DAMP=1%
   @DF-UKS iter   8:  -174.33791800568412    1.56978e-07   2.08560e-08 DIIS/DAMP=1%
   @DF-UKS iter   9:  -174.33791800880522   -3.12110e-09   1.40376e-09 DIIS/DAMP=1%
  Energy and wave function converged.


  ==> Post-Iterations <==

   Electrons on quadrature grid:
      Nalpha   =    7.9999998628 ; deviation = -1.372e-07
      Nbeta    =    7.9999998628 ; deviation = -1.372e-07
      Ntotal   =   15.9999997255 ; deviation = -2.745e-07 

   @Spin Contamination Metric:   6.217248938E-15
   @S^2 Expected:                0.000000000E+00
   @S^2 Observed:                6.217248938E-15
   @S   Expected:                0.000000000E+00
   @S   Observed:                0.000000000E+00

    Orbital Energies [Eh]
    ---------------------

    Alpha Occupied:                                                       

       1A1   -25.345017     2A1   -19.848977     3A1    -1.911396  
       4A1    -1.389254     5A1    -1.058713     1B1    -1.040221  
       1B2    -1.035432     2B2    -0.780269  

    Alpha Virtual:                                                        

       2B1    -0.702338     6A1    -0.366873     7A1     0.415982  
       3B1     0.442004     3B2     0.459207     8A1     0.689458  
       4B1     0.722060     4B2     0.736065     9A1     0.749821  
      10A1     1.604039     5B1     1.863673     5B2     1.901008  
       1A2     2.001831    11A1     2.006835    12A1     2.370159  
       2A2     2.998044    13A1     2.999050     6B1     3.337889  
       6B2     3.367548    14A1     4.002786  

    Beta Occupied:                                                        

       1A1   -25.345017     2A1   -19.848977     3A1    -1.911396  
       4A1    -1.389254     5A1    -1.058713     1B1    -1.040221  
       1B2    -1.035432     2B2    -0.780269  

    Beta Virtual:                                                         

       2B1    -0.702338     6A1    -0.366873     7A1     0.415982  
       3B1     0.442004     3B2     0.459207     8A1     0.689458  
       4B1     0.722060     4B2     0.736065     9A1     0.749821  
      10A1     1.604039     5B1     1.863673     5B2     1.901008  
       1A2     2.001831    11A1     2.006835    12A1     2.370159  
       2A2     2.998044    13A1     2.999050     6B1     3.337889  
       6B2     3.367548    14A1     4.002786  

    Final Occupation by Irrep:
             A1    A2    B1    B2 
    DOCC [     5,    0,    1,    2 ]
    SOCC [     0,    0,    0,    0 ]
    NA   [     5,    0,    1,    2 ]
    NB   [     5,    0,    1,    2 ]

  @DF-UKS Final Energy:  -174.33791800880522

   => Energetics <=

    Nuclear Repulsion Energy =             31.2788487577758119
    One-Electron Energy =                -295.7129566024514133
    Two-Electron Energy =                 105.0000637236446295
    DFT Exchange-Correlation Energy =     -14.9038738877742514
    Empirical Dispersion Energy =           0.0000000000000000
    VV10 Nonlocal Energy =                  0.0000000000000000
    Total Energy =                       -174.3379180088052181

  UHF NO Occupations:
  HONO-2 :    2 B2 2.0000000
  HONO-1 :    4 A1 2.0000000
  HONO-0 :    5 A1 2.0000000
  LUNO+0 :    6 A1 0.0000000
  LUNO+1 :    7 A1 0.0000000
  LUNO+2 :    3 B2 0.0000000
  LUNO+3 :    2 B1 0.0000000


Computation Completed


Properties will be evaluated at   0.000000,   0.000000,   0.000000 [a0]

Properties computed using the SCF density matrix


 Multipole Moments:

 ------------------------------------------------------------------------------------
     Multipole            Electronic (a.u.)      Nuclear  (a.u.)        Total (a.u.)
 ------------------------------------------------------------------------------------

 L = 1.  Multiply by 2.5417464519 to convert [e a0] to [Debye]
 Dipole X            :          0.0000000            0.0000000            0.0000000
 Dipole Y            :          0.0000000            0.0000000            0.0000000
 Dipole Z            :         -0.3285657            0.5284137            0.1998480
 Magnitude           :                                                    0.1998480

 ------------------------------------------------------------------------------------

*** tstop() called on Joses-MacBook-Pro-2.local at Thu Jul 17 14:01:15 2025
Module time:
	user time   =       2.00 seconds =       0.03 minutes
	system time =       5.56 seconds =       0.09 minutes
	total time  =          0 seconds =       0.00 minutes
Total time:
	user time   =       5.17 seconds =       0.09 minutes
	system time =      13.66 seconds =       0.23 minutes
	total time  =          2 seconds =       0.03 minutes

*** tstart() called on Joses-MacBook-Pro-2.local
*** at Thu Jul 17 14:01:15 2025


         ------------------------------------------------------------
                                   SCF GRAD                          
                          Rob Parrish, Justin Turney,                
                       Andy Simmonett, and Alex Sokolov              
         ------------------------------------------------------------

  ==> Geometry <==

    Molecular point group: c2v
    Full point group: C_inf_v

    Geometry (in Angstrom), charge = 1, multiplicity = 1:

       Center              X                  Y                   Z               Mass       
    ------------   -----------------  -----------------  -----------------  -----------------
         O            0.000000000000     0.000000000000     0.661324858828    15.994914619570
         F            0.000000000000     0.000000000000    -0.556774933248    18.998403162730

  Nuclear repulsion =   31.278848757775812

  ==> Basis Set <==

  Basis Set: CC-PVDZ
    Blend: CC-PVDZ
    Number of shells: 12
    Number of basis functions: 28
    Number of Cartesian functions: 30
    Spherical Harmonics?: true
    Max angular momentum: 2

  ==> DFJKGrad: Density-Fitted SCF Gradients <==

    Gradient:                    1
    J tasked:                  Yes
    K tasked:                  Yes
    wK tasked:                  No
    OpenMP threads:              1
    Integrals threads:           1
    Memory [MiB]:              375
    Schwarz Cutoff:          1E-12
    Fitting Condition:       1E-10

   => Auxiliary Basis Set <=

  Basis Set: (CC-PVDZ AUX)
    Blend: CC-PVDZ-JKFIT
    Number of shells: 48
    Number of basis functions: 140
    Number of Cartesian functions: 162
    Spherical Harmonics?: true
    Max angular momentum: 3

  ==> DFT Potential <==

   => LibXC <=

    Version 6.2.2
    S. Lehtola, C. Steigemann, M. J.T. Oliveira, and M. A.L. Marques.,  SoftwareX 7, 1–5 (2018) (10.1016/j.softx.2017.11.002)

   => Composite Functional: B3LYP <= 

    B3LYP Hyb-GGA Exchange-Correlation Functional

    P. J. Stephens, F. J. Devlin, C. F. Chabalowski, and M. J. Frisch.,  J. Phys. Chem. 98, 11623 (1994) (10.1021/j100096a001)

    Deriv               =              1
    GGA                 =           TRUE
    Meta                =          FALSE

    Exchange Hybrid     =           TRUE
    MP2 Hybrid          =          FALSE

   => Exchange Functionals <=

    0.0800   Slater exchange
    0.7200         Becke 88

   => Exact (HF) Exchange <=

    0.2000               HF 

   => Correlation Functionals <=

    0.1900   Vosko, Wilk & Nusair (VWN5_RPA)
    0.8100   Lee, Yang & Parr

   => LibXC Density Thresholds  <==

    XC_HYB_GGA_XC_B3LYP:  1.00E-15 

   => Molecular Quadrature <=

    Radial Scheme          =       TREUTLER
    Pruning Scheme         =           NONE
    Nuclear Scheme         =       TREUTLER

    Blocking Scheme        =         OCTREE
    BS radius alpha        =              1
    Pruning alpha          =              1
    Radial Points          =             75
    Spherical Points       =            302
    Total Points           =          42012
    Total Blocks           =            367
    Max Points             =            252
    Max Functions          =             28
    Weights Tolerance      =       1.00E-15


  -Total Gradient:
     Atom            X                  Y                   Z
    ------   -----------------  -----------------  -----------------
       1       -0.000000000000     0.000000000000    -0.010651662804
       2       -0.000000000000     0.000000000000     0.010655932291


*** tstop() called on Joses-MacBook-Pro-2.local at Thu Jul 17 14:01:16 2025
Module time:
	user time   =       0.55 seconds =       0.01 minutes
	system time =       1.22 seconds =       0.02 minutes
	total time  =          1 seconds =       0.02 minutes
Total time:
	user time   =       5.72 seconds =       0.10 minutes
	system time =      14.88 seconds =       0.25 minutes
	total time  =          3 seconds =       0.05 minutes

    			-----------------------------------------

    			 OPTKING 3.0: for geometry optimizations 

    			     By R.A. King, Bethel University     

    			        with contributions from          

    			    A.V. Copan, J. Cayton, A. Heide      

    			-----------------------------------------

    
	                            ===> Fragment 1 <== 

	 Z (Atomic Numbers)          Masses                          Geom                  
	       8.000000            15.994915          0.00000000  0.00000000  1.24972286   
	       9.000000            18.998403          0.00000000  0.00000000 -1.05215214   

	 - Coordinate -           - BOHR/RAD -       - ANG/DEG -
	 R(1,2)           =         2.301875           1.218100


	        --- Internal Coordinate Step in ANG or DEG, aJ/ANG or AJ/DEG ---
	-------------------------------------------------------------------------------
	           Coordinate      Previous         Force          Change          New 
	           ----------      --------        ------          ------        ------
	               R(1,2)       1.21810        0.08777        0.00764       1.22574
	-------------------------------------------------------------------------------

	                                 ==> Convergence Check <==                                  
    
	Measures of convergence in internal coordinates in au.
    
	Criteria marked as inactive (o), active & met (*), and active & unmet ( ).

	----------------------------------------------------------------------------------------------
	   Step    Total Energy     Delta E     Max Force     RMS Force      Max Disp      RMS Disp   
	----------------------------------------------------------------------------------------------
	  Convergence Criteria     1.00e-06 *    3.00e-04 *             o    1.20e-03 *             o
	----------------------------------------------------------------------------------------------
	     2    -174.33791801   -7.87e-04      1.07e-02      1.07e-02 o    1.44e-02      1.44e-02 o  ~
	----------------------------------------------------------------------------------------------

Next Geometry in Ang 
	Fragment 1 (Ang)

	    O   0.0000000000   0.0000000000   0.6651437932
	    F   0.0000000000   0.0000000000  -0.5605938676


    Structure for next step:
    Molecular point group: c2v
    Full point group: C_inf_v

    Geometry (in Angstrom), charge = 1, multiplicity = 1:

    O            0.000000000000     0.000000000000     0.665471573670
    F            0.000000000000     0.000000000000    -0.560266087177


Scratch directory: /tmp/
gradient() will perform analytic gradient computation.
   => Libint2 <=

    Primary   basis highest AM E, G, H:  6, 6, 3
    Auxiliary basis highest AM E, G, H:  7, 7, 4
    Onebody   basis highest AM E, G, H:  -, -, -
    Solid Harmonics ordering:            Gaussian

*** tstart() called on Joses-MacBook-Pro-2.local
*** at Thu Jul 17 14:01:16 2025

   => Loading Basis Set <=

    Name: CC-PVDZ
    Role: ORBITAL
    Keyword: BASIS
    atoms 1 entry O          line   198 file /Users/joseantoniorodriguesromero/anaconda3/share/psi4/basis/cc-pvdz.gbs 
    atoms 2 entry F          line   228 file /Users/joseantoniorodriguesromero/anaconda3/share/psi4/basis/cc-pvdz.gbs 


         ---------------------------------------------------------
                                   SCF
               by Justin Turney, Rob Parrish, Andy Simmonett
                          and Daniel G. A. Smith
                              UKS Reference
                        1 Threads,    500 MiB Core
         ---------------------------------------------------------

  ==> Geometry <==

    Molecular point group: c2v
    Full point group: C_inf_v

    Geometry (in Angstrom), charge = 1, multiplicity = 1:

       Center              X                  Y                   Z               Mass       
    ------------   -----------------  -----------------  -----------------  -----------------
         O            0.000000000000     0.000000000000     0.665471573670    15.994914619570
         F            0.000000000000     0.000000000000    -0.560266087177    18.998403162730

  Running in c2v symmetry.

  Rotational constants: A = ************  B =      1.29207  C =      1.29207 [cm^-1]
  Rotational constants: A = ************  B =  38735.41688  C =  38735.41688 [MHz]
  Nuclear repulsion =   31.083942661849054

  Charge       = 1
  Multiplicity = 1
  Electrons    = 16
  Nalpha       = 8
  Nbeta        = 8

  ==> Algorithm <==

  SCF Algorithm Type is DF.
  DIIS enabled.
  MOM disabled.
  Fractional occupation disabled.
  Guess Type is READ.
  Energy threshold   = 1.00e-08
  Density threshold  = 1.00e-08
  Integral threshold = 1.00e-12

  ==> Primary Basis <==

  Basis Set: CC-PVDZ
    Blend: CC-PVDZ
    Number of shells: 12
    Number of basis functions: 28
    Number of Cartesian functions: 30
    Spherical Harmonics?: true
    Max angular momentum: 2

  ==> DFT Potential <==

   => LibXC <=

    Version 6.2.2
    S. Lehtola, C. Steigemann, M. J.T. Oliveira, and M. A.L. Marques.,  SoftwareX 7, 1–5 (2018) (10.1016/j.softx.2017.11.002)

   => Composite Functional: B3LYP <= 

    B3LYP Hyb-GGA Exchange-Correlation Functional

    P. J. Stephens, F. J. Devlin, C. F. Chabalowski, and M. J. Frisch.,  J. Phys. Chem. 98, 11623 (1994) (10.1021/j100096a001)

    Deriv               =              1
    GGA                 =           TRUE
    Meta                =          FALSE

    Exchange Hybrid     =           TRUE
    MP2 Hybrid          =          FALSE

   => Exchange Functionals <=

    0.0800   Slater exchange
    0.7200         Becke 88

   => Exact (HF) Exchange <=

    0.2000               HF 

   => Correlation Functionals <=

    0.1900   Vosko, Wilk & Nusair (VWN5_RPA)
    0.8100   Lee, Yang & Parr

   => LibXC Density Thresholds  <==

    XC_HYB_GGA_XC_B3LYP:  1.00E-15 

   => Molecular Quadrature <=

    Radial Scheme          =       TREUTLER
    Pruning Scheme         =           NONE
    Nuclear Scheme         =       TREUTLER

    Blocking Scheme        =         OCTREE
    BS radius alpha        =              1
    Pruning alpha          =              1
    Radial Points          =             75
    Spherical Points       =            302
    Total Points           =          42012
    Total Blocks           =            366
    Max Points             =            253
    Max Functions          =             28
    Weights Tolerance      =       1.00E-15

   => Loading Basis Set <=

    Name: (CC-PVDZ AUX)
    Role: JKFIT
    Keyword: DF_BASIS_SCF
    atoms 1 entry O          line   221 file /Users/joseantoniorodriguesromero/anaconda3/share/psi4/basis/cc-pvdz-jkfit.gbs 
    atoms 2 entry F          line   271 file /Users/joseantoniorodriguesromero/anaconda3/share/psi4/basis/cc-pvdz-jkfit.gbs 

   => Loading Basis Set <=

    Name: CC-PVDZ
    Role: ORBITAL
    Keyword: BASIS
    atoms 1 entry O          line   198 file /Users/joseantoniorodriguesromero/anaconda3/share/psi4/basis/cc-pvdz.gbs 
    atoms 2 entry F          line   228 file /Users/joseantoniorodriguesromero/anaconda3/share/psi4/basis/cc-pvdz.gbs 

  Reading orbitals from file /tmp/singlet_OF.default.74537.180.npy, no projection.

  ==> Integral Setup <==

  DFHelper Memory: AOs need 0.001 GiB; user supplied 0.333 GiB. 
  Using in-core AOs.

  ==> MemDFJK: Density-Fitted J/K Matrices <==

    J tasked:                   Yes
    K tasked:                   Yes
    wK tasked:                   No
    OpenMP threads:               1
    Memory [MiB]:               340
    Algorithm:                 Core
    Schwarz Cutoff:           1E-12
    Mask sparsity (%):       0.0000
    Fitting Condition:        1E-10

   => Auxiliary Basis Set <=

  Basis Set: (CC-PVDZ AUX)
    Blend: CC-PVDZ-JKFIT
    Number of shells: 48
    Number of basis functions: 140
    Number of Cartesian functions: 162
    Spherical Harmonics?: true
    Max angular momentum: 3

  Cached 100.0% of DFT collocation blocks in 0.034 [GiB].

  Minimum eigenvalue in the overlap matrix is 2.9764017402E-02.
  Reciprocal condition number of the overlap matrix is 1.0918097833E-02.
    Using symmetric orthogonalization.

  ==> Pre-Iterations <==

  SCF Guess: Orbitals guess was supplied from a previous computation.

   -------------------------------------------------------
    Irrep   Nso     Nmo     Nalpha   Nbeta   Ndocc  Nsocc
   -------------------------------------------------------
     A1        14      14       5       5       5       0
     A2         2       2       0       0       0       0
     B1         6       6       1       1       1       0
     B2         6       6       2       2       2       0
   -------------------------------------------------------
    Total      28      28       8       8       8       0
   -------------------------------------------------------

  ==> Iterations <==

                           Total Energy        Delta E     RMS |[F,P]|

   @DF-UKS iter   0:  -174.32867344233813   -1.74329e+02   1.57735e-03 
   @DF-UKS iter   1:  -174.33796792506061   -9.29448e-03   6.04193e-04 DIIS/ADIIS
   @DF-UKS iter   2:  -174.33773472334971    2.33202e-04   1.70991e-03 DIIS/ADIIS/DAMP=1%
   @DF-UKS iter   3:  -174.33777727029599   -4.25469e-05   1.63715e-04 DIIS/ADIIS/DAMP=1%
   @DF-UKS iter   4:  -174.33799904989823   -2.21780e-04   1.73969e-05 DIIS/DAMP=1%
   @DF-UKS iter   5:  -174.33800316876304   -4.11886e-06   2.88912e-06 DIIS/DAMP=1%
   @DF-UKS iter   6:  -174.33800039596181    2.77280e-06   4.42362e-07 DIIS/DAMP=1%
   @DF-UKS iter   7:  -174.33800118409425   -7.88132e-07   1.06773e-08 DIIS/DAMP=1%
   @DF-UKS iter   8:  -174.33800112272198    6.13723e-08   8.39464e-09 DIIS/DAMP=1%
   @DF-UKS iter   9:  -174.33800112427141   -1.54944e-09   5.13978e-10 DIIS/DAMP=1%
  Energy and wave function converged.


  ==> Post-Iterations <==

   Electrons on quadrature grid:
      Nalpha   =    7.9999998921 ; deviation = -1.079e-07
      Nbeta    =    7.9999998921 ; deviation = -1.079e-07
      Ntotal   =   15.9999997842 ; deviation = -2.158e-07 

   @Spin Contamination Metric:   0.000000000E+00
   @S^2 Expected:                0.000000000E+00
   @S^2 Observed:                0.000000000E+00
   @S   Expected:                0.000000000E+00
   @S   Observed:                0.000000000E+00

    Orbital Energies [Eh]
    ---------------------

    Alpha Occupied:                                                       

       1A1   -25.343742     2A1   -19.850098     3A1    -1.904137  
       4A1    -1.390592     5A1    -1.057300     1B1    -1.036452  
       1B2    -1.031909     2B2    -0.782011  

    Alpha Virtual:                                                        

       2B1    -0.704178     6A1    -0.376381     7A1     0.417644  
       3B1     0.441885     3B2     0.459043     8A1     0.690920  
       4B1     0.722454     4B2     0.736425     9A1     0.753817  
      10A1     1.598523     5B1     1.867440     5B2     1.904697  
       1A2     2.003008    11A1     2.008000    12A1     2.354235  
       2A2     2.999254    13A1     3.000245     6B1     3.326591  
       6B2     3.356001    14A1     3.997939  

    Beta Occupied:                                                        

       1A1   -25.343742     2A1   -19.850098     3A1    -1.904137  
       4A1    -1.390592     5A1    -1.057300     1B1    -1.036452  
       1B2    -1.031909     2B2    -0.782011  

    Beta Virtual:                                                         

       2B1    -0.704178     6A1    -0.376381     7A1     0.417644  
       3B1     0.441885     3B2     0.459043     8A1     0.690920  
       4B1     0.722454     4B2     0.736425     9A1     0.753817  
      10A1     1.598523     5B1     1.867440     5B2     1.904697  
       1A2     2.003008    11A1     2.008000    12A1     2.354235  
       2A2     2.999254    13A1     3.000245     6B1     3.326591  
       6B2     3.356001    14A1     3.997939  

    Final Occupation by Irrep:
             A1    A2    B1    B2 
    DOCC [     5,    0,    1,    2 ]
    SOCC [     0,    0,    0,    0 ]
    NA   [     5,    0,    1,    2 ]
    NB   [     5,    0,    1,    2 ]

  @DF-UKS Final Energy:  -174.33800112427141

   => Energetics <=

    Nuclear Repulsion Energy =             31.0839426618490542
    One-Electron Energy =                -295.3526355512036616
    Two-Electron Energy =                 104.8296378097548711
    DFT Exchange-Correlation Energy =     -14.8989460446716677
    Empirical Dispersion Energy =           0.0000000000000000
    VV10 Nonlocal Energy =                  0.0000000000000000
    Total Energy =                       -174.3380011242714147

  UHF NO Occupations:
  HONO-2 :    3 A1 2.0000000
  HONO-1 :    4 A1 2.0000000
  HONO-0 :    5 A1 2.0000000
  LUNO+0 :    6 A1 0.0000000
  LUNO+1 :    7 A1 0.0000000
  LUNO+2 :    8 A1 0.0000000
  LUNO+3 :    9 A1 0.0000000


Computation Completed


Properties will be evaluated at   0.000000,   0.000000,   0.000000 [a0]

Properties computed using the SCF density matrix


 Multipole Moments:

 ------------------------------------------------------------------------------------
     Multipole            Electronic (a.u.)      Nuclear  (a.u.)        Total (a.u.)
 ------------------------------------------------------------------------------------

 L = 1.  Multiply by 2.5417464519 to convert [e a0] to [Debye]
 Dipole X            :          0.0000000            0.0000000            0.0000000
 Dipole Y            :          0.0000000            0.0000000            0.0000000
 Dipole Z            :         -0.3233760            0.5317270            0.2083510
 Magnitude           :                                                    0.2083510

 ------------------------------------------------------------------------------------

*** tstop() called on Joses-MacBook-Pro-2.local at Thu Jul 17 14:01:16 2025
Module time:
	user time   =       1.79 seconds =       0.03 minutes
	system time =       4.72 seconds =       0.08 minutes
	total time  =          0 seconds =       0.00 minutes
Total time:
	user time   =       7.55 seconds =       0.13 minutes
	system time =      19.83 seconds =       0.33 minutes
	total time  =          3 seconds =       0.05 minutes

*** tstart() called on Joses-MacBook-Pro-2.local
*** at Thu Jul 17 14:01:16 2025


         ------------------------------------------------------------
                                   SCF GRAD                          
                          Rob Parrish, Justin Turney,                
                       Andy Simmonett, and Alex Sokolov              
         ------------------------------------------------------------

  ==> Geometry <==

    Molecular point group: c2v
    Full point group: C_inf_v

    Geometry (in Angstrom), charge = 1, multiplicity = 1:

       Center              X                  Y                   Z               Mass       
    ------------   -----------------  -----------------  -----------------  -----------------
         O            0.000000000000     0.000000000000     0.665471573670    15.994914619570
         F            0.000000000000     0.000000000000    -0.560266087177    18.998403162730

  Nuclear repulsion =   31.083942661849054

  ==> Basis Set <==

  Basis Set: CC-PVDZ
    Blend: CC-PVDZ
    Number of shells: 12
    Number of basis functions: 28
    Number of Cartesian functions: 30
    Spherical Harmonics?: true
    Max angular momentum: 2

  ==> DFJKGrad: Density-Fitted SCF Gradients <==

    Gradient:                    1
    J tasked:                  Yes
    K tasked:                  Yes
    wK tasked:                  No
    OpenMP threads:              1
    Integrals threads:           1
    Memory [MiB]:              375
    Schwarz Cutoff:          1E-12
    Fitting Condition:       1E-10

   => Auxiliary Basis Set <=

  Basis Set: (CC-PVDZ AUX)
    Blend: CC-PVDZ-JKFIT
    Number of shells: 48
    Number of basis functions: 140
    Number of Cartesian functions: 162
    Spherical Harmonics?: true
    Max angular momentum: 3

  ==> DFT Potential <==

   => LibXC <=

    Version 6.2.2
    S. Lehtola, C. Steigemann, M. J.T. Oliveira, and M. A.L. Marques.,  SoftwareX 7, 1–5 (2018) (10.1016/j.softx.2017.11.002)

   => Composite Functional: B3LYP <= 

    B3LYP Hyb-GGA Exchange-Correlation Functional

    P. J. Stephens, F. J. Devlin, C. F. Chabalowski, and M. J. Frisch.,  J. Phys. Chem. 98, 11623 (1994) (10.1021/j100096a001)

    Deriv               =              1
    GGA                 =           TRUE
    Meta                =          FALSE

    Exchange Hybrid     =           TRUE
    MP2 Hybrid          =          FALSE

   => Exchange Functionals <=

    0.0800   Slater exchange
    0.7200         Becke 88

   => Exact (HF) Exchange <=

    0.2000               HF 

   => Correlation Functionals <=

    0.1900   Vosko, Wilk & Nusair (VWN5_RPA)
    0.8100   Lee, Yang & Parr

   => LibXC Density Thresholds  <==

    XC_HYB_GGA_XC_B3LYP:  1.00E-15 

   => Molecular Quadrature <=

    Radial Scheme          =       TREUTLER
    Pruning Scheme         =           NONE
    Nuclear Scheme         =       TREUTLER

    Blocking Scheme        =         OCTREE
    BS radius alpha        =              1
    Pruning alpha          =              1
    Radial Points          =             75
    Spherical Points       =            302
    Total Points           =          42012
    Total Blocks           =            366
    Max Points             =            253
    Max Functions          =             28
    Weights Tolerance      =       1.00E-15


  -Total Gradient:
     Atom            X                  Y                   Z
    ------   -----------------  -----------------  -----------------
       1       -0.000000000000     0.000000000000    -0.000949861165
       2       -0.000000000000    -0.000000000000     0.000953667887


*** tstop() called on Joses-MacBook-Pro-2.local at Thu Jul 17 14:01:16 2025
Module time:
	user time   =       0.40 seconds =       0.01 minutes
	system time =       1.32 seconds =       0.02 minutes
	total time  =          0 seconds =       0.00 minutes
Total time:
	user time   =       7.95 seconds =       0.13 minutes
	system time =      21.16 seconds =       0.35 minutes
	total time  =          3 seconds =       0.05 minutes

    			-----------------------------------------

    			 OPTKING 3.0: for geometry optimizations 

    			     By R.A. King, Bethel University     

    			        with contributions from          

    			    A.V. Copan, J. Cayton, A. Heide      

    			-----------------------------------------

    
	                            ===> Fragment 1 <== 

	 Z (Atomic Numbers)          Masses                          Geom                  
	       8.000000            15.994915          0.00000000  0.00000000  1.25755902   
	       9.000000            18.998403          0.00000000  0.00000000 -1.05874946   

	 - Coordinate -           - BOHR/RAD -       - ANG/DEG -
	 R(1,2)           =         2.316308           1.225738


	        --- Internal Coordinate Step in ANG or DEG, aJ/ANG or AJ/DEG ---
	-------------------------------------------------------------------------------
	           Coordinate      Previous         Force          Change          New 
	           ----------      --------        ------          ------        ------
	               R(1,2)       1.22574        0.00784        0.00070       1.22644
	-------------------------------------------------------------------------------

	                                 ==> Convergence Check <==                                  
    
	Measures of convergence in internal coordinates in au.
    
	Criteria marked as inactive (o), active & met (*), and active & unmet ( ).

	----------------------------------------------------------------------------------------------
	   Step    Total Energy     Delta E     Max Force     RMS Force      Max Disp      RMS Disp   
	----------------------------------------------------------------------------------------------
	  Convergence Criteria     1.00e-06 *    3.00e-04 *             o    1.20e-03 *             o
	----------------------------------------------------------------------------------------------
	     3    -174.33800112   -8.31e-05      9.52e-04      9.52e-04 o    1.32e-03      1.32e-03 o  ~
	----------------------------------------------------------------------------------------------

Next Geometry in Ang 
	Fragment 1 (Ang)

	    O   0.0000000000   0.0000000000   0.6658220840
	    F   0.0000000000   0.0000000000  -0.5606165976


    Structure for next step:
    Molecular point group: c2v
    Full point group: C_inf_v

    Geometry (in Angstrom), charge = 1, multiplicity = 1:

    O            0.000000000000     0.000000000000     0.665852168473
    F            0.000000000000     0.000000000000    -0.560586513128


Scratch directory: /tmp/
gradient() will perform analytic gradient computation.
   => Libint2 <=

    Primary   basis highest AM E, G, H:  6, 6, 3
    Auxiliary basis highest AM E, G, H:  7, 7, 4
    Onebody   basis highest AM E, G, H:  -, -, -
    Solid Harmonics ordering:            Gaussian

*** tstart() called on Joses-MacBook-Pro-2.local
*** at Thu Jul 17 14:01:16 2025

   => Loading Basis Set <=

    Name: CC-PVDZ
    Role: ORBITAL
    Keyword: BASIS
    atoms 1 entry O          line   198 file /Users/joseantoniorodriguesromero/anaconda3/share/psi4/basis/cc-pvdz.gbs 
    atoms 2 entry F          line   228 file /Users/joseantoniorodriguesromero/anaconda3/share/psi4/basis/cc-pvdz.gbs 


         ---------------------------------------------------------
                                   SCF
               by Justin Turney, Rob Parrish, Andy Simmonett
                          and Daniel G. A. Smith
                              UKS Reference
                        1 Threads,    500 MiB Core
         ---------------------------------------------------------

  ==> Geometry <==

    Molecular point group: c2v
    Full point group: C_inf_v

    Geometry (in Angstrom), charge = 1, multiplicity = 1:

       Center              X                  Y                   Z               Mass       
    ------------   -----------------  -----------------  -----------------  -----------------
         O            0.000000000000     0.000000000000     0.665852168473    15.994914619570
         F            0.000000000000     0.000000000000    -0.560586513128    18.998403162730

  Running in c2v symmetry.

  Rotational constants: A = ************  B =      1.29060  C =      1.29060 [cm^-1]
  Rotational constants: A = ************  B =  38691.14794  C =  38691.14794 [MHz]
  Nuclear repulsion =   31.066175374136684

  Charge       = 1
  Multiplicity = 1
  Electrons    = 16
  Nalpha       = 8
  Nbeta        = 8

  ==> Algorithm <==

  SCF Algorithm Type is DF.
  DIIS enabled.
  MOM disabled.
  Fractional occupation disabled.
  Guess Type is READ.
  Energy threshold   = 1.00e-08
  Density threshold  = 1.00e-08
  Integral threshold = 1.00e-12

  ==> Primary Basis <==

  Basis Set: CC-PVDZ
    Blend: CC-PVDZ
    Number of shells: 12
    Number of basis functions: 28
    Number of Cartesian functions: 30
    Spherical Harmonics?: true
    Max angular momentum: 2

  ==> DFT Potential <==

   => LibXC <=

    Version 6.2.2
    S. Lehtola, C. Steigemann, M. J.T. Oliveira, and M. A.L. Marques.,  SoftwareX 7, 1–5 (2018) (10.1016/j.softx.2017.11.002)

   => Composite Functional: B3LYP <= 

    B3LYP Hyb-GGA Exchange-Correlation Functional

    P. J. Stephens, F. J. Devlin, C. F. Chabalowski, and M. J. Frisch.,  J. Phys. Chem. 98, 11623 (1994) (10.1021/j100096a001)

    Deriv               =              1
    GGA                 =           TRUE
    Meta                =          FALSE

    Exchange Hybrid     =           TRUE
    MP2 Hybrid          =          FALSE

   => Exchange Functionals <=

    0.0800   Slater exchange
    0.7200         Becke 88

   => Exact (HF) Exchange <=

    0.2000               HF 

   => Correlation Functionals <=

    0.1900   Vosko, Wilk & Nusair (VWN5_RPA)
    0.8100   Lee, Yang & Parr

   => LibXC Density Thresholds  <==

    XC_HYB_GGA_XC_B3LYP:  1.00E-15 

   => Molecular Quadrature <=

    Radial Scheme          =       TREUTLER
    Pruning Scheme         =           NONE
    Nuclear Scheme         =       TREUTLER

    Blocking Scheme        =         OCTREE
    BS radius alpha        =              1
    Pruning alpha          =              1
    Radial Points          =             75
    Spherical Points       =            302
    Total Points           =          42012
    Total Blocks           =            366
    Max Points             =            254
    Max Functions          =             28
    Weights Tolerance      =       1.00E-15

   => Loading Basis Set <=

    Name: (CC-PVDZ AUX)
    Role: JKFIT
    Keyword: DF_BASIS_SCF
    atoms 1 entry O          line   221 file /Users/joseantoniorodriguesromero/anaconda3/share/psi4/basis/cc-pvdz-jkfit.gbs 
    atoms 2 entry F          line   271 file /Users/joseantoniorodriguesromero/anaconda3/share/psi4/basis/cc-pvdz-jkfit.gbs 

   => Loading Basis Set <=

    Name: CC-PVDZ
    Role: ORBITAL
    Keyword: BASIS
    atoms 1 entry O          line   198 file /Users/joseantoniorodriguesromero/anaconda3/share/psi4/basis/cc-pvdz.gbs 
    atoms 2 entry F          line   228 file /Users/joseantoniorodriguesromero/anaconda3/share/psi4/basis/cc-pvdz.gbs 

  Reading orbitals from file /tmp/singlet_OF.default.74537.180.npy, no projection.

  ==> Integral Setup <==

  DFHelper Memory: AOs need 0.001 GiB; user supplied 0.333 GiB. 
  Using in-core AOs.

  ==> MemDFJK: Density-Fitted J/K Matrices <==

    J tasked:                   Yes
    K tasked:                   Yes
    wK tasked:                   No
    OpenMP threads:               1
    Memory [MiB]:               340
    Algorithm:                 Core
    Schwarz Cutoff:           1E-12
    Mask sparsity (%):       0.0000
    Fitting Condition:        1E-10

   => Auxiliary Basis Set <=

  Basis Set: (CC-PVDZ AUX)
    Blend: CC-PVDZ-JKFIT
    Number of shells: 48
    Number of basis functions: 140
    Number of Cartesian functions: 162
    Spherical Harmonics?: true
    Max angular momentum: 3

  Cached 100.0% of DFT collocation blocks in 0.034 [GiB].

  Minimum eigenvalue in the overlap matrix is 2.9824175143E-02.
  Reciprocal condition number of the overlap matrix is 1.0943211784E-02.
    Using symmetric orthogonalization.

  ==> Pre-Iterations <==

  SCF Guess: Orbitals guess was supplied from a previous computation.

   -------------------------------------------------------
    Irrep   Nso     Nmo     Nalpha   Nbeta   Ndocc  Nsocc
   -------------------------------------------------------
     A1        14      14       5       5       5       0
     A2         2       2       0       0       0       0
     B1         6       6       1       1       1       0
     B2         6       6       2       2       2       0
   -------------------------------------------------------
    Total      28      28       8       8       8       0
   -------------------------------------------------------

  ==> Iterations <==

                           Total Energy        Delta E     RMS |[F,P]|

   @DF-UKS iter   0:  -174.33715324910784   -1.74337e+02   1.43553e-04 
   @DF-UKS iter   1:  -174.33800153848745   -8.48289e-04   5.48096e-05 DIIS
   @DF-UKS iter   2:  -174.33799964053674    1.89795e-06   1.54234e-04 DIIS/ADIIS/DAMP=1%
   @DF-UKS iter   3:  -174.33798201986542    1.76207e-05   1.29757e-05 DIIS/DAMP=1%
   @DF-UKS iter   4:  -174.33800136562735   -1.93458e-05   1.62008e-06 DIIS/DAMP=1%
   @DF-UKS iter   5:  -174.33800199303701   -6.27410e-07   2.63617e-07 DIIS/DAMP=1%
   @DF-UKS iter   6:  -174.33800174479890    2.48238e-07   3.55948e-08 DIIS/DAMP=1%
   @DF-UKS iter   7:  -174.33800181670082   -7.19019e-08   7.39513e-10 DIIS/DAMP=1%
   @DF-UKS iter   8:  -174.33800181145753    5.24329e-09   7.25901e-10 DIIS/DAMP=1%
  Energy and wave function converged.


  ==> Post-Iterations <==

   Electrons on quadrature grid:
      Nalpha   =    7.9999998950 ; deviation = -1.050e-07
      Nbeta    =    7.9999998950 ; deviation = -1.050e-07
      Ntotal   =   15.9999997899 ; deviation = -2.101e-07 

   @Spin Contamination Metric:  -3.552713679E-15
   @S^2 Expected:                0.000000000E+00
   @S^2 Observed:               -3.552713679E-15
   @S   Expected:                0.000000000E+00
   @S   Observed:                0.000000000E+00

    Orbital Energies [Eh]
    ---------------------

    Alpha Occupied:                                                       

       1A1   -25.343625     2A1   -19.850200     3A1    -1.903477  
       4A1    -1.390715     5A1    -1.057169     1B1    -1.036110  
       1B2    -1.031588     2B2    -0.782168  

    Alpha Virtual:                                                        

       2B1    -0.704344     6A1    -0.377242     7A1     0.417798  
       3B1     0.441872     3B2     0.459027     8A1     0.691055  
       4B1     0.722490     4B2     0.736458     9A1     0.754183  
      10A1     1.598017     5B1     1.867791     5B2     1.905041  
       1A2     2.003113    11A1     2.008105    12A1     2.352795  
       2A2     2.999367    13A1     3.000357     6B1     3.325566  
       6B2     3.354952    14A1     3.997480  

    Beta Occupied:                                                        

       1A1   -25.343625     2A1   -19.850200     3A1    -1.903477  
       4A1    -1.390715     5A1    -1.057169     1B1    -1.036110  
       1B2    -1.031588     2B2    -0.782168  

    Beta Virtual:                                                         

       2B1    -0.704344     6A1    -0.377242     7A1     0.417798  
       3B1     0.441872     3B2     0.459027     8A1     0.691055  
       4B1     0.722490     4B2     0.736458     9A1     0.754183  
      10A1     1.598017     5B1     1.867791     5B2     1.905041  
       1A2     2.003113    11A1     2.008105    12A1     2.352795  
       2A2     2.999367    13A1     3.000357     6B1     3.325566  
       6B2     3.354952    14A1     3.997480  

    Final Occupation by Irrep:
             A1    A2    B1    B2 
    DOCC [     5,    0,    1,    2 ]
    SOCC [     0,    0,    0,    0 ]
    NA   [     5,    0,    1,    2 ]
    NB   [     5,    0,    1,    2 ]

  @DF-UKS Final Energy:  -174.33800181145753

   => Energetics <=

    Nuclear Repulsion Energy =             31.0661753741366837
    One-Electron Energy =                -295.3197739771163697
    Two-Electron Energy =                 104.8140956435897522
    DFT Exchange-Correlation Energy =     -14.8984988520675774
    Empirical Dispersion Energy =           0.0000000000000000
    VV10 Nonlocal Energy =                  0.0000000000000000
    Total Energy =                       -174.3380018114575307

  UHF NO Occupations:
  HONO-2 :    2 B2 2.0000000
  HONO-1 :    4 A1 2.0000000
  HONO-0 :    5 A1 2.0000000
  LUNO+0 :    6 A1 0.0000000
  LUNO+1 :    3 B2 0.0000000
  LUNO+2 :    7 A1 0.0000000
  LUNO+3 :    4 B2 0.0000000


Computation Completed


Properties will be evaluated at   0.000000,   0.000000,   0.000000 [a0]

Properties computed using the SCF density matrix


 Multipole Moments:

 ------------------------------------------------------------------------------------
     Multipole            Electronic (a.u.)      Nuclear  (a.u.)        Total (a.u.)
 ------------------------------------------------------------------------------------

 L = 1.  Multiply by 2.5417464519 to convert [e a0] to [Debye]
 Dipole X            :          0.0000000            0.0000000            0.0000000
 Dipole Y            :          0.0000000            0.0000000            0.0000000
 Dipole Z            :         -0.3229028            0.5320311            0.2091283
 Magnitude           :                                                    0.2091283

 ------------------------------------------------------------------------------------

*** tstop() called on Joses-MacBook-Pro-2.local at Thu Jul 17 14:01:17 2025
Module time:
	user time   =       1.71 seconds =       0.03 minutes
	system time =       4.33 seconds =       0.07 minutes
	total time  =          1 seconds =       0.02 minutes
Total time:
	user time   =       9.70 seconds =       0.16 minutes
	system time =      25.72 seconds =       0.43 minutes
	total time  =          4 seconds =       0.07 minutes

*** tstart() called on Joses-MacBook-Pro-2.local
*** at Thu Jul 17 14:01:17 2025


         ------------------------------------------------------------
                                   SCF GRAD                          
                          Rob Parrish, Justin Turney,                
                       Andy Simmonett, and Alex Sokolov              
         ------------------------------------------------------------

  ==> Geometry <==

    Molecular point group: c2v
    Full point group: C_inf_v

    Geometry (in Angstrom), charge = 1, multiplicity = 1:

       Center              X                  Y                   Z               Mass       
    ------------   -----------------  -----------------  -----------------  -----------------
         O            0.000000000000     0.000000000000     0.665852168473    15.994914619570
         F            0.000000000000     0.000000000000    -0.560586513128    18.998403162730

  Nuclear repulsion =   31.066175374136684

  ==> Basis Set <==

  Basis Set: CC-PVDZ
    Blend: CC-PVDZ
    Number of shells: 12
    Number of basis functions: 28
    Number of Cartesian functions: 30
    Spherical Harmonics?: true
    Max angular momentum: 2

  ==> DFJKGrad: Density-Fitted SCF Gradients <==

    Gradient:                    1
    J tasked:                  Yes
    K tasked:                  Yes
    wK tasked:                  No
    OpenMP threads:              1
    Integrals threads:           1
    Memory [MiB]:              375
    Schwarz Cutoff:          1E-12
    Fitting Condition:       1E-10

   => Auxiliary Basis Set <=

  Basis Set: (CC-PVDZ AUX)
    Blend: CC-PVDZ-JKFIT
    Number of shells: 48
    Number of basis functions: 140
    Number of Cartesian functions: 162
    Spherical Harmonics?: true
    Max angular momentum: 3

  ==> DFT Potential <==

   => LibXC <=

    Version 6.2.2
    S. Lehtola, C. Steigemann, M. J.T. Oliveira, and M. A.L. Marques.,  SoftwareX 7, 1–5 (2018) (10.1016/j.softx.2017.11.002)

   => Composite Functional: B3LYP <= 

    B3LYP Hyb-GGA Exchange-Correlation Functional

    P. J. Stephens, F. J. Devlin, C. F. Chabalowski, and M. J. Frisch.,  J. Phys. Chem. 98, 11623 (1994) (10.1021/j100096a001)

    Deriv               =              1
    GGA                 =           TRUE
    Meta                =          FALSE

    Exchange Hybrid     =           TRUE
    MP2 Hybrid          =          FALSE

   => Exchange Functionals <=

    0.0800   Slater exchange
    0.7200         Becke 88

   => Exact (HF) Exchange <=

    0.2000               HF 

   => Correlation Functionals <=

    0.1900   Vosko, Wilk & Nusair (VWN5_RPA)
    0.8100   Lee, Yang & Parr

   => LibXC Density Thresholds  <==

    XC_HYB_GGA_XC_B3LYP:  1.00E-15 

   => Molecular Quadrature <=

    Radial Scheme          =       TREUTLER
    Pruning Scheme         =           NONE
    Nuclear Scheme         =       TREUTLER

    Blocking Scheme        =         OCTREE
    BS radius alpha        =              1
    Pruning alpha          =              1
    Radial Points          =             75
    Spherical Points       =            302
    Total Points           =          42012
    Total Blocks           =            366
    Max Points             =            254
    Max Functions          =             28
    Weights Tolerance      =       1.00E-15


  -Total Gradient:
     Atom            X                  Y                   Z
    ------   -----------------  -----------------  -----------------
       1       -0.000000000000     0.000000000000    -0.000085941043
       2       -0.000000000000     0.000000000000     0.000089718411


*** tstop() called on Joses-MacBook-Pro-2.local at Thu Jul 17 14:01:17 2025
Module time:
	user time   =       0.45 seconds =       0.01 minutes
	system time =       1.16 seconds =       0.02 minutes
	total time  =          0 seconds =       0.00 minutes
Total time:
	user time   =      10.15 seconds =       0.17 minutes
	system time =      26.88 seconds =       0.45 minutes
	total time  =          4 seconds =       0.07 minutes

    			-----------------------------------------

    			 OPTKING 3.0: for geometry optimizations 

    			     By R.A. King, Bethel University     

    			        with contributions from          

    			    A.V. Copan, J. Cayton, A. Heide      

    			-----------------------------------------

    
	                            ===> Fragment 1 <== 

	 Z (Atomic Numbers)          Masses                          Geom                  
	       8.000000            15.994915          0.00000000  0.00000000  1.25827824   
	       9.000000            18.998403          0.00000000  0.00000000 -1.05935498   

	 - Coordinate -           - BOHR/RAD -       - ANG/DEG -
	 R(1,2)           =         2.317633           1.226439


	        --- Internal Coordinate Step in ANG or DEG, aJ/ANG or AJ/DEG ---
	-------------------------------------------------------------------------------
	           Coordinate      Previous         Force          Change          New 
	           ----------      --------        ------          ------        ------
	               R(1,2)       1.22644        0.00072        0.00006       1.22650
	-------------------------------------------------------------------------------

	                                 ==> Convergence Check <==                                  
    
	Measures of convergence in internal coordinates in au.
    
	Criteria marked as inactive (o), active & met (*), and active & unmet ( ).

	----------------------------------------------------------------------------------------------
	   Step    Total Energy     Delta E     Max Force     RMS Force      Max Disp      RMS Disp   
	----------------------------------------------------------------------------------------------
	  Convergence Criteria     1.00e-06 *    3.00e-04 *             o    1.20e-03 *             o
	----------------------------------------------------------------------------------------------
	     4    -174.33800181   -6.87e-07 *    8.78e-05 *    8.78e-05 o    1.23e-04 *    1.23e-04 o  ~
	----------------------------------------------------------------------------------------------

Next Geometry in Ang 
	Fragment 1 (Ang)

	    O   0.0000000000   0.0000000000   0.6658845933
	    F   0.0000000000   0.0000000000  -0.5606189379


    Final optimized geometry and variables:
    Molecular point group: c2v
    Full point group: C_inf_v

    Geometry (in Angstrom), charge = 1, multiplicity = 1:

    O            0.000000000000     0.000000000000     0.665852168473
    F            0.000000000000     0.000000000000    -0.560586513128


    Psi4 stopped on: Thursday, 17 July 2025 02:01PM
    Psi4 wall time for execution: 0:00:04.47

*** Psi4 exiting successfully. Buy a developer a beer!
