
    -----------------------------------------------------------------------
          Psi4: An Open-Source Ab Initio Electronic Structure Package
                               Psi4 1.9.1 release

                         Git: Rev {} zzzzzzz 


    D. G. A. Smith, L. A. Burns, A. C. Simmonett, R. M. Parrish,
    M. C. Schieber, R. Galvelis, P. Kraus, H. Kruse, R. Di Remigio,
    A. Alenaizan, A. M. James, S. Lehtola, J. P. Misiewicz, M. Scheurer,
    R. A. Shaw, J. B. Schriber, Y. Xie, Z. L. Glick, D. A. Sirianni,
    J. S. O'Brien, J. M. Waldrop, A. Kumar, E. G. Hohenstein,
    B. P. Pritchard, B. R. Brooks, H. F. Schaefer III, A. Yu. Sokolov,
    K. Patkowski, A. E. DePrince III, U. Bozkaya, R. A. King,
    F. A. Evangelista, J. M. Turney, T. D. Crawford, C. D. Sherrill,
    J. Chem. Phys. 152(18) 184108 (2020). https://doi.org/10.1063/5.0006002

                            Additional Code Authors
    E. T. Seidl, C. L. Janssen, E. F. Valeev, M. L. Leininger,
    J. F. Gonthier, R. M. Richard, H. R. McAlexander, M. Saitow, X. Wang,
    P. Verma, M. H. Lechner, A. Jiang, S. Behnle, A. G. Heide,
    M. F. Herbst, and D. L. Poole

             Previous Authors, Complete List of Code Contributors,
                       and Citations for Specific Modules
    https://github.com/psi4/psi4/blob/master/codemeta.json
    https://github.com/psi4/psi4/graphs/contributors
    http://psicode.org/psi4manual/master/introduction.html#citing-psifour

    -----------------------------------------------------------------------


    Psi4 started on: Thursday, 17 July 2025 12:19PM

    Process ID: 73667
    Host:       Joses-MacBook-Pro-2.local
    PSIDATADIR: /Users/joseantoniorodriguesromero/anaconda3/share/psi4
    Memory:     500.0 MiB
    Threads:    1
    
  ==> Input File <==

--------------------------------------------------------------------------
molecule { 
1 3
H   0.00000        0.60000        0.00000
C   0.00000       -0.60000        0.00000
}

set { 
basis              cc-pvdz
reference          uks
maxiter            500
geom_maxiter       500
DAMPING_PERCENTAGE 1
guess              SAP
}

optimize('b3lyp')
--------------------------------------------------------------------------

Scratch directory: /tmp/
gradient() will perform analytic gradient computation.
   => Libint2 <=

    Primary   basis highest AM E, G, H:  6, 6, 3
    Auxiliary basis highest AM E, G, H:  7, 7, 4
    Onebody   basis highest AM E, G, H:  -, -, -
    Solid Harmonics ordering:            Gaussian

*** tstart() called on Joses-MacBook-Pro-2.local
*** at Thu Jul 17 12:19:32 2025

   => Loading Basis Set <=

    Name: CC-PVDZ
    Role: ORBITAL
    Keyword: BASIS
    atoms 1 entry H          line    22 file /Users/joseantoniorodriguesromero/anaconda3/share/psi4/basis/cc-pvdz.gbs 
    atoms 2 entry C          line   138 file /Users/joseantoniorodriguesromero/anaconda3/share/psi4/basis/cc-pvdz.gbs 


         ---------------------------------------------------------
                                   SCF
               by Justin Turney, Rob Parrish, Andy Simmonett
                          and Daniel G. A. Smith
                              UKS Reference
                        1 Threads,    500 MiB Core
         ---------------------------------------------------------

  ==> Geometry <==

    Molecular point group: c2v
    Full point group: C_inf_v

    Geometry (in Angstrom), charge = 1, multiplicity = 3:

       Center              X                  Y                   Z               Mass       
    ------------   -----------------  -----------------  -----------------  -----------------
         H            0.000000000000     0.000000000000     1.107025960475     1.007825032230
         C            0.000000000000     0.000000000000    -0.092974039525    12.000000000000

  Running in c2v symmetry.

  Rotational constants: A = ************  B =     12.59135  C =     12.59135 [cm^-1]
  Rotational constants: A = ************  B = 377479.18325  C = 377479.18325 [MHz]
  Nuclear repulsion =    2.645886053350000

  Charge       = 1
  Multiplicity = 3
  Electrons    = 6
  Nalpha       = 4
  Nbeta        = 2

  ==> Algorithm <==

  SCF Algorithm Type is DF.
  DIIS enabled.
  MOM disabled.
  Fractional occupation disabled.
  Guess Type is SAP.
  Energy threshold   = 1.00e-08
  Density threshold  = 1.00e-08
  Integral threshold = 1.00e-12

  ==> Primary Basis <==

  Basis Set: CC-PVDZ
    Blend: CC-PVDZ
    Number of shells: 9
    Number of basis functions: 19
    Number of Cartesian functions: 20
    Spherical Harmonics?: true
    Max angular momentum: 2

  ==> DFT Potential <==

   => LibXC <=

    Version 6.2.2
    S. Lehtola, C. Steigemann, M. J.T. Oliveira, and M. A.L. Marques.,  SoftwareX 7, 1–5 (2018) (10.1016/j.softx.2017.11.002)

   => Composite Functional: B3LYP <= 

    B3LYP Hyb-GGA Exchange-Correlation Functional

    P. J. Stephens, F. J. Devlin, C. F. Chabalowski, and M. J. Frisch.,  J. Phys. Chem. 98, 11623 (1994) (10.1021/j100096a001)

    Deriv               =              1
    GGA                 =           TRUE
    Meta                =          FALSE

    Exchange Hybrid     =           TRUE
    MP2 Hybrid          =          FALSE

   => Exchange Functionals <=

    0.0800   Slater exchange
    0.7200         Becke 88

   => Exact (HF) Exchange <=

    0.2000               HF 

   => Correlation Functionals <=

    0.1900   Vosko, Wilk & Nusair (VWN5_RPA)
    0.8100   Lee, Yang & Parr

   => LibXC Density Thresholds  <==

    XC_HYB_GGA_XC_B3LYP:  1.00E-15 

   => Molecular Quadrature <=

    Radial Scheme          =       TREUTLER
    Pruning Scheme         =           NONE
    Nuclear Scheme         =       TREUTLER

    Blocking Scheme        =         OCTREE
    BS radius alpha        =              1
    Pruning alpha          =              1
    Radial Points          =             75
    Spherical Points       =            302
    Total Points           =          43742
    Total Blocks           =            387
    Max Points             =            255
    Max Functions          =             19
    Weights Tolerance      =       1.00E-15

   => Loading Basis Set <=

    Name: (CC-PVDZ AUX)
    Role: JKFIT
    Keyword: DF_BASIS_SCF
    atoms 1 entry H          line    51 file /Users/joseantoniorodriguesromero/anaconda3/share/psi4/basis/cc-pvdz-jkfit.gbs 
    atoms 2 entry C          line   121 file /Users/joseantoniorodriguesromero/anaconda3/share/psi4/basis/cc-pvdz-jkfit.gbs 

  ==> Integral Setup <==

  DFHelper Memory: AOs need 0.000 GiB; user supplied 0.342 GiB. 
  Using in-core AOs.

  ==> MemDFJK: Density-Fitted J/K Matrices <==

    J tasked:                   Yes
    K tasked:                   Yes
    wK tasked:                   No
    OpenMP threads:               1
    Memory [MiB]:               349
    Algorithm:                 Core
    Schwarz Cutoff:           1E-12
    Mask sparsity (%):       0.0000
    Fitting Condition:        1E-10

   => Auxiliary Basis Set <=

  Basis Set: (CC-PVDZ AUX)
    Blend: CC-PVDZ-JKFIT
    Number of shells: 33
    Number of basis functions: 93
    Number of Cartesian functions: 106
    Spherical Harmonics?: true
    Max angular momentum: 3

  Cached 100.0% of DFT collocation blocks in 0.024 [GiB].

  Minimum eigenvalue in the overlap matrix is 4.4207294837E-02.
  Reciprocal condition number of the overlap matrix is 1.4754317306E-02.
    Using symmetric orthogonalization.

  ==> Pre-Iterations <==

  SCF Guess: Superposition of Atomic Potentials (doi:10.1021/acs.jctc.8b01089).

  ==> SAP guess <==

   => Molecular Quadrature <=

    Radial Scheme          =       TREUTLER
    Pruning Scheme         =           NONE
    Nuclear Scheme         =       TREUTLER

    Blocking Scheme        =         OCTREE
    BS radius alpha        =              1
    Pruning alpha          =              1
    Radial Points          =             75
    Spherical Points       =            302
    Total Points           =          43742
    Total Blocks           =            387
    Max Points             =            255
    Max Functions          =             19
    Weights Tolerance      =       1.00E-15

   -------------------------------------------------------
    Irrep   Nso     Nmo     Nalpha   Nbeta   Ndocc  Nsocc
   -------------------------------------------------------
     A1        10      10       3       2       2       1
     A2         1       1       0       0       0       0
     B1         4       4       1       0       0       1
     B2         4       4       0       0       0       0
   -------------------------------------------------------
    Total      19      19       4       2       2       2
   -------------------------------------------------------

  ==> Iterations <==

                           Total Energy        Delta E     RMS |[F,P]|

   @DF-UKS iter   1:   -38.01609993307211   -3.80161e+01   1.88974e-02 DIIS/ADIIS
   @DF-UKS iter   2:   -38.04103417180410   -2.49342e-02   9.02962e-03 DIIS/ADIIS/DAMP=1%
   @DF-UKS iter   3:   -38.05075536311799   -9.72119e-03   1.09410e-03 DIIS/ADIIS/DAMP=1%
   @DF-UKS iter   4:   -38.04943852186167    1.31684e-03   1.47823e-04 DIIS/ADIIS/DAMP=1%
   @DF-UKS iter   5:   -38.04964626698482   -2.07745e-04   2.56103e-05 DIIS/DAMP=1%
   @DF-UKS iter   6:   -38.04962362412139    2.26429e-05   6.98365e-06 DIIS/DAMP=1%
   @DF-UKS iter   7:   -38.04962542984050   -1.80572e-06   4.63894e-07 DIIS/DAMP=1%
   @DF-UKS iter   8:   -38.04962569288782   -2.63047e-07   1.42952e-07 DIIS/DAMP=1%
   @DF-UKS iter   9:   -38.04962567224752    2.06403e-08   1.70384e-08 DIIS/DAMP=1%
   @DF-UKS iter  10:   -38.04962567800777   -5.76026e-09   1.32887e-09 DIIS/DAMP=1%
  Energy and wave function converged.


  ==> Post-Iterations <==

   Electrons on quadrature grid:
      Nalpha   =    3.9999999827 ; deviation = -1.727e-08
      Nbeta    =    1.9999999855 ; deviation = -1.453e-08
      Ntotal   =    5.9999999682 ; deviation = -3.180e-08 

   @Spin Contamination Metric:   1.808843515E-03
   @S^2 Expected:                2.000000000E+00
   @S^2 Observed:                2.001808844E+00
   @S   Expected:                1.000000000E+00
   @S   Observed:                1.000000000E+00

    Orbital Energies [Eh]
    ---------------------

    Alpha Occupied:                                                       

       1A1   -10.777718     2A1    -1.052966     3A1    -0.785093  
       1B1    -0.669783  

    Alpha Virtual:                                                        

       1B2    -0.542204     4A1    -0.251863     5A1     0.095213  
       2B1     0.112187     6A1     0.132790     2B2     0.134905  
       7A1     0.381744     3B1     0.569338     3B2     0.575652  
       1A2     0.728570     8A1     0.738521     9A1     1.066690  
       4B1     1.280847     4B2     1.282267    10A1     1.808534  

    Beta Occupied:                                                        

       1A1   -10.744367     2A1    -0.959486  

    Beta Virtual:                                                         

       3A1    -0.564396     1B2    -0.495578     1B1    -0.442747  
       4A1    -0.206433     5A1     0.150070     2B2     0.154178  
       2B1     0.187502     6A1     0.201689     7A1     0.414687  
       3B2     0.632761     3B1     0.661418     8A1     0.814318  
       1A2     0.814898     9A1     1.149553     4B2     1.333944  
       4B1     1.355660    10A1     1.871709  

    Final Occupation by Irrep:
             A1    A2    B1    B2 
    DOCC [     2,    0,    0,    0 ]
    SOCC [     1,    0,    1,    0 ]
    NA   [     3,    0,    1,    0 ]
    NB   [     2,    0,    0,    0 ]

  @DF-UKS Final Energy:   -38.04962567800777

   => Energetics <=

    Nuclear Repulsion Energy =              2.6458860533500004
    One-Electron Energy =                 -53.3139867880276057
    Two-Electron Energy =                  16.8958488439200494
    DFT Exchange-Correlation Energy =      -4.2773737872502116
    Empirical Dispersion Energy =           0.0000000000000000
    VV10 Nonlocal Energy =                  0.0000000000000000
    Total Energy =                        -38.0496256780077715

  UHF NO Occupations:
  HONO-2 :    2 A1 1.9990954
  HONO-1 :    3 A1 1.0000000
  HONO-0 :    1 B1 1.0000000
  LUNO+0 :    4 A1 0.0009046
  LUNO+1 :    5 A1 0.0000003
  LUNO+2 :    6 A1 0.0000000
  LUNO+3 :    7 A1 0.0000000


Computation Completed


Properties will be evaluated at   0.000000,   0.000000,   0.000000 [a0]

Properties computed using the SCF density matrix


 Multipole Moments:

 ------------------------------------------------------------------------------------
     Multipole            Electronic (a.u.)      Nuclear  (a.u.)        Total (a.u.)
 ------------------------------------------------------------------------------------

 L = 1.  Multiply by 2.5417464519 to convert [e a0] to [Debye]
 Dipole X            :          0.0000000            0.0000000            0.0000000
 Dipole Y            :          0.0000000            0.0000000            0.0000000
 Dipole Z            :         -0.5265301            1.0378031            0.5112730
 Magnitude           :                                                    0.5112730

 ------------------------------------------------------------------------------------

*** tstop() called on Joses-MacBook-Pro-2.local at Thu Jul 17 12:19:33 2025
Module time:
	user time   =       1.40 seconds =       0.02 minutes
	system time =       2.34 seconds =       0.04 minutes
	total time  =          1 seconds =       0.02 minutes
Total time:
	user time   =       1.40 seconds =       0.02 minutes
	system time =       2.34 seconds =       0.04 minutes
	total time  =          1 seconds =       0.02 minutes

*** tstart() called on Joses-MacBook-Pro-2.local
*** at Thu Jul 17 12:19:33 2025


         ------------------------------------------------------------
                                   SCF GRAD                          
                          Rob Parrish, Justin Turney,                
                       Andy Simmonett, and Alex Sokolov              
         ------------------------------------------------------------

  ==> Geometry <==

    Molecular point group: c2v
    Full point group: C_inf_v

    Geometry (in Angstrom), charge = 1, multiplicity = 3:

       Center              X                  Y                   Z               Mass       
    ------------   -----------------  -----------------  -----------------  -----------------
         H            0.000000000000     0.000000000000     1.107025960475     1.007825032230
         C            0.000000000000     0.000000000000    -0.092974039525    12.000000000000

  Nuclear repulsion =    2.645886053350000

  ==> Basis Set <==

  Basis Set: CC-PVDZ
    Blend: CC-PVDZ
    Number of shells: 9
    Number of basis functions: 19
    Number of Cartesian functions: 20
    Spherical Harmonics?: true
    Max angular momentum: 2

  ==> DFJKGrad: Density-Fitted SCF Gradients <==

    Gradient:                    1
    J tasked:                  Yes
    K tasked:                  Yes
    wK tasked:                  No
    OpenMP threads:              1
    Integrals threads:           1
    Memory [MiB]:              375
    Schwarz Cutoff:          1E-12
    Fitting Condition:       1E-10

   => Auxiliary Basis Set <=

  Basis Set: (CC-PVDZ AUX)
    Blend: CC-PVDZ-JKFIT
    Number of shells: 33
    Number of basis functions: 93
    Number of Cartesian functions: 106
    Spherical Harmonics?: true
    Max angular momentum: 3

  ==> DFT Potential <==

   => LibXC <=

    Version 6.2.2
    S. Lehtola, C. Steigemann, M. J.T. Oliveira, and M. A.L. Marques.,  SoftwareX 7, 1–5 (2018) (10.1016/j.softx.2017.11.002)

   => Composite Functional: B3LYP <= 

    B3LYP Hyb-GGA Exchange-Correlation Functional

    P. J. Stephens, F. J. Devlin, C. F. Chabalowski, and M. J. Frisch.,  J. Phys. Chem. 98, 11623 (1994) (10.1021/j100096a001)

    Deriv               =              1
    GGA                 =           TRUE
    Meta                =          FALSE

    Exchange Hybrid     =           TRUE
    MP2 Hybrid          =          FALSE

   => Exchange Functionals <=

    0.0800   Slater exchange
    0.7200         Becke 88

   => Exact (HF) Exchange <=

    0.2000               HF 

   => Correlation Functionals <=

    0.1900   Vosko, Wilk & Nusair (VWN5_RPA)
    0.8100   Lee, Yang & Parr

   => LibXC Density Thresholds  <==

    XC_HYB_GGA_XC_B3LYP:  1.00E-15 

   => Molecular Quadrature <=

    Radial Scheme          =       TREUTLER
    Pruning Scheme         =           NONE
    Nuclear Scheme         =       TREUTLER

    Blocking Scheme        =         OCTREE
    BS radius alpha        =              1
    Pruning alpha          =              1
    Radial Points          =             75
    Spherical Points       =            302
    Total Points           =          43742
    Total Blocks           =            387
    Max Points             =            255
    Max Functions          =             19
    Weights Tolerance      =       1.00E-15


  -Total Gradient:
     Atom            X                  Y                   Z
    ------   -----------------  -----------------  -----------------
       1        0.000000000000     0.000000000000     0.016370397415
       2        0.000000000000    -0.000000000000    -0.016370135294


*** tstop() called on Joses-MacBook-Pro-2.local at Thu Jul 17 12:19:33 2025
Module time:
	user time   =       0.22 seconds =       0.00 minutes
	system time =       0.87 seconds =       0.01 minutes
	total time  =          0 seconds =       0.00 minutes
Total time:
	user time   =       1.62 seconds =       0.03 minutes
	system time =       3.21 seconds =       0.05 minutes
	total time  =          1 seconds =       0.02 minutes

    			-----------------------------------------

    			 OPTKING 3.0: for geometry optimizations 

    			     By R.A. King, Bethel University     

    			        with contributions from          

    			    A.V. Copan, J. Cayton, A. Heide      

    			-----------------------------------------

    
	                            ===> Fragment 1 <== 

	 Z (Atomic Numbers)          Masses                          Geom                  
	       1.000000             1.007825          0.00000000  0.00000000  2.09197588   
	       6.000000            12.000000          0.00000000  0.00000000 -0.17569547   

	 - Coordinate -           - BOHR/RAD -       - ANG/DEG -
	 R(1,2)           =         2.267671           1.200000


	        --- Internal Coordinate Step in ANG or DEG, aJ/ANG or AJ/DEG ---
	-------------------------------------------------------------------------------
	           Coordinate      Previous         Force          Change          New 
	           ----------      --------        ------          ------        ------
	               R(1,2)       1.20000       -0.13487       -0.03497       1.16503
	-------------------------------------------------------------------------------

	                                 ==> Convergence Check <==                                  
    
	Measures of convergence in internal coordinates in au.
    
	Criteria marked as inactive (o), active & met (*), and active & unmet ( ).

	----------------------------------------------------------------------------------------------
	   Step    Total Energy     Delta E     Max Force     RMS Force      Max Disp      RMS Disp   
	----------------------------------------------------------------------------------------------
	  Convergence Criteria     1.00e-06 *    3.00e-04 *             o    1.20e-03 *             o
	----------------------------------------------------------------------------------------------
	     1     -38.04962568   -3.80e+01      1.64e-02      1.64e-02 o    6.61e-02      6.61e-02 o  ~
	----------------------------------------------------------------------------------------------

Next Geometry in Ang 
	Fragment 1 (Ang)

	    H   0.0000000000   0.0000000000   1.0895419812
	    C   0.0000000000   0.0000000000  -0.0754900603


    Structure for next step:
    Molecular point group: c2v
    Full point group: C_inf_v

    Geometry (in Angstrom), charge = 1, multiplicity = 3:

    H            0.000000000000     0.000000000000     1.074767262286
    C            0.000000000000     0.000000000000    -0.090264779229


Scratch directory: /tmp/
gradient() will perform analytic gradient computation.
   => Libint2 <=

    Primary   basis highest AM E, G, H:  6, 6, 3
    Auxiliary basis highest AM E, G, H:  7, 7, 4
    Onebody   basis highest AM E, G, H:  -, -, -
    Solid Harmonics ordering:            Gaussian

*** tstart() called on Joses-MacBook-Pro-2.local
*** at Thu Jul 17 12:19:33 2025

   => Loading Basis Set <=

    Name: CC-PVDZ
    Role: ORBITAL
    Keyword: BASIS
    atoms 1 entry H          line    22 file /Users/joseantoniorodriguesromero/anaconda3/share/psi4/basis/cc-pvdz.gbs 
    atoms 2 entry C          line   138 file /Users/joseantoniorodriguesromero/anaconda3/share/psi4/basis/cc-pvdz.gbs 


         ---------------------------------------------------------
                                   SCF
               by Justin Turney, Rob Parrish, Andy Simmonett
                          and Daniel G. A. Smith
                              UKS Reference
                        1 Threads,    500 MiB Core
         ---------------------------------------------------------

  ==> Geometry <==

    Molecular point group: c2v
    Full point group: C_inf_v

    Geometry (in Angstrom), charge = 1, multiplicity = 3:

       Center              X                  Y                   Z               Mass       
    ------------   -----------------  -----------------  -----------------  -----------------
         H            0.000000000000     0.000000000000     1.074767262286     1.007825032230
         C            0.000000000000     0.000000000000    -0.090264779229    12.000000000000

  Running in c2v symmetry.

  Rotational constants: A = ************  B =     13.35854  C =     13.35854 [cm^-1]
  Rotational constants: A = ************  B = 400479.01049  C = 400479.01049 [MHz]
  Nuclear repulsion =    2.725301237114807

  Charge       = 1
  Multiplicity = 3
  Electrons    = 6
  Nalpha       = 4
  Nbeta        = 2

  ==> Algorithm <==

  SCF Algorithm Type is DF.
  DIIS enabled.
  MOM disabled.
  Fractional occupation disabled.
  Guess Type is READ.
  Energy threshold   = 1.00e-08
  Density threshold  = 1.00e-08
  Integral threshold = 1.00e-12

  ==> Primary Basis <==

  Basis Set: CC-PVDZ
    Blend: CC-PVDZ
    Number of shells: 9
    Number of basis functions: 19
    Number of Cartesian functions: 20
    Spherical Harmonics?: true
    Max angular momentum: 2

  ==> DFT Potential <==

   => LibXC <=

    Version 6.2.2
    S. Lehtola, C. Steigemann, M. J.T. Oliveira, and M. A.L. Marques.,  SoftwareX 7, 1–5 (2018) (10.1016/j.softx.2017.11.002)

   => Composite Functional: B3LYP <= 

    B3LYP Hyb-GGA Exchange-Correlation Functional

    P. J. Stephens, F. J. Devlin, C. F. Chabalowski, and M. J. Frisch.,  J. Phys. Chem. 98, 11623 (1994) (10.1021/j100096a001)

    Deriv               =              1
    GGA                 =           TRUE
    Meta                =          FALSE

    Exchange Hybrid     =           TRUE
    MP2 Hybrid          =          FALSE

   => Exchange Functionals <=

    0.0800   Slater exchange
    0.7200         Becke 88

   => Exact (HF) Exchange <=

    0.2000               HF 

   => Correlation Functionals <=

    0.1900   Vosko, Wilk & Nusair (VWN5_RPA)
    0.8100   Lee, Yang & Parr

   => LibXC Density Thresholds  <==

    XC_HYB_GGA_XC_B3LYP:  1.00E-15 

   => Molecular Quadrature <=

    Radial Scheme          =       TREUTLER
    Pruning Scheme         =           NONE
    Nuclear Scheme         =       TREUTLER

    Blocking Scheme        =         OCTREE
    BS radius alpha        =              1
    Pruning alpha          =              1
    Radial Points          =             75
    Spherical Points       =            302
    Total Points           =          43741
    Total Blocks           =            385
    Max Points             =            256
    Max Functions          =             19
    Weights Tolerance      =       1.00E-15

   => Loading Basis Set <=

    Name: (CC-PVDZ AUX)
    Role: JKFIT
    Keyword: DF_BASIS_SCF
    atoms 1 entry H          line    51 file /Users/joseantoniorodriguesromero/anaconda3/share/psi4/basis/cc-pvdz-jkfit.gbs 
    atoms 2 entry C          line   121 file /Users/joseantoniorodriguesromero/anaconda3/share/psi4/basis/cc-pvdz-jkfit.gbs 

   => Loading Basis Set <=

    Name: CC-PVDZ
    Role: ORBITAL
    Keyword: BASIS
    atoms 1 entry H          line    22 file /Users/joseantoniorodriguesromero/anaconda3/share/psi4/basis/cc-pvdz.gbs 
    atoms 2 entry C          line   138 file /Users/joseantoniorodriguesromero/anaconda3/share/psi4/basis/cc-pvdz.gbs 

  Reading orbitals from file /tmp/triplet_HC.default.73667.180.npy, no projection.

  ==> Integral Setup <==

  DFHelper Memory: AOs need 0.000 GiB; user supplied 0.342 GiB. 
  Using in-core AOs.

  ==> MemDFJK: Density-Fitted J/K Matrices <==

    J tasked:                   Yes
    K tasked:                   Yes
    wK tasked:                   No
    OpenMP threads:               1
    Memory [MiB]:               349
    Algorithm:                 Core
    Schwarz Cutoff:           1E-12
    Mask sparsity (%):       0.0000
    Fitting Condition:        1E-10

   => Auxiliary Basis Set <=

  Basis Set: (CC-PVDZ AUX)
    Blend: CC-PVDZ-JKFIT
    Number of shells: 33
    Number of basis functions: 93
    Number of Cartesian functions: 106
    Spherical Harmonics?: true
    Max angular momentum: 3

  Cached 100.0% of DFT collocation blocks in 0.024 [GiB].

  Minimum eigenvalue in the overlap matrix is 4.1377981198E-02.
  Reciprocal condition number of the overlap matrix is 1.3691022284E-02.
    Using symmetric orthogonalization.

  ==> Pre-Iterations <==

  SCF Guess: Orbitals guess was supplied from a previous computation.

   -------------------------------------------------------
    Irrep   Nso     Nmo     Nalpha   Nbeta   Ndocc  Nsocc
   -------------------------------------------------------
     A1        10      10       3       2       2       1
     A2         1       1       0       0       0       0
     B1         4       4       1       0       0       1
     B2         4       4       0       0       0       0
   -------------------------------------------------------
    Total      19      19       4       2       2       2
   -------------------------------------------------------

  ==> Iterations <==

                           Total Energy        Delta E     RMS |[F,P]|

   @DF-UKS iter   0:   -38.07216097916719   -3.80722e+01   3.04780e-03 
   @DF-UKS iter   1:   -38.05024221921136    2.19188e-02   5.18022e-04 DIIS/ADIIS
   @DF-UKS iter   2:   -38.05027839695845   -3.61777e-05   2.00562e-04 DIIS/ADIIS/DAMP=1%
   @DF-UKS iter   3:   -38.05031430580659   -3.59088e-05   4.89383e-05 DIIS/DAMP=1%
   @DF-UKS iter   4:   -38.05027898160151    3.53242e-05   1.64216e-05 DIIS/DAMP=1%
   @DF-UKS iter   5:   -38.05028478206996   -5.80047e-06   1.91131e-06 DIIS/DAMP=1%
   @DF-UKS iter   6:   -38.05028301928222    1.76279e-06   3.63432e-07 DIIS/DAMP=1%
   @DF-UKS iter   7:   -38.05028317091443   -1.51632e-07   2.77905e-08 DIIS/DAMP=1%
   @DF-UKS iter   8:   -38.05028315612211    1.47923e-08   2.11146e-09 DIIS/DAMP=1%
   @DF-UKS iter   9:   -38.05028315600141    1.20693e-10   1.04343e-10 DIIS/DAMP=1%
  Energy and wave function converged.


  ==> Post-Iterations <==

   Electrons on quadrature grid:
      Nalpha   =    3.9999999809 ; deviation = -1.907e-08
      Nbeta    =    1.9999999855 ; deviation = -1.449e-08
      Ntotal   =    5.9999999664 ; deviation = -3.356e-08 

   @Spin Contamination Metric:   1.609821864E-03
   @S^2 Expected:                2.000000000E+00
   @S^2 Observed:                2.001609822E+00
   @S   Expected:                1.000000000E+00
   @S   Observed:                1.000000000E+00

    Orbital Energies [Eh]
    ---------------------

    Alpha Occupied:                                                       

       1A1   -10.779428     2A1    -1.060948     3A1    -0.790463  
       1B1    -0.672732  

    Alpha Virtual:                                                        

       1B2    -0.545052     4A1    -0.237627     5A1     0.099543  
       2B1     0.111111     6A1     0.128891     2B2     0.133766  
       7A1     0.389712     3B1     0.568911     3B2     0.575194  
       1A2     0.725819     8A1     0.735815     9A1     1.096583  
       4B1     1.302727     4B2     1.304048    10A1     1.849284  

    Beta Occupied:                                                        

       1A1   -10.745628     2A1    -0.968932  

    Beta Virtual:                                                         

       3A1    -0.565692     1B2    -0.497398     1B1    -0.444562  
       4A1    -0.196696     5A1     0.151824     2B2     0.153240  
       2B1     0.186519     6A1     0.202444     7A1     0.422620  
       3B2     0.632384     3B1     0.661603     8A1     0.812530  
       1A2     0.812974     9A1     1.179905     4B2     1.354536  
       4B1     1.376669    10A1     1.910737  

    Final Occupation by Irrep:
             A1    A2    B1    B2 
    DOCC [     2,    0,    0,    0 ]
    SOCC [     1,    0,    1,    0 ]
    NA   [     3,    0,    1,    0 ]
    NB   [     2,    0,    0,    0 ]

  @DF-UKS Final Energy:   -38.05028315600141

   => Energetics <=

    Nuclear Repulsion Energy =              2.7253012371148069
    One-Electron Energy =                 -53.4397962895855301
    Two-Electron Energy =                  16.9497399783730494
    DFT Exchange-Correlation Energy =      -4.2855280819037382
    Empirical Dispersion Energy =           0.0000000000000000
    VV10 Nonlocal Energy =                  0.0000000000000000
    Total Energy =                        -38.0502831560014130

  UHF NO Occupations:
  HONO-2 :    2 A1 1.9991950
  HONO-1 :    3 A1 1.0000000
  HONO-0 :    1 B1 1.0000000
  LUNO+0 :    4 A1 0.0008050
  LUNO+1 :    5 A1 0.0000002
  LUNO+2 :    6 A1 0.0000000
  LUNO+3 :    2 B1 0.0000000


Computation Completed


Properties will be evaluated at   0.000000,   0.000000,   0.000000 [a0]

Properties computed using the SCF density matrix


 Multipole Moments:

 ------------------------------------------------------------------------------------
     Multipole            Electronic (a.u.)      Nuclear  (a.u.)        Total (a.u.)
 ------------------------------------------------------------------------------------

 L = 1.  Multiply by 2.5417464519 to convert [e a0] to [Debye]
 Dipole X            :          0.0000000            0.0000000            0.0000000
 Dipole Y            :          0.0000000            0.0000000            0.0000000
 Dipole Z            :         -0.5354927            1.0075615            0.4720688
 Magnitude           :                                                    0.4720688

 ------------------------------------------------------------------------------------

*** tstop() called on Joses-MacBook-Pro-2.local at Thu Jul 17 12:19:33 2025
Module time:
	user time   =       0.92 seconds =       0.02 minutes
	system time =       3.10 seconds =       0.05 minutes
	total time  =          0 seconds =       0.00 minutes
Total time:
	user time   =       2.57 seconds =       0.04 minutes
	system time =       6.51 seconds =       0.11 minutes
	total time  =          1 seconds =       0.02 minutes

*** tstart() called on Joses-MacBook-Pro-2.local
*** at Thu Jul 17 12:19:33 2025


         ------------------------------------------------------------
                                   SCF GRAD                          
                          Rob Parrish, Justin Turney,                
                       Andy Simmonett, and Alex Sokolov              
         ------------------------------------------------------------

  ==> Geometry <==

    Molecular point group: c2v
    Full point group: C_inf_v

    Geometry (in Angstrom), charge = 1, multiplicity = 3:

       Center              X                  Y                   Z               Mass       
    ------------   -----------------  -----------------  -----------------  -----------------
         H            0.000000000000     0.000000000000     1.074767262286     1.007825032230
         C            0.000000000000     0.000000000000    -0.090264779229    12.000000000000

  Nuclear repulsion =    2.725301237114807

  ==> Basis Set <==

  Basis Set: CC-PVDZ
    Blend: CC-PVDZ
    Number of shells: 9
    Number of basis functions: 19
    Number of Cartesian functions: 20
    Spherical Harmonics?: true
    Max angular momentum: 2

  ==> DFJKGrad: Density-Fitted SCF Gradients <==

    Gradient:                    1
    J tasked:                  Yes
    K tasked:                  Yes
    wK tasked:                  No
    OpenMP threads:              1
    Integrals threads:           1
    Memory [MiB]:              375
    Schwarz Cutoff:          1E-12
    Fitting Condition:       1E-10

   => Auxiliary Basis Set <=

  Basis Set: (CC-PVDZ AUX)
    Blend: CC-PVDZ-JKFIT
    Number of shells: 33
    Number of basis functions: 93
    Number of Cartesian functions: 106
    Spherical Harmonics?: true
    Max angular momentum: 3

  ==> DFT Potential <==

   => LibXC <=

    Version 6.2.2
    S. Lehtola, C. Steigemann, M. J.T. Oliveira, and M. A.L. Marques.,  SoftwareX 7, 1–5 (2018) (10.1016/j.softx.2017.11.002)

   => Composite Functional: B3LYP <= 

    B3LYP Hyb-GGA Exchange-Correlation Functional

    P. J. Stephens, F. J. Devlin, C. F. Chabalowski, and M. J. Frisch.,  J. Phys. Chem. 98, 11623 (1994) (10.1021/j100096a001)

    Deriv               =              1
    GGA                 =           TRUE
    Meta                =          FALSE

    Exchange Hybrid     =           TRUE
    MP2 Hybrid          =          FALSE

   => Exchange Functionals <=

    0.0800   Slater exchange
    0.7200         Becke 88

   => Exact (HF) Exchange <=

    0.2000               HF 

   => Correlation Functionals <=

    0.1900   Vosko, Wilk & Nusair (VWN5_RPA)
    0.8100   Lee, Yang & Parr

   => LibXC Density Thresholds  <==

    XC_HYB_GGA_XC_B3LYP:  1.00E-15 

   => Molecular Quadrature <=

    Radial Scheme          =       TREUTLER
    Pruning Scheme         =           NONE
    Nuclear Scheme         =       TREUTLER

    Blocking Scheme        =         OCTREE
    BS radius alpha        =              1
    Pruning alpha          =              1
    Radial Points          =             75
    Spherical Points       =            302
    Total Points           =          43741
    Total Blocks           =            385
    Max Points             =            256
    Max Functions          =             19
    Weights Tolerance      =       1.00E-15


  -Total Gradient:
     Atom            X                  Y                   Z
    ------   -----------------  -----------------  -----------------
       1       -0.000000000000     0.000000000000     0.002994662668
       2       -0.000000000000     0.000000000000    -0.002994461484


*** tstop() called on Joses-MacBook-Pro-2.local at Thu Jul 17 12:19:33 2025
Module time:
	user time   =       0.34 seconds =       0.01 minutes
	system time =       0.83 seconds =       0.01 minutes
	total time  =          0 seconds =       0.00 minutes
Total time:
	user time   =       2.91 seconds =       0.05 minutes
	system time =       7.34 seconds =       0.12 minutes
	total time  =          1 seconds =       0.02 minutes

    			-----------------------------------------

    			 OPTKING 3.0: for geometry optimizations 

    			     By R.A. King, Bethel University     

    			        with contributions from          

    			    A.V. Copan, J. Cayton, A. Heide      

    			-----------------------------------------

    
	                            ===> Fragment 1 <== 

	 Z (Atomic Numbers)          Masses                          Geom                  
	       1.000000             1.007825          0.00000000  0.00000000  2.03101577   
	       6.000000            12.000000          0.00000000  0.00000000 -0.17057571   

	 - Coordinate -           - BOHR/RAD -       - ANG/DEG -
	 R(1,2)           =         2.201591           1.165032


	        --- Internal Coordinate Step in ANG or DEG, aJ/ANG or AJ/DEG ---
	-------------------------------------------------------------------------------
	           Coordinate      Previous         Force          Change          New 
	           ----------      --------        ------          ------        ------
	               R(1,2)       1.16503       -0.02467       -0.00783       1.15721
	-------------------------------------------------------------------------------

	                                 ==> Convergence Check <==                                  
    
	Measures of convergence in internal coordinates in au.
    
	Criteria marked as inactive (o), active & met (*), and active & unmet ( ).

	----------------------------------------------------------------------------------------------
	   Step    Total Energy     Delta E     Max Force     RMS Force      Max Disp      RMS Disp   
	----------------------------------------------------------------------------------------------
	  Convergence Criteria     1.00e-06 *    3.00e-04 *             o    1.20e-03 *             o
	----------------------------------------------------------------------------------------------
	     2     -38.05028316   -6.57e-04      2.99e-03      2.99e-03 o    1.48e-02      1.48e-02 o  ~
	----------------------------------------------------------------------------------------------

Next Geometry in Ang 
	Fragment 1 (Ang)

	    H   0.0000000000   0.0000000000   1.0708537930
	    C   0.0000000000   0.0000000000  -0.0863513100


    Structure for next step:
    Molecular point group: c2v
    Full point group: C_inf_v

    Geometry (in Angstrom), charge = 1, multiplicity = 3:

    H            0.000000000000     0.000000000000     1.067546742216
    C            0.000000000000     0.000000000000    -0.089658360823


Scratch directory: /tmp/
gradient() will perform analytic gradient computation.
   => Libint2 <=

    Primary   basis highest AM E, G, H:  6, 6, 3
    Auxiliary basis highest AM E, G, H:  7, 7, 4
    Onebody   basis highest AM E, G, H:  -, -, -
    Solid Harmonics ordering:            Gaussian

*** tstart() called on Joses-MacBook-Pro-2.local
*** at Thu Jul 17 12:19:33 2025

   => Loading Basis Set <=

    Name: CC-PVDZ
    Role: ORBITAL
    Keyword: BASIS
    atoms 1 entry H          line    22 file /Users/joseantoniorodriguesromero/anaconda3/share/psi4/basis/cc-pvdz.gbs 
    atoms 2 entry C          line   138 file /Users/joseantoniorodriguesromero/anaconda3/share/psi4/basis/cc-pvdz.gbs 


         ---------------------------------------------------------
                                   SCF
               by Justin Turney, Rob Parrish, Andy Simmonett
                          and Daniel G. A. Smith
                              UKS Reference
                        1 Threads,    500 MiB Core
         ---------------------------------------------------------

  ==> Geometry <==

    Molecular point group: c2v
    Full point group: C_inf_v

    Geometry (in Angstrom), charge = 1, multiplicity = 3:

       Center              X                  Y                   Z               Mass       
    ------------   -----------------  -----------------  -----------------  -----------------
         H            0.000000000000     0.000000000000     1.067546742216     1.007825032230
         C            0.000000000000     0.000000000000    -0.089658360823    12.000000000000

  Running in c2v symmetry.

  Rotational constants: A = ************  B =     13.53986  C =     13.53986 [cm^-1]
  Rotational constants: A = ************  B = 405914.73661  C = 405914.73661 [MHz]
  Nuclear repulsion =    2.743734240092233

  Charge       = 1
  Multiplicity = 3
  Electrons    = 6
  Nalpha       = 4
  Nbeta        = 2

  ==> Algorithm <==

  SCF Algorithm Type is DF.
  DIIS enabled.
  MOM disabled.
  Fractional occupation disabled.
  Guess Type is READ.
  Energy threshold   = 1.00e-08
  Density threshold  = 1.00e-08
  Integral threshold = 1.00e-12

  ==> Primary Basis <==

  Basis Set: CC-PVDZ
    Blend: CC-PVDZ
    Number of shells: 9
    Number of basis functions: 19
    Number of Cartesian functions: 20
    Spherical Harmonics?: true
    Max angular momentum: 2

  ==> DFT Potential <==

   => LibXC <=

    Version 6.2.2
    S. Lehtola, C. Steigemann, M. J.T. Oliveira, and M. A.L. Marques.,  SoftwareX 7, 1–5 (2018) (10.1016/j.softx.2017.11.002)

   => Composite Functional: B3LYP <= 

    B3LYP Hyb-GGA Exchange-Correlation Functional

    P. J. Stephens, F. J. Devlin, C. F. Chabalowski, and M. J. Frisch.,  J. Phys. Chem. 98, 11623 (1994) (10.1021/j100096a001)

    Deriv               =              1
    GGA                 =           TRUE
    Meta                =          FALSE

    Exchange Hybrid     =           TRUE
    MP2 Hybrid          =          FALSE

   => Exchange Functionals <=

    0.0800   Slater exchange
    0.7200         Becke 88

   => Exact (HF) Exchange <=

    0.2000               HF 

   => Correlation Functionals <=

    0.1900   Vosko, Wilk & Nusair (VWN5_RPA)
    0.8100   Lee, Yang & Parr

   => LibXC Density Thresholds  <==

    XC_HYB_GGA_XC_B3LYP:  1.00E-15 

   => Molecular Quadrature <=

    Radial Scheme          =       TREUTLER
    Pruning Scheme         =           NONE
    Nuclear Scheme         =       TREUTLER

    Blocking Scheme        =         OCTREE
    BS radius alpha        =              1
    Pruning alpha          =              1
    Radial Points          =             75
    Spherical Points       =            302
    Total Points           =          43737
    Total Blocks           =            385
    Max Points             =            256
    Max Functions          =             19
    Weights Tolerance      =       1.00E-15

   => Loading Basis Set <=

    Name: (CC-PVDZ AUX)
    Role: JKFIT
    Keyword: DF_BASIS_SCF
    atoms 1 entry H          line    51 file /Users/joseantoniorodriguesromero/anaconda3/share/psi4/basis/cc-pvdz-jkfit.gbs 
    atoms 2 entry C          line   121 file /Users/joseantoniorodriguesromero/anaconda3/share/psi4/basis/cc-pvdz-jkfit.gbs 

   => Loading Basis Set <=

    Name: CC-PVDZ
    Role: ORBITAL
    Keyword: BASIS
    atoms 1 entry H          line    22 file /Users/joseantoniorodriguesromero/anaconda3/share/psi4/basis/cc-pvdz.gbs 
    atoms 2 entry C          line   138 file /Users/joseantoniorodriguesromero/anaconda3/share/psi4/basis/cc-pvdz.gbs 

  Reading orbitals from file /tmp/triplet_HC.default.73667.180.npy, no projection.

  ==> Integral Setup <==

  DFHelper Memory: AOs need 0.000 GiB; user supplied 0.342 GiB. 
  Using in-core AOs.

  ==> MemDFJK: Density-Fitted J/K Matrices <==

    J tasked:                   Yes
    K tasked:                   Yes
    wK tasked:                   No
    OpenMP threads:               1
    Memory [MiB]:               349
    Algorithm:                 Core
    Schwarz Cutoff:           1E-12
    Mask sparsity (%):       0.0000
    Fitting Condition:        1E-10

   => Auxiliary Basis Set <=

  Basis Set: (CC-PVDZ AUX)
    Blend: CC-PVDZ-JKFIT
    Number of shells: 33
    Number of basis functions: 93
    Number of Cartesian functions: 106
    Spherical Harmonics?: true
    Max angular momentum: 3

  Cached 100.0% of DFT collocation blocks in 0.024 [GiB].

  Minimum eigenvalue in the overlap matrix is 4.0758320632E-02.
  Reciprocal condition number of the overlap matrix is 1.3460605524E-02.
    Using symmetric orthogonalization.

  ==> Pre-Iterations <==

  SCF Guess: Orbitals guess was supplied from a previous computation.

   -------------------------------------------------------
    Irrep   Nso     Nmo     Nalpha   Nbeta   Ndocc  Nsocc
   -------------------------------------------------------
     A1        10      10       3       2       2       1
     A2         1       1       0       0       0       0
     B1         4       4       1       0       0       1
     B2         4       4       0       0       0       0
   -------------------------------------------------------
    Total      19      19       4       2       2       2
   -------------------------------------------------------

  ==> Iterations <==

                           Total Energy        Delta E     RMS |[F,P]|

   @DF-UKS iter   0:   -38.05529406279811   -3.80553e+01   7.18942e-04 
   @DF-UKS iter   1:   -38.05030006748855    4.99400e-03   1.17979e-04 DIIS/ADIIS
   @DF-UKS iter   2:   -38.05030189915570   -1.83167e-06   4.54592e-05 DIIS/DAMP=1%
   @DF-UKS iter   3:   -38.05030939934586   -7.50019e-06   1.08170e-05 DIIS/DAMP=1%
   @DF-UKS iter   4:   -38.05030124033370    8.15901e-06   3.60469e-06 DIIS/DAMP=1%
   @DF-UKS iter   5:   -38.05030248349689   -1.24316e-06   4.20066e-07 DIIS/DAMP=1%
   @DF-UKS iter   6:   -38.05030210974003    3.73757e-07   7.83583e-08 DIIS/DAMP=1%
   @DF-UKS iter   7:   -38.05030214222307   -3.24830e-08   6.23642e-09 DIIS/DAMP=1%
   @DF-UKS iter   8:   -38.05030213913888    3.08420e-09   4.50683e-10 DIIS/DAMP=1%
  Energy and wave function converged.


  ==> Post-Iterations <==

   Electrons on quadrature grid:
      Nalpha   =    3.9999999810 ; deviation = -1.902e-08
      Nbeta    =    1.9999999858 ; deviation = -1.416e-08
      Ntotal   =    5.9999999668 ; deviation = -3.318e-08 

   @Spin Contamination Metric:   1.571001827E-03
   @S^2 Expected:                2.000000000E+00
   @S^2 Observed:                2.001571002E+00
   @S   Expected:                1.000000000E+00
   @S   Observed:                1.000000000E+00

    Orbital Energies [Eh]
    ---------------------

    Alpha Occupied:                                                       

       1A1   -10.779800     2A1    -1.062788     3A1    -0.791668  
       1B1    -0.673395  

    Alpha Virtual:                                                        

       1B2    -0.545691     4A1    -0.234487     5A1     0.100642  
       2B1     0.110869     6A1     0.128037     2B2     0.133509  
       7A1     0.391631     3B1     0.568922     3B2     0.575201  
       1A2     0.725204     8A1     0.735210     9A1     1.103188  
       4B1     1.307655     4B2     1.308955    10A1     1.859514  

    Beta Occupied:                                                        

       1A1   -10.745902     2A1    -0.971117  

    Beta Virtual:                                                         

       3A1    -0.565969     1B2    -0.497812     1B1    -0.444972  
       4A1    -0.194558     5A1     0.152181     2B2     0.153026  
       2B1     0.186293     6A1     0.202831     7A1     0.424525  
       3B2     0.632424     3B1     0.661778     8A1     0.812127  
       1A2     0.812542     9A1     1.186623     4B2     1.359193  
       4B1     1.381419    10A1     1.920590  

    Final Occupation by Irrep:
             A1    A2    B1    B2 
    DOCC [     2,    0,    0,    0 ]
    SOCC [     1,    0,    1,    0 ]
    NA   [     3,    0,    1,    0 ]
    NB   [     2,    0,    0,    0 ]

  @DF-UKS Final Energy:   -38.05030213913888

   => Energetics <=

    Nuclear Repulsion Energy =              2.7437342400922331
    One-Electron Energy =                 -53.4688524505669989
    Two-Electron Energy =                  16.9622402420785683
    DFT Exchange-Correlation Energy =      -4.2874241707426837
    Empirical Dispersion Energy =           0.0000000000000000
    VV10 Nonlocal Energy =                  0.0000000000000000
    Total Energy =                        -38.0503021391388785

  UHF NO Occupations:
  HONO-2 :    2 A1 1.9992144
  HONO-1 :    3 A1 1.0000000
  HONO-0 :    1 B1 1.0000000
  LUNO+0 :    4 A1 0.0007856
  LUNO+1 :    5 A1 0.0000002
  LUNO+2 :    6 A1 0.0000000
  LUNO+3 :    7 A1 0.0000000


Computation Completed


Properties will be evaluated at   0.000000,   0.000000,   0.000000 [a0]

Properties computed using the SCF density matrix


 Multipole Moments:

 ------------------------------------------------------------------------------------
     Multipole            Electronic (a.u.)      Nuclear  (a.u.)        Total (a.u.)
 ------------------------------------------------------------------------------------

 L = 1.  Multiply by 2.5417464519 to convert [e a0] to [Debye]
 Dipole X            :          0.0000000            0.0000000            0.0000000
 Dipole Y            :          0.0000000            0.0000000            0.0000000
 Dipole Z            :         -0.5374053            1.0007925            0.4633872
 Magnitude           :                                                    0.4633872

 ------------------------------------------------------------------------------------

*** tstop() called on Joses-MacBook-Pro-2.local at Thu Jul 17 12:19:34 2025
Module time:
	user time   =       0.83 seconds =       0.01 minutes
	system time =       2.79 seconds =       0.05 minutes
	total time  =          1 seconds =       0.02 minutes
Total time:
	user time   =       3.78 seconds =       0.06 minutes
	system time =      10.40 seconds =       0.17 minutes
	total time  =          2 seconds =       0.03 minutes

*** tstart() called on Joses-MacBook-Pro-2.local
*** at Thu Jul 17 12:19:34 2025


         ------------------------------------------------------------
                                   SCF GRAD                          
                          Rob Parrish, Justin Turney,                
                       Andy Simmonett, and Alex Sokolov              
         ------------------------------------------------------------

  ==> Geometry <==

    Molecular point group: c2v
    Full point group: C_inf_v

    Geometry (in Angstrom), charge = 1, multiplicity = 3:

       Center              X                  Y                   Z               Mass       
    ------------   -----------------  -----------------  -----------------  -----------------
         H            0.000000000000     0.000000000000     1.067546742216     1.007825032230
         C            0.000000000000     0.000000000000    -0.089658360823    12.000000000000

  Nuclear repulsion =    2.743734240092233

  ==> Basis Set <==

  Basis Set: CC-PVDZ
    Blend: CC-PVDZ
    Number of shells: 9
    Number of basis functions: 19
    Number of Cartesian functions: 20
    Spherical Harmonics?: true
    Max angular momentum: 2

  ==> DFJKGrad: Density-Fitted SCF Gradients <==

    Gradient:                    1
    J tasked:                  Yes
    K tasked:                  Yes
    wK tasked:                  No
    OpenMP threads:              1
    Integrals threads:           1
    Memory [MiB]:              375
    Schwarz Cutoff:          1E-12
    Fitting Condition:       1E-10

   => Auxiliary Basis Set <=

  Basis Set: (CC-PVDZ AUX)
    Blend: CC-PVDZ-JKFIT
    Number of shells: 33
    Number of basis functions: 93
    Number of Cartesian functions: 106
    Spherical Harmonics?: true
    Max angular momentum: 3

  ==> DFT Potential <==

   => LibXC <=

    Version 6.2.2
    S. Lehtola, C. Steigemann, M. J.T. Oliveira, and M. A.L. Marques.,  SoftwareX 7, 1–5 (2018) (10.1016/j.softx.2017.11.002)

   => Composite Functional: B3LYP <= 

    B3LYP Hyb-GGA Exchange-Correlation Functional

    P. J. Stephens, F. J. Devlin, C. F. Chabalowski, and M. J. Frisch.,  J. Phys. Chem. 98, 11623 (1994) (10.1021/j100096a001)

    Deriv               =              1
    GGA                 =           TRUE
    Meta                =          FALSE

    Exchange Hybrid     =           TRUE
    MP2 Hybrid          =          FALSE

   => Exchange Functionals <=

    0.0800   Slater exchange
    0.7200         Becke 88

   => Exact (HF) Exchange <=

    0.2000               HF 

   => Correlation Functionals <=

    0.1900   Vosko, Wilk & Nusair (VWN5_RPA)
    0.8100   Lee, Yang & Parr

   => LibXC Density Thresholds  <==

    XC_HYB_GGA_XC_B3LYP:  1.00E-15 

   => Molecular Quadrature <=

    Radial Scheme          =       TREUTLER
    Pruning Scheme         =           NONE
    Nuclear Scheme         =       TREUTLER

    Blocking Scheme        =         OCTREE
    BS radius alpha        =              1
    Pruning alpha          =              1
    Radial Points          =             75
    Spherical Points       =            302
    Total Points           =          43737
    Total Blocks           =            385
    Max Points             =            256
    Max Functions          =             19
    Weights Tolerance      =       1.00E-15


  -Total Gradient:
     Atom            X                  Y                   Z
    ------   -----------------  -----------------  -----------------
       1        0.000000000000    -0.000000000000    -0.000457792447
       2        0.000000000000    -0.000000000000     0.000457976417


*** tstop() called on Joses-MacBook-Pro-2.local at Thu Jul 17 12:19:34 2025
Module time:
	user time   =       0.31 seconds =       0.01 minutes
	system time =       0.74 seconds =       0.01 minutes
	total time  =          0 seconds =       0.00 minutes
Total time:
	user time   =       4.09 seconds =       0.07 minutes
	system time =      11.14 seconds =       0.19 minutes
	total time  =          2 seconds =       0.03 minutes

    			-----------------------------------------

    			 OPTKING 3.0: for geometry optimizations 

    			     By R.A. King, Bethel University     

    			        with contributions from          

    			    A.V. Copan, J. Cayton, A. Heide      

    			-----------------------------------------

    
	                            ===> Fragment 1 <== 

	 Z (Atomic Numbers)          Masses                          Geom                  
	       1.000000             1.007825          0.00000000  0.00000000  2.01737097   
	       6.000000            12.000000          0.00000000  0.00000000 -0.16942975   

	 - Coordinate -           - BOHR/RAD -       - ANG/DEG -
	 R(1,2)           =         2.186801           1.157205


	        --- Internal Coordinate Step in ANG or DEG, aJ/ANG or AJ/DEG ---
	-------------------------------------------------------------------------------
	           Coordinate      Previous         Force          Change          New 
	           ----------      --------        ------          ------        ------
	               R(1,2)       1.15721        0.00377        0.00116       1.15837
	-------------------------------------------------------------------------------

	                                 ==> Convergence Check <==                                  
    
	Measures of convergence in internal coordinates in au.
    
	Criteria marked as inactive (o), active & met (*), and active & unmet ( ).

	----------------------------------------------------------------------------------------------
	   Step    Total Energy     Delta E     Max Force     RMS Force      Max Disp      RMS Disp   
	----------------------------------------------------------------------------------------------
	  Convergence Criteria     1.00e-06 *    3.00e-04 *             o    1.20e-03 *             o
	----------------------------------------------------------------------------------------------
	     3     -38.05030214   -1.90e-05      4.58e-04      4.58e-04 o    2.20e-03      2.20e-03 o  ~
	----------------------------------------------------------------------------------------------

Next Geometry in Ang 
	Fragment 1 (Ang)

	    H   0.0000000000   0.0000000000   1.0681289518
	    C   0.0000000000   0.0000000000  -0.0902405704


    Structure for next step:
    Molecular point group: c2v
    Full point group: C_inf_v

    Geometry (in Angstrom), charge = 1, multiplicity = 3:

    H            0.000000000000     0.000000000000     1.068620944137
    C            0.000000000000     0.000000000000    -0.089748578122


Scratch directory: /tmp/
gradient() will perform analytic gradient computation.
   => Libint2 <=

    Primary   basis highest AM E, G, H:  6, 6, 3
    Auxiliary basis highest AM E, G, H:  7, 7, 4
    Onebody   basis highest AM E, G, H:  -, -, -
    Solid Harmonics ordering:            Gaussian

*** tstart() called on Joses-MacBook-Pro-2.local
*** at Thu Jul 17 12:19:34 2025

   => Loading Basis Set <=

    Name: CC-PVDZ
    Role: ORBITAL
    Keyword: BASIS
    atoms 1 entry H          line    22 file /Users/joseantoniorodriguesromero/anaconda3/share/psi4/basis/cc-pvdz.gbs 
    atoms 2 entry C          line   138 file /Users/joseantoniorodriguesromero/anaconda3/share/psi4/basis/cc-pvdz.gbs 


         ---------------------------------------------------------
                                   SCF
               by Justin Turney, Rob Parrish, Andy Simmonett
                          and Daniel G. A. Smith
                              UKS Reference
                        1 Threads,    500 MiB Core
         ---------------------------------------------------------

  ==> Geometry <==

    Molecular point group: c2v
    Full point group: C_inf_v

    Geometry (in Angstrom), charge = 1, multiplicity = 3:

       Center              X                  Y                   Z               Mass       
    ------------   -----------------  -----------------  -----------------  -----------------
         H            0.000000000000     0.000000000000     1.068620944137     1.007825032230
         C            0.000000000000     0.000000000000    -0.089748578122    12.000000000000

  Running in c2v symmetry.

  Rotational constants: A = ************  B =     13.51265  C =     13.51265 [cm^-1]
  Rotational constants: A = ************  B = 405099.07744  C = 405099.07744 [MHz]
  Nuclear repulsion =    2.740976176434043

  Charge       = 1
  Multiplicity = 3
  Electrons    = 6
  Nalpha       = 4
  Nbeta        = 2

  ==> Algorithm <==

  SCF Algorithm Type is DF.
  DIIS enabled.
  MOM disabled.
  Fractional occupation disabled.
  Guess Type is READ.
  Energy threshold   = 1.00e-08
  Density threshold  = 1.00e-08
  Integral threshold = 1.00e-12

  ==> Primary Basis <==

  Basis Set: CC-PVDZ
    Blend: CC-PVDZ
    Number of shells: 9
    Number of basis functions: 19
    Number of Cartesian functions: 20
    Spherical Harmonics?: true
    Max angular momentum: 2

  ==> DFT Potential <==

   => LibXC <=

    Version 6.2.2
    S. Lehtola, C. Steigemann, M. J.T. Oliveira, and M. A.L. Marques.,  SoftwareX 7, 1–5 (2018) (10.1016/j.softx.2017.11.002)

   => Composite Functional: B3LYP <= 

    B3LYP Hyb-GGA Exchange-Correlation Functional

    P. J. Stephens, F. J. Devlin, C. F. Chabalowski, and M. J. Frisch.,  J. Phys. Chem. 98, 11623 (1994) (10.1021/j100096a001)

    Deriv               =              1
    GGA                 =           TRUE
    Meta                =          FALSE

    Exchange Hybrid     =           TRUE
    MP2 Hybrid          =          FALSE

   => Exchange Functionals <=

    0.0800   Slater exchange
    0.7200         Becke 88

   => Exact (HF) Exchange <=

    0.2000               HF 

   => Correlation Functionals <=

    0.1900   Vosko, Wilk & Nusair (VWN5_RPA)
    0.8100   Lee, Yang & Parr

   => LibXC Density Thresholds  <==

    XC_HYB_GGA_XC_B3LYP:  1.00E-15 

   => Molecular Quadrature <=

    Radial Scheme          =       TREUTLER
    Pruning Scheme         =           NONE
    Nuclear Scheme         =       TREUTLER

    Blocking Scheme        =         OCTREE
    BS radius alpha        =              1
    Pruning alpha          =              1
    Radial Points          =             75
    Spherical Points       =            302
    Total Points           =          43741
    Total Blocks           =            385
    Max Points             =            256
    Max Functions          =             19
    Weights Tolerance      =       1.00E-15

   => Loading Basis Set <=

    Name: (CC-PVDZ AUX)
    Role: JKFIT
    Keyword: DF_BASIS_SCF
    atoms 1 entry H          line    51 file /Users/joseantoniorodriguesromero/anaconda3/share/psi4/basis/cc-pvdz-jkfit.gbs 
    atoms 2 entry C          line   121 file /Users/joseantoniorodriguesromero/anaconda3/share/psi4/basis/cc-pvdz-jkfit.gbs 

   => Loading Basis Set <=

    Name: CC-PVDZ
    Role: ORBITAL
    Keyword: BASIS
    atoms 1 entry H          line    22 file /Users/joseantoniorodriguesromero/anaconda3/share/psi4/basis/cc-pvdz.gbs 
    atoms 2 entry C          line   138 file /Users/joseantoniorodriguesromero/anaconda3/share/psi4/basis/cc-pvdz.gbs 

  Reading orbitals from file /tmp/triplet_HC.default.73667.180.npy, no projection.

  ==> Integral Setup <==

  DFHelper Memory: AOs need 0.000 GiB; user supplied 0.342 GiB. 
  Using in-core AOs.

  ==> MemDFJK: Density-Fitted J/K Matrices <==

    J tasked:                   Yes
    K tasked:                   Yes
    wK tasked:                   No
    OpenMP threads:               1
    Memory [MiB]:               349
    Algorithm:                 Core
    Schwarz Cutoff:           1E-12
    Mask sparsity (%):       0.0000
    Fitting Condition:        1E-10

   => Auxiliary Basis Set <=

  Basis Set: (CC-PVDZ AUX)
    Blend: CC-PVDZ-JKFIT
    Number of shells: 33
    Number of basis functions: 93
    Number of Cartesian functions: 106
    Spherical Harmonics?: true
    Max angular momentum: 3

  Cached 100.0% of DFT collocation blocks in 0.024 [GiB].

  Minimum eigenvalue in the overlap matrix is 4.0850187364E-02.
  Reciprocal condition number of the overlap matrix is 1.3494710107E-02.
    Using symmetric orthogonalization.

  ==> Pre-Iterations <==

  SCF Guess: Orbitals guess was supplied from a previous computation.

   -------------------------------------------------------
    Irrep   Nso     Nmo     Nalpha   Nbeta   Ndocc  Nsocc
   -------------------------------------------------------
     A1        10      10       3       2       2       1
     A2         1       1       0       0       0       0
     B1         4       4       1       0       0       1
     B2         4       4       0       0       0       0
   -------------------------------------------------------
    Total      19      19       4       2       2       2
   -------------------------------------------------------

  ==> Iterations <==

                           Total Energy        Delta E     RMS |[F,P]|

   @DF-UKS iter   0:   -38.04955723356080   -3.80496e+01   1.07823e-04 
   @DF-UKS iter   1:   -38.05030252169488   -7.45288e-04   1.76358e-05 DIIS
   @DF-UKS iter   2:   -38.05030256242061   -4.07257e-08   6.80354e-06 DIIS/DAMP=1%
   @DF-UKS iter   3:   -38.05030147138523    1.09104e-06   1.61267e-06 DIIS/DAMP=1%
   @DF-UKS iter   4:   -38.05030270148497   -1.23010e-06   5.39027e-07 DIIS/DAMP=1%
   @DF-UKS iter   5:   -38.05030251667088    1.84814e-07   6.27053e-08 DIIS/DAMP=1%
   @DF-UKS iter   6:   -38.05030257212761   -5.54567e-08   1.16962e-08 DIIS/DAMP=1%
   @DF-UKS iter   7:   -38.05030256730898    4.81863e-09   9.41702e-10 DIIS/DAMP=1%
  Energy and wave function converged.


  ==> Post-Iterations <==

   Electrons on quadrature grid:
      Nalpha   =    3.9999999810 ; deviation = -1.904e-08
      Nbeta    =    1.9999999858 ; deviation = -1.422e-08
      Ntotal   =    5.9999999667 ; deviation = -3.326e-08 

   @Spin Contamination Metric:   1.576652947E-03
   @S^2 Expected:                2.000000000E+00
   @S^2 Observed:                2.001576653E+00
   @S   Expected:                1.000000000E+00
   @S   Observed:                1.000000000E+00

    Orbital Energies [Eh]
    ---------------------

    Alpha Occupied:                                                       

       1A1   -10.779745     2A1    -1.062513     3A1    -0.791489  
       1B1    -0.673296  

    Alpha Virtual:                                                        

       1B2    -0.545596     4A1    -0.234953     5A1     0.100475  
       2B1     0.110905     6A1     0.128164     2B2     0.133547  
       7A1     0.391342     3B1     0.568918     3B2     0.575197  
       1A2     0.725296     8A1     0.735300     9A1     1.102207  
       4B1     1.306921     4B2     1.308224    10A1     1.857965  

    Beta Occupied:                                                        

       1A1   -10.745862     2A1    -0.970790  

    Beta Virtual:                                                         

       3A1    -0.565928     1B2    -0.497750     1B1    -0.444911  
       4A1    -0.194875     5A1     0.152130     2B2     0.153058  
       2B1     0.186327     6A1     0.202768     7A1     0.424239  
       3B2     0.632415     3B1     0.661749     8A1     0.812187  
       1A2     0.812607     9A1     1.185626     4B2     1.358499  
       4B1     1.380711    10A1     1.919096  

    Final Occupation by Irrep:
             A1    A2    B1    B2 
    DOCC [     2,    0,    0,    0 ]
    SOCC [     1,    0,    1,    0 ]
    NA   [     3,    0,    1,    0 ]
    NB   [     2,    0,    0,    0 ]

  @DF-UKS Final Energy:   -38.05030256730898

   => Energetics <=

    Nuclear Repulsion Energy =              2.7409761764340432
    One-Electron Energy =                 -53.4645084586275985
    Two-Electron Energy =                  16.9603701354870040
    DFT Exchange-Correlation Energy =      -4.2871404206024240
    Empirical Dispersion Energy =           0.0000000000000000
    VV10 Nonlocal Energy =                  0.0000000000000000
    Total Energy =                        -38.0503025673089752

  UHF NO Occupations:
  HONO-2 :    2 A1 1.9992116
  HONO-1 :    3 A1 1.0000000
  HONO-0 :    1 B1 1.0000000
  LUNO+0 :    4 A1 0.0007884
  LUNO+1 :    5 A1 0.0000002
  LUNO+2 :    2 B1 0.0000000
  LUNO+3 :    6 A1 0.0000000


Computation Completed


Properties will be evaluated at   0.000000,   0.000000,   0.000000 [a0]

Properties computed using the SCF density matrix


 Multipole Moments:

 ------------------------------------------------------------------------------------
     Multipole            Electronic (a.u.)      Nuclear  (a.u.)        Total (a.u.)
 ------------------------------------------------------------------------------------

 L = 1.  Multiply by 2.5417464519 to convert [e a0] to [Debye]
 Dipole X            :          0.0000000            0.0000000            0.0000000
 Dipole Y            :          0.0000000            0.0000000            0.0000000
 Dipole Z            :         -0.5371231            1.0017995            0.4646764
 Magnitude           :                                                    0.4646764

 ------------------------------------------------------------------------------------

*** tstop() called on Joses-MacBook-Pro-2.local at Thu Jul 17 12:19:34 2025
Module time:
	user time   =       1.08 seconds =       0.02 minutes
	system time =       2.69 seconds =       0.04 minutes
	total time  =          0 seconds =       0.00 minutes
Total time:
	user time   =       5.22 seconds =       0.09 minutes
	system time =      14.07 seconds =       0.23 minutes
	total time  =          2 seconds =       0.03 minutes

*** tstart() called on Joses-MacBook-Pro-2.local
*** at Thu Jul 17 12:19:34 2025


         ------------------------------------------------------------
                                   SCF GRAD                          
                          Rob Parrish, Justin Turney,                
                       Andy Simmonett, and Alex Sokolov              
         ------------------------------------------------------------

  ==> Geometry <==

    Molecular point group: c2v
    Full point group: C_inf_v

    Geometry (in Angstrom), charge = 1, multiplicity = 3:

       Center              X                  Y                   Z               Mass       
    ------------   -----------------  -----------------  -----------------  -----------------
         H            0.000000000000     0.000000000000     1.068620944137     1.007825032230
         C            0.000000000000     0.000000000000    -0.089748578122    12.000000000000

  Nuclear repulsion =    2.740976176434043

  ==> Basis Set <==

  Basis Set: CC-PVDZ
    Blend: CC-PVDZ
    Number of shells: 9
    Number of basis functions: 19
    Number of Cartesian functions: 20
    Spherical Harmonics?: true
    Max angular momentum: 2

  ==> DFJKGrad: Density-Fitted SCF Gradients <==

    Gradient:                    1
    J tasked:                  Yes
    K tasked:                  Yes
    wK tasked:                  No
    OpenMP threads:              1
    Integrals threads:           1
    Memory [MiB]:              375
    Schwarz Cutoff:          1E-12
    Fitting Condition:       1E-10

   => Auxiliary Basis Set <=

  Basis Set: (CC-PVDZ AUX)
    Blend: CC-PVDZ-JKFIT
    Number of shells: 33
    Number of basis functions: 93
    Number of Cartesian functions: 106
    Spherical Harmonics?: true
    Max angular momentum: 3

  ==> DFT Potential <==

   => LibXC <=

    Version 6.2.2
    S. Lehtola, C. Steigemann, M. J.T. Oliveira, and M. A.L. Marques.,  SoftwareX 7, 1–5 (2018) (10.1016/j.softx.2017.11.002)

   => Composite Functional: B3LYP <= 

    B3LYP Hyb-GGA Exchange-Correlation Functional

    P. J. Stephens, F. J. Devlin, C. F. Chabalowski, and M. J. Frisch.,  J. Phys. Chem. 98, 11623 (1994) (10.1021/j100096a001)

    Deriv               =              1
    GGA                 =           TRUE
    Meta                =          FALSE

    Exchange Hybrid     =           TRUE
    MP2 Hybrid          =          FALSE

   => Exchange Functionals <=

    0.0800   Slater exchange
    0.7200         Becke 88

   => Exact (HF) Exchange <=

    0.2000               HF 

   => Correlation Functionals <=

    0.1900   Vosko, Wilk & Nusair (VWN5_RPA)
    0.8100   Lee, Yang & Parr

   => LibXC Density Thresholds  <==

    XC_HYB_GGA_XC_B3LYP:  1.00E-15 

   => Molecular Quadrature <=

    Radial Scheme          =       TREUTLER
    Pruning Scheme         =           NONE
    Nuclear Scheme         =       TREUTLER

    Blocking Scheme        =         OCTREE
    BS radius alpha        =              1
    Pruning alpha          =              1
    Radial Points          =             75
    Spherical Points       =            302
    Total Points           =          43741
    Total Blocks           =            385
    Max Points             =            256
    Max Functions          =             19
    Weights Tolerance      =       1.00E-15


  -Total Gradient:
     Atom            X                  Y                   Z
    ------   -----------------  -----------------  -----------------
       1        0.000000000000     0.000000000000     0.000067216948
       2       -0.000000000000     0.000000000000    -0.000067030716


*** tstop() called on Joses-MacBook-Pro-2.local at Thu Jul 17 12:19:34 2025
Module time:
	user time   =       0.26 seconds =       0.00 minutes
	system time =       0.81 seconds =       0.01 minutes
	total time  =          0 seconds =       0.00 minutes
Total time:
	user time   =       5.48 seconds =       0.09 minutes
	system time =      14.88 seconds =       0.25 minutes
	total time  =          2 seconds =       0.03 minutes

    			-----------------------------------------

    			 OPTKING 3.0: for geometry optimizations 

    			     By R.A. King, Bethel University     

    			        with contributions from          

    			    A.V. Copan, J. Cayton, A. Heide      

    			-----------------------------------------

    
	                            ===> Fragment 1 <== 

	 Z (Atomic Numbers)          Masses                          Geom                  
	       1.000000             1.007825          0.00000000  0.00000000  2.01940092   
	       6.000000            12.000000          0.00000000  0.00000000 -0.16960023   

	 - Coordinate -           - BOHR/RAD -       - ANG/DEG -
	 R(1,2)           =         2.189001           1.158370


	        --- Internal Coordinate Step in ANG or DEG, aJ/ANG or AJ/DEG ---
	-------------------------------------------------------------------------------
	           Coordinate      Previous         Force          Change          New 
	           ----------      --------        ------          ------        ------
	               R(1,2)       1.15837       -0.00055       -0.00017       1.15820
	-------------------------------------------------------------------------------

	                                 ==> Convergence Check <==                                  
    
	Measures of convergence in internal coordinates in au.
    
	Criteria marked as inactive (o), active & met (*), and active & unmet ( ).

	----------------------------------------------------------------------------------------------
	   Step    Total Energy     Delta E     Max Force     RMS Force      Max Disp      RMS Disp   
	----------------------------------------------------------------------------------------------
	  Convergence Criteria     1.00e-06 *    3.00e-04 *             o    1.20e-03 *             o
	----------------------------------------------------------------------------------------------
	     4     -38.05030257   -4.28e-07 *    6.71e-05 *    6.71e-05 o    3.24e-04 *    3.24e-04 o  ~
	----------------------------------------------------------------------------------------------

Next Geometry in Ang 
	Fragment 1 (Ang)

	    H   0.0000000000   0.0000000000   1.0685352430
	    C   0.0000000000   0.0000000000  -0.0896628769


    Final optimized geometry and variables:
    Molecular point group: c2v
    Full point group: C_inf_v

    Geometry (in Angstrom), charge = 1, multiplicity = 3:

    H            0.000000000000     0.000000000000     1.068620944137
    C            0.000000000000     0.000000000000    -0.089748578122


    Psi4 stopped on: Thursday, 17 July 2025 12:19PM
    Psi4 wall time for execution: 0:00:02.99

*** Psi4 exiting successfully. Buy a developer a beer!
