
    -----------------------------------------------------------------------
          Psi4: An Open-Source Ab Initio Electronic Structure Package
                               Psi4 1.9.1 release

                         Git: Rev {} zzzzzzz 


    D. G. A. Smith, L. A. Burns, A. C. Simmonett, R. M. Parrish,
    M. C. Schieber, R. Galvelis, P. Kraus, H. Kruse, R. Di Remigio,
    A. Alenaizan, A. M. James, S. Lehtola, J. P. Misiewicz, M. Scheurer,
    R. A. Shaw, J. B. Schriber, Y. Xie, Z. L. Glick, D. A. Sirianni,
    J. S. O'Brien, J. M. Waldrop, A. Kumar, E. G. Hohenstein,
    B. P. Pritchard, B. R. Brooks, H. F. Schaefer III, A. Yu. Sokolov,
    K. Patkowski, A. E. DePrince III, U. Bozkaya, R. A. King,
    F. A. Evangelista, J. M. Turney, T. D. Crawford, C. D. Sherrill,
    J. Chem. Phys. 152(18) 184108 (2020). https://doi.org/10.1063/5.0006002

                            Additional Code Authors
    E. T. Seidl, C. L. Janssen, E. F. Valeev, M. L. Leininger,
    J. F. Gonthier, R. M. Richard, H. R. McAlexander, M. Saitow, X. Wang,
    P. Verma, M. H. Lechner, A. Jiang, S. Behnle, A. G. Heide,
    M. F. Herbst, and D. L. Poole

             Previous Authors, Complete List of Code Contributors,
                       and Citations for Specific Modules
    https://github.com/psi4/psi4/blob/master/codemeta.json
    https://github.com/psi4/psi4/graphs/contributors
    http://psicode.org/psi4manual/master/introduction.html#citing-psifour

    -----------------------------------------------------------------------


    Psi4 started on: Thursday, 17 July 2025 02:01PM

    Process ID: 74543
    Host:       Joses-MacBook-Pro-2.local
    PSIDATADIR: /Users/joseantoniorodriguesromero/anaconda3/share/psi4
    Memory:     500.0 MiB
    Threads:    1
    
  ==> Input File <==

--------------------------------------------------------------------------
molecule { 
1 3
O   0.00000        0.60000        0.00000
F   0.00000       -0.60000        0.00000
}

set { 
basis              cc-pvdz
reference          uks
maxiter            500
geom_maxiter       500
DAMPING_PERCENTAGE 1
guess              SAP
}

optimize('b3lyp')
--------------------------------------------------------------------------

Scratch directory: /tmp/
gradient() will perform analytic gradient computation.
   => Libint2 <=

    Primary   basis highest AM E, G, H:  6, 6, 3
    Auxiliary basis highest AM E, G, H:  7, 7, 4
    Onebody   basis highest AM E, G, H:  -, -, -
    Solid Harmonics ordering:            Gaussian

*** tstart() called on Joses-MacBook-Pro-2.local
*** at Thu Jul 17 14:01:18 2025

   => Loading Basis Set <=

    Name: CC-PVDZ
    Role: ORBITAL
    Keyword: BASIS
    atoms 1 entry O          line   198 file /Users/joseantoniorodriguesromero/anaconda3/share/psi4/basis/cc-pvdz.gbs 
    atoms 2 entry F          line   228 file /Users/joseantoniorodriguesromero/anaconda3/share/psi4/basis/cc-pvdz.gbs 


         ---------------------------------------------------------
                                   SCF
               by Justin Turney, Rob Parrish, Andy Simmonett
                          and Daniel G. A. Smith
                              UKS Reference
                        1 Threads,    500 MiB Core
         ---------------------------------------------------------

  ==> Geometry <==

    Molecular point group: c2v
    Full point group: C_inf_v

    Geometry (in Angstrom), charge = 1, multiplicity = 3:

       Center              X                  Y                   Z               Mass       
    ------------   -----------------  -----------------  -----------------  -----------------
         O            0.000000000000     0.000000000000     0.651498207089    15.994914619570
         F            0.000000000000     0.000000000000    -0.548501792911    18.998403162730

  Running in c2v symmetry.

  Rotational constants: A = ************  B =      1.34809  C =      1.34809 [cm^-1]
  Rotational constants: A = ************  B =  40414.83427  C =  40414.83427 [MHz]
  Nuclear repulsion =   31.750632640200006

  Charge       = 1
  Multiplicity = 3
  Electrons    = 16
  Nalpha       = 9
  Nbeta        = 7

  ==> Algorithm <==

  SCF Algorithm Type is DF.
  DIIS enabled.
  MOM disabled.
  Fractional occupation disabled.
  Guess Type is SAP.
  Energy threshold   = 1.00e-08
  Density threshold  = 1.00e-08
  Integral threshold = 1.00e-12

  ==> Primary Basis <==

  Basis Set: CC-PVDZ
    Blend: CC-PVDZ
    Number of shells: 12
    Number of basis functions: 28
    Number of Cartesian functions: 30
    Spherical Harmonics?: true
    Max angular momentum: 2

  ==> DFT Potential <==

   => LibXC <=

    Version 6.2.2
    S. Lehtola, C. Steigemann, M. J.T. Oliveira, and M. A.L. Marques.,  SoftwareX 7, 1–5 (2018) (10.1016/j.softx.2017.11.002)

   => Composite Functional: B3LYP <= 

    B3LYP Hyb-GGA Exchange-Correlation Functional

    P. J. Stephens, F. J. Devlin, C. F. Chabalowski, and M. J. Frisch.,  J. Phys. Chem. 98, 11623 (1994) (10.1021/j100096a001)

    Deriv               =              1
    GGA                 =           TRUE
    Meta                =          FALSE

    Exchange Hybrid     =           TRUE
    MP2 Hybrid          =          FALSE

   => Exchange Functionals <=

    0.0800   Slater exchange
    0.7200         Becke 88

   => Exact (HF) Exchange <=

    0.2000               HF 

   => Correlation Functionals <=

    0.1900   Vosko, Wilk & Nusair (VWN5_RPA)
    0.8100   Lee, Yang & Parr

   => LibXC Density Thresholds  <==

    XC_HYB_GGA_XC_B3LYP:  1.00E-15 

   => Molecular Quadrature <=

    Radial Scheme          =       TREUTLER
    Pruning Scheme         =           NONE
    Nuclear Scheme         =       TREUTLER

    Blocking Scheme        =         OCTREE
    BS radius alpha        =              1
    Pruning alpha          =              1
    Radial Points          =             75
    Spherical Points       =            302
    Total Points           =          42011
    Total Blocks           =            368
    Max Points             =            253
    Max Functions          =             28
    Weights Tolerance      =       1.00E-15

   => Loading Basis Set <=

    Name: (CC-PVDZ AUX)
    Role: JKFIT
    Keyword: DF_BASIS_SCF
    atoms 1 entry O          line   221 file /Users/joseantoniorodriguesromero/anaconda3/share/psi4/basis/cc-pvdz-jkfit.gbs 
    atoms 2 entry F          line   271 file /Users/joseantoniorodriguesromero/anaconda3/share/psi4/basis/cc-pvdz-jkfit.gbs 

  ==> Integral Setup <==

  DFHelper Memory: AOs need 0.001 GiB; user supplied 0.333 GiB. 
  Using in-core AOs.

  ==> MemDFJK: Density-Fitted J/K Matrices <==

    J tasked:                   Yes
    K tasked:                   Yes
    wK tasked:                   No
    OpenMP threads:               1
    Memory [MiB]:               340
    Algorithm:                 Core
    Schwarz Cutoff:           1E-12
    Mask sparsity (%):       0.0000
    Fitting Condition:        1E-10

   => Auxiliary Basis Set <=

  Basis Set: (CC-PVDZ AUX)
    Blend: CC-PVDZ-JKFIT
    Number of shells: 48
    Number of basis functions: 140
    Number of Cartesian functions: 162
    Spherical Harmonics?: true
    Max angular momentum: 3

  Cached 100.0% of DFT collocation blocks in 0.034 [GiB].

  Minimum eigenvalue in the overlap matrix is 2.7627076544E-02.
  Reciprocal condition number of the overlap matrix is 1.0031729215E-02.
    Using symmetric orthogonalization.

  ==> Pre-Iterations <==

  SCF Guess: Superposition of Atomic Potentials (doi:10.1021/acs.jctc.8b01089).

  ==> SAP guess <==

   => Molecular Quadrature <=

    Radial Scheme          =       TREUTLER
    Pruning Scheme         =           NONE
    Nuclear Scheme         =       TREUTLER

    Blocking Scheme        =         OCTREE
    BS radius alpha        =              1
    Pruning alpha          =              1
    Radial Points          =             75
    Spherical Points       =            302
    Total Points           =          42011
    Total Blocks           =            368
    Max Points             =            253
    Max Functions          =             28
    Weights Tolerance      =       1.00E-15

   -------------------------------------------------------
    Irrep   Nso     Nmo     Nalpha   Nbeta   Ndocc  Nsocc
   -------------------------------------------------------
     A1        14      14       5       5       5       0
     A2         2       2       0       0       0       0
     B1         6       6       2       1       1       1
     B2         6       6       2       1       1       1
   -------------------------------------------------------
    Total      28      28       9       7       7       2
   -------------------------------------------------------

  ==> Iterations <==

                           Total Energy        Delta E     RMS |[F,P]|

   @DF-UKS iter   1:  -174.39856523222599   -1.74399e+02   1.35446e-02 ADIIS/DIIS
   @DF-UKS iter   2:  -174.40692335857321   -8.35813e-03   1.01907e-02 ADIIS/DIIS/DAMP=1%
   @DF-UKS iter   3:  -174.40882804158466   -1.90468e-03   1.08467e-02 ADIIS/DIIS/DAMP=1%
   @DF-UKS iter   4:  -174.41380382907633   -4.97579e-03   1.91741e-03 ADIIS/DIIS/DAMP=1%
   @DF-UKS iter   5:  -174.41500401184399   -1.20018e-03   2.16007e-04 ADIIS/DIIS/DAMP=1%
   @DF-UKS iter   6:  -174.41534209480650   -3.38083e-04   9.20966e-05 DIIS/DAMP=1%
   @DF-UKS iter   7:  -174.41527421719900    6.78776e-05   2.95522e-05 DIIS/DAMP=1%
   @DF-UKS iter   8:  -174.41528054808171   -6.33088e-06   4.23301e-06 DIIS/DAMP=1%
   @DF-UKS iter   9:  -174.41527701506647    3.53302e-06   3.78983e-07 DIIS/DAMP=1%
   @DF-UKS iter  10:  -174.41527752758861   -5.12522e-07   5.53806e-08 DIIS/DAMP=1%
   @DF-UKS iter  11:  -174.41527749725824    3.03304e-08   2.55765e-08 DIIS/DAMP=1%
   @DF-UKS iter  12:  -174.41527749470276    2.55548e-09   7.58180e-10 DIIS/DAMP=1%
  Energy and wave function converged.


  ==> Post-Iterations <==

   Electrons on quadrature grid:
      Nalpha   =    8.9999997635 ; deviation = -2.365e-07
      Nbeta    =    6.9999998519 ; deviation = -1.481e-07
      Ntotal   =   15.9999996154 ; deviation = -3.846e-07 

   @Spin Contamination Metric:   5.324746951E-03
   @S^2 Expected:                2.000000000E+00
   @S^2 Observed:                2.005324747E+00
   @S   Expected:                1.000000000E+00
   @S   Observed:                1.000000000E+00

    Orbital Energies [Eh]
    ---------------------

    Alpha Occupied:                                                       

       1A1   -25.332319     2A1   -19.867068     3A1    -1.945488  
       4A1    -1.429478     1B2    -1.088673     1B1    -1.088673  
       5A1    -1.079816     2B2    -0.846766     2B1    -0.846766  

    Alpha Virtual:                                                        

       6A1    -0.362100     7A1     0.401887     3B1     0.412463  
       3B2     0.412463     8A1     0.665738     4B1     0.720805  
       4B2     0.720805     9A1     0.740715    10A1     1.614198  
       5B2     1.844484     5B1     1.844484     1A2     1.932285  
      11A1     1.932286    12A1     2.384751     2A2     2.986497  
      13A1     2.986499     6B2     3.372549     6B1     3.372549  
      14A1     4.008162  

    Beta Occupied:                                                        

       1A1   -25.312286     2A1   -19.821186     3A1    -1.892313  
       4A1    -1.330272     5A1    -1.031762     1B2    -0.988680  
       1B1    -0.988680  

    Beta Virtual:                                                         

       2B1    -0.617073     2B2    -0.617073     6A1    -0.311960  
       7A1     0.419998     3B1     0.489349     3B2     0.489349  
       8A1     0.710061     9A1     0.756636     4B1     0.757234  
       4B2     0.757234    10A1     1.639602     5B2     1.905040  
       5B1     1.905040    11A1     2.063595     1A2     2.063596  
      12A1     2.439953     2A2     3.042296    13A1     3.042299  
       6B2     3.414260     6B1     3.414260    14A1     4.040235  

    Final Occupation by Irrep:
             A1    A2    B1    B2 
    DOCC [     5,    0,    1,    1 ]
    SOCC [     0,    0,    1,    1 ]
    NA   [     5,    0,    2,    2 ]
    NB   [     5,    0,    1,    1 ]

  @DF-UKS Final Energy:  -174.41527749470276

   => Energetics <=

    Nuclear Repulsion Energy =             31.7506326402000063
    One-Electron Energy =                -296.7125394047563418
    Two-Electron Energy =                 105.4950686520028285
    DFT Exchange-Correlation Energy =     -14.9484393821492656
    Empirical Dispersion Energy =           0.0000000000000000
    VV10 Nonlocal Energy =                  0.0000000000000000
    Total Energy =                       -174.4152774947027638

  UHF NO Occupations:
  HONO-2 :    5 A1 1.9989908
  HONO-1 :    2 B1 1.0000000
  HONO-0 :    2 B2 1.0000000
  LUNO+0 :    6 A1 0.0010092
  LUNO+1 :    3 B1 0.0007269
  LUNO+2 :    3 B2 0.0007269
  LUNO+3 :    7 A1 0.0001566


Computation Completed


Properties will be evaluated at   0.000000,   0.000000,   0.000000 [a0]

Properties computed using the SCF density matrix


 Multipole Moments:

 ------------------------------------------------------------------------------------
     Multipole            Electronic (a.u.)      Nuclear  (a.u.)        Total (a.u.)
 ------------------------------------------------------------------------------------

 L = 1.  Multiply by 2.5417464519 to convert [e a0] to [Debye]
 Dipole X            :          0.0000000            0.0000000            0.0000000
 Dipole Y            :          0.0000000            0.0000000            0.0000000
 Dipole Z            :         -0.2373758            0.5205619            0.2831861
 Magnitude           :                                                    0.2831861

 ------------------------------------------------------------------------------------

*** tstop() called on Joses-MacBook-Pro-2.local at Thu Jul 17 14:01:19 2025
Module time:
	user time   =       2.91 seconds =       0.05 minutes
	system time =       6.23 seconds =       0.10 minutes
	total time  =          1 seconds =       0.02 minutes
Total time:
	user time   =       2.91 seconds =       0.05 minutes
	system time =       6.23 seconds =       0.10 minutes
	total time  =          1 seconds =       0.02 minutes

*** tstart() called on Joses-MacBook-Pro-2.local
*** at Thu Jul 17 14:01:19 2025


         ------------------------------------------------------------
                                   SCF GRAD                          
                          Rob Parrish, Justin Turney,                
                       Andy Simmonett, and Alex Sokolov              
         ------------------------------------------------------------

  ==> Geometry <==

    Molecular point group: c2v
    Full point group: C_inf_v

    Geometry (in Angstrom), charge = 1, multiplicity = 3:

       Center              X                  Y                   Z               Mass       
    ------------   -----------------  -----------------  -----------------  -----------------
         O            0.000000000000     0.000000000000     0.651498207089    15.994914619570
         F            0.000000000000     0.000000000000    -0.548501792911    18.998403162730

  Nuclear repulsion =   31.750632640200006

  ==> Basis Set <==

  Basis Set: CC-PVDZ
    Blend: CC-PVDZ
    Number of shells: 12
    Number of basis functions: 28
    Number of Cartesian functions: 30
    Spherical Harmonics?: true
    Max angular momentum: 2

  ==> DFJKGrad: Density-Fitted SCF Gradients <==

    Gradient:                    1
    J tasked:                  Yes
    K tasked:                  Yes
    wK tasked:                  No
    OpenMP threads:              1
    Integrals threads:           1
    Memory [MiB]:              375
    Schwarz Cutoff:          1E-12
    Fitting Condition:       1E-10

   => Auxiliary Basis Set <=

  Basis Set: (CC-PVDZ AUX)
    Blend: CC-PVDZ-JKFIT
    Number of shells: 48
    Number of basis functions: 140
    Number of Cartesian functions: 162
    Spherical Harmonics?: true
    Max angular momentum: 3

  ==> DFT Potential <==

   => LibXC <=

    Version 6.2.2
    S. Lehtola, C. Steigemann, M. J.T. Oliveira, and M. A.L. Marques.,  SoftwareX 7, 1–5 (2018) (10.1016/j.softx.2017.11.002)

   => Composite Functional: B3LYP <= 

    B3LYP Hyb-GGA Exchange-Correlation Functional

    P. J. Stephens, F. J. Devlin, C. F. Chabalowski, and M. J. Frisch.,  J. Phys. Chem. 98, 11623 (1994) (10.1021/j100096a001)

    Deriv               =              1
    GGA                 =           TRUE
    Meta                =          FALSE

    Exchange Hybrid     =           TRUE
    MP2 Hybrid          =          FALSE

   => Exchange Functionals <=

    0.0800   Slater exchange
    0.7200         Becke 88

   => Exact (HF) Exchange <=

    0.2000               HF 

   => Correlation Functionals <=

    0.1900   Vosko, Wilk & Nusair (VWN5_RPA)
    0.8100   Lee, Yang & Parr

   => LibXC Density Thresholds  <==

    XC_HYB_GGA_XC_B3LYP:  1.00E-15 

   => Molecular Quadrature <=

    Radial Scheme          =       TREUTLER
    Pruning Scheme         =           NONE
    Nuclear Scheme         =       TREUTLER

    Blocking Scheme        =         OCTREE
    BS radius alpha        =              1
    Pruning alpha          =              1
    Radial Points          =             75
    Spherical Points       =            302
    Total Points           =          42011
    Total Blocks           =            368
    Max Points             =            253
    Max Functions          =             28
    Weights Tolerance      =       1.00E-15


  -Total Gradient:
     Atom            X                  Y                   Z
    ------   -----------------  -----------------  -----------------
       1        0.000000000000     0.000000000000    -0.040438371310
       2        0.000000000000    -0.000000000000     0.040443518463


*** tstop() called on Joses-MacBook-Pro-2.local at Thu Jul 17 14:01:20 2025
Module time:
	user time   =       0.52 seconds =       0.01 minutes
	system time =       1.60 seconds =       0.03 minutes
	total time  =          1 seconds =       0.02 minutes
Total time:
	user time   =       3.43 seconds =       0.06 minutes
	system time =       7.84 seconds =       0.13 minutes
	total time  =          2 seconds =       0.03 minutes

    			-----------------------------------------

    			 OPTKING 3.0: for geometry optimizations 

    			     By R.A. King, Bethel University     

    			        with contributions from          

    			    A.V. Copan, J. Cayton, A. Heide      

    			-----------------------------------------

    
	                            ===> Fragment 1 <== 

	 Z (Atomic Numbers)          Masses                          Geom                  
	       8.000000            15.994915          0.00000000  0.00000000  1.23115318   
	       9.000000            18.998403          0.00000000  0.00000000 -1.03651817   

	 - Coordinate -           - BOHR/RAD -       - ANG/DEG -
	 R(1,2)           =         2.267671           1.200000


	        --- Internal Coordinate Step in ANG or DEG, aJ/ANG or AJ/DEG ---
	-------------------------------------------------------------------------------
	           Coordinate      Previous         Force          Change          New 
	           ----------      --------        ------          ------        ------
	               R(1,2)       1.20000        0.33318        0.02039       1.22039
	-------------------------------------------------------------------------------

	                                 ==> Convergence Check <==                                  
    
	Measures of convergence in internal coordinates in au.
    
	Criteria marked as inactive (o), active & met (*), and active & unmet ( ).

	----------------------------------------------------------------------------------------------
	   Step    Total Energy     Delta E     Max Force     RMS Force      Max Disp      RMS Disp   
	----------------------------------------------------------------------------------------------
	  Convergence Criteria     1.00e-06 *    3.00e-04 *             o    1.20e-03 *             o
	----------------------------------------------------------------------------------------------
	     1    -174.41527749   -1.74e+02      4.04e-02      4.04e-02 o    3.85e-02      3.85e-02 o  ~
	----------------------------------------------------------------------------------------------

Next Geometry in Ang 
	Fragment 1 (Ang)

	    O   0.0000000000   0.0000000000   0.6616909387
	    F   0.0000000000   0.0000000000  -0.5586945245


    Structure for next step:
    Molecular point group: c2v
    Full point group: C_inf_v

    Geometry (in Angstrom), charge = 1, multiplicity = 3:

    O            0.000000000000     0.000000000000     0.662565784360
    F            0.000000000000     0.000000000000    -0.557819678839


Scratch directory: /tmp/
gradient() will perform analytic gradient computation.
   => Libint2 <=

    Primary   basis highest AM E, G, H:  6, 6, 3
    Auxiliary basis highest AM E, G, H:  7, 7, 4
    Onebody   basis highest AM E, G, H:  -, -, -
    Solid Harmonics ordering:            Gaussian

*** tstart() called on Joses-MacBook-Pro-2.local
*** at Thu Jul 17 14:01:20 2025

   => Loading Basis Set <=

    Name: CC-PVDZ
    Role: ORBITAL
    Keyword: BASIS
    atoms 1 entry O          line   198 file /Users/joseantoniorodriguesromero/anaconda3/share/psi4/basis/cc-pvdz.gbs 
    atoms 2 entry F          line   228 file /Users/joseantoniorodriguesromero/anaconda3/share/psi4/basis/cc-pvdz.gbs 


         ---------------------------------------------------------
                                   SCF
               by Justin Turney, Rob Parrish, Andy Simmonett
                          and Daniel G. A. Smith
                              UKS Reference
                        1 Threads,    500 MiB Core
         ---------------------------------------------------------

  ==> Geometry <==

    Molecular point group: c2v
    Full point group: C_inf_v

    Geometry (in Angstrom), charge = 1, multiplicity = 3:

       Center              X                  Y                   Z               Mass       
    ------------   -----------------  -----------------  -----------------  -----------------
         O            0.000000000000     0.000000000000     0.662565784360    15.994914619570
         F            0.000000000000     0.000000000000    -0.557819678839    18.998403162730

  Running in c2v symmetry.

  Rotational constants: A = ************  B =      1.30343  C =      1.30343 [cm^-1]
  Rotational constants: A = ************  B =  39075.92278  C =  39075.92278 [MHz]
  Nuclear repulsion =   31.220266315171639

  Charge       = 1
  Multiplicity = 3
  Electrons    = 16
  Nalpha       = 9
  Nbeta        = 7

  ==> Algorithm <==

  SCF Algorithm Type is DF.
  DIIS enabled.
  MOM disabled.
  Fractional occupation disabled.
  Guess Type is READ.
  Energy threshold   = 1.00e-08
  Density threshold  = 1.00e-08
  Integral threshold = 1.00e-12

  ==> Primary Basis <==

  Basis Set: CC-PVDZ
    Blend: CC-PVDZ
    Number of shells: 12
    Number of basis functions: 28
    Number of Cartesian functions: 30
    Spherical Harmonics?: true
    Max angular momentum: 2

  ==> DFT Potential <==

   => LibXC <=

    Version 6.2.2
    S. Lehtola, C. Steigemann, M. J.T. Oliveira, and M. A.L. Marques.,  SoftwareX 7, 1–5 (2018) (10.1016/j.softx.2017.11.002)

   => Composite Functional: B3LYP <= 

    B3LYP Hyb-GGA Exchange-Correlation Functional

    P. J. Stephens, F. J. Devlin, C. F. Chabalowski, and M. J. Frisch.,  J. Phys. Chem. 98, 11623 (1994) (10.1021/j100096a001)

    Deriv               =              1
    GGA                 =           TRUE
    Meta                =          FALSE

    Exchange Hybrid     =           TRUE
    MP2 Hybrid          =          FALSE

   => Exchange Functionals <=

    0.0800   Slater exchange
    0.7200         Becke 88

   => Exact (HF) Exchange <=

    0.2000               HF 

   => Correlation Functionals <=

    0.1900   Vosko, Wilk & Nusair (VWN5_RPA)
    0.8100   Lee, Yang & Parr

   => LibXC Density Thresholds  <==

    XC_HYB_GGA_XC_B3LYP:  1.00E-15 

   => Molecular Quadrature <=

    Radial Scheme          =       TREUTLER
    Pruning Scheme         =           NONE
    Nuclear Scheme         =       TREUTLER

    Blocking Scheme        =         OCTREE
    BS radius alpha        =              1
    Pruning alpha          =              1
    Radial Points          =             75
    Spherical Points       =            302
    Total Points           =          42012
    Total Blocks           =            367
    Max Points             =            252
    Max Functions          =             28
    Weights Tolerance      =       1.00E-15

   => Loading Basis Set <=

    Name: (CC-PVDZ AUX)
    Role: JKFIT
    Keyword: DF_BASIS_SCF
    atoms 1 entry O          line   221 file /Users/joseantoniorodriguesromero/anaconda3/share/psi4/basis/cc-pvdz-jkfit.gbs 
    atoms 2 entry F          line   271 file /Users/joseantoniorodriguesromero/anaconda3/share/psi4/basis/cc-pvdz-jkfit.gbs 

   => Loading Basis Set <=

    Name: CC-PVDZ
    Role: ORBITAL
    Keyword: BASIS
    atoms 1 entry O          line   198 file /Users/joseantoniorodriguesromero/anaconda3/share/psi4/basis/cc-pvdz.gbs 
    atoms 2 entry F          line   228 file /Users/joseantoniorodriguesromero/anaconda3/share/psi4/basis/cc-pvdz.gbs 

  Reading orbitals from file /tmp/triplet_OF.default.74543.180.npy, no projection.

  ==> Integral Setup <==

  DFHelper Memory: AOs need 0.001 GiB; user supplied 0.333 GiB. 
  Using in-core AOs.

  ==> MemDFJK: Density-Fitted J/K Matrices <==

    J tasked:                   Yes
    K tasked:                   Yes
    wK tasked:                   No
    OpenMP threads:               1
    Memory [MiB]:               340
    Algorithm:                 Core
    Schwarz Cutoff:           1E-12
    Mask sparsity (%):       0.0000
    Fitting Condition:        1E-10

   => Auxiliary Basis Set <=

  Basis Set: (CC-PVDZ AUX)
    Blend: CC-PVDZ-JKFIT
    Number of shells: 48
    Number of basis functions: 140
    Number of Cartesian functions: 162
    Spherical Harmonics?: true
    Max angular momentum: 3

  Cached 100.0% of DFT collocation blocks in 0.034 [GiB].

  Minimum eigenvalue in the overlap matrix is 2.9308155054E-02.
  Reciprocal condition number of the overlap matrix is 1.0728074769E-02.
    Using symmetric orthogonalization.

  ==> Pre-Iterations <==

  SCF Guess: Orbitals guess was supplied from a previous computation.

   -------------------------------------------------------
    Irrep   Nso     Nmo     Nalpha   Nbeta   Ndocc  Nsocc
   -------------------------------------------------------
     A1        14      14       5       5       5       0
     A2         2       2       0       0       0       0
     B1         6       6       2       1       1       1
     B2         6       6       2       1       1       1
   -------------------------------------------------------
    Total      28      28       9       7       7       2
   -------------------------------------------------------

  ==> Iterations <==

                           Total Energy        Delta E     RMS |[F,P]|

   @DF-UKS iter   0:  -174.39170543648510   -1.74392e+02   4.30757e-03 
   @DF-UKS iter   1:  -174.41608188482846   -2.43764e-02   1.50440e-03 ADIIS/DIIS
   @DF-UKS iter   2:  -174.41517233384027    9.09551e-04   3.51094e-03 ADIIS/DIIS/DAMP=1%
   @DF-UKS iter   3:  -174.41574040369838   -5.68070e-04   5.05706e-04 ADIIS/DIIS/DAMP=1%
   @DF-UKS iter   4:  -174.41629176303667   -5.51359e-04   1.95999e-05 DIIS/DAMP=1%
   @DF-UKS iter   5:  -174.41628868070114    3.08234e-06   1.56051e-05 DIIS/DAMP=1%
   @DF-UKS iter   6:  -174.41627933631560    9.34439e-06   6.61644e-06 DIIS/DAMP=1%
   @DF-UKS iter   7:  -174.41628240801057   -3.07169e-06   1.32236e-06 DIIS/DAMP=1%
   @DF-UKS iter   8:  -174.41628117008523    1.23793e-06   6.65777e-08 DIIS/DAMP=1%
   @DF-UKS iter   9:  -174.41628135822680   -1.88142e-07   2.45976e-08 DIIS/DAMP=1%
   @DF-UKS iter  10:  -174.41628135378684    4.43995e-09   1.97900e-09 DIIS/DAMP=1%
  Energy and wave function converged.


  ==> Post-Iterations <==

   Electrons on quadrature grid:
      Nalpha   =    8.9999998440 ; deviation = -1.560e-07
      Nbeta    =    6.9999998930 ; deviation = -1.070e-07
      Ntotal   =   15.9999997370 ; deviation = -2.630e-07 

   @Spin Contamination Metric:   5.423197175E-03
   @S^2 Expected:                2.000000000E+00
   @S^2 Observed:                2.005423197E+00
   @S   Expected:                1.000000000E+00
   @S   Observed:                1.000000000E+00

    Orbital Energies [Eh]
    ---------------------

    Alpha Occupied:                                                       

       1A1   -25.328004     2A1   -19.870683     3A1    -1.925274  
       4A1    -1.434262     1B2    -1.078780     1B1    -1.078780  
       5A1    -1.075080     2B2    -0.851358     2B1    -0.851358  

    Alpha Virtual:                                                        

       6A1    -0.388137     7A1     0.405693     3B2     0.411716  
       3B1     0.411716     8A1     0.669436     4B1     0.722406  
       4B2     0.722406     9A1     0.751783    10A1     1.599912  
       5B2     1.852921     5B1     1.852921     1A2     1.934476  
      11A1     1.934476    12A1     2.340715     2A2     2.990935  
      13A1     2.990935     6B1     3.342311     6B2     3.342311  
      14A1     3.996457  

    Beta Occupied:                                                        

       1A1   -25.308491     2A1   -19.824544     3A1    -1.872187  
       4A1    -1.333359     5A1    -1.028626     1B2    -0.978745  
       1B1    -0.978745  

    Beta Virtual:                                                         

       2B1    -0.622140     2B2    -0.622140     6A1    -0.338590  
       7A1     0.424216     3B2     0.489210     3B1     0.489210  
       8A1     0.714094     4B1     0.758267     4B2     0.758267  
       9A1     0.767481    10A1     1.624930     5B2     1.914610  
       5B1     1.914610    11A1     2.067112     1A2     2.067112  
      12A1     2.395498     2A2     3.045339    13A1     3.045341  
       6B1     3.382752     6B2     3.382752    14A1     4.028469  

    Final Occupation by Irrep:
             A1    A2    B1    B2 
    DOCC [     5,    0,    1,    1 ]
    SOCC [     0,    0,    1,    1 ]
    NA   [     5,    0,    2,    2 ]
    NB   [     5,    0,    1,    1 ]

  @DF-UKS Final Energy:  -174.41628135378684

   => Energetics <=

    Nuclear Repulsion Energy =             31.2202663151716386
    One-Electron Energy =                -295.7344571677961085
    Two-Electron Energy =                 105.0331931642605241
    DFT Exchange-Correlation Energy =     -14.9352836654228849
    Empirical Dispersion Energy =           0.0000000000000000
    VV10 Nonlocal Energy =                  0.0000000000000000
    Total Energy =                       -174.4162813537868431

  UHF NO Occupations:
  HONO-2 :    5 A1 1.9989690
  HONO-1 :    2 B1 1.0000000
  HONO-0 :    2 B2 1.0000000
  LUNO+0 :    6 A1 0.0010310
  LUNO+1 :    3 B2 0.0007305
  LUNO+2 :    3 B1 0.0007305
  LUNO+3 :    7 A1 0.0001759


Computation Completed


Properties will be evaluated at   0.000000,   0.000000,   0.000000 [a0]

Properties computed using the SCF density matrix


 Multipole Moments:

 ------------------------------------------------------------------------------------
     Multipole            Electronic (a.u.)      Nuclear  (a.u.)        Total (a.u.)
 ------------------------------------------------------------------------------------

 L = 1.  Multiply by 2.5417464519 to convert [e a0] to [Debye]
 Dipole X            :          0.0000000            0.0000000            0.0000000
 Dipole Y            :          0.0000000            0.0000000            0.0000000
 Dipole Z            :         -0.2190541            0.5294052            0.3103511
 Magnitude           :                                                    0.3103511

 ------------------------------------------------------------------------------------

*** tstop() called on Joses-MacBook-Pro-2.local at Thu Jul 17 14:01:20 2025
Module time:
	user time   =       2.09 seconds =       0.03 minutes
	system time =       5.51 seconds =       0.09 minutes
	total time  =          0 seconds =       0.00 minutes
Total time:
	user time   =       5.56 seconds =       0.09 minutes
	system time =      13.60 seconds =       0.23 minutes
	total time  =          2 seconds =       0.03 minutes

*** tstart() called on Joses-MacBook-Pro-2.local
*** at Thu Jul 17 14:01:20 2025


         ------------------------------------------------------------
                                   SCF GRAD                          
                          Rob Parrish, Justin Turney,                
                       Andy Simmonett, and Alex Sokolov              
         ------------------------------------------------------------

  ==> Geometry <==

    Molecular point group: c2v
    Full point group: C_inf_v

    Geometry (in Angstrom), charge = 1, multiplicity = 3:

       Center              X                  Y                   Z               Mass       
    ------------   -----------------  -----------------  -----------------  -----------------
         O            0.000000000000     0.000000000000     0.662565784360    15.994914619570
         F            0.000000000000     0.000000000000    -0.557819678839    18.998403162730

  Nuclear repulsion =   31.220266315171639

  ==> Basis Set <==

  Basis Set: CC-PVDZ
    Blend: CC-PVDZ
    Number of shells: 12
    Number of basis functions: 28
    Number of Cartesian functions: 30
    Spherical Harmonics?: true
    Max angular momentum: 2

  ==> DFJKGrad: Density-Fitted SCF Gradients <==

    Gradient:                    1
    J tasked:                  Yes
    K tasked:                  Yes
    wK tasked:                  No
    OpenMP threads:              1
    Integrals threads:           1
    Memory [MiB]:              375
    Schwarz Cutoff:          1E-12
    Fitting Condition:       1E-10

   => Auxiliary Basis Set <=

  Basis Set: (CC-PVDZ AUX)
    Blend: CC-PVDZ-JKFIT
    Number of shells: 48
    Number of basis functions: 140
    Number of Cartesian functions: 162
    Spherical Harmonics?: true
    Max angular momentum: 3

  ==> DFT Potential <==

   => LibXC <=

    Version 6.2.2
    S. Lehtola, C. Steigemann, M. J.T. Oliveira, and M. A.L. Marques.,  SoftwareX 7, 1–5 (2018) (10.1016/j.softx.2017.11.002)

   => Composite Functional: B3LYP <= 

    B3LYP Hyb-GGA Exchange-Correlation Functional

    P. J. Stephens, F. J. Devlin, C. F. Chabalowski, and M. J. Frisch.,  J. Phys. Chem. 98, 11623 (1994) (10.1021/j100096a001)

    Deriv               =              1
    GGA                 =           TRUE
    Meta                =          FALSE

    Exchange Hybrid     =           TRUE
    MP2 Hybrid          =          FALSE

   => Exchange Functionals <=

    0.0800   Slater exchange
    0.7200         Becke 88

   => Exact (HF) Exchange <=

    0.2000               HF 

   => Correlation Functionals <=

    0.1900   Vosko, Wilk & Nusair (VWN5_RPA)
    0.8100   Lee, Yang & Parr

   => LibXC Density Thresholds  <==

    XC_HYB_GGA_XC_B3LYP:  1.00E-15 

   => Molecular Quadrature <=

    Radial Scheme          =       TREUTLER
    Pruning Scheme         =           NONE
    Nuclear Scheme         =       TREUTLER

    Blocking Scheme        =         OCTREE
    BS radius alpha        =              1
    Pruning alpha          =              1
    Radial Points          =             75
    Spherical Points       =            302
    Total Points           =          42012
    Total Blocks           =            367
    Max Points             =            252
    Max Functions          =             28
    Weights Tolerance      =       1.00E-15


  -Total Gradient:
     Atom            X                  Y                   Z
    ------   -----------------  -----------------  -----------------
       1       -0.000000000000    -0.000000000000    -0.012371414827
       2       -0.000000000000     0.000000000000     0.012375393953


*** tstop() called on Joses-MacBook-Pro-2.local at Thu Jul 17 14:01:20 2025
Module time:
	user time   =       0.50 seconds =       0.01 minutes
	system time =       1.44 seconds =       0.02 minutes
	total time  =          0 seconds =       0.00 minutes
Total time:
	user time   =       6.06 seconds =       0.10 minutes
	system time =      15.04 seconds =       0.25 minutes
	total time  =          2 seconds =       0.03 minutes

    			-----------------------------------------

    			 OPTKING 3.0: for geometry optimizations 

    			     By R.A. King, Bethel University     

    			        with contributions from          

    			    A.V. Copan, J. Cayton, A. Heide      

    			-----------------------------------------

    
	                            ===> Fragment 1 <== 

	 Z (Atomic Numbers)          Masses                          Geom                  
	       8.000000            15.994915          0.00000000  0.00000000  1.25206787   
	       9.000000            18.998403          0.00000000  0.00000000 -1.05412642   

	 - Coordinate -           - BOHR/RAD -       - ANG/DEG -
	 R(1,2)           =         2.306194           1.220385


	        --- Internal Coordinate Step in ANG or DEG, aJ/ANG or AJ/DEG ---
	-------------------------------------------------------------------------------
	           Coordinate      Previous         Force          Change          New 
	           ----------      --------        ------          ------        ------
	               R(1,2)       1.22039        0.10194        0.00898       1.22937
	-------------------------------------------------------------------------------

	                                 ==> Convergence Check <==                                  
    
	Measures of convergence in internal coordinates in au.
    
	Criteria marked as inactive (o), active & met (*), and active & unmet ( ).

	----------------------------------------------------------------------------------------------
	   Step    Total Energy     Delta E     Max Force     RMS Force      Max Disp      RMS Disp   
	----------------------------------------------------------------------------------------------
	  Convergence Criteria     1.00e-06 *    3.00e-04 *             o    1.20e-03 *             o
	----------------------------------------------------------------------------------------------
	     2    -174.41628135   -1.00e-03      1.24e-02      1.24e-02 o    1.70e-02      1.70e-02 o  ~
	----------------------------------------------------------------------------------------------

Next Geometry in Ang 
	Fragment 1 (Ang)

	    O   0.0000000000   0.0000000000   0.6670578929
	    F   0.0000000000   0.0000000000  -0.5623117873


    Structure for next step:
    Molecular point group: c2v
    Full point group: C_inf_v

    Geometry (in Angstrom), charge = 1, multiplicity = 3:

    O            0.000000000000     0.000000000000     0.667443452078
    F            0.000000000000     0.000000000000    -0.561926228112


Scratch directory: /tmp/
gradient() will perform analytic gradient computation.
   => Libint2 <=

    Primary   basis highest AM E, G, H:  6, 6, 3
    Auxiliary basis highest AM E, G, H:  7, 7, 4
    Onebody   basis highest AM E, G, H:  -, -, -
    Solid Harmonics ordering:            Gaussian

*** tstart() called on Joses-MacBook-Pro-2.local
*** at Thu Jul 17 14:01:21 2025

   => Loading Basis Set <=

    Name: CC-PVDZ
    Role: ORBITAL
    Keyword: BASIS
    atoms 1 entry O          line   198 file /Users/joseantoniorodriguesromero/anaconda3/share/psi4/basis/cc-pvdz.gbs 
    atoms 2 entry F          line   228 file /Users/joseantoniorodriguesromero/anaconda3/share/psi4/basis/cc-pvdz.gbs 


         ---------------------------------------------------------
                                   SCF
               by Justin Turney, Rob Parrish, Andy Simmonett
                          and Daniel G. A. Smith
                              UKS Reference
                        1 Threads,    500 MiB Core
         ---------------------------------------------------------

  ==> Geometry <==

    Molecular point group: c2v
    Full point group: C_inf_v

    Geometry (in Angstrom), charge = 1, multiplicity = 3:

       Center              X                  Y                   Z               Mass       
    ------------   -----------------  -----------------  -----------------  -----------------
         O            0.000000000000     0.000000000000     0.667443452078    15.994914619570
         F            0.000000000000     0.000000000000    -0.561926228112    18.998403162730

  Running in c2v symmetry.

  Rotational constants: A = ************  B =      1.28445  C =      1.28445 [cm^-1]
  Rotational constants: A = ************  B =  38506.87706  C =  38506.87706 [MHz]
  Nuclear repulsion =   30.992109031311212

  Charge       = 1
  Multiplicity = 3
  Electrons    = 16
  Nalpha       = 9
  Nbeta        = 7

  ==> Algorithm <==

  SCF Algorithm Type is DF.
  DIIS enabled.
  MOM disabled.
  Fractional occupation disabled.
  Guess Type is READ.
  Energy threshold   = 1.00e-08
  Density threshold  = 1.00e-08
  Integral threshold = 1.00e-12

  ==> Primary Basis <==

  Basis Set: CC-PVDZ
    Blend: CC-PVDZ
    Number of shells: 12
    Number of basis functions: 28
    Number of Cartesian functions: 30
    Spherical Harmonics?: true
    Max angular momentum: 2

  ==> DFT Potential <==

   => LibXC <=

    Version 6.2.2
    S. Lehtola, C. Steigemann, M. J.T. Oliveira, and M. A.L. Marques.,  SoftwareX 7, 1–5 (2018) (10.1016/j.softx.2017.11.002)

   => Composite Functional: B3LYP <= 

    B3LYP Hyb-GGA Exchange-Correlation Functional

    P. J. Stephens, F. J. Devlin, C. F. Chabalowski, and M. J. Frisch.,  J. Phys. Chem. 98, 11623 (1994) (10.1021/j100096a001)

    Deriv               =              1
    GGA                 =           TRUE
    Meta                =          FALSE

    Exchange Hybrid     =           TRUE
    MP2 Hybrid          =          FALSE

   => Exchange Functionals <=

    0.0800   Slater exchange
    0.7200         Becke 88

   => Exact (HF) Exchange <=

    0.2000               HF 

   => Correlation Functionals <=

    0.1900   Vosko, Wilk & Nusair (VWN5_RPA)
    0.8100   Lee, Yang & Parr

   => LibXC Density Thresholds  <==

    XC_HYB_GGA_XC_B3LYP:  1.00E-15 

   => Molecular Quadrature <=

    Radial Scheme          =       TREUTLER
    Pruning Scheme         =           NONE
    Nuclear Scheme         =       TREUTLER

    Blocking Scheme        =         OCTREE
    BS radius alpha        =              1
    Pruning alpha          =              1
    Radial Points          =             75
    Spherical Points       =            302
    Total Points           =          42012
    Total Blocks           =            366
    Max Points             =            254
    Max Functions          =             28
    Weights Tolerance      =       1.00E-15

   => Loading Basis Set <=

    Name: (CC-PVDZ AUX)
    Role: JKFIT
    Keyword: DF_BASIS_SCF
    atoms 1 entry O          line   221 file /Users/joseantoniorodriguesromero/anaconda3/share/psi4/basis/cc-pvdz-jkfit.gbs 
    atoms 2 entry F          line   271 file /Users/joseantoniorodriguesromero/anaconda3/share/psi4/basis/cc-pvdz-jkfit.gbs 

   => Loading Basis Set <=

    Name: CC-PVDZ
    Role: ORBITAL
    Keyword: BASIS
    atoms 1 entry O          line   198 file /Users/joseantoniorodriguesromero/anaconda3/share/psi4/basis/cc-pvdz.gbs 
    atoms 2 entry F          line   228 file /Users/joseantoniorodriguesromero/anaconda3/share/psi4/basis/cc-pvdz.gbs 

  Reading orbitals from file /tmp/triplet_OF.default.74543.180.npy, no projection.

  ==> Integral Setup <==

  DFHelper Memory: AOs need 0.001 GiB; user supplied 0.333 GiB. 
  Using in-core AOs.

  ==> MemDFJK: Density-Fitted J/K Matrices <==

    J tasked:                   Yes
    K tasked:                   Yes
    wK tasked:                   No
    OpenMP threads:               1
    Memory [MiB]:               340
    Algorithm:                 Core
    Schwarz Cutoff:           1E-12
    Mask sparsity (%):       0.0000
    Fitting Condition:        1E-10

   => Auxiliary Basis Set <=

  Basis Set: (CC-PVDZ AUX)
    Blend: CC-PVDZ-JKFIT
    Number of shells: 48
    Number of basis functions: 140
    Number of Cartesian functions: 162
    Spherical Harmonics?: true
    Max angular momentum: 3

  Cached 100.0% of DFT collocation blocks in 0.034 [GiB].

  Minimum eigenvalue in the overlap matrix is 3.0076828034E-02.
  Reciprocal condition number of the overlap matrix is 1.1048781778E-02.
    Using symmetric orthogonalization.

  ==> Pre-Iterations <==

  SCF Guess: Orbitals guess was supplied from a previous computation.

   -------------------------------------------------------
    Irrep   Nso     Nmo     Nalpha   Nbeta   Ndocc  Nsocc
   -------------------------------------------------------
     A1        14      14       5       5       5       0
     A2         2       2       0       0       0       0
     B1         6       6       2       1       1       1
     B2         6       6       2       1       1       1
   -------------------------------------------------------
    Total      28      28       9       7       7       2
   -------------------------------------------------------

  ==> Iterations <==

                           Total Energy        Delta E     RMS |[F,P]|

   @DF-UKS iter   0:  -174.40598858763926   -1.74406e+02   1.83524e-03 
   @DF-UKS iter   1:  -174.41635985503135   -1.03713e-02   6.41506e-04 ADIIS/DIIS
   @DF-UKS iter   2:  -174.41619111144064    1.68744e-04   1.50538e-03 ADIIS/DIIS/DAMP=1%
   @DF-UKS iter   3:  -174.41617120792824    1.99035e-05   2.02651e-04 ADIIS/DIIS/DAMP=1%
   @DF-UKS iter   4:  -174.41639906011460   -2.27852e-04   8.87909e-06 DIIS/DAMP=1%
   @DF-UKS iter   5:  -174.41639917400397   -1.13889e-07   7.20539e-06 DIIS/DAMP=1%
   @DF-UKS iter   6:  -174.41639534933350    3.82467e-06   2.82854e-06 DIIS/DAMP=1%
   @DF-UKS iter   7:  -174.41639667456525   -1.32523e-06   5.92863e-07 DIIS/DAMP=1%
   @DF-UKS iter   8:  -174.41639612435259    5.50213e-07   3.27223e-08 DIIS/DAMP=1%
   @DF-UKS iter   9:  -174.41639621144819   -8.70956e-08   9.15590e-09 DIIS/DAMP=1%
   @DF-UKS iter  10:  -174.41639620816412    3.28407e-09   8.20636e-10 DIIS/DAMP=1%
  Energy and wave function converged.


  ==> Post-Iterations <==

   Electrons on quadrature grid:
      Nalpha   =    8.9999998905 ; deviation = -1.095e-07
      Nbeta    =    6.9999999205 ; deviation = -7.950e-08
      Ntotal   =   15.9999998111 ; deviation = -1.889e-07 

   @Spin Contamination Metric:   5.470924713E-03
   @S^2 Expected:                2.000000000E+00
   @S^2 Observed:                2.005470925E+00
   @S   Expected:                1.000000000E+00
   @S   Observed:                1.000000000E+00

    Orbital Energies [Eh]
    ---------------------

    Alpha Occupied:                                                       

       1A1   -25.326115     2A1   -19.872239     3A1    -1.916631  
       4A1    -1.436362     1B1    -1.074574     1B2    -1.074574  
       5A1    -1.072951     2B1    -0.853245     2B2    -0.853245  

    Alpha Virtual:                                                        

       6A1    -0.399075     7A1     0.407402     3B1     0.411323  
       3B2     0.411323     8A1     0.671105     4B2     0.723115  
       4B1     0.723115     9A1     0.756595    10A1     1.593605  
       5B2     1.856902     5B1     1.856902     1A2     1.935321  
      11A1     1.935322    12A1     2.322283     2A2     2.992994  
      13A1     2.992994     6B1     3.329524     6B2     3.329524  
      14A1     3.990713  

    Beta Occupied:                                                        

       1A1   -25.306837     2A1   -19.825982     3A1    -1.863608  
       4A1    -1.334722     5A1    -1.027174     1B1    -0.974504  
       1B2    -0.974504  

    Beta Virtual:                                                         

       2B1    -0.624257     2B2    -0.624257     6A1    -0.349799  
       7A1     0.426136     3B1     0.489071     3B2     0.489071  
       8A1     0.715875     4B2     0.758726     4B1     0.758726  
       9A1     0.772233    10A1     1.618475     5B2     1.919128  
       5B1     1.919128    11A1     2.068528     1A2     2.068529  
      12A1     2.376859     2A2     3.046789    13A1     3.046790  
       6B1     3.369379     6B2     3.369379    14A1     4.022687  

    Final Occupation by Irrep:
             A1    A2    B1    B2 
    DOCC [     5,    0,    1,    1 ]
    SOCC [     0,    0,    1,    1 ]
    NA   [     5,    0,    2,    2 ]
    NB   [     5,    0,    1,    1 ]

  @DF-UKS Final Energy:  -174.41639620816412

   => Energetics <=

    Nuclear Repulsion Energy =             30.9921090313112124
    One-Electron Energy =                -295.3130469126023172
    Two-Electron Energy =                 104.8342735837334772
    DFT Exchange-Correlation Energy =     -14.9297319106064723
    Empirical Dispersion Energy =           0.0000000000000000
    VV10 Nonlocal Energy =                  0.0000000000000000
    Total Energy =                       -174.4163962081641159

  UHF NO Occupations:
  HONO-2 :    5 A1 1.9989574
  HONO-1 :    2 B1 1.0000000
  HONO-0 :    2 B2 1.0000000
  LUNO+0 :    6 A1 0.0010426
  LUNO+1 :    3 B1 0.0007316
  LUNO+2 :    3 B2 0.0007316
  LUNO+3 :    7 A1 0.0001858


Computation Completed


Properties will be evaluated at   0.000000,   0.000000,   0.000000 [a0]

Properties computed using the SCF density matrix


 Multipole Moments:

 ------------------------------------------------------------------------------------
     Multipole            Electronic (a.u.)      Nuclear  (a.u.)        Total (a.u.)
 ------------------------------------------------------------------------------------

 L = 1.  Multiply by 2.5417464519 to convert [e a0] to [Debye]
 Dipole X            :          0.0000000            0.0000000            0.0000000
 Dipole Y            :          0.0000000            0.0000000            0.0000000
 Dipole Z            :         -0.2110991            0.5333026            0.3222035
 Magnitude           :                                                    0.3222035

 ------------------------------------------------------------------------------------

*** tstop() called on Joses-MacBook-Pro-2.local at Thu Jul 17 14:01:21 2025
Module time:
	user time   =       2.03 seconds =       0.03 minutes
	system time =       5.61 seconds =       0.09 minutes
	total time  =          0 seconds =       0.00 minutes
Total time:
	user time   =       8.14 seconds =       0.14 minutes
	system time =      20.94 seconds =       0.35 minutes
	total time  =          3 seconds =       0.05 minutes

*** tstart() called on Joses-MacBook-Pro-2.local
*** at Thu Jul 17 14:01:21 2025


         ------------------------------------------------------------
                                   SCF GRAD                          
                          Rob Parrish, Justin Turney,                
                       Andy Simmonett, and Alex Sokolov              
         ------------------------------------------------------------

  ==> Geometry <==

    Molecular point group: c2v
    Full point group: C_inf_v

    Geometry (in Angstrom), charge = 1, multiplicity = 3:

       Center              X                  Y                   Z               Mass       
    ------------   -----------------  -----------------  -----------------  -----------------
         O            0.000000000000     0.000000000000     0.667443452078    15.994914619570
         F            0.000000000000     0.000000000000    -0.561926228112    18.998403162730

  Nuclear repulsion =   30.992109031311212

  ==> Basis Set <==

  Basis Set: CC-PVDZ
    Blend: CC-PVDZ
    Number of shells: 12
    Number of basis functions: 28
    Number of Cartesian functions: 30
    Spherical Harmonics?: true
    Max angular momentum: 2

  ==> DFJKGrad: Density-Fitted SCF Gradients <==

    Gradient:                    1
    J tasked:                  Yes
    K tasked:                  Yes
    wK tasked:                  No
    OpenMP threads:              1
    Integrals threads:           1
    Memory [MiB]:              375
    Schwarz Cutoff:          1E-12
    Fitting Condition:       1E-10

   => Auxiliary Basis Set <=

  Basis Set: (CC-PVDZ AUX)
    Blend: CC-PVDZ-JKFIT
    Number of shells: 48
    Number of basis functions: 140
    Number of Cartesian functions: 162
    Spherical Harmonics?: true
    Max angular momentum: 3

  ==> DFT Potential <==

   => LibXC <=

    Version 6.2.2
    S. Lehtola, C. Steigemann, M. J.T. Oliveira, and M. A.L. Marques.,  SoftwareX 7, 1–5 (2018) (10.1016/j.softx.2017.11.002)

   => Composite Functional: B3LYP <= 

    B3LYP Hyb-GGA Exchange-Correlation Functional

    P. J. Stephens, F. J. Devlin, C. F. Chabalowski, and M. J. Frisch.,  J. Phys. Chem. 98, 11623 (1994) (10.1021/j100096a001)

    Deriv               =              1
    GGA                 =           TRUE
    Meta                =          FALSE

    Exchange Hybrid     =           TRUE
    MP2 Hybrid          =          FALSE

   => Exchange Functionals <=

    0.0800   Slater exchange
    0.7200         Becke 88

   => Exact (HF) Exchange <=

    0.2000               HF 

   => Correlation Functionals <=

    0.1900   Vosko, Wilk & Nusair (VWN5_RPA)
    0.8100   Lee, Yang & Parr

   => LibXC Density Thresholds  <==

    XC_HYB_GGA_XC_B3LYP:  1.00E-15 

   => Molecular Quadrature <=

    Radial Scheme          =       TREUTLER
    Pruning Scheme         =           NONE
    Nuclear Scheme         =       TREUTLER

    Blocking Scheme        =         OCTREE
    BS radius alpha        =              1
    Pruning alpha          =              1
    Radial Points          =             75
    Spherical Points       =            302
    Total Points           =          42012
    Total Blocks           =            366
    Max Points             =            254
    Max Functions          =             28
    Weights Tolerance      =       1.00E-15


  -Total Gradient:
     Atom            X                  Y                   Z
    ------   -----------------  -----------------  -----------------
       1        0.000000000000    -0.000000000000    -0.001276563222
       2        0.000000000000    -0.000000000000     0.001280058420


*** tstop() called on Joses-MacBook-Pro-2.local at Thu Jul 17 14:01:21 2025
Module time:
	user time   =       0.53 seconds =       0.01 minutes
	system time =       1.30 seconds =       0.02 minutes
	total time  =          0 seconds =       0.00 minutes
Total time:
	user time   =       8.67 seconds =       0.14 minutes
	system time =      22.24 seconds =       0.37 minutes
	total time  =          3 seconds =       0.05 minutes

    			-----------------------------------------

    			 OPTKING 3.0: for geometry optimizations 

    			     By R.A. King, Bethel University     

    			        with contributions from          

    			    A.V. Copan, J. Cayton, A. Heide      

    			-----------------------------------------

    
	                            ===> Fragment 1 <== 

	 Z (Atomic Numbers)          Masses                          Geom                  
	       8.000000            15.994915          0.00000000  0.00000000  1.26128533   
	       9.000000            18.998403          0.00000000  0.00000000 -1.06188667   

	 - Coordinate -           - BOHR/RAD -       - ANG/DEG -
	 R(1,2)           =         2.323172           1.229370


	        --- Internal Coordinate Step in ANG or DEG, aJ/ANG or AJ/DEG ---
	-------------------------------------------------------------------------------
	           Coordinate      Previous         Force          Change          New 
	           ----------      --------        ------          ------        ------
	               R(1,2)       1.22937        0.01053        0.00096       1.23033
	-------------------------------------------------------------------------------

	                                 ==> Convergence Check <==                                  
    
	Measures of convergence in internal coordinates in au.
    
	Criteria marked as inactive (o), active & met (*), and active & unmet ( ).

	----------------------------------------------------------------------------------------------
	   Step    Total Energy     Delta E     Max Force     RMS Force      Max Disp      RMS Disp   
	----------------------------------------------------------------------------------------------
	  Convergence Criteria     1.00e-06 *    3.00e-04 *             o    1.20e-03 *             o
	----------------------------------------------------------------------------------------------
	     3    -174.41639621   -1.15e-04      1.28e-03      1.28e-03 o    1.81e-03      1.81e-03 o  ~
	----------------------------------------------------------------------------------------------

Next Geometry in Ang 
	Fragment 1 (Ang)

	    O   0.0000000000   0.0000000000   0.6679227796
	    F   0.0000000000   0.0000000000  -0.5624055556


    Structure for next step:
    Molecular point group: c2v
    Full point group: C_inf_v

    Geometry (in Angstrom), charge = 1, multiplicity = 3:

    O            0.000000000000     0.000000000000     0.667963920448
    F            0.000000000000     0.000000000000    -0.562364414788


Scratch directory: /tmp/
gradient() will perform analytic gradient computation.
   => Libint2 <=

    Primary   basis highest AM E, G, H:  6, 6, 3
    Auxiliary basis highest AM E, G, H:  7, 7, 4
    Onebody   basis highest AM E, G, H:  -, -, -
    Solid Harmonics ordering:            Gaussian

*** tstart() called on Joses-MacBook-Pro-2.local
*** at Thu Jul 17 14:01:21 2025

   => Loading Basis Set <=

    Name: CC-PVDZ
    Role: ORBITAL
    Keyword: BASIS
    atoms 1 entry O          line   198 file /Users/joseantoniorodriguesromero/anaconda3/share/psi4/basis/cc-pvdz.gbs 
    atoms 2 entry F          line   228 file /Users/joseantoniorodriguesromero/anaconda3/share/psi4/basis/cc-pvdz.gbs 


         ---------------------------------------------------------
                                   SCF
               by Justin Turney, Rob Parrish, Andy Simmonett
                          and Daniel G. A. Smith
                              UKS Reference
                        1 Threads,    500 MiB Core
         ---------------------------------------------------------

  ==> Geometry <==

    Molecular point group: c2v
    Full point group: C_inf_v

    Geometry (in Angstrom), charge = 1, multiplicity = 3:

       Center              X                  Y                   Z               Mass       
    ------------   -----------------  -----------------  -----------------  -----------------
         O            0.000000000000     0.000000000000     0.667963920448    15.994914619570
         F            0.000000000000     0.000000000000    -0.562364414788    18.998403162730

  Running in c2v symmetry.

  Rotational constants: A = ************  B =      1.28245  C =      1.28245 [cm^-1]
  Rotational constants: A = ************  B =  38446.89237  C =  38446.89237 [MHz]
  Nuclear repulsion =   30.967960402949497

  Charge       = 1
  Multiplicity = 3
  Electrons    = 16
  Nalpha       = 9
  Nbeta        = 7

  ==> Algorithm <==

  SCF Algorithm Type is DF.
  DIIS enabled.
  MOM disabled.
  Fractional occupation disabled.
  Guess Type is READ.
  Energy threshold   = 1.00e-08
  Density threshold  = 1.00e-08
  Integral threshold = 1.00e-12

  ==> Primary Basis <==

  Basis Set: CC-PVDZ
    Blend: CC-PVDZ
    Number of shells: 12
    Number of basis functions: 28
    Number of Cartesian functions: 30
    Spherical Harmonics?: true
    Max angular momentum: 2

  ==> DFT Potential <==

   => LibXC <=

    Version 6.2.2
    S. Lehtola, C. Steigemann, M. J.T. Oliveira, and M. A.L. Marques.,  SoftwareX 7, 1–5 (2018) (10.1016/j.softx.2017.11.002)

   => Composite Functional: B3LYP <= 

    B3LYP Hyb-GGA Exchange-Correlation Functional

    P. J. Stephens, F. J. Devlin, C. F. Chabalowski, and M. J. Frisch.,  J. Phys. Chem. 98, 11623 (1994) (10.1021/j100096a001)

    Deriv               =              1
    GGA                 =           TRUE
    Meta                =          FALSE

    Exchange Hybrid     =           TRUE
    MP2 Hybrid          =          FALSE

   => Exchange Functionals <=

    0.0800   Slater exchange
    0.7200         Becke 88

   => Exact (HF) Exchange <=

    0.2000               HF 

   => Correlation Functionals <=

    0.1900   Vosko, Wilk & Nusair (VWN5_RPA)
    0.8100   Lee, Yang & Parr

   => LibXC Density Thresholds  <==

    XC_HYB_GGA_XC_B3LYP:  1.00E-15 

   => Molecular Quadrature <=

    Radial Scheme          =       TREUTLER
    Pruning Scheme         =           NONE
    Nuclear Scheme         =       TREUTLER

    Blocking Scheme        =         OCTREE
    BS radius alpha        =              1
    Pruning alpha          =              1
    Radial Points          =             75
    Spherical Points       =            302
    Total Points           =          42012
    Total Blocks           =            366
    Max Points             =            254
    Max Functions          =             28
    Weights Tolerance      =       1.00E-15

   => Loading Basis Set <=

    Name: (CC-PVDZ AUX)
    Role: JKFIT
    Keyword: DF_BASIS_SCF
    atoms 1 entry O          line   221 file /Users/joseantoniorodriguesromero/anaconda3/share/psi4/basis/cc-pvdz-jkfit.gbs 
    atoms 2 entry F          line   271 file /Users/joseantoniorodriguesromero/anaconda3/share/psi4/basis/cc-pvdz-jkfit.gbs 

   => Loading Basis Set <=

    Name: CC-PVDZ
    Role: ORBITAL
    Keyword: BASIS
    atoms 1 entry O          line   198 file /Users/joseantoniorodriguesromero/anaconda3/share/psi4/basis/cc-pvdz.gbs 
    atoms 2 entry F          line   228 file /Users/joseantoniorodriguesromero/anaconda3/share/psi4/basis/cc-pvdz.gbs 

  Reading orbitals from file /tmp/triplet_OF.default.74543.180.npy, no projection.

  ==> Integral Setup <==

  DFHelper Memory: AOs need 0.001 GiB; user supplied 0.333 GiB. 
  Using in-core AOs.

  ==> MemDFJK: Density-Fitted J/K Matrices <==

    J tasked:                   Yes
    K tasked:                   Yes
    wK tasked:                   No
    OpenMP threads:               1
    Memory [MiB]:               340
    Algorithm:                 Core
    Schwarz Cutoff:           1E-12
    Mask sparsity (%):       0.0000
    Fitting Condition:        1E-10

   => Auxiliary Basis Set <=

  Basis Set: (CC-PVDZ AUX)
    Blend: CC-PVDZ-JKFIT
    Number of shells: 48
    Number of basis functions: 140
    Number of Cartesian functions: 162
    Spherical Harmonics?: true
    Max angular momentum: 3

  Cached 100.0% of DFT collocation blocks in 0.034 [GiB].

  Minimum eigenvalue in the overlap matrix is 3.0159860851E-02.
  Reciprocal condition number of the overlap matrix is 1.1083510299E-02.
    Using symmetric orthogonalization.

  ==> Pre-Iterations <==

  SCF Guess: Orbitals guess was supplied from a previous computation.

   -------------------------------------------------------
    Irrep   Nso     Nmo     Nalpha   Nbeta   Ndocc  Nsocc
   -------------------------------------------------------
     A1        14      14       5       5       5       0
     A2         2       2       0       0       0       0
     B1         6       6       2       1       1       1
     B2         6       6       2       1       1       1
   -------------------------------------------------------
    Total      28      28       9       7       7       2
   -------------------------------------------------------

  ==> Iterations <==

                           Total Energy        Delta E     RMS |[F,P]|

   @DF-UKS iter   0:  -174.41529959532818   -1.74415e+02   1.93866e-04 
   @DF-UKS iter   1:  -174.41639708683138   -1.09749e-03   6.74213e-05 DIIS
   @DF-UKS iter   2:  -174.41639524991345    1.83692e-06   1.57130e-04 ADIIS/DIIS/DAMP=1%
   @DF-UKS iter   3:  -174.41637441624670    2.08337e-05   2.01676e-05 DIIS/DAMP=1%
   @DF-UKS iter   4:  -174.41639763399854   -2.32178e-05   9.56085e-07 DIIS/DAMP=1%
   @DF-UKS iter   5:  -174.41639779837098   -1.64372e-07   7.68947e-07 DIIS/DAMP=1%
   @DF-UKS iter   6:  -174.41639739847179    3.99899e-07   2.90008e-07 DIIS/DAMP=1%
   @DF-UKS iter   7:  -174.41639753677597   -1.38304e-07   5.99867e-08 DIIS/DAMP=1%
   @DF-UKS iter   8:  -174.41639747962603    5.71499e-08   3.12604e-09 DIIS/DAMP=1%
   @DF-UKS iter   9:  -174.41639748851333   -8.88730e-09   7.55388e-10 DIIS/DAMP=1%
  Energy and wave function converged.


  ==> Post-Iterations <==

   Electrons on quadrature grid:
      Nalpha   =    8.9999998958 ; deviation = -1.042e-07
      Nbeta    =    6.9999999236 ; deviation = -7.638e-08
      Ntotal   =   15.9999998194 ; deviation = -1.806e-07 

   @Spin Contamination Metric:   5.476220790E-03
   @S^2 Expected:                2.000000000E+00
   @S^2 Observed:                2.005476221E+00
   @S   Expected:                1.000000000E+00
   @S   Observed:                1.000000000E+00

    Orbital Energies [Eh]
    ---------------------

    Alpha Occupied:                                                       

       1A1   -25.325914     2A1   -19.872404     3A1    -1.915718  
       4A1    -1.436586     1B1    -1.074130     1B2    -1.074130  
       5A1    -1.072722     2B1    -0.853442     2B2    -0.853442  

    Alpha Virtual:                                                        

       6A1    -0.400223     7A1     0.407585     3B1     0.411279  
       3B2     0.411279     8A1     0.671284     4B1     0.723191  
       4B2     0.723191     9A1     0.757106    10A1     1.592931  
       5B2     1.857334     5B1     1.857334     1A2     1.935407  
      11A1     1.935408    12A1     2.320354     2A2     2.993217  
      13A1     2.993217     6B2     3.328179     6B1     3.328179  
      14A1     3.990077  

    Beta Occupied:                                                        

       1A1   -25.306661     2A1   -19.826134     3A1    -1.862703  
       4A1    -1.334867     5A1    -1.027017     1B2    -0.974057  
       1B1    -0.974057  

    Beta Virtual:                                                         

       2B1    -0.624479     2B2    -0.624479     6A1    -0.350976  
       7A1     0.426342     3B1     0.489053     3B2     0.489053  
       8A1     0.716065     4B1     0.758775     4B2     0.758775  
       9A1     0.772738    10A1     1.617786     5B2     1.919619  
       5B1     1.919619    11A1     2.068675     1A2     2.068675  
      12A1     2.374907     2A2     3.046947    13A1     3.046948  
       6B2     3.367972     6B1     3.367972    14A1     4.022046  

    Final Occupation by Irrep:
             A1    A2    B1    B2 
    DOCC [     5,    0,    1,    1 ]
    SOCC [     0,    0,    1,    1 ]
    NA   [     5,    0,    2,    2 ]
    NB   [     5,    0,    1,    1 ]

  @DF-UKS Final Energy:  -174.41639748851333

   => Energetics <=

    Nuclear Repulsion Energy =             30.9679604029494975
    One-Electron Energy =                -295.2684217099136958
    Two-Electron Energy =                 104.8132120379608807
    DFT Exchange-Correlation Energy =     -14.9291482195099814
    Empirical Dispersion Energy =           0.0000000000000000
    VV10 Nonlocal Energy =                  0.0000000000000000
    Total Energy =                       -174.4163974885133257

  UHF NO Occupations:
  HONO-2 :    5 A1 1.9989560
  HONO-1 :    2 B2 1.0000000
  HONO-0 :    2 B1 1.0000000
  LUNO+0 :    6 A1 0.0010440
  LUNO+1 :    3 B1 0.0007317
  LUNO+2 :    3 B2 0.0007317
  LUNO+3 :    7 A1 0.0001870


Computation Completed


Properties will be evaluated at   0.000000,   0.000000,   0.000000 [a0]

Properties computed using the SCF density matrix


 Multipole Moments:

 ------------------------------------------------------------------------------------
     Multipole            Electronic (a.u.)      Nuclear  (a.u.)        Total (a.u.)
 ------------------------------------------------------------------------------------

 L = 1.  Multiply by 2.5417464519 to convert [e a0] to [Debye]
 Dipole X            :          0.0000000            0.0000000            0.0000000
 Dipole Y            :          0.0000000            0.0000000            0.0000000
 Dipole Z            :         -0.2102547            0.5337184            0.3234637
 Magnitude           :                                                    0.3234637

 ------------------------------------------------------------------------------------

*** tstop() called on Joses-MacBook-Pro-2.local at Thu Jul 17 14:01:22 2025
Module time:
	user time   =       2.02 seconds =       0.03 minutes
	system time =       5.35 seconds =       0.09 minutes
	total time  =          1 seconds =       0.02 minutes
Total time:
	user time   =      10.76 seconds =       0.18 minutes
	system time =      27.88 seconds =       0.46 minutes
	total time  =          4 seconds =       0.07 minutes

*** tstart() called on Joses-MacBook-Pro-2.local
*** at Thu Jul 17 14:01:22 2025


         ------------------------------------------------------------
                                   SCF GRAD                          
                          Rob Parrish, Justin Turney,                
                       Andy Simmonett, and Alex Sokolov              
         ------------------------------------------------------------

  ==> Geometry <==

    Molecular point group: c2v
    Full point group: C_inf_v

    Geometry (in Angstrom), charge = 1, multiplicity = 3:

       Center              X                  Y                   Z               Mass       
    ------------   -----------------  -----------------  -----------------  -----------------
         O            0.000000000000     0.000000000000     0.667963920448    15.994914619570
         F            0.000000000000     0.000000000000    -0.562364414788    18.998403162730

  Nuclear repulsion =   30.967960402949497

  ==> Basis Set <==

  Basis Set: CC-PVDZ
    Blend: CC-PVDZ
    Number of shells: 12
    Number of basis functions: 28
    Number of Cartesian functions: 30
    Spherical Harmonics?: true
    Max angular momentum: 2

  ==> DFJKGrad: Density-Fitted SCF Gradients <==

    Gradient:                    1
    J tasked:                  Yes
    K tasked:                  Yes
    wK tasked:                  No
    OpenMP threads:              1
    Integrals threads:           1
    Memory [MiB]:              375
    Schwarz Cutoff:          1E-12
    Fitting Condition:       1E-10

   => Auxiliary Basis Set <=

  Basis Set: (CC-PVDZ AUX)
    Blend: CC-PVDZ-JKFIT
    Number of shells: 48
    Number of basis functions: 140
    Number of Cartesian functions: 162
    Spherical Harmonics?: true
    Max angular momentum: 3

  ==> DFT Potential <==

   => LibXC <=

    Version 6.2.2
    S. Lehtola, C. Steigemann, M. J.T. Oliveira, and M. A.L. Marques.,  SoftwareX 7, 1–5 (2018) (10.1016/j.softx.2017.11.002)

   => Composite Functional: B3LYP <= 

    B3LYP Hyb-GGA Exchange-Correlation Functional

    P. J. Stephens, F. J. Devlin, C. F. Chabalowski, and M. J. Frisch.,  J. Phys. Chem. 98, 11623 (1994) (10.1021/j100096a001)

    Deriv               =              1
    GGA                 =           TRUE
    Meta                =          FALSE

    Exchange Hybrid     =           TRUE
    MP2 Hybrid          =          FALSE

   => Exchange Functionals <=

    0.0800   Slater exchange
    0.7200         Becke 88

   => Exact (HF) Exchange <=

    0.2000               HF 

   => Correlation Functionals <=

    0.1900   Vosko, Wilk & Nusair (VWN5_RPA)
    0.8100   Lee, Yang & Parr

   => LibXC Density Thresholds  <==

    XC_HYB_GGA_XC_B3LYP:  1.00E-15 

   => Molecular Quadrature <=

    Radial Scheme          =       TREUTLER
    Pruning Scheme         =           NONE
    Nuclear Scheme         =       TREUTLER

    Blocking Scheme        =         OCTREE
    BS radius alpha        =              1
    Pruning alpha          =              1
    Radial Points          =             75
    Spherical Points       =            302
    Total Points           =          42012
    Total Blocks           =            366
    Max Points             =            254
    Max Functions          =             28
    Weights Tolerance      =       1.00E-15


  -Total Gradient:
     Atom            X                  Y                   Z
    ------   -----------------  -----------------  -----------------
       1       -0.000000000000     0.000000000000    -0.000135621586
       2        0.000000000000    -0.000000000000     0.000139094547


*** tstop() called on Joses-MacBook-Pro-2.local at Thu Jul 17 14:01:22 2025
Module time:
	user time   =       0.42 seconds =       0.01 minutes
	system time =       1.57 seconds =       0.03 minutes
	total time  =          0 seconds =       0.00 minutes
Total time:
	user time   =      11.18 seconds =       0.19 minutes
	system time =      29.46 seconds =       0.49 minutes
	total time  =          4 seconds =       0.07 minutes

    			-----------------------------------------

    			 OPTKING 3.0: for geometry optimizations 

    			     By R.A. King, Bethel University     

    			        with contributions from          

    			    A.V. Copan, J. Cayton, A. Heide      

    			-----------------------------------------

    
	                            ===> Fragment 1 <== 

	 Z (Atomic Numbers)          Masses                          Geom                  
	       8.000000            15.994915          0.00000000  0.00000000  1.26226887   
	       9.000000            18.998403          0.00000000  0.00000000 -1.06271473   

	 - Coordinate -           - BOHR/RAD -       - ANG/DEG -
	 R(1,2)           =         2.324984           1.230328


	        --- Internal Coordinate Step in ANG or DEG, aJ/ANG or AJ/DEG ---
	-------------------------------------------------------------------------------
	           Coordinate      Previous         Force          Change          New 
	           ----------      --------        ------          ------        ------
	               R(1,2)       1.23033        0.00113        0.00010       1.23043
	-------------------------------------------------------------------------------

	                                 ==> Convergence Check <==                                  
    
	Measures of convergence in internal coordinates in au.
    
	Criteria marked as inactive (o), active & met (*), and active & unmet ( ).

	----------------------------------------------------------------------------------------------
	   Step    Total Energy     Delta E     Max Force     RMS Force      Max Disp      RMS Disp   
	----------------------------------------------------------------------------------------------
	  Convergence Criteria     1.00e-06 *    3.00e-04 *             o    1.20e-03 *             o
	----------------------------------------------------------------------------------------------
	     4    -174.41639749   -1.28e-06      1.37e-04 *    1.37e-04 o    1.95e-04 *    1.95e-04 o  ~
	----------------------------------------------------------------------------------------------

Next Geometry in Ang 
	Fragment 1 (Ang)

	    O   0.0000000000   0.0000000000   0.6680156012
	    F   0.0000000000   0.0000000000  -0.5624160956


    Final optimized geometry and variables:
    Molecular point group: c2v
    Full point group: C_inf_v

    Geometry (in Angstrom), charge = 1, multiplicity = 3:

    O            0.000000000000     0.000000000000     0.667963920448
    F            0.000000000000     0.000000000000    -0.562364414788


    Psi4 stopped on: Thursday, 17 July 2025 02:01PM
    Psi4 wall time for execution: 0:00:04.72

*** Psi4 exiting successfully. Buy a developer a beer!
