
    -----------------------------------------------------------------------
          Psi4: An Open-Source Ab Initio Electronic Structure Package
                               Psi4 1.9.1 release

                         Git: Rev {} zzzzzzz 


    D. G. A. Smith, L. A. Burns, A. C. Simmonett, R. M. Parrish,
    M. C. Schieber, R. Galvelis, P. Kraus, H. Kruse, R. Di Remigio,
    A. Alenaizan, A. M. James, S. Lehtola, J. P. Misiewicz, M. Scheurer,
    R. A. Shaw, J. B. Schriber, Y. Xie, Z. L. Glick, D. A. Sirianni,
    J. S. O'Brien, J. M. Waldrop, A. Kumar, E. G. Hohenstein,
    B. P. Pritchard, B. R. Brooks, H. F. Schaefer III, A. Yu. Sokolov,
    K. Patkowski, A. E. DePrince III, U. Bozkaya, R. A. King,
    F. A. Evangelista, J. M. Turney, T. D. Crawford, C. D. Sherrill,
    J. Chem. Phys. 152(18) 184108 (2020). https://doi.org/10.1063/5.0006002

                            Additional Code Authors
    E. T. Seidl, C. L. Janssen, E. F. Valeev, M. L. Leininger,
    J. F. Gonthier, R. M. Richard, H. R. McAlexander, M. Saitow, X. Wang,
    P. Verma, M. H. Lechner, A. Jiang, S. Behnle, A. G. Heide,
    M. F. Herbst, and D. L. Poole

             Previous Authors, Complete List of Code Contributors,
                       and Citations for Specific Modules
    https://github.com/psi4/psi4/blob/master/codemeta.json
    https://github.com/psi4/psi4/graphs/contributors
    http://psicode.org/psi4manual/master/introduction.html#citing-psifour

    -----------------------------------------------------------------------


    Psi4 started on: Thursday, 17 July 2025 01:41PM

    Process ID: 74331
    Host:       Joses-MacBook-Pro-2.local
    PSIDATADIR: /Users/joseantoniorodriguesromero/anaconda3/share/psi4
    Memory:     500.0 MiB
    Threads:    1
    
  ==> Input File <==

--------------------------------------------------------------------------
molecule { 
1 3
C   0.00000        0.60000        0.00000
F   0.00000       -0.60000        0.00000
}

set { 
basis              cc-pvdz
reference          uks
maxiter            500
geom_maxiter       500
DAMPING_PERCENTAGE 1
guess              SAP
}

optimize('b3lyp')
--------------------------------------------------------------------------

Scratch directory: /tmp/
gradient() will perform analytic gradient computation.
   => Libint2 <=

    Primary   basis highest AM E, G, H:  6, 6, 3
    Auxiliary basis highest AM E, G, H:  7, 7, 4
    Onebody   basis highest AM E, G, H:  -, -, -
    Solid Harmonics ordering:            Gaussian

*** tstart() called on Joses-MacBook-Pro-2.local
*** at Thu Jul 17 13:41:29 2025

   => Loading Basis Set <=

    Name: CC-PVDZ
    Role: ORBITAL
    Keyword: BASIS
    atoms 1 entry C          line   138 file /Users/joseantoniorodriguesromero/anaconda3/share/psi4/basis/cc-pvdz.gbs 
    atoms 2 entry F          line   228 file /Users/joseantoniorodriguesromero/anaconda3/share/psi4/basis/cc-pvdz.gbs 


         ---------------------------------------------------------
                                   SCF
               by Justin Turney, Rob Parrish, Andy Simmonett
                          and Daniel G. A. Smith
                              UKS Reference
                        1 Threads,    500 MiB Core
         ---------------------------------------------------------

  ==> Geometry <==

    Molecular point group: c2v
    Full point group: C_inf_v

    Geometry (in Angstrom), charge = 1, multiplicity = 3:

       Center              X                  Y                   Z               Mass       
    ------------   -----------------  -----------------  -----------------  -----------------
         C            0.000000000000     0.000000000000     0.735459942101    12.000000000000
         F            0.000000000000     0.000000000000    -0.464540057899    18.998403162730

  Running in c2v symmetry.

  Rotational constants: A = ************  B =      1.59175  C =      1.59175 [cm^-1]
  Rotational constants: A = ************  B =  47719.47797  C =  47719.47797 [MHz]
  Nuclear repulsion =   23.812974480150004

  Charge       = 1
  Multiplicity = 3
  Electrons    = 14
  Nalpha       = 8
  Nbeta        = 6

  ==> Algorithm <==

  SCF Algorithm Type is DF.
  DIIS enabled.
  MOM disabled.
  Fractional occupation disabled.
  Guess Type is SAP.
  Energy threshold   = 1.00e-08
  Density threshold  = 1.00e-08
  Integral threshold = 1.00e-12

  ==> Primary Basis <==

  Basis Set: CC-PVDZ
    Blend: CC-PVDZ
    Number of shells: 12
    Number of basis functions: 28
    Number of Cartesian functions: 30
    Spherical Harmonics?: true
    Max angular momentum: 2

  ==> DFT Potential <==

   => LibXC <=

    Version 6.2.2
    S. Lehtola, C. Steigemann, M. J.T. Oliveira, and M. A.L. Marques.,  SoftwareX 7, 1–5 (2018) (10.1016/j.softx.2017.11.002)

   => Composite Functional: B3LYP <= 

    B3LYP Hyb-GGA Exchange-Correlation Functional

    P. J. Stephens, F. J. Devlin, C. F. Chabalowski, and M. J. Frisch.,  J. Phys. Chem. 98, 11623 (1994) (10.1021/j100096a001)

    Deriv               =              1
    GGA                 =           TRUE
    Meta                =          FALSE

    Exchange Hybrid     =           TRUE
    MP2 Hybrid          =          FALSE

   => Exchange Functionals <=

    0.0800   Slater exchange
    0.7200         Becke 88

   => Exact (HF) Exchange <=

    0.2000               HF 

   => Correlation Functionals <=

    0.1900   Vosko, Wilk & Nusair (VWN5_RPA)
    0.8100   Lee, Yang & Parr

   => LibXC Density Thresholds  <==

    XC_HYB_GGA_XC_B3LYP:  1.00E-15 

   => Molecular Quadrature <=

    Radial Scheme          =       TREUTLER
    Pruning Scheme         =           NONE
    Nuclear Scheme         =       TREUTLER

    Blocking Scheme        =         OCTREE
    BS radius alpha        =              1
    Pruning alpha          =              1
    Radial Points          =             75
    Spherical Points       =            302
    Total Points           =          43222
    Total Blocks           =            387
    Max Points             =            254
    Max Functions          =             28
    Weights Tolerance      =       1.00E-15

   => Loading Basis Set <=

    Name: (CC-PVDZ AUX)
    Role: JKFIT
    Keyword: DF_BASIS_SCF
    atoms 1 entry C          line   121 file /Users/joseantoniorodriguesromero/anaconda3/share/psi4/basis/cc-pvdz-jkfit.gbs 
    atoms 2 entry F          line   271 file /Users/joseantoniorodriguesromero/anaconda3/share/psi4/basis/cc-pvdz-jkfit.gbs 

  ==> Integral Setup <==

  DFHelper Memory: AOs need 0.001 GiB; user supplied 0.332 GiB. 
  Using in-core AOs.

  ==> MemDFJK: Density-Fitted J/K Matrices <==

    J tasked:                   Yes
    K tasked:                   Yes
    wK tasked:                   No
    OpenMP threads:               1
    Memory [MiB]:               339
    Algorithm:                 Core
    Schwarz Cutoff:           1E-12
    Mask sparsity (%):       0.0000
    Fitting Condition:        1E-10

   => Auxiliary Basis Set <=

  Basis Set: (CC-PVDZ AUX)
    Blend: CC-PVDZ-JKFIT
    Number of shells: 48
    Number of basis functions: 140
    Number of Cartesian functions: 162
    Spherical Harmonics?: true
    Max angular momentum: 3

  Cached 100.0% of DFT collocation blocks in 0.034 [GiB].

  Minimum eigenvalue in the overlap matrix is 3.5998128127E-02.
  Reciprocal condition number of the overlap matrix is 1.2373533977E-02.
    Using symmetric orthogonalization.

  ==> Pre-Iterations <==

  SCF Guess: Superposition of Atomic Potentials (doi:10.1021/acs.jctc.8b01089).

  ==> SAP guess <==

   => Molecular Quadrature <=

    Radial Scheme          =       TREUTLER
    Pruning Scheme         =           NONE
    Nuclear Scheme         =       TREUTLER

    Blocking Scheme        =         OCTREE
    BS radius alpha        =              1
    Pruning alpha          =              1
    Radial Points          =             75
    Spherical Points       =            302
    Total Points           =          43222
    Total Blocks           =            387
    Max Points             =            254
    Max Functions          =             28
    Weights Tolerance      =       1.00E-15

   -------------------------------------------------------
    Irrep   Nso     Nmo     Nalpha   Nbeta   Ndocc  Nsocc
   -------------------------------------------------------
     A1        14      14       5       4       4       1
     A2         2       2       0       0       0       0
     B1         6       6       1       1       1       0
     B2         6       6       2       1       1       1
   -------------------------------------------------------
    Total      28      28       8       6       6       2
   -------------------------------------------------------

  ==> Iterations <==

                           Total Energy        Delta E     RMS |[F,P]|

   @DF-UKS iter   1:  -137.23191054495237   -1.37232e+02   1.96737e-02 DIIS/ADIIS
   @DF-UKS iter   2:  -137.16122121799020    7.06893e-02   3.50335e-02 DIIS/ADIIS/DAMP=1%
   @DF-UKS iter   3:  -137.26394993154378   -1.02729e-01   3.49565e-03 DIIS/ADIIS/DAMP=1%
   @DF-UKS iter   4:  -137.27737959224518   -1.34297e-02   4.52584e-04 DIIS/ADIIS/DAMP=1%
   @DF-UKS iter   5:  -137.27676527363320    6.14319e-04   1.18597e-04 DIIS/ADIIS/DAMP=1%
   @DF-UKS iter   6:  -137.27684597077308   -8.06971e-05   3.67089e-05 DIIS/DAMP=1%
   @DF-UKS iter   7:  -137.27684826394872   -2.29318e-06   9.15767e-06 DIIS/DAMP=1%
   @DF-UKS iter   8:  -137.27684357021548    4.69373e-06   2.00590e-06 DIIS/DAMP=1%
   @DF-UKS iter   9:  -137.27684476674000   -1.19652e-06   1.75529e-07 DIIS/DAMP=1%
   @DF-UKS iter  10:  -137.27684517987151   -4.13132e-07   2.05838e-08 DIIS/DAMP=1%
   @DF-UKS iter  11:  -137.27684518175818   -1.88666e-09   6.45290e-09 DIIS/DAMP=1%
  Energy and wave function converged.


  ==> Post-Iterations <==

   Electrons on quadrature grid:
      Nalpha   =    7.9999997382 ; deviation = -2.618e-07
      Nbeta    =    5.9999997221 ; deviation = -2.779e-07
      Ntotal   =   13.9999994604 ; deviation = -5.396e-07 

   @Spin Contamination Metric:   5.705808319E-03
   @S^2 Expected:                2.000000000E+00
   @S^2 Observed:                2.005705808E+00
   @S   Expected:                1.000000000E+00
   @S   Observed:                1.000000000E+00

    Orbital Energies [Eh]
    ---------------------

    Alpha Occupied:                                                       

       1A1   -25.215659     2A1   -10.825072     3A1    -1.757085  
       4A1    -1.091930     1B2    -0.952063     1B1    -0.933353  
       5A1    -0.892107     2B2    -0.623411  

    Alpha Virtual:                                                        

       2B1    -0.507794     6A1    -0.159598     3B2     0.095351  
       3B1     0.110501     7A1     0.141061     8A1     0.197303  
       9A1     0.676593     1A2     0.682052    10A1     0.688355  
       4B2     0.739335     4B1     0.743768     5B2     0.902059  
       5B1     0.902453    11A1     1.360577    12A1     1.758706  
       2A2     3.101729    13A1     3.102209     6B1     3.393076  
       6B2     3.395044    14A1     3.759812  

    Beta Occupied:                                                        

       1A1   -25.208334     2A1   -10.784602     3A1    -1.737913  
       4A1    -1.049542     1B1    -0.927534     1B2    -0.902043  

    Beta Virtual:                                                         

       5A1    -0.633895     2B1    -0.437159     2B2    -0.391081  
       6A1    -0.109651     3B1     0.134723     3B2     0.163425  
       7A1     0.217462     8A1     0.247522     9A1     0.698344  
       4B1     0.774393     1A2     0.780260    10A1     0.780964  
       4B2     0.799117     5B1     0.944257     5B2     0.972255  
      11A1     1.442583    12A1     1.767282    13A1     3.113692  
       2A2     3.113743     6B1     3.404748     6B2     3.426157  
      14A1     3.779051  

    Final Occupation by Irrep:
             A1    A2    B1    B2 
    DOCC [     4,    0,    1,    1 ]
    SOCC [     1,    0,    0,    1 ]
    NA   [     5,    0,    1,    2 ]
    NB   [     4,    0,    1,    1 ]

  @DF-UKS Final Energy:  -137.27684518175818

   => Energetics <=

    Nuclear Repulsion Energy =             23.8129744801500038
    One-Electron Energy =                -230.3262005030503019
    Two-Electron Energy =                  81.6999679306972126
    DFT Exchange-Correlation Energy =     -12.4635870895550678
    Empirical Dispersion Energy =           0.0000000000000000
    VV10 Nonlocal Energy =                  0.0000000000000000
    Total Energy =                       -137.2768451817581763

  UHF NO Occupations:
  HONO-2 :    1 B1 1.9977364
  HONO-1 :    2 B2 1.0000000
  HONO-0 :    5 A1 1.0000000
  LUNO+0 :    2 B1 0.0022636
  LUNO+1 :    3 B2 0.0004052
  LUNO+2 :    6 A1 0.0001732
  LUNO+3 :    7 A1 0.0000135


Computation Completed


Properties will be evaluated at   0.000000,   0.000000,   0.000000 [a0]

Properties computed using the SCF density matrix


 Multipole Moments:

 ------------------------------------------------------------------------------------
     Multipole            Electronic (a.u.)      Nuclear  (a.u.)        Total (a.u.)
 ------------------------------------------------------------------------------------

 L = 1.  Multiply by 2.5417464519 to convert [e a0] to [Debye]
 Dipole X            :          0.0000000            0.0000000            0.0000000
 Dipole Y            :          0.0000000            0.0000000            0.0000000
 Dipole Z            :          0.6002020            0.4382258            1.0384279
 Magnitude           :                                                    1.0384279

 ------------------------------------------------------------------------------------

*** tstop() called on Joses-MacBook-Pro-2.local at Thu Jul 17 13:41:30 2025
Module time:
	user time   =       3.19 seconds =       0.05 minutes
	system time =       4.53 seconds =       0.08 minutes
	total time  =          1 seconds =       0.02 minutes
Total time:
	user time   =       3.19 seconds =       0.05 minutes
	system time =       4.53 seconds =       0.08 minutes
	total time  =          1 seconds =       0.02 minutes

*** tstart() called on Joses-MacBook-Pro-2.local
*** at Thu Jul 17 13:41:30 2025


         ------------------------------------------------------------
                                   SCF GRAD                          
                          Rob Parrish, Justin Turney,                
                       Andy Simmonett, and Alex Sokolov              
         ------------------------------------------------------------

  ==> Geometry <==

    Molecular point group: c2v
    Full point group: C_inf_v

    Geometry (in Angstrom), charge = 1, multiplicity = 3:

       Center              X                  Y                   Z               Mass       
    ------------   -----------------  -----------------  -----------------  -----------------
         C            0.000000000000     0.000000000000     0.735459942101    12.000000000000
         F            0.000000000000     0.000000000000    -0.464540057899    18.998403162730

  Nuclear repulsion =   23.812974480150004

  ==> Basis Set <==

  Basis Set: CC-PVDZ
    Blend: CC-PVDZ
    Number of shells: 12
    Number of basis functions: 28
    Number of Cartesian functions: 30
    Spherical Harmonics?: true
    Max angular momentum: 2

  ==> DFJKGrad: Density-Fitted SCF Gradients <==

    Gradient:                    1
    J tasked:                  Yes
    K tasked:                  Yes
    wK tasked:                  No
    OpenMP threads:              1
    Integrals threads:           1
    Memory [MiB]:              375
    Schwarz Cutoff:          1E-12
    Fitting Condition:       1E-10

   => Auxiliary Basis Set <=

  Basis Set: (CC-PVDZ AUX)
    Blend: CC-PVDZ-JKFIT
    Number of shells: 48
    Number of basis functions: 140
    Number of Cartesian functions: 162
    Spherical Harmonics?: true
    Max angular momentum: 3

  ==> DFT Potential <==

   => LibXC <=

    Version 6.2.2
    S. Lehtola, C. Steigemann, M. J.T. Oliveira, and M. A.L. Marques.,  SoftwareX 7, 1–5 (2018) (10.1016/j.softx.2017.11.002)

   => Composite Functional: B3LYP <= 

    B3LYP Hyb-GGA Exchange-Correlation Functional

    P. J. Stephens, F. J. Devlin, C. F. Chabalowski, and M. J. Frisch.,  J. Phys. Chem. 98, 11623 (1994) (10.1021/j100096a001)

    Deriv               =              1
    GGA                 =           TRUE
    Meta                =          FALSE

    Exchange Hybrid     =           TRUE
    MP2 Hybrid          =          FALSE

   => Exchange Functionals <=

    0.0800   Slater exchange
    0.7200         Becke 88

   => Exact (HF) Exchange <=

    0.2000               HF 

   => Correlation Functionals <=

    0.1900   Vosko, Wilk & Nusair (VWN5_RPA)
    0.8100   Lee, Yang & Parr

   => LibXC Density Thresholds  <==

    XC_HYB_GGA_XC_B3LYP:  1.00E-15 

   => Molecular Quadrature <=

    Radial Scheme          =       TREUTLER
    Pruning Scheme         =           NONE
    Nuclear Scheme         =       TREUTLER

    Blocking Scheme        =         OCTREE
    BS radius alpha        =              1
    Pruning alpha          =              1
    Radial Points          =             75
    Spherical Points       =            302
    Total Points           =          43222
    Total Blocks           =            387
    Max Points             =            254
    Max Functions          =             28
    Weights Tolerance      =       1.00E-15


  -Total Gradient:
     Atom            X                  Y                   Z
    ------   -----------------  -----------------  -----------------
       1        0.000000000000     0.000000000000    -0.031505763222
       2        0.000000000000    -0.000000000000     0.031518981645


*** tstop() called on Joses-MacBook-Pro-2.local at Thu Jul 17 13:41:30 2025
Module time:
	user time   =       0.65 seconds =       0.01 minutes
	system time =       1.03 seconds =       0.02 minutes
	total time  =          0 seconds =       0.00 minutes
Total time:
	user time   =       3.84 seconds =       0.06 minutes
	system time =       5.56 seconds =       0.09 minutes
	total time  =          1 seconds =       0.02 minutes

    			-----------------------------------------

    			 OPTKING 3.0: for geometry optimizations 

    			     By R.A. King, Bethel University     

    			        with contributions from          

    			    A.V. Copan, J. Cayton, A. Heide      

    			-----------------------------------------

    
	                            ===> Fragment 1 <== 

	 Z (Atomic Numbers)          Masses                          Geom                  
	       6.000000            12.000000          0.00000000  0.00000000  1.38981787   
	       9.000000            18.998403          0.00000000  0.00000000 -0.87785348   

	 - Coordinate -           - BOHR/RAD -       - ANG/DEG -
	 R(1,2)           =         2.267671           1.200000


	        --- Internal Coordinate Step in ANG or DEG, aJ/ANG or AJ/DEG ---
	-------------------------------------------------------------------------------
	           Coordinate      Previous         Force          Change          New 
	           ----------      --------        ------          ------        ------
	               R(1,2)       1.20000        0.25962        0.01589       1.21589
	-------------------------------------------------------------------------------

	                                 ==> Convergence Check <==                                  
    
	Measures of convergence in internal coordinates in au.
    
	Criteria marked as inactive (o), active & met (*), and active & unmet ( ).

	----------------------------------------------------------------------------------------------
	   Step    Total Energy     Delta E     Max Force     RMS Force      Max Disp      RMS Disp   
	----------------------------------------------------------------------------------------------
	  Convergence Criteria     1.00e-06 *    3.00e-04 *             o    1.20e-03 *             o
	----------------------------------------------------------------------------------------------
	     1    -137.27684518   -1.37e+02      3.15e-02      3.15e-02 o    3.00e-02      3.00e-02 o  ~
	----------------------------------------------------------------------------------------------

Next Geometry in Ang 
	Fragment 1 (Ang)

	    C   0.0000000000   0.0000000000   0.7434069457
	    F   0.0000000000   0.0000000000  -0.4724870615


    Structure for next step:
    Molecular point group: c2v
    Full point group: C_inf_v

    Geometry (in Angstrom), charge = 1, multiplicity = 3:

    C            0.000000000000     0.000000000000     0.745201113477
    F            0.000000000000     0.000000000000    -0.470692893772


Scratch directory: /tmp/
gradient() will perform analytic gradient computation.
   => Libint2 <=

    Primary   basis highest AM E, G, H:  6, 6, 3
    Auxiliary basis highest AM E, G, H:  7, 7, 4
    Onebody   basis highest AM E, G, H:  -, -, -
    Solid Harmonics ordering:            Gaussian

*** tstart() called on Joses-MacBook-Pro-2.local
*** at Thu Jul 17 13:41:30 2025

   => Loading Basis Set <=

    Name: CC-PVDZ
    Role: ORBITAL
    Keyword: BASIS
    atoms 1 entry C          line   138 file /Users/joseantoniorodriguesromero/anaconda3/share/psi4/basis/cc-pvdz.gbs 
    atoms 2 entry F          line   228 file /Users/joseantoniorodriguesromero/anaconda3/share/psi4/basis/cc-pvdz.gbs 


         ---------------------------------------------------------
                                   SCF
               by Justin Turney, Rob Parrish, Andy Simmonett
                          and Daniel G. A. Smith
                              UKS Reference
                        1 Threads,    500 MiB Core
         ---------------------------------------------------------

  ==> Geometry <==

    Molecular point group: c2v
    Full point group: C_inf_v

    Geometry (in Angstrom), charge = 1, multiplicity = 3:

       Center              X                  Y                   Z               Mass       
    ------------   -----------------  -----------------  -----------------  -----------------
         C            0.000000000000     0.000000000000     0.745201113477    12.000000000000
         F            0.000000000000     0.000000000000    -0.470692893772    18.998403162730

  Running in c2v symmetry.

  Rotational constants: A = ************  B =      1.55041  C =      1.55041 [cm^-1]
  Rotational constants: A = ************  B =  46480.06644  C =  46480.06644 [MHz]
  Nuclear repulsion =   23.501694395903222

  Charge       = 1
  Multiplicity = 3
  Electrons    = 14
  Nalpha       = 8
  Nbeta        = 6

  ==> Algorithm <==

  SCF Algorithm Type is DF.
  DIIS enabled.
  MOM disabled.
  Fractional occupation disabled.
  Guess Type is READ.
  Energy threshold   = 1.00e-08
  Density threshold  = 1.00e-08
  Integral threshold = 1.00e-12

  ==> Primary Basis <==

  Basis Set: CC-PVDZ
    Blend: CC-PVDZ
    Number of shells: 12
    Number of basis functions: 28
    Number of Cartesian functions: 30
    Spherical Harmonics?: true
    Max angular momentum: 2

  ==> DFT Potential <==

   => LibXC <=

    Version 6.2.2
    S. Lehtola, C. Steigemann, M. J.T. Oliveira, and M. A.L. Marques.,  SoftwareX 7, 1–5 (2018) (10.1016/j.softx.2017.11.002)

   => Composite Functional: B3LYP <= 

    B3LYP Hyb-GGA Exchange-Correlation Functional

    P. J. Stephens, F. J. Devlin, C. F. Chabalowski, and M. J. Frisch.,  J. Phys. Chem. 98, 11623 (1994) (10.1021/j100096a001)

    Deriv               =              1
    GGA                 =           TRUE
    Meta                =          FALSE

    Exchange Hybrid     =           TRUE
    MP2 Hybrid          =          FALSE

   => Exchange Functionals <=

    0.0800   Slater exchange
    0.7200         Becke 88

   => Exact (HF) Exchange <=

    0.2000               HF 

   => Correlation Functionals <=

    0.1900   Vosko, Wilk & Nusair (VWN5_RPA)
    0.8100   Lee, Yang & Parr

   => LibXC Density Thresholds  <==

    XC_HYB_GGA_XC_B3LYP:  1.00E-15 

   => Molecular Quadrature <=

    Radial Scheme          =       TREUTLER
    Pruning Scheme         =           NONE
    Nuclear Scheme         =       TREUTLER

    Blocking Scheme        =         OCTREE
    BS radius alpha        =              1
    Pruning alpha          =              1
    Radial Points          =             75
    Spherical Points       =            302
    Total Points           =          43222
    Total Blocks           =            388
    Max Points             =            256
    Max Functions          =             28
    Weights Tolerance      =       1.00E-15

   => Loading Basis Set <=

    Name: (CC-PVDZ AUX)
    Role: JKFIT
    Keyword: DF_BASIS_SCF
    atoms 1 entry C          line   121 file /Users/joseantoniorodriguesromero/anaconda3/share/psi4/basis/cc-pvdz-jkfit.gbs 
    atoms 2 entry F          line   271 file /Users/joseantoniorodriguesromero/anaconda3/share/psi4/basis/cc-pvdz-jkfit.gbs 

   => Loading Basis Set <=

    Name: CC-PVDZ
    Role: ORBITAL
    Keyword: BASIS
    atoms 1 entry C          line   138 file /Users/joseantoniorodriguesromero/anaconda3/share/psi4/basis/cc-pvdz.gbs 
    atoms 2 entry F          line   228 file /Users/joseantoniorodriguesromero/anaconda3/share/psi4/basis/cc-pvdz.gbs 

  Reading orbitals from file /tmp/triplet_CF.default.74331.180.npy, no projection.

  ==> Integral Setup <==

  DFHelper Memory: AOs need 0.001 GiB; user supplied 0.332 GiB. 
  Using in-core AOs.

  ==> MemDFJK: Density-Fitted J/K Matrices <==

    J tasked:                   Yes
    K tasked:                   Yes
    wK tasked:                   No
    OpenMP threads:               1
    Memory [MiB]:               339
    Algorithm:                 Core
    Schwarz Cutoff:           1E-12
    Mask sparsity (%):       0.0000
    Fitting Condition:        1E-10

   => Auxiliary Basis Set <=

  Basis Set: (CC-PVDZ AUX)
    Blend: CC-PVDZ-JKFIT
    Number of shells: 48
    Number of basis functions: 140
    Number of Cartesian functions: 162
    Spherical Harmonics?: true
    Max angular momentum: 3

  Cached 100.0% of DFT collocation blocks in 0.034 [GiB].

  Minimum eigenvalue in the overlap matrix is 3.6666106731E-02.
  Reciprocal condition number of the overlap matrix is 1.2657631336E-02.
    Using symmetric orthogonalization.

  ==> Pre-Iterations <==

  SCF Guess: Orbitals guess was supplied from a previous computation.

   -------------------------------------------------------
    Irrep   Nso     Nmo     Nalpha   Nbeta   Ndocc  Nsocc
   -------------------------------------------------------
     A1        14      14       5       4       4       1
     A2         2       2       0       0       0       0
     B1         6       6       1       1       1       0
     B2         6       6       2       1       1       1
   -------------------------------------------------------
    Total      28      28       8       6       6       2
   -------------------------------------------------------

  ==> Iterations <==

                           Total Energy        Delta E     RMS |[F,P]|

   @DF-UKS iter   0:  -137.25217488713744   -1.37252e+02   3.49468e-03 
   @DF-UKS iter   1:  -137.27731378172271   -2.51389e-02   1.10619e-03 DIIS/ADIIS
   @DF-UKS iter   2:  -137.27702275493689    2.91027e-04   2.13187e-03 DIIS/ADIIS/DAMP=1%
   @DF-UKS iter   3:  -137.27672664225250    2.96113e-04   1.21647e-04 DIIS/ADIIS/DAMP=1%
   @DF-UKS iter   4:  -137.27743938583129   -7.12744e-04   3.69382e-05 DIIS/DAMP=1%
   @DF-UKS iter   5:  -137.27742278664354    1.65992e-05   5.46443e-06 DIIS/DAMP=1%
   @DF-UKS iter   6:  -137.27743314836289   -1.03617e-05   1.23577e-06 DIIS/DAMP=1%
   @DF-UKS iter   7:  -137.27743326317255   -1.14810e-07   2.92052e-07 DIIS/DAMP=1%
   @DF-UKS iter   8:  -137.27743268676744    5.76405e-07   3.92110e-08 DIIS/DAMP=1%
   @DF-UKS iter   9:  -137.27743274962711   -6.28597e-08   9.34311e-09 DIIS/DAMP=1%
   @DF-UKS iter  10:  -137.27743275266525   -3.03814e-09   4.32883e-10 DIIS/DAMP=1%
  Energy and wave function converged.


  ==> Post-Iterations <==

   Electrons on quadrature grid:
      Nalpha   =    7.9999998261 ; deviation = -1.739e-07
      Nbeta    =    5.9999998009 ; deviation = -1.991e-07
      Ntotal   =   13.9999996270 ; deviation = -3.730e-07 

   @Spin Contamination Metric:   5.857740097E-03
   @S^2 Expected:                2.000000000E+00
   @S^2 Observed:                2.005857740E+00
   @S   Expected:                1.000000000E+00
   @S   Observed:                1.000000000E+00

    Orbital Energies [Eh]
    ---------------------

    Alpha Occupied:                                                       

       1A1   -25.213220     2A1   -10.827756     3A1    -1.746551  
       4A1    -1.089528     1B2    -0.945060     1B1    -0.926331  
       5A1    -0.892000     2B2    -0.627682  

    Alpha Virtual:                                                        

       2B1    -0.511901     6A1    -0.170301     3B2     0.096021  
       3B1     0.111269     7A1     0.136732     8A1     0.189868  
       9A1     0.681103     1A2     0.682678    10A1     0.689051  
       4B2     0.731535     4B1     0.735984     5B2     0.905646  
       5B1     0.906107    11A1     1.344481    12A1     1.759148  
       2A2     3.104373    13A1     3.104833     6B1     3.381325  
       6B2     3.383284    14A1     3.736750  

    Beta Occupied:                                                        

       1A1   -25.205877     2A1   -10.787348     3A1    -1.727264  
       4A1    -1.044879     1B1    -0.920785     1B2    -0.895787  

    Beta Virtual:                                                         

       5A1    -0.636127     2B1    -0.441328     2B2    -0.394991  
       6A1    -0.117837     3B1     0.135442     3B2     0.164246  
       7A1     0.203573     8A1     0.245994     9A1     0.703476  
       4B1     0.768315     1A2     0.781199    10A1     0.781937  
       4B2     0.793575     5B1     0.945684     5B2     0.972949  
      11A1     1.426666    12A1     1.767677    13A1     3.115889  
       2A2     3.115944     6B1     3.393214     6B2     3.414208  
      14A1     3.756349  

    Final Occupation by Irrep:
             A1    A2    B1    B2 
    DOCC [     4,    0,    1,    1 ]
    SOCC [     1,    0,    0,    1 ]
    NA   [     5,    0,    1,    2 ]
    NB   [     4,    0,    1,    1 ]

  @DF-UKS Final Energy:  -137.27743275266525

   => Energetics <=

    Nuclear Repulsion Energy =             23.5016943959032218
    One-Electron Energy =                -229.7617668815846912
    Two-Electron Energy =                  81.4367563240714958
    DFT Exchange-Correlation Energy =     -12.4541165910552714
    Empirical Dispersion Energy =           0.0000000000000000
    VV10 Nonlocal Energy =                  0.0000000000000000
    Total Energy =                       -137.2774327526652485

  UHF NO Occupations:
  HONO-2 :    1 B1 1.9976662
  HONO-1 :    2 B2 1.0000000
  HONO-0 :    5 A1 1.0000000
  LUNO+0 :    2 B1 0.0023338
  LUNO+1 :    3 B2 0.0003991
  LUNO+2 :    6 A1 0.0001849
  LUNO+3 :    7 A1 0.0000138


Computation Completed


Properties will be evaluated at   0.000000,   0.000000,   0.000000 [a0]

Properties computed using the SCF density matrix


 Multipole Moments:

 ------------------------------------------------------------------------------------
     Multipole            Electronic (a.u.)      Nuclear  (a.u.)        Total (a.u.)
 ------------------------------------------------------------------------------------

 L = 1.  Multiply by 2.5417464519 to convert [e a0] to [Debye]
 Dipole X            :          0.0000000            0.0000000            0.0000000
 Dipole Y            :          0.0000000            0.0000000            0.0000000
 Dipole Z            :          0.6219181            0.4440302            1.0659482
 Magnitude           :                                                    1.0659482

 ------------------------------------------------------------------------------------

*** tstop() called on Joses-MacBook-Pro-2.local at Thu Jul 17 13:41:31 2025
Module time:
	user time   =       3.75 seconds =       0.06 minutes
	system time =       2.90 seconds =       0.05 minutes
	total time  =          1 seconds =       0.02 minutes
Total time:
	user time   =       7.62 seconds =       0.13 minutes
	system time =       8.68 seconds =       0.14 minutes
	total time  =          2 seconds =       0.03 minutes

*** tstart() called on Joses-MacBook-Pro-2.local
*** at Thu Jul 17 13:41:31 2025


         ------------------------------------------------------------
                                   SCF GRAD                          
                          Rob Parrish, Justin Turney,                
                       Andy Simmonett, and Alex Sokolov              
         ------------------------------------------------------------

  ==> Geometry <==

    Molecular point group: c2v
    Full point group: C_inf_v

    Geometry (in Angstrom), charge = 1, multiplicity = 3:

       Center              X                  Y                   Z               Mass       
    ------------   -----------------  -----------------  -----------------  -----------------
         C            0.000000000000     0.000000000000     0.745201113477    12.000000000000
         F            0.000000000000     0.000000000000    -0.470692893772    18.998403162730

  Nuclear repulsion =   23.501694395903222

  ==> Basis Set <==

  Basis Set: CC-PVDZ
    Blend: CC-PVDZ
    Number of shells: 12
    Number of basis functions: 28
    Number of Cartesian functions: 30
    Spherical Harmonics?: true
    Max angular momentum: 2

  ==> DFJKGrad: Density-Fitted SCF Gradients <==

    Gradient:                    1
    J tasked:                  Yes
    K tasked:                  Yes
    wK tasked:                  No
    OpenMP threads:              1
    Integrals threads:           1
    Memory [MiB]:              375
    Schwarz Cutoff:          1E-12
    Fitting Condition:       1E-10

   => Auxiliary Basis Set <=

  Basis Set: (CC-PVDZ AUX)
    Blend: CC-PVDZ-JKFIT
    Number of shells: 48
    Number of basis functions: 140
    Number of Cartesian functions: 162
    Spherical Harmonics?: true
    Max angular momentum: 3

  ==> DFT Potential <==

   => LibXC <=

    Version 6.2.2
    S. Lehtola, C. Steigemann, M. J.T. Oliveira, and M. A.L. Marques.,  SoftwareX 7, 1–5 (2018) (10.1016/j.softx.2017.11.002)

   => Composite Functional: B3LYP <= 

    B3LYP Hyb-GGA Exchange-Correlation Functional

    P. J. Stephens, F. J. Devlin, C. F. Chabalowski, and M. J. Frisch.,  J. Phys. Chem. 98, 11623 (1994) (10.1021/j100096a001)

    Deriv               =              1
    GGA                 =           TRUE
    Meta                =          FALSE

    Exchange Hybrid     =           TRUE
    MP2 Hybrid          =          FALSE

   => Exchange Functionals <=

    0.0800   Slater exchange
    0.7200         Becke 88

   => Exact (HF) Exchange <=

    0.2000               HF 

   => Correlation Functionals <=

    0.1900   Vosko, Wilk & Nusair (VWN5_RPA)
    0.8100   Lee, Yang & Parr

   => LibXC Density Thresholds  <==

    XC_HYB_GGA_XC_B3LYP:  1.00E-15 

   => Molecular Quadrature <=

    Radial Scheme          =       TREUTLER
    Pruning Scheme         =           NONE
    Nuclear Scheme         =       TREUTLER

    Blocking Scheme        =         OCTREE
    BS radius alpha        =              1
    Pruning alpha          =              1
    Radial Points          =             75
    Spherical Points       =            302
    Total Points           =          43222
    Total Blocks           =            388
    Max Points             =            256
    Max Functions          =             28
    Weights Tolerance      =       1.00E-15


  -Total Gradient:
     Atom            X                  Y                   Z
    ------   -----------------  -----------------  -----------------
       1       -0.000000000000     0.000000000000    -0.008059890824
       2        0.000000000000     0.000000000000     0.008072683846


*** tstop() called on Joses-MacBook-Pro-2.local at Thu Jul 17 13:41:31 2025
Module time:
	user time   =       0.61 seconds =       0.01 minutes
	system time =       1.07 seconds =       0.02 minutes
	total time  =          0 seconds =       0.00 minutes
Total time:
	user time   =       8.23 seconds =       0.14 minutes
	system time =       9.76 seconds =       0.16 minutes
	total time  =          2 seconds =       0.03 minutes

    			-----------------------------------------

    			 OPTKING 3.0: for geometry optimizations 

    			     By R.A. King, Bethel University     

    			        with contributions from          

    			    A.V. Copan, J. Cayton, A. Heide      

    			-----------------------------------------

    
	                            ===> Fragment 1 <== 

	 Z (Atomic Numbers)          Masses                          Geom                  
	       6.000000            12.000000          0.00000000  0.00000000  1.40822601   
	       9.000000            18.998403          0.00000000  0.00000000 -0.88948066   

	 - Coordinate -           - BOHR/RAD -       - ANG/DEG -
	 R(1,2)           =         2.297707           1.215894


	        --- Internal Coordinate Step in ANG or DEG, aJ/ANG or AJ/DEG ---
	-------------------------------------------------------------------------------
	           Coordinate      Previous         Force          Change          New 
	           ----------      --------        ------          ------        ------
	               R(1,2)       1.21589        0.06646        0.00547       1.22136
	-------------------------------------------------------------------------------

	                                 ==> Convergence Check <==                                  
    
	Measures of convergence in internal coordinates in au.
    
	Criteria marked as inactive (o), active & met (*), and active & unmet ( ).

	----------------------------------------------------------------------------------------------
	   Step    Total Energy     Delta E     Max Force     RMS Force      Max Disp      RMS Disp   
	----------------------------------------------------------------------------------------------
	  Convergence Criteria     1.00e-06 *    3.00e-04 *             o    1.20e-03 *             o
	----------------------------------------------------------------------------------------------
	     2    -137.27743275   -5.88e-04      8.07e-03      8.07e-03 o    1.03e-02      1.03e-02 o  ~
	----------------------------------------------------------------------------------------------

Next Geometry in Ang 
	Fragment 1 (Ang)

	    C   0.0000000000   0.0000000000   0.7479348736
	    F   0.0000000000   0.0000000000  -0.4734266539


    Structure for next step:
    Molecular point group: c2v
    Full point group: C_inf_v

    Geometry (in Angstrom), charge = 1, multiplicity = 3:

    C            0.000000000000     0.000000000000     0.748552065197
    F            0.000000000000     0.000000000000    -0.472809462218


Scratch directory: /tmp/
gradient() will perform analytic gradient computation.
   => Libint2 <=

    Primary   basis highest AM E, G, H:  6, 6, 3
    Auxiliary basis highest AM E, G, H:  7, 7, 4
    Onebody   basis highest AM E, G, H:  -, -, -
    Solid Harmonics ordering:            Gaussian

*** tstart() called on Joses-MacBook-Pro-2.local
*** at Thu Jul 17 13:41:31 2025

   => Loading Basis Set <=

    Name: CC-PVDZ
    Role: ORBITAL
    Keyword: BASIS
    atoms 1 entry C          line   138 file /Users/joseantoniorodriguesromero/anaconda3/share/psi4/basis/cc-pvdz.gbs 
    atoms 2 entry F          line   228 file /Users/joseantoniorodriguesromero/anaconda3/share/psi4/basis/cc-pvdz.gbs 


         ---------------------------------------------------------
                                   SCF
               by Justin Turney, Rob Parrish, Andy Simmonett
                          and Daniel G. A. Smith
                              UKS Reference
                        1 Threads,    500 MiB Core
         ---------------------------------------------------------

  ==> Geometry <==

    Molecular point group: c2v
    Full point group: C_inf_v

    Geometry (in Angstrom), charge = 1, multiplicity = 3:

       Center              X                  Y                   Z               Mass       
    ------------   -----------------  -----------------  -----------------  -----------------
         C            0.000000000000     0.000000000000     0.748552065197    12.000000000000
         F            0.000000000000     0.000000000000    -0.472809462218    18.998403162730

  Running in c2v symmetry.

  Rotational constants: A = ************  B =      1.53656  C =      1.53656 [cm^-1]
  Rotational constants: A = ************  B =  46064.85460  C =  46064.85460 [MHz]
  Nuclear repulsion =   23.396487227379257

  Charge       = 1
  Multiplicity = 3
  Electrons    = 14
  Nalpha       = 8
  Nbeta        = 6

  ==> Algorithm <==

  SCF Algorithm Type is DF.
  DIIS enabled.
  MOM disabled.
  Fractional occupation disabled.
  Guess Type is READ.
  Energy threshold   = 1.00e-08
  Density threshold  = 1.00e-08
  Integral threshold = 1.00e-12

  ==> Primary Basis <==

  Basis Set: CC-PVDZ
    Blend: CC-PVDZ
    Number of shells: 12
    Number of basis functions: 28
    Number of Cartesian functions: 30
    Spherical Harmonics?: true
    Max angular momentum: 2

  ==> DFT Potential <==

   => LibXC <=

    Version 6.2.2
    S. Lehtola, C. Steigemann, M. J.T. Oliveira, and M. A.L. Marques.,  SoftwareX 7, 1–5 (2018) (10.1016/j.softx.2017.11.002)

   => Composite Functional: B3LYP <= 

    B3LYP Hyb-GGA Exchange-Correlation Functional

    P. J. Stephens, F. J. Devlin, C. F. Chabalowski, and M. J. Frisch.,  J. Phys. Chem. 98, 11623 (1994) (10.1021/j100096a001)

    Deriv               =              1
    GGA                 =           TRUE
    Meta                =          FALSE

    Exchange Hybrid     =           TRUE
    MP2 Hybrid          =          FALSE

   => Exchange Functionals <=

    0.0800   Slater exchange
    0.7200         Becke 88

   => Exact (HF) Exchange <=

    0.2000               HF 

   => Correlation Functionals <=

    0.1900   Vosko, Wilk & Nusair (VWN5_RPA)
    0.8100   Lee, Yang & Parr

   => LibXC Density Thresholds  <==

    XC_HYB_GGA_XC_B3LYP:  1.00E-15 

   => Molecular Quadrature <=

    Radial Scheme          =       TREUTLER
    Pruning Scheme         =           NONE
    Nuclear Scheme         =       TREUTLER

    Blocking Scheme        =         OCTREE
    BS radius alpha        =              1
    Pruning alpha          =              1
    Radial Points          =             75
    Spherical Points       =            302
    Total Points           =          43223
    Total Blocks           =            389
    Max Points             =            256
    Max Functions          =             28
    Weights Tolerance      =       1.00E-15

   => Loading Basis Set <=

    Name: (CC-PVDZ AUX)
    Role: JKFIT
    Keyword: DF_BASIS_SCF
    atoms 1 entry C          line   121 file /Users/joseantoniorodriguesromero/anaconda3/share/psi4/basis/cc-pvdz-jkfit.gbs 
    atoms 2 entry F          line   271 file /Users/joseantoniorodriguesromero/anaconda3/share/psi4/basis/cc-pvdz-jkfit.gbs 

   => Loading Basis Set <=

    Name: CC-PVDZ
    Role: ORBITAL
    Keyword: BASIS
    atoms 1 entry C          line   138 file /Users/joseantoniorodriguesromero/anaconda3/share/psi4/basis/cc-pvdz.gbs 
    atoms 2 entry F          line   228 file /Users/joseantoniorodriguesromero/anaconda3/share/psi4/basis/cc-pvdz.gbs 

  Reading orbitals from file /tmp/triplet_CF.default.74331.180.npy, no projection.

  ==> Integral Setup <==

  DFHelper Memory: AOs need 0.001 GiB; user supplied 0.332 GiB. 
  Using in-core AOs.

  ==> MemDFJK: Density-Fitted J/K Matrices <==

    J tasked:                   Yes
    K tasked:                   Yes
    wK tasked:                   No
    OpenMP threads:               1
    Memory [MiB]:               339
    Algorithm:                 Core
    Schwarz Cutoff:           1E-12
    Mask sparsity (%):       0.0000
    Fitting Condition:        1E-10

   => Auxiliary Basis Set <=

  Basis Set: (CC-PVDZ AUX)
    Blend: CC-PVDZ-JKFIT
    Number of shells: 48
    Number of basis functions: 140
    Number of Cartesian functions: 162
    Spherical Harmonics?: true
    Max angular momentum: 3

  Cached 100.0% of DFT collocation blocks in 0.034 [GiB].

  Minimum eigenvalue in the overlap matrix is 3.6898036941E-02.
  Reciprocal condition number of the overlap matrix is 1.2756868234E-02.
    Using symmetric orthogonalization.

  ==> Pre-Iterations <==

  SCF Guess: Orbitals guess was supplied from a previous computation.

   -------------------------------------------------------
    Irrep   Nso     Nmo     Nalpha   Nbeta   Ndocc  Nsocc
   -------------------------------------------------------
     A1        14      14       5       4       4       1
     A2         2       2       0       0       0       0
     B1         6       6       1       1       1       0
     B2         6       6       2       1       1       1
   -------------------------------------------------------
    Total      28      28       8       6       6       2
   -------------------------------------------------------

  ==> Iterations <==

                           Total Energy        Delta E     RMS |[F,P]|

   @DF-UKS iter   0:  -137.26891080353124   -1.37269e+02   1.17198e-03 
   @DF-UKS iter   1:  -137.27746368889569   -8.55289e-03   3.74500e-04 DIIS/ADIIS
   @DF-UKS iter   2:  -137.27743044143568    3.32475e-05   7.20486e-04 DIIS/ADIIS/DAMP=1%
   @DF-UKS iter   3:  -137.27724003950470    1.90402e-04   3.97198e-05 DIIS/DAMP=1%
   @DF-UKS iter   4:  -137.27747844086855   -2.38401e-04   1.29312e-05 DIIS/DAMP=1%
   @DF-UKS iter   5:  -137.27747387199383    4.56887e-06   1.96520e-06 DIIS/DAMP=1%
   @DF-UKS iter   6:  -137.27747752547816   -3.65348e-06   4.38774e-07 DIIS/DAMP=1%
   @DF-UKS iter   7:  -137.27747755282596   -2.73478e-08   1.07232e-07 DIIS/DAMP=1%
   @DF-UKS iter   8:  -137.27747734916227    2.03664e-07   1.44425e-08 DIIS/DAMP=1%
   @DF-UKS iter   9:  -137.27747737150182   -2.23395e-08   3.41749e-09 DIIS/DAMP=1%
   @DF-UKS iter  10:  -137.27747737292589   -1.42407e-09   1.80540e-10 DIIS/DAMP=1%
  Energy and wave function converged.


  ==> Post-Iterations <==

   Electrons on quadrature grid:
      Nalpha   =    7.9999998696 ; deviation = -1.304e-07
      Nbeta    =    5.9999998412 ; deviation = -1.588e-07
      Ntotal   =   13.9999997108 ; deviation = -2.892e-07 

   @Spin Contamination Metric:   5.908222115E-03
   @S^2 Expected:                2.000000000E+00
   @S^2 Observed:                2.005908222E+00
   @S   Expected:                1.000000000E+00
   @S   Observed:                1.000000000E+00

    Orbital Energies [Eh]
    ---------------------

    Alpha Occupied:                                                       

       1A1   -25.212392     2A1   -10.828664     3A1    -1.743004  
       4A1    -1.088729     1B2    -0.942699     1B1    -0.923968  
       5A1    -0.891941     2B2    -0.629110  

    Alpha Virtual:                                                        

       2B1    -0.513271     6A1    -0.174120     3B2     0.096242  
       3B1     0.111524     7A1     0.135127     8A1     0.187780  
       9A1     0.682697     1A2     0.682887    10A1     0.689284  
       4B2     0.728892     4B1     0.733348     5B2     0.906887  
       5B1     0.907373    11A1     1.338982    12A1     1.759363  
       2A2     3.105297    13A1     3.105749     6B1     3.377339  
       6B2     3.379295    14A1     3.728999  

    Beta Occupied:                                                        

       1A1   -25.205038     2A1   -10.788281     3A1    -1.723671  
       4A1    -1.043280     1B1    -0.918510     1B2    -0.893683  

    Beta Virtual:                                                         

       5A1    -0.636899     2B1    -0.442728     2B2    -0.396303  
       6A1    -0.120808     3B1     0.135677     3B2     0.164516  
       7A1     0.199059     8A1     0.245594     9A1     0.705278  
       4B1     0.766191     1A2     0.781505    10A1     0.782256  
       4B2     0.791617     5B1     0.946255     5B2     0.973286  
      11A1     1.421179    12A1     1.767917    13A1     3.116664  
       2A2     3.116721     6B1     3.389314     6B2     3.410164  
      14A1     3.748738  

    Final Occupation by Irrep:
             A1    A2    B1    B2 
    DOCC [     4,    0,    1,    1 ]
    SOCC [     1,    0,    0,    1 ]
    NA   [     5,    0,    1,    2 ]
    NB   [     4,    0,    1,    1 ]

  @DF-UKS Final Energy:  -137.27747737292589

   => Energetics <=

    Nuclear Repulsion Energy =             23.3964872273792572
    One-Electron Energy =                -229.5706726100964943
    Two-Electron Energy =                  81.3476537880638517
    DFT Exchange-Correlation Energy =     -12.4509457782725068
    Empirical Dispersion Energy =           0.0000000000000000
    VV10 Nonlocal Energy =                  0.0000000000000000
    Total Energy =                       -137.2774773729258868

  UHF NO Occupations:
  HONO-2 :    1 B1 1.9976433
  HONO-1 :    2 B2 1.0000000
  HONO-0 :    5 A1 1.0000000
  LUNO+0 :    2 B1 0.0023567
  LUNO+1 :    3 B2 0.0003969
  LUNO+2 :    6 A1 0.0001894
  LUNO+3 :    7 A1 0.0000140


Computation Completed


Properties will be evaluated at   0.000000,   0.000000,   0.000000 [a0]

Properties computed using the SCF density matrix


 Multipole Moments:

 ------------------------------------------------------------------------------------
     Multipole            Electronic (a.u.)      Nuclear  (a.u.)        Total (a.u.)
 ------------------------------------------------------------------------------------

 L = 1.  Multiply by 2.5417464519 to convert [e a0] to [Debye]
 Dipole X            :          0.0000000            0.0000000            0.0000000
 Dipole Y            :          0.0000000            0.0000000            0.0000000
 Dipole Z            :          0.6292601            0.4460268            1.0752869
 Magnitude           :                                                    1.0752869

 ------------------------------------------------------------------------------------

*** tstop() called on Joses-MacBook-Pro-2.local at Thu Jul 17 13:41:32 2025
Module time:
	user time   =       2.84 seconds =       0.05 minutes
	system time =       3.86 seconds =       0.06 minutes
	total time  =          1 seconds =       0.02 minutes
Total time:
	user time   =      11.29 seconds =       0.19 minutes
	system time =      13.72 seconds =       0.23 minutes
	total time  =          3 seconds =       0.05 minutes

*** tstart() called on Joses-MacBook-Pro-2.local
*** at Thu Jul 17 13:41:32 2025


         ------------------------------------------------------------
                                   SCF GRAD                          
                          Rob Parrish, Justin Turney,                
                       Andy Simmonett, and Alex Sokolov              
         ------------------------------------------------------------

  ==> Geometry <==

    Molecular point group: c2v
    Full point group: C_inf_v

    Geometry (in Angstrom), charge = 1, multiplicity = 3:

       Center              X                  Y                   Z               Mass       
    ------------   -----------------  -----------------  -----------------  -----------------
         C            0.000000000000     0.000000000000     0.748552065197    12.000000000000
         F            0.000000000000     0.000000000000    -0.472809462218    18.998403162730

  Nuclear repulsion =   23.396487227379254

  ==> Basis Set <==

  Basis Set: CC-PVDZ
    Blend: CC-PVDZ
    Number of shells: 12
    Number of basis functions: 28
    Number of Cartesian functions: 30
    Spherical Harmonics?: true
    Max angular momentum: 2

  ==> DFJKGrad: Density-Fitted SCF Gradients <==

    Gradient:                    1
    J tasked:                  Yes
    K tasked:                  Yes
    wK tasked:                  No
    OpenMP threads:              1
    Integrals threads:           1
    Memory [MiB]:              375
    Schwarz Cutoff:          1E-12
    Fitting Condition:       1E-10

   => Auxiliary Basis Set <=

  Basis Set: (CC-PVDZ AUX)
    Blend: CC-PVDZ-JKFIT
    Number of shells: 48
    Number of basis functions: 140
    Number of Cartesian functions: 162
    Spherical Harmonics?: true
    Max angular momentum: 3

  ==> DFT Potential <==

   => LibXC <=

    Version 6.2.2
    S. Lehtola, C. Steigemann, M. J.T. Oliveira, and M. A.L. Marques.,  SoftwareX 7, 1–5 (2018) (10.1016/j.softx.2017.11.002)

   => Composite Functional: B3LYP <= 

    B3LYP Hyb-GGA Exchange-Correlation Functional

    P. J. Stephens, F. J. Devlin, C. F. Chabalowski, and M. J. Frisch.,  J. Phys. Chem. 98, 11623 (1994) (10.1021/j100096a001)

    Deriv               =              1
    GGA                 =           TRUE
    Meta                =          FALSE

    Exchange Hybrid     =           TRUE
    MP2 Hybrid          =          FALSE

   => Exchange Functionals <=

    0.0800   Slater exchange
    0.7200         Becke 88

   => Exact (HF) Exchange <=

    0.2000               HF 

   => Correlation Functionals <=

    0.1900   Vosko, Wilk & Nusair (VWN5_RPA)
    0.8100   Lee, Yang & Parr

   => LibXC Density Thresholds  <==

    XC_HYB_GGA_XC_B3LYP:  1.00E-15 

   => Molecular Quadrature <=

    Radial Scheme          =       TREUTLER
    Pruning Scheme         =           NONE
    Nuclear Scheme         =       TREUTLER

    Blocking Scheme        =         OCTREE
    BS radius alpha        =              1
    Pruning alpha          =              1
    Radial Points          =             75
    Spherical Points       =            302
    Total Points           =          43223
    Total Blocks           =            389
    Max Points             =            256
    Max Functions          =             28
    Weights Tolerance      =       1.00E-15


  -Total Gradient:
     Atom            X                  Y                   Z
    ------   -----------------  -----------------  -----------------
       1        0.000000000000    -0.000000000000    -0.000609587754
       2        0.000000000000     0.000000000000     0.000621572707


*** tstop() called on Joses-MacBook-Pro-2.local at Thu Jul 17 13:41:32 2025
Module time:
	user time   =       0.45 seconds =       0.01 minutes
	system time =       1.14 seconds =       0.02 minutes
	total time  =          0 seconds =       0.00 minutes
Total time:
	user time   =      11.75 seconds =       0.20 minutes
	system time =      14.86 seconds =       0.25 minutes
	total time  =          3 seconds =       0.05 minutes

    			-----------------------------------------

    			 OPTKING 3.0: for geometry optimizations 

    			     By R.A. King, Bethel University     

    			        with contributions from          

    			    A.V. Copan, J. Cayton, A. Heide      

    			-----------------------------------------

    
	                            ===> Fragment 1 <== 

	 Z (Atomic Numbers)          Masses                          Geom                  
	       6.000000            12.000000          0.00000000  0.00000000  1.41455839   
	       9.000000            18.998403          0.00000000  0.00000000 -0.89348039   

	 - Coordinate -           - BOHR/RAD -       - ANG/DEG -
	 R(1,2)           =         2.308039           1.221362


	        --- Internal Coordinate Step in ANG or DEG, aJ/ANG or AJ/DEG ---
	-------------------------------------------------------------------------------
	           Coordinate      Previous         Force          Change          New 
	           ----------      --------        ------          ------        ------
	               R(1,2)       1.22136        0.00507        0.00043       1.22179
	-------------------------------------------------------------------------------

	                                 ==> Convergence Check <==                                  
    
	Measures of convergence in internal coordinates in au.
    
	Criteria marked as inactive (o), active & met (*), and active & unmet ( ).

	----------------------------------------------------------------------------------------------
	   Step    Total Energy     Delta E     Max Force     RMS Force      Max Disp      RMS Disp   
	----------------------------------------------------------------------------------------------
	  Convergence Criteria     1.00e-06 *    3.00e-04 *             o    1.20e-03 *             o
	----------------------------------------------------------------------------------------------
	     3    -137.27747737   -4.46e-05      6.16e-04      6.16e-04 o    8.04e-04 *    8.04e-04 o  ~
	----------------------------------------------------------------------------------------------

Next Geometry in Ang 
	Fragment 1 (Ang)

	    C   0.0000000000   0.0000000000   0.7487648660
	    F   0.0000000000   0.0000000000  -0.4730222630


    Structure for next step:
    Molecular point group: c2v
    Full point group: C_inf_v

    Geometry (in Angstrom), charge = 1, multiplicity = 3:

    C            0.000000000000     0.000000000000     0.748812909329
    F            0.000000000000     0.000000000000    -0.472974219727


Scratch directory: /tmp/
gradient() will perform analytic gradient computation.
   => Libint2 <=

    Primary   basis highest AM E, G, H:  6, 6, 3
    Auxiliary basis highest AM E, G, H:  7, 7, 4
    Onebody   basis highest AM E, G, H:  -, -, -
    Solid Harmonics ordering:            Gaussian

*** tstart() called on Joses-MacBook-Pro-2.local
*** at Thu Jul 17 13:41:32 2025

   => Loading Basis Set <=

    Name: CC-PVDZ
    Role: ORBITAL
    Keyword: BASIS
    atoms 1 entry C          line   138 file /Users/joseantoniorodriguesromero/anaconda3/share/psi4/basis/cc-pvdz.gbs 
    atoms 2 entry F          line   228 file /Users/joseantoniorodriguesromero/anaconda3/share/psi4/basis/cc-pvdz.gbs 


         ---------------------------------------------------------
                                   SCF
               by Justin Turney, Rob Parrish, Andy Simmonett
                          and Daniel G. A. Smith
                              UKS Reference
                        1 Threads,    500 MiB Core
         ---------------------------------------------------------

  ==> Geometry <==

    Molecular point group: c2v
    Full point group: C_inf_v

    Geometry (in Angstrom), charge = 1, multiplicity = 3:

       Center              X                  Y                   Z               Mass       
    ------------   -----------------  -----------------  -----------------  -----------------
         C            0.000000000000     0.000000000000     0.748812909329    12.000000000000
         F            0.000000000000     0.000000000000    -0.472974219727    18.998403162730

  Running in c2v symmetry.

  Rotational constants: A = ************  B =      1.53549  C =      1.53549 [cm^-1]
  Rotational constants: A = ************  B =  46032.76740  C =  46032.76740 [MHz]
  Nuclear repulsion =   23.388337212437516

  Charge       = 1
  Multiplicity = 3
  Electrons    = 14
  Nalpha       = 8
  Nbeta        = 6

  ==> Algorithm <==

  SCF Algorithm Type is DF.
  DIIS enabled.
  MOM disabled.
  Fractional occupation disabled.
  Guess Type is READ.
  Energy threshold   = 1.00e-08
  Density threshold  = 1.00e-08
  Integral threshold = 1.00e-12

  ==> Primary Basis <==

  Basis Set: CC-PVDZ
    Blend: CC-PVDZ
    Number of shells: 12
    Number of basis functions: 28
    Number of Cartesian functions: 30
    Spherical Harmonics?: true
    Max angular momentum: 2

  ==> DFT Potential <==

   => LibXC <=

    Version 6.2.2
    S. Lehtola, C. Steigemann, M. J.T. Oliveira, and M. A.L. Marques.,  SoftwareX 7, 1–5 (2018) (10.1016/j.softx.2017.11.002)

   => Composite Functional: B3LYP <= 

    B3LYP Hyb-GGA Exchange-Correlation Functional

    P. J. Stephens, F. J. Devlin, C. F. Chabalowski, and M. J. Frisch.,  J. Phys. Chem. 98, 11623 (1994) (10.1021/j100096a001)

    Deriv               =              1
    GGA                 =           TRUE
    Meta                =          FALSE

    Exchange Hybrid     =           TRUE
    MP2 Hybrid          =          FALSE

   => Exchange Functionals <=

    0.0800   Slater exchange
    0.7200         Becke 88

   => Exact (HF) Exchange <=

    0.2000               HF 

   => Correlation Functionals <=

    0.1900   Vosko, Wilk & Nusair (VWN5_RPA)
    0.8100   Lee, Yang & Parr

   => LibXC Density Thresholds  <==

    XC_HYB_GGA_XC_B3LYP:  1.00E-15 

   => Molecular Quadrature <=

    Radial Scheme          =       TREUTLER
    Pruning Scheme         =           NONE
    Nuclear Scheme         =       TREUTLER

    Blocking Scheme        =         OCTREE
    BS radius alpha        =              1
    Pruning alpha          =              1
    Radial Points          =             75
    Spherical Points       =            302
    Total Points           =          43223
    Total Blocks           =            389
    Max Points             =            256
    Max Functions          =             28
    Weights Tolerance      =       1.00E-15

   => Loading Basis Set <=

    Name: (CC-PVDZ AUX)
    Role: JKFIT
    Keyword: DF_BASIS_SCF
    atoms 1 entry C          line   121 file /Users/joseantoniorodriguesromero/anaconda3/share/psi4/basis/cc-pvdz-jkfit.gbs 
    atoms 2 entry F          line   271 file /Users/joseantoniorodriguesromero/anaconda3/share/psi4/basis/cc-pvdz-jkfit.gbs 

   => Loading Basis Set <=

    Name: CC-PVDZ
    Role: ORBITAL
    Keyword: BASIS
    atoms 1 entry C          line   138 file /Users/joseantoniorodriguesromero/anaconda3/share/psi4/basis/cc-pvdz.gbs 
    atoms 2 entry F          line   228 file /Users/joseantoniorodriguesromero/anaconda3/share/psi4/basis/cc-pvdz.gbs 

  Reading orbitals from file /tmp/triplet_CF.default.74331.180.npy, no projection.

  ==> Integral Setup <==

  DFHelper Memory: AOs need 0.001 GiB; user supplied 0.332 GiB. 
  Using in-core AOs.

  ==> MemDFJK: Density-Fitted J/K Matrices <==

    J tasked:                   Yes
    K tasked:                   Yes
    wK tasked:                   No
    OpenMP threads:               1
    Memory [MiB]:               339
    Algorithm:                 Core
    Schwarz Cutoff:           1E-12
    Mask sparsity (%):       0.0000
    Fitting Condition:        1E-10

   => Auxiliary Basis Set <=

  Basis Set: (CC-PVDZ AUX)
    Blend: CC-PVDZ-JKFIT
    Number of shells: 48
    Number of basis functions: 140
    Number of Cartesian functions: 162
    Spherical Harmonics?: true
    Max angular momentum: 3

  Cached 100.0% of DFT collocation blocks in 0.034 [GiB].

  Minimum eigenvalue in the overlap matrix is 3.6916141787E-02.
  Reciprocal condition number of the overlap matrix is 1.2764627322E-02.
    Using symmetric orthogonalization.

  ==> Pre-Iterations <==

  SCF Guess: Orbitals guess was supplied from a previous computation.

   -------------------------------------------------------
    Irrep   Nso     Nmo     Nalpha   Nbeta   Ndocc  Nsocc
   -------------------------------------------------------
     A1        14      14       5       4       4       1
     A2         2       2       0       0       0       0
     B1         6       6       1       1       1       0
     B2         6       6       2       1       1       1
   -------------------------------------------------------
    Total      28      28       8       6       6       2
   -------------------------------------------------------

  ==> Iterations <==

                           Total Energy        Delta E     RMS |[F,P]|

   @DF-UKS iter   0:  -137.27681370027889   -1.37277e+02   9.06156e-05 
   @DF-UKS iter   1:  -137.27747755990214   -6.63860e-04   2.89399e-05 DIIS
   @DF-UKS iter   2:  -137.27747736327228    1.96630e-07   5.54916e-05 DIIS/DAMP=1%
   @DF-UKS iter   3:  -137.27745941793978    1.79453e-05   3.01368e-06 DIIS/DAMP=1%
   @DF-UKS iter   4:  -137.27747767976993   -1.82618e-05   1.00705e-06 DIIS/DAMP=1%
   @DF-UKS iter   5:  -137.27747736957033    3.10200e-07   1.53505e-07 DIIS/DAMP=1%
   @DF-UKS iter   6:  -137.27747765356895   -2.83999e-07   3.41789e-08 DIIS/DAMP=1%
   @DF-UKS iter   7:  -137.27747765569120   -2.12225e-09   8.39054e-09 DIIS/DAMP=1%
  Energy and wave function converged.


  ==> Post-Iterations <==

   Electrons on quadrature grid:
      Nalpha   =    7.9999998732 ; deviation = -1.268e-07
      Nbeta    =    5.9999998446 ; deviation = -1.554e-07
      Ntotal   =   13.9999997178 ; deviation = -2.822e-07 

   @Spin Contamination Metric:   5.912119184E-03
   @S^2 Expected:                2.000000000E+00
   @S^2 Observed:                2.005912119E+00
   @S   Expected:                1.000000000E+00
   @S   Observed:                1.000000000E+00

    Orbital Energies [Eh]
    ---------------------

    Alpha Occupied:                                                       

       1A1   -25.212327     2A1   -10.828734     3A1    -1.742730  
       4A1    -1.088668     1B2    -0.942516     1B1    -0.923785  
       5A1    -0.891936     2B2    -0.629220  

    Alpha Virtual:                                                        

       2B1    -0.513377     6A1    -0.174420     3B2     0.096259  
       3B1     0.111544     7A1     0.135000     8A1     0.187627  
       9A1     0.682822     1A2     0.682903    10A1     0.689302  
       4B2     0.728688     4B1     0.733144     5B2     0.906984  
       5B1     0.907472    11A1     1.338555    12A1     1.759381  
       2A2     3.105369    13A1     3.105821     6B1     3.377029  
       6B2     3.378985    14A1     3.728400  

    Beta Occupied:                                                        

       1A1   -25.204973     2A1   -10.788353     3A1    -1.723393  
       4A1    -1.043156     1B1    -0.918334     1B2    -0.893520  

    Beta Virtual:                                                         

       5A1    -0.636959     2B1    -0.442837     2B2    -0.396404  
       6A1    -0.121043     3B1     0.135695     3B2     0.164537  
       7A1     0.198715     8A1     0.245565     9A1     0.705419  
       4B1     0.766025     1A2     0.781528    10A1     0.782281  
       4B2     0.791464     5B1     0.946301     5B2     0.973314  
      11A1     1.420752    12A1     1.767937    13A1     3.116724  
       2A2     3.116782     6B1     3.389012     6B2     3.409850  
      14A1     3.748150  

    Final Occupation by Irrep:
             A1    A2    B1    B2 
    DOCC [     4,    0,    1,    1 ]
    SOCC [     1,    0,    0,    1 ]
    NA   [     5,    0,    1,    2 ]
    NB   [     4,    0,    1,    1 ]

  @DF-UKS Final Energy:  -137.27747765569120

   => Energetics <=

    Nuclear Repulsion Energy =             23.3883372124375164
    One-Electron Energy =                -229.5558621026163166
    Two-Electron Energy =                  81.3407479941272840
    DFT Exchange-Correlation Energy =     -12.4507007596396608
    Empirical Dispersion Energy =           0.0000000000000000
    VV10 Nonlocal Energy =                  0.0000000000000000
    Total Energy =                       -137.2774776556912002

  UHF NO Occupations:
  HONO-2 :    1 B1 1.9976415
  HONO-1 :    2 B2 1.0000000
  HONO-0 :    5 A1 1.0000000
  LUNO+0 :    2 B1 0.0023585
  LUNO+1 :    3 B2 0.0003967
  LUNO+2 :    6 A1 0.0001897
  LUNO+3 :    7 A1 0.0000140


Computation Completed


Properties will be evaluated at   0.000000,   0.000000,   0.000000 [a0]

Properties computed using the SCF density matrix


 Multipole Moments:

 ------------------------------------------------------------------------------------
     Multipole            Electronic (a.u.)      Nuclear  (a.u.)        Total (a.u.)
 ------------------------------------------------------------------------------------

 L = 1.  Multiply by 2.5417464519 to convert [e a0] to [Debye]
 Dipole X            :          0.0000000            0.0000000            0.0000000
 Dipole Y            :          0.0000000            0.0000000            0.0000000
 Dipole Z            :          0.6298288            0.4461822            1.0760110
 Magnitude           :                                                    1.0760110

 ------------------------------------------------------------------------------------

*** tstop() called on Joses-MacBook-Pro-2.local at Thu Jul 17 13:41:32 2025
Module time:
	user time   =       1.57 seconds =       0.03 minutes
	system time =       3.49 seconds =       0.06 minutes
	total time  =          0 seconds =       0.00 minutes
Total time:
	user time   =      13.37 seconds =       0.22 minutes
	system time =      18.66 seconds =       0.31 minutes
	total time  =          3 seconds =       0.05 minutes

*** tstart() called on Joses-MacBook-Pro-2.local
*** at Thu Jul 17 13:41:32 2025


         ------------------------------------------------------------
                                   SCF GRAD                          
                          Rob Parrish, Justin Turney,                
                       Andy Simmonett, and Alex Sokolov              
         ------------------------------------------------------------

  ==> Geometry <==

    Molecular point group: c2v
    Full point group: C_inf_v

    Geometry (in Angstrom), charge = 1, multiplicity = 3:

       Center              X                  Y                   Z               Mass       
    ------------   -----------------  -----------------  -----------------  -----------------
         C            0.000000000000     0.000000000000     0.748812909329    12.000000000000
         F            0.000000000000     0.000000000000    -0.472974219727    18.998403162730

  Nuclear repulsion =   23.388337212437516

  ==> Basis Set <==

  Basis Set: CC-PVDZ
    Blend: CC-PVDZ
    Number of shells: 12
    Number of basis functions: 28
    Number of Cartesian functions: 30
    Spherical Harmonics?: true
    Max angular momentum: 2

  ==> DFJKGrad: Density-Fitted SCF Gradients <==

    Gradient:                    1
    J tasked:                  Yes
    K tasked:                  Yes
    wK tasked:                  No
    OpenMP threads:              1
    Integrals threads:           1
    Memory [MiB]:              375
    Schwarz Cutoff:          1E-12
    Fitting Condition:       1E-10

   => Auxiliary Basis Set <=

  Basis Set: (CC-PVDZ AUX)
    Blend: CC-PVDZ-JKFIT
    Number of shells: 48
    Number of basis functions: 140
    Number of Cartesian functions: 162
    Spherical Harmonics?: true
    Max angular momentum: 3

  ==> DFT Potential <==

   => LibXC <=

    Version 6.2.2
    S. Lehtola, C. Steigemann, M. J.T. Oliveira, and M. A.L. Marques.,  SoftwareX 7, 1–5 (2018) (10.1016/j.softx.2017.11.002)

   => Composite Functional: B3LYP <= 

    B3LYP Hyb-GGA Exchange-Correlation Functional

    P. J. Stephens, F. J. Devlin, C. F. Chabalowski, and M. J. Frisch.,  J. Phys. Chem. 98, 11623 (1994) (10.1021/j100096a001)

    Deriv               =              1
    GGA                 =           TRUE
    Meta                =          FALSE

    Exchange Hybrid     =           TRUE
    MP2 Hybrid          =          FALSE

   => Exchange Functionals <=

    0.0800   Slater exchange
    0.7200         Becke 88

   => Exact (HF) Exchange <=

    0.2000               HF 

   => Correlation Functionals <=

    0.1900   Vosko, Wilk & Nusair (VWN5_RPA)
    0.8100   Lee, Yang & Parr

   => LibXC Density Thresholds  <==

    XC_HYB_GGA_XC_B3LYP:  1.00E-15 

   => Molecular Quadrature <=

    Radial Scheme          =       TREUTLER
    Pruning Scheme         =           NONE
    Nuclear Scheme         =       TREUTLER

    Blocking Scheme        =         OCTREE
    BS radius alpha        =              1
    Pruning alpha          =              1
    Radial Points          =             75
    Spherical Points       =            302
    Total Points           =          43223
    Total Blocks           =            389
    Max Points             =            256
    Max Functions          =             28
    Weights Tolerance      =       1.00E-15


  -Total Gradient:
     Atom            X                  Y                   Z
    ------   -----------------  -----------------  -----------------
       1       -0.000000000000    -0.000000000000    -0.000042315141
       2        0.000000000000    -0.000000000000     0.000054228710


*** tstop() called on Joses-MacBook-Pro-2.local at Thu Jul 17 13:41:33 2025
Module time:
	user time   =       0.39 seconds =       0.01 minutes
	system time =       1.42 seconds =       0.02 minutes
	total time  =          1 seconds =       0.02 minutes
Total time:
	user time   =      13.76 seconds =       0.23 minutes
	system time =      20.08 seconds =       0.33 minutes
	total time  =          4 seconds =       0.07 minutes

    			-----------------------------------------

    			 OPTKING 3.0: for geometry optimizations 

    			     By R.A. King, Bethel University     

    			        with contributions from          

    			    A.V. Copan, J. Cayton, A. Heide      

    			-----------------------------------------

    
	                            ===> Fragment 1 <== 

	 Z (Atomic Numbers)          Masses                          Geom                  
	       6.000000            12.000000          0.00000000  0.00000000  1.41505132   
	       9.000000            18.998403          0.00000000  0.00000000 -0.89379174   

	 - Coordinate -           - BOHR/RAD -       - ANG/DEG -
	 R(1,2)           =         2.308843           1.221787


	        --- Internal Coordinate Step in ANG or DEG, aJ/ANG or AJ/DEG ---
	-------------------------------------------------------------------------------
	           Coordinate      Previous         Force          Change          New 
	           ----------      --------        ------          ------        ------
	               R(1,2)       1.22179        0.00040        0.00003       1.22182
	-------------------------------------------------------------------------------

	                                 ==> Convergence Check <==                                  
    
	Measures of convergence in internal coordinates in au.
    
	Criteria marked as inactive (o), active & met (*), and active & unmet ( ).

	----------------------------------------------------------------------------------------------
	   Step    Total Energy     Delta E     Max Force     RMS Force      Max Disp      RMS Disp   
	----------------------------------------------------------------------------------------------
	  Convergence Criteria     1.00e-06 *    3.00e-04 *             o    1.20e-03 *             o
	----------------------------------------------------------------------------------------------
	     4    -137.27747766   -2.83e-07 *    4.83e-05 *    4.83e-05 o    6.32e-05 *    6.32e-05 o  ~
	----------------------------------------------------------------------------------------------

Next Geometry in Ang 
	Fragment 1 (Ang)

	    C   0.0000000000   0.0000000000   0.7488296221
	    F   0.0000000000   0.0000000000  -0.4729909325


    Final optimized geometry and variables:
    Molecular point group: c2v
    Full point group: C_inf_v

    Geometry (in Angstrom), charge = 1, multiplicity = 3:

    C            0.000000000000     0.000000000000     0.748812909329
    F            0.000000000000     0.000000000000    -0.472974219727


    Psi4 stopped on: Thursday, 17 July 2025 01:41PM
    Psi4 wall time for execution: 0:00:03.82

*** Psi4 exiting successfully. Buy a developer a beer!
