
    -----------------------------------------------------------------------
          Psi4: An Open-Source Ab Initio Electronic Structure Package
                               Psi4 1.9.1 release

                         Git: Rev {} zzzzzzz 


    D. G. A. Smith, L. A. Burns, A. C. Simmonett, R. M. Parrish,
    M. C. Schieber, R. Galvelis, P. Kraus, H. Kruse, R. Di Remigio,
    A. Alenaizan, A. M. James, S. Lehtola, J. P. Misiewicz, M. Scheurer,
    R. A. Shaw, J. B. Schriber, Y. Xie, Z. L. Glick, D. A. Sirianni,
    J. S. O'Brien, J. M. Waldrop, A. Kumar, E. G. Hohenstein,
    B. P. Pritchard, B. R. Brooks, H. F. Schaefer III, A. Yu. Sokolov,
    K. Patkowski, A. E. DePrince III, U. Bozkaya, R. A. King,
    F. A. Evangelista, J. M. Turney, T. D. Crawford, C. D. Sherrill,
    J. Chem. Phys. 152(18) 184108 (2020). https://doi.org/10.1063/5.0006002

                            Additional Code Authors
    E. T. Seidl, C. L. Janssen, E. F. Valeev, M. L. Leininger,
    J. F. Gonthier, R. M. Richard, H. R. McAlexander, M. Saitow, X. Wang,
    P. Verma, M. H. Lechner, A. Jiang, S. Behnle, A. G. Heide,
    M. F. Herbst, and D. L. Poole

             Previous Authors, Complete List of Code Contributors,
                       and Citations for Specific Modules
    https://github.com/psi4/psi4/blob/master/codemeta.json
    https://github.com/psi4/psi4/graphs/contributors
    http://psicode.org/psi4manual/master/introduction.html#citing-psifour

    -----------------------------------------------------------------------


    Psi4 started on: Thursday, 17 July 2025 01:40PM

    Process ID: 74321
    Host:       Joses-MacBook-Pro-2.local
    PSIDATADIR: /Users/joseantoniorodriguesromero/anaconda3/share/psi4
    Memory:     500.0 MiB
    Threads:    1
    
  ==> Input File <==

--------------------------------------------------------------------------
molecule { 
1 3
C   0.00000        0.60000        0.00000
N   0.00000       -0.60000        0.00000
}

set { 
basis              cc-pvdz
reference          uks
maxiter            500
geom_maxiter       500
DAMPING_PERCENTAGE 1
guess              SAP
}

optimize('b3lyp')
--------------------------------------------------------------------------

Scratch directory: /tmp/
gradient() will perform analytic gradient computation.
   => Libint2 <=

    Primary   basis highest AM E, G, H:  6, 6, 3
    Auxiliary basis highest AM E, G, H:  7, 7, 4
    Onebody   basis highest AM E, G, H:  -, -, -
    Solid Harmonics ordering:            Gaussian

*** tstart() called on Joses-MacBook-Pro-2.local
*** at Thu Jul 17 13:40:45 2025

   => Loading Basis Set <=

    Name: CC-PVDZ
    Role: ORBITAL
    Keyword: BASIS
    atoms 1 entry C          line   138 file /Users/joseantoniorodriguesromero/anaconda3/share/psi4/basis/cc-pvdz.gbs 
    atoms 2 entry N          line   168 file /Users/joseantoniorodriguesromero/anaconda3/share/psi4/basis/cc-pvdz.gbs 


         ---------------------------------------------------------
                                   SCF
               by Justin Turney, Rob Parrish, Andy Simmonett
                          and Daniel G. A. Smith
                              UKS Reference
                        1 Threads,    500 MiB Core
         ---------------------------------------------------------

  ==> Geometry <==

    Molecular point group: c2v
    Full point group: C_inf_v

    Geometry (in Angstrom), charge = 1, multiplicity = 3:

       Center              X                  Y                   Z               Mass       
    ------------   -----------------  -----------------  -----------------  -----------------
         C            0.000000000000     0.000000000000     0.646219320164    12.000000000000
         N            0.000000000000     0.000000000000    -0.553780679836    14.003074004430

  Running in c2v symmetry.

  Rotational constants: A = ************  B =      1.81157  C =      1.81157 [cm^-1]
  Rotational constants: A = ************  B =  54309.37053  C =  54309.37053 [MHz]
  Nuclear repulsion =   18.521202373450002

  Charge       = 1
  Multiplicity = 3
  Electrons    = 12
  Nalpha       = 7
  Nbeta        = 5

  ==> Algorithm <==

  SCF Algorithm Type is DF.
  DIIS enabled.
  MOM disabled.
  Fractional occupation disabled.
  Guess Type is SAP.
  Energy threshold   = 1.00e-08
  Density threshold  = 1.00e-08
  Integral threshold = 1.00e-12

  ==> Primary Basis <==

  Basis Set: CC-PVDZ
    Blend: CC-PVDZ
    Number of shells: 12
    Number of basis functions: 28
    Number of Cartesian functions: 30
    Spherical Harmonics?: true
    Max angular momentum: 2

  ==> DFT Potential <==

   => LibXC <=

    Version 6.2.2
    S. Lehtola, C. Steigemann, M. J.T. Oliveira, and M. A.L. Marques.,  SoftwareX 7, 1–5 (2018) (10.1016/j.softx.2017.11.002)

   => Composite Functional: B3LYP <= 

    B3LYP Hyb-GGA Exchange-Correlation Functional

    P. J. Stephens, F. J. Devlin, C. F. Chabalowski, and M. J. Frisch.,  J. Phys. Chem. 98, 11623 (1994) (10.1021/j100096a001)

    Deriv               =              1
    GGA                 =           TRUE
    Meta                =          FALSE

    Exchange Hybrid     =           TRUE
    MP2 Hybrid          =          FALSE

   => Exchange Functionals <=

    0.0800   Slater exchange
    0.7200         Becke 88

   => Exact (HF) Exchange <=

    0.2000               HF 

   => Correlation Functionals <=

    0.1900   Vosko, Wilk & Nusair (VWN5_RPA)
    0.8100   Lee, Yang & Parr

   => LibXC Density Thresholds  <==

    XC_HYB_GGA_XC_B3LYP:  1.00E-15 

   => Molecular Quadrature <=

    Radial Scheme          =       TREUTLER
    Pruning Scheme         =           NONE
    Nuclear Scheme         =       TREUTLER

    Blocking Scheme        =         OCTREE
    BS radius alpha        =              1
    Pruning alpha          =              1
    Radial Points          =             75
    Spherical Points       =            302
    Total Points           =          42672
    Total Blocks           =            384
    Max Points             =            256
    Max Functions          =             28
    Weights Tolerance      =       1.00E-15

   => Loading Basis Set <=

    Name: (CC-PVDZ AUX)
    Role: JKFIT
    Keyword: DF_BASIS_SCF
    atoms 1 entry C          line   121 file /Users/joseantoniorodriguesromero/anaconda3/share/psi4/basis/cc-pvdz-jkfit.gbs 
    atoms 2 entry N          line   171 file /Users/joseantoniorodriguesromero/anaconda3/share/psi4/basis/cc-pvdz-jkfit.gbs 

  ==> Integral Setup <==

  DFHelper Memory: AOs need 0.001 GiB; user supplied 0.332 GiB. 
  Using in-core AOs.

  ==> MemDFJK: Density-Fitted J/K Matrices <==

    J tasked:                   Yes
    K tasked:                   Yes
    wK tasked:                   No
    OpenMP threads:               1
    Memory [MiB]:               339
    Algorithm:                 Core
    Schwarz Cutoff:           1E-12
    Mask sparsity (%):       0.0000
    Fitting Condition:        1E-10

   => Auxiliary Basis Set <=

  Basis Set: (CC-PVDZ AUX)
    Blend: CC-PVDZ-JKFIT
    Number of shells: 48
    Number of basis functions: 140
    Number of Cartesian functions: 162
    Spherical Harmonics?: true
    Max angular momentum: 3

  Cached 100.0% of DFT collocation blocks in 0.034 [GiB].

  Minimum eigenvalue in the overlap matrix is 1.1329986613E-02.
  Reciprocal condition number of the overlap matrix is 3.6584227228E-03.
    Using symmetric orthogonalization.

  ==> Pre-Iterations <==

  SCF Guess: Superposition of Atomic Potentials (doi:10.1021/acs.jctc.8b01089).

  ==> SAP guess <==

   => Molecular Quadrature <=

    Radial Scheme          =       TREUTLER
    Pruning Scheme         =           NONE
    Nuclear Scheme         =       TREUTLER

    Blocking Scheme        =         OCTREE
    BS radius alpha        =              1
    Pruning alpha          =              1
    Radial Points          =             75
    Spherical Points       =            302
    Total Points           =          42672
    Total Blocks           =            384
    Max Points             =            256
    Max Functions          =             28
    Weights Tolerance      =       1.00E-15

   -------------------------------------------------------
    Irrep   Nso     Nmo     Nalpha   Nbeta   Ndocc  Nsocc
   -------------------------------------------------------
     A1        14      14       5       4       4       1
     A2         2       2       0       0       0       0
     B1         6       6       1       1       1       0
     B2         6       6       1       0       0       1
   -------------------------------------------------------
    Total      28      28       7       5       5       2
   -------------------------------------------------------

  ==> Iterations <==

                           Total Energy        Delta E     RMS |[F,P]|

   @DF-UKS iter   1:   -92.12036900003982   -9.21204e+01   2.47336e-02 DIIS/ADIIS
   @DF-UKS iter   2:   -91.56596568463733    5.54403e-01   6.63962e-02 DIIS/ADIIS/DAMP=1%
   @DF-UKS iter   3:   -92.18519934268352   -6.19234e-01   9.59001e-03 DIIS/ADIIS/DAMP=1%
   @DF-UKS iter   4:   -92.20297978456793   -1.77804e-02   5.85567e-04 DIIS/ADIIS/DAMP=1%
   @DF-UKS iter   5:   -92.20593483795309   -2.95505e-03   2.58075e-04 DIIS/ADIIS/DAMP=1%
   @DF-UKS iter   6:   -92.20563979101725    2.95047e-04   5.37610e-05 DIIS/DAMP=1%
   @DF-UKS iter   7:   -92.20569958939120   -5.97984e-05   2.57070e-05 DIIS/DAMP=1%
   @DF-UKS iter   8:   -92.20570419588508   -4.60649e-06   7.90076e-06 DIIS/DAMP=1%
   @DF-UKS iter   9:   -92.20569870356775    5.49232e-06   3.04193e-06 DIIS/DAMP=1%
   @DF-UKS iter  10:   -92.20570040120795   -1.69764e-06   1.53542e-06 DIIS/DAMP=1%
   @DF-UKS iter  11:   -92.20570056855749   -1.67350e-07   3.11562e-07 DIIS/DAMP=1%
   @DF-UKS iter  12:   -92.20570049347134    7.50861e-08   3.54355e-08 DIIS/DAMP=1%
   @DF-UKS iter  13:   -92.20570047156221    2.19091e-08   3.03405e-09 DIIS/DAMP=1%
   @DF-UKS iter  14:   -92.20570046774868    3.81353e-09   6.35984e-10 DIIS/DAMP=1%
  Energy and wave function converged.


  ==> Post-Iterations <==

   Electrons on quadrature grid:
      Nalpha   =    6.9999999222 ; deviation = -7.776e-08
      Nbeta    =    4.9999999515 ; deviation = -4.846e-08
      Ntotal   =   11.9999998738 ; deviation = -1.262e-07 

   @Spin Contamination Metric:   4.490852133E-03
   @S^2 Expected:                2.000000000E+00
   @S^2 Observed:                2.004490852E+00
   @S   Expected:                1.000000000E+00
   @S   Observed:                1.000000000E+00

    Orbital Energies [Eh]
    ---------------------

    Alpha Occupied:                                                       

       1A1   -14.863634     2A1   -10.778148     3A1    -1.410157  
       4A1    -0.901091     1B2    -0.833254     5A1    -0.798117  
       1B1    -0.790281  

    Alpha Virtual:                                                        

       2B2    -0.440752     2B1    -0.407181     6A1    -0.052431  
       3B2     0.108337     3B1     0.122737     7A1     0.164232  
       8A1     0.258542     9A1     0.348975     4B2     0.402751  
       4B1     0.428437     1A2     0.675463    10A1     0.675586  
       5B2     0.781935     5B1     0.811301    11A1     0.954823  
       2A2     1.410455    12A1     1.410757    13A1     1.457951  
       6B2     1.887534     6B1     1.919477    14A1     2.267320  

    Beta Occupied:                                                        

       1A1   -14.847042     2A1   -10.753893     3A1    -1.342927  
       4A1    -0.810434     1B1    -0.766649  

    Beta Virtual:                                                         

       1B2    -0.652695     5A1    -0.610096     2B1    -0.369749  
       2B2    -0.336102     6A1    -0.024872     3B1     0.137353  
       3B2     0.146139     7A1     0.234662     8A1     0.297608  
       9A1     0.390671     4B1     0.435523     4B2     0.450753  
       1A2     0.728491    10A1     0.732312     5B1     0.864509  
       5B2     0.875659    11A1     0.985642     2A2     1.456388  
      12A1     1.461250    13A1     1.530759     6B1     1.950514  
       6B2     1.958927    14A1     2.308290  

    Final Occupation by Irrep:
             A1    A2    B1    B2 
    DOCC [     4,    0,    1,    0 ]
    SOCC [     1,    0,    0,    1 ]
    NA   [     5,    0,    1,    1 ]
    NB   [     4,    0,    1,    0 ]

  @DF-UKS Final Energy:   -92.20570046774868

   => Energetics <=

    Nuclear Repulsion Energy =             18.5212023734500022
    One-Electron Energy =                -155.6887913291746486
    Two-Electron Energy =                  54.4965176702000136
    DFT Exchange-Correlation Energy =      -9.5346291822240534
    Empirical Dispersion Energy =           0.0000000000000000
    VV10 Nonlocal Energy =                  0.0000000000000000
    Total Energy =                        -92.2057004677486987

  UHF NO Occupations:
  HONO-2 :    1 B1 1.9986608
  HONO-1 :    5 A1 1.0000000
  HONO-0 :    1 B2 1.0000000
  LUNO+0 :    2 B1 0.0013392
  LUNO+1 :    6 A1 0.0006828
  LUNO+2 :    7 A1 0.0002244
  LUNO+3 :    8 A1 0.0000001


Computation Completed


Properties will be evaluated at   0.000000,   0.000000,   0.000000 [a0]

Properties computed using the SCF density matrix


 Multipole Moments:

 ------------------------------------------------------------------------------------
     Multipole            Electronic (a.u.)      Nuclear  (a.u.)        Total (a.u.)
 ------------------------------------------------------------------------------------

 L = 1.  Multiply by 2.5417464519 to convert [e a0] to [Debye]
 Dipole X            :          0.0000000            0.0000000            0.0000000
 Dipole Y            :          0.0000000            0.0000000            0.0000000
 Dipole Z            :          0.7248986            0.0016085            0.7265071
 Magnitude           :                                                    0.7265071

 ------------------------------------------------------------------------------------

*** tstop() called on Joses-MacBook-Pro-2.local at Thu Jul 17 13:40:46 2025
Module time:
	user time   =       4.22 seconds =       0.07 minutes
	system time =       5.09 seconds =       0.08 minutes
	total time  =          1 seconds =       0.02 minutes
Total time:
	user time   =       4.22 seconds =       0.07 minutes
	system time =       5.09 seconds =       0.08 minutes
	total time  =          1 seconds =       0.02 minutes

*** tstart() called on Joses-MacBook-Pro-2.local
*** at Thu Jul 17 13:40:46 2025


         ------------------------------------------------------------
                                   SCF GRAD                          
                          Rob Parrish, Justin Turney,                
                       Andy Simmonett, and Alex Sokolov              
         ------------------------------------------------------------

  ==> Geometry <==

    Molecular point group: c2v
    Full point group: C_inf_v

    Geometry (in Angstrom), charge = 1, multiplicity = 3:

       Center              X                  Y                   Z               Mass       
    ------------   -----------------  -----------------  -----------------  -----------------
         C            0.000000000000     0.000000000000     0.646219320164    12.000000000000
         N            0.000000000000     0.000000000000    -0.553780679836    14.003074004430

  Nuclear repulsion =   18.521202373450002

  ==> Basis Set <==

  Basis Set: CC-PVDZ
    Blend: CC-PVDZ
    Number of shells: 12
    Number of basis functions: 28
    Number of Cartesian functions: 30
    Spherical Harmonics?: true
    Max angular momentum: 2

  ==> DFJKGrad: Density-Fitted SCF Gradients <==

    Gradient:                    1
    J tasked:                  Yes
    K tasked:                  Yes
    wK tasked:                  No
    OpenMP threads:              1
    Integrals threads:           1
    Memory [MiB]:              375
    Schwarz Cutoff:          1E-12
    Fitting Condition:       1E-10

   => Auxiliary Basis Set <=

  Basis Set: (CC-PVDZ AUX)
    Blend: CC-PVDZ-JKFIT
    Number of shells: 48
    Number of basis functions: 140
    Number of Cartesian functions: 162
    Spherical Harmonics?: true
    Max angular momentum: 3

  ==> DFT Potential <==

   => LibXC <=

    Version 6.2.2
    S. Lehtola, C. Steigemann, M. J.T. Oliveira, and M. A.L. Marques.,  SoftwareX 7, 1–5 (2018) (10.1016/j.softx.2017.11.002)

   => Composite Functional: B3LYP <= 

    B3LYP Hyb-GGA Exchange-Correlation Functional

    P. J. Stephens, F. J. Devlin, C. F. Chabalowski, and M. J. Frisch.,  J. Phys. Chem. 98, 11623 (1994) (10.1021/j100096a001)

    Deriv               =              1
    GGA                 =           TRUE
    Meta                =          FALSE

    Exchange Hybrid     =           TRUE
    MP2 Hybrid          =          FALSE

   => Exchange Functionals <=

    0.0800   Slater exchange
    0.7200         Becke 88

   => Exact (HF) Exchange <=

    0.2000               HF 

   => Correlation Functionals <=

    0.1900   Vosko, Wilk & Nusair (VWN5_RPA)
    0.8100   Lee, Yang & Parr

   => LibXC Density Thresholds  <==

    XC_HYB_GGA_XC_B3LYP:  1.00E-15 

   => Molecular Quadrature <=

    Radial Scheme          =       TREUTLER
    Pruning Scheme         =           NONE
    Nuclear Scheme         =       TREUTLER

    Blocking Scheme        =         OCTREE
    BS radius alpha        =              1
    Pruning alpha          =              1
    Radial Points          =             75
    Spherical Points       =            302
    Total Points           =          42672
    Total Blocks           =            384
    Max Points             =            256
    Max Functions          =             28
    Weights Tolerance      =       1.00E-15


  -Total Gradient:
     Atom            X                  Y                   Z
    ------   -----------------  -----------------  -----------------
       1        0.000000000000     0.000000000000    -0.073707459120
       2        0.000000000000     0.000000000000     0.073710034626


*** tstop() called on Joses-MacBook-Pro-2.local at Thu Jul 17 13:40:46 2025
Module time:
	user time   =       0.55 seconds =       0.01 minutes
	system time =       1.11 seconds =       0.02 minutes
	total time  =          0 seconds =       0.00 minutes
Total time:
	user time   =       4.77 seconds =       0.08 minutes
	system time =       6.20 seconds =       0.10 minutes
	total time  =          1 seconds =       0.02 minutes

    			-----------------------------------------

    			 OPTKING 3.0: for geometry optimizations 

    			     By R.A. King, Bethel University     

    			        with contributions from          

    			    A.V. Copan, J. Cayton, A. Heide      

    			-----------------------------------------

    
	                            ===> Fragment 1 <== 

	 Z (Atomic Numbers)          Masses                          Geom                  
	       6.000000            12.000000          0.00000000  0.00000000  1.22117753   
	       7.000000            14.003074          0.00000000  0.00000000 -1.04649382   

	 - Coordinate -           - BOHR/RAD -       - ANG/DEG -
	 R(1,2)           =         2.267671           1.200000


	        --- Internal Coordinate Step in ANG or DEG, aJ/ANG or AJ/DEG ---
	-------------------------------------------------------------------------------
	           Coordinate      Previous         Force          Change          New 
	           ----------      --------        ------          ------        ------
	               R(1,2)       1.20000        0.60727        0.03703       1.23703
	-------------------------------------------------------------------------------

	                                 ==> Convergence Check <==                                  
    
	Measures of convergence in internal coordinates in au.
    
	Criteria marked as inactive (o), active & met (*), and active & unmet ( ).

	----------------------------------------------------------------------------------------------
	   Step    Total Energy     Delta E     Max Force     RMS Force      Max Disp      RMS Disp   
	----------------------------------------------------------------------------------------------
	  Convergence Criteria     1.00e-06 *    3.00e-04 *             o    1.20e-03 *             o
	----------------------------------------------------------------------------------------------
	     1     -92.20570047   -9.22e+01      7.37e-02      7.37e-02 o    7.00e-02      7.00e-02 o  ~
	----------------------------------------------------------------------------------------------

Next Geometry in Ang 
	Fragment 1 (Ang)

	    C   0.0000000000   0.0000000000   0.6647333806
	    N   0.0000000000   0.0000000000  -0.5722947402


    Structure for next step:
    Molecular point group: c2v
    Full point group: C_inf_v

    Geometry (in Angstrom), charge = 1, multiplicity = 3:

    C            0.000000000000     0.000000000000     0.666159559374
    N            0.000000000000     0.000000000000    -0.570868561428


Scratch directory: /tmp/
gradient() will perform analytic gradient computation.
   => Libint2 <=

    Primary   basis highest AM E, G, H:  6, 6, 3
    Auxiliary basis highest AM E, G, H:  7, 7, 4
    Onebody   basis highest AM E, G, H:  -, -, -
    Solid Harmonics ordering:            Gaussian

*** tstart() called on Joses-MacBook-Pro-2.local
*** at Thu Jul 17 13:40:46 2025

   => Loading Basis Set <=

    Name: CC-PVDZ
    Role: ORBITAL
    Keyword: BASIS
    atoms 1 entry C          line   138 file /Users/joseantoniorodriguesromero/anaconda3/share/psi4/basis/cc-pvdz.gbs 
    atoms 2 entry N          line   168 file /Users/joseantoniorodriguesromero/anaconda3/share/psi4/basis/cc-pvdz.gbs 


         ---------------------------------------------------------
                                   SCF
               by Justin Turney, Rob Parrish, Andy Simmonett
                          and Daniel G. A. Smith
                              UKS Reference
                        1 Threads,    500 MiB Core
         ---------------------------------------------------------

  ==> Geometry <==

    Molecular point group: c2v
    Full point group: C_inf_v

    Geometry (in Angstrom), charge = 1, multiplicity = 3:

       Center              X                  Y                   Z               Mass       
    ------------   -----------------  -----------------  -----------------  -----------------
         C            0.000000000000     0.000000000000     0.666159559374    12.000000000000
         N            0.000000000000     0.000000000000    -0.570868561428    14.003074004430

  Running in c2v symmetry.

  Rotational constants: A = ************  B =      1.70474  C =      1.70474 [cm^-1]
  Rotational constants: A = ************  B =  51106.73265  C =  51106.73265 [MHz]
  Nuclear repulsion =   17.966804856246430

  Charge       = 1
  Multiplicity = 3
  Electrons    = 12
  Nalpha       = 7
  Nbeta        = 5

  ==> Algorithm <==

  SCF Algorithm Type is DF.
  DIIS enabled.
  MOM disabled.
  Fractional occupation disabled.
  Guess Type is READ.
  Energy threshold   = 1.00e-08
  Density threshold  = 1.00e-08
  Integral threshold = 1.00e-12

  ==> Primary Basis <==

  Basis Set: CC-PVDZ
    Blend: CC-PVDZ
    Number of shells: 12
    Number of basis functions: 28
    Number of Cartesian functions: 30
    Spherical Harmonics?: true
    Max angular momentum: 2

  ==> DFT Potential <==

   => LibXC <=

    Version 6.2.2
    S. Lehtola, C. Steigemann, M. J.T. Oliveira, and M. A.L. Marques.,  SoftwareX 7, 1–5 (2018) (10.1016/j.softx.2017.11.002)

   => Composite Functional: B3LYP <= 

    B3LYP Hyb-GGA Exchange-Correlation Functional

    P. J. Stephens, F. J. Devlin, C. F. Chabalowski, and M. J. Frisch.,  J. Phys. Chem. 98, 11623 (1994) (10.1021/j100096a001)

    Deriv               =              1
    GGA                 =           TRUE
    Meta                =          FALSE

    Exchange Hybrid     =           TRUE
    MP2 Hybrid          =          FALSE

   => Exchange Functionals <=

    0.0800   Slater exchange
    0.7200         Becke 88

   => Exact (HF) Exchange <=

    0.2000               HF 

   => Correlation Functionals <=

    0.1900   Vosko, Wilk & Nusair (VWN5_RPA)
    0.8100   Lee, Yang & Parr

   => LibXC Density Thresholds  <==

    XC_HYB_GGA_XC_B3LYP:  1.00E-15 

   => Molecular Quadrature <=

    Radial Scheme          =       TREUTLER
    Pruning Scheme         =           NONE
    Nuclear Scheme         =       TREUTLER

    Blocking Scheme        =         OCTREE
    BS radius alpha        =              1
    Pruning alpha          =              1
    Radial Points          =             75
    Spherical Points       =            302
    Total Points           =          42674
    Total Blocks           =            383
    Max Points             =            256
    Max Functions          =             28
    Weights Tolerance      =       1.00E-15

   => Loading Basis Set <=

    Name: (CC-PVDZ AUX)
    Role: JKFIT
    Keyword: DF_BASIS_SCF
    atoms 1 entry C          line   121 file /Users/joseantoniorodriguesromero/anaconda3/share/psi4/basis/cc-pvdz-jkfit.gbs 
    atoms 2 entry N          line   171 file /Users/joseantoniorodriguesromero/anaconda3/share/psi4/basis/cc-pvdz-jkfit.gbs 

   => Loading Basis Set <=

    Name: CC-PVDZ
    Role: ORBITAL
    Keyword: BASIS
    atoms 1 entry C          line   138 file /Users/joseantoniorodriguesromero/anaconda3/share/psi4/basis/cc-pvdz.gbs 
    atoms 2 entry N          line   168 file /Users/joseantoniorodriguesromero/anaconda3/share/psi4/basis/cc-pvdz.gbs 

  Reading orbitals from file /tmp/triplet_CN.default.74321.180.npy, no projection.

  ==> Integral Setup <==

  DFHelper Memory: AOs need 0.001 GiB; user supplied 0.332 GiB. 
  Using in-core AOs.

  ==> MemDFJK: Density-Fitted J/K Matrices <==

    J tasked:                   Yes
    K tasked:                   Yes
    wK tasked:                   No
    OpenMP threads:               1
    Memory [MiB]:               339
    Algorithm:                 Core
    Schwarz Cutoff:           1E-12
    Mask sparsity (%):       0.0000
    Fitting Condition:        1E-10

   => Auxiliary Basis Set <=

  Basis Set: (CC-PVDZ AUX)
    Blend: CC-PVDZ-JKFIT
    Number of shells: 48
    Number of basis functions: 140
    Number of Cartesian functions: 162
    Spherical Harmonics?: true
    Max angular momentum: 3

  Cached 100.0% of DFT collocation blocks in 0.034 [GiB].

  Minimum eigenvalue in the overlap matrix is 1.2169895421E-02.
  Reciprocal condition number of the overlap matrix is 3.9582342538E-03.
    Using symmetric orthogonalization.

  ==> Pre-Iterations <==

  SCF Guess: Orbitals guess was supplied from a previous computation.

   -------------------------------------------------------
    Irrep   Nso     Nmo     Nalpha   Nbeta   Ndocc  Nsocc
   -------------------------------------------------------
     A1        14      14       5       4       4       1
     A2         2       2       0       0       0       0
     B1         6       6       1       1       1       0
     B2         6       6       1       0       0       1
   -------------------------------------------------------
    Total      28      28       7       5       5       2
   -------------------------------------------------------

  ==> Iterations <==

                           Total Energy        Delta E     RMS |[F,P]|

   @DF-UKS iter   0:   -92.15359116416387   -9.21536e+01   7.27074e-03 
   @DF-UKS iter   1:   -92.20824171327328   -5.46505e-02   1.15475e-03 DIIS/ADIIS
   @DF-UKS iter   2:   -92.20826423904312   -2.25258e-05   1.28222e-03 DIIS/ADIIS/DAMP=1%
   @DF-UKS iter   3:   -92.20794586814283    3.18371e-04   9.88537e-04 DIIS/ADIIS/DAMP=1%
   @DF-UKS iter   4:   -92.20857139095038   -6.25523e-04   1.27589e-04 DIIS/ADIIS/DAMP=1%
   @DF-UKS iter   5:   -92.20848208087662    8.93101e-05   3.36334e-05 DIIS/DAMP=1%
   @DF-UKS iter   6:   -92.20849595164668   -1.38708e-05   1.60395e-05 DIIS/DAMP=1%
   @DF-UKS iter   7:   -92.20849154455333    4.40709e-06   5.15809e-06 DIIS/DAMP=1%
   @DF-UKS iter   8:   -92.20849063233975    9.12214e-07   2.58452e-06 DIIS/DAMP=1%
   @DF-UKS iter   9:   -92.20849137607661   -7.43737e-07   2.87793e-07 DIIS/DAMP=1%
   @DF-UKS iter  10:   -92.20849096566320    4.10413e-07   2.71805e-08 DIIS/DAMP=1%
   @DF-UKS iter  11:   -92.20849099440474   -2.87415e-08   3.12374e-09 DIIS/DAMP=1%
   @DF-UKS iter  12:   -92.20849099521759   -8.12847e-10   5.86233e-10 DIIS/DAMP=1%
  Energy and wave function converged.


  ==> Post-Iterations <==

   Electrons on quadrature grid:
      Nalpha   =    6.9999999612 ; deviation = -3.879e-08
      Nbeta    =    4.9999999917 ; deviation = -8.349e-09
      Ntotal   =   11.9999999529 ; deviation = -4.714e-08 

   @Spin Contamination Metric:   4.452747723E-03
   @S^2 Expected:                2.000000000E+00
   @S^2 Observed:                2.004452748E+00
   @S   Expected:                1.000000000E+00
   @S   Observed:                1.000000000E+00

    Orbital Energies [Eh]
    ---------------------

    Alpha Occupied:                                                       

       1A1   -14.868487     2A1   -10.781815     3A1    -1.391171  
       4A1    -0.906381     1B2    -0.821174     5A1    -0.796045  
       1B1    -0.778825  

    Alpha Virtual:                                                        

       2B2    -0.451974     2B1    -0.418773     6A1    -0.061233  
       3B2     0.113264     3B1     0.127276     7A1     0.161139  
       8A1     0.224972     9A1     0.347663     4B2     0.400411  
       4B1     0.426504     1A2     0.683239    10A1     0.683358  
       5B2     0.764102     5B1     0.792625    11A1     0.945279  
       2A2     1.400223    12A1     1.400397    13A1     1.408603  
       6B2     1.856062     6B1     1.888101    14A1     2.216390  

    Beta Occupied:                                                        

       1A1   -14.850986     2A1   -10.758582     3A1    -1.323801  
       4A1    -0.814188     1B1    -0.755663  

    Beta Virtual:                                                         

       1B2    -0.642780     5A1    -0.609923     2B1    -0.382270  
       2B2    -0.347881     6A1    -0.030276     3B1     0.141237  
       3B2     0.149744     7A1     0.234503     8A1     0.262768  
       9A1     0.384028     4B1     0.434044     4B2     0.449919  
       1A2     0.734071    10A1     0.737666     5B1     0.844613  
       5B2     0.855541    11A1     0.976300     2A2     1.446944  
      12A1     1.451659    13A1     1.481239     6B1     1.920319  
       6B2     1.929251    14A1     2.259802  

    Final Occupation by Irrep:
             A1    A2    B1    B2 
    DOCC [     4,    0,    1,    0 ]
    SOCC [     1,    0,    0,    1 ]
    NA   [     5,    0,    1,    1 ]
    NB   [     4,    0,    1,    0 ]

  @DF-UKS Final Energy:   -92.20849099521759

   => Energetics <=

    Nuclear Repulsion Energy =             17.9668048562464300
    One-Electron Energy =                -154.6525959006872881
    Two-Electron Energy =                  53.9849350678935664
    DFT Exchange-Correlation Energy =      -9.5076350186702800
    Empirical Dispersion Energy =           0.0000000000000000
    VV10 Nonlocal Energy =                  0.0000000000000000
    Total Energy =                        -92.2084909952175877

  UHF NO Occupations:
  HONO-2 :    1 B1 1.9988203
  HONO-1 :    1 B2 1.0000000
  HONO-0 :    5 A1 1.0000000
  LUNO+0 :    2 B1 0.0011797
  LUNO+1 :    6 A1 0.0008159
  LUNO+2 :    7 A1 0.0002317
  LUNO+3 :    8 A1 0.0000001


Computation Completed


Properties will be evaluated at   0.000000,   0.000000,   0.000000 [a0]

Properties computed using the SCF density matrix


 Multipole Moments:

 ------------------------------------------------------------------------------------
     Multipole            Electronic (a.u.)      Nuclear  (a.u.)        Total (a.u.)
 ------------------------------------------------------------------------------------

 L = 1.  Multiply by 2.5417464519 to convert [e a0] to [Debye]
 Dipole X            :          0.0000000            0.0000000            0.0000000
 Dipole Y            :          0.0000000            0.0000000            0.0000000
 Dipole Z            :          0.7057334            0.0016581            0.7073915
 Magnitude           :                                                    0.7073915

 ------------------------------------------------------------------------------------

*** tstop() called on Joses-MacBook-Pro-2.local at Thu Jul 17 13:40:47 2025
Module time:
	user time   =       4.21 seconds =       0.07 minutes
	system time =       4.28 seconds =       0.07 minutes
	total time  =          1 seconds =       0.02 minutes
Total time:
	user time   =       9.01 seconds =       0.15 minutes
	system time =      10.67 seconds =       0.18 minutes
	total time  =          2 seconds =       0.03 minutes

*** tstart() called on Joses-MacBook-Pro-2.local
*** at Thu Jul 17 13:40:47 2025


         ------------------------------------------------------------
                                   SCF GRAD                          
                          Rob Parrish, Justin Turney,                
                       Andy Simmonett, and Alex Sokolov              
         ------------------------------------------------------------

  ==> Geometry <==

    Molecular point group: c2v
    Full point group: C_inf_v

    Geometry (in Angstrom), charge = 1, multiplicity = 3:

       Center              X                  Y                   Z               Mass       
    ------------   -----------------  -----------------  -----------------  -----------------
         C            0.000000000000     0.000000000000     0.666159559374    12.000000000000
         N            0.000000000000     0.000000000000    -0.570868561428    14.003074004430

  Nuclear repulsion =   17.966804856246430

  ==> Basis Set <==

  Basis Set: CC-PVDZ
    Blend: CC-PVDZ
    Number of shells: 12
    Number of basis functions: 28
    Number of Cartesian functions: 30
    Spherical Harmonics?: true
    Max angular momentum: 2

  ==> DFJKGrad: Density-Fitted SCF Gradients <==

    Gradient:                    1
    J tasked:                  Yes
    K tasked:                  Yes
    wK tasked:                  No
    OpenMP threads:              1
    Integrals threads:           1
    Memory [MiB]:              375
    Schwarz Cutoff:          1E-12
    Fitting Condition:       1E-10

   => Auxiliary Basis Set <=

  Basis Set: (CC-PVDZ AUX)
    Blend: CC-PVDZ-JKFIT
    Number of shells: 48
    Number of basis functions: 140
    Number of Cartesian functions: 162
    Spherical Harmonics?: true
    Max angular momentum: 3

  ==> DFT Potential <==

   => LibXC <=

    Version 6.2.2
    S. Lehtola, C. Steigemann, M. J.T. Oliveira, and M. A.L. Marques.,  SoftwareX 7, 1–5 (2018) (10.1016/j.softx.2017.11.002)

   => Composite Functional: B3LYP <= 

    B3LYP Hyb-GGA Exchange-Correlation Functional

    P. J. Stephens, F. J. Devlin, C. F. Chabalowski, and M. J. Frisch.,  J. Phys. Chem. 98, 11623 (1994) (10.1021/j100096a001)

    Deriv               =              1
    GGA                 =           TRUE
    Meta                =          FALSE

    Exchange Hybrid     =           TRUE
    MP2 Hybrid          =          FALSE

   => Exchange Functionals <=

    0.0800   Slater exchange
    0.7200         Becke 88

   => Exact (HF) Exchange <=

    0.2000               HF 

   => Correlation Functionals <=

    0.1900   Vosko, Wilk & Nusair (VWN5_RPA)
    0.8100   Lee, Yang & Parr

   => LibXC Density Thresholds  <==

    XC_HYB_GGA_XC_B3LYP:  1.00E-15 

   => Molecular Quadrature <=

    Radial Scheme          =       TREUTLER
    Pruning Scheme         =           NONE
    Nuclear Scheme         =       TREUTLER

    Blocking Scheme        =         OCTREE
    BS radius alpha        =              1
    Pruning alpha          =              1
    Radial Points          =             75
    Spherical Points       =            302
    Total Points           =          42674
    Total Blocks           =            383
    Max Points             =            256
    Max Functions          =             28
    Weights Tolerance      =       1.00E-15


  -Total Gradient:
     Atom            X                  Y                   Z
    ------   -----------------  -----------------  -----------------
       1        0.000000000000     0.000000000000    -0.008801032694
       2       -0.000000000000     0.000000000000     0.008803764259


*** tstop() called on Joses-MacBook-Pro-2.local at Thu Jul 17 13:40:47 2025
Module time:
	user time   =       0.45 seconds =       0.01 minutes
	system time =       1.04 seconds =       0.02 minutes
	total time  =          0 seconds =       0.00 minutes
Total time:
	user time   =       9.47 seconds =       0.16 minutes
	system time =      11.71 seconds =       0.20 minutes
	total time  =          2 seconds =       0.03 minutes

    			-----------------------------------------

    			 OPTKING 3.0: for geometry optimizations 

    			     By R.A. King, Bethel University     

    			        with contributions from          

    			    A.V. Copan, J. Cayton, A. Heide      

    			-----------------------------------------

    
	                            ===> Fragment 1 <== 

	 Z (Atomic Numbers)          Masses                          Geom                  
	       6.000000            12.000000          0.00000000  0.00000000  1.25885912   
	       7.000000            14.003074          0.00000000  0.00000000 -1.07878523   

	 - Coordinate -           - BOHR/RAD -       - ANG/DEG -
	 R(1,2)           =         2.337644           1.237028


	        --- Internal Coordinate Step in ANG or DEG, aJ/ANG or AJ/DEG ---
	-------------------------------------------------------------------------------
	           Coordinate      Previous         Force          Change          New 
	           ----------      --------        ------          ------        ------
	               R(1,2)       1.23703        0.07252        0.00502       1.24205
	-------------------------------------------------------------------------------

	                                 ==> Convergence Check <==                                  
    
	Measures of convergence in internal coordinates in au.
    
	Criteria marked as inactive (o), active & met (*), and active & unmet ( ).

	----------------------------------------------------------------------------------------------
	   Step    Total Energy     Delta E     Max Force     RMS Force      Max Disp      RMS Disp   
	----------------------------------------------------------------------------------------------
	  Convergence Criteria     1.00e-06 *    3.00e-04 *             o    1.20e-03 *             o
	----------------------------------------------------------------------------------------------
	     2     -92.20849100   -2.79e-03      8.80e-03      8.80e-03 o    9.49e-03      9.49e-03 o  ~
	----------------------------------------------------------------------------------------------

Next Geometry in Ang 
	Fragment 1 (Ang)

	    C   0.0000000000   0.0000000000   0.6686701530
	    N   0.0000000000   0.0000000000  -0.5733791550


    Structure for next step:
    Molecular point group: c2v
    Full point group: C_inf_v

    Geometry (in Angstrom), charge = 1, multiplicity = 3:

    C            0.000000000000     0.000000000000     0.668863549545
    N            0.000000000000     0.000000000000    -0.573185758499


Scratch directory: /tmp/
gradient() will perform analytic gradient computation.
   => Libint2 <=

    Primary   basis highest AM E, G, H:  6, 6, 3
    Auxiliary basis highest AM E, G, H:  7, 7, 4
    Onebody   basis highest AM E, G, H:  -, -, -
    Solid Harmonics ordering:            Gaussian

*** tstart() called on Joses-MacBook-Pro-2.local
*** at Thu Jul 17 13:40:47 2025

   => Loading Basis Set <=

    Name: CC-PVDZ
    Role: ORBITAL
    Keyword: BASIS
    atoms 1 entry C          line   138 file /Users/joseantoniorodriguesromero/anaconda3/share/psi4/basis/cc-pvdz.gbs 
    atoms 2 entry N          line   168 file /Users/joseantoniorodriguesromero/anaconda3/share/psi4/basis/cc-pvdz.gbs 


         ---------------------------------------------------------
                                   SCF
               by Justin Turney, Rob Parrish, Andy Simmonett
                          and Daniel G. A. Smith
                              UKS Reference
                        1 Threads,    500 MiB Core
         ---------------------------------------------------------

  ==> Geometry <==

    Molecular point group: c2v
    Full point group: C_inf_v

    Geometry (in Angstrom), charge = 1, multiplicity = 3:

       Center              X                  Y                   Z               Mass       
    ------------   -----------------  -----------------  -----------------  -----------------
         C            0.000000000000     0.000000000000     0.668863549545    12.000000000000
         N            0.000000000000     0.000000000000    -0.573185758499    14.003074004430

  Running in c2v symmetry.

  Rotational constants: A = ************  B =      1.69098  C =      1.69098 [cm^-1]
  Rotational constants: A = ************  B =  50694.35326  C =  50694.35326 [MHz]
  Nuclear repulsion =   17.894171112364042

  Charge       = 1
  Multiplicity = 3
  Electrons    = 12
  Nalpha       = 7
  Nbeta        = 5

  ==> Algorithm <==

  SCF Algorithm Type is DF.
  DIIS enabled.
  MOM disabled.
  Fractional occupation disabled.
  Guess Type is READ.
  Energy threshold   = 1.00e-08
  Density threshold  = 1.00e-08
  Integral threshold = 1.00e-12

  ==> Primary Basis <==

  Basis Set: CC-PVDZ
    Blend: CC-PVDZ
    Number of shells: 12
    Number of basis functions: 28
    Number of Cartesian functions: 30
    Spherical Harmonics?: true
    Max angular momentum: 2

  ==> DFT Potential <==

   => LibXC <=

    Version 6.2.2
    S. Lehtola, C. Steigemann, M. J.T. Oliveira, and M. A.L. Marques.,  SoftwareX 7, 1–5 (2018) (10.1016/j.softx.2017.11.002)

   => Composite Functional: B3LYP <= 

    B3LYP Hyb-GGA Exchange-Correlation Functional

    P. J. Stephens, F. J. Devlin, C. F. Chabalowski, and M. J. Frisch.,  J. Phys. Chem. 98, 11623 (1994) (10.1021/j100096a001)

    Deriv               =              1
    GGA                 =           TRUE
    Meta                =          FALSE

    Exchange Hybrid     =           TRUE
    MP2 Hybrid          =          FALSE

   => Exchange Functionals <=

    0.0800   Slater exchange
    0.7200         Becke 88

   => Exact (HF) Exchange <=

    0.2000               HF 

   => Correlation Functionals <=

    0.1900   Vosko, Wilk & Nusair (VWN5_RPA)
    0.8100   Lee, Yang & Parr

   => LibXC Density Thresholds  <==

    XC_HYB_GGA_XC_B3LYP:  1.00E-15 

   => Molecular Quadrature <=

    Radial Scheme          =       TREUTLER
    Pruning Scheme         =           NONE
    Nuclear Scheme         =       TREUTLER

    Blocking Scheme        =         OCTREE
    BS radius alpha        =              1
    Pruning alpha          =              1
    Radial Points          =             75
    Spherical Points       =            302
    Total Points           =          42674
    Total Blocks           =            383
    Max Points             =            255
    Max Functions          =             28
    Weights Tolerance      =       1.00E-15

   => Loading Basis Set <=

    Name: (CC-PVDZ AUX)
    Role: JKFIT
    Keyword: DF_BASIS_SCF
    atoms 1 entry C          line   121 file /Users/joseantoniorodriguesromero/anaconda3/share/psi4/basis/cc-pvdz-jkfit.gbs 
    atoms 2 entry N          line   171 file /Users/joseantoniorodriguesromero/anaconda3/share/psi4/basis/cc-pvdz-jkfit.gbs 

   => Loading Basis Set <=

    Name: CC-PVDZ
    Role: ORBITAL
    Keyword: BASIS
    atoms 1 entry C          line   138 file /Users/joseantoniorodriguesromero/anaconda3/share/psi4/basis/cc-pvdz.gbs 
    atoms 2 entry N          line   168 file /Users/joseantoniorodriguesromero/anaconda3/share/psi4/basis/cc-pvdz.gbs 

  Reading orbitals from file /tmp/triplet_CN.default.74321.180.npy, no projection.

  ==> Integral Setup <==

  DFHelper Memory: AOs need 0.001 GiB; user supplied 0.332 GiB. 
  Using in-core AOs.

  ==> MemDFJK: Density-Fitted J/K Matrices <==

    J tasked:                   Yes
    K tasked:                   Yes
    wK tasked:                   No
    OpenMP threads:               1
    Memory [MiB]:               339
    Algorithm:                 Core
    Schwarz Cutoff:           1E-12
    Mask sparsity (%):       0.0000
    Fitting Condition:        1E-10

   => Auxiliary Basis Set <=

  Basis Set: (CC-PVDZ AUX)
    Blend: CC-PVDZ-JKFIT
    Number of shells: 48
    Number of basis functions: 140
    Number of Cartesian functions: 162
    Spherical Harmonics?: true
    Max angular momentum: 3

  Cached 100.0% of DFT collocation blocks in 0.034 [GiB].

  Minimum eigenvalue in the overlap matrix is 1.2288457237E-02.
  Reciprocal condition number of the overlap matrix is 4.0008713656E-03.
    Using symmetric orthogonalization.

  ==> Pre-Iterations <==

  SCF Guess: Orbitals guess was supplied from a previous computation.

   -------------------------------------------------------
    Irrep   Nso     Nmo     Nalpha   Nbeta   Ndocc  Nsocc
   -------------------------------------------------------
     A1        14      14       5       4       4       1
     A2         2       2       0       0       0       0
     B1         6       6       1       1       1       0
     B2         6       6       1       0       0       1
   -------------------------------------------------------
    Total      28      28       7       5       5       2
   -------------------------------------------------------

  ==> Iterations <==

                           Total Energy        Delta E     RMS |[F,P]|

   @DF-UKS iter   0:   -92.20117999146697   -9.22012e+01   9.44348e-04 
   @DF-UKS iter   1:   -92.20853357144428   -7.35358e-03   1.58819e-04 DIIS/ADIIS
   @DF-UKS iter   2:   -92.20853328629838    2.85146e-07   1.90911e-04 DIIS/ADIIS/DAMP=1%
   @DF-UKS iter   3:   -92.20847991828128    5.33680e-05   1.36691e-04 DIIS/ADIIS/DAMP=1%
   @DF-UKS iter   4:   -92.20854973440784   -6.98161e-05   1.76844e-05 DIIS/DAMP=1%
   @DF-UKS iter   5:   -92.20853729325114    1.24412e-05   4.91394e-06 DIIS/DAMP=1%
   @DF-UKS iter   6:   -92.20853902832387   -1.73507e-06   2.23397e-06 DIIS/DAMP=1%
   @DF-UKS iter   7:   -92.20853840099055    6.27333e-07   7.37093e-07 DIIS/DAMP=1%
   @DF-UKS iter   8:   -92.20853823043333    1.70557e-07   3.67910e-07 DIIS/DAMP=1%
   @DF-UKS iter   9:   -92.20853834193539   -1.11502e-07   3.46709e-08 DIIS/DAMP=1%
   @DF-UKS iter  10:   -92.20853828592394    5.60115e-08   4.93501e-09 DIIS/DAMP=1%
   @DF-UKS iter  11:   -92.20853828871120   -2.78726e-09   4.68054e-10 DIIS/DAMP=1%
  Energy and wave function converged.


  ==> Post-Iterations <==

   Electrons on quadrature grid:
      Nalpha   =    6.9999999695 ; deviation = -3.054e-08
      Nbeta    =    4.9999999999 ; deviation = -1.049e-10
      Ntotal   =   11.9999999694 ; deviation = -3.065e-08 

   @Spin Contamination Metric:   4.441456007E-03
   @S^2 Expected:                2.000000000E+00
   @S^2 Observed:                2.004441456E+00
   @S   Expected:                1.000000000E+00
   @S   Observed:                1.000000000E+00

    Orbital Energies [Eh]
    ---------------------

    Alpha Occupied:                                                       

       1A1   -14.869092     2A1   -10.782309     3A1    -1.388634  
       4A1    -0.907095     1B2    -0.819601     5A1    -0.795747  
       1B1    -0.777327  

    Alpha Virtual:                                                        

       2B2    -0.453417     2B1    -0.420271     6A1    -0.062737  
       3B2     0.113906     3B1     0.127868     7A1     0.160189  
       8A1     0.221335     9A1     0.347705     4B2     0.400093  
       4B1     0.426240     1A2     0.684286    10A1     0.684404  
       5B2     0.761857     5B1     0.790262    11A1     0.943927  
      12A1     1.398918     2A2     1.398919    13A1     1.402624  
       6B2     1.851832     6B1     1.883882    14A1     2.209733  

    Beta Occupied:                                                        

       1A1   -14.851460     2A1   -10.759221     3A1    -1.321227  
       4A1    -0.814697     1B1    -0.754216  

    Beta Virtual:                                                         

       1B2    -0.641475     5A1    -0.609883     2B1    -0.383903  
       2B2    -0.349415     6A1    -0.031231     3B1     0.141727  
       3B2     0.150197     7A1     0.233989     8A1     0.258467  
       9A1     0.383744     4B1     0.433862     4B2     0.449825  
       1A2     0.734797    10A1     0.738363     5B1     0.842080  
       5B2     0.852982    11A1     0.974999     2A2     1.445769  
      12A1     1.450425    13A1     1.475080     6B1     1.916265  
       6B2     1.925272    14A1     2.253496  

    Final Occupation by Irrep:
             A1    A2    B1    B2 
    DOCC [     4,    0,    1,    0 ]
    SOCC [     1,    0,    0,    1 ]
    NA   [     5,    0,    1,    1 ]
    NB   [     4,    0,    1,    0 ]

  @DF-UKS Final Energy:   -92.20853828871120

   => Energetics <=

    Nuclear Repulsion Energy =             17.8941711123640417
    One-Electron Energy =                -154.5162939665846693
    Two-Electron Energy =                  53.9177447076544993
    DFT Exchange-Correlation Energy =      -9.5041601421450626
    Empirical Dispersion Energy =           0.0000000000000000
    VV10 Nonlocal Energy =                  0.0000000000000000
    Total Energy =                        -92.2085382887112104

  UHF NO Occupations:
  HONO-2 :    1 B1 1.9988480
  HONO-1 :    5 A1 1.0000000
  HONO-0 :    1 B2 1.0000000
  LUNO+0 :    2 B1 0.0011520
  LUNO+1 :    6 A1 0.0008368
  LUNO+2 :    7 A1 0.0002328
  LUNO+3 :    8 A1 0.0000001


Computation Completed


Properties will be evaluated at   0.000000,   0.000000,   0.000000 [a0]

Properties computed using the SCF density matrix


 Multipole Moments:

 ------------------------------------------------------------------------------------
     Multipole            Electronic (a.u.)      Nuclear  (a.u.)        Total (a.u.)
 ------------------------------------------------------------------------------------

 L = 1.  Multiply by 2.5417464519 to convert [e a0] to [Debye]
 Dipole X            :          0.0000000            0.0000000            0.0000000
 Dipole Y            :          0.0000000            0.0000000            0.0000000
 Dipole Z            :          0.7031642            0.0016648            0.7048291
 Magnitude           :                                                    0.7048291

 ------------------------------------------------------------------------------------

*** tstop() called on Joses-MacBook-Pro-2.local at Thu Jul 17 13:40:48 2025
Module time:
	user time   =       2.81 seconds =       0.05 minutes
	system time =       4.13 seconds =       0.07 minutes
	total time  =          1 seconds =       0.02 minutes
Total time:
	user time   =      12.32 seconds =       0.21 minutes
	system time =      16.07 seconds =       0.27 minutes
	total time  =          3 seconds =       0.05 minutes

*** tstart() called on Joses-MacBook-Pro-2.local
*** at Thu Jul 17 13:40:48 2025


         ------------------------------------------------------------
                                   SCF GRAD                          
                          Rob Parrish, Justin Turney,                
                       Andy Simmonett, and Alex Sokolov              
         ------------------------------------------------------------

  ==> Geometry <==

    Molecular point group: c2v
    Full point group: C_inf_v

    Geometry (in Angstrom), charge = 1, multiplicity = 3:

       Center              X                  Y                   Z               Mass       
    ------------   -----------------  -----------------  -----------------  -----------------
         C            0.000000000000     0.000000000000     0.668863549545    12.000000000000
         N            0.000000000000     0.000000000000    -0.573185758499    14.003074004430

  Nuclear repulsion =   17.894171112364042

  ==> Basis Set <==

  Basis Set: CC-PVDZ
    Blend: CC-PVDZ
    Number of shells: 12
    Number of basis functions: 28
    Number of Cartesian functions: 30
    Spherical Harmonics?: true
    Max angular momentum: 2

  ==> DFJKGrad: Density-Fitted SCF Gradients <==

    Gradient:                    1
    J tasked:                  Yes
    K tasked:                  Yes
    wK tasked:                  No
    OpenMP threads:              1
    Integrals threads:           1
    Memory [MiB]:              375
    Schwarz Cutoff:          1E-12
    Fitting Condition:       1E-10

   => Auxiliary Basis Set <=

  Basis Set: (CC-PVDZ AUX)
    Blend: CC-PVDZ-JKFIT
    Number of shells: 48
    Number of basis functions: 140
    Number of Cartesian functions: 162
    Spherical Harmonics?: true
    Max angular momentum: 3

  ==> DFT Potential <==

   => LibXC <=

    Version 6.2.2
    S. Lehtola, C. Steigemann, M. J.T. Oliveira, and M. A.L. Marques.,  SoftwareX 7, 1–5 (2018) (10.1016/j.softx.2017.11.002)

   => Composite Functional: B3LYP <= 

    B3LYP Hyb-GGA Exchange-Correlation Functional

    P. J. Stephens, F. J. Devlin, C. F. Chabalowski, and M. J. Frisch.,  J. Phys. Chem. 98, 11623 (1994) (10.1021/j100096a001)

    Deriv               =              1
    GGA                 =           TRUE
    Meta                =          FALSE

    Exchange Hybrid     =           TRUE
    MP2 Hybrid          =          FALSE

   => Exchange Functionals <=

    0.0800   Slater exchange
    0.7200         Becke 88

   => Exact (HF) Exchange <=

    0.2000               HF 

   => Correlation Functionals <=

    0.1900   Vosko, Wilk & Nusair (VWN5_RPA)
    0.8100   Lee, Yang & Parr

   => LibXC Density Thresholds  <==

    XC_HYB_GGA_XC_B3LYP:  1.00E-15 

   => Molecular Quadrature <=

    Radial Scheme          =       TREUTLER
    Pruning Scheme         =           NONE
    Nuclear Scheme         =       TREUTLER

    Blocking Scheme        =         OCTREE
    BS radius alpha        =              1
    Pruning alpha          =              1
    Radial Points          =             75
    Spherical Points       =            302
    Total Points           =          42674
    Total Blocks           =            383
    Max Points             =            255
    Max Functions          =             28
    Weights Tolerance      =       1.00E-15


  -Total Gradient:
     Atom            X                  Y                   Z
    ------   -----------------  -----------------  -----------------
       1        0.000000000000     0.000000000000    -0.001215416578
       2        0.000000000000     0.000000000000     0.001218167175


*** tstop() called on Joses-MacBook-Pro-2.local at Thu Jul 17 13:40:48 2025
Module time:
	user time   =       0.50 seconds =       0.01 minutes
	system time =       1.29 seconds =       0.02 minutes
	total time  =          0 seconds =       0.00 minutes
Total time:
	user time   =      12.82 seconds =       0.21 minutes
	system time =      17.36 seconds =       0.29 minutes
	total time  =          3 seconds =       0.05 minutes

    			-----------------------------------------

    			 OPTKING 3.0: for geometry optimizations 

    			     By R.A. King, Bethel University     

    			        with contributions from          

    			    A.V. Copan, J. Cayton, A. Heide      

    			-----------------------------------------

    
	                            ===> Fragment 1 <== 

	 Z (Atomic Numbers)          Masses                          Geom                  
	       6.000000            12.000000          0.00000000  0.00000000  1.26396892   
	       7.000000            14.003074          0.00000000  0.00000000 -1.08316410   

	 - Coordinate -           - BOHR/RAD -       - ANG/DEG -
	 R(1,2)           =         2.347133           1.242049


	        --- Internal Coordinate Step in ANG or DEG, aJ/ANG or AJ/DEG ---
	-------------------------------------------------------------------------------
	           Coordinate      Previous         Force          Change          New 
	           ----------      --------        ------          ------        ------
	               R(1,2)       1.24205        0.01002        0.00071       1.24276
	-------------------------------------------------------------------------------

	                                 ==> Convergence Check <==                                  
    
	Measures of convergence in internal coordinates in au.
    
	Criteria marked as inactive (o), active & met (*), and active & unmet ( ).

	----------------------------------------------------------------------------------------------
	   Step    Total Energy     Delta E     Max Force     RMS Force      Max Disp      RMS Disp   
	----------------------------------------------------------------------------------------------
	  Convergence Criteria     1.00e-06 *    3.00e-04 *             o    1.20e-03 *             o
	----------------------------------------------------------------------------------------------
	     3     -92.20853829   -4.73e-05      1.22e-03      1.22e-03 o    1.33e-03      1.33e-03 o  ~
	----------------------------------------------------------------------------------------------

Next Geometry in Ang 
	Fragment 1 (Ang)

	    C   0.0000000000   0.0000000000   0.6692164519
	    N   0.0000000000   0.0000000000  -0.5735386609


    Structure for next step:
    Molecular point group: c2v
    Full point group: C_inf_v

    Geometry (in Angstrom), charge = 1, multiplicity = 3:

    C            0.000000000000     0.000000000000     0.669243636761
    N            0.000000000000     0.000000000000    -0.573511476023


Scratch directory: /tmp/
gradient() will perform analytic gradient computation.
   => Libint2 <=

    Primary   basis highest AM E, G, H:  6, 6, 3
    Auxiliary basis highest AM E, G, H:  7, 7, 4
    Onebody   basis highest AM E, G, H:  -, -, -
    Solid Harmonics ordering:            Gaussian

*** tstart() called on Joses-MacBook-Pro-2.local
*** at Thu Jul 17 13:40:48 2025

   => Loading Basis Set <=

    Name: CC-PVDZ
    Role: ORBITAL
    Keyword: BASIS
    atoms 1 entry C          line   138 file /Users/joseantoniorodriguesromero/anaconda3/share/psi4/basis/cc-pvdz.gbs 
    atoms 2 entry N          line   168 file /Users/joseantoniorodriguesromero/anaconda3/share/psi4/basis/cc-pvdz.gbs 


         ---------------------------------------------------------
                                   SCF
               by Justin Turney, Rob Parrish, Andy Simmonett
                          and Daniel G. A. Smith
                              UKS Reference
                        1 Threads,    500 MiB Core
         ---------------------------------------------------------

  ==> Geometry <==

    Molecular point group: c2v
    Full point group: C_inf_v

    Geometry (in Angstrom), charge = 1, multiplicity = 3:

       Center              X                  Y                   Z               Mass       
    ------------   -----------------  -----------------  -----------------  -----------------
         C            0.000000000000     0.000000000000     0.669243636761    12.000000000000
         N            0.000000000000     0.000000000000    -0.573511476023    14.003074004430

  Running in c2v symmetry.

  Rotational constants: A = ************  B =      1.68906  C =      1.68906 [cm^-1]
  Rotational constants: A = ************  B =  50636.78736  C =  50636.78736 [MHz]
  Nuclear repulsion =   17.884008377443507

  Charge       = 1
  Multiplicity = 3
  Electrons    = 12
  Nalpha       = 7
  Nbeta        = 5

  ==> Algorithm <==

  SCF Algorithm Type is DF.
  DIIS enabled.
  MOM disabled.
  Fractional occupation disabled.
  Guess Type is READ.
  Energy threshold   = 1.00e-08
  Density threshold  = 1.00e-08
  Integral threshold = 1.00e-12

  ==> Primary Basis <==

  Basis Set: CC-PVDZ
    Blend: CC-PVDZ
    Number of shells: 12
    Number of basis functions: 28
    Number of Cartesian functions: 30
    Spherical Harmonics?: true
    Max angular momentum: 2

  ==> DFT Potential <==

   => LibXC <=

    Version 6.2.2
    S. Lehtola, C. Steigemann, M. J.T. Oliveira, and M. A.L. Marques.,  SoftwareX 7, 1–5 (2018) (10.1016/j.softx.2017.11.002)

   => Composite Functional: B3LYP <= 

    B3LYP Hyb-GGA Exchange-Correlation Functional

    P. J. Stephens, F. J. Devlin, C. F. Chabalowski, and M. J. Frisch.,  J. Phys. Chem. 98, 11623 (1994) (10.1021/j100096a001)

    Deriv               =              1
    GGA                 =           TRUE
    Meta                =          FALSE

    Exchange Hybrid     =           TRUE
    MP2 Hybrid          =          FALSE

   => Exchange Functionals <=

    0.0800   Slater exchange
    0.7200         Becke 88

   => Exact (HF) Exchange <=

    0.2000               HF 

   => Correlation Functionals <=

    0.1900   Vosko, Wilk & Nusair (VWN5_RPA)
    0.8100   Lee, Yang & Parr

   => LibXC Density Thresholds  <==

    XC_HYB_GGA_XC_B3LYP:  1.00E-15 

   => Molecular Quadrature <=

    Radial Scheme          =       TREUTLER
    Pruning Scheme         =           NONE
    Nuclear Scheme         =       TREUTLER

    Blocking Scheme        =         OCTREE
    BS radius alpha        =              1
    Pruning alpha          =              1
    Radial Points          =             75
    Spherical Points       =            302
    Total Points           =          42674
    Total Blocks           =            383
    Max Points             =            255
    Max Functions          =             28
    Weights Tolerance      =       1.00E-15

   => Loading Basis Set <=

    Name: (CC-PVDZ AUX)
    Role: JKFIT
    Keyword: DF_BASIS_SCF
    atoms 1 entry C          line   121 file /Users/joseantoniorodriguesromero/anaconda3/share/psi4/basis/cc-pvdz-jkfit.gbs 
    atoms 2 entry N          line   171 file /Users/joseantoniorodriguesromero/anaconda3/share/psi4/basis/cc-pvdz-jkfit.gbs 

   => Loading Basis Set <=

    Name: CC-PVDZ
    Role: ORBITAL
    Keyword: BASIS
    atoms 1 entry C          line   138 file /Users/joseantoniorodriguesromero/anaconda3/share/psi4/basis/cc-pvdz.gbs 
    atoms 2 entry N          line   168 file /Users/joseantoniorodriguesromero/anaconda3/share/psi4/basis/cc-pvdz.gbs 

  Reading orbitals from file /tmp/triplet_CN.default.74321.180.npy, no projection.

  ==> Integral Setup <==

  DFHelper Memory: AOs need 0.001 GiB; user supplied 0.332 GiB. 
  Using in-core AOs.

  ==> MemDFJK: Density-Fitted J/K Matrices <==

    J tasked:                   Yes
    K tasked:                   Yes
    wK tasked:                   No
    OpenMP threads:               1
    Memory [MiB]:               339
    Algorithm:                 Core
    Schwarz Cutoff:           1E-12
    Mask sparsity (%):       0.0000
    Fitting Condition:        1E-10

   => Auxiliary Basis Set <=

  Basis Set: (CC-PVDZ AUX)
    Blend: CC-PVDZ-JKFIT
    Number of shells: 48
    Number of basis functions: 140
    Number of Cartesian functions: 162
    Spherical Harmonics?: true
    Max angular momentum: 3

  Cached 100.0% of DFT collocation blocks in 0.034 [GiB].

  Minimum eigenvalue in the overlap matrix is 1.2305215891E-02.
  Reciprocal condition number of the overlap matrix is 4.0069042743E-03.
    Using symmetric orthogonalization.

  ==> Pre-Iterations <==

  SCF Guess: Orbitals guess was supplied from a previous computation.

   -------------------------------------------------------
    Irrep   Nso     Nmo     Nalpha   Nbeta   Ndocc  Nsocc
   -------------------------------------------------------
     A1        14      14       5       4       4       1
     A2         2       2       0       0       0       0
     B1         6       6       1       1       1       0
     B2         6       6       1       0       0       1
   -------------------------------------------------------
    Total      28      28       7       5       5       2
   -------------------------------------------------------

  ==> Iterations <==

                           Total Energy        Delta E     RMS |[F,P]|

   @DF-UKS iter   0:   -92.20750708587215   -9.22075e+01   1.31980e-04 
   @DF-UKS iter   1:   -92.20853911718100   -1.03203e-03   2.23551e-05 DIIS
   @DF-UKS iter   2:   -92.20853910956943    7.61158e-09   2.71475e-05 DIIS/DAMP=1%
   @DF-UKS iter   3:   -92.20853132435379    7.78522e-06   1.92379e-05 DIIS/DAMP=1%
   @DF-UKS iter   4:   -92.20854083053567   -9.50618e-06   2.49594e-06 DIIS/DAMP=1%
   @DF-UKS iter   5:   -92.20853907475960    1.75578e-06   6.97400e-07 DIIS/DAMP=1%
   @DF-UKS iter   6:   -92.20853931585634   -2.41097e-07   3.15118e-07 DIIS/DAMP=1%
   @DF-UKS iter   7:   -92.20853922720902    8.86473e-08   1.04423e-07 DIIS/DAMP=1%
   @DF-UKS iter   8:   -92.20853920228586    2.49232e-08   5.19656e-08 DIIS/DAMP=1%
   @DF-UKS iter   9:   -92.20853921813860   -1.58527e-08   4.77328e-09 DIIS/DAMP=1%
   @DF-UKS iter  10:   -92.20853921027177    7.86683e-09   7.13675e-10 DIIS/DAMP=1%
  Energy and wave function converged.


  ==> Post-Iterations <==

   Electrons on quadrature grid:
      Nalpha   =    6.9999999706 ; deviation = -2.936e-08
      Nbeta    =    5.0000000011 ; deviation = 1.077e-09
      Ntotal   =   11.9999999717 ; deviation = -2.828e-08 

   @Spin Contamination Metric:   4.439751779E-03
   @S^2 Expected:                2.000000000E+00
   @S^2 Observed:                2.004439752E+00
   @S   Expected:                1.000000000E+00
   @S   Observed:                1.000000000E+00

    Orbital Energies [Eh]
    ---------------------

    Alpha Occupied:                                                       

       1A1   -14.869176     2A1   -10.782378     3A1    -1.388278  
       4A1    -0.907196     1B2    -0.819381     5A1    -0.795704  
       1B1    -0.777117  

    Alpha Virtual:                                                        

       2B2    -0.453618     2B1    -0.420480     6A1    -0.062954  
       3B2     0.113995     3B1     0.127950     7A1     0.160043  
       8A1     0.220846     9A1     0.347714     4B2     0.400048  
       4B1     0.426202     1A2     0.684433    10A1     0.684551  
       5B2     0.761544     5B1     0.789934    11A1     0.943736  
      12A1     1.398671     2A2     1.398737    13A1     1.401834  
       6B2     1.851238     6B1     1.883289    14A1     2.208802  

    Beta Occupied:                                                        

       1A1   -14.851525     2A1   -10.759311     3A1    -1.320866  
       4A1    -0.814769     1B1    -0.754013  

    Beta Virtual:                                                         

       1B2    -0.641293     5A1    -0.609877     2B1    -0.384131  
       2B2    -0.349629     6A1    -0.031370     3B1     0.141795  
       3B2     0.150260     7A1     0.233895     8A1     0.257888  
       9A1     0.383712     4B1     0.433837     4B2     0.449812  
       1A2     0.734898    10A1     0.738461     5B1     0.841727  
       5B2     0.852625    11A1     0.974815     2A2     1.445606  
      12A1     1.450252    13A1     1.474225     6B1     1.915696  
       6B2     1.924714    14A1     2.252615  

    Final Occupation by Irrep:
             A1    A2    B1    B2 
    DOCC [     4,    0,    1,    0 ]
    SOCC [     1,    0,    0,    1 ]
    NA   [     5,    0,    1,    1 ]
    NB   [     4,    0,    1,    0 ]

  @DF-UKS Final Energy:   -92.20853921027177

   => Energetics <=

    Nuclear Repulsion Energy =             17.8840083774435072
    One-Electron Energy =                -154.4972133813862740
    Two-Electron Energy =                  53.9083409842769257
    DFT Exchange-Correlation Energy =      -9.5036751906059322
    Empirical Dispersion Energy =           0.0000000000000000
    VV10 Nonlocal Energy =                  0.0000000000000000
    Total Energy =                        -92.2085392102717805

  UHF NO Occupations:
  HONO-2 :    1 B1 1.9988520
  HONO-1 :    5 A1 1.0000000
  HONO-0 :    1 B2 1.0000000
  LUNO+0 :    2 B1 0.0011480
  LUNO+1 :    6 A1 0.0008398
  LUNO+2 :    7 A1 0.0002329
  LUNO+3 :    8 A1 0.0000001


Computation Completed


Properties will be evaluated at   0.000000,   0.000000,   0.000000 [a0]

Properties computed using the SCF density matrix


 Multipole Moments:

 ------------------------------------------------------------------------------------
     Multipole            Electronic (a.u.)      Nuclear  (a.u.)        Total (a.u.)
 ------------------------------------------------------------------------------------

 L = 1.  Multiply by 2.5417464519 to convert [e a0] to [Debye]
 Dipole X            :          0.0000000            0.0000000            0.0000000
 Dipole Y            :          0.0000000            0.0000000            0.0000000
 Dipole Z            :          0.7028038            0.0016658            0.7044696
 Magnitude           :                                                    0.7044696

 ------------------------------------------------------------------------------------

*** tstop() called on Joses-MacBook-Pro-2.local at Thu Jul 17 13:40:49 2025
Module time:
	user time   =       2.85 seconds =       0.05 minutes
	system time =       4.15 seconds =       0.07 minutes
	total time  =          1 seconds =       0.02 minutes
Total time:
	user time   =      15.71 seconds =       0.26 minutes
	system time =      21.73 seconds =       0.36 minutes
	total time  =          4 seconds =       0.07 minutes

*** tstart() called on Joses-MacBook-Pro-2.local
*** at Thu Jul 17 13:40:49 2025


         ------------------------------------------------------------
                                   SCF GRAD                          
                          Rob Parrish, Justin Turney,                
                       Andy Simmonett, and Alex Sokolov              
         ------------------------------------------------------------

  ==> Geometry <==

    Molecular point group: c2v
    Full point group: C_inf_v

    Geometry (in Angstrom), charge = 1, multiplicity = 3:

       Center              X                  Y                   Z               Mass       
    ------------   -----------------  -----------------  -----------------  -----------------
         C            0.000000000000     0.000000000000     0.669243636761    12.000000000000
         N            0.000000000000     0.000000000000    -0.573511476023    14.003074004430

  Nuclear repulsion =   17.884008377443507

  ==> Basis Set <==

  Basis Set: CC-PVDZ
    Blend: CC-PVDZ
    Number of shells: 12
    Number of basis functions: 28
    Number of Cartesian functions: 30
    Spherical Harmonics?: true
    Max angular momentum: 2

  ==> DFJKGrad: Density-Fitted SCF Gradients <==

    Gradient:                    1
    J tasked:                  Yes
    K tasked:                  Yes
    wK tasked:                  No
    OpenMP threads:              1
    Integrals threads:           1
    Memory [MiB]:              375
    Schwarz Cutoff:          1E-12
    Fitting Condition:       1E-10

   => Auxiliary Basis Set <=

  Basis Set: (CC-PVDZ AUX)
    Blend: CC-PVDZ-JKFIT
    Number of shells: 48
    Number of basis functions: 140
    Number of Cartesian functions: 162
    Spherical Harmonics?: true
    Max angular momentum: 3

  ==> DFT Potential <==

   => LibXC <=

    Version 6.2.2
    S. Lehtola, C. Steigemann, M. J.T. Oliveira, and M. A.L. Marques.,  SoftwareX 7, 1–5 (2018) (10.1016/j.softx.2017.11.002)

   => Composite Functional: B3LYP <= 

    B3LYP Hyb-GGA Exchange-Correlation Functional

    P. J. Stephens, F. J. Devlin, C. F. Chabalowski, and M. J. Frisch.,  J. Phys. Chem. 98, 11623 (1994) (10.1021/j100096a001)

    Deriv               =              1
    GGA                 =           TRUE
    Meta                =          FALSE

    Exchange Hybrid     =           TRUE
    MP2 Hybrid          =          FALSE

   => Exchange Functionals <=

    0.0800   Slater exchange
    0.7200         Becke 88

   => Exact (HF) Exchange <=

    0.2000               HF 

   => Correlation Functionals <=

    0.1900   Vosko, Wilk & Nusair (VWN5_RPA)
    0.8100   Lee, Yang & Parr

   => LibXC Density Thresholds  <==

    XC_HYB_GGA_XC_B3LYP:  1.00E-15 

   => Molecular Quadrature <=

    Radial Scheme          =       TREUTLER
    Pruning Scheme         =           NONE
    Nuclear Scheme         =       TREUTLER

    Blocking Scheme        =         OCTREE
    BS radius alpha        =              1
    Pruning alpha          =              1
    Radial Points          =             75
    Spherical Points       =            302
    Total Points           =          42674
    Total Blocks           =            383
    Max Points             =            255
    Max Functions          =             28
    Weights Tolerance      =       1.00E-15


  -Total Gradient:
     Atom            X                  Y                   Z
    ------   -----------------  -----------------  -----------------
       1        0.000000000000    -0.000000000000    -0.000170699785
       2       -0.000000000000    -0.000000000000     0.000173446672


*** tstop() called on Joses-MacBook-Pro-2.local at Thu Jul 17 13:40:49 2025
Module time:
	user time   =       0.36 seconds =       0.01 minutes
	system time =       1.39 seconds =       0.02 minutes
	total time  =          0 seconds =       0.00 minutes
Total time:
	user time   =      16.07 seconds =       0.27 minutes
	system time =      23.13 seconds =       0.39 minutes
	total time  =          4 seconds =       0.07 minutes

    			-----------------------------------------

    			 OPTKING 3.0: for geometry optimizations 

    			     By R.A. King, Bethel University     

    			        with contributions from          

    			    A.V. Copan, J. Cayton, A. Heide      

    			-----------------------------------------

    
	                            ===> Fragment 1 <== 

	 Z (Atomic Numbers)          Masses                          Geom                  
	       6.000000            12.000000          0.00000000  0.00000000  1.26468718   
	       7.000000            14.003074          0.00000000  0.00000000 -1.08377962   

	 - Coordinate -           - BOHR/RAD -       - ANG/DEG -
	 R(1,2)           =         2.348467           1.242755


	        --- Internal Coordinate Step in ANG or DEG, aJ/ANG or AJ/DEG ---
	-------------------------------------------------------------------------------
	           Coordinate      Previous         Force          Change          New 
	           ----------      --------        ------          ------        ------
	               R(1,2)       1.24276        0.00142        0.00010       1.24286
	-------------------------------------------------------------------------------

	                                 ==> Convergence Check <==                                  
    
	Measures of convergence in internal coordinates in au.
    
	Criteria marked as inactive (o), active & met (*), and active & unmet ( ).

	----------------------------------------------------------------------------------------------
	   Step    Total Energy     Delta E     Max Force     RMS Force      Max Disp      RMS Disp   
	----------------------------------------------------------------------------------------------
	  Convergence Criteria     1.00e-06 *    3.00e-04 *             o    1.20e-03 *             o
	----------------------------------------------------------------------------------------------
	     4     -92.20853921   -9.22e-07 *    1.72e-04 *    1.72e-04 o    1.89e-04 *    1.89e-04 o  ~
	----------------------------------------------------------------------------------------------

Next Geometry in Ang 
	Fragment 1 (Ang)

	    C   0.0000000000   0.0000000000   0.6692936595
	    N   0.0000000000   0.0000000000  -0.5735614988


    Final optimized geometry and variables:
    Molecular point group: c2v
    Full point group: C_inf_v

    Geometry (in Angstrom), charge = 1, multiplicity = 3:

    C            0.000000000000     0.000000000000     0.669243636761
    N            0.000000000000     0.000000000000    -0.573511476023


    Psi4 stopped on: Thursday, 17 July 2025 01:40PM
    Psi4 wall time for execution: 0:00:04.30

*** Psi4 exiting successfully. Buy a developer a beer!
