
    -----------------------------------------------------------------------
          Psi4: An Open-Source Ab Initio Electronic Structure Package
                               Psi4 1.9.1 release

                         Git: Rev {} zzzzzzz 


    D. G. A. Smith, L. A. Burns, A. C. Simmonett, R. M. Parrish,
    M. C. Schieber, R. Galvelis, P. Kraus, H. Kruse, R. Di Remigio,
    A. Alenaizan, A. M. James, S. Lehtola, J. P. Misiewicz, M. Scheurer,
    R. A. Shaw, J. B. Schriber, Y. Xie, Z. L. Glick, D. A. Sirianni,
    J. S. O'Brien, J. M. Waldrop, A. Kumar, E. G. Hohenstein,
    B. P. Pritchard, B. R. Brooks, H. F. Schaefer III, A. Yu. Sokolov,
    K. Patkowski, A. E. DePrince III, U. Bozkaya, R. A. King,
    F. A. Evangelista, J. M. Turney, T. D. Crawford, C. D. Sherrill,
    J. Chem. Phys. 152(18) 184108 (2020). https://doi.org/10.1063/5.0006002

                            Additional Code Authors
    E. T. Seidl, C. L. Janssen, E. F. Valeev, M. L. Leininger,
    J. F. Gonthier, R. M. Richard, H. R. McAlexander, M. Saitow, X. Wang,
    P. Verma, M. H. Lechner, A. Jiang, S. Behnle, A. G. Heide,
    M. F. Herbst, and D. L. Poole

             Previous Authors, Complete List of Code Contributors,
                       and Citations for Specific Modules
    https://github.com/psi4/psi4/blob/master/codemeta.json
    https://github.com/psi4/psi4/graphs/contributors
    http://psicode.org/psi4manual/master/introduction.html#citing-psifour

    -----------------------------------------------------------------------


    Psi4 started on: Wednesday, 16 July 2025 06:12PM

    Process ID: 68094
    Host:       Joses-MacBook-Pro-2.local
    PSIDATADIR: /Users/joseantoniorodriguesromero/anaconda3/share/psi4
    Memory:     500.0 MiB
    Threads:    1
    
  ==> Input File <==

--------------------------------------------------------------------------
molecule { 
0 2
H   0.00000        0.60000        0.00000
C   0.00000       -0.60000        0.00000
}

set { 
basis              cc-pvdz
reference          uks
maxiter            500
geom_maxiter       500
DAMPING_PERCENTAGE 1
guess              SAP
}

optimize('b3lyp')
--------------------------------------------------------------------------

Scratch directory: /tmp/
gradient() will perform analytic gradient computation.
   => Libint2 <=

    Primary   basis highest AM E, G, H:  6, 6, 3
    Auxiliary basis highest AM E, G, H:  7, 7, 4
    Onebody   basis highest AM E, G, H:  -, -, -
    Solid Harmonics ordering:            Gaussian

*** tstart() called on Joses-MacBook-Pro-2.local
*** at Wed Jul 16 18:12:55 2025

   => Loading Basis Set <=

    Name: CC-PVDZ
    Role: ORBITAL
    Keyword: BASIS
    atoms 1 entry H          line    22 file /Users/joseantoniorodriguesromero/anaconda3/share/psi4/basis/cc-pvdz.gbs 
    atoms 2 entry C          line   138 file /Users/joseantoniorodriguesromero/anaconda3/share/psi4/basis/cc-pvdz.gbs 


         ---------------------------------------------------------
                                   SCF
               by Justin Turney, Rob Parrish, Andy Simmonett
                          and Daniel G. A. Smith
                              UKS Reference
                        1 Threads,    500 MiB Core
         ---------------------------------------------------------

  ==> Geometry <==

    Molecular point group: c2v
    Full point group: C_inf_v

    Geometry (in Angstrom), charge = 0, multiplicity = 2:

       Center              X                  Y                   Z               Mass       
    ------------   -----------------  -----------------  -----------------  -----------------
         H            0.000000000000     0.000000000000     1.107025960475     1.007825032230
         C            0.000000000000     0.000000000000    -0.092974039525    12.000000000000

  Running in c2v symmetry.

  Rotational constants: A = ************  B =     12.59135  C =     12.59135 [cm^-1]
  Rotational constants: A = ************  B = 377479.18325  C = 377479.18325 [MHz]
  Nuclear repulsion =    2.645886053350000

  Charge       = 0
  Multiplicity = 2
  Electrons    = 7
  Nalpha       = 4
  Nbeta        = 3

  ==> Algorithm <==

  SCF Algorithm Type is DF.
  DIIS enabled.
  MOM disabled.
  Fractional occupation disabled.
  Guess Type is SAP.
  Energy threshold   = 1.00e-08
  Density threshold  = 1.00e-08
  Integral threshold = 1.00e-12

  ==> Primary Basis <==

  Basis Set: CC-PVDZ
    Blend: CC-PVDZ
    Number of shells: 9
    Number of basis functions: 19
    Number of Cartesian functions: 20
    Spherical Harmonics?: true
    Max angular momentum: 2

  ==> DFT Potential <==

   => LibXC <=

    Version 6.2.2
    S. Lehtola, C. Steigemann, M. J.T. Oliveira, and M. A.L. Marques.,  SoftwareX 7, 1–5 (2018) (10.1016/j.softx.2017.11.002)

   => Composite Functional: B3LYP <= 

    B3LYP Hyb-GGA Exchange-Correlation Functional

    P. J. Stephens, F. J. Devlin, C. F. Chabalowski, and M. J. Frisch.,  J. Phys. Chem. 98, 11623 (1994) (10.1021/j100096a001)

    Deriv               =              1
    GGA                 =           TRUE
    Meta                =          FALSE

    Exchange Hybrid     =           TRUE
    MP2 Hybrid          =          FALSE

   => Exchange Functionals <=

    0.0800   Slater exchange
    0.7200         Becke 88

   => Exact (HF) Exchange <=

    0.2000               HF 

   => Correlation Functionals <=

    0.1900   Vosko, Wilk & Nusair (VWN5_RPA)
    0.8100   Lee, Yang & Parr

   => LibXC Density Thresholds  <==

    XC_HYB_GGA_XC_B3LYP:  1.00E-15 

   => Molecular Quadrature <=

    Radial Scheme          =       TREUTLER
    Pruning Scheme         =           NONE
    Nuclear Scheme         =       TREUTLER

    Blocking Scheme        =         OCTREE
    BS radius alpha        =              1
    Pruning alpha          =              1
    Radial Points          =             75
    Spherical Points       =            302
    Total Points           =          43742
    Total Blocks           =            387
    Max Points             =            255
    Max Functions          =             19
    Weights Tolerance      =       1.00E-15

   => Loading Basis Set <=

    Name: (CC-PVDZ AUX)
    Role: JKFIT
    Keyword: DF_BASIS_SCF
    atoms 1 entry H          line    51 file /Users/joseantoniorodriguesromero/anaconda3/share/psi4/basis/cc-pvdz-jkfit.gbs 
    atoms 2 entry C          line   121 file /Users/joseantoniorodriguesromero/anaconda3/share/psi4/basis/cc-pvdz-jkfit.gbs 

  ==> Integral Setup <==

  DFHelper Memory: AOs need 0.000 GiB; user supplied 0.342 GiB. 
  Using in-core AOs.

  ==> MemDFJK: Density-Fitted J/K Matrices <==

    J tasked:                   Yes
    K tasked:                   Yes
    wK tasked:                   No
    OpenMP threads:               1
    Memory [MiB]:               349
    Algorithm:                 Core
    Schwarz Cutoff:           1E-12
    Mask sparsity (%):       0.0000
    Fitting Condition:        1E-10

   => Auxiliary Basis Set <=

  Basis Set: (CC-PVDZ AUX)
    Blend: CC-PVDZ-JKFIT
    Number of shells: 33
    Number of basis functions: 93
    Number of Cartesian functions: 106
    Spherical Harmonics?: true
    Max angular momentum: 3

  Cached 100.0% of DFT collocation blocks in 0.024 [GiB].

  Minimum eigenvalue in the overlap matrix is 4.4207294837E-02.
  Reciprocal condition number of the overlap matrix is 1.4754317306E-02.
    Using symmetric orthogonalization.

  ==> Pre-Iterations <==

  SCF Guess: Superposition of Atomic Potentials (doi:10.1021/acs.jctc.8b01089).

  ==> SAP guess <==

   => Molecular Quadrature <=

    Radial Scheme          =       TREUTLER
    Pruning Scheme         =           NONE
    Nuclear Scheme         =       TREUTLER

    Blocking Scheme        =         OCTREE
    BS radius alpha        =              1
    Pruning alpha          =              1
    Radial Points          =             75
    Spherical Points       =            302
    Total Points           =          43742
    Total Blocks           =            387
    Max Points             =            255
    Max Functions          =             19
    Weights Tolerance      =       1.00E-15

   -------------------------------------------------------
    Irrep   Nso     Nmo     Nalpha   Nbeta   Ndocc  Nsocc
   -------------------------------------------------------
     A1        10      10       3       3       3       0
     A2         1       1       0       0       0       0
     B1         4       4       1       0       0       1
     B2         4       4       0       0       0       0
   -------------------------------------------------------
    Total      19      19       4       3       3       1
   -------------------------------------------------------

  ==> Iterations <==

                           Total Energy        Delta E     RMS |[F,P]|

   @DF-UKS iter   1:   -38.46067471100063   -3.84607e+01   1.51786e-02 DIIS/ADIIS
   @DF-UKS iter   2:   -38.47864120173085   -1.79665e-02   6.91663e-03 DIIS/ADIIS/DAMP=1%
   @DF-UKS iter   3:   -38.48096394528120   -2.32274e-03   1.83739e-03 DIIS/ADIIS/DAMP=1%
   @DF-UKS iter   4:   -38.48358374130415   -2.61980e-03   3.36617e-04 DIIS/ADIIS/DAMP=1%
   @DF-UKS iter   5:   -38.48316580578388    4.17936e-04   4.16098e-05 DIIS/DAMP=1%
   @DF-UKS iter   6:   -38.48321480892766   -4.90031e-05   9.58504e-06 DIIS/DAMP=1%
   @DF-UKS iter   7:   -38.48321276653519    2.04239e-06   2.02361e-06 DIIS/DAMP=1%
   @DF-UKS iter   8:   -38.48321289001485   -1.23480e-07   2.53681e-07 DIIS/DAMP=1%
   @DF-UKS iter   9:   -38.48321289543212   -5.41728e-09   2.85111e-08 DIIS/DAMP=1%
   @DF-UKS iter  10:   -38.48321289162659    3.80553e-09   2.47407e-09 DIIS/DAMP=1%
  Energy and wave function converged.


  ==> Post-Iterations <==

   Electrons on quadrature grid:
      Nalpha   =    3.9999999837 ; deviation = -1.634e-08
      Nbeta    =    2.9999999788 ; deviation = -2.122e-08
      Ntotal   =    6.9999999624 ; deviation = -3.756e-08 

   @Spin Contamination Metric:   2.620981712E-03
   @S^2 Expected:                7.500000000E-01
   @S^2 Observed:                7.526209817E-01
   @S   Expected:                5.000000000E-01
   @S   Observed:                5.000000000E-01

    Orbital Energies [Eh]
    ---------------------

    Alpha Occupied:                                                       

       1A1   -10.292976     2A1    -0.630956     3A1    -0.316457  
       1B1    -0.253650  

    Alpha Virtual:                                                        

       1B2    -0.140850     4A1     0.069918     2B1     0.453030  
       5A1     0.453416     2B2     0.480029     6A1     0.508212  
       7A1     0.708584     3B1     0.983092     3B2     0.989591  
       1A2     1.126094     8A1     1.135110     9A1     1.488914  
       4B1     1.680389     4B2     1.682022    10A1     2.218631  

    Beta Occupied:                                                        

       1A1   -10.278572     2A1    -0.586521     3A1    -0.296859  

    Beta Virtual:                                                         

       1B2    -0.123191     1B1    -0.075033     4A1     0.078074  
       5A1     0.460329     2B2     0.490226     6A1     0.518069  
       2B1     0.525551     7A1     0.734970     3B2     0.992601  
       3B1     1.020967     8A1     1.192135     1A2     1.193050  
       9A1     1.510003     4B2     1.683707     4B1     1.706628  
      10A1     2.224775  

    Final Occupation by Irrep:
             A1    A2    B1    B2 
    DOCC [     3,    0,    0,    0 ]
    SOCC [     0,    0,    1,    0 ]
    NA   [     3,    0,    1,    0 ]
    NB   [     3,    0,    0,    0 ]

  @DF-UKS Final Energy:   -38.48321289162659

   => Energetics <=

    Nuclear Repulsion Energy =              2.6458860533500004
    One-Electron Energy =                 -56.3287552593474885
    Two-Electron Energy =                  19.7335798878125921
    DFT Exchange-Correlation Energy =      -4.5339235734416974
    Empirical Dispersion Energy =           0.0000000000000000
    VV10 Nonlocal Energy =                  0.0000000000000000
    Total Energy =                        -38.4832128916265930

  UHF NO Occupations:
  HONO-2 :    2 A1 1.9998448
  HONO-1 :    3 A1 1.9988441
  HONO-0 :    1 B1 1.0000000
  LUNO+0 :    4 A1 0.0011559
  LUNO+1 :    5 A1 0.0001552
  LUNO+2 :    6 A1 0.0000001
  LUNO+3 :    7 A1 0.0000000


Computation Completed


Properties will be evaluated at   0.000000,   0.000000,   0.000000 [a0]

Properties computed using the SCF density matrix


 Multipole Moments:

 ------------------------------------------------------------------------------------
     Multipole            Electronic (a.u.)      Nuclear  (a.u.)        Total (a.u.)
 ------------------------------------------------------------------------------------

 L = 1.  Multiply by 2.5417464519 to convert [e a0] to [Debye]
 Dipole X            :          0.0000000            0.0000000            0.0000000
 Dipole Y            :          0.0000000            0.0000000            0.0000000
 Dipole Z            :         -0.5296561            1.0378031            0.5081469
 Magnitude           :                                                    0.5081469

 ------------------------------------------------------------------------------------

*** tstop() called on Joses-MacBook-Pro-2.local at Wed Jul 16 18:12:56 2025
Module time:
	user time   =       1.07 seconds =       0.02 minutes
	system time =       2.31 seconds =       0.04 minutes
	total time  =          1 seconds =       0.02 minutes
Total time:
	user time   =       1.07 seconds =       0.02 minutes
	system time =       2.31 seconds =       0.04 minutes
	total time  =          1 seconds =       0.02 minutes

*** tstart() called on Joses-MacBook-Pro-2.local
*** at Wed Jul 16 18:12:56 2025


         ------------------------------------------------------------
                                   SCF GRAD                          
                          Rob Parrish, Justin Turney,                
                       Andy Simmonett, and Alex Sokolov              
         ------------------------------------------------------------

  ==> Geometry <==

    Molecular point group: c2v
    Full point group: C_inf_v

    Geometry (in Angstrom), charge = 0, multiplicity = 2:

       Center              X                  Y                   Z               Mass       
    ------------   -----------------  -----------------  -----------------  -----------------
         H            0.000000000000     0.000000000000     1.107025960475     1.007825032230
         C            0.000000000000     0.000000000000    -0.092974039525    12.000000000000

  Nuclear repulsion =    2.645886053350000

  ==> Basis Set <==

  Basis Set: CC-PVDZ
    Blend: CC-PVDZ
    Number of shells: 9
    Number of basis functions: 19
    Number of Cartesian functions: 20
    Spherical Harmonics?: true
    Max angular momentum: 2

  ==> DFJKGrad: Density-Fitted SCF Gradients <==

    Gradient:                    1
    J tasked:                  Yes
    K tasked:                  Yes
    wK tasked:                  No
    OpenMP threads:              1
    Integrals threads:           1
    Memory [MiB]:              375
    Schwarz Cutoff:          1E-12
    Fitting Condition:       1E-10

   => Auxiliary Basis Set <=

  Basis Set: (CC-PVDZ AUX)
    Blend: CC-PVDZ-JKFIT
    Number of shells: 33
    Number of basis functions: 93
    Number of Cartesian functions: 106
    Spherical Harmonics?: true
    Max angular momentum: 3

  ==> DFT Potential <==

   => LibXC <=

    Version 6.2.2
    S. Lehtola, C. Steigemann, M. J.T. Oliveira, and M. A.L. Marques.,  SoftwareX 7, 1–5 (2018) (10.1016/j.softx.2017.11.002)

   => Composite Functional: B3LYP <= 

    B3LYP Hyb-GGA Exchange-Correlation Functional

    P. J. Stephens, F. J. Devlin, C. F. Chabalowski, and M. J. Frisch.,  J. Phys. Chem. 98, 11623 (1994) (10.1021/j100096a001)

    Deriv               =              1
    GGA                 =           TRUE
    Meta                =          FALSE

    Exchange Hybrid     =           TRUE
    MP2 Hybrid          =          FALSE

   => Exchange Functionals <=

    0.0800   Slater exchange
    0.7200         Becke 88

   => Exact (HF) Exchange <=

    0.2000               HF 

   => Correlation Functionals <=

    0.1900   Vosko, Wilk & Nusair (VWN5_RPA)
    0.8100   Lee, Yang & Parr

   => LibXC Density Thresholds  <==

    XC_HYB_GGA_XC_B3LYP:  1.00E-15 

   => Molecular Quadrature <=

    Radial Scheme          =       TREUTLER
    Pruning Scheme         =           NONE
    Nuclear Scheme         =       TREUTLER

    Blocking Scheme        =         OCTREE
    BS radius alpha        =              1
    Pruning alpha          =              1
    Radial Points          =             75
    Spherical Points       =            302
    Total Points           =          43742
    Total Blocks           =            387
    Max Points             =            255
    Max Functions          =             19
    Weights Tolerance      =       1.00E-15


  -Total Gradient:
     Atom            X                  Y                   Z
    ------   -----------------  -----------------  -----------------
       1        0.000000000000     0.000000000000     0.025463805409
       2        0.000000000000     0.000000000000    -0.025463652561


*** tstop() called on Joses-MacBook-Pro-2.local at Wed Jul 16 18:12:56 2025
Module time:
	user time   =       0.33 seconds =       0.01 minutes
	system time =       0.78 seconds =       0.01 minutes
	total time  =          0 seconds =       0.00 minutes
Total time:
	user time   =       1.40 seconds =       0.02 minutes
	system time =       3.09 seconds =       0.05 minutes
	total time  =          1 seconds =       0.02 minutes

    			-----------------------------------------

    			 OPTKING 3.0: for geometry optimizations 

    			     By R.A. King, Bethel University     

    			        with contributions from          

    			    A.V. Copan, J. Cayton, A. Heide      

    			-----------------------------------------

    
	                            ===> Fragment 1 <== 

	 Z (Atomic Numbers)          Masses                          Geom                  
	       1.000000             1.007825          0.00000000  0.00000000  2.09197588   
	       6.000000            12.000000          0.00000000  0.00000000 -0.17569547   

	 - Coordinate -           - BOHR/RAD -       - ANG/DEG -
	 R(1,2)           =         2.267671           1.200000


	        --- Internal Coordinate Step in ANG or DEG, aJ/ANG or AJ/DEG ---
	-------------------------------------------------------------------------------
	           Coordinate      Previous         Force          Change          New 
	           ----------      --------        ------          ------        ------
	               R(1,2)       1.20000       -0.20979       -0.05406       1.14594
	-------------------------------------------------------------------------------

	                                 ==> Convergence Check <==                                  
    
	Measures of convergence in internal coordinates in au.
    
	Criteria marked as inactive (o), active & met (*), and active & unmet ( ).

	----------------------------------------------------------------------------------------------
	   Step    Total Energy     Delta E     Max Force     RMS Force      Max Disp      RMS Disp   
	----------------------------------------------------------------------------------------------
	  Convergence Criteria     1.00e-06 *    3.00e-04 *             o    1.20e-03 *             o
	----------------------------------------------------------------------------------------------
	     1     -38.48321289   -3.85e+01      2.55e-02      2.55e-02 o    1.02e-01      1.02e-01 o  ~
	----------------------------------------------------------------------------------------------

Next Geometry in Ang 
	Fragment 1 (Ang)

	    H   0.0000000000   0.0000000000   1.0799956718
	    C   0.0000000000   0.0000000000  -0.0659437509


    Structure for next step:
    Molecular point group: c2v
    Full point group: C_inf_v

    Geometry (in Angstrom), charge = 0, multiplicity = 2:

    H            0.000000000000     0.000000000000     1.057153908357
    C            0.000000000000     0.000000000000    -0.088785514313


Scratch directory: /tmp/
gradient() will perform analytic gradient computation.
   => Libint2 <=

    Primary   basis highest AM E, G, H:  6, 6, 3
    Auxiliary basis highest AM E, G, H:  7, 7, 4
    Onebody   basis highest AM E, G, H:  -, -, -
    Solid Harmonics ordering:            Gaussian

*** tstart() called on Joses-MacBook-Pro-2.local
*** at Wed Jul 16 18:12:56 2025

   => Loading Basis Set <=

    Name: CC-PVDZ
    Role: ORBITAL
    Keyword: BASIS
    atoms 1 entry H          line    22 file /Users/joseantoniorodriguesromero/anaconda3/share/psi4/basis/cc-pvdz.gbs 
    atoms 2 entry C          line   138 file /Users/joseantoniorodriguesromero/anaconda3/share/psi4/basis/cc-pvdz.gbs 


         ---------------------------------------------------------
                                   SCF
               by Justin Turney, Rob Parrish, Andy Simmonett
                          and Daniel G. A. Smith
                              UKS Reference
                        1 Threads,    500 MiB Core
         ---------------------------------------------------------

  ==> Geometry <==

    Molecular point group: c2v
    Full point group: C_inf_v

    Geometry (in Angstrom), charge = 0, multiplicity = 2:

       Center              X                  Y                   Z               Mass       
    ------------   -----------------  -----------------  -----------------  -----------------
         H            0.000000000000     0.000000000000     1.057153908357     1.007825032230
         C            0.000000000000     0.000000000000    -0.088785514313    12.000000000000

  Running in c2v symmetry.

  Rotational constants: A = ************  B =     13.80739  C =     13.80739 [cm^-1]
  Rotational constants: A = ************  B = 413935.02740  C = 413935.02740 [MHz]
  Nuclear repulsion =    2.770707771464676

  Charge       = 0
  Multiplicity = 2
  Electrons    = 7
  Nalpha       = 4
  Nbeta        = 3

  ==> Algorithm <==

  SCF Algorithm Type is DF.
  DIIS enabled.
  MOM disabled.
  Fractional occupation disabled.
  Guess Type is READ.
  Energy threshold   = 1.00e-08
  Density threshold  = 1.00e-08
  Integral threshold = 1.00e-12

  ==> Primary Basis <==

  Basis Set: CC-PVDZ
    Blend: CC-PVDZ
    Number of shells: 9
    Number of basis functions: 19
    Number of Cartesian functions: 20
    Spherical Harmonics?: true
    Max angular momentum: 2

  ==> DFT Potential <==

   => LibXC <=

    Version 6.2.2
    S. Lehtola, C. Steigemann, M. J.T. Oliveira, and M. A.L. Marques.,  SoftwareX 7, 1–5 (2018) (10.1016/j.softx.2017.11.002)

   => Composite Functional: B3LYP <= 

    B3LYP Hyb-GGA Exchange-Correlation Functional

    P. J. Stephens, F. J. Devlin, C. F. Chabalowski, and M. J. Frisch.,  J. Phys. Chem. 98, 11623 (1994) (10.1021/j100096a001)

    Deriv               =              1
    GGA                 =           TRUE
    Meta                =          FALSE

    Exchange Hybrid     =           TRUE
    MP2 Hybrid          =          FALSE

   => Exchange Functionals <=

    0.0800   Slater exchange
    0.7200         Becke 88

   => Exact (HF) Exchange <=

    0.2000               HF 

   => Correlation Functionals <=

    0.1900   Vosko, Wilk & Nusair (VWN5_RPA)
    0.8100   Lee, Yang & Parr

   => LibXC Density Thresholds  <==

    XC_HYB_GGA_XC_B3LYP:  1.00E-15 

   => Molecular Quadrature <=

    Radial Scheme          =       TREUTLER
    Pruning Scheme         =           NONE
    Nuclear Scheme         =       TREUTLER

    Blocking Scheme        =         OCTREE
    BS radius alpha        =              1
    Pruning alpha          =              1
    Radial Points          =             75
    Spherical Points       =            302
    Total Points           =          43733
    Total Blocks           =            387
    Max Points             =            253
    Max Functions          =             19
    Weights Tolerance      =       1.00E-15

   => Loading Basis Set <=

    Name: (CC-PVDZ AUX)
    Role: JKFIT
    Keyword: DF_BASIS_SCF
    atoms 1 entry H          line    51 file /Users/joseantoniorodriguesromero/anaconda3/share/psi4/basis/cc-pvdz-jkfit.gbs 
    atoms 2 entry C          line   121 file /Users/joseantoniorodriguesromero/anaconda3/share/psi4/basis/cc-pvdz-jkfit.gbs 

   => Loading Basis Set <=

    Name: CC-PVDZ
    Role: ORBITAL
    Keyword: BASIS
    atoms 1 entry H          line    22 file /Users/joseantoniorodriguesromero/anaconda3/share/psi4/basis/cc-pvdz.gbs 
    atoms 2 entry C          line   138 file /Users/joseantoniorodriguesromero/anaconda3/share/psi4/basis/cc-pvdz.gbs 

  Reading orbitals from file /tmp/doublet_HC.default.68094.180.npy, no projection.

  ==> Integral Setup <==

  DFHelper Memory: AOs need 0.000 GiB; user supplied 0.342 GiB. 
  Using in-core AOs.

  ==> MemDFJK: Density-Fitted J/K Matrices <==

    J tasked:                   Yes
    K tasked:                   Yes
    wK tasked:                   No
    OpenMP threads:               1
    Memory [MiB]:               349
    Algorithm:                 Core
    Schwarz Cutoff:           1E-12
    Mask sparsity (%):       0.0000
    Fitting Condition:        1E-10

   => Auxiliary Basis Set <=

  Basis Set: (CC-PVDZ AUX)
    Blend: CC-PVDZ-JKFIT
    Number of shells: 33
    Number of basis functions: 93
    Number of Cartesian functions: 106
    Spherical Harmonics?: true
    Max angular momentum: 3

  Cached 100.0% of DFT collocation blocks in 0.024 [GiB].

  Minimum eigenvalue in the overlap matrix is 3.9875343122E-02.
  Reciprocal condition number of the overlap matrix is 1.3133790826E-02.
    Using symmetric orthogonalization.

  ==> Pre-Iterations <==

  SCF Guess: Orbitals guess was supplied from a previous computation.

   -------------------------------------------------------
    Irrep   Nso     Nmo     Nalpha   Nbeta   Ndocc  Nsocc
   -------------------------------------------------------
     A1        10      10       3       3       3       0
     A2         1       1       0       0       0       0
     B1         4       4       1       0       0       1
     B2         4       4       0       0       0       0
   -------------------------------------------------------
    Total      19      19       4       3       3       1
   -------------------------------------------------------

  ==> Iterations <==

                           Total Energy        Delta E     RMS |[F,P]|

   @DF-UKS iter   0:   -38.49978915936925   -3.84998e+01   5.94400e-03 
   @DF-UKS iter   1:   -38.48459013474519    1.51990e-02   1.00129e-03 DIIS/ADIIS
   @DF-UKS iter   2:   -38.48466920792252   -7.90732e-05   4.21570e-04 DIIS/ADIIS/DAMP=1%
   @DF-UKS iter   3:   -38.48463294610679    3.62618e-05   8.10195e-05 DIIS/DAMP=1%
   @DF-UKS iter   4:   -38.48470379454918   -7.08484e-05   3.63114e-06 DIIS/DAMP=1%
   @DF-UKS iter   5:   -38.48468595533839    1.78392e-05   9.54778e-07 DIIS/DAMP=1%
   @DF-UKS iter   6:   -38.48468655575427   -6.00416e-07   2.67698e-07 DIIS/DAMP=1%
   @DF-UKS iter   7:   -38.48468634618059    2.09574e-07   3.34509e-08 DIIS/DAMP=1%
   @DF-UKS iter   8:   -38.48468639795213   -5.17715e-08   2.64336e-09 DIIS/DAMP=1%
   @DF-UKS iter   9:   -38.48468639190210    6.05003e-09   2.17346e-10 DIIS/DAMP=1%
  Energy and wave function converged.


  ==> Post-Iterations <==

   Electrons on quadrature grid:
      Nalpha   =    3.9999999823 ; deviation = -1.767e-08
      Nbeta    =    2.9999999770 ; deviation = -2.305e-08
      Ntotal   =    6.9999999593 ; deviation = -4.072e-08 

   @Spin Contamination Metric:   2.514686447E-03
   @S^2 Expected:                7.500000000E-01
   @S^2 Observed:                7.525146864E-01
   @S   Expected:                5.000000000E-01
   @S   Observed:                5.000000000E-01

    Orbital Energies [Eh]
    ---------------------

    Alpha Occupied:                                                       

       1A1   -10.287030     2A1    -0.641355     3A1    -0.316493  
       1B1    -0.252472  

    Alpha Virtual:                                                        

       1B2    -0.139959     4A1     0.079815     2B1     0.454616  
       5A1     0.458352     2B2     0.481572     6A1     0.516710  
       7A1     0.722254     3B1     0.985512     3B2     0.991979  
       1A2     1.127205     8A1     1.136212     9A1     1.537211  
       4B1     1.714219     4B2     1.715728    10A1     2.287375  

    Beta Occupied:                                                        

       1A1   -10.272708     2A1    -0.598030     3A1    -0.295750  

    Beta Virtual:                                                         

       1B2    -0.122320     1B1    -0.074324     4A1     0.087208  
       5A1     0.466981     2B2     0.491768     6A1     0.526534  
       2B1     0.526996     7A1     0.748210     3B2     0.995160  
       3B1     1.024284     8A1     1.193365     1A2     1.194088  
       9A1     1.558648     4B2     1.717695     4B1     1.741196  
      10A1     2.293413  

    Final Occupation by Irrep:
             A1    A2    B1    B2 
    DOCC [     3,    0,    0,    0 ]
    SOCC [     0,    0,    1,    0 ]
    NA   [     3,    0,    1,    0 ]
    NB   [     3,    0,    0,    0 ]

  @DF-UKS Final Energy:   -38.48468639190210

   => Energetics <=

    Nuclear Repulsion Energy =              2.7707077714646755
    One-Electron Energy =                 -56.5639029442901276
    Two-Electron Energy =                  19.8561768205029203
    DFT Exchange-Correlation Energy =      -4.5476680395795750
    Empirical Dispersion Energy =           0.0000000000000000
    VV10 Nonlocal Energy =                  0.0000000000000000
    Total Energy =                        -38.4846863919021018

  UHF NO Occupations:
  HONO-2 :    2 A1 1.9998773
  HONO-1 :    3 A1 1.9988648
  HONO-0 :    1 B1 1.0000000
  LUNO+0 :    4 A1 0.0011352
  LUNO+1 :    5 A1 0.0001227
  LUNO+2 :    6 A1 0.0000001
  LUNO+3 :    7 A1 0.0000000


Computation Completed


Properties will be evaluated at   0.000000,   0.000000,   0.000000 [a0]

Properties computed using the SCF density matrix


 Multipole Moments:

 ------------------------------------------------------------------------------------
     Multipole            Electronic (a.u.)      Nuclear  (a.u.)        Total (a.u.)
 ------------------------------------------------------------------------------------

 L = 1.  Multiply by 2.5417464519 to convert [e a0] to [Debye]
 Dipole X            :          0.0000000            0.0000000            0.0000000
 Dipole Y            :          0.0000000            0.0000000            0.0000000
 Dipole Z            :         -0.4397979            0.9910495            0.5512516
 Magnitude           :                                                    0.5512516

 ------------------------------------------------------------------------------------

*** tstop() called on Joses-MacBook-Pro-2.local at Wed Jul 16 18:12:56 2025
Module time:
	user time   =       0.90 seconds =       0.01 minutes
	system time =       2.98 seconds =       0.05 minutes
	total time  =          0 seconds =       0.00 minutes
Total time:
	user time   =       2.33 seconds =       0.04 minutes
	system time =       6.28 seconds =       0.10 minutes
	total time  =          1 seconds =       0.02 minutes

*** tstart() called on Joses-MacBook-Pro-2.local
*** at Wed Jul 16 18:12:56 2025


         ------------------------------------------------------------
                                   SCF GRAD                          
                          Rob Parrish, Justin Turney,                
                       Andy Simmonett, and Alex Sokolov              
         ------------------------------------------------------------

  ==> Geometry <==

    Molecular point group: c2v
    Full point group: C_inf_v

    Geometry (in Angstrom), charge = 0, multiplicity = 2:

       Center              X                  Y                   Z               Mass       
    ------------   -----------------  -----------------  -----------------  -----------------
         H            0.000000000000     0.000000000000     1.057153908357     1.007825032230
         C            0.000000000000     0.000000000000    -0.088785514313    12.000000000000

  Nuclear repulsion =    2.770707771464676

  ==> Basis Set <==

  Basis Set: CC-PVDZ
    Blend: CC-PVDZ
    Number of shells: 9
    Number of basis functions: 19
    Number of Cartesian functions: 20
    Spherical Harmonics?: true
    Max angular momentum: 2

  ==> DFJKGrad: Density-Fitted SCF Gradients <==

    Gradient:                    1
    J tasked:                  Yes
    K tasked:                  Yes
    wK tasked:                  No
    OpenMP threads:              1
    Integrals threads:           1
    Memory [MiB]:              375
    Schwarz Cutoff:          1E-12
    Fitting Condition:       1E-10

   => Auxiliary Basis Set <=

  Basis Set: (CC-PVDZ AUX)
    Blend: CC-PVDZ-JKFIT
    Number of shells: 33
    Number of basis functions: 93
    Number of Cartesian functions: 106
    Spherical Harmonics?: true
    Max angular momentum: 3

  ==> DFT Potential <==

   => LibXC <=

    Version 6.2.2
    S. Lehtola, C. Steigemann, M. J.T. Oliveira, and M. A.L. Marques.,  SoftwareX 7, 1–5 (2018) (10.1016/j.softx.2017.11.002)

   => Composite Functional: B3LYP <= 

    B3LYP Hyb-GGA Exchange-Correlation Functional

    P. J. Stephens, F. J. Devlin, C. F. Chabalowski, and M. J. Frisch.,  J. Phys. Chem. 98, 11623 (1994) (10.1021/j100096a001)

    Deriv               =              1
    GGA                 =           TRUE
    Meta                =          FALSE

    Exchange Hybrid     =           TRUE
    MP2 Hybrid          =          FALSE

   => Exchange Functionals <=

    0.0800   Slater exchange
    0.7200         Becke 88

   => Exact (HF) Exchange <=

    0.2000               HF 

   => Correlation Functionals <=

    0.1900   Vosko, Wilk & Nusair (VWN5_RPA)
    0.8100   Lee, Yang & Parr

   => LibXC Density Thresholds  <==

    XC_HYB_GGA_XC_B3LYP:  1.00E-15 

   => Molecular Quadrature <=

    Radial Scheme          =       TREUTLER
    Pruning Scheme         =           NONE
    Nuclear Scheme         =       TREUTLER

    Blocking Scheme        =         OCTREE
    BS radius alpha        =              1
    Pruning alpha          =              1
    Radial Points          =             75
    Spherical Points       =            302
    Total Points           =          43733
    Total Blocks           =            387
    Max Points             =            253
    Max Functions          =             19
    Weights Tolerance      =       1.00E-15


  -Total Gradient:
     Atom            X                  Y                   Z
    ------   -----------------  -----------------  -----------------
       1        0.000000000000    -0.000000000000     0.002112825847
       2       -0.000000000000     0.000000000000    -0.002112759457


*** tstop() called on Joses-MacBook-Pro-2.local at Wed Jul 16 18:12:57 2025
Module time:
	user time   =       0.33 seconds =       0.01 minutes
	system time =       0.75 seconds =       0.01 minutes
	total time  =          1 seconds =       0.02 minutes
Total time:
	user time   =       2.66 seconds =       0.04 minutes
	system time =       7.03 seconds =       0.12 minutes
	total time  =          2 seconds =       0.03 minutes

    			-----------------------------------------

    			 OPTKING 3.0: for geometry optimizations 

    			     By R.A. King, Bethel University     

    			        with contributions from          

    			    A.V. Copan, J. Cayton, A. Heide      

    			-----------------------------------------

    
	                            ===> Fragment 1 <== 

	 Z (Atomic Numbers)          Masses                          Geom                  
	       1.000000             1.007825          0.00000000  0.00000000  1.99773136   
	       6.000000            12.000000          0.00000000  0.00000000 -0.16778031   

	 - Coordinate -           - BOHR/RAD -       - ANG/DEG -
	 R(1,2)           =         2.165512           1.145939


	        --- Internal Coordinate Step in ANG or DEG, aJ/ANG or AJ/DEG ---
	-------------------------------------------------------------------------------
	           Coordinate      Previous         Force          Change          New 
	           ----------      --------        ------          ------        ------
	               R(1,2)       1.14594       -0.01741       -0.00489       1.14105
	-------------------------------------------------------------------------------

	                                 ==> Convergence Check <==                                  
    
	Measures of convergence in internal coordinates in au.
    
	Criteria marked as inactive (o), active & met (*), and active & unmet ( ).

	----------------------------------------------------------------------------------------------
	   Step    Total Energy     Delta E     Max Force     RMS Force      Max Disp      RMS Disp   
	----------------------------------------------------------------------------------------------
	  Convergence Criteria     1.00e-06 *    3.00e-04 *             o    1.20e-03 *             o
	----------------------------------------------------------------------------------------------
	     2     -38.48468639   -1.47e-03      2.11e-03      2.11e-03 o    9.24e-03      9.24e-03 o  ~
	----------------------------------------------------------------------------------------------

Next Geometry in Ang 
	Fragment 1 (Ang)

	    H   0.0000000000   0.0000000000   1.0547084168
	    C   0.0000000000   0.0000000000  -0.0863400228


    Structure for next step:
    Molecular point group: c2v
    Full point group: C_inf_v

    Geometry (in Angstrom), charge = 0, multiplicity = 2:

    H            0.000000000000     0.000000000000     1.052641870703
    C            0.000000000000     0.000000000000    -0.088406568939


Scratch directory: /tmp/
gradient() will perform analytic gradient computation.
   => Libint2 <=

    Primary   basis highest AM E, G, H:  6, 6, 3
    Auxiliary basis highest AM E, G, H:  7, 7, 4
    Onebody   basis highest AM E, G, H:  -, -, -
    Solid Harmonics ordering:            Gaussian

*** tstart() called on Joses-MacBook-Pro-2.local
*** at Wed Jul 16 18:12:57 2025

   => Loading Basis Set <=

    Name: CC-PVDZ
    Role: ORBITAL
    Keyword: BASIS
    atoms 1 entry H          line    22 file /Users/joseantoniorodriguesromero/anaconda3/share/psi4/basis/cc-pvdz.gbs 
    atoms 2 entry C          line   138 file /Users/joseantoniorodriguesromero/anaconda3/share/psi4/basis/cc-pvdz.gbs 


         ---------------------------------------------------------
                                   SCF
               by Justin Turney, Rob Parrish, Andy Simmonett
                          and Daniel G. A. Smith
                              UKS Reference
                        1 Threads,    500 MiB Core
         ---------------------------------------------------------

  ==> Geometry <==

    Molecular point group: c2v
    Full point group: C_inf_v

    Geometry (in Angstrom), charge = 0, multiplicity = 2:

       Center              X                  Y                   Z               Mass       
    ------------   -----------------  -----------------  -----------------  -----------------
         H            0.000000000000     0.000000000000     1.052641870703     1.007825032230
         C            0.000000000000     0.000000000000    -0.088406568939    12.000000000000

  Running in c2v symmetry.

  Rotational constants: A = ************  B =     13.92601  C =     13.92601 [cm^-1]
  Rotational constants: A = ************  B = 417491.20982  C = 417491.20982 [MHz]
  Nuclear repulsion =    2.782584116251016

  Charge       = 0
  Multiplicity = 2
  Electrons    = 7
  Nalpha       = 4
  Nbeta        = 3

  ==> Algorithm <==

  SCF Algorithm Type is DF.
  DIIS enabled.
  MOM disabled.
  Fractional occupation disabled.
  Guess Type is READ.
  Energy threshold   = 1.00e-08
  Density threshold  = 1.00e-08
  Integral threshold = 1.00e-12

  ==> Primary Basis <==

  Basis Set: CC-PVDZ
    Blend: CC-PVDZ
    Number of shells: 9
    Number of basis functions: 19
    Number of Cartesian functions: 20
    Spherical Harmonics?: true
    Max angular momentum: 2

  ==> DFT Potential <==

   => LibXC <=

    Version 6.2.2
    S. Lehtola, C. Steigemann, M. J.T. Oliveira, and M. A.L. Marques.,  SoftwareX 7, 1–5 (2018) (10.1016/j.softx.2017.11.002)

   => Composite Functional: B3LYP <= 

    B3LYP Hyb-GGA Exchange-Correlation Functional

    P. J. Stephens, F. J. Devlin, C. F. Chabalowski, and M. J. Frisch.,  J. Phys. Chem. 98, 11623 (1994) (10.1021/j100096a001)

    Deriv               =              1
    GGA                 =           TRUE
    Meta                =          FALSE

    Exchange Hybrid     =           TRUE
    MP2 Hybrid          =          FALSE

   => Exchange Functionals <=

    0.0800   Slater exchange
    0.7200         Becke 88

   => Exact (HF) Exchange <=

    0.2000               HF 

   => Correlation Functionals <=

    0.1900   Vosko, Wilk & Nusair (VWN5_RPA)
    0.8100   Lee, Yang & Parr

   => LibXC Density Thresholds  <==

    XC_HYB_GGA_XC_B3LYP:  1.00E-15 

   => Molecular Quadrature <=

    Radial Scheme          =       TREUTLER
    Pruning Scheme         =           NONE
    Nuclear Scheme         =       TREUTLER

    Blocking Scheme        =         OCTREE
    BS radius alpha        =              1
    Pruning alpha          =              1
    Radial Points          =             75
    Spherical Points       =            302
    Total Points           =          43733
    Total Blocks           =            388
    Max Points             =            255
    Max Functions          =             19
    Weights Tolerance      =       1.00E-15

   => Loading Basis Set <=

    Name: (CC-PVDZ AUX)
    Role: JKFIT
    Keyword: DF_BASIS_SCF
    atoms 1 entry H          line    51 file /Users/joseantoniorodriguesromero/anaconda3/share/psi4/basis/cc-pvdz-jkfit.gbs 
    atoms 2 entry C          line   121 file /Users/joseantoniorodriguesromero/anaconda3/share/psi4/basis/cc-pvdz-jkfit.gbs 

   => Loading Basis Set <=

    Name: CC-PVDZ
    Role: ORBITAL
    Keyword: BASIS
    atoms 1 entry H          line    22 file /Users/joseantoniorodriguesromero/anaconda3/share/psi4/basis/cc-pvdz.gbs 
    atoms 2 entry C          line   138 file /Users/joseantoniorodriguesromero/anaconda3/share/psi4/basis/cc-pvdz.gbs 

  Reading orbitals from file /tmp/doublet_HC.default.68094.180.npy, no projection.

  ==> Integral Setup <==

  DFHelper Memory: AOs need 0.000 GiB; user supplied 0.342 GiB. 
  Using in-core AOs.

  ==> MemDFJK: Density-Fitted J/K Matrices <==

    J tasked:                   Yes
    K tasked:                   Yes
    wK tasked:                   No
    OpenMP threads:               1
    Memory [MiB]:               349
    Algorithm:                 Core
    Schwarz Cutoff:           1E-12
    Mask sparsity (%):       0.0000
    Fitting Condition:        1E-10

   => Auxiliary Basis Set <=

  Basis Set: (CC-PVDZ AUX)
    Blend: CC-PVDZ-JKFIT
    Number of shells: 33
    Number of basis functions: 93
    Number of Cartesian functions: 106
    Spherical Harmonics?: true
    Max angular momentum: 3

  Cached 100.0% of DFT collocation blocks in 0.024 [GiB].

  Minimum eigenvalue in the overlap matrix is 3.9495307995E-02.
  Reciprocal condition number of the overlap matrix is 1.2993675056E-02.
    Using symmetric orthogonalization.

  ==> Pre-Iterations <==

  SCF Guess: Orbitals guess was supplied from a previous computation.

   -------------------------------------------------------
    Irrep   Nso     Nmo     Nalpha   Nbeta   Ndocc  Nsocc
   -------------------------------------------------------
     A1        10      10       3       3       3       0
     A2         1       1       0       0       0       0
     B1         4       4       1       0       0       1
     B2         4       4       0       0       0       0
   -------------------------------------------------------
    Total      19      19       4       3       3       1
   -------------------------------------------------------

  ==> Iterations <==

                           Total Energy        Delta E     RMS |[F,P]|

   @DF-UKS iter   0:   -38.48604944160196   -3.84860e+01   5.66723e-04 
   @DF-UKS iter   1:   -38.48469360171529    1.35584e-03   8.99444e-05 DIIS
   @DF-UKS iter   2:   -38.48469424465569   -6.42940e-07   3.67523e-05 DIIS/DAMP=1%
   @DF-UKS iter   3:   -38.48469002935447    4.21530e-06   7.01835e-06 DIIS/DAMP=1%
   @DF-UKS iter   4:   -38.48469587898982   -5.84964e-06   3.10649e-07 DIIS/DAMP=1%
   @DF-UKS iter   5:   -38.48469433640063    1.54259e-06   7.49505e-08 DIIS/DAMP=1%
   @DF-UKS iter   6:   -38.48469438802442   -5.16238e-08   2.00951e-08 DIIS/DAMP=1%
   @DF-UKS iter   7:   -38.48469437155637    1.64680e-08   2.97363e-09 DIIS/DAMP=1%
   @DF-UKS iter   8:   -38.48469437545543   -3.89905e-09   2.42243e-10 DIIS/DAMP=1%
  Energy and wave function converged.


  ==> Post-Iterations <==

   Electrons on quadrature grid:
      Nalpha   =    3.9999999825 ; deviation = -1.746e-08
      Nbeta    =    2.9999999772 ; deviation = -2.276e-08
      Ntotal   =    6.9999999598 ; deviation = -4.022e-08 

   @Spin Contamination Metric:   2.505952413E-03
   @S^2 Expected:                7.500000000E-01
   @S^2 Observed:                7.525059524E-01
   @S   Expected:                5.000000000E-01
   @S   Observed:                5.000000000E-01

    Orbital Energies [Eh]
    ---------------------

    Alpha Occupied:                                                       

       1A1   -10.286487     2A1    -0.642366     3A1    -0.316482  
       1B1    -0.252377  

    Alpha Virtual:                                                        

       1B2    -0.139890     4A1     0.080647     2B1     0.454748  
       5A1     0.458702     2B2     0.481699     6A1     0.517721  
       7A1     0.723616     3B1     0.985831     3B2     0.992298  
       1A2     1.127296     8A1     1.136302     9A1     1.541509  
       4B1     1.717320     4B2     1.718817    10A1     2.294655  

    Beta Occupied:                                                        

       1A1   -10.272172     2A1    -0.599136     3A1    -0.295639  

    Beta Virtual:                                                         

       1B2    -0.122251     1B1    -0.074269     4A1     0.087969  
       5A1     0.467460     2B2     0.491893     2B1     0.527111  
       6A1     0.527574     7A1     0.749530     3B2     0.995498  
       3B1     1.024696     8A1     1.193466     1A2     1.194173  
       9A1     1.562969     4B2     1.720809     4B1     1.744360  
      10A1     2.300690  

    Final Occupation by Irrep:
             A1    A2    B1    B2 
    DOCC [     3,    0,    0,    0 ]
    SOCC [     0,    0,    1,    0 ]
    NA   [     3,    0,    1,    0 ]
    NB   [     3,    0,    0,    0 ]

  @DF-UKS Final Energy:   -38.48469437545543

   => Energetics <=

    Nuclear Repulsion Energy =              2.7825841162510159
    One-Electron Energy =                 -56.5859443340436457
    Two-Electron Energy =                  19.8676329695365155
    DFT Exchange-Correlation Energy =      -4.5489671271993117
    Empirical Dispersion Energy =           0.0000000000000000
    VV10 Nonlocal Energy =                  0.0000000000000000
    Total Energy =                        -38.4846943754554260

  UHF NO Occupations:
  HONO-2 :    2 A1 1.9998798
  HONO-1 :    3 A1 1.9988667
  HONO-0 :    1 B1 1.0000000
  LUNO+0 :    4 A1 0.0011333
  LUNO+1 :    5 A1 0.0001202
  LUNO+2 :    6 A1 0.0000001
  LUNO+3 :    7 A1 0.0000000


Computation Completed


Properties will be evaluated at   0.000000,   0.000000,   0.000000 [a0]

Properties computed using the SCF density matrix


 Multipole Moments:

 ------------------------------------------------------------------------------------
     Multipole            Electronic (a.u.)      Nuclear  (a.u.)        Total (a.u.)
 ------------------------------------------------------------------------------------

 L = 1.  Multiply by 2.5417464519 to convert [e a0] to [Debye]
 Dipole X            :          0.0000000            0.0000000            0.0000000
 Dipole Y            :          0.0000000            0.0000000            0.0000000
 Dipole Z            :         -0.4317856            0.9868196            0.5550341
 Magnitude           :                                                    0.5550341

 ------------------------------------------------------------------------------------

*** tstop() called on Joses-MacBook-Pro-2.local at Wed Jul 16 18:12:57 2025
Module time:
	user time   =       0.86 seconds =       0.01 minutes
	system time =       3.08 seconds =       0.05 minutes
	total time  =          0 seconds =       0.00 minutes
Total time:
	user time   =       3.55 seconds =       0.06 minutes
	system time =      10.32 seconds =       0.17 minutes
	total time  =          2 seconds =       0.03 minutes

*** tstart() called on Joses-MacBook-Pro-2.local
*** at Wed Jul 16 18:12:57 2025


         ------------------------------------------------------------
                                   SCF GRAD                          
                          Rob Parrish, Justin Turney,                
                       Andy Simmonett, and Alex Sokolov              
         ------------------------------------------------------------

  ==> Geometry <==

    Molecular point group: c2v
    Full point group: C_inf_v

    Geometry (in Angstrom), charge = 0, multiplicity = 2:

       Center              X                  Y                   Z               Mass       
    ------------   -----------------  -----------------  -----------------  -----------------
         H            0.000000000000     0.000000000000     1.052641870703     1.007825032230
         C            0.000000000000     0.000000000000    -0.088406568939    12.000000000000

  Nuclear repulsion =    2.782584116251016

  ==> Basis Set <==

  Basis Set: CC-PVDZ
    Blend: CC-PVDZ
    Number of shells: 9
    Number of basis functions: 19
    Number of Cartesian functions: 20
    Spherical Harmonics?: true
    Max angular momentum: 2

  ==> DFJKGrad: Density-Fitted SCF Gradients <==

    Gradient:                    1
    J tasked:                  Yes
    K tasked:                  Yes
    wK tasked:                  No
    OpenMP threads:              1
    Integrals threads:           1
    Memory [MiB]:              375
    Schwarz Cutoff:          1E-12
    Fitting Condition:       1E-10

   => Auxiliary Basis Set <=

  Basis Set: (CC-PVDZ AUX)
    Blend: CC-PVDZ-JKFIT
    Number of shells: 33
    Number of basis functions: 93
    Number of Cartesian functions: 106
    Spherical Harmonics?: true
    Max angular momentum: 3

  ==> DFT Potential <==

   => LibXC <=

    Version 6.2.2
    S. Lehtola, C. Steigemann, M. J.T. Oliveira, and M. A.L. Marques.,  SoftwareX 7, 1–5 (2018) (10.1016/j.softx.2017.11.002)

   => Composite Functional: B3LYP <= 

    B3LYP Hyb-GGA Exchange-Correlation Functional

    P. J. Stephens, F. J. Devlin, C. F. Chabalowski, and M. J. Frisch.,  J. Phys. Chem. 98, 11623 (1994) (10.1021/j100096a001)

    Deriv               =              1
    GGA                 =           TRUE
    Meta                =          FALSE

    Exchange Hybrid     =           TRUE
    MP2 Hybrid          =          FALSE

   => Exchange Functionals <=

    0.0800   Slater exchange
    0.7200         Becke 88

   => Exact (HF) Exchange <=

    0.2000               HF 

   => Correlation Functionals <=

    0.1900   Vosko, Wilk & Nusair (VWN5_RPA)
    0.8100   Lee, Yang & Parr

   => LibXC Density Thresholds  <==

    XC_HYB_GGA_XC_B3LYP:  1.00E-15 

   => Molecular Quadrature <=

    Radial Scheme          =       TREUTLER
    Pruning Scheme         =           NONE
    Nuclear Scheme         =       TREUTLER

    Blocking Scheme        =         OCTREE
    BS radius alpha        =              1
    Pruning alpha          =              1
    Radial Points          =             75
    Spherical Points       =            302
    Total Points           =          43733
    Total Blocks           =            388
    Max Points             =            255
    Max Functions          =             19
    Weights Tolerance      =       1.00E-15


  -Total Gradient:
     Atom            X                  Y                   Z
    ------   -----------------  -----------------  -----------------
       1        0.000000000000     0.000000000000    -0.000397868157
       2        0.000000000000     0.000000000000     0.000397931683


*** tstop() called on Joses-MacBook-Pro-2.local at Wed Jul 16 18:12:57 2025
Module time:
	user time   =       0.32 seconds =       0.01 minutes
	system time =       0.74 seconds =       0.01 minutes
	total time  =          0 seconds =       0.00 minutes
Total time:
	user time   =       3.87 seconds =       0.06 minutes
	system time =      11.06 seconds =       0.18 minutes
	total time  =          2 seconds =       0.03 minutes

    			-----------------------------------------

    			 OPTKING 3.0: for geometry optimizations 

    			     By R.A. King, Bethel University     

    			        with contributions from          

    			    A.V. Copan, J. Cayton, A. Heide      

    			-----------------------------------------

    
	                            ===> Fragment 1 <== 

	 Z (Atomic Numbers)          Masses                          Geom                  
	       1.000000             1.007825          0.00000000  0.00000000  1.98920484   
	       6.000000            12.000000          0.00000000  0.00000000 -0.16706420   

	 - Coordinate -           - BOHR/RAD -       - ANG/DEG -
	 R(1,2)           =         2.156269           1.141048


	        --- Internal Coordinate Step in ANG or DEG, aJ/ANG or AJ/DEG ---
	-------------------------------------------------------------------------------
	           Coordinate      Previous         Force          Change          New 
	           ----------      --------        ------          ------        ------
	               R(1,2)       1.14105        0.00328        0.00091       1.14196
	-------------------------------------------------------------------------------

	                                 ==> Convergence Check <==                                  
    
	Measures of convergence in internal coordinates in au.
    
	Criteria marked as inactive (o), active & met (*), and active & unmet ( ).

	----------------------------------------------------------------------------------------------
	   Step    Total Energy     Delta E     Max Force     RMS Force      Max Disp      RMS Disp   
	----------------------------------------------------------------------------------------------
	  Convergence Criteria     1.00e-06 *    3.00e-04 *             o    1.20e-03 *             o
	----------------------------------------------------------------------------------------------
	     3     -38.48469438   -7.98e-06      3.98e-04      3.98e-04 o    1.71e-03      1.71e-03 o  ~
	----------------------------------------------------------------------------------------------

Next Geometry in Ang 
	Fragment 1 (Ang)

	    H   0.0000000000   0.0000000000   1.0530953756
	    C   0.0000000000   0.0000000000  -0.0888600739


    Structure for next step:
    Molecular point group: c2v
    Full point group: C_inf_v

    Geometry (in Angstrom), charge = 0, multiplicity = 2:

    H            0.000000000000     0.000000000000     1.053478606914
    C            0.000000000000     0.000000000000    -0.088476842581


Scratch directory: /tmp/
gradient() will perform analytic gradient computation.
   => Libint2 <=

    Primary   basis highest AM E, G, H:  6, 6, 3
    Auxiliary basis highest AM E, G, H:  7, 7, 4
    Onebody   basis highest AM E, G, H:  -, -, -
    Solid Harmonics ordering:            Gaussian

*** tstart() called on Joses-MacBook-Pro-2.local
*** at Wed Jul 16 18:12:57 2025

   => Loading Basis Set <=

    Name: CC-PVDZ
    Role: ORBITAL
    Keyword: BASIS
    atoms 1 entry H          line    22 file /Users/joseantoniorodriguesromero/anaconda3/share/psi4/basis/cc-pvdz.gbs 
    atoms 2 entry C          line   138 file /Users/joseantoniorodriguesromero/anaconda3/share/psi4/basis/cc-pvdz.gbs 


         ---------------------------------------------------------
                                   SCF
               by Justin Turney, Rob Parrish, Andy Simmonett
                          and Daniel G. A. Smith
                              UKS Reference
                        1 Threads,    500 MiB Core
         ---------------------------------------------------------

  ==> Geometry <==

    Molecular point group: c2v
    Full point group: C_inf_v

    Geometry (in Angstrom), charge = 0, multiplicity = 2:

       Center              X                  Y                   Z               Mass       
    ------------   -----------------  -----------------  -----------------  -----------------
         H            0.000000000000     0.000000000000     1.053478606914     1.007825032230
         C            0.000000000000     0.000000000000    -0.088476842581    12.000000000000

  Running in c2v symmetry.

  Rotational constants: A = ************  B =     13.90389  C =     13.90389 [cm^-1]
  Rotational constants: A = ************  B = 416828.27982  C = 416828.27982 [MHz]
  Nuclear repulsion =    2.780374020216652

  Charge       = 0
  Multiplicity = 2
  Electrons    = 7
  Nalpha       = 4
  Nbeta        = 3

  ==> Algorithm <==

  SCF Algorithm Type is DF.
  DIIS enabled.
  MOM disabled.
  Fractional occupation disabled.
  Guess Type is READ.
  Energy threshold   = 1.00e-08
  Density threshold  = 1.00e-08
  Integral threshold = 1.00e-12

  ==> Primary Basis <==

  Basis Set: CC-PVDZ
    Blend: CC-PVDZ
    Number of shells: 9
    Number of basis functions: 19
    Number of Cartesian functions: 20
    Spherical Harmonics?: true
    Max angular momentum: 2

  ==> DFT Potential <==

   => LibXC <=

    Version 6.2.2
    S. Lehtola, C. Steigemann, M. J.T. Oliveira, and M. A.L. Marques.,  SoftwareX 7, 1–5 (2018) (10.1016/j.softx.2017.11.002)

   => Composite Functional: B3LYP <= 

    B3LYP Hyb-GGA Exchange-Correlation Functional

    P. J. Stephens, F. J. Devlin, C. F. Chabalowski, and M. J. Frisch.,  J. Phys. Chem. 98, 11623 (1994) (10.1021/j100096a001)

    Deriv               =              1
    GGA                 =           TRUE
    Meta                =          FALSE

    Exchange Hybrid     =           TRUE
    MP2 Hybrid          =          FALSE

   => Exchange Functionals <=

    0.0800   Slater exchange
    0.7200         Becke 88

   => Exact (HF) Exchange <=

    0.2000               HF 

   => Correlation Functionals <=

    0.1900   Vosko, Wilk & Nusair (VWN5_RPA)
    0.8100   Lee, Yang & Parr

   => LibXC Density Thresholds  <==

    XC_HYB_GGA_XC_B3LYP:  1.00E-15 

   => Molecular Quadrature <=

    Radial Scheme          =       TREUTLER
    Pruning Scheme         =           NONE
    Nuclear Scheme         =       TREUTLER

    Blocking Scheme        =         OCTREE
    BS radius alpha        =              1
    Pruning alpha          =              1
    Radial Points          =             75
    Spherical Points       =            302
    Total Points           =          43729
    Total Blocks           =            387
    Max Points             =            255
    Max Functions          =             19
    Weights Tolerance      =       1.00E-15

   => Loading Basis Set <=

    Name: (CC-PVDZ AUX)
    Role: JKFIT
    Keyword: DF_BASIS_SCF
    atoms 1 entry H          line    51 file /Users/joseantoniorodriguesromero/anaconda3/share/psi4/basis/cc-pvdz-jkfit.gbs 
    atoms 2 entry C          line   121 file /Users/joseantoniorodriguesromero/anaconda3/share/psi4/basis/cc-pvdz-jkfit.gbs 

   => Loading Basis Set <=

    Name: CC-PVDZ
    Role: ORBITAL
    Keyword: BASIS
    atoms 1 entry H          line    22 file /Users/joseantoniorodriguesromero/anaconda3/share/psi4/basis/cc-pvdz.gbs 
    atoms 2 entry C          line   138 file /Users/joseantoniorodriguesromero/anaconda3/share/psi4/basis/cc-pvdz.gbs 

  Reading orbitals from file /tmp/doublet_HC.default.68094.180.npy, no projection.

  ==> Integral Setup <==

  DFHelper Memory: AOs need 0.000 GiB; user supplied 0.342 GiB. 
  Using in-core AOs.

  ==> MemDFJK: Density-Fitted J/K Matrices <==

    J tasked:                   Yes
    K tasked:                   Yes
    wK tasked:                   No
    OpenMP threads:               1
    Memory [MiB]:               349
    Algorithm:                 Core
    Schwarz Cutoff:           1E-12
    Mask sparsity (%):       0.0000
    Fitting Condition:        1E-10

   => Auxiliary Basis Set <=

  Basis Set: (CC-PVDZ AUX)
    Blend: CC-PVDZ-JKFIT
    Number of shells: 33
    Number of basis functions: 93
    Number of Cartesian functions: 106
    Spherical Harmonics?: true
    Max angular momentum: 3

  Cached 100.0% of DFT collocation blocks in 0.024 [GiB].

  Minimum eigenvalue in the overlap matrix is 3.9565631619E-02.
  Reciprocal condition number of the overlap matrix is 1.3019578081E-02.
    Using symmetric orthogonalization.

  ==> Pre-Iterations <==

  SCF Guess: Orbitals guess was supplied from a previous computation.

   -------------------------------------------------------
    Irrep   Nso     Nmo     Nalpha   Nbeta   Ndocc  Nsocc
   -------------------------------------------------------
     A1        10      10       3       3       3       0
     A2         1       1       0       0       0       0
     B1         4       4       1       0       0       1
     B2         4       4       0       0       0       0
   -------------------------------------------------------
    Total      19      19       4       3       3       1
   -------------------------------------------------------

  ==> Iterations <==

                           Total Energy        Delta E     RMS |[F,P]|

   @DF-UKS iter   0:   -38.48444377352973   -3.84844e+01   1.05449e-04 
   @DF-UKS iter   1:   -38.48469462588593   -2.50852e-04   1.66782e-05 DIIS
   @DF-UKS iter   2:   -38.48469464800945   -2.21235e-08   6.80697e-06 DIIS/DAMP=1%
   @DF-UKS iter   3:   -38.48469545318658   -8.05177e-07   1.30175e-06 DIIS/DAMP=1%
   @DF-UKS iter   4:   -38.48469437362404    1.07956e-06   5.73494e-08 DIIS/DAMP=1%
   @DF-UKS iter   5:   -38.48469465954397   -2.85920e-07   1.38264e-08 DIIS/DAMP=1%
   @DF-UKS iter   6:   -38.48469465006026    9.48371e-09   3.69922e-09 DIIS/DAMP=1%
  Energy and wave function converged.


  ==> Post-Iterations <==

   Electrons on quadrature grid:
      Nalpha   =    3.9999999825 ; deviation = -1.750e-08
      Nbeta    =    2.9999999772 ; deviation = -2.282e-08
      Ntotal   =    6.9999999597 ; deviation = -4.032e-08 

   @Spin Contamination Metric:   2.507562491E-03
   @S^2 Expected:                7.500000000E-01
   @S^2 Observed:                7.525075625E-01
   @S   Expected:                5.000000000E-01
   @S   Observed:                5.000000000E-01

    Orbital Energies [Eh]
    ---------------------

    Alpha Occupied:                                                       

       1A1   -10.286588     2A1    -0.642178     3A1    -0.316484  
       1B1    -0.252394  

    Alpha Virtual:                                                        

       1B2    -0.139902     4A1     0.080494     2B1     0.454724  
       5A1     0.458638     2B2     0.481675     6A1     0.517530  
       7A1     0.723362     3B1     0.985771     3B2     0.992238  
       1A2     1.127280     8A1     1.136285     9A1     1.540713  
       4B1     1.716745     4B2     1.718244    10A1     2.293290  

    Beta Occupied:                                                        

       1A1   -10.272271     2A1    -0.598930     3A1    -0.295660  

    Beta Virtual:                                                         

       1B2    -0.122264     1B1    -0.074279     4A1     0.087829  
       5A1     0.467373     2B2     0.491870     2B1     0.527090  
       6A1     0.527378     7A1     0.749284     3B2     0.995434  
       3B1     1.024619     8A1     1.193447     1A2     1.194157  
       9A1     1.562169     4B2     1.720231     4B1     1.743773  
      10A1     2.299326  

    Final Occupation by Irrep:
             A1    A2    B1    B2 
    DOCC [     3,    0,    0,    0 ]
    SOCC [     0,    0,    1,    0 ]
    NA   [     3,    0,    1,    0 ]
    NB   [     3,    0,    0,    0 ]

  @DF-UKS Final Energy:   -38.48469465006026

   => Energetics <=

    Nuclear Repulsion Energy =              2.7803740202166525
    One-Electron Energy =                 -56.5818470627998877
    Two-Electron Energy =                  19.8655039054009173
    DFT Exchange-Correlation Energy =      -4.5487255128779518
    Empirical Dispersion Energy =           0.0000000000000000
    VV10 Nonlocal Energy =                  0.0000000000000000
    Total Energy =                        -38.4846946500602627

  UHF NO Occupations:
  HONO-2 :    2 A1 1.9998793
  HONO-1 :    3 A1 1.9988663
  HONO-0 :    1 B1 1.0000000
  LUNO+0 :    4 A1 0.0011337
  LUNO+1 :    5 A1 0.0001207
  LUNO+2 :    6 A1 0.0000001
  LUNO+3 :    7 A1 0.0000000


Computation Completed


Properties will be evaluated at   0.000000,   0.000000,   0.000000 [a0]

Properties computed using the SCF density matrix


 Multipole Moments:

 ------------------------------------------------------------------------------------
     Multipole            Electronic (a.u.)      Nuclear  (a.u.)        Total (a.u.)
 ------------------------------------------------------------------------------------

 L = 1.  Multiply by 2.5417464519 to convert [e a0] to [Debye]
 Dipole X            :          0.0000000            0.0000000            0.0000000
 Dipole Y            :          0.0000000            0.0000000            0.0000000
 Dipole Z            :         -0.4332698            0.9876040            0.5543342
 Magnitude           :                                                    0.5543342

 ------------------------------------------------------------------------------------

*** tstop() called on Joses-MacBook-Pro-2.local at Wed Jul 16 18:12:57 2025
Module time:
	user time   =       0.64 seconds =       0.01 minutes
	system time =       3.05 seconds =       0.05 minutes
	total time  =          0 seconds =       0.00 minutes
Total time:
	user time   =       4.56 seconds =       0.08 minutes
	system time =      14.36 seconds =       0.24 minutes
	total time  =          2 seconds =       0.03 minutes

*** tstart() called on Joses-MacBook-Pro-2.local
*** at Wed Jul 16 18:12:57 2025


         ------------------------------------------------------------
                                   SCF GRAD                          
                          Rob Parrish, Justin Turney,                
                       Andy Simmonett, and Alex Sokolov              
         ------------------------------------------------------------

  ==> Geometry <==

    Molecular point group: c2v
    Full point group: C_inf_v

    Geometry (in Angstrom), charge = 0, multiplicity = 2:

       Center              X                  Y                   Z               Mass       
    ------------   -----------------  -----------------  -----------------  -----------------
         H            0.000000000000     0.000000000000     1.053478606914     1.007825032230
         C            0.000000000000     0.000000000000    -0.088476842581    12.000000000000

  Nuclear repulsion =    2.780374020216652

  ==> Basis Set <==

  Basis Set: CC-PVDZ
    Blend: CC-PVDZ
    Number of shells: 9
    Number of basis functions: 19
    Number of Cartesian functions: 20
    Spherical Harmonics?: true
    Max angular momentum: 2

  ==> DFJKGrad: Density-Fitted SCF Gradients <==

    Gradient:                    1
    J tasked:                  Yes
    K tasked:                  Yes
    wK tasked:                  No
    OpenMP threads:              1
    Integrals threads:           1
    Memory [MiB]:              375
    Schwarz Cutoff:          1E-12
    Fitting Condition:       1E-10

   => Auxiliary Basis Set <=

  Basis Set: (CC-PVDZ AUX)
    Blend: CC-PVDZ-JKFIT
    Number of shells: 33
    Number of basis functions: 93
    Number of Cartesian functions: 106
    Spherical Harmonics?: true
    Max angular momentum: 3

  ==> DFT Potential <==

   => LibXC <=

    Version 6.2.2
    S. Lehtola, C. Steigemann, M. J.T. Oliveira, and M. A.L. Marques.,  SoftwareX 7, 1–5 (2018) (10.1016/j.softx.2017.11.002)

   => Composite Functional: B3LYP <= 

    B3LYP Hyb-GGA Exchange-Correlation Functional

    P. J. Stephens, F. J. Devlin, C. F. Chabalowski, and M. J. Frisch.,  J. Phys. Chem. 98, 11623 (1994) (10.1021/j100096a001)

    Deriv               =              1
    GGA                 =           TRUE
    Meta                =          FALSE

    Exchange Hybrid     =           TRUE
    MP2 Hybrid          =          FALSE

   => Exchange Functionals <=

    0.0800   Slater exchange
    0.7200         Becke 88

   => Exact (HF) Exchange <=

    0.2000               HF 

   => Correlation Functionals <=

    0.1900   Vosko, Wilk & Nusair (VWN5_RPA)
    0.8100   Lee, Yang & Parr

   => LibXC Density Thresholds  <==

    XC_HYB_GGA_XC_B3LYP:  1.00E-15 

   => Molecular Quadrature <=

    Radial Scheme          =       TREUTLER
    Pruning Scheme         =           NONE
    Nuclear Scheme         =       TREUTLER

    Blocking Scheme        =         OCTREE
    BS radius alpha        =              1
    Pruning alpha          =              1
    Radial Points          =             75
    Spherical Points       =            302
    Total Points           =          43729
    Total Blocks           =            387
    Max Points             =            255
    Max Functions          =             19
    Weights Tolerance      =       1.00E-15


  -Total Gradient:
     Atom            X                  Y                   Z
    ------   -----------------  -----------------  -----------------
       1        0.000000000000    -0.000000000000     0.000073244936
       2        0.000000000000     0.000000000000    -0.000073180911


*** tstop() called on Joses-MacBook-Pro-2.local at Wed Jul 16 18:12:58 2025
Module time:
	user time   =       0.33 seconds =       0.01 minutes
	system time =       0.76 seconds =       0.01 minutes
	total time  =          1 seconds =       0.02 minutes
Total time:
	user time   =       4.89 seconds =       0.08 minutes
	system time =      15.12 seconds =       0.25 minutes
	total time  =          3 seconds =       0.05 minutes

    			-----------------------------------------

    			 OPTKING 3.0: for geometry optimizations 

    			     By R.A. King, Bethel University     

    			        with contributions from          

    			    A.V. Copan, J. Cayton, A. Heide      

    			-----------------------------------------

    
	                            ===> Fragment 1 <== 

	 Z (Atomic Numbers)          Masses                          Geom                  
	       1.000000             1.007825          0.00000000  0.00000000  1.99078605   
	       6.000000            12.000000          0.00000000  0.00000000 -0.16719700   

	 - Coordinate -           - BOHR/RAD -       - ANG/DEG -
	 R(1,2)           =         2.157983           1.141955


	        --- Internal Coordinate Step in ANG or DEG, aJ/ANG or AJ/DEG ---
	-------------------------------------------------------------------------------
	           Coordinate      Previous         Force          Change          New 
	           ----------      --------        ------          ------        ------
	               R(1,2)       1.14196       -0.00060       -0.00017       1.14179
	-------------------------------------------------------------------------------

	                                 ==> Convergence Check <==                                  
    
	Measures of convergence in internal coordinates in au.
    
	Criteria marked as inactive (o), active & met (*), and active & unmet ( ).

	----------------------------------------------------------------------------------------------
	   Step    Total Energy     Delta E     Max Force     RMS Force      Max Disp      RMS Disp   
	----------------------------------------------------------------------------------------------
	  Convergence Criteria     1.00e-06 *    3.00e-04 *             o    1.20e-03 *             o
	----------------------------------------------------------------------------------------------
	     4     -38.48469465   -2.75e-07 *    7.32e-05 *    7.32e-05 o    3.16e-04 *    3.16e-04 o  ~
	----------------------------------------------------------------------------------------------

Next Geometry in Ang 
	Fragment 1 (Ang)

	    H   0.0000000000   0.0000000000   1.0533949219
	    C   0.0000000000   0.0000000000  -0.0883931576


    Final optimized geometry and variables:
    Molecular point group: c2v
    Full point group: C_inf_v

    Geometry (in Angstrom), charge = 0, multiplicity = 2:

    H            0.000000000000     0.000000000000     1.053478606914
    C            0.000000000000     0.000000000000    -0.088476842581


    Psi4 stopped on: Wednesday, 16 July 2025 06:12PM
    Psi4 wall time for execution: 0:00:02.86

*** Psi4 exiting successfully. Buy a developer a beer!
