
    -----------------------------------------------------------------------
          Psi4: An Open-Source Ab Initio Electronic Structure Package
                               Psi4 1.9.1 release

                         Git: Rev {} zzzzzzz 


    D. G. A. Smith, L. A. Burns, A. C. Simmonett, R. M. Parrish,
    M. C. Schieber, R. Galvelis, P. Kraus, H. Kruse, R. Di Remigio,
    A. Alenaizan, A. M. James, S. Lehtola, J. P. Misiewicz, M. Scheurer,
    R. A. Shaw, J. B. Schriber, Y. Xie, Z. L. Glick, D. A. Sirianni,
    J. S. O'Brien, J. M. Waldrop, A. Kumar, E. G. Hohenstein,
    B. P. Pritchard, B. R. Brooks, H. F. Schaefer III, A. Yu. Sokolov,
    K. Patkowski, A. E. DePrince III, U. Bozkaya, R. A. King,
    F. A. Evangelista, J. M. Turney, T. D. Crawford, C. D. Sherrill,
    J. Chem. Phys. 152(18) 184108 (2020). https://doi.org/10.1063/5.0006002

                            Additional Code Authors
    E. T. Seidl, C. L. Janssen, E. F. Valeev, M. L. Leininger,
    J. F. Gonthier, R. M. Richard, H. R. McAlexander, M. Saitow, X. Wang,
    P. Verma, M. H. Lechner, A. Jiang, S. Behnle, A. G. Heide,
    M. F. Herbst, and D. L. Poole

             Previous Authors, Complete List of Code Contributors,
                       and Citations for Specific Modules
    https://github.com/psi4/psi4/blob/master/codemeta.json
    https://github.com/psi4/psi4/graphs/contributors
    http://psicode.org/psi4manual/master/introduction.html#citing-psifour

    -----------------------------------------------------------------------


    Psi4 started on: Wednesday, 16 July 2025 06:59PM

    Process ID: 68761
    Host:       Joses-MacBook-Pro-2.local
    PSIDATADIR: /Users/joseantoniorodriguesromero/anaconda3/share/psi4
    Memory:     500.0 MiB
    Threads:    1
    
  ==> Input File <==

--------------------------------------------------------------------------
molecule { 
0 2
C   0.00000        0.60000        0.00000
N   0.00000       -0.60000        0.00000
}

set { 
basis              cc-pvdz
reference          uks
maxiter            500
geom_maxiter       500
DAMPING_PERCENTAGE 1
guess              SAP
}

optimize('b3lyp')
--------------------------------------------------------------------------

Scratch directory: /tmp/
gradient() will perform analytic gradient computation.
   => Libint2 <=

    Primary   basis highest AM E, G, H:  6, 6, 3
    Auxiliary basis highest AM E, G, H:  7, 7, 4
    Onebody   basis highest AM E, G, H:  -, -, -
    Solid Harmonics ordering:            Gaussian

*** tstart() called on Joses-MacBook-Pro-2.local
*** at Wed Jul 16 18:59:23 2025

   => Loading Basis Set <=

    Name: CC-PVDZ
    Role: ORBITAL
    Keyword: BASIS
    atoms 1 entry C          line   138 file /Users/joseantoniorodriguesromero/anaconda3/share/psi4/basis/cc-pvdz.gbs 
    atoms 2 entry N          line   168 file /Users/joseantoniorodriguesromero/anaconda3/share/psi4/basis/cc-pvdz.gbs 


         ---------------------------------------------------------
                                   SCF
               by Justin Turney, Rob Parrish, Andy Simmonett
                          and Daniel G. A. Smith
                              UKS Reference
                        1 Threads,    500 MiB Core
         ---------------------------------------------------------

  ==> Geometry <==

    Molecular point group: c2v
    Full point group: C_inf_v

    Geometry (in Angstrom), charge = 0, multiplicity = 2:

       Center              X                  Y                   Z               Mass       
    ------------   -----------------  -----------------  -----------------  -----------------
         C            0.000000000000     0.000000000000     0.646219320164    12.000000000000
         N            0.000000000000     0.000000000000    -0.553780679836    14.003074004430

  Running in c2v symmetry.

  Rotational constants: A = ************  B =      1.81157  C =      1.81157 [cm^-1]
  Rotational constants: A = ************  B =  54309.37053  C =  54309.37053 [MHz]
  Nuclear repulsion =   18.521202373450002

  Charge       = 0
  Multiplicity = 2
  Electrons    = 13
  Nalpha       = 7
  Nbeta        = 6

  ==> Algorithm <==

  SCF Algorithm Type is DF.
  DIIS enabled.
  MOM disabled.
  Fractional occupation disabled.
  Guess Type is SAP.
  Energy threshold   = 1.00e-08
  Density threshold  = 1.00e-08
  Integral threshold = 1.00e-12

  ==> Primary Basis <==

  Basis Set: CC-PVDZ
    Blend: CC-PVDZ
    Number of shells: 12
    Number of basis functions: 28
    Number of Cartesian functions: 30
    Spherical Harmonics?: true
    Max angular momentum: 2

  ==> DFT Potential <==

   => LibXC <=

    Version 6.2.2
    S. Lehtola, C. Steigemann, M. J.T. Oliveira, and M. A.L. Marques.,  SoftwareX 7, 1–5 (2018) (10.1016/j.softx.2017.11.002)

   => Composite Functional: B3LYP <= 

    B3LYP Hyb-GGA Exchange-Correlation Functional

    P. J. Stephens, F. J. Devlin, C. F. Chabalowski, and M. J. Frisch.,  J. Phys. Chem. 98, 11623 (1994) (10.1021/j100096a001)

    Deriv               =              1
    GGA                 =           TRUE
    Meta                =          FALSE

    Exchange Hybrid     =           TRUE
    MP2 Hybrid          =          FALSE

   => Exchange Functionals <=

    0.0800   Slater exchange
    0.7200         Becke 88

   => Exact (HF) Exchange <=

    0.2000               HF 

   => Correlation Functionals <=

    0.1900   Vosko, Wilk & Nusair (VWN5_RPA)
    0.8100   Lee, Yang & Parr

   => LibXC Density Thresholds  <==

    XC_HYB_GGA_XC_B3LYP:  1.00E-15 

   => Molecular Quadrature <=

    Radial Scheme          =       TREUTLER
    Pruning Scheme         =           NONE
    Nuclear Scheme         =       TREUTLER

    Blocking Scheme        =         OCTREE
    BS radius alpha        =              1
    Pruning alpha          =              1
    Radial Points          =             75
    Spherical Points       =            302
    Total Points           =          42672
    Total Blocks           =            384
    Max Points             =            256
    Max Functions          =             28
    Weights Tolerance      =       1.00E-15

   => Loading Basis Set <=

    Name: (CC-PVDZ AUX)
    Role: JKFIT
    Keyword: DF_BASIS_SCF
    atoms 1 entry C          line   121 file /Users/joseantoniorodriguesromero/anaconda3/share/psi4/basis/cc-pvdz-jkfit.gbs 
    atoms 2 entry N          line   171 file /Users/joseantoniorodriguesromero/anaconda3/share/psi4/basis/cc-pvdz-jkfit.gbs 

  ==> Integral Setup <==

  DFHelper Memory: AOs need 0.001 GiB; user supplied 0.332 GiB. 
  Using in-core AOs.

  ==> MemDFJK: Density-Fitted J/K Matrices <==

    J tasked:                   Yes
    K tasked:                   Yes
    wK tasked:                   No
    OpenMP threads:               1
    Memory [MiB]:               339
    Algorithm:                 Core
    Schwarz Cutoff:           1E-12
    Mask sparsity (%):       0.0000
    Fitting Condition:        1E-10

   => Auxiliary Basis Set <=

  Basis Set: (CC-PVDZ AUX)
    Blend: CC-PVDZ-JKFIT
    Number of shells: 48
    Number of basis functions: 140
    Number of Cartesian functions: 162
    Spherical Harmonics?: true
    Max angular momentum: 3

  Cached 100.0% of DFT collocation blocks in 0.034 [GiB].

  Minimum eigenvalue in the overlap matrix is 1.1329986613E-02.
  Reciprocal condition number of the overlap matrix is 3.6584227228E-03.
    Using symmetric orthogonalization.

  ==> Pre-Iterations <==

  SCF Guess: Superposition of Atomic Potentials (doi:10.1021/acs.jctc.8b01089).

  ==> SAP guess <==

   => Molecular Quadrature <=

    Radial Scheme          =       TREUTLER
    Pruning Scheme         =           NONE
    Nuclear Scheme         =       TREUTLER

    Blocking Scheme        =         OCTREE
    BS radius alpha        =              1
    Pruning alpha          =              1
    Radial Points          =             75
    Spherical Points       =            302
    Total Points           =          42672
    Total Blocks           =            384
    Max Points             =            256
    Max Functions          =             28
    Weights Tolerance      =       1.00E-15

   -------------------------------------------------------
    Irrep   Nso     Nmo     Nalpha   Nbeta   Ndocc  Nsocc
   -------------------------------------------------------
     A1        14      14       5       4       4       1
     A2         2       2       0       0       0       0
     B1         6       6       1       1       1       0
     B2         6       6       1       1       1       0
   -------------------------------------------------------
    Total      28      28       7       6       6       1
   -------------------------------------------------------

  ==> Iterations <==

                           Total Energy        Delta E     RMS |[F,P]|

   @DF-UKS iter   1:   -92.45964203478771   -9.24596e+01   4.38697e-02 ADIIS/DIIS
   @DF-UKS iter   2:   -91.16194123001814    1.29770e+00   9.82680e-02 ADIIS/DIIS/DAMP=1%
   @DF-UKS iter   3:   -92.63056676539929   -1.46863e+00   2.38775e-02 ADIIS/DIIS/DAMP=1%
   @DF-UKS iter   4:   -92.70761591344625   -7.70491e-02   3.04805e-03 ADIIS/DIIS/DAMP=1%
   @DF-UKS iter   5:   -92.71878694542103   -1.11710e-02   1.72860e-03 ADIIS/DIIS/DAMP=1%
   @DF-UKS iter   6:   -92.71818749149708    5.99454e-04   6.04736e-04 ADIIS/DIIS/DAMP=1%
   @DF-UKS iter   7:   -92.71815826568124    2.92258e-05   8.08181e-05 DIIS/DAMP=1%
   @DF-UKS iter   8:   -92.71826003926923   -1.01774e-04   2.80136e-05 DIIS/DAMP=1%
   @DF-UKS iter   9:   -92.71826512441302   -5.08514e-06   7.31929e-06 DIIS/DAMP=1%
   @DF-UKS iter  10:   -92.71826625388209   -1.12947e-06   1.86358e-06 DIIS/DAMP=1%
   @DF-UKS iter  11:   -92.71826687752194   -6.23640e-07   5.65246e-07 DIIS/DAMP=1%
   @DF-UKS iter  12:   -92.71826710295504   -2.25433e-07   5.56086e-08 DIIS/DAMP=1%
   @DF-UKS iter  13:   -92.71826696934022    1.33615e-07   6.27608e-09 DIIS/DAMP=1%
   @DF-UKS iter  14:   -92.71826697615990   -6.81968e-09   1.39723e-09 DIIS/DAMP=1%
  Energy and wave function converged.


  ==> Post-Iterations <==

   Electrons on quadrature grid:
      Nalpha   =    6.9999999335 ; deviation = -6.650e-08
      Nbeta    =    5.9999999271 ; deviation = -7.292e-08
      Ntotal   =   12.9999998606 ; deviation = -1.394e-07 

   @Spin Contamination Metric:   7.486565011E-03
   @S^2 Expected:                7.500000000E-01
   @S^2 Observed:                7.574865650E-01
   @S   Expected:                5.000000000E-01
   @S   Observed:                5.000000000E-01

    Orbital Energies [Eh]
    ---------------------

    Alpha Occupied:                                                       

       1A1   -14.408925     2A1   -10.312912     3A1    -0.950139  
       4A1    -0.506555     5A1    -0.405152     1B1    -0.381576  
       1B2    -0.381576  

    Alpha Virtual:                                                        

       2B1    -0.019985     2B2    -0.019985     6A1     0.248620  
       3B1     0.449161     3B2     0.449161     7A1     0.492098  
       8A1     0.641698     9A1     0.703895     4B2     0.765914  
       4B1     0.765914    10A1     1.081840     1A2     1.081840  
       5B2     1.203513     5B1     1.203513    11A1     1.309000  
      12A1     1.833514     2A2     1.833514    13A1     1.862508  
       6B2     2.302074     6B1     2.302074    14A1     2.663063  

    Beta Occupied:                                                        

       1A1   -14.403981     2A1   -10.298442     3A1    -0.927515  
       4A1    -0.438805     1B1    -0.372691     1B2    -0.372691  

    Beta Virtual:                                                         

       5A1    -0.245013     2B1     0.001855     2B2     0.001855  
       6A1     0.262184     3B1     0.462408     3B2     0.462408  
       7A1     0.552126     8A1     0.653188     9A1     0.754268  
       4B2     0.767945     4B1     0.767945     1A2     1.099849  
      10A1     1.099849     5B2     1.247962     5B1     1.247962  
      11A1     1.323968    12A1     1.833239     2A2     1.833239  
      13A1     1.913537     6B2     2.329923     6B1     2.329923  
      14A1     2.691265  

    Final Occupation by Irrep:
             A1    A2    B1    B2 
    DOCC [     4,    0,    1,    1 ]
    SOCC [     1,    0,    0,    0 ]
    NA   [     5,    0,    1,    1 ]
    NB   [     4,    0,    1,    1 ]

  @DF-UKS Final Energy:   -92.71826697615990

   => Energetics <=

    Nuclear Repulsion Energy =             18.5212023734500022
    One-Electron Energy =                -161.2526852973617508
    Two-Electron Energy =                  59.8243295074288355
    DFT Exchange-Correlation Energy =      -9.8111135596769863
    Empirical Dispersion Energy =           0.0000000000000000
    VV10 Nonlocal Energy =                  0.0000000000000000
    Total Energy =                        -92.7182669761598959

  UHF NO Occupations:
  HONO-2 :    1 B2 1.9987274
  HONO-1 :    1 B1 1.9987274
  HONO-0 :    5 A1 1.0000000
  LUNO+0 :    2 B1 0.0012726
  LUNO+1 :    2 B2 0.0012726
  LUNO+2 :    6 A1 0.0011104
  LUNO+3 :    7 A1 0.0000897


Computation Completed


Properties will be evaluated at   0.000000,   0.000000,   0.000000 [a0]

Properties computed using the SCF density matrix


 Multipole Moments:

 ------------------------------------------------------------------------------------
     Multipole            Electronic (a.u.)      Nuclear  (a.u.)        Total (a.u.)
 ------------------------------------------------------------------------------------

 L = 1.  Multiply by 2.5417464519 to convert [e a0] to [Debye]
 Dipole X            :          0.0000000            0.0000000            0.0000000
 Dipole Y            :          0.0000000            0.0000000            0.0000000
 Dipole Z            :          0.4389529            0.0016085            0.4405613
 Magnitude           :                                                    0.4405613

 ------------------------------------------------------------------------------------

*** tstop() called on Joses-MacBook-Pro-2.local at Wed Jul 16 18:59:24 2025
Module time:
	user time   =       3.92 seconds =       0.07 minutes
	system time =       5.45 seconds =       0.09 minutes
	total time  =          1 seconds =       0.02 minutes
Total time:
	user time   =       3.92 seconds =       0.07 minutes
	system time =       5.45 seconds =       0.09 minutes
	total time  =          1 seconds =       0.02 minutes

*** tstart() called on Joses-MacBook-Pro-2.local
*** at Wed Jul 16 18:59:24 2025


         ------------------------------------------------------------
                                   SCF GRAD                          
                          Rob Parrish, Justin Turney,                
                       Andy Simmonett, and Alex Sokolov              
         ------------------------------------------------------------

  ==> Geometry <==

    Molecular point group: c2v
    Full point group: C_inf_v

    Geometry (in Angstrom), charge = 0, multiplicity = 2:

       Center              X                  Y                   Z               Mass       
    ------------   -----------------  -----------------  -----------------  -----------------
         C            0.000000000000     0.000000000000     0.646219320164    12.000000000000
         N            0.000000000000     0.000000000000    -0.553780679836    14.003074004430

  Nuclear repulsion =   18.521202373450002

  ==> Basis Set <==

  Basis Set: CC-PVDZ
    Blend: CC-PVDZ
    Number of shells: 12
    Number of basis functions: 28
    Number of Cartesian functions: 30
    Spherical Harmonics?: true
    Max angular momentum: 2

  ==> DFJKGrad: Density-Fitted SCF Gradients <==

    Gradient:                    1
    J tasked:                  Yes
    K tasked:                  Yes
    wK tasked:                  No
    OpenMP threads:              1
    Integrals threads:           1
    Memory [MiB]:              375
    Schwarz Cutoff:          1E-12
    Fitting Condition:       1E-10

   => Auxiliary Basis Set <=

  Basis Set: (CC-PVDZ AUX)
    Blend: CC-PVDZ-JKFIT
    Number of shells: 48
    Number of basis functions: 140
    Number of Cartesian functions: 162
    Spherical Harmonics?: true
    Max angular momentum: 3

  ==> DFT Potential <==

   => LibXC <=

    Version 6.2.2
    S. Lehtola, C. Steigemann, M. J.T. Oliveira, and M. A.L. Marques.,  SoftwareX 7, 1–5 (2018) (10.1016/j.softx.2017.11.002)

   => Composite Functional: B3LYP <= 

    B3LYP Hyb-GGA Exchange-Correlation Functional

    P. J. Stephens, F. J. Devlin, C. F. Chabalowski, and M. J. Frisch.,  J. Phys. Chem. 98, 11623 (1994) (10.1021/j100096a001)

    Deriv               =              1
    GGA                 =           TRUE
    Meta                =          FALSE

    Exchange Hybrid     =           TRUE
    MP2 Hybrid          =          FALSE

   => Exchange Functionals <=

    0.0800   Slater exchange
    0.7200         Becke 88

   => Exact (HF) Exchange <=

    0.2000               HF 

   => Correlation Functionals <=

    0.1900   Vosko, Wilk & Nusair (VWN5_RPA)
    0.8100   Lee, Yang & Parr

   => LibXC Density Thresholds  <==

    XC_HYB_GGA_XC_B3LYP:  1.00E-15 

   => Molecular Quadrature <=

    Radial Scheme          =       TREUTLER
    Pruning Scheme         =           NONE
    Nuclear Scheme         =       TREUTLER

    Blocking Scheme        =         OCTREE
    BS radius alpha        =              1
    Pruning alpha          =              1
    Radial Points          =             75
    Spherical Points       =            302
    Total Points           =          42672
    Total Blocks           =            384
    Max Points             =            256
    Max Functions          =             28
    Weights Tolerance      =       1.00E-15


  -Total Gradient:
     Atom            X                  Y                   Z
    ------   -----------------  -----------------  -----------------
       1        0.000000000000    -0.000000000000     0.048649727954
       2        0.000000000000     0.000000000000    -0.048646632347


*** tstop() called on Joses-MacBook-Pro-2.local at Wed Jul 16 18:59:24 2025
Module time:
	user time   =       0.73 seconds =       0.01 minutes
	system time =       1.14 seconds =       0.02 minutes
	total time  =          0 seconds =       0.00 minutes
Total time:
	user time   =       4.66 seconds =       0.08 minutes
	system time =       6.59 seconds =       0.11 minutes
	total time  =          1 seconds =       0.02 minutes

    			-----------------------------------------

    			 OPTKING 3.0: for geometry optimizations 

    			     By R.A. King, Bethel University     

    			        with contributions from          

    			    A.V. Copan, J. Cayton, A. Heide      

    			-----------------------------------------

    
	                            ===> Fragment 1 <== 

	 Z (Atomic Numbers)          Masses                          Geom                  
	       6.000000            12.000000          0.00000000  0.00000000  1.22117753   
	       7.000000            14.003074          0.00000000  0.00000000 -1.04649382   

	 - Coordinate -           - BOHR/RAD -       - ANG/DEG -
	 R(1,2)           =         2.267671           1.200000


	        --- Internal Coordinate Step in ANG or DEG, aJ/ANG or AJ/DEG ---
	-------------------------------------------------------------------------------
	           Coordinate      Previous         Force          Change          New 
	           ----------      --------        ------          ------        ------
	               R(1,2)       1.20000       -0.40080       -0.02451       1.17549
	-------------------------------------------------------------------------------

	                                 ==> Convergence Check <==                                  
    
	Measures of convergence in internal coordinates in au.
    
	Criteria marked as inactive (o), active & met (*), and active & unmet ( ).

	----------------------------------------------------------------------------------------------
	   Step    Total Energy     Delta E     Max Force     RMS Force      Max Disp      RMS Disp   
	----------------------------------------------------------------------------------------------
	  Convergence Criteria     1.00e-06 *    3.00e-04 *             o    1.20e-03 *             o
	----------------------------------------------------------------------------------------------
	     1     -92.71826698   -9.27e+01      4.86e-02      4.86e-02 o    4.63e-02      4.63e-02 o  ~
	----------------------------------------------------------------------------------------------

Next Geometry in Ang 
	Fragment 1 (Ang)

	    C   0.0000000000   0.0000000000   0.6339661500
	    N   0.0000000000   0.0000000000  -0.5415275096


    Structure for next step:
    Molecular point group: c2v
    Full point group: C_inf_v

    Geometry (in Angstrom), charge = 0, multiplicity = 2:

    C            0.000000000000     0.000000000000     0.633022261308
    N            0.000000000000     0.000000000000    -0.542471398301


Scratch directory: /tmp/
gradient() will perform analytic gradient computation.
   => Libint2 <=

    Primary   basis highest AM E, G, H:  6, 6, 3
    Auxiliary basis highest AM E, G, H:  7, 7, 4
    Onebody   basis highest AM E, G, H:  -, -, -
    Solid Harmonics ordering:            Gaussian

*** tstart() called on Joses-MacBook-Pro-2.local
*** at Wed Jul 16 18:59:24 2025

   => Loading Basis Set <=

    Name: CC-PVDZ
    Role: ORBITAL
    Keyword: BASIS
    atoms 1 entry C          line   138 file /Users/joseantoniorodriguesromero/anaconda3/share/psi4/basis/cc-pvdz.gbs 
    atoms 2 entry N          line   168 file /Users/joseantoniorodriguesromero/anaconda3/share/psi4/basis/cc-pvdz.gbs 


         ---------------------------------------------------------
                                   SCF
               by Justin Turney, Rob Parrish, Andy Simmonett
                          and Daniel G. A. Smith
                              UKS Reference
                        1 Threads,    500 MiB Core
         ---------------------------------------------------------

  ==> Geometry <==

    Molecular point group: c2v
    Full point group: C_inf_v

    Geometry (in Angstrom), charge = 0, multiplicity = 2:

       Center              X                  Y                   Z               Mass       
    ------------   -----------------  -----------------  -----------------  -----------------
         C            0.000000000000     0.000000000000     0.633022261308    12.000000000000
         N            0.000000000000     0.000000000000    -0.542471398301    14.003074004430

  Running in c2v symmetry.

  Rotational constants: A = ************  B =      1.88789  C =      1.88789 [cm^-1]
  Rotational constants: A = ************  B =  56597.42587  C =  56597.42587 [MHz]
  Nuclear repulsion =   18.907326863448905

  Charge       = 0
  Multiplicity = 2
  Electrons    = 13
  Nalpha       = 7
  Nbeta        = 6

  ==> Algorithm <==

  SCF Algorithm Type is DF.
  DIIS enabled.
  MOM disabled.
  Fractional occupation disabled.
  Guess Type is READ.
  Energy threshold   = 1.00e-08
  Density threshold  = 1.00e-08
  Integral threshold = 1.00e-12

  ==> Primary Basis <==

  Basis Set: CC-PVDZ
    Blend: CC-PVDZ
    Number of shells: 12
    Number of basis functions: 28
    Number of Cartesian functions: 30
    Spherical Harmonics?: true
    Max angular momentum: 2

  ==> DFT Potential <==

   => LibXC <=

    Version 6.2.2
    S. Lehtola, C. Steigemann, M. J.T. Oliveira, and M. A.L. Marques.,  SoftwareX 7, 1–5 (2018) (10.1016/j.softx.2017.11.002)

   => Composite Functional: B3LYP <= 

    B3LYP Hyb-GGA Exchange-Correlation Functional

    P. J. Stephens, F. J. Devlin, C. F. Chabalowski, and M. J. Frisch.,  J. Phys. Chem. 98, 11623 (1994) (10.1021/j100096a001)

    Deriv               =              1
    GGA                 =           TRUE
    Meta                =          FALSE

    Exchange Hybrid     =           TRUE
    MP2 Hybrid          =          FALSE

   => Exchange Functionals <=

    0.0800   Slater exchange
    0.7200         Becke 88

   => Exact (HF) Exchange <=

    0.2000               HF 

   => Correlation Functionals <=

    0.1900   Vosko, Wilk & Nusair (VWN5_RPA)
    0.8100   Lee, Yang & Parr

   => LibXC Density Thresholds  <==

    XC_HYB_GGA_XC_B3LYP:  1.00E-15 

   => Molecular Quadrature <=

    Radial Scheme          =       TREUTLER
    Pruning Scheme         =           NONE
    Nuclear Scheme         =       TREUTLER

    Blocking Scheme        =         OCTREE
    BS radius alpha        =              1
    Pruning alpha          =              1
    Radial Points          =             75
    Spherical Points       =            302
    Total Points           =          42672
    Total Blocks           =            385
    Max Points             =            256
    Max Functions          =             28
    Weights Tolerance      =       1.00E-15

   => Loading Basis Set <=

    Name: (CC-PVDZ AUX)
    Role: JKFIT
    Keyword: DF_BASIS_SCF
    atoms 1 entry C          line   121 file /Users/joseantoniorodriguesromero/anaconda3/share/psi4/basis/cc-pvdz-jkfit.gbs 
    atoms 2 entry N          line   171 file /Users/joseantoniorodriguesromero/anaconda3/share/psi4/basis/cc-pvdz-jkfit.gbs 

   => Loading Basis Set <=

    Name: CC-PVDZ
    Role: ORBITAL
    Keyword: BASIS
    atoms 1 entry C          line   138 file /Users/joseantoniorodriguesromero/anaconda3/share/psi4/basis/cc-pvdz.gbs 
    atoms 2 entry N          line   168 file /Users/joseantoniorodriguesromero/anaconda3/share/psi4/basis/cc-pvdz.gbs 

  Reading orbitals from file /tmp/doublet_CN.default.68761.180.npy, no projection.

  ==> Integral Setup <==

  DFHelper Memory: AOs need 0.001 GiB; user supplied 0.332 GiB. 
  Using in-core AOs.

  ==> MemDFJK: Density-Fitted J/K Matrices <==

    J tasked:                   Yes
    K tasked:                   Yes
    wK tasked:                   No
    OpenMP threads:               1
    Memory [MiB]:               339
    Algorithm:                 Core
    Schwarz Cutoff:           1E-12
    Mask sparsity (%):       0.0000
    Fitting Condition:        1E-10

   => Auxiliary Basis Set <=

  Basis Set: (CC-PVDZ AUX)
    Blend: CC-PVDZ-JKFIT
    Number of shells: 48
    Number of basis functions: 140
    Number of Cartesian functions: 162
    Spherical Harmonics?: true
    Max angular momentum: 3

  Cached 100.0% of DFT collocation blocks in 0.035 [GiB].

  Minimum eigenvalue in the overlap matrix is 1.0805521060E-02.
  Reciprocal condition number of the overlap matrix is 3.4732540287E-03.
    Using symmetric orthogonalization.

  ==> Pre-Iterations <==

  SCF Guess: Orbitals guess was supplied from a previous computation.

   -------------------------------------------------------
    Irrep   Nso     Nmo     Nalpha   Nbeta   Ndocc  Nsocc
   -------------------------------------------------------
     A1        14      14       5       4       4       1
     A2         2       2       0       0       0       0
     B1         6       6       1       1       1       0
     B2         6       6       1       1       1       0
   -------------------------------------------------------
    Total      28      28       7       6       6       1
   -------------------------------------------------------

  ==> Iterations <==

                           Total Energy        Delta E     RMS |[F,P]|

   @DF-UKS iter   0:   -92.74608806266079   -9.27461e+01   4.94241e-03 
   @DF-UKS iter   1:   -92.71920625428844    2.68818e-02   1.23520e-03 ADIIS/DIIS
   @DF-UKS iter   2:   -92.71830204534204    9.04209e-04   3.06463e-03 ADIIS/DIIS/DAMP=1%
   @DF-UKS iter   3:   -92.72000801614854   -1.70597e-03   6.94982e-04 ADIIS/DIIS/DAMP=1%
   @DF-UKS iter   4:   -92.71947146466333    5.36551e-04   1.13557e-04 ADIIS/DIIS/DAMP=1%
   @DF-UKS iter   5:   -92.71945064468096    2.08200e-05   1.85694e-05 DIIS/DAMP=1%
   @DF-UKS iter   6:   -92.71943883197419    1.18127e-05   1.27956e-05 DIIS/DAMP=1%
   @DF-UKS iter   7:   -92.71943918092379   -3.48950e-07   4.04879e-06 DIIS/DAMP=1%
   @DF-UKS iter   8:   -92.71944031848001   -1.13756e-06   2.54812e-06 DIIS/DAMP=1%
   @DF-UKS iter   9:   -92.71943957644849    7.42032e-07   7.16184e-08 DIIS/DAMP=1%
   @DF-UKS iter  10:   -92.71943990424418   -3.27796e-07   1.36405e-08 DIIS/DAMP=1%
   @DF-UKS iter  11:   -92.71943989566553    8.57865e-09   1.76990e-09 DIIS/DAMP=1%
  Energy and wave function converged.


  ==> Post-Iterations <==

   Electrons on quadrature grid:
      Nalpha   =    6.9999999142 ; deviation = -8.583e-08
      Nbeta    =    5.9999999093 ; deviation = -9.069e-08
      Ntotal   =   12.9999998235 ; deviation = -1.765e-07 

   @Spin Contamination Metric:   7.248412933E-03
   @S^2 Expected:                7.500000000E-01
   @S^2 Observed:                7.572484129E-01
   @S   Expected:                5.000000000E-01
   @S   Observed:                5.000000000E-01

    Orbital Energies [Eh]
    ---------------------

    Alpha Occupied:                                                       

       1A1   -14.402579     2A1   -10.307098     3A1    -0.958742  
       4A1    -0.501575     5A1    -0.404824     1B2    -0.386481  
       1B1    -0.386481  

    Alpha Virtual:                                                        

       2B2    -0.010881     2B1    -0.010881     6A1     0.250082  
       3B2     0.447546     3B1     0.447546     7A1     0.491569  
       8A1     0.647977     9A1     0.733109     4B2     0.767934  
       4B1     0.767934    10A1     1.079642     1A2     1.079642  
       5B2     1.219192     5B1     1.219192    11A1     1.315774  
      12A1     1.842590     2A2     1.842590    13A1     1.903119  
       6B2     2.324346     6B1     2.324346    14A1     2.700040  

    Beta Occupied:                                                        

       1A1   -14.397920     2A1   -10.292337     3A1    -0.936608  
       4A1    -0.434118     1B2    -0.377396     1B1    -0.377396  

    Beta Virtual:                                                         

       5A1    -0.244302     2B2     0.011387     2B1     0.011387  
       6A1     0.263365     3B2     0.461126     3B1     0.461126  
       7A1     0.551545     8A1     0.660122     4B2     0.770158  
       4B1     0.770158     9A1     0.782871    10A1     1.098041  
       1A2     1.098041     5B2     1.264058     5B1     1.264058  
      11A1     1.331136    12A1     1.842551     2A2     1.842551  
      13A1     1.953326     6B2     2.351669     6B1     2.351669  
      14A1     2.727395  

    Final Occupation by Irrep:
             A1    A2    B1    B2 
    DOCC [     4,    0,    1,    1 ]
    SOCC [     1,    0,    0,    0 ]
    NA   [     5,    0,    1,    1 ]
    NB   [     4,    0,    1,    1 ]

  @DF-UKS Final Energy:   -92.71943989566553

   => Energetics <=

    Nuclear Repulsion Energy =             18.9073268634489047
    One-Electron Energy =                -162.0110585453120677
    Two-Electron Energy =                  60.2152647212181193
    DFT Exchange-Correlation Energy =      -9.8309729350204869
    Empirical Dispersion Energy =           0.0000000000000000
    VV10 Nonlocal Energy =                  0.0000000000000000
    Total Energy =                        -92.7194398956655306

  UHF NO Occupations:
  HONO-2 :    1 B2 1.9987301
  HONO-1 :    1 B1 1.9987301
  HONO-0 :    5 A1 1.0000000
  LUNO+0 :    2 B2 0.0012699
  LUNO+1 :    2 B1 0.0012699
  LUNO+2 :    6 A1 0.0010043
  LUNO+3 :    7 A1 0.0000822


Computation Completed


Properties will be evaluated at   0.000000,   0.000000,   0.000000 [a0]

Properties computed using the SCF density matrix


 Multipole Moments:

 ------------------------------------------------------------------------------------
     Multipole            Electronic (a.u.)      Nuclear  (a.u.)        Total (a.u.)
 ------------------------------------------------------------------------------------

 L = 1.  Multiply by 2.5417464519 to convert [e a0] to [Debye]
 Dipole X            :          0.0000000            0.0000000            0.0000000
 Dipole Y            :          0.0000000            0.0000000            0.0000000
 Dipole Z            :          0.4530722            0.0015756            0.4546478
 Magnitude           :                                                    0.4546478

 ------------------------------------------------------------------------------------

*** tstop() called on Joses-MacBook-Pro-2.local at Wed Jul 16 18:59:25 2025
Module time:
	user time   =       2.90 seconds =       0.05 minutes
	system time =       4.31 seconds =       0.07 minutes
	total time  =          1 seconds =       0.02 minutes
Total time:
	user time   =       7.60 seconds =       0.13 minutes
	system time =      11.11 seconds =       0.19 minutes
	total time  =          2 seconds =       0.03 minutes

*** tstart() called on Joses-MacBook-Pro-2.local
*** at Wed Jul 16 18:59:25 2025


         ------------------------------------------------------------
                                   SCF GRAD                          
                          Rob Parrish, Justin Turney,                
                       Andy Simmonett, and Alex Sokolov              
         ------------------------------------------------------------

  ==> Geometry <==

    Molecular point group: c2v
    Full point group: C_inf_v

    Geometry (in Angstrom), charge = 0, multiplicity = 2:

       Center              X                  Y                   Z               Mass       
    ------------   -----------------  -----------------  -----------------  -----------------
         C            0.000000000000     0.000000000000     0.633022261308    12.000000000000
         N            0.000000000000     0.000000000000    -0.542471398301    14.003074004430

  Nuclear repulsion =   18.907326863448905

  ==> Basis Set <==

  Basis Set: CC-PVDZ
    Blend: CC-PVDZ
    Number of shells: 12
    Number of basis functions: 28
    Number of Cartesian functions: 30
    Spherical Harmonics?: true
    Max angular momentum: 2

  ==> DFJKGrad: Density-Fitted SCF Gradients <==

    Gradient:                    1
    J tasked:                  Yes
    K tasked:                  Yes
    wK tasked:                  No
    OpenMP threads:              1
    Integrals threads:           1
    Memory [MiB]:              375
    Schwarz Cutoff:          1E-12
    Fitting Condition:       1E-10

   => Auxiliary Basis Set <=

  Basis Set: (CC-PVDZ AUX)
    Blend: CC-PVDZ-JKFIT
    Number of shells: 48
    Number of basis functions: 140
    Number of Cartesian functions: 162
    Spherical Harmonics?: true
    Max angular momentum: 3

  ==> DFT Potential <==

   => LibXC <=

    Version 6.2.2
    S. Lehtola, C. Steigemann, M. J.T. Oliveira, and M. A.L. Marques.,  SoftwareX 7, 1–5 (2018) (10.1016/j.softx.2017.11.002)

   => Composite Functional: B3LYP <= 

    B3LYP Hyb-GGA Exchange-Correlation Functional

    P. J. Stephens, F. J. Devlin, C. F. Chabalowski, and M. J. Frisch.,  J. Phys. Chem. 98, 11623 (1994) (10.1021/j100096a001)

    Deriv               =              1
    GGA                 =           TRUE
    Meta                =          FALSE

    Exchange Hybrid     =           TRUE
    MP2 Hybrid          =          FALSE

   => Exchange Functionals <=

    0.0800   Slater exchange
    0.7200         Becke 88

   => Exact (HF) Exchange <=

    0.2000               HF 

   => Correlation Functionals <=

    0.1900   Vosko, Wilk & Nusair (VWN5_RPA)
    0.8100   Lee, Yang & Parr

   => LibXC Density Thresholds  <==

    XC_HYB_GGA_XC_B3LYP:  1.00E-15 

   => Molecular Quadrature <=

    Radial Scheme          =       TREUTLER
    Pruning Scheme         =           NONE
    Nuclear Scheme         =       TREUTLER

    Blocking Scheme        =         OCTREE
    BS radius alpha        =              1
    Pruning alpha          =              1
    Radial Points          =             75
    Spherical Points       =            302
    Total Points           =          42672
    Total Blocks           =            385
    Max Points             =            256
    Max Functions          =             28
    Weights Tolerance      =       1.00E-15


  -Total Gradient:
     Atom            X                  Y                   Z
    ------   -----------------  -----------------  -----------------
       1        0.000000000000     0.000000000000     0.000655277133
       2        0.000000000000     0.000000000000    -0.000651020189


*** tstop() called on Joses-MacBook-Pro-2.local at Wed Jul 16 18:59:25 2025
Module time:
	user time   =       0.48 seconds =       0.01 minutes
	system time =       0.96 seconds =       0.02 minutes
	total time  =          0 seconds =       0.00 minutes
Total time:
	user time   =       8.08 seconds =       0.13 minutes
	system time =      12.07 seconds =       0.20 minutes
	total time  =          2 seconds =       0.03 minutes

    			-----------------------------------------

    			 OPTKING 3.0: for geometry optimizations 

    			     By R.A. King, Bethel University     

    			        with contributions from          

    			    A.V. Copan, J. Cayton, A. Heide      

    			-----------------------------------------

    
	                            ===> Fragment 1 <== 

	 Z (Atomic Numbers)          Masses                          Geom                  
	       6.000000            12.000000          0.00000000  0.00000000  1.19623871   
	       7.000000            14.003074          0.00000000  0.00000000 -1.02512237   

	 - Coordinate -           - BOHR/RAD -       - ANG/DEG -
	 R(1,2)           =         2.221361           1.175494


	        --- Internal Coordinate Step in ANG or DEG, aJ/ANG or AJ/DEG ---
	-------------------------------------------------------------------------------
	           Coordinate      Previous         Force          Change          New 
	           ----------      --------        ------          ------        ------
	               R(1,2)       1.17549       -0.00538       -0.00033       1.17516
	-------------------------------------------------------------------------------

	                                 ==> Convergence Check <==                                  
    
	Measures of convergence in internal coordinates in au.
    
	Criteria marked as inactive (o), active & met (*), and active & unmet ( ).

	----------------------------------------------------------------------------------------------
	   Step    Total Energy     Delta E     Max Force     RMS Force      Max Disp      RMS Disp   
	----------------------------------------------------------------------------------------------
	  Convergence Criteria     1.00e-06 *    3.00e-04 *             o    1.20e-03 *             o
	----------------------------------------------------------------------------------------------
	     2     -92.71943990   -1.17e-03      6.53e-04      6.53e-04 o    6.30e-04 *    6.30e-04 o  ~
	----------------------------------------------------------------------------------------------

Next Geometry in Ang 
	Fragment 1 (Ang)

	    C   0.0000000000   0.0000000000   0.6328555120
	    N   0.0000000000   0.0000000000  -0.5423046490


    Structure for next step:
    Molecular point group: c2v
    Full point group: C_inf_v

    Geometry (in Angstrom), charge = 0, multiplicity = 2:

    C            0.000000000000     0.000000000000     0.632842666929
    N            0.000000000000     0.000000000000    -0.542317494055


Scratch directory: /tmp/
gradient() will perform analytic gradient computation.
   => Libint2 <=

    Primary   basis highest AM E, G, H:  6, 6, 3
    Auxiliary basis highest AM E, G, H:  7, 7, 4
    Onebody   basis highest AM E, G, H:  -, -, -
    Solid Harmonics ordering:            Gaussian

*** tstart() called on Joses-MacBook-Pro-2.local
*** at Wed Jul 16 18:59:25 2025

   => Loading Basis Set <=

    Name: CC-PVDZ
    Role: ORBITAL
    Keyword: BASIS
    atoms 1 entry C          line   138 file /Users/joseantoniorodriguesromero/anaconda3/share/psi4/basis/cc-pvdz.gbs 
    atoms 2 entry N          line   168 file /Users/joseantoniorodriguesromero/anaconda3/share/psi4/basis/cc-pvdz.gbs 


         ---------------------------------------------------------
                                   SCF
               by Justin Turney, Rob Parrish, Andy Simmonett
                          and Daniel G. A. Smith
                              UKS Reference
                        1 Threads,    500 MiB Core
         ---------------------------------------------------------

  ==> Geometry <==

    Molecular point group: c2v
    Full point group: C_inf_v

    Geometry (in Angstrom), charge = 0, multiplicity = 2:

       Center              X                  Y                   Z               Mass       
    ------------   -----------------  -----------------  -----------------  -----------------
         C            0.000000000000     0.000000000000     0.632842666929    12.000000000000
         N            0.000000000000     0.000000000000    -0.542317494055    14.003074004430

  Running in c2v symmetry.

  Rotational constants: A = ************  B =      1.88896  C =      1.88896 [cm^-1]
  Rotational constants: A = ************  B =  56629.55399  C =  56629.55399 [MHz]
  Nuclear repulsion =   18.912692572513819

  Charge       = 0
  Multiplicity = 2
  Electrons    = 13
  Nalpha       = 7
  Nbeta        = 6

  ==> Algorithm <==

  SCF Algorithm Type is DF.
  DIIS enabled.
  MOM disabled.
  Fractional occupation disabled.
  Guess Type is READ.
  Energy threshold   = 1.00e-08
  Density threshold  = 1.00e-08
  Integral threshold = 1.00e-12

  ==> Primary Basis <==

  Basis Set: CC-PVDZ
    Blend: CC-PVDZ
    Number of shells: 12
    Number of basis functions: 28
    Number of Cartesian functions: 30
    Spherical Harmonics?: true
    Max angular momentum: 2

  ==> DFT Potential <==

   => LibXC <=

    Version 6.2.2
    S. Lehtola, C. Steigemann, M. J.T. Oliveira, and M. A.L. Marques.,  SoftwareX 7, 1–5 (2018) (10.1016/j.softx.2017.11.002)

   => Composite Functional: B3LYP <= 

    B3LYP Hyb-GGA Exchange-Correlation Functional

    P. J. Stephens, F. J. Devlin, C. F. Chabalowski, and M. J. Frisch.,  J. Phys. Chem. 98, 11623 (1994) (10.1021/j100096a001)

    Deriv               =              1
    GGA                 =           TRUE
    Meta                =          FALSE

    Exchange Hybrid     =           TRUE
    MP2 Hybrid          =          FALSE

   => Exchange Functionals <=

    0.0800   Slater exchange
    0.7200         Becke 88

   => Exact (HF) Exchange <=

    0.2000               HF 

   => Correlation Functionals <=

    0.1900   Vosko, Wilk & Nusair (VWN5_RPA)
    0.8100   Lee, Yang & Parr

   => LibXC Density Thresholds  <==

    XC_HYB_GGA_XC_B3LYP:  1.00E-15 

   => Molecular Quadrature <=

    Radial Scheme          =       TREUTLER
    Pruning Scheme         =           NONE
    Nuclear Scheme         =       TREUTLER

    Blocking Scheme        =         OCTREE
    BS radius alpha        =              1
    Pruning alpha          =              1
    Radial Points          =             75
    Spherical Points       =            302
    Total Points           =          42672
    Total Blocks           =            385
    Max Points             =            256
    Max Functions          =             28
    Weights Tolerance      =       1.00E-15

   => Loading Basis Set <=

    Name: (CC-PVDZ AUX)
    Role: JKFIT
    Keyword: DF_BASIS_SCF
    atoms 1 entry C          line   121 file /Users/joseantoniorodriguesromero/anaconda3/share/psi4/basis/cc-pvdz-jkfit.gbs 
    atoms 2 entry N          line   171 file /Users/joseantoniorodriguesromero/anaconda3/share/psi4/basis/cc-pvdz-jkfit.gbs 

   => Loading Basis Set <=

    Name: CC-PVDZ
    Role: ORBITAL
    Keyword: BASIS
    atoms 1 entry C          line   138 file /Users/joseantoniorodriguesromero/anaconda3/share/psi4/basis/cc-pvdz.gbs 
    atoms 2 entry N          line   168 file /Users/joseantoniorodriguesromero/anaconda3/share/psi4/basis/cc-pvdz.gbs 

  Reading orbitals from file /tmp/doublet_CN.default.68761.180.npy, no projection.

  ==> Integral Setup <==

  DFHelper Memory: AOs need 0.001 GiB; user supplied 0.332 GiB. 
  Using in-core AOs.

  ==> MemDFJK: Density-Fitted J/K Matrices <==

    J tasked:                   Yes
    K tasked:                   Yes
    wK tasked:                   No
    OpenMP threads:               1
    Memory [MiB]:               339
    Algorithm:                 Core
    Schwarz Cutoff:           1E-12
    Mask sparsity (%):       0.0000
    Fitting Condition:        1E-10

   => Auxiliary Basis Set <=

  Basis Set: (CC-PVDZ AUX)
    Blend: CC-PVDZ-JKFIT
    Number of shells: 48
    Number of basis functions: 140
    Number of Cartesian functions: 162
    Spherical Harmonics?: true
    Max angular momentum: 3

  Cached 100.0% of DFT collocation blocks in 0.035 [GiB].

  Minimum eigenvalue in the overlap matrix is 1.0798547576E-02.
  Reciprocal condition number of the overlap matrix is 3.4708027831E-03.
    Using symmetric orthogonalization.

  ==> Pre-Iterations <==

  SCF Guess: Orbitals guess was supplied from a previous computation.

   -------------------------------------------------------
    Irrep   Nso     Nmo     Nalpha   Nbeta   Ndocc  Nsocc
   -------------------------------------------------------
     A1        14      14       5       4       4       1
     A2         2       2       0       0       0       0
     B1         6       6       1       1       1       0
     B2         6       6       1       1       1       0
   -------------------------------------------------------
    Total      28      28       7       6       6       1
   -------------------------------------------------------

  ==> Iterations <==

                           Total Energy        Delta E     RMS |[F,P]|

   @DF-UKS iter   0:   -92.71980487662911   -9.27198e+01   6.90284e-05 
   @DF-UKS iter   1:   -92.71944004490382    3.64832e-04   1.68385e-05 DIIS
   @DF-UKS iter   2:   -92.71943987335995    1.71544e-07   4.20926e-05 DIIS/DAMP=1%
   @DF-UKS iter   3:   -92.71944859071010   -8.71735e-06   8.32991e-06 DIIS/DAMP=1%
   @DF-UKS iter   4:   -92.71944077707195    7.81364e-06   1.64896e-06 DIIS/DAMP=1%
   @DF-UKS iter   5:   -92.71944026436731    5.12705e-07   2.43983e-07 DIIS/DAMP=1%
   @DF-UKS iter   6:   -92.71944007360511    1.90762e-07   1.74086e-07 DIIS/DAMP=1%
   @DF-UKS iter   7:   -92.71944008058730   -6.98219e-09   5.31060e-08 DIIS/DAMP=1%
   @DF-UKS iter   8:   -92.71944009336063   -1.27733e-08   3.39734e-08 DIIS/DAMP=1%
   @DF-UKS iter   9:   -92.71944008427629    9.08435e-09   1.09287e-09 DIIS/DAMP=1%
  Energy and wave function converged.


  ==> Post-Iterations <==

   Electrons on quadrature grid:
      Nalpha   =    6.9999999138 ; deviation = -8.616e-08
      Nbeta    =    5.9999999090 ; deviation = -9.101e-08
      Ntotal   =   12.9999998228 ; deviation = -1.772e-07 

   @Spin Contamination Metric:   7.245184044E-03
   @S^2 Expected:                7.500000000E-01
   @S^2 Observed:                7.572451840E-01
   @S   Expected:                5.000000000E-01
   @S   Observed:                5.000000000E-01

    Orbital Energies [Eh]
    ---------------------

    Alpha Occupied:                                                       

       1A1   -14.402491     2A1   -10.307018     3A1    -0.958859  
       4A1    -0.501507     5A1    -0.404818     1B1    -0.386550  
       1B2    -0.386550  

    Alpha Virtual:                                                        

       2B1    -0.010755     2B2    -0.010755     6A1     0.250099  
       3B1     0.447523     3B2     0.447523     7A1     0.491557  
       8A1     0.648033     9A1     0.733552     4B1     0.767962  
       4B2     0.767962    10A1     1.079612     1A2     1.079612  
       5B1     1.219411     5B2     1.219411    11A1     1.315866  
      12A1     1.842717     2A2     1.842717    13A1     1.903697  
       6B1     2.324651     6B2     2.324651    14A1     2.700557  

    Beta Occupied:                                                        

       1A1   -14.397835     2A1   -10.292253     3A1    -0.936732  
       4A1    -0.434054     1B1    -0.377462     1B2    -0.377462  

    Beta Virtual:                                                         

       5A1    -0.244291     2B1     0.011519     2B2     0.011519  
       6A1     0.263379     3B1     0.461108     3B2     0.461108  
       7A1     0.551535     8A1     0.660194     4B1     0.770189  
       4B2     0.770189     9A1     0.783299    10A1     1.098017  
       1A2     1.098017     5B1     1.264283     5B2     1.264283  
      11A1     1.331233    12A1     1.842682     2A2     1.842682  
      13A1     1.953892     6B1     2.351967     6B2     2.351967  
      14A1     2.727901  

    Final Occupation by Irrep:
             A1    A2    B1    B2 
    DOCC [     4,    0,    1,    1 ]
    SOCC [     1,    0,    0,    0 ]
    NA   [     5,    0,    1,    1 ]
    NB   [     4,    0,    1,    1 ]

  @DF-UKS Final Energy:   -92.71944008427629

   => Energetics <=

    Nuclear Repulsion Energy =             18.9126925725138193
    One-Electron Energy =                -162.0215671456501241
    Two-Electron Energy =                  60.2206859063633431
    DFT Exchange-Correlation Energy =      -9.8312514175033385
    Empirical Dispersion Energy =           0.0000000000000000
    VV10 Nonlocal Energy =                  0.0000000000000000
    Total Energy =                        -92.7194400842762860

  UHF NO Occupations:
  HONO-2 :    1 B1 1.9987302
  HONO-1 :    1 B2 1.9987302
  HONO-0 :    5 A1 1.0000000
  LUNO+0 :    2 B1 0.0012698
  LUNO+1 :    2 B2 0.0012698
  LUNO+2 :    6 A1 0.0010029
  LUNO+3 :    7 A1 0.0000821


Computation Completed


Properties will be evaluated at   0.000000,   0.000000,   0.000000 [a0]

Properties computed using the SCF density matrix


 Multipole Moments:

 ------------------------------------------------------------------------------------
     Multipole            Electronic (a.u.)      Nuclear  (a.u.)        Total (a.u.)
 ------------------------------------------------------------------------------------

 L = 1.  Multiply by 2.5417464519 to convert [e a0] to [Debye]
 Dipole X            :          0.0000000            0.0000000            0.0000000
 Dipole Y            :          0.0000000            0.0000000            0.0000000
 Dipole Z            :          0.4532700            0.0015752            0.4548451
 Magnitude           :                                                    0.4548451

 ------------------------------------------------------------------------------------

*** tstop() called on Joses-MacBook-Pro-2.local at Wed Jul 16 18:59:26 2025
Module time:
	user time   =       3.71 seconds =       0.06 minutes
	system time =       2.73 seconds =       0.05 minutes
	total time  =          1 seconds =       0.02 minutes
Total time:
	user time   =      11.85 seconds =       0.20 minutes
	system time =      15.12 seconds =       0.25 minutes
	total time  =          3 seconds =       0.05 minutes

*** tstart() called on Joses-MacBook-Pro-2.local
*** at Wed Jul 16 18:59:26 2025


         ------------------------------------------------------------
                                   SCF GRAD                          
                          Rob Parrish, Justin Turney,                
                       Andy Simmonett, and Alex Sokolov              
         ------------------------------------------------------------

  ==> Geometry <==

    Molecular point group: c2v
    Full point group: C_inf_v

    Geometry (in Angstrom), charge = 0, multiplicity = 2:

       Center              X                  Y                   Z               Mass       
    ------------   -----------------  -----------------  -----------------  -----------------
         C            0.000000000000     0.000000000000     0.632842666929    12.000000000000
         N            0.000000000000     0.000000000000    -0.542317494055    14.003074004430

  Nuclear repulsion =   18.912692572513819

  ==> Basis Set <==

  Basis Set: CC-PVDZ
    Blend: CC-PVDZ
    Number of shells: 12
    Number of basis functions: 28
    Number of Cartesian functions: 30
    Spherical Harmonics?: true
    Max angular momentum: 2

  ==> DFJKGrad: Density-Fitted SCF Gradients <==

    Gradient:                    1
    J tasked:                  Yes
    K tasked:                  Yes
    wK tasked:                  No
    OpenMP threads:              1
    Integrals threads:           1
    Memory [MiB]:              375
    Schwarz Cutoff:          1E-12
    Fitting Condition:       1E-10

   => Auxiliary Basis Set <=

  Basis Set: (CC-PVDZ AUX)
    Blend: CC-PVDZ-JKFIT
    Number of shells: 48
    Number of basis functions: 140
    Number of Cartesian functions: 162
    Spherical Harmonics?: true
    Max angular momentum: 3

  ==> DFT Potential <==

   => LibXC <=

    Version 6.2.2
    S. Lehtola, C. Steigemann, M. J.T. Oliveira, and M. A.L. Marques.,  SoftwareX 7, 1–5 (2018) (10.1016/j.softx.2017.11.002)

   => Composite Functional: B3LYP <= 

    B3LYP Hyb-GGA Exchange-Correlation Functional

    P. J. Stephens, F. J. Devlin, C. F. Chabalowski, and M. J. Frisch.,  J. Phys. Chem. 98, 11623 (1994) (10.1021/j100096a001)

    Deriv               =              1
    GGA                 =           TRUE
    Meta                =          FALSE

    Exchange Hybrid     =           TRUE
    MP2 Hybrid          =          FALSE

   => Exchange Functionals <=

    0.0800   Slater exchange
    0.7200         Becke 88

   => Exact (HF) Exchange <=

    0.2000               HF 

   => Correlation Functionals <=

    0.1900   Vosko, Wilk & Nusair (VWN5_RPA)
    0.8100   Lee, Yang & Parr

   => LibXC Density Thresholds  <==

    XC_HYB_GGA_XC_B3LYP:  1.00E-15 

   => Molecular Quadrature <=

    Radial Scheme          =       TREUTLER
    Pruning Scheme         =           NONE
    Nuclear Scheme         =       TREUTLER

    Blocking Scheme        =         OCTREE
    BS radius alpha        =              1
    Pruning alpha          =              1
    Radial Points          =             75
    Spherical Points       =            302
    Total Points           =          42672
    Total Blocks           =            385
    Max Points             =            256
    Max Functions          =             28
    Weights Tolerance      =       1.00E-15


  -Total Gradient:
     Atom            X                  Y                   Z
    ------   -----------------  -----------------  -----------------
       1       -0.000000000000     0.000000000000    -0.000054745317
       2       -0.000000000000    -0.000000000000     0.000059012094


*** tstop() called on Joses-MacBook-Pro-2.local at Wed Jul 16 18:59:26 2025
Module time:
	user time   =       0.37 seconds =       0.01 minutes
	system time =       1.24 seconds =       0.02 minutes
	total time  =          0 seconds =       0.00 minutes
Total time:
	user time   =      12.23 seconds =       0.20 minutes
	system time =      16.36 seconds =       0.27 minutes
	total time  =          3 seconds =       0.05 minutes

    			-----------------------------------------

    			 OPTKING 3.0: for geometry optimizations 

    			     By R.A. King, Bethel University     

    			        with contributions from          

    			    A.V. Copan, J. Cayton, A. Heide      

    			-----------------------------------------

    
	                            ===> Fragment 1 <== 

	 Z (Atomic Numbers)          Masses                          Geom                  
	       6.000000            12.000000          0.00000000  0.00000000  1.19589932   
	       7.000000            14.003074          0.00000000  0.00000000 -1.02483154   

	 - Coordinate -           - BOHR/RAD -       - ANG/DEG -
	 R(1,2)           =         2.220731           1.175160


	        --- Internal Coordinate Step in ANG or DEG, aJ/ANG or AJ/DEG ---
	-------------------------------------------------------------------------------
	           Coordinate      Previous         Force          Change          New 
	           ----------      --------        ------          ------        ------
	               R(1,2)       1.17516        0.00047        0.00003       1.17519
	-------------------------------------------------------------------------------

	                                 ==> Convergence Check <==                                  
    
	Measures of convergence in internal coordinates in au.
    
	Criteria marked as inactive (o), active & met (*), and active & unmet ( ).

	----------------------------------------------------------------------------------------------
	   Step    Total Energy     Delta E     Max Force     RMS Force      Max Disp      RMS Disp   
	----------------------------------------------------------------------------------------------
	  Convergence Criteria     1.00e-06 *    3.00e-04 *             o    1.20e-03 *             o
	----------------------------------------------------------------------------------------------
	     3     -92.71944008   -1.89e-07 *    5.69e-05 *    5.69e-05 o    5.48e-05 *    5.48e-05 o  ~
	----------------------------------------------------------------------------------------------

Next Geometry in Ang 
	Fragment 1 (Ang)

	    C   0.0000000000   0.0000000000   0.6328571711
	    N   0.0000000000   0.0000000000  -0.5423319983


    Final optimized geometry and variables:
    Molecular point group: c2v
    Full point group: C_inf_v

    Geometry (in Angstrom), charge = 0, multiplicity = 2:

    C            0.000000000000     0.000000000000     0.632842666929
    N            0.000000000000     0.000000000000    -0.542317494055


    Psi4 stopped on: Wednesday, 16 July 2025 06:59PM
    Psi4 wall time for execution: 0:00:03.34

*** Psi4 exiting successfully. Buy a developer a beer!
