
    -----------------------------------------------------------------------
          Psi4: An Open-Source Ab Initio Electronic Structure Package
                               Psi4 1.9.1 release

                         Git: Rev {} zzzzzzz 


    D. G. A. Smith, L. A. Burns, A. C. Simmonett, R. M. Parrish,
    M. C. Schieber, R. Galvelis, P. Kraus, H. Kruse, R. Di Remigio,
    A. Alenaizan, A. M. James, S. Lehtola, J. P. Misiewicz, M. Scheurer,
    R. A. Shaw, J. B. Schriber, Y. Xie, Z. L. Glick, D. A. Sirianni,
    J. S. O'Brien, J. M. Waldrop, A. Kumar, E. G. Hohenstein,
    B. P. Pritchard, B. R. Brooks, H. F. Schaefer III, A. Yu. Sokolov,
    K. Patkowski, A. E. DePrince III, U. Bozkaya, R. A. King,
    F. A. Evangelista, J. M. Turney, T. D. Crawford, C. D. Sherrill,
    J. Chem. Phys. 152(18) 184108 (2020). https://doi.org/10.1063/5.0006002

                            Additional Code Authors
    E. T. Seidl, C. L. Janssen, E. F. Valeev, M. L. Leininger,
    J. F. Gonthier, R. M. Richard, H. R. McAlexander, M. Saitow, X. Wang,
    P. Verma, M. H. Lechner, A. Jiang, S. Behnle, A. G. Heide,
    M. F. Herbst, and D. L. Poole

             Previous Authors, Complete List of Code Contributors,
                       and Citations for Specific Modules
    https://github.com/psi4/psi4/blob/master/codemeta.json
    https://github.com/psi4/psi4/graphs/contributors
    http://psicode.org/psi4manual/master/introduction.html#citing-psifour

    -----------------------------------------------------------------------


    Psi4 started on: Wednesday, 16 July 2025 06:49PM

    Process ID: 68555
    Host:       Joses-MacBook-Pro-2.local
    PSIDATADIR: /Users/joseantoniorodriguesromero/anaconda3/share/psi4
    Memory:     500.0 MiB
    Threads:    1
    
  ==> Input File <==

--------------------------------------------------------------------------
molecule { 
0 2
B   0.00000        0.60000        0.00000
O   0.00000       -0.60000        0.00000
}

set { 
basis              cc-pvdz
reference          uks
maxiter            500
geom_maxiter       500
DAMPING_PERCENTAGE 1
guess              SAP
}

optimize('b3lyp')
--------------------------------------------------------------------------

Scratch directory: /tmp/
gradient() will perform analytic gradient computation.
   => Libint2 <=

    Primary   basis highest AM E, G, H:  6, 6, 3
    Auxiliary basis highest AM E, G, H:  7, 7, 4
    Onebody   basis highest AM E, G, H:  -, -, -
    Solid Harmonics ordering:            Gaussian

*** tstart() called on Joses-MacBook-Pro-2.local
*** at Wed Jul 16 18:49:59 2025

   => Loading Basis Set <=

    Name: CC-PVDZ
    Role: ORBITAL
    Keyword: BASIS
    atoms 1 entry B          line   108 file /Users/joseantoniorodriguesromero/anaconda3/share/psi4/basis/cc-pvdz.gbs 
    atoms 2 entry O          line   198 file /Users/joseantoniorodriguesromero/anaconda3/share/psi4/basis/cc-pvdz.gbs 


         ---------------------------------------------------------
                                   SCF
               by Justin Turney, Rob Parrish, Andy Simmonett
                          and Daniel G. A. Smith
                              UKS Reference
                        1 Threads,    500 MiB Core
         ---------------------------------------------------------

  ==> Geometry <==

    Molecular point group: c2v
    Full point group: C_inf_v

    Geometry (in Angstrom), charge = 0, multiplicity = 2:

       Center              X                  Y                   Z               Mass       
    ------------   -----------------  -----------------  -----------------  -----------------
         B            0.000000000000     0.000000000000     0.710774003397    11.009305360000
         O            0.000000000000     0.000000000000    -0.489225996603    15.994914619570

  Running in c2v symmetry.

  Rotational constants: A = ************  B =      1.79525  C =      1.79525 [cm^-1]
  Rotational constants: A = ************  B =  53820.10002  C =  53820.10002 [MHz]
  Nuclear repulsion =   17.639240355666669

  Charge       = 0
  Multiplicity = 2
  Electrons    = 13
  Nalpha       = 7
  Nbeta        = 6

  ==> Algorithm <==

  SCF Algorithm Type is DF.
  DIIS enabled.
  MOM disabled.
  Fractional occupation disabled.
  Guess Type is SAP.
  Energy threshold   = 1.00e-08
  Density threshold  = 1.00e-08
  Integral threshold = 1.00e-12

  ==> Primary Basis <==

  Basis Set: CC-PVDZ
    Blend: CC-PVDZ
    Number of shells: 12
    Number of basis functions: 28
    Number of Cartesian functions: 30
    Spherical Harmonics?: true
    Max angular momentum: 2

  ==> DFT Potential <==

   => LibXC <=

    Version 6.2.2
    S. Lehtola, C. Steigemann, M. J.T. Oliveira, and M. A.L. Marques.,  SoftwareX 7, 1–5 (2018) (10.1016/j.softx.2017.11.002)

   => Composite Functional: B3LYP <= 

    B3LYP Hyb-GGA Exchange-Correlation Functional

    P. J. Stephens, F. J. Devlin, C. F. Chabalowski, and M. J. Frisch.,  J. Phys. Chem. 98, 11623 (1994) (10.1021/j100096a001)

    Deriv               =              1
    GGA                 =           TRUE
    Meta                =          FALSE

    Exchange Hybrid     =           TRUE
    MP2 Hybrid          =          FALSE

   => Exchange Functionals <=

    0.0800   Slater exchange
    0.7200         Becke 88

   => Exact (HF) Exchange <=

    0.2000               HF 

   => Correlation Functionals <=

    0.1900   Vosko, Wilk & Nusair (VWN5_RPA)
    0.8100   Lee, Yang & Parr

   => LibXC Density Thresholds  <==

    XC_HYB_GGA_XC_B3LYP:  1.00E-15 

   => Molecular Quadrature <=

    Radial Scheme          =       TREUTLER
    Pruning Scheme         =           NONE
    Nuclear Scheme         =       TREUTLER

    Blocking Scheme        =         OCTREE
    BS radius alpha        =              1
    Pruning alpha          =              1
    Radial Points          =             75
    Spherical Points       =            302
    Total Points           =          43261
    Total Blocks           =            392
    Max Points             =            256
    Max Functions          =             28
    Weights Tolerance      =       1.00E-15

   => Loading Basis Set <=

    Name: (CC-PVDZ AUX)
    Role: JKFIT
    Keyword: DF_BASIS_SCF
    atoms 1 entry B          line    71 file /Users/joseantoniorodriguesromero/anaconda3/share/psi4/basis/cc-pvdz-jkfit.gbs 
    atoms 2 entry O          line   221 file /Users/joseantoniorodriguesromero/anaconda3/share/psi4/basis/cc-pvdz-jkfit.gbs 

  ==> Integral Setup <==

  DFHelper Memory: AOs need 0.001 GiB; user supplied 0.332 GiB. 
  Using in-core AOs.

  ==> MemDFJK: Density-Fitted J/K Matrices <==

    J tasked:                   Yes
    K tasked:                   Yes
    wK tasked:                   No
    OpenMP threads:               1
    Memory [MiB]:               339
    Algorithm:                 Core
    Schwarz Cutoff:           1E-12
    Mask sparsity (%):       0.0000
    Fitting Condition:        1E-10

   => Auxiliary Basis Set <=

  Basis Set: (CC-PVDZ AUX)
    Blend: CC-PVDZ-JKFIT
    Number of shells: 48
    Number of basis functions: 140
    Number of Cartesian functions: 162
    Spherical Harmonics?: true
    Max angular momentum: 3

  Cached 100.0% of DFT collocation blocks in 0.034 [GiB].

  Minimum eigenvalue in the overlap matrix is 2.6021757573E-02.
  Reciprocal condition number of the overlap matrix is 8.6042066289E-03.
    Using symmetric orthogonalization.

  ==> Pre-Iterations <==

  SCF Guess: Superposition of Atomic Potentials (doi:10.1021/acs.jctc.8b01089).

  ==> SAP guess <==

   => Molecular Quadrature <=

    Radial Scheme          =       TREUTLER
    Pruning Scheme         =           NONE
    Nuclear Scheme         =       TREUTLER

    Blocking Scheme        =         OCTREE
    BS radius alpha        =              1
    Pruning alpha          =              1
    Radial Points          =             75
    Spherical Points       =            302
    Total Points           =          43261
    Total Blocks           =            392
    Max Points             =            256
    Max Functions          =             28
    Weights Tolerance      =       1.00E-15

   -------------------------------------------------------
    Irrep   Nso     Nmo     Nalpha   Nbeta   Ndocc  Nsocc
   -------------------------------------------------------
     A1        14      14       5       4       4       1
     A2         2       2       0       0       0       0
     B1         6       6       1       1       1       0
     B2         6       6       1       1       1       0
   -------------------------------------------------------
    Total      28      28       7       6       6       1
   -------------------------------------------------------

  ==> Iterations <==

                           Total Energy        Delta E     RMS |[F,P]|

   @DF-UKS iter   1:   -99.73586915913951   -9.97359e+01   5.09950e-02 DIIS/ADIIS
   @DF-UKS iter   2:   -97.23481383014445    2.50106e+00   1.34385e-01 ADIIS/DAMP=1%
   @DF-UKS iter   3:   -99.78244315547012   -2.54763e+00   4.35283e-02 DIIS/ADIIS/DAMP=1%
   @DF-UKS iter   4:  -100.01401465947441   -2.31572e-01   1.41081e-03 DIIS/ADIIS/DAMP=1%
   @DF-UKS iter   5:  -100.03230251511886   -1.82879e-02   1.38975e-03 DIIS/ADIIS/DAMP=1%
   @DF-UKS iter   6:  -100.03218871427077    1.13801e-04   7.52108e-05 DIIS/DAMP=1%
   @DF-UKS iter   7:  -100.03252598497264   -3.37271e-04   5.29718e-05 DIIS/DAMP=1%
   @DF-UKS iter   8:  -100.03259178851474   -6.58035e-05   9.68623e-06 DIIS/DAMP=1%
   @DF-UKS iter   9:  -100.03257754057968    1.42479e-05   5.64624e-06 DIIS/DAMP=1%
   @DF-UKS iter  10:  -100.03257320536648    4.33521e-06   2.93359e-07 DIIS/DAMP=1%
   @DF-UKS iter  11:  -100.03257500734713   -1.80198e-06   1.48782e-07 DIIS/DAMP=1%
   @DF-UKS iter  12:  -100.03257499762175    9.72538e-09   4.87080e-09 DIIS/DAMP=1%
  Energy and wave function converged.


  ==> Post-Iterations <==

   Electrons on quadrature grid:
      Nalpha   =    7.0000001212 ; deviation = 1.212e-07
      Nbeta    =    6.0000000822 ; deviation = 8.223e-08
      Ntotal   =   13.0000002035 ; deviation = 2.035e-07 

   @Spin Contamination Metric:   7.391341211E-03
   @S^2 Expected:                7.500000000E-01
   @S^2 Observed:                7.573913412E-01
   @S   Expected:                5.000000000E-01
   @S   Observed:                5.000000000E-01

    Orbital Energies [Eh]
    ---------------------

    Alpha Occupied:                                                       

       1A1   -19.162447     2A1    -6.844245     3A1    -1.008366  
       4A1    -0.449264     1B2    -0.375457     1B1    -0.375457  
       5A1    -0.345721  

    Alpha Virtual:                                                        

       2B2    -0.008941     2B1    -0.008941     6A1     0.145666  
       3B1     0.278847     3B2     0.278847     7A1     0.296358  
       8A1     0.572906     9A1     0.670790     1A2     0.670790  
       4B2     0.838952     4B1     0.838952    10A1     0.881170  
       5B1     1.007892     5B2     1.007892    11A1     1.404752  
      12A1     1.690154     2A2     2.631524    13A1     2.631525  
       6B1     2.924253     6B2     2.924253    14A1     3.377146  

    Beta Occupied:                                                        

       1A1   -19.162781     2A1    -6.828742     3A1    -1.005969  
       4A1    -0.435442     1B2    -0.375033     1B1    -0.375033  

    Beta Virtual:                                                         

       5A1    -0.172990     2B2     0.021969     2B1     0.021969  
       6A1     0.157000     3B1     0.299094     3B2     0.299094  
       7A1     0.361043     8A1     0.628830     1A2     0.700605  
       9A1     0.700605    10A1     0.885364     4B2     0.889503  
       4B1     0.889503     5B1     1.004990     5B2     1.004990  
      11A1     1.436671    12A1     1.693806     2A2     2.625160  
      13A1     2.625162     6B1     2.929616     6B2     2.929616  
      14A1     3.383398  

    Final Occupation by Irrep:
             A1    A2    B1    B2 
    DOCC [     4,    0,    1,    1 ]
    SOCC [     1,    0,    0,    0 ]
    NA   [     5,    0,    1,    1 ]
    NB   [     4,    0,    1,    1 ]

  @DF-UKS Final Energy:  -100.03257499762175

   => Energetics <=

    Nuclear Repulsion Energy =             17.6392403556666686
    One-Electron Energy =                -171.2678545947470070
    Two-Electron Energy =                  63.7872969338342131
    DFT Exchange-Correlation Energy =     -10.1912576923756166
    Empirical Dispersion Energy =           0.0000000000000000
    VV10 Nonlocal Energy =                  0.0000000000000000
    Total Energy =                       -100.0325749976217509

  UHF NO Occupations:
  HONO-2 :    1 B2 1.9982065
  HONO-1 :    1 B1 1.9982065
  HONO-0 :    5 A1 1.0000000
  LUNO+0 :    2 B1 0.0017935
  LUNO+1 :    2 B2 0.0017935
  LUNO+2 :    6 A1 0.0001038
  LUNO+3 :    7 A1 0.0000080


Computation Completed


Properties will be evaluated at   0.000000,   0.000000,   0.000000 [a0]

Properties computed using the SCF density matrix


 Multipole Moments:

 ------------------------------------------------------------------------------------
     Multipole            Electronic (a.u.)      Nuclear  (a.u.)        Total (a.u.)
 ------------------------------------------------------------------------------------

 L = 1.  Multiply by 2.5417464519 to convert [e a0] to [Debye]
 Dipole X            :          0.0000000            0.0000000            0.0000000
 Dipole Y            :          0.0000000            0.0000000            0.0000000
 Dipole Z            :          1.4795997           -0.6801842            0.7994156
 Magnitude           :                                                    0.7994156

 ------------------------------------------------------------------------------------

*** tstop() called on Joses-MacBook-Pro-2.local at Wed Jul 16 18:50:00 2025
Module time:
	user time   =       3.16 seconds =       0.05 minutes
	system time =       6.61 seconds =       0.11 minutes
	total time  =          1 seconds =       0.02 minutes
Total time:
	user time   =       3.16 seconds =       0.05 minutes
	system time =       6.61 seconds =       0.11 minutes
	total time  =          1 seconds =       0.02 minutes

*** tstart() called on Joses-MacBook-Pro-2.local
*** at Wed Jul 16 18:50:00 2025


         ------------------------------------------------------------
                                   SCF GRAD                          
                          Rob Parrish, Justin Turney,                
                       Andy Simmonett, and Alex Sokolov              
         ------------------------------------------------------------

  ==> Geometry <==

    Molecular point group: c2v
    Full point group: C_inf_v

    Geometry (in Angstrom), charge = 0, multiplicity = 2:

       Center              X                  Y                   Z               Mass       
    ------------   -----------------  -----------------  -----------------  -----------------
         B            0.000000000000     0.000000000000     0.710774003397    11.009305360000
         O            0.000000000000     0.000000000000    -0.489225996603    15.994914619570

  Nuclear repulsion =   17.639240355666669

  ==> Basis Set <==

  Basis Set: CC-PVDZ
    Blend: CC-PVDZ
    Number of shells: 12
    Number of basis functions: 28
    Number of Cartesian functions: 30
    Spherical Harmonics?: true
    Max angular momentum: 2

  ==> DFJKGrad: Density-Fitted SCF Gradients <==

    Gradient:                    1
    J tasked:                  Yes
    K tasked:                  Yes
    wK tasked:                  No
    OpenMP threads:              1
    Integrals threads:           1
    Memory [MiB]:              375
    Schwarz Cutoff:          1E-12
    Fitting Condition:       1E-10

   => Auxiliary Basis Set <=

  Basis Set: (CC-PVDZ AUX)
    Blend: CC-PVDZ-JKFIT
    Number of shells: 48
    Number of basis functions: 140
    Number of Cartesian functions: 162
    Spherical Harmonics?: true
    Max angular momentum: 3

  ==> DFT Potential <==

   => LibXC <=

    Version 6.2.2
    S. Lehtola, C. Steigemann, M. J.T. Oliveira, and M. A.L. Marques.,  SoftwareX 7, 1–5 (2018) (10.1016/j.softx.2017.11.002)

   => Composite Functional: B3LYP <= 

    B3LYP Hyb-GGA Exchange-Correlation Functional

    P. J. Stephens, F. J. Devlin, C. F. Chabalowski, and M. J. Frisch.,  J. Phys. Chem. 98, 11623 (1994) (10.1021/j100096a001)

    Deriv               =              1
    GGA                 =           TRUE
    Meta                =          FALSE

    Exchange Hybrid     =           TRUE
    MP2 Hybrid          =          FALSE

   => Exchange Functionals <=

    0.0800   Slater exchange
    0.7200         Becke 88

   => Exact (HF) Exchange <=

    0.2000               HF 

   => Correlation Functionals <=

    0.1900   Vosko, Wilk & Nusair (VWN5_RPA)
    0.8100   Lee, Yang & Parr

   => LibXC Density Thresholds  <==

    XC_HYB_GGA_XC_B3LYP:  1.00E-15 

   => Molecular Quadrature <=

    Radial Scheme          =       TREUTLER
    Pruning Scheme         =           NONE
    Nuclear Scheme         =       TREUTLER

    Blocking Scheme        =         OCTREE
    BS radius alpha        =              1
    Pruning alpha          =              1
    Radial Points          =             75
    Spherical Points       =            302
    Total Points           =          43261
    Total Blocks           =            392
    Max Points             =            256
    Max Functions          =             28
    Weights Tolerance      =       1.00E-15


  -Total Gradient:
     Atom            X                  Y                   Z
    ------   -----------------  -----------------  -----------------
       1        0.000000000000    -0.000000000000    -0.013486318187
       2        0.000000000000     0.000000000000     0.013501061799


*** tstop() called on Joses-MacBook-Pro-2.local at Wed Jul 16 18:50:00 2025
Module time:
	user time   =       0.71 seconds =       0.01 minutes
	system time =       1.27 seconds =       0.02 minutes
	total time  =          0 seconds =       0.00 minutes
Total time:
	user time   =       3.87 seconds =       0.06 minutes
	system time =       7.89 seconds =       0.13 minutes
	total time  =          1 seconds =       0.02 minutes

    			-----------------------------------------

    			 OPTKING 3.0: for geometry optimizations 

    			     By R.A. King, Bethel University     

    			        with contributions from          

    			    A.V. Copan, J. Cayton, A. Heide      

    			-----------------------------------------

    
	                            ===> Fragment 1 <== 

	 Z (Atomic Numbers)          Masses                          Geom                  
	       5.000000            11.009305          0.00000000  0.00000000  1.34316820   
	       8.000000            15.994915          0.00000000  0.00000000 -0.92450315   

	 - Coordinate -           - BOHR/RAD -       - ANG/DEG -
	 R(1,2)           =         2.267671           1.200000


	        --- Internal Coordinate Step in ANG or DEG, aJ/ANG or AJ/DEG ---
	-------------------------------------------------------------------------------
	           Coordinate      Previous         Force          Change          New 
	           ----------      --------        ------          ------        ------
	               R(1,2)       1.20000        0.11117        0.00681       1.20681
	-------------------------------------------------------------------------------

	                                 ==> Convergence Check <==                                  
    
	Measures of convergence in internal coordinates in au.
    
	Criteria marked as inactive (o), active & met (*), and active & unmet ( ).

	----------------------------------------------------------------------------------------------
	   Step    Total Energy     Delta E     Max Force     RMS Force      Max Disp      RMS Disp   
	----------------------------------------------------------------------------------------------
	  Convergence Criteria     1.00e-06 *    3.00e-04 *             o    1.20e-03 *             o
	----------------------------------------------------------------------------------------------
	     1    -100.03257500   -1.00e+02      1.35e-02      1.35e-02 o    1.29e-02      1.29e-02 o  ~
	----------------------------------------------------------------------------------------------

Next Geometry in Ang 
	Fragment 1 (Ang)

	    B   0.0000000000   0.0000000000   0.7141794420
	    O   0.0000000000   0.0000000000  -0.4926314352


    Structure for next step:
    Molecular point group: c2v
    Full point group: C_inf_v

    Geometry (in Angstrom), charge = 0, multiplicity = 2:

    B            0.000000000000     0.000000000000     0.714808165427
    O            0.000000000000     0.000000000000    -0.492002711748


Scratch directory: /tmp/
gradient() will perform analytic gradient computation.
   => Libint2 <=

    Primary   basis highest AM E, G, H:  6, 6, 3
    Auxiliary basis highest AM E, G, H:  7, 7, 4
    Onebody   basis highest AM E, G, H:  -, -, -
    Solid Harmonics ordering:            Gaussian

*** tstart() called on Joses-MacBook-Pro-2.local
*** at Wed Jul 16 18:50:00 2025

   => Loading Basis Set <=

    Name: CC-PVDZ
    Role: ORBITAL
    Keyword: BASIS
    atoms 1 entry B          line   108 file /Users/joseantoniorodriguesromero/anaconda3/share/psi4/basis/cc-pvdz.gbs 
    atoms 2 entry O          line   198 file /Users/joseantoniorodriguesromero/anaconda3/share/psi4/basis/cc-pvdz.gbs 


         ---------------------------------------------------------
                                   SCF
               by Justin Turney, Rob Parrish, Andy Simmonett
                          and Daniel G. A. Smith
                              UKS Reference
                        1 Threads,    500 MiB Core
         ---------------------------------------------------------

  ==> Geometry <==

    Molecular point group: c2v
    Full point group: C_inf_v

    Geometry (in Angstrom), charge = 0, multiplicity = 2:

       Center              X                  Y                   Z               Mass       
    ------------   -----------------  -----------------  -----------------  -----------------
         B            0.000000000000     0.000000000000     0.714808165427    11.009305360000
         O            0.000000000000     0.000000000000    -0.492002711748    15.994914619570

  Running in c2v symmetry.

  Rotational constants: A = ************  B =      1.77504  C =      1.77504 [cm^-1]
  Rotational constants: A = ************  B =  53214.32538  C =  53214.32538 [MHz]
  Nuclear repulsion =   17.539689794939758

  Charge       = 0
  Multiplicity = 2
  Electrons    = 13
  Nalpha       = 7
  Nbeta        = 6

  ==> Algorithm <==

  SCF Algorithm Type is DF.
  DIIS enabled.
  MOM disabled.
  Fractional occupation disabled.
  Guess Type is READ.
  Energy threshold   = 1.00e-08
  Density threshold  = 1.00e-08
  Integral threshold = 1.00e-12

  ==> Primary Basis <==

  Basis Set: CC-PVDZ
    Blend: CC-PVDZ
    Number of shells: 12
    Number of basis functions: 28
    Number of Cartesian functions: 30
    Spherical Harmonics?: true
    Max angular momentum: 2

  ==> DFT Potential <==

   => LibXC <=

    Version 6.2.2
    S. Lehtola, C. Steigemann, M. J.T. Oliveira, and M. A.L. Marques.,  SoftwareX 7, 1–5 (2018) (10.1016/j.softx.2017.11.002)

   => Composite Functional: B3LYP <= 

    B3LYP Hyb-GGA Exchange-Correlation Functional

    P. J. Stephens, F. J. Devlin, C. F. Chabalowski, and M. J. Frisch.,  J. Phys. Chem. 98, 11623 (1994) (10.1021/j100096a001)

    Deriv               =              1
    GGA                 =           TRUE
    Meta                =          FALSE

    Exchange Hybrid     =           TRUE
    MP2 Hybrid          =          FALSE

   => Exchange Functionals <=

    0.0800   Slater exchange
    0.7200         Becke 88

   => Exact (HF) Exchange <=

    0.2000               HF 

   => Correlation Functionals <=

    0.1900   Vosko, Wilk & Nusair (VWN5_RPA)
    0.8100   Lee, Yang & Parr

   => LibXC Density Thresholds  <==

    XC_HYB_GGA_XC_B3LYP:  1.00E-15 

   => Molecular Quadrature <=

    Radial Scheme          =       TREUTLER
    Pruning Scheme         =           NONE
    Nuclear Scheme         =       TREUTLER

    Blocking Scheme        =         OCTREE
    BS radius alpha        =              1
    Pruning alpha          =              1
    Radial Points          =             75
    Spherical Points       =            302
    Total Points           =          43261
    Total Blocks           =            391
    Max Points             =            256
    Max Functions          =             28
    Weights Tolerance      =       1.00E-15

   => Loading Basis Set <=

    Name: (CC-PVDZ AUX)
    Role: JKFIT
    Keyword: DF_BASIS_SCF
    atoms 1 entry B          line    71 file /Users/joseantoniorodriguesromero/anaconda3/share/psi4/basis/cc-pvdz-jkfit.gbs 
    atoms 2 entry O          line   221 file /Users/joseantoniorodriguesromero/anaconda3/share/psi4/basis/cc-pvdz-jkfit.gbs 

   => Loading Basis Set <=

    Name: CC-PVDZ
    Role: ORBITAL
    Keyword: BASIS
    atoms 1 entry B          line   108 file /Users/joseantoniorodriguesromero/anaconda3/share/psi4/basis/cc-pvdz.gbs 
    atoms 2 entry O          line   198 file /Users/joseantoniorodriguesromero/anaconda3/share/psi4/basis/cc-pvdz.gbs 

  Reading orbitals from file /tmp/doublet_BO.default.68555.180.npy, no projection.

  ==> Integral Setup <==

  DFHelper Memory: AOs need 0.001 GiB; user supplied 0.332 GiB. 
  Using in-core AOs.

  ==> MemDFJK: Density-Fitted J/K Matrices <==

    J tasked:                   Yes
    K tasked:                   Yes
    wK tasked:                   No
    OpenMP threads:               1
    Memory [MiB]:               339
    Algorithm:                 Core
    Schwarz Cutoff:           1E-12
    Mask sparsity (%):       0.0000
    Fitting Condition:        1E-10

   => Auxiliary Basis Set <=

  Basis Set: (CC-PVDZ AUX)
    Blend: CC-PVDZ-JKFIT
    Number of shells: 48
    Number of basis functions: 140
    Number of Cartesian functions: 162
    Spherical Harmonics?: true
    Max angular momentum: 3

  Cached 100.0% of DFT collocation blocks in 0.034 [GiB].

  Minimum eigenvalue in the overlap matrix is 2.6421636009E-02.
  Reciprocal condition number of the overlap matrix is 8.7457730498E-03.
    Using symmetric orthogonalization.

  ==> Pre-Iterations <==

  SCF Guess: Orbitals guess was supplied from a previous computation.

   -------------------------------------------------------
    Irrep   Nso     Nmo     Nalpha   Nbeta   Ndocc  Nsocc
   -------------------------------------------------------
     A1        14      14       5       4       4       1
     A2         2       2       0       0       0       0
     B1         6       6       1       1       1       0
     B2         6       6       1       1       1       0
   -------------------------------------------------------
    Total      28      28       7       6       6       1
   -------------------------------------------------------

  ==> Iterations <==

                           Total Energy        Delta E     RMS |[F,P]|

   @DF-UKS iter   0:  -100.02705560220764   -1.00027e+02   1.33873e-03 
   @DF-UKS iter   1:  -100.03265274786629   -5.59715e-03   3.96366e-04 DIIS/ADIIS
   @DF-UKS iter   2:  -100.03256040402178    9.23438e-05   1.01742e-03 DIIS/ADIIS/DAMP=1%
   @DF-UKS iter   3:  -100.03231340469999    2.46999e-04   3.20651e-05 DIIS/DAMP=1%
   @DF-UKS iter   4:  -100.03266368188184   -3.50277e-04   1.94063e-05 DIIS/DAMP=1%
   @DF-UKS iter   5:  -100.03266564811031   -1.96623e-06   1.88271e-06 DIIS/DAMP=1%
   @DF-UKS iter   6:  -100.03267265387014   -7.00576e-06   4.39018e-07 DIIS/DAMP=1%
   @DF-UKS iter   7:  -100.03267251403173    1.39838e-07   1.62980e-07 DIIS/DAMP=1%
   @DF-UKS iter   8:  -100.03267234365629    1.70375e-07   2.07871e-08 DIIS/DAMP=1%
   @DF-UKS iter   9:  -100.03267236912947   -2.54732e-08   3.31905e-09 DIIS/DAMP=1%
   @DF-UKS iter  10:  -100.03267236827030    8.59174e-10   4.23124e-10 DIIS/DAMP=1%
  Energy and wave function converged.


  ==> Post-Iterations <==

   Electrons on quadrature grid:
      Nalpha   =    7.0000001131 ; deviation = 1.131e-07
      Nbeta    =    6.0000000739 ; deviation = 7.391e-08
      Ntotal   =   13.0000001871 ; deviation = 1.871e-07 

   @Spin Contamination Metric:   7.512853685E-03
   @S^2 Expected:                7.500000000E-01
   @S^2 Observed:                7.575128537E-01
   @S   Expected:                5.000000000E-01
   @S   Observed:                5.000000000E-01

    Orbital Energies [Eh]
    ---------------------

    Alpha Occupied:                                                       

       1A1   -19.163234     2A1    -6.846209     3A1    -1.006383  
       4A1    -0.449504     1B2    -0.373986     1B1    -0.373986  
       5A1    -0.346080  

    Alpha Virtual:                                                        

       2B1    -0.010777     2B2    -0.010777     6A1     0.145163  
       3B2     0.278375     3B1     0.278375     7A1     0.295940  
       8A1     0.568919     9A1     0.670605     1A2     0.670605  
       4B2     0.836162     4B1     0.836162    10A1     0.876911  
       5B1     1.008255     5B2     1.008255    11A1     1.395576  
      12A1     1.688862     2A2     2.630929    13A1     2.630931  
       6B1     2.920206     6B2     2.920206    14A1     3.369234  

    Beta Occupied:                                                        

       1A1   -19.163537     2A1    -6.830725     3A1    -1.003925  
       4A1    -0.435137     1B2    -0.373635     1B1    -0.373635  

    Beta Virtual:                                                         

       5A1    -0.173702     2B2     0.020194     2B1     0.020194  
       6A1     0.156561     3B2     0.298439     3B1     0.298439  
       7A1     0.360597     8A1     0.624080     1A2     0.700396  
       9A1     0.700396    10A1     0.881363     4B2     0.886499  
       4B1     0.886499     5B1     1.005462     5B2     1.005462  
      11A1     1.428003    12A1     1.692326     2A2     2.624509  
      13A1     2.624510     6B1     2.925658     6B2     2.925658  
      14A1     3.375538  

    Final Occupation by Irrep:
             A1    A2    B1    B2 
    DOCC [     4,    0,    1,    1 ]
    SOCC [     1,    0,    0,    0 ]
    NA   [     5,    0,    1,    1 ]
    NB   [     4,    0,    1,    1 ]

  @DF-UKS Final Energy:  -100.03267236827030

   => Energetics <=

    Nuclear Repulsion Energy =             17.5396897949397577
    One-Electron Energy =                -171.0761037102062119
    Two-Electron Energy =                  63.6903863795503611
    DFT Exchange-Correlation Energy =     -10.1866448325542027
    Empirical Dispersion Energy =           0.0000000000000000
    VV10 Nonlocal Energy =                  0.0000000000000000
    Total Energy =                       -100.0326723682702976

  UHF NO Occupations:
  HONO-2 :    1 B2 1.9981798
  HONO-1 :    1 B1 1.9981798
  HONO-0 :    5 A1 1.0000000
  LUNO+0 :    2 B1 0.0018202
  LUNO+1 :    2 B2 0.0018202
  LUNO+2 :    6 A1 0.0001111
  LUNO+3 :    7 A1 0.0000082


Computation Completed


Properties will be evaluated at   0.000000,   0.000000,   0.000000 [a0]

Properties computed using the SCF density matrix


 Multipole Moments:

 ------------------------------------------------------------------------------------
     Multipole            Electronic (a.u.)      Nuclear  (a.u.)        Total (a.u.)
 ------------------------------------------------------------------------------------

 L = 1.  Multiply by 2.5417464519 to convert [e a0] to [Debye]
 Dipole X            :          0.0000000            0.0000000            0.0000000
 Dipole Y            :          0.0000000            0.0000000            0.0000000
 Dipole Z            :          1.4898648           -0.6840447            0.8058201
 Magnitude           :                                                    0.8058201

 ------------------------------------------------------------------------------------

*** tstop() called on Joses-MacBook-Pro-2.local at Wed Jul 16 18:50:01 2025
Module time:
	user time   =       3.24 seconds =       0.05 minutes
	system time =       6.02 seconds =       0.10 minutes
	total time  =          1 seconds =       0.02 minutes
Total time:
	user time   =       7.22 seconds =       0.12 minutes
	system time =      14.11 seconds =       0.24 minutes
	total time  =          2 seconds =       0.03 minutes

*** tstart() called on Joses-MacBook-Pro-2.local
*** at Wed Jul 16 18:50:01 2025


         ------------------------------------------------------------
                                   SCF GRAD                          
                          Rob Parrish, Justin Turney,                
                       Andy Simmonett, and Alex Sokolov              
         ------------------------------------------------------------

  ==> Geometry <==

    Molecular point group: c2v
    Full point group: C_inf_v

    Geometry (in Angstrom), charge = 0, multiplicity = 2:

       Center              X                  Y                   Z               Mass       
    ------------   -----------------  -----------------  -----------------  -----------------
         B            0.000000000000     0.000000000000     0.714808165427    11.009305360000
         O            0.000000000000     0.000000000000    -0.492002711748    15.994914619570

  Nuclear repulsion =   17.539689794939758

  ==> Basis Set <==

  Basis Set: CC-PVDZ
    Blend: CC-PVDZ
    Number of shells: 12
    Number of basis functions: 28
    Number of Cartesian functions: 30
    Spherical Harmonics?: true
    Max angular momentum: 2

  ==> DFJKGrad: Density-Fitted SCF Gradients <==

    Gradient:                    1
    J tasked:                  Yes
    K tasked:                  Yes
    wK tasked:                  No
    OpenMP threads:              1
    Integrals threads:           1
    Memory [MiB]:              375
    Schwarz Cutoff:          1E-12
    Fitting Condition:       1E-10

   => Auxiliary Basis Set <=

  Basis Set: (CC-PVDZ AUX)
    Blend: CC-PVDZ-JKFIT
    Number of shells: 48
    Number of basis functions: 140
    Number of Cartesian functions: 162
    Spherical Harmonics?: true
    Max angular momentum: 3

  ==> DFT Potential <==

   => LibXC <=

    Version 6.2.2
    S. Lehtola, C. Steigemann, M. J.T. Oliveira, and M. A.L. Marques.,  SoftwareX 7, 1–5 (2018) (10.1016/j.softx.2017.11.002)

   => Composite Functional: B3LYP <= 

    B3LYP Hyb-GGA Exchange-Correlation Functional

    P. J. Stephens, F. J. Devlin, C. F. Chabalowski, and M. J. Frisch.,  J. Phys. Chem. 98, 11623 (1994) (10.1021/j100096a001)

    Deriv               =              1
    GGA                 =           TRUE
    Meta                =          FALSE

    Exchange Hybrid     =           TRUE
    MP2 Hybrid          =          FALSE

   => Exchange Functionals <=

    0.0800   Slater exchange
    0.7200         Becke 88

   => Exact (HF) Exchange <=

    0.2000               HF 

   => Correlation Functionals <=

    0.1900   Vosko, Wilk & Nusair (VWN5_RPA)
    0.8100   Lee, Yang & Parr

   => LibXC Density Thresholds  <==

    XC_HYB_GGA_XC_B3LYP:  1.00E-15 

   => Molecular Quadrature <=

    Radial Scheme          =       TREUTLER
    Pruning Scheme         =           NONE
    Nuclear Scheme         =       TREUTLER

    Blocking Scheme        =         OCTREE
    BS radius alpha        =              1
    Pruning alpha          =              1
    Radial Points          =             75
    Spherical Points       =            302
    Total Points           =          43261
    Total Blocks           =            391
    Max Points             =            256
    Max Functions          =             28
    Weights Tolerance      =       1.00E-15


  -Total Gradient:
     Atom            X                  Y                   Z
    ------   -----------------  -----------------  -----------------
       1       -0.000000000000    -0.000000000000    -0.001716381989
       2        0.000000000000    -0.000000000000     0.001730736176


*** tstop() called on Joses-MacBook-Pro-2.local at Wed Jul 16 18:50:02 2025
Module time:
	user time   =       0.64 seconds =       0.01 minutes
	system time =       1.56 seconds =       0.03 minutes
	total time  =          1 seconds =       0.02 minutes
Total time:
	user time   =       7.86 seconds =       0.13 minutes
	system time =      15.68 seconds =       0.26 minutes
	total time  =          3 seconds =       0.05 minutes

    			-----------------------------------------

    			 OPTKING 3.0: for geometry optimizations 

    			     By R.A. King, Bethel University     

    			        with contributions from          

    			    A.V. Copan, J. Cayton, A. Heide      

    			-----------------------------------------

    
	                            ===> Fragment 1 <== 

	 Z (Atomic Numbers)          Masses                          Geom                  
	       5.000000            11.009305          0.00000000  0.00000000  1.35079166   
	       8.000000            15.994915          0.00000000  0.00000000 -0.92975038   

	 - Coordinate -           - BOHR/RAD -       - ANG/DEG -
	 R(1,2)           =         2.280542           1.206811


	        --- Internal Coordinate Step in ANG or DEG, aJ/ANG or AJ/DEG ---
	-------------------------------------------------------------------------------
	           Coordinate      Previous         Force          Change          New 
	           ----------      --------        ------          ------        ------
	               R(1,2)       1.20681        0.01420        0.00100       1.20781
	-------------------------------------------------------------------------------

	                                 ==> Convergence Check <==                                  
    
	Measures of convergence in internal coordinates in au.
    
	Criteria marked as inactive (o), active & met (*), and active & unmet ( ).

	----------------------------------------------------------------------------------------------
	   Step    Total Energy     Delta E     Max Force     RMS Force      Max Disp      RMS Disp   
	----------------------------------------------------------------------------------------------
	  Convergence Criteria     1.00e-06 *    3.00e-04 *             o    1.20e-03 *             o
	----------------------------------------------------------------------------------------------
	     2    -100.03267237   -9.74e-05      1.72e-03      1.72e-03 o    1.88e-03      1.88e-03 o  ~
	----------------------------------------------------------------------------------------------

Next Geometry in Ang 
	Fragment 1 (Ang)

	    B   0.0000000000   0.0000000000   0.7153068390
	    O   0.0000000000   0.0000000000  -0.4925013854


    Structure for next step:
    Molecular point group: c2v
    Full point group: C_inf_v

    Geometry (in Angstrom), charge = 0, multiplicity = 2:

    B            0.000000000000     0.000000000000     0.715398905832
    O            0.000000000000     0.000000000000    -0.492409318577


Scratch directory: /tmp/
gradient() will perform analytic gradient computation.
   => Libint2 <=

    Primary   basis highest AM E, G, H:  6, 6, 3
    Auxiliary basis highest AM E, G, H:  7, 7, 4
    Onebody   basis highest AM E, G, H:  -, -, -
    Solid Harmonics ordering:            Gaussian

*** tstart() called on Joses-MacBook-Pro-2.local
*** at Wed Jul 16 18:50:02 2025

   => Loading Basis Set <=

    Name: CC-PVDZ
    Role: ORBITAL
    Keyword: BASIS
    atoms 1 entry B          line   108 file /Users/joseantoniorodriguesromero/anaconda3/share/psi4/basis/cc-pvdz.gbs 
    atoms 2 entry O          line   198 file /Users/joseantoniorodriguesromero/anaconda3/share/psi4/basis/cc-pvdz.gbs 


         ---------------------------------------------------------
                                   SCF
               by Justin Turney, Rob Parrish, Andy Simmonett
                          and Daniel G. A. Smith
                              UKS Reference
                        1 Threads,    500 MiB Core
         ---------------------------------------------------------

  ==> Geometry <==

    Molecular point group: c2v
    Full point group: C_inf_v

    Geometry (in Angstrom), charge = 0, multiplicity = 2:

       Center              X                  Y                   Z               Mass       
    ------------   -----------------  -----------------  -----------------  -----------------
         B            0.000000000000     0.000000000000     0.715398905832    11.009305360000
         O            0.000000000000     0.000000000000    -0.492409318577    15.994914619570

  Running in c2v symmetry.

  Rotational constants: A = ************  B =      1.77211  C =      1.77211 [cm^-1]
  Rotational constants: A = ************  B =  53126.47825  C =  53126.47825 [MHz]
  Nuclear repulsion =   17.525206401998101

  Charge       = 0
  Multiplicity = 2
  Electrons    = 13
  Nalpha       = 7
  Nbeta        = 6

  ==> Algorithm <==

  SCF Algorithm Type is DF.
  DIIS enabled.
  MOM disabled.
  Fractional occupation disabled.
  Guess Type is READ.
  Energy threshold   = 1.00e-08
  Density threshold  = 1.00e-08
  Integral threshold = 1.00e-12

  ==> Primary Basis <==

  Basis Set: CC-PVDZ
    Blend: CC-PVDZ
    Number of shells: 12
    Number of basis functions: 28
    Number of Cartesian functions: 30
    Spherical Harmonics?: true
    Max angular momentum: 2

  ==> DFT Potential <==

   => LibXC <=

    Version 6.2.2
    S. Lehtola, C. Steigemann, M. J.T. Oliveira, and M. A.L. Marques.,  SoftwareX 7, 1–5 (2018) (10.1016/j.softx.2017.11.002)

   => Composite Functional: B3LYP <= 

    B3LYP Hyb-GGA Exchange-Correlation Functional

    P. J. Stephens, F. J. Devlin, C. F. Chabalowski, and M. J. Frisch.,  J. Phys. Chem. 98, 11623 (1994) (10.1021/j100096a001)

    Deriv               =              1
    GGA                 =           TRUE
    Meta                =          FALSE

    Exchange Hybrid     =           TRUE
    MP2 Hybrid          =          FALSE

   => Exchange Functionals <=

    0.0800   Slater exchange
    0.7200         Becke 88

   => Exact (HF) Exchange <=

    0.2000               HF 

   => Correlation Functionals <=

    0.1900   Vosko, Wilk & Nusair (VWN5_RPA)
    0.8100   Lee, Yang & Parr

   => LibXC Density Thresholds  <==

    XC_HYB_GGA_XC_B3LYP:  1.00E-15 

   => Molecular Quadrature <=

    Radial Scheme          =       TREUTLER
    Pruning Scheme         =           NONE
    Nuclear Scheme         =       TREUTLER

    Blocking Scheme        =         OCTREE
    BS radius alpha        =              1
    Pruning alpha          =              1
    Radial Points          =             75
    Spherical Points       =            302
    Total Points           =          43262
    Total Blocks           =            391
    Max Points             =            256
    Max Functions          =             28
    Weights Tolerance      =       1.00E-15

   => Loading Basis Set <=

    Name: (CC-PVDZ AUX)
    Role: JKFIT
    Keyword: DF_BASIS_SCF
    atoms 1 entry B          line    71 file /Users/joseantoniorodriguesromero/anaconda3/share/psi4/basis/cc-pvdz-jkfit.gbs 
    atoms 2 entry O          line   221 file /Users/joseantoniorodriguesromero/anaconda3/share/psi4/basis/cc-pvdz-jkfit.gbs 

   => Loading Basis Set <=

    Name: CC-PVDZ
    Role: ORBITAL
    Keyword: BASIS
    atoms 1 entry B          line   108 file /Users/joseantoniorodriguesromero/anaconda3/share/psi4/basis/cc-pvdz.gbs 
    atoms 2 entry O          line   198 file /Users/joseantoniorodriguesromero/anaconda3/share/psi4/basis/cc-pvdz.gbs 

  Reading orbitals from file /tmp/doublet_BO.default.68555.180.npy, no projection.

  ==> Integral Setup <==

  DFHelper Memory: AOs need 0.001 GiB; user supplied 0.332 GiB. 
  Using in-core AOs.

  ==> MemDFJK: Density-Fitted J/K Matrices <==

    J tasked:                   Yes
    K tasked:                   Yes
    wK tasked:                   No
    OpenMP threads:               1
    Memory [MiB]:               339
    Algorithm:                 Core
    Schwarz Cutoff:           1E-12
    Mask sparsity (%):       0.0000
    Fitting Condition:        1E-10

   => Auxiliary Basis Set <=

  Basis Set: (CC-PVDZ AUX)
    Blend: CC-PVDZ-JKFIT
    Number of shells: 48
    Number of basis functions: 140
    Number of Cartesian functions: 162
    Spherical Harmonics?: true
    Max angular momentum: 3

  Cached 100.0% of DFT collocation blocks in 0.034 [GiB].

  Minimum eigenvalue in the overlap matrix is 2.6480137326E-02.
  Reciprocal condition number of the overlap matrix is 8.7665194247E-03.
    Using symmetric orthogonalization.

  ==> Pre-Iterations <==

  SCF Guess: Orbitals guess was supplied from a previous computation.

   -------------------------------------------------------
    Irrep   Nso     Nmo     Nalpha   Nbeta   Ndocc  Nsocc
   -------------------------------------------------------
     A1        14      14       5       4       4       1
     A2         2       2       0       0       0       0
     B1         6       6       1       1       1       0
     B2         6       6       1       1       1       0
   -------------------------------------------------------
    Total      28      28       7       6       6       1
   -------------------------------------------------------

  ==> Iterations <==

                           Total Energy        Delta E     RMS |[F,P]|

   @DF-UKS iter   0:  -100.03185118406688   -1.00032e+02   1.94462e-04 
   @DF-UKS iter   1:  -100.03267359891881   -8.22415e-04   5.81595e-05 DIIS
   @DF-UKS iter   2:  -100.03267162120652    1.97771e-06   1.48966e-04 DIIS/ADIIS/DAMP=1%
   @DF-UKS iter   3:  -100.03262187119937    4.97500e-05   5.32021e-06 DIIS/DAMP=1%
   @DF-UKS iter   4:  -100.03267239230347   -5.05211e-05   2.85802e-06 DIIS/DAMP=1%
   @DF-UKS iter   5:  -100.03267303380855   -6.41505e-07   2.71886e-07 DIIS/DAMP=1%
   @DF-UKS iter   6:  -100.03267405904818   -1.02524e-06   6.68863e-08 DIIS/DAMP=1%
   @DF-UKS iter   7:  -100.03267404352069    1.55275e-08   2.44213e-08 DIIS/DAMP=1%
   @DF-UKS iter   8:  -100.03267401825353    2.52672e-08   3.02526e-09 DIIS/DAMP=1%
   @DF-UKS iter   9:  -100.03267402142410   -3.17057e-09   4.71335e-10 DIIS/DAMP=1%
  Energy and wave function converged.


  ==> Post-Iterations <==

   Electrons on quadrature grid:
      Nalpha   =    7.0000001115 ; deviation = 1.115e-07
      Nbeta    =    6.0000000723 ; deviation = 7.227e-08
      Ntotal   =   13.0000001838 ; deviation = 1.838e-07 

   @Spin Contamination Metric:   7.530688036E-03
   @S^2 Expected:                7.500000000E-01
   @S^2 Observed:                7.575306880E-01
   @S   Expected:                5.000000000E-01
   @S   Observed:                5.000000000E-01

    Orbital Energies [Eh]
    ---------------------

    Alpha Occupied:                                                       

       1A1   -19.163348     2A1    -6.846496     3A1    -1.006094  
       4A1    -0.449539     1B1    -0.373772     1B2    -0.373772  
       5A1    -0.346131  

    Alpha Virtual:                                                        

       2B2    -0.011045     2B1    -0.011045     6A1     0.145089  
       3B2     0.278307     3B1     0.278307     7A1     0.295879  
       8A1     0.568329     9A1     0.670578     1A2     0.670578  
       4B1     0.835753     4B2     0.835753    10A1     0.876295  
       5B1     1.008310     5B2     1.008310    11A1     1.394255  
      12A1     1.688683     2A2     2.630843    13A1     2.630845  
       6B1     2.919615     6B2     2.919615    14A1     3.368069  

    Beta Occupied:                                                        

       1A1   -19.163647     2A1    -6.831014     3A1    -1.003626  
       4A1    -0.435092     1B1    -0.373432     1B2    -0.373432  

    Beta Virtual:                                                         

       5A1    -0.173806     2B2     0.019935     2B1     0.019935  
       6A1     0.156496     3B2     0.298345     3B1     0.298345  
       7A1     0.360531     8A1     0.623376     1A2     0.700365  
       9A1     0.700365    10A1     0.880788     4B1     0.886059  
       4B2     0.886059     5B1     1.005533     5B2     1.005533  
      11A1     1.426754    12A1     1.692121     2A2     2.624415  
      13A1     2.624417     6B1     2.925081     6B2     2.925081  
      14A1     3.374382  

    Final Occupation by Irrep:
             A1    A2    B1    B2 
    DOCC [     4,    0,    1,    1 ]
    SOCC [     1,    0,    0,    0 ]
    NA   [     5,    0,    1,    1 ]
    NB   [     4,    0,    1,    1 ]

  @DF-UKS Final Energy:  -100.03267402142410

   => Energetics <=

    Nuclear Repulsion Energy =             17.5252064019981013
    One-Electron Energy =                -171.0481820887260938
    Two-Electron Energy =                  63.6762767562751577
    DFT Exchange-Correlation Energy =     -10.1859750909712705
    Empirical Dispersion Energy =           0.0000000000000000
    VV10 Nonlocal Energy =                  0.0000000000000000
    Total Energy =                       -100.0326740214240999

  UHF NO Occupations:
  HONO-2 :    1 B1 1.9981759
  HONO-1 :    1 B2 1.9981759
  HONO-0 :    5 A1 1.0000000
  LUNO+0 :    2 B2 0.0018241
  LUNO+1 :    2 B1 0.0018241
  LUNO+2 :    6 A1 0.0001122
  LUNO+3 :    7 A1 0.0000082


Computation Completed


Properties will be evaluated at   0.000000,   0.000000,   0.000000 [a0]

Properties computed using the SCF density matrix


 Multipole Moments:

 ------------------------------------------------------------------------------------
     Multipole            Electronic (a.u.)      Nuclear  (a.u.)        Total (a.u.)
 ------------------------------------------------------------------------------------

 L = 1.  Multiply by 2.5417464519 to convert [e a0] to [Debye]
 Dipole X            :          0.0000000            0.0000000            0.0000000
 Dipole Y            :          0.0000000            0.0000000            0.0000000
 Dipole Z            :          1.4913623           -0.6846100            0.8067522
 Magnitude           :                                                    0.8067522

 ------------------------------------------------------------------------------------

*** tstop() called on Joses-MacBook-Pro-2.local at Wed Jul 16 18:50:03 2025
Module time:
	user time   =       3.73 seconds =       0.06 minutes
	system time =       4.32 seconds =       0.07 minutes
	total time  =          1 seconds =       0.02 minutes
Total time:
	user time   =      11.64 seconds =       0.19 minutes
	system time =      20.26 seconds =       0.34 minutes
	total time  =          4 seconds =       0.07 minutes

*** tstart() called on Joses-MacBook-Pro-2.local
*** at Wed Jul 16 18:50:03 2025


         ------------------------------------------------------------
                                   SCF GRAD                          
                          Rob Parrish, Justin Turney,                
                       Andy Simmonett, and Alex Sokolov              
         ------------------------------------------------------------

  ==> Geometry <==

    Molecular point group: c2v
    Full point group: C_inf_v

    Geometry (in Angstrom), charge = 0, multiplicity = 2:

       Center              X                  Y                   Z               Mass       
    ------------   -----------------  -----------------  -----------------  -----------------
         B            0.000000000000     0.000000000000     0.715398905832    11.009305360000
         O            0.000000000000     0.000000000000    -0.492409318577    15.994914619570

  Nuclear repulsion =   17.525206401998101

  ==> Basis Set <==

  Basis Set: CC-PVDZ
    Blend: CC-PVDZ
    Number of shells: 12
    Number of basis functions: 28
    Number of Cartesian functions: 30
    Spherical Harmonics?: true
    Max angular momentum: 2

  ==> DFJKGrad: Density-Fitted SCF Gradients <==

    Gradient:                    1
    J tasked:                  Yes
    K tasked:                  Yes
    wK tasked:                  No
    OpenMP threads:              1
    Integrals threads:           1
    Memory [MiB]:              375
    Schwarz Cutoff:          1E-12
    Fitting Condition:       1E-10

   => Auxiliary Basis Set <=

  Basis Set: (CC-PVDZ AUX)
    Blend: CC-PVDZ-JKFIT
    Number of shells: 48
    Number of basis functions: 140
    Number of Cartesian functions: 162
    Spherical Harmonics?: true
    Max angular momentum: 3

  ==> DFT Potential <==

   => LibXC <=

    Version 6.2.2
    S. Lehtola, C. Steigemann, M. J.T. Oliveira, and M. A.L. Marques.,  SoftwareX 7, 1–5 (2018) (10.1016/j.softx.2017.11.002)

   => Composite Functional: B3LYP <= 

    B3LYP Hyb-GGA Exchange-Correlation Functional

    P. J. Stephens, F. J. Devlin, C. F. Chabalowski, and M. J. Frisch.,  J. Phys. Chem. 98, 11623 (1994) (10.1021/j100096a001)

    Deriv               =              1
    GGA                 =           TRUE
    Meta                =          FALSE

    Exchange Hybrid     =           TRUE
    MP2 Hybrid          =          FALSE

   => Exchange Functionals <=

    0.0800   Slater exchange
    0.7200         Becke 88

   => Exact (HF) Exchange <=

    0.2000               HF 

   => Correlation Functionals <=

    0.1900   Vosko, Wilk & Nusair (VWN5_RPA)
    0.8100   Lee, Yang & Parr

   => LibXC Density Thresholds  <==

    XC_HYB_GGA_XC_B3LYP:  1.00E-15 

   => Molecular Quadrature <=

    Radial Scheme          =       TREUTLER
    Pruning Scheme         =           NONE
    Nuclear Scheme         =       TREUTLER

    Blocking Scheme        =         OCTREE
    BS radius alpha        =              1
    Pruning alpha          =              1
    Radial Points          =             75
    Spherical Points       =            302
    Total Points           =          43262
    Total Blocks           =            391
    Max Points             =            256
    Max Functions          =             28
    Weights Tolerance      =       1.00E-15


  -Total Gradient:
     Atom            X                  Y                   Z
    ------   -----------------  -----------------  -----------------
       1       -0.000000000000     0.000000000000    -0.000036006159
       2        0.000000000000     0.000000000000     0.000050323070


*** tstop() called on Joses-MacBook-Pro-2.local at Wed Jul 16 18:50:03 2025
Module time:
	user time   =       0.68 seconds =       0.01 minutes
	system time =       1.47 seconds =       0.02 minutes
	total time  =          0 seconds =       0.00 minutes
Total time:
	user time   =      12.32 seconds =       0.21 minutes
	system time =      21.75 seconds =       0.36 minutes
	total time  =          4 seconds =       0.07 minutes

    			-----------------------------------------

    			 OPTKING 3.0: for geometry optimizations 

    			     By R.A. King, Bethel University     

    			        with contributions from          

    			    A.V. Copan, J. Cayton, A. Heide      

    			-----------------------------------------

    
	                            ===> Fragment 1 <== 

	 Z (Atomic Numbers)          Masses                          Geom                  
	       5.000000            11.009305          0.00000000  0.00000000  1.35190800   
	       8.000000            15.994915          0.00000000  0.00000000 -0.93051875   

	 - Coordinate -           - BOHR/RAD -       - ANG/DEG -
	 R(1,2)           =         2.282427           1.207808


	        --- Internal Coordinate Step in ANG or DEG, aJ/ANG or AJ/DEG ---
	-------------------------------------------------------------------------------
	           Coordinate      Previous         Force          Change          New 
	           ----------      --------        ------          ------        ------
	               R(1,2)       1.20781        0.00036        0.00003       1.20783
	-------------------------------------------------------------------------------

	                                 ==> Convergence Check <==                                  
    
	Measures of convergence in internal coordinates in au.
    
	Criteria marked as inactive (o), active & met (*), and active & unmet ( ).

	----------------------------------------------------------------------------------------------
	   Step    Total Energy     Delta E     Max Force     RMS Force      Max Disp      RMS Disp   
	----------------------------------------------------------------------------------------------
	  Convergence Criteria     1.00e-06 *    3.00e-04 *             o    1.20e-03 *             o
	----------------------------------------------------------------------------------------------
	     3    -100.03267402   -1.65e-06      4.32e-05 *    4.32e-05 o    4.74e-05 *    4.74e-05 o  ~
	----------------------------------------------------------------------------------------------

Next Geometry in Ang 
	Fragment 1 (Ang)

	    B   0.0000000000   0.0000000000   0.7154114347
	    O   0.0000000000   0.0000000000  -0.4924218474


    Final optimized geometry and variables:
    Molecular point group: c2v
    Full point group: C_inf_v

    Geometry (in Angstrom), charge = 0, multiplicity = 2:

    B            0.000000000000     0.000000000000     0.715398905832
    O            0.000000000000     0.000000000000    -0.492409318577


    Psi4 stopped on: Wednesday, 16 July 2025 06:50PM
    Psi4 wall time for execution: 0:00:04.52

*** Psi4 exiting successfully. Buy a developer a beer!
