
    -----------------------------------------------------------------------
          Psi4: An Open-Source Ab Initio Electronic Structure Package
                               Psi4 1.9.1 release

                         Git: Rev {} zzzzzzz 


    D. G. A. Smith, L. A. Burns, A. C. Simmonett, R. M. Parrish,
    M. C. Schieber, R. Galvelis, P. Kraus, H. Kruse, R. Di Remigio,
    A. Alenaizan, A. M. James, S. Lehtola, J. P. Misiewicz, M. Scheurer,
    R. A. Shaw, J. B. Schriber, Y. Xie, Z. L. Glick, D. A. Sirianni,
    J. S. O'Brien, J. M. Waldrop, A. Kumar, E. G. Hohenstein,
    B. P. Pritchard, B. R. Brooks, H. F. Schaefer III, A. Yu. Sokolov,
    K. Patkowski, A. E. DePrince III, U. Bozkaya, R. A. King,
    F. A. Evangelista, J. M. Turney, T. D. Crawford, C. D. Sherrill,
    J. Chem. Phys. 152(18) 184108 (2020). https://doi.org/10.1063/5.0006002

                            Additional Code Authors
    E. T. Seidl, C. L. Janssen, E. F. Valeev, M. L. Leininger,
    J. F. Gonthier, R. M. Richard, H. R. McAlexander, M. Saitow, X. Wang,
    P. Verma, M. H. Lechner, A. Jiang, S. Behnle, A. G. Heide,
    M. F. Herbst, and D. L. Poole

             Previous Authors, Complete List of Code Contributors,
                       and Citations for Specific Modules
    https://github.com/psi4/psi4/blob/master/codemeta.json
    https://github.com/psi4/psi4/graphs/contributors
    http://psicode.org/psi4manual/master/introduction.html#citing-psifour

    -----------------------------------------------------------------------


    Psi4 started on: Wednesday, 16 July 2025 06:14PM

    Process ID: 68112
    Host:       Joses-MacBook-Pro-2.local
    PSIDATADIR: /Users/joseantoniorodriguesromero/anaconda3/share/psi4
    Memory:     500.0 MiB
    Threads:    1
    
  ==> Input File <==

--------------------------------------------------------------------------
molecule { 
0 4
H   0.00000        0.60000        0.00000
Ne   0.00000       -0.60000        0.00000
}

set { 
basis              cc-pvdz
reference          uks
maxiter            500
geom_maxiter       500
DAMPING_PERCENTAGE 1
guess              SAP
}

optimize('b3lyp')
--------------------------------------------------------------------------

Scratch directory: /tmp/
gradient() will perform analytic gradient computation.
   => Libint2 <=

    Primary   basis highest AM E, G, H:  6, 6, 3
    Auxiliary basis highest AM E, G, H:  7, 7, 4
    Onebody   basis highest AM E, G, H:  -, -, -
    Solid Harmonics ordering:            Gaussian

*** tstart() called on Joses-MacBook-Pro-2.local
*** at Wed Jul 16 18:14:16 2025

   => Loading Basis Set <=

    Name: CC-PVDZ
    Role: ORBITAL
    Keyword: BASIS
    atoms 1 entry H          line    22 file /Users/joseantoniorodriguesromero/anaconda3/share/psi4/basis/cc-pvdz.gbs 
    atoms 2 entry NE         line   258 file /Users/joseantoniorodriguesromero/anaconda3/share/psi4/basis/cc-pvdz.gbs 


         ---------------------------------------------------------
                                   SCF
               by Justin Turney, Rob Parrish, Andy Simmonett
                          and Daniel G. A. Smith
                              UKS Reference
                        1 Threads,    500 MiB Core
         ---------------------------------------------------------

  ==> Geometry <==

    Molecular point group: c2v
    Full point group: C_inf_v

    Geometry (in Angstrom), charge = 0, multiplicity = 4:

       Center              X                  Y                   Z               Mass       
    ------------   -----------------  -----------------  -----------------  -----------------
         H            0.000000000000     0.000000000000     1.142410725452     1.007825032230
         NE           0.000000000000     0.000000000000    -0.057589274548    19.992440176200

  Running in c2v symmetry.

  Rotational constants: A = ************  B =     12.20135  C =     12.20135 [cm^-1]
  Rotational constants: A = ************  B = 365787.23054  C = 365787.23054 [MHz]
  Nuclear repulsion =    4.409810088916667

  Charge       = 0
  Multiplicity = 4
  Electrons    = 11
  Nalpha       = 7
  Nbeta        = 4

  ==> Algorithm <==

  SCF Algorithm Type is DF.
  DIIS enabled.
  MOM disabled.
  Fractional occupation disabled.
  Guess Type is SAP.
  Energy threshold   = 1.00e-08
  Density threshold  = 1.00e-08
  Integral threshold = 1.00e-12

  ==> Primary Basis <==

  Basis Set: CC-PVDZ
    Blend: CC-PVDZ
    Number of shells: 9
    Number of basis functions: 19
    Number of Cartesian functions: 20
    Spherical Harmonics?: true
    Max angular momentum: 2

  ==> DFT Potential <==

   => LibXC <=

    Version 6.2.2
    S. Lehtola, C. Steigemann, M. J.T. Oliveira, and M. A.L. Marques.,  SoftwareX 7, 1–5 (2018) (10.1016/j.softx.2017.11.002)

   => Composite Functional: B3LYP <= 

    B3LYP Hyb-GGA Exchange-Correlation Functional

    P. J. Stephens, F. J. Devlin, C. F. Chabalowski, and M. J. Frisch.,  J. Phys. Chem. 98, 11623 (1994) (10.1021/j100096a001)

    Deriv               =              1
    GGA                 =           TRUE
    Meta                =          FALSE

    Exchange Hybrid     =           TRUE
    MP2 Hybrid          =          FALSE

   => Exchange Functionals <=

    0.0800   Slater exchange
    0.7200         Becke 88

   => Exact (HF) Exchange <=

    0.2000               HF 

   => Correlation Functionals <=

    0.1900   Vosko, Wilk & Nusair (VWN5_RPA)
    0.8100   Lee, Yang & Parr

   => LibXC Density Thresholds  <==

    XC_HYB_GGA_XC_B3LYP:  1.00E-15 

   => Molecular Quadrature <=

    Radial Scheme          =       TREUTLER
    Pruning Scheme         =           NONE
    Nuclear Scheme         =       TREUTLER

    Blocking Scheme        =         OCTREE
    BS radius alpha        =              1
    Pruning alpha          =              1
    Radial Points          =             75
    Spherical Points       =            302
    Total Points           =          44438
    Total Blocks           =            394
    Max Points             =            255
    Max Functions          =             19
    Weights Tolerance      =       1.00E-15

   => Loading Basis Set <=

    Name: (CC-PVDZ AUX)
    Role: JKFIT
    Keyword: DF_BASIS_SCF
    atoms 1 entry H          line    51 file /Users/joseantoniorodriguesromero/anaconda3/share/psi4/basis/cc-pvdz-jkfit.gbs 
    atoms 2 entry NE         line   321 file /Users/joseantoniorodriguesromero/anaconda3/share/psi4/basis/cc-pvdz-jkfit.gbs 

  ==> Integral Setup <==

  DFHelper Memory: AOs need 0.000 GiB; user supplied 0.343 GiB. 
  Using in-core AOs.

  ==> MemDFJK: Density-Fitted J/K Matrices <==

    J tasked:                   Yes
    K tasked:                   Yes
    wK tasked:                   No
    OpenMP threads:               1
    Memory [MiB]:               350
    Algorithm:                 Core
    Schwarz Cutoff:           1E-12
    Mask sparsity (%):       0.0000
    Fitting Condition:        1E-10

   => Auxiliary Basis Set <=

  Basis Set: (CC-PVDZ AUX)
    Blend: CC-PVDZ-JKFIT
    Number of shells: 33
    Number of basis functions: 93
    Number of Cartesian functions: 106
    Spherical Harmonics?: true
    Max angular momentum: 3

  Cached 100.0% of DFT collocation blocks in 0.024 [GiB].

  Minimum eigenvalue in the overlap matrix is 1.0411230825E-01.
  Reciprocal condition number of the overlap matrix is 4.1852094496E-02.
    Using symmetric orthogonalization.

  ==> Pre-Iterations <==

  SCF Guess: Superposition of Atomic Potentials (doi:10.1021/acs.jctc.8b01089).

  ==> SAP guess <==

   => Molecular Quadrature <=

    Radial Scheme          =       TREUTLER
    Pruning Scheme         =           NONE
    Nuclear Scheme         =       TREUTLER

    Blocking Scheme        =         OCTREE
    BS radius alpha        =              1
    Pruning alpha          =              1
    Radial Points          =             75
    Spherical Points       =            302
    Total Points           =          44438
    Total Blocks           =            394
    Max Points             =            255
    Max Functions          =             19
    Weights Tolerance      =       1.00E-15

   -------------------------------------------------------
    Irrep   Nso     Nmo     Nalpha   Nbeta   Ndocc  Nsocc
   -------------------------------------------------------
     A1        10      10       5       3       3       2
     A2         1       1       0       0       0       0
     B1         4       4       1       1       1       0
     B2         4       4       1       0       0       1
   -------------------------------------------------------
    Total      19      19       7       4       4       3
   -------------------------------------------------------

  ==> Iterations <==

                           Total Energy        Delta E     RMS |[F,P]|

   @DF-UKS iter   1:  -128.11252994753869   -1.28113e+02   6.58773e-02 ADIIS/DIIS
   @DF-UKS iter   2:  -128.22244990314547   -1.09920e-01   4.29811e-02 ADIIS/DIIS/DAMP=1%
   @DF-UKS iter   3:  -128.29999244584423   -7.75425e-02   8.51859e-03 ADIIS/DIIS/DAMP=1%
   @DF-UKS iter   4:  -128.28818094482583    1.18115e-02   7.47143e-04 ADIIS/DIIS/DAMP=1%
   @DF-UKS iter   5:  -128.29055333776154   -2.37239e-03   3.07147e-05 DIIS/DAMP=1%
   @DF-UKS iter   6:  -128.29039227180948    1.61066e-04   3.38172e-06 DIIS/DAMP=1%
   @DF-UKS iter   7:  -128.29039514169432   -2.86988e-06   3.25262e-07 DIIS/DAMP=1%
   @DF-UKS iter   8:  -128.29039494202362    1.99671e-07   2.74556e-08 DIIS/DAMP=1%
   @DF-UKS iter   9:  -128.29039487253101    6.94926e-08   3.40216e-09 DIIS/DAMP=1%
   @DF-UKS iter  10:  -128.29039487882886   -6.29785e-09   2.11648e-10 DIIS/DAMP=1%
  Energy and wave function converged.


  ==> Post-Iterations <==

   Electrons on quadrature grid:
      Nalpha   =    7.0000001248 ; deviation = 1.248e-07
      Nbeta    =    4.0000000466 ; deviation = 4.661e-08
      Ntotal   =   11.0000001714 ; deviation = 1.714e-07 

   @Spin Contamination Metric:   9.466072895E-04
   @S^2 Expected:                3.750000000E+00
   @S^2 Observed:                3.750946607E+00
   @S   Expected:                1.500000000E+00
   @S   Observed:                1.500000000E+00

    Orbital Energies [Eh]
    ---------------------

    Alpha Occupied:                                                       

       1A1   -31.540730     2A1    -1.929069     1B2    -1.095493  
       3A1    -1.012844     1B1    -0.986264     4A1    -0.173115  
       5A1     0.353689  

    Alpha Virtual:                                                        

       2B2     0.932867     2B1     0.982419     6A1     1.130687  
       3B2     1.399671     3B1     1.414946     7A1     1.463146  
       8A1     2.127636     9A1     4.200386     1A2     4.203202  
       4B2     4.251977     4B1     4.334064    10A1     4.723997  

    Beta Occupied:                                                        

       1A1   -31.494203     2A1    -1.811426     3A1    -0.947490  
       1B1    -0.941363  

    Beta Virtual:                                                         

       1B2    -0.731305     4A1     0.051122     5A1     0.668223  
       2B1     1.024303     2B2     1.054645     6A1     1.184800  
       3B1     1.541121     3B2     1.541847     7A1     1.581273  
       8A1     2.216893     1A2     4.320504     9A1     4.334662  
       4B1     4.362393     4B2     4.374355    10A1     4.804099  

    Final Occupation by Irrep:
             A1    A2    B1    B2 
    DOCC [     3,    0,    1,    0 ]
    SOCC [     2,    0,    0,    1 ]
    NA   [     5,    0,    1,    1 ]
    NB   [     3,    0,    1,    0 ]

  @DF-UKS Final Energy:  -128.29039487882886

   => Energetics <=

    Nuclear Repulsion Energy =              4.4098100889166671
    One-Electron Energy =                -186.4754573570706384
    Two-Electron Energy =                  64.0248281151522747
    DFT Exchange-Correlation Energy =     -10.2495757258271460
    Empirical Dispersion Energy =           0.0000000000000000
    VV10 Nonlocal Energy =                  0.0000000000000000
    Total Energy =                       -128.2903948788288631

  UHF NO Occupations:
  HONO-2 :    1 B2 1.0000000
  HONO-1 :    4 A1 1.0000000
  HONO-0 :    5 A1 1.0000000
  LUNO+0 :    6 A1 0.0002673
  LUNO+1 :    7 A1 0.0001513
  LUNO+2 :    2 B1 0.0000547
  LUNO+3 :    8 A1 0.0000000


Computation Completed


Properties will be evaluated at   0.000000,   0.000000,   0.000000 [a0]

Properties computed using the SCF density matrix


 Multipole Moments:

 ------------------------------------------------------------------------------------
     Multipole            Electronic (a.u.)      Nuclear  (a.u.)        Total (a.u.)
 ------------------------------------------------------------------------------------

 L = 1.  Multiply by 2.5417464519 to convert [e a0] to [Debye]
 Dipole X            :          0.0000000            0.0000000            0.0000000
 Dipole Y            :          0.0000000            0.0000000            0.0000000
 Dipole Z            :         -3.5450833            1.0705638           -2.4745194
 Magnitude           :                                                    2.4745194

 ------------------------------------------------------------------------------------

*** tstop() called on Joses-MacBook-Pro-2.local at Wed Jul 16 18:14:17 2025
Module time:
	user time   =       1.11 seconds =       0.02 minutes
	system time =       2.41 seconds =       0.04 minutes
	total time  =          1 seconds =       0.02 minutes
Total time:
	user time   =       1.11 seconds =       0.02 minutes
	system time =       2.41 seconds =       0.04 minutes
	total time  =          1 seconds =       0.02 minutes

*** tstart() called on Joses-MacBook-Pro-2.local
*** at Wed Jul 16 18:14:17 2025


         ------------------------------------------------------------
                                   SCF GRAD                          
                          Rob Parrish, Justin Turney,                
                       Andy Simmonett, and Alex Sokolov              
         ------------------------------------------------------------

  ==> Geometry <==

    Molecular point group: c2v
    Full point group: C_inf_v

    Geometry (in Angstrom), charge = 0, multiplicity = 4:

       Center              X                  Y                   Z               Mass       
    ------------   -----------------  -----------------  -----------------  -----------------
         H            0.000000000000     0.000000000000     1.142410725452     1.007825032230
         NE           0.000000000000     0.000000000000    -0.057589274548    19.992440176200

  Nuclear repulsion =    4.409810088916667

  ==> Basis Set <==

  Basis Set: CC-PVDZ
    Blend: CC-PVDZ
    Number of shells: 9
    Number of basis functions: 19
    Number of Cartesian functions: 20
    Spherical Harmonics?: true
    Max angular momentum: 2

  ==> DFJKGrad: Density-Fitted SCF Gradients <==

    Gradient:                    1
    J tasked:                  Yes
    K tasked:                  Yes
    wK tasked:                  No
    OpenMP threads:              1
    Integrals threads:           1
    Memory [MiB]:              375
    Schwarz Cutoff:          1E-12
    Fitting Condition:       1E-10

   => Auxiliary Basis Set <=

  Basis Set: (CC-PVDZ AUX)
    Blend: CC-PVDZ-JKFIT
    Number of shells: 33
    Number of basis functions: 93
    Number of Cartesian functions: 106
    Spherical Harmonics?: true
    Max angular momentum: 3

  ==> DFT Potential <==

   => LibXC <=

    Version 6.2.2
    S. Lehtola, C. Steigemann, M. J.T. Oliveira, and M. A.L. Marques.,  SoftwareX 7, 1–5 (2018) (10.1016/j.softx.2017.11.002)

   => Composite Functional: B3LYP <= 

    B3LYP Hyb-GGA Exchange-Correlation Functional

    P. J. Stephens, F. J. Devlin, C. F. Chabalowski, and M. J. Frisch.,  J. Phys. Chem. 98, 11623 (1994) (10.1021/j100096a001)

    Deriv               =              1
    GGA                 =           TRUE
    Meta                =          FALSE

    Exchange Hybrid     =           TRUE
    MP2 Hybrid          =          FALSE

   => Exchange Functionals <=

    0.0800   Slater exchange
    0.7200         Becke 88

   => Exact (HF) Exchange <=

    0.2000               HF 

   => Correlation Functionals <=

    0.1900   Vosko, Wilk & Nusair (VWN5_RPA)
    0.8100   Lee, Yang & Parr

   => LibXC Density Thresholds  <==

    XC_HYB_GGA_XC_B3LYP:  1.00E-15 

   => Molecular Quadrature <=

    Radial Scheme          =       TREUTLER
    Pruning Scheme         =           NONE
    Nuclear Scheme         =       TREUTLER

    Blocking Scheme        =         OCTREE
    BS radius alpha        =              1
    Pruning alpha          =              1
    Radial Points          =             75
    Spherical Points       =            302
    Total Points           =          44438
    Total Blocks           =            394
    Max Points             =            255
    Max Functions          =             19
    Weights Tolerance      =       1.00E-15


  -Total Gradient:
     Atom            X                  Y                   Z
    ------   -----------------  -----------------  -----------------
       1        0.000000000000     0.000000000000    -0.163879554412
       2        0.000000000000     0.000000000000     0.163882736588


*** tstop() called on Joses-MacBook-Pro-2.local at Wed Jul 16 18:14:17 2025
Module time:
	user time   =       0.32 seconds =       0.01 minutes
	system time =       0.71 seconds =       0.01 minutes
	total time  =          0 seconds =       0.00 minutes
Total time:
	user time   =       1.43 seconds =       0.02 minutes
	system time =       3.12 seconds =       0.05 minutes
	total time  =          1 seconds =       0.02 minutes

    			-----------------------------------------

    			 OPTKING 3.0: for geometry optimizations 

    			     By R.A. King, Bethel University     

    			        with contributions from          

    			    A.V. Copan, J. Cayton, A. Heide      

    			-----------------------------------------

    
	                            ===> Fragment 1 <== 

	 Z (Atomic Numbers)          Masses                          Geom                  
	       1.000000             1.007825          0.00000000  0.00000000  2.15884339   
	      10.000000            19.992440          0.00000000  0.00000000 -0.10882796   

	 - Coordinate -           - BOHR/RAD -       - ANG/DEG -
	 R(1,2)           =         2.267671           1.200000


	        --- Internal Coordinate Step in ANG or DEG, aJ/ANG or AJ/DEG ---
	-------------------------------------------------------------------------------
	           Coordinate      Previous         Force          Change          New 
	           ----------      --------        ------          ------        ------
	               R(1,2)       1.20000        1.35017        0.26405       1.46405
	-------------------------------------------------------------------------------

	                                 ==> Convergence Check <==                                  
    
	Measures of convergence in internal coordinates in au.
    
	Criteria marked as inactive (o), active & met (*), and active & unmet ( ).

	----------------------------------------------------------------------------------------------
	   Step    Total Energy     Delta E     Max Force     RMS Force      Max Disp      RMS Disp   
	----------------------------------------------------------------------------------------------
	  Convergence Criteria     1.00e-06 *    3.00e-04 *             o    1.20e-03 *             o
	----------------------------------------------------------------------------------------------
	     1    -128.29039488   -1.28e+02      1.64e-01      1.64e-01 o    4.99e-01      4.99e-01 o  ~
	----------------------------------------------------------------------------------------------

Next Geometry in Ang 
	Fragment 1 (Ang)

	    H   0.0000000000   0.0000000000   1.2744370987
	   Ne   0.0000000000   0.0000000000  -0.1896156478


    Structure for next step:
    Molecular point group: c2v
    Full point group: C_inf_v

    Geometry (in Angstrom), charge = 0, multiplicity = 4:

    H            0.000000000000     0.000000000000     1.393791300192
    NE           0.000000000000     0.000000000000    -0.070261446310


Scratch directory: /tmp/
gradient() will perform analytic gradient computation.
   => Libint2 <=

    Primary   basis highest AM E, G, H:  6, 6, 3
    Auxiliary basis highest AM E, G, H:  7, 7, 4
    Onebody   basis highest AM E, G, H:  -, -, -
    Solid Harmonics ordering:            Gaussian

*** tstart() called on Joses-MacBook-Pro-2.local
*** at Wed Jul 16 18:14:17 2025

   => Loading Basis Set <=

    Name: CC-PVDZ
    Role: ORBITAL
    Keyword: BASIS
    atoms 1 entry H          line    22 file /Users/joseantoniorodriguesromero/anaconda3/share/psi4/basis/cc-pvdz.gbs 
    atoms 2 entry NE         line   258 file /Users/joseantoniorodriguesromero/anaconda3/share/psi4/basis/cc-pvdz.gbs 


         ---------------------------------------------------------
                                   SCF
               by Justin Turney, Rob Parrish, Andy Simmonett
                          and Daniel G. A. Smith
                              UKS Reference
                        1 Threads,    500 MiB Core
         ---------------------------------------------------------

  ==> Geometry <==

    Molecular point group: c2v
    Full point group: C_inf_v

    Geometry (in Angstrom), charge = 0, multiplicity = 4:

       Center              X                  Y                   Z               Mass       
    ------------   -----------------  -----------------  -----------------  -----------------
         H            0.000000000000     0.000000000000     1.393791300192     1.007825032230
         NE           0.000000000000     0.000000000000    -0.070261446310    19.992440176200

  Running in c2v symmetry.

  Rotational constants: A = ************  B =      8.19704  C =      8.19704 [cm^-1]
  Rotational constants: A = ************  B = 245740.97960  C = 245740.97960 [MHz]
  Nuclear repulsion =    3.614468207751266

  Charge       = 0
  Multiplicity = 4
  Electrons    = 11
  Nalpha       = 7
  Nbeta        = 4

  ==> Algorithm <==

  SCF Algorithm Type is DF.
  DIIS enabled.
  MOM disabled.
  Fractional occupation disabled.
  Guess Type is READ.
  Energy threshold   = 1.00e-08
  Density threshold  = 1.00e-08
  Integral threshold = 1.00e-12

  ==> Primary Basis <==

  Basis Set: CC-PVDZ
    Blend: CC-PVDZ
    Number of shells: 9
    Number of basis functions: 19
    Number of Cartesian functions: 20
    Spherical Harmonics?: true
    Max angular momentum: 2

  ==> DFT Potential <==

   => LibXC <=

    Version 6.2.2
    S. Lehtola, C. Steigemann, M. J.T. Oliveira, and M. A.L. Marques.,  SoftwareX 7, 1–5 (2018) (10.1016/j.softx.2017.11.002)

   => Composite Functional: B3LYP <= 

    B3LYP Hyb-GGA Exchange-Correlation Functional

    P. J. Stephens, F. J. Devlin, C. F. Chabalowski, and M. J. Frisch.,  J. Phys. Chem. 98, 11623 (1994) (10.1021/j100096a001)

    Deriv               =              1
    GGA                 =           TRUE
    Meta                =          FALSE

    Exchange Hybrid     =           TRUE
    MP2 Hybrid          =          FALSE

   => Exchange Functionals <=

    0.0800   Slater exchange
    0.7200         Becke 88

   => Exact (HF) Exchange <=

    0.2000               HF 

   => Correlation Functionals <=

    0.1900   Vosko, Wilk & Nusair (VWN5_RPA)
    0.8100   Lee, Yang & Parr

   => LibXC Density Thresholds  <==

    XC_HYB_GGA_XC_B3LYP:  1.00E-15 

   => Molecular Quadrature <=

    Radial Scheme          =       TREUTLER
    Pruning Scheme         =           NONE
    Nuclear Scheme         =       TREUTLER

    Blocking Scheme        =         OCTREE
    BS radius alpha        =              1
    Pruning alpha          =              1
    Radial Points          =             75
    Spherical Points       =            302
    Total Points           =          44448
    Total Blocks           =            393
    Max Points             =            256
    Max Functions          =             19
    Weights Tolerance      =       1.00E-15

   => Loading Basis Set <=

    Name: (CC-PVDZ AUX)
    Role: JKFIT
    Keyword: DF_BASIS_SCF
    atoms 1 entry H          line    51 file /Users/joseantoniorodriguesromero/anaconda3/share/psi4/basis/cc-pvdz-jkfit.gbs 
    atoms 2 entry NE         line   321 file /Users/joseantoniorodriguesromero/anaconda3/share/psi4/basis/cc-pvdz-jkfit.gbs 

   => Loading Basis Set <=

    Name: CC-PVDZ
    Role: ORBITAL
    Keyword: BASIS
    atoms 1 entry H          line    22 file /Users/joseantoniorodriguesromero/anaconda3/share/psi4/basis/cc-pvdz.gbs 
    atoms 2 entry NE         line   258 file /Users/joseantoniorodriguesromero/anaconda3/share/psi4/basis/cc-pvdz.gbs 

  Reading orbitals from file /tmp/quartet_HNe.default.68112.180.npy, no projection.

  ==> Integral Setup <==

  DFHelper Memory: AOs need 0.000 GiB; user supplied 0.343 GiB. 
  Using in-core AOs.

  ==> MemDFJK: Density-Fitted J/K Matrices <==

    J tasked:                   Yes
    K tasked:                   Yes
    wK tasked:                   No
    OpenMP threads:               1
    Memory [MiB]:               350
    Algorithm:                 Core
    Schwarz Cutoff:           1E-12
    Mask sparsity (%):       0.0000
    Fitting Condition:        1E-10

   => Auxiliary Basis Set <=

  Basis Set: (CC-PVDZ AUX)
    Blend: CC-PVDZ-JKFIT
    Number of shells: 33
    Number of basis functions: 93
    Number of Cartesian functions: 106
    Spherical Harmonics?: true
    Max angular momentum: 3

  Cached 100.0% of DFT collocation blocks in 0.024 [GiB].

  Minimum eigenvalue in the overlap matrix is 1.4482456282E-01.
  Reciprocal condition number of the overlap matrix is 6.5072055888E-02.
    Using symmetric orthogonalization.

  ==> Pre-Iterations <==

  SCF Guess: Orbitals guess was supplied from a previous computation.

   -------------------------------------------------------
    Irrep   Nso     Nmo     Nalpha   Nbeta   Ndocc  Nsocc
   -------------------------------------------------------
     A1        10      10       5       3       3       2
     A2         1       1       0       0       0       0
     B1         4       4       1       1       1       0
     B2         4       4       1       0       0       1
   -------------------------------------------------------
    Total      19      19       7       4       4       3
   -------------------------------------------------------

  ==> Iterations <==

                           Total Energy        Delta E     RMS |[F,P]|

   @DF-UKS iter   0:  -128.36937913079475   -1.28369e+02   4.50929e-02 
   @DF-UKS iter   1:  -128.32494374530182    4.44354e-02   3.70178e-03 ADIIS/DIIS
   @DF-UKS iter   2:  -128.32529274761754   -3.49002e-04   2.48417e-03 ADIIS/DIIS/DAMP=1%
   @DF-UKS iter   3:  -128.32611141611628   -8.18668e-04   1.19289e-04 ADIIS/DIIS/DAMP=1%
   @DF-UKS iter   4:  -128.32549140732075    6.20009e-04   2.70204e-05 DIIS/DAMP=1%
   @DF-UKS iter   5:  -128.32551051312825   -1.91058e-05   1.65502e-06 DIIS/DAMP=1%
   @DF-UKS iter   6:  -128.32550673944687    3.77368e-06   1.70714e-07 DIIS/DAMP=1%
   @DF-UKS iter   7:  -128.32550644683181    2.92615e-07   1.16438e-08 DIIS/DAMP=1%
   @DF-UKS iter   8:  -128.32550646748075   -2.06489e-08   1.14270e-09 DIIS/DAMP=1%
   @DF-UKS iter   9:  -128.32550646452455    2.95620e-09   1.01665e-10 DIIS/DAMP=1%
  Energy and wave function converged.


  ==> Post-Iterations <==

   Electrons on quadrature grid:
      Nalpha   =    6.9999998954 ; deviation = -1.046e-07
      Nbeta    =    3.9999999214 ; deviation = -7.861e-08
      Ntotal   =   10.9999998167 ; deviation = -1.833e-07 

   @Spin Contamination Metric:   8.291394094E-04
   @S^2 Expected:                3.750000000E+00
   @S^2 Observed:                3.750829139E+00
   @S   Expected:                1.500000000E+00
   @S   Observed:                1.500000000E+00

    Orbital Energies [Eh]
    ---------------------

    Alpha Occupied:                                                       

       1A1   -31.556226     2A1    -1.933575     1B2    -1.104817  
       3A1    -1.001702     1B1    -0.995344     4A1    -0.184557  
       5A1     0.391492  

    Alpha Virtual:                                                        

       2B2     0.940342     2B1     0.992595     6A1     1.115218  
       7A1     1.272141     3B2     1.411138     3B1     1.420039  
       8A1     2.111248     9A1     4.183313     1A2     4.193209  
       4B2     4.202411     4B1     4.285217    10A1     4.394477  

    Beta Occupied:                                                        

       1A1   -31.512564     2A1    -1.820491     1B1    -0.952990  
       3A1    -0.949314  

    Beta Virtual:                                                         

       1B2    -0.742565     4A1     0.056341     5A1     0.724311  
       2B1     1.026112     2B2     1.058334     6A1     1.183855  
       7A1     1.375524     3B1     1.576732     3B2     1.577446  
       8A1     2.212957     4B1     4.308466     1A2     4.308905  
       4B2     4.320525     9A1     4.321635    10A1     4.453231  

    Final Occupation by Irrep:
             A1    A2    B1    B2 
    DOCC [     3,    0,    1,    0 ]
    SOCC [     2,    0,    0,    1 ]
    NA   [     5,    0,    1,    1 ]
    NB   [     3,    0,    1,    0 ]

  @DF-UKS Final Energy:  -128.32550646452455

   => Energetics <=

    Nuclear Repulsion Energy =              3.6144682077512655
    One-Electron Energy =                -184.9288672872605730
    Two-Electron Energy =                  63.2154019084143926
    DFT Exchange-Correlation Energy =     -10.2265092934296380
    Empirical Dispersion Energy =           0.0000000000000000
    VV10 Nonlocal Energy =                  0.0000000000000000
    Total Energy =                       -128.3255064645245511

  UHF NO Occupations:
  HONO-2 :    1 B2 1.0000000
  HONO-1 :    4 A1 1.0000000
  HONO-0 :    5 A1 1.0000000
  LUNO+0 :    6 A1 0.0002644
  LUNO+1 :    7 A1 0.0000990
  LUNO+2 :    2 B1 0.0000512
  LUNO+3 :    8 A1 0.0000000


Computation Completed


Properties will be evaluated at   0.000000,   0.000000,   0.000000 [a0]

Properties computed using the SCF density matrix


 Multipole Moments:

 ------------------------------------------------------------------------------------
     Multipole            Electronic (a.u.)      Nuclear  (a.u.)        Total (a.u.)
 ------------------------------------------------------------------------------------

 L = 1.  Multiply by 2.5417464519 to convert [e a0] to [Debye]
 Dipole X            :          0.0000000            0.0000000            0.0000000
 Dipole Y            :          0.0000000            0.0000000            0.0000000
 Dipole Z            :         -4.1728382            1.3061349           -2.8667033
 Magnitude           :                                                    2.8667033

 ------------------------------------------------------------------------------------

*** tstop() called on Joses-MacBook-Pro-2.local at Wed Jul 16 18:14:17 2025
Module time:
	user time   =       0.90 seconds =       0.02 minutes
	system time =       3.03 seconds =       0.05 minutes
	total time  =          0 seconds =       0.00 minutes
Total time:
	user time   =       2.36 seconds =       0.04 minutes
	system time =       6.37 seconds =       0.11 minutes
	total time  =          1 seconds =       0.02 minutes

*** tstart() called on Joses-MacBook-Pro-2.local
*** at Wed Jul 16 18:14:17 2025


         ------------------------------------------------------------
                                   SCF GRAD                          
                          Rob Parrish, Justin Turney,                
                       Andy Simmonett, and Alex Sokolov              
         ------------------------------------------------------------

  ==> Geometry <==

    Molecular point group: c2v
    Full point group: C_inf_v

    Geometry (in Angstrom), charge = 0, multiplicity = 4:

       Center              X                  Y                   Z               Mass       
    ------------   -----------------  -----------------  -----------------  -----------------
         H            0.000000000000     0.000000000000     1.393791300192     1.007825032230
         NE           0.000000000000     0.000000000000    -0.070261446310    19.992440176200

  Nuclear repulsion =    3.614468207751266

  ==> Basis Set <==

  Basis Set: CC-PVDZ
    Blend: CC-PVDZ
    Number of shells: 9
    Number of basis functions: 19
    Number of Cartesian functions: 20
    Spherical Harmonics?: true
    Max angular momentum: 2

  ==> DFJKGrad: Density-Fitted SCF Gradients <==

    Gradient:                    1
    J tasked:                  Yes
    K tasked:                  Yes
    wK tasked:                  No
    OpenMP threads:              1
    Integrals threads:           1
    Memory [MiB]:              375
    Schwarz Cutoff:          1E-12
    Fitting Condition:       1E-10

   => Auxiliary Basis Set <=

  Basis Set: (CC-PVDZ AUX)
    Blend: CC-PVDZ-JKFIT
    Number of shells: 33
    Number of basis functions: 93
    Number of Cartesian functions: 106
    Spherical Harmonics?: true
    Max angular momentum: 3

  ==> DFT Potential <==

   => LibXC <=

    Version 6.2.2
    S. Lehtola, C. Steigemann, M. J.T. Oliveira, and M. A.L. Marques.,  SoftwareX 7, 1–5 (2018) (10.1016/j.softx.2017.11.002)

   => Composite Functional: B3LYP <= 

    B3LYP Hyb-GGA Exchange-Correlation Functional

    P. J. Stephens, F. J. Devlin, C. F. Chabalowski, and M. J. Frisch.,  J. Phys. Chem. 98, 11623 (1994) (10.1021/j100096a001)

    Deriv               =              1
    GGA                 =           TRUE
    Meta                =          FALSE

    Exchange Hybrid     =           TRUE
    MP2 Hybrid          =          FALSE

   => Exchange Functionals <=

    0.0800   Slater exchange
    0.7200         Becke 88

   => Exact (HF) Exchange <=

    0.2000               HF 

   => Correlation Functionals <=

    0.1900   Vosko, Wilk & Nusair (VWN5_RPA)
    0.8100   Lee, Yang & Parr

   => LibXC Density Thresholds  <==

    XC_HYB_GGA_XC_B3LYP:  1.00E-15 

   => Molecular Quadrature <=

    Radial Scheme          =       TREUTLER
    Pruning Scheme         =           NONE
    Nuclear Scheme         =       TREUTLER

    Blocking Scheme        =         OCTREE
    BS radius alpha        =              1
    Pruning alpha          =              1
    Radial Points          =             75
    Spherical Points       =            302
    Total Points           =          44448
    Total Blocks           =            393
    Max Points             =            256
    Max Functions          =             19
    Weights Tolerance      =       1.00E-15


  -Total Gradient:
     Atom            X                  Y                   Z
    ------   -----------------  -----------------  -----------------
       1       -0.000000000000     0.000000000000    -0.001392102245
       2        0.000000000000     0.000000000000     0.001396409500


*** tstop() called on Joses-MacBook-Pro-2.local at Wed Jul 16 18:14:17 2025
Module time:
	user time   =       0.32 seconds =       0.01 minutes
	system time =       0.75 seconds =       0.01 minutes
	total time  =          0 seconds =       0.00 minutes
Total time:
	user time   =       2.68 seconds =       0.04 minutes
	system time =       7.12 seconds =       0.12 minutes
	total time  =          1 seconds =       0.02 minutes

    			-----------------------------------------

    			 OPTKING 3.0: for geometry optimizations 

    			     By R.A. King, Bethel University     

    			        with contributions from          

    			    A.V. Copan, J. Cayton, A. Heide      

    			-----------------------------------------

    
	                            ===> Fragment 1 <== 

	 Z (Atomic Numbers)          Masses                          Geom                  
	       1.000000             1.007825          0.00000000  0.00000000  2.63388383   
	      10.000000            19.992440          0.00000000  0.00000000 -0.13277489   

	 - Coordinate -           - BOHR/RAD -       - ANG/DEG -
	 R(1,2)           =         2.766659           1.464053


	        --- Internal Coordinate Step in ANG or DEG, aJ/ANG or AJ/DEG ---
	-------------------------------------------------------------------------------
	           Coordinate      Previous         Force          Change          New 
	           ----------      --------        ------          ------        ------
	               R(1,2)       1.46405        0.01149        0.00227       1.46632
	-------------------------------------------------------------------------------

	                                 ==> Convergence Check <==                                  
    
	Measures of convergence in internal coordinates in au.
    
	Criteria marked as inactive (o), active & met (*), and active & unmet ( ).

	----------------------------------------------------------------------------------------------
	   Step    Total Energy     Delta E     Max Force     RMS Force      Max Disp      RMS Disp   
	----------------------------------------------------------------------------------------------
	  Convergence Criteria     1.00e-06 *    3.00e-04 *             o    1.20e-03 *             o
	----------------------------------------------------------------------------------------------
	     2    -128.32550646   -3.51e-02      1.39e-03      1.39e-03 o    4.28e-03      4.28e-03 o  ~
	----------------------------------------------------------------------------------------------

Next Geometry in Ang 
	Fragment 1 (Ang)

	    H   0.0000000000   0.0000000000   1.3949241619
	   Ne   0.0000000000   0.0000000000  -0.0713943080


    Structure for next step:
    Molecular point group: c2v
    Full point group: C_inf_v

    Geometry (in Angstrom), charge = 0, multiplicity = 4:

    H            0.000000000000     0.000000000000     1.395948289092
    NE           0.000000000000     0.000000000000    -0.070370180781


Scratch directory: /tmp/
gradient() will perform analytic gradient computation.
   => Libint2 <=

    Primary   basis highest AM E, G, H:  6, 6, 3
    Auxiliary basis highest AM E, G, H:  7, 7, 4
    Onebody   basis highest AM E, G, H:  -, -, -
    Solid Harmonics ordering:            Gaussian

*** tstart() called on Joses-MacBook-Pro-2.local
*** at Wed Jul 16 18:14:17 2025

   => Loading Basis Set <=

    Name: CC-PVDZ
    Role: ORBITAL
    Keyword: BASIS
    atoms 1 entry H          line    22 file /Users/joseantoniorodriguesromero/anaconda3/share/psi4/basis/cc-pvdz.gbs 
    atoms 2 entry NE         line   258 file /Users/joseantoniorodriguesromero/anaconda3/share/psi4/basis/cc-pvdz.gbs 


         ---------------------------------------------------------
                                   SCF
               by Justin Turney, Rob Parrish, Andy Simmonett
                          and Daniel G. A. Smith
                              UKS Reference
                        1 Threads,    500 MiB Core
         ---------------------------------------------------------

  ==> Geometry <==

    Molecular point group: c2v
    Full point group: C_inf_v

    Geometry (in Angstrom), charge = 0, multiplicity = 4:

       Center              X                  Y                   Z               Mass       
    ------------   -----------------  -----------------  -----------------  -----------------
         H            0.000000000000     0.000000000000     1.395948289092     1.007825032230
         NE           0.000000000000     0.000000000000    -0.070370180781    19.992440176200

  Running in c2v symmetry.

  Rotational constants: A = ************  B =      8.17172  C =      8.17172 [cm^-1]
  Rotational constants: A = ************  B = 244982.13911  C = 244982.13911 [MHz]
  Nuclear repulsion =    3.608883210179220

  Charge       = 0
  Multiplicity = 4
  Electrons    = 11
  Nalpha       = 7
  Nbeta        = 4

  ==> Algorithm <==

  SCF Algorithm Type is DF.
  DIIS enabled.
  MOM disabled.
  Fractional occupation disabled.
  Guess Type is READ.
  Energy threshold   = 1.00e-08
  Density threshold  = 1.00e-08
  Integral threshold = 1.00e-12

  ==> Primary Basis <==

  Basis Set: CC-PVDZ
    Blend: CC-PVDZ
    Number of shells: 9
    Number of basis functions: 19
    Number of Cartesian functions: 20
    Spherical Harmonics?: true
    Max angular momentum: 2

  ==> DFT Potential <==

   => LibXC <=

    Version 6.2.2
    S. Lehtola, C. Steigemann, M. J.T. Oliveira, and M. A.L. Marques.,  SoftwareX 7, 1–5 (2018) (10.1016/j.softx.2017.11.002)

   => Composite Functional: B3LYP <= 

    B3LYP Hyb-GGA Exchange-Correlation Functional

    P. J. Stephens, F. J. Devlin, C. F. Chabalowski, and M. J. Frisch.,  J. Phys. Chem. 98, 11623 (1994) (10.1021/j100096a001)

    Deriv               =              1
    GGA                 =           TRUE
    Meta                =          FALSE

    Exchange Hybrid     =           TRUE
    MP2 Hybrid          =          FALSE

   => Exchange Functionals <=

    0.0800   Slater exchange
    0.7200         Becke 88

   => Exact (HF) Exchange <=

    0.2000               HF 

   => Correlation Functionals <=

    0.1900   Vosko, Wilk & Nusair (VWN5_RPA)
    0.8100   Lee, Yang & Parr

   => LibXC Density Thresholds  <==

    XC_HYB_GGA_XC_B3LYP:  1.00E-15 

   => Molecular Quadrature <=

    Radial Scheme          =       TREUTLER
    Pruning Scheme         =           NONE
    Nuclear Scheme         =       TREUTLER

    Blocking Scheme        =         OCTREE
    BS radius alpha        =              1
    Pruning alpha          =              1
    Radial Points          =             75
    Spherical Points       =            302
    Total Points           =          44448
    Total Blocks           =            392
    Max Points             =            256
    Max Functions          =             19
    Weights Tolerance      =       1.00E-15

   => Loading Basis Set <=

    Name: (CC-PVDZ AUX)
    Role: JKFIT
    Keyword: DF_BASIS_SCF
    atoms 1 entry H          line    51 file /Users/joseantoniorodriguesromero/anaconda3/share/psi4/basis/cc-pvdz-jkfit.gbs 
    atoms 2 entry NE         line   321 file /Users/joseantoniorodriguesromero/anaconda3/share/psi4/basis/cc-pvdz-jkfit.gbs 

   => Loading Basis Set <=

    Name: CC-PVDZ
    Role: ORBITAL
    Keyword: BASIS
    atoms 1 entry H          line    22 file /Users/joseantoniorodriguesromero/anaconda3/share/psi4/basis/cc-pvdz.gbs 
    atoms 2 entry NE         line   258 file /Users/joseantoniorodriguesromero/anaconda3/share/psi4/basis/cc-pvdz.gbs 

  Reading orbitals from file /tmp/quartet_HNe.default.68112.180.npy, no projection.

  ==> Integral Setup <==

  DFHelper Memory: AOs need 0.000 GiB; user supplied 0.343 GiB. 
  Using in-core AOs.

  ==> MemDFJK: Density-Fitted J/K Matrices <==

    J tasked:                   Yes
    K tasked:                   Yes
    wK tasked:                   No
    OpenMP threads:               1
    Memory [MiB]:               350
    Algorithm:                 Core
    Schwarz Cutoff:           1E-12
    Mask sparsity (%):       0.0000
    Fitting Condition:        1E-10

   => Auxiliary Basis Set <=

  Basis Set: (CC-PVDZ AUX)
    Blend: CC-PVDZ-JKFIT
    Number of shells: 33
    Number of basis functions: 93
    Number of Cartesian functions: 106
    Spherical Harmonics?: true
    Max angular momentum: 3

  Cached 100.0% of DFT collocation blocks in 0.024 [GiB].

  Minimum eigenvalue in the overlap matrix is 1.4508233856E-01.
  Reciprocal condition number of the overlap matrix is 6.5246749721E-02.
    Using symmetric orthogonalization.

  ==> Pre-Iterations <==

  SCF Guess: Orbitals guess was supplied from a previous computation.

   -------------------------------------------------------
    Irrep   Nso     Nmo     Nalpha   Nbeta   Ndocc  Nsocc
   -------------------------------------------------------
     A1        10      10       5       3       3       2
     A2         1       1       0       0       0       0
     B1         4       4       1       1       1       0
     B2         4       4       1       0       0       1
   -------------------------------------------------------
    Total      19      19       7       4       4       3
   -------------------------------------------------------

  ==> Iterations <==

                           Total Energy        Delta E     RMS |[F,P]|

   @DF-UKS iter   0:  -128.32566120489287   -1.28326e+02   2.91045e-04 
   @DF-UKS iter   1:  -128.32551062589135    1.50579e-04   1.77943e-05 DIIS
   @DF-UKS iter   2:  -128.32551063492741   -9.03606e-09   1.20944e-05 DIIS/DAMP=1%
   @DF-UKS iter   3:  -128.32551360616210   -2.97123e-06   6.29305e-07 DIIS/DAMP=1%
   @DF-UKS iter   4:  -128.32551056522601    3.04094e-06   7.47811e-08 DIIS/DAMP=1%
   @DF-UKS iter   5:  -128.32551065338313   -8.81571e-08   7.46882e-09 DIIS/DAMP=1%
   @DF-UKS iter   6:  -128.32551064013009    1.32530e-08   1.15900e-09 DIIS/DAMP=1%
   @DF-UKS iter   7:  -128.32551063978980    3.40293e-10   8.08721e-11 DIIS/DAMP=1%
  Energy and wave function converged.


  ==> Post-Iterations <==

   Electrons on quadrature grid:
      Nalpha   =    6.9999998813 ; deviation = -1.187e-07
      Nbeta    =    3.9999999147 ; deviation = -8.528e-08
      Ntotal   =   10.9999997960 ; deviation = -2.040e-07 

   @Spin Contamination Metric:   8.283530575E-04
   @S^2 Expected:                3.750000000E+00
   @S^2 Observed:                3.750828353E+00
   @S   Expected:                1.500000000E+00
   @S   Observed:                1.500000000E+00

    Orbital Energies [Eh]
    ---------------------

    Alpha Occupied:                                                       

       1A1   -31.556404     2A1    -1.933696     1B2    -1.104959  
       3A1    -1.001739     1B1    -0.995484     4A1    -0.184504  
       5A1     0.391920  

    Alpha Virtual:                                                        

       2B2     0.940416     2B1     0.992704     6A1     1.114173  
       7A1     1.271908     3B2     1.411197     3B1     1.420042  
       8A1     2.110308     9A1     4.183069     1A2     4.193062  
       4B2     4.202143     4B1     4.284952    10A1     4.392679  

    Beta Occupied:                                                        

       1A1   -31.512760     2A1    -1.820639     1B1    -0.953145  
       3A1    -0.949433  

    Beta Virtual:                                                         

       1B2    -0.742716     4A1     0.056466     5A1     0.724949  
       2B1     1.026133     2B2     1.058375     6A1     1.183083  
       7A1     1.374979     3B1     1.577000     3B2     1.577710  
       8A1     2.212150     4B1     4.308174     1A2     4.308748  
       4B2     4.320232     9A1     4.321451    10A1     4.451253  

    Final Occupation by Irrep:
             A1    A2    B1    B2 
    DOCC [     3,    0,    1,    0 ]
    SOCC [     2,    0,    0,    1 ]
    NA   [     5,    0,    1,    1 ]
    NB   [     3,    0,    1,    0 ]

  @DF-UKS Final Energy:  -128.32551063978980

   => Energetics <=

    Nuclear Repulsion Energy =              3.6088832101792203
    One-Electron Energy =                -184.9170329947863252
    Two-Electron Energy =                  63.2090230616770867
    DFT Exchange-Correlation Energy =     -10.2263839168597634
    Empirical Dispersion Energy =           0.0000000000000000
    VV10 Nonlocal Energy =                  0.0000000000000000
    Total Energy =                       -128.3255106397897976

  UHF NO Occupations:
  HONO-2 :    1 B2 1.0000000
  HONO-1 :    4 A1 1.0000000
  HONO-0 :    5 A1 1.0000000
  LUNO+0 :    6 A1 0.0002644
  LUNO+1 :    7 A1 0.0000987
  LUNO+2 :    2 B1 0.0000511
  LUNO+3 :    8 A1 0.0000000


Computation Completed


Properties will be evaluated at   0.000000,   0.000000,   0.000000 [a0]

Properties computed using the SCF density matrix


 Multipole Moments:

 ------------------------------------------------------------------------------------
     Multipole            Electronic (a.u.)      Nuclear  (a.u.)        Total (a.u.)
 ------------------------------------------------------------------------------------

 L = 1.  Multiply by 2.5417464519 to convert [e a0] to [Debye]
 Dipole X            :          0.0000000            0.0000000            0.0000000
 Dipole Y            :          0.0000000            0.0000000            0.0000000
 Dipole Z            :         -4.1784887            1.3081563           -2.8703325
 Magnitude           :                                                    2.8703325

 ------------------------------------------------------------------------------------

*** tstop() called on Joses-MacBook-Pro-2.local at Wed Jul 16 18:14:18 2025
Module time:
	user time   =       0.74 seconds =       0.01 minutes
	system time =       3.06 seconds =       0.05 minutes
	total time  =          1 seconds =       0.02 minutes
Total time:
	user time   =       3.46 seconds =       0.06 minutes
	system time =      10.43 seconds =       0.17 minutes
	total time  =          2 seconds =       0.03 minutes

*** tstart() called on Joses-MacBook-Pro-2.local
*** at Wed Jul 16 18:14:18 2025


         ------------------------------------------------------------
                                   SCF GRAD                          
                          Rob Parrish, Justin Turney,                
                       Andy Simmonett, and Alex Sokolov              
         ------------------------------------------------------------

  ==> Geometry <==

    Molecular point group: c2v
    Full point group: C_inf_v

    Geometry (in Angstrom), charge = 0, multiplicity = 4:

       Center              X                  Y                   Z               Mass       
    ------------   -----------------  -----------------  -----------------  -----------------
         H            0.000000000000     0.000000000000     1.395948289092     1.007825032230
         NE           0.000000000000     0.000000000000    -0.070370180781    19.992440176200

  Nuclear repulsion =    3.608883210179220

  ==> Basis Set <==

  Basis Set: CC-PVDZ
    Blend: CC-PVDZ
    Number of shells: 9
    Number of basis functions: 19
    Number of Cartesian functions: 20
    Spherical Harmonics?: true
    Max angular momentum: 2

  ==> DFJKGrad: Density-Fitted SCF Gradients <==

    Gradient:                    1
    J tasked:                  Yes
    K tasked:                  Yes
    wK tasked:                  No
    OpenMP threads:              1
    Integrals threads:           1
    Memory [MiB]:              375
    Schwarz Cutoff:          1E-12
    Fitting Condition:       1E-10

   => Auxiliary Basis Set <=

  Basis Set: (CC-PVDZ AUX)
    Blend: CC-PVDZ-JKFIT
    Number of shells: 33
    Number of basis functions: 93
    Number of Cartesian functions: 106
    Spherical Harmonics?: true
    Max angular momentum: 3

  ==> DFT Potential <==

   => LibXC <=

    Version 6.2.2
    S. Lehtola, C. Steigemann, M. J.T. Oliveira, and M. A.L. Marques.,  SoftwareX 7, 1–5 (2018) (10.1016/j.softx.2017.11.002)

   => Composite Functional: B3LYP <= 

    B3LYP Hyb-GGA Exchange-Correlation Functional

    P. J. Stephens, F. J. Devlin, C. F. Chabalowski, and M. J. Frisch.,  J. Phys. Chem. 98, 11623 (1994) (10.1021/j100096a001)

    Deriv               =              1
    GGA                 =           TRUE
    Meta                =          FALSE

    Exchange Hybrid     =           TRUE
    MP2 Hybrid          =          FALSE

   => Exchange Functionals <=

    0.0800   Slater exchange
    0.7200         Becke 88

   => Exact (HF) Exchange <=

    0.2000               HF 

   => Correlation Functionals <=

    0.1900   Vosko, Wilk & Nusair (VWN5_RPA)
    0.8100   Lee, Yang & Parr

   => LibXC Density Thresholds  <==

    XC_HYB_GGA_XC_B3LYP:  1.00E-15 

   => Molecular Quadrature <=

    Radial Scheme          =       TREUTLER
    Pruning Scheme         =           NONE
    Nuclear Scheme         =       TREUTLER

    Blocking Scheme        =         OCTREE
    BS radius alpha        =              1
    Pruning alpha          =              1
    Radial Points          =             75
    Spherical Points       =            302
    Total Points           =          44448
    Total Blocks           =            392
    Max Points             =            256
    Max Functions          =             19
    Weights Tolerance      =       1.00E-15


  -Total Gradient:
     Atom            X                  Y                   Z
    ------   -----------------  -----------------  -----------------
       1        0.000000000000     0.000000000000    -0.000564718736
       2        0.000000000000     0.000000000000     0.000569055438


*** tstop() called on Joses-MacBook-Pro-2.local at Wed Jul 16 18:14:18 2025
Module time:
	user time   =       0.20 seconds =       0.00 minutes
	system time =       0.90 seconds =       0.02 minutes
	total time  =          0 seconds =       0.00 minutes
Total time:
	user time   =       3.66 seconds =       0.06 minutes
	system time =      11.33 seconds =       0.19 minutes
	total time  =          2 seconds =       0.03 minutes

    			-----------------------------------------

    			 OPTKING 3.0: for geometry optimizations 

    			     By R.A. King, Bethel University     

    			        with contributions from          

    			    A.V. Copan, J. Cayton, A. Heide      

    			-----------------------------------------

    
	                            ===> Fragment 1 <== 

	 Z (Atomic Numbers)          Masses                          Geom                  
	       1.000000             1.007825          0.00000000  0.00000000  2.63795995   
	      10.000000            19.992440          0.00000000  0.00000000 -0.13298037   

	 - Coordinate -           - BOHR/RAD -       - ANG/DEG -
	 R(1,2)           =         2.770940           1.466318


	        --- Internal Coordinate Step in ANG or DEG, aJ/ANG or AJ/DEG ---
	-------------------------------------------------------------------------------
	           Coordinate      Previous         Force          Change          New 
	           ----------      --------        ------          ------        ------
	               R(1,2)       1.46632        0.00467        0.00155       1.46787
	-------------------------------------------------------------------------------

	                                 ==> Convergence Check <==                                  
    
	Measures of convergence in internal coordinates in au.
    
	Criteria marked as inactive (o), active & met (*), and active & unmet ( ).

	----------------------------------------------------------------------------------------------
	   Step    Total Energy     Delta E     Max Force     RMS Force      Max Disp      RMS Disp   
	----------------------------------------------------------------------------------------------
	  Convergence Criteria     1.00e-06 *    3.00e-04 *             o    1.20e-03 *             o
	----------------------------------------------------------------------------------------------
	     3    -128.32551064   -4.18e-06      5.67e-04      5.67e-04 o    2.93e-03      2.93e-03 o  ~
	----------------------------------------------------------------------------------------------

Next Geometry in Ang 
	Fragment 1 (Ang)

	    H   0.0000000000   0.0000000000   1.3967244836
	   Ne   0.0000000000   0.0000000000  -0.0711463753


    Structure for next step:
    Molecular point group: c2v
    Full point group: C_inf_v

    Geometry (in Angstrom), charge = 0, multiplicity = 4:

    H            0.000000000000     0.000000000000     1.397426177373
    NE           0.000000000000     0.000000000000    -0.070444681582


Scratch directory: /tmp/
gradient() will perform analytic gradient computation.
   => Libint2 <=

    Primary   basis highest AM E, G, H:  6, 6, 3
    Auxiliary basis highest AM E, G, H:  7, 7, 4
    Onebody   basis highest AM E, G, H:  -, -, -
    Solid Harmonics ordering:            Gaussian

*** tstart() called on Joses-MacBook-Pro-2.local
*** at Wed Jul 16 18:14:18 2025

   => Loading Basis Set <=

    Name: CC-PVDZ
    Role: ORBITAL
    Keyword: BASIS
    atoms 1 entry H          line    22 file /Users/joseantoniorodriguesromero/anaconda3/share/psi4/basis/cc-pvdz.gbs 
    atoms 2 entry NE         line   258 file /Users/joseantoniorodriguesromero/anaconda3/share/psi4/basis/cc-pvdz.gbs 


         ---------------------------------------------------------
                                   SCF
               by Justin Turney, Rob Parrish, Andy Simmonett
                          and Daniel G. A. Smith
                              UKS Reference
                        1 Threads,    500 MiB Core
         ---------------------------------------------------------

  ==> Geometry <==

    Molecular point group: c2v
    Full point group: C_inf_v

    Geometry (in Angstrom), charge = 0, multiplicity = 4:

       Center              X                  Y                   Z               Mass       
    ------------   -----------------  -----------------  -----------------  -----------------
         H            0.000000000000     0.000000000000     1.397426177373     1.007825032230
         NE           0.000000000000     0.000000000000    -0.070444681582    19.992440176200

  Running in c2v symmetry.

  Rotational constants: A = ************  B =      8.15445  C =      8.15445 [cm^-1]
  Rotational constants: A = ************  B = 244464.23729  C = 244464.23729 [MHz]
  Nuclear repulsion =    3.605066531853034

  Charge       = 0
  Multiplicity = 4
  Electrons    = 11
  Nalpha       = 7
  Nbeta        = 4

  ==> Algorithm <==

  SCF Algorithm Type is DF.
  DIIS enabled.
  MOM disabled.
  Fractional occupation disabled.
  Guess Type is READ.
  Energy threshold   = 1.00e-08
  Density threshold  = 1.00e-08
  Integral threshold = 1.00e-12

  ==> Primary Basis <==

  Basis Set: CC-PVDZ
    Blend: CC-PVDZ
    Number of shells: 9
    Number of basis functions: 19
    Number of Cartesian functions: 20
    Spherical Harmonics?: true
    Max angular momentum: 2

  ==> DFT Potential <==

   => LibXC <=

    Version 6.2.2
    S. Lehtola, C. Steigemann, M. J.T. Oliveira, and M. A.L. Marques.,  SoftwareX 7, 1–5 (2018) (10.1016/j.softx.2017.11.002)

   => Composite Functional: B3LYP <= 

    B3LYP Hyb-GGA Exchange-Correlation Functional

    P. J. Stephens, F. J. Devlin, C. F. Chabalowski, and M. J. Frisch.,  J. Phys. Chem. 98, 11623 (1994) (10.1021/j100096a001)

    Deriv               =              1
    GGA                 =           TRUE
    Meta                =          FALSE

    Exchange Hybrid     =           TRUE
    MP2 Hybrid          =          FALSE

   => Exchange Functionals <=

    0.0800   Slater exchange
    0.7200         Becke 88

   => Exact (HF) Exchange <=

    0.2000               HF 

   => Correlation Functionals <=

    0.1900   Vosko, Wilk & Nusair (VWN5_RPA)
    0.8100   Lee, Yang & Parr

   => LibXC Density Thresholds  <==

    XC_HYB_GGA_XC_B3LYP:  1.00E-15 

   => Molecular Quadrature <=

    Radial Scheme          =       TREUTLER
    Pruning Scheme         =           NONE
    Nuclear Scheme         =       TREUTLER

    Blocking Scheme        =         OCTREE
    BS radius alpha        =              1
    Pruning alpha          =              1
    Radial Points          =             75
    Spherical Points       =            302
    Total Points           =          44448
    Total Blocks           =            392
    Max Points             =            256
    Max Functions          =             19
    Weights Tolerance      =       1.00E-15

   => Loading Basis Set <=

    Name: (CC-PVDZ AUX)
    Role: JKFIT
    Keyword: DF_BASIS_SCF
    atoms 1 entry H          line    51 file /Users/joseantoniorodriguesromero/anaconda3/share/psi4/basis/cc-pvdz-jkfit.gbs 
    atoms 2 entry NE         line   321 file /Users/joseantoniorodriguesromero/anaconda3/share/psi4/basis/cc-pvdz-jkfit.gbs 

   => Loading Basis Set <=

    Name: CC-PVDZ
    Role: ORBITAL
    Keyword: BASIS
    atoms 1 entry H          line    22 file /Users/joseantoniorodriguesromero/anaconda3/share/psi4/basis/cc-pvdz.gbs 
    atoms 2 entry NE         line   258 file /Users/joseantoniorodriguesromero/anaconda3/share/psi4/basis/cc-pvdz.gbs 

  Reading orbitals from file /tmp/quartet_HNe.default.68112.180.npy, no projection.

  ==> Integral Setup <==

  DFHelper Memory: AOs need 0.000 GiB; user supplied 0.343 GiB. 
  Using in-core AOs.

  ==> MemDFJK: Density-Fitted J/K Matrices <==

    J tasked:                   Yes
    K tasked:                   Yes
    wK tasked:                   No
    OpenMP threads:               1
    Memory [MiB]:               350
    Algorithm:                 Core
    Schwarz Cutoff:           1E-12
    Mask sparsity (%):       0.0000
    Fitting Condition:        1E-10

   => Auxiliary Basis Set <=

  Basis Set: (CC-PVDZ AUX)
    Blend: CC-PVDZ-JKFIT
    Number of shells: 33
    Number of basis functions: 93
    Number of Cartesian functions: 106
    Spherical Harmonics?: true
    Max angular momentum: 3

  Cached 100.0% of DFT collocation blocks in 0.024 [GiB].

  Minimum eigenvalue in the overlap matrix is 1.4525807247E-01.
  Reciprocal condition number of the overlap matrix is 6.5366140943E-02.
    Using symmetric orthogonalization.

  ==> Pre-Iterations <==

  SCF Guess: Orbitals guess was supplied from a previous computation.

   -------------------------------------------------------
    Irrep   Nso     Nmo     Nalpha   Nbeta   Ndocc  Nsocc
   -------------------------------------------------------
     A1        10      10       5       3       3       2
     A2         1       1       0       0       0       0
     B1         4       4       1       1       1       0
     B2         4       4       1       0       0       1
   -------------------------------------------------------
    Total      19      19       7       4       4       3
   -------------------------------------------------------

  ==> Iterations <==

                           Total Energy        Delta E     RMS |[F,P]|

   @DF-UKS iter   0:  -128.32561430442158   -1.28326e+02   1.99002e-04 
   @DF-UKS iter   1:  -128.32551145650021    1.02848e-04   1.21225e-05 DIIS
   @DF-UKS iter   2:  -128.32551146069017   -4.18996e-09   8.23967e-06 DIIS/DAMP=1%
   @DF-UKS iter   3:  -128.32551348375603   -2.02307e-06   4.28328e-07 DIIS/DAMP=1%
   @DF-UKS iter   4:  -128.32551141227691    2.07148e-06   5.05935e-08 DIIS/DAMP=1%
   @DF-UKS iter   5:  -128.32551147215540   -5.98785e-08   5.06499e-09 DIIS/DAMP=1%
   @DF-UKS iter   6:  -128.32551146309794    9.05746e-09   7.87951e-10 DIIS/DAMP=1%
  Energy and wave function converged.


  ==> Post-Iterations <==

   Electrons on quadrature grid:
      Nalpha   =    6.9999998716 ; deviation = -1.284e-07
      Nbeta    =    3.9999999101 ; deviation = -8.986e-08
      Ntotal   =   10.9999997817 ; deviation = -2.183e-07 

   @Spin Contamination Metric:   8.278163076E-04
   @S^2 Expected:                3.750000000E+00
   @S^2 Observed:                3.750827816E+00
   @S   Expected:                1.500000000E+00
   @S   Observed:                1.500000000E+00

    Orbital Energies [Eh]
    ---------------------

    Alpha Occupied:                                                       

       1A1   -31.556526     2A1    -1.933780     1B2    -1.105057  
       3A1    -1.001766     1B1    -0.995581     4A1    -0.184467  
       5A1     0.392215  

    Alpha Virtual:                                                        

       2B2     0.940466     2B1     0.992778     6A1     1.113452  
       7A1     1.271758     3B2     1.411238     3B1     1.420045  
       8A1     2.109657     9A1     4.182902     1A2     4.192960  
       4B2     4.201960     4B1     4.284771    10A1     4.391457  

    Beta Occupied:                                                        

       1A1   -31.512895     2A1    -1.820741     1B1    -0.953251  
       3A1    -0.949515  

    Beta Virtual:                                                         

       1B2    -0.742820     4A1     0.056551     5A1     0.725387  
       2B1     1.026148     2B2     1.058402     6A1     1.182546  
       7A1     1.374617     3B1     1.577184     3B2     1.577890  
       8A1     2.211589     4B1     4.307974     1A2     4.308641  
       4B2     4.320033     9A1     4.321325    10A1     4.449908  

    Final Occupation by Irrep:
             A1    A2    B1    B2 
    DOCC [     3,    0,    1,    0 ]
    SOCC [     2,    0,    0,    1 ]
    NA   [     5,    0,    1,    1 ]
    NB   [     3,    0,    1,    0 ]

  @DF-UKS Final Energy:  -128.32551146309794

   => Energetics <=

    Nuclear Repulsion Energy =              3.6050665318530339
    One-Electron Energy =                -184.9089368197425642
    Two-Electron Energy =                  63.2046574915728456
    DFT Exchange-Correlation Energy =     -10.2262986667812434
    Empirical Dispersion Energy =           0.0000000000000000
    VV10 Nonlocal Energy =                  0.0000000000000000
    Total Energy =                       -128.3255114630979392

  UHF NO Occupations:
  HONO-2 :    1 B2 1.0000000
  HONO-1 :    4 A1 1.0000000
  HONO-0 :    5 A1 1.0000000
  LUNO+0 :    6 A1 0.0002644
  LUNO+1 :    7 A1 0.0000984
  LUNO+2 :    2 B1 0.0000511
  LUNO+3 :    8 A1 0.0000000


Computation Completed


Properties will be evaluated at   0.000000,   0.000000,   0.000000 [a0]

Properties computed using the SCF density matrix


 Multipole Moments:

 ------------------------------------------------------------------------------------
     Multipole            Electronic (a.u.)      Nuclear  (a.u.)        Total (a.u.)
 ------------------------------------------------------------------------------------

 L = 1.  Multiply by 2.5417464519 to convert [e a0] to [Debye]
 Dipole X            :          0.0000000            0.0000000            0.0000000
 Dipole Y            :          0.0000000            0.0000000            0.0000000
 Dipole Z            :         -4.1823627            1.3095412           -2.8728215
 Magnitude           :                                                    2.8728215

 ------------------------------------------------------------------------------------

*** tstop() called on Joses-MacBook-Pro-2.local at Wed Jul 16 18:14:18 2025
Module time:
	user time   =       0.66 seconds =       0.01 minutes
	system time =       2.88 seconds =       0.05 minutes
	total time  =          0 seconds =       0.00 minutes
Total time:
	user time   =       4.36 seconds =       0.07 minutes
	system time =      14.47 seconds =       0.24 minutes
	total time  =          2 seconds =       0.03 minutes

*** tstart() called on Joses-MacBook-Pro-2.local
*** at Wed Jul 16 18:14:18 2025


         ------------------------------------------------------------
                                   SCF GRAD                          
                          Rob Parrish, Justin Turney,                
                       Andy Simmonett, and Alex Sokolov              
         ------------------------------------------------------------

  ==> Geometry <==

    Molecular point group: c2v
    Full point group: C_inf_v

    Geometry (in Angstrom), charge = 0, multiplicity = 4:

       Center              X                  Y                   Z               Mass       
    ------------   -----------------  -----------------  -----------------  -----------------
         H            0.000000000000     0.000000000000     1.397426177373     1.007825032230
         NE           0.000000000000     0.000000000000    -0.070444681582    19.992440176200

  Nuclear repulsion =    3.605066531853034

  ==> Basis Set <==

  Basis Set: CC-PVDZ
    Blend: CC-PVDZ
    Number of shells: 9
    Number of basis functions: 19
    Number of Cartesian functions: 20
    Spherical Harmonics?: true
    Max angular momentum: 2

  ==> DFJKGrad: Density-Fitted SCF Gradients <==

    Gradient:                    1
    J tasked:                  Yes
    K tasked:                  Yes
    wK tasked:                  No
    OpenMP threads:              1
    Integrals threads:           1
    Memory [MiB]:              375
    Schwarz Cutoff:          1E-12
    Fitting Condition:       1E-10

   => Auxiliary Basis Set <=

  Basis Set: (CC-PVDZ AUX)
    Blend: CC-PVDZ-JKFIT
    Number of shells: 33
    Number of basis functions: 93
    Number of Cartesian functions: 106
    Spherical Harmonics?: true
    Max angular momentum: 3

  ==> DFT Potential <==

   => LibXC <=

    Version 6.2.2
    S. Lehtola, C. Steigemann, M. J.T. Oliveira, and M. A.L. Marques.,  SoftwareX 7, 1–5 (2018) (10.1016/j.softx.2017.11.002)

   => Composite Functional: B3LYP <= 

    B3LYP Hyb-GGA Exchange-Correlation Functional

    P. J. Stephens, F. J. Devlin, C. F. Chabalowski, and M. J. Frisch.,  J. Phys. Chem. 98, 11623 (1994) (10.1021/j100096a001)

    Deriv               =              1
    GGA                 =           TRUE
    Meta                =          FALSE

    Exchange Hybrid     =           TRUE
    MP2 Hybrid          =          FALSE

   => Exchange Functionals <=

    0.0800   Slater exchange
    0.7200         Becke 88

   => Exact (HF) Exchange <=

    0.2000               HF 

   => Correlation Functionals <=

    0.1900   Vosko, Wilk & Nusair (VWN5_RPA)
    0.8100   Lee, Yang & Parr

   => LibXC Density Thresholds  <==

    XC_HYB_GGA_XC_B3LYP:  1.00E-15 

   => Molecular Quadrature <=

    Radial Scheme          =       TREUTLER
    Pruning Scheme         =           NONE
    Nuclear Scheme         =       TREUTLER

    Blocking Scheme        =         OCTREE
    BS radius alpha        =              1
    Pruning alpha          =              1
    Radial Points          =             75
    Spherical Points       =            302
    Total Points           =          44448
    Total Blocks           =            392
    Max Points             =            256
    Max Functions          =             19
    Weights Tolerance      =       1.00E-15


  -Total Gradient:
     Atom            X                  Y                   Z
    ------   -----------------  -----------------  -----------------
       1        0.000000000000     0.000000000000    -0.000002318430
       2        0.000000000000     0.000000000000     0.000006675233


*** tstop() called on Joses-MacBook-Pro-2.local at Wed Jul 16 18:14:18 2025
Module time:
	user time   =       0.33 seconds =       0.01 minutes
	system time =       0.77 seconds =       0.01 minutes
	total time  =          0 seconds =       0.00 minutes
Total time:
	user time   =       4.69 seconds =       0.08 minutes
	system time =      15.24 seconds =       0.25 minutes
	total time  =          2 seconds =       0.03 minutes

    			-----------------------------------------

    			 OPTKING 3.0: for geometry optimizations 

    			     By R.A. King, Bethel University     

    			        with contributions from          

    			    A.V. Copan, J. Cayton, A. Heide      

    			-----------------------------------------

    
	                            ===> Fragment 1 <== 

	 Z (Atomic Numbers)          Masses                          Geom                  
	       1.000000             1.007825          0.00000000  0.00000000  2.64075276   
	      10.000000            19.992440          0.00000000  0.00000000 -0.13312116   

	 - Coordinate -           - BOHR/RAD -       - ANG/DEG -
	 R(1,2)           =         2.773874           1.467871


	        --- Internal Coordinate Step in ANG or DEG, aJ/ANG or AJ/DEG ---
	-------------------------------------------------------------------------------
	           Coordinate      Previous         Force          Change          New 
	           ----------      --------        ------          ------        ------
	               R(1,2)       1.46787        0.00004        0.00001       1.46788
	-------------------------------------------------------------------------------

	                                 ==> Convergence Check <==                                  
    
	Measures of convergence in internal coordinates in au.
    
	Criteria marked as inactive (o), active & met (*), and active & unmet ( ).

	----------------------------------------------------------------------------------------------
	   Step    Total Energy     Delta E     Max Force     RMS Force      Max Disp      RMS Disp   
	----------------------------------------------------------------------------------------------
	  Convergence Criteria     1.00e-06 *    3.00e-04 *             o    1.20e-03 *             o
	----------------------------------------------------------------------------------------------
	     4    -128.32551146   -8.23e-07 *    4.50e-06 *    4.50e-06 o    2.33e-05 *    2.33e-05 o  ~
	----------------------------------------------------------------------------------------------

Next Geometry in Ang 
	Fragment 1 (Ang)

	    H   0.0000000000   0.0000000000   1.3974323545
	   Ne   0.0000000000   0.0000000000  -0.0704508587


    Final optimized geometry and variables:
    Molecular point group: c2v
    Full point group: C_inf_v

    Geometry (in Angstrom), charge = 0, multiplicity = 4:

    H            0.000000000000     0.000000000000     1.397426177373
    NE           0.000000000000     0.000000000000    -0.070444681582


    Psi4 stopped on: Wednesday, 16 July 2025 06:14PM
    Psi4 wall time for execution: 0:00:02.83

*** Psi4 exiting successfully. Buy a developer a beer!
