
    -----------------------------------------------------------------------
          Psi4: An Open-Source Ab Initio Electronic Structure Package
                               Psi4 1.9.1 release

                         Git: Rev {} zzzzzzz 


    D. G. A. Smith, L. A. Burns, A. C. Simmonett, R. M. Parrish,
    M. C. Schieber, R. Galvelis, P. Kraus, H. Kruse, R. Di Remigio,
    A. Alenaizan, A. M. James, S. Lehtola, J. P. Misiewicz, M. Scheurer,
    R. A. Shaw, J. B. Schriber, Y. Xie, Z. L. Glick, D. A. Sirianni,
    J. S. O'Brien, J. M. Waldrop, A. Kumar, E. G. Hohenstein,
    B. P. Pritchard, B. R. Brooks, H. F. Schaefer III, A. Yu. Sokolov,
    K. Patkowski, A. E. DePrince III, U. Bozkaya, R. A. King,
    F. A. Evangelista, J. M. Turney, T. D. Crawford, C. D. Sherrill,
    J. Chem. Phys. 152(18) 184108 (2020). https://doi.org/10.1063/5.0006002

                            Additional Code Authors
    E. T. Seidl, C. L. Janssen, E. F. Valeev, M. L. Leininger,
    J. F. Gonthier, R. M. Richard, H. R. McAlexander, M. Saitow, X. Wang,
    P. Verma, M. H. Lechner, A. Jiang, S. Behnle, A. G. Heide,
    M. F. Herbst, and D. L. Poole

             Previous Authors, Complete List of Code Contributors,
                       and Citations for Specific Modules
    https://github.com/psi4/psi4/blob/master/codemeta.json
    https://github.com/psi4/psi4/graphs/contributors
    http://psicode.org/psi4manual/master/introduction.html#citing-psifour

    -----------------------------------------------------------------------


    Psi4 started on: Wednesday, 16 July 2025 06:12PM

    Process ID: 68095
    Host:       Joses-MacBook-Pro-2.local
    PSIDATADIR: /Users/joseantoniorodriguesromero/anaconda3/share/psi4
    Memory:     500.0 MiB
    Threads:    1
    
  ==> Input File <==

--------------------------------------------------------------------------
molecule { 
0 4
H   0.00000        0.60000        0.00000
C   0.00000       -0.60000        0.00000
}

set { 
basis              cc-pvdz
reference          uks
maxiter            500
geom_maxiter       500
DAMPING_PERCENTAGE 1
guess              SAP
}

optimize('b3lyp')
--------------------------------------------------------------------------

Scratch directory: /tmp/
gradient() will perform analytic gradient computation.
   => Libint2 <=

    Primary   basis highest AM E, G, H:  6, 6, 3
    Auxiliary basis highest AM E, G, H:  7, 7, 4
    Onebody   basis highest AM E, G, H:  -, -, -
    Solid Harmonics ordering:            Gaussian

*** tstart() called on Joses-MacBook-Pro-2.local
*** at Wed Jul 16 18:12:59 2025

   => Loading Basis Set <=

    Name: CC-PVDZ
    Role: ORBITAL
    Keyword: BASIS
    atoms 1 entry H          line    22 file /Users/joseantoniorodriguesromero/anaconda3/share/psi4/basis/cc-pvdz.gbs 
    atoms 2 entry C          line   138 file /Users/joseantoniorodriguesromero/anaconda3/share/psi4/basis/cc-pvdz.gbs 


         ---------------------------------------------------------
                                   SCF
               by Justin Turney, Rob Parrish, Andy Simmonett
                          and Daniel G. A. Smith
                              UKS Reference
                        1 Threads,    500 MiB Core
         ---------------------------------------------------------

  ==> Geometry <==

    Molecular point group: c2v
    Full point group: C_inf_v

    Geometry (in Angstrom), charge = 0, multiplicity = 4:

       Center              X                  Y                   Z               Mass       
    ------------   -----------------  -----------------  -----------------  -----------------
         H            0.000000000000     0.000000000000     1.107025960475     1.007825032230
         C            0.000000000000     0.000000000000    -0.092974039525    12.000000000000

  Running in c2v symmetry.

  Rotational constants: A = ************  B =     12.59135  C =     12.59135 [cm^-1]
  Rotational constants: A = ************  B = 377479.18325  C = 377479.18325 [MHz]
  Nuclear repulsion =    2.645886053350000

  Charge       = 0
  Multiplicity = 4
  Electrons    = 7
  Nalpha       = 5
  Nbeta        = 2

  ==> Algorithm <==

  SCF Algorithm Type is DF.
  DIIS enabled.
  MOM disabled.
  Fractional occupation disabled.
  Guess Type is SAP.
  Energy threshold   = 1.00e-08
  Density threshold  = 1.00e-08
  Integral threshold = 1.00e-12

  ==> Primary Basis <==

  Basis Set: CC-PVDZ
    Blend: CC-PVDZ
    Number of shells: 9
    Number of basis functions: 19
    Number of Cartesian functions: 20
    Spherical Harmonics?: true
    Max angular momentum: 2

  ==> DFT Potential <==

   => LibXC <=

    Version 6.2.2
    S. Lehtola, C. Steigemann, M. J.T. Oliveira, and M. A.L. Marques.,  SoftwareX 7, 1–5 (2018) (10.1016/j.softx.2017.11.002)

   => Composite Functional: B3LYP <= 

    B3LYP Hyb-GGA Exchange-Correlation Functional

    P. J. Stephens, F. J. Devlin, C. F. Chabalowski, and M. J. Frisch.,  J. Phys. Chem. 98, 11623 (1994) (10.1021/j100096a001)

    Deriv               =              1
    GGA                 =           TRUE
    Meta                =          FALSE

    Exchange Hybrid     =           TRUE
    MP2 Hybrid          =          FALSE

   => Exchange Functionals <=

    0.0800   Slater exchange
    0.7200         Becke 88

   => Exact (HF) Exchange <=

    0.2000               HF 

   => Correlation Functionals <=

    0.1900   Vosko, Wilk & Nusair (VWN5_RPA)
    0.8100   Lee, Yang & Parr

   => LibXC Density Thresholds  <==

    XC_HYB_GGA_XC_B3LYP:  1.00E-15 

   => Molecular Quadrature <=

    Radial Scheme          =       TREUTLER
    Pruning Scheme         =           NONE
    Nuclear Scheme         =       TREUTLER

    Blocking Scheme        =         OCTREE
    BS radius alpha        =              1
    Pruning alpha          =              1
    Radial Points          =             75
    Spherical Points       =            302
    Total Points           =          43742
    Total Blocks           =            387
    Max Points             =            255
    Max Functions          =             19
    Weights Tolerance      =       1.00E-15

   => Loading Basis Set <=

    Name: (CC-PVDZ AUX)
    Role: JKFIT
    Keyword: DF_BASIS_SCF
    atoms 1 entry H          line    51 file /Users/joseantoniorodriguesromero/anaconda3/share/psi4/basis/cc-pvdz-jkfit.gbs 
    atoms 2 entry C          line   121 file /Users/joseantoniorodriguesromero/anaconda3/share/psi4/basis/cc-pvdz-jkfit.gbs 

  ==> Integral Setup <==

  DFHelper Memory: AOs need 0.000 GiB; user supplied 0.342 GiB. 
  Using in-core AOs.

  ==> MemDFJK: Density-Fitted J/K Matrices <==

    J tasked:                   Yes
    K tasked:                   Yes
    wK tasked:                   No
    OpenMP threads:               1
    Memory [MiB]:               349
    Algorithm:                 Core
    Schwarz Cutoff:           1E-12
    Mask sparsity (%):       0.0000
    Fitting Condition:        1E-10

   => Auxiliary Basis Set <=

  Basis Set: (CC-PVDZ AUX)
    Blend: CC-PVDZ-JKFIT
    Number of shells: 33
    Number of basis functions: 93
    Number of Cartesian functions: 106
    Spherical Harmonics?: true
    Max angular momentum: 3

  Cached 100.0% of DFT collocation blocks in 0.024 [GiB].

  Minimum eigenvalue in the overlap matrix is 4.4207294837E-02.
  Reciprocal condition number of the overlap matrix is 1.4754317306E-02.
    Using symmetric orthogonalization.

  ==> Pre-Iterations <==

  SCF Guess: Superposition of Atomic Potentials (doi:10.1021/acs.jctc.8b01089).

  ==> SAP guess <==

   => Molecular Quadrature <=

    Radial Scheme          =       TREUTLER
    Pruning Scheme         =           NONE
    Nuclear Scheme         =       TREUTLER

    Blocking Scheme        =         OCTREE
    BS radius alpha        =              1
    Pruning alpha          =              1
    Radial Points          =             75
    Spherical Points       =            302
    Total Points           =          43742
    Total Blocks           =            387
    Max Points             =            255
    Max Functions          =             19
    Weights Tolerance      =       1.00E-15

   -------------------------------------------------------
    Irrep   Nso     Nmo     Nalpha   Nbeta   Ndocc  Nsocc
   -------------------------------------------------------
     A1        10      10       3       2       2       1
     A2         1       1       0       0       0       0
     B1         4       4       1       0       0       1
     B2         4       4       1       0       0       1
   -------------------------------------------------------
    Total      19      19       5       2       2       3
   -------------------------------------------------------

  ==> Iterations <==

                           Total Energy        Delta E     RMS |[F,P]|

   @DF-UKS iter   1:   -38.41245034030210   -3.84125e+01   1.99786e-02 ADIIS/DIIS
   @DF-UKS iter   2:   -38.44067253570648   -2.82222e-02   8.89411e-03 ADIIS/DIIS/DAMP=1%
   @DF-UKS iter   3:   -38.44589959380417   -5.22706e-03   1.38402e-03 ADIIS/DIIS/DAMP=1%
   @DF-UKS iter   4:   -38.44854251612482   -2.64292e-03   4.83140e-04 ADIIS/DIIS/DAMP=1%
   @DF-UKS iter   5:   -38.44813616987394    4.06346e-04   6.83513e-05 DIIS/DAMP=1%
   @DF-UKS iter   6:   -38.44820253458110   -6.63647e-05   1.63997e-05 DIIS/DAMP=1%
   @DF-UKS iter   7:   -38.44820515078741   -2.61621e-06   2.60757e-06 DIIS/DAMP=1%
   @DF-UKS iter   8:   -38.44820539206389   -2.41276e-07   2.64101e-07 DIIS/DAMP=1%
   @DF-UKS iter   9:   -38.44820546102466   -6.89608e-08   2.03844e-08 DIIS/DAMP=1%
   @DF-UKS iter  10:   -38.44820545033855    1.06861e-08   1.52966e-09 DIIS/DAMP=1%
   @DF-UKS iter  11:   -38.44820545148148   -1.14293e-09   1.26058e-10 DIIS/DAMP=1%
  Energy and wave function converged.


  ==> Post-Iterations <==

   Electrons on quadrature grid:
      Nalpha   =    4.9999999860 ; deviation = -1.396e-08
      Nbeta    =    1.9999999850 ; deviation = -1.498e-08
      Ntotal   =    6.9999999711 ; deviation = -2.894e-08 

   @Spin Contamination Metric:   1.290027224E-03
   @S^2 Expected:                3.750000000E+00
   @S^2 Observed:                3.751290027E+00
   @S   Expected:                1.500000000E+00
   @S   Observed:                1.500000000E+00

    Orbital Energies [Eh]
    ---------------------

    Alpha Occupied:                                                       

       1A1   -10.264457     2A1    -0.647452     3A1    -0.378818  
       1B1    -0.252832     1B2    -0.252832  

    Alpha Virtual:                                                        

       4A1     0.061639     5A1     0.421268     2B1     0.457268  
       2B2     0.457268     6A1     0.466145     7A1     0.714941  
       3B2     0.959484     3B1     0.959484     1A2     1.120350  
       8A1     1.120350     9A1     1.450685     4B2     1.648085  
       4B1     1.648085    10A1     2.184065  

    Beta Occupied:                                                        

       1A1   -10.222640     2A1    -0.527186  

    Beta Virtual:                                                         

       3A1    -0.165506     1B2    -0.042318     1B1    -0.042318  
       4A1     0.101152     5A1     0.479202     2B1     0.551640  
       2B2     0.551640     6A1     0.559562     7A1     0.773731  
       3B2     1.045981     3B1     1.045981     8A1     1.253350  
       1A2     1.253350     9A1     1.544358     4B2     1.722844  
       4B1     1.722844    10A1     2.247775  

    Final Occupation by Irrep:
             A1    A2    B1    B2 
    DOCC [     2,    0,    0,    0 ]
    SOCC [     1,    0,    1,    1 ]
    NA   [     3,    0,    1,    1 ]
    NB   [     2,    0,    0,    0 ]

  @DF-UKS Final Energy:   -38.44820545148148

   => Energetics <=

    Nuclear Repulsion Energy =              2.6458860533500004
    One-Electron Energy =                 -56.3584998809611832
    Two-Electron Energy =                  19.8248239813701694
    DFT Exchange-Correlation Energy =      -4.5604156052404550
    Empirical Dispersion Energy =           0.0000000000000000
    VV10 Nonlocal Energy =                  0.0000000000000000
    Total Energy =                        -38.4482054514814777

  UHF NO Occupations:
  HONO-2 :    3 A1 1.0000000
  HONO-1 :    1 B1 1.0000000
  HONO-0 :    1 B2 1.0000000
  LUNO+0 :    4 A1 0.0006450
  LUNO+1 :    5 A1 0.0000002
  LUNO+2 :    6 A1 0.0000000
  LUNO+3 :    7 A1 0.0000000


Computation Completed


Properties will be evaluated at   0.000000,   0.000000,   0.000000 [a0]

Properties computed using the SCF density matrix


 Multipole Moments:

 ------------------------------------------------------------------------------------
     Multipole            Electronic (a.u.)      Nuclear  (a.u.)        Total (a.u.)
 ------------------------------------------------------------------------------------

 L = 1.  Multiply by 2.5417464519 to convert [e a0] to [Debye]
 Dipole X            :          0.0000000            0.0000000            0.0000000
 Dipole Y            :          0.0000000            0.0000000            0.0000000
 Dipole Z            :         -0.7070357            1.0378031            0.3307674
 Magnitude           :                                                    0.3307674

 ------------------------------------------------------------------------------------

*** tstop() called on Joses-MacBook-Pro-2.local at Wed Jul 16 18:12:59 2025
Module time:
	user time   =       1.23 seconds =       0.02 minutes
	system time =       2.41 seconds =       0.04 minutes
	total time  =          0 seconds =       0.00 minutes
Total time:
	user time   =       1.23 seconds =       0.02 minutes
	system time =       2.41 seconds =       0.04 minutes
	total time  =          0 seconds =       0.00 minutes

*** tstart() called on Joses-MacBook-Pro-2.local
*** at Wed Jul 16 18:12:59 2025


         ------------------------------------------------------------
                                   SCF GRAD                          
                          Rob Parrish, Justin Turney,                
                       Andy Simmonett, and Alex Sokolov              
         ------------------------------------------------------------

  ==> Geometry <==

    Molecular point group: c2v
    Full point group: C_inf_v

    Geometry (in Angstrom), charge = 0, multiplicity = 4:

       Center              X                  Y                   Z               Mass       
    ------------   -----------------  -----------------  -----------------  -----------------
         H            0.000000000000     0.000000000000     1.107025960475     1.007825032230
         C            0.000000000000     0.000000000000    -0.092974039525    12.000000000000

  Nuclear repulsion =    2.645886053350000

  ==> Basis Set <==

  Basis Set: CC-PVDZ
    Blend: CC-PVDZ
    Number of shells: 9
    Number of basis functions: 19
    Number of Cartesian functions: 20
    Spherical Harmonics?: true
    Max angular momentum: 2

  ==> DFJKGrad: Density-Fitted SCF Gradients <==

    Gradient:                    1
    J tasked:                  Yes
    K tasked:                  Yes
    wK tasked:                  No
    OpenMP threads:              1
    Integrals threads:           1
    Memory [MiB]:              375
    Schwarz Cutoff:          1E-12
    Fitting Condition:       1E-10

   => Auxiliary Basis Set <=

  Basis Set: (CC-PVDZ AUX)
    Blend: CC-PVDZ-JKFIT
    Number of shells: 33
    Number of basis functions: 93
    Number of Cartesian functions: 106
    Spherical Harmonics?: true
    Max angular momentum: 3

  ==> DFT Potential <==

   => LibXC <=

    Version 6.2.2
    S. Lehtola, C. Steigemann, M. J.T. Oliveira, and M. A.L. Marques.,  SoftwareX 7, 1–5 (2018) (10.1016/j.softx.2017.11.002)

   => Composite Functional: B3LYP <= 

    B3LYP Hyb-GGA Exchange-Correlation Functional

    P. J. Stephens, F. J. Devlin, C. F. Chabalowski, and M. J. Frisch.,  J. Phys. Chem. 98, 11623 (1994) (10.1021/j100096a001)

    Deriv               =              1
    GGA                 =           TRUE
    Meta                =          FALSE

    Exchange Hybrid     =           TRUE
    MP2 Hybrid          =          FALSE

   => Exchange Functionals <=

    0.0800   Slater exchange
    0.7200         Becke 88

   => Exact (HF) Exchange <=

    0.2000               HF 

   => Correlation Functionals <=

    0.1900   Vosko, Wilk & Nusair (VWN5_RPA)
    0.8100   Lee, Yang & Parr

   => LibXC Density Thresholds  <==

    XC_HYB_GGA_XC_B3LYP:  1.00E-15 

   => Molecular Quadrature <=

    Radial Scheme          =       TREUTLER
    Pruning Scheme         =           NONE
    Nuclear Scheme         =       TREUTLER

    Blocking Scheme        =         OCTREE
    BS radius alpha        =              1
    Pruning alpha          =              1
    Radial Points          =             75
    Spherical Points       =            302
    Total Points           =          43742
    Total Blocks           =            387
    Max Points             =            255
    Max Functions          =             19
    Weights Tolerance      =       1.00E-15


  -Total Gradient:
     Atom            X                  Y                   Z
    ------   -----------------  -----------------  -----------------
       1       -0.000000000000    -0.000000000000     0.043011000011
       2        0.000000000000    -0.000000000000    -0.043010828065


*** tstop() called on Joses-MacBook-Pro-2.local at Wed Jul 16 18:12:59 2025
Module time:
	user time   =       0.22 seconds =       0.00 minutes
	system time =       0.86 seconds =       0.01 minutes
	total time  =          0 seconds =       0.00 minutes
Total time:
	user time   =       1.45 seconds =       0.02 minutes
	system time =       3.27 seconds =       0.05 minutes
	total time  =          0 seconds =       0.00 minutes

    			-----------------------------------------

    			 OPTKING 3.0: for geometry optimizations 

    			     By R.A. King, Bethel University     

    			        with contributions from          

    			    A.V. Copan, J. Cayton, A. Heide      

    			-----------------------------------------

    
	                            ===> Fragment 1 <== 

	 Z (Atomic Numbers)          Masses                          Geom                  
	       1.000000             1.007825          0.00000000  0.00000000  2.09197588   
	       6.000000            12.000000          0.00000000  0.00000000 -0.17569547   

	 - Coordinate -           - BOHR/RAD -       - ANG/DEG -
	 R(1,2)           =         2.267671           1.200000


	        --- Internal Coordinate Step in ANG or DEG, aJ/ANG or AJ/DEG ---
	-------------------------------------------------------------------------------
	           Coordinate      Previous         Force          Change          New 
	           ----------      --------        ------          ------        ------
	               R(1,2)       1.20000       -0.35436       -0.08963       1.11037
	-------------------------------------------------------------------------------

	                                 ==> Convergence Check <==                                  
    
	Measures of convergence in internal coordinates in au.
    
	Criteria marked as inactive (o), active & met (*), and active & unmet ( ).

	----------------------------------------------------------------------------------------------
	   Step    Total Energy     Delta E     Max Force     RMS Force      Max Disp      RMS Disp   
	----------------------------------------------------------------------------------------------
	  Convergence Criteria     1.00e-06 *    3.00e-04 *             o    1.20e-03 *             o
	----------------------------------------------------------------------------------------------
	     1     -38.44820545   -3.84e+01      4.30e-02      4.30e-02 o    1.69e-01      1.69e-01 o  ~
	----------------------------------------------------------------------------------------------

Next Geometry in Ang 
	Fragment 1 (Ang)

	    H   0.0000000000   0.0000000000   1.0622110621
	    C   0.0000000000   0.0000000000  -0.0481591412


    Structure for next step:
    Molecular point group: c2v
    Full point group: C_inf_v

    Geometry (in Angstrom), charge = 0, multiplicity = 4:

    H            0.000000000000     0.000000000000     1.024340534022
    C            0.000000000000     0.000000000000    -0.086029669310


Scratch directory: /tmp/
gradient() will perform analytic gradient computation.
   => Libint2 <=

    Primary   basis highest AM E, G, H:  6, 6, 3
    Auxiliary basis highest AM E, G, H:  7, 7, 4
    Onebody   basis highest AM E, G, H:  -, -, -
    Solid Harmonics ordering:            Gaussian

*** tstart() called on Joses-MacBook-Pro-2.local
*** at Wed Jul 16 18:12:59 2025

   => Loading Basis Set <=

    Name: CC-PVDZ
    Role: ORBITAL
    Keyword: BASIS
    atoms 1 entry H          line    22 file /Users/joseantoniorodriguesromero/anaconda3/share/psi4/basis/cc-pvdz.gbs 
    atoms 2 entry C          line   138 file /Users/joseantoniorodriguesromero/anaconda3/share/psi4/basis/cc-pvdz.gbs 


         ---------------------------------------------------------
                                   SCF
               by Justin Turney, Rob Parrish, Andy Simmonett
                          and Daniel G. A. Smith
                              UKS Reference
                        1 Threads,    500 MiB Core
         ---------------------------------------------------------

  ==> Geometry <==

    Molecular point group: c2v
    Full point group: C_inf_v

    Geometry (in Angstrom), charge = 0, multiplicity = 4:

       Center              X                  Y                   Z               Mass       
    ------------   -----------------  -----------------  -----------------  -----------------
         H            0.000000000000     0.000000000000     1.024340534022     1.007825032230
         C            0.000000000000     0.000000000000    -0.086029669310    12.000000000000

  Running in c2v symmetry.

  Rotational constants: A = ************  B =     14.70616  C =     14.70616 [cm^-1]
  Rotational constants: A = ************  B = 440879.49519  C = 440879.49519 [MHz]
  Nuclear repulsion =    2.859463676613177

  Charge       = 0
  Multiplicity = 4
  Electrons    = 7
  Nalpha       = 5
  Nbeta        = 2

  ==> Algorithm <==

  SCF Algorithm Type is DF.
  DIIS enabled.
  MOM disabled.
  Fractional occupation disabled.
  Guess Type is READ.
  Energy threshold   = 1.00e-08
  Density threshold  = 1.00e-08
  Integral threshold = 1.00e-12

  ==> Primary Basis <==

  Basis Set: CC-PVDZ
    Blend: CC-PVDZ
    Number of shells: 9
    Number of basis functions: 19
    Number of Cartesian functions: 20
    Spherical Harmonics?: true
    Max angular momentum: 2

  ==> DFT Potential <==

   => LibXC <=

    Version 6.2.2
    S. Lehtola, C. Steigemann, M. J.T. Oliveira, and M. A.L. Marques.,  SoftwareX 7, 1–5 (2018) (10.1016/j.softx.2017.11.002)

   => Composite Functional: B3LYP <= 

    B3LYP Hyb-GGA Exchange-Correlation Functional

    P. J. Stephens, F. J. Devlin, C. F. Chabalowski, and M. J. Frisch.,  J. Phys. Chem. 98, 11623 (1994) (10.1021/j100096a001)

    Deriv               =              1
    GGA                 =           TRUE
    Meta                =          FALSE

    Exchange Hybrid     =           TRUE
    MP2 Hybrid          =          FALSE

   => Exchange Functionals <=

    0.0800   Slater exchange
    0.7200         Becke 88

   => Exact (HF) Exchange <=

    0.2000               HF 

   => Correlation Functionals <=

    0.1900   Vosko, Wilk & Nusair (VWN5_RPA)
    0.8100   Lee, Yang & Parr

   => LibXC Density Thresholds  <==

    XC_HYB_GGA_XC_B3LYP:  1.00E-15 

   => Molecular Quadrature <=

    Radial Scheme          =       TREUTLER
    Pruning Scheme         =           NONE
    Nuclear Scheme         =       TREUTLER

    Blocking Scheme        =         OCTREE
    BS radius alpha        =              1
    Pruning alpha          =              1
    Radial Points          =             75
    Spherical Points       =            302
    Total Points           =          43731
    Total Blocks           =            389
    Max Points             =            256
    Max Functions          =             19
    Weights Tolerance      =       1.00E-15

   => Loading Basis Set <=

    Name: (CC-PVDZ AUX)
    Role: JKFIT
    Keyword: DF_BASIS_SCF
    atoms 1 entry H          line    51 file /Users/joseantoniorodriguesromero/anaconda3/share/psi4/basis/cc-pvdz-jkfit.gbs 
    atoms 2 entry C          line   121 file /Users/joseantoniorodriguesromero/anaconda3/share/psi4/basis/cc-pvdz-jkfit.gbs 

   => Loading Basis Set <=

    Name: CC-PVDZ
    Role: ORBITAL
    Keyword: BASIS
    atoms 1 entry H          line    22 file /Users/joseantoniorodriguesromero/anaconda3/share/psi4/basis/cc-pvdz.gbs 
    atoms 2 entry C          line   138 file /Users/joseantoniorodriguesromero/anaconda3/share/psi4/basis/cc-pvdz.gbs 

  Reading orbitals from file /tmp/quartet_HC.default.68095.180.npy, no projection.

  ==> Integral Setup <==

  DFHelper Memory: AOs need 0.000 GiB; user supplied 0.342 GiB. 
  Using in-core AOs.

  ==> MemDFJK: Density-Fitted J/K Matrices <==

    J tasked:                   Yes
    K tasked:                   Yes
    wK tasked:                   No
    OpenMP threads:               1
    Memory [MiB]:               349
    Algorithm:                 Core
    Schwarz Cutoff:           1E-12
    Mask sparsity (%):       0.0000
    Fitting Condition:        1E-10

   => Auxiliary Basis Set <=

  Basis Set: (CC-PVDZ AUX)
    Blend: CC-PVDZ-JKFIT
    Number of shells: 33
    Number of basis functions: 93
    Number of Cartesian functions: 106
    Spherical Harmonics?: true
    Max angular momentum: 3

  Cached 100.0% of DFT collocation blocks in 0.024 [GiB].

  Minimum eigenvalue in the overlap matrix is 3.7158004743E-02.
  Reciprocal condition number of the overlap matrix is 1.2139096970E-02.
    Using symmetric orthogonalization.

  ==> Pre-Iterations <==

  SCF Guess: Orbitals guess was supplied from a previous computation.

   -------------------------------------------------------
    Irrep   Nso     Nmo     Nalpha   Nbeta   Ndocc  Nsocc
   -------------------------------------------------------
     A1        10      10       3       2       2       1
     A2         1       1       0       0       0       0
     B1         4       4       1       0       0       1
     B2         4       4       1       0       0       1
   -------------------------------------------------------
    Total      19      19       5       2       2       3
   -------------------------------------------------------

  ==> Iterations <==

                           Total Energy        Delta E     RMS |[F,P]|

   @DF-UKS iter   0:   -38.48377255344563   -3.84838e+01   9.25534e-03 
   @DF-UKS iter   1:   -38.45210655582874    3.16660e-02   1.37499e-03 ADIIS/DIIS
   @DF-UKS iter   2:   -38.45231502178615   -2.08466e-04   7.55367e-04 ADIIS/DIIS/DAMP=1%
   @DF-UKS iter   3:   -38.45253047825992   -2.15456e-04   1.44617e-04 ADIIS/DIIS/DAMP=1%
   @DF-UKS iter   4:   -38.45235409383441    1.76384e-04   5.94902e-05 DIIS/DAMP=1%
   @DF-UKS iter   5:   -38.45238036504600   -2.62712e-05   6.25788e-06 DIIS/DAMP=1%
   @DF-UKS iter   6:   -38.45237159240595    8.77264e-06   9.18395e-07 DIIS/DAMP=1%
   @DF-UKS iter   7:   -38.45237245927802   -8.66872e-07   9.24174e-08 DIIS/DAMP=1%
   @DF-UKS iter   8:   -38.45237241008780    4.91902e-08   1.15505e-08 DIIS/DAMP=1%
   @DF-UKS iter   9:   -38.45237240813321    1.95459e-09   5.73059e-10 DIIS/DAMP=1%
  Energy and wave function converged.


  ==> Post-Iterations <==

   Electrons on quadrature grid:
      Nalpha   =    4.9999999855 ; deviation = -1.447e-08
      Nbeta    =    1.9999999875 ; deviation = -1.254e-08
      Ntotal   =    6.9999999730 ; deviation = -2.701e-08 

   @Spin Contamination Metric:   1.378557255E-03
   @S^2 Expected:                3.750000000E+00
   @S^2 Observed:                3.751378557E+00
   @S   Expected:                1.500000000E+00
   @S   Observed:                1.500000000E+00

    Orbital Energies [Eh]
    ---------------------

    Alpha Occupied:                                                       

       1A1   -10.259791     2A1    -0.662640     3A1    -0.384450  
       1B1    -0.254894     1B2    -0.254894  

    Alpha Virtual:                                                        

       4A1     0.083466     5A1     0.434747     2B2     0.456967  
       2B1     0.456967     6A1     0.474294     7A1     0.737902  
       3B1     0.966075     3B2     0.966075     8A1     1.118080  
       1A2     1.118080     9A1     1.528894     4B1     1.709092  
       4B2     1.709092    10A1     2.317687  

    Beta Occupied:                                                        

       1A1   -10.217224     2A1    -0.546851  

    Beta Virtual:                                                         

       3A1    -0.159773     1B1    -0.042862     1B2    -0.042862  
       4A1     0.113804     5A1     0.488412     2B2     0.551883  
       2B1     0.551883     6A1     0.579502     7A1     0.796291  
       3B1     1.055574     3B2     1.055574     8A1     1.252467  
       1A2     1.252467     9A1     1.625696     4B1     1.782235  
       4B2     1.782235    10A1     2.377089  

    Final Occupation by Irrep:
             A1    A2    B1    B2 
    DOCC [     2,    0,    0,    0 ]
    SOCC [     1,    0,    1,    1 ]
    NA   [     3,    0,    1,    1 ]
    NB   [     2,    0,    0,    0 ]

  @DF-UKS Final Energy:   -38.45237240813321

   => Energetics <=

    Nuclear Repulsion Energy =              2.8594636766131774
    One-Electron Energy =                 -56.7433725245821563
    Two-Electron Energy =                  20.0154316202426159
    DFT Exchange-Correlation Energy =      -4.5838951804068451
    Empirical Dispersion Energy =           0.0000000000000000
    VV10 Nonlocal Energy =                  0.0000000000000000
    Total Energy =                        -38.4523724081332148

  UHF NO Occupations:
  HONO-2 :    1 B2 1.0000000
  HONO-1 :    1 B1 1.0000000
  HONO-0 :    3 A1 1.0000000
  LUNO+0 :    4 A1 0.0006892
  LUNO+1 :    5 A1 0.0000003
  LUNO+2 :    6 A1 0.0000000
  LUNO+3 :    7 A1 0.0000000


Computation Completed


Properties will be evaluated at   0.000000,   0.000000,   0.000000 [a0]

Properties computed using the SCF density matrix


 Multipole Moments:

 ------------------------------------------------------------------------------------
     Multipole            Electronic (a.u.)      Nuclear  (a.u.)        Total (a.u.)
 ------------------------------------------------------------------------------------

 L = 1.  Multiply by 2.5417464519 to convert [e a0] to [Debye]
 Dipole X            :          0.0000000            0.0000000            0.0000000
 Dipole Y            :          0.0000000            0.0000000            0.0000000
 Dipole Z            :         -0.6672418            0.9602880            0.2930462
 Magnitude           :                                                    0.2930462

 ------------------------------------------------------------------------------------

*** tstop() called on Joses-MacBook-Pro-2.local at Wed Jul 16 18:13:00 2025
Module time:
	user time   =       0.92 seconds =       0.02 minutes
	system time =       2.95 seconds =       0.05 minutes
	total time  =          1 seconds =       0.02 minutes
Total time:
	user time   =       2.41 seconds =       0.04 minutes
	system time =       6.45 seconds =       0.11 minutes
	total time  =          1 seconds =       0.02 minutes

*** tstart() called on Joses-MacBook-Pro-2.local
*** at Wed Jul 16 18:13:00 2025


         ------------------------------------------------------------
                                   SCF GRAD                          
                          Rob Parrish, Justin Turney,                
                       Andy Simmonett, and Alex Sokolov              
         ------------------------------------------------------------

  ==> Geometry <==

    Molecular point group: c2v
    Full point group: C_inf_v

    Geometry (in Angstrom), charge = 0, multiplicity = 4:

       Center              X                  Y                   Z               Mass       
    ------------   -----------------  -----------------  -----------------  -----------------
         H            0.000000000000     0.000000000000     1.024340534022     1.007825032230
         C            0.000000000000     0.000000000000    -0.086029669310    12.000000000000

  Nuclear repulsion =    2.859463676613177

  ==> Basis Set <==

  Basis Set: CC-PVDZ
    Blend: CC-PVDZ
    Number of shells: 9
    Number of basis functions: 19
    Number of Cartesian functions: 20
    Spherical Harmonics?: true
    Max angular momentum: 2

  ==> DFJKGrad: Density-Fitted SCF Gradients <==

    Gradient:                    1
    J tasked:                  Yes
    K tasked:                  Yes
    wK tasked:                  No
    OpenMP threads:              1
    Integrals threads:           1
    Memory [MiB]:              375
    Schwarz Cutoff:          1E-12
    Fitting Condition:       1E-10

   => Auxiliary Basis Set <=

  Basis Set: (CC-PVDZ AUX)
    Blend: CC-PVDZ-JKFIT
    Number of shells: 33
    Number of basis functions: 93
    Number of Cartesian functions: 106
    Spherical Harmonics?: true
    Max angular momentum: 3

  ==> DFT Potential <==

   => LibXC <=

    Version 6.2.2
    S. Lehtola, C. Steigemann, M. J.T. Oliveira, and M. A.L. Marques.,  SoftwareX 7, 1–5 (2018) (10.1016/j.softx.2017.11.002)

   => Composite Functional: B3LYP <= 

    B3LYP Hyb-GGA Exchange-Correlation Functional

    P. J. Stephens, F. J. Devlin, C. F. Chabalowski, and M. J. Frisch.,  J. Phys. Chem. 98, 11623 (1994) (10.1021/j100096a001)

    Deriv               =              1
    GGA                 =           TRUE
    Meta                =          FALSE

    Exchange Hybrid     =           TRUE
    MP2 Hybrid          =          FALSE

   => Exchange Functionals <=

    0.0800   Slater exchange
    0.7200         Becke 88

   => Exact (HF) Exchange <=

    0.2000               HF 

   => Correlation Functionals <=

    0.1900   Vosko, Wilk & Nusair (VWN5_RPA)
    0.8100   Lee, Yang & Parr

   => LibXC Density Thresholds  <==

    XC_HYB_GGA_XC_B3LYP:  1.00E-15 

   => Molecular Quadrature <=

    Radial Scheme          =       TREUTLER
    Pruning Scheme         =           NONE
    Nuclear Scheme         =       TREUTLER

    Blocking Scheme        =         OCTREE
    BS radius alpha        =              1
    Pruning alpha          =              1
    Radial Points          =             75
    Spherical Points       =            302
    Total Points           =          43731
    Total Blocks           =            389
    Max Points             =            256
    Max Functions          =             19
    Weights Tolerance      =       1.00E-15


  -Total Gradient:
     Atom            X                  Y                   Z
    ------   -----------------  -----------------  -----------------
       1        0.000000000000    -0.000000000000     0.002110333127
       2       -0.000000000000     0.000000000000    -0.002110337489


*** tstop() called on Joses-MacBook-Pro-2.local at Wed Jul 16 18:13:00 2025
Module time:
	user time   =       0.30 seconds =       0.01 minutes
	system time =       0.92 seconds =       0.02 minutes
	total time  =          0 seconds =       0.00 minutes
Total time:
	user time   =       2.71 seconds =       0.05 minutes
	system time =       7.37 seconds =       0.12 minutes
	total time  =          1 seconds =       0.02 minutes

    			-----------------------------------------

    			 OPTKING 3.0: for geometry optimizations 

    			     By R.A. King, Bethel University     

    			        with contributions from          

    			    A.V. Copan, J. Cayton, A. Heide      

    			-----------------------------------------

    
	                            ===> Fragment 1 <== 

	 Z (Atomic Numbers)          Masses                          Geom                  
	       1.000000             1.007825          0.00000000  0.00000000  1.93572307   
	       6.000000            12.000000          0.00000000  0.00000000 -0.16257251   

	 - Coordinate -           - BOHR/RAD -       - ANG/DEG -
	 R(1,2)           =         2.098296           1.110370


	        --- Internal Coordinate Step in ANG or DEG, aJ/ANG or AJ/DEG ---
	-------------------------------------------------------------------------------
	           Coordinate      Previous         Force          Change          New 
	           ----------      --------        ------          ------        ------
	               R(1,2)       1.11037       -0.01739       -0.00462       1.10575
	-------------------------------------------------------------------------------

	                                 ==> Convergence Check <==                                  
    
	Measures of convergence in internal coordinates in au.
    
	Criteria marked as inactive (o), active & met (*), and active & unmet ( ).

	----------------------------------------------------------------------------------------------
	   Step    Total Energy     Delta E     Max Force     RMS Force      Max Disp      RMS Disp   
	----------------------------------------------------------------------------------------------
	  Convergence Criteria     1.00e-06 *    3.00e-04 *             o    1.20e-03 *             o
	----------------------------------------------------------------------------------------------
	     2     -38.45237241   -4.17e-03      2.11e-03      2.11e-03 o    8.74e-03      8.74e-03 o  ~
	----------------------------------------------------------------------------------------------

Next Geometry in Ang 
	Fragment 1 (Ang)

	    H   0.0000000000   0.0000000000   1.0220284093
	    C   0.0000000000   0.0000000000  -0.0837175446


    Structure for next step:
    Molecular point group: c2v
    Full point group: C_inf_v

    Geometry (in Angstrom), charge = 0, multiplicity = 4:

    H            0.000000000000     0.000000000000     1.020074563819
    C            0.000000000000     0.000000000000    -0.085671390013


Scratch directory: /tmp/
gradient() will perform analytic gradient computation.
   => Libint2 <=

    Primary   basis highest AM E, G, H:  6, 6, 3
    Auxiliary basis highest AM E, G, H:  7, 7, 4
    Onebody   basis highest AM E, G, H:  -, -, -
    Solid Harmonics ordering:            Gaussian

*** tstart() called on Joses-MacBook-Pro-2.local
*** at Wed Jul 16 18:13:00 2025

   => Loading Basis Set <=

    Name: CC-PVDZ
    Role: ORBITAL
    Keyword: BASIS
    atoms 1 entry H          line    22 file /Users/joseantoniorodriguesromero/anaconda3/share/psi4/basis/cc-pvdz.gbs 
    atoms 2 entry C          line   138 file /Users/joseantoniorodriguesromero/anaconda3/share/psi4/basis/cc-pvdz.gbs 


         ---------------------------------------------------------
                                   SCF
               by Justin Turney, Rob Parrish, Andy Simmonett
                          and Daniel G. A. Smith
                              UKS Reference
                        1 Threads,    500 MiB Core
         ---------------------------------------------------------

  ==> Geometry <==

    Molecular point group: c2v
    Full point group: C_inf_v

    Geometry (in Angstrom), charge = 0, multiplicity = 4:

       Center              X                  Y                   Z               Mass       
    ------------   -----------------  -----------------  -----------------  -----------------
         H            0.000000000000     0.000000000000     1.020074563819     1.007825032230
         C            0.000000000000     0.000000000000    -0.085671390013    12.000000000000

  Running in c2v symmetry.

  Rotational constants: A = ************  B =     14.82942  C =     14.82942 [cm^-1]
  Rotational constants: A = ************  B = 444574.73784  C = 444574.73784 [MHz]
  Nuclear repulsion =    2.871422005222117

  Charge       = 0
  Multiplicity = 4
  Electrons    = 7
  Nalpha       = 5
  Nbeta        = 2

  ==> Algorithm <==

  SCF Algorithm Type is DF.
  DIIS enabled.
  MOM disabled.
  Fractional occupation disabled.
  Guess Type is READ.
  Energy threshold   = 1.00e-08
  Density threshold  = 1.00e-08
  Integral threshold = 1.00e-12

  ==> Primary Basis <==

  Basis Set: CC-PVDZ
    Blend: CC-PVDZ
    Number of shells: 9
    Number of basis functions: 19
    Number of Cartesian functions: 20
    Spherical Harmonics?: true
    Max angular momentum: 2

  ==> DFT Potential <==

   => LibXC <=

    Version 6.2.2
    S. Lehtola, C. Steigemann, M. J.T. Oliveira, and M. A.L. Marques.,  SoftwareX 7, 1–5 (2018) (10.1016/j.softx.2017.11.002)

   => Composite Functional: B3LYP <= 

    B3LYP Hyb-GGA Exchange-Correlation Functional

    P. J. Stephens, F. J. Devlin, C. F. Chabalowski, and M. J. Frisch.,  J. Phys. Chem. 98, 11623 (1994) (10.1021/j100096a001)

    Deriv               =              1
    GGA                 =           TRUE
    Meta                =          FALSE

    Exchange Hybrid     =           TRUE
    MP2 Hybrid          =          FALSE

   => Exchange Functionals <=

    0.0800   Slater exchange
    0.7200         Becke 88

   => Exact (HF) Exchange <=

    0.2000               HF 

   => Correlation Functionals <=

    0.1900   Vosko, Wilk & Nusair (VWN5_RPA)
    0.8100   Lee, Yang & Parr

   => LibXC Density Thresholds  <==

    XC_HYB_GGA_XC_B3LYP:  1.00E-15 

   => Molecular Quadrature <=

    Radial Scheme          =       TREUTLER
    Pruning Scheme         =           NONE
    Nuclear Scheme         =       TREUTLER

    Blocking Scheme        =         OCTREE
    BS radius alpha        =              1
    Pruning alpha          =              1
    Radial Points          =             75
    Spherical Points       =            302
    Total Points           =          43727
    Total Blocks           =            387
    Max Points             =            256
    Max Functions          =             19
    Weights Tolerance      =       1.00E-15

   => Loading Basis Set <=

    Name: (CC-PVDZ AUX)
    Role: JKFIT
    Keyword: DF_BASIS_SCF
    atoms 1 entry H          line    51 file /Users/joseantoniorodriguesromero/anaconda3/share/psi4/basis/cc-pvdz-jkfit.gbs 
    atoms 2 entry C          line   121 file /Users/joseantoniorodriguesromero/anaconda3/share/psi4/basis/cc-pvdz-jkfit.gbs 

   => Loading Basis Set <=

    Name: CC-PVDZ
    Role: ORBITAL
    Keyword: BASIS
    atoms 1 entry H          line    22 file /Users/joseantoniorodriguesromero/anaconda3/share/psi4/basis/cc-pvdz.gbs 
    atoms 2 entry C          line   138 file /Users/joseantoniorodriguesromero/anaconda3/share/psi4/basis/cc-pvdz.gbs 

  Reading orbitals from file /tmp/quartet_HC.default.68095.180.npy, no projection.

  ==> Integral Setup <==

  DFHelper Memory: AOs need 0.000 GiB; user supplied 0.342 GiB. 
  Using in-core AOs.

  ==> MemDFJK: Density-Fitted J/K Matrices <==

    J tasked:                   Yes
    K tasked:                   Yes
    wK tasked:                   No
    OpenMP threads:               1
    Memory [MiB]:               349
    Algorithm:                 Core
    Schwarz Cutoff:           1E-12
    Mask sparsity (%):       0.0000
    Fitting Condition:        1E-10

   => Auxiliary Basis Set <=

  Basis Set: (CC-PVDZ AUX)
    Blend: CC-PVDZ-JKFIT
    Number of shells: 33
    Number of basis functions: 93
    Number of Cartesian functions: 106
    Spherical Harmonics?: true
    Max angular momentum: 3

  Cached 100.0% of DFT collocation blocks in 0.024 [GiB].

  Minimum eigenvalue in the overlap matrix is 3.6812733713E-02.
  Reciprocal condition number of the overlap matrix is 1.2013894599E-02.
    Using symmetric orthogonalization.

  ==> Pre-Iterations <==

  SCF Guess: Orbitals guess was supplied from a previous computation.

   -------------------------------------------------------
    Irrep   Nso     Nmo     Nalpha   Nbeta   Ndocc  Nsocc
   -------------------------------------------------------
     A1        10      10       3       2       2       1
     A2         1       1       0       0       0       0
     B1         4       4       1       0       0       1
     B2         4       4       1       0       0       1
   -------------------------------------------------------
    Total      19      19       5       2       2       3
   -------------------------------------------------------

  ==> Iterations <==

                           Total Energy        Delta E     RMS |[F,P]|

   @DF-UKS iter   0:   -38.45402378532543   -3.84540e+01   5.25878e-04 
   @DF-UKS iter   1:   -38.45237782367566    1.64596e-03   7.33542e-05 DIIS
   @DF-UKS iter   2:   -38.45237837674123   -5.53066e-07   4.11043e-05 DIIS/DAMP=1%
   @DF-UKS iter   3:   -38.45238764183368   -9.26509e-06   7.38375e-06 DIIS/DAMP=1%
   @DF-UKS iter   4:   -38.45237770107440    9.94076e-06   2.82853e-06 DIIS/DAMP=1%
   @DF-UKS iter   5:   -38.45237888583092   -1.18476e-06   3.34886e-07 DIIS/DAMP=1%
   @DF-UKS iter   6:   -38.45237850015829    3.85673e-07   4.42957e-08 DIIS/DAMP=1%
   @DF-UKS iter   7:   -38.45237854537118   -4.52129e-08   5.16217e-09 DIIS/DAMP=1%
   @DF-UKS iter   8:   -38.45237854360748    1.76370e-09   5.70846e-10 DIIS/DAMP=1%
  Energy and wave function converged.


  ==> Post-Iterations <==

   Electrons on quadrature grid:
      Nalpha   =    4.9999999857 ; deviation = -1.428e-08
      Nbeta    =    1.9999999879 ; deviation = -1.212e-08
      Ntotal   =    6.9999999736 ; deviation = -2.640e-08 

   @Spin Contamination Metric:   1.384371419E-03
   @S^2 Expected:                3.750000000E+00
   @S^2 Observed:                3.751384371E+00
   @S   Expected:                1.500000000E+00
   @S   Observed:                1.500000000E+00

    Orbital Energies [Eh]
    ---------------------

    Alpha Occupied:                                                       

       1A1   -10.259532     2A1    -0.663488     3A1    -0.384753  
       1B2    -0.255004     1B1    -0.255004  

    Alpha Virtual:                                                        

       4A1     0.084485     5A1     0.434958     2B2     0.456939  
       2B1     0.456939     6A1     0.475389     7A1     0.739316  
       3B2     0.966550     3B1     0.966550     8A1     1.117962  
       1A2     1.117962     9A1     1.532796     4B1     1.712283  
       4B2     1.712283    10A1     2.326393  

    Beta Occupied:                                                        

       1A1   -10.216930     2A1    -0.547932  

    Beta Virtual:                                                         

       3A1    -0.159484     1B2    -0.042897     1B1    -0.042897  
       4A1     0.114385     5A1     0.488675     2B2     0.551874  
       2B1     0.551874     6A1     0.580957     7A1     0.797665  
       3B2     1.056245     3B1     1.056245     8A1     1.252415  
       1A2     1.252415     9A1     1.629742     4B1     1.785363  
       4B2     1.785363    10A1     2.385608  

    Final Occupation by Irrep:
             A1    A2    B1    B2 
    DOCC [     2,    0,    0,    0 ]
    SOCC [     1,    0,    1,    1 ]
    NA   [     3,    0,    1,    1 ]
    NB   [     2,    0,    0,    0 ]

  @DF-UKS Final Energy:   -38.45237854360748

   => Energetics <=

    Nuclear Repulsion Energy =              2.8714220052221169
    One-Electron Energy =                 -56.7644981288361663
    Two-Electron Energy =                  20.0259018263848922
    DFT Exchange-Correlation Energy =      -4.5852042463783249
    Empirical Dispersion Energy =           0.0000000000000000
    VV10 Nonlocal Energy =                  0.0000000000000000
    Total Energy =                        -38.4523785436074803

  UHF NO Occupations:
  HONO-2 :    1 B2 1.0000000
  HONO-1 :    3 A1 1.0000000
  HONO-0 :    1 B1 1.0000000
  LUNO+0 :    4 A1 0.0006921
  LUNO+1 :    5 A1 0.0000003
  LUNO+2 :    6 A1 0.0000000
  LUNO+3 :    7 A1 0.0000000


Computation Completed


Properties will be evaluated at   0.000000,   0.000000,   0.000000 [a0]

Properties computed using the SCF density matrix


 Multipole Moments:

 ------------------------------------------------------------------------------------
     Multipole            Electronic (a.u.)      Nuclear  (a.u.)        Total (a.u.)
 ------------------------------------------------------------------------------------

 L = 1.  Multiply by 2.5417464519 to convert [e a0] to [Debye]
 Dipole X            :          0.0000000            0.0000000            0.0000000
 Dipole Y            :          0.0000000            0.0000000            0.0000000
 Dipole Z            :         -0.6652498            0.9562888            0.2910389
 Magnitude           :                                                    0.2910389

 ------------------------------------------------------------------------------------

*** tstop() called on Joses-MacBook-Pro-2.local at Wed Jul 16 18:13:00 2025
Module time:
	user time   =       0.73 seconds =       0.01 minutes
	system time =       3.05 seconds =       0.05 minutes
	total time  =          0 seconds =       0.00 minutes
Total time:
	user time   =       3.48 seconds =       0.06 minutes
	system time =      10.71 seconds =       0.18 minutes
	total time  =          1 seconds =       0.02 minutes

*** tstart() called on Joses-MacBook-Pro-2.local
*** at Wed Jul 16 18:13:00 2025


         ------------------------------------------------------------
                                   SCF GRAD                          
                          Rob Parrish, Justin Turney,                
                       Andy Simmonett, and Alex Sokolov              
         ------------------------------------------------------------

  ==> Geometry <==

    Molecular point group: c2v
    Full point group: C_inf_v

    Geometry (in Angstrom), charge = 0, multiplicity = 4:

       Center              X                  Y                   Z               Mass       
    ------------   -----------------  -----------------  -----------------  -----------------
         H            0.000000000000     0.000000000000     1.020074563819     1.007825032230
         C            0.000000000000     0.000000000000    -0.085671390013    12.000000000000

  Nuclear repulsion =    2.871422005222117

  ==> Basis Set <==

  Basis Set: CC-PVDZ
    Blend: CC-PVDZ
    Number of shells: 9
    Number of basis functions: 19
    Number of Cartesian functions: 20
    Spherical Harmonics?: true
    Max angular momentum: 2

  ==> DFJKGrad: Density-Fitted SCF Gradients <==

    Gradient:                    1
    J tasked:                  Yes
    K tasked:                  Yes
    wK tasked:                  No
    OpenMP threads:              1
    Integrals threads:           1
    Memory [MiB]:              375
    Schwarz Cutoff:          1E-12
    Fitting Condition:       1E-10

   => Auxiliary Basis Set <=

  Basis Set: (CC-PVDZ AUX)
    Blend: CC-PVDZ-JKFIT
    Number of shells: 33
    Number of basis functions: 93
    Number of Cartesian functions: 106
    Spherical Harmonics?: true
    Max angular momentum: 3

  ==> DFT Potential <==

   => LibXC <=

    Version 6.2.2
    S. Lehtola, C. Steigemann, M. J.T. Oliveira, and M. A.L. Marques.,  SoftwareX 7, 1–5 (2018) (10.1016/j.softx.2017.11.002)

   => Composite Functional: B3LYP <= 

    B3LYP Hyb-GGA Exchange-Correlation Functional

    P. J. Stephens, F. J. Devlin, C. F. Chabalowski, and M. J. Frisch.,  J. Phys. Chem. 98, 11623 (1994) (10.1021/j100096a001)

    Deriv               =              1
    GGA                 =           TRUE
    Meta                =          FALSE

    Exchange Hybrid     =           TRUE
    MP2 Hybrid          =          FALSE

   => Exchange Functionals <=

    0.0800   Slater exchange
    0.7200         Becke 88

   => Exact (HF) Exchange <=

    0.2000               HF 

   => Correlation Functionals <=

    0.1900   Vosko, Wilk & Nusair (VWN5_RPA)
    0.8100   Lee, Yang & Parr

   => LibXC Density Thresholds  <==

    XC_HYB_GGA_XC_B3LYP:  1.00E-15 

   => Molecular Quadrature <=

    Radial Scheme          =       TREUTLER
    Pruning Scheme         =           NONE
    Nuclear Scheme         =       TREUTLER

    Blocking Scheme        =         OCTREE
    BS radius alpha        =              1
    Pruning alpha          =              1
    Radial Points          =             75
    Spherical Points       =            302
    Total Points           =          43727
    Total Blocks           =            387
    Max Points             =            256
    Max Functions          =             19
    Weights Tolerance      =       1.00E-15


  -Total Gradient:
     Atom            X                  Y                   Z
    ------   -----------------  -----------------  -----------------
       1       -0.000000000000     0.000000000000    -0.000719972460
       2        0.000000000000     0.000000000000     0.000719954150


*** tstop() called on Joses-MacBook-Pro-2.local at Wed Jul 16 18:13:00 2025
Module time:
	user time   =       0.25 seconds =       0.00 minutes
	system time =       0.85 seconds =       0.01 minutes
	total time  =          0 seconds =       0.00 minutes
Total time:
	user time   =       3.73 seconds =       0.06 minutes
	system time =      11.56 seconds =       0.19 minutes
	total time  =          1 seconds =       0.02 minutes

    			-----------------------------------------

    			 OPTKING 3.0: for geometry optimizations 

    			     By R.A. King, Bethel University     

    			        with contributions from          

    			    A.V. Copan, J. Cayton, A. Heide      

    			-----------------------------------------

    
	                            ===> Fragment 1 <== 

	 Z (Atomic Numbers)          Masses                          Geom                  
	       1.000000             1.007825          0.00000000  0.00000000  1.92766155   
	       6.000000            12.000000          0.00000000  0.00000000 -0.16189546   

	 - Coordinate -           - BOHR/RAD -       - ANG/DEG -
	 R(1,2)           =         2.089557           1.105746


	        --- Internal Coordinate Step in ANG or DEG, aJ/ANG or AJ/DEG ---
	-------------------------------------------------------------------------------
	           Coordinate      Previous         Force          Change          New 
	           ----------      --------        ------          ------        ------
	               R(1,2)       1.10575        0.00593        0.00155       1.10730
	-------------------------------------------------------------------------------

	                                 ==> Convergence Check <==                                  
    
	Measures of convergence in internal coordinates in au.
    
	Criteria marked as inactive (o), active & met (*), and active & unmet ( ).

	----------------------------------------------------------------------------------------------
	   Step    Total Energy     Delta E     Max Force     RMS Force      Max Disp      RMS Disp   
	----------------------------------------------------------------------------------------------
	  Convergence Criteria     1.00e-06 *    3.00e-04 *             o    1.20e-03 *             o
	----------------------------------------------------------------------------------------------
	     3     -38.45237854   -6.14e-06      7.20e-04      7.20e-04 o    2.93e-03      2.93e-03 o  ~
	----------------------------------------------------------------------------------------------

Next Geometry in Ang 
	Fragment 1 (Ang)

	    H   0.0000000000   0.0000000000   1.0208504329
	    C   0.0000000000   0.0000000000  -0.0864472591


    Structure for next step:
    Molecular point group: c2v
    Full point group: C_inf_v

    Geometry (in Angstrom), charge = 0, multiplicity = 4:

    H            0.000000000000     0.000000000000     1.021506075840
    C            0.000000000000     0.000000000000    -0.085791616151


Scratch directory: /tmp/
gradient() will perform analytic gradient computation.
   => Libint2 <=

    Primary   basis highest AM E, G, H:  6, 6, 3
    Auxiliary basis highest AM E, G, H:  7, 7, 4
    Onebody   basis highest AM E, G, H:  -, -, -
    Solid Harmonics ordering:            Gaussian

*** tstart() called on Joses-MacBook-Pro-2.local
*** at Wed Jul 16 18:13:01 2025

   => Loading Basis Set <=

    Name: CC-PVDZ
    Role: ORBITAL
    Keyword: BASIS
    atoms 1 entry H          line    22 file /Users/joseantoniorodriguesromero/anaconda3/share/psi4/basis/cc-pvdz.gbs 
    atoms 2 entry C          line   138 file /Users/joseantoniorodriguesromero/anaconda3/share/psi4/basis/cc-pvdz.gbs 


         ---------------------------------------------------------
                                   SCF
               by Justin Turney, Rob Parrish, Andy Simmonett
                          and Daniel G. A. Smith
                              UKS Reference
                        1 Threads,    500 MiB Core
         ---------------------------------------------------------

  ==> Geometry <==

    Molecular point group: c2v
    Full point group: C_inf_v

    Geometry (in Angstrom), charge = 0, multiplicity = 4:

       Center              X                  Y                   Z               Mass       
    ------------   -----------------  -----------------  -----------------  -----------------
         H            0.000000000000     0.000000000000     1.021506075840     1.007825032230
         C            0.000000000000     0.000000000000    -0.085791616151    12.000000000000

  Running in c2v symmetry.

  Rotational constants: A = ************  B =     14.78788  C =     14.78788 [cm^-1]
  Rotational constants: A = ************  B = 443329.57999  C = 443329.57999 [MHz]
  Nuclear repulsion =    2.867398069178231

  Charge       = 0
  Multiplicity = 4
  Electrons    = 7
  Nalpha       = 5
  Nbeta        = 2

  ==> Algorithm <==

  SCF Algorithm Type is DF.
  DIIS enabled.
  MOM disabled.
  Fractional occupation disabled.
  Guess Type is READ.
  Energy threshold   = 1.00e-08
  Density threshold  = 1.00e-08
  Integral threshold = 1.00e-12

  ==> Primary Basis <==

  Basis Set: CC-PVDZ
    Blend: CC-PVDZ
    Number of shells: 9
    Number of basis functions: 19
    Number of Cartesian functions: 20
    Spherical Harmonics?: true
    Max angular momentum: 2

  ==> DFT Potential <==

   => LibXC <=

    Version 6.2.2
    S. Lehtola, C. Steigemann, M. J.T. Oliveira, and M. A.L. Marques.,  SoftwareX 7, 1–5 (2018) (10.1016/j.softx.2017.11.002)

   => Composite Functional: B3LYP <= 

    B3LYP Hyb-GGA Exchange-Correlation Functional

    P. J. Stephens, F. J. Devlin, C. F. Chabalowski, and M. J. Frisch.,  J. Phys. Chem. 98, 11623 (1994) (10.1021/j100096a001)

    Deriv               =              1
    GGA                 =           TRUE
    Meta                =          FALSE

    Exchange Hybrid     =           TRUE
    MP2 Hybrid          =          FALSE

   => Exchange Functionals <=

    0.0800   Slater exchange
    0.7200         Becke 88

   => Exact (HF) Exchange <=

    0.2000               HF 

   => Correlation Functionals <=

    0.1900   Vosko, Wilk & Nusair (VWN5_RPA)
    0.8100   Lee, Yang & Parr

   => LibXC Density Thresholds  <==

    XC_HYB_GGA_XC_B3LYP:  1.00E-15 

   => Molecular Quadrature <=

    Radial Scheme          =       TREUTLER
    Pruning Scheme         =           NONE
    Nuclear Scheme         =       TREUTLER

    Blocking Scheme        =         OCTREE
    BS radius alpha        =              1
    Pruning alpha          =              1
    Radial Points          =             75
    Spherical Points       =            302
    Total Points           =          43731
    Total Blocks           =            389
    Max Points             =            256
    Max Functions          =             19
    Weights Tolerance      =       1.00E-15

   => Loading Basis Set <=

    Name: (CC-PVDZ AUX)
    Role: JKFIT
    Keyword: DF_BASIS_SCF
    atoms 1 entry H          line    51 file /Users/joseantoniorodriguesromero/anaconda3/share/psi4/basis/cc-pvdz-jkfit.gbs 
    atoms 2 entry C          line   121 file /Users/joseantoniorodriguesromero/anaconda3/share/psi4/basis/cc-pvdz-jkfit.gbs 

   => Loading Basis Set <=

    Name: CC-PVDZ
    Role: ORBITAL
    Keyword: BASIS
    atoms 1 entry H          line    22 file /Users/joseantoniorodriguesromero/anaconda3/share/psi4/basis/cc-pvdz.gbs 
    atoms 2 entry C          line   138 file /Users/joseantoniorodriguesromero/anaconda3/share/psi4/basis/cc-pvdz.gbs 

  Reading orbitals from file /tmp/quartet_HC.default.68095.180.npy, no projection.

  ==> Integral Setup <==

  DFHelper Memory: AOs need 0.000 GiB; user supplied 0.342 GiB. 
  Using in-core AOs.

  ==> MemDFJK: Density-Fitted J/K Matrices <==

    J tasked:                   Yes
    K tasked:                   Yes
    wK tasked:                   No
    OpenMP threads:               1
    Memory [MiB]:               349
    Algorithm:                 Core
    Schwarz Cutoff:           1E-12
    Mask sparsity (%):       0.0000
    Fitting Condition:        1E-10

   => Auxiliary Basis Set <=

  Basis Set: (CC-PVDZ AUX)
    Blend: CC-PVDZ-JKFIT
    Number of shells: 33
    Number of basis functions: 93
    Number of Cartesian functions: 106
    Spherical Harmonics?: true
    Max angular momentum: 3

  Cached 100.0% of DFT collocation blocks in 0.024 [GiB].

  Minimum eigenvalue in the overlap matrix is 3.6928386877E-02.
  Reciprocal condition number of the overlap matrix is 1.2055803250E-02.
    Using symmetric orthogonalization.

  ==> Pre-Iterations <==

  SCF Guess: Orbitals guess was supplied from a previous computation.

   -------------------------------------------------------
    Irrep   Nso     Nmo     Nalpha   Nbeta   Ndocc  Nsocc
   -------------------------------------------------------
     A1        10      10       3       2       2       1
     A2         1       1       0       0       0       0
     B1         4       4       1       0       0       1
     B2         4       4       1       0       0       1
   -------------------------------------------------------
    Total      19      19       5       2       2       3
   -------------------------------------------------------

  ==> Iterations <==

                           Total Energy        Delta E     RMS |[F,P]|

   @DF-UKS iter   0:   -38.45182723491240   -3.84518e+01   1.77016e-04 
   @DF-UKS iter   1:   -38.45237916448826   -5.51930e-04   2.46748e-05 DIIS
   @DF-UKS iter   2:   -38.45237922687689   -6.23886e-08   1.38472e-05 DIIS/DAMP=1%
   @DF-UKS iter   3:   -38.45237617131895    3.05556e-06   2.48500e-06 DIIS/DAMP=1%
   @DF-UKS iter   4:   -38.45237952784483   -3.35653e-06   9.49885e-07 DIIS/DAMP=1%
   @DF-UKS iter   5:   -38.45237913142007    3.96425e-07   1.13256e-07 DIIS/DAMP=1%
   @DF-UKS iter   6:   -38.45237926038279   -1.28963e-07   1.49497e-08 DIIS/DAMP=1%
   @DF-UKS iter   7:   -38.45237924510704    1.52758e-08   1.76127e-09 DIIS/DAMP=1%
   @DF-UKS iter   8:   -38.45237924569077   -5.83732e-10   1.92944e-10 DIIS/DAMP=1%
  Energy and wave function converged.


  ==> Post-Iterations <==

   Electrons on quadrature grid:
      Nalpha   =    4.9999999857 ; deviation = -1.435e-08
      Nbeta    =    1.9999999877 ; deviation = -1.227e-08
      Ntotal   =    6.9999999734 ; deviation = -2.661e-08 

   @Spin Contamination Metric:   1.382420525E-03
   @S^2 Expected:                3.750000000E+00
   @S^2 Observed:                3.751382421E+00
   @S   Expected:                1.500000000E+00
   @S   Observed:                1.500000000E+00

    Orbital Energies [Eh]
    ---------------------

    Alpha Occupied:                                                       

       1A1   -10.259619     2A1    -0.663203     3A1    -0.384651  
       1B1    -0.254967     1B2    -0.254967  

    Alpha Virtual:                                                        

       4A1     0.084145     5A1     0.434893     2B2     0.456948  
       2B1     0.456948     6A1     0.475014     7A1     0.738839  
       3B2     0.966389     3B1     0.966389     8A1     1.118001  
       1A2     1.118001     9A1     1.531488     4B1     1.711211  
       4B2     1.711211    10A1     2.323448  

    Beta Occupied:                                                        

       1A1   -10.217029     2A1    -0.547568  

    Beta Virtual:                                                         

       3A1    -0.159581     1B1    -0.042885     1B2    -0.042885  
       4A1     0.114191     5A1     0.488589     2B2     0.551877  
       2B1     0.551877     6A1     0.580464     7A1     0.797201  
       3B1     1.056018     3B2     1.056018     8A1     1.252433  
       1A2     1.252433     9A1     1.628386     4B1     1.784313  
       4B2     1.784313    10A1     2.382726  

    Final Occupation by Irrep:
             A1    A2    B1    B2 
    DOCC [     2,    0,    0,    0 ]
    SOCC [     1,    0,    1,    1 ]
    NA   [     3,    0,    1,    1 ]
    NB   [     2,    0,    0,    0 ]

  @DF-UKS Final Energy:   -38.45237924569077

   => Energetics <=

    Nuclear Repulsion Energy =              2.8673980691782313
    One-Electron Energy =                 -56.7573945144292082
    Two-Electron Energy =                  20.0223810627274332
    DFT Exchange-Correlation Energy =      -4.5847638631672272
    Empirical Dispersion Energy =           0.0000000000000000
    VV10 Nonlocal Energy =                  0.0000000000000000
    Total Energy =                        -38.4523792456907714

  UHF NO Occupations:
  HONO-2 :    3 A1 1.0000000
  HONO-1 :    1 B2 1.0000000
  HONO-0 :    1 B1 1.0000000
  LUNO+0 :    4 A1 0.0006912
  LUNO+1 :    5 A1 0.0000003
  LUNO+2 :    6 A1 0.0000000
  LUNO+3 :    2 B1 0.0000000


Computation Completed


Properties will be evaluated at   0.000000,   0.000000,   0.000000 [a0]

Properties computed using the SCF density matrix


 Multipole Moments:

 ------------------------------------------------------------------------------------
     Multipole            Electronic (a.u.)      Nuclear  (a.u.)        Total (a.u.)
 ------------------------------------------------------------------------------------

 L = 1.  Multiply by 2.5417464519 to convert [e a0] to [Debye]
 Dipole X            :          0.0000000            0.0000000            0.0000000
 Dipole Y            :          0.0000000            0.0000000            0.0000000
 Dipole Z            :         -0.6659177            0.9576308            0.2917131
 Magnitude           :                                                    0.2917131

 ------------------------------------------------------------------------------------

*** tstop() called on Joses-MacBook-Pro-2.local at Wed Jul 16 18:13:01 2025
Module time:
	user time   =       0.80 seconds =       0.01 minutes
	system time =       2.91 seconds =       0.05 minutes
	total time  =          0 seconds =       0.00 minutes
Total time:
	user time   =       4.57 seconds =       0.08 minutes
	system time =      14.71 seconds =       0.25 minutes
	total time  =          2 seconds =       0.03 minutes

*** tstart() called on Joses-MacBook-Pro-2.local
*** at Wed Jul 16 18:13:01 2025


         ------------------------------------------------------------
                                   SCF GRAD                          
                          Rob Parrish, Justin Turney,                
                       Andy Simmonett, and Alex Sokolov              
         ------------------------------------------------------------

  ==> Geometry <==

    Molecular point group: c2v
    Full point group: C_inf_v

    Geometry (in Angstrom), charge = 0, multiplicity = 4:

       Center              X                  Y                   Z               Mass       
    ------------   -----------------  -----------------  -----------------  -----------------
         H            0.000000000000     0.000000000000     1.021506075840     1.007825032230
         C            0.000000000000     0.000000000000    -0.085791616151    12.000000000000

  Nuclear repulsion =    2.867398069178231

  ==> Basis Set <==

  Basis Set: CC-PVDZ
    Blend: CC-PVDZ
    Number of shells: 9
    Number of basis functions: 19
    Number of Cartesian functions: 20
    Spherical Harmonics?: true
    Max angular momentum: 2

  ==> DFJKGrad: Density-Fitted SCF Gradients <==

    Gradient:                    1
    J tasked:                  Yes
    K tasked:                  Yes
    wK tasked:                  No
    OpenMP threads:              1
    Integrals threads:           1
    Memory [MiB]:              375
    Schwarz Cutoff:          1E-12
    Fitting Condition:       1E-10

   => Auxiliary Basis Set <=

  Basis Set: (CC-PVDZ AUX)
    Blend: CC-PVDZ-JKFIT
    Number of shells: 33
    Number of basis functions: 93
    Number of Cartesian functions: 106
    Spherical Harmonics?: true
    Max angular momentum: 3

  ==> DFT Potential <==

   => LibXC <=

    Version 6.2.2
    S. Lehtola, C. Steigemann, M. J.T. Oliveira, and M. A.L. Marques.,  SoftwareX 7, 1–5 (2018) (10.1016/j.softx.2017.11.002)

   => Composite Functional: B3LYP <= 

    B3LYP Hyb-GGA Exchange-Correlation Functional

    P. J. Stephens, F. J. Devlin, C. F. Chabalowski, and M. J. Frisch.,  J. Phys. Chem. 98, 11623 (1994) (10.1021/j100096a001)

    Deriv               =              1
    GGA                 =           TRUE
    Meta                =          FALSE

    Exchange Hybrid     =           TRUE
    MP2 Hybrid          =          FALSE

   => Exchange Functionals <=

    0.0800   Slater exchange
    0.7200         Becke 88

   => Exact (HF) Exchange <=

    0.2000               HF 

   => Correlation Functionals <=

    0.1900   Vosko, Wilk & Nusair (VWN5_RPA)
    0.8100   Lee, Yang & Parr

   => LibXC Density Thresholds  <==

    XC_HYB_GGA_XC_B3LYP:  1.00E-15 

   => Molecular Quadrature <=

    Radial Scheme          =       TREUTLER
    Pruning Scheme         =           NONE
    Nuclear Scheme         =       TREUTLER

    Blocking Scheme        =         OCTREE
    BS radius alpha        =              1
    Pruning alpha          =              1
    Radial Points          =             75
    Spherical Points       =            302
    Total Points           =          43731
    Total Blocks           =            389
    Max Points             =            256
    Max Functions          =             19
    Weights Tolerance      =       1.00E-15


  -Total Gradient:
     Atom            X                  Y                   Z
    ------   -----------------  -----------------  -----------------
       1        0.000000000000    -0.000000000000     0.000238884837
       2        0.000000000000     0.000000000000    -0.000238898567


*** tstop() called on Joses-MacBook-Pro-2.local at Wed Jul 16 18:13:01 2025
Module time:
	user time   =       0.37 seconds =       0.01 minutes
	system time =       1.01 seconds =       0.02 minutes
	total time  =          0 seconds =       0.00 minutes
Total time:
	user time   =       4.94 seconds =       0.08 minutes
	system time =      15.73 seconds =       0.26 minutes
	total time  =          2 seconds =       0.03 minutes

    			-----------------------------------------

    			 OPTKING 3.0: for geometry optimizations 

    			     By R.A. King, Bethel University     

    			        with contributions from          

    			    A.V. Copan, J. Cayton, A. Heide      

    			-----------------------------------------

    
	                            ===> Fragment 1 <== 

	 Z (Atomic Numbers)          Masses                          Geom                  
	       1.000000             1.007825          0.00000000  0.00000000  1.93036672   
	       6.000000            12.000000          0.00000000  0.00000000 -0.16212266   

	 - Coordinate -           - BOHR/RAD -       - ANG/DEG -
	 R(1,2)           =         2.092489           1.107298


	        --- Internal Coordinate Step in ANG or DEG, aJ/ANG or AJ/DEG ---
	-------------------------------------------------------------------------------
	           Coordinate      Previous         Force          Change          New 
	           ----------      --------        ------          ------        ------
	               R(1,2)       1.10730       -0.00197       -0.00052       1.10678
	-------------------------------------------------------------------------------

	                                 ==> Convergence Check <==                                  
    
	Measures of convergence in internal coordinates in au.
    
	Criteria marked as inactive (o), active & met (*), and active & unmet ( ).

	----------------------------------------------------------------------------------------------
	   Step    Total Energy     Delta E     Max Force     RMS Force      Max Disp      RMS Disp   
	----------------------------------------------------------------------------------------------
	  Convergence Criteria     1.00e-06 *    3.00e-04 *             o    1.20e-03 *             o
	----------------------------------------------------------------------------------------------
	     4     -38.45237925   -7.02e-07 *    2.39e-04 *    2.39e-04 o    9.78e-04 *    9.78e-04 o  ~
	----------------------------------------------------------------------------------------------

Next Geometry in Ang 
	Fragment 1 (Ang)

	    H   0.0000000000   0.0000000000   1.0212471941
	    C   0.0000000000   0.0000000000  -0.0855327344


    Final optimized geometry and variables:
    Molecular point group: c2v
    Full point group: C_inf_v

    Geometry (in Angstrom), charge = 0, multiplicity = 4:

    H            0.000000000000     0.000000000000     1.021506075840
    C            0.000000000000     0.000000000000    -0.085791616151


    Psi4 stopped on: Wednesday, 16 July 2025 06:13PM
    Psi4 wall time for execution: 0:00:02.96

*** Psi4 exiting successfully. Buy a developer a beer!
