
    -----------------------------------------------------------------------
          Psi4: An Open-Source Ab Initio Electronic Structure Package
                               Psi4 1.9.1 release

                         Git: Rev {} zzzzzzz 


    D. G. A. Smith, L. A. Burns, A. C. Simmonett, R. M. Parrish,
    M. C. Schieber, R. Galvelis, P. Kraus, H. Kruse, R. Di Remigio,
    A. Alenaizan, A. M. James, S. Lehtola, J. P. Misiewicz, M. Scheurer,
    R. A. Shaw, J. B. Schriber, Y. Xie, Z. L. Glick, D. A. Sirianni,
    J. S. O'Brien, J. M. Waldrop, A. Kumar, E. G. Hohenstein,
    B. P. Pritchard, B. R. Brooks, H. F. Schaefer III, A. Yu. Sokolov,
    K. Patkowski, A. E. DePrince III, U. Bozkaya, R. A. King,
    F. A. Evangelista, J. M. Turney, T. D. Crawford, C. D. Sherrill,
    J. Chem. Phys. 152(18) 184108 (2020). https://doi.org/10.1063/5.0006002

                            Additional Code Authors
    E. T. Seidl, C. L. Janssen, E. F. Valeev, M. L. Leininger,
    J. F. Gonthier, R. M. Richard, H. R. McAlexander, M. Saitow, X. Wang,
    P. Verma, M. H. Lechner, A. Jiang, S. Behnle, A. G. Heide,
    M. F. Herbst, and D. L. Poole

             Previous Authors, Complete List of Code Contributors,
                       and Citations for Specific Modules
    https://github.com/psi4/psi4/blob/master/codemeta.json
    https://github.com/psi4/psi4/graphs/contributors
    http://psicode.org/psi4manual/master/introduction.html#citing-psifour

    -----------------------------------------------------------------------


    Psi4 started on: Wednesday, 16 July 2025 06:17PM

    Process ID: 68151
    Host:       Joses-MacBook-Pro-2.local
    PSIDATADIR: /Users/joseantoniorodriguesromero/anaconda3/share/psi4
    Memory:     500.0 MiB
    Threads:    1
    
  ==> Input File <==

--------------------------------------------------------------------------
molecule { 
0 1
H   0.00000        0.60000        0.00000
Cl   0.00000       -0.60000        0.00000
}

set { 
basis              cc-pvdz
reference          uks
maxiter            500
geom_maxiter       500
DAMPING_PERCENTAGE 1
guess              SAP
}

optimize('b3lyp')
--------------------------------------------------------------------------

Scratch directory: /tmp/
gradient() will perform analytic gradient computation.
   => Libint2 <=

    Primary   basis highest AM E, G, H:  6, 6, 3
    Auxiliary basis highest AM E, G, H:  7, 7, 4
    Onebody   basis highest AM E, G, H:  -, -, -
    Solid Harmonics ordering:            Gaussian

*** tstart() called on Joses-MacBook-Pro-2.local
*** at Wed Jul 16 18:17:32 2025

   => Loading Basis Set <=

    Name: CC-PVDZ
    Role: ORBITAL
    Keyword: BASIS
    atoms 1 entry H          line    22 file /Users/joseantoniorodriguesromero/anaconda3/share/psi4/basis/cc-pvdz.gbs 
    atoms 2 entry CL         line   658 file /Users/joseantoniorodriguesromero/anaconda3/share/psi4/basis/cc-pvdz.gbs 


         ---------------------------------------------------------
                                   SCF
               by Justin Turney, Rob Parrish, Andy Simmonett
                          and Daniel G. A. Smith
                              UKS Reference
                        1 Threads,    500 MiB Core
         ---------------------------------------------------------

  ==> Geometry <==

    Molecular point group: c2v
    Full point group: C_inf_v

    Geometry (in Angstrom), charge = 0, multiplicity = 1:

       Center              X                  Y                   Z               Mass       
    ------------   -----------------  -----------------  -----------------  -----------------
         H            0.000000000000     0.000000000000     1.166384054462     1.007825032230
         CL           0.000000000000     0.000000000000    -0.033615945538    34.968852682000

  Running in c2v symmetry.

  Rotational constants: A = ************  B =     11.95057  C =     11.95057 [cm^-1]
  Rotational constants: A = ************  B = 358269.00565  C = 358269.00565 [MHz]
  Nuclear repulsion =    7.496677151158335

  Charge       = 0
  Multiplicity = 1
  Electrons    = 18
  Nalpha       = 9
  Nbeta        = 9

  ==> Algorithm <==

  SCF Algorithm Type is DF.
  DIIS enabled.
  MOM disabled.
  Fractional occupation disabled.
  Guess Type is SAP.
  Energy threshold   = 1.00e-08
  Density threshold  = 1.00e-08
  Integral threshold = 1.00e-12

  ==> Primary Basis <==

  Basis Set: CC-PVDZ
    Blend: CC-PVDZ
    Number of shells: 11
    Number of basis functions: 23
    Number of Cartesian functions: 24
    Spherical Harmonics?: true
    Max angular momentum: 2

  ==> DFT Potential <==

   => LibXC <=

    Version 6.2.2
    S. Lehtola, C. Steigemann, M. J.T. Oliveira, and M. A.L. Marques.,  SoftwareX 7, 1–5 (2018) (10.1016/j.softx.2017.11.002)

   => Composite Functional: B3LYP <= 

    B3LYP Hyb-GGA Exchange-Correlation Functional

    P. J. Stephens, F. J. Devlin, C. F. Chabalowski, and M. J. Frisch.,  J. Phys. Chem. 98, 11623 (1994) (10.1021/j100096a001)

    Deriv               =              1
    GGA                 =           TRUE
    Meta                =          FALSE

    Exchange Hybrid     =           TRUE
    MP2 Hybrid          =          FALSE

   => Exchange Functionals <=

    0.0800   Slater exchange
    0.7200         Becke 88

   => Exact (HF) Exchange <=

    0.2000               HF 

   => Correlation Functionals <=

    0.1900   Vosko, Wilk & Nusair (VWN5_RPA)
    0.8100   Lee, Yang & Parr

   => LibXC Density Thresholds  <==

    XC_HYB_GGA_XC_B3LYP:  1.00E-15 

   => Molecular Quadrature <=

    Radial Scheme          =       TREUTLER
    Pruning Scheme         =           NONE
    Nuclear Scheme         =       TREUTLER

    Blocking Scheme        =         OCTREE
    BS radius alpha        =              1
    Pruning alpha          =              1
    Radial Points          =             75
    Spherical Points       =            302
    Total Points           =          42348
    Total Blocks           =            375
    Max Points             =            255
    Max Functions          =             23
    Weights Tolerance      =       1.00E-15

   => Loading Basis Set <=

    Name: (CC-PVDZ AUX)
    Role: JKFIT
    Keyword: DF_BASIS_SCF
    atoms 1 entry H          line    51 file /Users/joseantoniorodriguesromero/anaconda3/share/psi4/basis/cc-pvdz-jkfit.gbs 
    atoms 2 entry CL         line   667 file /Users/joseantoniorodriguesromero/anaconda3/share/psi4/basis/cc-pvdz-jkfit.gbs 

  ==> Integral Setup <==

  DFHelper Memory: AOs need 0.001 GiB; user supplied 0.338 GiB. 
  Using in-core AOs.

  ==> MemDFJK: Density-Fitted J/K Matrices <==

    J tasked:                   Yes
    K tasked:                   Yes
    wK tasked:                   No
    OpenMP threads:               1
    Memory [MiB]:               345
    Algorithm:                 Core
    Schwarz Cutoff:           1E-12
    Mask sparsity (%):       0.0000
    Fitting Condition:        1E-10

   => Auxiliary Basis Set <=

  Basis Set: (CC-PVDZ AUX)
    Blend: CC-PVDZ-JKFIT
    Number of shells: 45
    Number of basis functions: 135
    Number of Cartesian functions: 155
    Spherical Harmonics?: true
    Max angular momentum: 3

  Cached 100.0% of DFT collocation blocks in 0.028 [GiB].

  Minimum eigenvalue in the overlap matrix is 4.1501207573E-02.
  Reciprocal condition number of the overlap matrix is 1.3911077101E-02.
    Using symmetric orthogonalization.

  ==> Pre-Iterations <==

  SCF Guess: Superposition of Atomic Potentials (doi:10.1021/acs.jctc.8b01089).

  ==> SAP guess <==

   => Molecular Quadrature <=

    Radial Scheme          =       TREUTLER
    Pruning Scheme         =           NONE
    Nuclear Scheme         =       TREUTLER

    Blocking Scheme        =         OCTREE
    BS radius alpha        =              1
    Pruning alpha          =              1
    Radial Points          =             75
    Spherical Points       =            302
    Total Points           =          42348
    Total Blocks           =            375
    Max Points             =            255
    Max Functions          =             23
    Weights Tolerance      =       1.00E-15

   -------------------------------------------------------
    Irrep   Nso     Nmo     Nalpha   Nbeta   Ndocc  Nsocc
   -------------------------------------------------------
     A1        12      12       5       5       5       0
     A2         1       1       0       0       0       0
     B1         5       5       2       2       2       0
     B2         5       5       2       2       2       0
   -------------------------------------------------------
    Total      23      23       9       9       9       0
   -------------------------------------------------------

  ==> Iterations <==

                           Total Energy        Delta E     RMS |[F,P]|

   @DF-UKS iter   1:  -460.75672017775685   -4.60757e+02   2.29668e-02 ADIIS/DIIS
   @DF-UKS iter   2:  -460.78759635417981   -3.08762e-02   1.57685e-02 ADIIS/DIIS/DAMP=1%
   @DF-UKS iter   3:  -460.80891169143445   -2.13153e-02   8.98323e-04 ADIIS/DIIS/DAMP=1%
   @DF-UKS iter   4:  -460.81569944497915   -6.78775e-03   2.86219e-04 ADIIS/DIIS/DAMP=1%
   @DF-UKS iter   5:  -460.81598120358399   -2.81759e-04   3.77158e-05 DIIS/DAMP=1%
   @DF-UKS iter   6:  -460.81578623904454    1.94965e-04   3.13092e-06 DIIS/DAMP=1%
   @DF-UKS iter   7:  -460.81580951494141   -2.32759e-05   2.19131e-07 DIIS/DAMP=1%
   @DF-UKS iter   8:  -460.81580914109929    3.73842e-07   8.87562e-09 DIIS/DAMP=1%
   @DF-UKS iter   9:  -460.81580918043511   -3.93358e-08   9.96983e-10 DIIS/DAMP=1%
   @DF-UKS iter  10:  -460.81580918206379   -1.62868e-09   2.91208e-11 DIIS/DAMP=1%
  Energy and wave function converged.


  ==> Post-Iterations <==

   Electrons on quadrature grid:
      Nalpha   =    8.9999999447 ; deviation = -5.533e-08
      Nbeta    =    8.9999999447 ; deviation = -5.533e-08
      Ntotal   =   17.9999998893 ; deviation = -1.107e-07 

   @Spin Contamination Metric:  -1.776356839E-15
   @S^2 Expected:                0.000000000E+00
   @S^2 Observed:               -1.776356839E-15
   @S   Expected:                0.000000000E+00
   @S   Observed:                0.000000000E+00

    Orbital Energies [Eh]
    ---------------------

    Alpha Occupied:                                                       

       1A1  -101.546606     2A1    -9.466115     3A1    -7.228686  
       1B1    -7.218687     1B2    -7.218687     4A1    -0.857262  
       5A1    -0.479072     2B1    -0.329605     2B2    -0.329605  

    Alpha Virtual:                                                        

       6A1     0.034222     7A1     0.308800     3B1     0.543164  
       3B2     0.543164     8A1     0.546115     4B2     0.637428  
       4B1     0.637428     1A2     0.733195     9A1     0.733195  
      10A1     0.779973    11A1     1.124161     5B1     1.481196  
       5B2     1.481196    12A1     2.237186  

    Beta Occupied:                                                        

       1A1  -101.546606     2A1    -9.466115     3A1    -7.228686  
       1B1    -7.218687     1B2    -7.218687     4A1    -0.857262  
       5A1    -0.479072     2B1    -0.329605     2B2    -0.329605  

    Beta Virtual:                                                         

       6A1     0.034222     7A1     0.308800     3B1     0.543164  
       3B2     0.543164     8A1     0.546115     4B2     0.637428  
       4B1     0.637428     1A2     0.733195     9A1     0.733195  
      10A1     0.779973    11A1     1.124161     5B1     1.481196  
       5B2     1.481196    12A1     2.237186  

    Final Occupation by Irrep:
             A1    A2    B1    B2 
    DOCC [     5,    0,    2,    2 ]
    SOCC [     0,    0,    0,    0 ]
    NA   [     5,    0,    2,    2 ]
    NB   [     5,    0,    2,    2 ]

  @DF-UKS Final Energy:  -460.81580918206379

   => Energetics <=

    Nuclear Repulsion Energy =              7.4966771511583348
    One-Electron Energy =                -650.8814473843294763
    Two-Electron Energy =                 205.6407586123918634
    DFT Exchange-Correlation Energy =     -23.0717975612845443
    Empirical Dispersion Energy =           0.0000000000000000
    VV10 Nonlocal Energy =                  0.0000000000000000
    Total Energy =                       -460.8158091820637878

  UHF NO Occupations:
  HONO-2 :    3 A1 2.0000000
  HONO-1 :    4 A1 2.0000000
  HONO-0 :    5 A1 2.0000000
  LUNO+0 :    6 A1 0.0000000
  LUNO+1 :    7 A1 0.0000000
  LUNO+2 :    3 B2 0.0000000
  LUNO+3 :    8 A1 0.0000000


Computation Completed


Properties will be evaluated at   0.000000,   0.000000,   0.000000 [a0]

Properties computed using the SCF density matrix


 Multipole Moments:

 ------------------------------------------------------------------------------------
     Multipole            Electronic (a.u.)      Nuclear  (a.u.)        Total (a.u.)
 ------------------------------------------------------------------------------------

 L = 1.  Multiply by 2.5417464519 to convert [e a0] to [Debye]
 Dipole X            :          0.0000000            0.0000000            0.0000000
 Dipole Y            :          0.0000000            0.0000000            0.0000000
 Dipole Z            :         -0.6300288            1.1242226            0.4941938
 Magnitude           :                                                    0.4941938

 ------------------------------------------------------------------------------------

*** tstop() called on Joses-MacBook-Pro-2.local at Wed Jul 16 18:17:33 2025
Module time:
	user time   =       2.94 seconds =       0.05 minutes
	system time =       3.94 seconds =       0.07 minutes
	total time  =          1 seconds =       0.02 minutes
Total time:
	user time   =       2.94 seconds =       0.05 minutes
	system time =       3.94 seconds =       0.07 minutes
	total time  =          1 seconds =       0.02 minutes

*** tstart() called on Joses-MacBook-Pro-2.local
*** at Wed Jul 16 18:17:33 2025


         ------------------------------------------------------------
                                   SCF GRAD                          
                          Rob Parrish, Justin Turney,                
                       Andy Simmonett, and Alex Sokolov              
         ------------------------------------------------------------

  ==> Geometry <==

    Molecular point group: c2v
    Full point group: C_inf_v

    Geometry (in Angstrom), charge = 0, multiplicity = 1:

       Center              X                  Y                   Z               Mass       
    ------------   -----------------  -----------------  -----------------  -----------------
         H            0.000000000000     0.000000000000     1.166384054462     1.007825032230
         CL           0.000000000000     0.000000000000    -0.033615945538    34.968852682000

  Nuclear repulsion =    7.496677151158335

  ==> Basis Set <==

  Basis Set: CC-PVDZ
    Blend: CC-PVDZ
    Number of shells: 11
    Number of basis functions: 23
    Number of Cartesian functions: 24
    Spherical Harmonics?: true
    Max angular momentum: 2

  ==> DFJKGrad: Density-Fitted SCF Gradients <==

    Gradient:                    1
    J tasked:                  Yes
    K tasked:                  Yes
    wK tasked:                  No
    OpenMP threads:              1
    Integrals threads:           1
    Memory [MiB]:              375
    Schwarz Cutoff:          1E-12
    Fitting Condition:       1E-10

   => Auxiliary Basis Set <=

  Basis Set: (CC-PVDZ AUX)
    Blend: CC-PVDZ-JKFIT
    Number of shells: 45
    Number of basis functions: 135
    Number of Cartesian functions: 155
    Spherical Harmonics?: true
    Max angular momentum: 3

  ==> DFT Potential <==

   => LibXC <=

    Version 6.2.2
    S. Lehtola, C. Steigemann, M. J.T. Oliveira, and M. A.L. Marques.,  SoftwareX 7, 1–5 (2018) (10.1016/j.softx.2017.11.002)

   => Composite Functional: B3LYP <= 

    B3LYP Hyb-GGA Exchange-Correlation Functional

    P. J. Stephens, F. J. Devlin, C. F. Chabalowski, and M. J. Frisch.,  J. Phys. Chem. 98, 11623 (1994) (10.1021/j100096a001)

    Deriv               =              1
    GGA                 =           TRUE
    Meta                =          FALSE

    Exchange Hybrid     =           TRUE
    MP2 Hybrid          =          FALSE

   => Exchange Functionals <=

    0.0800   Slater exchange
    0.7200         Becke 88

   => Exact (HF) Exchange <=

    0.2000               HF 

   => Correlation Functionals <=

    0.1900   Vosko, Wilk & Nusair (VWN5_RPA)
    0.8100   Lee, Yang & Parr

   => LibXC Density Thresholds  <==

    XC_HYB_GGA_XC_B3LYP:  1.00E-15 

   => Molecular Quadrature <=

    Radial Scheme          =       TREUTLER
    Pruning Scheme         =           NONE
    Nuclear Scheme         =       TREUTLER

    Blocking Scheme        =         OCTREE
    BS radius alpha        =              1
    Pruning alpha          =              1
    Radial Points          =             75
    Spherical Points       =            302
    Total Points           =          42348
    Total Blocks           =            375
    Max Points             =            255
    Max Functions          =             23
    Weights Tolerance      =       1.00E-15


  -Total Gradient:
     Atom            X                  Y                   Z
    ------   -----------------  -----------------  -----------------
       1       -0.000000000000     0.000000000000    -0.076430943836
       2       -0.000000000000     0.000000000000     0.076430992410


*** tstop() called on Joses-MacBook-Pro-2.local at Wed Jul 16 18:17:33 2025
Module time:
	user time   =       0.53 seconds =       0.01 minutes
	system time =       1.37 seconds =       0.02 minutes
	total time  =          0 seconds =       0.00 minutes
Total time:
	user time   =       3.47 seconds =       0.06 minutes
	system time =       5.31 seconds =       0.09 minutes
	total time  =          1 seconds =       0.02 minutes

    			-----------------------------------------

    			 OPTKING 3.0: for geometry optimizations 

    			     By R.A. King, Bethel University     

    			        with contributions from          

    			    A.V. Copan, J. Cayton, A. Heide      

    			-----------------------------------------

    
	                            ===> Fragment 1 <== 

	 Z (Atomic Numbers)          Masses                          Geom                  
	       1.000000             1.007825          0.00000000  0.00000000  2.20414642   
	      17.000000            34.968853          0.00000000  0.00000000 -0.06352493   

	 - Coordinate -           - BOHR/RAD -       - ANG/DEG -
	 R(1,2)           =         2.267671           1.200000


	        --- Internal Coordinate Step in ANG or DEG, aJ/ANG or AJ/DEG ---
	-------------------------------------------------------------------------------
	           Coordinate      Previous         Force          Change          New 
	           ----------      --------        ------          ------        ------
	               R(1,2)       1.20000        0.62969        0.09387       1.29387
	-------------------------------------------------------------------------------

	                                 ==> Convergence Check <==                                  
    
	Measures of convergence in internal coordinates in au.
    
	Criteria marked as inactive (o), active & met (*), and active & unmet ( ).

	----------------------------------------------------------------------------------------------
	   Step    Total Energy     Delta E     Max Force     RMS Force      Max Disp      RMS Disp   
	----------------------------------------------------------------------------------------------
	  Convergence Criteria     1.00e-06 *    3.00e-04 *             o    1.20e-03 *             o
	----------------------------------------------------------------------------------------------
	     1    -460.81580918   -4.61e+02      7.64e-02      7.64e-02 o    1.77e-01      1.77e-01 o  ~
	----------------------------------------------------------------------------------------------

Next Geometry in Ang 
	Fragment 1 (Ang)

	    H   0.0000000000   0.0000000000   1.2133191510
	   Cl   0.0000000000   0.0000000000  -0.0805510421


    Structure for next step:
    Molecular point group: c2v
    Full point group: C_inf_v

    Geometry (in Angstrom), charge = 0, multiplicity = 1:

    H            0.000000000000     0.000000000000     1.257624634840
    CL           0.000000000000     0.000000000000    -0.036245558288


Scratch directory: /tmp/
gradient() will perform analytic gradient computation.
   => Libint2 <=

    Primary   basis highest AM E, G, H:  6, 6, 3
    Auxiliary basis highest AM E, G, H:  7, 7, 4
    Onebody   basis highest AM E, G, H:  -, -, -
    Solid Harmonics ordering:            Gaussian

*** tstart() called on Joses-MacBook-Pro-2.local
*** at Wed Jul 16 18:17:33 2025

   => Loading Basis Set <=

    Name: CC-PVDZ
    Role: ORBITAL
    Keyword: BASIS
    atoms 1 entry H          line    22 file /Users/joseantoniorodriguesromero/anaconda3/share/psi4/basis/cc-pvdz.gbs 
    atoms 2 entry CL         line   658 file /Users/joseantoniorodriguesromero/anaconda3/share/psi4/basis/cc-pvdz.gbs 


         ---------------------------------------------------------
                                   SCF
               by Justin Turney, Rob Parrish, Andy Simmonett
                          and Daniel G. A. Smith
                              UKS Reference
                        1 Threads,    500 MiB Core
         ---------------------------------------------------------

  ==> Geometry <==

    Molecular point group: c2v
    Full point group: C_inf_v

    Geometry (in Angstrom), charge = 0, multiplicity = 1:

       Center              X                  Y                   Z               Mass       
    ------------   -----------------  -----------------  -----------------  -----------------
         H            0.000000000000     0.000000000000     1.257624634840     1.007825032230
         CL           0.000000000000     0.000000000000    -0.036245558288    34.968852682000

  Running in c2v symmetry.

  Rotational constants: A = ************  B =     10.27944  C =     10.27944 [cm^-1]
  Rotational constants: A = ************  B = 308169.96865  C = 308169.96865 [MHz]
  Nuclear repulsion =    6.952793741730114

  Charge       = 0
  Multiplicity = 1
  Electrons    = 18
  Nalpha       = 9
  Nbeta        = 9

  ==> Algorithm <==

  SCF Algorithm Type is DF.
  DIIS enabled.
  MOM disabled.
  Fractional occupation disabled.
  Guess Type is READ.
  Energy threshold   = 1.00e-08
  Density threshold  = 1.00e-08
  Integral threshold = 1.00e-12

  ==> Primary Basis <==

  Basis Set: CC-PVDZ
    Blend: CC-PVDZ
    Number of shells: 11
    Number of basis functions: 23
    Number of Cartesian functions: 24
    Spherical Harmonics?: true
    Max angular momentum: 2

  ==> DFT Potential <==

   => LibXC <=

    Version 6.2.2
    S. Lehtola, C. Steigemann, M. J.T. Oliveira, and M. A.L. Marques.,  SoftwareX 7, 1–5 (2018) (10.1016/j.softx.2017.11.002)

   => Composite Functional: B3LYP <= 

    B3LYP Hyb-GGA Exchange-Correlation Functional

    P. J. Stephens, F. J. Devlin, C. F. Chabalowski, and M. J. Frisch.,  J. Phys. Chem. 98, 11623 (1994) (10.1021/j100096a001)

    Deriv               =              1
    GGA                 =           TRUE
    Meta                =          FALSE

    Exchange Hybrid     =           TRUE
    MP2 Hybrid          =          FALSE

   => Exchange Functionals <=

    0.0800   Slater exchange
    0.7200         Becke 88

   => Exact (HF) Exchange <=

    0.2000               HF 

   => Correlation Functionals <=

    0.1900   Vosko, Wilk & Nusair (VWN5_RPA)
    0.8100   Lee, Yang & Parr

   => LibXC Density Thresholds  <==

    XC_HYB_GGA_XC_B3LYP:  1.00E-15 

   => Molecular Quadrature <=

    Radial Scheme          =       TREUTLER
    Pruning Scheme         =           NONE
    Nuclear Scheme         =       TREUTLER

    Blocking Scheme        =         OCTREE
    BS radius alpha        =              1
    Pruning alpha          =              1
    Radial Points          =             75
    Spherical Points       =            302
    Total Points           =          42359
    Total Blocks           =            375
    Max Points             =            253
    Max Functions          =             23
    Weights Tolerance      =       1.00E-15

   => Loading Basis Set <=

    Name: (CC-PVDZ AUX)
    Role: JKFIT
    Keyword: DF_BASIS_SCF
    atoms 1 entry H          line    51 file /Users/joseantoniorodriguesromero/anaconda3/share/psi4/basis/cc-pvdz-jkfit.gbs 
    atoms 2 entry CL         line   667 file /Users/joseantoniorodriguesromero/anaconda3/share/psi4/basis/cc-pvdz-jkfit.gbs 

   => Loading Basis Set <=

    Name: CC-PVDZ
    Role: ORBITAL
    Keyword: BASIS
    atoms 1 entry H          line    22 file /Users/joseantoniorodriguesromero/anaconda3/share/psi4/basis/cc-pvdz.gbs 
    atoms 2 entry CL         line   658 file /Users/joseantoniorodriguesromero/anaconda3/share/psi4/basis/cc-pvdz.gbs 

  Reading orbitals from file /tmp/singlet_HCl.default.68151.180.npy, no projection.

  ==> Integral Setup <==

  DFHelper Memory: AOs need 0.001 GiB; user supplied 0.338 GiB. 
  Using in-core AOs.

  ==> MemDFJK: Density-Fitted J/K Matrices <==

    J tasked:                   Yes
    K tasked:                   Yes
    wK tasked:                   No
    OpenMP threads:               1
    Memory [MiB]:               345
    Algorithm:                 Core
    Schwarz Cutoff:           1E-12
    Mask sparsity (%):       0.0000
    Fitting Condition:        1E-10

   => Auxiliary Basis Set <=

  Basis Set: (CC-PVDZ AUX)
    Blend: CC-PVDZ-JKFIT
    Number of shells: 45
    Number of basis functions: 135
    Number of Cartesian functions: 155
    Spherical Harmonics?: true
    Max angular momentum: 3

  Cached 100.0% of DFT collocation blocks in 0.028 [GiB].

  Minimum eigenvalue in the overlap matrix is 4.6743771170E-02.
  Reciprocal condition number of the overlap matrix is 1.6055011109E-02.
    Using symmetric orthogonalization.

  ==> Pre-Iterations <==

  SCF Guess: Orbitals guess was supplied from a previous computation.

   -------------------------------------------------------
    Irrep   Nso     Nmo     Nalpha   Nbeta   Ndocc  Nsocc
   -------------------------------------------------------
     A1        12      12       5       5       5       0
     A2         1       1       0       0       0       0
     B1         5       5       2       2       2       0
     B2         5       5       2       2       2       0
   -------------------------------------------------------
    Total      23      23       9       9       9       0
   -------------------------------------------------------

  ==> Iterations <==

                           Total Energy        Delta E     RMS |[F,P]|

   @DF-UKS iter   0:  -460.78610571263414   -4.60786e+02   1.65847e-02 
   @DF-UKS iter   1:  -460.82160840308774   -3.55027e-02   2.20804e-03 ADIIS/DIIS
   @DF-UKS iter   2:  -460.82188810253706   -2.79699e-04   1.60758e-03 ADIIS/DIIS/DAMP=1%
   @DF-UKS iter   3:  -460.82157031303677    3.17790e-04   5.01365e-05 DIIS/DAMP=1%
   @DF-UKS iter   4:  -460.82211606827673   -5.45755e-04   3.42417e-05 DIIS/DAMP=1%
   @DF-UKS iter   5:  -460.82219773036201   -8.16621e-05   3.37443e-06 DIIS/DAMP=1%
   @DF-UKS iter   6:  -460.82217540796472    2.23224e-05   2.48147e-07 DIIS/DAMP=1%
   @DF-UKS iter   7:  -460.82217738194504   -1.97398e-06   2.51650e-08 DIIS/DAMP=1%
   @DF-UKS iter   8:  -460.82217727794483    1.04000e-07   1.26430e-09 DIIS/DAMP=1%
   @DF-UKS iter   9:  -460.82217725786990    2.00749e-08   8.70533e-11 DIIS/DAMP=1%
   @DF-UKS iter  10:  -460.82217725766679    2.03102e-10   5.58966e-12 DIIS/DAMP=1%
  Energy and wave function converged.


  ==> Post-Iterations <==

   Electrons on quadrature grid:
      Nalpha   =    8.9999999958 ; deviation = -4.192e-09
      Nbeta    =    8.9999999958 ; deviation = -4.192e-09
      Ntotal   =   17.9999999916 ; deviation = -8.384e-09 

   @Spin Contamination Metric:  -1.065814104E-14
   @S^2 Expected:                0.000000000E+00
   @S^2 Observed:               -1.065814104E-14
   @S   Expected:                0.000000000E+00
   @S   Observed:                0.000000000E+00

    Orbital Energies [Eh]
    ---------------------

    Alpha Occupied:                                                       

       1A1  -101.550313     2A1    -9.467358     3A1    -7.230244  
       1B2    -7.220114     1B1    -7.220114     4A1    -0.840771  
       5A1    -0.467557     2B1    -0.327088     2B2    -0.327088  

    Alpha Virtual:                                                        

       6A1     0.006332     7A1     0.317671     8A1     0.541947  
       3B1     0.544459     3B2     0.544459     4B2     0.643958  
       4B1     0.643958     9A1     0.735128     1A2     0.735128  
      10A1     0.748326    11A1     1.057846     5B2     1.431852  
       5B1     1.431852    12A1     2.086638  

    Beta Occupied:                                                        

       1A1  -101.550313     2A1    -9.467358     3A1    -7.230244  
       1B2    -7.220114     1B1    -7.220114     4A1    -0.840771  
       5A1    -0.467557     2B1    -0.327088     2B2    -0.327088  

    Beta Virtual:                                                         

       6A1     0.006332     7A1     0.317671     8A1     0.541947  
       3B1     0.544459     3B2     0.544459     4B2     0.643958  
       4B1     0.643958     9A1     0.735128     1A2     0.735128  
      10A1     0.748326    11A1     1.057846     5B2     1.431852  
       5B1     1.431852    12A1     2.086638  

    Final Occupation by Irrep:
             A1    A2    B1    B2 
    DOCC [     5,    0,    2,    2 ]
    SOCC [     0,    0,    0,    0 ]
    NA   [     5,    0,    2,    2 ]
    NB   [     5,    0,    2,    2 ]

  @DF-UKS Final Energy:  -460.82217725766679

   => Energetics <=

    Nuclear Repulsion Energy =              6.9527937417301144
    One-Electron Energy =                -649.8718926444250883
    Two-Electron Energy =                 205.1423915280541905
    DFT Exchange-Correlation Energy =     -23.0454698830260334
    Empirical Dispersion Energy =           0.0000000000000000
    VV10 Nonlocal Energy =                  0.0000000000000000
    Total Energy =                       -460.8221772576667945

  UHF NO Occupations:
  HONO-2 :    2 B2 2.0000000
  HONO-1 :    2 B1 2.0000000
  HONO-0 :    5 A1 2.0000000
  LUNO+0 :    3 B1 0.0000000
  LUNO+1 :    3 B2 0.0000000
  LUNO+2 :    6 A1 0.0000000
  LUNO+3 :    7 A1 0.0000000


Computation Completed


Properties will be evaluated at   0.000000,   0.000000,   0.000000 [a0]

Properties computed using the SCF density matrix


 Multipole Moments:

 ------------------------------------------------------------------------------------
     Multipole            Electronic (a.u.)      Nuclear  (a.u.)        Total (a.u.)
 ------------------------------------------------------------------------------------

 L = 1.  Multiply by 2.5417464519 to convert [e a0] to [Debye]
 Dipole X            :          0.0000000            0.0000000            0.0000000
 Dipole Y            :          0.0000000            0.0000000            0.0000000
 Dipole Z            :         -0.6867772            1.2121651            0.5253879
 Magnitude           :                                                    0.5253879

 ------------------------------------------------------------------------------------

*** tstop() called on Joses-MacBook-Pro-2.local at Wed Jul 16 18:17:34 2025
Module time:
	user time   =       4.02 seconds =       0.07 minutes
	system time =       2.91 seconds =       0.05 minutes
	total time  =          1 seconds =       0.02 minutes
Total time:
	user time   =       7.53 seconds =       0.13 minutes
	system time =       8.44 seconds =       0.14 minutes
	total time  =          2 seconds =       0.03 minutes

*** tstart() called on Joses-MacBook-Pro-2.local
*** at Wed Jul 16 18:17:34 2025


         ------------------------------------------------------------
                                   SCF GRAD                          
                          Rob Parrish, Justin Turney,                
                       Andy Simmonett, and Alex Sokolov              
         ------------------------------------------------------------

  ==> Geometry <==

    Molecular point group: c2v
    Full point group: C_inf_v

    Geometry (in Angstrom), charge = 0, multiplicity = 1:

       Center              X                  Y                   Z               Mass       
    ------------   -----------------  -----------------  -----------------  -----------------
         H            0.000000000000     0.000000000000     1.257624634840     1.007825032230
         CL           0.000000000000     0.000000000000    -0.036245558288    34.968852682000

  Nuclear repulsion =    6.952793741730114

  ==> Basis Set <==

  Basis Set: CC-PVDZ
    Blend: CC-PVDZ
    Number of shells: 11
    Number of basis functions: 23
    Number of Cartesian functions: 24
    Spherical Harmonics?: true
    Max angular momentum: 2

  ==> DFJKGrad: Density-Fitted SCF Gradients <==

    Gradient:                    1
    J tasked:                  Yes
    K tasked:                  Yes
    wK tasked:                  No
    OpenMP threads:              1
    Integrals threads:           1
    Memory [MiB]:              375
    Schwarz Cutoff:          1E-12
    Fitting Condition:       1E-10

   => Auxiliary Basis Set <=

  Basis Set: (CC-PVDZ AUX)
    Blend: CC-PVDZ-JKFIT
    Number of shells: 45
    Number of basis functions: 135
    Number of Cartesian functions: 155
    Spherical Harmonics?: true
    Max angular momentum: 3

  ==> DFT Potential <==

   => LibXC <=

    Version 6.2.2
    S. Lehtola, C. Steigemann, M. J.T. Oliveira, and M. A.L. Marques.,  SoftwareX 7, 1–5 (2018) (10.1016/j.softx.2017.11.002)

   => Composite Functional: B3LYP <= 

    B3LYP Hyb-GGA Exchange-Correlation Functional

    P. J. Stephens, F. J. Devlin, C. F. Chabalowski, and M. J. Frisch.,  J. Phys. Chem. 98, 11623 (1994) (10.1021/j100096a001)

    Deriv               =              1
    GGA                 =           TRUE
    Meta                =          FALSE

    Exchange Hybrid     =           TRUE
    MP2 Hybrid          =          FALSE

   => Exchange Functionals <=

    0.0800   Slater exchange
    0.7200         Becke 88

   => Exact (HF) Exchange <=

    0.2000               HF 

   => Correlation Functionals <=

    0.1900   Vosko, Wilk & Nusair (VWN5_RPA)
    0.8100   Lee, Yang & Parr

   => LibXC Density Thresholds  <==

    XC_HYB_GGA_XC_B3LYP:  1.00E-15 

   => Molecular Quadrature <=

    Radial Scheme          =       TREUTLER
    Pruning Scheme         =           NONE
    Nuclear Scheme         =       TREUTLER

    Blocking Scheme        =         OCTREE
    BS radius alpha        =              1
    Pruning alpha          =              1
    Radial Points          =             75
    Spherical Points       =            302
    Total Points           =          42359
    Total Blocks           =            375
    Max Points             =            253
    Max Functions          =             23
    Weights Tolerance      =       1.00E-15


  -Total Gradient:
     Atom            X                  Y                   Z
    ------   -----------------  -----------------  -----------------
       1       -0.000000000000     0.000000000000    -0.001642794898
       2        0.000000000000     0.000000000000     0.001642226798


*** tstop() called on Joses-MacBook-Pro-2.local at Wed Jul 16 18:17:34 2025
Module time:
	user time   =       0.62 seconds =       0.01 minutes
	system time =       1.37 seconds =       0.02 minutes
	total time  =          0 seconds =       0.00 minutes
Total time:
	user time   =       8.15 seconds =       0.14 minutes
	system time =       9.81 seconds =       0.16 minutes
	total time  =          2 seconds =       0.03 minutes

    			-----------------------------------------

    			 OPTKING 3.0: for geometry optimizations 

    			     By R.A. King, Bethel University     

    			        with contributions from          

    			    A.V. Copan, J. Cayton, A. Heide      

    			-----------------------------------------

    
	                            ===> Fragment 1 <== 

	 Z (Atomic Numbers)          Masses                          Geom                  
	       1.000000             1.007825          0.00000000  0.00000000  2.37656613   
	      17.000000            34.968853          0.00000000  0.00000000 -0.06849418   

	 - Coordinate -           - BOHR/RAD -       - ANG/DEG -
	 R(1,2)           =         2.445060           1.293870


	        --- Internal Coordinate Step in ANG or DEG, aJ/ANG or AJ/DEG ---
	-------------------------------------------------------------------------------
	           Coordinate      Previous         Force          Change          New 
	           ----------      --------        ------          ------        ------
	               R(1,2)       1.29387        0.01353        0.00206       1.29593
	-------------------------------------------------------------------------------

	                                 ==> Convergence Check <==                                  
    
	Measures of convergence in internal coordinates in au.
    
	Criteria marked as inactive (o), active & met (*), and active & unmet ( ).

	----------------------------------------------------------------------------------------------
	   Step    Total Energy     Delta E     Max Force     RMS Force      Max Disp      RMS Disp   
	----------------------------------------------------------------------------------------------
	  Convergence Criteria     1.00e-06 *    3.00e-04 *             o    1.20e-03 *             o
	----------------------------------------------------------------------------------------------
	     2    -460.82217726   -6.37e-03      1.64e-03      1.64e-03 o    3.90e-03      3.90e-03 o  ~
	----------------------------------------------------------------------------------------------

Next Geometry in Ang 
	Fragment 1 (Ang)

	    H   0.0000000000   0.0000000000   1.2586554120
	   Cl   0.0000000000   0.0000000000  -0.0372763355


    Structure for next step:
    Molecular point group: c2v
    Full point group: C_inf_v

    Geometry (in Angstrom), charge = 0, multiplicity = 1:

    H            0.000000000000     0.000000000000     1.259628438288
    CL           0.000000000000     0.000000000000    -0.036303309204


Scratch directory: /tmp/
gradient() will perform analytic gradient computation.
   => Libint2 <=

    Primary   basis highest AM E, G, H:  6, 6, 3
    Auxiliary basis highest AM E, G, H:  7, 7, 4
    Onebody   basis highest AM E, G, H:  -, -, -
    Solid Harmonics ordering:            Gaussian

*** tstart() called on Joses-MacBook-Pro-2.local
*** at Wed Jul 16 18:17:34 2025

   => Loading Basis Set <=

    Name: CC-PVDZ
    Role: ORBITAL
    Keyword: BASIS
    atoms 1 entry H          line    22 file /Users/joseantoniorodriguesromero/anaconda3/share/psi4/basis/cc-pvdz.gbs 
    atoms 2 entry CL         line   658 file /Users/joseantoniorodriguesromero/anaconda3/share/psi4/basis/cc-pvdz.gbs 


         ---------------------------------------------------------
                                   SCF
               by Justin Turney, Rob Parrish, Andy Simmonett
                          and Daniel G. A. Smith
                              UKS Reference
                        1 Threads,    500 MiB Core
         ---------------------------------------------------------

  ==> Geometry <==

    Molecular point group: c2v
    Full point group: C_inf_v

    Geometry (in Angstrom), charge = 0, multiplicity = 1:

       Center              X                  Y                   Z               Mass       
    ------------   -----------------  -----------------  -----------------  -----------------
         H            0.000000000000     0.000000000000     1.259628438288     1.007825032230
         CL           0.000000000000     0.000000000000    -0.036303309204    34.968852682000

  Running in c2v symmetry.

  Rotational constants: A = ************  B =     10.24676  C =     10.24676 [cm^-1]
  Rotational constants: A = ************  B = 307190.28152  C = 307190.28152 [MHz]
  Nuclear repulsion =    6.941733311805399

  Charge       = 0
  Multiplicity = 1
  Electrons    = 18
  Nalpha       = 9
  Nbeta        = 9

  ==> Algorithm <==

  SCF Algorithm Type is DF.
  DIIS enabled.
  MOM disabled.
  Fractional occupation disabled.
  Guess Type is READ.
  Energy threshold   = 1.00e-08
  Density threshold  = 1.00e-08
  Integral threshold = 1.00e-12

  ==> Primary Basis <==

  Basis Set: CC-PVDZ
    Blend: CC-PVDZ
    Number of shells: 11
    Number of basis functions: 23
    Number of Cartesian functions: 24
    Spherical Harmonics?: true
    Max angular momentum: 2

  ==> DFT Potential <==

   => LibXC <=

    Version 6.2.2
    S. Lehtola, C. Steigemann, M. J.T. Oliveira, and M. A.L. Marques.,  SoftwareX 7, 1–5 (2018) (10.1016/j.softx.2017.11.002)

   => Composite Functional: B3LYP <= 

    B3LYP Hyb-GGA Exchange-Correlation Functional

    P. J. Stephens, F. J. Devlin, C. F. Chabalowski, and M. J. Frisch.,  J. Phys. Chem. 98, 11623 (1994) (10.1021/j100096a001)

    Deriv               =              1
    GGA                 =           TRUE
    Meta                =          FALSE

    Exchange Hybrid     =           TRUE
    MP2 Hybrid          =          FALSE

   => Exchange Functionals <=

    0.0800   Slater exchange
    0.7200         Becke 88

   => Exact (HF) Exchange <=

    0.2000               HF 

   => Correlation Functionals <=

    0.1900   Vosko, Wilk & Nusair (VWN5_RPA)
    0.8100   Lee, Yang & Parr

   => LibXC Density Thresholds  <==

    XC_HYB_GGA_XC_B3LYP:  1.00E-15 

   => Molecular Quadrature <=

    Radial Scheme          =       TREUTLER
    Pruning Scheme         =           NONE
    Nuclear Scheme         =       TREUTLER

    Blocking Scheme        =         OCTREE
    BS radius alpha        =              1
    Pruning alpha          =              1
    Radial Points          =             75
    Spherical Points       =            302
    Total Points           =          42359
    Total Blocks           =            375
    Max Points             =            253
    Max Functions          =             23
    Weights Tolerance      =       1.00E-15

   => Loading Basis Set <=

    Name: (CC-PVDZ AUX)
    Role: JKFIT
    Keyword: DF_BASIS_SCF
    atoms 1 entry H          line    51 file /Users/joseantoniorodriguesromero/anaconda3/share/psi4/basis/cc-pvdz-jkfit.gbs 
    atoms 2 entry CL         line   667 file /Users/joseantoniorodriguesromero/anaconda3/share/psi4/basis/cc-pvdz-jkfit.gbs 

   => Loading Basis Set <=

    Name: CC-PVDZ
    Role: ORBITAL
    Keyword: BASIS
    atoms 1 entry H          line    22 file /Users/joseantoniorodriguesromero/anaconda3/share/psi4/basis/cc-pvdz.gbs 
    atoms 2 entry CL         line   658 file /Users/joseantoniorodriguesromero/anaconda3/share/psi4/basis/cc-pvdz.gbs 

  Reading orbitals from file /tmp/singlet_HCl.default.68151.180.npy, no projection.

  ==> Integral Setup <==

  DFHelper Memory: AOs need 0.001 GiB; user supplied 0.338 GiB. 
  Using in-core AOs.

  ==> MemDFJK: Density-Fitted J/K Matrices <==

    J tasked:                   Yes
    K tasked:                   Yes
    wK tasked:                   No
    OpenMP threads:               1
    Memory [MiB]:               345
    Algorithm:                 Core
    Schwarz Cutoff:           1E-12
    Mask sparsity (%):       0.0000
    Fitting Condition:        1E-10

   => Auxiliary Basis Set <=

  Basis Set: (CC-PVDZ AUX)
    Blend: CC-PVDZ-JKFIT
    Number of shells: 45
    Number of basis functions: 135
    Number of Cartesian functions: 155
    Spherical Harmonics?: true
    Max angular momentum: 3

  Cached 100.0% of DFT collocation blocks in 0.028 [GiB].

  Minimum eigenvalue in the overlap matrix is 4.6859709433E-02.
  Reciprocal condition number of the overlap matrix is 1.6104010730E-02.
    Using symmetric orthogonalization.

  ==> Pre-Iterations <==

  SCF Guess: Orbitals guess was supplied from a previous computation.

   -------------------------------------------------------
    Irrep   Nso     Nmo     Nalpha   Nbeta   Ndocc  Nsocc
   -------------------------------------------------------
     A1        12      12       5       5       5       0
     A2         1       1       0       0       0       0
     B1         5       5       2       2       2       0
     B2         5       5       2       2       2       0
   -------------------------------------------------------
    Total      23      23       9       9       9       0
   -------------------------------------------------------

  ==> Iterations <==

                           Total Energy        Delta E     RMS |[F,P]|

   @DF-UKS iter   0:  -460.82134918021239   -4.60821e+02   3.18454e-04 
   @DF-UKS iter   1:  -460.82218094656457   -8.31766e-04   4.78748e-05 DIIS
   @DF-UKS iter   2:  -460.82218107665869   -1.30094e-07   3.50878e-05 DIIS/DAMP=1%
   @DF-UKS iter   3:  -460.82216973731386    1.13393e-05   1.36739e-06 DIIS/DAMP=1%
   @DF-UKS iter   4:  -460.82217968676798   -9.94945e-06   7.46138e-07 DIIS/DAMP=1%
   @DF-UKS iter   5:  -460.82218167114598   -1.98438e-06   6.30550e-08 DIIS/DAMP=1%
   @DF-UKS iter   6:  -460.82218118159830    4.89548e-07   5.79242e-09 DIIS/DAMP=1%
   @DF-UKS iter   7:  -460.82218121819318   -3.65949e-08   4.52267e-10 DIIS/DAMP=1%
   @DF-UKS iter   8:  -460.82218121587533    2.31785e-09   3.52253e-11 DIIS/DAMP=1%
  Energy and wave function converged.


  ==> Post-Iterations <==

   Electrons on quadrature grid:
      Nalpha   =    8.9999999965 ; deviation = -3.502e-09
      Nbeta    =    8.9999999965 ; deviation = -3.502e-09
      Ntotal   =   17.9999999930 ; deviation = -7.003e-09 

   @Spin Contamination Metric:  -1.421085472E-14
   @S^2 Expected:                0.000000000E+00
   @S^2 Observed:               -1.421085472E-14
   @S   Expected:                0.000000000E+00
   @S   Observed:                0.000000000E+00

    Orbital Energies [Eh]
    ---------------------

    Alpha Occupied:                                                       

       1A1  -101.550387     2A1    -9.467387     3A1    -7.230281  
       1B1    -7.220145     1B2    -7.220145     4A1    -0.840451  
       5A1    -0.467299     2B2    -0.327035     2B1    -0.327035  

    Alpha Virtual:                                                        

       6A1     0.005703     7A1     0.317893     8A1     0.541865  
       3B1     0.544477     3B2     0.544477     4B2     0.644136  
       4B1     0.644136     9A1     0.735168     1A2     0.735168  
      10A1     0.747701    11A1     1.056447     5B1     1.430829  
       5B2     1.430829    12A1     2.083777  

    Beta Occupied:                                                        

       1A1  -101.550387     2A1    -9.467387     3A1    -7.230281  
       1B1    -7.220145     1B2    -7.220145     4A1    -0.840451  
       5A1    -0.467299     2B2    -0.327035     2B1    -0.327035  

    Beta Virtual:                                                         

       6A1     0.005703     7A1     0.317893     8A1     0.541865  
       3B1     0.544477     3B2     0.544477     4B2     0.644136  
       4B1     0.644136     9A1     0.735168     1A2     0.735168  
      10A1     0.747701    11A1     1.056447     5B1     1.430829  
       5B2     1.430829    12A1     2.083777  

    Final Occupation by Irrep:
             A1    A2    B1    B2 
    DOCC [     5,    0,    2,    2 ]
    SOCC [     0,    0,    0,    0 ]
    NA   [     5,    0,    2,    2 ]
    NB   [     5,    0,    2,    2 ]

  @DF-UKS Final Energy:  -460.82218121587533

   => Energetics <=

    Nuclear Repulsion Energy =              6.9417333118053985
    One-Electron Energy =                -649.8511111889787344
    Two-Electron Energy =                 205.1321312452626273
    DFT Exchange-Correlation Energy =     -23.0449345839645616
    Empirical Dispersion Energy =           0.0000000000000000
    VV10 Nonlocal Energy =                  0.0000000000000000
    Total Energy =                       -460.8221812158753323

  UHF NO Occupations:
  HONO-2 :    1 B1 2.0000000
  HONO-1 :    2 B1 2.0000000
  HONO-0 :    5 A1 2.0000000
  LUNO+0 :    6 A1 0.0000000
  LUNO+1 :    7 A1 0.0000000
  LUNO+2 :    8 A1 0.0000000
  LUNO+3 :    3 B2 0.0000000


Computation Completed


Properties will be evaluated at   0.000000,   0.000000,   0.000000 [a0]

Properties computed using the SCF density matrix


 Multipole Moments:

 ------------------------------------------------------------------------------------
     Multipole            Electronic (a.u.)      Nuclear  (a.u.)        Total (a.u.)
 ------------------------------------------------------------------------------------

 L = 1.  Multiply by 2.5417464519 to convert [e a0] to [Debye]
 Dipole X            :          0.0000000            0.0000000            0.0000000
 Dipole Y            :          0.0000000            0.0000000            0.0000000
 Dipole Z            :         -0.6880416            1.2140965            0.5260549
 Magnitude           :                                                    0.5260549

 ------------------------------------------------------------------------------------

*** tstop() called on Joses-MacBook-Pro-2.local at Wed Jul 16 18:17:34 2025
Module time:
	user time   =       2.79 seconds =       0.05 minutes
	system time =       2.78 seconds =       0.05 minutes
	total time  =          0 seconds =       0.00 minutes
Total time:
	user time   =      10.98 seconds =       0.18 minutes
	system time =      12.85 seconds =       0.21 minutes
	total time  =          2 seconds =       0.03 minutes

*** tstart() called on Joses-MacBook-Pro-2.local
*** at Wed Jul 16 18:17:34 2025


         ------------------------------------------------------------
                                   SCF GRAD                          
                          Rob Parrish, Justin Turney,                
                       Andy Simmonett, and Alex Sokolov              
         ------------------------------------------------------------

  ==> Geometry <==

    Molecular point group: c2v
    Full point group: C_inf_v

    Geometry (in Angstrom), charge = 0, multiplicity = 1:

       Center              X                  Y                   Z               Mass       
    ------------   -----------------  -----------------  -----------------  -----------------
         H            0.000000000000     0.000000000000     1.259628438288     1.007825032230
         CL           0.000000000000     0.000000000000    -0.036303309204    34.968852682000

  Nuclear repulsion =    6.941733311805399

  ==> Basis Set <==

  Basis Set: CC-PVDZ
    Blend: CC-PVDZ
    Number of shells: 11
    Number of basis functions: 23
    Number of Cartesian functions: 24
    Spherical Harmonics?: true
    Max angular momentum: 2

  ==> DFJKGrad: Density-Fitted SCF Gradients <==

    Gradient:                    1
    J tasked:                  Yes
    K tasked:                  Yes
    wK tasked:                  No
    OpenMP threads:              1
    Integrals threads:           1
    Memory [MiB]:              375
    Schwarz Cutoff:          1E-12
    Fitting Condition:       1E-10

   => Auxiliary Basis Set <=

  Basis Set: (CC-PVDZ AUX)
    Blend: CC-PVDZ-JKFIT
    Number of shells: 45
    Number of basis functions: 135
    Number of Cartesian functions: 155
    Spherical Harmonics?: true
    Max angular momentum: 3

  ==> DFT Potential <==

   => LibXC <=

    Version 6.2.2
    S. Lehtola, C. Steigemann, M. J.T. Oliveira, and M. A.L. Marques.,  SoftwareX 7, 1–5 (2018) (10.1016/j.softx.2017.11.002)

   => Composite Functional: B3LYP <= 

    B3LYP Hyb-GGA Exchange-Correlation Functional

    P. J. Stephens, F. J. Devlin, C. F. Chabalowski, and M. J. Frisch.,  J. Phys. Chem. 98, 11623 (1994) (10.1021/j100096a001)

    Deriv               =              1
    GGA                 =           TRUE
    Meta                =          FALSE

    Exchange Hybrid     =           TRUE
    MP2 Hybrid          =          FALSE

   => Exchange Functionals <=

    0.0800   Slater exchange
    0.7200         Becke 88

   => Exact (HF) Exchange <=

    0.2000               HF 

   => Correlation Functionals <=

    0.1900   Vosko, Wilk & Nusair (VWN5_RPA)
    0.8100   Lee, Yang & Parr

   => LibXC Density Thresholds  <==

    XC_HYB_GGA_XC_B3LYP:  1.00E-15 

   => Molecular Quadrature <=

    Radial Scheme          =       TREUTLER
    Pruning Scheme         =           NONE
    Nuclear Scheme         =       TREUTLER

    Blocking Scheme        =         OCTREE
    BS radius alpha        =              1
    Pruning alpha          =              1
    Radial Points          =             75
    Spherical Points       =            302
    Total Points           =          42359
    Total Blocks           =            375
    Max Points             =            253
    Max Functions          =             23
    Weights Tolerance      =       1.00E-15


  -Total Gradient:
     Atom            X                  Y                   Z
    ------   -----------------  -----------------  -----------------
       1        0.000000000000    -0.000000000000    -0.000390682954
       2        0.000000000000     0.000000000000     0.000390114461


*** tstop() called on Joses-MacBook-Pro-2.local at Wed Jul 16 18:17:35 2025
Module time:
	user time   =       0.48 seconds =       0.01 minutes
	system time =       1.21 seconds =       0.02 minutes
	total time  =          1 seconds =       0.02 minutes
Total time:
	user time   =      11.47 seconds =       0.19 minutes
	system time =      14.06 seconds =       0.23 minutes
	total time  =          3 seconds =       0.05 minutes

    			-----------------------------------------

    			 OPTKING 3.0: for geometry optimizations 

    			     By R.A. King, Bethel University     

    			        with contributions from          

    			    A.V. Copan, J. Cayton, A. Heide      

    			-----------------------------------------

    
	                            ===> Fragment 1 <== 

	 Z (Atomic Numbers)          Masses                          Geom                  
	       1.000000             1.007825          0.00000000  0.00000000  2.38035277   
	      17.000000            34.968853          0.00000000  0.00000000 -0.06860331   

	 - Coordinate -           - BOHR/RAD -       - ANG/DEG -
	 R(1,2)           =         2.448956           1.295932


	        --- Internal Coordinate Step in ANG or DEG, aJ/ANG or AJ/DEG ---
	-------------------------------------------------------------------------------
	           Coordinate      Previous         Force          Change          New 
	           ----------      --------        ------          ------        ------
	               R(1,2)       1.29593        0.00322        0.00049       1.29642
	-------------------------------------------------------------------------------

	                                 ==> Convergence Check <==                                  
    
	Measures of convergence in internal coordinates in au.
    
	Criteria marked as inactive (o), active & met (*), and active & unmet ( ).

	----------------------------------------------------------------------------------------------
	   Step    Total Energy     Delta E     Max Force     RMS Force      Max Disp      RMS Disp   
	----------------------------------------------------------------------------------------------
	  Convergence Criteria     1.00e-06 *    3.00e-04 *             o    1.20e-03 *             o
	----------------------------------------------------------------------------------------------
	     3    -460.82218122   -3.96e-06      3.90e-04      3.90e-04 o    9.31e-04 *    9.31e-04 o  ~
	----------------------------------------------------------------------------------------------

Next Geometry in Ang 
	Fragment 1 (Ang)

	    H   0.0000000000   0.0000000000   1.2598746989
	   Cl   0.0000000000   0.0000000000  -0.0365495698


    Structure for next step:
    Molecular point group: c2v
    Full point group: C_inf_v

    Geometry (in Angstrom), charge = 0, multiplicity = 1:

    H            0.000000000000     0.000000000000     1.260107162418
    CL           0.000000000000     0.000000000000    -0.036317106344


Scratch directory: /tmp/
gradient() will perform analytic gradient computation.
   => Libint2 <=

    Primary   basis highest AM E, G, H:  6, 6, 3
    Auxiliary basis highest AM E, G, H:  7, 7, 4
    Onebody   basis highest AM E, G, H:  -, -, -
    Solid Harmonics ordering:            Gaussian

*** tstart() called on Joses-MacBook-Pro-2.local
*** at Wed Jul 16 18:17:35 2025

   => Loading Basis Set <=

    Name: CC-PVDZ
    Role: ORBITAL
    Keyword: BASIS
    atoms 1 entry H          line    22 file /Users/joseantoniorodriguesromero/anaconda3/share/psi4/basis/cc-pvdz.gbs 
    atoms 2 entry CL         line   658 file /Users/joseantoniorodriguesromero/anaconda3/share/psi4/basis/cc-pvdz.gbs 


         ---------------------------------------------------------
                                   SCF
               by Justin Turney, Rob Parrish, Andy Simmonett
                          and Daniel G. A. Smith
                              UKS Reference
                        1 Threads,    500 MiB Core
         ---------------------------------------------------------

  ==> Geometry <==

    Molecular point group: c2v
    Full point group: C_inf_v

    Geometry (in Angstrom), charge = 0, multiplicity = 1:

       Center              X                  Y                   Z               Mass       
    ------------   -----------------  -----------------  -----------------  -----------------
         H            0.000000000000     0.000000000000     1.260107162418     1.007825032230
         CL           0.000000000000     0.000000000000    -0.036317106344    34.968852682000

  Running in c2v symmetry.

  Rotational constants: A = ************  B =     10.23898  C =     10.23898 [cm^-1]
  Rotational constants: A = ************  B = 306956.91809  C = 306956.91809 [MHz]
  Nuclear repulsion =    6.939096095435308

  Charge       = 0
  Multiplicity = 1
  Electrons    = 18
  Nalpha       = 9
  Nbeta        = 9

  ==> Algorithm <==

  SCF Algorithm Type is DF.
  DIIS enabled.
  MOM disabled.
  Fractional occupation disabled.
  Guess Type is READ.
  Energy threshold   = 1.00e-08
  Density threshold  = 1.00e-08
  Integral threshold = 1.00e-12

  ==> Primary Basis <==

  Basis Set: CC-PVDZ
    Blend: CC-PVDZ
    Number of shells: 11
    Number of basis functions: 23
    Number of Cartesian functions: 24
    Spherical Harmonics?: true
    Max angular momentum: 2

  ==> DFT Potential <==

   => LibXC <=

    Version 6.2.2
    S. Lehtola, C. Steigemann, M. J.T. Oliveira, and M. A.L. Marques.,  SoftwareX 7, 1–5 (2018) (10.1016/j.softx.2017.11.002)

   => Composite Functional: B3LYP <= 

    B3LYP Hyb-GGA Exchange-Correlation Functional

    P. J. Stephens, F. J. Devlin, C. F. Chabalowski, and M. J. Frisch.,  J. Phys. Chem. 98, 11623 (1994) (10.1021/j100096a001)

    Deriv               =              1
    GGA                 =           TRUE
    Meta                =          FALSE

    Exchange Hybrid     =           TRUE
    MP2 Hybrid          =          FALSE

   => Exchange Functionals <=

    0.0800   Slater exchange
    0.7200         Becke 88

   => Exact (HF) Exchange <=

    0.2000               HF 

   => Correlation Functionals <=

    0.1900   Vosko, Wilk & Nusair (VWN5_RPA)
    0.8100   Lee, Yang & Parr

   => LibXC Density Thresholds  <==

    XC_HYB_GGA_XC_B3LYP:  1.00E-15 

   => Molecular Quadrature <=

    Radial Scheme          =       TREUTLER
    Pruning Scheme         =           NONE
    Nuclear Scheme         =       TREUTLER

    Blocking Scheme        =         OCTREE
    BS radius alpha        =              1
    Pruning alpha          =              1
    Radial Points          =             75
    Spherical Points       =            302
    Total Points           =          42359
    Total Blocks           =            375
    Max Points             =            253
    Max Functions          =             23
    Weights Tolerance      =       1.00E-15

   => Loading Basis Set <=

    Name: (CC-PVDZ AUX)
    Role: JKFIT
    Keyword: DF_BASIS_SCF
    atoms 1 entry H          line    51 file /Users/joseantoniorodriguesromero/anaconda3/share/psi4/basis/cc-pvdz-jkfit.gbs 
    atoms 2 entry CL         line   667 file /Users/joseantoniorodriguesromero/anaconda3/share/psi4/basis/cc-pvdz-jkfit.gbs 

   => Loading Basis Set <=

    Name: CC-PVDZ
    Role: ORBITAL
    Keyword: BASIS
    atoms 1 entry H          line    22 file /Users/joseantoniorodriguesromero/anaconda3/share/psi4/basis/cc-pvdz.gbs 
    atoms 2 entry CL         line   658 file /Users/joseantoniorodriguesromero/anaconda3/share/psi4/basis/cc-pvdz.gbs 

  Reading orbitals from file /tmp/singlet_HCl.default.68151.180.npy, no projection.

  ==> Integral Setup <==

  DFHelper Memory: AOs need 0.001 GiB; user supplied 0.338 GiB. 
  Using in-core AOs.

  ==> MemDFJK: Density-Fitted J/K Matrices <==

    J tasked:                   Yes
    K tasked:                   Yes
    wK tasked:                   No
    OpenMP threads:               1
    Memory [MiB]:               345
    Algorithm:                 Core
    Schwarz Cutoff:           1E-12
    Mask sparsity (%):       0.0000
    Fitting Condition:        1E-10

   => Auxiliary Basis Set <=

  Basis Set: (CC-PVDZ AUX)
    Blend: CC-PVDZ-JKFIT
    Number of shells: 45
    Number of basis functions: 135
    Number of Cartesian functions: 155
    Spherical Harmonics?: true
    Max angular momentum: 3

  Cached 100.0% of DFT collocation blocks in 0.028 [GiB].

  Minimum eigenvalue in the overlap matrix is 4.6887412684E-02.
  Reciprocal condition number of the overlap matrix is 1.6115729559E-02.
    Using symmetric orthogonalization.

  ==> Pre-Iterations <==

  SCF Guess: Orbitals guess was supplied from a previous computation.

   -------------------------------------------------------
    Irrep   Nso     Nmo     Nalpha   Nbeta   Ndocc  Nsocc
   -------------------------------------------------------
     A1        12      12       5       5       5       0
     A2         1       1       0       0       0       0
     B1         5       5       2       2       2       0
     B2         5       5       2       2       2       0
   -------------------------------------------------------
    Total      23      23       9       9       9       0
   -------------------------------------------------------

  ==> Iterations <==

                           Total Energy        Delta E     RMS |[F,P]|

   @DF-UKS iter   0:  -460.82198260470085   -4.60822e+02   7.58239e-05 
   @DF-UKS iter   1:  -460.82218142587237   -1.98821e-04   1.14350e-05 DIIS
   @DF-UKS iter   2:  -460.82218143329203   -7.41966e-09   8.38235e-06 DIIS/DAMP=1%
   @DF-UKS iter   3:  -460.82217870820091    2.72509e-06   3.28195e-07 DIIS/DAMP=1%
   @DF-UKS iter   4:  -460.82218107494168   -2.36674e-06   1.78082e-07 DIIS/DAMP=1%
   @DF-UKS iter   5:  -460.82218155001885   -4.75077e-07   1.50136e-08 DIIS/DAMP=1%
   @DF-UKS iter   6:  -460.82218143313662    1.16882e-07   1.38531e-09 DIIS/DAMP=1%
   @DF-UKS iter   7:  -460.82218144186061   -8.72399e-09   1.07480e-10 DIIS/DAMP=1%
  Energy and wave function converged.


  ==> Post-Iterations <==

   Electrons on quadrature grid:
      Nalpha   =    8.9999999967 ; deviation = -3.338e-09
      Nbeta    =    8.9999999967 ; deviation = -3.338e-09
      Ntotal   =   17.9999999933 ; deviation = -6.676e-09 

   @Spin Contamination Metric:  -1.243449788E-14
   @S^2 Expected:                0.000000000E+00
   @S^2 Observed:               -1.243449788E-14
   @S   Expected:                0.000000000E+00
   @S   Observed:                0.000000000E+00

    Orbital Energies [Eh]
    ---------------------

    Alpha Occupied:                                                       

       1A1  -101.550404     2A1    -9.467394     3A1    -7.230290  
       1B2    -7.220152     1B1    -7.220152     4A1    -0.840375  
       5A1    -0.467237     2B2    -0.327023     2B1    -0.327023  

    Alpha Virtual:                                                        

       6A1     0.005553     7A1     0.317946     8A1     0.541846  
       3B2     0.544481     3B1     0.544481     4B1     0.644178  
       4B2     0.644178     9A1     0.735178     1A2     0.735178  
      10A1     0.747553    11A1     1.056113     5B2     1.430585  
       5B1     1.430585    12A1     2.083095  

    Beta Occupied:                                                        

       1A1  -101.550404     2A1    -9.467394     3A1    -7.230290  
       1B2    -7.220152     1B1    -7.220152     4A1    -0.840375  
       5A1    -0.467237     2B2    -0.327023     2B1    -0.327023  

    Beta Virtual:                                                         

       6A1     0.005553     7A1     0.317946     8A1     0.541846  
       3B2     0.544481     3B1     0.544481     4B1     0.644178  
       4B2     0.644178     9A1     0.735178     1A2     0.735178  
      10A1     0.747553    11A1     1.056113     5B2     1.430585  
       5B1     1.430585    12A1     2.083095  

    Final Occupation by Irrep:
             A1    A2    B1    B2 
    DOCC [     5,    0,    2,    2 ]
    SOCC [     0,    0,    0,    0 ]
    NA   [     5,    0,    2,    2 ]
    NB   [     5,    0,    2,    2 ]

  @DF-UKS Final Energy:  -460.82218144186061

   => Energetics <=

    Nuclear Repulsion Energy =              6.9390960954353078
    One-Electron Energy =                -649.8461547045194493
    Two-Electron Energy =                 205.1296841244452196
    DFT Exchange-Correlation Energy =     -23.0448069572215992
    Empirical Dispersion Energy =           0.0000000000000000
    VV10 Nonlocal Energy =                  0.0000000000000000
    Total Energy =                       -460.8221814418605504

  UHF NO Occupations:
  HONO-2 :    2 B1 2.0000000
  HONO-1 :    4 A1 2.0000000
  HONO-0 :    5 A1 2.0000000
  LUNO+0 :    6 A1 0.0000000
  LUNO+1 :    3 B1 0.0000000
  LUNO+2 :    4 B1 0.0000000
  LUNO+3 :    7 A1 0.0000000


Computation Completed


Properties will be evaluated at   0.000000,   0.000000,   0.000000 [a0]

Properties computed using the SCF density matrix


 Multipole Moments:

 ------------------------------------------------------------------------------------
     Multipole            Electronic (a.u.)      Nuclear  (a.u.)        Total (a.u.)
 ------------------------------------------------------------------------------------

 L = 1.  Multiply by 2.5417464519 to convert [e a0] to [Debye]
 Dipole X            :          0.0000000            0.0000000            0.0000000
 Dipole Y            :          0.0000000            0.0000000            0.0000000
 Dipole Z            :         -0.6883438            1.2145579            0.5262141
 Magnitude           :                                                    0.5262141

 ------------------------------------------------------------------------------------

*** tstop() called on Joses-MacBook-Pro-2.local at Wed Jul 16 18:17:35 2025
Module time:
	user time   =       2.72 seconds =       0.05 minutes
	system time =       2.32 seconds =       0.04 minutes
	total time  =          0 seconds =       0.00 minutes
Total time:
	user time   =      14.23 seconds =       0.24 minutes
	system time =      16.59 seconds =       0.28 minutes
	total time  =          3 seconds =       0.05 minutes

*** tstart() called on Joses-MacBook-Pro-2.local
*** at Wed Jul 16 18:17:35 2025


         ------------------------------------------------------------
                                   SCF GRAD                          
                          Rob Parrish, Justin Turney,                
                       Andy Simmonett, and Alex Sokolov              
         ------------------------------------------------------------

  ==> Geometry <==

    Molecular point group: c2v
    Full point group: C_inf_v

    Geometry (in Angstrom), charge = 0, multiplicity = 1:

       Center              X                  Y                   Z               Mass       
    ------------   -----------------  -----------------  -----------------  -----------------
         H            0.000000000000     0.000000000000     1.260107162418     1.007825032230
         CL           0.000000000000     0.000000000000    -0.036317106344    34.968852682000

  Nuclear repulsion =    6.939096095435308

  ==> Basis Set <==

  Basis Set: CC-PVDZ
    Blend: CC-PVDZ
    Number of shells: 11
    Number of basis functions: 23
    Number of Cartesian functions: 24
    Spherical Harmonics?: true
    Max angular momentum: 2

  ==> DFJKGrad: Density-Fitted SCF Gradients <==

    Gradient:                    1
    J tasked:                  Yes
    K tasked:                  Yes
    wK tasked:                  No
    OpenMP threads:              1
    Integrals threads:           1
    Memory [MiB]:              375
    Schwarz Cutoff:          1E-12
    Fitting Condition:       1E-10

   => Auxiliary Basis Set <=

  Basis Set: (CC-PVDZ AUX)
    Blend: CC-PVDZ-JKFIT
    Number of shells: 45
    Number of basis functions: 135
    Number of Cartesian functions: 155
    Spherical Harmonics?: true
    Max angular momentum: 3

  ==> DFT Potential <==

   => LibXC <=

    Version 6.2.2
    S. Lehtola, C. Steigemann, M. J.T. Oliveira, and M. A.L. Marques.,  SoftwareX 7, 1–5 (2018) (10.1016/j.softx.2017.11.002)

   => Composite Functional: B3LYP <= 

    B3LYP Hyb-GGA Exchange-Correlation Functional

    P. J. Stephens, F. J. Devlin, C. F. Chabalowski, and M. J. Frisch.,  J. Phys. Chem. 98, 11623 (1994) (10.1021/j100096a001)

    Deriv               =              1
    GGA                 =           TRUE
    Meta                =          FALSE

    Exchange Hybrid     =           TRUE
    MP2 Hybrid          =          FALSE

   => Exchange Functionals <=

    0.0800   Slater exchange
    0.7200         Becke 88

   => Exact (HF) Exchange <=

    0.2000               HF 

   => Correlation Functionals <=

    0.1900   Vosko, Wilk & Nusair (VWN5_RPA)
    0.8100   Lee, Yang & Parr

   => LibXC Density Thresholds  <==

    XC_HYB_GGA_XC_B3LYP:  1.00E-15 

   => Molecular Quadrature <=

    Radial Scheme          =       TREUTLER
    Pruning Scheme         =           NONE
    Nuclear Scheme         =       TREUTLER

    Blocking Scheme        =         OCTREE
    BS radius alpha        =              1
    Pruning alpha          =              1
    Radial Points          =             75
    Spherical Points       =            302
    Total Points           =          42359
    Total Blocks           =            375
    Max Points             =            253
    Max Functions          =             23
    Weights Tolerance      =       1.00E-15


  -Total Gradient:
     Atom            X                  Y                   Z
    ------   -----------------  -----------------  -----------------
       1       -0.000000000000    -0.000000000000    -0.000093650506
       2        0.000000000000     0.000000000000     0.000093081993


*** tstop() called on Joses-MacBook-Pro-2.local at Wed Jul 16 18:17:35 2025
Module time:
	user time   =       0.66 seconds =       0.01 minutes
	system time =       1.10 seconds =       0.02 minutes
	total time  =          0 seconds =       0.00 minutes
Total time:
	user time   =      14.90 seconds =       0.25 minutes
	system time =      17.69 seconds =       0.29 minutes
	total time  =          3 seconds =       0.05 minutes

    			-----------------------------------------

    			 OPTKING 3.0: for geometry optimizations 

    			     By R.A. King, Bethel University     

    			        with contributions from          

    			    A.V. Copan, J. Cayton, A. Heide      

    			-----------------------------------------

    
	                            ===> Fragment 1 <== 

	 Z (Atomic Numbers)          Masses                          Geom                  
	       1.000000             1.007825          0.00000000  0.00000000  2.38125743   
	      17.000000            34.968853          0.00000000  0.00000000 -0.06862938   

	 - Coordinate -           - BOHR/RAD -       - ANG/DEG -
	 R(1,2)           =         2.449887           1.296424


	        --- Internal Coordinate Step in ANG or DEG, aJ/ANG or AJ/DEG ---
	-------------------------------------------------------------------------------
	           Coordinate      Previous         Force          Change          New 
	           ----------      --------        ------          ------        ------
	               R(1,2)       1.29642        0.00077        0.00012       1.29654
	-------------------------------------------------------------------------------

	                                 ==> Convergence Check <==                                  
    
	Measures of convergence in internal coordinates in au.
    
	Criteria marked as inactive (o), active & met (*), and active & unmet ( ).

	----------------------------------------------------------------------------------------------
	   Step    Total Energy     Delta E     Max Force     RMS Force      Max Disp      RMS Disp   
	----------------------------------------------------------------------------------------------
	  Convergence Criteria     1.00e-06 *    3.00e-04 *             o    1.20e-03 *             o
	----------------------------------------------------------------------------------------------
	     4    -460.82218144   -2.26e-07 *    9.34e-05 *    9.34e-05 o    2.23e-04 *    2.23e-04 o  ~
	----------------------------------------------------------------------------------------------

Next Geometry in Ang 
	Fragment 1 (Ang)

	    H   0.0000000000   0.0000000000   1.2601661292
	   Cl   0.0000000000   0.0000000000  -0.0363760732


    Final optimized geometry and variables:
    Molecular point group: c2v
    Full point group: C_inf_v

    Geometry (in Angstrom), charge = 0, multiplicity = 1:

    H            0.000000000000     0.000000000000     1.260107162418
    CL           0.000000000000     0.000000000000    -0.036317106344


    Psi4 stopped on: Wednesday, 16 July 2025 06:17PM
    Psi4 wall time for execution: 0:00:03.74

*** Psi4 exiting successfully. Buy a developer a beer!
