
    -----------------------------------------------------------------------
          Psi4: An Open-Source Ab Initio Electronic Structure Package
                               Psi4 1.9.1 release

                         Git: Rev {} zzzzzzz 


    D. G. A. Smith, L. A. Burns, A. C. Simmonett, R. M. Parrish,
    M. C. Schieber, R. Galvelis, P. Kraus, H. Kruse, R. Di Remigio,
    A. Alenaizan, A. M. James, S. Lehtola, J. P. Misiewicz, M. Scheurer,
    R. A. Shaw, J. B. Schriber, Y. Xie, Z. L. Glick, D. A. Sirianni,
    J. S. O'Brien, J. M. Waldrop, A. Kumar, E. G. Hohenstein,
    B. P. Pritchard, B. R. Brooks, H. F. Schaefer III, A. Yu. Sokolov,
    K. Patkowski, A. E. DePrince III, U. Bozkaya, R. A. King,
    F. A. Evangelista, J. M. Turney, T. D. Crawford, C. D. Sherrill,
    J. Chem. Phys. 152(18) 184108 (2020). https://doi.org/10.1063/5.0006002

                            Additional Code Authors
    E. T. Seidl, C. L. Janssen, E. F. Valeev, M. L. Leininger,
    J. F. Gonthier, R. M. Richard, H. R. McAlexander, M. Saitow, X. Wang,
    P. Verma, M. H. Lechner, A. Jiang, S. Behnle, A. G. Heide,
    M. F. Herbst, and D. L. Poole

             Previous Authors, Complete List of Code Contributors,
                       and Citations for Specific Modules
    https://github.com/psi4/psi4/blob/master/codemeta.json
    https://github.com/psi4/psi4/graphs/contributors
    http://psicode.org/psi4manual/master/introduction.html#citing-psifour

    -----------------------------------------------------------------------


    Psi4 started on: Wednesday, 16 July 2025 06:59PM

    Process ID: 68766
    Host:       Joses-MacBook-Pro-2.local
    PSIDATADIR: /Users/joseantoniorodriguesromero/anaconda3/share/psi4
    Memory:     500.0 MiB
    Threads:    1
    
  ==> Input File <==

--------------------------------------------------------------------------
molecule { 
0 3
C   0.00000        0.60000        0.00000
O   0.00000       -0.60000        0.00000
}

set { 
basis              cc-pvdz
reference          uks
maxiter            500
geom_maxiter       500
DAMPING_PERCENTAGE 1
guess              SAP
}

optimize('b3lyp')
--------------------------------------------------------------------------

Scratch directory: /tmp/
gradient() will perform analytic gradient computation.
   => Libint2 <=

    Primary   basis highest AM E, G, H:  6, 6, 3
    Auxiliary basis highest AM E, G, H:  7, 7, 4
    Onebody   basis highest AM E, G, H:  -, -, -
    Solid Harmonics ordering:            Gaussian

*** tstart() called on Joses-MacBook-Pro-2.local
*** at Wed Jul 16 18:59:51 2025

   => Loading Basis Set <=

    Name: CC-PVDZ
    Role: ORBITAL
    Keyword: BASIS
    atoms 1 entry C          line   138 file /Users/joseantoniorodriguesromero/anaconda3/share/psi4/basis/cc-pvdz.gbs 
    atoms 2 entry O          line   198 file /Users/joseantoniorodriguesromero/anaconda3/share/psi4/basis/cc-pvdz.gbs 


         ---------------------------------------------------------
                                   SCF
               by Justin Turney, Rob Parrish, Andy Simmonett
                          and Daniel G. A. Smith
                              UKS Reference
                        1 Threads,    500 MiB Core
         ---------------------------------------------------------

  ==> Geometry <==

    Molecular point group: c2v
    Full point group: C_inf_v

    Geometry (in Angstrom), charge = 0, multiplicity = 3:

       Center              X                  Y                   Z               Mass       
    ------------   -----------------  -----------------  -----------------  -----------------
         C            0.000000000000     0.000000000000     0.685620863800    12.000000000000
         O            0.000000000000     0.000000000000    -0.514379136200    15.994914619570

  Running in c2v symmetry.

  Rotational constants: A = ************  B =      1.70746  C =      1.70746 [cm^-1]
  Rotational constants: A = ************  B =  51188.29714  C =  51188.29714 [MHz]
  Nuclear repulsion =   21.167088426800003

  Charge       = 0
  Multiplicity = 3
  Electrons    = 14
  Nalpha       = 8
  Nbeta        = 6

  ==> Algorithm <==

  SCF Algorithm Type is DF.
  DIIS enabled.
  MOM disabled.
  Fractional occupation disabled.
  Guess Type is SAP.
  Energy threshold   = 1.00e-08
  Density threshold  = 1.00e-08
  Integral threshold = 1.00e-12

  ==> Primary Basis <==

  Basis Set: CC-PVDZ
    Blend: CC-PVDZ
    Number of shells: 12
    Number of basis functions: 28
    Number of Cartesian functions: 30
    Spherical Harmonics?: true
    Max angular momentum: 2

  ==> DFT Potential <==

   => LibXC <=

    Version 6.2.2
    S. Lehtola, C. Steigemann, M. J.T. Oliveira, and M. A.L. Marques.,  SoftwareX 7, 1–5 (2018) (10.1016/j.softx.2017.11.002)

   => Composite Functional: B3LYP <= 

    B3LYP Hyb-GGA Exchange-Correlation Functional

    P. J. Stephens, F. J. Devlin, C. F. Chabalowski, and M. J. Frisch.,  J. Phys. Chem. 98, 11623 (1994) (10.1021/j100096a001)

    Deriv               =              1
    GGA                 =           TRUE
    Meta                =          FALSE

    Exchange Hybrid     =           TRUE
    MP2 Hybrid          =          FALSE

   => Exchange Functionals <=

    0.0800   Slater exchange
    0.7200         Becke 88

   => Exact (HF) Exchange <=

    0.2000               HF 

   => Correlation Functionals <=

    0.1900   Vosko, Wilk & Nusair (VWN5_RPA)
    0.8100   Lee, Yang & Parr

   => LibXC Density Thresholds  <==

    XC_HYB_GGA_XC_B3LYP:  1.00E-15 

   => Molecular Quadrature <=

    Radial Scheme          =       TREUTLER
    Pruning Scheme         =           NONE
    Nuclear Scheme         =       TREUTLER

    Blocking Scheme        =         OCTREE
    BS radius alpha        =              1
    Pruning alpha          =              1
    Radial Points          =             75
    Spherical Points       =            302
    Total Points           =          42745
    Total Blocks           =            382
    Max Points             =            256
    Max Functions          =             28
    Weights Tolerance      =       1.00E-15

   => Loading Basis Set <=

    Name: (CC-PVDZ AUX)
    Role: JKFIT
    Keyword: DF_BASIS_SCF
    atoms 1 entry C          line   121 file /Users/joseantoniorodriguesromero/anaconda3/share/psi4/basis/cc-pvdz-jkfit.gbs 
    atoms 2 entry O          line   221 file /Users/joseantoniorodriguesromero/anaconda3/share/psi4/basis/cc-pvdz-jkfit.gbs 

  ==> Integral Setup <==

  DFHelper Memory: AOs need 0.001 GiB; user supplied 0.332 GiB. 
  Using in-core AOs.

  ==> MemDFJK: Density-Fitted J/K Matrices <==

    J tasked:                   Yes
    K tasked:                   Yes
    wK tasked:                   No
    OpenMP threads:               1
    Memory [MiB]:               340
    Algorithm:                 Core
    Schwarz Cutoff:           1E-12
    Mask sparsity (%):       0.0000
    Fitting Condition:        1E-10

   => Auxiliary Basis Set <=

  Basis Set: (CC-PVDZ AUX)
    Blend: CC-PVDZ-JKFIT
    Number of shells: 48
    Number of basis functions: 140
    Number of Cartesian functions: 162
    Spherical Harmonics?: true
    Max angular momentum: 3

  Cached 100.0% of DFT collocation blocks in 0.034 [GiB].

  Minimum eigenvalue in the overlap matrix is 2.3746511758E-02.
  Reciprocal condition number of the overlap matrix is 7.9054171771E-03.
    Using symmetric orthogonalization.

  ==> Pre-Iterations <==

  SCF Guess: Superposition of Atomic Potentials (doi:10.1021/acs.jctc.8b01089).

  ==> SAP guess <==

   => Molecular Quadrature <=

    Radial Scheme          =       TREUTLER
    Pruning Scheme         =           NONE
    Nuclear Scheme         =       TREUTLER

    Blocking Scheme        =         OCTREE
    BS radius alpha        =              1
    Pruning alpha          =              1
    Radial Points          =             75
    Spherical Points       =            302
    Total Points           =          42745
    Total Blocks           =            382
    Max Points             =            256
    Max Functions          =             28
    Weights Tolerance      =       1.00E-15

   -------------------------------------------------------
    Irrep   Nso     Nmo     Nalpha   Nbeta   Ndocc  Nsocc
   -------------------------------------------------------
     A1        14      14       5       4       4       1
     A2         2       2       0       0       0       0
     B1         6       6       1       1       1       0
     B2         6       6       2       1       1       1
   -------------------------------------------------------
    Total      28      28       8       6       6       2
   -------------------------------------------------------

  ==> Iterations <==

                           Total Energy        Delta E     RMS |[F,P]|

   @DF-UKS iter   1:  -112.91243347989881   -1.12912e+02   4.10912e-02 DIIS/ADIIS
   @DF-UKS iter   2:  -111.89979707803874    1.01264e+00   9.82892e-02 DIIS/ADIIS/DAMP=1%
   @DF-UKS iter   3:  -113.02539338045652   -1.12560e+00   2.30646e-02 DIIS/ADIIS/DAMP=1%
   @DF-UKS iter   4:  -113.09487931105549   -6.94859e-02   2.13314e-03 DIIS/ADIIS/DAMP=1%
   @DF-UKS iter   5:  -113.10680577767030   -1.19265e-02   6.02837e-04 DIIS/ADIIS/DAMP=1%
   @DF-UKS iter   6:  -113.10587081875856    9.34959e-04   7.97503e-05 DIIS/DAMP=1%
   @DF-UKS iter   7:  -113.10594654448819   -7.57257e-05   5.44852e-05 DIIS/DAMP=1%
   @DF-UKS iter   8:  -113.10600463412354   -5.80896e-05   1.27099e-05 DIIS/DAMP=1%
   @DF-UKS iter   9:  -113.10598746418833    1.71699e-05   5.26473e-06 DIIS/DAMP=1%
   @DF-UKS iter  10:  -113.10598842181834   -9.57630e-07   4.18982e-07 DIIS/DAMP=1%
   @DF-UKS iter  11:  -113.10598981502494   -1.39321e-06   2.20499e-07 DIIS/DAMP=1%
   @DF-UKS iter  12:  -113.10598977804688    3.69781e-08   7.90823e-09 DIIS/DAMP=1%
   @DF-UKS iter  13:  -113.10598982775866   -4.97118e-08   4.37916e-09 DIIS/DAMP=1%
   @DF-UKS iter  14:  -113.10598982724579    5.12870e-10   7.79208e-11 DIIS/DAMP=1%
  Energy and wave function converged.


  ==> Post-Iterations <==

   Electrons on quadrature grid:
      Nalpha   =    7.9999999926 ; deviation = -7.408e-09
      Nbeta    =    6.0000000081 ; deviation = 8.070e-09
      Ntotal   =   14.0000000007 ; deviation = 6.624e-10 

   @Spin Contamination Metric:   9.296046830E-03
   @S^2 Expected:                2.000000000E+00
   @S^2 Observed:                2.009296047E+00
   @S   Expected:                1.000000000E+00
   @S   Observed:                1.000000000E+00

    Orbital Energies [Eh]
    ---------------------

    Alpha Occupied:                                                       

       1A1   -19.222089     2A1   -10.332982     3A1    -1.111299  
       4A1    -0.587857     1B2    -0.457803     5A1    -0.455757  
       1B1    -0.435018     2B2    -0.166960  

    Alpha Virtual:                                                        

       2B1    -0.069836     6A1     0.221528     3B2     0.426226  
       3B1     0.439149     7A1     0.473426     8A1     0.628520  
       9A1     0.837032     4B2     0.953304     4B1     0.961062  
       1A2     1.076016    10A1     1.079286     5B2     1.208526  
       5B1     1.209153    11A1     1.659225    12A1     1.842498  
       2A2     2.581603    13A1     2.582847     6B2     2.978423  
       6B1     2.978679    14A1     3.364215  

    Beta Occupied:                                                        

       1A1   -19.210671     2A1   -10.303026     3A1    -1.081216  
       4A1    -0.516346     1B1    -0.422713     1B2    -0.390066  

    Beta Virtual:                                                         

       5A1    -0.248445     2B1    -0.024083     2B2     0.010551  
       6A1     0.245925     3B1     0.465399     3B2     0.490426  
       7A1     0.566600     8A1     0.677599     9A1     0.860227  
       4B1     0.962504     4B2     0.984208     1A2     1.146278  
      10A1     1.146582     5B1     1.268528     5B2     1.298403  
      11A1     1.691449    12A1     1.903212    13A1     2.604441  
       2A2     2.604465     6B1     2.998377     6B2     3.026109  
      14A1     3.393265  

    Final Occupation by Irrep:
             A1    A2    B1    B2 
    DOCC [     4,    0,    1,    1 ]
    SOCC [     1,    0,    0,    1 ]
    NA   [     5,    0,    1,    2 ]
    NB   [     4,    0,    1,    1 ]

  @DF-UKS Final Energy:  -113.10598982724579

   => Energetics <=

    Nuclear Repulsion Energy =             21.1670884268000030
    One-Electron Energy =                -195.7810637497625521
    Two-Electron Energy =                  72.7330197059355470
    DFT Exchange-Correlation Energy =     -11.2250342102187908
    Empirical Dispersion Energy =           0.0000000000000000
    VV10 Nonlocal Energy =                  0.0000000000000000
    Total Energy =                       -113.1059898272457929

  UHF NO Occupations:
  HONO-2 :    1 B1 1.9967270
  HONO-1 :    2 B2 1.0000000
  HONO-0 :    5 A1 1.0000000
  LUNO+0 :    2 B1 0.0032730
  LUNO+1 :    3 B2 0.0009340
  LUNO+2 :    6 A1 0.0003940
  LUNO+3 :    7 A1 0.0000527


Computation Completed


Properties will be evaluated at   0.000000,   0.000000,   0.000000 [a0]

Properties computed using the SCF density matrix


 Multipole Moments:

 ------------------------------------------------------------------------------------
     Multipole            Electronic (a.u.)      Nuclear  (a.u.)        Total (a.u.)
 ------------------------------------------------------------------------------------

 L = 1.  Multiply by 2.5417464519 to convert [e a0] to [Debye]
 Dipole X            :          0.0000000            0.0000000            0.0000000
 Dipole Y            :          0.0000000            0.0000000            0.0000000
 Dipole Z            :          0.5123618           -0.0024716            0.5098902
 Magnitude           :                                                    0.5098902

 ------------------------------------------------------------------------------------

*** tstop() called on Joses-MacBook-Pro-2.local at Wed Jul 16 18:59:51 2025
Module time:
	user time   =       4.99 seconds =       0.08 minutes
	system time =       4.70 seconds =       0.08 minutes
	total time  =          0 seconds =       0.00 minutes
Total time:
	user time   =       4.99 seconds =       0.08 minutes
	system time =       4.70 seconds =       0.08 minutes
	total time  =          0 seconds =       0.00 minutes

*** tstart() called on Joses-MacBook-Pro-2.local
*** at Wed Jul 16 18:59:51 2025


         ------------------------------------------------------------
                                   SCF GRAD                          
                          Rob Parrish, Justin Turney,                
                       Andy Simmonett, and Alex Sokolov              
         ------------------------------------------------------------

  ==> Geometry <==

    Molecular point group: c2v
    Full point group: C_inf_v

    Geometry (in Angstrom), charge = 0, multiplicity = 3:

       Center              X                  Y                   Z               Mass       
    ------------   -----------------  -----------------  -----------------  -----------------
         C            0.000000000000     0.000000000000     0.685620863800    12.000000000000
         O            0.000000000000     0.000000000000    -0.514379136200    15.994914619570

  Nuclear repulsion =   21.167088426800003

  ==> Basis Set <==

  Basis Set: CC-PVDZ
    Blend: CC-PVDZ
    Number of shells: 12
    Number of basis functions: 28
    Number of Cartesian functions: 30
    Spherical Harmonics?: true
    Max angular momentum: 2

  ==> DFJKGrad: Density-Fitted SCF Gradients <==

    Gradient:                    1
    J tasked:                  Yes
    K tasked:                  Yes
    wK tasked:                  No
    OpenMP threads:              1
    Integrals threads:           1
    Memory [MiB]:              375
    Schwarz Cutoff:          1E-12
    Fitting Condition:       1E-10

   => Auxiliary Basis Set <=

  Basis Set: (CC-PVDZ AUX)
    Blend: CC-PVDZ-JKFIT
    Number of shells: 48
    Number of basis functions: 140
    Number of Cartesian functions: 162
    Spherical Harmonics?: true
    Max angular momentum: 3

  ==> DFT Potential <==

   => LibXC <=

    Version 6.2.2
    S. Lehtola, C. Steigemann, M. J.T. Oliveira, and M. A.L. Marques.,  SoftwareX 7, 1–5 (2018) (10.1016/j.softx.2017.11.002)

   => Composite Functional: B3LYP <= 

    B3LYP Hyb-GGA Exchange-Correlation Functional

    P. J. Stephens, F. J. Devlin, C. F. Chabalowski, and M. J. Frisch.,  J. Phys. Chem. 98, 11623 (1994) (10.1021/j100096a001)

    Deriv               =              1
    GGA                 =           TRUE
    Meta                =          FALSE

    Exchange Hybrid     =           TRUE
    MP2 Hybrid          =          FALSE

   => Exchange Functionals <=

    0.0800   Slater exchange
    0.7200         Becke 88

   => Exact (HF) Exchange <=

    0.2000               HF 

   => Correlation Functionals <=

    0.1900   Vosko, Wilk & Nusair (VWN5_RPA)
    0.8100   Lee, Yang & Parr

   => LibXC Density Thresholds  <==

    XC_HYB_GGA_XC_B3LYP:  1.00E-15 

   => Molecular Quadrature <=

    Radial Scheme          =       TREUTLER
    Pruning Scheme         =           NONE
    Nuclear Scheme         =       TREUTLER

    Blocking Scheme        =         OCTREE
    BS radius alpha        =              1
    Pruning alpha          =              1
    Radial Points          =             75
    Spherical Points       =            302
    Total Points           =          42745
    Total Blocks           =            382
    Max Points             =            256
    Max Functions          =             28
    Weights Tolerance      =       1.00E-15


  -Total Gradient:
     Atom            X                  Y                   Z
    ------   -----------------  -----------------  -----------------
       1        0.000000000000     0.000000000000    -0.021733339582
       2        0.000000000000    -0.000000000000     0.021739205960


*** tstop() called on Joses-MacBook-Pro-2.local at Wed Jul 16 18:59:52 2025
Module time:
	user time   =       0.48 seconds =       0.01 minutes
	system time =       1.29 seconds =       0.02 minutes
	total time  =          1 seconds =       0.02 minutes
Total time:
	user time   =       5.48 seconds =       0.09 minutes
	system time =       5.99 seconds =       0.10 minutes
	total time  =          1 seconds =       0.02 minutes

    			-----------------------------------------

    			 OPTKING 3.0: for geometry optimizations 

    			     By R.A. King, Bethel University     

    			        with contributions from          

    			    A.V. Copan, J. Cayton, A. Heide      

    			-----------------------------------------

    
	                            ===> Fragment 1 <== 

	 Z (Atomic Numbers)          Masses                          Geom                  
	       6.000000            12.000000          0.00000000  0.00000000  1.29563566   
	       8.000000            15.994915          0.00000000  0.00000000 -0.97203569   

	 - Coordinate -           - BOHR/RAD -       - ANG/DEG -
	 R(1,2)           =         2.267671           1.200000


	        --- Internal Coordinate Step in ANG or DEG, aJ/ANG or AJ/DEG ---
	-------------------------------------------------------------------------------
	           Coordinate      Previous         Force          Change          New 
	           ----------      --------        ------          ------        ------
	               R(1,2)       1.20000        0.17908        0.01097       1.21097
	-------------------------------------------------------------------------------

	                                 ==> Convergence Check <==                                  
    
	Measures of convergence in internal coordinates in au.
    
	Criteria marked as inactive (o), active & met (*), and active & unmet ( ).

	----------------------------------------------------------------------------------------------
	   Step    Total Energy     Delta E     Max Force     RMS Force      Max Disp      RMS Disp   
	----------------------------------------------------------------------------------------------
	  Convergence Criteria     1.00e-06 *    3.00e-04 *             o    1.20e-03 *             o
	----------------------------------------------------------------------------------------------
	     1    -113.10598983   -1.13e+02      2.17e-02      2.17e-02 o    2.07e-02      2.07e-02 o  ~
	----------------------------------------------------------------------------------------------

Next Geometry in Ang 
	Fragment 1 (Ang)

	    C   0.0000000000   0.0000000000   0.6911050568
	    O   0.0000000000   0.0000000000  -0.5198633292


    Structure for next step:
    Molecular point group: c2v
    Full point group: C_inf_v

    Geometry (in Angstrom), charge = 0, multiplicity = 3:

    C            0.000000000000     0.000000000000     0.691887659001
    O            0.000000000000     0.000000000000    -0.519080726936


Scratch directory: /tmp/
gradient() will perform analytic gradient computation.
   => Libint2 <=

    Primary   basis highest AM E, G, H:  6, 6, 3
    Auxiliary basis highest AM E, G, H:  7, 7, 4
    Onebody   basis highest AM E, G, H:  -, -, -
    Solid Harmonics ordering:            Gaussian

*** tstart() called on Joses-MacBook-Pro-2.local
*** at Wed Jul 16 18:59:52 2025

   => Loading Basis Set <=

    Name: CC-PVDZ
    Role: ORBITAL
    Keyword: BASIS
    atoms 1 entry C          line   138 file /Users/joseantoniorodriguesromero/anaconda3/share/psi4/basis/cc-pvdz.gbs 
    atoms 2 entry O          line   198 file /Users/joseantoniorodriguesromero/anaconda3/share/psi4/basis/cc-pvdz.gbs 


         ---------------------------------------------------------
                                   SCF
               by Justin Turney, Rob Parrish, Andy Simmonett
                          and Daniel G. A. Smith
                              UKS Reference
                        1 Threads,    500 MiB Core
         ---------------------------------------------------------

  ==> Geometry <==

    Molecular point group: c2v
    Full point group: C_inf_v

    Geometry (in Angstrom), charge = 0, multiplicity = 3:

       Center              X                  Y                   Z               Mass       
    ------------   -----------------  -----------------  -----------------  -----------------
         C            0.000000000000     0.000000000000     0.691887659001    12.000000000000
         O            0.000000000000     0.000000000000    -0.519080726936    15.994914619570

  Running in c2v symmetry.

  Rotational constants: A = ************  B =      1.67667  C =      1.67667 [cm^-1]
  Rotational constants: A = ************  B =  50265.21721  C =  50265.21721 [MHz]
  Nuclear repulsion =   20.975366828016725

  Charge       = 0
  Multiplicity = 3
  Electrons    = 14
  Nalpha       = 8
  Nbeta        = 6

  ==> Algorithm <==

  SCF Algorithm Type is DF.
  DIIS enabled.
  MOM disabled.
  Fractional occupation disabled.
  Guess Type is READ.
  Energy threshold   = 1.00e-08
  Density threshold  = 1.00e-08
  Integral threshold = 1.00e-12

  ==> Primary Basis <==

  Basis Set: CC-PVDZ
    Blend: CC-PVDZ
    Number of shells: 12
    Number of basis functions: 28
    Number of Cartesian functions: 30
    Spherical Harmonics?: true
    Max angular momentum: 2

  ==> DFT Potential <==

   => LibXC <=

    Version 6.2.2
    S. Lehtola, C. Steigemann, M. J.T. Oliveira, and M. A.L. Marques.,  SoftwareX 7, 1–5 (2018) (10.1016/j.softx.2017.11.002)

   => Composite Functional: B3LYP <= 

    B3LYP Hyb-GGA Exchange-Correlation Functional

    P. J. Stephens, F. J. Devlin, C. F. Chabalowski, and M. J. Frisch.,  J. Phys. Chem. 98, 11623 (1994) (10.1021/j100096a001)

    Deriv               =              1
    GGA                 =           TRUE
    Meta                =          FALSE

    Exchange Hybrid     =           TRUE
    MP2 Hybrid          =          FALSE

   => Exchange Functionals <=

    0.0800   Slater exchange
    0.7200         Becke 88

   => Exact (HF) Exchange <=

    0.2000               HF 

   => Correlation Functionals <=

    0.1900   Vosko, Wilk & Nusair (VWN5_RPA)
    0.8100   Lee, Yang & Parr

   => LibXC Density Thresholds  <==

    XC_HYB_GGA_XC_B3LYP:  1.00E-15 

   => Molecular Quadrature <=

    Radial Scheme          =       TREUTLER
    Pruning Scheme         =           NONE
    Nuclear Scheme         =       TREUTLER

    Blocking Scheme        =         OCTREE
    BS radius alpha        =              1
    Pruning alpha          =              1
    Radial Points          =             75
    Spherical Points       =            302
    Total Points           =          42750
    Total Blocks           =            384
    Max Points             =            255
    Max Functions          =             28
    Weights Tolerance      =       1.00E-15

   => Loading Basis Set <=

    Name: (CC-PVDZ AUX)
    Role: JKFIT
    Keyword: DF_BASIS_SCF
    atoms 1 entry C          line   121 file /Users/joseantoniorodriguesromero/anaconda3/share/psi4/basis/cc-pvdz-jkfit.gbs 
    atoms 2 entry O          line   221 file /Users/joseantoniorodriguesromero/anaconda3/share/psi4/basis/cc-pvdz-jkfit.gbs 

   => Loading Basis Set <=

    Name: CC-PVDZ
    Role: ORBITAL
    Keyword: BASIS
    atoms 1 entry C          line   138 file /Users/joseantoniorodriguesromero/anaconda3/share/psi4/basis/cc-pvdz.gbs 
    atoms 2 entry O          line   198 file /Users/joseantoniorodriguesromero/anaconda3/share/psi4/basis/cc-pvdz.gbs 

  Reading orbitals from file /tmp/triplet_CO.default.68766.180.npy, no projection.

  ==> Integral Setup <==

  DFHelper Memory: AOs need 0.001 GiB; user supplied 0.332 GiB. 
  Using in-core AOs.

  ==> MemDFJK: Density-Fitted J/K Matrices <==

    J tasked:                   Yes
    K tasked:                   Yes
    wK tasked:                   No
    OpenMP threads:               1
    Memory [MiB]:               340
    Algorithm:                 Core
    Schwarz Cutoff:           1E-12
    Mask sparsity (%):       0.0000
    Fitting Condition:        1E-10

   => Auxiliary Basis Set <=

  Basis Set: (CC-PVDZ AUX)
    Blend: CC-PVDZ-JKFIT
    Number of shells: 48
    Number of basis functions: 140
    Number of Cartesian functions: 162
    Spherical Harmonics?: true
    Max angular momentum: 3

  Cached 100.0% of DFT collocation blocks in 0.034 [GiB].

  Minimum eigenvalue in the overlap matrix is 2.4067812908E-02.
  Reciprocal condition number of the overlap matrix is 8.0330490085E-03.
    Using symmetric orthogonalization.

  ==> Pre-Iterations <==

  SCF Guess: Orbitals guess was supplied from a previous computation.

   -------------------------------------------------------
    Irrep   Nso     Nmo     Nalpha   Nbeta   Ndocc  Nsocc
   -------------------------------------------------------
     A1        14      14       5       4       4       1
     A2         2       2       0       0       0       0
     B1         6       6       1       1       1       0
     B2         6       6       2       1       1       1
   -------------------------------------------------------
    Total      28      28       8       6       6       2
   -------------------------------------------------------

  ==> Iterations <==

                           Total Energy        Delta E     RMS |[F,P]|

   @DF-UKS iter   0:  -113.09392094996025   -1.13094e+02   2.24217e-03 
   @DF-UKS iter   1:  -113.10619718746466   -1.22762e-02   6.61111e-04 DIIS/ADIIS
   @DF-UKS iter   2:  -113.10598639105194    2.10796e-04   1.57770e-03 DIIS/ADIIS/DAMP=1%
   @DF-UKS iter   3:  -113.10579578914945    1.90602e-04   1.45016e-04 DIIS/ADIIS/DAMP=1%
   @DF-UKS iter   4:  -113.10623964904869   -4.43860e-04   4.54435e-05 DIIS/DAMP=1%
   @DF-UKS iter   5:  -113.10624417317820   -4.52413e-06   6.74413e-06 DIIS/DAMP=1%
   @DF-UKS iter   6:  -113.10625136712993   -7.19395e-06   1.76138e-06 DIIS/DAMP=1%
   @DF-UKS iter   7:  -113.10625245709053   -1.08996e-06   7.95300e-07 DIIS/DAMP=1%
   @DF-UKS iter   8:  -113.10625153345212    9.23638e-07   2.23262e-07 DIIS/DAMP=1%
   @DF-UKS iter   9:  -113.10625175264258   -2.19190e-07   1.80068e-08 DIIS/DAMP=1%
   @DF-UKS iter  10:  -113.10625170091072    5.17319e-08   1.36146e-09 DIIS/DAMP=1%
   @DF-UKS iter  11:  -113.10625169744341    3.46731e-09   2.02761e-10 DIIS/DAMP=1%
  Energy and wave function converged.


  ==> Post-Iterations <==

   Electrons on quadrature grid:
      Nalpha   =    7.9999999574 ; deviation = -4.256e-08
      Nbeta    =    5.9999999753 ; deviation = -2.472e-08
      Ntotal   =   13.9999999327 ; deviation = -6.728e-08 

   @Spin Contamination Metric:   9.564522382E-03
   @S^2 Expected:                2.000000000E+00
   @S^2 Observed:                2.009564522E+00
   @S   Expected:                1.000000000E+00
   @S   Observed:                1.000000000E+00

    Orbital Energies [Eh]
    ---------------------

    Alpha Occupied:                                                       

       1A1   -19.223403     2A1   -10.334898     3A1    -1.106213  
       4A1    -0.589428     5A1    -0.455156     1B2    -0.454997  
       1B1    -0.431999     2B2    -0.170550  

    Alpha Virtual:                                                        

       2B1    -0.073338     6A1     0.219090     3B2     0.426658  
       3B1     0.439683     7A1     0.472709     8A1     0.615087  
       9A1     0.838670     4B2     0.952814     4B1     0.960622  
       1A2     1.076461    10A1     1.079763     5B2     1.203749  
       5B1     1.204294    11A1     1.658640    12A1     1.826333  
       2A2     2.580144    13A1     2.581374     6B2     2.967614  
       6B1     2.967863    14A1     3.347705  

    Beta Occupied:                                                        

       1A1   -19.211926     2A1   -10.304989     3A1    -1.075828  
       4A1    -0.516463     1B1    -0.419903     1B2    -0.387384  

    Beta Virtual:                                                         

       5A1    -0.249293     2B1    -0.027721     2B2     0.007041  
       6A1     0.244227     3B1     0.465846     3B2     0.490949  
       7A1     0.566154     8A1     0.662512     9A1     0.862190  
       4B1     0.962012     4B2     0.983699     1A2     1.146905  
      10A1     1.147192     5B1     1.263324     5B2     1.293093  
      11A1     1.691680    12A1     1.886497    13A1     2.602627  
       2A2     2.602657     6B1     2.987807     6B2     3.015415  
      14A1     3.377232  

    Final Occupation by Irrep:
             A1    A2    B1    B2 
    DOCC [     4,    0,    1,    1 ]
    SOCC [     1,    0,    0,    1 ]
    NA   [     5,    0,    1,    2 ]
    NB   [     4,    0,    1,    1 ]

  @DF-UKS Final Energy:  -113.10625169744341

   => Energetics <=

    Nuclear Repulsion Energy =             20.9753668280167247
    One-Electron Energy =                -195.4139315693011554
    Two-Electron Energy =                  72.5497895407288951
    DFT Exchange-Correlation Energy =     -11.2174764968878762
    Empirical Dispersion Energy =           0.0000000000000000
    VV10 Nonlocal Energy =                  0.0000000000000000
    Total Energy =                       -113.1062516974434118

  UHF NO Occupations:
  HONO-2 :    1 B1 1.9966279
  HONO-1 :    2 B2 1.0000000
  HONO-0 :    5 A1 1.0000000
  LUNO+0 :    2 B1 0.0033721
  LUNO+1 :    3 B2 0.0009399
  LUNO+2 :    6 A1 0.0004224
  LUNO+3 :    7 A1 0.0000538


Computation Completed


Properties will be evaluated at   0.000000,   0.000000,   0.000000 [a0]

Properties computed using the SCF density matrix


 Multipole Moments:

 ------------------------------------------------------------------------------------
     Multipole            Electronic (a.u.)      Nuclear  (a.u.)        Total (a.u.)
 ------------------------------------------------------------------------------------

 L = 1.  Multiply by 2.5417464519 to convert [e a0] to [Debye]
 Dipole X            :          0.0000000            0.0000000            0.0000000
 Dipole Y            :          0.0000000            0.0000000            0.0000000
 Dipole Z            :          0.5174316           -0.0024942            0.5149375
 Magnitude           :                                                    0.5149375

 ------------------------------------------------------------------------------------

*** tstop() called on Joses-MacBook-Pro-2.local at Wed Jul 16 18:59:52 2025
Module time:
	user time   =       4.32 seconds =       0.07 minutes
	system time =       2.90 seconds =       0.05 minutes
	total time  =          0 seconds =       0.00 minutes
Total time:
	user time   =       9.84 seconds =       0.16 minutes
	system time =       9.14 seconds =       0.15 minutes
	total time  =          1 seconds =       0.02 minutes

*** tstart() called on Joses-MacBook-Pro-2.local
*** at Wed Jul 16 18:59:52 2025


         ------------------------------------------------------------
                                   SCF GRAD                          
                          Rob Parrish, Justin Turney,                
                       Andy Simmonett, and Alex Sokolov              
         ------------------------------------------------------------

  ==> Geometry <==

    Molecular point group: c2v
    Full point group: C_inf_v

    Geometry (in Angstrom), charge = 0, multiplicity = 3:

       Center              X                  Y                   Z               Mass       
    ------------   -----------------  -----------------  -----------------  -----------------
         C            0.000000000000     0.000000000000     0.691887659001    12.000000000000
         O            0.000000000000     0.000000000000    -0.519080726936    15.994914619570

  Nuclear repulsion =   20.975366828016725

  ==> Basis Set <==

  Basis Set: CC-PVDZ
    Blend: CC-PVDZ
    Number of shells: 12
    Number of basis functions: 28
    Number of Cartesian functions: 30
    Spherical Harmonics?: true
    Max angular momentum: 2

  ==> DFJKGrad: Density-Fitted SCF Gradients <==

    Gradient:                    1
    J tasked:                  Yes
    K tasked:                  Yes
    wK tasked:                  No
    OpenMP threads:              1
    Integrals threads:           1
    Memory [MiB]:              375
    Schwarz Cutoff:          1E-12
    Fitting Condition:       1E-10

   => Auxiliary Basis Set <=

  Basis Set: (CC-PVDZ AUX)
    Blend: CC-PVDZ-JKFIT
    Number of shells: 48
    Number of basis functions: 140
    Number of Cartesian functions: 162
    Spherical Harmonics?: true
    Max angular momentum: 3

  ==> DFT Potential <==

   => LibXC <=

    Version 6.2.2
    S. Lehtola, C. Steigemann, M. J.T. Oliveira, and M. A.L. Marques.,  SoftwareX 7, 1–5 (2018) (10.1016/j.softx.2017.11.002)

   => Composite Functional: B3LYP <= 

    B3LYP Hyb-GGA Exchange-Correlation Functional

    P. J. Stephens, F. J. Devlin, C. F. Chabalowski, and M. J. Frisch.,  J. Phys. Chem. 98, 11623 (1994) (10.1021/j100096a001)

    Deriv               =              1
    GGA                 =           TRUE
    Meta                =          FALSE

    Exchange Hybrid     =           TRUE
    MP2 Hybrid          =          FALSE

   => Exchange Functionals <=

    0.0800   Slater exchange
    0.7200         Becke 88

   => Exact (HF) Exchange <=

    0.2000               HF 

   => Correlation Functionals <=

    0.1900   Vosko, Wilk & Nusair (VWN5_RPA)
    0.8100   Lee, Yang & Parr

   => LibXC Density Thresholds  <==

    XC_HYB_GGA_XC_B3LYP:  1.00E-15 

   => Molecular Quadrature <=

    Radial Scheme          =       TREUTLER
    Pruning Scheme         =           NONE
    Nuclear Scheme         =       TREUTLER

    Blocking Scheme        =         OCTREE
    BS radius alpha        =              1
    Pruning alpha          =              1
    Radial Points          =             75
    Spherical Points       =            302
    Total Points           =          42750
    Total Blocks           =            384
    Max Points             =            255
    Max Functions          =             28
    Weights Tolerance      =       1.00E-15


  -Total Gradient:
     Atom            X                  Y                   Z
    ------   -----------------  -----------------  -----------------
       1        0.000000000000     0.000000000000    -0.003774142365
       2        0.000000000000    -0.000000000000     0.003779552096


*** tstop() called on Joses-MacBook-Pro-2.local at Wed Jul 16 18:59:52 2025
Module time:
	user time   =       0.45 seconds =       0.01 minutes
	system time =       1.09 seconds =       0.02 minutes
	total time  =          0 seconds =       0.00 minutes
Total time:
	user time   =      10.29 seconds =       0.17 minutes
	system time =      10.24 seconds =       0.17 minutes
	total time  =          1 seconds =       0.02 minutes

    			-----------------------------------------

    			 OPTKING 3.0: for geometry optimizations 

    			     By R.A. King, Bethel University     

    			        with contributions from          

    			    A.V. Copan, J. Cayton, A. Heide      

    			-----------------------------------------

    
	                            ===> Fragment 1 <== 

	 Z (Atomic Numbers)          Masses                          Geom                  
	       6.000000            12.000000          0.00000000  0.00000000  1.30747819   
	       8.000000            15.994915          0.00000000  0.00000000 -0.98092041   

	 - Coordinate -           - BOHR/RAD -       - ANG/DEG -
	 R(1,2)           =         2.288399           1.210968


	        --- Internal Coordinate Step in ANG or DEG, aJ/ANG or AJ/DEG ---
	-------------------------------------------------------------------------------
	           Coordinate      Previous         Force          Change          New 
	           ----------      --------        ------          ------        ------
	               R(1,2)       1.21097        0.03112        0.00231       1.21327
	-------------------------------------------------------------------------------

	                                 ==> Convergence Check <==                                  
    
	Measures of convergence in internal coordinates in au.
    
	Criteria marked as inactive (o), active & met (*), and active & unmet ( ).

	----------------------------------------------------------------------------------------------
	   Step    Total Energy     Delta E     Max Force     RMS Force      Max Disp      RMS Disp   
	----------------------------------------------------------------------------------------------
	  Convergence Criteria     1.00e-06 *    3.00e-04 *             o    1.20e-03 *             o
	----------------------------------------------------------------------------------------------
	     2    -113.10625170   -2.62e-04      3.78e-03      3.78e-03 o    4.36e-03      4.36e-03 o  ~
	----------------------------------------------------------------------------------------------

Next Geometry in Ang 
	Fragment 1 (Ang)

	    C   0.0000000000   0.0000000000   0.6930409568
	    O   0.0000000000   0.0000000000  -0.5202340247


    Structure for next step:
    Molecular point group: c2v
    Full point group: C_inf_v

    Geometry (in Angstrom), charge = 0, multiplicity = 3:

    C            0.000000000000     0.000000000000     0.693205534027
    O            0.000000000000     0.000000000000    -0.520069447457


Scratch directory: /tmp/
gradient() will perform analytic gradient computation.
   => Libint2 <=

    Primary   basis highest AM E, G, H:  6, 6, 3
    Auxiliary basis highest AM E, G, H:  7, 7, 4
    Onebody   basis highest AM E, G, H:  -, -, -
    Solid Harmonics ordering:            Gaussian

*** tstart() called on Joses-MacBook-Pro-2.local
*** at Wed Jul 16 18:59:53 2025

   => Loading Basis Set <=

    Name: CC-PVDZ
    Role: ORBITAL
    Keyword: BASIS
    atoms 1 entry C          line   138 file /Users/joseantoniorodriguesromero/anaconda3/share/psi4/basis/cc-pvdz.gbs 
    atoms 2 entry O          line   198 file /Users/joseantoniorodriguesromero/anaconda3/share/psi4/basis/cc-pvdz.gbs 


         ---------------------------------------------------------
                                   SCF
               by Justin Turney, Rob Parrish, Andy Simmonett
                          and Daniel G. A. Smith
                              UKS Reference
                        1 Threads,    500 MiB Core
         ---------------------------------------------------------

  ==> Geometry <==

    Molecular point group: c2v
    Full point group: C_inf_v

    Geometry (in Angstrom), charge = 0, multiplicity = 3:

       Center              X                  Y                   Z               Mass       
    ------------   -----------------  -----------------  -----------------  -----------------
         C            0.000000000000     0.000000000000     0.693205534027    12.000000000000
         O            0.000000000000     0.000000000000    -0.520069447457    15.994914619570

  Running in c2v symmetry.

  Rotational constants: A = ************  B =      1.67030  C =      1.67030 [cm^-1]
  Rotational constants: A = ************  B =  50074.27728  C =  50074.27728 [MHz]
  Nuclear repulsion =   20.935489892888942

  Charge       = 0
  Multiplicity = 3
  Electrons    = 14
  Nalpha       = 8
  Nbeta        = 6

  ==> Algorithm <==

  SCF Algorithm Type is DF.
  DIIS enabled.
  MOM disabled.
  Fractional occupation disabled.
  Guess Type is READ.
  Energy threshold   = 1.00e-08
  Density threshold  = 1.00e-08
  Integral threshold = 1.00e-12

  ==> Primary Basis <==

  Basis Set: CC-PVDZ
    Blend: CC-PVDZ
    Number of shells: 12
    Number of basis functions: 28
    Number of Cartesian functions: 30
    Spherical Harmonics?: true
    Max angular momentum: 2

  ==> DFT Potential <==

   => LibXC <=

    Version 6.2.2
    S. Lehtola, C. Steigemann, M. J.T. Oliveira, and M. A.L. Marques.,  SoftwareX 7, 1–5 (2018) (10.1016/j.softx.2017.11.002)

   => Composite Functional: B3LYP <= 

    B3LYP Hyb-GGA Exchange-Correlation Functional

    P. J. Stephens, F. J. Devlin, C. F. Chabalowski, and M. J. Frisch.,  J. Phys. Chem. 98, 11623 (1994) (10.1021/j100096a001)

    Deriv               =              1
    GGA                 =           TRUE
    Meta                =          FALSE

    Exchange Hybrid     =           TRUE
    MP2 Hybrid          =          FALSE

   => Exchange Functionals <=

    0.0800   Slater exchange
    0.7200         Becke 88

   => Exact (HF) Exchange <=

    0.2000               HF 

   => Correlation Functionals <=

    0.1900   Vosko, Wilk & Nusair (VWN5_RPA)
    0.8100   Lee, Yang & Parr

   => LibXC Density Thresholds  <==

    XC_HYB_GGA_XC_B3LYP:  1.00E-15 

   => Molecular Quadrature <=

    Radial Scheme          =       TREUTLER
    Pruning Scheme         =           NONE
    Nuclear Scheme         =       TREUTLER

    Blocking Scheme        =         OCTREE
    BS radius alpha        =              1
    Pruning alpha          =              1
    Radial Points          =             75
    Spherical Points       =            302
    Total Points           =          42750
    Total Blocks           =            383
    Max Points             =            255
    Max Functions          =             28
    Weights Tolerance      =       1.00E-15

   => Loading Basis Set <=

    Name: (CC-PVDZ AUX)
    Role: JKFIT
    Keyword: DF_BASIS_SCF
    atoms 1 entry C          line   121 file /Users/joseantoniorodriguesromero/anaconda3/share/psi4/basis/cc-pvdz-jkfit.gbs 
    atoms 2 entry O          line   221 file /Users/joseantoniorodriguesromero/anaconda3/share/psi4/basis/cc-pvdz-jkfit.gbs 

   => Loading Basis Set <=

    Name: CC-PVDZ
    Role: ORBITAL
    Keyword: BASIS
    atoms 1 entry C          line   138 file /Users/joseantoniorodriguesromero/anaconda3/share/psi4/basis/cc-pvdz.gbs 
    atoms 2 entry O          line   198 file /Users/joseantoniorodriguesromero/anaconda3/share/psi4/basis/cc-pvdz.gbs 

  Reading orbitals from file /tmp/triplet_CO.default.68766.180.npy, no projection.

  ==> Integral Setup <==

  DFHelper Memory: AOs need 0.001 GiB; user supplied 0.332 GiB. 
  Using in-core AOs.

  ==> MemDFJK: Density-Fitted J/K Matrices <==

    J tasked:                   Yes
    K tasked:                   Yes
    wK tasked:                   No
    OpenMP threads:               1
    Memory [MiB]:               340
    Algorithm:                 Core
    Schwarz Cutoff:           1E-12
    Mask sparsity (%):       0.0000
    Fitting Condition:        1E-10

   => Auxiliary Basis Set <=

  Basis Set: (CC-PVDZ AUX)
    Blend: CC-PVDZ-JKFIT
    Number of shells: 48
    Number of basis functions: 140
    Number of Cartesian functions: 162
    Spherical Harmonics?: true
    Max angular momentum: 3

  Cached 100.0% of DFT collocation blocks in 0.034 [GiB].

  Minimum eigenvalue in the overlap matrix is 2.4135959041E-02.
  Reciprocal condition number of the overlap matrix is 8.0602013821E-03.
    Using symmetric orthogonalization.

  ==> Pre-Iterations <==

  SCF Guess: Orbitals guess was supplied from a previous computation.

   -------------------------------------------------------
    Irrep   Nso     Nmo     Nalpha   Nbeta   Ndocc  Nsocc
   -------------------------------------------------------
     A1        14      14       5       4       4       1
     A2         2       2       0       0       0       0
     B1         6       6       1       1       1       0
     B2         6       6       2       1       1       1
   -------------------------------------------------------
    Total      28      28       8       6       6       2
   -------------------------------------------------------

  ==> Iterations <==

                           Total Energy        Delta E     RMS |[F,P]|

   @DF-UKS iter   0:  -113.10368416012032   -1.13104e+02   4.64718e-04 
   @DF-UKS iter   1:  -113.10625789372325   -2.57373e-03   1.37828e-04 DIIS/ADIIS
   @DF-UKS iter   2:  -113.10624880333452    9.09039e-06   3.27909e-04 DIIS/ADIIS/DAMP=1%
   @DF-UKS iter   3:  -113.10616671904454    8.20843e-05   2.89313e-05 DIIS/DAMP=1%
   @DF-UKS iter   4:  -113.10625708867413   -9.03696e-05   9.72224e-06 DIIS/DAMP=1%
   @DF-UKS iter   5:  -113.10625866111087   -1.57244e-06   1.43993e-06 DIIS/DAMP=1%
   @DF-UKS iter   6:  -113.10626020161037   -1.54050e-06   3.72552e-07 DIIS/DAMP=1%
   @DF-UKS iter   7:  -113.10626042983611   -2.28226e-07   1.70782e-07 DIIS/DAMP=1%
   @DF-UKS iter   8:  -113.10626023546618    1.94370e-07   4.64891e-08 DIIS/DAMP=1%
   @DF-UKS iter   9:  -113.10626028150318   -4.60370e-08   3.62441e-09 DIIS/DAMP=1%
   @DF-UKS iter  10:  -113.10626027064222    1.08610e-08   3.42854e-10 DIIS/DAMP=1%
   @DF-UKS iter  11:  -113.10626026999205    6.50175e-10   4.50358e-11 DIIS/DAMP=1%
  Energy and wave function converged.


  ==> Post-Iterations <==

   Electrons on quadrature grid:
      Nalpha   =    7.9999999505 ; deviation = -4.954e-08
      Nbeta    =    5.9999999688 ; deviation = -3.116e-08
      Ntotal   =   13.9999999193 ; deviation = -8.071e-08 

   @Spin Contamination Metric:   9.621297621E-03
   @S^2 Expected:                2.000000000E+00
   @S^2 Observed:                2.009621298E+00
   @S   Expected:                1.000000000E+00
   @S   Observed:                1.000000000E+00

    Orbital Energies [Eh]
    ---------------------

    Alpha Occupied:                                                       

       1A1   -19.223676     2A1   -10.335299     3A1    -1.105156  
       4A1    -0.589756     5A1    -0.455031     1B2    -0.454415  
       1B1    -0.431374     2B2    -0.171296  

    Alpha Virtual:                                                        

       2B1    -0.074066     6A1     0.218552     3B2     0.426746  
       3B1     0.439793     7A1     0.472535     8A1     0.612356  
       9A1     0.839017     4B2     0.952696     4B1     0.960514  
       1A2     1.076553    10A1     1.079861     5B2     1.202779  
       5B1     1.203307    11A1     1.658515    12A1     1.823003  
       2A2     2.579847    13A1     2.581074     6B2     2.965350  
       6B1     2.965598    14A1     3.344247  

    Beta Occupied:                                                        

       1A1   -19.212186     2A1   -10.305401     3A1    -1.074706  
       4A1    -0.516489     1B1    -0.419322     1B2    -0.386831  

    Beta Virtual:                                                         

       5A1    -0.249470     2B1    -0.028478     2B2     0.006310  
       6A1     0.243852     3B1     0.465937     3B2     0.491057  
       7A1     0.566047     8A1     0.659420     9A1     0.862608  
       4B1     0.961897     4B2     0.983580     1A2     1.147032  
      10A1     1.147317     5B1     1.262261     5B2     1.292008  
      11A1     1.691736    12A1     1.883040    13A1     2.602256  
       2A2     2.602287     6B1     2.985595     6B2     3.013176  
      14A1     3.373877  

    Final Occupation by Irrep:
             A1    A2    B1    B2 
    DOCC [     4,    0,    1,    1 ]
    SOCC [     1,    0,    0,    1 ]
    NA   [     5,    0,    1,    2 ]
    NB   [     4,    0,    1,    1 ]

  @DF-UKS Final Energy:  -113.10626026999205

   => Energetics <=

    Nuclear Repulsion Energy =             20.9354898928889419
    One-Electron Energy =                -195.3374530405099563
    Two-Electron Energy =                  72.5116153549554241
    DFT Exchange-Correlation Energy =     -11.2159124773264569
    Empirical Dispersion Energy =           0.0000000000000000
    VV10 Nonlocal Energy =                  0.0000000000000000
    Total Energy =                       -113.1062602699920490

  UHF NO Occupations:
  HONO-2 :    1 B1 1.9966070
  HONO-1 :    2 B2 1.0000000
  HONO-0 :    5 A1 1.0000000
  LUNO+0 :    2 B1 0.0033930
  LUNO+1 :    3 B2 0.0009411
  LUNO+2 :    6 A1 0.0004287
  LUNO+3 :    7 A1 0.0000541


Computation Completed


Properties will be evaluated at   0.000000,   0.000000,   0.000000 [a0]

Properties computed using the SCF density matrix


 Multipole Moments:

 ------------------------------------------------------------------------------------
     Multipole            Electronic (a.u.)      Nuclear  (a.u.)        Total (a.u.)
 ------------------------------------------------------------------------------------

 L = 1.  Multiply by 2.5417464519 to convert [e a0] to [Debye]
 Dipole X            :          0.0000000            0.0000000            0.0000000
 Dipole Y            :          0.0000000            0.0000000            0.0000000
 Dipole Z            :          0.5184574           -0.0024989            0.5159585
 Magnitude           :                                                    0.5159585

 ------------------------------------------------------------------------------------

*** tstop() called on Joses-MacBook-Pro-2.local at Wed Jul 16 18:59:53 2025
Module time:
	user time   =       3.79 seconds =       0.06 minutes
	system time =       3.41 seconds =       0.06 minutes
	total time  =          0 seconds =       0.00 minutes
Total time:
	user time   =      14.12 seconds =       0.24 minutes
	system time =      13.93 seconds =       0.23 minutes
	total time  =          2 seconds =       0.03 minutes

*** tstart() called on Joses-MacBook-Pro-2.local
*** at Wed Jul 16 18:59:53 2025


         ------------------------------------------------------------
                                   SCF GRAD                          
                          Rob Parrish, Justin Turney,                
                       Andy Simmonett, and Alex Sokolov              
         ------------------------------------------------------------

  ==> Geometry <==

    Molecular point group: c2v
    Full point group: C_inf_v

    Geometry (in Angstrom), charge = 0, multiplicity = 3:

       Center              X                  Y                   Z               Mass       
    ------------   -----------------  -----------------  -----------------  -----------------
         C            0.000000000000     0.000000000000     0.693205534027    12.000000000000
         O            0.000000000000     0.000000000000    -0.520069447457    15.994914619570

  Nuclear repulsion =   20.935489892888942

  ==> Basis Set <==

  Basis Set: CC-PVDZ
    Blend: CC-PVDZ
    Number of shells: 12
    Number of basis functions: 28
    Number of Cartesian functions: 30
    Spherical Harmonics?: true
    Max angular momentum: 2

  ==> DFJKGrad: Density-Fitted SCF Gradients <==

    Gradient:                    1
    J tasked:                  Yes
    K tasked:                  Yes
    wK tasked:                  No
    OpenMP threads:              1
    Integrals threads:           1
    Memory [MiB]:              375
    Schwarz Cutoff:          1E-12
    Fitting Condition:       1E-10

   => Auxiliary Basis Set <=

  Basis Set: (CC-PVDZ AUX)
    Blend: CC-PVDZ-JKFIT
    Number of shells: 48
    Number of basis functions: 140
    Number of Cartesian functions: 162
    Spherical Harmonics?: true
    Max angular momentum: 3

  ==> DFT Potential <==

   => LibXC <=

    Version 6.2.2
    S. Lehtola, C. Steigemann, M. J.T. Oliveira, and M. A.L. Marques.,  SoftwareX 7, 1–5 (2018) (10.1016/j.softx.2017.11.002)

   => Composite Functional: B3LYP <= 

    B3LYP Hyb-GGA Exchange-Correlation Functional

    P. J. Stephens, F. J. Devlin, C. F. Chabalowski, and M. J. Frisch.,  J. Phys. Chem. 98, 11623 (1994) (10.1021/j100096a001)

    Deriv               =              1
    GGA                 =           TRUE
    Meta                =          FALSE

    Exchange Hybrid     =           TRUE
    MP2 Hybrid          =          FALSE

   => Exchange Functionals <=

    0.0800   Slater exchange
    0.7200         Becke 88

   => Exact (HF) Exchange <=

    0.2000               HF 

   => Correlation Functionals <=

    0.1900   Vosko, Wilk & Nusair (VWN5_RPA)
    0.8100   Lee, Yang & Parr

   => LibXC Density Thresholds  <==

    XC_HYB_GGA_XC_B3LYP:  1.00E-15 

   => Molecular Quadrature <=

    Radial Scheme          =       TREUTLER
    Pruning Scheme         =           NONE
    Nuclear Scheme         =       TREUTLER

    Blocking Scheme        =         OCTREE
    BS radius alpha        =              1
    Pruning alpha          =              1
    Radial Points          =             75
    Spherical Points       =            302
    Total Points           =          42750
    Total Blocks           =            383
    Max Points             =            255
    Max Functions          =             28
    Weights Tolerance      =       1.00E-15


  -Total Gradient:
     Atom            X                  Y                   Z
    ------   -----------------  -----------------  -----------------
       1        0.000000000000    -0.000000000000    -0.000173570956
       2        0.000000000000    -0.000000000000     0.000178864933


*** tstop() called on Joses-MacBook-Pro-2.local at Wed Jul 16 18:59:53 2025
Module time:
	user time   =       0.58 seconds =       0.01 minutes
	system time =       1.12 seconds =       0.02 minutes
	total time  =          0 seconds =       0.00 minutes
Total time:
	user time   =      14.70 seconds =       0.25 minutes
	system time =      15.05 seconds =       0.25 minutes
	total time  =          2 seconds =       0.03 minutes

    			-----------------------------------------

    			 OPTKING 3.0: for geometry optimizations 

    			     By R.A. King, Bethel University     

    			        with contributions from          

    			    A.V. Copan, J. Cayton, A. Heide      

    			-----------------------------------------

    
	                            ===> Fragment 1 <== 

	 Z (Atomic Numbers)          Masses                          Geom                  
	       6.000000            12.000000          0.00000000  0.00000000  1.30996861   
	       8.000000            15.994915          0.00000000  0.00000000 -0.98278882   

	 - Coordinate -           - BOHR/RAD -       - ANG/DEG -
	 R(1,2)           =         2.292757           1.213275


	        --- Internal Coordinate Step in ANG or DEG, aJ/ANG or AJ/DEG ---
	-------------------------------------------------------------------------------
	           Coordinate      Previous         Force          Change          New 
	           ----------      --------        ------          ------        ------
	               R(1,2)       1.21327        0.00145        0.00011       1.21338
	-------------------------------------------------------------------------------

	                                 ==> Convergence Check <==                                  
    
	Measures of convergence in internal coordinates in au.
    
	Criteria marked as inactive (o), active & met (*), and active & unmet ( ).

	----------------------------------------------------------------------------------------------
	   Step    Total Energy     Delta E     Max Force     RMS Force      Max Disp      RMS Disp   
	----------------------------------------------------------------------------------------------
	  Convergence Criteria     1.00e-06 *    3.00e-04 *             o    1.20e-03 *             o
	----------------------------------------------------------------------------------------------
	     3    -113.10626027   -8.57e-06      1.76e-04 *    1.76e-04 o    2.05e-04 *    2.05e-04 o  ~
	----------------------------------------------------------------------------------------------

Next Geometry in Ang 
	Fragment 1 (Ang)

	    C   0.0000000000   0.0000000000   0.6932597846
	    O   0.0000000000   0.0000000000  -0.5201236980


    Final optimized geometry and variables:
    Molecular point group: c2v
    Full point group: C_inf_v

    Geometry (in Angstrom), charge = 0, multiplicity = 3:

    C            0.000000000000     0.000000000000     0.693205534027
    O            0.000000000000     0.000000000000    -0.520069447457


    Psi4 stopped on: Wednesday, 16 July 2025 06:59PM
    Psi4 wall time for execution: 0:00:03.44

*** Psi4 exiting successfully. Buy a developer a beer!
