
    -----------------------------------------------------------------------
          Psi4: An Open-Source Ab Initio Electronic Structure Package
                               Psi4 1.9.1 release

                         Git: Rev {} zzzzzzz 


    D. G. A. Smith, L. A. Burns, A. C. Simmonett, R. M. Parrish,
    M. C. Schieber, R. Galvelis, P. Kraus, H. Kruse, R. Di Remigio,
    A. Alenaizan, A. M. James, S. Lehtola, J. P. Misiewicz, M. Scheurer,
    R. A. Shaw, J. B. Schriber, Y. Xie, Z. L. Glick, D. A. Sirianni,
    J. S. O'Brien, J. M. Waldrop, A. Kumar, E. G. Hohenstein,
    B. P. Pritchard, B. R. Brooks, H. F. Schaefer III, A. Yu. Sokolov,
    K. Patkowski, A. E. DePrince III, U. Bozkaya, R. A. King,
    F. A. Evangelista, J. M. Turney, T. D. Crawford, C. D. Sherrill,
    J. Chem. Phys. 152(18) 184108 (2020). https://doi.org/10.1063/5.0006002

                            Additional Code Authors
    E. T. Seidl, C. L. Janssen, E. F. Valeev, M. L. Leininger,
    J. F. Gonthier, R. M. Richard, H. R. McAlexander, M. Saitow, X. Wang,
    P. Verma, M. H. Lechner, A. Jiang, S. Behnle, A. G. Heide,
    M. F. Herbst, and D. L. Poole

             Previous Authors, Complete List of Code Contributors,
                       and Citations for Specific Modules
    https://github.com/psi4/psi4/blob/master/codemeta.json
    https://github.com/psi4/psi4/graphs/contributors
    http://psicode.org/psi4manual/master/introduction.html#citing-psifour

    -----------------------------------------------------------------------


    Psi4 started on: Thursday, 17 July 2025 09:58AM

    Process ID: 72436
    Host:       Joses-MacBook-Pro-2.local
    PSIDATADIR: /Users/joseantoniorodriguesromero/anaconda3/share/psi4
    Memory:     500.0 MiB
    Threads:    1
    
  ==> Input File <==

--------------------------------------------------------------------------
molecule { 
-1 2
C   0.00000        0.60000        0.00000
O   0.00000       -0.60000        0.00000
}

set { 
basis              cc-pvdz
reference          uks
maxiter            500
geom_maxiter       500
DAMPING_PERCENTAGE 1
guess              SAP
}

optimize('b3lyp')
--------------------------------------------------------------------------

Scratch directory: /tmp/
gradient() will perform analytic gradient computation.
   => Libint2 <=

    Primary   basis highest AM E, G, H:  6, 6, 3
    Auxiliary basis highest AM E, G, H:  7, 7, 4
    Onebody   basis highest AM E, G, H:  -, -, -
    Solid Harmonics ordering:            Gaussian

*** tstart() called on Joses-MacBook-Pro-2.local
*** at Thu Jul 17 09:58:39 2025

   => Loading Basis Set <=

    Name: CC-PVDZ
    Role: ORBITAL
    Keyword: BASIS
    atoms 1 entry C          line   138 file /Users/joseantoniorodriguesromero/anaconda3/share/psi4/basis/cc-pvdz.gbs 
    atoms 2 entry O          line   198 file /Users/joseantoniorodriguesromero/anaconda3/share/psi4/basis/cc-pvdz.gbs 


         ---------------------------------------------------------
                                   SCF
               by Justin Turney, Rob Parrish, Andy Simmonett
                          and Daniel G. A. Smith
                              UKS Reference
                        1 Threads,    500 MiB Core
         ---------------------------------------------------------

  ==> Geometry <==

    Molecular point group: c2v
    Full point group: C_inf_v

    Geometry (in Angstrom), charge = -1, multiplicity = 2:

       Center              X                  Y                   Z               Mass       
    ------------   -----------------  -----------------  -----------------  -----------------
         C            0.000000000000     0.000000000000     0.685620863800    12.000000000000
         O            0.000000000000     0.000000000000    -0.514379136200    15.994914619570

  Running in c2v symmetry.

  Rotational constants: A = ************  B =      1.70746  C =      1.70746 [cm^-1]
  Rotational constants: A = ************  B =  51188.29714  C =  51188.29714 [MHz]
  Nuclear repulsion =   21.167088426800003

  Charge       = -1
  Multiplicity = 2
  Electrons    = 15
  Nalpha       = 8
  Nbeta        = 7

  ==> Algorithm <==

  SCF Algorithm Type is DF.
  DIIS enabled.
  MOM disabled.
  Fractional occupation disabled.
  Guess Type is SAP.
  Energy threshold   = 1.00e-08
  Density threshold  = 1.00e-08
  Integral threshold = 1.00e-12

  ==> Primary Basis <==

  Basis Set: CC-PVDZ
    Blend: CC-PVDZ
    Number of shells: 12
    Number of basis functions: 28
    Number of Cartesian functions: 30
    Spherical Harmonics?: true
    Max angular momentum: 2

  ==> DFT Potential <==

   => LibXC <=

    Version 6.2.2
    S. Lehtola, C. Steigemann, M. J.T. Oliveira, and M. A.L. Marques.,  SoftwareX 7, 1–5 (2018) (10.1016/j.softx.2017.11.002)

   => Composite Functional: B3LYP <= 

    B3LYP Hyb-GGA Exchange-Correlation Functional

    P. J. Stephens, F. J. Devlin, C. F. Chabalowski, and M. J. Frisch.,  J. Phys. Chem. 98, 11623 (1994) (10.1021/j100096a001)

    Deriv               =              1
    GGA                 =           TRUE
    Meta                =          FALSE

    Exchange Hybrid     =           TRUE
    MP2 Hybrid          =          FALSE

   => Exchange Functionals <=

    0.0800   Slater exchange
    0.7200         Becke 88

   => Exact (HF) Exchange <=

    0.2000               HF 

   => Correlation Functionals <=

    0.1900   Vosko, Wilk & Nusair (VWN5_RPA)
    0.8100   Lee, Yang & Parr

   => LibXC Density Thresholds  <==

    XC_HYB_GGA_XC_B3LYP:  1.00E-15 

   => Molecular Quadrature <=

    Radial Scheme          =       TREUTLER
    Pruning Scheme         =           NONE
    Nuclear Scheme         =       TREUTLER

    Blocking Scheme        =         OCTREE
    BS radius alpha        =              1
    Pruning alpha          =              1
    Radial Points          =             75
    Spherical Points       =            302
    Total Points           =          42745
    Total Blocks           =            382
    Max Points             =            256
    Max Functions          =             28
    Weights Tolerance      =       1.00E-15

   => Loading Basis Set <=

    Name: (CC-PVDZ AUX)
    Role: JKFIT
    Keyword: DF_BASIS_SCF
    atoms 1 entry C          line   121 file /Users/joseantoniorodriguesromero/anaconda3/share/psi4/basis/cc-pvdz-jkfit.gbs 
    atoms 2 entry O          line   221 file /Users/joseantoniorodriguesromero/anaconda3/share/psi4/basis/cc-pvdz-jkfit.gbs 

  ==> Integral Setup <==

  DFHelper Memory: AOs need 0.001 GiB; user supplied 0.332 GiB. 
  Using in-core AOs.

  ==> MemDFJK: Density-Fitted J/K Matrices <==

    J tasked:                   Yes
    K tasked:                   Yes
    wK tasked:                   No
    OpenMP threads:               1
    Memory [MiB]:               340
    Algorithm:                 Core
    Schwarz Cutoff:           1E-12
    Mask sparsity (%):       0.0000
    Fitting Condition:        1E-10

   => Auxiliary Basis Set <=

  Basis Set: (CC-PVDZ AUX)
    Blend: CC-PVDZ-JKFIT
    Number of shells: 48
    Number of basis functions: 140
    Number of Cartesian functions: 162
    Spherical Harmonics?: true
    Max angular momentum: 3

  Cached 100.0% of DFT collocation blocks in 0.034 [GiB].

  Minimum eigenvalue in the overlap matrix is 2.3746511758E-02.
  Reciprocal condition number of the overlap matrix is 7.9054171771E-03.
    Using symmetric orthogonalization.

  ==> Pre-Iterations <==

  SCF Guess: Superposition of Atomic Potentials (doi:10.1021/acs.jctc.8b01089).

  ==> SAP guess <==

   => Molecular Quadrature <=

    Radial Scheme          =       TREUTLER
    Pruning Scheme         =           NONE
    Nuclear Scheme         =       TREUTLER

    Blocking Scheme        =         OCTREE
    BS radius alpha        =              1
    Pruning alpha          =              1
    Radial Points          =             75
    Spherical Points       =            302
    Total Points           =          42745
    Total Blocks           =            382
    Max Points             =            256
    Max Functions          =             28
    Weights Tolerance      =       1.00E-15

   -------------------------------------------------------
    Irrep   Nso     Nmo     Nalpha   Nbeta   Ndocc  Nsocc
   -------------------------------------------------------
     A1        14      14       5       5       5       0
     A2         2       2       0       0       0       0
     B1         6       6       1       1       1       0
     B2         6       6       2       1       1       1
   -------------------------------------------------------
    Total      28      28       8       7       7       1
   -------------------------------------------------------

  ==> Iterations <==

                           Total Energy        Delta E     RMS |[F,P]|

   @DF-UKS iter   1:  -112.96184076522742   -1.12962e+02   4.55347e-02 ADIIS/DIIS
   @DF-UKS iter   2:  -112.79486743722838    1.66973e-01   6.23843e-02 ADIIS/DIIS/DAMP=1%
   @DF-UKS iter   3:  -113.16896394454386   -3.74097e-01   1.52755e-02 ADIIS/DIIS/DAMP=1%
   @DF-UKS iter   4:  -113.22572164354555   -5.67577e-02   6.46560e-03 ADIIS/DIIS/DAMP=1%
   @DF-UKS iter   5:  -113.22907767289867   -3.35603e-03   3.05234e-04 ADIIS/DIIS/DAMP=1%
   @DF-UKS iter   6:  -113.22986227275705   -7.84600e-04   5.67080e-05 DIIS/DAMP=1%
   @DF-UKS iter   7:  -113.22987834727749   -1.60745e-05   9.65617e-06 DIIS/DAMP=1%
   @DF-UKS iter   8:  -113.22989160661798   -1.32593e-05   9.50733e-07 DIIS/DAMP=1%
   @DF-UKS iter   9:  -113.22988983446514    1.77215e-06   3.48356e-07 DIIS/DAMP=1%
   @DF-UKS iter  10:  -113.22988966577987    1.68685e-07   9.01478e-08 DIIS/DAMP=1%
   @DF-UKS iter  11:  -113.22988972159739   -5.58175e-08   2.43526e-08 DIIS/DAMP=1%
   @DF-UKS iter  12:  -113.22988973203817   -1.04408e-08   2.22363e-09 DIIS/DAMP=1%
   @DF-UKS iter  13:  -113.22988972717819    4.85998e-09   3.10428e-10 DIIS/DAMP=1%
  Energy and wave function converged.


  ==> Post-Iterations <==

   Electrons on quadrature grid:
      Nalpha   =    7.9999999898 ; deviation = -1.017e-08
      Nbeta    =    7.0000000197 ; deviation = 1.969e-08
      Ntotal   =   15.0000000095 ; deviation = 9.528e-09 

   @Spin Contamination Metric:   2.079580094E-03
   @S^2 Expected:                7.500000000E-01
   @S^2 Observed:                7.520795801E-01
   @S   Expected:                5.000000000E-01
   @S   Observed:                5.000000000E-01

    Orbital Energies [Eh]
    ---------------------

    Alpha Occupied:                                                       

       1A1   -18.842013     2A1    -9.890135     3A1    -0.742613  
       4A1    -0.212594     1B2    -0.099594     1B1    -0.083125  
       5A1    -0.017839     2B2     0.215487  

    Alpha Virtual:                                                        

       2B1     0.303632     6A1     0.523236     3B2     0.765538  
       3B1     0.782759     7A1     0.865440     8A1     1.010749  
       9A1     1.144099     4B2     1.261120     4B1     1.266233  
       1A2     1.464864    10A1     1.468424     5B2     1.616263  
       5B1     1.617750    11A1     1.996664    12A1     2.241926  
       2A2     2.924533    13A1     2.925388     6B1     3.340731  
       6B2     3.341562    14A1     3.723657  

    Beta Occupied:                                                        

       1A1   -18.834284     2A1    -9.880966     3A1    -0.726564  
       4A1    -0.190355     1B1    -0.076173     1B2    -0.047916  
       5A1     0.007486  

    Beta Virtual:                                                         

       2B1     0.315653     2B2     0.349135     6A1     0.531036  
       3B1     0.791566     3B2     0.819588     7A1     0.884062  
       8A1     1.029313     9A1     1.150436     4B1     1.270040  
       4B2     1.288949     1A2     1.507010    10A1     1.507223  
       5B1     1.621097     5B2     1.651772    11A1     2.005750  
      12A1     2.257364    13A1     2.948195     2A2     2.948200  
       6B1     3.344340     6B2     3.368692    14A1     3.735850  

    Final Occupation by Irrep:
             A1    A2    B1    B2 
    DOCC [     5,    0,    1,    1 ]
    SOCC [     0,    0,    0,    1 ]
    NA   [     5,    0,    1,    2 ]
    NB   [     5,    0,    1,    1 ]

  @DF-UKS Final Energy:  -113.22988972717819

   => Energetics <=

    Nuclear Repulsion Energy =             21.1670884268000030
    One-Electron Energy =                -201.1056976215730003
    Two-Electron Energy =                  78.2075534947835393
    DFT Exchange-Correlation Energy =     -11.4988340271887370
    Empirical Dispersion Energy =           0.0000000000000000
    VV10 Nonlocal Energy =                  0.0000000000000000
    Total Energy =                       -113.2298897271781897

  UHF NO Occupations:
  HONO-2 :    1 B2 1.9995722
  HONO-1 :    5 A1 1.9994703
  HONO-0 :    2 B2 1.0000000
  LUNO+0 :    6 A1 0.0005297
  LUNO+1 :    3 B2 0.0004278
  LUNO+2 :    7 A1 0.0000424
  LUNO+3 :    2 B1 0.0000369


Computation Completed


Properties will be evaluated at   0.000000,   0.000000,   0.000000 [a0]

Properties computed using the SCF density matrix


 Multipole Moments:

 ------------------------------------------------------------------------------------
     Multipole            Electronic (a.u.)      Nuclear  (a.u.)        Total (a.u.)
 ------------------------------------------------------------------------------------

 L = 1.  Multiply by 2.5417464519 to convert [e a0] to [Debye]
 Dipole X            :          0.0000000            0.0000000            0.0000000
 Dipole Y            :          0.0000000            0.0000000            0.0000000
 Dipole Z            :         -0.7939105           -0.0024716           -0.7963821
 Magnitude           :                                                    0.7963821

 ------------------------------------------------------------------------------------

*** tstop() called on Joses-MacBook-Pro-2.local at Thu Jul 17 09:58:40 2025
Module time:
	user time   =       5.98 seconds =       0.10 minutes
	system time =       3.63 seconds =       0.06 minutes
	total time  =          1 seconds =       0.02 minutes
Total time:
	user time   =       5.98 seconds =       0.10 minutes
	system time =       3.63 seconds =       0.06 minutes
	total time  =          1 seconds =       0.02 minutes

*** tstart() called on Joses-MacBook-Pro-2.local
*** at Thu Jul 17 09:58:40 2025


         ------------------------------------------------------------
                                   SCF GRAD                          
                          Rob Parrish, Justin Turney,                
                       Andy Simmonett, and Alex Sokolov              
         ------------------------------------------------------------

  ==> Geometry <==

    Molecular point group: c2v
    Full point group: C_inf_v

    Geometry (in Angstrom), charge = -1, multiplicity = 2:

       Center              X                  Y                   Z               Mass       
    ------------   -----------------  -----------------  -----------------  -----------------
         C            0.000000000000     0.000000000000     0.685620863800    12.000000000000
         O            0.000000000000     0.000000000000    -0.514379136200    15.994914619570

  Nuclear repulsion =   21.167088426800003

  ==> Basis Set <==

  Basis Set: CC-PVDZ
    Blend: CC-PVDZ
    Number of shells: 12
    Number of basis functions: 28
    Number of Cartesian functions: 30
    Spherical Harmonics?: true
    Max angular momentum: 2

  ==> DFJKGrad: Density-Fitted SCF Gradients <==

    Gradient:                    1
    J tasked:                  Yes
    K tasked:                  Yes
    wK tasked:                  No
    OpenMP threads:              1
    Integrals threads:           1
    Memory [MiB]:              375
    Schwarz Cutoff:          1E-12
    Fitting Condition:       1E-10

   => Auxiliary Basis Set <=

  Basis Set: (CC-PVDZ AUX)
    Blend: CC-PVDZ-JKFIT
    Number of shells: 48
    Number of basis functions: 140
    Number of Cartesian functions: 162
    Spherical Harmonics?: true
    Max angular momentum: 3

  ==> DFT Potential <==

   => LibXC <=

    Version 6.2.2
    S. Lehtola, C. Steigemann, M. J.T. Oliveira, and M. A.L. Marques.,  SoftwareX 7, 1–5 (2018) (10.1016/j.softx.2017.11.002)

   => Composite Functional: B3LYP <= 

    B3LYP Hyb-GGA Exchange-Correlation Functional

    P. J. Stephens, F. J. Devlin, C. F. Chabalowski, and M. J. Frisch.,  J. Phys. Chem. 98, 11623 (1994) (10.1021/j100096a001)

    Deriv               =              1
    GGA                 =           TRUE
    Meta                =          FALSE

    Exchange Hybrid     =           TRUE
    MP2 Hybrid          =          FALSE

   => Exchange Functionals <=

    0.0800   Slater exchange
    0.7200         Becke 88

   => Exact (HF) Exchange <=

    0.2000               HF 

   => Correlation Functionals <=

    0.1900   Vosko, Wilk & Nusair (VWN5_RPA)
    0.8100   Lee, Yang & Parr

   => LibXC Density Thresholds  <==

    XC_HYB_GGA_XC_B3LYP:  1.00E-15 

   => Molecular Quadrature <=

    Radial Scheme          =       TREUTLER
    Pruning Scheme         =           NONE
    Nuclear Scheme         =       TREUTLER

    Blocking Scheme        =         OCTREE
    BS radius alpha        =              1
    Pruning alpha          =              1
    Radial Points          =             75
    Spherical Points       =            302
    Total Points           =          42745
    Total Blocks           =            382
    Max Points             =            256
    Max Functions          =             28
    Weights Tolerance      =       1.00E-15


  -Total Gradient:
     Atom            X                  Y                   Z
    ------   -----------------  -----------------  -----------------
       1        0.000000000000    -0.000000000000    -0.058111806911
       2        0.000000000000     0.000000000000     0.058117773055


*** tstop() called on Joses-MacBook-Pro-2.local at Thu Jul 17 09:58:40 2025
Module time:
	user time   =       0.71 seconds =       0.01 minutes
	system time =       1.05 seconds =       0.02 minutes
	total time  =          0 seconds =       0.00 minutes
Total time:
	user time   =       6.70 seconds =       0.11 minutes
	system time =       4.68 seconds =       0.08 minutes
	total time  =          1 seconds =       0.02 minutes

    			-----------------------------------------

    			 OPTKING 3.0: for geometry optimizations 

    			     By R.A. King, Bethel University     

    			        with contributions from          

    			    A.V. Copan, J. Cayton, A. Heide      

    			-----------------------------------------

    
	                            ===> Fragment 1 <== 

	 Z (Atomic Numbers)          Masses                          Geom                  
	       6.000000            12.000000          0.00000000  0.00000000  1.29563566   
	       8.000000            15.994915          0.00000000  0.00000000 -0.97203569   

	 - Coordinate -           - BOHR/RAD -       - ANG/DEG -
	 R(1,2)           =         2.267671           1.200000


	        --- Internal Coordinate Step in ANG or DEG, aJ/ANG or AJ/DEG ---
	-------------------------------------------------------------------------------
	           Coordinate      Previous         Force          Change          New 
	           ----------      --------        ------          ------        ------
	               R(1,2)       1.20000        0.47879        0.02925       1.22925
	-------------------------------------------------------------------------------

	                                 ==> Convergence Check <==                                  
    
	Measures of convergence in internal coordinates in au.
    
	Criteria marked as inactive (o), active & met (*), and active & unmet ( ).

	----------------------------------------------------------------------------------------------
	   Step    Total Energy     Delta E     Max Force     RMS Force      Max Disp      RMS Disp   
	----------------------------------------------------------------------------------------------
	  Convergence Criteria     1.00e-06 *    3.00e-04 *             o    1.20e-03 *             o
	----------------------------------------------------------------------------------------------
	     1    -113.22988973   -1.13e+02      5.81e-02      5.81e-02 o    5.53e-02      5.53e-02 o  ~
	----------------------------------------------------------------------------------------------

Next Geometry in Ang 
	Fragment 1 (Ang)

	    C   0.0000000000   0.0000000000   0.7002450657
	    O   0.0000000000   0.0000000000  -0.5290033381


    Structure for next step:
    Molecular point group: c2v
    Full point group: C_inf_v

    Geometry (in Angstrom), charge = -1, multiplicity = 2:

    C            0.000000000000     0.000000000000     0.702331960338
    O            0.000000000000     0.000000000000    -0.526916443414


Scratch directory: /tmp/
gradient() will perform analytic gradient computation.
   => Libint2 <=

    Primary   basis highest AM E, G, H:  6, 6, 3
    Auxiliary basis highest AM E, G, H:  7, 7, 4
    Onebody   basis highest AM E, G, H:  -, -, -
    Solid Harmonics ordering:            Gaussian

*** tstart() called on Joses-MacBook-Pro-2.local
*** at Thu Jul 17 09:58:40 2025

   => Loading Basis Set <=

    Name: CC-PVDZ
    Role: ORBITAL
    Keyword: BASIS
    atoms 1 entry C          line   138 file /Users/joseantoniorodriguesromero/anaconda3/share/psi4/basis/cc-pvdz.gbs 
    atoms 2 entry O          line   198 file /Users/joseantoniorodriguesromero/anaconda3/share/psi4/basis/cc-pvdz.gbs 


         ---------------------------------------------------------
                                   SCF
               by Justin Turney, Rob Parrish, Andy Simmonett
                          and Daniel G. A. Smith
                              UKS Reference
                        1 Threads,    500 MiB Core
         ---------------------------------------------------------

  ==> Geometry <==

    Molecular point group: c2v
    Full point group: C_inf_v

    Geometry (in Angstrom), charge = -1, multiplicity = 2:

       Center              X                  Y                   Z               Mass       
    ------------   -----------------  -----------------  -----------------  -----------------
         C            0.000000000000     0.000000000000     0.702331960338    12.000000000000
         O            0.000000000000     0.000000000000    -0.526916443414    15.994914619570

  Running in c2v symmetry.

  Rotational constants: A = ************  B =      1.62717  C =      1.62717 [cm^-1]
  Rotational constants: A = ************  B =  48781.35599  C =  48781.35599 [MHz]
  Nuclear repulsion =   20.663444454861665

  Charge       = -1
  Multiplicity = 2
  Electrons    = 15
  Nalpha       = 8
  Nbeta        = 7

  ==> Algorithm <==

  SCF Algorithm Type is DF.
  DIIS enabled.
  MOM disabled.
  Fractional occupation disabled.
  Guess Type is READ.
  Energy threshold   = 1.00e-08
  Density threshold  = 1.00e-08
  Integral threshold = 1.00e-12

  ==> Primary Basis <==

  Basis Set: CC-PVDZ
    Blend: CC-PVDZ
    Number of shells: 12
    Number of basis functions: 28
    Number of Cartesian functions: 30
    Spherical Harmonics?: true
    Max angular momentum: 2

  ==> DFT Potential <==

   => LibXC <=

    Version 6.2.2
    S. Lehtola, C. Steigemann, M. J.T. Oliveira, and M. A.L. Marques.,  SoftwareX 7, 1–5 (2018) (10.1016/j.softx.2017.11.002)

   => Composite Functional: B3LYP <= 

    B3LYP Hyb-GGA Exchange-Correlation Functional

    P. J. Stephens, F. J. Devlin, C. F. Chabalowski, and M. J. Frisch.,  J. Phys. Chem. 98, 11623 (1994) (10.1021/j100096a001)

    Deriv               =              1
    GGA                 =           TRUE
    Meta                =          FALSE

    Exchange Hybrid     =           TRUE
    MP2 Hybrid          =          FALSE

   => Exchange Functionals <=

    0.0800   Slater exchange
    0.7200         Becke 88

   => Exact (HF) Exchange <=

    0.2000               HF 

   => Correlation Functionals <=

    0.1900   Vosko, Wilk & Nusair (VWN5_RPA)
    0.8100   Lee, Yang & Parr

   => LibXC Density Thresholds  <==

    XC_HYB_GGA_XC_B3LYP:  1.00E-15 

   => Molecular Quadrature <=

    Radial Scheme          =       TREUTLER
    Pruning Scheme         =           NONE
    Nuclear Scheme         =       TREUTLER

    Blocking Scheme        =         OCTREE
    BS radius alpha        =              1
    Pruning alpha          =              1
    Radial Points          =             75
    Spherical Points       =            302
    Total Points           =          42751
    Total Blocks           =            381
    Max Points             =            256
    Max Functions          =             28
    Weights Tolerance      =       1.00E-15

   => Loading Basis Set <=

    Name: (CC-PVDZ AUX)
    Role: JKFIT
    Keyword: DF_BASIS_SCF
    atoms 1 entry C          line   121 file /Users/joseantoniorodriguesromero/anaconda3/share/psi4/basis/cc-pvdz-jkfit.gbs 
    atoms 2 entry O          line   221 file /Users/joseantoniorodriguesromero/anaconda3/share/psi4/basis/cc-pvdz-jkfit.gbs 

   => Loading Basis Set <=

    Name: CC-PVDZ
    Role: ORBITAL
    Keyword: BASIS
    atoms 1 entry C          line   138 file /Users/joseantoniorodriguesromero/anaconda3/share/psi4/basis/cc-pvdz.gbs 
    atoms 2 entry O          line   198 file /Users/joseantoniorodriguesromero/anaconda3/share/psi4/basis/cc-pvdz.gbs 

  Reading orbitals from file /tmp/doublet_CO.default.72436.180.npy, no projection.

  ==> Integral Setup <==

  DFHelper Memory: AOs need 0.001 GiB; user supplied 0.332 GiB. 
  Using in-core AOs.

  ==> MemDFJK: Density-Fitted J/K Matrices <==

    J tasked:                   Yes
    K tasked:                   Yes
    wK tasked:                   No
    OpenMP threads:               1
    Memory [MiB]:               340
    Algorithm:                 Core
    Schwarz Cutoff:           1E-12
    Mask sparsity (%):       0.0000
    Fitting Condition:        1E-10

   => Auxiliary Basis Set <=

  Basis Set: (CC-PVDZ AUX)
    Blend: CC-PVDZ-JKFIT
    Number of shells: 48
    Number of basis functions: 140
    Number of Cartesian functions: 162
    Spherical Harmonics?: true
    Max angular momentum: 3

  Cached 100.0% of DFT collocation blocks in 0.034 [GiB].

  Minimum eigenvalue in the overlap matrix is 2.4613821323E-02.
  Reciprocal condition number of the overlap matrix is 8.2513821150E-03.
    Using symmetric orthogonalization.

  ==> Pre-Iterations <==

  SCF Guess: Orbitals guess was supplied from a previous computation.

   -------------------------------------------------------
    Irrep   Nso     Nmo     Nalpha   Nbeta   Ndocc  Nsocc
   -------------------------------------------------------
     A1        14      14       5       5       5       0
     A2         2       2       0       0       0       0
     B1         6       6       1       1       1       0
     B2         6       6       2       1       1       1
   -------------------------------------------------------
    Total      28      28       8       7       7       1
   -------------------------------------------------------

  ==> Iterations <==

                           Total Energy        Delta E     RMS |[F,P]|

   @DF-UKS iter   0:  -113.21131522366737   -1.13211e+02   6.04673e-03 
   @DF-UKS iter   1:  -113.23110641041305   -1.97912e-02   2.38392e-03 ADIIS/DIIS
   @DF-UKS iter   2:  -113.22876726665405    2.33914e-03   5.34152e-03 ADIIS/DIIS/DAMP=1%
   @DF-UKS iter   3:  -113.23025377647618   -1.48651e-03   2.82127e-04 ADIIS/DIIS/DAMP=1%
   @DF-UKS iter   4:  -113.23171034866341   -1.45657e-03   8.17353e-05 DIIS/DAMP=1%
   @DF-UKS iter   5:  -113.23176560886397   -5.52602e-05   1.16816e-05 DIIS/DAMP=1%
   @DF-UKS iter   6:  -113.23176285388919    2.75497e-06   2.15585e-06 DIIS/DAMP=1%
   @DF-UKS iter   7:  -113.23176879339880   -5.93951e-06   5.11922e-07 DIIS/DAMP=1%
   @DF-UKS iter   8:  -113.23176829468665    4.98712e-07   1.57276e-07 DIIS/DAMP=1%
   @DF-UKS iter   9:  -113.23176821170193    8.29847e-08   1.71544e-08 DIIS/DAMP=1%
   @DF-UKS iter  10:  -113.23176825342209   -4.17202e-08   2.58473e-09 DIIS/DAMP=1%
   @DF-UKS iter  11:  -113.23176825143463    1.98746e-09   3.95947e-10 DIIS/DAMP=1%
  Energy and wave function converged.


  ==> Post-Iterations <==

   Electrons on quadrature grid:
      Nalpha   =    7.9999999080 ; deviation = -9.201e-08
      Nbeta    =    6.9999999461 ; deviation = -5.392e-08
      Ntotal   =   14.9999998541 ; deviation = -1.459e-07 

   @Spin Contamination Metric:   2.210696856E-03
   @S^2 Expected:                7.500000000E-01
   @S^2 Observed:                7.522106969E-01
   @S   Expected:                5.000000000E-01
   @S   Observed:                5.000000000E-01

    Orbital Energies [Eh]
    ---------------------

    Alpha Occupied:                                                       

       1A1   -18.842905     2A1    -9.896812     3A1    -0.728375  
       4A1    -0.212662     1B2    -0.092086     1B1    -0.075140  
       5A1    -0.019458     2B2     0.205959  

    Alpha Virtual:                                                        

       2B1     0.294666     6A1     0.519869     3B2     0.764960  
       3B1     0.782614     7A1     0.863560     8A1     0.970381  
       9A1     1.150498     4B2     1.261957     4B1     1.267174  
       1A2     1.464337    10A1     1.468006     5B2     1.601634  
       5B1     1.603106    11A1     1.998349    12A1     2.197750  
       2A2     2.922141    13A1     2.922974     6B1     3.314233  
       6B2     3.315086    14A1     3.683154  

    Beta Occupied:                                                        

       1A1   -18.835321     2A1    -9.887353     3A1    -0.712201  
       4A1    -0.189577     1B1    -0.068320     1B2    -0.040349  
       5A1     0.005171  

    Beta Virtual:                                                         

       2B1     0.306807     2B2     0.340617     6A1     0.528113  
       3B1     0.791628     3B2     0.819926     7A1     0.881866  
       8A1     0.989041     9A1     1.156666     4B1     1.270830  
       4B2     1.289674     1A2     1.507519    10A1     1.507680  
       5B1     1.606483     5B2     1.637051    11A1     2.007446  
      12A1     2.213332    13A1     2.945287     2A2     2.945302  
       6B1     3.317681     6B2     3.341788    14A1     3.695157  

    Final Occupation by Irrep:
             A1    A2    B1    B2 
    DOCC [     5,    0,    1,    1 ]
    SOCC [     0,    0,    0,    1 ]
    NA   [     5,    0,    1,    2 ]
    NB   [     5,    0,    1,    1 ]

  @DF-UKS Final Energy:  -113.23176825143463

   => Energetics <=

    Nuclear Repulsion Energy =             20.6634444548616649
    One-Electron Energy =                -200.1458856963985795
    Two-Electron Energy =                  77.7319155256943759
    DFT Exchange-Correlation Energy =     -11.4812425355920844
    Empirical Dispersion Energy =           0.0000000000000000
    VV10 Nonlocal Energy =                  0.0000000000000000
    Total Energy =                       -113.2317682514346302

  UHF NO Occupations:
  HONO-2 :    1 B2 1.9995453
  HONO-1 :    5 A1 1.9994423
  HONO-0 :    2 B2 1.0000000
  LUNO+0 :    6 A1 0.0005577
  LUNO+1 :    3 B2 0.0004547
  LUNO+2 :    2 B1 0.0000479
  LUNO+3 :    7 A1 0.0000416


Computation Completed


Properties will be evaluated at   0.000000,   0.000000,   0.000000 [a0]

Properties computed using the SCF density matrix


 Multipole Moments:

 ------------------------------------------------------------------------------------
     Multipole            Electronic (a.u.)      Nuclear  (a.u.)        Total (a.u.)
 ------------------------------------------------------------------------------------

 L = 1.  Multiply by 2.5417464519 to convert [e a0] to [Debye]
 Dipole X            :          0.0000000            0.0000000            0.0000000
 Dipole Y            :          0.0000000            0.0000000            0.0000000
 Dipole Z            :         -0.7548380           -0.0025318           -0.7573698
 Magnitude           :                                                    0.7573698

 ------------------------------------------------------------------------------------

*** tstop() called on Joses-MacBook-Pro-2.local at Thu Jul 17 09:58:41 2025
Module time:
	user time   =       4.43 seconds =       0.07 minutes
	system time =       3.68 seconds =       0.06 minutes
	total time  =          1 seconds =       0.02 minutes
Total time:
	user time   =      11.17 seconds =       0.19 minutes
	system time =       8.56 seconds =       0.14 minutes
	total time  =          2 seconds =       0.03 minutes

*** tstart() called on Joses-MacBook-Pro-2.local
*** at Thu Jul 17 09:58:41 2025


         ------------------------------------------------------------
                                   SCF GRAD                          
                          Rob Parrish, Justin Turney,                
                       Andy Simmonett, and Alex Sokolov              
         ------------------------------------------------------------

  ==> Geometry <==

    Molecular point group: c2v
    Full point group: C_inf_v

    Geometry (in Angstrom), charge = -1, multiplicity = 2:

       Center              X                  Y                   Z               Mass       
    ------------   -----------------  -----------------  -----------------  -----------------
         C            0.000000000000     0.000000000000     0.702331960338    12.000000000000
         O            0.000000000000     0.000000000000    -0.526916443414    15.994914619570

  Nuclear repulsion =   20.663444454861665

  ==> Basis Set <==

  Basis Set: CC-PVDZ
    Blend: CC-PVDZ
    Number of shells: 12
    Number of basis functions: 28
    Number of Cartesian functions: 30
    Spherical Harmonics?: true
    Max angular momentum: 2

  ==> DFJKGrad: Density-Fitted SCF Gradients <==

    Gradient:                    1
    J tasked:                  Yes
    K tasked:                  Yes
    wK tasked:                  No
    OpenMP threads:              1
    Integrals threads:           1
    Memory [MiB]:              375
    Schwarz Cutoff:          1E-12
    Fitting Condition:       1E-10

   => Auxiliary Basis Set <=

  Basis Set: (CC-PVDZ AUX)
    Blend: CC-PVDZ-JKFIT
    Number of shells: 48
    Number of basis functions: 140
    Number of Cartesian functions: 162
    Spherical Harmonics?: true
    Max angular momentum: 3

  ==> DFT Potential <==

   => LibXC <=

    Version 6.2.2
    S. Lehtola, C. Steigemann, M. J.T. Oliveira, and M. A.L. Marques.,  SoftwareX 7, 1–5 (2018) (10.1016/j.softx.2017.11.002)

   => Composite Functional: B3LYP <= 

    B3LYP Hyb-GGA Exchange-Correlation Functional

    P. J. Stephens, F. J. Devlin, C. F. Chabalowski, and M. J. Frisch.,  J. Phys. Chem. 98, 11623 (1994) (10.1021/j100096a001)

    Deriv               =              1
    GGA                 =           TRUE
    Meta                =          FALSE

    Exchange Hybrid     =           TRUE
    MP2 Hybrid          =          FALSE

   => Exchange Functionals <=

    0.0800   Slater exchange
    0.7200         Becke 88

   => Exact (HF) Exchange <=

    0.2000               HF 

   => Correlation Functionals <=

    0.1900   Vosko, Wilk & Nusair (VWN5_RPA)
    0.8100   Lee, Yang & Parr

   => LibXC Density Thresholds  <==

    XC_HYB_GGA_XC_B3LYP:  1.00E-15 

   => Molecular Quadrature <=

    Radial Scheme          =       TREUTLER
    Pruning Scheme         =           NONE
    Nuclear Scheme         =       TREUTLER

    Blocking Scheme        =         OCTREE
    BS radius alpha        =              1
    Pruning alpha          =              1
    Radial Points          =             75
    Spherical Points       =            302
    Total Points           =          42751
    Total Blocks           =            381
    Max Points             =            256
    Max Functions          =             28
    Weights Tolerance      =       1.00E-15


  -Total Gradient:
     Atom            X                  Y                   Z
    ------   -----------------  -----------------  -----------------
       1        0.000000000000     0.000000000000    -0.011354316840
       2        0.000000000000    -0.000000000000     0.011359016561


*** tstop() called on Joses-MacBook-Pro-2.local at Thu Jul 17 09:58:41 2025
Module time:
	user time   =       0.74 seconds =       0.01 minutes
	system time =       1.22 seconds =       0.02 minutes
	total time  =          0 seconds =       0.00 minutes
Total time:
	user time   =      11.91 seconds =       0.20 minutes
	system time =       9.78 seconds =       0.16 minutes
	total time  =          2 seconds =       0.03 minutes

    			-----------------------------------------

    			 OPTKING 3.0: for geometry optimizations 

    			     By R.A. King, Bethel University     

    			        with contributions from          

    			    A.V. Copan, J. Cayton, A. Heide      

    			-----------------------------------------

    
	                            ===> Fragment 1 <== 

	 Z (Atomic Numbers)          Masses                          Geom                  
	       6.000000            12.000000          0.00000000  0.00000000  1.32721505   
	       8.000000            15.994915          0.00000000  0.00000000 -0.99572777   

	 - Coordinate -           - BOHR/RAD -       - ANG/DEG -
	 R(1,2)           =         2.322943           1.229248


	        --- Internal Coordinate Step in ANG or DEG, aJ/ANG or AJ/DEG ---
	-------------------------------------------------------------------------------
	           Coordinate      Previous         Force          Change          New 
	           ----------      --------        ------          ------        ------
	               R(1,2)       1.22925        0.09356        0.00710       1.23635
	-------------------------------------------------------------------------------

	                                 ==> Convergence Check <==                                  
    
	Measures of convergence in internal coordinates in au.
    
	Criteria marked as inactive (o), active & met (*), and active & unmet ( ).

	----------------------------------------------------------------------------------------------
	   Step    Total Energy     Delta E     Max Force     RMS Force      Max Disp      RMS Disp   
	----------------------------------------------------------------------------------------------
	  Convergence Criteria     1.00e-06 *    3.00e-04 *             o    1.20e-03 *             o
	----------------------------------------------------------------------------------------------
	     2    -113.23176825   -1.88e-03      1.14e-02      1.14e-02 o    1.34e-02      1.34e-02 o  ~
	----------------------------------------------------------------------------------------------

Next Geometry in Ang 
	Fragment 1 (Ang)

	    C   0.0000000000   0.0000000000   0.7058832634
	    O   0.0000000000   0.0000000000  -0.5304677465


    Structure for next step:
    Molecular point group: c2v
    Full point group: C_inf_v

    Geometry (in Angstrom), charge = -1, multiplicity = 2:

    C            0.000000000000     0.000000000000     0.706390039471
    O            0.000000000000     0.000000000000    -0.529960970425


Scratch directory: /tmp/
gradient() will perform analytic gradient computation.
   => Libint2 <=

    Primary   basis highest AM E, G, H:  6, 6, 3
    Auxiliary basis highest AM E, G, H:  7, 7, 4
    Onebody   basis highest AM E, G, H:  -, -, -
    Solid Harmonics ordering:            Gaussian

*** tstart() called on Joses-MacBook-Pro-2.local
*** at Thu Jul 17 09:58:41 2025

   => Loading Basis Set <=

    Name: CC-PVDZ
    Role: ORBITAL
    Keyword: BASIS
    atoms 1 entry C          line   138 file /Users/joseantoniorodriguesromero/anaconda3/share/psi4/basis/cc-pvdz.gbs 
    atoms 2 entry O          line   198 file /Users/joseantoniorodriguesromero/anaconda3/share/psi4/basis/cc-pvdz.gbs 


         ---------------------------------------------------------
                                   SCF
               by Justin Turney, Rob Parrish, Andy Simmonett
                          and Daniel G. A. Smith
                              UKS Reference
                        1 Threads,    500 MiB Core
         ---------------------------------------------------------

  ==> Geometry <==

    Molecular point group: c2v
    Full point group: C_inf_v

    Geometry (in Angstrom), charge = -1, multiplicity = 2:

       Center              X                  Y                   Z               Mass       
    ------------   -----------------  -----------------  -----------------  -----------------
         C            0.000000000000     0.000000000000     0.706390039471    12.000000000000
         O            0.000000000000     0.000000000000    -0.529960970425    15.994914619570

  Running in c2v symmetry.

  Rotational constants: A = ************  B =      1.60853  C =      1.60853 [cm^-1]
  Rotational constants: A = ************  B =  48222.48632  C =  48222.48632 [MHz]
  Nuclear repulsion =   20.544736817341882

  Charge       = -1
  Multiplicity = 2
  Electrons    = 15
  Nalpha       = 8
  Nbeta        = 7

  ==> Algorithm <==

  SCF Algorithm Type is DF.
  DIIS enabled.
  MOM disabled.
  Fractional occupation disabled.
  Guess Type is READ.
  Energy threshold   = 1.00e-08
  Density threshold  = 1.00e-08
  Integral threshold = 1.00e-12

  ==> Primary Basis <==

  Basis Set: CC-PVDZ
    Blend: CC-PVDZ
    Number of shells: 12
    Number of basis functions: 28
    Number of Cartesian functions: 30
    Spherical Harmonics?: true
    Max angular momentum: 2

  ==> DFT Potential <==

   => LibXC <=

    Version 6.2.2
    S. Lehtola, C. Steigemann, M. J.T. Oliveira, and M. A.L. Marques.,  SoftwareX 7, 1–5 (2018) (10.1016/j.softx.2017.11.002)

   => Composite Functional: B3LYP <= 

    B3LYP Hyb-GGA Exchange-Correlation Functional

    P. J. Stephens, F. J. Devlin, C. F. Chabalowski, and M. J. Frisch.,  J. Phys. Chem. 98, 11623 (1994) (10.1021/j100096a001)

    Deriv               =              1
    GGA                 =           TRUE
    Meta                =          FALSE

    Exchange Hybrid     =           TRUE
    MP2 Hybrid          =          FALSE

   => Exchange Functionals <=

    0.0800   Slater exchange
    0.7200         Becke 88

   => Exact (HF) Exchange <=

    0.2000               HF 

   => Correlation Functionals <=

    0.1900   Vosko, Wilk & Nusair (VWN5_RPA)
    0.8100   Lee, Yang & Parr

   => LibXC Density Thresholds  <==

    XC_HYB_GGA_XC_B3LYP:  1.00E-15 

   => Molecular Quadrature <=

    Radial Scheme          =       TREUTLER
    Pruning Scheme         =           NONE
    Nuclear Scheme         =       TREUTLER

    Blocking Scheme        =         OCTREE
    BS radius alpha        =              1
    Pruning alpha          =              1
    Radial Points          =             75
    Spherical Points       =            302
    Total Points           =          42751
    Total Blocks           =            381
    Max Points             =            256
    Max Functions          =             28
    Weights Tolerance      =       1.00E-15

   => Loading Basis Set <=

    Name: (CC-PVDZ AUX)
    Role: JKFIT
    Keyword: DF_BASIS_SCF
    atoms 1 entry C          line   121 file /Users/joseantoniorodriguesromero/anaconda3/share/psi4/basis/cc-pvdz-jkfit.gbs 
    atoms 2 entry O          line   221 file /Users/joseantoniorodriguesromero/anaconda3/share/psi4/basis/cc-pvdz-jkfit.gbs 

   => Loading Basis Set <=

    Name: CC-PVDZ
    Role: ORBITAL
    Keyword: BASIS
    atoms 1 entry C          line   138 file /Users/joseantoniorodriguesromero/anaconda3/share/psi4/basis/cc-pvdz.gbs 
    atoms 2 entry O          line   198 file /Users/joseantoniorodriguesromero/anaconda3/share/psi4/basis/cc-pvdz.gbs 

  Reading orbitals from file /tmp/doublet_CO.default.72436.180.npy, no projection.

  ==> Integral Setup <==

  DFHelper Memory: AOs need 0.001 GiB; user supplied 0.332 GiB. 
  Using in-core AOs.

  ==> MemDFJK: Density-Fitted J/K Matrices <==

    J tasked:                   Yes
    K tasked:                   Yes
    wK tasked:                   No
    OpenMP threads:               1
    Memory [MiB]:               340
    Algorithm:                 Core
    Schwarz Cutoff:           1E-12
    Mask sparsity (%):       0.0000
    Fitting Condition:        1E-10

   => Auxiliary Basis Set <=

  Basis Set: (CC-PVDZ AUX)
    Blend: CC-PVDZ-JKFIT
    Number of shells: 48
    Number of basis functions: 140
    Number of Cartesian functions: 162
    Spherical Harmonics?: true
    Max angular momentum: 3

  Cached 100.0% of DFT collocation blocks in 0.034 [GiB].

  Minimum eigenvalue in the overlap matrix is 2.4829852892E-02.
  Reciprocal condition number of the overlap matrix is 8.3382435515E-03.
    Using symmetric orthogonalization.

  ==> Pre-Iterations <==

  SCF Guess: Orbitals guess was supplied from a previous computation.

   -------------------------------------------------------
    Irrep   Nso     Nmo     Nalpha   Nbeta   Ndocc  Nsocc
   -------------------------------------------------------
     A1        14      14       5       5       5       0
     A2         2       2       0       0       0       0
     B1         6       6       1       1       1       0
     B2         6       6       2       1       1       1
   -------------------------------------------------------
    Total      28      28       8       7       7       1
   -------------------------------------------------------

  ==> Iterations <==

                           Total Energy        Delta E     RMS |[F,P]|

   @DF-UKS iter   0:  -113.22695939594485   -1.13227e+02   1.41191e-03 
   @DF-UKS iter   1:  -113.23181447333120   -4.85508e-03   5.71691e-04 ADIIS/DIIS
   @DF-UKS iter   2:  -113.23168078133681    1.33692e-04   1.27731e-03 ADIIS/DIIS/DAMP=1%
   @DF-UKS iter   3:  -113.23150075134711    1.80030e-04   5.74351e-05 DIIS/DAMP=1%
   @DF-UKS iter   4:  -113.23183020772585   -3.29456e-04   2.12923e-05 DIIS/DAMP=1%
   @DF-UKS iter   5:  -113.23185168586504   -2.14781e-05   3.05064e-06 DIIS/DAMP=1%
   @DF-UKS iter   6:  -113.23185120552931    4.80336e-07   5.18226e-07 DIIS/DAMP=1%
   @DF-UKS iter   7:  -113.23185270470977   -1.49918e-06   1.43122e-07 DIIS/DAMP=1%
   @DF-UKS iter   8:  -113.23185259628742    1.08422e-07   3.92107e-08 DIIS/DAMP=1%
   @DF-UKS iter   9:  -113.23185256951228    2.67751e-08   4.25990e-09 DIIS/DAMP=1%
   @DF-UKS iter  10:  -113.23185258034958   -1.08373e-08   6.84378e-10 DIIS/DAMP=1%
   @DF-UKS iter  11:  -113.23185257993455    4.15028e-10   1.10848e-10 DIIS/DAMP=1%
  Energy and wave function converged.


  ==> Post-Iterations <==

   Electrons on quadrature grid:
      Nalpha   =    7.9999998919 ; deviation = -1.081e-07
      Nbeta    =    6.9999999321 ; deviation = -6.791e-08
      Ntotal   =   14.9999998240 ; deviation = -1.760e-07 

   @Spin Contamination Metric:   2.242845685E-03
   @S^2 Expected:                7.500000000E-01
   @S^2 Observed:                7.522428457E-01
   @S   Expected:                5.000000000E-01
   @S   Observed:                5.000000000E-01

    Orbital Energies [Eh]
    ---------------------

    Alpha Occupied:                                                       

       1A1   -18.843098     2A1    -9.898434     3A1    -0.725010  
       4A1    -0.212720     1B2    -0.090327     1B1    -0.073268  
       5A1    -0.019821     2B2     0.203701  

    Alpha Virtual:                                                        

       2B1     0.292533     6A1     0.518933     3B2     0.764800  
       3B1     0.782553     7A1     0.863037     8A1     0.961146  
       9A1     1.152112     4B2     1.262072     4B1     1.267316  
       1A2     1.464175    10A1     1.467869     5B2     1.598327  
       5B1     1.599799    11A1     1.998805    12A1     2.187466  
       2A2     2.921652    13A1     2.922480     6B1     3.307896  
       6B2     3.308753    14A1     3.673499  

    Beta Occupied:                                                        

       1A1   -18.835550     2A1    -9.888908     3A1    -0.708815  
       4A1    -0.189419     1B1    -0.066485     1B2    -0.038587  
       5A1     0.004628  

    Beta Virtual:                                                         

       2B1     0.304704     2B2     0.338591     6A1     0.527298  
       3B1     0.791616     3B2     0.819977     7A1     0.881218  
       8A1     0.979850     9A1     1.158249     4B1     1.270932  
       4B2     1.289765     1A2     1.507602    10A1     1.507750  
       5B1     1.603187     5B2     1.633724    11A1     2.007904  
      12A1     2.203083    13A1     2.944668     2A2     2.944685  
       6B1     3.311301     6B2     3.335344    14A1     3.685448  

    Final Occupation by Irrep:
             A1    A2    B1    B2 
    DOCC [     5,    0,    1,    1 ]
    SOCC [     0,    0,    0,    1 ]
    NA   [     5,    0,    1,    2 ]
    NB   [     5,    0,    1,    1 ]

  @DF-UKS Final Energy:  -113.23185257993455

   => Energetics <=

    Nuclear Repulsion Energy =             20.5447368173418816
    One-Electron Energy =                -199.9187325817583201
    Two-Electron Energy =                  77.6192959804852620
    DFT Exchange-Correlation Energy =     -11.4771527960033826
    Empirical Dispersion Energy =           0.0000000000000000
    VV10 Nonlocal Energy =                  0.0000000000000000
    Total Energy =                       -113.2318525799345537

  UHF NO Occupations:
  HONO-2 :    1 B2 1.9995390
  HONO-1 :    5 A1 1.9994356
  HONO-0 :    2 B2 1.0000000
  LUNO+0 :    6 A1 0.0005644
  LUNO+1 :    3 B2 0.0004610
  LUNO+2 :    2 B1 0.0000510
  LUNO+3 :    7 A1 0.0000415


Computation Completed


Properties will be evaluated at   0.000000,   0.000000,   0.000000 [a0]

Properties computed using the SCF density matrix


 Multipole Moments:

 ------------------------------------------------------------------------------------
     Multipole            Electronic (a.u.)      Nuclear  (a.u.)        Total (a.u.)
 ------------------------------------------------------------------------------------

 L = 1.  Multiply by 2.5417464519 to convert [e a0] to [Debye]
 Dipole X            :          0.0000000            0.0000000            0.0000000
 Dipole Y            :          0.0000000            0.0000000            0.0000000
 Dipole Z            :         -0.7454696           -0.0025465           -0.7480161
 Magnitude           :                                                    0.7480161

 ------------------------------------------------------------------------------------

*** tstop() called on Joses-MacBook-Pro-2.local at Thu Jul 17 09:58:42 2025
Module time:
	user time   =       4.63 seconds =       0.08 minutes
	system time =       3.57 seconds =       0.06 minutes
	total time  =          1 seconds =       0.02 minutes
Total time:
	user time   =      16.57 seconds =       0.28 minutes
	system time =      13.57 seconds =       0.23 minutes
	total time  =          3 seconds =       0.05 minutes

*** tstart() called on Joses-MacBook-Pro-2.local
*** at Thu Jul 17 09:58:42 2025


         ------------------------------------------------------------
                                   SCF GRAD                          
                          Rob Parrish, Justin Turney,                
                       Andy Simmonett, and Alex Sokolov              
         ------------------------------------------------------------

  ==> Geometry <==

    Molecular point group: c2v
    Full point group: C_inf_v

    Geometry (in Angstrom), charge = -1, multiplicity = 2:

       Center              X                  Y                   Z               Mass       
    ------------   -----------------  -----------------  -----------------  -----------------
         C            0.000000000000     0.000000000000     0.706390039471    12.000000000000
         O            0.000000000000     0.000000000000    -0.529960970425    15.994914619570

  Nuclear repulsion =   20.544736817341882

  ==> Basis Set <==

  Basis Set: CC-PVDZ
    Blend: CC-PVDZ
    Number of shells: 12
    Number of basis functions: 28
    Number of Cartesian functions: 30
    Spherical Harmonics?: true
    Max angular momentum: 2

  ==> DFJKGrad: Density-Fitted SCF Gradients <==

    Gradient:                    1
    J tasked:                  Yes
    K tasked:                  Yes
    wK tasked:                  No
    OpenMP threads:              1
    Integrals threads:           1
    Memory [MiB]:              375
    Schwarz Cutoff:          1E-12
    Fitting Condition:       1E-10

   => Auxiliary Basis Set <=

  Basis Set: (CC-PVDZ AUX)
    Blend: CC-PVDZ-JKFIT
    Number of shells: 48
    Number of basis functions: 140
    Number of Cartesian functions: 162
    Spherical Harmonics?: true
    Max angular momentum: 3

  ==> DFT Potential <==

   => LibXC <=

    Version 6.2.2
    S. Lehtola, C. Steigemann, M. J.T. Oliveira, and M. A.L. Marques.,  SoftwareX 7, 1–5 (2018) (10.1016/j.softx.2017.11.002)

   => Composite Functional: B3LYP <= 

    B3LYP Hyb-GGA Exchange-Correlation Functional

    P. J. Stephens, F. J. Devlin, C. F. Chabalowski, and M. J. Frisch.,  J. Phys. Chem. 98, 11623 (1994) (10.1021/j100096a001)

    Deriv               =              1
    GGA                 =           TRUE
    Meta                =          FALSE

    Exchange Hybrid     =           TRUE
    MP2 Hybrid          =          FALSE

   => Exchange Functionals <=

    0.0800   Slater exchange
    0.7200         Becke 88

   => Exact (HF) Exchange <=

    0.2000               HF 

   => Correlation Functionals <=

    0.1900   Vosko, Wilk & Nusair (VWN5_RPA)
    0.8100   Lee, Yang & Parr

   => LibXC Density Thresholds  <==

    XC_HYB_GGA_XC_B3LYP:  1.00E-15 

   => Molecular Quadrature <=

    Radial Scheme          =       TREUTLER
    Pruning Scheme         =           NONE
    Nuclear Scheme         =       TREUTLER

    Blocking Scheme        =         OCTREE
    BS radius alpha        =              1
    Pruning alpha          =              1
    Radial Points          =             75
    Spherical Points       =            302
    Total Points           =          42751
    Total Blocks           =            381
    Max Points             =            256
    Max Functions          =             28
    Weights Tolerance      =       1.00E-15


  -Total Gradient:
     Atom            X                  Y                   Z
    ------   -----------------  -----------------  -----------------
       1       -0.000000000000     0.000000000000    -0.001293167986
       2       -0.000000000000     0.000000000000     0.001297605525


*** tstop() called on Joses-MacBook-Pro-2.local at Thu Jul 17 09:58:42 2025
Module time:
	user time   =       0.49 seconds =       0.01 minutes
	system time =       1.29 seconds =       0.02 minutes
	total time  =          0 seconds =       0.00 minutes
Total time:
	user time   =      17.07 seconds =       0.28 minutes
	system time =      14.86 seconds =       0.25 minutes
	total time  =          3 seconds =       0.05 minutes

    			-----------------------------------------

    			 OPTKING 3.0: for geometry optimizations 

    			     By R.A. King, Bethel University     

    			        with contributions from          

    			    A.V. Copan, J. Cayton, A. Heide      

    			-----------------------------------------

    
	                            ===> Fragment 1 <== 

	 Z (Atomic Numbers)          Masses                          Geom                  
	       6.000000            12.000000          0.00000000  0.00000000  1.33488371   
	       8.000000            15.994915          0.00000000  0.00000000 -1.00148109   

	 - Coordinate -           - BOHR/RAD -       - ANG/DEG -
	 R(1,2)           =         2.336365           1.236351


	        --- Internal Coordinate Step in ANG or DEG, aJ/ANG or AJ/DEG ---
	-------------------------------------------------------------------------------
	           Coordinate      Previous         Force          Change          New 
	           ----------      --------        ------          ------        ------
	               R(1,2)       1.23635        0.01067        0.00083       1.23718
	-------------------------------------------------------------------------------

	                                 ==> Convergence Check <==                                  
    
	Measures of convergence in internal coordinates in au.
    
	Criteria marked as inactive (o), active & met (*), and active & unmet ( ).

	----------------------------------------------------------------------------------------------
	   Step    Total Energy     Delta E     Max Force     RMS Force      Max Disp      RMS Disp   
	----------------------------------------------------------------------------------------------
	  Convergence Criteria     1.00e-06 *    3.00e-04 *             o    1.20e-03 *             o
	----------------------------------------------------------------------------------------------
	     3    -113.23185258   -8.43e-05      1.30e-03      1.30e-03 o    1.57e-03      1.57e-03 o  ~
	----------------------------------------------------------------------------------------------

Next Geometry in Ang 
	Fragment 1 (Ang)

	    C   0.0000000000   0.0000000000   0.7068044094
	    O   0.0000000000   0.0000000000  -0.5303753403


    Structure for next step:
    Molecular point group: c2v
    Full point group: C_inf_v

    Geometry (in Angstrom), charge = -1, multiplicity = 2:

    C            0.000000000000     0.000000000000     0.706863540556
    O            0.000000000000     0.000000000000    -0.530316209147


Scratch directory: /tmp/
gradient() will perform analytic gradient computation.
   => Libint2 <=

    Primary   basis highest AM E, G, H:  6, 6, 3
    Auxiliary basis highest AM E, G, H:  7, 7, 4
    Onebody   basis highest AM E, G, H:  -, -, -
    Solid Harmonics ordering:            Gaussian

*** tstart() called on Joses-MacBook-Pro-2.local
*** at Thu Jul 17 09:58:42 2025

   => Loading Basis Set <=

    Name: CC-PVDZ
    Role: ORBITAL
    Keyword: BASIS
    atoms 1 entry C          line   138 file /Users/joseantoniorodriguesromero/anaconda3/share/psi4/basis/cc-pvdz.gbs 
    atoms 2 entry O          line   198 file /Users/joseantoniorodriguesromero/anaconda3/share/psi4/basis/cc-pvdz.gbs 


         ---------------------------------------------------------
                                   SCF
               by Justin Turney, Rob Parrish, Andy Simmonett
                          and Daniel G. A. Smith
                              UKS Reference
                        1 Threads,    500 MiB Core
         ---------------------------------------------------------

  ==> Geometry <==

    Molecular point group: c2v
    Full point group: C_inf_v

    Geometry (in Angstrom), charge = -1, multiplicity = 2:

       Center              X                  Y                   Z               Mass       
    ------------   -----------------  -----------------  -----------------  -----------------
         C            0.000000000000     0.000000000000     0.706863540556    12.000000000000
         O            0.000000000000     0.000000000000    -0.530316209147    15.994914619570

  Running in c2v symmetry.

  Rotational constants: A = ************  B =      1.60637  C =      1.60637 [cm^-1]
  Rotational constants: A = ************  B =  48157.90313  C =  48157.90313 [MHz]
  Nuclear repulsion =   20.530974677091614

  Charge       = -1
  Multiplicity = 2
  Electrons    = 15
  Nalpha       = 8
  Nbeta        = 7

  ==> Algorithm <==

  SCF Algorithm Type is DF.
  DIIS enabled.
  MOM disabled.
  Fractional occupation disabled.
  Guess Type is READ.
  Energy threshold   = 1.00e-08
  Density threshold  = 1.00e-08
  Integral threshold = 1.00e-12

  ==> Primary Basis <==

  Basis Set: CC-PVDZ
    Blend: CC-PVDZ
    Number of shells: 12
    Number of basis functions: 28
    Number of Cartesian functions: 30
    Spherical Harmonics?: true
    Max angular momentum: 2

  ==> DFT Potential <==

   => LibXC <=

    Version 6.2.2
    S. Lehtola, C. Steigemann, M. J.T. Oliveira, and M. A.L. Marques.,  SoftwareX 7, 1–5 (2018) (10.1016/j.softx.2017.11.002)

   => Composite Functional: B3LYP <= 

    B3LYP Hyb-GGA Exchange-Correlation Functional

    P. J. Stephens, F. J. Devlin, C. F. Chabalowski, and M. J. Frisch.,  J. Phys. Chem. 98, 11623 (1994) (10.1021/j100096a001)

    Deriv               =              1
    GGA                 =           TRUE
    Meta                =          FALSE

    Exchange Hybrid     =           TRUE
    MP2 Hybrid          =          FALSE

   => Exchange Functionals <=

    0.0800   Slater exchange
    0.7200         Becke 88

   => Exact (HF) Exchange <=

    0.2000               HF 

   => Correlation Functionals <=

    0.1900   Vosko, Wilk & Nusair (VWN5_RPA)
    0.8100   Lee, Yang & Parr

   => LibXC Density Thresholds  <==

    XC_HYB_GGA_XC_B3LYP:  1.00E-15 

   => Molecular Quadrature <=

    Radial Scheme          =       TREUTLER
    Pruning Scheme         =           NONE
    Nuclear Scheme         =       TREUTLER

    Blocking Scheme        =         OCTREE
    BS radius alpha        =              1
    Pruning alpha          =              1
    Radial Points          =             75
    Spherical Points       =            302
    Total Points           =          42751
    Total Blocks           =            380
    Max Points             =            256
    Max Functions          =             28
    Weights Tolerance      =       1.00E-15

   => Loading Basis Set <=

    Name: (CC-PVDZ AUX)
    Role: JKFIT
    Keyword: DF_BASIS_SCF
    atoms 1 entry C          line   121 file /Users/joseantoniorodriguesromero/anaconda3/share/psi4/basis/cc-pvdz-jkfit.gbs 
    atoms 2 entry O          line   221 file /Users/joseantoniorodriguesromero/anaconda3/share/psi4/basis/cc-pvdz-jkfit.gbs 

   => Loading Basis Set <=

    Name: CC-PVDZ
    Role: ORBITAL
    Keyword: BASIS
    atoms 1 entry C          line   138 file /Users/joseantoniorodriguesromero/anaconda3/share/psi4/basis/cc-pvdz.gbs 
    atoms 2 entry O          line   198 file /Users/joseantoniorodriguesromero/anaconda3/share/psi4/basis/cc-pvdz.gbs 

  Reading orbitals from file /tmp/doublet_CO.default.72436.180.npy, no projection.

  ==> Integral Setup <==

  DFHelper Memory: AOs need 0.001 GiB; user supplied 0.332 GiB. 
  Using in-core AOs.

  ==> MemDFJK: Density-Fitted J/K Matrices <==

    J tasked:                   Yes
    K tasked:                   Yes
    wK tasked:                   No
    OpenMP threads:               1
    Memory [MiB]:               340
    Algorithm:                 Core
    Schwarz Cutoff:           1E-12
    Mask sparsity (%):       0.0000
    Fitting Condition:        1E-10

   => Auxiliary Basis Set <=

  Basis Set: (CC-PVDZ AUX)
    Blend: CC-PVDZ-JKFIT
    Number of shells: 48
    Number of basis functions: 140
    Number of Cartesian functions: 162
    Spherical Harmonics?: true
    Max angular momentum: 3

  Cached 100.0% of DFT collocation blocks in 0.034 [GiB].

  Minimum eigenvalue in the overlap matrix is 2.4855210204E-02.
  Reciprocal condition number of the overlap matrix is 8.3484562336E-03.
    Using symmetric orthogonalization.

  ==> Pre-Iterations <==

  SCF Guess: Orbitals guess was supplied from a previous computation.

   -------------------------------------------------------
    Irrep   Nso     Nmo     Nalpha   Nbeta   Ndocc  Nsocc
   -------------------------------------------------------
     A1        14      14       5       5       5       0
     A2         2       2       0       0       0       0
     B1         6       6       1       1       1       0
     B2         6       6       2       1       1       1
   -------------------------------------------------------
    Total      28      28       8       7       7       1
   -------------------------------------------------------

  ==> Iterations <==

                           Total Energy        Delta E     RMS |[F,P]|

   @DF-UKS iter   0:  -113.23128448235204   -1.13231e+02   1.63391e-04 
   @DF-UKS iter   1:  -113.23185319277526   -5.68710e-04   6.63860e-05 DIIS
   @DF-UKS iter   2:  -113.23185140165644    1.79112e-06   1.47960e-04 ADIIS/DIIS/DAMP=1%
   @DF-UKS iter   3:  -113.23181327111507    3.81305e-05   6.66100e-06 DIIS/DAMP=1%
   @DF-UKS iter   4:  -113.23185082809105   -3.75570e-05   2.49489e-06 DIIS/DAMP=1%
   @DF-UKS iter   5:  -113.23185360393600   -2.77584e-06   3.59608e-07 DIIS/DAMP=1%
   @DF-UKS iter   6:  -113.23185354533720    5.85988e-08   5.97216e-08 DIIS/DAMP=1%
   @DF-UKS iter   7:  -113.23185372080283   -1.75466e-07   1.72951e-08 DIIS/DAMP=1%
   @DF-UKS iter   8:  -113.23185370877906    1.20238e-08   4.49549e-09 DIIS/DAMP=1%
   @DF-UKS iter   9:  -113.23185370558599    3.19307e-09   4.99635e-10 DIIS/DAMP=1%
  Energy and wave function converged.


  ==> Post-Iterations <==

   Electrons on quadrature grid:
      Nalpha   =    7.9999998901 ; deviation = -1.099e-07
      Nbeta    =    6.9999999305 ; deviation = -6.954e-08
      Ntotal   =   14.9999998205 ; deviation = -1.795e-07 

   @Spin Contamination Metric:   2.246606519E-03
   @S^2 Expected:                7.500000000E-01
   @S^2 Observed:                7.522466065E-01
   @S   Expected:                5.000000000E-01
   @S   Observed:                5.000000000E-01

    Orbital Energies [Eh]
    ---------------------

    Alpha Occupied:                                                       

       1A1   -18.843120     2A1    -9.898623     3A1    -0.724619  
       4A1    -0.212728     1B2    -0.090123     1B1    -0.073052  
       5A1    -0.019862     2B2     0.203439  

    Alpha Virtual:                                                        

       2B1     0.292285     6A1     0.518820     3B2     0.764781  
       3B1     0.782545     7A1     0.862974     8A1     0.960084  
       9A1     1.152302     4B2     1.262083     4B1     1.267330  
       1A2     1.464155    10A1     1.467852     5B2     1.597948  
       5B1     1.599420    11A1     1.998860    12A1     2.186277  
       2A2     2.921597    13A1     2.922425     6B1     3.307159  
       6B2     3.308017    14A1     3.672378  

    Beta Occupied:                                                        

       1A1   -18.835576     2A1    -9.889090     3A1    -0.708422  
       4A1    -0.189402     1B1    -0.066273     1B2    -0.038383  
       5A1     0.004565  

    Beta Virtual:                                                         

       2B1     0.304459     2B2     0.338356     6A1     0.527200  
       3B1     0.791614     3B2     0.819982     7A1     0.881138  
       8A1     0.978795     9A1     1.158435     4B1     1.270942  
       4B2     1.289773     1A2     1.507610    10A1     1.507757  
       5B1     1.602808     5B2     1.633342    11A1     2.007958  
      12A1     2.201898    13A1     2.944598     2A2     2.944615  
       6B1     3.310559     6B2     3.334595    14A1     3.684321  

    Final Occupation by Irrep:
             A1    A2    B1    B2 
    DOCC [     5,    0,    1,    1 ]
    SOCC [     0,    0,    0,    1 ]
    NA   [     5,    0,    1,    2 ]
    NB   [     5,    0,    1,    1 ]

  @DF-UKS Final Energy:  -113.23185370558599

   => Energetics <=

    Nuclear Repulsion Energy =             20.5309746770916135
    One-Electron Energy =                -199.8923755386865935
    Two-Electron Energy =                  77.6062272500822559
    DFT Exchange-Correlation Energy =     -11.4766800940732807
    Empirical Dispersion Energy =           0.0000000000000000
    VV10 Nonlocal Energy =                  0.0000000000000000
    Total Energy =                       -113.2318537055859906

  UHF NO Occupations:
  HONO-2 :    1 B2 1.9995383
  HONO-1 :    5 A1 1.9994348
  HONO-0 :    2 B2 1.0000000
  LUNO+0 :    6 A1 0.0005652
  LUNO+1 :    3 B2 0.0004617
  LUNO+2 :    2 B1 0.0000514
  LUNO+3 :    7 A1 0.0000414


Computation Completed


Properties will be evaluated at   0.000000,   0.000000,   0.000000 [a0]

Properties computed using the SCF density matrix


 Multipole Moments:

 ------------------------------------------------------------------------------------
     Multipole            Electronic (a.u.)      Nuclear  (a.u.)        Total (a.u.)
 ------------------------------------------------------------------------------------

 L = 1.  Multiply by 2.5417464519 to convert [e a0] to [Debye]
 Dipole X            :          0.0000000            0.0000000            0.0000000
 Dipole Y            :          0.0000000            0.0000000            0.0000000
 Dipole Z            :         -0.7443795           -0.0025482           -0.7469277
 Magnitude           :                                                    0.7469277

 ------------------------------------------------------------------------------------

*** tstop() called on Joses-MacBook-Pro-2.local at Thu Jul 17 09:58:43 2025
Module time:
	user time   =       4.59 seconds =       0.08 minutes
	system time =       3.66 seconds =       0.06 minutes
	total time  =          1 seconds =       0.02 minutes
Total time:
	user time   =      21.70 seconds =       0.36 minutes
	system time =      18.74 seconds =       0.31 minutes
	total time  =          4 seconds =       0.07 minutes

*** tstart() called on Joses-MacBook-Pro-2.local
*** at Thu Jul 17 09:58:43 2025


         ------------------------------------------------------------
                                   SCF GRAD                          
                          Rob Parrish, Justin Turney,                
                       Andy Simmonett, and Alex Sokolov              
         ------------------------------------------------------------

  ==> Geometry <==

    Molecular point group: c2v
    Full point group: C_inf_v

    Geometry (in Angstrom), charge = -1, multiplicity = 2:

       Center              X                  Y                   Z               Mass       
    ------------   -----------------  -----------------  -----------------  -----------------
         C            0.000000000000     0.000000000000     0.706863540556    12.000000000000
         O            0.000000000000     0.000000000000    -0.530316209147    15.994914619570

  Nuclear repulsion =   20.530974677091614

  ==> Basis Set <==

  Basis Set: CC-PVDZ
    Blend: CC-PVDZ
    Number of shells: 12
    Number of basis functions: 28
    Number of Cartesian functions: 30
    Spherical Harmonics?: true
    Max angular momentum: 2

  ==> DFJKGrad: Density-Fitted SCF Gradients <==

    Gradient:                    1
    J tasked:                  Yes
    K tasked:                  Yes
    wK tasked:                  No
    OpenMP threads:              1
    Integrals threads:           1
    Memory [MiB]:              375
    Schwarz Cutoff:          1E-12
    Fitting Condition:       1E-10

   => Auxiliary Basis Set <=

  Basis Set: (CC-PVDZ AUX)
    Blend: CC-PVDZ-JKFIT
    Number of shells: 48
    Number of basis functions: 140
    Number of Cartesian functions: 162
    Spherical Harmonics?: true
    Max angular momentum: 3

  ==> DFT Potential <==

   => LibXC <=

    Version 6.2.2
    S. Lehtola, C. Steigemann, M. J.T. Oliveira, and M. A.L. Marques.,  SoftwareX 7, 1–5 (2018) (10.1016/j.softx.2017.11.002)

   => Composite Functional: B3LYP <= 

    B3LYP Hyb-GGA Exchange-Correlation Functional

    P. J. Stephens, F. J. Devlin, C. F. Chabalowski, and M. J. Frisch.,  J. Phys. Chem. 98, 11623 (1994) (10.1021/j100096a001)

    Deriv               =              1
    GGA                 =           TRUE
    Meta                =          FALSE

    Exchange Hybrid     =           TRUE
    MP2 Hybrid          =          FALSE

   => Exchange Functionals <=

    0.0800   Slater exchange
    0.7200         Becke 88

   => Exact (HF) Exchange <=

    0.2000               HF 

   => Correlation Functionals <=

    0.1900   Vosko, Wilk & Nusair (VWN5_RPA)
    0.8100   Lee, Yang & Parr

   => LibXC Density Thresholds  <==

    XC_HYB_GGA_XC_B3LYP:  1.00E-15 

   => Molecular Quadrature <=

    Radial Scheme          =       TREUTLER
    Pruning Scheme         =           NONE
    Nuclear Scheme         =       TREUTLER

    Blocking Scheme        =         OCTREE
    BS radius alpha        =              1
    Pruning alpha          =              1
    Radial Points          =             75
    Spherical Points       =            302
    Total Points           =          42751
    Total Blocks           =            380
    Max Points             =            256
    Max Functions          =             28
    Weights Tolerance      =       1.00E-15


  -Total Gradient:
     Atom            X                  Y                   Z
    ------   -----------------  -----------------  -----------------
       1       -0.000000000000     0.000000000000    -0.000149902111
       2        0.000000000000    -0.000000000000     0.000154312374


*** tstop() called on Joses-MacBook-Pro-2.local at Thu Jul 17 09:58:43 2025
Module time:
	user time   =       0.62 seconds =       0.01 minutes
	system time =       0.92 seconds =       0.02 minutes
	total time  =          0 seconds =       0.00 minutes
Total time:
	user time   =      22.33 seconds =       0.37 minutes
	system time =      19.68 seconds =       0.33 minutes
	total time  =          4 seconds =       0.07 minutes

    			-----------------------------------------

    			 OPTKING 3.0: for geometry optimizations 

    			     By R.A. King, Bethel University     

    			        with contributions from          

    			    A.V. Copan, J. Cayton, A. Heide      

    			-----------------------------------------

    
	                            ===> Fragment 1 <== 

	 Z (Atomic Numbers)          Masses                          Geom                  
	       6.000000            12.000000          0.00000000  0.00000000  1.33577850   
	       8.000000            15.994915          0.00000000  0.00000000 -1.00215240   

	 - Coordinate -           - BOHR/RAD -       - ANG/DEG -
	 R(1,2)           =         2.337931           1.237180


	        --- Internal Coordinate Step in ANG or DEG, aJ/ANG or AJ/DEG ---
	-------------------------------------------------------------------------------
	           Coordinate      Previous         Force          Change          New 
	           ----------      --------        ------          ------        ------
	               R(1,2)       1.23718        0.00125        0.00010       1.23728
	-------------------------------------------------------------------------------

	                                 ==> Convergence Check <==                                  
    
	Measures of convergence in internal coordinates in au.
    
	Criteria marked as inactive (o), active & met (*), and active & unmet ( ).

	----------------------------------------------------------------------------------------------
	   Step    Total Energy     Delta E     Max Force     RMS Force      Max Disp      RMS Disp   
	----------------------------------------------------------------------------------------------
	  Convergence Criteria     1.00e-06 *    3.00e-04 *             o    1.20e-03 *             o
	----------------------------------------------------------------------------------------------
	     4    -113.23185371   -1.13e-06      1.52e-04 *    1.52e-04 o    1.84e-04 *    1.84e-04 o  ~
	----------------------------------------------------------------------------------------------

Next Geometry in Ang 
	Fragment 1 (Ang)

	    C   0.0000000000   0.0000000000   0.7069123246
	    O   0.0000000000   0.0000000000  -0.5303649932


    Final optimized geometry and variables:
    Molecular point group: c2v
    Full point group: C_inf_v

    Geometry (in Angstrom), charge = -1, multiplicity = 2:

    C            0.000000000000     0.000000000000     0.706863540556
    O            0.000000000000     0.000000000000    -0.530316209147


    Psi4 stopped on: Thursday, 17 July 2025 09:58AM
    Psi4 wall time for execution: 0:00:04.85

*** Psi4 exiting successfully. Buy a developer a beer!
