
    -----------------------------------------------------------------------
          Psi4: An Open-Source Ab Initio Electronic Structure Package
                               Psi4 1.9.1 release

                         Git: Rev {} zzzzzzz 


    D. G. A. Smith, L. A. Burns, A. C. Simmonett, R. M. Parrish,
    M. C. Schieber, R. Galvelis, P. Kraus, H. Kruse, R. Di Remigio,
    A. Alenaizan, A. M. James, S. Lehtola, J. P. Misiewicz, M. Scheurer,
    R. A. Shaw, J. B. Schriber, Y. Xie, Z. L. Glick, D. A. Sirianni,
    J. S. O'Brien, J. M. Waldrop, A. Kumar, E. G. Hohenstein,
    B. P. Pritchard, B. R. Brooks, H. F. Schaefer III, A. Yu. Sokolov,
    K. Patkowski, A. E. DePrince III, U. Bozkaya, R. A. King,
    F. A. Evangelista, J. M. Turney, T. D. Crawford, C. D. Sherrill,
    J. Chem. Phys. 152(18) 184108 (2020). https://doi.org/10.1063/5.0006002

                            Additional Code Authors
    E. T. Seidl, C. L. Janssen, E. F. Valeev, M. L. Leininger,
    J. F. Gonthier, R. M. Richard, H. R. McAlexander, M. Saitow, X. Wang,
    P. Verma, M. H. Lechner, A. Jiang, S. Behnle, A. G. Heide,
    M. F. Herbst, and D. L. Poole

             Previous Authors, Complete List of Code Contributors,
                       and Citations for Specific Modules
    https://github.com/psi4/psi4/blob/master/codemeta.json
    https://github.com/psi4/psi4/graphs/contributors
    http://psicode.org/psi4manual/master/introduction.html#citing-psifour

    -----------------------------------------------------------------------


    Psi4 started on: Thursday, 17 July 2025 09:20AM

    Process ID: 71845
    Host:       Joses-MacBook-Pro-2.local
    PSIDATADIR: /Users/joseantoniorodriguesromero/anaconda3/share/psi4
    Memory:     500.0 MiB
    Threads:    1
    
  ==> Input File <==

--------------------------------------------------------------------------
molecule { 
-1 5
He   0.00000        0.60000        0.00000
F   0.00000       -0.60000        0.00000
}

set { 
basis              cc-pvdz
reference          uks
maxiter            500
geom_maxiter       500
DAMPING_PERCENTAGE 1
guess              SAP
}

optimize('b3lyp')
--------------------------------------------------------------------------

Scratch directory: /tmp/
gradient() will perform analytic gradient computation.
   => Libint2 <=

    Primary   basis highest AM E, G, H:  6, 6, 3
    Auxiliary basis highest AM E, G, H:  7, 7, 4
    Onebody   basis highest AM E, G, H:  -, -, -
    Solid Harmonics ordering:            Gaussian

*** tstart() called on Joses-MacBook-Pro-2.local
*** at Thu Jul 17 09:20:23 2025

   => Loading Basis Set <=

    Name: CC-PVDZ
    Role: ORBITAL
    Keyword: BASIS
    atoms 1 entry HE         line    32 file /Users/joseantoniorodriguesromero/anaconda3/share/psi4/basis/cc-pvdz.gbs 
    atoms 2 entry F          line   228 file /Users/joseantoniorodriguesromero/anaconda3/share/psi4/basis/cc-pvdz.gbs 


         ---------------------------------------------------------
                                   SCF
               by Justin Turney, Rob Parrish, Andy Simmonett
                          and Daniel G. A. Smith
                              UKS Reference
                        1 Threads,    500 MiB Core
         ---------------------------------------------------------

  ==> Geometry <==

    Molecular point group: c2v
    Full point group: C_inf_v

    Geometry (in Angstrom), charge = -1, multiplicity = 5:

       Center              X                  Y                   Z               Mass       
    ------------   -----------------  -----------------  -----------------  -----------------
         HE           0.000000000000     0.000000000000     0.991177663364     4.002603254130
         F            0.000000000000     0.000000000000    -0.208822336636    18.998403162730

  Running in c2v symmetry.

  Rotational constants: A = ************  B =      3.54096  C =      3.54096 [cm^-1]
  Rotational constants: A = ************  B = 106155.35395  C = 106155.35395 [MHz]
  Nuclear repulsion =    7.937658160050002

  Charge       = -1
  Multiplicity = 5
  Electrons    = 12
  Nalpha       = 8
  Nbeta        = 4

  ==> Algorithm <==

  SCF Algorithm Type is DF.
  DIIS enabled.
  MOM disabled.
  Fractional occupation disabled.
  Guess Type is SAP.
  Energy threshold   = 1.00e-08
  Density threshold  = 1.00e-08
  Integral threshold = 1.00e-12

  ==> Primary Basis <==

  Basis Set: CC-PVDZ
    Blend: CC-PVDZ
    Number of shells: 9
    Number of basis functions: 19
    Number of Cartesian functions: 20
    Spherical Harmonics?: true
    Max angular momentum: 2

  ==> DFT Potential <==

   => LibXC <=

    Version 6.2.2
    S. Lehtola, C. Steigemann, M. J.T. Oliveira, and M. A.L. Marques.,  SoftwareX 7, 1–5 (2018) (10.1016/j.softx.2017.11.002)

   => Composite Functional: B3LYP <= 

    B3LYP Hyb-GGA Exchange-Correlation Functional

    P. J. Stephens, F. J. Devlin, C. F. Chabalowski, and M. J. Frisch.,  J. Phys. Chem. 98, 11623 (1994) (10.1021/j100096a001)

    Deriv               =              1
    GGA                 =           TRUE
    Meta                =          FALSE

    Exchange Hybrid     =           TRUE
    MP2 Hybrid          =          FALSE

   => Exchange Functionals <=

    0.0800   Slater exchange
    0.7200         Becke 88

   => Exact (HF) Exchange <=

    0.2000               HF 

   => Correlation Functionals <=

    0.1900   Vosko, Wilk & Nusair (VWN5_RPA)
    0.8100   Lee, Yang & Parr

   => LibXC Density Thresholds  <==

    XC_HYB_GGA_XC_B3LYP:  1.00E-15 

   => Molecular Quadrature <=

    Radial Scheme          =       TREUTLER
    Pruning Scheme         =           NONE
    Nuclear Scheme         =       TREUTLER

    Blocking Scheme        =         OCTREE
    BS radius alpha        =              1
    Pruning alpha          =              1
    Radial Points          =             75
    Spherical Points       =            302
    Total Points           =          43261
    Total Blocks           =            380
    Max Points             =            255
    Max Functions          =             19
    Weights Tolerance      =       1.00E-15

   => Loading Basis Set <=

    Name: (CC-PVDZ AUX)
    Role: JKFIT
    Keyword: DF_BASIS_SCF
    atoms 1 entry HE         line    34 file /Users/joseantoniorodriguesromero/anaconda3/share/psi4/basis/def2-universal-jkfit.gbs 
    atoms 2 entry F          line   271 file /Users/joseantoniorodriguesromero/anaconda3/share/psi4/basis/cc-pvdz-jkfit.gbs 

  ==> Integral Setup <==

  DFHelper Memory: AOs need 0.000 GiB; user supplied 0.343 GiB. 
  Using in-core AOs.

  ==> MemDFJK: Density-Fitted J/K Matrices <==

    J tasked:                   Yes
    K tasked:                   Yes
    wK tasked:                   No
    OpenMP threads:               1
    Memory [MiB]:               350
    Algorithm:                 Core
    Schwarz Cutoff:           1E-12
    Mask sparsity (%):       0.0000
    Fitting Condition:        1E-10

   => Auxiliary Basis Set <=

  Basis Set: (CC-PVDZ AUX)
    Blend: CC-PVDZ-JKFIT + DEF2-UNIVERSAL-JKFIT
    Number of shells: 33
    Number of basis functions: 93
    Number of Cartesian functions: 106
    Spherical Harmonics?: true
    Max angular momentum: 3

  Cached 100.0% of DFT collocation blocks in 0.024 [GiB].

  Minimum eigenvalue in the overlap matrix is 1.0404291457E-01.
  Reciprocal condition number of the overlap matrix is 4.3367024170E-02.
    Using symmetric orthogonalization.

  ==> Pre-Iterations <==

  SCF Guess: Superposition of Atomic Potentials (doi:10.1021/acs.jctc.8b01089).

  ==> SAP guess <==

   => Molecular Quadrature <=

    Radial Scheme          =       TREUTLER
    Pruning Scheme         =           NONE
    Nuclear Scheme         =       TREUTLER

    Blocking Scheme        =         OCTREE
    BS radius alpha        =              1
    Pruning alpha          =              1
    Radial Points          =             75
    Spherical Points       =            302
    Total Points           =          43261
    Total Blocks           =            380
    Max Points             =            255
    Max Functions          =             19
    Weights Tolerance      =       1.00E-15

   -------------------------------------------------------
    Irrep   Nso     Nmo     Nalpha   Nbeta   Ndocc  Nsocc
   -------------------------------------------------------
     A1        10      10       5       3       3       2
     A2         1       1       0       0       0       0
     B1         4       4       2       1       1       1
     B2         4       4       1       0       0       1
   -------------------------------------------------------
    Total      19      19       8       4       4       4
   -------------------------------------------------------

  ==> Iterations <==

                           Total Energy        Delta E     RMS |[F,P]|

   @DF-UKS iter   1:  -100.09329253829486   -1.00093e+02   2.28381e-02 ADIIS/DIIS
   @DF-UKS iter   2:  -100.11779003017689   -2.44975e-02   8.39617e-03 ADIIS/DIIS/DAMP=1%
   @DF-UKS iter   3:  -100.11961903086748   -1.82900e-03   1.70835e-03 ADIIS/DIIS/DAMP=1%
   @DF-UKS iter   4:  -100.12049280859027   -8.73778e-04   1.72606e-03 ADIIS/DIIS/DAMP=1%
   @DF-UKS iter   5:  -100.12148209525718   -9.89287e-04   1.71765e-04 ADIIS/DIIS/DAMP=1%
   @DF-UKS iter   6:  -100.12105394839438    4.28147e-04   4.11429e-05 DIIS/DAMP=1%
   @DF-UKS iter   7:  -100.12110089514321   -4.69467e-05   4.00818e-06 DIIS/DAMP=1%
   @DF-UKS iter   8:  -100.12109464305092    6.25209e-06   1.80515e-06 DIIS/DAMP=1%
   @DF-UKS iter   9:  -100.12109458073888    6.23120e-08   2.83635e-07 DIIS/DAMP=1%
   @DF-UKS iter  10:  -100.12109446402502    1.16714e-07   2.88283e-08 DIIS/DAMP=1%
   @DF-UKS iter  11:  -100.12109446141312    2.61190e-09   1.70423e-09 DIIS/DAMP=1%
  Energy and wave function converged.


  ==> Post-Iterations <==

   Electrons on quadrature grid:
      Nalpha   =    8.0000000893 ; deviation = 8.934e-08
      Nbeta    =    4.0000000157 ; deviation = 1.570e-08
      Ntotal   =   12.0000001050 ; deviation = 1.050e-07 

   @Spin Contamination Metric:   3.820377548E-03
   @S^2 Expected:                6.000000000E+00
   @S^2 Observed:                6.003820378E+00
   @S   Expected:                2.000000000E+00
   @S   Observed:                2.000000000E+00

    Orbital Energies [Eh]
    ---------------------

    Alpha Occupied:                                                       

       1A1   -24.287256     2A1    -0.909571     3A1    -0.392464  
       1B2    -0.183730     1B1    -0.112495     4A1    -0.008395  
       5A1     1.242128     2B1     1.285134  

    Alpha Virtual:                                                        

       2B2     1.354817     6A1     1.522873     7A1     1.911655  
       3B2     2.563528     3B1     2.569657     8A1     2.783216  
       1A2     3.838226     9A1     3.839296     4B2     3.848566  
       4B1     3.934008    10A1     4.608352  

    Beta Occupied:                                                        

       1A1   -24.188469     2A1    -0.721754     3A1    -0.215029  
       1B1     0.030334  

    Beta Virtual:                                                         

       1B2     0.141925     4A1     0.297367     5A1     1.491842  
       2B2     1.512222     2B1     1.524222     6A1     1.702637  
       7A1     2.058176     3B2     2.630959     3B1     2.642625  
       8A1     2.876831     1A2     3.964033     9A1     3.977017  
       4B2     4.026648     4B1     4.042296    10A1     4.743100  

    Final Occupation by Irrep:
             A1    A2    B1    B2 
    DOCC [     3,    0,    1,    0 ]
    SOCC [     2,    0,    1,    1 ]
    NA   [     5,    0,    2,    1 ]
    NB   [     3,    0,    1,    0 ]

  @DF-UKS Final Energy:  -100.12109446141312

   => Energetics <=

    Nuclear Repulsion Energy =              7.9376581600500016
    One-Electron Energy =                -160.6599775448829632
    Two-Electron Energy =                  62.3578239647178449
    DFT Exchange-Correlation Energy =      -9.7565990412980117
    Empirical Dispersion Energy =           0.0000000000000000
    VV10 Nonlocal Energy =                  0.0000000000000000
    Total Energy =                       -100.1210944614131222

  UHF NO Occupations:
  HONO-2 :    2 B1 1.0000000
  HONO-1 :    4 A1 1.0000000
  HONO-0 :    5 A1 1.0000000
  LUNO+0 :    6 A1 0.0013842
  LUNO+1 :    7 A1 0.0005217
  LUNO+2 :    3 B1 0.0000052
  LUNO+3 :    8 A1 0.0000001


Computation Completed


Properties will be evaluated at   0.000000,   0.000000,   0.000000 [a0]

Properties computed using the SCF density matrix


 Multipole Moments:

 ------------------------------------------------------------------------------------
     Multipole            Electronic (a.u.)      Nuclear  (a.u.)        Total (a.u.)
 ------------------------------------------------------------------------------------

 L = 1.  Multiply by 2.5417464519 to convert [e a0] to [Debye]
 Dipole X            :          0.0000000            0.0000000            0.0000000
 Dipole Y            :          0.0000000            0.0000000            0.0000000
 Dipole Z            :         -0.6821182            0.1945554           -0.4875628
 Magnitude           :                                                    0.4875628

 ------------------------------------------------------------------------------------

*** tstop() called on Joses-MacBook-Pro-2.local at Thu Jul 17 09:20:23 2025
Module time:
	user time   =       3.44 seconds =       0.06 minutes
	system time =       2.67 seconds =       0.04 minutes
	total time  =          0 seconds =       0.00 minutes
Total time:
	user time   =       3.44 seconds =       0.06 minutes
	system time =       2.67 seconds =       0.04 minutes
	total time  =          0 seconds =       0.00 minutes

*** tstart() called on Joses-MacBook-Pro-2.local
*** at Thu Jul 17 09:20:23 2025


         ------------------------------------------------------------
                                   SCF GRAD                          
                          Rob Parrish, Justin Turney,                
                       Andy Simmonett, and Alex Sokolov              
         ------------------------------------------------------------

  ==> Geometry <==

    Molecular point group: c2v
    Full point group: C_inf_v

    Geometry (in Angstrom), charge = -1, multiplicity = 5:

       Center              X                  Y                   Z               Mass       
    ------------   -----------------  -----------------  -----------------  -----------------
         HE           0.000000000000     0.000000000000     0.991177663364     4.002603254130
         F            0.000000000000     0.000000000000    -0.208822336636    18.998403162730

  Nuclear repulsion =    7.937658160050002

  ==> Basis Set <==

  Basis Set: CC-PVDZ
    Blend: CC-PVDZ
    Number of shells: 9
    Number of basis functions: 19
    Number of Cartesian functions: 20
    Spherical Harmonics?: true
    Max angular momentum: 2

  ==> DFJKGrad: Density-Fitted SCF Gradients <==

    Gradient:                    1
    J tasked:                  Yes
    K tasked:                  Yes
    wK tasked:                  No
    OpenMP threads:              1
    Integrals threads:           1
    Memory [MiB]:              375
    Schwarz Cutoff:          1E-12
    Fitting Condition:       1E-10

   => Auxiliary Basis Set <=

  Basis Set: (CC-PVDZ AUX)
    Blend: CC-PVDZ-JKFIT + DEF2-UNIVERSAL-JKFIT
    Number of shells: 33
    Number of basis functions: 93
    Number of Cartesian functions: 106
    Spherical Harmonics?: true
    Max angular momentum: 3

  ==> DFT Potential <==

   => LibXC <=

    Version 6.2.2
    S. Lehtola, C. Steigemann, M. J.T. Oliveira, and M. A.L. Marques.,  SoftwareX 7, 1–5 (2018) (10.1016/j.softx.2017.11.002)

   => Composite Functional: B3LYP <= 

    B3LYP Hyb-GGA Exchange-Correlation Functional

    P. J. Stephens, F. J. Devlin, C. F. Chabalowski, and M. J. Frisch.,  J. Phys. Chem. 98, 11623 (1994) (10.1021/j100096a001)

    Deriv               =              1
    GGA                 =           TRUE
    Meta                =          FALSE

    Exchange Hybrid     =           TRUE
    MP2 Hybrid          =          FALSE

   => Exchange Functionals <=

    0.0800   Slater exchange
    0.7200         Becke 88

   => Exact (HF) Exchange <=

    0.2000               HF 

   => Correlation Functionals <=

    0.1900   Vosko, Wilk & Nusair (VWN5_RPA)
    0.8100   Lee, Yang & Parr

   => LibXC Density Thresholds  <==

    XC_HYB_GGA_XC_B3LYP:  1.00E-15 

   => Molecular Quadrature <=

    Radial Scheme          =       TREUTLER
    Pruning Scheme         =           NONE
    Nuclear Scheme         =       TREUTLER

    Blocking Scheme        =         OCTREE
    BS radius alpha        =              1
    Pruning alpha          =              1
    Radial Points          =             75
    Spherical Points       =            302
    Total Points           =          43261
    Total Blocks           =            380
    Max Points             =            255
    Max Functions          =             19
    Weights Tolerance      =       1.00E-15


  -Total Gradient:
     Atom            X                  Y                   Z
    ------   -----------------  -----------------  -----------------
       1        0.000000000000    -0.000000000000    -0.008400395244
       2       -0.000000000000     0.000000000000     0.008398659441


*** tstop() called on Joses-MacBook-Pro-2.local at Thu Jul 17 09:20:23 2025
Module time:
	user time   =       0.47 seconds =       0.01 minutes
	system time =       0.76 seconds =       0.01 minutes
	total time  =          0 seconds =       0.00 minutes
Total time:
	user time   =       3.91 seconds =       0.07 minutes
	system time =       3.43 seconds =       0.06 minutes
	total time  =          0 seconds =       0.00 minutes

    			-----------------------------------------

    			 OPTKING 3.0: for geometry optimizations 

    			     By R.A. King, Bethel University     

    			        with contributions from          

    			    A.V. Copan, J. Cayton, A. Heide      

    			-----------------------------------------

    
	                            ===> Fragment 1 <== 

	 Z (Atomic Numbers)          Masses                          Geom                  
	       2.000000             4.002603          0.00000000  0.00000000  1.87305433   
	       9.000000            18.998403          0.00000000  0.00000000 -0.39461703   

	 - Coordinate -           - BOHR/RAD -       - ANG/DEG -
	 R(1,2)           =         2.267671           1.200000


	        --- Internal Coordinate Step in ANG or DEG, aJ/ANG or AJ/DEG ---
	-------------------------------------------------------------------------------
	           Coordinate      Previous         Force          Change          New 
	           ----------      --------        ------          ------        ------
	               R(1,2)       1.20000        0.06920        0.01800       1.21800
	-------------------------------------------------------------------------------

	                                 ==> Convergence Check <==                                  
    
	Measures of convergence in internal coordinates in au.
    
	Criteria marked as inactive (o), active & met (*), and active & unmet ( ).

	----------------------------------------------------------------------------------------------
	   Step    Total Energy     Delta E     Max Force     RMS Force      Max Disp      RMS Disp   
	----------------------------------------------------------------------------------------------
	  Convergence Criteria     1.00e-06 *    3.00e-04 *             o    1.20e-03 *             o
	----------------------------------------------------------------------------------------------
	     1    -100.12109446   -1.00e+02      8.40e-03      8.40e-03 o    3.40e-02      3.40e-02 o  ~
	----------------------------------------------------------------------------------------------

Next Geometry in Ang 
	Fragment 1 (Ang)

	   He   0.0000000000   0.0000000000   1.0001775520
	    F   0.0000000000   0.0000000000  -0.2178222253


    Structure for next step:
    Molecular point group: c2v
    Full point group: C_inf_v

    Geometry (in Angstrom), charge = -1, multiplicity = 5:

    HE           0.000000000000     0.000000000000     1.006045144392
    F            0.000000000000     0.000000000000    -0.211954632937


Scratch directory: /tmp/
gradient() will perform analytic gradient computation.
   => Libint2 <=

    Primary   basis highest AM E, G, H:  6, 6, 3
    Auxiliary basis highest AM E, G, H:  7, 7, 4
    Onebody   basis highest AM E, G, H:  -, -, -
    Solid Harmonics ordering:            Gaussian

*** tstart() called on Joses-MacBook-Pro-2.local
*** at Thu Jul 17 09:20:23 2025

   => Loading Basis Set <=

    Name: CC-PVDZ
    Role: ORBITAL
    Keyword: BASIS
    atoms 1 entry HE         line    32 file /Users/joseantoniorodriguesromero/anaconda3/share/psi4/basis/cc-pvdz.gbs 
    atoms 2 entry F          line   228 file /Users/joseantoniorodriguesromero/anaconda3/share/psi4/basis/cc-pvdz.gbs 


         ---------------------------------------------------------
                                   SCF
               by Justin Turney, Rob Parrish, Andy Simmonett
                          and Daniel G. A. Smith
                              UKS Reference
                        1 Threads,    500 MiB Core
         ---------------------------------------------------------

  ==> Geometry <==

    Molecular point group: c2v
    Full point group: C_inf_v

    Geometry (in Angstrom), charge = -1, multiplicity = 5:

       Center              X                  Y                   Z               Mass       
    ------------   -----------------  -----------------  -----------------  -----------------
         HE           0.000000000000     0.000000000000     1.006045144392     4.002603254130
         F            0.000000000000     0.000000000000    -0.211954632937    18.998403162730

  Running in c2v symmetry.

  Rotational constants: A = ************  B =      3.43708  C =      3.43708 [cm^-1]
  Rotational constants: A = ************  B = 103040.97917  C = 103040.97917 [MHz]
  Nuclear repulsion =    7.820354296740662

  Charge       = -1
  Multiplicity = 5
  Electrons    = 12
  Nalpha       = 8
  Nbeta        = 4

  ==> Algorithm <==

  SCF Algorithm Type is DF.
  DIIS enabled.
  MOM disabled.
  Fractional occupation disabled.
  Guess Type is READ.
  Energy threshold   = 1.00e-08
  Density threshold  = 1.00e-08
  Integral threshold = 1.00e-12

  ==> Primary Basis <==

  Basis Set: CC-PVDZ
    Blend: CC-PVDZ
    Number of shells: 9
    Number of basis functions: 19
    Number of Cartesian functions: 20
    Spherical Harmonics?: true
    Max angular momentum: 2

  ==> DFT Potential <==

   => LibXC <=

    Version 6.2.2
    S. Lehtola, C. Steigemann, M. J.T. Oliveira, and M. A.L. Marques.,  SoftwareX 7, 1–5 (2018) (10.1016/j.softx.2017.11.002)

   => Composite Functional: B3LYP <= 

    B3LYP Hyb-GGA Exchange-Correlation Functional

    P. J. Stephens, F. J. Devlin, C. F. Chabalowski, and M. J. Frisch.,  J. Phys. Chem. 98, 11623 (1994) (10.1021/j100096a001)

    Deriv               =              1
    GGA                 =           TRUE
    Meta                =          FALSE

    Exchange Hybrid     =           TRUE
    MP2 Hybrid          =          FALSE

   => Exchange Functionals <=

    0.0800   Slater exchange
    0.7200         Becke 88

   => Exact (HF) Exchange <=

    0.2000               HF 

   => Correlation Functionals <=

    0.1900   Vosko, Wilk & Nusair (VWN5_RPA)
    0.8100   Lee, Yang & Parr

   => LibXC Density Thresholds  <==

    XC_HYB_GGA_XC_B3LYP:  1.00E-15 

   => Molecular Quadrature <=

    Radial Scheme          =       TREUTLER
    Pruning Scheme         =           NONE
    Nuclear Scheme         =       TREUTLER

    Blocking Scheme        =         OCTREE
    BS radius alpha        =              1
    Pruning alpha          =              1
    Radial Points          =             75
    Spherical Points       =            302
    Total Points           =          43261
    Total Blocks           =            378
    Max Points             =            254
    Max Functions          =             19
    Weights Tolerance      =       1.00E-15

   => Loading Basis Set <=

    Name: (CC-PVDZ AUX)
    Role: JKFIT
    Keyword: DF_BASIS_SCF
    atoms 1 entry HE         line    34 file /Users/joseantoniorodriguesromero/anaconda3/share/psi4/basis/def2-universal-jkfit.gbs 
    atoms 2 entry F          line   271 file /Users/joseantoniorodriguesromero/anaconda3/share/psi4/basis/cc-pvdz-jkfit.gbs 

   => Loading Basis Set <=

    Name: CC-PVDZ
    Role: ORBITAL
    Keyword: BASIS
    atoms 1 entry HE         line    32 file /Users/joseantoniorodriguesromero/anaconda3/share/psi4/basis/cc-pvdz.gbs 
    atoms 2 entry F          line   228 file /Users/joseantoniorodriguesromero/anaconda3/share/psi4/basis/cc-pvdz.gbs 

  Reading orbitals from file /tmp/quintet_HeF.default.71845.180.npy, no projection.

  ==> Integral Setup <==

  DFHelper Memory: AOs need 0.000 GiB; user supplied 0.343 GiB. 
  Using in-core AOs.

  ==> MemDFJK: Density-Fitted J/K Matrices <==

    J tasked:                   Yes
    K tasked:                   Yes
    wK tasked:                   No
    OpenMP threads:               1
    Memory [MiB]:               350
    Algorithm:                 Core
    Schwarz Cutoff:           1E-12
    Mask sparsity (%):       0.0000
    Fitting Condition:        1E-10

   => Auxiliary Basis Set <=

  Basis Set: (CC-PVDZ AUX)
    Blend: CC-PVDZ-JKFIT + DEF2-UNIVERSAL-JKFIT
    Number of shells: 33
    Number of basis functions: 93
    Number of Cartesian functions: 106
    Spherical Harmonics?: true
    Max angular momentum: 3

  Cached 100.0% of DFT collocation blocks in 0.024 [GiB].

  Minimum eigenvalue in the overlap matrix is 1.0715972460E-01.
  Reciprocal condition number of the overlap matrix is 4.5064596997E-02.
    Using symmetric orthogonalization.

  ==> Pre-Iterations <==

  SCF Guess: Orbitals guess was supplied from a previous computation.

   -------------------------------------------------------
    Irrep   Nso     Nmo     Nalpha   Nbeta   Ndocc  Nsocc
   -------------------------------------------------------
     A1        10      10       5       3       3       2
     A2         1       1       0       0       0       0
     B1         4       4       2       1       1       1
     B2         4       4       1       0       0       1
   -------------------------------------------------------
    Total      19      19       8       4       4       4
   -------------------------------------------------------

  ==> Iterations <==

                           Total Energy        Delta E     RMS |[F,P]|

   @DF-UKS iter   0:  -100.11229569970334   -1.00112e+02   6.06266e-03 
   @DF-UKS iter   1:  -100.12107872511748   -8.78303e-03   6.24771e-04 ADIIS/DIIS
   @DF-UKS iter   2:  -100.12107160946647    7.11565e-06   8.73062e-04 ADIIS/DIIS/DAMP=1%
   @DF-UKS iter   3:  -100.12132030727452   -2.48698e-04   1.37514e-04 ADIIS/DIIS/DAMP=1%
   @DF-UKS iter   4:  -100.12109462611751    2.25681e-04   1.06751e-04 ADIIS/DIIS/DAMP=1%
   @DF-UKS iter   5:  -100.12113075360283   -3.61275e-05   3.02071e-05 DIIS/DAMP=1%
   @DF-UKS iter   6:  -100.12113131467767   -5.61075e-07   3.54452e-06 DIIS/DAMP=1%
   @DF-UKS iter   7:  -100.12112631078672    5.00389e-06   7.87967e-07 DIIS/DAMP=1%
   @DF-UKS iter   8:  -100.12112670448801   -3.93701e-07   6.65938e-08 DIIS/DAMP=1%
   @DF-UKS iter   9:  -100.12112659004609    1.14442e-07   8.71202e-09 DIIS/DAMP=1%
   @DF-UKS iter  10:  -100.12112658199516    8.05093e-09   4.50150e-10 DIIS/DAMP=1%
  Energy and wave function converged.


  ==> Post-Iterations <==

   Electrons on quadrature grid:
      Nalpha   =    8.0000000938 ; deviation = 9.378e-08
      Nbeta    =    4.0000000178 ; deviation = 1.782e-08
      Ntotal   =   12.0000001116 ; deviation = 1.116e-07 

   @Spin Contamination Metric:   3.814806204E-03
   @S^2 Expected:                6.000000000E+00
   @S^2 Observed:                6.003814806E+00
   @S   Expected:                2.000000000E+00
   @S   Observed:                2.000000000E+00

    Orbital Energies [Eh]
    ---------------------

    Alpha Occupied:                                                       

       1A1   -24.289197     2A1    -0.907799     3A1    -0.389431  
       1B2    -0.184559     1B1    -0.113200     4A1    -0.018450  
       5A1     1.247986     2B1     1.284559  

    Alpha Virtual:                                                        

       2B2     1.354095     6A1     1.524499     7A1     1.899363  
       3B2     2.567169     3B1     2.572628     8A1     2.778349  
       1A2     3.837567     4B2     3.837949     9A1     3.838471  
       4B1     3.923807    10A1     4.566096  

    Beta Occupied:                                                        

       1A1   -24.189780     2A1    -0.718610     3A1    -0.214231  
       1B1     0.030044  

    Beta Virtual:                                                         

       1B2     0.141801     4A1     0.288623     5A1     1.495403  
       2B2     1.511867     2B1     1.523803     6A1     1.706200  
       7A1     2.045483     3B2     2.632353     3B1     2.643661  
       8A1     2.871493     1A2     3.963372     9A1     3.976360  
       4B2     4.018112     4B1     4.033405    10A1     4.701478  

    Final Occupation by Irrep:
             A1    A2    B1    B2 
    DOCC [     3,    0,    1,    0 ]
    SOCC [     2,    0,    1,    1 ]
    NA   [     5,    0,    2,    1 ]
    NB   [     3,    0,    1,    0 ]

  @DF-UKS Final Energy:  -100.12112658199516

   => Energetics <=

    Nuclear Repulsion Energy =              7.8203542967406623
    One-Electron Energy =                -160.4274949471885066
    Two-Electron Energy =                  62.2380240317588971
    DFT Exchange-Correlation Energy =      -9.7520099633062216
    Empirical Dispersion Energy =           0.0000000000000000
    VV10 Nonlocal Energy =                  0.0000000000000000
    Total Energy =                       -100.1211265819951564

  UHF NO Occupations:
  HONO-2 :    1 B2 1.0000000
  HONO-1 :    5 A1 1.0000000
  HONO-0 :    2 B1 1.0000000
  LUNO+0 :    6 A1 0.0013737
  LUNO+1 :    7 A1 0.0005297
  LUNO+2 :    3 B1 0.0000049
  LUNO+3 :    8 A1 0.0000001


Computation Completed


Properties will be evaluated at   0.000000,   0.000000,   0.000000 [a0]

Properties computed using the SCF density matrix


 Multipole Moments:

 ------------------------------------------------------------------------------------
     Multipole            Electronic (a.u.)      Nuclear  (a.u.)        Total (a.u.)
 ------------------------------------------------------------------------------------

 L = 1.  Multiply by 2.5417464519 to convert [e a0] to [Debye]
 Dipole X            :          0.0000000            0.0000000            0.0000000
 Dipole Y            :          0.0000000            0.0000000            0.0000000
 Dipole Z            :         -0.6707831            0.1974737           -0.4733094
 Magnitude           :                                                    0.4733094

 ------------------------------------------------------------------------------------

*** tstop() called on Joses-MacBook-Pro-2.local at Thu Jul 17 09:20:24 2025
Module time:
	user time   =       2.88 seconds =       0.05 minutes
	system time =       2.97 seconds =       0.05 minutes
	total time  =          1 seconds =       0.02 minutes
Total time:
	user time   =       6.83 seconds =       0.11 minutes
	system time =       6.64 seconds =       0.11 minutes
	total time  =          1 seconds =       0.02 minutes

*** tstart() called on Joses-MacBook-Pro-2.local
*** at Thu Jul 17 09:20:24 2025


         ------------------------------------------------------------
                                   SCF GRAD                          
                          Rob Parrish, Justin Turney,                
                       Andy Simmonett, and Alex Sokolov              
         ------------------------------------------------------------

  ==> Geometry <==

    Molecular point group: c2v
    Full point group: C_inf_v

    Geometry (in Angstrom), charge = -1, multiplicity = 5:

       Center              X                  Y                   Z               Mass       
    ------------   -----------------  -----------------  -----------------  -----------------
         HE           0.000000000000     0.000000000000     1.006045144392     4.002603254130
         F            0.000000000000     0.000000000000    -0.211954632937    18.998403162730

  Nuclear repulsion =    7.820354296740662

  ==> Basis Set <==

  Basis Set: CC-PVDZ
    Blend: CC-PVDZ
    Number of shells: 9
    Number of basis functions: 19
    Number of Cartesian functions: 20
    Spherical Harmonics?: true
    Max angular momentum: 2

  ==> DFJKGrad: Density-Fitted SCF Gradients <==

    Gradient:                    1
    J tasked:                  Yes
    K tasked:                  Yes
    wK tasked:                  No
    OpenMP threads:              1
    Integrals threads:           1
    Memory [MiB]:              375
    Schwarz Cutoff:          1E-12
    Fitting Condition:       1E-10

   => Auxiliary Basis Set <=

  Basis Set: (CC-PVDZ AUX)
    Blend: CC-PVDZ-JKFIT + DEF2-UNIVERSAL-JKFIT
    Number of shells: 33
    Number of basis functions: 93
    Number of Cartesian functions: 106
    Spherical Harmonics?: true
    Max angular momentum: 3

  ==> DFT Potential <==

   => LibXC <=

    Version 6.2.2
    S. Lehtola, C. Steigemann, M. J.T. Oliveira, and M. A.L. Marques.,  SoftwareX 7, 1–5 (2018) (10.1016/j.softx.2017.11.002)

   => Composite Functional: B3LYP <= 

    B3LYP Hyb-GGA Exchange-Correlation Functional

    P. J. Stephens, F. J. Devlin, C. F. Chabalowski, and M. J. Frisch.,  J. Phys. Chem. 98, 11623 (1994) (10.1021/j100096a001)

    Deriv               =              1
    GGA                 =           TRUE
    Meta                =          FALSE

    Exchange Hybrid     =           TRUE
    MP2 Hybrid          =          FALSE

   => Exchange Functionals <=

    0.0800   Slater exchange
    0.7200         Becke 88

   => Exact (HF) Exchange <=

    0.2000               HF 

   => Correlation Functionals <=

    0.1900   Vosko, Wilk & Nusair (VWN5_RPA)
    0.8100   Lee, Yang & Parr

   => LibXC Density Thresholds  <==

    XC_HYB_GGA_XC_B3LYP:  1.00E-15 

   => Molecular Quadrature <=

    Radial Scheme          =       TREUTLER
    Pruning Scheme         =           NONE
    Nuclear Scheme         =       TREUTLER

    Blocking Scheme        =         OCTREE
    BS radius alpha        =              1
    Pruning alpha          =              1
    Radial Points          =             75
    Spherical Points       =            302
    Total Points           =          43261
    Total Blocks           =            378
    Max Points             =            254
    Max Functions          =             19
    Weights Tolerance      =       1.00E-15


  -Total Gradient:
     Atom            X                  Y                   Z
    ------   -----------------  -----------------  -----------------
       1        0.000000000000    -0.000000000000     0.006202598263
       2       -0.000000000000     0.000000000000    -0.006203659108


*** tstop() called on Joses-MacBook-Pro-2.local at Thu Jul 17 09:20:24 2025
Module time:
	user time   =       0.32 seconds =       0.01 minutes
	system time =       0.73 seconds =       0.01 minutes
	total time  =          0 seconds =       0.00 minutes
Total time:
	user time   =       7.16 seconds =       0.12 minutes
	system time =       7.37 seconds =       0.12 minutes
	total time  =          1 seconds =       0.02 minutes

    			-----------------------------------------

    			 OPTKING 3.0: for geometry optimizations 

    			     By R.A. King, Bethel University     

    			        with contributions from          

    			    A.V. Copan, J. Cayton, A. Heide      

    			-----------------------------------------

    
	                            ===> Fragment 1 <== 

	 Z (Atomic Numbers)          Masses                          Geom                  
	       2.000000             4.002603          0.00000000  0.00000000  1.90114979   
	       9.000000            18.998403          0.00000000  0.00000000 -0.40053621   

	 - Coordinate -           - BOHR/RAD -       - ANG/DEG -
	 R(1,2)           =         2.301686           1.218000


	        --- Internal Coordinate Step in ANG or DEG, aJ/ANG or AJ/DEG ---
	-------------------------------------------------------------------------------
	           Coordinate      Previous         Force          Change          New 
	           ----------      --------        ------          ------        ------
	               R(1,2)       1.21800       -0.05111       -0.00764       1.21036
	-------------------------------------------------------------------------------

	                                 ==> Convergence Check <==                                  
    
	Measures of convergence in internal coordinates in au.
    
	Criteria marked as inactive (o), active & met (*), and active & unmet ( ).

	----------------------------------------------------------------------------------------------
	   Step    Total Energy     Delta E     Max Force     RMS Force      Max Disp      RMS Disp   
	----------------------------------------------------------------------------------------------
	  Convergence Criteria     1.00e-06 *    3.00e-04 *             o    1.20e-03 *             o
	----------------------------------------------------------------------------------------------
	     2    -100.12112658   -3.21e-05      6.20e-03      6.20e-03 o    1.44e-02      1.44e-02 o  ~
	----------------------------------------------------------------------------------------------

Next Geometry in Ang 
	Fragment 1 (Ang)

	   He   0.0000000000   0.0000000000   1.0022228386
	    F   0.0000000000   0.0000000000  -0.2081323271


    Structure for next step:
    Molecular point group: c2v
    Full point group: C_inf_v

    Geometry (in Angstrom), charge = -1, multiplicity = 5:

    HE           0.000000000000     0.000000000000     0.999730837519
    F            0.000000000000     0.000000000000    -0.210624328225


Scratch directory: /tmp/
gradient() will perform analytic gradient computation.
   => Libint2 <=

    Primary   basis highest AM E, G, H:  6, 6, 3
    Auxiliary basis highest AM E, G, H:  7, 7, 4
    Onebody   basis highest AM E, G, H:  -, -, -
    Solid Harmonics ordering:            Gaussian

*** tstart() called on Joses-MacBook-Pro-2.local
*** at Thu Jul 17 09:20:24 2025

   => Loading Basis Set <=

    Name: CC-PVDZ
    Role: ORBITAL
    Keyword: BASIS
    atoms 1 entry HE         line    32 file /Users/joseantoniorodriguesromero/anaconda3/share/psi4/basis/cc-pvdz.gbs 
    atoms 2 entry F          line   228 file /Users/joseantoniorodriguesromero/anaconda3/share/psi4/basis/cc-pvdz.gbs 


         ---------------------------------------------------------
                                   SCF
               by Justin Turney, Rob Parrish, Andy Simmonett
                          and Daniel G. A. Smith
                              UKS Reference
                        1 Threads,    500 MiB Core
         ---------------------------------------------------------

  ==> Geometry <==

    Molecular point group: c2v
    Full point group: C_inf_v

    Geometry (in Angstrom), charge = -1, multiplicity = 5:

       Center              X                  Y                   Z               Mass       
    ------------   -----------------  -----------------  -----------------  -----------------
         HE           0.000000000000     0.000000000000     0.999730837519     4.002603254130
         F            0.000000000000     0.000000000000    -0.210624328225    18.998403162730

  Running in c2v symmetry.

  Rotational constants: A = ************  B =      3.48063  C =      3.48063 [cm^-1]
  Rotational constants: A = ************  B = 104346.70474  C = 104346.70474 [MHz]
  Nuclear repulsion =    7.869747708479680

  Charge       = -1
  Multiplicity = 5
  Electrons    = 12
  Nalpha       = 8
  Nbeta        = 4

  ==> Algorithm <==

  SCF Algorithm Type is DF.
  DIIS enabled.
  MOM disabled.
  Fractional occupation disabled.
  Guess Type is READ.
  Energy threshold   = 1.00e-08
  Density threshold  = 1.00e-08
  Integral threshold = 1.00e-12

  ==> Primary Basis <==

  Basis Set: CC-PVDZ
    Blend: CC-PVDZ
    Number of shells: 9
    Number of basis functions: 19
    Number of Cartesian functions: 20
    Spherical Harmonics?: true
    Max angular momentum: 2

  ==> DFT Potential <==

   => LibXC <=

    Version 6.2.2
    S. Lehtola, C. Steigemann, M. J.T. Oliveira, and M. A.L. Marques.,  SoftwareX 7, 1–5 (2018) (10.1016/j.softx.2017.11.002)

   => Composite Functional: B3LYP <= 

    B3LYP Hyb-GGA Exchange-Correlation Functional

    P. J. Stephens, F. J. Devlin, C. F. Chabalowski, and M. J. Frisch.,  J. Phys. Chem. 98, 11623 (1994) (10.1021/j100096a001)

    Deriv               =              1
    GGA                 =           TRUE
    Meta                =          FALSE

    Exchange Hybrid     =           TRUE
    MP2 Hybrid          =          FALSE

   => Exchange Functionals <=

    0.0800   Slater exchange
    0.7200         Becke 88

   => Exact (HF) Exchange <=

    0.2000               HF 

   => Correlation Functionals <=

    0.1900   Vosko, Wilk & Nusair (VWN5_RPA)
    0.8100   Lee, Yang & Parr

   => LibXC Density Thresholds  <==

    XC_HYB_GGA_XC_B3LYP:  1.00E-15 

   => Molecular Quadrature <=

    Radial Scheme          =       TREUTLER
    Pruning Scheme         =           NONE
    Nuclear Scheme         =       TREUTLER

    Blocking Scheme        =         OCTREE
    BS radius alpha        =              1
    Pruning alpha          =              1
    Radial Points          =             75
    Spherical Points       =            302
    Total Points           =          43261
    Total Blocks           =            377
    Max Points             =            256
    Max Functions          =             19
    Weights Tolerance      =       1.00E-15

   => Loading Basis Set <=

    Name: (CC-PVDZ AUX)
    Role: JKFIT
    Keyword: DF_BASIS_SCF
    atoms 1 entry HE         line    34 file /Users/joseantoniorodriguesromero/anaconda3/share/psi4/basis/def2-universal-jkfit.gbs 
    atoms 2 entry F          line   271 file /Users/joseantoniorodriguesromero/anaconda3/share/psi4/basis/cc-pvdz-jkfit.gbs 

   => Loading Basis Set <=

    Name: CC-PVDZ
    Role: ORBITAL
    Keyword: BASIS
    atoms 1 entry HE         line    32 file /Users/joseantoniorodriguesromero/anaconda3/share/psi4/basis/cc-pvdz.gbs 
    atoms 2 entry F          line   228 file /Users/joseantoniorodriguesromero/anaconda3/share/psi4/basis/cc-pvdz.gbs 

  Reading orbitals from file /tmp/quintet_HeF.default.71845.180.npy, no projection.

  ==> Integral Setup <==

  DFHelper Memory: AOs need 0.000 GiB; user supplied 0.343 GiB. 
  Using in-core AOs.

  ==> MemDFJK: Density-Fitted J/K Matrices <==

    J tasked:                   Yes
    K tasked:                   Yes
    wK tasked:                   No
    OpenMP threads:               1
    Memory [MiB]:               350
    Algorithm:                 Core
    Schwarz Cutoff:           1E-12
    Mask sparsity (%):       0.0000
    Fitting Condition:        1E-10

   => Auxiliary Basis Set <=

  Basis Set: (CC-PVDZ AUX)
    Blend: CC-PVDZ-JKFIT + DEF2-UNIVERSAL-JKFIT
    Number of shells: 33
    Number of basis functions: 93
    Number of Cartesian functions: 106
    Spherical Harmonics?: true
    Max angular momentum: 3

  Cached 100.0% of DFT collocation blocks in 0.024 [GiB].

  Minimum eigenvalue in the overlap matrix is 1.0583664341E-01.
  Reciprocal condition number of the overlap matrix is 4.4340788394E-02.
    Using symmetric orthogonalization.

  ==> Pre-Iterations <==

  SCF Guess: Orbitals guess was supplied from a previous computation.

   -------------------------------------------------------
    Irrep   Nso     Nmo     Nalpha   Nbeta   Ndocc  Nsocc
   -------------------------------------------------------
     A1        10      10       5       3       3       2
     A2         1       1       0       0       0       0
     B1         4       4       2       1       1       1
     B2         4       4       1       0       0       1
   -------------------------------------------------------
    Total      19      19       8       4       4       4
   -------------------------------------------------------

  ==> Iterations <==

                           Total Energy        Delta E     RMS |[F,P]|

   @DF-UKS iter   0:  -100.12490850758003   -1.00125e+02   2.49637e-03 
   @DF-UKS iter   1:  -100.12116477059800    3.74374e-03   2.61331e-04 ADIIS/DIIS
   @DF-UKS iter   2:  -100.12116362616629    1.14443e-06   3.68259e-04 ADIIS/DIIS/DAMP=1%
   @DF-UKS iter   3:  -100.12108899380183    7.46324e-05   5.48964e-05 DIIS/DAMP=1%
   @DF-UKS iter   4:  -100.12118467234895   -9.56785e-05   4.50395e-05 DIIS/DAMP=1%
   @DF-UKS iter   5:  -100.12117111372183    1.35586e-05   1.11438e-05 DIIS/DAMP=1%
   @DF-UKS iter   6:  -100.12117159386653   -4.80145e-07   1.43391e-06 DIIS/DAMP=1%
   @DF-UKS iter   7:  -100.12117356478161   -1.97092e-06   3.25118e-07 DIIS/DAMP=1%
   @DF-UKS iter   8:  -100.12117337303232    1.91749e-07   2.75639e-08 DIIS/DAMP=1%
   @DF-UKS iter   9:  -100.12117342024585   -4.72135e-08   3.77914e-09 DIIS/DAMP=1%
   @DF-UKS iter  10:  -100.12117342342113   -3.17527e-09   1.75726e-10 DIIS/DAMP=1%
  Energy and wave function converged.


  ==> Post-Iterations <==

   Electrons on quadrature grid:
      Nalpha   =    8.0000000916 ; deviation = 9.158e-08
      Nbeta    =    4.0000000167 ; deviation = 1.673e-08
      Ntotal   =   12.0000001083 ; deviation = 1.083e-07 

   @Spin Contamination Metric:   3.818976933E-03
   @S^2 Expected:                6.000000000E+00
   @S^2 Observed:                6.003818977E+00
   @S   Expected:                2.000000000E+00
   @S   Observed:                2.000000000E+00

    Orbital Energies [Eh]
    ---------------------

    Alpha Occupied:                                                       

       1A1   -24.288396     2A1    -0.908515     3A1    -0.390722  
       1B2    -0.184208     1B1    -0.112901     4A1    -0.014234  
       5A1     1.245500     2B1     1.284796  

    Alpha Virtual:                                                        

       2B2     1.354394     6A1     1.523854     7A1     1.904647  
       3B2     2.565681     3B1     2.571417     8A1     2.780076  
       1A2     3.837845     9A1     3.838822     4B2     3.842339  
       4B1     3.928024    10A1     4.584082  

    Beta Occupied:                                                        

       1A1   -24.189251     2A1    -0.719919     3A1    -0.214529  
       1B1     0.030162  

    Beta Virtual:                                                         

       1B2     0.141850     4A1     0.292265     5A1     1.493882  
       2B2     1.512004     2B1     1.523967     6A1     1.704759  
       7A1     2.050953     3B2     2.631834     3B1     2.643294  
       8A1     2.873407     1A2     3.963649     9A1     3.976635  
       4B2     4.021615     4B1     4.037058    10A1     4.719181  

    Final Occupation by Irrep:
             A1    A2    B1    B2 
    DOCC [     3,    0,    1,    0 ]
    SOCC [     2,    0,    1,    1 ]
    NA   [     5,    0,    2,    1 ]
    NB   [     3,    0,    1,    0 ]

  @DF-UKS Final Energy:  -100.12117342342113

   => Energetics <=

    Nuclear Repulsion Energy =              7.8697477084796796
    One-Electron Energy =                -160.5255107035162041
    Two-Electron Energy =                  62.2885068841861340
    DFT Exchange-Correlation Energy =      -9.7539173125707403
    Empirical Dispersion Energy =           0.0000000000000000
    VV10 Nonlocal Energy =                  0.0000000000000000
    Total Energy =                       -100.1211734234211264

  UHF NO Occupations:
  HONO-2 :    1 B2 1.0000000
  HONO-1 :    2 B1 1.0000000
  HONO-0 :    5 A1 1.0000000
  LUNO+0 :    6 A1 0.0013791
  LUNO+1 :    7 A1 0.0005263
  LUNO+2 :    3 B1 0.0000050
  LUNO+3 :    8 A1 0.0000001


Computation Completed


Properties will be evaluated at   0.000000,   0.000000,   0.000000 [a0]

Properties computed using the SCF density matrix


 Multipole Moments:

 ------------------------------------------------------------------------------------
     Multipole            Electronic (a.u.)      Nuclear  (a.u.)        Total (a.u.)
 ------------------------------------------------------------------------------------

 L = 1.  Multiply by 2.5417464519 to convert [e a0] to [Debye]
 Dipole X            :          0.0000000            0.0000000            0.0000000
 Dipole Y            :          0.0000000            0.0000000            0.0000000
 Dipole Z            :         -0.6757277            0.1962343           -0.4794934
 Magnitude           :                                                    0.4794934

 ------------------------------------------------------------------------------------

*** tstop() called on Joses-MacBook-Pro-2.local at Thu Jul 17 09:20:25 2025
Module time:
	user time   =       3.23 seconds =       0.05 minutes
	system time =       2.17 seconds =       0.04 minutes
	total time  =          1 seconds =       0.02 minutes
Total time:
	user time   =      10.43 seconds =       0.17 minutes
	system time =       9.77 seconds =       0.16 minutes
	total time  =          2 seconds =       0.03 minutes

*** tstart() called on Joses-MacBook-Pro-2.local
*** at Thu Jul 17 09:20:25 2025


         ------------------------------------------------------------
                                   SCF GRAD                          
                          Rob Parrish, Justin Turney,                
                       Andy Simmonett, and Alex Sokolov              
         ------------------------------------------------------------

  ==> Geometry <==

    Molecular point group: c2v
    Full point group: C_inf_v

    Geometry (in Angstrom), charge = -1, multiplicity = 5:

       Center              X                  Y                   Z               Mass       
    ------------   -----------------  -----------------  -----------------  -----------------
         HE           0.000000000000     0.000000000000     0.999730837519     4.002603254130
         F            0.000000000000     0.000000000000    -0.210624328225    18.998403162730

  Nuclear repulsion =    7.869747708479680

  ==> Basis Set <==

  Basis Set: CC-PVDZ
    Blend: CC-PVDZ
    Number of shells: 9
    Number of basis functions: 19
    Number of Cartesian functions: 20
    Spherical Harmonics?: true
    Max angular momentum: 2

  ==> DFJKGrad: Density-Fitted SCF Gradients <==

    Gradient:                    1
    J tasked:                  Yes
    K tasked:                  Yes
    wK tasked:                  No
    OpenMP threads:              1
    Integrals threads:           1
    Memory [MiB]:              375
    Schwarz Cutoff:          1E-12
    Fitting Condition:       1E-10

   => Auxiliary Basis Set <=

  Basis Set: (CC-PVDZ AUX)
    Blend: CC-PVDZ-JKFIT + DEF2-UNIVERSAL-JKFIT
    Number of shells: 33
    Number of basis functions: 93
    Number of Cartesian functions: 106
    Spherical Harmonics?: true
    Max angular momentum: 3

  ==> DFT Potential <==

   => LibXC <=

    Version 6.2.2
    S. Lehtola, C. Steigemann, M. J.T. Oliveira, and M. A.L. Marques.,  SoftwareX 7, 1–5 (2018) (10.1016/j.softx.2017.11.002)

   => Composite Functional: B3LYP <= 

    B3LYP Hyb-GGA Exchange-Correlation Functional

    P. J. Stephens, F. J. Devlin, C. F. Chabalowski, and M. J. Frisch.,  J. Phys. Chem. 98, 11623 (1994) (10.1021/j100096a001)

    Deriv               =              1
    GGA                 =           TRUE
    Meta                =          FALSE

    Exchange Hybrid     =           TRUE
    MP2 Hybrid          =          FALSE

   => Exchange Functionals <=

    0.0800   Slater exchange
    0.7200         Becke 88

   => Exact (HF) Exchange <=

    0.2000               HF 

   => Correlation Functionals <=

    0.1900   Vosko, Wilk & Nusair (VWN5_RPA)
    0.8100   Lee, Yang & Parr

   => LibXC Density Thresholds  <==

    XC_HYB_GGA_XC_B3LYP:  1.00E-15 

   => Molecular Quadrature <=

    Radial Scheme          =       TREUTLER
    Pruning Scheme         =           NONE
    Nuclear Scheme         =       TREUTLER

    Blocking Scheme        =         OCTREE
    BS radius alpha        =              1
    Pruning alpha          =              1
    Radial Points          =             75
    Spherical Points       =            302
    Total Points           =          43261
    Total Blocks           =            377
    Max Points             =            256
    Max Functions          =             19
    Weights Tolerance      =       1.00E-15


  -Total Gradient:
     Atom            X                  Y                   Z
    ------   -----------------  -----------------  -----------------
       1        0.000000000000     0.000000000000     0.000223717487
       2       -0.000000000000     0.000000000000    -0.000225097932


*** tstop() called on Joses-MacBook-Pro-2.local at Thu Jul 17 09:20:25 2025
Module time:
	user time   =       0.36 seconds =       0.01 minutes
	system time =       0.88 seconds =       0.01 minutes
	total time  =          0 seconds =       0.00 minutes
Total time:
	user time   =      10.80 seconds =       0.18 minutes
	system time =      10.65 seconds =       0.18 minutes
	total time  =          2 seconds =       0.03 minutes

    			-----------------------------------------

    			 OPTKING 3.0: for geometry optimizations 

    			     By R.A. King, Bethel University     

    			        with contributions from          

    			    A.V. Copan, J. Cayton, A. Heide      

    			-----------------------------------------

    
	                            ===> Fragment 1 <== 

	 Z (Atomic Numbers)          Masses                          Geom                  
	       2.000000             4.002603          0.00000000  0.00000000  1.88921748   
	       9.000000            18.998403          0.00000000  0.00000000 -0.39802230   

	 - Coordinate -           - BOHR/RAD -       - ANG/DEG -
	 R(1,2)           =         2.287240           1.210355


	        --- Internal Coordinate Step in ANG or DEG, aJ/ANG or AJ/DEG ---
	-------------------------------------------------------------------------------
	           Coordinate      Previous         Force          Change          New 
	           ----------      --------        ------          ------        ------
	               R(1,2)       1.21036       -0.00185       -0.00027       1.21009
	-------------------------------------------------------------------------------

	                                 ==> Convergence Check <==                                  
    
	Measures of convergence in internal coordinates in au.
    
	Criteria marked as inactive (o), active & met (*), and active & unmet ( ).

	----------------------------------------------------------------------------------------------
	   Step    Total Energy     Delta E     Max Force     RMS Force      Max Disp      RMS Disp   
	----------------------------------------------------------------------------------------------
	  Convergence Criteria     1.00e-06 *    3.00e-04 *             o    1.20e-03 *             o
	----------------------------------------------------------------------------------------------
	     3    -100.12117342   -4.68e-05      2.24e-04 *    2.24e-04 o    5.09e-04 *    5.09e-04 o  ~
	----------------------------------------------------------------------------------------------

Next Geometry in Ang 
	Fragment 1 (Ang)

	   He   0.0000000000   0.0000000000   0.9995961091
	    F   0.0000000000   0.0000000000  -0.2104895998


    Final optimized geometry and variables:
    Molecular point group: c2v
    Full point group: C_inf_v

    Geometry (in Angstrom), charge = -1, multiplicity = 5:

    HE           0.000000000000     0.000000000000     0.999730837519
    F            0.000000000000     0.000000000000    -0.210624328225


    Psi4 stopped on: Thursday, 17 July 2025 09:20AM
    Psi4 wall time for execution: 0:00:02.72

*** Psi4 exiting successfully. Buy a developer a beer!
