
    -----------------------------------------------------------------------
          Psi4: An Open-Source Ab Initio Electronic Structure Package
                               Psi4 1.9.1 release

                         Git: Rev {} zzzzzzz 


    D. G. A. Smith, L. A. Burns, A. C. Simmonett, R. M. Parrish,
    M. C. Schieber, R. Galvelis, P. Kraus, H. Kruse, R. Di Remigio,
    A. Alenaizan, A. M. James, S. Lehtola, J. P. Misiewicz, M. Scheurer,
    R. A. Shaw, J. B. Schriber, Y. Xie, Z. L. Glick, D. A. Sirianni,
    J. S. O'Brien, J. M. Waldrop, A. Kumar, E. G. Hohenstein,
    B. P. Pritchard, B. R. Brooks, H. F. Schaefer III, A. Yu. Sokolov,
    K. Patkowski, A. E. DePrince III, U. Bozkaya, R. A. King,
    F. A. Evangelista, J. M. Turney, T. D. Crawford, C. D. Sherrill,
    J. Chem. Phys. 152(18) 184108 (2020). https://doi.org/10.1063/5.0006002

                            Additional Code Authors
    E. T. Seidl, C. L. Janssen, E. F. Valeev, M. L. Leininger,
    J. F. Gonthier, R. M. Richard, H. R. McAlexander, M. Saitow, X. Wang,
    P. Verma, M. H. Lechner, A. Jiang, S. Behnle, A. G. Heide,
    M. F. Herbst, and D. L. Poole

             Previous Authors, Complete List of Code Contributors,
                       and Citations for Specific Modules
    https://github.com/psi4/psi4/blob/master/codemeta.json
    https://github.com/psi4/psi4/graphs/contributors
    http://psicode.org/psi4manual/master/introduction.html#citing-psifour

    -----------------------------------------------------------------------


    Psi4 started on: Thursday, 17 July 2025 09:11AM

    Process ID: 71734
    Host:       Joses-MacBook-Pro-2.local
    PSIDATADIR: /Users/joseantoniorodriguesromero/anaconda3/share/psi4
    Memory:     500.0 MiB
    Threads:    1
    
  ==> Input File <==

--------------------------------------------------------------------------
molecule { 
-1 1
H   0.00000        0.60000        0.00000
C   0.00000       -0.60000        0.00000
}

set { 
basis              cc-pvdz
reference          uks
maxiter            500
geom_maxiter       500
DAMPING_PERCENTAGE 1
guess              SAP
}

optimize('b3lyp')
--------------------------------------------------------------------------

Scratch directory: /tmp/
gradient() will perform analytic gradient computation.
   => Libint2 <=

    Primary   basis highest AM E, G, H:  6, 6, 3
    Auxiliary basis highest AM E, G, H:  7, 7, 4
    Onebody   basis highest AM E, G, H:  -, -, -
    Solid Harmonics ordering:            Gaussian

*** tstart() called on Joses-MacBook-Pro-2.local
*** at Thu Jul 17 09:11:17 2025

   => Loading Basis Set <=

    Name: CC-PVDZ
    Role: ORBITAL
    Keyword: BASIS
    atoms 1 entry H          line    22 file /Users/joseantoniorodriguesromero/anaconda3/share/psi4/basis/cc-pvdz.gbs 
    atoms 2 entry C          line   138 file /Users/joseantoniorodriguesromero/anaconda3/share/psi4/basis/cc-pvdz.gbs 


         ---------------------------------------------------------
                                   SCF
               by Justin Turney, Rob Parrish, Andy Simmonett
                          and Daniel G. A. Smith
                              UKS Reference
                        1 Threads,    500 MiB Core
         ---------------------------------------------------------

  ==> Geometry <==

    Molecular point group: c2v
    Full point group: C_inf_v

    Geometry (in Angstrom), charge = -1, multiplicity = 1:

       Center              X                  Y                   Z               Mass       
    ------------   -----------------  -----------------  -----------------  -----------------
         H            0.000000000000     0.000000000000     1.107025960475     1.007825032230
         C            0.000000000000     0.000000000000    -0.092974039525    12.000000000000

  Running in c2v symmetry.

  Rotational constants: A = ************  B =     12.59135  C =     12.59135 [cm^-1]
  Rotational constants: A = ************  B = 377479.18325  C = 377479.18325 [MHz]
  Nuclear repulsion =    2.645886053350000

  Charge       = -1
  Multiplicity = 1
  Electrons    = 8
  Nalpha       = 4
  Nbeta        = 4

  ==> Algorithm <==

  SCF Algorithm Type is DF.
  DIIS enabled.
  MOM disabled.
  Fractional occupation disabled.
  Guess Type is SAP.
  Energy threshold   = 1.00e-08
  Density threshold  = 1.00e-08
  Integral threshold = 1.00e-12

  ==> Primary Basis <==

  Basis Set: CC-PVDZ
    Blend: CC-PVDZ
    Number of shells: 9
    Number of basis functions: 19
    Number of Cartesian functions: 20
    Spherical Harmonics?: true
    Max angular momentum: 2

  ==> DFT Potential <==

   => LibXC <=

    Version 6.2.2
    S. Lehtola, C. Steigemann, M. J.T. Oliveira, and M. A.L. Marques.,  SoftwareX 7, 1–5 (2018) (10.1016/j.softx.2017.11.002)

   => Composite Functional: B3LYP <= 

    B3LYP Hyb-GGA Exchange-Correlation Functional

    P. J. Stephens, F. J. Devlin, C. F. Chabalowski, and M. J. Frisch.,  J. Phys. Chem. 98, 11623 (1994) (10.1021/j100096a001)

    Deriv               =              1
    GGA                 =           TRUE
    Meta                =          FALSE

    Exchange Hybrid     =           TRUE
    MP2 Hybrid          =          FALSE

   => Exchange Functionals <=

    0.0800   Slater exchange
    0.7200         Becke 88

   => Exact (HF) Exchange <=

    0.2000               HF 

   => Correlation Functionals <=

    0.1900   Vosko, Wilk & Nusair (VWN5_RPA)
    0.8100   Lee, Yang & Parr

   => LibXC Density Thresholds  <==

    XC_HYB_GGA_XC_B3LYP:  1.00E-15 

   => Molecular Quadrature <=

    Radial Scheme          =       TREUTLER
    Pruning Scheme         =           NONE
    Nuclear Scheme         =       TREUTLER

    Blocking Scheme        =         OCTREE
    BS radius alpha        =              1
    Pruning alpha          =              1
    Radial Points          =             75
    Spherical Points       =            302
    Total Points           =          43742
    Total Blocks           =            387
    Max Points             =            255
    Max Functions          =             19
    Weights Tolerance      =       1.00E-15

   => Loading Basis Set <=

    Name: (CC-PVDZ AUX)
    Role: JKFIT
    Keyword: DF_BASIS_SCF
    atoms 1 entry H          line    51 file /Users/joseantoniorodriguesromero/anaconda3/share/psi4/basis/cc-pvdz-jkfit.gbs 
    atoms 2 entry C          line   121 file /Users/joseantoniorodriguesromero/anaconda3/share/psi4/basis/cc-pvdz-jkfit.gbs 

  ==> Integral Setup <==

  DFHelper Memory: AOs need 0.000 GiB; user supplied 0.342 GiB. 
  Using in-core AOs.

  ==> MemDFJK: Density-Fitted J/K Matrices <==

    J tasked:                   Yes
    K tasked:                   Yes
    wK tasked:                   No
    OpenMP threads:               1
    Memory [MiB]:               349
    Algorithm:                 Core
    Schwarz Cutoff:           1E-12
    Mask sparsity (%):       0.0000
    Fitting Condition:        1E-10

   => Auxiliary Basis Set <=

  Basis Set: (CC-PVDZ AUX)
    Blend: CC-PVDZ-JKFIT
    Number of shells: 33
    Number of basis functions: 93
    Number of Cartesian functions: 106
    Spherical Harmonics?: true
    Max angular momentum: 3

  Cached 100.0% of DFT collocation blocks in 0.024 [GiB].

  Minimum eigenvalue in the overlap matrix is 4.4207294837E-02.
  Reciprocal condition number of the overlap matrix is 1.4754317306E-02.
    Using symmetric orthogonalization.

  ==> Pre-Iterations <==

  SCF Guess: Superposition of Atomic Potentials (doi:10.1021/acs.jctc.8b01089).

  ==> SAP guess <==

   => Molecular Quadrature <=

    Radial Scheme          =       TREUTLER
    Pruning Scheme         =           NONE
    Nuclear Scheme         =       TREUTLER

    Blocking Scheme        =         OCTREE
    BS radius alpha        =              1
    Pruning alpha          =              1
    Radial Points          =             75
    Spherical Points       =            302
    Total Points           =          43742
    Total Blocks           =            387
    Max Points             =            255
    Max Functions          =             19
    Weights Tolerance      =       1.00E-15

   -------------------------------------------------------
    Irrep   Nso     Nmo     Nalpha   Nbeta   Ndocc  Nsocc
   -------------------------------------------------------
     A1        10      10       3       3       3       0
     A2         1       1       0       0       0       0
     B1         4       4       1       1       1       0
     B2         4       4       0       0       0       0
   -------------------------------------------------------
    Total      19      19       4       4       4       0
   -------------------------------------------------------

  ==> Iterations <==

                           Total Energy        Delta E     RMS |[F,P]|

   @DF-UKS iter   1:   -38.27752225842441   -3.82775e+01   4.01337e-02 ADIIS/DIIS
   @DF-UKS iter   2:   -38.29923370708951   -2.17114e-02   3.79789e-02 ADIIS/DIIS/DAMP=1%
   @DF-UKS iter   3:   -38.42754741370727   -1.28314e-01   2.51881e-03 ADIIS/DIIS/DAMP=1%
   @DF-UKS iter   4:   -38.43950537918521   -1.19580e-02   7.68662e-04 ADIIS/DIIS/DAMP=1%
   @DF-UKS iter   5:   -38.43906413694783    4.41242e-04   9.27184e-05 DIIS/DAMP=1%
   @DF-UKS iter   6:   -38.43913690956614   -7.27726e-05   9.13903e-06 DIIS/DAMP=1%
   @DF-UKS iter   7:   -38.43915503814547   -1.81286e-05   8.73324e-07 DIIS/DAMP=1%
   @DF-UKS iter   8:   -38.43915670724709   -1.66910e-06   9.02720e-08 DIIS/DAMP=1%
   @DF-UKS iter   9:   -38.43915685634953   -1.49102e-07   2.92483e-09 DIIS/DAMP=1%
   @DF-UKS iter  10:   -38.43915687781173   -2.14622e-08   2.55696e-10 DIIS/DAMP=1%
   @DF-UKS iter  11:   -38.43915687850450   -6.92772e-10   5.77442e-12 DIIS/DAMP=1%
  Energy and wave function converged.


  ==> Post-Iterations <==

   Electrons on quadrature grid:
      Nalpha   =    3.9999999832 ; deviation = -1.679e-08
      Nbeta    =    3.9999999832 ; deviation = -1.679e-08
      Ntotal   =    7.9999999664 ; deviation = -3.358e-08 

   @Spin Contamination Metric:  -1.421085472E-14
   @S^2 Expected:                0.000000000E+00
   @S^2 Observed:               -1.421085472E-14
   @S   Expected:                0.000000000E+00
   @S   Observed:                0.000000000E+00

    Orbital Energies [Eh]
    ---------------------

    Alpha Occupied:                                                       

       1A1    -9.873359     2A1    -0.239513     3A1     0.045419  
       1B1     0.166028  

    Alpha Virtual:                                                        

       1B2     0.218630     4A1     0.349287     5A1     0.764428  
       2B2     0.815088     2B1     0.822854     6A1     0.842412  
       7A1     1.045624     3B2     1.342819     3B1     1.363559  
       1A2     1.532164     8A1     1.540276     9A1     1.851945  
       4B2     2.020608     4B1     2.041694    10A1     2.562392  

    Beta Occupied:                                                        

       1A1    -9.873359     2A1    -0.239513     3A1     0.045419  
       1B1     0.166028  

    Beta Virtual:                                                         

       1B2     0.218630     4A1     0.349287     5A1     0.764428  
       2B2     0.815088     2B1     0.822854     6A1     0.842412  
       7A1     1.045624     3B2     1.342819     3B1     1.363559  
       1A2     1.532164     8A1     1.540276     9A1     1.851945  
       4B2     2.020608     4B1     2.041694    10A1     2.562392  

    Final Occupation by Irrep:
             A1    A2    B1    B2 
    DOCC [     3,    0,    1,    0 ]
    SOCC [     0,    0,    0,    0 ]
    NA   [     3,    0,    1,    0 ]
    NB   [     3,    0,    1,    0 ]

  @DF-UKS Final Energy:   -38.43915687850450

   => Energetics <=

    Nuclear Repulsion Energy =              2.6458860533500004
    One-Electron Energy =                 -58.9312898619780015
    Two-Electron Energy =                  22.6086491388827326
    DFT Exchange-Correlation Energy =      -4.7624022087592266
    Empirical Dispersion Energy =           0.0000000000000000
    VV10 Nonlocal Energy =                  0.0000000000000000
    Total Energy =                        -38.4391568785044981

  UHF NO Occupations:
  HONO-2 :    1 B1 2.0000000
  HONO-1 :    2 A1 2.0000000
  HONO-0 :    3 A1 2.0000000
  LUNO+0 :    4 A1 0.0000000
  LUNO+1 :    5 A1 0.0000000
  LUNO+2 :    6 A1 0.0000000
  LUNO+3 :    7 A1 0.0000000


Computation Completed


Properties will be evaluated at   0.000000,   0.000000,   0.000000 [a0]

Properties computed using the SCF density matrix


 Multipole Moments:

 ------------------------------------------------------------------------------------
     Multipole            Electronic (a.u.)      Nuclear  (a.u.)        Total (a.u.)
 ------------------------------------------------------------------------------------

 L = 1.  Multiply by 2.5417464519 to convert [e a0] to [Debye]
 Dipole X            :          0.0000000            0.0000000            0.0000000
 Dipole Y            :          0.0000000            0.0000000            0.0000000
 Dipole Z            :         -0.7884612            1.0378031            0.2493418
 Magnitude           :                                                    0.2493418

 ------------------------------------------------------------------------------------

*** tstop() called on Joses-MacBook-Pro-2.local at Thu Jul 17 09:11:17 2025
Module time:
	user time   =       1.15 seconds =       0.02 minutes
	system time =       2.39 seconds =       0.04 minutes
	total time  =          0 seconds =       0.00 minutes
Total time:
	user time   =       1.15 seconds =       0.02 minutes
	system time =       2.39 seconds =       0.04 minutes
	total time  =          0 seconds =       0.00 minutes

*** tstart() called on Joses-MacBook-Pro-2.local
*** at Thu Jul 17 09:11:17 2025


         ------------------------------------------------------------
                                   SCF GRAD                          
                          Rob Parrish, Justin Turney,                
                       Andy Simmonett, and Alex Sokolov              
         ------------------------------------------------------------

  ==> Geometry <==

    Molecular point group: c2v
    Full point group: C_inf_v

    Geometry (in Angstrom), charge = -1, multiplicity = 1:

       Center              X                  Y                   Z               Mass       
    ------------   -----------------  -----------------  -----------------  -----------------
         H            0.000000000000     0.000000000000     1.107025960475     1.007825032230
         C            0.000000000000     0.000000000000    -0.092974039525    12.000000000000

  Nuclear repulsion =    2.645886053350000

  ==> Basis Set <==

  Basis Set: CC-PVDZ
    Blend: CC-PVDZ
    Number of shells: 9
    Number of basis functions: 19
    Number of Cartesian functions: 20
    Spherical Harmonics?: true
    Max angular momentum: 2

  ==> DFJKGrad: Density-Fitted SCF Gradients <==

    Gradient:                    1
    J tasked:                  Yes
    K tasked:                  Yes
    wK tasked:                  No
    OpenMP threads:              1
    Integrals threads:           1
    Memory [MiB]:              375
    Schwarz Cutoff:          1E-12
    Fitting Condition:       1E-10

   => Auxiliary Basis Set <=

  Basis Set: (CC-PVDZ AUX)
    Blend: CC-PVDZ-JKFIT
    Number of shells: 33
    Number of basis functions: 93
    Number of Cartesian functions: 106
    Spherical Harmonics?: true
    Max angular momentum: 3

  ==> DFT Potential <==

   => LibXC <=

    Version 6.2.2
    S. Lehtola, C. Steigemann, M. J.T. Oliveira, and M. A.L. Marques.,  SoftwareX 7, 1–5 (2018) (10.1016/j.softx.2017.11.002)

   => Composite Functional: B3LYP <= 

    B3LYP Hyb-GGA Exchange-Correlation Functional

    P. J. Stephens, F. J. Devlin, C. F. Chabalowski, and M. J. Frisch.,  J. Phys. Chem. 98, 11623 (1994) (10.1021/j100096a001)

    Deriv               =              1
    GGA                 =           TRUE
    Meta                =          FALSE

    Exchange Hybrid     =           TRUE
    MP2 Hybrid          =          FALSE

   => Exchange Functionals <=

    0.0800   Slater exchange
    0.7200         Becke 88

   => Exact (HF) Exchange <=

    0.2000               HF 

   => Correlation Functionals <=

    0.1900   Vosko, Wilk & Nusair (VWN5_RPA)
    0.8100   Lee, Yang & Parr

   => LibXC Density Thresholds  <==

    XC_HYB_GGA_XC_B3LYP:  1.00E-15 

   => Molecular Quadrature <=

    Radial Scheme          =       TREUTLER
    Pruning Scheme         =           NONE
    Nuclear Scheme         =       TREUTLER

    Blocking Scheme        =         OCTREE
    BS radius alpha        =              1
    Pruning alpha          =              1
    Radial Points          =             75
    Spherical Points       =            302
    Total Points           =          43742
    Total Blocks           =            387
    Max Points             =            255
    Max Functions          =             19
    Weights Tolerance      =       1.00E-15


  -Total Gradient:
     Atom            X                  Y                   Z
    ------   -----------------  -----------------  -----------------
       1       -0.000000000000     0.000000000000     0.006752988667
       2        0.000000000000    -0.000000000000    -0.006752701896


*** tstop() called on Joses-MacBook-Pro-2.local at Thu Jul 17 09:11:17 2025
Module time:
	user time   =       0.27 seconds =       0.00 minutes
	system time =       0.75 seconds =       0.01 minutes
	total time  =          0 seconds =       0.00 minutes
Total time:
	user time   =       1.42 seconds =       0.02 minutes
	system time =       3.14 seconds =       0.05 minutes
	total time  =          0 seconds =       0.00 minutes

    			-----------------------------------------

    			 OPTKING 3.0: for geometry optimizations 

    			     By R.A. King, Bethel University     

    			        with contributions from          

    			    A.V. Copan, J. Cayton, A. Heide      

    			-----------------------------------------

    
	                            ===> Fragment 1 <== 

	 Z (Atomic Numbers)          Masses                          Geom                  
	       1.000000             1.007825          0.00000000  0.00000000  2.09197588   
	       6.000000            12.000000          0.00000000  0.00000000 -0.17569547   

	 - Coordinate -           - BOHR/RAD -       - ANG/DEG -
	 R(1,2)           =         2.267671           1.200000


	        --- Internal Coordinate Step in ANG or DEG, aJ/ANG or AJ/DEG ---
	-------------------------------------------------------------------------------
	           Coordinate      Previous         Force          Change          New 
	           ----------      --------        ------          ------        ------
	               R(1,2)       1.20000       -0.05563       -0.01448       1.18552
	-------------------------------------------------------------------------------

	                                 ==> Convergence Check <==                                  
    
	Measures of convergence in internal coordinates in au.
    
	Criteria marked as inactive (o), active & met (*), and active & unmet ( ).

	----------------------------------------------------------------------------------------------
	   Step    Total Energy     Delta E     Max Force     RMS Force      Max Disp      RMS Disp   
	----------------------------------------------------------------------------------------------
	  Convergence Criteria     1.00e-06 *    3.00e-04 *             o    1.20e-03 *             o
	----------------------------------------------------------------------------------------------
	     1     -38.43915688   -3.84e+01      6.75e-03      6.75e-03 o    2.74e-02      2.74e-02 o  ~
	----------------------------------------------------------------------------------------------

Next Geometry in Ang 
	Fragment 1 (Ang)

	    H   0.0000000000   0.0000000000   1.0997874919
	    C   0.0000000000   0.0000000000  -0.0857355709


    Structure for next step:
    Molecular point group: c2v
    Full point group: C_inf_v

    Geometry (in Angstrom), charge = -1, multiplicity = 1:

    H            0.000000000000     0.000000000000     1.093670672694
    C            0.000000000000     0.000000000000    -0.091852390080


Scratch directory: /tmp/
gradient() will perform analytic gradient computation.
   => Libint2 <=

    Primary   basis highest AM E, G, H:  6, 6, 3
    Auxiliary basis highest AM E, G, H:  7, 7, 4
    Onebody   basis highest AM E, G, H:  -, -, -
    Solid Harmonics ordering:            Gaussian

*** tstart() called on Joses-MacBook-Pro-2.local
*** at Thu Jul 17 09:11:17 2025

   => Loading Basis Set <=

    Name: CC-PVDZ
    Role: ORBITAL
    Keyword: BASIS
    atoms 1 entry H          line    22 file /Users/joseantoniorodriguesromero/anaconda3/share/psi4/basis/cc-pvdz.gbs 
    atoms 2 entry C          line   138 file /Users/joseantoniorodriguesromero/anaconda3/share/psi4/basis/cc-pvdz.gbs 


         ---------------------------------------------------------
                                   SCF
               by Justin Turney, Rob Parrish, Andy Simmonett
                          and Daniel G. A. Smith
                              UKS Reference
                        1 Threads,    500 MiB Core
         ---------------------------------------------------------

  ==> Geometry <==

    Molecular point group: c2v
    Full point group: C_inf_v

    Geometry (in Angstrom), charge = -1, multiplicity = 1:

       Center              X                  Y                   Z               Mass       
    ------------   -----------------  -----------------  -----------------  -----------------
         H            0.000000000000     0.000000000000     1.093670672694     1.007825032230
         C            0.000000000000     0.000000000000    -0.091852390080    12.000000000000

  Running in c2v symmetry.

  Rotational constants: A = ************  B =     12.90074  C =     12.90074 [cm^-1]
  Rotational constants: A = ************  B = 386754.59726  C = 386754.59726 [MHz]
  Nuclear repulsion =    2.678196117577846

  Charge       = -1
  Multiplicity = 1
  Electrons    = 8
  Nalpha       = 4
  Nbeta        = 4

  ==> Algorithm <==

  SCF Algorithm Type is DF.
  DIIS enabled.
  MOM disabled.
  Fractional occupation disabled.
  Guess Type is READ.
  Energy threshold   = 1.00e-08
  Density threshold  = 1.00e-08
  Integral threshold = 1.00e-12

  ==> Primary Basis <==

  Basis Set: CC-PVDZ
    Blend: CC-PVDZ
    Number of shells: 9
    Number of basis functions: 19
    Number of Cartesian functions: 20
    Spherical Harmonics?: true
    Max angular momentum: 2

  ==> DFT Potential <==

   => LibXC <=

    Version 6.2.2
    S. Lehtola, C. Steigemann, M. J.T. Oliveira, and M. A.L. Marques.,  SoftwareX 7, 1–5 (2018) (10.1016/j.softx.2017.11.002)

   => Composite Functional: B3LYP <= 

    B3LYP Hyb-GGA Exchange-Correlation Functional

    P. J. Stephens, F. J. Devlin, C. F. Chabalowski, and M. J. Frisch.,  J. Phys. Chem. 98, 11623 (1994) (10.1021/j100096a001)

    Deriv               =              1
    GGA                 =           TRUE
    Meta                =          FALSE

    Exchange Hybrid     =           TRUE
    MP2 Hybrid          =          FALSE

   => Exchange Functionals <=

    0.0800   Slater exchange
    0.7200         Becke 88

   => Exact (HF) Exchange <=

    0.2000               HF 

   => Correlation Functionals <=

    0.1900   Vosko, Wilk & Nusair (VWN5_RPA)
    0.8100   Lee, Yang & Parr

   => LibXC Density Thresholds  <==

    XC_HYB_GGA_XC_B3LYP:  1.00E-15 

   => Molecular Quadrature <=

    Radial Scheme          =       TREUTLER
    Pruning Scheme         =           NONE
    Nuclear Scheme         =       TREUTLER

    Blocking Scheme        =         OCTREE
    BS radius alpha        =              1
    Pruning alpha          =              1
    Radial Points          =             75
    Spherical Points       =            302
    Total Points           =          43737
    Total Blocks           =            384
    Max Points             =            256
    Max Functions          =             19
    Weights Tolerance      =       1.00E-15

   => Loading Basis Set <=

    Name: (CC-PVDZ AUX)
    Role: JKFIT
    Keyword: DF_BASIS_SCF
    atoms 1 entry H          line    51 file /Users/joseantoniorodriguesromero/anaconda3/share/psi4/basis/cc-pvdz-jkfit.gbs 
    atoms 2 entry C          line   121 file /Users/joseantoniorodriguesromero/anaconda3/share/psi4/basis/cc-pvdz-jkfit.gbs 

   => Loading Basis Set <=

    Name: CC-PVDZ
    Role: ORBITAL
    Keyword: BASIS
    atoms 1 entry H          line    22 file /Users/joseantoniorodriguesromero/anaconda3/share/psi4/basis/cc-pvdz.gbs 
    atoms 2 entry C          line   138 file /Users/joseantoniorodriguesromero/anaconda3/share/psi4/basis/cc-pvdz.gbs 

  Reading orbitals from file /tmp/singlet_HC.default.71734.180.npy, no projection.

  ==> Integral Setup <==

  DFHelper Memory: AOs need 0.000 GiB; user supplied 0.342 GiB. 
  Using in-core AOs.

  ==> MemDFJK: Density-Fitted J/K Matrices <==

    J tasked:                   Yes
    K tasked:                   Yes
    wK tasked:                   No
    OpenMP threads:               1
    Memory [MiB]:               349
    Algorithm:                 Core
    Schwarz Cutoff:           1E-12
    Mask sparsity (%):       0.0000
    Fitting Condition:        1E-10

   => Auxiliary Basis Set <=

  Basis Set: (CC-PVDZ AUX)
    Blend: CC-PVDZ-JKFIT
    Number of shells: 33
    Number of basis functions: 93
    Number of Cartesian functions: 106
    Spherical Harmonics?: true
    Max angular momentum: 3

  Cached 100.0% of DFT collocation blocks in 0.024 [GiB].

  Minimum eigenvalue in the overlap matrix is 4.3024001353E-02.
  Reciprocal condition number of the overlap matrix is 1.4307368014E-02.
    Using symmetric orthogonalization.

  ==> Pre-Iterations <==

  SCF Guess: Orbitals guess was supplied from a previous computation.

   -------------------------------------------------------
    Irrep   Nso     Nmo     Nalpha   Nbeta   Ndocc  Nsocc
   -------------------------------------------------------
     A1        10      10       3       3       3       0
     A2         1       1       0       0       0       0
     B1         4       4       1       1       1       0
     B2         4       4       0       0       0       0
   -------------------------------------------------------
    Total      19      19       4       4       4       0
   -------------------------------------------------------

  ==> Iterations <==

                           Total Energy        Delta E     RMS |[F,P]|

   @DF-UKS iter   0:   -38.44164841352050   -3.84416e+01   1.72360e-03 
   @DF-UKS iter   1:   -38.43926285288370    2.38556e-03   3.40304e-04 ADIIS/DIIS
   @DF-UKS iter   2:   -38.43926776995452   -4.91707e-06   2.51484e-04 ADIIS/DIIS/DAMP=1%
   @DF-UKS iter   3:   -38.43922024632994    4.75236e-05   4.61074e-05 DIIS/DAMP=1%
   @DF-UKS iter   4:   -38.43928503621749   -6.47899e-05   2.00005e-06 DIIS/DAMP=1%
   @DF-UKS iter   5:   -38.43927310790491    1.19283e-05   3.67969e-07 DIIS/DAMP=1%
   @DF-UKS iter   6:   -38.43927368345103   -5.75546e-07   3.23889e-08 DIIS/DAMP=1%
   @DF-UKS iter   7:   -38.43927360780516    7.56459e-08   5.37436e-10 DIIS/DAMP=1%
   @DF-UKS iter   8:   -38.43927360193769    5.86747e-09   1.73123e-10 DIIS/DAMP=1%
  Energy and wave function converged.


  ==> Post-Iterations <==

   Electrons on quadrature grid:
      Nalpha   =    3.9999999821 ; deviation = -1.795e-08
      Nbeta    =    3.9999999821 ; deviation = -1.795e-08
      Ntotal   =    7.9999999641 ; deviation = -3.590e-08 

   @Spin Contamination Metric:  -5.329070518E-15
   @S^2 Expected:                0.000000000E+00
   @S^2 Observed:               -5.329070518E-15
   @S   Expected:                0.000000000E+00
   @S   Observed:                0.000000000E+00

    Orbital Energies [Eh]
    ---------------------

    Alpha Occupied:                                                       

       1A1    -9.871161     2A1    -0.241693     3A1     0.046579  
       1B1     0.166806  

    Alpha Virtual:                                                        

       1B2     0.219348     4A1     0.350596     5A1     0.766454  
       2B2     0.815965     2B1     0.823743     6A1     0.845958  
       7A1     1.049098     3B2     1.344081     3B1     1.365038  
       1A2     1.533055     8A1     1.541171     9A1     1.865634  
       4B2     2.030214     4B1     2.051504    10A1     2.579880  

    Beta Occupied:                                                        

       1A1    -9.871161     2A1    -0.241693     3A1     0.046579  
       1B1     0.166806  

    Beta Virtual:                                                         

       1B2     0.219348     4A1     0.350596     5A1     0.766454  
       2B2     0.815965     2B1     0.823743     6A1     0.845958  
       7A1     1.049098     3B2     1.344081     3B1     1.365038  
       1A2     1.533055     8A1     1.541171     9A1     1.865634  
       4B2     2.030214     4B1     2.051504    10A1     2.579880  

    Final Occupation by Irrep:
             A1    A2    B1    B2 
    DOCC [     3,    0,    1,    0 ]
    SOCC [     0,    0,    0,    0 ]
    NA   [     3,    0,    1,    0 ]
    NB   [     3,    0,    1,    0 ]

  @DF-UKS Final Energy:   -38.43927360193769

   => Energetics <=

    Nuclear Repulsion Energy =              2.6781961175778459
    One-Electron Energy =                 -58.9976143023188513
    Two-Electron Energy =                  22.6460770631735073
    DFT Exchange-Correlation Energy =      -4.7659324803701919
    Empirical Dispersion Energy =           0.0000000000000000
    VV10 Nonlocal Energy =                  0.0000000000000000
    Total Energy =                        -38.4392736019376855

  UHF NO Occupations:
  HONO-2 :    2 A1 2.0000000
  HONO-1 :    3 A1 2.0000000
  HONO-0 :    1 B1 2.0000000
  LUNO+0 :    4 A1 0.0000000
  LUNO+1 :    2 B1 0.0000000
  LUNO+2 :    5 A1 0.0000000
  LUNO+3 :    6 A1 0.0000000


Computation Completed


Properties will be evaluated at   0.000000,   0.000000,   0.000000 [a0]

Properties computed using the SCF density matrix


 Multipole Moments:

 ------------------------------------------------------------------------------------
     Multipole            Electronic (a.u.)      Nuclear  (a.u.)        Total (a.u.)
 ------------------------------------------------------------------------------------

 L = 1.  Multiply by 2.5417464519 to convert [e a0] to [Debye]
 Dipole X            :          0.0000000            0.0000000            0.0000000
 Dipole Y            :          0.0000000            0.0000000            0.0000000
 Dipole Z            :         -0.7509198            1.0252829            0.2743630
 Magnitude           :                                                    0.2743630

 ------------------------------------------------------------------------------------

*** tstop() called on Joses-MacBook-Pro-2.local at Thu Jul 17 09:11:18 2025
Module time:
	user time   =       0.76 seconds =       0.01 minutes
	system time =       3.04 seconds =       0.05 minutes
	total time  =          1 seconds =       0.02 minutes
Total time:
	user time   =       2.21 seconds =       0.04 minutes
	system time =       6.40 seconds =       0.11 minutes
	total time  =          1 seconds =       0.02 minutes

*** tstart() called on Joses-MacBook-Pro-2.local
*** at Thu Jul 17 09:11:18 2025


         ------------------------------------------------------------
                                   SCF GRAD                          
                          Rob Parrish, Justin Turney,                
                       Andy Simmonett, and Alex Sokolov              
         ------------------------------------------------------------

  ==> Geometry <==

    Molecular point group: c2v
    Full point group: C_inf_v

    Geometry (in Angstrom), charge = -1, multiplicity = 1:

       Center              X                  Y                   Z               Mass       
    ------------   -----------------  -----------------  -----------------  -----------------
         H            0.000000000000     0.000000000000     1.093670672694     1.007825032230
         C            0.000000000000     0.000000000000    -0.091852390080    12.000000000000

  Nuclear repulsion =    2.678196117577846

  ==> Basis Set <==

  Basis Set: CC-PVDZ
    Blend: CC-PVDZ
    Number of shells: 9
    Number of basis functions: 19
    Number of Cartesian functions: 20
    Spherical Harmonics?: true
    Max angular momentum: 2

  ==> DFJKGrad: Density-Fitted SCF Gradients <==

    Gradient:                    1
    J tasked:                  Yes
    K tasked:                  Yes
    wK tasked:                  No
    OpenMP threads:              1
    Integrals threads:           1
    Memory [MiB]:              375
    Schwarz Cutoff:          1E-12
    Fitting Condition:       1E-10

   => Auxiliary Basis Set <=

  Basis Set: (CC-PVDZ AUX)
    Blend: CC-PVDZ-JKFIT
    Number of shells: 33
    Number of basis functions: 93
    Number of Cartesian functions: 106
    Spherical Harmonics?: true
    Max angular momentum: 3

  ==> DFT Potential <==

   => LibXC <=

    Version 6.2.2
    S. Lehtola, C. Steigemann, M. J.T. Oliveira, and M. A.L. Marques.,  SoftwareX 7, 1–5 (2018) (10.1016/j.softx.2017.11.002)

   => Composite Functional: B3LYP <= 

    B3LYP Hyb-GGA Exchange-Correlation Functional

    P. J. Stephens, F. J. Devlin, C. F. Chabalowski, and M. J. Frisch.,  J. Phys. Chem. 98, 11623 (1994) (10.1021/j100096a001)

    Deriv               =              1
    GGA                 =           TRUE
    Meta                =          FALSE

    Exchange Hybrid     =           TRUE
    MP2 Hybrid          =          FALSE

   => Exchange Functionals <=

    0.0800   Slater exchange
    0.7200         Becke 88

   => Exact (HF) Exchange <=

    0.2000               HF 

   => Correlation Functionals <=

    0.1900   Vosko, Wilk & Nusair (VWN5_RPA)
    0.8100   Lee, Yang & Parr

   => LibXC Density Thresholds  <==

    XC_HYB_GGA_XC_B3LYP:  1.00E-15 

   => Molecular Quadrature <=

    Radial Scheme          =       TREUTLER
    Pruning Scheme         =           NONE
    Nuclear Scheme         =       TREUTLER

    Blocking Scheme        =         OCTREE
    BS radius alpha        =              1
    Pruning alpha          =              1
    Radial Points          =             75
    Spherical Points       =            302
    Total Points           =          43737
    Total Blocks           =            384
    Max Points             =            256
    Max Functions          =             19
    Weights Tolerance      =       1.00E-15


  -Total Gradient:
     Atom            X                  Y                   Z
    ------   -----------------  -----------------  -----------------
       1        0.000000000000    -0.000000000000     0.001701482375
       2        0.000000000000     0.000000000000    -0.001701216095


*** tstop() called on Joses-MacBook-Pro-2.local at Thu Jul 17 09:11:18 2025
Module time:
	user time   =       0.33 seconds =       0.01 minutes
	system time =       0.84 seconds =       0.01 minutes
	total time  =          0 seconds =       0.00 minutes
Total time:
	user time   =       2.54 seconds =       0.04 minutes
	system time =       7.24 seconds =       0.12 minutes
	total time  =          1 seconds =       0.02 minutes

    			-----------------------------------------

    			 OPTKING 3.0: for geometry optimizations 

    			     By R.A. King, Bethel University     

    			        with contributions from          

    			    A.V. Copan, J. Cayton, A. Heide      

    			-----------------------------------------

    
	                            ===> Fragment 1 <== 

	 Z (Atomic Numbers)          Masses                          Geom                  
	       1.000000             1.007825          0.00000000  0.00000000  2.06673804   
	       6.000000            12.000000          0.00000000  0.00000000 -0.17357586   

	 - Coordinate -           - BOHR/RAD -       - ANG/DEG -
	 R(1,2)           =         2.240314           1.185523


	        --- Internal Coordinate Step in ANG or DEG, aJ/ANG or AJ/DEG ---
	-------------------------------------------------------------------------------
	           Coordinate      Previous         Force          Change          New 
	           ----------      --------        ------          ------        ------
	               R(1,2)       1.18552       -0.01402       -0.00488       1.18065
	-------------------------------------------------------------------------------

	                                 ==> Convergence Check <==                                  
    
	Measures of convergence in internal coordinates in au.
    
	Criteria marked as inactive (o), active & met (*), and active & unmet ( ).

	----------------------------------------------------------------------------------------------
	   Step    Total Energy     Delta E     Max Force     RMS Force      Max Disp      RMS Disp   
	----------------------------------------------------------------------------------------------
	  Convergence Criteria     1.00e-06 *    3.00e-04 *             o    1.20e-03 *             o
	----------------------------------------------------------------------------------------------
	     2     -38.43927360   -1.17e-04      1.70e-03      1.70e-03 o    9.21e-03      9.21e-03 o  ~
	----------------------------------------------------------------------------------------------

Next Geometry in Ang 
	Fragment 1 (Ang)

	    H   0.0000000000   0.0000000000   1.0912329557
	    C   0.0000000000   0.0000000000  -0.0894146731


    Structure for next step:
    Molecular point group: c2v
    Full point group: C_inf_v

    Geometry (in Angstrom), charge = -1, multiplicity = 1:

    H            0.000000000000     0.000000000000     1.089172979395
    C            0.000000000000     0.000000000000    -0.091474649422


Scratch directory: /tmp/
gradient() will perform analytic gradient computation.
   => Libint2 <=

    Primary   basis highest AM E, G, H:  6, 6, 3
    Auxiliary basis highest AM E, G, H:  7, 7, 4
    Onebody   basis highest AM E, G, H:  -, -, -
    Solid Harmonics ordering:            Gaussian

*** tstart() called on Joses-MacBook-Pro-2.local
*** at Thu Jul 17 09:11:18 2025

   => Loading Basis Set <=

    Name: CC-PVDZ
    Role: ORBITAL
    Keyword: BASIS
    atoms 1 entry H          line    22 file /Users/joseantoniorodriguesromero/anaconda3/share/psi4/basis/cc-pvdz.gbs 
    atoms 2 entry C          line   138 file /Users/joseantoniorodriguesromero/anaconda3/share/psi4/basis/cc-pvdz.gbs 


         ---------------------------------------------------------
                                   SCF
               by Justin Turney, Rob Parrish, Andy Simmonett
                          and Daniel G. A. Smith
                              UKS Reference
                        1 Threads,    500 MiB Core
         ---------------------------------------------------------

  ==> Geometry <==

    Molecular point group: c2v
    Full point group: C_inf_v

    Geometry (in Angstrom), charge = -1, multiplicity = 1:

       Center              X                  Y                   Z               Mass       
    ------------   -----------------  -----------------  -----------------  -----------------
         H            0.000000000000     0.000000000000     1.089172979395     1.007825032230
         C            0.000000000000     0.000000000000    -0.091474649422    12.000000000000

  Running in c2v symmetry.

  Rotational constants: A = ************  B =     13.00751  C =     13.00751 [cm^-1]
  Rotational constants: A = ************  B = 389955.36554  C = 389955.36554 [MHz]
  Nuclear repulsion =    2.689255614056961

  Charge       = -1
  Multiplicity = 1
  Electrons    = 8
  Nalpha       = 4
  Nbeta        = 4

  ==> Algorithm <==

  SCF Algorithm Type is DF.
  DIIS enabled.
  MOM disabled.
  Fractional occupation disabled.
  Guess Type is READ.
  Energy threshold   = 1.00e-08
  Density threshold  = 1.00e-08
  Integral threshold = 1.00e-12

  ==> Primary Basis <==

  Basis Set: CC-PVDZ
    Blend: CC-PVDZ
    Number of shells: 9
    Number of basis functions: 19
    Number of Cartesian functions: 20
    Spherical Harmonics?: true
    Max angular momentum: 2

  ==> DFT Potential <==

   => LibXC <=

    Version 6.2.2
    S. Lehtola, C. Steigemann, M. J.T. Oliveira, and M. A.L. Marques.,  SoftwareX 7, 1–5 (2018) (10.1016/j.softx.2017.11.002)

   => Composite Functional: B3LYP <= 

    B3LYP Hyb-GGA Exchange-Correlation Functional

    P. J. Stephens, F. J. Devlin, C. F. Chabalowski, and M. J. Frisch.,  J. Phys. Chem. 98, 11623 (1994) (10.1021/j100096a001)

    Deriv               =              1
    GGA                 =           TRUE
    Meta                =          FALSE

    Exchange Hybrid     =           TRUE
    MP2 Hybrid          =          FALSE

   => Exchange Functionals <=

    0.0800   Slater exchange
    0.7200         Becke 88

   => Exact (HF) Exchange <=

    0.2000               HF 

   => Correlation Functionals <=

    0.1900   Vosko, Wilk & Nusair (VWN5_RPA)
    0.8100   Lee, Yang & Parr

   => LibXC Density Thresholds  <==

    XC_HYB_GGA_XC_B3LYP:  1.00E-15 

   => Molecular Quadrature <=

    Radial Scheme          =       TREUTLER
    Pruning Scheme         =           NONE
    Nuclear Scheme         =       TREUTLER

    Blocking Scheme        =         OCTREE
    BS radius alpha        =              1
    Pruning alpha          =              1
    Radial Points          =             75
    Spherical Points       =            302
    Total Points           =          43737
    Total Blocks           =            385
    Max Points             =            256
    Max Functions          =             19
    Weights Tolerance      =       1.00E-15

   => Loading Basis Set <=

    Name: (CC-PVDZ AUX)
    Role: JKFIT
    Keyword: DF_BASIS_SCF
    atoms 1 entry H          line    51 file /Users/joseantoniorodriguesromero/anaconda3/share/psi4/basis/cc-pvdz-jkfit.gbs 
    atoms 2 entry C          line   121 file /Users/joseantoniorodriguesromero/anaconda3/share/psi4/basis/cc-pvdz-jkfit.gbs 

   => Loading Basis Set <=

    Name: CC-PVDZ
    Role: ORBITAL
    Keyword: BASIS
    atoms 1 entry H          line    22 file /Users/joseantoniorodriguesromero/anaconda3/share/psi4/basis/cc-pvdz.gbs 
    atoms 2 entry C          line   138 file /Users/joseantoniorodriguesromero/anaconda3/share/psi4/basis/cc-pvdz.gbs 

  Reading orbitals from file /tmp/singlet_HC.default.71734.180.npy, no projection.

  ==> Integral Setup <==

  DFHelper Memory: AOs need 0.000 GiB; user supplied 0.342 GiB. 
  Using in-core AOs.

  ==> MemDFJK: Density-Fitted J/K Matrices <==

    J tasked:                   Yes
    K tasked:                   Yes
    wK tasked:                   No
    OpenMP threads:               1
    Memory [MiB]:               349
    Algorithm:                 Core
    Schwarz Cutoff:           1E-12
    Mask sparsity (%):       0.0000
    Fitting Condition:        1E-10

   => Auxiliary Basis Set <=

  Basis Set: (CC-PVDZ AUX)
    Blend: CC-PVDZ-JKFIT
    Number of shells: 33
    Number of basis functions: 93
    Number of Cartesian functions: 106
    Spherical Harmonics?: true
    Max angular momentum: 3

  Cached 100.0% of DFT collocation blocks in 0.024 [GiB].

  Minimum eigenvalue in the overlap matrix is 4.2629275761E-02.
  Reciprocal condition number of the overlap matrix is 1.4158995255E-02.
    Using symmetric orthogonalization.

  ==> Pre-Iterations <==

  SCF Guess: Orbitals guess was supplied from a previous computation.

   -------------------------------------------------------
    Irrep   Nso     Nmo     Nalpha   Nbeta   Ndocc  Nsocc
   -------------------------------------------------------
     A1        10      10       3       3       3       0
     A2         1       1       0       0       0       0
     B1         4       4       1       1       1       0
     B2         4       4       0       0       0       0
   -------------------------------------------------------
    Total      19      19       4       4       4       0
   -------------------------------------------------------

  ==> Iterations <==

                           Total Energy        Delta E     RMS |[F,P]|

   @DF-UKS iter   0:   -38.44007362713523   -3.84401e+01   5.89251e-04 
   @DF-UKS iter   1:   -38.43927977600325    7.93851e-04   1.14265e-04 ADIIS/DIIS
   @DF-UKS iter   2:   -38.43928034059004   -5.64587e-07   8.36334e-05 DIIS/DAMP=1%
   @DF-UKS iter   3:   -38.43926332150359    1.70191e-05   1.54765e-05 DIIS/DAMP=1%
   @DF-UKS iter   4:   -38.43928482492908   -2.15034e-05   6.67584e-07 DIIS/DAMP=1%
   @DF-UKS iter   5:   -38.43928081861082    4.00632e-06   1.24697e-07 DIIS/DAMP=1%
   @DF-UKS iter   6:   -38.43928101129541   -1.92685e-07   1.05784e-08 DIIS/DAMP=1%
   @DF-UKS iter   7:   -38.43928098547890    2.58165e-08   1.80463e-10 DIIS/DAMP=1%
   @DF-UKS iter   8:   -38.43928098357500    1.90390e-09   5.67729e-11 DIIS/DAMP=1%
  Energy and wave function converged.


  ==> Post-Iterations <==

   Electrons on quadrature grid:
      Nalpha   =    3.9999999817 ; deviation = -1.826e-08
      Nbeta    =    3.9999999817 ; deviation = -1.826e-08
      Ntotal   =    7.9999999635 ; deviation = -3.652e-08 

   @Spin Contamination Metric:   4.440892099E-15
   @S^2 Expected:                0.000000000E+00
   @S^2 Observed:                4.440892099E-15
   @S   Expected:                0.000000000E+00
   @S   Observed:                0.000000000E+00

    Orbital Energies [Eh]
    ---------------------

    Alpha Occupied:                                                       

       1A1    -9.870418     2A1    -0.242444     3A1     0.046974  
       1B1     0.167066  

    Alpha Virtual:                                                        

       1B2     0.219586     4A1     0.351020     5A1     0.767097  
       2B2     0.816256     2B1     0.824038     6A1     0.847238  
       7A1     1.050307     3B2     1.344543     3B1     1.365574  
       1A2     1.533353     8A1     1.541469     9A1     1.870221  
       4B2     2.033464     4B1     2.054821    10A1     2.586080  

    Beta Occupied:                                                        

       1A1    -9.870418     2A1    -0.242444     3A1     0.046974  
       1B1     0.167066  

    Beta Virtual:                                                         

       1B2     0.219586     4A1     0.351020     5A1     0.767097  
       2B2     0.816256     2B1     0.824038     6A1     0.847238  
       7A1     1.050307     3B2     1.344543     3B1     1.365574  
       1A2     1.533353     8A1     1.541469     9A1     1.870221  
       4B2     2.033464     4B1     2.054821    10A1     2.586080  

    Final Occupation by Irrep:
             A1    A2    B1    B2 
    DOCC [     3,    0,    1,    0 ]
    SOCC [     0,    0,    0,    0 ]
    NA   [     3,    0,    1,    0 ]
    NB   [     3,    0,    1,    0 ]

  @DF-UKS Final Energy:   -38.43928098357500

   => Energetics <=

    Nuclear Repulsion Energy =              2.6892556140569606
    One-Electron Energy =                 -59.0202031014021884
    Two-Electron Energy =                  22.6588081843396836
    DFT Exchange-Correlation Energy =      -4.7671416805694538
    Empirical Dispersion Energy =           0.0000000000000000
    VV10 Nonlocal Energy =                  0.0000000000000000
    Total Energy =                        -38.4392809835749958

  UHF NO Occupations:
  HONO-2 :    1 A1 2.0000000
  HONO-1 :    2 A1 2.0000000
  HONO-0 :    3 A1 2.0000000
  LUNO+0 :    4 A1 0.0000000
  LUNO+1 :    5 A1 0.0000000
  LUNO+2 :    2 B1 0.0000000
  LUNO+3 :    6 A1 0.0000000


Computation Completed


Properties will be evaluated at   0.000000,   0.000000,   0.000000 [a0]

Properties computed using the SCF density matrix


 Multipole Moments:

 ------------------------------------------------------------------------------------
     Multipole            Electronic (a.u.)      Nuclear  (a.u.)        Total (a.u.)
 ------------------------------------------------------------------------------------

 L = 1.  Multiply by 2.5417464519 to convert [e a0] to [Debye]
 Dipole X            :          0.0000000            0.0000000            0.0000000
 Dipole Y            :          0.0000000            0.0000000            0.0000000
 Dipole Z            :         -0.7383173            1.0210664            0.2827492
 Magnitude           :                                                    0.2827492

 ------------------------------------------------------------------------------------

*** tstop() called on Joses-MacBook-Pro-2.local at Thu Jul 17 09:11:18 2025
Module time:
	user time   =       0.78 seconds =       0.01 minutes
	system time =       3.03 seconds =       0.05 minutes
	total time  =          0 seconds =       0.00 minutes
Total time:
	user time   =       3.37 seconds =       0.06 minutes
	system time =      10.55 seconds =       0.18 minutes
	total time  =          1 seconds =       0.02 minutes

*** tstart() called on Joses-MacBook-Pro-2.local
*** at Thu Jul 17 09:11:18 2025


         ------------------------------------------------------------
                                   SCF GRAD                          
                          Rob Parrish, Justin Turney,                
                       Andy Simmonett, and Alex Sokolov              
         ------------------------------------------------------------

  ==> Geometry <==

    Molecular point group: c2v
    Full point group: C_inf_v

    Geometry (in Angstrom), charge = -1, multiplicity = 1:

       Center              X                  Y                   Z               Mass       
    ------------   -----------------  -----------------  -----------------  -----------------
         H            0.000000000000     0.000000000000     1.089172979395     1.007825032230
         C            0.000000000000     0.000000000000    -0.091474649422    12.000000000000

  Nuclear repulsion =    2.689255614056961

  ==> Basis Set <==

  Basis Set: CC-PVDZ
    Blend: CC-PVDZ
    Number of shells: 9
    Number of basis functions: 19
    Number of Cartesian functions: 20
    Spherical Harmonics?: true
    Max angular momentum: 2

  ==> DFJKGrad: Density-Fitted SCF Gradients <==

    Gradient:                    1
    J tasked:                  Yes
    K tasked:                  Yes
    wK tasked:                  No
    OpenMP threads:              1
    Integrals threads:           1
    Memory [MiB]:              375
    Schwarz Cutoff:          1E-12
    Fitting Condition:       1E-10

   => Auxiliary Basis Set <=

  Basis Set: (CC-PVDZ AUX)
    Blend: CC-PVDZ-JKFIT
    Number of shells: 33
    Number of basis functions: 93
    Number of Cartesian functions: 106
    Spherical Harmonics?: true
    Max angular momentum: 3

  ==> DFT Potential <==

   => LibXC <=

    Version 6.2.2
    S. Lehtola, C. Steigemann, M. J.T. Oliveira, and M. A.L. Marques.,  SoftwareX 7, 1–5 (2018) (10.1016/j.softx.2017.11.002)

   => Composite Functional: B3LYP <= 

    B3LYP Hyb-GGA Exchange-Correlation Functional

    P. J. Stephens, F. J. Devlin, C. F. Chabalowski, and M. J. Frisch.,  J. Phys. Chem. 98, 11623 (1994) (10.1021/j100096a001)

    Deriv               =              1
    GGA                 =           TRUE
    Meta                =          FALSE

    Exchange Hybrid     =           TRUE
    MP2 Hybrid          =          FALSE

   => Exchange Functionals <=

    0.0800   Slater exchange
    0.7200         Becke 88

   => Exact (HF) Exchange <=

    0.2000               HF 

   => Correlation Functionals <=

    0.1900   Vosko, Wilk & Nusair (VWN5_RPA)
    0.8100   Lee, Yang & Parr

   => LibXC Density Thresholds  <==

    XC_HYB_GGA_XC_B3LYP:  1.00E-15 

   => Molecular Quadrature <=

    Radial Scheme          =       TREUTLER
    Pruning Scheme         =           NONE
    Nuclear Scheme         =       TREUTLER

    Blocking Scheme        =         OCTREE
    BS radius alpha        =              1
    Pruning alpha          =              1
    Radial Points          =             75
    Spherical Points       =            302
    Total Points           =          43737
    Total Blocks           =            385
    Max Points             =            256
    Max Functions          =             19
    Weights Tolerance      =       1.00E-15


  -Total Gradient:
     Atom            X                  Y                   Z
    ------   -----------------  -----------------  -----------------
       1        0.000000000000    -0.000000000000    -0.000108533611
       2        0.000000000000     0.000000000000     0.000108788361


*** tstop() called on Joses-MacBook-Pro-2.local at Thu Jul 17 09:11:18 2025
Module time:
	user time   =       0.20 seconds =       0.00 minutes
	system time =       0.90 seconds =       0.01 minutes
	total time  =          0 seconds =       0.00 minutes
Total time:
	user time   =       3.58 seconds =       0.06 minutes
	system time =      11.45 seconds =       0.19 minutes
	total time  =          1 seconds =       0.02 minutes

    			-----------------------------------------

    			 OPTKING 3.0: for geometry optimizations 

    			     By R.A. King, Bethel University     

    			        with contributions from          

    			    A.V. Copan, J. Cayton, A. Heide      

    			-----------------------------------------

    
	                            ===> Fragment 1 <== 

	 Z (Atomic Numbers)          Masses                          Geom                  
	       1.000000             1.007825          0.00000000  0.00000000  2.05823863   
	       6.000000            12.000000          0.00000000  0.00000000 -0.17286203   

	 - Coordinate -           - BOHR/RAD -       - ANG/DEG -
	 R(1,2)           =         2.231101           1.180648


	        --- Internal Coordinate Step in ANG or DEG, aJ/ANG or AJ/DEG ---
	-------------------------------------------------------------------------------
	           Coordinate      Previous         Force          Change          New 
	           ----------      --------        ------          ------        ------
	               R(1,2)       1.18065        0.00090        0.00031       1.18095
	-------------------------------------------------------------------------------

	                                 ==> Convergence Check <==                                  
    
	Measures of convergence in internal coordinates in au.
    
	Criteria marked as inactive (o), active & met (*), and active & unmet ( ).

	----------------------------------------------------------------------------------------------
	   Step    Total Energy     Delta E     Max Force     RMS Force      Max Disp      RMS Disp   
	----------------------------------------------------------------------------------------------
	  Convergence Criteria     1.00e-06 *    3.00e-04 *             o    1.20e-03 *             o
	----------------------------------------------------------------------------------------------
	     3     -38.43928098   -7.38e-06      1.09e-04 *    1.09e-04 o    5.79e-04 *    5.79e-04 o  ~
	----------------------------------------------------------------------------------------------

Next Geometry in Ang 
	Fragment 1 (Ang)

	    H   0.0000000000   0.0000000000   1.0893262145
	    C   0.0000000000   0.0000000000  -0.0916278845


    Final optimized geometry and variables:
    Molecular point group: c2v
    Full point group: C_inf_v

    Geometry (in Angstrom), charge = -1, multiplicity = 1:

    H            0.000000000000     0.000000000000     1.089172979395
    C            0.000000000000     0.000000000000    -0.091474649422


    Psi4 stopped on: Thursday, 17 July 2025 09:11AM
    Psi4 wall time for execution: 0:00:02.36

*** Psi4 exiting successfully. Buy a developer a beer!
