
    -----------------------------------------------------------------------
          Psi4: An Open-Source Ab Initio Electronic Structure Package
                               Psi4 1.9.1 release

                         Git: Rev {} zzzzzzz 


    D. G. A. Smith, L. A. Burns, A. C. Simmonett, R. M. Parrish,
    M. C. Schieber, R. Galvelis, P. Kraus, H. Kruse, R. Di Remigio,
    A. Alenaizan, A. M. James, S. Lehtola, J. P. Misiewicz, M. Scheurer,
    R. A. Shaw, J. B. Schriber, Y. Xie, Z. L. Glick, D. A. Sirianni,
    J. S. O'Brien, J. M. Waldrop, A. Kumar, E. G. Hohenstein,
    B. P. Pritchard, B. R. Brooks, H. F. Schaefer III, A. Yu. Sokolov,
    K. Patkowski, A. E. DePrince III, U. Bozkaya, R. A. King,
    F. A. Evangelista, J. M. Turney, T. D. Crawford, C. D. Sherrill,
    J. Chem. Phys. 152(18) 184108 (2020). https://doi.org/10.1063/5.0006002

                            Additional Code Authors
    E. T. Seidl, C. L. Janssen, E. F. Valeev, M. L. Leininger,
    J. F. Gonthier, R. M. Richard, H. R. McAlexander, M. Saitow, X. Wang,
    P. Verma, M. H. Lechner, A. Jiang, S. Behnle, A. G. Heide,
    M. F. Herbst, and D. L. Poole

             Previous Authors, Complete List of Code Contributors,
                       and Citations for Specific Modules
    https://github.com/psi4/psi4/blob/master/codemeta.json
    https://github.com/psi4/psi4/graphs/contributors
    http://psicode.org/psi4manual/master/introduction.html#citing-psifour

    -----------------------------------------------------------------------


    Psi4 started on: Thursday, 17 July 2025 09:50AM

    Process ID: 72248
    Host:       Joses-MacBook-Pro-2.local
    PSIDATADIR: /Users/joseantoniorodriguesromero/anaconda3/share/psi4
    Memory:     500.0 MiB
    Threads:    1
    
  ==> Input File <==

--------------------------------------------------------------------------
molecule { 
-1 1
B   0.00000        0.60000        0.00000
O   0.00000       -0.60000        0.00000
}

set { 
basis              cc-pvdz
reference          uks
maxiter            500
geom_maxiter       500
DAMPING_PERCENTAGE 1
guess              SAP
}

optimize('b3lyp')
--------------------------------------------------------------------------

Scratch directory: /tmp/
gradient() will perform analytic gradient computation.
   => Libint2 <=

    Primary   basis highest AM E, G, H:  6, 6, 3
    Auxiliary basis highest AM E, G, H:  7, 7, 4
    Onebody   basis highest AM E, G, H:  -, -, -
    Solid Harmonics ordering:            Gaussian

*** tstart() called on Joses-MacBook-Pro-2.local
*** at Thu Jul 17 09:50:06 2025

   => Loading Basis Set <=

    Name: CC-PVDZ
    Role: ORBITAL
    Keyword: BASIS
    atoms 1 entry B          line   108 file /Users/joseantoniorodriguesromero/anaconda3/share/psi4/basis/cc-pvdz.gbs 
    atoms 2 entry O          line   198 file /Users/joseantoniorodriguesromero/anaconda3/share/psi4/basis/cc-pvdz.gbs 


         ---------------------------------------------------------
                                   SCF
               by Justin Turney, Rob Parrish, Andy Simmonett
                          and Daniel G. A. Smith
                              UKS Reference
                        1 Threads,    500 MiB Core
         ---------------------------------------------------------

  ==> Geometry <==

    Molecular point group: c2v
    Full point group: C_inf_v

    Geometry (in Angstrom), charge = -1, multiplicity = 1:

       Center              X                  Y                   Z               Mass       
    ------------   -----------------  -----------------  -----------------  -----------------
         B            0.000000000000     0.000000000000     0.710774003397    11.009305360000
         O            0.000000000000     0.000000000000    -0.489225996603    15.994914619570

  Running in c2v symmetry.

  Rotational constants: A = ************  B =      1.79525  C =      1.79525 [cm^-1]
  Rotational constants: A = ************  B =  53820.10002  C =  53820.10002 [MHz]
  Nuclear repulsion =   17.639240355666669

  Charge       = -1
  Multiplicity = 1
  Electrons    = 14
  Nalpha       = 7
  Nbeta        = 7

  ==> Algorithm <==

  SCF Algorithm Type is DF.
  DIIS enabled.
  MOM disabled.
  Fractional occupation disabled.
  Guess Type is SAP.
  Energy threshold   = 1.00e-08
  Density threshold  = 1.00e-08
  Integral threshold = 1.00e-12

  ==> Primary Basis <==

  Basis Set: CC-PVDZ
    Blend: CC-PVDZ
    Number of shells: 12
    Number of basis functions: 28
    Number of Cartesian functions: 30
    Spherical Harmonics?: true
    Max angular momentum: 2

  ==> DFT Potential <==

   => LibXC <=

    Version 6.2.2
    S. Lehtola, C. Steigemann, M. J.T. Oliveira, and M. A.L. Marques.,  SoftwareX 7, 1–5 (2018) (10.1016/j.softx.2017.11.002)

   => Composite Functional: B3LYP <= 

    B3LYP Hyb-GGA Exchange-Correlation Functional

    P. J. Stephens, F. J. Devlin, C. F. Chabalowski, and M. J. Frisch.,  J. Phys. Chem. 98, 11623 (1994) (10.1021/j100096a001)

    Deriv               =              1
    GGA                 =           TRUE
    Meta                =          FALSE

    Exchange Hybrid     =           TRUE
    MP2 Hybrid          =          FALSE

   => Exchange Functionals <=

    0.0800   Slater exchange
    0.7200         Becke 88

   => Exact (HF) Exchange <=

    0.2000               HF 

   => Correlation Functionals <=

    0.1900   Vosko, Wilk & Nusair (VWN5_RPA)
    0.8100   Lee, Yang & Parr

   => LibXC Density Thresholds  <==

    XC_HYB_GGA_XC_B3LYP:  1.00E-15 

   => Molecular Quadrature <=

    Radial Scheme          =       TREUTLER
    Pruning Scheme         =           NONE
    Nuclear Scheme         =       TREUTLER

    Blocking Scheme        =         OCTREE
    BS radius alpha        =              1
    Pruning alpha          =              1
    Radial Points          =             75
    Spherical Points       =            302
    Total Points           =          43261
    Total Blocks           =            392
    Max Points             =            256
    Max Functions          =             28
    Weights Tolerance      =       1.00E-15

   => Loading Basis Set <=

    Name: (CC-PVDZ AUX)
    Role: JKFIT
    Keyword: DF_BASIS_SCF
    atoms 1 entry B          line    71 file /Users/joseantoniorodriguesromero/anaconda3/share/psi4/basis/cc-pvdz-jkfit.gbs 
    atoms 2 entry O          line   221 file /Users/joseantoniorodriguesromero/anaconda3/share/psi4/basis/cc-pvdz-jkfit.gbs 

  ==> Integral Setup <==

  DFHelper Memory: AOs need 0.001 GiB; user supplied 0.332 GiB. 
  Using in-core AOs.

  ==> MemDFJK: Density-Fitted J/K Matrices <==

    J tasked:                   Yes
    K tasked:                   Yes
    wK tasked:                   No
    OpenMP threads:               1
    Memory [MiB]:               339
    Algorithm:                 Core
    Schwarz Cutoff:           1E-12
    Mask sparsity (%):       0.0000
    Fitting Condition:        1E-10

   => Auxiliary Basis Set <=

  Basis Set: (CC-PVDZ AUX)
    Blend: CC-PVDZ-JKFIT
    Number of shells: 48
    Number of basis functions: 140
    Number of Cartesian functions: 162
    Spherical Harmonics?: true
    Max angular momentum: 3

  Cached 100.0% of DFT collocation blocks in 0.034 [GiB].

  Minimum eigenvalue in the overlap matrix is 2.6021757573E-02.
  Reciprocal condition number of the overlap matrix is 8.6042066289E-03.
    Using symmetric orthogonalization.

  ==> Pre-Iterations <==

  SCF Guess: Superposition of Atomic Potentials (doi:10.1021/acs.jctc.8b01089).

  ==> SAP guess <==

   => Molecular Quadrature <=

    Radial Scheme          =       TREUTLER
    Pruning Scheme         =           NONE
    Nuclear Scheme         =       TREUTLER

    Blocking Scheme        =         OCTREE
    BS radius alpha        =              1
    Pruning alpha          =              1
    Radial Points          =             75
    Spherical Points       =            302
    Total Points           =          43261
    Total Blocks           =            392
    Max Points             =            256
    Max Functions          =             28
    Weights Tolerance      =       1.00E-15

   -------------------------------------------------------
    Irrep   Nso     Nmo     Nalpha   Nbeta   Ndocc  Nsocc
   -------------------------------------------------------
     A1        14      14       5       5       5       0
     A2         2       2       0       0       0       0
     B1         6       6       1       1       1       0
     B2         6       6       1       1       1       0
   -------------------------------------------------------
    Total      28      28       7       7       7       0
   -------------------------------------------------------

  ==> Iterations <==

                           Total Energy        Delta E     RMS |[F,P]|

   @DF-UKS iter   1:   -99.77085649856197   -9.97709e+01   5.19636e-02 DIIS/ADIIS
   @DF-UKS iter   2:   -98.66175430328845    1.10910e+00   1.03410e-01 ADIIS/DAMP=1%
   @DF-UKS iter   3:  -100.00701107011045   -1.34526e+00   2.10020e-02 DIIS/ADIIS/DAMP=1%
   @DF-UKS iter   4:  -100.08905475525260   -8.20437e-02   2.23068e-03 DIIS/ADIIS/DAMP=1%
   @DF-UKS iter   5:  -100.10269435435069   -1.36396e-02   3.82947e-04 DIIS/ADIIS/DAMP=1%
   @DF-UKS iter   6:  -100.10142837371382    1.26598e-03   7.47308e-05 DIIS/DAMP=1%
   @DF-UKS iter   7:  -100.10150640988017   -7.80362e-05   1.71833e-06 DIIS/DAMP=1%
   @DF-UKS iter   8:  -100.10155027240188   -4.38625e-05   4.05381e-07 DIIS/DAMP=1%
   @DF-UKS iter   9:  -100.10154959764260    6.74759e-07   8.27032e-08 DIIS/DAMP=1%
   @DF-UKS iter  10:  -100.10154960197472   -4.33212e-09   1.21268e-08 DIIS/DAMP=1%
   @DF-UKS iter  11:  -100.10154957441046    2.75643e-08   9.23199e-11 DIIS/DAMP=1%
   @DF-UKS iter  12:  -100.10154956909662    5.31384e-09   9.43992e-11 DIIS/DAMP=1%
  Energy and wave function converged.


  ==> Post-Iterations <==

   Electrons on quadrature grid:
      Nalpha   =    7.0000001107 ; deviation = 1.107e-07
      Nbeta    =    7.0000001107 ; deviation = 1.107e-07
      Ntotal   =   14.0000002213 ; deviation = 2.213e-07 

   @Spin Contamination Metric:   1.065814104E-14
   @S^2 Expected:                0.000000000E+00
   @S^2 Observed:                1.065814104E-14
   @S   Expected:                0.000000000E+00
   @S   Observed:                0.000000000E+00

    Orbital Energies [Eh]
    ---------------------

    Alpha Occupied:                                                       

       1A1   -18.842862     2A1    -6.446126     3A1    -0.697076  
       4A1    -0.147073     1B2    -0.074264     1B1    -0.074264  
       5A1     0.045221  

    Alpha Virtual:                                                        

       2B2     0.295967     2B1     0.295967     6A1     0.389217  
       3B1     0.587043     3B2     0.587043     7A1     0.632674  
       8A1     0.920183     1A2     1.004691     9A1     1.004691  
      10A1     1.151333     4B2     1.187253     4B1     1.187253  
       5B1     1.273587     5B2     1.273587    11A1     1.735417  
      12A1     1.977965     2A2     2.925036    13A1     2.925038  
       6B1     3.228719     6B2     3.228719    14A1     3.682204  

    Beta Occupied:                                                        

       1A1   -18.842862     2A1    -6.446126     3A1    -0.697076  
       4A1    -0.147073     1B2    -0.074264     1B1    -0.074264  
       5A1     0.045221  

    Beta Virtual:                                                         

       2B2     0.295967     2B1     0.295967     6A1     0.389217  
       3B1     0.587043     3B2     0.587043     7A1     0.632674  
       8A1     0.920183     1A2     1.004691     9A1     1.004691  
      10A1     1.151333     4B2     1.187253     4B1     1.187253  
       5B1     1.273587     5B2     1.273587    11A1     1.735417  
      12A1     1.977965     2A2     2.925036    13A1     2.925038  
       6B1     3.228719     6B2     3.228719    14A1     3.682204  

    Final Occupation by Irrep:
             A1    A2    B1    B2 
    DOCC [     5,    0,    1,    1 ]
    SOCC [     0,    0,    0,    0 ]
    NA   [     5,    0,    1,    1 ]
    NB   [     5,    0,    1,    1 ]

  @DF-UKS Final Energy:  -100.10154956909662

   => Energetics <=

    Nuclear Repulsion Energy =             17.6392403556666686
    One-Electron Energy =                -175.5124783979283620
    Two-Electron Energy =                  68.1926476406038091
    DFT Exchange-Correlation Energy =     -10.4209591674387241
    Empirical Dispersion Energy =           0.0000000000000000
    VV10 Nonlocal Energy =                  0.0000000000000000
    Total Energy =                       -100.1015495690966191

  UHF NO Occupations:
  HONO-2 :    3 A1 2.0000000
  HONO-1 :    4 A1 2.0000000
  HONO-0 :    5 A1 2.0000000
  LUNO+0 :    6 A1 0.0000000
  LUNO+1 :    7 A1 0.0000000
  LUNO+2 :    2 B2 0.0000000
  LUNO+3 :    2 B1 0.0000000


Computation Completed


Properties will be evaluated at   0.000000,   0.000000,   0.000000 [a0]

Properties computed using the SCF density matrix


 Multipole Moments:

 ------------------------------------------------------------------------------------
     Multipole            Electronic (a.u.)      Nuclear  (a.u.)        Total (a.u.)
 ------------------------------------------------------------------------------------

 L = 1.  Multiply by 2.5417464519 to convert [e a0] to [Debye]
 Dipole X            :          0.0000000            0.0000000            0.0000000
 Dipole Y            :          0.0000000            0.0000000            0.0000000
 Dipole Z            :         -0.3618468           -0.6801842           -1.0420310
 Magnitude           :                                                    1.0420310

 ------------------------------------------------------------------------------------

*** tstop() called on Joses-MacBook-Pro-2.local at Thu Jul 17 09:50:06 2025
Module time:
	user time   =       3.31 seconds =       0.06 minutes
	system time =       4.80 seconds =       0.08 minutes
	total time  =          0 seconds =       0.00 minutes
Total time:
	user time   =       3.31 seconds =       0.06 minutes
	system time =       4.80 seconds =       0.08 minutes
	total time  =          0 seconds =       0.00 minutes

*** tstart() called on Joses-MacBook-Pro-2.local
*** at Thu Jul 17 09:50:06 2025


         ------------------------------------------------------------
                                   SCF GRAD                          
                          Rob Parrish, Justin Turney,                
                       Andy Simmonett, and Alex Sokolov              
         ------------------------------------------------------------

  ==> Geometry <==

    Molecular point group: c2v
    Full point group: C_inf_v

    Geometry (in Angstrom), charge = -1, multiplicity = 1:

       Center              X                  Y                   Z               Mass       
    ------------   -----------------  -----------------  -----------------  -----------------
         B            0.000000000000     0.000000000000     0.710774003397    11.009305360000
         O            0.000000000000     0.000000000000    -0.489225996603    15.994914619570

  Nuclear repulsion =   17.639240355666669

  ==> Basis Set <==

  Basis Set: CC-PVDZ
    Blend: CC-PVDZ
    Number of shells: 12
    Number of basis functions: 28
    Number of Cartesian functions: 30
    Spherical Harmonics?: true
    Max angular momentum: 2

  ==> DFJKGrad: Density-Fitted SCF Gradients <==

    Gradient:                    1
    J tasked:                  Yes
    K tasked:                  Yes
    wK tasked:                  No
    OpenMP threads:              1
    Integrals threads:           1
    Memory [MiB]:              375
    Schwarz Cutoff:          1E-12
    Fitting Condition:       1E-10

   => Auxiliary Basis Set <=

  Basis Set: (CC-PVDZ AUX)
    Blend: CC-PVDZ-JKFIT
    Number of shells: 48
    Number of basis functions: 140
    Number of Cartesian functions: 162
    Spherical Harmonics?: true
    Max angular momentum: 3

  ==> DFT Potential <==

   => LibXC <=

    Version 6.2.2
    S. Lehtola, C. Steigemann, M. J.T. Oliveira, and M. A.L. Marques.,  SoftwareX 7, 1–5 (2018) (10.1016/j.softx.2017.11.002)

   => Composite Functional: B3LYP <= 

    B3LYP Hyb-GGA Exchange-Correlation Functional

    P. J. Stephens, F. J. Devlin, C. F. Chabalowski, and M. J. Frisch.,  J. Phys. Chem. 98, 11623 (1994) (10.1021/j100096a001)

    Deriv               =              1
    GGA                 =           TRUE
    Meta                =          FALSE

    Exchange Hybrid     =           TRUE
    MP2 Hybrid          =          FALSE

   => Exchange Functionals <=

    0.0800   Slater exchange
    0.7200         Becke 88

   => Exact (HF) Exchange <=

    0.2000               HF 

   => Correlation Functionals <=

    0.1900   Vosko, Wilk & Nusair (VWN5_RPA)
    0.8100   Lee, Yang & Parr

   => LibXC Density Thresholds  <==

    XC_HYB_GGA_XC_B3LYP:  1.00E-15 

   => Molecular Quadrature <=

    Radial Scheme          =       TREUTLER
    Pruning Scheme         =           NONE
    Nuclear Scheme         =       TREUTLER

    Blocking Scheme        =         OCTREE
    BS radius alpha        =              1
    Pruning alpha          =              1
    Radial Points          =             75
    Spherical Points       =            302
    Total Points           =          43261
    Total Blocks           =            392
    Max Points             =            256
    Max Functions          =             28
    Weights Tolerance      =       1.00E-15


  -Total Gradient:
     Atom            X                  Y                   Z
    ------   -----------------  -----------------  -----------------
       1        0.000000000000    -0.000000000000    -0.067484330765
       2       -0.000000000000    -0.000000000000     0.067499032159


*** tstop() called on Joses-MacBook-Pro-2.local at Thu Jul 17 09:50:07 2025
Module time:
	user time   =       0.60 seconds =       0.01 minutes
	system time =       1.68 seconds =       0.03 minutes
	total time  =          1 seconds =       0.02 minutes
Total time:
	user time   =       3.91 seconds =       0.07 minutes
	system time =       6.48 seconds =       0.11 minutes
	total time  =          1 seconds =       0.02 minutes

    			-----------------------------------------

    			 OPTKING 3.0: for geometry optimizations 

    			     By R.A. King, Bethel University     

    			        with contributions from          

    			    A.V. Copan, J. Cayton, A. Heide      

    			-----------------------------------------

    
	                            ===> Fragment 1 <== 

	 Z (Atomic Numbers)          Masses                          Geom                  
	       5.000000            11.009305          0.00000000  0.00000000  1.34316820   
	       8.000000            15.994915          0.00000000  0.00000000 -0.92450315   

	 - Coordinate -           - BOHR/RAD -       - ANG/DEG -
	 R(1,2)           =         2.267671           1.200000


	        --- Internal Coordinate Step in ANG or DEG, aJ/ANG or AJ/DEG ---
	-------------------------------------------------------------------------------
	           Coordinate      Previous         Force          Change          New 
	           ----------      --------        ------          ------        ------
	               R(1,2)       1.20000        0.55605        0.03393       1.23393
	-------------------------------------------------------------------------------

	                                 ==> Convergence Check <==                                  
    
	Measures of convergence in internal coordinates in au.
    
	Criteria marked as inactive (o), active & met (*), and active & unmet ( ).

	----------------------------------------------------------------------------------------------
	   Step    Total Energy     Delta E     Max Force     RMS Force      Max Disp      RMS Disp   
	----------------------------------------------------------------------------------------------
	  Convergence Criteria     1.00e-06 *    3.00e-04 *             o    1.20e-03 *             o
	----------------------------------------------------------------------------------------------
	     1    -100.10154957   -1.00e+02      6.75e-02      6.75e-02 o    6.41e-02      6.41e-02 o  ~
	----------------------------------------------------------------------------------------------

Next Geometry in Ang 
	Fragment 1 (Ang)

	    B   0.0000000000   0.0000000000   0.7277398371
	    O   0.0000000000   0.0000000000  -0.5061918303


    Structure for next step:
    Molecular point group: c2v
    Full point group: C_inf_v

    Geometry (in Angstrom), charge = -1, multiplicity = 1:

    B            0.000000000000     0.000000000000     0.730872125995
    O            0.000000000000     0.000000000000    -0.503059541459


Scratch directory: /tmp/
gradient() will perform analytic gradient computation.
   => Libint2 <=

    Primary   basis highest AM E, G, H:  6, 6, 3
    Auxiliary basis highest AM E, G, H:  7, 7, 4
    Onebody   basis highest AM E, G, H:  -, -, -
    Solid Harmonics ordering:            Gaussian

*** tstart() called on Joses-MacBook-Pro-2.local
*** at Thu Jul 17 09:50:07 2025

   => Loading Basis Set <=

    Name: CC-PVDZ
    Role: ORBITAL
    Keyword: BASIS
    atoms 1 entry B          line   108 file /Users/joseantoniorodriguesromero/anaconda3/share/psi4/basis/cc-pvdz.gbs 
    atoms 2 entry O          line   198 file /Users/joseantoniorodriguesromero/anaconda3/share/psi4/basis/cc-pvdz.gbs 


         ---------------------------------------------------------
                                   SCF
               by Justin Turney, Rob Parrish, Andy Simmonett
                          and Daniel G. A. Smith
                              UKS Reference
                        1 Threads,    500 MiB Core
         ---------------------------------------------------------

  ==> Geometry <==

    Molecular point group: c2v
    Full point group: C_inf_v

    Geometry (in Angstrom), charge = -1, multiplicity = 1:

       Center              X                  Y                   Z               Mass       
    ------------   -----------------  -----------------  -----------------  -----------------
         B            0.000000000000     0.000000000000     0.730872125995    11.009305360000
         O            0.000000000000     0.000000000000    -0.503059541459    15.994914619570

  Running in c2v symmetry.

  Rotational constants: A = ************  B =      1.69787  C =      1.69787 [cm^-1]
  Rotational constants: A = ************  B =  50900.81926  C =  50900.81926 [MHz]
  Nuclear repulsion =   17.154182022473975

  Charge       = -1
  Multiplicity = 1
  Electrons    = 14
  Nalpha       = 7
  Nbeta        = 7

  ==> Algorithm <==

  SCF Algorithm Type is DF.
  DIIS enabled.
  MOM disabled.
  Fractional occupation disabled.
  Guess Type is READ.
  Energy threshold   = 1.00e-08
  Density threshold  = 1.00e-08
  Integral threshold = 1.00e-12

  ==> Primary Basis <==

  Basis Set: CC-PVDZ
    Blend: CC-PVDZ
    Number of shells: 12
    Number of basis functions: 28
    Number of Cartesian functions: 30
    Spherical Harmonics?: true
    Max angular momentum: 2

  ==> DFT Potential <==

   => LibXC <=

    Version 6.2.2
    S. Lehtola, C. Steigemann, M. J.T. Oliveira, and M. A.L. Marques.,  SoftwareX 7, 1–5 (2018) (10.1016/j.softx.2017.11.002)

   => Composite Functional: B3LYP <= 

    B3LYP Hyb-GGA Exchange-Correlation Functional

    P. J. Stephens, F. J. Devlin, C. F. Chabalowski, and M. J. Frisch.,  J. Phys. Chem. 98, 11623 (1994) (10.1021/j100096a001)

    Deriv               =              1
    GGA                 =           TRUE
    Meta                =          FALSE

    Exchange Hybrid     =           TRUE
    MP2 Hybrid          =          FALSE

   => Exchange Functionals <=

    0.0800   Slater exchange
    0.7200         Becke 88

   => Exact (HF) Exchange <=

    0.2000               HF 

   => Correlation Functionals <=

    0.1900   Vosko, Wilk & Nusair (VWN5_RPA)
    0.8100   Lee, Yang & Parr

   => LibXC Density Thresholds  <==

    XC_HYB_GGA_XC_B3LYP:  1.00E-15 

   => Molecular Quadrature <=

    Radial Scheme          =       TREUTLER
    Pruning Scheme         =           NONE
    Nuclear Scheme         =       TREUTLER

    Blocking Scheme        =         OCTREE
    BS radius alpha        =              1
    Pruning alpha          =              1
    Radial Points          =             75
    Spherical Points       =            302
    Total Points           =          43262
    Total Blocks           =            387
    Max Points             =            255
    Max Functions          =             28
    Weights Tolerance      =       1.00E-15

   => Loading Basis Set <=

    Name: (CC-PVDZ AUX)
    Role: JKFIT
    Keyword: DF_BASIS_SCF
    atoms 1 entry B          line    71 file /Users/joseantoniorodriguesromero/anaconda3/share/psi4/basis/cc-pvdz-jkfit.gbs 
    atoms 2 entry O          line   221 file /Users/joseantoniorodriguesromero/anaconda3/share/psi4/basis/cc-pvdz-jkfit.gbs 

   => Loading Basis Set <=

    Name: CC-PVDZ
    Role: ORBITAL
    Keyword: BASIS
    atoms 1 entry B          line   108 file /Users/joseantoniorodriguesromero/anaconda3/share/psi4/basis/cc-pvdz.gbs 
    atoms 2 entry O          line   198 file /Users/joseantoniorodriguesromero/anaconda3/share/psi4/basis/cc-pvdz.gbs 

  Reading orbitals from file /tmp/singlet_BO.default.72248.180.npy, no projection.

  ==> Integral Setup <==

  DFHelper Memory: AOs need 0.001 GiB; user supplied 0.332 GiB. 
  Using in-core AOs.

  ==> MemDFJK: Density-Fitted J/K Matrices <==

    J tasked:                   Yes
    K tasked:                   Yes
    wK tasked:                   No
    OpenMP threads:               1
    Memory [MiB]:               339
    Algorithm:                 Core
    Schwarz Cutoff:           1E-12
    Mask sparsity (%):       0.0000
    Fitting Condition:        1E-10

   => Auxiliary Basis Set <=

  Basis Set: (CC-PVDZ AUX)
    Blend: CC-PVDZ-JKFIT
    Number of shells: 48
    Number of basis functions: 140
    Number of Cartesian functions: 162
    Spherical Harmonics?: true
    Max angular momentum: 3

  Cached 100.0% of DFT collocation blocks in 0.034 [GiB].

  Minimum eigenvalue in the overlap matrix is 2.8005752678E-02.
  Reciprocal condition number of the overlap matrix is 9.3108878701E-03.
    Using symmetric orthogonalization.

  ==> Pre-Iterations <==

  SCF Guess: Orbitals guess was supplied from a previous computation.

   -------------------------------------------------------
    Irrep   Nso     Nmo     Nalpha   Nbeta   Ndocc  Nsocc
   -------------------------------------------------------
     A1        14      14       5       5       5       0
     A2         2       2       0       0       0       0
     B1         6       6       1       1       1       0
     B2         6       6       1       1       1       0
   -------------------------------------------------------
    Total      28      28       7       7       7       0
   -------------------------------------------------------

  ==> Iterations <==

                           Total Energy        Delta E     RMS |[F,P]|

   @DF-UKS iter   0:  -100.09110526127719   -1.00091e+02   6.39535e-03 
   @DF-UKS iter   1:  -100.10336774955245   -1.22625e-02   2.31035e-03 DIIS/ADIIS
   @DF-UKS iter   2:  -100.10052718057851    2.84057e-03   5.67820e-03 DIIS/ADIIS/DAMP=1%
   @DF-UKS iter   3:  -100.10188218670677   -1.35501e-03   1.06071e-04 DIIS/ADIIS/DAMP=1%
   @DF-UKS iter   4:  -100.10402798322983   -2.14580e-03   7.65883e-05 DIIS/DAMP=1%
   @DF-UKS iter   5:  -100.10401917335440    8.80988e-06   6.89040e-06 DIIS/DAMP=1%
   @DF-UKS iter   6:  -100.10403723881639   -1.80655e-05   4.59961e-07 DIIS/DAMP=1%
   @DF-UKS iter   7:  -100.10404039164243   -3.15283e-06   4.96237e-08 DIIS/DAMP=1%
   @DF-UKS iter   8:  -100.10404052308579   -1.31443e-07   1.13085e-08 DIIS/DAMP=1%
   @DF-UKS iter   9:  -100.10404052394067   -8.54882e-10   7.19930e-10 DIIS/DAMP=1%
  Energy and wave function converged.


  ==> Post-Iterations <==

   Electrons on quadrature grid:
      Nalpha   =    7.0000000072 ; deviation = 7.247e-09
      Nbeta    =    7.0000000072 ; deviation = 7.247e-09
      Ntotal   =   14.0000000145 ; deviation = 1.449e-08 

   @Spin Contamination Metric:   1.065814104E-14
   @S^2 Expected:                0.000000000E+00
   @S^2 Observed:                1.065814104E-14
   @S   Expected:                0.000000000E+00
   @S   Observed:                0.000000000E+00

    Orbital Energies [Eh]
    ---------------------

    Alpha Occupied:                                                       

       1A1   -18.845384     2A1    -6.456235     3A1    -0.687322  
       4A1    -0.145139     1B1    -0.067650     1B2    -0.067650  
       5A1     0.041574  

    Alpha Virtual:                                                        

       2B2     0.289144     2B1     0.289144     6A1     0.387869  
       3B2     0.582210     3B1     0.582210     7A1     0.629627  
       8A1     0.898297     1A2     1.003009     9A1     1.003009  
      10A1     1.133009     4B2     1.173870     4B1     1.173870  
       5B2     1.275007     5B1     1.275007    11A1     1.693239  
      12A1     1.970310     2A2     2.922481    13A1     2.922484  
       6B1     3.209673     6B2     3.209673    14A1     3.643503  

    Beta Occupied:                                                        

       1A1   -18.845384     2A1    -6.456235     3A1    -0.687322  
       4A1    -0.145139     1B1    -0.067650     1B2    -0.067650  
       5A1     0.041574  

    Beta Virtual:                                                         

       2B2     0.289144     2B1     0.289144     6A1     0.387869  
       3B2     0.582210     3B1     0.582210     7A1     0.629627  
       8A1     0.898297     1A2     1.003009     9A1     1.003009  
      10A1     1.133009     4B2     1.173870     4B1     1.173870  
       5B2     1.275007     5B1     1.275007    11A1     1.693239  
      12A1     1.970310     2A2     2.922481    13A1     2.922484  
       6B1     3.209673     6B2     3.209673    14A1     3.643503  

    Final Occupation by Irrep:
             A1    A2    B1    B2 
    DOCC [     5,    0,    1,    1 ]
    SOCC [     0,    0,    0,    0 ]
    NA   [     5,    0,    1,    1 ]
    NB   [     5,    0,    1,    1 ]

  @DF-UKS Final Energy:  -100.10404052394067

   => Energetics <=

    Nuclear Repulsion Energy =             17.1541820224739752
    One-Electron Energy =                -174.5784750787476014
    Two-Electron Energy =                  67.7211092263581236
    DFT Exchange-Correlation Energy =     -10.4008566940251601
    Empirical Dispersion Energy =           0.0000000000000000
    VV10 Nonlocal Energy =                  0.0000000000000000
    Total Energy =                       -100.1040405239406681

  UHF NO Occupations:
  HONO-2 :    3 A1 2.0000000
  HONO-1 :    4 A1 2.0000000
  HONO-0 :    5 A1 2.0000000
  LUNO+0 :    6 A1 0.0000000
  LUNO+1 :    7 A1 0.0000000
  LUNO+2 :    2 B2 0.0000000
  LUNO+3 :    8 A1 0.0000000


Computation Completed


Properties will be evaluated at   0.000000,   0.000000,   0.000000 [a0]

Properties computed using the SCF density matrix


 Multipole Moments:

 ------------------------------------------------------------------------------------
     Multipole            Electronic (a.u.)      Nuclear  (a.u.)        Total (a.u.)
 ------------------------------------------------------------------------------------

 L = 1.  Multiply by 2.5417464519 to convert [e a0] to [Debye]
 Dipole X            :          0.0000000            0.0000000            0.0000000
 Dipole Y            :          0.0000000            0.0000000            0.0000000
 Dipole Z            :         -0.3089962           -0.6994173           -1.0084135
 Magnitude           :                                                    1.0084135

 ------------------------------------------------------------------------------------

*** tstop() called on Joses-MacBook-Pro-2.local at Thu Jul 17 09:50:07 2025
Module time:
	user time   =       3.31 seconds =       0.06 minutes
	system time =       3.15 seconds =       0.05 minutes
	total time  =          0 seconds =       0.00 minutes
Total time:
	user time   =       7.26 seconds =       0.12 minutes
	system time =       9.86 seconds =       0.16 minutes
	total time  =          1 seconds =       0.02 minutes

*** tstart() called on Joses-MacBook-Pro-2.local
*** at Thu Jul 17 09:50:07 2025


         ------------------------------------------------------------
                                   SCF GRAD                          
                          Rob Parrish, Justin Turney,                
                       Andy Simmonett, and Alex Sokolov              
         ------------------------------------------------------------

  ==> Geometry <==

    Molecular point group: c2v
    Full point group: C_inf_v

    Geometry (in Angstrom), charge = -1, multiplicity = 1:

       Center              X                  Y                   Z               Mass       
    ------------   -----------------  -----------------  -----------------  -----------------
         B            0.000000000000     0.000000000000     0.730872125995    11.009305360000
         O            0.000000000000     0.000000000000    -0.503059541459    15.994914619570

  Nuclear repulsion =   17.154182022473975

  ==> Basis Set <==

  Basis Set: CC-PVDZ
    Blend: CC-PVDZ
    Number of shells: 12
    Number of basis functions: 28
    Number of Cartesian functions: 30
    Spherical Harmonics?: true
    Max angular momentum: 2

  ==> DFJKGrad: Density-Fitted SCF Gradients <==

    Gradient:                    1
    J tasked:                  Yes
    K tasked:                  Yes
    wK tasked:                  No
    OpenMP threads:              1
    Integrals threads:           1
    Memory [MiB]:              375
    Schwarz Cutoff:          1E-12
    Fitting Condition:       1E-10

   => Auxiliary Basis Set <=

  Basis Set: (CC-PVDZ AUX)
    Blend: CC-PVDZ-JKFIT
    Number of shells: 48
    Number of basis functions: 140
    Number of Cartesian functions: 162
    Spherical Harmonics?: true
    Max angular momentum: 3

  ==> DFT Potential <==

   => LibXC <=

    Version 6.2.2
    S. Lehtola, C. Steigemann, M. J.T. Oliveira, and M. A.L. Marques.,  SoftwareX 7, 1–5 (2018) (10.1016/j.softx.2017.11.002)

   => Composite Functional: B3LYP <= 

    B3LYP Hyb-GGA Exchange-Correlation Functional

    P. J. Stephens, F. J. Devlin, C. F. Chabalowski, and M. J. Frisch.,  J. Phys. Chem. 98, 11623 (1994) (10.1021/j100096a001)

    Deriv               =              1
    GGA                 =           TRUE
    Meta                =          FALSE

    Exchange Hybrid     =           TRUE
    MP2 Hybrid          =          FALSE

   => Exchange Functionals <=

    0.0800   Slater exchange
    0.7200         Becke 88

   => Exact (HF) Exchange <=

    0.2000               HF 

   => Correlation Functionals <=

    0.1900   Vosko, Wilk & Nusair (VWN5_RPA)
    0.8100   Lee, Yang & Parr

   => LibXC Density Thresholds  <==

    XC_HYB_GGA_XC_B3LYP:  1.00E-15 

   => Molecular Quadrature <=

    Radial Scheme          =       TREUTLER
    Pruning Scheme         =           NONE
    Nuclear Scheme         =       TREUTLER

    Blocking Scheme        =         OCTREE
    BS radius alpha        =              1
    Pruning alpha          =              1
    Radial Points          =             75
    Spherical Points       =            302
    Total Points           =          43262
    Total Blocks           =            387
    Max Points             =            255
    Max Functions          =             28
    Weights Tolerance      =       1.00E-15


  -Total Gradient:
     Atom            X                  Y                   Z
    ------   -----------------  -----------------  -----------------
       1        0.000000000000     0.000000000000    -0.012176299448
       2       -0.000000000000     0.000000000000     0.012191914338


*** tstop() called on Joses-MacBook-Pro-2.local at Thu Jul 17 09:50:07 2025
Module time:
	user time   =       0.40 seconds =       0.01 minutes
	system time =       1.21 seconds =       0.02 minutes
	total time  =          0 seconds =       0.00 minutes
Total time:
	user time   =       7.66 seconds =       0.13 minutes
	system time =      11.07 seconds =       0.18 minutes
	total time  =          1 seconds =       0.02 minutes

    			-----------------------------------------

    			 OPTKING 3.0: for geometry optimizations 

    			     By R.A. King, Bethel University     

    			        with contributions from          

    			    A.V. Copan, J. Cayton, A. Heide      

    			-----------------------------------------

    
	                            ===> Fragment 1 <== 

	 Z (Atomic Numbers)          Masses                          Geom                  
	       5.000000            11.009305          0.00000000  0.00000000  1.38114815   
	       8.000000            15.994915          0.00000000  0.00000000 -0.95064476   

	 - Coordinate -           - BOHR/RAD -       - ANG/DEG -
	 R(1,2)           =         2.331793           1.233932


	        --- Internal Coordinate Step in ANG or DEG, aJ/ANG or AJ/DEG ---
	-------------------------------------------------------------------------------
	           Coordinate      Previous         Force          Change          New 
	           ----------      --------        ------          ------        ------
	               R(1,2)       1.23393        0.10038        0.00747       1.24141
	-------------------------------------------------------------------------------

	                                 ==> Convergence Check <==                                  
    
	Measures of convergence in internal coordinates in au.
    
	Criteria marked as inactive (o), active & met (*), and active & unmet ( ).

	----------------------------------------------------------------------------------------------
	   Step    Total Energy     Delta E     Max Force     RMS Force      Max Disp      RMS Disp   
	----------------------------------------------------------------------------------------------
	  Convergence Criteria     1.00e-06 *    3.00e-04 *             o    1.20e-03 *             o
	----------------------------------------------------------------------------------------------
	     2    -100.10404052   -2.49e-03      1.22e-02      1.22e-02 o    1.41e-02      1.41e-02 o  ~
	----------------------------------------------------------------------------------------------

Next Geometry in Ang 
	Fragment 1 (Ang)

	    B   0.0000000000   0.0000000000   0.7346089071
	    O   0.0000000000   0.0000000000  -0.5067963226


    Structure for next step:
    Molecular point group: c2v
    Full point group: C_inf_v

    Geometry (in Angstrom), charge = -1, multiplicity = 1:

    B            0.000000000000     0.000000000000     0.735298804131
    O            0.000000000000     0.000000000000    -0.506106425577


Scratch directory: /tmp/
gradient() will perform analytic gradient computation.
   => Libint2 <=

    Primary   basis highest AM E, G, H:  6, 6, 3
    Auxiliary basis highest AM E, G, H:  7, 7, 4
    Onebody   basis highest AM E, G, H:  -, -, -
    Solid Harmonics ordering:            Gaussian

*** tstart() called on Joses-MacBook-Pro-2.local
*** at Thu Jul 17 09:50:07 2025

   => Loading Basis Set <=

    Name: CC-PVDZ
    Role: ORBITAL
    Keyword: BASIS
    atoms 1 entry B          line   108 file /Users/joseantoniorodriguesromero/anaconda3/share/psi4/basis/cc-pvdz.gbs 
    atoms 2 entry O          line   198 file /Users/joseantoniorodriguesromero/anaconda3/share/psi4/basis/cc-pvdz.gbs 


         ---------------------------------------------------------
                                   SCF
               by Justin Turney, Rob Parrish, Andy Simmonett
                          and Daniel G. A. Smith
                              UKS Reference
                        1 Threads,    500 MiB Core
         ---------------------------------------------------------

  ==> Geometry <==

    Molecular point group: c2v
    Full point group: C_inf_v

    Geometry (in Angstrom), charge = -1, multiplicity = 1:

       Center              X                  Y                   Z               Mass       
    ------------   -----------------  -----------------  -----------------  -----------------
         B            0.000000000000     0.000000000000     0.735298804131    11.009305360000
         O            0.000000000000     0.000000000000    -0.506106425577    15.994914619570

  Running in c2v symmetry.

  Rotational constants: A = ************  B =      1.67749  C =      1.67749 [cm^-1]
  Rotational constants: A = ************  B =  50289.79339  C =  50289.79339 [MHz]
  Nuclear repulsion =   17.050909662892064

  Charge       = -1
  Multiplicity = 1
  Electrons    = 14
  Nalpha       = 7
  Nbeta        = 7

  ==> Algorithm <==

  SCF Algorithm Type is DF.
  DIIS enabled.
  MOM disabled.
  Fractional occupation disabled.
  Guess Type is READ.
  Energy threshold   = 1.00e-08
  Density threshold  = 1.00e-08
  Integral threshold = 1.00e-12

  ==> Primary Basis <==

  Basis Set: CC-PVDZ
    Blend: CC-PVDZ
    Number of shells: 12
    Number of basis functions: 28
    Number of Cartesian functions: 30
    Spherical Harmonics?: true
    Max angular momentum: 2

  ==> DFT Potential <==

   => LibXC <=

    Version 6.2.2
    S. Lehtola, C. Steigemann, M. J.T. Oliveira, and M. A.L. Marques.,  SoftwareX 7, 1–5 (2018) (10.1016/j.softx.2017.11.002)

   => Composite Functional: B3LYP <= 

    B3LYP Hyb-GGA Exchange-Correlation Functional

    P. J. Stephens, F. J. Devlin, C. F. Chabalowski, and M. J. Frisch.,  J. Phys. Chem. 98, 11623 (1994) (10.1021/j100096a001)

    Deriv               =              1
    GGA                 =           TRUE
    Meta                =          FALSE

    Exchange Hybrid     =           TRUE
    MP2 Hybrid          =          FALSE

   => Exchange Functionals <=

    0.0800   Slater exchange
    0.7200         Becke 88

   => Exact (HF) Exchange <=

    0.2000               HF 

   => Correlation Functionals <=

    0.1900   Vosko, Wilk & Nusair (VWN5_RPA)
    0.8100   Lee, Yang & Parr

   => LibXC Density Thresholds  <==

    XC_HYB_GGA_XC_B3LYP:  1.00E-15 

   => Molecular Quadrature <=

    Radial Scheme          =       TREUTLER
    Pruning Scheme         =           NONE
    Nuclear Scheme         =       TREUTLER

    Blocking Scheme        =         OCTREE
    BS radius alpha        =              1
    Pruning alpha          =              1
    Radial Points          =             75
    Spherical Points       =            302
    Total Points           =          43262
    Total Blocks           =            387
    Max Points             =            255
    Max Functions          =             28
    Weights Tolerance      =       1.00E-15

   => Loading Basis Set <=

    Name: (CC-PVDZ AUX)
    Role: JKFIT
    Keyword: DF_BASIS_SCF
    atoms 1 entry B          line    71 file /Users/joseantoniorodriguesromero/anaconda3/share/psi4/basis/cc-pvdz-jkfit.gbs 
    atoms 2 entry O          line   221 file /Users/joseantoniorodriguesromero/anaconda3/share/psi4/basis/cc-pvdz-jkfit.gbs 

   => Loading Basis Set <=

    Name: CC-PVDZ
    Role: ORBITAL
    Keyword: BASIS
    atoms 1 entry B          line   108 file /Users/joseantoniorodriguesromero/anaconda3/share/psi4/basis/cc-pvdz.gbs 
    atoms 2 entry O          line   198 file /Users/joseantoniorodriguesromero/anaconda3/share/psi4/basis/cc-pvdz.gbs 

  Reading orbitals from file /tmp/singlet_BO.default.72248.180.npy, no projection.

  ==> Integral Setup <==

  DFHelper Memory: AOs need 0.001 GiB; user supplied 0.332 GiB. 
  Using in-core AOs.

  ==> MemDFJK: Density-Fitted J/K Matrices <==

    J tasked:                   Yes
    K tasked:                   Yes
    wK tasked:                   No
    OpenMP threads:               1
    Memory [MiB]:               339
    Algorithm:                 Core
    Schwarz Cutoff:           1E-12
    Mask sparsity (%):       0.0000
    Fitting Condition:        1E-10

   => Auxiliary Basis Set <=

  Basis Set: (CC-PVDZ AUX)
    Blend: CC-PVDZ-JKFIT
    Number of shells: 48
    Number of basis functions: 140
    Number of Cartesian functions: 162
    Spherical Harmonics?: true
    Max angular momentum: 3

  Cached 100.0% of DFT collocation blocks in 0.034 [GiB].

  Minimum eigenvalue in the overlap matrix is 2.8439279173E-02.
  Reciprocal condition number of the overlap matrix is 9.4668019656E-03.
    Using symmetric orthogonalization.

  ==> Pre-Iterations <==

  SCF Guess: Orbitals guess was supplied from a previous computation.

   -------------------------------------------------------
    Irrep   Nso     Nmo     Nalpha   Nbeta   Ndocc  Nsocc
   -------------------------------------------------------
     A1        14      14       5       5       5       0
     A2         2       2       0       0       0       0
     B1         6       6       1       1       1       0
     B2         6       6       1       1       1       0
   -------------------------------------------------------
    Total      28      28       7       7       7       0
   -------------------------------------------------------

  ==> Iterations <==

                           Total Energy        Delta E     RMS |[F,P]|

   @DF-UKS iter   0:  -100.10124208745233   -1.00101e+02   1.35177e-03 
   @DF-UKS iter   1:  -100.10410280543991   -2.86072e-03   5.17601e-04 DIIS/ADIIS
   @DF-UKS iter   2:  -100.10396290874715    1.39897e-04   1.26260e-03 DIIS/ADIIS/DAMP=1%
   @DF-UKS iter   3:  -100.10367364427842    2.89264e-04   3.89917e-05 DIIS/DAMP=1%
   @DF-UKS iter   4:  -100.10411833934135   -4.44695e-04   1.76736e-05 DIIS/DAMP=1%
   @DF-UKS iter   5:  -100.10413165712360   -1.33178e-05   1.92387e-06 DIIS/DAMP=1%
   @DF-UKS iter   6:  -100.10413567033123   -4.01321e-06   1.58783e-07 DIIS/DAMP=1%
   @DF-UKS iter   7:  -100.10413649586874   -8.25538e-07   7.81240e-09 DIIS/DAMP=1%
   @DF-UKS iter   8:  -100.10413654286802   -4.69993e-08   1.72914e-09 DIIS/DAMP=1%
   @DF-UKS iter   9:  -100.10413654349513   -6.27111e-10   1.98072e-10 DIIS/DAMP=1%
  Energy and wave function converged.


  ==> Post-Iterations <==

   Electrons on quadrature grid:
      Nalpha   =    6.9999999666 ; deviation = -3.340e-08
      Nbeta    =    6.9999999666 ; deviation = -3.340e-08
      Ntotal   =   13.9999999332 ; deviation = -6.680e-08 

   @Spin Contamination Metric:   1.776356839E-15
   @S^2 Expected:                0.000000000E+00
   @S^2 Observed:                1.776356839E-15
   @S   Expected:                0.000000000E+00
   @S   Observed:                0.000000000E+00

    Orbital Energies [Eh]
    ---------------------

    Alpha Occupied:                                                       

       1A1   -18.845884     2A1    -6.458434     3A1    -0.685189  
       4A1    -0.144694     1B1    -0.066232     1B2    -0.066232  
       5A1     0.040786  

    Alpha Virtual:                                                        

       2B2     0.287643     2B1     0.287643     6A1     0.387558  
       3B1     0.581215     3B2     0.581215     7A1     0.628954  
       8A1     0.893154     9A1     1.002631     1A2     1.002631  
      10A1     1.129405     4B2     1.170793     4B1     1.170793  
       5B1     1.275531     5B2     1.275531    11A1     1.684652  
      12A1     1.969123     2A2     2.921996    13A1     2.921999  
       6B1     3.205577     6B2     3.205577    14A1     3.634803  

    Beta Occupied:                                                        

       1A1   -18.845884     2A1    -6.458434     3A1    -0.685189  
       4A1    -0.144694     1B1    -0.066232     1B2    -0.066232  
       5A1     0.040786  

    Beta Virtual:                                                         

       2B2     0.287643     2B1     0.287643     6A1     0.387558  
       3B1     0.581215     3B2     0.581215     7A1     0.628954  
       8A1     0.893154     9A1     1.002631     1A2     1.002631  
      10A1     1.129405     4B2     1.170793     4B1     1.170793  
       5B1     1.275531     5B2     1.275531    11A1     1.684652  
      12A1     1.969123     2A2     2.921996    13A1     2.921999  
       6B1     3.205577     6B2     3.205577    14A1     3.634803  

    Final Occupation by Irrep:
             A1    A2    B1    B2 
    DOCC [     5,    0,    1,    1 ]
    SOCC [     0,    0,    0,    0 ]
    NA   [     5,    0,    1,    1 ]
    NB   [     5,    0,    1,    1 ]

  @DF-UKS Final Energy:  -100.10413654349513

   => Energetics <=

    Nuclear Repulsion Energy =             17.0509096628920638
    One-Electron Energy =                -174.3788805110795010
    Two-Electron Energy =                  67.6204792071948475
    DFT Exchange-Correlation Energy =     -10.3966449025025334
    Empirical Dispersion Energy =           0.0000000000000000
    VV10 Nonlocal Energy =                  0.0000000000000000
    Total Energy =                       -100.1041365434951302

  UHF NO Occupations:
  HONO-2 :    1 B1 2.0000000
  HONO-1 :    4 A1 2.0000000
  HONO-0 :    5 A1 2.0000000
  LUNO+0 :    6 A1 0.0000000
  LUNO+1 :    7 A1 0.0000000
  LUNO+2 :    8 A1 0.0000000
  LUNO+3 :    2 B2 0.0000000


Computation Completed


Properties will be evaluated at   0.000000,   0.000000,   0.000000 [a0]

Properties computed using the SCF density matrix


 Multipole Moments:

 ------------------------------------------------------------------------------------
     Multipole            Electronic (a.u.)      Nuclear  (a.u.)        Total (a.u.)
 ------------------------------------------------------------------------------------

 L = 1.  Multiply by 2.5417464519 to convert [e a0] to [Debye]
 Dipole X            :          0.0000000            0.0000000            0.0000000
 Dipole Y            :          0.0000000            0.0000000            0.0000000
 Dipole Z            :         -0.2973279           -0.7036535           -1.0009814
 Magnitude           :                                                    1.0009814

 ------------------------------------------------------------------------------------

*** tstop() called on Joses-MacBook-Pro-2.local at Thu Jul 17 09:50:08 2025
Module time:
	user time   =       3.08 seconds =       0.05 minutes
	system time =       4.32 seconds =       0.07 minutes
	total time  =          1 seconds =       0.02 minutes
Total time:
	user time   =      10.78 seconds =       0.18 minutes
	system time =      15.59 seconds =       0.26 minutes
	total time  =          2 seconds =       0.03 minutes

*** tstart() called on Joses-MacBook-Pro-2.local
*** at Thu Jul 17 09:50:08 2025


         ------------------------------------------------------------
                                   SCF GRAD                          
                          Rob Parrish, Justin Turney,                
                       Andy Simmonett, and Alex Sokolov              
         ------------------------------------------------------------

  ==> Geometry <==

    Molecular point group: c2v
    Full point group: C_inf_v

    Geometry (in Angstrom), charge = -1, multiplicity = 1:

       Center              X                  Y                   Z               Mass       
    ------------   -----------------  -----------------  -----------------  -----------------
         B            0.000000000000     0.000000000000     0.735298804131    11.009305360000
         O            0.000000000000     0.000000000000    -0.506106425577    15.994914619570

  Nuclear repulsion =   17.050909662892064

  ==> Basis Set <==

  Basis Set: CC-PVDZ
    Blend: CC-PVDZ
    Number of shells: 12
    Number of basis functions: 28
    Number of Cartesian functions: 30
    Spherical Harmonics?: true
    Max angular momentum: 2

  ==> DFJKGrad: Density-Fitted SCF Gradients <==

    Gradient:                    1
    J tasked:                  Yes
    K tasked:                  Yes
    wK tasked:                  No
    OpenMP threads:              1
    Integrals threads:           1
    Memory [MiB]:              375
    Schwarz Cutoff:          1E-12
    Fitting Condition:       1E-10

   => Auxiliary Basis Set <=

  Basis Set: (CC-PVDZ AUX)
    Blend: CC-PVDZ-JKFIT
    Number of shells: 48
    Number of basis functions: 140
    Number of Cartesian functions: 162
    Spherical Harmonics?: true
    Max angular momentum: 3

  ==> DFT Potential <==

   => LibXC <=

    Version 6.2.2
    S. Lehtola, C. Steigemann, M. J.T. Oliveira, and M. A.L. Marques.,  SoftwareX 7, 1–5 (2018) (10.1016/j.softx.2017.11.002)

   => Composite Functional: B3LYP <= 

    B3LYP Hyb-GGA Exchange-Correlation Functional

    P. J. Stephens, F. J. Devlin, C. F. Chabalowski, and M. J. Frisch.,  J. Phys. Chem. 98, 11623 (1994) (10.1021/j100096a001)

    Deriv               =              1
    GGA                 =           TRUE
    Meta                =          FALSE

    Exchange Hybrid     =           TRUE
    MP2 Hybrid          =          FALSE

   => Exchange Functionals <=

    0.0800   Slater exchange
    0.7200         Becke 88

   => Exact (HF) Exchange <=

    0.2000               HF 

   => Correlation Functionals <=

    0.1900   Vosko, Wilk & Nusair (VWN5_RPA)
    0.8100   Lee, Yang & Parr

   => LibXC Density Thresholds  <==

    XC_HYB_GGA_XC_B3LYP:  1.00E-15 

   => Molecular Quadrature <=

    Radial Scheme          =       TREUTLER
    Pruning Scheme         =           NONE
    Nuclear Scheme         =       TREUTLER

    Blocking Scheme        =         OCTREE
    BS radius alpha        =              1
    Pruning alpha          =              1
    Radial Points          =             75
    Spherical Points       =            302
    Total Points           =          43262
    Total Blocks           =            387
    Max Points             =            255
    Max Functions          =             28
    Weights Tolerance      =       1.00E-15


  -Total Gradient:
     Atom            X                  Y                   Z
    ------   -----------------  -----------------  -----------------
       1       -0.000000000000    -0.000000000000    -0.001510020705
       2        0.000000000000     0.000000000000     0.001526373651


*** tstop() called on Joses-MacBook-Pro-2.local at Thu Jul 17 09:50:08 2025
Module time:
	user time   =       0.52 seconds =       0.01 minutes
	system time =       1.26 seconds =       0.02 minutes
	total time  =          0 seconds =       0.00 minutes
Total time:
	user time   =      11.31 seconds =       0.19 minutes
	system time =      16.86 seconds =       0.28 minutes
	total time  =          2 seconds =       0.03 minutes

    			-----------------------------------------

    			 OPTKING 3.0: for geometry optimizations 

    			     By R.A. King, Bethel University     

    			        with contributions from          

    			    A.V. Copan, J. Cayton, A. Heide      

    			-----------------------------------------

    
	                            ===> Fragment 1 <== 

	 Z (Atomic Numbers)          Masses                          Geom                  
	       5.000000            11.009305          0.00000000  0.00000000  1.38951336   
	       8.000000            15.994915          0.00000000  0.00000000 -0.95640253   

	 - Coordinate -           - BOHR/RAD -       - ANG/DEG -
	 R(1,2)           =         2.345916           1.241405


	        --- Internal Coordinate Step in ANG or DEG, aJ/ANG or AJ/DEG ---
	-------------------------------------------------------------------------------
	           Coordinate      Previous         Force          Change          New 
	           ----------      --------        ------          ------        ------
	               R(1,2)       1.24141        0.01251        0.00095       1.24236
	-------------------------------------------------------------------------------

	                                 ==> Convergence Check <==                                  
    
	Measures of convergence in internal coordinates in au.
    
	Criteria marked as inactive (o), active & met (*), and active & unmet ( ).

	----------------------------------------------------------------------------------------------
	   Step    Total Energy     Delta E     Max Force     RMS Force      Max Disp      RMS Disp   
	----------------------------------------------------------------------------------------------
	  Convergence Criteria     1.00e-06 *    3.00e-04 *             o    1.20e-03 *             o
	----------------------------------------------------------------------------------------------
	     3    -100.10413654   -9.60e-05      1.52e-03      1.52e-03 o    1.80e-03      1.80e-03 o  ~
	----------------------------------------------------------------------------------------------

Next Geometry in Ang 
	Fragment 1 (Ang)

	    B   0.0000000000   0.0000000000   0.7357752160
	    O   0.0000000000   0.0000000000  -0.5065828374


    Structure for next step:
    Molecular point group: c2v
    Full point group: C_inf_v

    Geometry (in Angstrom), charge = -1, multiplicity = 1:

    B            0.000000000000     0.000000000000     0.735863172725
    O            0.000000000000     0.000000000000    -0.506494880679


Scratch directory: /tmp/
gradient() will perform analytic gradient computation.
   => Libint2 <=

    Primary   basis highest AM E, G, H:  6, 6, 3
    Auxiliary basis highest AM E, G, H:  7, 7, 4
    Onebody   basis highest AM E, G, H:  -, -, -
    Solid Harmonics ordering:            Gaussian

*** tstart() called on Joses-MacBook-Pro-2.local
*** at Thu Jul 17 09:50:08 2025

   => Loading Basis Set <=

    Name: CC-PVDZ
    Role: ORBITAL
    Keyword: BASIS
    atoms 1 entry B          line   108 file /Users/joseantoniorodriguesromero/anaconda3/share/psi4/basis/cc-pvdz.gbs 
    atoms 2 entry O          line   198 file /Users/joseantoniorodriguesromero/anaconda3/share/psi4/basis/cc-pvdz.gbs 


         ---------------------------------------------------------
                                   SCF
               by Justin Turney, Rob Parrish, Andy Simmonett
                          and Daniel G. A. Smith
                              UKS Reference
                        1 Threads,    500 MiB Core
         ---------------------------------------------------------

  ==> Geometry <==

    Molecular point group: c2v
    Full point group: C_inf_v

    Geometry (in Angstrom), charge = -1, multiplicity = 1:

       Center              X                  Y                   Z               Mass       
    ------------   -----------------  -----------------  -----------------  -----------------
         B            0.000000000000     0.000000000000     0.735863172725    11.009305360000
         O            0.000000000000     0.000000000000    -0.506494880679    15.994914619570

  Running in c2v symmetry.

  Rotational constants: A = ************  B =      1.67491  C =      1.67491 [cm^-1]
  Rotational constants: A = ************  B =  50212.68368  C =  50212.68368 [MHz]
  Nuclear repulsion =   17.037832506341516

  Charge       = -1
  Multiplicity = 1
  Electrons    = 14
  Nalpha       = 7
  Nbeta        = 7

  ==> Algorithm <==

  SCF Algorithm Type is DF.
  DIIS enabled.
  MOM disabled.
  Fractional occupation disabled.
  Guess Type is READ.
  Energy threshold   = 1.00e-08
  Density threshold  = 1.00e-08
  Integral threshold = 1.00e-12

  ==> Primary Basis <==

  Basis Set: CC-PVDZ
    Blend: CC-PVDZ
    Number of shells: 12
    Number of basis functions: 28
    Number of Cartesian functions: 30
    Spherical Harmonics?: true
    Max angular momentum: 2

  ==> DFT Potential <==

   => LibXC <=

    Version 6.2.2
    S. Lehtola, C. Steigemann, M. J.T. Oliveira, and M. A.L. Marques.,  SoftwareX 7, 1–5 (2018) (10.1016/j.softx.2017.11.002)

   => Composite Functional: B3LYP <= 

    B3LYP Hyb-GGA Exchange-Correlation Functional

    P. J. Stephens, F. J. Devlin, C. F. Chabalowski, and M. J. Frisch.,  J. Phys. Chem. 98, 11623 (1994) (10.1021/j100096a001)

    Deriv               =              1
    GGA                 =           TRUE
    Meta                =          FALSE

    Exchange Hybrid     =           TRUE
    MP2 Hybrid          =          FALSE

   => Exchange Functionals <=

    0.0800   Slater exchange
    0.7200         Becke 88

   => Exact (HF) Exchange <=

    0.2000               HF 

   => Correlation Functionals <=

    0.1900   Vosko, Wilk & Nusair (VWN5_RPA)
    0.8100   Lee, Yang & Parr

   => LibXC Density Thresholds  <==

    XC_HYB_GGA_XC_B3LYP:  1.00E-15 

   => Molecular Quadrature <=

    Radial Scheme          =       TREUTLER
    Pruning Scheme         =           NONE
    Nuclear Scheme         =       TREUTLER

    Blocking Scheme        =         OCTREE
    BS radius alpha        =              1
    Pruning alpha          =              1
    Radial Points          =             75
    Spherical Points       =            302
    Total Points           =          43262
    Total Blocks           =            388
    Max Points             =            255
    Max Functions          =             28
    Weights Tolerance      =       1.00E-15

   => Loading Basis Set <=

    Name: (CC-PVDZ AUX)
    Role: JKFIT
    Keyword: DF_BASIS_SCF
    atoms 1 entry B          line    71 file /Users/joseantoniorodriguesromero/anaconda3/share/psi4/basis/cc-pvdz-jkfit.gbs 
    atoms 2 entry O          line   221 file /Users/joseantoniorodriguesromero/anaconda3/share/psi4/basis/cc-pvdz-jkfit.gbs 

   => Loading Basis Set <=

    Name: CC-PVDZ
    Role: ORBITAL
    Keyword: BASIS
    atoms 1 entry B          line   108 file /Users/joseantoniorodriguesromero/anaconda3/share/psi4/basis/cc-pvdz.gbs 
    atoms 2 entry O          line   198 file /Users/joseantoniorodriguesromero/anaconda3/share/psi4/basis/cc-pvdz.gbs 

  Reading orbitals from file /tmp/singlet_BO.default.72248.180.npy, no projection.

  ==> Integral Setup <==

  DFHelper Memory: AOs need 0.001 GiB; user supplied 0.332 GiB. 
  Using in-core AOs.

  ==> MemDFJK: Density-Fitted J/K Matrices <==

    J tasked:                   Yes
    K tasked:                   Yes
    wK tasked:                   No
    OpenMP threads:               1
    Memory [MiB]:               339
    Algorithm:                 Core
    Schwarz Cutoff:           1E-12
    Mask sparsity (%):       0.0000
    Fitting Condition:        1E-10

   => Auxiliary Basis Set <=

  Basis Set: (CC-PVDZ AUX)
    Blend: CC-PVDZ-JKFIT
    Number of shells: 48
    Number of basis functions: 140
    Number of Cartesian functions: 162
    Spherical Harmonics?: true
    Max angular momentum: 3

  Cached 100.0% of DFT collocation blocks in 0.034 [GiB].

  Minimum eigenvalue in the overlap matrix is 2.8494441095E-02.
  Reciprocal condition number of the overlap matrix is 9.4866809600E-03.
    Using symmetric orthogonalization.

  ==> Pre-Iterations <==

  SCF Guess: Orbitals guess was supplied from a previous computation.

   -------------------------------------------------------
    Irrep   Nso     Nmo     Nalpha   Nbeta   Ndocc  Nsocc
   -------------------------------------------------------
     A1        14      14       5       5       5       0
     A2         2       2       0       0       0       0
     B1         6       6       1       1       1       0
     B2         6       6       1       1       1       0
   -------------------------------------------------------
    Total      28      28       7       7       7       0
   -------------------------------------------------------

  ==> Iterations <==

                           Total Energy        Delta E     RMS |[F,P]|

   @DF-UKS iter   0:  -100.10376800422222   -1.00104e+02   1.70898e-04 
   @DF-UKS iter   1:  -100.10413751613024   -3.69512e-04   6.60981e-05 DIIS
   @DF-UKS iter   2:  -100.10413525190269    2.26423e-06   1.60769e-04 DIIS/ADIIS/DAMP=1%
   @DF-UKS iter   3:  -100.10407969646845    5.55554e-05   6.07564e-06 DIIS/DAMP=1%
   @DF-UKS iter   4:  -100.10413525028179   -5.55538e-05   2.25921e-06 DIIS/DAMP=1%
   @DF-UKS iter   5:  -100.10413744524770   -2.19497e-06   2.56527e-07 DIIS/DAMP=1%
   @DF-UKS iter   6:  -100.10413795138633   -5.06139e-07   2.28334e-08 DIIS/DAMP=1%
   @DF-UKS iter   7:  -100.10413805943912   -1.08053e-07   8.87734e-10 DIIS/DAMP=1%
   @DF-UKS iter   8:  -100.10413806625662   -6.81750e-09   2.04596e-10 DIIS/DAMP=1%
  Energy and wave function converged.


  ==> Post-Iterations <==

   Electrons on quadrature grid:
      Nalpha   =    6.9999999613 ; deviation = -3.870e-08
      Nbeta    =    6.9999999613 ; deviation = -3.870e-08
      Ntotal   =   13.9999999226 ; deviation = -7.741e-08 

   @Spin Contamination Metric:  -7.105427358E-15
   @S^2 Expected:                0.000000000E+00
   @S^2 Observed:               -7.105427358E-15
   @S   Expected:                0.000000000E+00
   @S   Observed:                0.000000000E+00

    Orbital Energies [Eh]
    ---------------------

    Alpha Occupied:                                                       

       1A1   -18.845946     2A1    -6.458714     3A1    -0.684917  
       4A1    -0.144636     1B1    -0.066053     1B2    -0.066053  
       5A1     0.040686  

    Alpha Virtual:                                                        

       2B1     0.287451     2B2     0.287451     6A1     0.387518  
       3B2     0.581090     3B1     0.581090     7A1     0.628868  
       8A1     0.892490     9A1     1.002582     1A2     1.002582  
      10A1     1.128957     4B2     1.170399     4B1     1.170399  
       5B1     1.275602     5B2     1.275602    11A1     1.683575  
      12A1     1.968982     2A2     2.921936    13A1     2.921939  
       6B1     3.205057     6B2     3.205057    14A1     3.633689  

    Beta Occupied:                                                        

       1A1   -18.845946     2A1    -6.458714     3A1    -0.684917  
       4A1    -0.144636     1B1    -0.066053     1B2    -0.066053  
       5A1     0.040686  

    Beta Virtual:                                                         

       2B1     0.287451     2B2     0.287451     6A1     0.387518  
       3B2     0.581090     3B1     0.581090     7A1     0.628868  
       8A1     0.892490     9A1     1.002582     1A2     1.002582  
      10A1     1.128957     4B2     1.170399     4B1     1.170399  
       5B1     1.275602     5B2     1.275602    11A1     1.683575  
      12A1     1.968982     2A2     2.921936    13A1     2.921939  
       6B1     3.205057     6B2     3.205057    14A1     3.633689  

    Final Occupation by Irrep:
             A1    A2    B1    B2 
    DOCC [     5,    0,    1,    1 ]
    SOCC [     0,    0,    0,    0 ]
    NA   [     5,    0,    1,    1 ]
    NB   [     5,    0,    1,    1 ]

  @DF-UKS Final Energy:  -100.10413806625662

   => Energetics <=

    Nuclear Repulsion Energy =             17.0378325063415161
    One-Electron Energy =                -174.3535882744436094
    Two-Electron Energy =                  67.6077310313013697
    DFT Exchange-Correlation Energy =     -10.3961133294559023
    Empirical Dispersion Energy =           0.0000000000000000
    VV10 Nonlocal Energy =                  0.0000000000000000
    Total Energy =                       -100.1041380662566240

  UHF NO Occupations:
  HONO-2 :    1 B1 2.0000000
  HONO-1 :    4 A1 2.0000000
  HONO-0 :    5 A1 2.0000000
  LUNO+0 :    6 A1 0.0000000
  LUNO+1 :    2 B1 0.0000000
  LUNO+2 :    2 B2 0.0000000
  LUNO+3 :    3 B2 0.0000000


Computation Completed


Properties will be evaluated at   0.000000,   0.000000,   0.000000 [a0]

Properties computed using the SCF density matrix


 Multipole Moments:

 ------------------------------------------------------------------------------------
     Multipole            Electronic (a.u.)      Nuclear  (a.u.)        Total (a.u.)
 ------------------------------------------------------------------------------------

 L = 1.  Multiply by 2.5417464519 to convert [e a0] to [Debye]
 Dipole X            :          0.0000000            0.0000000            0.0000000
 Dipole Y            :          0.0000000            0.0000000            0.0000000
 Dipole Z            :         -0.2958395           -0.7041936           -1.0000331
 Magnitude           :                                                    1.0000331

 ------------------------------------------------------------------------------------

*** tstop() called on Joses-MacBook-Pro-2.local at Thu Jul 17 09:50:09 2025
Module time:
	user time   =       2.73 seconds =       0.05 minutes
	system time =       2.66 seconds =       0.04 minutes
	total time  =          1 seconds =       0.02 minutes
Total time:
	user time   =      14.08 seconds =       0.23 minutes
	system time =      19.73 seconds =       0.33 minutes
	total time  =          3 seconds =       0.05 minutes

*** tstart() called on Joses-MacBook-Pro-2.local
*** at Thu Jul 17 09:50:09 2025


         ------------------------------------------------------------
                                   SCF GRAD                          
                          Rob Parrish, Justin Turney,                
                       Andy Simmonett, and Alex Sokolov              
         ------------------------------------------------------------

  ==> Geometry <==

    Molecular point group: c2v
    Full point group: C_inf_v

    Geometry (in Angstrom), charge = -1, multiplicity = 1:

       Center              X                  Y                   Z               Mass       
    ------------   -----------------  -----------------  -----------------  -----------------
         B            0.000000000000     0.000000000000     0.735863172725    11.009305360000
         O            0.000000000000     0.000000000000    -0.506494880679    15.994914619570

  Nuclear repulsion =   17.037832506341516

  ==> Basis Set <==

  Basis Set: CC-PVDZ
    Blend: CC-PVDZ
    Number of shells: 12
    Number of basis functions: 28
    Number of Cartesian functions: 30
    Spherical Harmonics?: true
    Max angular momentum: 2

  ==> DFJKGrad: Density-Fitted SCF Gradients <==

    Gradient:                    1
    J tasked:                  Yes
    K tasked:                  Yes
    wK tasked:                  No
    OpenMP threads:              1
    Integrals threads:           1
    Memory [MiB]:              375
    Schwarz Cutoff:          1E-12
    Fitting Condition:       1E-10

   => Auxiliary Basis Set <=

  Basis Set: (CC-PVDZ AUX)
    Blend: CC-PVDZ-JKFIT
    Number of shells: 48
    Number of basis functions: 140
    Number of Cartesian functions: 162
    Spherical Harmonics?: true
    Max angular momentum: 3

  ==> DFT Potential <==

   => LibXC <=

    Version 6.2.2
    S. Lehtola, C. Steigemann, M. J.T. Oliveira, and M. A.L. Marques.,  SoftwareX 7, 1–5 (2018) (10.1016/j.softx.2017.11.002)

   => Composite Functional: B3LYP <= 

    B3LYP Hyb-GGA Exchange-Correlation Functional

    P. J. Stephens, F. J. Devlin, C. F. Chabalowski, and M. J. Frisch.,  J. Phys. Chem. 98, 11623 (1994) (10.1021/j100096a001)

    Deriv               =              1
    GGA                 =           TRUE
    Meta                =          FALSE

    Exchange Hybrid     =           TRUE
    MP2 Hybrid          =          FALSE

   => Exchange Functionals <=

    0.0800   Slater exchange
    0.7200         Becke 88

   => Exact (HF) Exchange <=

    0.2000               HF 

   => Correlation Functionals <=

    0.1900   Vosko, Wilk & Nusair (VWN5_RPA)
    0.8100   Lee, Yang & Parr

   => LibXC Density Thresholds  <==

    XC_HYB_GGA_XC_B3LYP:  1.00E-15 

   => Molecular Quadrature <=

    Radial Scheme          =       TREUTLER
    Pruning Scheme         =           NONE
    Nuclear Scheme         =       TREUTLER

    Blocking Scheme        =         OCTREE
    BS radius alpha        =              1
    Pruning alpha          =              1
    Radial Points          =             75
    Spherical Points       =            302
    Total Points           =          43262
    Total Blocks           =            388
    Max Points             =            255
    Max Functions          =             28
    Weights Tolerance      =       1.00E-15


  -Total Gradient:
     Atom            X                  Y                   Z
    ------   -----------------  -----------------  -----------------
       1        0.000000000000     0.000000000000    -0.000186423498
       2        0.000000000000     0.000000000000     0.000202858548


*** tstop() called on Joses-MacBook-Pro-2.local at Thu Jul 17 09:50:09 2025
Module time:
	user time   =       0.44 seconds =       0.01 minutes
	system time =       1.07 seconds =       0.02 minutes
	total time  =          0 seconds =       0.00 minutes
Total time:
	user time   =      14.56 seconds =       0.24 minutes
	system time =      20.80 seconds =       0.35 minutes
	total time  =          3 seconds =       0.05 minutes

    			-----------------------------------------

    			 OPTKING 3.0: for geometry optimizations 

    			     By R.A. King, Bethel University     

    			        with contributions from          

    			    A.V. Copan, J. Cayton, A. Heide      

    			-----------------------------------------

    
	                            ===> Fragment 1 <== 

	 Z (Atomic Numbers)          Masses                          Geom                  
	       5.000000            11.009305          0.00000000  0.00000000  1.39057986   
	       8.000000            15.994915          0.00000000  0.00000000 -0.95713661   

	 - Coordinate -           - BOHR/RAD -       - ANG/DEG -
	 R(1,2)           =         2.347716           1.242358


	        --- Internal Coordinate Step in ANG or DEG, aJ/ANG or AJ/DEG ---
	-------------------------------------------------------------------------------
	           Coordinate      Previous         Force          Change          New 
	           ----------      --------        ------          ------        ------
	               R(1,2)       1.24236        0.00160        0.00012       1.24248
	-------------------------------------------------------------------------------

	                                 ==> Convergence Check <==                                  
    
	Measures of convergence in internal coordinates in au.
    
	Criteria marked as inactive (o), active & met (*), and active & unmet ( ).

	----------------------------------------------------------------------------------------------
	   Step    Total Energy     Delta E     Max Force     RMS Force      Max Disp      RMS Disp   
	----------------------------------------------------------------------------------------------
	  Convergence Criteria     1.00e-06 *    3.00e-04 *             o    1.20e-03 *             o
	----------------------------------------------------------------------------------------------
	     4    -100.10413807   -1.52e-06      1.95e-04 *    1.95e-04 o    2.32e-04 *    2.32e-04 o  ~
	----------------------------------------------------------------------------------------------

Next Geometry in Ang 
	Fragment 1 (Ang)

	    B   0.0000000000   0.0000000000   0.7359244281
	    O   0.0000000000   0.0000000000  -0.5065561361


    Final optimized geometry and variables:
    Molecular point group: c2v
    Full point group: C_inf_v

    Geometry (in Angstrom), charge = -1, multiplicity = 1:

    B            0.000000000000     0.000000000000     0.735863172725
    O            0.000000000000     0.000000000000    -0.506494880679


    Psi4 stopped on: Thursday, 17 July 2025 09:50AM
    Psi4 wall time for execution: 0:00:04.01

*** Psi4 exiting successfully. Buy a developer a beer!
