
    -----------------------------------------------------------------------
          Psi4: An Open-Source Ab Initio Electronic Structure Package
                               Psi4 1.9.1 release

                         Git: Rev {} zzzzzzz 


    D. G. A. Smith, L. A. Burns, A. C. Simmonett, R. M. Parrish,
    M. C. Schieber, R. Galvelis, P. Kraus, H. Kruse, R. Di Remigio,
    A. Alenaizan, A. M. James, S. Lehtola, J. P. Misiewicz, M. Scheurer,
    R. A. Shaw, J. B. Schriber, Y. Xie, Z. L. Glick, D. A. Sirianni,
    J. S. O'Brien, J. M. Waldrop, A. Kumar, E. G. Hohenstein,
    B. P. Pritchard, B. R. Brooks, H. F. Schaefer III, A. Yu. Sokolov,
    K. Patkowski, A. E. DePrince III, U. Bozkaya, R. A. King,
    F. A. Evangelista, J. M. Turney, T. D. Crawford, C. D. Sherrill,
    J. Chem. Phys. 152(18) 184108 (2020). https://doi.org/10.1063/5.0006002

                            Additional Code Authors
    E. T. Seidl, C. L. Janssen, E. F. Valeev, M. L. Leininger,
    J. F. Gonthier, R. M. Richard, H. R. McAlexander, M. Saitow, X. Wang,
    P. Verma, M. H. Lechner, A. Jiang, S. Behnle, A. G. Heide,
    M. F. Herbst, and D. L. Poole

             Previous Authors, Complete List of Code Contributors,
                       and Citations for Specific Modules
    https://github.com/psi4/psi4/blob/master/codemeta.json
    https://github.com/psi4/psi4/graphs/contributors
    http://psicode.org/psi4manual/master/introduction.html#citing-psifour

    -----------------------------------------------------------------------


    Psi4 started on: Thursday, 17 July 2025 09:58AM

    Process ID: 72426
    Host:       Joses-MacBook-Pro-2.local
    PSIDATADIR: /Users/joseantoniorodriguesromero/anaconda3/share/psi4
    Memory:     500.0 MiB
    Threads:    1
    
  ==> Input File <==

--------------------------------------------------------------------------
molecule { 
-1 1
C   0.00000        0.60000        0.00000
N   0.00000       -0.60000        0.00000
}

set { 
basis              cc-pvdz
reference          uks
maxiter            500
geom_maxiter       500
DAMPING_PERCENTAGE 1
guess              SAP
}

optimize('b3lyp')
--------------------------------------------------------------------------

Scratch directory: /tmp/
gradient() will perform analytic gradient computation.
   => Libint2 <=

    Primary   basis highest AM E, G, H:  6, 6, 3
    Auxiliary basis highest AM E, G, H:  7, 7, 4
    Onebody   basis highest AM E, G, H:  -, -, -
    Solid Harmonics ordering:            Gaussian

*** tstart() called on Joses-MacBook-Pro-2.local
*** at Thu Jul 17 09:58:16 2025

   => Loading Basis Set <=

    Name: CC-PVDZ
    Role: ORBITAL
    Keyword: BASIS
    atoms 1 entry C          line   138 file /Users/joseantoniorodriguesromero/anaconda3/share/psi4/basis/cc-pvdz.gbs 
    atoms 2 entry N          line   168 file /Users/joseantoniorodriguesromero/anaconda3/share/psi4/basis/cc-pvdz.gbs 


         ---------------------------------------------------------
                                   SCF
               by Justin Turney, Rob Parrish, Andy Simmonett
                          and Daniel G. A. Smith
                              UKS Reference
                        1 Threads,    500 MiB Core
         ---------------------------------------------------------

  ==> Geometry <==

    Molecular point group: c2v
    Full point group: C_inf_v

    Geometry (in Angstrom), charge = -1, multiplicity = 1:

       Center              X                  Y                   Z               Mass       
    ------------   -----------------  -----------------  -----------------  -----------------
         C            0.000000000000     0.000000000000     0.646219320164    12.000000000000
         N            0.000000000000     0.000000000000    -0.553780679836    14.003074004430

  Running in c2v symmetry.

  Rotational constants: A = ************  B =      1.81157  C =      1.81157 [cm^-1]
  Rotational constants: A = ************  B =  54309.37053  C =  54309.37053 [MHz]
  Nuclear repulsion =   18.521202373450002

  Charge       = -1
  Multiplicity = 1
  Electrons    = 14
  Nalpha       = 7
  Nbeta        = 7

  ==> Algorithm <==

  SCF Algorithm Type is DF.
  DIIS enabled.
  MOM disabled.
  Fractional occupation disabled.
  Guess Type is SAP.
  Energy threshold   = 1.00e-08
  Density threshold  = 1.00e-08
  Integral threshold = 1.00e-12

  ==> Primary Basis <==

  Basis Set: CC-PVDZ
    Blend: CC-PVDZ
    Number of shells: 12
    Number of basis functions: 28
    Number of Cartesian functions: 30
    Spherical Harmonics?: true
    Max angular momentum: 2

  ==> DFT Potential <==

   => LibXC <=

    Version 6.2.2
    S. Lehtola, C. Steigemann, M. J.T. Oliveira, and M. A.L. Marques.,  SoftwareX 7, 1–5 (2018) (10.1016/j.softx.2017.11.002)

   => Composite Functional: B3LYP <= 

    B3LYP Hyb-GGA Exchange-Correlation Functional

    P. J. Stephens, F. J. Devlin, C. F. Chabalowski, and M. J. Frisch.,  J. Phys. Chem. 98, 11623 (1994) (10.1021/j100096a001)

    Deriv               =              1
    GGA                 =           TRUE
    Meta                =          FALSE

    Exchange Hybrid     =           TRUE
    MP2 Hybrid          =          FALSE

   => Exchange Functionals <=

    0.0800   Slater exchange
    0.7200         Becke 88

   => Exact (HF) Exchange <=

    0.2000               HF 

   => Correlation Functionals <=

    0.1900   Vosko, Wilk & Nusair (VWN5_RPA)
    0.8100   Lee, Yang & Parr

   => LibXC Density Thresholds  <==

    XC_HYB_GGA_XC_B3LYP:  1.00E-15 

   => Molecular Quadrature <=

    Radial Scheme          =       TREUTLER
    Pruning Scheme         =           NONE
    Nuclear Scheme         =       TREUTLER

    Blocking Scheme        =         OCTREE
    BS radius alpha        =              1
    Pruning alpha          =              1
    Radial Points          =             75
    Spherical Points       =            302
    Total Points           =          42672
    Total Blocks           =            384
    Max Points             =            256
    Max Functions          =             28
    Weights Tolerance      =       1.00E-15

   => Loading Basis Set <=

    Name: (CC-PVDZ AUX)
    Role: JKFIT
    Keyword: DF_BASIS_SCF
    atoms 1 entry C          line   121 file /Users/joseantoniorodriguesromero/anaconda3/share/psi4/basis/cc-pvdz-jkfit.gbs 
    atoms 2 entry N          line   171 file /Users/joseantoniorodriguesromero/anaconda3/share/psi4/basis/cc-pvdz-jkfit.gbs 

  ==> Integral Setup <==

  DFHelper Memory: AOs need 0.001 GiB; user supplied 0.332 GiB. 
  Using in-core AOs.

  ==> MemDFJK: Density-Fitted J/K Matrices <==

    J tasked:                   Yes
    K tasked:                   Yes
    wK tasked:                   No
    OpenMP threads:               1
    Memory [MiB]:               339
    Algorithm:                 Core
    Schwarz Cutoff:           1E-12
    Mask sparsity (%):       0.0000
    Fitting Condition:        1E-10

   => Auxiliary Basis Set <=

  Basis Set: (CC-PVDZ AUX)
    Blend: CC-PVDZ-JKFIT
    Number of shells: 48
    Number of basis functions: 140
    Number of Cartesian functions: 162
    Spherical Harmonics?: true
    Max angular momentum: 3

  Cached 100.0% of DFT collocation blocks in 0.034 [GiB].

  Minimum eigenvalue in the overlap matrix is 1.1329986613E-02.
  Reciprocal condition number of the overlap matrix is 3.6584227228E-03.
    Using symmetric orthogonalization.

  ==> Pre-Iterations <==

  SCF Guess: Superposition of Atomic Potentials (doi:10.1021/acs.jctc.8b01089).

  ==> SAP guess <==

   => Molecular Quadrature <=

    Radial Scheme          =       TREUTLER
    Pruning Scheme         =           NONE
    Nuclear Scheme         =       TREUTLER

    Blocking Scheme        =         OCTREE
    BS radius alpha        =              1
    Pruning alpha          =              1
    Radial Points          =             75
    Spherical Points       =            302
    Total Points           =          42672
    Total Blocks           =            384
    Max Points             =            256
    Max Functions          =             28
    Weights Tolerance      =       1.00E-15

   -------------------------------------------------------
    Irrep   Nso     Nmo     Nalpha   Nbeta   Ndocc  Nsocc
   -------------------------------------------------------
     A1        14      14       5       5       5       0
     A2         2       2       0       0       0       0
     B1         6       6       1       1       1       0
     B2         6       6       1       1       1       0
   -------------------------------------------------------
    Total      28      28       7       7       7       0
   -------------------------------------------------------

  ==> Iterations <==

                           Total Energy        Delta E     RMS |[F,P]|

   @DF-UKS iter   1:   -92.52545672399380   -9.25255e+01   4.53661e-02 DIIS/ADIIS
   @DF-UKS iter   2:   -92.31288154951837    2.12575e-01   6.00433e-02 DIIS/ADIIS/DAMP=1%
   @DF-UKS iter   3:   -92.75403263726653   -4.41151e-01   2.00021e-02 DIIS/ADIIS/DAMP=1%
   @DF-UKS iter   4:   -92.82496547896517   -7.09328e-02   9.19085e-03 DIIS/ADIIS/DAMP=1%
   @DF-UKS iter   5:   -92.83590036645964   -1.09349e-02   2.10111e-04 DIIS/ADIIS/DAMP=1%
   @DF-UKS iter   6:   -92.83608607173169   -1.85705e-04   1.14418e-04 DIIS/ADIIS/DAMP=1%
   @DF-UKS iter   7:   -92.83612791922295   -4.18475e-05   5.84203e-06 DIIS/DAMP=1%
   @DF-UKS iter   8:   -92.83613640043866   -8.48122e-06   4.95181e-07 DIIS/DAMP=1%
   @DF-UKS iter   9:   -92.83613778348284   -1.38304e-06   2.28639e-08 DIIS/DAMP=1%
   @DF-UKS iter  10:   -92.83613789950265   -1.16020e-07   1.09184e-08 DIIS/DAMP=1%
   @DF-UKS iter  11:   -92.83613790879943   -9.29678e-09   2.12002e-10 DIIS/DAMP=1%
  Energy and wave function converged.


  ==> Post-Iterations <==

   Electrons on quadrature grid:
      Nalpha   =    6.9999999299 ; deviation = -7.014e-08
      Nbeta    =    6.9999999299 ; deviation = -7.014e-08
      Ntotal   =   13.9999998597 ; deviation = -1.403e-07 

   @Spin Contamination Metric:   3.552713679E-15
   @S^2 Expected:                0.000000000E+00
   @S^2 Observed:                3.552713679E-15
   @S   Expected:                0.000000000E+00
   @S   Observed:                0.000000000E+00

    Orbital Energies [Eh]
    ---------------------

    Alpha Occupied:                                                       

       1A1   -14.007616     2A1    -9.878494     3A1    -0.564211  
       4A1    -0.114488     1B1    -0.020394     1B2    -0.020394  
       5A1     0.011823  

    Alpha Virtual:                                                        

       2B1     0.340061     2B2     0.340061     6A1     0.538182  
       3B1     0.781669     3B2     0.781669     7A1     0.859632  
       8A1     0.960147     4B2     1.079932     4B1     1.079932  
       9A1     1.097060    10A1     1.452740     1A2     1.452740  
       5B2     1.599799     5B1     1.599799    11A1     1.637341  
      12A1     2.183741     2A2     2.183741    13A1     2.268383  
       6B2     2.677857     6B1     2.677857    14A1     3.038280  

    Beta Occupied:                                                        

       1A1   -14.007616     2A1    -9.878494     3A1    -0.564211  
       4A1    -0.114488     1B1    -0.020394     1B2    -0.020394  
       5A1     0.011823  

    Beta Virtual:                                                         

       2B1     0.340061     2B2     0.340061     6A1     0.538182  
       3B1     0.781669     3B2     0.781669     7A1     0.859632  
       8A1     0.960147     4B2     1.079932     4B1     1.079932  
       9A1     1.097060    10A1     1.452740     1A2     1.452740  
       5B2     1.599799     5B1     1.599799    11A1     1.637341  
      12A1     2.183741     2A2     2.183741    13A1     2.268383  
       6B2     2.677857     6B1     2.677857    14A1     3.038280  

    Final Occupation by Irrep:
             A1    A2    B1    B2 
    DOCC [     5,    0,    1,    1 ]
    SOCC [     0,    0,    0,    0 ]
    NA   [     5,    0,    1,    1 ]
    NB   [     5,    0,    1,    1 ]

  @DF-UKS Final Energy:   -92.83613790879943

   => Energetics <=

    Nuclear Repulsion Energy =             18.5212023734500022
    One-Electron Energy =                -166.2569499467340677
    Two-Electron Energy =                  64.9999331106140801
    DFT Exchange-Correlation Energy =     -10.1003234461294404
    Empirical Dispersion Energy =           0.0000000000000000
    VV10 Nonlocal Energy =                  0.0000000000000000
    Total Energy =                        -92.8361379087994294

  UHF NO Occupations:
  HONO-2 :    1 B1 2.0000000
  HONO-1 :    4 A1 2.0000000
  HONO-0 :    5 A1 2.0000000
  LUNO+0 :    6 A1 0.0000000
  LUNO+1 :    7 A1 0.0000000
  LUNO+2 :    2 B1 0.0000000
  LUNO+3 :    8 A1 0.0000000


Computation Completed


Properties will be evaluated at   0.000000,   0.000000,   0.000000 [a0]

Properties computed using the SCF density matrix


 Multipole Moments:

 ------------------------------------------------------------------------------------
     Multipole            Electronic (a.u.)      Nuclear  (a.u.)        Total (a.u.)
 ------------------------------------------------------------------------------------

 L = 1.  Multiply by 2.5417464519 to convert [e a0] to [Debye]
 Dipole X            :          0.0000000            0.0000000            0.0000000
 Dipole Y            :          0.0000000            0.0000000            0.0000000
 Dipole Z            :         -0.3138887            0.0016085           -0.3122803
 Magnitude           :                                                    0.3122803

 ------------------------------------------------------------------------------------

*** tstop() called on Joses-MacBook-Pro-2.local at Thu Jul 17 09:58:17 2025
Module time:
	user time   =       3.93 seconds =       0.07 minutes
	system time =       4.68 seconds =       0.08 minutes
	total time  =          1 seconds =       0.02 minutes
Total time:
	user time   =       3.93 seconds =       0.07 minutes
	system time =       4.68 seconds =       0.08 minutes
	total time  =          1 seconds =       0.02 minutes

*** tstart() called on Joses-MacBook-Pro-2.local
*** at Thu Jul 17 09:58:17 2025


         ------------------------------------------------------------
                                   SCF GRAD                          
                          Rob Parrish, Justin Turney,                
                       Andy Simmonett, and Alex Sokolov              
         ------------------------------------------------------------

  ==> Geometry <==

    Molecular point group: c2v
    Full point group: C_inf_v

    Geometry (in Angstrom), charge = -1, multiplicity = 1:

       Center              X                  Y                   Z               Mass       
    ------------   -----------------  -----------------  -----------------  -----------------
         C            0.000000000000     0.000000000000     0.646219320164    12.000000000000
         N            0.000000000000     0.000000000000    -0.553780679836    14.003074004430

  Nuclear repulsion =   18.521202373450002

  ==> Basis Set <==

  Basis Set: CC-PVDZ
    Blend: CC-PVDZ
    Number of shells: 12
    Number of basis functions: 28
    Number of Cartesian functions: 30
    Spherical Harmonics?: true
    Max angular momentum: 2

  ==> DFJKGrad: Density-Fitted SCF Gradients <==

    Gradient:                    1
    J tasked:                  Yes
    K tasked:                  Yes
    wK tasked:                  No
    OpenMP threads:              1
    Integrals threads:           1
    Memory [MiB]:              375
    Schwarz Cutoff:          1E-12
    Fitting Condition:       1E-10

   => Auxiliary Basis Set <=

  Basis Set: (CC-PVDZ AUX)
    Blend: CC-PVDZ-JKFIT
    Number of shells: 48
    Number of basis functions: 140
    Number of Cartesian functions: 162
    Spherical Harmonics?: true
    Max angular momentum: 3

  ==> DFT Potential <==

   => LibXC <=

    Version 6.2.2
    S. Lehtola, C. Steigemann, M. J.T. Oliveira, and M. A.L. Marques.,  SoftwareX 7, 1–5 (2018) (10.1016/j.softx.2017.11.002)

   => Composite Functional: B3LYP <= 

    B3LYP Hyb-GGA Exchange-Correlation Functional

    P. J. Stephens, F. J. Devlin, C. F. Chabalowski, and M. J. Frisch.,  J. Phys. Chem. 98, 11623 (1994) (10.1021/j100096a001)

    Deriv               =              1
    GGA                 =           TRUE
    Meta                =          FALSE

    Exchange Hybrid     =           TRUE
    MP2 Hybrid          =          FALSE

   => Exchange Functionals <=

    0.0800   Slater exchange
    0.7200         Becke 88

   => Exact (HF) Exchange <=

    0.2000               HF 

   => Correlation Functionals <=

    0.1900   Vosko, Wilk & Nusair (VWN5_RPA)
    0.8100   Lee, Yang & Parr

   => LibXC Density Thresholds  <==

    XC_HYB_GGA_XC_B3LYP:  1.00E-15 

   => Molecular Quadrature <=

    Radial Scheme          =       TREUTLER
    Pruning Scheme         =           NONE
    Nuclear Scheme         =       TREUTLER

    Blocking Scheme        =         OCTREE
    BS radius alpha        =              1
    Pruning alpha          =              1
    Radial Points          =             75
    Spherical Points       =            302
    Total Points           =          42672
    Total Blocks           =            384
    Max Points             =            256
    Max Functions          =             28
    Weights Tolerance      =       1.00E-15


  -Total Gradient:
     Atom            X                  Y                   Z
    ------   -----------------  -----------------  -----------------
       1        0.000000000000    -0.000000000000     0.031181273564
       2        0.000000000000     0.000000000000    -0.031177945422


*** tstop() called on Joses-MacBook-Pro-2.local at Thu Jul 17 09:58:17 2025
Module time:
	user time   =       0.82 seconds =       0.01 minutes
	system time =       0.94 seconds =       0.02 minutes
	total time  =          0 seconds =       0.00 minutes
Total time:
	user time   =       4.75 seconds =       0.08 minutes
	system time =       5.63 seconds =       0.09 minutes
	total time  =          1 seconds =       0.02 minutes

    			-----------------------------------------

    			 OPTKING 3.0: for geometry optimizations 

    			     By R.A. King, Bethel University     

    			        with contributions from          

    			    A.V. Copan, J. Cayton, A. Heide      

    			-----------------------------------------

    
	                            ===> Fragment 1 <== 

	 Z (Atomic Numbers)          Masses                          Geom                  
	       6.000000            12.000000          0.00000000  0.00000000  1.22117753   
	       7.000000            14.003074          0.00000000  0.00000000 -1.04649382   

	 - Coordinate -           - BOHR/RAD -       - ANG/DEG -
	 R(1,2)           =         2.267671           1.200000


	        --- Internal Coordinate Step in ANG or DEG, aJ/ANG or AJ/DEG ---
	-------------------------------------------------------------------------------
	           Coordinate      Previous         Force          Change          New 
	           ----------      --------        ------          ------        ------
	               R(1,2)       1.20000       -0.25688       -0.01573       1.18427
	-------------------------------------------------------------------------------

	                                 ==> Convergence Check <==                                  
    
	Measures of convergence in internal coordinates in au.
    
	Criteria marked as inactive (o), active & met (*), and active & unmet ( ).

	----------------------------------------------------------------------------------------------
	   Step    Total Energy     Delta E     Max Force     RMS Force      Max Disp      RMS Disp   
	----------------------------------------------------------------------------------------------
	  Convergence Criteria     1.00e-06 *    3.00e-04 *             o    1.20e-03 *             o
	----------------------------------------------------------------------------------------------
	     1     -92.83613791   -9.28e+01      3.12e-02      3.12e-02 o    2.97e-02      2.97e-02 o  ~
	----------------------------------------------------------------------------------------------

Next Geometry in Ang 
	Fragment 1 (Ang)

	    C   0.0000000000   0.0000000000   0.6383560861
	    N   0.0000000000   0.0000000000  -0.5459174457


    Structure for next step:
    Molecular point group: c2v
    Full point group: C_inf_v

    Geometry (in Angstrom), charge = -1, multiplicity = 1:

    C            0.000000000000     0.000000000000     0.637750363838
    N            0.000000000000     0.000000000000    -0.546523167958


Scratch directory: /tmp/
gradient() will perform analytic gradient computation.
   => Libint2 <=

    Primary   basis highest AM E, G, H:  6, 6, 3
    Auxiliary basis highest AM E, G, H:  7, 7, 4
    Onebody   basis highest AM E, G, H:  -, -, -
    Solid Harmonics ordering:            Gaussian

*** tstart() called on Joses-MacBook-Pro-2.local
*** at Thu Jul 17 09:58:17 2025

   => Loading Basis Set <=

    Name: CC-PVDZ
    Role: ORBITAL
    Keyword: BASIS
    atoms 1 entry C          line   138 file /Users/joseantoniorodriguesromero/anaconda3/share/psi4/basis/cc-pvdz.gbs 
    atoms 2 entry N          line   168 file /Users/joseantoniorodriguesromero/anaconda3/share/psi4/basis/cc-pvdz.gbs 


         ---------------------------------------------------------
                                   SCF
               by Justin Turney, Rob Parrish, Andy Simmonett
                          and Daniel G. A. Smith
                              UKS Reference
                        1 Threads,    500 MiB Core
         ---------------------------------------------------------

  ==> Geometry <==

    Molecular point group: c2v
    Full point group: C_inf_v

    Geometry (in Angstrom), charge = -1, multiplicity = 1:

       Center              X                  Y                   Z               Mass       
    ------------   -----------------  -----------------  -----------------  -----------------
         C            0.000000000000     0.000000000000     0.637750363838    12.000000000000
         N            0.000000000000     0.000000000000    -0.546523167958    14.003074004430

  Running in c2v symmetry.

  Rotational constants: A = ************  B =      1.86000  C =      1.86000 [cm^-1]
  Rotational constants: A = ************  B =  55761.34173  C =  55761.34173 [MHz]
  Nuclear repulsion =   18.767153239018576

  Charge       = -1
  Multiplicity = 1
  Electrons    = 14
  Nalpha       = 7
  Nbeta        = 7

  ==> Algorithm <==

  SCF Algorithm Type is DF.
  DIIS enabled.
  MOM disabled.
  Fractional occupation disabled.
  Guess Type is READ.
  Energy threshold   = 1.00e-08
  Density threshold  = 1.00e-08
  Integral threshold = 1.00e-12

  ==> Primary Basis <==

  Basis Set: CC-PVDZ
    Blend: CC-PVDZ
    Number of shells: 12
    Number of basis functions: 28
    Number of Cartesian functions: 30
    Spherical Harmonics?: true
    Max angular momentum: 2

  ==> DFT Potential <==

   => LibXC <=

    Version 6.2.2
    S. Lehtola, C. Steigemann, M. J.T. Oliveira, and M. A.L. Marques.,  SoftwareX 7, 1–5 (2018) (10.1016/j.softx.2017.11.002)

   => Composite Functional: B3LYP <= 

    B3LYP Hyb-GGA Exchange-Correlation Functional

    P. J. Stephens, F. J. Devlin, C. F. Chabalowski, and M. J. Frisch.,  J. Phys. Chem. 98, 11623 (1994) (10.1021/j100096a001)

    Deriv               =              1
    GGA                 =           TRUE
    Meta                =          FALSE

    Exchange Hybrid     =           TRUE
    MP2 Hybrid          =          FALSE

   => Exchange Functionals <=

    0.0800   Slater exchange
    0.7200         Becke 88

   => Exact (HF) Exchange <=

    0.2000               HF 

   => Correlation Functionals <=

    0.1900   Vosko, Wilk & Nusair (VWN5_RPA)
    0.8100   Lee, Yang & Parr

   => LibXC Density Thresholds  <==

    XC_HYB_GGA_XC_B3LYP:  1.00E-15 

   => Molecular Quadrature <=

    Radial Scheme          =       TREUTLER
    Pruning Scheme         =           NONE
    Nuclear Scheme         =       TREUTLER

    Blocking Scheme        =         OCTREE
    BS radius alpha        =              1
    Pruning alpha          =              1
    Radial Points          =             75
    Spherical Points       =            302
    Total Points           =          42672
    Total Blocks           =            386
    Max Points             =            256
    Max Functions          =             28
    Weights Tolerance      =       1.00E-15

   => Loading Basis Set <=

    Name: (CC-PVDZ AUX)
    Role: JKFIT
    Keyword: DF_BASIS_SCF
    atoms 1 entry C          line   121 file /Users/joseantoniorodriguesromero/anaconda3/share/psi4/basis/cc-pvdz-jkfit.gbs 
    atoms 2 entry N          line   171 file /Users/joseantoniorodriguesromero/anaconda3/share/psi4/basis/cc-pvdz-jkfit.gbs 

   => Loading Basis Set <=

    Name: CC-PVDZ
    Role: ORBITAL
    Keyword: BASIS
    atoms 1 entry C          line   138 file /Users/joseantoniorodriguesromero/anaconda3/share/psi4/basis/cc-pvdz.gbs 
    atoms 2 entry N          line   168 file /Users/joseantoniorodriguesromero/anaconda3/share/psi4/basis/cc-pvdz.gbs 

  Reading orbitals from file /tmp/singlet_CN.default.72426.180.npy, no projection.

  ==> Integral Setup <==

  DFHelper Memory: AOs need 0.001 GiB; user supplied 0.332 GiB. 
  Using in-core AOs.

  ==> MemDFJK: Density-Fitted J/K Matrices <==

    J tasked:                   Yes
    K tasked:                   Yes
    wK tasked:                   No
    OpenMP threads:               1
    Memory [MiB]:               339
    Algorithm:                 Core
    Schwarz Cutoff:           1E-12
    Mask sparsity (%):       0.0000
    Fitting Condition:        1E-10

   => Auxiliary Basis Set <=

  Basis Set: (CC-PVDZ AUX)
    Blend: CC-PVDZ-JKFIT
    Number of shells: 48
    Number of basis functions: 140
    Number of Cartesian functions: 162
    Spherical Harmonics?: true
    Max angular momentum: 3

  Cached 100.0% of DFT collocation blocks in 0.034 [GiB].

  Minimum eigenvalue in the overlap matrix is 1.0990671399E-02.
  Reciprocal condition number of the overlap matrix is 3.5384405499E-03.
    Using symmetric orthogonalization.

  ==> Pre-Iterations <==

  SCF Guess: Orbitals guess was supplied from a previous computation.

   -------------------------------------------------------
    Irrep   Nso     Nmo     Nalpha   Nbeta   Ndocc  Nsocc
   -------------------------------------------------------
     A1        14      14       5       5       5       0
     A2         2       2       0       0       0       0
     B1         6       6       1       1       1       0
     B2         6       6       1       1       1       0
   -------------------------------------------------------
    Total      28      28       7       7       7       0
   -------------------------------------------------------

  ==> Iterations <==

                           Total Energy        Delta E     RMS |[F,P]|

   @DF-UKS iter   0:   -92.84302872595048   -9.28430e+01   3.33993e-03 
   @DF-UKS iter   1:   -92.83642798208653    6.60074e-03   1.14347e-03 DIIS/ADIIS
   @DF-UKS iter   2:   -92.83578253236396    6.45450e-04   2.60659e-03 DIIS/ADIIS/DAMP=1%
   @DF-UKS iter   3:   -92.83711981120395   -1.33728e-03   2.46919e-04 DIIS/ADIIS/DAMP=1%
   @DF-UKS iter   4:   -92.83667536818976    4.44443e-04   4.24970e-05 DIIS/DAMP=1%
   @DF-UKS iter   5:   -92.83660912080806    6.62474e-05   2.46022e-06 DIIS/DAMP=1%
   @DF-UKS iter   6:   -92.83660713464072    1.98617e-06   2.54096e-07 DIIS/DAMP=1%
   @DF-UKS iter   7:   -92.83660582859881    1.30604e-06   9.62970e-09 DIIS/DAMP=1%
   @DF-UKS iter   8:   -92.83660583325664   -4.65784e-09   4.16664e-09 DIIS/DAMP=1%
  Energy and wave function converged.


  ==> Post-Iterations <==

   Electrons on quadrature grid:
      Nalpha   =    6.9999999180 ; deviation = -8.204e-08
      Nbeta    =    6.9999999180 ; deviation = -8.204e-08
      Ntotal   =   13.9999998359 ; deviation = -1.641e-07 

   @Spin Contamination Metric:  -2.042810365E-14
   @S^2 Expected:                0.000000000E+00
   @S^2 Observed:               -2.042810365E-14
   @S   Expected:                0.000000000E+00
   @S   Observed:                0.000000000E+00

    Orbital Energies [Eh]
    ---------------------

    Alpha Occupied:                                                       

       1A1   -14.003899     2A1    -9.873452     3A1    -0.569404  
       4A1    -0.111437     1B1    -0.022895     1B2    -0.022895  
       5A1     0.012575  

    Alpha Virtual:                                                        

       2B1     0.345739     2B2     0.345739     6A1     0.538693  
       3B2     0.781609     3B1     0.781609     7A1     0.859630  
       8A1     0.961787     4B2     1.081100     4B1     1.081100  
       9A1     1.118877    10A1     1.452330     1A2     1.452330  
       5B2     1.610728     5B1     1.610728    11A1     1.642133  
      12A1     2.189499     2A2     2.189499    13A1     2.294400  
       6B2     2.691789     6B1     2.691789    14A1     3.061173  

    Beta Occupied:                                                        

       1A1   -14.003899     2A1    -9.873452     3A1    -0.569404  
       4A1    -0.111437     1B1    -0.022895     1B2    -0.022895  
       5A1     0.012575  

    Beta Virtual:                                                         

       2B1     0.345739     2B2     0.345739     6A1     0.538693  
       3B2     0.781609     3B1     0.781609     7A1     0.859630  
       8A1     0.961787     4B2     1.081100     4B1     1.081100  
       9A1     1.118877    10A1     1.452330     1A2     1.452330  
       5B2     1.610728     5B1     1.610728    11A1     1.642133  
      12A1     2.189499     2A2     2.189499    13A1     2.294400  
       6B2     2.691789     6B1     2.691789    14A1     3.061173  

    Final Occupation by Irrep:
             A1    A2    B1    B2 
    DOCC [     5,    0,    1,    1 ]
    SOCC [     0,    0,    0,    0 ]
    NA   [     5,    0,    1,    1 ]
    NB   [     5,    0,    1,    1 ]

  @DF-UKS Final Energy:   -92.83660583325664

   => Energetics <=

    Nuclear Repulsion Energy =             18.7671532390185760
    One-Electron Energy =                -166.7462029741169545
    Two-Electron Energy =                  65.2548378292779176
    DFT Exchange-Correlation Energy =     -10.1123939274361696
    Empirical Dispersion Energy =           0.0000000000000000
    VV10 Nonlocal Energy =                  0.0000000000000000
    Total Energy =                        -92.8366058332566411

  UHF NO Occupations:
  HONO-2 :    1 B1 2.0000000
  HONO-1 :    5 A1 2.0000000
  HONO-0 :    1 B2 2.0000000
  LUNO+0 :    2 B2 0.0000000
  LUNO+1 :    6 A1 0.0000000
  LUNO+2 :    2 B1 0.0000000
  LUNO+3 :    7 A1 0.0000000


Computation Completed


Properties will be evaluated at   0.000000,   0.000000,   0.000000 [a0]

Properties computed using the SCF density matrix


 Multipole Moments:

 ------------------------------------------------------------------------------------
     Multipole            Electronic (a.u.)      Nuclear  (a.u.)        Total (a.u.)
 ------------------------------------------------------------------------------------

 L = 1.  Multiply by 2.5417464519 to convert [e a0] to [Debye]
 Dipole X            :          0.0000000            0.0000000            0.0000000
 Dipole Y            :          0.0000000            0.0000000            0.0000000
 Dipole Z            :         -0.3199498            0.0015874           -0.3183624
 Magnitude           :                                                    0.3183624

 ------------------------------------------------------------------------------------

*** tstop() called on Joses-MacBook-Pro-2.local at Thu Jul 17 09:58:18 2025
Module time:
	user time   =       2.11 seconds =       0.04 minutes
	system time =       4.07 seconds =       0.07 minutes
	total time  =          1 seconds =       0.02 minutes
Total time:
	user time   =       6.90 seconds =       0.12 minutes
	system time =       9.92 seconds =       0.17 minutes
	total time  =          2 seconds =       0.03 minutes

*** tstart() called on Joses-MacBook-Pro-2.local
*** at Thu Jul 17 09:58:18 2025


         ------------------------------------------------------------
                                   SCF GRAD                          
                          Rob Parrish, Justin Turney,                
                       Andy Simmonett, and Alex Sokolov              
         ------------------------------------------------------------

  ==> Geometry <==

    Molecular point group: c2v
    Full point group: C_inf_v

    Geometry (in Angstrom), charge = -1, multiplicity = 1:

       Center              X                  Y                   Z               Mass       
    ------------   -----------------  -----------------  -----------------  -----------------
         C            0.000000000000     0.000000000000     0.637750363838    12.000000000000
         N            0.000000000000     0.000000000000    -0.546523167958    14.003074004430

  Nuclear repulsion =   18.767153239018576

  ==> Basis Set <==

  Basis Set: CC-PVDZ
    Blend: CC-PVDZ
    Number of shells: 12
    Number of basis functions: 28
    Number of Cartesian functions: 30
    Spherical Harmonics?: true
    Max angular momentum: 2

  ==> DFJKGrad: Density-Fitted SCF Gradients <==

    Gradient:                    1
    J tasked:                  Yes
    K tasked:                  Yes
    wK tasked:                  No
    OpenMP threads:              1
    Integrals threads:           1
    Memory [MiB]:              375
    Schwarz Cutoff:          1E-12
    Fitting Condition:       1E-10

   => Auxiliary Basis Set <=

  Basis Set: (CC-PVDZ AUX)
    Blend: CC-PVDZ-JKFIT
    Number of shells: 48
    Number of basis functions: 140
    Number of Cartesian functions: 162
    Spherical Harmonics?: true
    Max angular momentum: 3

  ==> DFT Potential <==

   => LibXC <=

    Version 6.2.2
    S. Lehtola, C. Steigemann, M. J.T. Oliveira, and M. A.L. Marques.,  SoftwareX 7, 1–5 (2018) (10.1016/j.softx.2017.11.002)

   => Composite Functional: B3LYP <= 

    B3LYP Hyb-GGA Exchange-Correlation Functional

    P. J. Stephens, F. J. Devlin, C. F. Chabalowski, and M. J. Frisch.,  J. Phys. Chem. 98, 11623 (1994) (10.1021/j100096a001)

    Deriv               =              1
    GGA                 =           TRUE
    Meta                =          FALSE

    Exchange Hybrid     =           TRUE
    MP2 Hybrid          =          FALSE

   => Exchange Functionals <=

    0.0800   Slater exchange
    0.7200         Becke 88

   => Exact (HF) Exchange <=

    0.2000               HF 

   => Correlation Functionals <=

    0.1900   Vosko, Wilk & Nusair (VWN5_RPA)
    0.8100   Lee, Yang & Parr

   => LibXC Density Thresholds  <==

    XC_HYB_GGA_XC_B3LYP:  1.00E-15 

   => Molecular Quadrature <=

    Radial Scheme          =       TREUTLER
    Pruning Scheme         =           NONE
    Nuclear Scheme         =       TREUTLER

    Blocking Scheme        =         OCTREE
    BS radius alpha        =              1
    Pruning alpha          =              1
    Radial Points          =             75
    Spherical Points       =            302
    Total Points           =          42672
    Total Blocks           =            386
    Max Points             =            256
    Max Functions          =             28
    Weights Tolerance      =       1.00E-15


  -Total Gradient:
     Atom            X                  Y                   Z
    ------   -----------------  -----------------  -----------------
       1        0.000000000000     0.000000000000    -0.000241544654
       2        0.000000000000    -0.000000000000     0.000245675425


*** tstop() called on Joses-MacBook-Pro-2.local at Thu Jul 17 09:58:18 2025
Module time:
	user time   =       1.39 seconds =       0.02 minutes
	system time =       1.54 seconds =       0.03 minutes
	total time  =          0 seconds =       0.00 minutes
Total time:
	user time   =       8.29 seconds =       0.14 minutes
	system time =      11.46 seconds =       0.19 minutes
	total time  =          2 seconds =       0.03 minutes

    			-----------------------------------------

    			 OPTKING 3.0: for geometry optimizations 

    			     By R.A. King, Bethel University     

    			        with contributions from          

    			    A.V. Copan, J. Cayton, A. Heide      

    			-----------------------------------------

    
	                            ===> Fragment 1 <== 

	 Z (Atomic Numbers)          Masses                          Geom                  
	       6.000000            12.000000          0.00000000  0.00000000  1.20517352   
	       7.000000            14.003074          0.00000000  0.00000000 -1.03277911   

	 - Coordinate -           - BOHR/RAD -       - ANG/DEG -
	 R(1,2)           =         2.237953           1.184274


	        --- Internal Coordinate Step in ANG or DEG, aJ/ANG or AJ/DEG ---
	-------------------------------------------------------------------------------
	           Coordinate      Previous         Force          Change          New 
	           ----------      --------        ------          ------        ------
	               R(1,2)       1.18427        0.00201        0.00012       1.18440
	-------------------------------------------------------------------------------

	                                 ==> Convergence Check <==                                  
    
	Measures of convergence in internal coordinates in au.
    
	Criteria marked as inactive (o), active & met (*), and active & unmet ( ).

	----------------------------------------------------------------------------------------------
	   Step    Total Energy     Delta E     Max Force     RMS Force      Max Disp      RMS Disp   
	----------------------------------------------------------------------------------------------
	  Convergence Criteria     1.00e-06 *    3.00e-04 *             o    1.20e-03 *             o
	----------------------------------------------------------------------------------------------
	     2     -92.83660583   -4.68e-04      2.44e-04 *    2.44e-04 o    2.30e-04 *    2.30e-04 o  ~
	----------------------------------------------------------------------------------------------

Next Geometry in Ang 
	Fragment 1 (Ang)

	    C   0.0000000000   0.0000000000   0.6378113239
	    N   0.0000000000   0.0000000000  -0.5465841281


    Final optimized geometry and variables:
    Molecular point group: c2v
    Full point group: C_inf_v

    Geometry (in Angstrom), charge = -1, multiplicity = 1:

    C            0.000000000000     0.000000000000     0.637750363838
    N            0.000000000000     0.000000000000    -0.546523167958


    Psi4 stopped on: Thursday, 17 July 2025 09:58AM
    Psi4 wall time for execution: 0:00:03.01

*** Psi4 exiting successfully. Buy a developer a beer!
