
    -----------------------------------------------------------------------
          Psi4: An Open-Source Ab Initio Electronic Structure Package
                               Psi4 1.9.1 release

                         Git: Rev {} zzzzzzz 


    D. G. A. Smith, L. A. Burns, A. C. Simmonett, R. M. Parrish,
    M. C. Schieber, R. Galvelis, P. Kraus, H. Kruse, R. Di Remigio,
    A. Alenaizan, A. M. James, S. Lehtola, J. P. Misiewicz, M. Scheurer,
    R. A. Shaw, J. B. Schriber, Y. Xie, Z. L. Glick, D. A. Sirianni,
    J. S. O'Brien, J. M. Waldrop, A. Kumar, E. G. Hohenstein,
    B. P. Pritchard, B. R. Brooks, H. F. Schaefer III, A. Yu. Sokolov,
    K. Patkowski, A. E. DePrince III, U. Bozkaya, R. A. King,
    F. A. Evangelista, J. M. Turney, T. D. Crawford, C. D. Sherrill,
    J. Chem. Phys. 152(18) 184108 (2020). https://doi.org/10.1063/5.0006002

                            Additional Code Authors
    E. T. Seidl, C. L. Janssen, E. F. Valeev, M. L. Leininger,
    J. F. Gonthier, R. M. Richard, H. R. McAlexander, M. Saitow, X. Wang,
    P. Verma, M. H. Lechner, A. Jiang, S. Behnle, A. G. Heide,
    M. F. Herbst, and D. L. Poole

             Previous Authors, Complete List of Code Contributors,
                       and Citations for Specific Modules
    https://github.com/psi4/psi4/blob/master/codemeta.json
    https://github.com/psi4/psi4/graphs/contributors
    http://psicode.org/psi4manual/master/introduction.html#citing-psifour

    -----------------------------------------------------------------------


    Psi4 started on: Thursday, 17 July 2025 09:11AM

    Process ID: 71735
    Host:       Joses-MacBook-Pro-2.local
    PSIDATADIR: /Users/joseantoniorodriguesromero/anaconda3/share/psi4
    Memory:     500.0 MiB
    Threads:    1
    
  ==> Input File <==

--------------------------------------------------------------------------
molecule { 
-1 3
H   0.00000        0.60000        0.00000
C   0.00000       -0.60000        0.00000
}

set { 
basis              cc-pvdz
reference          uks
maxiter            500
geom_maxiter       500
DAMPING_PERCENTAGE 1
guess              SAP
}

optimize('b3lyp')
--------------------------------------------------------------------------

Scratch directory: /tmp/
gradient() will perform analytic gradient computation.
   => Libint2 <=

    Primary   basis highest AM E, G, H:  6, 6, 3
    Auxiliary basis highest AM E, G, H:  7, 7, 4
    Onebody   basis highest AM E, G, H:  -, -, -
    Solid Harmonics ordering:            Gaussian

*** tstart() called on Joses-MacBook-Pro-2.local
*** at Thu Jul 17 09:11:19 2025

   => Loading Basis Set <=

    Name: CC-PVDZ
    Role: ORBITAL
    Keyword: BASIS
    atoms 1 entry H          line    22 file /Users/joseantoniorodriguesromero/anaconda3/share/psi4/basis/cc-pvdz.gbs 
    atoms 2 entry C          line   138 file /Users/joseantoniorodriguesromero/anaconda3/share/psi4/basis/cc-pvdz.gbs 


         ---------------------------------------------------------
                                   SCF
               by Justin Turney, Rob Parrish, Andy Simmonett
                          and Daniel G. A. Smith
                              UKS Reference
                        1 Threads,    500 MiB Core
         ---------------------------------------------------------

  ==> Geometry <==

    Molecular point group: c2v
    Full point group: C_inf_v

    Geometry (in Angstrom), charge = -1, multiplicity = 3:

       Center              X                  Y                   Z               Mass       
    ------------   -----------------  -----------------  -----------------  -----------------
         H            0.000000000000     0.000000000000     1.107025960475     1.007825032230
         C            0.000000000000     0.000000000000    -0.092974039525    12.000000000000

  Running in c2v symmetry.

  Rotational constants: A = ************  B =     12.59135  C =     12.59135 [cm^-1]
  Rotational constants: A = ************  B = 377479.18325  C = 377479.18325 [MHz]
  Nuclear repulsion =    2.645886053350000

  Charge       = -1
  Multiplicity = 3
  Electrons    = 8
  Nalpha       = 5
  Nbeta        = 3

  ==> Algorithm <==

  SCF Algorithm Type is DF.
  DIIS enabled.
  MOM disabled.
  Fractional occupation disabled.
  Guess Type is SAP.
  Energy threshold   = 1.00e-08
  Density threshold  = 1.00e-08
  Integral threshold = 1.00e-12

  ==> Primary Basis <==

  Basis Set: CC-PVDZ
    Blend: CC-PVDZ
    Number of shells: 9
    Number of basis functions: 19
    Number of Cartesian functions: 20
    Spherical Harmonics?: true
    Max angular momentum: 2

  ==> DFT Potential <==

   => LibXC <=

    Version 6.2.2
    S. Lehtola, C. Steigemann, M. J.T. Oliveira, and M. A.L. Marques.,  SoftwareX 7, 1–5 (2018) (10.1016/j.softx.2017.11.002)

   => Composite Functional: B3LYP <= 

    B3LYP Hyb-GGA Exchange-Correlation Functional

    P. J. Stephens, F. J. Devlin, C. F. Chabalowski, and M. J. Frisch.,  J. Phys. Chem. 98, 11623 (1994) (10.1021/j100096a001)

    Deriv               =              1
    GGA                 =           TRUE
    Meta                =          FALSE

    Exchange Hybrid     =           TRUE
    MP2 Hybrid          =          FALSE

   => Exchange Functionals <=

    0.0800   Slater exchange
    0.7200         Becke 88

   => Exact (HF) Exchange <=

    0.2000               HF 

   => Correlation Functionals <=

    0.1900   Vosko, Wilk & Nusair (VWN5_RPA)
    0.8100   Lee, Yang & Parr

   => LibXC Density Thresholds  <==

    XC_HYB_GGA_XC_B3LYP:  1.00E-15 

   => Molecular Quadrature <=

    Radial Scheme          =       TREUTLER
    Pruning Scheme         =           NONE
    Nuclear Scheme         =       TREUTLER

    Blocking Scheme        =         OCTREE
    BS radius alpha        =              1
    Pruning alpha          =              1
    Radial Points          =             75
    Spherical Points       =            302
    Total Points           =          43742
    Total Blocks           =            387
    Max Points             =            255
    Max Functions          =             19
    Weights Tolerance      =       1.00E-15

   => Loading Basis Set <=

    Name: (CC-PVDZ AUX)
    Role: JKFIT
    Keyword: DF_BASIS_SCF
    atoms 1 entry H          line    51 file /Users/joseantoniorodriguesromero/anaconda3/share/psi4/basis/cc-pvdz-jkfit.gbs 
    atoms 2 entry C          line   121 file /Users/joseantoniorodriguesromero/anaconda3/share/psi4/basis/cc-pvdz-jkfit.gbs 

  ==> Integral Setup <==

  DFHelper Memory: AOs need 0.000 GiB; user supplied 0.342 GiB. 
  Using in-core AOs.

  ==> MemDFJK: Density-Fitted J/K Matrices <==

    J tasked:                   Yes
    K tasked:                   Yes
    wK tasked:                   No
    OpenMP threads:               1
    Memory [MiB]:               349
    Algorithm:                 Core
    Schwarz Cutoff:           1E-12
    Mask sparsity (%):       0.0000
    Fitting Condition:        1E-10

   => Auxiliary Basis Set <=

  Basis Set: (CC-PVDZ AUX)
    Blend: CC-PVDZ-JKFIT
    Number of shells: 33
    Number of basis functions: 93
    Number of Cartesian functions: 106
    Spherical Harmonics?: true
    Max angular momentum: 3

  Cached 100.0% of DFT collocation blocks in 0.024 [GiB].

  Minimum eigenvalue in the overlap matrix is 4.4207294837E-02.
  Reciprocal condition number of the overlap matrix is 1.4754317306E-02.
    Using symmetric orthogonalization.

  ==> Pre-Iterations <==

  SCF Guess: Superposition of Atomic Potentials (doi:10.1021/acs.jctc.8b01089).

  ==> SAP guess <==

   => Molecular Quadrature <=

    Radial Scheme          =       TREUTLER
    Pruning Scheme         =           NONE
    Nuclear Scheme         =       TREUTLER

    Blocking Scheme        =         OCTREE
    BS radius alpha        =              1
    Pruning alpha          =              1
    Radial Points          =             75
    Spherical Points       =            302
    Total Points           =          43742
    Total Blocks           =            387
    Max Points             =            255
    Max Functions          =             19
    Weights Tolerance      =       1.00E-15

   -------------------------------------------------------
    Irrep   Nso     Nmo     Nalpha   Nbeta   Ndocc  Nsocc
   -------------------------------------------------------
     A1        10      10       3       3       3       0
     A2         1       1       0       0       0       0
     B1         4       4       1       0       0       1
     B2         4       4       1       0       0       1
   -------------------------------------------------------
    Total      19      19       5       3       3       2
   -------------------------------------------------------

  ==> Iterations <==

                           Total Energy        Delta E     RMS |[F,P]|

   @DF-UKS iter   1:   -38.34818378399626   -3.83482e+01   3.85700e-02 DIIS/ADIIS
   @DF-UKS iter   2:   -38.37959619047973   -3.14124e-02   3.51277e-02 DIIS/ADIIS/DAMP=1%
   @DF-UKS iter   3:   -38.48813579687027   -1.08540e-01   2.69797e-03 DIIS/ADIIS/DAMP=1%
   @DF-UKS iter   4:   -38.49956641886963   -1.14306e-02   7.71841e-04 DIIS/ADIIS/DAMP=1%
   @DF-UKS iter   5:   -38.49905051288167    5.15906e-04   8.64347e-05 DIIS/DAMP=1%
   @DF-UKS iter   6:   -38.49912529495209   -7.47821e-05   1.79976e-05 DIIS/DAMP=1%
   @DF-UKS iter   7:   -38.49914659112375   -2.12962e-05   3.58015e-06 DIIS/DAMP=1%
   @DF-UKS iter   8:   -38.49914446146013    2.12966e-06   8.18321e-07 DIIS/DAMP=1%
   @DF-UKS iter   9:   -38.49914420868919    2.52771e-07   1.41032e-07 DIIS/DAMP=1%
   @DF-UKS iter  10:   -38.49914426918073   -6.04915e-08   1.02282e-08 DIIS/DAMP=1%
   @DF-UKS iter  11:   -38.49914427877963   -9.59891e-09   1.03601e-09 DIIS/DAMP=1%
  Energy and wave function converged.


  ==> Post-Iterations <==

   Electrons on quadrature grid:
      Nalpha   =    4.9999999871 ; deviation = -1.287e-08
      Nbeta    =    2.9999999799 ; deviation = -2.006e-08
      Ntotal   =    7.9999999671 ; deviation = -3.293e-08 

   @Spin Contamination Metric:   5.369335014E-03
   @S^2 Expected:                2.000000000E+00
   @S^2 Observed:                2.005369335E+00
   @S   Expected:                1.000000000E+00
   @S   Observed:                1.000000000E+00

    Orbital Energies [Eh]
    ---------------------

    Alpha Occupied:                                                       

       1A1    -9.863875     2A1    -0.271902     3A1     0.034061  
       1B2     0.112077     1B1     0.112077  

    Alpha Virtual:                                                        

       4A1     0.345589     5A1     0.758822     2B2     0.784745  
       2B1     0.784745     6A1     0.839569     7A1     1.024425  
       3B2     1.338634     3B1     1.338634     1A2     1.487392  
       8A1     1.487392     9A1     1.839849     4B2     2.021527  
       4B1     2.021527    10A1     2.562009  

    Beta Occupied:                                                        

       1A1    -9.841683     2A1    -0.197349     3A1     0.069902  

    Beta Virtual:                                                         

       1B1     0.281358     1B2     0.281358     4A1     0.359375  
       5A1     0.776511     6A1     0.858637     2B2     0.867883  
       2B1     0.867883     7A1     1.077401     3B2     1.376739  
       3B1     1.376739     8A1     1.598947     1A2     1.598947  
       9A1     1.875807     4B2     2.050125     4B1     2.050125  
      10A1     2.573928  

    Final Occupation by Irrep:
             A1    A2    B1    B2 
    DOCC [     3,    0,    0,    0 ]
    SOCC [     0,    0,    1,    1 ]
    NA   [     3,    0,    1,    1 ]
    NB   [     3,    0,    0,    0 ]

  @DF-UKS Final Energy:   -38.49914427877963

   => Energetics <=

    Nuclear Repulsion Energy =              2.6458860533500004
    One-Electron Energy =                 -58.9995882036272477
    Two-Electron Energy =                  22.6335484714940698
    DFT Exchange-Correlation Energy =      -4.7789905999964466
    Empirical Dispersion Energy =           0.0000000000000000
    VV10 Nonlocal Energy =                  0.0000000000000000
    Total Energy =                        -38.4991442787796245

  UHF NO Occupations:
  HONO-2 :    3 A1 1.9976297
  HONO-1 :    1 B1 1.0000000
  HONO-0 :    1 B2 1.0000000
  LUNO+0 :    4 A1 0.0023703
  LUNO+1 :    5 A1 0.0003170
  LUNO+2 :    6 A1 0.0000003
  LUNO+3 :    7 A1 0.0000000


Computation Completed


Properties will be evaluated at   0.000000,   0.000000,   0.000000 [a0]

Properties computed using the SCF density matrix


 Multipole Moments:

 ------------------------------------------------------------------------------------
     Multipole            Electronic (a.u.)      Nuclear  (a.u.)        Total (a.u.)
 ------------------------------------------------------------------------------------

 L = 1.  Multiply by 2.5417464519 to convert [e a0] to [Debye]
 Dipole X            :          0.0000000            0.0000000            0.0000000
 Dipole Y            :          0.0000000            0.0000000            0.0000000
 Dipole Z            :         -0.8035291            1.0378031            0.2342739
 Magnitude           :                                                    0.2342739

 ------------------------------------------------------------------------------------

*** tstop() called on Joses-MacBook-Pro-2.local at Thu Jul 17 09:11:20 2025
Module time:
	user time   =       1.22 seconds =       0.02 minutes
	system time =       2.40 seconds =       0.04 minutes
	total time  =          1 seconds =       0.02 minutes
Total time:
	user time   =       1.22 seconds =       0.02 minutes
	system time =       2.40 seconds =       0.04 minutes
	total time  =          1 seconds =       0.02 minutes

*** tstart() called on Joses-MacBook-Pro-2.local
*** at Thu Jul 17 09:11:20 2025


         ------------------------------------------------------------
                                   SCF GRAD                          
                          Rob Parrish, Justin Turney,                
                       Andy Simmonett, and Alex Sokolov              
         ------------------------------------------------------------

  ==> Geometry <==

    Molecular point group: c2v
    Full point group: C_inf_v

    Geometry (in Angstrom), charge = -1, multiplicity = 3:

       Center              X                  Y                   Z               Mass       
    ------------   -----------------  -----------------  -----------------  -----------------
         H            0.000000000000     0.000000000000     1.107025960475     1.007825032230
         C            0.000000000000     0.000000000000    -0.092974039525    12.000000000000

  Nuclear repulsion =    2.645886053350000

  ==> Basis Set <==

  Basis Set: CC-PVDZ
    Blend: CC-PVDZ
    Number of shells: 9
    Number of basis functions: 19
    Number of Cartesian functions: 20
    Spherical Harmonics?: true
    Max angular momentum: 2

  ==> DFJKGrad: Density-Fitted SCF Gradients <==

    Gradient:                    1
    J tasked:                  Yes
    K tasked:                  Yes
    wK tasked:                  No
    OpenMP threads:              1
    Integrals threads:           1
    Memory [MiB]:              375
    Schwarz Cutoff:          1E-12
    Fitting Condition:       1E-10

   => Auxiliary Basis Set <=

  Basis Set: (CC-PVDZ AUX)
    Blend: CC-PVDZ-JKFIT
    Number of shells: 33
    Number of basis functions: 93
    Number of Cartesian functions: 106
    Spherical Harmonics?: true
    Max angular momentum: 3

  ==> DFT Potential <==

   => LibXC <=

    Version 6.2.2
    S. Lehtola, C. Steigemann, M. J.T. Oliveira, and M. A.L. Marques.,  SoftwareX 7, 1–5 (2018) (10.1016/j.softx.2017.11.002)

   => Composite Functional: B3LYP <= 

    B3LYP Hyb-GGA Exchange-Correlation Functional

    P. J. Stephens, F. J. Devlin, C. F. Chabalowski, and M. J. Frisch.,  J. Phys. Chem. 98, 11623 (1994) (10.1021/j100096a001)

    Deriv               =              1
    GGA                 =           TRUE
    Meta                =          FALSE

    Exchange Hybrid     =           TRUE
    MP2 Hybrid          =          FALSE

   => Exchange Functionals <=

    0.0800   Slater exchange
    0.7200         Becke 88

   => Exact (HF) Exchange <=

    0.2000               HF 

   => Correlation Functionals <=

    0.1900   Vosko, Wilk & Nusair (VWN5_RPA)
    0.8100   Lee, Yang & Parr

   => LibXC Density Thresholds  <==

    XC_HYB_GGA_XC_B3LYP:  1.00E-15 

   => Molecular Quadrature <=

    Radial Scheme          =       TREUTLER
    Pruning Scheme         =           NONE
    Nuclear Scheme         =       TREUTLER

    Blocking Scheme        =         OCTREE
    BS radius alpha        =              1
    Pruning alpha          =              1
    Radial Points          =             75
    Spherical Points       =            302
    Total Points           =          43742
    Total Blocks           =            387
    Max Points             =            255
    Max Functions          =             19
    Weights Tolerance      =       1.00E-15


  -Total Gradient:
     Atom            X                  Y                   Z
    ------   -----------------  -----------------  -----------------
       1       -0.000000000000     0.000000000000     0.004784843018
       2        0.000000000000     0.000000000000    -0.004784702453


*** tstop() called on Joses-MacBook-Pro-2.local at Thu Jul 17 09:11:20 2025
Module time:
	user time   =       0.31 seconds =       0.01 minutes
	system time =       0.73 seconds =       0.01 minutes
	total time  =          0 seconds =       0.00 minutes
Total time:
	user time   =       1.53 seconds =       0.03 minutes
	system time =       3.13 seconds =       0.05 minutes
	total time  =          1 seconds =       0.02 minutes

    			-----------------------------------------

    			 OPTKING 3.0: for geometry optimizations 

    			     By R.A. King, Bethel University     

    			        with contributions from          

    			    A.V. Copan, J. Cayton, A. Heide      

    			-----------------------------------------

    
	                            ===> Fragment 1 <== 

	 Z (Atomic Numbers)          Masses                          Geom                  
	       1.000000             1.007825          0.00000000  0.00000000  2.09197588   
	       6.000000            12.000000          0.00000000  0.00000000 -0.17569547   

	 - Coordinate -           - BOHR/RAD -       - ANG/DEG -
	 R(1,2)           =         2.267671           1.200000


	        --- Internal Coordinate Step in ANG or DEG, aJ/ANG or AJ/DEG ---
	-------------------------------------------------------------------------------
	           Coordinate      Previous         Force          Change          New 
	           ----------      --------        ------          ------        ------
	               R(1,2)       1.20000       -0.03942       -0.01026       1.18974
	-------------------------------------------------------------------------------

	                                 ==> Convergence Check <==                                  
    
	Measures of convergence in internal coordinates in au.
    
	Criteria marked as inactive (o), active & met (*), and active & unmet ( ).

	----------------------------------------------------------------------------------------------
	   Step    Total Energy     Delta E     Max Force     RMS Force      Max Disp      RMS Disp   
	----------------------------------------------------------------------------------------------
	  Convergence Criteria     1.00e-06 *    3.00e-04 *             o    1.20e-03 *             o
	----------------------------------------------------------------------------------------------
	     1     -38.49914428   -3.85e+01      4.78e-03      4.78e-03 o    1.94e-02      1.94e-02 o  ~
	----------------------------------------------------------------------------------------------

Next Geometry in Ang 
	Fragment 1 (Ang)

	    H   0.0000000000   0.0000000000   1.1018951847
	    C   0.0000000000   0.0000000000  -0.0878432638


    Structure for next step:
    Molecular point group: c2v
    Full point group: C_inf_v

    Geometry (in Angstrom), charge = -1, multiplicity = 3:

    H            0.000000000000     0.000000000000     1.097559457240
    C            0.000000000000     0.000000000000    -0.092178991281


Scratch directory: /tmp/
gradient() will perform analytic gradient computation.
   => Libint2 <=

    Primary   basis highest AM E, G, H:  6, 6, 3
    Auxiliary basis highest AM E, G, H:  7, 7, 4
    Onebody   basis highest AM E, G, H:  -, -, -
    Solid Harmonics ordering:            Gaussian

*** tstart() called on Joses-MacBook-Pro-2.local
*** at Thu Jul 17 09:11:20 2025

   => Loading Basis Set <=

    Name: CC-PVDZ
    Role: ORBITAL
    Keyword: BASIS
    atoms 1 entry H          line    22 file /Users/joseantoniorodriguesromero/anaconda3/share/psi4/basis/cc-pvdz.gbs 
    atoms 2 entry C          line   138 file /Users/joseantoniorodriguesromero/anaconda3/share/psi4/basis/cc-pvdz.gbs 


         ---------------------------------------------------------
                                   SCF
               by Justin Turney, Rob Parrish, Andy Simmonett
                          and Daniel G. A. Smith
                              UKS Reference
                        1 Threads,    500 MiB Core
         ---------------------------------------------------------

  ==> Geometry <==

    Molecular point group: c2v
    Full point group: C_inf_v

    Geometry (in Angstrom), charge = -1, multiplicity = 3:

       Center              X                  Y                   Z               Mass       
    ------------   -----------------  -----------------  -----------------  -----------------
         H            0.000000000000     0.000000000000     1.097559457240     1.007825032230
         C            0.000000000000     0.000000000000    -0.092178991281    12.000000000000

  Running in c2v symmetry.

  Rotational constants: A = ************  B =     12.80949  C =     12.80949 [cm^-1]
  Rotational constants: A = ************  B = 384018.81679  C = 384018.81679 [MHz]
  Nuclear repulsion =    2.668706948126465

  Charge       = -1
  Multiplicity = 3
  Electrons    = 8
  Nalpha       = 5
  Nbeta        = 3

  ==> Algorithm <==

  SCF Algorithm Type is DF.
  DIIS enabled.
  MOM disabled.
  Fractional occupation disabled.
  Guess Type is READ.
  Energy threshold   = 1.00e-08
  Density threshold  = 1.00e-08
  Integral threshold = 1.00e-12

  ==> Primary Basis <==

  Basis Set: CC-PVDZ
    Blend: CC-PVDZ
    Number of shells: 9
    Number of basis functions: 19
    Number of Cartesian functions: 20
    Spherical Harmonics?: true
    Max angular momentum: 2

  ==> DFT Potential <==

   => LibXC <=

    Version 6.2.2
    S. Lehtola, C. Steigemann, M. J.T. Oliveira, and M. A.L. Marques.,  SoftwareX 7, 1–5 (2018) (10.1016/j.softx.2017.11.002)

   => Composite Functional: B3LYP <= 

    B3LYP Hyb-GGA Exchange-Correlation Functional

    P. J. Stephens, F. J. Devlin, C. F. Chabalowski, and M. J. Frisch.,  J. Phys. Chem. 98, 11623 (1994) (10.1021/j100096a001)

    Deriv               =              1
    GGA                 =           TRUE
    Meta                =          FALSE

    Exchange Hybrid     =           TRUE
    MP2 Hybrid          =          FALSE

   => Exchange Functionals <=

    0.0800   Slater exchange
    0.7200         Becke 88

   => Exact (HF) Exchange <=

    0.2000               HF 

   => Correlation Functionals <=

    0.1900   Vosko, Wilk & Nusair (VWN5_RPA)
    0.8100   Lee, Yang & Parr

   => LibXC Density Thresholds  <==

    XC_HYB_GGA_XC_B3LYP:  1.00E-15 

   => Molecular Quadrature <=

    Radial Scheme          =       TREUTLER
    Pruning Scheme         =           NONE
    Nuclear Scheme         =       TREUTLER

    Blocking Scheme        =         OCTREE
    BS radius alpha        =              1
    Pruning alpha          =              1
    Radial Points          =             75
    Spherical Points       =            302
    Total Points           =          43737
    Total Blocks           =            388
    Max Points             =            255
    Max Functions          =             19
    Weights Tolerance      =       1.00E-15

   => Loading Basis Set <=

    Name: (CC-PVDZ AUX)
    Role: JKFIT
    Keyword: DF_BASIS_SCF
    atoms 1 entry H          line    51 file /Users/joseantoniorodriguesromero/anaconda3/share/psi4/basis/cc-pvdz-jkfit.gbs 
    atoms 2 entry C          line   121 file /Users/joseantoniorodriguesromero/anaconda3/share/psi4/basis/cc-pvdz-jkfit.gbs 

   => Loading Basis Set <=

    Name: CC-PVDZ
    Role: ORBITAL
    Keyword: BASIS
    atoms 1 entry H          line    22 file /Users/joseantoniorodriguesromero/anaconda3/share/psi4/basis/cc-pvdz.gbs 
    atoms 2 entry C          line   138 file /Users/joseantoniorodriguesromero/anaconda3/share/psi4/basis/cc-pvdz.gbs 

  Reading orbitals from file /tmp/triplet_HC.default.71735.180.npy, no projection.

  ==> Integral Setup <==

  DFHelper Memory: AOs need 0.000 GiB; user supplied 0.342 GiB. 
  Using in-core AOs.

  ==> MemDFJK: Density-Fitted J/K Matrices <==

    J tasked:                   Yes
    K tasked:                   Yes
    wK tasked:                   No
    OpenMP threads:               1
    Memory [MiB]:               349
    Algorithm:                 Core
    Schwarz Cutoff:           1E-12
    Mask sparsity (%):       0.0000
    Fitting Condition:        1E-10

   => Auxiliary Basis Set <=

  Basis Set: (CC-PVDZ AUX)
    Blend: CC-PVDZ-JKFIT
    Number of shells: 33
    Number of basis functions: 93
    Number of Cartesian functions: 106
    Spherical Harmonics?: true
    Max angular momentum: 3

  Cached 100.0% of DFT collocation blocks in 0.024 [GiB].

  Minimum eigenvalue in the overlap matrix is 4.3366827480E-02.
  Reciprocal condition number of the overlap matrix is 1.4436524853E-02.
    Using symmetric orthogonalization.

  ==> Pre-Iterations <==

  SCF Guess: Orbitals guess was supplied from a previous computation.

   -------------------------------------------------------
    Irrep   Nso     Nmo     Nalpha   Nbeta   Ndocc  Nsocc
   -------------------------------------------------------
     A1        10      10       3       3       3       0
     A2         1       1       0       0       0       0
     B1         4       4       1       0       0       1
     B2         4       4       1       0       0       1
   -------------------------------------------------------
    Total      19      19       5       3       3       2
   -------------------------------------------------------

  ==> Iterations <==

                           Total Energy        Delta E     RMS |[F,P]|

   @DF-UKS iter   0:   -38.50089144250653   -3.85009e+01   1.22559e-03 
   @DF-UKS iter   1:   -38.49919832400139    1.69312e-03   2.38133e-04 DIIS/ADIIS
   @DF-UKS iter   2:   -38.49920081184854   -2.48785e-06   1.74252e-04 DIIS/ADIIS/DAMP=1%
   @DF-UKS iter   3:   -38.49916637354083    3.44383e-05   2.96796e-05 DIIS/DAMP=1%
   @DF-UKS iter   4:   -38.49921117353213   -4.48000e-05   1.99440e-06 DIIS/DAMP=1%
   @DF-UKS iter   5:   -38.49920324800229    7.92553e-06   3.82947e-07 DIIS/DAMP=1%
   @DF-UKS iter   6:   -38.49920373296529   -4.84963e-07   9.01180e-08 DIIS/DAMP=1%
   @DF-UKS iter   7:   -38.49920365746262    7.55027e-08   2.36644e-08 DIIS/DAMP=1%
   @DF-UKS iter   8:   -38.49920365663640    8.26226e-10   4.44799e-09 DIIS/DAMP=1%
  Energy and wave function converged.


  ==> Post-Iterations <==

   Electrons on quadrature grid:
      Nalpha   =    4.9999999865 ; deviation = -1.352e-08
      Nbeta    =    2.9999999789 ; deviation = -2.112e-08
      Ntotal   =    7.9999999654 ; deviation = -3.464e-08 

   @Spin Contamination Metric:   5.317728407E-03
   @S^2 Expected:                2.000000000E+00
   @S^2 Observed:                2.005317728E+00
   @S   Expected:                1.000000000E+00
   @S   Observed:                1.000000000E+00

    Orbital Energies [Eh]
    ---------------------

    Alpha Occupied:                                                       

       1A1    -9.862343     2A1    -0.273253     3A1     0.034711  
       1B1     0.112659     1B2     0.112659  

    Alpha Virtual:                                                        

       4A1     0.346602     5A1     0.759997     2B2     0.785379  
       2B1     0.785379     6A1     0.842060     7A1     1.026952  
       3B1     1.339522     3B2     1.339522     1A2     1.488029  
       8A1     1.488029     9A1     1.849487     4B1     2.028345  
       4B2     2.028345    10A1     2.574359  

    Beta Occupied:                                                        

       1A1    -9.840187     2A1    -0.199039     3A1     0.070913  

    Beta Virtual:                                                         

       1B1     0.281830     1B2     0.281830     4A1     0.360113  
       5A1     0.778253     6A1     0.861098     2B2     0.868488  
       2B1     0.868488     7A1     1.079762     3B1     1.377801  
       3B2     1.377801     8A1     1.599561     1A2     1.599561  
       9A1     1.885639     4B1     2.057048     4B2     2.057048  
      10A1     2.586170  

    Final Occupation by Irrep:
             A1    A2    B1    B2 
    DOCC [     3,    0,    0,    0 ]
    SOCC [     0,    0,    1,    1 ]
    NA   [     3,    0,    1,    1 ]
    NB   [     3,    0,    0,    0 ]

  @DF-UKS Final Energy:   -38.49920365663640

   => Energetics <=

    Nuclear Repulsion Energy =              2.6687069481264651
    One-Electron Energy =                 -59.0464686097752889
    Two-Electron Energy =                  22.6599881803871277
    DFT Exchange-Correlation Energy =      -4.7814301753746937
    Empirical Dispersion Energy =           0.0000000000000000
    VV10 Nonlocal Energy =                  0.0000000000000000
    Total Energy =                        -38.4992036566363964

  UHF NO Occupations:
  HONO-2 :    3 A1 1.9976463
  HONO-1 :    1 B2 1.0000000
  HONO-0 :    1 B1 1.0000000
  LUNO+0 :    4 A1 0.0023537
  LUNO+1 :    5 A1 0.0003077
  LUNO+2 :    6 A1 0.0000003
  LUNO+3 :    7 A1 0.0000000


Computation Completed


Properties will be evaluated at   0.000000,   0.000000,   0.000000 [a0]

Properties computed using the SCF density matrix


 Multipole Moments:

 ------------------------------------------------------------------------------------
     Multipole            Electronic (a.u.)      Nuclear  (a.u.)        Total (a.u.)
 ------------------------------------------------------------------------------------

 L = 1.  Multiply by 2.5417464519 to convert [e a0] to [Debye]
 Dipole X            :          0.0000000            0.0000000            0.0000000
 Dipole Y            :          0.0000000            0.0000000            0.0000000
 Dipole Z            :         -0.7765068            1.0289285            0.2524217
 Magnitude           :                                                    0.2524217

 ------------------------------------------------------------------------------------

*** tstop() called on Joses-MacBook-Pro-2.local at Thu Jul 17 09:11:21 2025
Module time:
	user time   =       0.78 seconds =       0.01 minutes
	system time =       3.07 seconds =       0.05 minutes
	total time  =          1 seconds =       0.02 minutes
Total time:
	user time   =       2.35 seconds =       0.04 minutes
	system time =       6.41 seconds =       0.11 minutes
	total time  =          2 seconds =       0.03 minutes

*** tstart() called on Joses-MacBook-Pro-2.local
*** at Thu Jul 17 09:11:21 2025


         ------------------------------------------------------------
                                   SCF GRAD                          
                          Rob Parrish, Justin Turney,                
                       Andy Simmonett, and Alex Sokolov              
         ------------------------------------------------------------

  ==> Geometry <==

    Molecular point group: c2v
    Full point group: C_inf_v

    Geometry (in Angstrom), charge = -1, multiplicity = 3:

       Center              X                  Y                   Z               Mass       
    ------------   -----------------  -----------------  -----------------  -----------------
         H            0.000000000000     0.000000000000     1.097559457240     1.007825032230
         C            0.000000000000     0.000000000000    -0.092178991281    12.000000000000

  Nuclear repulsion =    2.668706948126465

  ==> Basis Set <==

  Basis Set: CC-PVDZ
    Blend: CC-PVDZ
    Number of shells: 9
    Number of basis functions: 19
    Number of Cartesian functions: 20
    Spherical Harmonics?: true
    Max angular momentum: 2

  ==> DFJKGrad: Density-Fitted SCF Gradients <==

    Gradient:                    1
    J tasked:                  Yes
    K tasked:                  Yes
    wK tasked:                  No
    OpenMP threads:              1
    Integrals threads:           1
    Memory [MiB]:              375
    Schwarz Cutoff:          1E-12
    Fitting Condition:       1E-10

   => Auxiliary Basis Set <=

  Basis Set: (CC-PVDZ AUX)
    Blend: CC-PVDZ-JKFIT
    Number of shells: 33
    Number of basis functions: 93
    Number of Cartesian functions: 106
    Spherical Harmonics?: true
    Max angular momentum: 3

  ==> DFT Potential <==

   => LibXC <=

    Version 6.2.2
    S. Lehtola, C. Steigemann, M. J.T. Oliveira, and M. A.L. Marques.,  SoftwareX 7, 1–5 (2018) (10.1016/j.softx.2017.11.002)

   => Composite Functional: B3LYP <= 

    B3LYP Hyb-GGA Exchange-Correlation Functional

    P. J. Stephens, F. J. Devlin, C. F. Chabalowski, and M. J. Frisch.,  J. Phys. Chem. 98, 11623 (1994) (10.1021/j100096a001)

    Deriv               =              1
    GGA                 =           TRUE
    Meta                =          FALSE

    Exchange Hybrid     =           TRUE
    MP2 Hybrid          =          FALSE

   => Exchange Functionals <=

    0.0800   Slater exchange
    0.7200         Becke 88

   => Exact (HF) Exchange <=

    0.2000               HF 

   => Correlation Functionals <=

    0.1900   Vosko, Wilk & Nusair (VWN5_RPA)
    0.8100   Lee, Yang & Parr

   => LibXC Density Thresholds  <==

    XC_HYB_GGA_XC_B3LYP:  1.00E-15 

   => Molecular Quadrature <=

    Radial Scheme          =       TREUTLER
    Pruning Scheme         =           NONE
    Nuclear Scheme         =       TREUTLER

    Blocking Scheme        =         OCTREE
    BS radius alpha        =              1
    Pruning alpha          =              1
    Radial Points          =             75
    Spherical Points       =            302
    Total Points           =          43737
    Total Blocks           =            388
    Max Points             =            255
    Max Functions          =             19
    Weights Tolerance      =       1.00E-15


  -Total Gradient:
     Atom            X                  Y                   Z
    ------   -----------------  -----------------  -----------------
       1        0.000000000000    -0.000000000000     0.001300580668
       2        0.000000000000     0.000000000000    -0.001300455497


*** tstop() called on Joses-MacBook-Pro-2.local at Thu Jul 17 09:11:21 2025
Module time:
	user time   =       0.34 seconds =       0.01 minutes
	system time =       0.83 seconds =       0.01 minutes
	total time  =          0 seconds =       0.00 minutes
Total time:
	user time   =       2.69 seconds =       0.04 minutes
	system time =       7.24 seconds =       0.12 minutes
	total time  =          2 seconds =       0.03 minutes

    			-----------------------------------------

    			 OPTKING 3.0: for geometry optimizations 

    			     By R.A. King, Bethel University     

    			        with contributions from          

    			    A.V. Copan, J. Cayton, A. Heide      

    			-----------------------------------------

    
	                            ===> Fragment 1 <== 

	 Z (Atomic Numbers)          Masses                          Geom                  
	       1.000000             1.007825          0.00000000  0.00000000  2.07408678   
	       6.000000            12.000000          0.00000000  0.00000000 -0.17419305   

	 - Coordinate -           - BOHR/RAD -       - ANG/DEG -
	 R(1,2)           =         2.248280           1.189738


	        --- Internal Coordinate Step in ANG or DEG, aJ/ANG or AJ/DEG ---
	-------------------------------------------------------------------------------
	           Coordinate      Previous         Force          Change          New 
	           ----------      --------        ------          ------        ------
	               R(1,2)       1.18974       -0.01071       -0.00383       1.18591
	-------------------------------------------------------------------------------

	                                 ==> Convergence Check <==                                  
    
	Measures of convergence in internal coordinates in au.
    
	Criteria marked as inactive (o), active & met (*), and active & unmet ( ).

	----------------------------------------------------------------------------------------------
	   Step    Total Energy     Delta E     Max Force     RMS Force      Max Disp      RMS Disp   
	----------------------------------------------------------------------------------------------
	  Convergence Criteria     1.00e-06 *    3.00e-04 *             o    1.20e-03 *             o
	----------------------------------------------------------------------------------------------
	     2     -38.49920366   -5.94e-05      1.30e-03      1.30e-03 o    7.24e-03      7.24e-03 o  ~
	----------------------------------------------------------------------------------------------

Next Geometry in Ang 
	Fragment 1 (Ang)

	    H   0.0000000000   0.0000000000   1.0956444660
	    C   0.0000000000   0.0000000000  -0.0902640001


    Structure for next step:
    Molecular point group: c2v
    Full point group: C_inf_v

    Geometry (in Angstrom), charge = -1, multiplicity = 3:

    H            0.000000000000     0.000000000000     1.094026215570
    C            0.000000000000     0.000000000000    -0.091882250497


Scratch directory: /tmp/
gradient() will perform analytic gradient computation.
   => Libint2 <=

    Primary   basis highest AM E, G, H:  6, 6, 3
    Auxiliary basis highest AM E, G, H:  7, 7, 4
    Onebody   basis highest AM E, G, H:  -, -, -
    Solid Harmonics ordering:            Gaussian

*** tstart() called on Joses-MacBook-Pro-2.local
*** at Thu Jul 17 09:11:21 2025

   => Loading Basis Set <=

    Name: CC-PVDZ
    Role: ORBITAL
    Keyword: BASIS
    atoms 1 entry H          line    22 file /Users/joseantoniorodriguesromero/anaconda3/share/psi4/basis/cc-pvdz.gbs 
    atoms 2 entry C          line   138 file /Users/joseantoniorodriguesromero/anaconda3/share/psi4/basis/cc-pvdz.gbs 


         ---------------------------------------------------------
                                   SCF
               by Justin Turney, Rob Parrish, Andy Simmonett
                          and Daniel G. A. Smith
                              UKS Reference
                        1 Threads,    500 MiB Core
         ---------------------------------------------------------

  ==> Geometry <==

    Molecular point group: c2v
    Full point group: C_inf_v

    Geometry (in Angstrom), charge = -1, multiplicity = 3:

       Center              X                  Y                   Z               Mass       
    ------------   -----------------  -----------------  -----------------  -----------------
         H            0.000000000000     0.000000000000     1.094026215570     1.007825032230
         C            0.000000000000     0.000000000000    -0.091882250497    12.000000000000

  Running in c2v symmetry.

  Rotational constants: A = ************  B =     12.89236  C =     12.89236 [cm^-1]
  Rotational constants: A = ************  B = 386503.25868  C = 386503.25868 [MHz]
  Nuclear repulsion =    2.677325742136677

  Charge       = -1
  Multiplicity = 3
  Electrons    = 8
  Nalpha       = 5
  Nbeta        = 3

  ==> Algorithm <==

  SCF Algorithm Type is DF.
  DIIS enabled.
  MOM disabled.
  Fractional occupation disabled.
  Guess Type is READ.
  Energy threshold   = 1.00e-08
  Density threshold  = 1.00e-08
  Integral threshold = 1.00e-12

  ==> Primary Basis <==

  Basis Set: CC-PVDZ
    Blend: CC-PVDZ
    Number of shells: 9
    Number of basis functions: 19
    Number of Cartesian functions: 20
    Spherical Harmonics?: true
    Max angular momentum: 2

  ==> DFT Potential <==

   => LibXC <=

    Version 6.2.2
    S. Lehtola, C. Steigemann, M. J.T. Oliveira, and M. A.L. Marques.,  SoftwareX 7, 1–5 (2018) (10.1016/j.softx.2017.11.002)

   => Composite Functional: B3LYP <= 

    B3LYP Hyb-GGA Exchange-Correlation Functional

    P. J. Stephens, F. J. Devlin, C. F. Chabalowski, and M. J. Frisch.,  J. Phys. Chem. 98, 11623 (1994) (10.1021/j100096a001)

    Deriv               =              1
    GGA                 =           TRUE
    Meta                =          FALSE

    Exchange Hybrid     =           TRUE
    MP2 Hybrid          =          FALSE

   => Exchange Functionals <=

    0.0800   Slater exchange
    0.7200         Becke 88

   => Exact (HF) Exchange <=

    0.2000               HF 

   => Correlation Functionals <=

    0.1900   Vosko, Wilk & Nusair (VWN5_RPA)
    0.8100   Lee, Yang & Parr

   => LibXC Density Thresholds  <==

    XC_HYB_GGA_XC_B3LYP:  1.00E-15 

   => Molecular Quadrature <=

    Radial Scheme          =       TREUTLER
    Pruning Scheme         =           NONE
    Nuclear Scheme         =       TREUTLER

    Blocking Scheme        =         OCTREE
    BS radius alpha        =              1
    Pruning alpha          =              1
    Radial Points          =             75
    Spherical Points       =            302
    Total Points           =          43741
    Total Blocks           =            386
    Max Points             =            256
    Max Functions          =             19
    Weights Tolerance      =       1.00E-15

   => Loading Basis Set <=

    Name: (CC-PVDZ AUX)
    Role: JKFIT
    Keyword: DF_BASIS_SCF
    atoms 1 entry H          line    51 file /Users/joseantoniorodriguesromero/anaconda3/share/psi4/basis/cc-pvdz-jkfit.gbs 
    atoms 2 entry C          line   121 file /Users/joseantoniorodriguesromero/anaconda3/share/psi4/basis/cc-pvdz-jkfit.gbs 

   => Loading Basis Set <=

    Name: CC-PVDZ
    Role: ORBITAL
    Keyword: BASIS
    atoms 1 entry H          line    22 file /Users/joseantoniorodriguesromero/anaconda3/share/psi4/basis/cc-pvdz.gbs 
    atoms 2 entry C          line   138 file /Users/joseantoniorodriguesromero/anaconda3/share/psi4/basis/cc-pvdz.gbs 

  Reading orbitals from file /tmp/triplet_HC.default.71735.180.npy, no projection.

  ==> Integral Setup <==

  DFHelper Memory: AOs need 0.000 GiB; user supplied 0.342 GiB. 
  Using in-core AOs.

  ==> MemDFJK: Density-Fitted J/K Matrices <==

    J tasked:                   Yes
    K tasked:                   Yes
    wK tasked:                   No
    OpenMP threads:               1
    Memory [MiB]:               349
    Algorithm:                 Core
    Schwarz Cutoff:           1E-12
    Mask sparsity (%):       0.0000
    Fitting Condition:        1E-10

   => Auxiliary Basis Set <=

  Basis Set: (CC-PVDZ AUX)
    Blend: CC-PVDZ-JKFIT
    Number of shells: 33
    Number of basis functions: 93
    Number of Cartesian functions: 106
    Spherical Harmonics?: true
    Max angular momentum: 3

  Cached 100.0% of DFT collocation blocks in 0.024 [GiB].

  Minimum eigenvalue in the overlap matrix is 4.3055286003E-02.
  Reciprocal condition number of the overlap matrix is 1.4319142958E-02.
    Using symmetric orthogonalization.

  ==> Pre-Iterations <==

  SCF Guess: Orbitals guess was supplied from a previous computation.

   -------------------------------------------------------
    Irrep   Nso     Nmo     Nalpha   Nbeta   Ndocc  Nsocc
   -------------------------------------------------------
     A1        10      10       3       3       3       0
     A2         1       1       0       0       0       0
     B1         4       4       1       0       0       1
     B2         4       4       1       0       0       1
   -------------------------------------------------------
    Total      19      19       5       3       3       2
   -------------------------------------------------------

  ==> Iterations <==

                           Total Energy        Delta E     RMS |[F,P]|

   @DF-UKS iter   0:   -38.49983435269595   -3.84998e+01   4.62494e-04 
   @DF-UKS iter   1:   -38.49920742996282    6.26923e-04   8.86808e-05 DIIS
   @DF-UKS iter   2:   -38.49920777905276   -3.49090e-07   6.44659e-05 DIIS/DAMP=1%
   @DF-UKS iter   3:   -38.49919440497941    1.33741e-05   1.10512e-05 DIIS/DAMP=1%
   @DF-UKS iter   4:   -38.49921096744260   -1.65625e-05   7.38925e-07 DIIS/DAMP=1%
   @DF-UKS iter   5:   -38.49920801502045    2.95242e-06   1.40509e-07 DIIS/DAMP=1%
   @DF-UKS iter   6:   -38.49920819511950   -1.80099e-07   3.23495e-08 DIIS/DAMP=1%
   @DF-UKS iter   7:   -38.49920816699490    2.81246e-08   8.52588e-09 DIIS/DAMP=1%
   @DF-UKS iter   8:   -38.49920816678937    2.05524e-10   1.62790e-09 DIIS/DAMP=1%
  Energy and wave function converged.


  ==> Post-Iterations <==

   Electrons on quadrature grid:
      Nalpha   =    4.9999999863 ; deviation = -1.374e-08
      Nbeta    =    2.9999999785 ; deviation = -2.146e-08
      Ntotal   =    7.9999999648 ; deviation = -3.521e-08 

   @Spin Contamination Metric:   5.298851899E-03
   @S^2 Expected:                2.000000000E+00
   @S^2 Observed:                2.005298852E+00
   @S   Expected:                1.000000000E+00
   @S   Observed:                1.000000000E+00

    Orbital Energies [Eh]
    ---------------------

    Alpha Occupied:                                                       

       1A1    -9.861768     2A1    -0.273769     3A1     0.034957  
       1B2     0.112874     1B1     0.112874  

    Alpha Virtual:                                                        

       4A1     0.346971     5A1     0.760418     2B1     0.785614  
       2B2     0.785614     6A1     0.843032     7A1     1.027919  
       3B2     1.339874     3B1     1.339874     1A2     1.488266  
       8A1     1.488266     9A1     1.853072     4B1     2.030899  
       4B2     2.030899    10A1     2.579143  

    Beta Occupied:                                                        

       1A1    -9.839626     2A1    -0.199678     3A1     0.071292  

    Beta Virtual:                                                         

       1B2     0.282005     1B1     0.282005     4A1     0.360379  
       5A1     0.778878     6A1     0.862070     2B1     0.868710  
       2B2     0.868710     7A1     1.080665     3B2     1.378220  
       3B1     1.378220     8A1     1.599789     1A2     1.599789  
       9A1     1.889295     4B1     2.059639     4B2     2.059639  
      10A1     2.590915  

    Final Occupation by Irrep:
             A1    A2    B1    B2 
    DOCC [     3,    0,    0,    0 ]
    SOCC [     0,    0,    1,    1 ]
    NA   [     3,    0,    1,    1 ]
    NB   [     3,    0,    0,    0 ]

  @DF-UKS Final Energy:   -38.49920816678937

   => Energetics <=

    Nuclear Repulsion Energy =              2.6773257421366772
    One-Electron Energy =                 -59.0641109847164216
    Two-Electron Energy =                  22.6699295222071839
    DFT Exchange-Correlation Energy =      -4.7823524464168115
    Empirical Dispersion Energy =           0.0000000000000000
    VV10 Nonlocal Energy =                  0.0000000000000000
    Total Energy =                        -38.4992081667893729

  UHF NO Occupations:
  HONO-2 :    3 A1 1.9976524
  HONO-1 :    1 B1 1.0000000
  HONO-0 :    1 B2 1.0000000
  LUNO+0 :    4 A1 0.0023476
  LUNO+1 :    5 A1 0.0003044
  LUNO+2 :    6 A1 0.0000003
  LUNO+3 :    7 A1 0.0000000


Computation Completed


Properties will be evaluated at   0.000000,   0.000000,   0.000000 [a0]

Properties computed using the SCF density matrix


 Multipole Moments:

 ------------------------------------------------------------------------------------
     Multipole            Electronic (a.u.)      Nuclear  (a.u.)        Total (a.u.)
 ------------------------------------------------------------------------------------

 L = 1.  Multiply by 2.5417464519 to convert [e a0] to [Debye]
 Dipole X            :          0.0000000            0.0000000            0.0000000
 Dipole Y            :          0.0000000            0.0000000            0.0000000
 Dipole Z            :         -0.7664430            1.0256162            0.2591732
 Magnitude           :                                                    0.2591732

 ------------------------------------------------------------------------------------

*** tstop() called on Joses-MacBook-Pro-2.local at Thu Jul 17 09:11:21 2025
Module time:
	user time   =       0.81 seconds =       0.01 minutes
	system time =       2.96 seconds =       0.05 minutes
	total time  =          0 seconds =       0.00 minutes
Total time:
	user time   =       3.55 seconds =       0.06 minutes
	system time =      10.45 seconds =       0.17 minutes
	total time  =          2 seconds =       0.03 minutes

*** tstart() called on Joses-MacBook-Pro-2.local
*** at Thu Jul 17 09:11:21 2025


         ------------------------------------------------------------
                                   SCF GRAD                          
                          Rob Parrish, Justin Turney,                
                       Andy Simmonett, and Alex Sokolov              
         ------------------------------------------------------------

  ==> Geometry <==

    Molecular point group: c2v
    Full point group: C_inf_v

    Geometry (in Angstrom), charge = -1, multiplicity = 3:

       Center              X                  Y                   Z               Mass       
    ------------   -----------------  -----------------  -----------------  -----------------
         H            0.000000000000     0.000000000000     1.094026215570     1.007825032230
         C            0.000000000000     0.000000000000    -0.091882250497    12.000000000000

  Nuclear repulsion =    2.677325742136677

  ==> Basis Set <==

  Basis Set: CC-PVDZ
    Blend: CC-PVDZ
    Number of shells: 9
    Number of basis functions: 19
    Number of Cartesian functions: 20
    Spherical Harmonics?: true
    Max angular momentum: 2

  ==> DFJKGrad: Density-Fitted SCF Gradients <==

    Gradient:                    1
    J tasked:                  Yes
    K tasked:                  Yes
    wK tasked:                  No
    OpenMP threads:              1
    Integrals threads:           1
    Memory [MiB]:              375
    Schwarz Cutoff:          1E-12
    Fitting Condition:       1E-10

   => Auxiliary Basis Set <=

  Basis Set: (CC-PVDZ AUX)
    Blend: CC-PVDZ-JKFIT
    Number of shells: 33
    Number of basis functions: 93
    Number of Cartesian functions: 106
    Spherical Harmonics?: true
    Max angular momentum: 3

  ==> DFT Potential <==

   => LibXC <=

    Version 6.2.2
    S. Lehtola, C. Steigemann, M. J.T. Oliveira, and M. A.L. Marques.,  SoftwareX 7, 1–5 (2018) (10.1016/j.softx.2017.11.002)

   => Composite Functional: B3LYP <= 

    B3LYP Hyb-GGA Exchange-Correlation Functional

    P. J. Stephens, F. J. Devlin, C. F. Chabalowski, and M. J. Frisch.,  J. Phys. Chem. 98, 11623 (1994) (10.1021/j100096a001)

    Deriv               =              1
    GGA                 =           TRUE
    Meta                =          FALSE

    Exchange Hybrid     =           TRUE
    MP2 Hybrid          =          FALSE

   => Exchange Functionals <=

    0.0800   Slater exchange
    0.7200         Becke 88

   => Exact (HF) Exchange <=

    0.2000               HF 

   => Correlation Functionals <=

    0.1900   Vosko, Wilk & Nusair (VWN5_RPA)
    0.8100   Lee, Yang & Parr

   => LibXC Density Thresholds  <==

    XC_HYB_GGA_XC_B3LYP:  1.00E-15 

   => Molecular Quadrature <=

    Radial Scheme          =       TREUTLER
    Pruning Scheme         =           NONE
    Nuclear Scheme         =       TREUTLER

    Blocking Scheme        =         OCTREE
    BS radius alpha        =              1
    Pruning alpha          =              1
    Radial Points          =             75
    Spherical Points       =            302
    Total Points           =          43741
    Total Blocks           =            386
    Max Points             =            256
    Max Functions          =             19
    Weights Tolerance      =       1.00E-15


  -Total Gradient:
     Atom            X                  Y                   Z
    ------   -----------------  -----------------  -----------------
       1        0.000000000000    -0.000000000000    -0.000060462351
       2       -0.000000000000    -0.000000000000     0.000060579592


*** tstop() called on Joses-MacBook-Pro-2.local at Thu Jul 17 09:11:21 2025
Module time:
	user time   =       0.29 seconds =       0.00 minutes
	system time =       0.93 seconds =       0.02 minutes
	total time  =          0 seconds =       0.00 minutes
Total time:
	user time   =       3.84 seconds =       0.06 minutes
	system time =      11.38 seconds =       0.19 minutes
	total time  =          2 seconds =       0.03 minutes

    			-----------------------------------------

    			 OPTKING 3.0: for geometry optimizations 

    			     By R.A. King, Bethel University     

    			        with contributions from          

    			    A.V. Copan, J. Cayton, A. Heide      

    			-----------------------------------------

    
	                            ===> Fragment 1 <== 

	 Z (Atomic Numbers)          Masses                          Geom                  
	       1.000000             1.007825          0.00000000  0.00000000  2.06740992   
	       6.000000            12.000000          0.00000000  0.00000000 -0.17363229   

	 - Coordinate -           - BOHR/RAD -       - ANG/DEG -
	 R(1,2)           =         2.241042           1.185908


	        --- Internal Coordinate Step in ANG or DEG, aJ/ANG or AJ/DEG ---
	-------------------------------------------------------------------------------
	           Coordinate      Previous         Force          Change          New 
	           ----------      --------        ------          ------        ------
	               R(1,2)       1.18591        0.00050        0.00018       1.18608
	-------------------------------------------------------------------------------

	                                 ==> Convergence Check <==                                  
    
	Measures of convergence in internal coordinates in au.
    
	Criteria marked as inactive (o), active & met (*), and active & unmet ( ).

	----------------------------------------------------------------------------------------------
	   Step    Total Energy     Delta E     Max Force     RMS Force      Max Disp      RMS Disp   
	----------------------------------------------------------------------------------------------
	  Convergence Criteria     1.00e-06 *    3.00e-04 *             o    1.20e-03 *             o
	----------------------------------------------------------------------------------------------
	     3     -38.49920817   -4.51e-06      6.05e-05 *    6.05e-05 o    3.33e-04 *    3.33e-04 o  ~
	----------------------------------------------------------------------------------------------

Next Geometry in Ang 
	Fragment 1 (Ang)

	    H   0.0000000000   0.0000000000   1.0941142219
	    C   0.0000000000   0.0000000000  -0.0919702568


    Final optimized geometry and variables:
    Molecular point group: c2v
    Full point group: C_inf_v

    Geometry (in Angstrom), charge = -1, multiplicity = 3:

    H            0.000000000000     0.000000000000     1.094026215570
    C            0.000000000000     0.000000000000    -0.091882250497


    Psi4 stopped on: Thursday, 17 July 2025 09:11AM
    Psi4 wall time for execution: 0:00:02.38

*** Psi4 exiting successfully. Buy a developer a beer!
