
    -----------------------------------------------------------------------
          Psi4: An Open-Source Ab Initio Electronic Structure Package
                               Psi4 1.9.1 release

                         Git: Rev {} zzzzzzz 


    D. G. A. Smith, L. A. Burns, A. C. Simmonett, R. M. Parrish,
    M. C. Schieber, R. Galvelis, P. Kraus, H. Kruse, R. Di Remigio,
    A. Alenaizan, A. M. James, S. Lehtola, J. P. Misiewicz, M. Scheurer,
    R. A. Shaw, J. B. Schriber, Y. Xie, Z. L. Glick, D. A. Sirianni,
    J. S. O'Brien, J. M. Waldrop, A. Kumar, E. G. Hohenstein,
    B. P. Pritchard, B. R. Brooks, H. F. Schaefer III, A. Yu. Sokolov,
    K. Patkowski, A. E. DePrince III, U. Bozkaya, R. A. King,
    F. A. Evangelista, J. M. Turney, T. D. Crawford, C. D. Sherrill,
    J. Chem. Phys. 152(18) 184108 (2020). https://doi.org/10.1063/5.0006002

                            Additional Code Authors
    E. T. Seidl, C. L. Janssen, E. F. Valeev, M. L. Leininger,
    J. F. Gonthier, R. M. Richard, H. R. McAlexander, M. Saitow, X. Wang,
    P. Verma, M. H. Lechner, A. Jiang, S. Behnle, A. G. Heide,
    M. F. Herbst, and D. L. Poole

             Previous Authors, Complete List of Code Contributors,
                       and Citations for Specific Modules
    https://github.com/psi4/psi4/blob/master/codemeta.json
    https://github.com/psi4/psi4/graphs/contributors
    http://psicode.org/psi4manual/master/introduction.html#citing-psifour

    -----------------------------------------------------------------------


    Psi4 started on: Thursday, 17 July 2025 09:09AM

    Process ID: 71710
    Host:       Joses-MacBook-Pro-2.local
    PSIDATADIR: /Users/joseantoniorodriguesromero/anaconda3/share/psi4
    Memory:     500.0 MiB
    Threads:    1
    
  ==> Input File <==

--------------------------------------------------------------------------
molecule { 
-1 3
H   0.00000        0.60000        0.00000
He   0.00000       -0.60000        0.00000
}

set { 
basis              cc-pvdz
reference          uks
maxiter            500
geom_maxiter       500
DAMPING_PERCENTAGE 1
guess              SAP
}

optimize('b3lyp')
--------------------------------------------------------------------------

Scratch directory: /tmp/
gradient() will perform analytic gradient computation.
   => Libint2 <=

    Primary   basis highest AM E, G, H:  6, 6, 3
    Auxiliary basis highest AM E, G, H:  7, 7, 4
    Onebody   basis highest AM E, G, H:  -, -, -
    Solid Harmonics ordering:            Gaussian

*** tstart() called on Joses-MacBook-Pro-2.local
*** at Thu Jul 17 09:09:43 2025

   => Loading Basis Set <=

    Name: CC-PVDZ
    Role: ORBITAL
    Keyword: BASIS
    atoms 1 entry H          line    22 file /Users/joseantoniorodriguesromero/anaconda3/share/psi4/basis/cc-pvdz.gbs 
    atoms 2 entry HE         line    32 file /Users/joseantoniorodriguesromero/anaconda3/share/psi4/basis/cc-pvdz.gbs 


         ---------------------------------------------------------
                                   SCF
               by Justin Turney, Rob Parrish, Andy Simmonett
                          and Daniel G. A. Smith
                              UKS Reference
                        1 Threads,    500 MiB Core
         ---------------------------------------------------------

  ==> Geometry <==

    Molecular point group: c2v
    Full point group: C_inf_v

    Geometry (in Angstrom), charge = -1, multiplicity = 3:

       Center              X                  Y                   Z               Mass       
    ------------   -----------------  -----------------  -----------------  -----------------
         H            0.000000000000     0.000000000000     0.958625416919     1.007825032230
         HE           0.000000000000     0.000000000000    -0.241374583081     4.002603254130

  Running in c2v symmetry.

  Rotational constants: A = ************  B =     14.54056  C =     14.54056 [cm^-1]
  Rotational constants: A = ************  B = 435915.05923  C = 435915.05923 [MHz]
  Nuclear repulsion =    0.881962017783333

  Charge       = -1
  Multiplicity = 3
  Electrons    = 4
  Nalpha       = 3
  Nbeta        = 1

  ==> Algorithm <==

  SCF Algorithm Type is DF.
  DIIS enabled.
  MOM disabled.
  Fractional occupation disabled.
  Guess Type is SAP.
  Energy threshold   = 1.00e-08
  Density threshold  = 1.00e-08
  Integral threshold = 1.00e-12

  ==> Primary Basis <==

  Basis Set: CC-PVDZ
    Blend: CC-PVDZ
    Number of shells: 6
    Number of basis functions: 10
    Number of Cartesian functions: 10
    Spherical Harmonics?: true
    Max angular momentum: 1

  ==> DFT Potential <==

   => LibXC <=

    Version 6.2.2
    S. Lehtola, C. Steigemann, M. J.T. Oliveira, and M. A.L. Marques.,  SoftwareX 7, 1–5 (2018) (10.1016/j.softx.2017.11.002)

   => Composite Functional: B3LYP <= 

    B3LYP Hyb-GGA Exchange-Correlation Functional

    P. J. Stephens, F. J. Devlin, C. F. Chabalowski, and M. J. Frisch.,  J. Phys. Chem. 98, 11623 (1994) (10.1021/j100096a001)

    Deriv               =              1
    GGA                 =           TRUE
    Meta                =          FALSE

    Exchange Hybrid     =           TRUE
    MP2 Hybrid          =          FALSE

   => Exchange Functionals <=

    0.0800   Slater exchange
    0.7200         Becke 88

   => Exact (HF) Exchange <=

    0.2000               HF 

   => Correlation Functionals <=

    0.1900   Vosko, Wilk & Nusair (VWN5_RPA)
    0.8100   Lee, Yang & Parr

   => LibXC Density Thresholds  <==

    XC_HYB_GGA_XC_B3LYP:  1.00E-15 

   => Molecular Quadrature <=

    Radial Scheme          =       TREUTLER
    Pruning Scheme         =           NONE
    Nuclear Scheme         =       TREUTLER

    Blocking Scheme        =         OCTREE
    BS radius alpha        =              1
    Pruning alpha          =              1
    Radial Points          =             75
    Spherical Points       =            302
    Total Points           =          44656
    Total Blocks           =            388
    Max Points             =            253
    Max Functions          =             10
    Weights Tolerance      =       1.00E-15

   => Loading Basis Set <=

    Name: (CC-PVDZ AUX)
    Role: JKFIT
    Keyword: DF_BASIS_SCF
    atoms 1 entry H          line    51 file /Users/joseantoniorodriguesromero/anaconda3/share/psi4/basis/cc-pvdz-jkfit.gbs 
    atoms 2 entry HE         line    34 file /Users/joseantoniorodriguesromero/anaconda3/share/psi4/basis/def2-universal-jkfit.gbs 

  ==> Integral Setup <==

  DFHelper Memory: AOs need 0.000 GiB; user supplied 0.353 GiB. 
  Using in-core AOs.

  ==> MemDFJK: Density-Fitted J/K Matrices <==

    J tasked:                   Yes
    K tasked:                   Yes
    wK tasked:                   No
    OpenMP threads:               1
    Memory [MiB]:               361
    Algorithm:                 Core
    Schwarz Cutoff:           1E-12
    Mask sparsity (%):       0.0000
    Fitting Condition:        1E-10

   => Auxiliary Basis Set <=

  Basis Set: (CC-PVDZ AUX)
    Blend: CC-PVDZ-JKFIT + DEF2-UNIVERSAL-JKFIT
    Number of shells: 18
    Number of basis functions: 46
    Number of Cartesian functions: 50
    Spherical Harmonics?: true
    Max angular momentum: 2

  Cached 100.0% of DFT collocation blocks in 0.013 [GiB].

  Minimum eigenvalue in the overlap matrix is 1.9579717983E-01.
  Reciprocal condition number of the overlap matrix is 8.2040646254E-02.
    Using symmetric orthogonalization.

  ==> Pre-Iterations <==

  SCF Guess: Superposition of Atomic Potentials (doi:10.1021/acs.jctc.8b01089).

  ==> SAP guess <==

   => Molecular Quadrature <=

    Radial Scheme          =       TREUTLER
    Pruning Scheme         =           NONE
    Nuclear Scheme         =       TREUTLER

    Blocking Scheme        =         OCTREE
    BS radius alpha        =              1
    Pruning alpha          =              1
    Radial Points          =             75
    Spherical Points       =            302
    Total Points           =          44656
    Total Blocks           =            388
    Max Points             =            253
    Max Functions          =             10
    Weights Tolerance      =       1.00E-15

   -------------------------------------------------------
    Irrep   Nso     Nmo     Nalpha   Nbeta   Ndocc  Nsocc
   -------------------------------------------------------
     A1         6       6       3       1       1       2
     A2         0       0       0       0       0       0
     B1         2       2       0       0       0       0
     B2         2       2       0       0       0       0
   -------------------------------------------------------
    Total      10      10       3       1       1       2
   -------------------------------------------------------

  ==> Iterations <==

                           Total Energy        Delta E     RMS |[F,P]|

   @DF-UKS iter   1:    -2.80310529172200   -2.80311e+00   3.02813e-02 DIIS/ADIIS
   @DF-UKS iter   2:    -2.82986074750145   -2.67555e-02   4.95824e-03 DIIS/ADIIS/DAMP=1%
   @DF-UKS iter   3:    -2.83038462587930   -5.23878e-04   6.67355e-04 DIIS/ADIIS/DAMP=1%
   @DF-UKS iter   4:    -2.83030348198866    8.11439e-05   1.61910e-04 DIIS/ADIIS/DAMP=1%
   @DF-UKS iter   5:    -2.83032419473099   -2.07127e-05   1.75466e-05 DIIS/DAMP=1%
   @DF-UKS iter   6:    -2.83032047410433    3.72063e-06   1.29830e-06 DIIS/DAMP=1%
   @DF-UKS iter   7:    -2.83032065874911   -1.84645e-07   1.21582e-07 DIIS/DAMP=1%
   @DF-UKS iter   8:    -2.83032063652830    2.22208e-08   7.28018e-09 DIIS/DAMP=1%
   @DF-UKS iter   9:    -2.83032063855007   -2.02176e-09   1.89062e-10 DIIS/DAMP=1%
  Energy and wave function converged.


  ==> Post-Iterations <==

   Electrons on quadrature grid:
      Nalpha   =    3.0000000194 ; deviation = 1.942e-08
      Nbeta    =    1.0000000301 ; deviation = 3.007e-08
      Ntotal   =    4.0000000495 ; deviation = 4.949e-08 

   @Spin Contamination Metric:   7.050352217E-05
   @S^2 Expected:                2.000000000E+00
   @S^2 Observed:                2.000070504E+00
   @S   Expected:                1.000000000E+00
   @S   Observed:                1.000000000E+00

    Orbital Energies [Eh]
    ---------------------

    Alpha Occupied:                                                       

       1A1    -0.389948     2A1     0.159515     3A1     0.691466  

    Alpha Virtual:                                                        

       4A1     1.488250     1B1     1.657897     1B2     1.657897  
       5A1     1.715486     2B1     2.530025     2B2     2.530025  
       6A1     3.187754  

    Beta Occupied:                                                        

       1A1    -0.366485  

    Beta Virtual:                                                         

       2A1     0.370953     3A1     1.038192     4A1     1.502044  
       1B1     1.799220     1B2     1.799220     5A1     1.833976  
       2B1     2.549129     2B2     2.549129     6A1     3.252588  

    Final Occupation by Irrep:
             A1    A2    B1    B2 
    DOCC [     1,    0,    0,    0 ]
    SOCC [     2,    0,    0,    0 ]
    NA   [     3,    0,    0,    0 ]
    NB   [     1,    0,    0,    0 ]

  @DF-UKS Final Energy:    -2.83032063855007

   => Energetics <=

    Nuclear Repulsion Energy =              0.8819620177833335
    One-Electron Energy =                  -6.4762028122343285
    Two-Electron Energy =                   4.2065298332428558
    DFT Exchange-Correlation Energy =      -1.4426096773419295
    Empirical Dispersion Energy =           0.0000000000000000
    VV10 Nonlocal Energy =                  0.0000000000000000
    Total Energy =                         -2.8303206385500683

  UHF NO Occupations:
  HONO-2 :    1 A1 1.9999647
  HONO-1 :    2 A1 1.0000000
  HONO-0 :    3 A1 1.0000000
  LUNO+0 :    4 A1 0.0000353
  LUNO+1 :    5 A1 0.0000000
  LUNO+2 :    6 A1 0.0000000
  LUNO+3 :    2 B2 0.0000000


Computation Completed


Properties will be evaluated at   0.000000,   0.000000,   0.000000 [a0]

Properties computed using the SCF density matrix


 Multipole Moments:

 ------------------------------------------------------------------------------------
     Multipole            Electronic (a.u.)      Nuclear  (a.u.)        Total (a.u.)
 ------------------------------------------------------------------------------------

 L = 1.  Multiply by 2.5417464519 to convert [e a0] to [Debye]
 Dipole X            :          0.0000000            0.0000000            0.0000000
 Dipole Y            :          0.0000000            0.0000000            0.0000000
 Dipole Z            :         -3.1543865            0.8992758           -2.2551107
 Magnitude           :                                                    2.2551107

 ------------------------------------------------------------------------------------

*** tstop() called on Joses-MacBook-Pro-2.local at Thu Jul 17 09:09:44 2025
Module time:
	user time   =       1.88 seconds =       0.03 minutes
	system time =       0.71 seconds =       0.01 minutes
	total time  =          1 seconds =       0.02 minutes
Total time:
	user time   =       1.88 seconds =       0.03 minutes
	system time =       0.71 seconds =       0.01 minutes
	total time  =          1 seconds =       0.02 minutes

*** tstart() called on Joses-MacBook-Pro-2.local
*** at Thu Jul 17 09:09:44 2025


         ------------------------------------------------------------
                                   SCF GRAD                          
                          Rob Parrish, Justin Turney,                
                       Andy Simmonett, and Alex Sokolov              
         ------------------------------------------------------------

  ==> Geometry <==

    Molecular point group: c2v
    Full point group: C_inf_v

    Geometry (in Angstrom), charge = -1, multiplicity = 3:

       Center              X                  Y                   Z               Mass       
    ------------   -----------------  -----------------  -----------------  -----------------
         H            0.000000000000     0.000000000000     0.958625416919     1.007825032230
         HE           0.000000000000     0.000000000000    -0.241374583081     4.002603254130

  Nuclear repulsion =    0.881962017783333

  ==> Basis Set <==

  Basis Set: CC-PVDZ
    Blend: CC-PVDZ
    Number of shells: 6
    Number of basis functions: 10
    Number of Cartesian functions: 10
    Spherical Harmonics?: true
    Max angular momentum: 1

  ==> DFJKGrad: Density-Fitted SCF Gradients <==

    Gradient:                    1
    J tasked:                  Yes
    K tasked:                  Yes
    wK tasked:                  No
    OpenMP threads:              1
    Integrals threads:           1
    Memory [MiB]:              375
    Schwarz Cutoff:          1E-12
    Fitting Condition:       1E-10

   => Auxiliary Basis Set <=

  Basis Set: (CC-PVDZ AUX)
    Blend: CC-PVDZ-JKFIT + DEF2-UNIVERSAL-JKFIT
    Number of shells: 18
    Number of basis functions: 46
    Number of Cartesian functions: 50
    Spherical Harmonics?: true
    Max angular momentum: 2

  ==> DFT Potential <==

   => LibXC <=

    Version 6.2.2
    S. Lehtola, C. Steigemann, M. J.T. Oliveira, and M. A.L. Marques.,  SoftwareX 7, 1–5 (2018) (10.1016/j.softx.2017.11.002)

   => Composite Functional: B3LYP <= 

    B3LYP Hyb-GGA Exchange-Correlation Functional

    P. J. Stephens, F. J. Devlin, C. F. Chabalowski, and M. J. Frisch.,  J. Phys. Chem. 98, 11623 (1994) (10.1021/j100096a001)

    Deriv               =              1
    GGA                 =           TRUE
    Meta                =          FALSE

    Exchange Hybrid     =           TRUE
    MP2 Hybrid          =          FALSE

   => Exchange Functionals <=

    0.0800   Slater exchange
    0.7200         Becke 88

   => Exact (HF) Exchange <=

    0.2000               HF 

   => Correlation Functionals <=

    0.1900   Vosko, Wilk & Nusair (VWN5_RPA)
    0.8100   Lee, Yang & Parr

   => LibXC Density Thresholds  <==

    XC_HYB_GGA_XC_B3LYP:  1.00E-15 

   => Molecular Quadrature <=

    Radial Scheme          =       TREUTLER
    Pruning Scheme         =           NONE
    Nuclear Scheme         =       TREUTLER

    Blocking Scheme        =         OCTREE
    BS radius alpha        =              1
    Pruning alpha          =              1
    Radial Points          =             75
    Spherical Points       =            302
    Total Points           =          44656
    Total Blocks           =            388
    Max Points             =            253
    Max Functions          =             10
    Weights Tolerance      =       1.00E-15


  -Total Gradient:
     Atom            X                  Y                   Z
    ------   -----------------  -----------------  -----------------
       1        0.000000000000    -0.000000000000    -0.004964004845
       2        0.000000000000     0.000000000000     0.004962724871


*** tstop() called on Joses-MacBook-Pro-2.local at Thu Jul 17 09:09:44 2025
Module time:
	user time   =       0.27 seconds =       0.00 minutes
	system time =       0.21 seconds =       0.00 minutes
	total time  =          0 seconds =       0.00 minutes
Total time:
	user time   =       2.15 seconds =       0.04 minutes
	system time =       0.92 seconds =       0.02 minutes
	total time  =          1 seconds =       0.02 minutes

    			-----------------------------------------

    			 OPTKING 3.0: for geometry optimizations 

    			     By R.A. King, Bethel University     

    			        with contributions from          

    			    A.V. Copan, J. Cayton, A. Heide      

    			-----------------------------------------

    
	                            ===> Fragment 1 <== 

	 Z (Atomic Numbers)          Masses                          Geom                  
	       1.000000             1.007825          0.00000000  0.00000000  1.81153949   
	       2.000000             4.002603          0.00000000  0.00000000 -0.45613186   

	 - Coordinate -           - BOHR/RAD -       - ANG/DEG -
	 R(1,2)           =         2.267671           1.200000


	        --- Internal Coordinate Step in ANG or DEG, aJ/ANG or AJ/DEG ---
	-------------------------------------------------------------------------------
	           Coordinate      Previous         Force          Change          New 
	           ----------      --------        ------          ------        ------
	               R(1,2)       1.20000        0.04089        0.02395       1.22395
	-------------------------------------------------------------------------------

	                                 ==> Convergence Check <==                                  
    
	Measures of convergence in internal coordinates in au.
    
	Criteria marked as inactive (o), active & met (*), and active & unmet ( ).

	----------------------------------------------------------------------------------------------
	   Step    Total Energy     Delta E     Max Force     RMS Force      Max Disp      RMS Disp   
	----------------------------------------------------------------------------------------------
	  Convergence Criteria     1.00e-06 *    3.00e-04 *             o    1.20e-03 *             o
	----------------------------------------------------------------------------------------------
	     1      -2.83032064   -2.83e+00      4.96e-03      4.96e-03 o    4.53e-02      4.53e-02 o  ~
	----------------------------------------------------------------------------------------------

Next Geometry in Ang 
	Fragment 1 (Ang)

	    H   0.0000000000   0.0000000000   0.9706009840
	   He   0.0000000000   0.0000000000  -0.2533501502


    Structure for next step:
    Molecular point group: c2v
    Full point group: C_inf_v

    Geometry (in Angstrom), charge = -1, multiplicity = 3:

    H            0.000000000000     0.000000000000     0.977758888552
    HE           0.000000000000     0.000000000000    -0.246192245597


Scratch directory: /tmp/
gradient() will perform analytic gradient computation.
   => Libint2 <=

    Primary   basis highest AM E, G, H:  6, 6, 3
    Auxiliary basis highest AM E, G, H:  7, 7, 4
    Onebody   basis highest AM E, G, H:  -, -, -
    Solid Harmonics ordering:            Gaussian

*** tstart() called on Joses-MacBook-Pro-2.local
*** at Thu Jul 17 09:09:44 2025

   => Loading Basis Set <=

    Name: CC-PVDZ
    Role: ORBITAL
    Keyword: BASIS
    atoms 1 entry H          line    22 file /Users/joseantoniorodriguesromero/anaconda3/share/psi4/basis/cc-pvdz.gbs 
    atoms 2 entry HE         line    32 file /Users/joseantoniorodriguesromero/anaconda3/share/psi4/basis/cc-pvdz.gbs 


         ---------------------------------------------------------
                                   SCF
               by Justin Turney, Rob Parrish, Andy Simmonett
                          and Daniel G. A. Smith
                              UKS Reference
                        1 Threads,    500 MiB Core
         ---------------------------------------------------------

  ==> Geometry <==

    Molecular point group: c2v
    Full point group: C_inf_v

    Geometry (in Angstrom), charge = -1, multiplicity = 3:

       Center              X                  Y                   Z               Mass       
    ------------   -----------------  -----------------  -----------------  -----------------
         H            0.000000000000     0.000000000000     0.977758888552     1.007825032230
         HE           0.000000000000     0.000000000000    -0.246192245597     4.002603254130

  Running in c2v symmetry.

  Rotational constants: A = ************  B =     13.97705  C =     13.97705 [cm^-1]
  Rotational constants: A = ************  B = 419021.40279  C = 419021.40279 [MHz]
  Nuclear repulsion =    0.864703166500310

  Charge       = -1
  Multiplicity = 3
  Electrons    = 4
  Nalpha       = 3
  Nbeta        = 1

  ==> Algorithm <==

  SCF Algorithm Type is DF.
  DIIS enabled.
  MOM disabled.
  Fractional occupation disabled.
  Guess Type is READ.
  Energy threshold   = 1.00e-08
  Density threshold  = 1.00e-08
  Integral threshold = 1.00e-12

  ==> Primary Basis <==

  Basis Set: CC-PVDZ
    Blend: CC-PVDZ
    Number of shells: 6
    Number of basis functions: 10
    Number of Cartesian functions: 10
    Spherical Harmonics?: true
    Max angular momentum: 1

  ==> DFT Potential <==

   => LibXC <=

    Version 6.2.2
    S. Lehtola, C. Steigemann, M. J.T. Oliveira, and M. A.L. Marques.,  SoftwareX 7, 1–5 (2018) (10.1016/j.softx.2017.11.002)

   => Composite Functional: B3LYP <= 

    B3LYP Hyb-GGA Exchange-Correlation Functional

    P. J. Stephens, F. J. Devlin, C. F. Chabalowski, and M. J. Frisch.,  J. Phys. Chem. 98, 11623 (1994) (10.1021/j100096a001)

    Deriv               =              1
    GGA                 =           TRUE
    Meta                =          FALSE

    Exchange Hybrid     =           TRUE
    MP2 Hybrid          =          FALSE

   => Exchange Functionals <=

    0.0800   Slater exchange
    0.7200         Becke 88

   => Exact (HF) Exchange <=

    0.2000               HF 

   => Correlation Functionals <=

    0.1900   Vosko, Wilk & Nusair (VWN5_RPA)
    0.8100   Lee, Yang & Parr

   => LibXC Density Thresholds  <==

    XC_HYB_GGA_XC_B3LYP:  1.00E-15 

   => Molecular Quadrature <=

    Radial Scheme          =       TREUTLER
    Pruning Scheme         =           NONE
    Nuclear Scheme         =       TREUTLER

    Blocking Scheme        =         OCTREE
    BS radius alpha        =              1
    Pruning alpha          =              1
    Radial Points          =             75
    Spherical Points       =            302
    Total Points           =          44656
    Total Blocks           =            388
    Max Points             =            252
    Max Functions          =             10
    Weights Tolerance      =       1.00E-15

   => Loading Basis Set <=

    Name: (CC-PVDZ AUX)
    Role: JKFIT
    Keyword: DF_BASIS_SCF
    atoms 1 entry H          line    51 file /Users/joseantoniorodriguesromero/anaconda3/share/psi4/basis/cc-pvdz-jkfit.gbs 
    atoms 2 entry HE         line    34 file /Users/joseantoniorodriguesromero/anaconda3/share/psi4/basis/def2-universal-jkfit.gbs 

   => Loading Basis Set <=

    Name: CC-PVDZ
    Role: ORBITAL
    Keyword: BASIS
    atoms 1 entry H          line    22 file /Users/joseantoniorodriguesromero/anaconda3/share/psi4/basis/cc-pvdz.gbs 
    atoms 2 entry HE         line    32 file /Users/joseantoniorodriguesromero/anaconda3/share/psi4/basis/cc-pvdz.gbs 

  Reading orbitals from file /tmp/triplet_HHe.default.71710.180.npy, no projection.

  ==> Integral Setup <==

  DFHelper Memory: AOs need 0.000 GiB; user supplied 0.353 GiB. 
  Using in-core AOs.

  ==> MemDFJK: Density-Fitted J/K Matrices <==

    J tasked:                   Yes
    K tasked:                   Yes
    wK tasked:                   No
    OpenMP threads:               1
    Memory [MiB]:               361
    Algorithm:                 Core
    Schwarz Cutoff:           1E-12
    Mask sparsity (%):       0.0000
    Fitting Condition:        1E-10

   => Auxiliary Basis Set <=

  Basis Set: (CC-PVDZ AUX)
    Blend: CC-PVDZ-JKFIT + DEF2-UNIVERSAL-JKFIT
    Number of shells: 18
    Number of basis functions: 46
    Number of Cartesian functions: 50
    Spherical Harmonics?: true
    Max angular momentum: 2

  Cached 100.0% of DFT collocation blocks in 0.013 [GiB].

  Minimum eigenvalue in the overlap matrix is 1.9897440226E-01.
  Reciprocal condition number of the overlap matrix is 8.4204039660E-02.
    Using symmetric orthogonalization.

  ==> Pre-Iterations <==

  SCF Guess: Orbitals guess was supplied from a previous computation.

   -------------------------------------------------------
    Irrep   Nso     Nmo     Nalpha   Nbeta   Ndocc  Nsocc
   -------------------------------------------------------
     A1         6       6       3       1       1       2
     A2         0       0       0       0       0       0
     B1         2       2       0       0       0       0
     B2         2       2       0       0       0       0
   -------------------------------------------------------
    Total      10      10       3       1       1       2
   -------------------------------------------------------

  ==> Iterations <==

                           Total Energy        Delta E     RMS |[F,P]|

   @DF-UKS iter   0:    -2.82932508756084   -2.82933e+00   1.78139e-03 
   @DF-UKS iter   1:    -2.83046585454134   -1.14077e-03   1.90498e-04 DIIS/ADIIS
   @DF-UKS iter   2:    -2.83046698614472   -1.13160e-06   4.25597e-05 DIIS/DAMP=1%
   @DF-UKS iter   3:    -2.83046793417161   -9.48027e-07   8.76330e-06 DIIS/DAMP=1%
   @DF-UKS iter   4:    -2.83046683145338    1.10272e-06   7.57719e-07 DIIS/DAMP=1%
   @DF-UKS iter   5:    -2.83046703975284   -2.08299e-07   9.88027e-08 DIIS/DAMP=1%
   @DF-UKS iter   6:    -2.83046702581920    1.39336e-08   1.00314e-08 DIIS/DAMP=1%
   @DF-UKS iter   7:    -2.83046702699515   -1.17595e-09   5.21114e-10 DIIS/DAMP=1%
  Energy and wave function converged.


  ==> Post-Iterations <==

   Electrons on quadrature grid:
      Nalpha   =    3.0000000283 ; deviation = 2.830e-08
      Nbeta    =    1.0000000362 ; deviation = 3.615e-08
      Ntotal   =    4.0000000644 ; deviation = 6.445e-08 

   @Spin Contamination Metric:   6.738603052E-05
   @S^2 Expected:                2.000000000E+00
   @S^2 Observed:                2.000067386E+00
   @S   Expected:                1.000000000E+00
   @S   Observed:                1.000000000E+00

    Orbital Energies [Eh]
    ---------------------

    Alpha Occupied:                                                       

       1A1    -0.389220     2A1     0.156464     3A1     0.694454  

    Alpha Virtual:                                                        

       4A1     1.488448     1B1     1.662287     1B2     1.662287  
       5A1     1.701908     2B1     2.521786     2B2     2.521786  
       6A1     3.149781  

    Beta Occupied:                                                        

       1A1    -0.367306  

    Beta Virtual:                                                         

       2A1     0.369746     3A1     1.045184     4A1     1.500962  
       1B1     1.806949     1B2     1.806949     5A1     1.820808  
       2B1     2.539466     2B2     2.539466     6A1     3.213437  

    Final Occupation by Irrep:
             A1    A2    B1    B2 
    DOCC [     1,    0,    0,    0 ]
    SOCC [     2,    0,    0,    0 ]
    NA   [     3,    0,    0,    0 ]
    NB   [     1,    0,    0,    0 ]

  @DF-UKS Final Energy:    -2.83046702699515

   => Energetics <=

    Nuclear Repulsion Energy =              0.8647031665003101
    One-Electron Energy =                  -6.4420915878008076
    Two-Electron Energy =                   4.1890872297498509
    DFT Exchange-Correlation Energy =      -1.4421658354445026
    Empirical Dispersion Energy =           0.0000000000000000
    VV10 Nonlocal Energy =                  0.0000000000000000
    Total Energy =                         -2.8304670269951493

  UHF NO Occupations:
  HONO-2 :    1 A1 1.9999663
  HONO-1 :    2 A1 1.0000000
  HONO-0 :    3 A1 1.0000000
  LUNO+0 :    4 A1 0.0000337
  LUNO+1 :    5 A1 0.0000000
  LUNO+2 :    2 B2 0.0000000
  LUNO+3 :    1 B2 0.0000000


Computation Completed


Properties will be evaluated at   0.000000,   0.000000,   0.000000 [a0]

Properties computed using the SCF density matrix


 Multipole Moments:

 ------------------------------------------------------------------------------------
     Multipole            Electronic (a.u.)      Nuclear  (a.u.)        Total (a.u.)
 ------------------------------------------------------------------------------------

 L = 1.  Multiply by 2.5417464519 to convert [e a0] to [Debye]
 Dipole X            :          0.0000000            0.0000000            0.0000000
 Dipole Y            :          0.0000000            0.0000000            0.0000000
 Dipole Z            :         -3.2037719            0.9172247           -2.2865472
 Magnitude           :                                                    2.2865472

 ------------------------------------------------------------------------------------

*** tstop() called on Joses-MacBook-Pro-2.local at Thu Jul 17 09:09:44 2025
Module time:
	user time   =       0.62 seconds =       0.01 minutes
	system time =       2.37 seconds =       0.04 minutes
	total time  =          0 seconds =       0.00 minutes
Total time:
	user time   =       2.83 seconds =       0.05 minutes
	system time =       3.45 seconds =       0.06 minutes
	total time  =          1 seconds =       0.02 minutes

*** tstart() called on Joses-MacBook-Pro-2.local
*** at Thu Jul 17 09:09:44 2025


         ------------------------------------------------------------
                                   SCF GRAD                          
                          Rob Parrish, Justin Turney,                
                       Andy Simmonett, and Alex Sokolov              
         ------------------------------------------------------------

  ==> Geometry <==

    Molecular point group: c2v
    Full point group: C_inf_v

    Geometry (in Angstrom), charge = -1, multiplicity = 3:

       Center              X                  Y                   Z               Mass       
    ------------   -----------------  -----------------  -----------------  -----------------
         H            0.000000000000     0.000000000000     0.977758888552     1.007825032230
         HE           0.000000000000     0.000000000000    -0.246192245597     4.002603254130

  Nuclear repulsion =    0.864703166500310

  ==> Basis Set <==

  Basis Set: CC-PVDZ
    Blend: CC-PVDZ
    Number of shells: 6
    Number of basis functions: 10
    Number of Cartesian functions: 10
    Spherical Harmonics?: true
    Max angular momentum: 1

  ==> DFJKGrad: Density-Fitted SCF Gradients <==

    Gradient:                    1
    J tasked:                  Yes
    K tasked:                  Yes
    wK tasked:                  No
    OpenMP threads:              1
    Integrals threads:           1
    Memory [MiB]:              375
    Schwarz Cutoff:          1E-12
    Fitting Condition:       1E-10

   => Auxiliary Basis Set <=

  Basis Set: (CC-PVDZ AUX)
    Blend: CC-PVDZ-JKFIT + DEF2-UNIVERSAL-JKFIT
    Number of shells: 18
    Number of basis functions: 46
    Number of Cartesian functions: 50
    Spherical Harmonics?: true
    Max angular momentum: 2

  ==> DFT Potential <==

   => LibXC <=

    Version 6.2.2
    S. Lehtola, C. Steigemann, M. J.T. Oliveira, and M. A.L. Marques.,  SoftwareX 7, 1–5 (2018) (10.1016/j.softx.2017.11.002)

   => Composite Functional: B3LYP <= 

    B3LYP Hyb-GGA Exchange-Correlation Functional

    P. J. Stephens, F. J. Devlin, C. F. Chabalowski, and M. J. Frisch.,  J. Phys. Chem. 98, 11623 (1994) (10.1021/j100096a001)

    Deriv               =              1
    GGA                 =           TRUE
    Meta                =          FALSE

    Exchange Hybrid     =           TRUE
    MP2 Hybrid          =          FALSE

   => Exchange Functionals <=

    0.0800   Slater exchange
    0.7200         Becke 88

   => Exact (HF) Exchange <=

    0.2000               HF 

   => Correlation Functionals <=

    0.1900   Vosko, Wilk & Nusair (VWN5_RPA)
    0.8100   Lee, Yang & Parr

   => LibXC Density Thresholds  <==

    XC_HYB_GGA_XC_B3LYP:  1.00E-15 

   => Molecular Quadrature <=

    Radial Scheme          =       TREUTLER
    Pruning Scheme         =           NONE
    Nuclear Scheme         =       TREUTLER

    Blocking Scheme        =         OCTREE
    BS radius alpha        =              1
    Pruning alpha          =              1
    Radial Points          =             75
    Spherical Points       =            302
    Total Points           =          44656
    Total Blocks           =            388
    Max Points             =            252
    Max Functions          =             10
    Weights Tolerance      =       1.00E-15


  -Total Gradient:
     Atom            X                  Y                   Z
    ------   -----------------  -----------------  -----------------
       1       -0.000000000000    -0.000000000000    -0.001583221591
       2       -0.000000000000     0.000000000000     0.001581843016


*** tstop() called on Joses-MacBook-Pro-2.local at Thu Jul 17 09:09:44 2025
Module time:
	user time   =       0.14 seconds =       0.00 minutes
	system time =       0.41 seconds =       0.01 minutes
	total time  =          0 seconds =       0.00 minutes
Total time:
	user time   =       2.97 seconds =       0.05 minutes
	system time =       3.86 seconds =       0.06 minutes
	total time  =          1 seconds =       0.02 minutes

    			-----------------------------------------

    			 OPTKING 3.0: for geometry optimizations 

    			     By R.A. King, Bethel University     

    			        with contributions from          

    			    A.V. Copan, J. Cayton, A. Heide      

    			-----------------------------------------

    
	                            ===> Fragment 1 <== 

	 Z (Atomic Numbers)          Masses                          Geom                  
	       1.000000             1.007825          0.00000000  0.00000000  1.84769652   
	       2.000000             4.002603          0.00000000  0.00000000 -0.46523592   

	 - Coordinate -           - BOHR/RAD -       - ANG/DEG -
	 R(1,2)           =         2.312932           1.223951


	        --- Internal Coordinate Step in ANG or DEG, aJ/ANG or AJ/DEG ---
	-------------------------------------------------------------------------------
	           Coordinate      Previous         Force          Change          New 
	           ----------      --------        ------          ------        ------
	               R(1,2)       1.22395        0.01304        0.01121       1.23516
	-------------------------------------------------------------------------------

	                                 ==> Convergence Check <==                                  
    
	Measures of convergence in internal coordinates in au.
    
	Criteria marked as inactive (o), active & met (*), and active & unmet ( ).

	----------------------------------------------------------------------------------------------
	   Step    Total Energy     Delta E     Max Force     RMS Force      Max Disp      RMS Disp   
	----------------------------------------------------------------------------------------------
	  Convergence Criteria     1.00e-06 *    3.00e-04 *             o    1.20e-03 *             o
	----------------------------------------------------------------------------------------------
	     2      -2.83046703   -1.46e-04      1.58e-03      1.58e-03 o    2.12e-02      2.12e-02 o  ~
	----------------------------------------------------------------------------------------------

Next Geometry in Ang 
	Fragment 1 (Ang)

	    H   0.0000000000   0.0000000000   0.9833620122
	   He   0.0000000000   0.0000000000  -0.2517953692


    Structure for next step:
    Molecular point group: c2v
    Full point group: C_inf_v

    Geometry (in Angstrom), charge = -1, multiplicity = 3:

    H            0.000000000000     0.000000000000     0.986711049758
    HE           0.000000000000     0.000000000000    -0.248446331646


Scratch directory: /tmp/
gradient() will perform analytic gradient computation.
   => Libint2 <=

    Primary   basis highest AM E, G, H:  6, 6, 3
    Auxiliary basis highest AM E, G, H:  7, 7, 4
    Onebody   basis highest AM E, G, H:  -, -, -
    Solid Harmonics ordering:            Gaussian

*** tstart() called on Joses-MacBook-Pro-2.local
*** at Thu Jul 17 09:09:44 2025

   => Loading Basis Set <=

    Name: CC-PVDZ
    Role: ORBITAL
    Keyword: BASIS
    atoms 1 entry H          line    22 file /Users/joseantoniorodriguesromero/anaconda3/share/psi4/basis/cc-pvdz.gbs 
    atoms 2 entry HE         line    32 file /Users/joseantoniorodriguesromero/anaconda3/share/psi4/basis/cc-pvdz.gbs 


         ---------------------------------------------------------
                                   SCF
               by Justin Turney, Rob Parrish, Andy Simmonett
                          and Daniel G. A. Smith
                              UKS Reference
                        1 Threads,    500 MiB Core
         ---------------------------------------------------------

  ==> Geometry <==

    Molecular point group: c2v
    Full point group: C_inf_v

    Geometry (in Angstrom), charge = -1, multiplicity = 3:

       Center              X                  Y                   Z               Mass       
    ------------   -----------------  -----------------  -----------------  -----------------
         H            0.000000000000     0.000000000000     0.986711049758     1.007825032230
         HE           0.000000000000     0.000000000000    -0.248446331646     4.002603254130

  Running in c2v symmetry.

  Rotational constants: A = ************  B =     13.72458  C =     13.72458 [cm^-1]
  Rotational constants: A = ************  B = 411452.55965  C = 411452.55965 [MHz]
  Nuclear repulsion =    0.856857949662299

  Charge       = -1
  Multiplicity = 3
  Electrons    = 4
  Nalpha       = 3
  Nbeta        = 1

  ==> Algorithm <==

  SCF Algorithm Type is DF.
  DIIS enabled.
  MOM disabled.
  Fractional occupation disabled.
  Guess Type is READ.
  Energy threshold   = 1.00e-08
  Density threshold  = 1.00e-08
  Integral threshold = 1.00e-12

  ==> Primary Basis <==

  Basis Set: CC-PVDZ
    Blend: CC-PVDZ
    Number of shells: 6
    Number of basis functions: 10
    Number of Cartesian functions: 10
    Spherical Harmonics?: true
    Max angular momentum: 1

  ==> DFT Potential <==

   => LibXC <=

    Version 6.2.2
    S. Lehtola, C. Steigemann, M. J.T. Oliveira, and M. A.L. Marques.,  SoftwareX 7, 1–5 (2018) (10.1016/j.softx.2017.11.002)

   => Composite Functional: B3LYP <= 

    B3LYP Hyb-GGA Exchange-Correlation Functional

    P. J. Stephens, F. J. Devlin, C. F. Chabalowski, and M. J. Frisch.,  J. Phys. Chem. 98, 11623 (1994) (10.1021/j100096a001)

    Deriv               =              1
    GGA                 =           TRUE
    Meta                =          FALSE

    Exchange Hybrid     =           TRUE
    MP2 Hybrid          =          FALSE

   => Exchange Functionals <=

    0.0800   Slater exchange
    0.7200         Becke 88

   => Exact (HF) Exchange <=

    0.2000               HF 

   => Correlation Functionals <=

    0.1900   Vosko, Wilk & Nusair (VWN5_RPA)
    0.8100   Lee, Yang & Parr

   => LibXC Density Thresholds  <==

    XC_HYB_GGA_XC_B3LYP:  1.00E-15 

   => Molecular Quadrature <=

    Radial Scheme          =       TREUTLER
    Pruning Scheme         =           NONE
    Nuclear Scheme         =       TREUTLER

    Blocking Scheme        =         OCTREE
    BS radius alpha        =              1
    Pruning alpha          =              1
    Radial Points          =             75
    Spherical Points       =            302
    Total Points           =          44656
    Total Blocks           =            388
    Max Points             =            253
    Max Functions          =             10
    Weights Tolerance      =       1.00E-15

   => Loading Basis Set <=

    Name: (CC-PVDZ AUX)
    Role: JKFIT
    Keyword: DF_BASIS_SCF
    atoms 1 entry H          line    51 file /Users/joseantoniorodriguesromero/anaconda3/share/psi4/basis/cc-pvdz-jkfit.gbs 
    atoms 2 entry HE         line    34 file /Users/joseantoniorodriguesromero/anaconda3/share/psi4/basis/def2-universal-jkfit.gbs 

   => Loading Basis Set <=

    Name: CC-PVDZ
    Role: ORBITAL
    Keyword: BASIS
    atoms 1 entry H          line    22 file /Users/joseantoniorodriguesromero/anaconda3/share/psi4/basis/cc-pvdz.gbs 
    atoms 2 entry HE         line    32 file /Users/joseantoniorodriguesromero/anaconda3/share/psi4/basis/cc-pvdz.gbs 

  Reading orbitals from file /tmp/triplet_HHe.default.71710.180.npy, no projection.

  ==> Integral Setup <==

  DFHelper Memory: AOs need 0.000 GiB; user supplied 0.353 GiB. 
  Using in-core AOs.

  ==> MemDFJK: Density-Fitted J/K Matrices <==

    J tasked:                   Yes
    K tasked:                   Yes
    wK tasked:                   No
    OpenMP threads:               1
    Memory [MiB]:               361
    Algorithm:                 Core
    Schwarz Cutoff:           1E-12
    Mask sparsity (%):       0.0000
    Fitting Condition:        1E-10

   => Auxiliary Basis Set <=

  Basis Set: (CC-PVDZ AUX)
    Blend: CC-PVDZ-JKFIT + DEF2-UNIVERSAL-JKFIT
    Number of shells: 18
    Number of basis functions: 46
    Number of Cartesian functions: 50
    Spherical Harmonics?: true
    Max angular momentum: 2

  Cached 100.0% of DFT collocation blocks in 0.013 [GiB].

  Minimum eigenvalue in the overlap matrix is 2.0041201007E-01.
  Reciprocal condition number of the overlap matrix is 8.5203952992E-02.
    Using symmetric orthogonalization.

  ==> Pre-Iterations <==

  SCF Guess: Orbitals guess was supplied from a previous computation.

   -------------------------------------------------------
    Irrep   Nso     Nmo     Nalpha   Nbeta   Ndocc  Nsocc
   -------------------------------------------------------
     A1         6       6       3       1       1       2
     A2         0       0       0       0       0       0
     B1         2       2       0       0       0       0
     B2         2       2       0       0       0       0
   -------------------------------------------------------
    Total      10      10       3       1       1       2
   -------------------------------------------------------

  ==> Iterations <==

                           Total Energy        Delta E     RMS |[F,P]|

   @DF-UKS iter   0:    -2.82999878201011   -2.83000e+00   8.03670e-04 
   @DF-UKS iter   1:    -2.83048498156517   -4.86200e-04   8.49960e-05 DIIS
   @DF-UKS iter   2:    -2.83048520538213   -2.23817e-07   1.90674e-05 DIIS/DAMP=1%
   @DF-UKS iter   3:    -2.83048562012512   -4.14743e-07   3.90597e-06 DIIS/DAMP=1%
   @DF-UKS iter   4:    -2.83048512764808    4.92477e-07   3.45714e-07 DIIS/DAMP=1%
   @DF-UKS iter   5:    -2.83048521934976   -9.17017e-08   4.49867e-08 DIIS/DAMP=1%
   @DF-UKS iter   6:    -2.83048521304235    6.30741e-09   4.53127e-09 DIIS/DAMP=1%
  Energy and wave function converged.


  ==> Post-Iterations <==

   Electrons on quadrature grid:
      Nalpha   =    3.0000000320 ; deviation = 3.196e-08
      Nbeta    =    1.0000000384 ; deviation = 3.840e-08
      Ntotal   =    4.0000000704 ; deviation = 7.036e-08 

   @Spin Contamination Metric:   6.595528032E-05
   @S^2 Expected:                2.000000000E+00
   @S^2 Observed:                2.000065955E+00
   @S   Expected:                1.000000000E+00
   @S   Observed:                1.000000000E+00

    Orbital Energies [Eh]
    ---------------------

    Alpha Occupied:                                                       

       1A1    -0.388956     2A1     0.155103     3A1     0.695841  

    Alpha Virtual:                                                        

       4A1     1.488054     1B1     1.664265     1B2     1.664265  
       5A1     1.696518     2B1     2.518133     2B2     2.518133  
       6A1     3.132177  

    Beta Occupied:                                                        

       1A1    -0.367737  

    Beta Virtual:                                                         

       2A1     0.369210     3A1     1.048422     4A1     1.500197  
       1B1     1.810467     1B2     1.810467     5A1     1.815452  
       2B1     2.535166     2B2     2.535166     6A1     3.195274  

    Final Occupation by Irrep:
             A1    A2    B1    B2 
    DOCC [     1,    0,    0,    0 ]
    SOCC [     2,    0,    0,    0 ]
    NA   [     3,    0,    0,    0 ]
    NB   [     1,    0,    0,    0 ]

  @DF-UKS Final Energy:    -2.83048521304235

   => Energetics <=

    Nuclear Repulsion Energy =              0.8568579496622986
    One-Electron Energy =                  -6.4264150612426949
    Two-Electron Energy =                   4.1810401300392632
    DFT Exchange-Correlation Energy =      -1.4419682315012192
    Empirical Dispersion Energy =           0.0000000000000000
    VV10 Nonlocal Energy =                  0.0000000000000000
    Total Energy =                         -2.8304852130423521

  UHF NO Occupations:
  HONO-2 :    1 A1 1.9999670
  HONO-1 :    2 A1 1.0000000
  HONO-0 :    3 A1 1.0000000
  LUNO+0 :    4 A1 0.0000330
  LUNO+1 :    2 B2 0.0000000
  LUNO+2 :    1 B2 0.0000000
  LUNO+3 :    2 B1 0.0000000


Computation Completed


Properties will be evaluated at   0.000000,   0.000000,   0.000000 [a0]

Properties computed using the SCF density matrix


 Multipole Moments:

 ------------------------------------------------------------------------------------
     Multipole            Electronic (a.u.)      Nuclear  (a.u.)        Total (a.u.)
 ------------------------------------------------------------------------------------

 L = 1.  Multiply by 2.5417464519 to convert [e a0] to [Debye]
 Dipole X            :          0.0000000            0.0000000            0.0000000
 Dipole Y            :          0.0000000            0.0000000            0.0000000
 Dipole Z            :         -3.2267176            0.9256226           -2.3010950
 Magnitude           :                                                    2.3010950

 ------------------------------------------------------------------------------------

*** tstop() called on Joses-MacBook-Pro-2.local at Thu Jul 17 09:09:44 2025
Module time:
	user time   =       0.83 seconds =       0.01 minutes
	system time =       1.81 seconds =       0.03 minutes
	total time  =          0 seconds =       0.00 minutes
Total time:
	user time   =       3.83 seconds =       0.06 minutes
	system time =       5.85 seconds =       0.10 minutes
	total time  =          1 seconds =       0.02 minutes

*** tstart() called on Joses-MacBook-Pro-2.local
*** at Thu Jul 17 09:09:44 2025


         ------------------------------------------------------------
                                   SCF GRAD                          
                          Rob Parrish, Justin Turney,                
                       Andy Simmonett, and Alex Sokolov              
         ------------------------------------------------------------

  ==> Geometry <==

    Molecular point group: c2v
    Full point group: C_inf_v

    Geometry (in Angstrom), charge = -1, multiplicity = 3:

       Center              X                  Y                   Z               Mass       
    ------------   -----------------  -----------------  -----------------  -----------------
         H            0.000000000000     0.000000000000     0.986711049758     1.007825032230
         HE           0.000000000000     0.000000000000    -0.248446331646     4.002603254130

  Nuclear repulsion =    0.856857949662299

  ==> Basis Set <==

  Basis Set: CC-PVDZ
    Blend: CC-PVDZ
    Number of shells: 6
    Number of basis functions: 10
    Number of Cartesian functions: 10
    Spherical Harmonics?: true
    Max angular momentum: 1

  ==> DFJKGrad: Density-Fitted SCF Gradients <==

    Gradient:                    1
    J tasked:                  Yes
    K tasked:                  Yes
    wK tasked:                  No
    OpenMP threads:              1
    Integrals threads:           1
    Memory [MiB]:              375
    Schwarz Cutoff:          1E-12
    Fitting Condition:       1E-10

   => Auxiliary Basis Set <=

  Basis Set: (CC-PVDZ AUX)
    Blend: CC-PVDZ-JKFIT + DEF2-UNIVERSAL-JKFIT
    Number of shells: 18
    Number of basis functions: 46
    Number of Cartesian functions: 50
    Spherical Harmonics?: true
    Max angular momentum: 2

  ==> DFT Potential <==

   => LibXC <=

    Version 6.2.2
    S. Lehtola, C. Steigemann, M. J.T. Oliveira, and M. A.L. Marques.,  SoftwareX 7, 1–5 (2018) (10.1016/j.softx.2017.11.002)

   => Composite Functional: B3LYP <= 

    B3LYP Hyb-GGA Exchange-Correlation Functional

    P. J. Stephens, F. J. Devlin, C. F. Chabalowski, and M. J. Frisch.,  J. Phys. Chem. 98, 11623 (1994) (10.1021/j100096a001)

    Deriv               =              1
    GGA                 =           TRUE
    Meta                =          FALSE

    Exchange Hybrid     =           TRUE
    MP2 Hybrid          =          FALSE

   => Exchange Functionals <=

    0.0800   Slater exchange
    0.7200         Becke 88

   => Exact (HF) Exchange <=

    0.2000               HF 

   => Correlation Functionals <=

    0.1900   Vosko, Wilk & Nusair (VWN5_RPA)
    0.8100   Lee, Yang & Parr

   => LibXC Density Thresholds  <==

    XC_HYB_GGA_XC_B3LYP:  1.00E-15 

   => Molecular Quadrature <=

    Radial Scheme          =       TREUTLER
    Pruning Scheme         =           NONE
    Nuclear Scheme         =       TREUTLER

    Blocking Scheme        =         OCTREE
    BS radius alpha        =              1
    Pruning alpha          =              1
    Radial Points          =             75
    Spherical Points       =            302
    Total Points           =          44656
    Total Blocks           =            388
    Max Points             =            253
    Max Functions          =             10
    Weights Tolerance      =       1.00E-15


  -Total Gradient:
     Atom            X                  Y                   Z
    ------   -----------------  -----------------  -----------------
       1       -0.000000000000     0.000000000000    -0.000153327315
       2       -0.000000000000    -0.000000000000     0.000151999457


*** tstop() called on Joses-MacBook-Pro-2.local at Thu Jul 17 09:09:45 2025
Module time:
	user time   =       0.43 seconds =       0.01 minutes
	system time =       0.10 seconds =       0.00 minutes
	total time  =          1 seconds =       0.02 minutes
Total time:
	user time   =       4.28 seconds =       0.07 minutes
	system time =       5.95 seconds =       0.10 minutes
	total time  =          2 seconds =       0.03 minutes

    			-----------------------------------------

    			 OPTKING 3.0: for geometry optimizations 

    			     By R.A. King, Bethel University     

    			        with contributions from          

    			    A.V. Copan, J. Cayton, A. Heide      

    			-----------------------------------------

    
	                            ===> Fragment 1 <== 

	 Z (Atomic Numbers)          Masses                          Geom                  
	       1.000000             1.007825          0.00000000  0.00000000  1.86461365   
	       2.000000             4.002603          0.00000000  0.00000000 -0.46949552   

	 - Coordinate -           - BOHR/RAD -       - ANG/DEG -
	 R(1,2)           =         2.334109           1.235157


	        --- Internal Coordinate Step in ANG or DEG, aJ/ANG or AJ/DEG ---
	-------------------------------------------------------------------------------
	           Coordinate      Previous         Force          Change          New 
	           ----------      --------        ------          ------        ------
	               R(1,2)       1.23516        0.00126        0.00112       1.23627
	-------------------------------------------------------------------------------

	                                 ==> Convergence Check <==                                  
    
	Measures of convergence in internal coordinates in au.
    
	Criteria marked as inactive (o), active & met (*), and active & unmet ( ).

	----------------------------------------------------------------------------------------------
	   Step    Total Energy     Delta E     Max Force     RMS Force      Max Disp      RMS Disp   
	----------------------------------------------------------------------------------------------
	  Convergence Criteria     1.00e-06 *    3.00e-04 *             o    1.20e-03 *             o
	----------------------------------------------------------------------------------------------
	     3      -2.83048521   -1.82e-05      1.53e-04 *    1.53e-04 o    2.11e-03      2.11e-03 o  ~
	----------------------------------------------------------------------------------------------

Next Geometry in Ang 
	Fragment 1 (Ang)

	    H   0.0000000000   0.0000000000   0.9872688916
	   He   0.0000000000   0.0000000000  -0.2490041735


    Structure for next step:
    Molecular point group: c2v
    Full point group: C_inf_v

    Geometry (in Angstrom), charge = -1, multiplicity = 3:

    H            0.000000000000     0.000000000000     0.987602318687
    HE           0.000000000000     0.000000000000    -0.248670746378


Scratch directory: /tmp/
gradient() will perform analytic gradient computation.
   => Libint2 <=

    Primary   basis highest AM E, G, H:  6, 6, 3
    Auxiliary basis highest AM E, G, H:  7, 7, 4
    Onebody   basis highest AM E, G, H:  -, -, -
    Solid Harmonics ordering:            Gaussian

*** tstart() called on Joses-MacBook-Pro-2.local
*** at Thu Jul 17 09:09:45 2025

   => Loading Basis Set <=

    Name: CC-PVDZ
    Role: ORBITAL
    Keyword: BASIS
    atoms 1 entry H          line    22 file /Users/joseantoniorodriguesromero/anaconda3/share/psi4/basis/cc-pvdz.gbs 
    atoms 2 entry HE         line    32 file /Users/joseantoniorodriguesromero/anaconda3/share/psi4/basis/cc-pvdz.gbs 


         ---------------------------------------------------------
                                   SCF
               by Justin Turney, Rob Parrish, Andy Simmonett
                          and Daniel G. A. Smith
                              UKS Reference
                        1 Threads,    500 MiB Core
         ---------------------------------------------------------

  ==> Geometry <==

    Molecular point group: c2v
    Full point group: C_inf_v

    Geometry (in Angstrom), charge = -1, multiplicity = 3:

       Center              X                  Y                   Z               Mass       
    ------------   -----------------  -----------------  -----------------  -----------------
         H            0.000000000000     0.000000000000     0.987602318687     1.007825032230
         HE           0.000000000000     0.000000000000    -0.248670746378     4.002603254130

  Running in c2v symmetry.

  Rotational constants: A = ************  B =     13.69982  C =     13.69982 [cm^-1]
  Rotational constants: A = ************  B = 410710.25802  C = 410710.25802 [MHz]
  Nuclear repulsion =    0.856084671944610

  Charge       = -1
  Multiplicity = 3
  Electrons    = 4
  Nalpha       = 3
  Nbeta        = 1

  ==> Algorithm <==

  SCF Algorithm Type is DF.
  DIIS enabled.
  MOM disabled.
  Fractional occupation disabled.
  Guess Type is READ.
  Energy threshold   = 1.00e-08
  Density threshold  = 1.00e-08
  Integral threshold = 1.00e-12

  ==> Primary Basis <==

  Basis Set: CC-PVDZ
    Blend: CC-PVDZ
    Number of shells: 6
    Number of basis functions: 10
    Number of Cartesian functions: 10
    Spherical Harmonics?: true
    Max angular momentum: 1

  ==> DFT Potential <==

   => LibXC <=

    Version 6.2.2
    S. Lehtola, C. Steigemann, M. J.T. Oliveira, and M. A.L. Marques.,  SoftwareX 7, 1–5 (2018) (10.1016/j.softx.2017.11.002)

   => Composite Functional: B3LYP <= 

    B3LYP Hyb-GGA Exchange-Correlation Functional

    P. J. Stephens, F. J. Devlin, C. F. Chabalowski, and M. J. Frisch.,  J. Phys. Chem. 98, 11623 (1994) (10.1021/j100096a001)

    Deriv               =              1
    GGA                 =           TRUE
    Meta                =          FALSE

    Exchange Hybrid     =           TRUE
    MP2 Hybrid          =          FALSE

   => Exchange Functionals <=

    0.0800   Slater exchange
    0.7200         Becke 88

   => Exact (HF) Exchange <=

    0.2000               HF 

   => Correlation Functionals <=

    0.1900   Vosko, Wilk & Nusair (VWN5_RPA)
    0.8100   Lee, Yang & Parr

   => LibXC Density Thresholds  <==

    XC_HYB_GGA_XC_B3LYP:  1.00E-15 

   => Molecular Quadrature <=

    Radial Scheme          =       TREUTLER
    Pruning Scheme         =           NONE
    Nuclear Scheme         =       TREUTLER

    Blocking Scheme        =         OCTREE
    BS radius alpha        =              1
    Pruning alpha          =              1
    Radial Points          =             75
    Spherical Points       =            302
    Total Points           =          44656
    Total Blocks           =            388
    Max Points             =            253
    Max Functions          =             10
    Weights Tolerance      =       1.00E-15

   => Loading Basis Set <=

    Name: (CC-PVDZ AUX)
    Role: JKFIT
    Keyword: DF_BASIS_SCF
    atoms 1 entry H          line    51 file /Users/joseantoniorodriguesromero/anaconda3/share/psi4/basis/cc-pvdz-jkfit.gbs 
    atoms 2 entry HE         line    34 file /Users/joseantoniorodriguesromero/anaconda3/share/psi4/basis/def2-universal-jkfit.gbs 

   => Loading Basis Set <=

    Name: CC-PVDZ
    Role: ORBITAL
    Keyword: BASIS
    atoms 1 entry H          line    22 file /Users/joseantoniorodriguesromero/anaconda3/share/psi4/basis/cc-pvdz.gbs 
    atoms 2 entry HE         line    32 file /Users/joseantoniorodriguesromero/anaconda3/share/psi4/basis/cc-pvdz.gbs 

  Reading orbitals from file /tmp/triplet_HHe.default.71710.180.npy, no projection.

  ==> Integral Setup <==

  DFHelper Memory: AOs need 0.000 GiB; user supplied 0.353 GiB. 
  Using in-core AOs.

  ==> MemDFJK: Density-Fitted J/K Matrices <==

    J tasked:                   Yes
    K tasked:                   Yes
    wK tasked:                   No
    OpenMP threads:               1
    Memory [MiB]:               361
    Algorithm:                 Core
    Schwarz Cutoff:           1E-12
    Mask sparsity (%):       0.0000
    Fitting Condition:        1E-10

   => Auxiliary Basis Set <=

  Basis Set: (CC-PVDZ AUX)
    Blend: CC-PVDZ-JKFIT + DEF2-UNIVERSAL-JKFIT
    Number of shells: 18
    Number of basis functions: 46
    Number of Cartesian functions: 50
    Spherical Harmonics?: true
    Max angular momentum: 2

  Cached 100.0% of DFT collocation blocks in 0.013 [GiB].

  Minimum eigenvalue in the overlap matrix is 2.0055351177E-01.
  Reciprocal condition number of the overlap matrix is 8.5303089673E-02.
    Using symmetric orthogonalization.

  ==> Pre-Iterations <==

  SCF Guess: Orbitals guess was supplied from a previous computation.

   -------------------------------------------------------
    Irrep   Nso     Nmo     Nalpha   Nbeta   Ndocc  Nsocc
   -------------------------------------------------------
     A1         6       6       3       1       1       2
     A2         0       0       0       0       0       0
     B1         2       2       0       0       0       0
     B2         2       2       0       0       0       0
   -------------------------------------------------------
    Total      10      10       3       1       1       2
   -------------------------------------------------------

  ==> Iterations <==

                           Total Energy        Delta E     RMS |[F,P]|

   @DF-UKS iter   0:    -2.83043806055291   -2.83044e+00   7.89657e-05 
   @DF-UKS iter   1:    -2.83048538629007   -4.73257e-05   8.31943e-06 DIIS
   @DF-UKS iter   2:    -2.83048538843058   -2.14051e-09   1.86340e-06 DIIS/DAMP=1%
   @DF-UKS iter   3:    -2.83048542813292   -3.97023e-08   3.81905e-07 DIIS/DAMP=1%
   @DF-UKS iter   4:    -2.83048538012346    4.80095e-08   3.43657e-08 DIIS/DAMP=1%
   @DF-UKS iter   5:    -2.83048538909021   -8.96674e-09   4.45478e-09 DIIS/DAMP=1%
  Energy and wave function converged.


  ==> Post-Iterations <==

   Electrons on quadrature grid:
      Nalpha   =    3.0000000323 ; deviation = 3.230e-08
      Nbeta    =    1.0000000386 ; deviation = 3.859e-08
      Ntotal   =    4.0000000709 ; deviation = 7.089e-08 

   @Spin Contamination Metric:   6.581370595E-05
   @S^2 Expected:                2.000000000E+00
   @S^2 Observed:                2.000065814E+00
   @S   Expected:                1.000000000E+00
   @S   Observed:                1.000000000E+00

    Orbital Energies [Eh]
    ---------------------

    Alpha Occupied:                                                       

       1A1    -0.388932     2A1     0.154970     3A1     0.695979  

    Alpha Virtual:                                                        

       4A1     1.487996     1B1     1.664459     1B2     1.664459  
       5A1     1.696016     2B2     2.517777     2B1     2.517777  
       6A1     3.130430  

    Beta Occupied:                                                        

       1A1    -0.367782  

    Beta Virtual:                                                         

       2A1     0.369157     3A1     1.048743     4A1     1.500111  
       1B1     1.810814     1B2     1.810814     5A1     1.814948  
       2B2     2.534745     2B1     2.534745     6A1     3.193471  

    Final Occupation by Irrep:
             A1    A2    B1    B2 
    DOCC [     1,    0,    0,    0 ]
    SOCC [     2,    0,    0,    0 ]
    NA   [     3,    0,    0,    0 ]
    NB   [     1,    0,    0,    0 ]

  @DF-UKS Final Energy:    -2.83048538909021

   => Energetics <=

    Nuclear Repulsion Energy =              0.8560846719446104
    One-Electron Energy =                  -6.4248641125698613
    Two-Electron Energy =                   4.1802429494969946
    DFT Exchange-Correlation Energy =      -1.4419488979619495
    Empirical Dispersion Energy =           0.0000000000000000
    VV10 Nonlocal Energy =                  0.0000000000000000
    Total Energy =                         -2.8304853890902058

  UHF NO Occupations:
  HONO-2 :    1 A1 1.9999671
  HONO-1 :    2 A1 1.0000000
  HONO-0 :    3 A1 1.0000000
  LUNO+0 :    4 A1 0.0000329
  LUNO+1 :    2 B2 0.0000000
  LUNO+2 :    1 B2 0.0000000
  LUNO+3 :    2 B1 0.0000000


Computation Completed


Properties will be evaluated at   0.000000,   0.000000,   0.000000 [a0]

Properties computed using the SCF density matrix


 Multipole Moments:

 ------------------------------------------------------------------------------------
     Multipole            Electronic (a.u.)      Nuclear  (a.u.)        Total (a.u.)
 ------------------------------------------------------------------------------------

 L = 1.  Multiply by 2.5417464519 to convert [e a0] to [Debye]
 Dipole X            :          0.0000000            0.0000000            0.0000000
 Dipole Y            :          0.0000000            0.0000000            0.0000000
 Dipole Z            :         -3.2289964            0.9264587           -2.3025378
 Magnitude           :                                                    2.3025378

 ------------------------------------------------------------------------------------

*** tstop() called on Joses-MacBook-Pro-2.local at Thu Jul 17 09:09:45 2025
Module time:
	user time   =       2.05 seconds =       0.03 minutes
	system time =       0.52 seconds =       0.01 minutes
	total time  =          0 seconds =       0.00 minutes
Total time:
	user time   =       6.48 seconds =       0.11 minutes
	system time =       6.47 seconds =       0.11 minutes
	total time  =          2 seconds =       0.03 minutes

*** tstart() called on Joses-MacBook-Pro-2.local
*** at Thu Jul 17 09:09:45 2025


         ------------------------------------------------------------
                                   SCF GRAD                          
                          Rob Parrish, Justin Turney,                
                       Andy Simmonett, and Alex Sokolov              
         ------------------------------------------------------------

  ==> Geometry <==

    Molecular point group: c2v
    Full point group: C_inf_v

    Geometry (in Angstrom), charge = -1, multiplicity = 3:

       Center              X                  Y                   Z               Mass       
    ------------   -----------------  -----------------  -----------------  -----------------
         H            0.000000000000     0.000000000000     0.987602318687     1.007825032230
         HE           0.000000000000     0.000000000000    -0.248670746378     4.002603254130

  Nuclear repulsion =    0.856084671944610

  ==> Basis Set <==

  Basis Set: CC-PVDZ
    Blend: CC-PVDZ
    Number of shells: 6
    Number of basis functions: 10
    Number of Cartesian functions: 10
    Spherical Harmonics?: true
    Max angular momentum: 1

  ==> DFJKGrad: Density-Fitted SCF Gradients <==

    Gradient:                    1
    J tasked:                  Yes
    K tasked:                  Yes
    wK tasked:                  No
    OpenMP threads:              1
    Integrals threads:           1
    Memory [MiB]:              375
    Schwarz Cutoff:          1E-12
    Fitting Condition:       1E-10

   => Auxiliary Basis Set <=

  Basis Set: (CC-PVDZ AUX)
    Blend: CC-PVDZ-JKFIT + DEF2-UNIVERSAL-JKFIT
    Number of shells: 18
    Number of basis functions: 46
    Number of Cartesian functions: 50
    Spherical Harmonics?: true
    Max angular momentum: 2

  ==> DFT Potential <==

   => LibXC <=

    Version 6.2.2
    S. Lehtola, C. Steigemann, M. J.T. Oliveira, and M. A.L. Marques.,  SoftwareX 7, 1–5 (2018) (10.1016/j.softx.2017.11.002)

   => Composite Functional: B3LYP <= 

    B3LYP Hyb-GGA Exchange-Correlation Functional

    P. J. Stephens, F. J. Devlin, C. F. Chabalowski, and M. J. Frisch.,  J. Phys. Chem. 98, 11623 (1994) (10.1021/j100096a001)

    Deriv               =              1
    GGA                 =           TRUE
    Meta                =          FALSE

    Exchange Hybrid     =           TRUE
    MP2 Hybrid          =          FALSE

   => Exchange Functionals <=

    0.0800   Slater exchange
    0.7200         Becke 88

   => Exact (HF) Exchange <=

    0.2000               HF 

   => Correlation Functionals <=

    0.1900   Vosko, Wilk & Nusair (VWN5_RPA)
    0.8100   Lee, Yang & Parr

   => LibXC Density Thresholds  <==

    XC_HYB_GGA_XC_B3LYP:  1.00E-15 

   => Molecular Quadrature <=

    Radial Scheme          =       TREUTLER
    Pruning Scheme         =           NONE
    Nuclear Scheme         =       TREUTLER

    Blocking Scheme        =         OCTREE
    BS radius alpha        =              1
    Pruning alpha          =              1
    Radial Points          =             75
    Spherical Points       =            302
    Total Points           =          44656
    Total Blocks           =            388
    Max Points             =            253
    Max Functions          =             10
    Weights Tolerance      =       1.00E-15


  -Total Gradient:
     Atom            X                  Y                   Z
    ------   -----------------  -----------------  -----------------
       1        0.000000000000    -0.000000000000    -0.000016079085
       2       -0.000000000000     0.000000000000     0.000014758707


*** tstop() called on Joses-MacBook-Pro-2.local at Thu Jul 17 09:09:45 2025
Module time:
	user time   =       0.45 seconds =       0.01 minutes
	system time =       0.07 seconds =       0.00 minutes
	total time  =          0 seconds =       0.00 minutes
Total time:
	user time   =       6.94 seconds =       0.12 minutes
	system time =       6.54 seconds =       0.11 minutes
	total time  =          2 seconds =       0.03 minutes

    			-----------------------------------------

    			 OPTKING 3.0: for geometry optimizations 

    			     By R.A. King, Bethel University     

    			        with contributions from          

    			    A.V. Copan, J. Cayton, A. Heide      

    			-----------------------------------------

    
	                            ===> Fragment 1 <== 

	 Z (Atomic Numbers)          Masses                          Geom                  
	       1.000000             1.007825          0.00000000  0.00000000  1.86629790   
	       2.000000             4.002603          0.00000000  0.00000000 -0.46991961   

	 - Coordinate -           - BOHR/RAD -       - ANG/DEG -
	 R(1,2)           =         2.336218           1.236273


	        --- Internal Coordinate Step in ANG or DEG, aJ/ANG or AJ/DEG ---
	-------------------------------------------------------------------------------
	           Coordinate      Previous         Force          Change          New 
	           ----------      --------        ------          ------        ------
	               R(1,2)       1.23627        0.00013        0.00011       1.23639
	-------------------------------------------------------------------------------

	                                 ==> Convergence Check <==                                  
    
	Measures of convergence in internal coordinates in au.
    
	Criteria marked as inactive (o), active & met (*), and active & unmet ( ).

	----------------------------------------------------------------------------------------------
	   Step    Total Energy     Delta E     Max Force     RMS Force      Max Disp      RMS Disp   
	----------------------------------------------------------------------------------------------
	  Convergence Criteria     1.00e-06 *    3.00e-04 *             o    1.20e-03 *             o
	----------------------------------------------------------------------------------------------
	     4      -2.83048539   -1.76e-07 *    1.54e-05 *    1.54e-05 o    2.14e-04 *    2.14e-04 o  ~
	----------------------------------------------------------------------------------------------

Next Geometry in Ang 
	Fragment 1 (Ang)

	    H   0.0000000000   0.0000000000   0.9876588361
	   He   0.0000000000   0.0000000000  -0.2487272638


    Final optimized geometry and variables:
    Molecular point group: c2v
    Full point group: C_inf_v

    Geometry (in Angstrom), charge = -1, multiplicity = 3:

    H            0.000000000000     0.000000000000     0.987602318687
    HE           0.000000000000     0.000000000000    -0.248670746378


    Psi4 stopped on: Thursday, 17 July 2025 09:09AM
    Psi4 wall time for execution: 0:00:02.24

*** Psi4 exiting successfully. Buy a developer a beer!
