
    -----------------------------------------------------------------------
          Psi4: An Open-Source Ab Initio Electronic Structure Package
                               Psi4 1.9.1 release

                         Git: Rev {} zzzzzzz 


    D. G. A. Smith, L. A. Burns, A. C. Simmonett, R. M. Parrish,
    M. C. Schieber, R. Galvelis, P. Kraus, H. Kruse, R. Di Remigio,
    A. Alenaizan, A. M. James, S. Lehtola, J. P. Misiewicz, M. Scheurer,
    R. A. Shaw, J. B. Schriber, Y. Xie, Z. L. Glick, D. A. Sirianni,
    J. S. O'Brien, J. M. Waldrop, A. Kumar, E. G. Hohenstein,
    B. P. Pritchard, B. R. Brooks, H. F. Schaefer III, A. Yu. Sokolov,
    K. Patkowski, A. E. DePrince III, U. Bozkaya, R. A. King,
    F. A. Evangelista, J. M. Turney, T. D. Crawford, C. D. Sherrill,
    J. Chem. Phys. 152(18) 184108 (2020). https://doi.org/10.1063/5.0006002

                            Additional Code Authors
    E. T. Seidl, C. L. Janssen, E. F. Valeev, M. L. Leininger,
    J. F. Gonthier, R. M. Richard, H. R. McAlexander, M. Saitow, X. Wang,
    P. Verma, M. H. Lechner, A. Jiang, S. Behnle, A. G. Heide,
    M. F. Herbst, and D. L. Poole

             Previous Authors, Complete List of Code Contributors,
                       and Citations for Specific Modules
    https://github.com/psi4/psi4/blob/master/codemeta.json
    https://github.com/psi4/psi4/graphs/contributors
    http://psicode.org/psi4manual/master/introduction.html#citing-psifour

    -----------------------------------------------------------------------


    Psi4 started on: Thursday, 17 July 2025 09:20AM

    Process ID: 71844
    Host:       Joses-MacBook-Pro-2.local
    PSIDATADIR: /Users/joseantoniorodriguesromero/anaconda3/share/psi4
    Memory:     500.0 MiB
    Threads:    1
    
  ==> Input File <==

--------------------------------------------------------------------------
molecule { 
-1 3
He   0.00000        0.60000        0.00000
F   0.00000       -0.60000        0.00000
}

set { 
basis              cc-pvdz
reference          uks
maxiter            500
geom_maxiter       500
DAMPING_PERCENTAGE 1
guess              SAP
}

optimize('b3lyp')
--------------------------------------------------------------------------

Scratch directory: /tmp/
gradient() will perform analytic gradient computation.
   => Libint2 <=

    Primary   basis highest AM E, G, H:  6, 6, 3
    Auxiliary basis highest AM E, G, H:  7, 7, 4
    Onebody   basis highest AM E, G, H:  -, -, -
    Solid Harmonics ordering:            Gaussian

*** tstart() called on Joses-MacBook-Pro-2.local
*** at Thu Jul 17 09:20:20 2025

   => Loading Basis Set <=

    Name: CC-PVDZ
    Role: ORBITAL
    Keyword: BASIS
    atoms 1 entry HE         line    32 file /Users/joseantoniorodriguesromero/anaconda3/share/psi4/basis/cc-pvdz.gbs 
    atoms 2 entry F          line   228 file /Users/joseantoniorodriguesromero/anaconda3/share/psi4/basis/cc-pvdz.gbs 


         ---------------------------------------------------------
                                   SCF
               by Justin Turney, Rob Parrish, Andy Simmonett
                          and Daniel G. A. Smith
                              UKS Reference
                        1 Threads,    500 MiB Core
         ---------------------------------------------------------

  ==> Geometry <==

    Molecular point group: c2v
    Full point group: C_inf_v

    Geometry (in Angstrom), charge = -1, multiplicity = 3:

       Center              X                  Y                   Z               Mass       
    ------------   -----------------  -----------------  -----------------  -----------------
         HE           0.000000000000     0.000000000000     0.991177663364     4.002603254130
         F            0.000000000000     0.000000000000    -0.208822336636    18.998403162730

  Running in c2v symmetry.

  Rotational constants: A = ************  B =      3.54096  C =      3.54096 [cm^-1]
  Rotational constants: A = ************  B = 106155.35395  C = 106155.35395 [MHz]
  Nuclear repulsion =    7.937658160050002

  Charge       = -1
  Multiplicity = 3
  Electrons    = 12
  Nalpha       = 7
  Nbeta        = 5

  ==> Algorithm <==

  SCF Algorithm Type is DF.
  DIIS enabled.
  MOM disabled.
  Fractional occupation disabled.
  Guess Type is SAP.
  Energy threshold   = 1.00e-08
  Density threshold  = 1.00e-08
  Integral threshold = 1.00e-12

  ==> Primary Basis <==

  Basis Set: CC-PVDZ
    Blend: CC-PVDZ
    Number of shells: 9
    Number of basis functions: 19
    Number of Cartesian functions: 20
    Spherical Harmonics?: true
    Max angular momentum: 2

  ==> DFT Potential <==

   => LibXC <=

    Version 6.2.2
    S. Lehtola, C. Steigemann, M. J.T. Oliveira, and M. A.L. Marques.,  SoftwareX 7, 1–5 (2018) (10.1016/j.softx.2017.11.002)

   => Composite Functional: B3LYP <= 

    B3LYP Hyb-GGA Exchange-Correlation Functional

    P. J. Stephens, F. J. Devlin, C. F. Chabalowski, and M. J. Frisch.,  J. Phys. Chem. 98, 11623 (1994) (10.1021/j100096a001)

    Deriv               =              1
    GGA                 =           TRUE
    Meta                =          FALSE

    Exchange Hybrid     =           TRUE
    MP2 Hybrid          =          FALSE

   => Exchange Functionals <=

    0.0800   Slater exchange
    0.7200         Becke 88

   => Exact (HF) Exchange <=

    0.2000               HF 

   => Correlation Functionals <=

    0.1900   Vosko, Wilk & Nusair (VWN5_RPA)
    0.8100   Lee, Yang & Parr

   => LibXC Density Thresholds  <==

    XC_HYB_GGA_XC_B3LYP:  1.00E-15 

   => Molecular Quadrature <=

    Radial Scheme          =       TREUTLER
    Pruning Scheme         =           NONE
    Nuclear Scheme         =       TREUTLER

    Blocking Scheme        =         OCTREE
    BS radius alpha        =              1
    Pruning alpha          =              1
    Radial Points          =             75
    Spherical Points       =            302
    Total Points           =          43261
    Total Blocks           =            380
    Max Points             =            255
    Max Functions          =             19
    Weights Tolerance      =       1.00E-15

   => Loading Basis Set <=

    Name: (CC-PVDZ AUX)
    Role: JKFIT
    Keyword: DF_BASIS_SCF
    atoms 1 entry HE         line    34 file /Users/joseantoniorodriguesromero/anaconda3/share/psi4/basis/def2-universal-jkfit.gbs 
    atoms 2 entry F          line   271 file /Users/joseantoniorodriguesromero/anaconda3/share/psi4/basis/cc-pvdz-jkfit.gbs 

  ==> Integral Setup <==

  DFHelper Memory: AOs need 0.000 GiB; user supplied 0.343 GiB. 
  Using in-core AOs.

  ==> MemDFJK: Density-Fitted J/K Matrices <==

    J tasked:                   Yes
    K tasked:                   Yes
    wK tasked:                   No
    OpenMP threads:               1
    Memory [MiB]:               350
    Algorithm:                 Core
    Schwarz Cutoff:           1E-12
    Mask sparsity (%):       0.0000
    Fitting Condition:        1E-10

   => Auxiliary Basis Set <=

  Basis Set: (CC-PVDZ AUX)
    Blend: CC-PVDZ-JKFIT + DEF2-UNIVERSAL-JKFIT
    Number of shells: 33
    Number of basis functions: 93
    Number of Cartesian functions: 106
    Spherical Harmonics?: true
    Max angular momentum: 3

  Cached 100.0% of DFT collocation blocks in 0.024 [GiB].

  Minimum eigenvalue in the overlap matrix is 1.0404291457E-01.
  Reciprocal condition number of the overlap matrix is 4.3367024170E-02.
    Using symmetric orthogonalization.

  ==> Pre-Iterations <==

  SCF Guess: Superposition of Atomic Potentials (doi:10.1021/acs.jctc.8b01089).

  ==> SAP guess <==

   => Molecular Quadrature <=

    Radial Scheme          =       TREUTLER
    Pruning Scheme         =           NONE
    Nuclear Scheme         =       TREUTLER

    Blocking Scheme        =         OCTREE
    BS radius alpha        =              1
    Pruning alpha          =              1
    Radial Points          =             75
    Spherical Points       =            302
    Total Points           =          43261
    Total Blocks           =            380
    Max Points             =            255
    Max Functions          =             19
    Weights Tolerance      =       1.00E-15

   -------------------------------------------------------
    Irrep   Nso     Nmo     Nalpha   Nbeta   Ndocc  Nsocc
   -------------------------------------------------------
     A1        10      10       5       3       3       2
     A2         1       1       0       0       0       0
     B1         4       4       1       1       1       0
     B2         4       4       1       1       1       0
   -------------------------------------------------------
    Total      19      19       7       5       5       2
   -------------------------------------------------------

  ==> Iterations <==

                           Total Energy        Delta E     RMS |[F,P]|

   @DF-UKS iter   1:  -101.36058681878153   -1.01361e+02   3.65305e-02 ADIIS/DIIS
   @DF-UKS iter   2:  -101.35203951067749    8.54731e-03   4.00129e-02 ADIIS/DIIS/DAMP=1%
   @DF-UKS iter   3:  -101.40134945804770   -4.93099e-02   9.70260e-03 ADIIS/DIIS/DAMP=1%
   @DF-UKS iter   4:  -101.42115002416857   -1.98006e-02   4.38351e-03 ADIIS/DIIS/DAMP=1%
   @DF-UKS iter   5:  -101.41912043614010    2.02959e-03   1.67166e-04 ADIIS/DIIS/DAMP=1%
   @DF-UKS iter   6:  -101.41992394551981   -8.03509e-04   9.70943e-05 DIIS/DAMP=1%
   @DF-UKS iter   7:  -101.41991458974046    9.35578e-06   3.02058e-05 DIIS/DAMP=1%
   @DF-UKS iter   8:  -101.41991563486803   -1.04513e-06   4.29099e-06 DIIS/DAMP=1%
   @DF-UKS iter   9:  -101.41991961702296   -3.98215e-06   1.94066e-06 DIIS/DAMP=1%
   @DF-UKS iter  10:  -101.41991843346949    1.18355e-06   2.89170e-08 DIIS/DAMP=1%
   @DF-UKS iter  11:  -101.41991876301559   -3.29546e-07   7.75269e-09 DIIS/DAMP=1%
   @DF-UKS iter  12:  -101.41991876683839   -3.82281e-09   1.49031e-09 DIIS/DAMP=1%
  Energy and wave function converged.


  ==> Post-Iterations <==

   Electrons on quadrature grid:
      Nalpha   =    7.0000001270 ; deviation = 1.270e-07
      Nbeta    =    4.9999999760 ; deviation = -2.405e-08
      Ntotal   =   12.0000001030 ; deviation = 1.030e-07 

   @Spin Contamination Metric:   3.418886931E-03
   @S^2 Expected:                2.000000000E+00
   @S^2 Observed:                2.003418887E+00
   @S   Expected:                1.000000000E+00
   @S   Observed:                1.000000000E+00

    Orbital Energies [Eh]
    ---------------------

    Alpha Occupied:                                                       

       1A1   -24.259474     2A1    -0.795335     3A1    -0.333017  
       1B1    -0.013941     1B2    -0.013941     4A1     0.064548  
       5A1     1.274837  

    Alpha Virtual:                                                        

       2B1     1.471389     2B2     1.471389     6A1     1.576169  
       7A1     2.011388     3B1     2.612735     3B2     2.612735  
       8A1     2.845593     1A2     3.969975     9A1     3.969976  
       4B1     3.995654     4B2     3.995654    10A1     4.694084  

    Beta Occupied:                                                        

       1A1   -24.223529     2A1    -0.716366     3A1    -0.178748  
       1B1     0.014736     1B2     0.014736  

    Beta Virtual:                                                         

       4A1     0.332240     2B1     1.494152     2B2     1.494152  
       5A1     1.517074     6A1     1.723126     7A1     2.069689  
       3B1     2.672282     3B2     2.672282     8A1     2.919783  
       1A2     3.984685     9A1     3.984686     4B2     4.071197  
       4B1     4.071197    10A1     4.786720  

    Final Occupation by Irrep:
             A1    A2    B1    B2 
    DOCC [     3,    0,    1,    1 ]
    SOCC [     2,    0,    0,    0 ]
    NA   [     5,    0,    1,    1 ]
    NB   [     3,    0,    1,    1 ]

  @DF-UKS Final Energy:  -101.41991876683839

   => Energetics <=

    Nuclear Repulsion Energy =              7.9376581600500016
    One-Electron Energy =                -162.5692272445437823
    Two-Electron Energy =                  62.9392436606396970
    DFT Exchange-Correlation Energy =      -9.7275933429843242
    Empirical Dispersion Energy =           0.0000000000000000
    VV10 Nonlocal Energy =                  0.0000000000000000
    Total Energy =                       -101.4199187668383928

  UHF NO Occupations:
  HONO-2 :    3 A1 1.9986677
  HONO-1 :    4 A1 1.0000000
  HONO-0 :    5 A1 1.0000000
  LUNO+0 :    6 A1 0.0013323
  LUNO+1 :    7 A1 0.0002123
  LUNO+2 :    2 B2 0.0000829
  LUNO+3 :    2 B1 0.0000829


Computation Completed


Properties will be evaluated at   0.000000,   0.000000,   0.000000 [a0]

Properties computed using the SCF density matrix


 Multipole Moments:

 ------------------------------------------------------------------------------------
     Multipole            Electronic (a.u.)      Nuclear  (a.u.)        Total (a.u.)
 ------------------------------------------------------------------------------------

 L = 1.  Multiply by 2.5417464519 to convert [e a0] to [Debye]
 Dipole X            :          0.0000000            0.0000000            0.0000000
 Dipole Y            :          0.0000000            0.0000000            0.0000000
 Dipole Z            :         -0.8871833            0.1945554           -0.6926279
 Magnitude           :                                                    0.6926279

 ------------------------------------------------------------------------------------

*** tstop() called on Joses-MacBook-Pro-2.local at Thu Jul 17 09:20:20 2025
Module time:
	user time   =       1.25 seconds =       0.02 minutes
	system time =       2.31 seconds =       0.04 minutes
	total time  =          0 seconds =       0.00 minutes
Total time:
	user time   =       1.25 seconds =       0.02 minutes
	system time =       2.31 seconds =       0.04 minutes
	total time  =          0 seconds =       0.00 minutes

*** tstart() called on Joses-MacBook-Pro-2.local
*** at Thu Jul 17 09:20:20 2025


         ------------------------------------------------------------
                                   SCF GRAD                          
                          Rob Parrish, Justin Turney,                
                       Andy Simmonett, and Alex Sokolov              
         ------------------------------------------------------------

  ==> Geometry <==

    Molecular point group: c2v
    Full point group: C_inf_v

    Geometry (in Angstrom), charge = -1, multiplicity = 3:

       Center              X                  Y                   Z               Mass       
    ------------   -----------------  -----------------  -----------------  -----------------
         HE           0.000000000000     0.000000000000     0.991177663364     4.002603254130
         F            0.000000000000     0.000000000000    -0.208822336636    18.998403162730

  Nuclear repulsion =    7.937658160050002

  ==> Basis Set <==

  Basis Set: CC-PVDZ
    Blend: CC-PVDZ
    Number of shells: 9
    Number of basis functions: 19
    Number of Cartesian functions: 20
    Spherical Harmonics?: true
    Max angular momentum: 2

  ==> DFJKGrad: Density-Fitted SCF Gradients <==

    Gradient:                    1
    J tasked:                  Yes
    K tasked:                  Yes
    wK tasked:                  No
    OpenMP threads:              1
    Integrals threads:           1
    Memory [MiB]:              375
    Schwarz Cutoff:          1E-12
    Fitting Condition:       1E-10

   => Auxiliary Basis Set <=

  Basis Set: (CC-PVDZ AUX)
    Blend: CC-PVDZ-JKFIT + DEF2-UNIVERSAL-JKFIT
    Number of shells: 33
    Number of basis functions: 93
    Number of Cartesian functions: 106
    Spherical Harmonics?: true
    Max angular momentum: 3

  ==> DFT Potential <==

   => LibXC <=

    Version 6.2.2
    S. Lehtola, C. Steigemann, M. J.T. Oliveira, and M. A.L. Marques.,  SoftwareX 7, 1–5 (2018) (10.1016/j.softx.2017.11.002)

   => Composite Functional: B3LYP <= 

    B3LYP Hyb-GGA Exchange-Correlation Functional

    P. J. Stephens, F. J. Devlin, C. F. Chabalowski, and M. J. Frisch.,  J. Phys. Chem. 98, 11623 (1994) (10.1021/j100096a001)

    Deriv               =              1
    GGA                 =           TRUE
    Meta                =          FALSE

    Exchange Hybrid     =           TRUE
    MP2 Hybrid          =          FALSE

   => Exchange Functionals <=

    0.0800   Slater exchange
    0.7200         Becke 88

   => Exact (HF) Exchange <=

    0.2000               HF 

   => Correlation Functionals <=

    0.1900   Vosko, Wilk & Nusair (VWN5_RPA)
    0.8100   Lee, Yang & Parr

   => LibXC Density Thresholds  <==

    XC_HYB_GGA_XC_B3LYP:  1.00E-15 

   => Molecular Quadrature <=

    Radial Scheme          =       TREUTLER
    Pruning Scheme         =           NONE
    Nuclear Scheme         =       TREUTLER

    Blocking Scheme        =         OCTREE
    BS radius alpha        =              1
    Pruning alpha          =              1
    Radial Points          =             75
    Spherical Points       =            302
    Total Points           =          43261
    Total Blocks           =            380
    Max Points             =            255
    Max Functions          =             19
    Weights Tolerance      =       1.00E-15


  -Total Gradient:
     Atom            X                  Y                   Z
    ------   -----------------  -----------------  -----------------
       1        0.000000000000    -0.000000000000     0.005242673636
       2        0.000000000000     0.000000000000    -0.005241551967


*** tstop() called on Joses-MacBook-Pro-2.local at Thu Jul 17 09:20:20 2025
Module time:
	user time   =       0.34 seconds =       0.01 minutes
	system time =       0.88 seconds =       0.01 minutes
	total time  =          0 seconds =       0.00 minutes
Total time:
	user time   =       1.59 seconds =       0.03 minutes
	system time =       3.19 seconds =       0.05 minutes
	total time  =          0 seconds =       0.00 minutes

    			-----------------------------------------

    			 OPTKING 3.0: for geometry optimizations 

    			     By R.A. King, Bethel University     

    			        with contributions from          

    			    A.V. Copan, J. Cayton, A. Heide      

    			-----------------------------------------

    
	                            ===> Fragment 1 <== 

	 Z (Atomic Numbers)          Masses                          Geom                  
	       2.000000             4.002603          0.00000000  0.00000000  1.87305433   
	       9.000000            18.998403          0.00000000  0.00000000 -0.39461703   

	 - Coordinate -           - BOHR/RAD -       - ANG/DEG -
	 R(1,2)           =         2.267671           1.200000


	        --- Internal Coordinate Step in ANG or DEG, aJ/ANG or AJ/DEG ---
	-------------------------------------------------------------------------------
	           Coordinate      Previous         Force          Change          New 
	           ----------      --------        ------          ------        ------
	               R(1,2)       1.20000       -0.04319       -0.01124       1.18876
	-------------------------------------------------------------------------------

	                                 ==> Convergence Check <==                                  
    
	Measures of convergence in internal coordinates in au.
    
	Criteria marked as inactive (o), active & met (*), and active & unmet ( ).

	----------------------------------------------------------------------------------------------
	   Step    Total Energy     Delta E     Max Force     RMS Force      Max Disp      RMS Disp   
	----------------------------------------------------------------------------------------------
	  Convergence Criteria     1.00e-06 *    3.00e-04 *             o    1.20e-03 *             o
	----------------------------------------------------------------------------------------------
	     1    -101.41991877   -1.01e+02      5.24e-03      5.24e-03 o    2.12e-02      2.12e-02 o  ~
	----------------------------------------------------------------------------------------------

Next Geometry in Ang 
	Fragment 1 (Ang)

	   He   0.0000000000   0.0000000000   0.9855568989
	    F   0.0000000000   0.0000000000  -0.2032015722


    Structure for next step:
    Molecular point group: c2v
    Full point group: C_inf_v

    Geometry (in Angstrom), charge = -1, multiplicity = 3:

    HE           0.000000000000     0.000000000000     0.981892369753
    F            0.000000000000     0.000000000000    -0.206866101362


Scratch directory: /tmp/
gradient() will perform analytic gradient computation.
   => Libint2 <=

    Primary   basis highest AM E, G, H:  6, 6, 3
    Auxiliary basis highest AM E, G, H:  7, 7, 4
    Onebody   basis highest AM E, G, H:  -, -, -
    Solid Harmonics ordering:            Gaussian

*** tstart() called on Joses-MacBook-Pro-2.local
*** at Thu Jul 17 09:20:20 2025

   => Loading Basis Set <=

    Name: CC-PVDZ
    Role: ORBITAL
    Keyword: BASIS
    atoms 1 entry HE         line    32 file /Users/joseantoniorodriguesromero/anaconda3/share/psi4/basis/cc-pvdz.gbs 
    atoms 2 entry F          line   228 file /Users/joseantoniorodriguesromero/anaconda3/share/psi4/basis/cc-pvdz.gbs 


         ---------------------------------------------------------
                                   SCF
               by Justin Turney, Rob Parrish, Andy Simmonett
                          and Daniel G. A. Smith
                              UKS Reference
                        1 Threads,    500 MiB Core
         ---------------------------------------------------------

  ==> Geometry <==

    Molecular point group: c2v
    Full point group: C_inf_v

    Geometry (in Angstrom), charge = -1, multiplicity = 3:

       Center              X                  Y                   Z               Mass       
    ------------   -----------------  -----------------  -----------------  -----------------
         HE           0.000000000000     0.000000000000     0.981892369753     4.002603254130
         F            0.000000000000     0.000000000000    -0.206866101362    18.998403162730

  Running in c2v symmetry.

  Rotational constants: A = ************  B =      3.60825  C =      3.60825 [cm^-1]
  Rotational constants: A = ************  B = 108172.56934  C = 108172.56934 [MHz]
  Nuclear repulsion =    8.012720854160822

  Charge       = -1
  Multiplicity = 3
  Electrons    = 12
  Nalpha       = 7
  Nbeta        = 5

  ==> Algorithm <==

  SCF Algorithm Type is DF.
  DIIS enabled.
  MOM disabled.
  Fractional occupation disabled.
  Guess Type is READ.
  Energy threshold   = 1.00e-08
  Density threshold  = 1.00e-08
  Integral threshold = 1.00e-12

  ==> Primary Basis <==

  Basis Set: CC-PVDZ
    Blend: CC-PVDZ
    Number of shells: 9
    Number of basis functions: 19
    Number of Cartesian functions: 20
    Spherical Harmonics?: true
    Max angular momentum: 2

  ==> DFT Potential <==

   => LibXC <=

    Version 6.2.2
    S. Lehtola, C. Steigemann, M. J.T. Oliveira, and M. A.L. Marques.,  SoftwareX 7, 1–5 (2018) (10.1016/j.softx.2017.11.002)

   => Composite Functional: B3LYP <= 

    B3LYP Hyb-GGA Exchange-Correlation Functional

    P. J. Stephens, F. J. Devlin, C. F. Chabalowski, and M. J. Frisch.,  J. Phys. Chem. 98, 11623 (1994) (10.1021/j100096a001)

    Deriv               =              1
    GGA                 =           TRUE
    Meta                =          FALSE

    Exchange Hybrid     =           TRUE
    MP2 Hybrid          =          FALSE

   => Exchange Functionals <=

    0.0800   Slater exchange
    0.7200         Becke 88

   => Exact (HF) Exchange <=

    0.2000               HF 

   => Correlation Functionals <=

    0.1900   Vosko, Wilk & Nusair (VWN5_RPA)
    0.8100   Lee, Yang & Parr

   => LibXC Density Thresholds  <==

    XC_HYB_GGA_XC_B3LYP:  1.00E-15 

   => Molecular Quadrature <=

    Radial Scheme          =       TREUTLER
    Pruning Scheme         =           NONE
    Nuclear Scheme         =       TREUTLER

    Blocking Scheme        =         OCTREE
    BS radius alpha        =              1
    Pruning alpha          =              1
    Radial Points          =             75
    Spherical Points       =            302
    Total Points           =          43260
    Total Blocks           =            376
    Max Points             =            256
    Max Functions          =             19
    Weights Tolerance      =       1.00E-15

   => Loading Basis Set <=

    Name: (CC-PVDZ AUX)
    Role: JKFIT
    Keyword: DF_BASIS_SCF
    atoms 1 entry HE         line    34 file /Users/joseantoniorodriguesromero/anaconda3/share/psi4/basis/def2-universal-jkfit.gbs 
    atoms 2 entry F          line   271 file /Users/joseantoniorodriguesromero/anaconda3/share/psi4/basis/cc-pvdz-jkfit.gbs 

   => Loading Basis Set <=

    Name: CC-PVDZ
    Role: ORBITAL
    Keyword: BASIS
    atoms 1 entry HE         line    32 file /Users/joseantoniorodriguesromero/anaconda3/share/psi4/basis/cc-pvdz.gbs 
    atoms 2 entry F          line   228 file /Users/joseantoniorodriguesromero/anaconda3/share/psi4/basis/cc-pvdz.gbs 

  Reading orbitals from file /tmp/triplet_HeF.default.71844.180.npy, no projection.

  ==> Integral Setup <==

  DFHelper Memory: AOs need 0.000 GiB; user supplied 0.343 GiB. 
  Using in-core AOs.

  ==> MemDFJK: Density-Fitted J/K Matrices <==

    J tasked:                   Yes
    K tasked:                   Yes
    wK tasked:                   No
    OpenMP threads:               1
    Memory [MiB]:               350
    Algorithm:                 Core
    Schwarz Cutoff:           1E-12
    Mask sparsity (%):       0.0000
    Fitting Condition:        1E-10

   => Auxiliary Basis Set <=

  Basis Set: (CC-PVDZ AUX)
    Blend: CC-PVDZ-JKFIT + DEF2-UNIVERSAL-JKFIT
    Number of shells: 33
    Number of basis functions: 93
    Number of Cartesian functions: 106
    Spherical Harmonics?: true
    Max angular momentum: 3

  Cached 100.0% of DFT collocation blocks in 0.024 [GiB].

  Minimum eigenvalue in the overlap matrix is 1.0209489031E-01.
  Reciprocal condition number of the overlap matrix is 4.2319147836E-02.
    Using symmetric orthogonalization.

  ==> Pre-Iterations <==

  SCF Guess: Orbitals guess was supplied from a previous computation.

   -------------------------------------------------------
    Irrep   Nso     Nmo     Nalpha   Nbeta   Ndocc  Nsocc
   -------------------------------------------------------
     A1        10      10       5       3       3       2
     A2         1       1       0       0       0       0
     B1         4       4       1       1       1       0
     B2         4       4       1       1       1       0
   -------------------------------------------------------
    Total      19      19       7       5       5       2
   -------------------------------------------------------

  ==> Iterations <==

                           Total Energy        Delta E     RMS |[F,P]|

   @DF-UKS iter   0:  -101.42680029689636   -1.01427e+02   3.86415e-03 
   @DF-UKS iter   1:  -101.41991455164784    6.88575e-03   4.97638e-04 ADIIS/DIIS
   @DF-UKS iter   2:  -101.41990246666671    1.20850e-05   7.57991e-04 ADIIS/DIIS/DAMP=1%
   @DF-UKS iter   3:  -101.41973792411764    1.64543e-04   7.01745e-05 DIIS/DAMP=1%
   @DF-UKS iter   4:  -101.41994751285606   -2.09589e-04   5.20921e-05 DIIS/DAMP=1%
   @DF-UKS iter   5:  -101.41992872258641    1.87903e-05   1.56935e-05 DIIS/DAMP=1%
   @DF-UKS iter   6:  -101.41992936973500   -6.47149e-07   2.59000e-06 DIIS/DAMP=1%
   @DF-UKS iter   7:  -101.41993237849680   -3.00876e-06   3.61387e-07 DIIS/DAMP=1%
   @DF-UKS iter   8:  -101.41993207756009    3.00937e-07   3.75595e-08 DIIS/DAMP=1%
   @DF-UKS iter   9:  -101.41993211354122   -3.59811e-08   6.76819e-09 DIIS/DAMP=1%
   @DF-UKS iter  10:  -101.41993211881019   -5.26897e-09   4.77531e-10 DIIS/DAMP=1%
  Energy and wave function converged.


  ==> Post-Iterations <==

   Electrons on quadrature grid:
      Nalpha   =    7.0000001356 ; deviation = 1.356e-07
      Nbeta    =    4.9999999768 ; deviation = -2.315e-08
      Ntotal   =   12.0000001124 ; deviation = 1.124e-07 

   @Spin Contamination Metric:   3.391524750E-03
   @S^2 Expected:                2.000000000E+00
   @S^2 Observed:                2.003391525E+00
   @S   Expected:                1.000000000E+00
   @S   Observed:                1.000000000E+00

    Orbital Energies [Eh]
    ---------------------

    Alpha Occupied:                                                       

       1A1   -24.258093     2A1    -0.796841     3A1    -0.334322  
       1B2    -0.013366     1B1    -0.013366     4A1     0.070823  
       5A1     1.270975  

    Alpha Virtual:                                                        

       2B1     1.472006     2B2     1.472006     6A1     1.575319  
       7A1     2.018954     3B1     2.610613     3B2     2.610613  
       8A1     2.850133     1A2     3.970544     9A1     3.970544  
       4B2     4.002565     4B1     4.002565    10A1     4.720195  

    Beta Occupied:                                                        

       1A1   -24.222444     2A1    -0.718075     3A1    -0.179803  
       1B2     0.015053     1B1     0.015053  

    Beta Virtual:                                                         

       4A1     0.337911     2B1     1.494569     2B2     1.494569  
       5A1     1.514743     6A1     1.720566     7A1     2.077039  
       3B2     2.670869     3B1     2.670869     8A1     2.924726  
       1A2     3.985210     9A1     3.985210     4B2     4.077374  
       4B1     4.077374    10A1     4.812533  

    Final Occupation by Irrep:
             A1    A2    B1    B2 
    DOCC [     3,    0,    1,    1 ]
    SOCC [     2,    0,    0,    0 ]
    NA   [     5,    0,    1,    1 ]
    NB   [     3,    0,    1,    1 ]

  @DF-UKS Final Energy:  -101.41993211881019

   => Energetics <=

    Nuclear Repulsion Energy =              8.0127208541608219
    One-Electron Energy =                -162.7185141208564119
    Two-Electron Energy =                  63.0164077634461819
    DFT Exchange-Correlation Energy =      -9.7305466155607814
    Empirical Dispersion Energy =           0.0000000000000000
    VV10 Nonlocal Energy =                  0.0000000000000000
    Total Energy =                       -101.4199321188101948

  UHF NO Occupations:
  HONO-2 :    3 A1 1.9986758
  HONO-1 :    4 A1 1.0000000
  HONO-0 :    5 A1 1.0000000
  LUNO+0 :    6 A1 0.0013242
  LUNO+1 :    7 A1 0.0002067
  LUNO+2 :    2 B2 0.0000828
  LUNO+3 :    2 B1 0.0000828


Computation Completed


Properties will be evaluated at   0.000000,   0.000000,   0.000000 [a0]

Properties computed using the SCF density matrix


 Multipole Moments:

 ------------------------------------------------------------------------------------
     Multipole            Electronic (a.u.)      Nuclear  (a.u.)        Total (a.u.)
 ------------------------------------------------------------------------------------

 L = 1.  Multiply by 2.5417464519 to convert [e a0] to [Debye]
 Dipole X            :          0.0000000            0.0000000            0.0000000
 Dipole Y            :          0.0000000            0.0000000            0.0000000
 Dipole Z            :         -0.8870362            0.1927328           -0.6943033
 Magnitude           :                                                    0.6943033

 ------------------------------------------------------------------------------------

*** tstop() called on Joses-MacBook-Pro-2.local at Thu Jul 17 09:20:21 2025
Module time:
	user time   =       1.31 seconds =       0.02 minutes
	system time =       2.97 seconds =       0.05 minutes
	total time  =          1 seconds =       0.02 minutes
Total time:
	user time   =       2.96 seconds =       0.05 minutes
	system time =       6.52 seconds =       0.11 minutes
	total time  =          1 seconds =       0.02 minutes

*** tstart() called on Joses-MacBook-Pro-2.local
*** at Thu Jul 17 09:20:21 2025


         ------------------------------------------------------------
                                   SCF GRAD                          
                          Rob Parrish, Justin Turney,                
                       Andy Simmonett, and Alex Sokolov              
         ------------------------------------------------------------

  ==> Geometry <==

    Molecular point group: c2v
    Full point group: C_inf_v

    Geometry (in Angstrom), charge = -1, multiplicity = 3:

       Center              X                  Y                   Z               Mass       
    ------------   -----------------  -----------------  -----------------  -----------------
         HE           0.000000000000     0.000000000000     0.981892369753     4.002603254130
         F            0.000000000000     0.000000000000    -0.206866101362    18.998403162730

  Nuclear repulsion =    8.012720854160822

  ==> Basis Set <==

  Basis Set: CC-PVDZ
    Blend: CC-PVDZ
    Number of shells: 9
    Number of basis functions: 19
    Number of Cartesian functions: 20
    Spherical Harmonics?: true
    Max angular momentum: 2

  ==> DFJKGrad: Density-Fitted SCF Gradients <==

    Gradient:                    1
    J tasked:                  Yes
    K tasked:                  Yes
    wK tasked:                  No
    OpenMP threads:              1
    Integrals threads:           1
    Memory [MiB]:              375
    Schwarz Cutoff:          1E-12
    Fitting Condition:       1E-10

   => Auxiliary Basis Set <=

  Basis Set: (CC-PVDZ AUX)
    Blend: CC-PVDZ-JKFIT + DEF2-UNIVERSAL-JKFIT
    Number of shells: 33
    Number of basis functions: 93
    Number of Cartesian functions: 106
    Spherical Harmonics?: true
    Max angular momentum: 3

  ==> DFT Potential <==

   => LibXC <=

    Version 6.2.2
    S. Lehtola, C. Steigemann, M. J.T. Oliveira, and M. A.L. Marques.,  SoftwareX 7, 1–5 (2018) (10.1016/j.softx.2017.11.002)

   => Composite Functional: B3LYP <= 

    B3LYP Hyb-GGA Exchange-Correlation Functional

    P. J. Stephens, F. J. Devlin, C. F. Chabalowski, and M. J. Frisch.,  J. Phys. Chem. 98, 11623 (1994) (10.1021/j100096a001)

    Deriv               =              1
    GGA                 =           TRUE
    Meta                =          FALSE

    Exchange Hybrid     =           TRUE
    MP2 Hybrid          =          FALSE

   => Exchange Functionals <=

    0.0800   Slater exchange
    0.7200         Becke 88

   => Exact (HF) Exchange <=

    0.2000               HF 

   => Correlation Functionals <=

    0.1900   Vosko, Wilk & Nusair (VWN5_RPA)
    0.8100   Lee, Yang & Parr

   => LibXC Density Thresholds  <==

    XC_HYB_GGA_XC_B3LYP:  1.00E-15 

   => Molecular Quadrature <=

    Radial Scheme          =       TREUTLER
    Pruning Scheme         =           NONE
    Nuclear Scheme         =       TREUTLER

    Blocking Scheme        =         OCTREE
    BS radius alpha        =              1
    Pruning alpha          =              1
    Radial Points          =             75
    Spherical Points       =            302
    Total Points           =          43260
    Total Blocks           =            376
    Max Points             =            256
    Max Functions          =             19
    Weights Tolerance      =       1.00E-15


  -Total Gradient:
     Atom            X                  Y                   Z
    ------   -----------------  -----------------  -----------------
       1        0.000000000000     0.000000000000    -0.004098380496
       2        0.000000000000    -0.000000000000     0.004099227324


*** tstop() called on Joses-MacBook-Pro-2.local at Thu Jul 17 09:20:21 2025
Module time:
	user time   =       0.31 seconds =       0.01 minutes
	system time =       0.70 seconds =       0.01 minutes
	total time  =          0 seconds =       0.00 minutes
Total time:
	user time   =       3.28 seconds =       0.05 minutes
	system time =       7.22 seconds =       0.12 minutes
	total time  =          1 seconds =       0.02 minutes

    			-----------------------------------------

    			 OPTKING 3.0: for geometry optimizations 

    			     By R.A. King, Bethel University     

    			        with contributions from          

    			    A.V. Copan, J. Cayton, A. Heide      

    			-----------------------------------------

    
	                            ===> Fragment 1 <== 

	 Z (Atomic Numbers)          Masses                          Geom                  
	       2.000000             4.002603          0.00000000  0.00000000  1.85550766   
	       9.000000            18.998403          0.00000000  0.00000000 -0.39092028   

	 - Coordinate -           - BOHR/RAD -       - ANG/DEG -
	 R(1,2)           =         2.246428           1.188758


	        --- Internal Coordinate Step in ANG or DEG, aJ/ANG or AJ/DEG ---
	-------------------------------------------------------------------------------
	           Coordinate      Previous         Force          Change          New 
	           ----------      --------        ------          ------        ------
	               R(1,2)       1.18876        0.03377        0.00493       1.19369
	-------------------------------------------------------------------------------

	                                 ==> Convergence Check <==                                  
    
	Measures of convergence in internal coordinates in au.
    
	Criteria marked as inactive (o), active & met (*), and active & unmet ( ).

	----------------------------------------------------------------------------------------------
	   Step    Total Energy     Delta E     Max Force     RMS Force      Max Disp      RMS Disp   
	----------------------------------------------------------------------------------------------
	  Convergence Criteria     1.00e-06 *    3.00e-04 *             o    1.20e-03 *             o
	----------------------------------------------------------------------------------------------
	     2    -101.41993212   -1.34e-05      4.10e-03      4.10e-03 o    9.32e-03      9.32e-03 o  ~
	----------------------------------------------------------------------------------------------

Next Geometry in Ang 
	Fragment 1 (Ang)

	   He   0.0000000000   0.0000000000   0.9843585527
	    F   0.0000000000   0.0000000000  -0.2093322843


    Structure for next step:
    Molecular point group: c2v
    Full point group: C_inf_v

    Geometry (in Angstrom), charge = -1, multiplicity = 3:

    HE           0.000000000000     0.000000000000     0.985966412214
    F            0.000000000000     0.000000000000    -0.207724424847


Scratch directory: /tmp/
gradient() will perform analytic gradient computation.
   => Libint2 <=

    Primary   basis highest AM E, G, H:  6, 6, 3
    Auxiliary basis highest AM E, G, H:  7, 7, 4
    Onebody   basis highest AM E, G, H:  -, -, -
    Solid Harmonics ordering:            Gaussian

*** tstart() called on Joses-MacBook-Pro-2.local
*** at Thu Jul 17 09:20:21 2025

   => Loading Basis Set <=

    Name: CC-PVDZ
    Role: ORBITAL
    Keyword: BASIS
    atoms 1 entry HE         line    32 file /Users/joseantoniorodriguesromero/anaconda3/share/psi4/basis/cc-pvdz.gbs 
    atoms 2 entry F          line   228 file /Users/joseantoniorodriguesromero/anaconda3/share/psi4/basis/cc-pvdz.gbs 


         ---------------------------------------------------------
                                   SCF
               by Justin Turney, Rob Parrish, Andy Simmonett
                          and Daniel G. A. Smith
                              UKS Reference
                        1 Threads,    500 MiB Core
         ---------------------------------------------------------

  ==> Geometry <==

    Molecular point group: c2v
    Full point group: C_inf_v

    Geometry (in Angstrom), charge = -1, multiplicity = 3:

       Center              X                  Y                   Z               Mass       
    ------------   -----------------  -----------------  -----------------  -----------------
         HE           0.000000000000     0.000000000000     0.985966412214     4.002603254130
         F            0.000000000000     0.000000000000    -0.207724424847    18.998403162730

  Running in c2v symmetry.

  Rotational constants: A = ************  B =      3.57849  C =      3.57849 [cm^-1]
  Rotational constants: A = ************  B = 107280.47172  C = 107280.47172 [MHz]
  Nuclear repulsion =    7.979612053911518

  Charge       = -1
  Multiplicity = 3
  Electrons    = 12
  Nalpha       = 7
  Nbeta        = 5

  ==> Algorithm <==

  SCF Algorithm Type is DF.
  DIIS enabled.
  MOM disabled.
  Fractional occupation disabled.
  Guess Type is READ.
  Energy threshold   = 1.00e-08
  Density threshold  = 1.00e-08
  Integral threshold = 1.00e-12

  ==> Primary Basis <==

  Basis Set: CC-PVDZ
    Blend: CC-PVDZ
    Number of shells: 9
    Number of basis functions: 19
    Number of Cartesian functions: 20
    Spherical Harmonics?: true
    Max angular momentum: 2

  ==> DFT Potential <==

   => LibXC <=

    Version 6.2.2
    S. Lehtola, C. Steigemann, M. J.T. Oliveira, and M. A.L. Marques.,  SoftwareX 7, 1–5 (2018) (10.1016/j.softx.2017.11.002)

   => Composite Functional: B3LYP <= 

    B3LYP Hyb-GGA Exchange-Correlation Functional

    P. J. Stephens, F. J. Devlin, C. F. Chabalowski, and M. J. Frisch.,  J. Phys. Chem. 98, 11623 (1994) (10.1021/j100096a001)

    Deriv               =              1
    GGA                 =           TRUE
    Meta                =          FALSE

    Exchange Hybrid     =           TRUE
    MP2 Hybrid          =          FALSE

   => Exchange Functionals <=

    0.0800   Slater exchange
    0.7200         Becke 88

   => Exact (HF) Exchange <=

    0.2000               HF 

   => Correlation Functionals <=

    0.1900   Vosko, Wilk & Nusair (VWN5_RPA)
    0.8100   Lee, Yang & Parr

   => LibXC Density Thresholds  <==

    XC_HYB_GGA_XC_B3LYP:  1.00E-15 

   => Molecular Quadrature <=

    Radial Scheme          =       TREUTLER
    Pruning Scheme         =           NONE
    Nuclear Scheme         =       TREUTLER

    Blocking Scheme        =         OCTREE
    BS radius alpha        =              1
    Pruning alpha          =              1
    Radial Points          =             75
    Spherical Points       =            302
    Total Points           =          43261
    Total Blocks           =            379
    Max Points             =            256
    Max Functions          =             19
    Weights Tolerance      =       1.00E-15

   => Loading Basis Set <=

    Name: (CC-PVDZ AUX)
    Role: JKFIT
    Keyword: DF_BASIS_SCF
    atoms 1 entry HE         line    34 file /Users/joseantoniorodriguesromero/anaconda3/share/psi4/basis/def2-universal-jkfit.gbs 
    atoms 2 entry F          line   271 file /Users/joseantoniorodriguesromero/anaconda3/share/psi4/basis/cc-pvdz-jkfit.gbs 

   => Loading Basis Set <=

    Name: CC-PVDZ
    Role: ORBITAL
    Keyword: BASIS
    atoms 1 entry HE         line    32 file /Users/joseantoniorodriguesromero/anaconda3/share/psi4/basis/cc-pvdz.gbs 
    atoms 2 entry F          line   228 file /Users/joseantoniorodriguesromero/anaconda3/share/psi4/basis/cc-pvdz.gbs 

  Reading orbitals from file /tmp/triplet_HeF.default.71844.180.npy, no projection.

  ==> Integral Setup <==

  DFHelper Memory: AOs need 0.000 GiB; user supplied 0.343 GiB. 
  Using in-core AOs.

  ==> MemDFJK: Density-Fitted J/K Matrices <==

    J tasked:                   Yes
    K tasked:                   Yes
    wK tasked:                   No
    OpenMP threads:               1
    Memory [MiB]:               350
    Algorithm:                 Core
    Schwarz Cutoff:           1E-12
    Mask sparsity (%):       0.0000
    Fitting Condition:        1E-10

   => Auxiliary Basis Set <=

  Basis Set: (CC-PVDZ AUX)
    Blend: CC-PVDZ-JKFIT + DEF2-UNIVERSAL-JKFIT
    Number of shells: 33
    Number of basis functions: 93
    Number of Cartesian functions: 106
    Spherical Harmonics?: true
    Max angular momentum: 3

  Cached 100.0% of DFT collocation blocks in 0.024 [GiB].

  Minimum eigenvalue in the overlap matrix is 1.0294961980E-01.
  Reciprocal condition number of the overlap matrix is 4.2777695123E-02.
    Using symmetric orthogonalization.

  ==> Pre-Iterations <==

  SCF Guess: Orbitals guess was supplied from a previous computation.

   -------------------------------------------------------
    Irrep   Nso     Nmo     Nalpha   Nbeta   Ndocc  Nsocc
   -------------------------------------------------------
     A1        10      10       5       3       3       2
     A2         1       1       0       0       0       0
     B1         4       4       1       1       1       0
     B2         4       4       1       1       1       0
   -------------------------------------------------------
    Total      19      19       7       5       5       2
   -------------------------------------------------------

  ==> Iterations <==

                           Total Energy        Delta E     RMS |[F,P]|

   @DF-UKS iter   0:  -101.41693730323807   -1.01417e+02   1.72701e-03 
   @DF-UKS iter   1:  -101.41994732032633   -3.01002e-03   2.21206e-04 ADIIS/DIIS
   @DF-UKS iter   2:  -101.41994492272094    2.39761e-06   3.35880e-04 ADIIS/DIIS/DAMP=1%
   @DF-UKS iter   3:  -101.42003631800782   -9.13953e-05   3.21313e-05 DIIS/DAMP=1%
   @DF-UKS iter   4:  -101.41994351203921    9.28060e-05   2.33639e-05 DIIS/DAMP=1%
   @DF-UKS iter   5:  -101.41995199204871   -8.48001e-06   7.59906e-06 DIIS/DAMP=1%
   @DF-UKS iter   6:  -101.41995202887989   -3.68312e-08   1.16364e-06 DIIS/DAMP=1%
   @DF-UKS iter   7:  -101.41995062591749    1.40296e-06   1.69635e-07 DIIS/DAMP=1%
   @DF-UKS iter   8:  -101.41995074797381   -1.22056e-07   1.63771e-08 DIIS/DAMP=1%
   @DF-UKS iter   9:  -101.41995072960945    1.83644e-08   2.90802e-09 DIIS/DAMP=1%
   @DF-UKS iter  10:  -101.41995072742314    2.18631e-09   2.24988e-10 DIIS/DAMP=1%
  Energy and wave function converged.


  ==> Post-Iterations <==

   Electrons on quadrature grid:
      Nalpha   =    7.0000001319 ; deviation = 1.319e-07
      Nbeta    =    4.9999999762 ; deviation = -2.380e-08
      Ntotal   =   12.0000001081 ; deviation = 1.081e-07 

   @Spin Contamination Metric:   3.403929618E-03
   @S^2 Expected:                2.000000000E+00
   @S^2 Observed:                2.003403930E+00
   @S   Expected:                1.000000000E+00
   @S   Observed:                1.000000000E+00

    Orbital Energies [Eh]
    ---------------------

    Alpha Occupied:                                                       

       1A1   -24.258703     2A1    -0.796161     3A1    -0.333754  
       1B2    -0.013616     1B1    -0.013616     4A1     0.068049  
       5A1     1.272667  

    Alpha Virtual:                                                        

       2B2     1.471734     2B1     1.471734     6A1     1.575711  
       7A1     2.015667     3B2     2.611562     3B1     2.611562  
       8A1     2.847997     1A2     3.970296     9A1     3.970297  
       4B1     3.999488     4B2     3.999488    10A1     4.708765  

    Beta Occupied:                                                        

       1A1   -24.222926     2A1    -0.717312     3A1    -0.179330  
       1B2     0.014915     1B1     0.014915  

    Beta Virtual:                                                         

       4A1     0.335399     2B2     1.494383     2B1     1.494383  
       5A1     1.515759     6A1     1.721713     7A1     2.073854  
       3B1     2.671512     3B2     2.671512     8A1     2.922408  
       1A2     3.984980     9A1     3.984981     4B1     4.074617  
       4B2     4.074617    10A1     4.801227  

    Final Occupation by Irrep:
             A1    A2    B1    B2 
    DOCC [     3,    0,    1,    1 ]
    SOCC [     2,    0,    0,    0 ]
    NA   [     5,    0,    1,    1 ]
    NB   [     3,    0,    1,    1 ]

  @DF-UKS Final Energy:  -101.41995072742314

   => Energetics <=

    Nuclear Repulsion Energy =              7.9796120539115183
    One-Electron Energy =                -162.6527330220619376
    Two-Electron Energy =                  62.9824084067258454
    DFT Exchange-Correlation Energy =      -9.7292381659985718
    Empirical Dispersion Energy =           0.0000000000000000
    VV10 Nonlocal Energy =                  0.0000000000000000
    Total Energy =                       -101.4199507274231280

  UHF NO Occupations:
  HONO-2 :    3 A1 1.9986720
  HONO-1 :    4 A1 1.0000000
  HONO-0 :    5 A1 1.0000000
  LUNO+0 :    6 A1 0.0013280
  LUNO+1 :    7 A1 0.0002092
  LUNO+2 :    2 B2 0.0000828
  LUNO+3 :    2 B1 0.0000828


Computation Completed


Properties will be evaluated at   0.000000,   0.000000,   0.000000 [a0]

Properties computed using the SCF density matrix


 Multipole Moments:

 ------------------------------------------------------------------------------------
     Multipole            Electronic (a.u.)      Nuclear  (a.u.)        Total (a.u.)
 ------------------------------------------------------------------------------------

 L = 1.  Multiply by 2.5417464519 to convert [e a0] to [Debye]
 Dipole X            :          0.0000000            0.0000000            0.0000000
 Dipole Y            :          0.0000000            0.0000000            0.0000000
 Dipole Z            :         -0.8871218            0.1935325           -0.6935892
 Magnitude           :                                                    0.6935892

 ------------------------------------------------------------------------------------

*** tstop() called on Joses-MacBook-Pro-2.local at Thu Jul 17 09:20:21 2025
Module time:
	user time   =       0.93 seconds =       0.02 minutes
	system time =       3.08 seconds =       0.05 minutes
	total time  =          0 seconds =       0.00 minutes
Total time:
	user time   =       4.26 seconds =       0.07 minutes
	system time =      10.57 seconds =       0.18 minutes
	total time  =          1 seconds =       0.02 minutes

*** tstart() called on Joses-MacBook-Pro-2.local
*** at Thu Jul 17 09:20:21 2025


         ------------------------------------------------------------
                                   SCF GRAD                          
                          Rob Parrish, Justin Turney,                
                       Andy Simmonett, and Alex Sokolov              
         ------------------------------------------------------------

  ==> Geometry <==

    Molecular point group: c2v
    Full point group: C_inf_v

    Geometry (in Angstrom), charge = -1, multiplicity = 3:

       Center              X                  Y                   Z               Mass       
    ------------   -----------------  -----------------  -----------------  -----------------
         HE           0.000000000000     0.000000000000     0.985966412214     4.002603254130
         F            0.000000000000     0.000000000000    -0.207724424847    18.998403162730

  Nuclear repulsion =    7.979612053911518

  ==> Basis Set <==

  Basis Set: CC-PVDZ
    Blend: CC-PVDZ
    Number of shells: 9
    Number of basis functions: 19
    Number of Cartesian functions: 20
    Spherical Harmonics?: true
    Max angular momentum: 2

  ==> DFJKGrad: Density-Fitted SCF Gradients <==

    Gradient:                    1
    J tasked:                  Yes
    K tasked:                  Yes
    wK tasked:                  No
    OpenMP threads:              1
    Integrals threads:           1
    Memory [MiB]:              375
    Schwarz Cutoff:          1E-12
    Fitting Condition:       1E-10

   => Auxiliary Basis Set <=

  Basis Set: (CC-PVDZ AUX)
    Blend: CC-PVDZ-JKFIT + DEF2-UNIVERSAL-JKFIT
    Number of shells: 33
    Number of basis functions: 93
    Number of Cartesian functions: 106
    Spherical Harmonics?: true
    Max angular momentum: 3

  ==> DFT Potential <==

   => LibXC <=

    Version 6.2.2
    S. Lehtola, C. Steigemann, M. J.T. Oliveira, and M. A.L. Marques.,  SoftwareX 7, 1–5 (2018) (10.1016/j.softx.2017.11.002)

   => Composite Functional: B3LYP <= 

    B3LYP Hyb-GGA Exchange-Correlation Functional

    P. J. Stephens, F. J. Devlin, C. F. Chabalowski, and M. J. Frisch.,  J. Phys. Chem. 98, 11623 (1994) (10.1021/j100096a001)

    Deriv               =              1
    GGA                 =           TRUE
    Meta                =          FALSE

    Exchange Hybrid     =           TRUE
    MP2 Hybrid          =          FALSE

   => Exchange Functionals <=

    0.0800   Slater exchange
    0.7200         Becke 88

   => Exact (HF) Exchange <=

    0.2000               HF 

   => Correlation Functionals <=

    0.1900   Vosko, Wilk & Nusair (VWN5_RPA)
    0.8100   Lee, Yang & Parr

   => LibXC Density Thresholds  <==

    XC_HYB_GGA_XC_B3LYP:  1.00E-15 

   => Molecular Quadrature <=

    Radial Scheme          =       TREUTLER
    Pruning Scheme         =           NONE
    Nuclear Scheme         =       TREUTLER

    Blocking Scheme        =         OCTREE
    BS radius alpha        =              1
    Pruning alpha          =              1
    Radial Points          =             75
    Spherical Points       =            302
    Total Points           =          43261
    Total Blocks           =            379
    Max Points             =            256
    Max Functions          =             19
    Weights Tolerance      =       1.00E-15


  -Total Gradient:
     Atom            X                  Y                   Z
    ------   -----------------  -----------------  -----------------
       1        0.000000000000    -0.000000000000     0.000084198223
       2        0.000000000000     0.000000000000    -0.000083237701


*** tstop() called on Joses-MacBook-Pro-2.local at Thu Jul 17 09:20:22 2025
Module time:
	user time   =       0.32 seconds =       0.01 minutes
	system time =       0.71 seconds =       0.01 minutes
	total time  =          1 seconds =       0.02 minutes
Total time:
	user time   =       4.58 seconds =       0.08 minutes
	system time =      11.28 seconds =       0.19 minutes
	total time  =          2 seconds =       0.03 minutes

    			-----------------------------------------

    			 OPTKING 3.0: for geometry optimizations 

    			     By R.A. King, Bethel University     

    			        with contributions from          

    			    A.V. Copan, J. Cayton, A. Heide      

    			-----------------------------------------

    
	                            ===> Fragment 1 <== 

	 Z (Atomic Numbers)          Masses                          Geom                  
	       2.000000             4.002603          0.00000000  0.00000000  1.86320649   
	       9.000000            18.998403          0.00000000  0.00000000 -0.39254227   

	 - Coordinate -           - BOHR/RAD -       - ANG/DEG -
	 R(1,2)           =         2.255749           1.193691


	        --- Internal Coordinate Step in ANG or DEG, aJ/ANG or AJ/DEG ---
	-------------------------------------------------------------------------------
	           Coordinate      Previous         Force          Change          New 
	           ----------      --------        ------          ------        ------
	               R(1,2)       1.19369       -0.00069       -0.00010       1.19359
	-------------------------------------------------------------------------------

	                                 ==> Convergence Check <==                                  
    
	Measures of convergence in internal coordinates in au.
    
	Criteria marked as inactive (o), active & met (*), and active & unmet ( ).

	----------------------------------------------------------------------------------------------
	   Step    Total Energy     Delta E     Max Force     RMS Force      Max Disp      RMS Disp   
	----------------------------------------------------------------------------------------------
	  Convergence Criteria     1.00e-06 *    3.00e-04 *             o    1.20e-03 *             o
	----------------------------------------------------------------------------------------------
	     3    -101.41995073   -1.86e-05      8.37e-05 *    8.37e-05 o    1.93e-04 *    1.93e-04 o  ~
	----------------------------------------------------------------------------------------------

Next Geometry in Ang 
	Fragment 1 (Ang)

	   He   0.0000000000   0.0000000000   0.9859152151
	    F   0.0000000000   0.0000000000  -0.2076732277


    Final optimized geometry and variables:
    Molecular point group: c2v
    Full point group: C_inf_v

    Geometry (in Angstrom), charge = -1, multiplicity = 3:

    HE           0.000000000000     0.000000000000     0.985966412214
    F            0.000000000000     0.000000000000    -0.207724424847


    Psi4 stopped on: Thursday, 17 July 2025 09:20AM
    Psi4 wall time for execution: 0:00:02.56

*** Psi4 exiting successfully. Buy a developer a beer!
